[I 2023-12-10 23:06:15,823] Trial 209 finished with value: 0.34291658785700774 and parameters: {'EMBEDDING_DIM': 983, 'HIDDEN_DIM': 380, 'NUM_LAYERS': 1, 'DROPOUT': 0.11892595064197947, 'LR': 0.0006299768598138144, 'WEIGHT_0': 0.4478936243126237, 'WEIGHT_1': 0.5769364049809723, 'WEIGHT_2': 0.16829224286822098, 'WEIGHT_3': 0.9963711937081602, 'WEIGHT_4': 0.8144663441255575, 'WEIGHT_5': 0.5560345397388953, 'WEIGHT_6': 0.5071430707177451, 'WEIGHT_7': 0.264864999943839, 'WEIGHT_8': 0.3812855203666208, 'optimizer': 'Adam'}. Best is trial 134 with value: 0.4158467115484205.
/userhome/cs2/dingruiw/conda/envs/py310/lib/python3.10/site-packages/torch/nn/modules/rnn.py:82: UserWarning: dropout option adds dropout after all but last recurrent layer, so non-zero dropout expects num_layers greater than 1, but got dropout=0.09849710673222771 and num_layers=1
  warnings.warn("dropout option adds dropout after all but last "
{'EMBEDDING_DIM': 983, 'HIDDEN_DIM': 380, 'NUM_LAYERS': 1, 'DROPOUT': 0.11892595064197947, 'LR': 0.0006299768598138144, 'WEIGHT_0': 0.4478936243126237, 'WEIGHT_1': 0.5769364049809723, 'WEIGHT_2': 0.16829224286822098, 'WEIGHT_3': 0.9963711937081602, 'WEIGHT_4': 0.8144663441255575, 'WEIGHT_5': 0.5560345397388953, 'WEIGHT_6': 0.5071430707177451, 'WEIGHT_7': 0.264864999943839, 'WEIGHT_8': 0.3812855203666208, 'optimizer': 'Adam'}
0
              precision    recall  f1-score   support

         LOC       0.03      0.04      0.03      1837
        MISC       0.01      0.08      0.02       922
         ORG       0.02      0.10      0.04      1341
         PER       0.02      0.08      0.04      1842

   micro avg       0.02      0.07      0.03      5942
   macro avg       0.02      0.08      0.03      5942
weighted avg       0.02      0.07      0.03      5942

{'EMBEDDING_DIM': 983, 'HIDDEN_DIM': 380, 'NUM_LAYERS': 1, 'DROPOUT': 0.11892595064197947, 'LR': 0.0006299768598138144, 'WEIGHT_0': 0.4478936243126237, 'WEIGHT_1': 0.5769364049809723, 'WEIGHT_2': 0.16829224286822098, 'WEIGHT_3': 0.9963711937081602, 'WEIGHT_4': 0.8144663441255575, 'WEIGHT_5': 0.5560345397388953, 'WEIGHT_6': 0.5071430707177451, 'WEIGHT_7': 0.264864999943839, 'WEIGHT_8': 0.3812855203666208, 'optimizer': 'Adam'}
49
              precision    recall  f1-score   support

         LOC       0.59      0.49      0.54      1837
        MISC       0.21      0.04      0.06       922
         ORG       0.30      0.20      0.24      1341
         PER       0.30      0.33      0.31      1842

   micro avg       0.39      0.31      0.34      5942
   macro avg       0.35      0.26      0.29      5942
weighted avg       0.37      0.31      0.33      5942

epoch 49
LSTM
  0%|          | 0/50 [00:00<?, ?it/s]  2%|▏         | 1/50 [00:04<03:51,  4.72s/it]  4%|▍         | 2/50 [00:04<01:37,  2.03s/it]  6%|▌         | 3/50 [00:05<00:57,  1.23s/it]  8%|▊         | 4/50 [00:05<00:39,  1.18it/s] 10%|█         | 5/50 [00:05<00:28,  1.56it/s] 12%|█▏        | 6/50 [00:05<00:22,  1.94it/s] 14%|█▍        | 7/50 [00:06<00:18,  2.29it/s] 16%|█▌        | 8/50 [00:06<00:16,  2.60it/s] 18%|█▊        | 9/50 [00:06<00:14,  2.86it/s] 20%|██        | 10/50 [00:07<00:13,  3.08it/s] 22%|██▏       | 11/50 [00:07<00:12,  3.24it/s] 24%|██▍       | 12/50 [00:07<00:11,  3.36it/s] 26%|██▌       | 13/50 [00:07<00:10,  3.45it/s] 28%|██▊       | 14/50 [00:08<00:10,  3.52it/s] 30%|███       | 15/50 [00:08<00:09,  3.57it/s] 32%|███▏      | 16/50 [00:08<00:09,  3.60it/s] 34%|███▍      | 17/50 [00:08<00:09,  3.62it/s] 36%|███▌      | 18/50 [00:09<00:08,  3.64it/s] 38%|███▊      | 19/50 [00:09<00:08,  3.65it/s] 40%|████      | 20/50 [00:09<00:08,  3.66it/s] 42%|████▏     | 21/50 [00:10<00:07,  3.67it/s] 44%|████▍     | 22/50 [00:10<00:07,  3.67it/s] 46%|████▌     | 23/50 [00:10<00:07,  3.68it/s] 48%|████▊     | 24/50 [00:10<00:07,  3.67it/s] 50%|█████     | 25/50 [00:11<00:06,  3.68it/s] 52%|█████▏    | 26/50 [00:11<00:06,  3.68it/s] 54%|█████▍    | 27/50 [00:11<00:06,  3.68it/s] 56%|█████▌    | 28/50 [00:11<00:05,  3.67it/s] 58%|█████▊    | 29/50 [00:12<00:05,  3.67it/s] 60%|██████    | 30/50 [00:12<00:05,  3.67it/s] 62%|██████▏   | 31/50 [00:12<00:05,  3.67it/s] 64%|██████▍   | 32/50 [00:13<00:04,  3.67it/s] 66%|██████▌   | 33/50 [00:13<00:04,  3.67it/s] 68%|██████▊   | 34/50 [00:13<00:04,  3.67it/s] 70%|███████   | 35/50 [00:13<00:04,  3.67it/s] 72%|███████▏  | 36/50 [00:14<00:03,  3.67it/s] 74%|███████▍  | 37/50 [00:14<00:03,  3.67it/s] 76%|███████▌  | 38/50 [00:14<00:03,  3.67it/s] 78%|███████▊  | 39/50 [00:14<00:02,  3.67it/s] 80%|████████  | 40/50 [00:15<00:02,  3.67it/s] 82%|████████▏ | 41/50 [00:15<00:02,  3.66it/s] 84%|████████▍ | 42/50 [00:15<00:02,  3.66it/s] 86%|████████▌ | 43/50 [00:16<00:01,  3.66it/s] 88%|████████▊ | 44/50 [00:16<00:01,  3.66it/s] 90%|█████████ | 45/50 [00:16<00:01,  3.66it/s] 92%|█████████▏| 46/50 [00:16<00:01,  3.66it/s] 94%|█████████▍| 47/50 [00:17<00:00,  3.66it/s] 96%|█████████▌| 48/50 [00:17<00:00,  3.66it/s] 98%|█████████▊| 49/50 [00:17<00:00,  3.66it/s]100%|██████████| 50/50 [00:22<00:00,  1.70s/it]100%|██████████| 50/50 [00:22<00:00,  2.20it/s]
[I 2023-12-10 23:06:42,783] Trial 210 finished with value: 0.38612116151776604 and parameters: {'EMBEDDING_DIM': 1023, 'HIDDEN_DIM': 404, 'NUM_LAYERS': 1, 'DROPOUT': 0.09849710673222771, 'LR': 0.0004628970780039684, 'WEIGHT_0': 0.494218768404382, 'WEIGHT_1': 0.5109003249907874, 'WEIGHT_2': 0.5107583625251588, 'WEIGHT_3': 0.9592017181434076, 'WEIGHT_4': 0.837033819224108, 'WEIGHT_5': 0.5470304438966427, 'WEIGHT_6': 0.5098238097652329, 'WEIGHT_7': 0.32554663541618206, 'WEIGHT_8': 0.48124754240896206, 'optimizer': 'RMSprop'}. Best is trial 134 with value: 0.4158467115484205.
/userhome/cs2/dingruiw/conda/envs/py310/lib/python3.10/site-packages/torch/nn/modules/rnn.py:82: UserWarning: dropout option adds dropout after all but last recurrent layer, so non-zero dropout expects num_layers greater than 1, but got dropout=0.05227292862695157 and num_layers=1
  warnings.warn("dropout option adds dropout after all but last "
{'EMBEDDING_DIM': 1023, 'HIDDEN_DIM': 404, 'NUM_LAYERS': 1, 'DROPOUT': 0.09849710673222771, 'LR': 0.0004628970780039684, 'WEIGHT_0': 0.494218768404382, 'WEIGHT_1': 0.5109003249907874, 'WEIGHT_2': 0.5107583625251588, 'WEIGHT_3': 0.9592017181434076, 'WEIGHT_4': 0.837033819224108, 'WEIGHT_5': 0.5470304438966427, 'WEIGHT_6': 0.5098238097652329, 'WEIGHT_7': 0.32554663541618206, 'WEIGHT_8': 0.48124754240896206, 'optimizer': 'RMSprop'}
0
              precision    recall  f1-score   support

         LOC       0.08      0.05      0.06      1837
        MISC       0.06      0.03      0.05       922
         ORG       0.10      0.03      0.05      1341
         PER       0.03      0.01      0.02      1842

   micro avg       0.07      0.03      0.04      5942
   macro avg       0.07      0.03      0.04      5942
weighted avg       0.07      0.03      0.04      5942

{'EMBEDDING_DIM': 1023, 'HIDDEN_DIM': 404, 'NUM_LAYERS': 1, 'DROPOUT': 0.09849710673222771, 'LR': 0.0004628970780039684, 'WEIGHT_0': 0.494218768404382, 'WEIGHT_1': 0.5109003249907874, 'WEIGHT_2': 0.5107583625251588, 'WEIGHT_3': 0.9592017181434076, 'WEIGHT_4': 0.837033819224108, 'WEIGHT_5': 0.5470304438966427, 'WEIGHT_6': 0.5098238097652329, 'WEIGHT_7': 0.32554663541618206, 'WEIGHT_8': 0.48124754240896206, 'optimizer': 'RMSprop'}
49
              precision    recall  f1-score   support

         LOC       0.61      0.48      0.53      1837
        MISC       0.50      0.38      0.43       922
         ORG       0.30      0.21      0.25      1341
         PER       0.32      0.31      0.32      1842

   micro avg       0.43      0.35      0.39      5942
   macro avg       0.43      0.34      0.38      5942
weighted avg       0.43      0.35      0.39      5942

epoch 49
LSTM
  0%|          | 0/50 [00:00<?, ?it/s]  2%|▏         | 1/50 [00:04<03:58,  4.87s/it]  4%|▍         | 2/50 [00:05<01:40,  2.10s/it]  6%|▌         | 3/50 [00:05<00:59,  1.27s/it]  8%|▊         | 4/50 [00:05<00:40,  1.14it/s] 10%|█         | 5/50 [00:05<00:29,  1.50it/s] 12%|█▏        | 6/50 [00:06<00:23,  1.86it/s] 14%|█▍        | 7/50 [00:06<00:19,  2.19it/s] 16%|█▌        | 8/50 [00:06<00:16,  2.48it/s] 18%|█▊        | 9/50 [00:07<00:15,  2.73it/s] 20%|██        | 10/50 [00:07<00:13,  2.92it/s] 22%|██▏       | 11/50 [00:07<00:12,  3.07it/s] 24%|██▍       | 12/50 [00:07<00:11,  3.18it/s] 26%|██▌       | 13/50 [00:08<00:11,  3.27it/s] 28%|██▊       | 14/50 [00:08<00:10,  3.32it/s] 30%|███       | 15/50 [00:08<00:10,  3.37it/s] 32%|███▏      | 16/50 [00:09<00:10,  3.40it/s] 34%|███▍      | 17/50 [00:09<00:09,  3.42it/s] 36%|███▌      | 18/50 [00:09<00:09,  3.43it/s] 38%|███▊      | 19/50 [00:09<00:09,  3.44it/s] 40%|████      | 20/50 [00:10<00:08,  3.45it/s] 42%|████▏     | 21/50 [00:10<00:08,  3.45it/s] 44%|████▍     | 22/50 [00:10<00:08,  3.46it/s] 46%|████▌     | 23/50 [00:11<00:07,  3.46it/s] 48%|████▊     | 24/50 [00:11<00:07,  3.46it/s] 50%|█████     | 25/50 [00:11<00:07,  3.46it/s] 52%|█████▏    | 26/50 [00:11<00:06,  3.46it/s] 54%|█████▍    | 27/50 [00:12<00:06,  3.45it/s] 56%|█████▌    | 28/50 [00:12<00:06,  3.45it/s] 58%|█████▊    | 29/50 [00:12<00:06,  3.45it/s] 60%|██████    | 30/50 [00:13<00:05,  3.45it/s] 62%|██████▏   | 31/50 [00:13<00:05,  3.45it/s] 64%|██████▍   | 32/50 [00:13<00:05,  3.46it/s] 66%|██████▌   | 33/50 [00:13<00:04,  3.46it/s] 68%|██████▊   | 34/50 [00:14<00:04,  3.45it/s] 70%|███████   | 35/50 [00:14<00:04,  3.45it/s] 72%|███████▏  | 36/50 [00:14<00:04,  3.45it/s] 74%|███████▍  | 37/50 [00:15<00:03,  3.45it/s] 76%|███████▌  | 38/50 [00:15<00:03,  3.45it/s] 78%|███████▊  | 39/50 [00:15<00:03,  3.45it/s] 80%|████████  | 40/50 [00:15<00:02,  3.45it/s] 82%|████████▏ | 41/50 [00:16<00:02,  3.45it/s] 84%|████████▍ | 42/50 [00:16<00:02,  3.45it/s] 86%|████████▌ | 43/50 [00:16<00:02,  3.45it/s] 88%|████████▊ | 44/50 [00:17<00:01,  3.44it/s] 90%|█████████ | 45/50 [00:17<00:01,  3.45it/s] 92%|█████████▏| 46/50 [00:17<00:01,  3.44it/s] 94%|█████████▍| 47/50 [00:18<00:00,  3.44it/s] 96%|█████████▌| 48/50 [00:18<00:00,  3.44it/s] 98%|█████████▊| 49/50 [00:18<00:00,  3.44it/s]100%|██████████| 50/50 [00:23<00:00,  1.68s/it]100%|██████████| 50/50 [00:23<00:00,  2.12it/s]
[I 2023-12-10 23:07:10,546] Trial 211 finished with value: 0.19912152269399708 and parameters: {'EMBEDDING_DIM': 961, 'HIDDEN_DIM': 429, 'NUM_LAYERS': 1, 'DROPOUT': 0.05227292862695157, 'LR': 0.00010469654008168206, 'WEIGHT_0': 0.43008103289353655, 'WEIGHT_1': 0.6095267945586561, 'WEIGHT_2': 0.5512636980254286, 'WEIGHT_3': 0.97939232401269, 'WEIGHT_4': 0.857732206171509, 'WEIGHT_5': 0.5772845243604747, 'WEIGHT_6': 0.46069447049216516, 'WEIGHT_7': 0.8126640150260143, 'WEIGHT_8': 0.5681223447859849, 'optimizer': 'RMSprop'}. Best is trial 134 with value: 0.4158467115484205.
/userhome/cs2/dingruiw/conda/envs/py310/lib/python3.10/site-packages/torch/nn/modules/rnn.py:82: UserWarning: dropout option adds dropout after all but last recurrent layer, so non-zero dropout expects num_layers greater than 1, but got dropout=0.12167451128774766 and num_layers=1
  warnings.warn("dropout option adds dropout after all but last "
{'EMBEDDING_DIM': 961, 'HIDDEN_DIM': 429, 'NUM_LAYERS': 1, 'DROPOUT': 0.05227292862695157, 'LR': 0.00010469654008168206, 'WEIGHT_0': 0.43008103289353655, 'WEIGHT_1': 0.6095267945586561, 'WEIGHT_2': 0.5512636980254286, 'WEIGHT_3': 0.97939232401269, 'WEIGHT_4': 0.857732206171509, 'WEIGHT_5': 0.5772845243604747, 'WEIGHT_6': 0.46069447049216516, 'WEIGHT_7': 0.8126640150260143, 'WEIGHT_8': 0.5681223447859849, 'optimizer': 'RMSprop'}
0
              precision    recall  f1-score   support

         LOC       0.06      0.10      0.07      1837
        MISC       0.01      0.11      0.02       922
         ORG       0.03      0.10      0.04      1341
         PER       0.03      0.09      0.04      1842

   micro avg       0.03      0.10      0.04      5942
   macro avg       0.03      0.10      0.04      5942
weighted avg       0.03      0.10      0.05      5942

{'EMBEDDING_DIM': 961, 'HIDDEN_DIM': 429, 'NUM_LAYERS': 1, 'DROPOUT': 0.05227292862695157, 'LR': 0.00010469654008168206, 'WEIGHT_0': 0.43008103289353655, 'WEIGHT_1': 0.6095267945586561, 'WEIGHT_2': 0.5512636980254286, 'WEIGHT_3': 0.97939232401269, 'WEIGHT_4': 0.857732206171509, 'WEIGHT_5': 0.5772845243604747, 'WEIGHT_6': 0.46069447049216516, 'WEIGHT_7': 0.8126640150260143, 'WEIGHT_8': 0.5681223447859849, 'optimizer': 'RMSprop'}
49
              precision    recall  f1-score   support

         LOC       0.57      0.25      0.35      1837
        MISC       0.20      0.06      0.10       922
         ORG       0.17      0.02      0.04      1341
         PER       0.20      0.18      0.19      1842

   micro avg       0.30      0.15      0.20      5942
   macro avg       0.29      0.13      0.17      5942
weighted avg       0.31      0.15      0.19      5942

epoch 49
LSTM
  0%|          | 0/50 [00:00<?, ?it/s]  2%|▏         | 1/50 [00:04<03:54,  4.78s/it]  4%|▍         | 2/50 [00:04<01:38,  2.06s/it]  6%|▌         | 3/50 [00:05<00:59,  1.26s/it]  8%|▊         | 4/50 [00:05<00:40,  1.14it/s] 10%|█         | 5/50 [00:05<00:30,  1.50it/s] 12%|█▏        | 6/50 [00:06<00:23,  1.85it/s] 14%|█▍        | 7/50 [00:06<00:19,  2.17it/s] 16%|█▌        | 8/50 [00:06<00:17,  2.45it/s] 18%|█▊        | 9/50 [00:07<00:15,  2.68it/s] 20%|██        | 10/50 [00:07<00:13,  2.87it/s] 22%|██▏       | 11/50 [00:07<00:12,  3.01it/s] 24%|██▍       | 12/50 [00:07<00:12,  3.12it/s] 26%|██▌       | 13/50 [00:08<00:11,  3.19it/s] 28%|██▊       | 14/50 [00:08<00:11,  3.24it/s] 30%|███       | 15/50 [00:08<00:10,  3.29it/s] 32%|███▏      | 16/50 [00:09<00:10,  3.31it/s] 34%|███▍      | 17/50 [00:09<00:09,  3.34it/s] 36%|███▌      | 18/50 [00:09<00:09,  3.35it/s] 38%|███▊      | 19/50 [00:09<00:09,  3.35it/s] 40%|████      | 20/50 [00:10<00:08,  3.36it/s] 42%|████▏     | 21/50 [00:10<00:08,  3.36it/s] 44%|████▍     | 22/50 [00:10<00:08,  3.37it/s] 46%|████▌     | 23/50 [00:11<00:08,  3.37it/s] 48%|████▊     | 24/50 [00:11<00:07,  3.37it/s] 50%|█████     | 25/50 [00:11<00:07,  3.37it/s] 52%|█████▏    | 26/50 [00:12<00:07,  3.37it/s] 54%|█████▍    | 27/50 [00:12<00:06,  3.37it/s] 56%|█████▌    | 28/50 [00:12<00:06,  3.37it/s] 58%|█████▊    | 29/50 [00:12<00:06,  3.36it/s] 60%|██████    | 30/50 [00:13<00:05,  3.37it/s] 62%|██████▏   | 31/50 [00:13<00:05,  3.37it/s] 64%|██████▍   | 32/50 [00:13<00:05,  3.36it/s] 66%|██████▌   | 33/50 [00:14<00:05,  3.37it/s] 68%|██████▊   | 34/50 [00:14<00:04,  3.37it/s] 70%|███████   | 35/50 [00:14<00:04,  3.36it/s] 72%|███████▏  | 36/50 [00:15<00:04,  3.36it/s] 74%|███████▍  | 37/50 [00:15<00:03,  3.36it/s] 76%|███████▌  | 38/50 [00:15<00:03,  3.36it/s] 78%|███████▊  | 39/50 [00:15<00:03,  3.36it/s] 80%|████████  | 40/50 [00:16<00:02,  3.36it/s] 82%|████████▏ | 41/50 [00:16<00:02,  3.35it/s] 84%|████████▍ | 42/50 [00:16<00:02,  3.35it/s] 86%|████████▌ | 43/50 [00:17<00:02,  3.35it/s] 88%|████████▊ | 44/50 [00:17<00:01,  3.35it/s] 90%|█████████ | 45/50 [00:17<00:01,  3.34it/s] 92%|█████████▏| 46/50 [00:18<00:01,  3.35it/s] 94%|█████████▍| 47/50 [00:18<00:00,  3.35it/s] 96%|█████████▌| 48/50 [00:18<00:00,  3.34it/s] 98%|█████████▊| 49/50 [00:18<00:00,  3.34it/s]100%|██████████| 50/50 [00:23<00:00,  1.72s/it]100%|██████████| 50/50 [00:23<00:00,  2.09it/s]
[I 2023-12-10 23:07:38,782] Trial 212 finished with value: 0.40475158241567677 and parameters: {'EMBEDDING_DIM': 988, 'HIDDEN_DIM': 450, 'NUM_LAYERS': 1, 'DROPOUT': 0.12167451128774766, 'LR': 0.0007786296940340276, 'WEIGHT_0': 0.4011212716696729, 'WEIGHT_1': 0.5448413146000022, 'WEIGHT_2': 0.26775597041935806, 'WEIGHT_3': 0.9392481379770344, 'WEIGHT_4': 0.7988371467335994, 'WEIGHT_5': 0.5133425335964912, 'WEIGHT_6': 0.6490967325733243, 'WEIGHT_7': 0.3817446582160191, 'WEIGHT_8': 0.5366070287941372, 'optimizer': 'RMSprop'}. Best is trial 134 with value: 0.4158467115484205.
/userhome/cs2/dingruiw/conda/envs/py310/lib/python3.10/site-packages/torch/nn/modules/rnn.py:82: UserWarning: dropout option adds dropout after all but last recurrent layer, so non-zero dropout expects num_layers greater than 1, but got dropout=0.18811033548992612 and num_layers=1
  warnings.warn("dropout option adds dropout after all but last "
{'EMBEDDING_DIM': 988, 'HIDDEN_DIM': 450, 'NUM_LAYERS': 1, 'DROPOUT': 0.12167451128774766, 'LR': 0.0007786296940340276, 'WEIGHT_0': 0.4011212716696729, 'WEIGHT_1': 0.5448413146000022, 'WEIGHT_2': 0.26775597041935806, 'WEIGHT_3': 0.9392481379770344, 'WEIGHT_4': 0.7988371467335994, 'WEIGHT_5': 0.5133425335964912, 'WEIGHT_6': 0.6490967325733243, 'WEIGHT_7': 0.3817446582160191, 'WEIGHT_8': 0.5366070287941372, 'optimizer': 'RMSprop'}
0
              precision    recall  f1-score   support

         LOC       0.13      0.04      0.06      1837
        MISC       0.03      0.03      0.03       922
         ORG       0.07      0.02      0.03      1341
         PER       0.04      0.01      0.02      1842

   micro avg       0.06      0.02      0.04      5942
   macro avg       0.07      0.03      0.03      5942
weighted avg       0.07      0.02      0.04      5942

{'EMBEDDING_DIM': 988, 'HIDDEN_DIM': 450, 'NUM_LAYERS': 1, 'DROPOUT': 0.12167451128774766, 'LR': 0.0007786296940340276, 'WEIGHT_0': 0.4011212716696729, 'WEIGHT_1': 0.5448413146000022, 'WEIGHT_2': 0.26775597041935806, 'WEIGHT_3': 0.9392481379770344, 'WEIGHT_4': 0.7988371467335994, 'WEIGHT_5': 0.5133425335964912, 'WEIGHT_6': 0.6490967325733243, 'WEIGHT_7': 0.3817446582160191, 'WEIGHT_8': 0.5366070287941372, 'optimizer': 'RMSprop'}
49
              precision    recall  f1-score   support

         LOC       0.57      0.52      0.54      1837
        MISC       0.50      0.42      0.45       922
         ORG       0.29      0.26      0.27      1341
         PER       0.34      0.35      0.34      1842

   micro avg       0.42      0.39      0.40      5942
   macro avg       0.42      0.39      0.40      5942
weighted avg       0.42      0.39      0.41      5942

epoch 49
LSTM
  0%|          | 0/50 [00:00<?, ?it/s]  2%|▏         | 1/50 [00:04<03:52,  4.74s/it]  4%|▍         | 2/50 [00:04<01:37,  2.03s/it]  6%|▌         | 3/50 [00:05<00:56,  1.21s/it]  8%|▊         | 4/50 [00:05<00:37,  1.21it/s] 10%|█         | 5/50 [00:05<00:27,  1.64it/s] 12%|█▏        | 6/50 [00:05<00:21,  2.07it/s] 14%|█▍        | 7/50 [00:06<00:17,  2.49it/s] 16%|█▌        | 8/50 [00:06<00:14,  2.87it/s] 18%|█▊        | 9/50 [00:06<00:12,  3.20it/s] 20%|██        | 10/50 [00:06<00:11,  3.47it/s] 22%|██▏       | 11/50 [00:06<00:10,  3.68it/s] 24%|██▍       | 12/50 [00:07<00:09,  3.84it/s] 26%|██▌       | 13/50 [00:07<00:09,  3.96it/s] 28%|██▊       | 14/50 [00:07<00:08,  4.05it/s] 30%|███       | 15/50 [00:07<00:08,  4.11it/s] 32%|███▏      | 16/50 [00:08<00:08,  4.16it/s] 34%|███▍      | 17/50 [00:08<00:07,  4.19it/s] 36%|███▌      | 18/50 [00:08<00:07,  4.22it/s] 38%|███▊      | 19/50 [00:08<00:07,  4.23it/s] 40%|████      | 20/50 [00:09<00:07,  4.24it/s] 42%|████▏     | 21/50 [00:09<00:06,  4.25it/s] 44%|████▍     | 22/50 [00:09<00:06,  4.25it/s] 46%|████▌     | 23/50 [00:09<00:06,  4.26it/s] 48%|████▊     | 24/50 [00:10<00:06,  4.26it/s] 50%|█████     | 25/50 [00:10<00:05,  4.26it/s] 52%|█████▏    | 26/50 [00:10<00:05,  4.26it/s] 54%|█████▍    | 27/50 [00:10<00:05,  4.26it/s] 56%|█████▌    | 28/50 [00:10<00:05,  4.26it/s] 58%|█████▊    | 29/50 [00:11<00:04,  4.26it/s] 60%|██████    | 30/50 [00:11<00:04,  4.26it/s] 62%|██████▏   | 31/50 [00:11<00:04,  4.26it/s] 64%|██████▍   | 32/50 [00:11<00:04,  4.26it/s] 66%|██████▌   | 33/50 [00:12<00:03,  4.25it/s] 68%|██████▊   | 34/50 [00:12<00:03,  4.26it/s] 70%|███████   | 35/50 [00:12<00:03,  4.25it/s] 72%|███████▏  | 36/50 [00:12<00:03,  4.25it/s] 74%|███████▍  | 37/50 [00:13<00:03,  4.26it/s] 76%|███████▌  | 38/50 [00:13<00:02,  4.25it/s] 78%|███████▊  | 39/50 [00:13<00:02,  4.26it/s] 80%|████████  | 40/50 [00:13<00:02,  4.25it/s] 82%|████████▏ | 41/50 [00:14<00:02,  4.25it/s] 84%|████████▍ | 42/50 [00:14<00:01,  4.25it/s] 86%|████████▌ | 43/50 [00:14<00:01,  4.25it/s] 88%|████████▊ | 44/50 [00:14<00:01,  4.25it/s] 90%|█████████ | 45/50 [00:14<00:01,  4.25it/s] 92%|█████████▏| 46/50 [00:15<00:00,  4.25it/s] 94%|█████████▍| 47/50 [00:15<00:00,  4.25it/s] 96%|█████████▌| 48/50 [00:15<00:00,  4.25it/s] 98%|█████████▊| 49/50 [00:15<00:00,  4.24it/s]100%|██████████| 50/50 [00:20<00:00,  1.62s/it]100%|██████████| 50/50 [00:20<00:00,  2.41it/s]
