[I 2023-12-10 22:17:37,475] Trial 109 finished with value: 0.40544168978788153 and parameters: {'EMBEDDING_DIM': 973, 'HIDDEN_DIM': 606, 'NUM_LAYERS': 1, 'DROPOUT': 0.349521913261968, 'LR': 0.000652155753008496, 'WEIGHT_0': 0.3570747395431224, 'WEIGHT_1': 0.6273563995376097, 'WEIGHT_2': 0.5940840354189016, 'WEIGHT_3': 0.9124228973338534, 'WEIGHT_4': 0.8314591778551602, 'WEIGHT_5': 0.606211185841621, 'WEIGHT_6': 0.9745035402433276, 'WEIGHT_7': 0.4442780384112246, 'WEIGHT_8': 0.4234661536502002, 'optimizer': 'RMSprop'}. Best is trial 51 with value: 0.41438326562364947.
/userhome/cs2/dingruiw/conda/envs/py310/lib/python3.10/site-packages/torch/nn/modules/rnn.py:82: UserWarning: dropout option adds dropout after all but last recurrent layer, so non-zero dropout expects num_layers greater than 1, but got dropout=0.31941553326616656 and num_layers=1
  warnings.warn("dropout option adds dropout after all but last "
{'EMBEDDING_DIM': 973, 'HIDDEN_DIM': 606, 'NUM_LAYERS': 1, 'DROPOUT': 0.349521913261968, 'LR': 0.000652155753008496, 'WEIGHT_0': 0.3570747395431224, 'WEIGHT_1': 0.6273563995376097, 'WEIGHT_2': 0.5940840354189016, 'WEIGHT_3': 0.9124228973338534, 'WEIGHT_4': 0.8314591778551602, 'WEIGHT_5': 0.606211185841621, 'WEIGHT_6': 0.9745035402433276, 'WEIGHT_7': 0.4442780384112246, 'WEIGHT_8': 0.4234661536502002, 'optimizer': 'RMSprop'}
0
              precision    recall  f1-score   support

         LOC       0.12      0.13      0.13      1837
        MISC       0.05      0.05      0.05       922
         ORG       0.07      0.01      0.02      1341
         PER       0.04      0.04      0.04      1842

   micro avg       0.07      0.06      0.07      5942
   macro avg       0.07      0.06      0.06      5942
weighted avg       0.07      0.06      0.06      5942

{'EMBEDDING_DIM': 973, 'HIDDEN_DIM': 606, 'NUM_LAYERS': 1, 'DROPOUT': 0.349521913261968, 'LR': 0.000652155753008496, 'WEIGHT_0': 0.3570747395431224, 'WEIGHT_1': 0.6273563995376097, 'WEIGHT_2': 0.5940840354189016, 'WEIGHT_3': 0.9124228973338534, 'WEIGHT_4': 0.8314591778551602, 'WEIGHT_5': 0.606211185841621, 'WEIGHT_6': 0.9745035402433276, 'WEIGHT_7': 0.4442780384112246, 'WEIGHT_8': 0.4234661536502002, 'optimizer': 'RMSprop'}
49
              precision    recall  f1-score   support

         LOC       0.62      0.53      0.57      1837
        MISC       0.46      0.42      0.44       922
         ORG       0.30      0.23      0.26      1341
         PER       0.34      0.33      0.33      1842

   micro avg       0.43      0.38      0.41      5942
   macro avg       0.43      0.38      0.40      5942
weighted avg       0.43      0.38      0.41      5942

epoch 49
LSTM
  0%|          | 0/50 [00:00<?, ?it/s]  2%|▏         | 1/50 [00:04<03:54,  4.78s/it]  6%|▌         | 3/50 [00:05<01:02,  1.34s/it]  8%|▊         | 4/50 [00:05<00:42,  1.07it/s] 10%|█         | 5/50 [00:05<00:30,  1.47it/s] 12%|█▏        | 6/50 [00:05<00:22,  1.95it/s] 14%|█▍        | 7/50 [00:05<00:17,  2.47it/s] 16%|█▌        | 8/50 [00:05<00:13,  3.02it/s] 18%|█▊        | 9/50 [00:06<00:11,  3.56it/s] 20%|██        | 10/50 [00:06<00:09,  4.06it/s] 22%|██▏       | 11/50 [00:06<00:08,  4.51it/s] 24%|██▍       | 12/50 [00:06<00:07,  4.87it/s] 26%|██▌       | 13/50 [00:06<00:07,  5.16it/s] 28%|██▊       | 14/50 [00:06<00:06,  5.39it/s] 30%|███       | 15/50 [00:07<00:06,  5.56it/s] 32%|███▏      | 16/50 [00:07<00:05,  5.68it/s] 34%|███▍      | 17/50 [00:07<00:05,  5.77it/s] 36%|███▌      | 18/50 [00:07<00:05,  5.84it/s] 38%|███▊      | 19/50 [00:07<00:05,  5.89it/s] 40%|████      | 20/50 [00:07<00:05,  5.91it/s] 42%|████▏     | 21/50 [00:08<00:04,  5.94it/s] 44%|████▍     | 22/50 [00:08<00:04,  5.96it/s] 46%|████▌     | 23/50 [00:08<00:04,  5.97it/s] 48%|████▊     | 24/50 [00:08<00:04,  5.98it/s] 50%|█████     | 25/50 [00:08<00:04,  5.98it/s] 52%|█████▏    | 26/50 [00:08<00:04,  5.99it/s] 54%|█████▍    | 27/50 [00:09<00:03,  5.99it/s] 56%|█████▌    | 28/50 [00:09<00:03,  6.00it/s] 58%|█████▊    | 29/50 [00:09<00:03,  5.99it/s] 60%|██████    | 30/50 [00:09<00:03,  5.98it/s] 62%|██████▏   | 31/50 [00:09<00:03,  5.99it/s] 64%|██████▍   | 32/50 [00:09<00:03,  5.99it/s] 66%|██████▌   | 33/50 [00:10<00:02,  5.99it/s] 68%|██████▊   | 34/50 [00:10<00:02,  5.99it/s] 70%|███████   | 35/50 [00:10<00:02,  5.99it/s] 72%|███████▏  | 36/50 [00:10<00:02,  5.99it/s] 74%|███████▍  | 37/50 [00:10<00:02,  5.99it/s] 76%|███████▌  | 38/50 [00:10<00:02,  5.98it/s] 78%|███████▊  | 39/50 [00:11<00:01,  5.99it/s] 80%|████████  | 40/50 [00:11<00:01,  6.00it/s] 82%|████████▏ | 41/50 [00:11<00:01,  5.98it/s] 84%|████████▍ | 42/50 [00:11<00:01,  5.98it/s] 86%|████████▌ | 43/50 [00:11<00:01,  5.98it/s] 88%|████████▊ | 44/50 [00:11<00:01,  5.98it/s] 90%|█████████ | 45/50 [00:12<00:00,  5.97it/s] 92%|█████████▏| 46/50 [00:12<00:00,  5.97it/s] 94%|█████████▍| 47/50 [00:12<00:00,  5.98it/s] 96%|█████████▌| 48/50 [00:12<00:00,  5.98it/s] 98%|█████████▊| 49/50 [00:12<00:00,  5.97it/s]100%|██████████| 50/50 [00:17<00:00,  1.55s/it]100%|██████████| 50/50 [00:17<00:00,  2.86it/s]
[I 2023-12-10 22:17:59,193] Trial 110 finished with value: 0.3739084876004191 and parameters: {'EMBEDDING_DIM': 910, 'HIDDEN_DIM': 225, 'NUM_LAYERS': 1, 'DROPOUT': 0.31941553326616656, 'LR': 0.0009423538725190962, 'WEIGHT_0': 0.46598162297393847, 'WEIGHT_1': 0.6942086057139452, 'WEIGHT_2': 0.49071046587878175, 'WEIGHT_3': 0.8109731364462152, 'WEIGHT_4': 0.7460839032544642, 'WEIGHT_5': 0.5401274403930376, 'WEIGHT_6': 0.7872544225713541, 'WEIGHT_7': 0.23924645842506553, 'WEIGHT_8': 0.38471642915621684, 'optimizer': 'Adam'}. Best is trial 51 with value: 0.41438326562364947.
/userhome/cs2/dingruiw/conda/envs/py310/lib/python3.10/site-packages/torch/nn/modules/rnn.py:82: UserWarning: dropout option adds dropout after all but last recurrent layer, so non-zero dropout expects num_layers greater than 1, but got dropout=0.3488813953300913 and num_layers=1
  warnings.warn("dropout option adds dropout after all but last "
{'EMBEDDING_DIM': 910, 'HIDDEN_DIM': 225, 'NUM_LAYERS': 1, 'DROPOUT': 0.31941553326616656, 'LR': 0.0009423538725190962, 'WEIGHT_0': 0.46598162297393847, 'WEIGHT_1': 0.6942086057139452, 'WEIGHT_2': 0.49071046587878175, 'WEIGHT_3': 0.8109731364462152, 'WEIGHT_4': 0.7460839032544642, 'WEIGHT_5': 0.5401274403930376, 'WEIGHT_6': 0.7872544225713541, 'WEIGHT_7': 0.23924645842506553, 'WEIGHT_8': 0.38471642915621684, 'optimizer': 'Adam'}
0
              precision    recall  f1-score   support

         LOC       0.05      0.10      0.07      1837
        MISC       0.02      0.04      0.02       922
         ORG       0.02      0.08      0.03      1341
         PER       0.03      0.10      0.04      1842

   micro avg       0.03      0.09      0.04      5942
   macro avg       0.03      0.08      0.04      5942
weighted avg       0.03      0.09      0.05      5942

{'EMBEDDING_DIM': 910, 'HIDDEN_DIM': 225, 'NUM_LAYERS': 1, 'DROPOUT': 0.31941553326616656, 'LR': 0.0009423538725190962, 'WEIGHT_0': 0.46598162297393847, 'WEIGHT_1': 0.6942086057139452, 'WEIGHT_2': 0.49071046587878175, 'WEIGHT_3': 0.8109731364462152, 'WEIGHT_4': 0.7460839032544642, 'WEIGHT_5': 0.5401274403930376, 'WEIGHT_6': 0.7872544225713541, 'WEIGHT_7': 0.23924645842506553, 'WEIGHT_8': 0.38471642915621684, 'optimizer': 'Adam'}
49
              precision    recall  f1-score   support

         LOC       0.57      0.51      0.53      1837
        MISC       0.50      0.36      0.42       922
         ORG       0.25      0.21      0.23      1341
         PER       0.29      0.32      0.31      1842

   micro avg       0.39      0.36      0.37      5942
   macro avg       0.40      0.35      0.37      5942
weighted avg       0.40      0.36      0.38      5942

epoch 49
LSTM
  0%|          | 0/50 [00:00<?, ?it/s]  2%|▏         | 1/50 [00:04<03:48,  4.66s/it]  4%|▍         | 2/50 [00:04<01:35,  1.98s/it]  6%|▌         | 3/50 [00:04<00:54,  1.16s/it]  8%|▊         | 4/50 [00:05<00:35,  1.28it/s] 10%|█         | 5/50 [00:05<00:25,  1.76it/s] 12%|█▏        | 6/50 [00:05<00:19,  2.27it/s] 14%|█▍        | 7/50 [00:05<00:15,  2.78it/s] 16%|█▌        | 8/50 [00:05<00:12,  3.26it/s] 18%|█▊        | 9/50 [00:06<00:11,  3.70it/s] 20%|██        | 10/50 [00:06<00:09,  4.06it/s] 22%|██▏       | 11/50 [00:06<00:08,  4.36it/s] 24%|██▍       | 12/50 [00:06<00:08,  4.59it/s] 26%|██▌       | 13/50 [00:06<00:07,  4.76it/s] 28%|██▊       | 14/50 [00:07<00:07,  4.88it/s] 30%|███       | 15/50 [00:07<00:07,  4.97it/s] 32%|███▏      | 16/50 [00:07<00:06,  5.04it/s] 34%|███▍      | 17/50 [00:07<00:06,  5.08it/s] 36%|███▌      | 18/50 [00:07<00:06,  5.12it/s] 38%|███▊      | 19/50 [00:08<00:06,  5.14it/s] 40%|████      | 20/50 [00:08<00:05,  5.17it/s] 42%|████▏     | 21/50 [00:08<00:05,  5.18it/s] 44%|████▍     | 22/50 [00:08<00:05,  5.19it/s] 46%|████▌     | 23/50 [00:08<00:05,  5.20it/s] 48%|████▊     | 24/50 [00:08<00:04,  5.20it/s] 50%|█████     | 25/50 [00:09<00:04,  5.20it/s] 52%|█████▏    | 26/50 [00:09<00:04,  5.19it/s] 54%|█████▍    | 27/50 [00:09<00:04,  5.18it/s] 56%|█████▌    | 28/50 [00:09<00:04,  5.18it/s] 58%|█████▊    | 29/50 [00:09<00:04,  5.19it/s] 60%|██████    | 30/50 [00:10<00:03,  5.19it/s] 62%|██████▏   | 31/50 [00:10<00:03,  5.19it/s] 64%|██████▍   | 32/50 [00:10<00:03,  5.19it/s] 66%|██████▌   | 33/50 [00:10<00:03,  5.19it/s] 68%|██████▊   | 34/50 [00:10<00:03,  5.19it/s] 70%|███████   | 35/50 [00:11<00:02,  5.19it/s] 72%|███████▏  | 36/50 [00:11<00:02,  5.19it/s] 74%|███████▍  | 37/50 [00:11<00:02,  5.19it/s] 76%|███████▌  | 38/50 [00:11<00:02,  5.19it/s] 78%|███████▊  | 39/50 [00:11<00:02,  5.19it/s] 80%|████████  | 40/50 [00:12<00:01,  5.19it/s] 82%|████████▏ | 41/50 [00:12<00:01,  5.19it/s] 84%|████████▍ | 42/50 [00:12<00:01,  5.19it/s] 86%|████████▌ | 43/50 [00:12<00:01,  5.19it/s] 88%|████████▊ | 44/50 [00:12<00:01,  5.19it/s] 90%|█████████ | 45/50 [00:13<00:00,  5.19it/s] 92%|█████████▏| 46/50 [00:13<00:00,  5.17it/s] 94%|█████████▍| 47/50 [00:13<00:00,  5.18it/s] 96%|█████████▌| 48/50 [00:13<00:00,  5.19it/s] 98%|█████████▊| 49/50 [00:13<00:00,  5.16it/s]100%|██████████| 50/50 [00:18<00:00,  1.60s/it]100%|██████████| 50/50 [00:18<00:00,  2.67it/s]
[I 2023-12-10 22:18:22,196] Trial 111 finished with value: 0.40303611644007004 and parameters: {'EMBEDDING_DIM': 954, 'HIDDEN_DIM': 286, 'NUM_LAYERS': 1, 'DROPOUT': 0.3488813953300913, 'LR': 0.001972393835872689, 'WEIGHT_0': 0.38859040889476015, 'WEIGHT_1': 0.7575141961458691, 'WEIGHT_2': 0.5479767620154153, 'WEIGHT_3': 0.6876431704119051, 'WEIGHT_4': 0.9034171244424314, 'WEIGHT_5': 0.5064354750541744, 'WEIGHT_6': 0.9990618993212795, 'WEIGHT_7': 0.36222720959463867, 'WEIGHT_8': 0.437130916261074, 'optimizer': 'RMSprop'}. Best is trial 51 with value: 0.41438326562364947.
/userhome/cs2/dingruiw/conda/envs/py310/lib/python3.10/site-packages/torch/nn/modules/rnn.py:82: UserWarning: dropout option adds dropout after all but last recurrent layer, so non-zero dropout expects num_layers greater than 1, but got dropout=0.361837115505523 and num_layers=1
  warnings.warn("dropout option adds dropout after all but last "
{'EMBEDDING_DIM': 954, 'HIDDEN_DIM': 286, 'NUM_LAYERS': 1, 'DROPOUT': 0.3488813953300913, 'LR': 0.001972393835872689, 'WEIGHT_0': 0.38859040889476015, 'WEIGHT_1': 0.7575141961458691, 'WEIGHT_2': 0.5479767620154153, 'WEIGHT_3': 0.6876431704119051, 'WEIGHT_4': 0.9034171244424314, 'WEIGHT_5': 0.5064354750541744, 'WEIGHT_6': 0.9990618993212795, 'WEIGHT_7': 0.36222720959463867, 'WEIGHT_8': 0.437130916261074, 'optimizer': 'RMSprop'}
0
              precision    recall  f1-score   support

         LOC       0.37      0.10      0.16      1837
        MISC       0.09      0.03      0.04       922
         ORG       0.12      0.07      0.09      1341
         PER       0.06      0.02      0.03      1842

   micro avg       0.16      0.06      0.08      5942
   macro avg       0.16      0.05      0.08      5942
weighted avg       0.17      0.06      0.08      5942

{'EMBEDDING_DIM': 954, 'HIDDEN_DIM': 286, 'NUM_LAYERS': 1, 'DROPOUT': 0.3488813953300913, 'LR': 0.001972393835872689, 'WEIGHT_0': 0.38859040889476015, 'WEIGHT_1': 0.7575141961458691, 'WEIGHT_2': 0.5479767620154153, 'WEIGHT_3': 0.6876431704119051, 'WEIGHT_4': 0.9034171244424314, 'WEIGHT_5': 0.5064354750541744, 'WEIGHT_6': 0.9990618993212795, 'WEIGHT_7': 0.36222720959463867, 'WEIGHT_8': 0.437130916261074, 'optimizer': 'RMSprop'}
49
              precision    recall  f1-score   support

         LOC       0.57      0.54      0.55      1837
        MISC       0.42      0.46      0.44       922
         ORG       0.25      0.27      0.26      1341
         PER       0.34      0.35      0.35      1842

   micro avg       0.40      0.41      0.40      5942
   macro avg       0.40      0.40      0.40      5942
weighted avg       0.41      0.41      0.41      5942

epoch 49
LSTM
  0%|          | 0/50 [00:00<?, ?it/s]  2%|▏         | 1/50 [00:04<03:56,  4.82s/it]  4%|▍         | 2/50 [00:04<01:39,  2.08s/it]  6%|▌         | 3/50 [00:05<00:59,  1.27s/it]  8%|▊         | 4/50 [00:05<00:40,  1.13it/s] 10%|█         | 5/50 [00:05<00:30,  1.49it/s] 12%|█▏        | 6/50 [00:06<00:23,  1.83it/s] 14%|█▍        | 7/50 [00:06<00:19,  2.15it/s] 16%|█▌        | 8/50 [00:06<00:17,  2.43it/s] 18%|█▊        | 9/50 [00:07<00:15,  2.66it/s] 20%|██        | 10/50 [00:07<00:14,  2.84it/s] 22%|██▏       | 11/50 [00:07<00:13,  2.98it/s] 24%|██▍       | 12/50 [00:07<00:12,  3.09it/s] 26%|██▌       | 13/50 [00:08<00:11,  3.15it/s] 28%|██▊       | 14/50 [00:08<00:11,  3.21it/s] 30%|███       | 15/50 [00:08<00:10,  3.26it/s] 32%|███▏      | 16/50 [00:09<00:10,  3.28it/s] 34%|███▍      | 17/50 [00:09<00:10,  3.30it/s] 36%|███▌      | 18/50 [00:09<00:09,  3.31it/s] 38%|███▊      | 19/50 [00:10<00:09,  3.33it/s] 40%|████      | 20/50 [00:10<00:09,  3.33it/s] 42%|████▏     | 21/50 [00:10<00:08,  3.33it/s] 44%|████▍     | 22/50 [00:10<00:08,  3.34it/s] 46%|████▌     | 23/50 [00:11<00:08,  3.34it/s] 48%|████▊     | 24/50 [00:11<00:07,  3.34it/s] 50%|█████     | 25/50 [00:11<00:07,  3.34it/s] 52%|█████▏    | 26/50 [00:12<00:07,  3.34it/s] 54%|█████▍    | 27/50 [00:12<00:06,  3.34it/s] 56%|█████▌    | 28/50 [00:12<00:06,  3.34it/s] 58%|█████▊    | 29/50 [00:13<00:06,  3.32it/s] 60%|██████    | 30/50 [00:13<00:06,  3.32it/s] 62%|██████▏   | 31/50 [00:13<00:05,  3.33it/s] 64%|██████▍   | 32/50 [00:13<00:05,  3.33it/s] 66%|██████▌   | 33/50 [00:14<00:05,  3.33it/s] 68%|██████▊   | 34/50 [00:14<00:04,  3.32it/s] 70%|███████   | 35/50 [00:14<00:04,  3.32it/s] 72%|███████▏  | 36/50 [00:15<00:04,  3.32it/s] 74%|███████▍  | 37/50 [00:15<00:03,  3.33it/s] 76%|███████▌  | 38/50 [00:15<00:03,  3.33it/s] 78%|███████▊  | 39/50 [00:16<00:03,  3.33it/s] 80%|████████  | 40/50 [00:16<00:03,  3.32it/s] 82%|████████▏ | 41/50 [00:16<00:02,  3.32it/s] 84%|████████▍ | 42/50 [00:16<00:02,  3.32it/s] 86%|████████▌ | 43/50 [00:17<00:02,  3.33it/s] 88%|████████▊ | 44/50 [00:17<00:01,  3.33it/s] 90%|█████████ | 45/50 [00:17<00:01,  3.32it/s] 92%|█████████▏| 46/50 [00:18<00:01,  3.32it/s] 94%|█████████▍| 47/50 [00:18<00:00,  3.32it/s] 96%|█████████▌| 48/50 [00:18<00:00,  3.32it/s] 98%|█████████▊| 49/50 [00:19<00:00,  3.32it/s]100%|██████████| 50/50 [00:24<00:00,  1.73s/it]100%|██████████| 50/50 [00:24<00:00,  2.07it/s]
[I 2023-12-10 22:18:50,734] Trial 112 finished with value: 0.4123472209831386 and parameters: {'EMBEDDING_DIM': 941, 'HIDDEN_DIM': 457, 'NUM_LAYERS': 1, 'DROPOUT': 0.361837115505523, 'LR': 0.0024779273010326897, 'WEIGHT_0': 0.40214678719441344, 'WEIGHT_1': 0.7807022085253825, 'WEIGHT_2': 0.6084916384674349, 'WEIGHT_3': 0.723045228286031, 'WEIGHT_4': 0.9151354327650469, 'WEIGHT_5': 0.4842116177646565, 'WEIGHT_6': 0.9292234550212498, 'WEIGHT_7': 0.35234000952222744, 'WEIGHT_8': 0.48468812412161244, 'optimizer': 'RMSprop'}. Best is trial 51 with value: 0.41438326562364947.
/userhome/cs2/dingruiw/conda/envs/py310/lib/python3.10/site-packages/torch/nn/modules/rnn.py:82: UserWarning: dropout option adds dropout after all but last recurrent layer, so non-zero dropout expects num_layers greater than 1, but got dropout=0.36201720706673884 and num_layers=1
  warnings.warn("dropout option adds dropout after all but last "
{'EMBEDDING_DIM': 941, 'HIDDEN_DIM': 457, 'NUM_LAYERS': 1, 'DROPOUT': 0.361837115505523, 'LR': 0.0024779273010326897, 'WEIGHT_0': 0.40214678719441344, 'WEIGHT_1': 0.7807022085253825, 'WEIGHT_2': 0.6084916384674349, 'WEIGHT_3': 0.723045228286031, 'WEIGHT_4': 0.9151354327650469, 'WEIGHT_5': 0.4842116177646565, 'WEIGHT_6': 0.9292234550212498, 'WEIGHT_7': 0.35234000952222744, 'WEIGHT_8': 0.48468812412161244, 'optimizer': 'RMSprop'}
0
              precision    recall  f1-score   support

         LOC       0.13      0.05      0.07      1837
        MISC       0.03      0.02      0.02       922
         ORG       0.04      0.03      0.03      1341
         PER       0.05      0.02      0.03      1842

   micro avg       0.06      0.03      0.04      5942
   macro avg       0.06      0.03      0.04      5942
weighted avg       0.07      0.03      0.04      5942

{'EMBEDDING_DIM': 941, 'HIDDEN_DIM': 457, 'NUM_LAYERS': 1, 'DROPOUT': 0.361837115505523, 'LR': 0.0024779273010326897, 'WEIGHT_0': 0.40214678719441344, 'WEIGHT_1': 0.7807022085253825, 'WEIGHT_2': 0.6084916384674349, 'WEIGHT_3': 0.723045228286031, 'WEIGHT_4': 0.9151354327650469, 'WEIGHT_5': 0.4842116177646565, 'WEIGHT_6': 0.9292234550212498, 'WEIGHT_7': 0.35234000952222744, 'WEIGHT_8': 0.48468812412161244, 'optimizer': 'RMSprop'}
49
              precision    recall  f1-score   support

         LOC       0.60      0.52      0.56      1837
        MISC       0.45      0.39      0.41       922
         ORG       0.31      0.24      0.27      1341
         PER       0.37      0.37      0.37      1842

   micro avg       0.44      0.39      0.41      5942
   macro avg       0.43      0.38      0.40      5942
weighted avg       0.44      0.39      0.41      5942

epoch 49
LSTM
  0%|          | 0/50 [00:00<?, ?it/s]  2%|▏         | 1/50 [00:04<04:03,  4.96s/it]  4%|▍         | 2/50 [00:05<01:42,  2.14s/it]  6%|▌         | 3/50 [00:05<01:01,  1.31s/it]  8%|▊         | 4/50 [00:05<00:42,  1.09it/s] 10%|█         | 5/50 [00:06<00:31,  1.42it/s] 12%|█▏        | 6/50 [00:06<00:25,  1.74it/s] 14%|█▍        | 7/50 [00:06<00:21,  2.03it/s] 16%|█▌        | 8/50 [00:07<00:18,  2.27it/s] 18%|█▊        | 9/50 [00:07<00:16,  2.47it/s] 20%|██        | 10/50 [00:07<00:15,  2.63it/s] 22%|██▏       | 11/50 [00:08<00:14,  2.75it/s] 24%|██▍       | 12/50 [00:08<00:13,  2.84it/s] 26%|██▌       | 13/50 [00:08<00:12,  2.90it/s] 28%|██▊       | 14/50 [00:09<00:12,  2.95it/s] 30%|███       | 15/50 [00:09<00:11,  2.98it/s] 32%|███▏      | 16/50 [00:09<00:11,  3.00it/s] 34%|███▍      | 17/50 [00:10<00:10,  3.02it/s] 36%|███▌      | 18/50 [00:10<00:10,  3.03it/s] 38%|███▊      | 19/50 [00:10<00:10,  3.04it/s] 40%|████      | 20/50 [00:10<00:09,  3.05it/s] 42%|████▏     | 21/50 [00:11<00:09,  3.05it/s] 44%|████▍     | 22/50 [00:11<00:09,  3.05it/s] 46%|████▌     | 23/50 [00:11<00:08,  3.05it/s] 48%|████▊     | 24/50 [00:12<00:08,  3.05it/s] 50%|█████     | 25/50 [00:12<00:08,  3.05it/s] 52%|█████▏    | 26/50 [00:12<00:07,  3.05it/s] 54%|█████▍    | 27/50 [00:13<00:07,  3.05it/s] 56%|█████▌    | 28/50 [00:13<00:07,  3.05it/s] 58%|█████▊    | 29/50 [00:13<00:06,  3.05it/s] 60%|██████    | 30/50 [00:14<00:06,  3.05it/s] 62%|██████▏   | 31/50 [00:14<00:06,  3.05it/s] 64%|██████▍   | 32/50 [00:14<00:05,  3.05it/s] 66%|██████▌   | 33/50 [00:15<00:05,  3.05it/s] 68%|██████▊   | 34/50 [00:15<00:05,  3.05it/s] 70%|███████   | 35/50 [00:15<00:04,  3.05it/s] 72%|███████▏  | 36/50 [00:16<00:04,  3.05it/s] 74%|███████▍  | 37/50 [00:16<00:04,  3.05it/s] 76%|███████▌  | 38/50 [00:16<00:03,  3.04it/s] 78%|███████▊  | 39/50 [00:17<00:03,  3.04it/s] 80%|████████  | 40/50 [00:17<00:03,  3.04it/s] 82%|████████▏ | 41/50 [00:17<00:02,  3.04it/s] 84%|████████▍ | 42/50 [00:18<00:02,  3.04it/s] 86%|████████▌ | 43/50 [00:18<00:02,  3.04it/s] 88%|████████▊ | 44/50 [00:18<00:01,  3.04it/s] 90%|█████████ | 45/50 [00:19<00:01,  3.04it/s] 92%|█████████▏| 46/50 [00:19<00:01,  3.04it/s] 94%|█████████▍| 47/50 [00:19<00:00,  3.04it/s] 96%|█████████▌| 48/50 [00:20<00:00,  3.04it/s] 98%|█████████▊| 49/50 [00:20<00:00,  3.04it/s]100%|██████████| 50/50 [00:25<00:00,  1.75s/it]100%|██████████| 50/50 [00:25<00:00,  1.95it/s]
