[I 2023-12-10 22:34:30,342] Trial 149 finished with value: 0.40071404284257056 and parameters: {'EMBEDDING_DIM': 1001, 'HIDDEN_DIM': 230, 'NUM_LAYERS': 1, 'DROPOUT': 0.33819682624370406, 'LR': 0.003058739532451902, 'WEIGHT_0': 0.5276745840773622, 'WEIGHT_1': 0.8349613166709106, 'WEIGHT_2': 0.7848461078424724, 'WEIGHT_3': 0.8796685873511756, 'WEIGHT_4': 0.8972519909292331, 'WEIGHT_5': 0.5184676002127063, 'WEIGHT_6': 0.8102822439224187, 'WEIGHT_7': 0.5642677528370156, 'WEIGHT_8': 0.4451605526116605, 'optimizer': 'RMSprop'}. Best is trial 134 with value: 0.4158467115484205.
/userhome/cs2/dingruiw/conda/envs/py310/lib/python3.10/site-packages/torch/nn/modules/rnn.py:82: UserWarning: dropout option adds dropout after all but last recurrent layer, so non-zero dropout expects num_layers greater than 1, but got dropout=0.32142921179132694 and num_layers=1
  warnings.warn("dropout option adds dropout after all but last "
{'EMBEDDING_DIM': 1001, 'HIDDEN_DIM': 230, 'NUM_LAYERS': 1, 'DROPOUT': 0.33819682624370406, 'LR': 0.003058739532451902, 'WEIGHT_0': 0.5276745840773622, 'WEIGHT_1': 0.8349613166709106, 'WEIGHT_2': 0.7848461078424724, 'WEIGHT_3': 0.8796685873511756, 'WEIGHT_4': 0.8972519909292331, 'WEIGHT_5': 0.5184676002127063, 'WEIGHT_6': 0.8102822439224187, 'WEIGHT_7': 0.5642677528370156, 'WEIGHT_8': 0.4451605526116605, 'optimizer': 'RMSprop'}
0
              precision    recall  f1-score   support

         LOC       0.42      0.07      0.12      1837
        MISC       0.08      0.02      0.03       922
         ORG       0.16      0.02      0.03      1341
         PER       0.09      0.02      0.03      1842

   micro avg       0.19      0.03      0.06      5942
   macro avg       0.18      0.03      0.05      5942
weighted avg       0.20      0.03      0.06      5942

{'EMBEDDING_DIM': 1001, 'HIDDEN_DIM': 230, 'NUM_LAYERS': 1, 'DROPOUT': 0.33819682624370406, 'LR': 0.003058739532451902, 'WEIGHT_0': 0.5276745840773622, 'WEIGHT_1': 0.8349613166709106, 'WEIGHT_2': 0.7848461078424724, 'WEIGHT_3': 0.8796685873511756, 'WEIGHT_4': 0.8972519909292331, 'WEIGHT_5': 0.5184676002127063, 'WEIGHT_6': 0.8102822439224187, 'WEIGHT_7': 0.5642677528370156, 'WEIGHT_8': 0.4451605526116605, 'optimizer': 'RMSprop'}
49
              precision    recall  f1-score   support

         LOC       0.60      0.52      0.56      1837
        MISC       0.41      0.44      0.42       922
         ORG       0.28      0.27      0.28      1341
         PER       0.32      0.34      0.33      1842

   micro avg       0.40      0.40      0.40      5942
   macro avg       0.40      0.39      0.40      5942
weighted avg       0.41      0.40      0.40      5942

epoch 49
LSTM
  0%|          | 0/50 [00:00<?, ?it/s]  2%|▏         | 1/50 [00:04<03:56,  4.83s/it]  4%|▍         | 2/50 [00:04<01:39,  2.08s/it]  6%|▌         | 3/50 [00:05<00:59,  1.26s/it]  8%|▊         | 4/50 [00:05<00:40,  1.14it/s] 10%|█         | 5/50 [00:05<00:29,  1.51it/s] 12%|█▏        | 6/50 [00:06<00:23,  1.88it/s] 14%|█▍        | 7/50 [00:06<00:19,  2.21it/s] 16%|█▌        | 8/50 [00:06<00:16,  2.51it/s] 18%|█▊        | 9/50 [00:06<00:14,  2.76it/s] 20%|██        | 10/50 [00:07<00:13,  2.96it/s] 22%|██▏       | 11/50 [00:07<00:12,  3.11it/s] 24%|██▍       | 12/50 [00:07<00:11,  3.23it/s] 26%|██▌       | 13/50 [00:08<00:11,  3.31it/s] 28%|██▊       | 14/50 [00:08<00:10,  3.37it/s] 30%|███       | 15/50 [00:08<00:10,  3.42it/s] 32%|███▏      | 16/50 [00:08<00:09,  3.45it/s] 34%|███▍      | 17/50 [00:09<00:09,  3.47it/s] 36%|███▌      | 18/50 [00:09<00:09,  3.48it/s] 38%|███▊      | 19/50 [00:09<00:08,  3.49it/s] 40%|████      | 20/50 [00:10<00:08,  3.50it/s] 42%|████▏     | 21/50 [00:10<00:08,  3.51it/s] 44%|████▍     | 22/50 [00:10<00:07,  3.51it/s] 46%|████▌     | 23/50 [00:10<00:07,  3.52it/s] 48%|████▊     | 24/50 [00:11<00:07,  3.52it/s] 50%|█████     | 25/50 [00:11<00:07,  3.52it/s] 52%|█████▏    | 26/50 [00:11<00:06,  3.51it/s] 54%|█████▍    | 27/50 [00:12<00:06,  3.51it/s] 56%|█████▌    | 28/50 [00:12<00:06,  3.51it/s] 58%|█████▊    | 29/50 [00:12<00:05,  3.51it/s] 60%|██████    | 30/50 [00:12<00:05,  3.51it/s] 62%|██████▏   | 31/50 [00:13<00:05,  3.51it/s] 64%|██████▍   | 32/50 [00:13<00:05,  3.51it/s] 66%|██████▌   | 33/50 [00:13<00:04,  3.51it/s] 68%|██████▊   | 34/50 [00:14<00:04,  3.51it/s] 70%|███████   | 35/50 [00:14<00:04,  3.51it/s] 72%|███████▏  | 36/50 [00:14<00:03,  3.51it/s] 74%|███████▍  | 37/50 [00:14<00:03,  3.51it/s] 76%|███████▌  | 38/50 [00:15<00:03,  3.51it/s] 78%|███████▊  | 39/50 [00:15<00:03,  3.51it/s] 80%|████████  | 40/50 [00:15<00:02,  3.51it/s] 82%|████████▏ | 41/50 [00:16<00:02,  3.51it/s] 84%|████████▍ | 42/50 [00:16<00:02,  3.51it/s] 86%|████████▌ | 43/50 [00:16<00:01,  3.51it/s] 88%|████████▊ | 44/50 [00:16<00:01,  3.50it/s] 90%|█████████ | 45/50 [00:17<00:01,  3.50it/s] 92%|█████████▏| 46/50 [00:17<00:01,  3.51it/s] 94%|█████████▍| 47/50 [00:17<00:00,  3.51it/s] 96%|█████████▌| 48/50 [00:18<00:00,  3.51it/s] 98%|█████████▊| 49/50 [00:18<00:00,  3.50it/s]100%|██████████| 50/50 [00:23<00:00,  1.69s/it]100%|██████████| 50/50 [00:23<00:00,  2.14it/s]
[I 2023-12-10 22:34:57,902] Trial 150 finished with value: 0.4058276285764438 and parameters: {'EMBEDDING_DIM': 916, 'HIDDEN_DIM': 437, 'NUM_LAYERS': 1, 'DROPOUT': 0.32142921179132694, 'LR': 0.002031702309744274, 'WEIGHT_0': 0.4530633207262254, 'WEIGHT_1': 0.7959510254663579, 'WEIGHT_2': 0.7349023624929446, 'WEIGHT_3': 0.9785159424638921, 'WEIGHT_4': 0.9228245856047057, 'WEIGHT_5': 0.5737063546290327, 'WEIGHT_6': 0.8914320558412492, 'WEIGHT_7': 0.3318532822981153, 'WEIGHT_8': 0.3781490111665066, 'optimizer': 'RMSprop'}. Best is trial 134 with value: 0.4158467115484205.
/userhome/cs2/dingruiw/conda/envs/py310/lib/python3.10/site-packages/torch/nn/modules/rnn.py:82: UserWarning: dropout option adds dropout after all but last recurrent layer, so non-zero dropout expects num_layers greater than 1, but got dropout=0.34948041037229116 and num_layers=1
  warnings.warn("dropout option adds dropout after all but last "
{'EMBEDDING_DIM': 916, 'HIDDEN_DIM': 437, 'NUM_LAYERS': 1, 'DROPOUT': 0.32142921179132694, 'LR': 0.002031702309744274, 'WEIGHT_0': 0.4530633207262254, 'WEIGHT_1': 0.7959510254663579, 'WEIGHT_2': 0.7349023624929446, 'WEIGHT_3': 0.9785159424638921, 'WEIGHT_4': 0.9228245856047057, 'WEIGHT_5': 0.5737063546290327, 'WEIGHT_6': 0.8914320558412492, 'WEIGHT_7': 0.3318532822981153, 'WEIGHT_8': 0.3781490111665066, 'optimizer': 'RMSprop'}
0
              precision    recall  f1-score   support

         LOC       0.12      0.07      0.09      1837
        MISC       0.04      0.02      0.03       922
         ORG       0.05      0.05      0.05      1341
         PER       0.02      0.02      0.02      1842

   micro avg       0.05      0.05      0.05      5942
   macro avg       0.06      0.04      0.05      5942
weighted avg       0.06      0.05      0.05      5942

{'EMBEDDING_DIM': 916, 'HIDDEN_DIM': 437, 'NUM_LAYERS': 1, 'DROPOUT': 0.32142921179132694, 'LR': 0.002031702309744274, 'WEIGHT_0': 0.4530633207262254, 'WEIGHT_1': 0.7959510254663579, 'WEIGHT_2': 0.7349023624929446, 'WEIGHT_3': 0.9785159424638921, 'WEIGHT_4': 0.9228245856047057, 'WEIGHT_5': 0.5737063546290327, 'WEIGHT_6': 0.8914320558412492, 'WEIGHT_7': 0.3318532822981153, 'WEIGHT_8': 0.3781490111665066, 'optimizer': 'RMSprop'}
49
              precision    recall  f1-score   support

         LOC       0.59      0.53      0.56      1837
        MISC       0.46      0.43      0.44       922
         ORG       0.29      0.25      0.27      1341
         PER       0.34      0.32      0.33      1842

   micro avg       0.42      0.39      0.41      5942
   macro avg       0.42      0.38      0.40      5942
weighted avg       0.42      0.39      0.41      5942

epoch 49
LSTM
  0%|          | 0/50 [00:00<?, ?it/s]  2%|▏         | 1/50 [00:04<03:22,  4.12s/it] 10%|█         | 5/50 [00:04<00:28,  1.56it/s] 14%|█▍        | 7/50 [00:04<00:18,  2.29it/s] 18%|█▊        | 9/50 [00:04<00:12,  3.17it/s] 22%|██▏       | 11/50 [00:04<00:09,  4.15it/s] 26%|██▌       | 13/50 [00:05<00:07,  5.18it/s] 30%|███       | 15/50 [00:05<00:05,  6.19it/s] 34%|███▍      | 17/50 [00:05<00:04,  7.12it/s] 38%|███▊      | 19/50 [00:05<00:03,  7.95it/s] 42%|████▏     | 21/50 [00:05<00:03,  8.64it/s] 46%|████▌     | 23/50 [00:05<00:02,  9.19it/s] 50%|█████     | 25/50 [00:06<00:02,  9.62it/s] 54%|█████▍    | 27/50 [00:06<00:02,  9.92it/s] 58%|█████▊    | 29/50 [00:06<00:02, 10.15it/s] 62%|██████▏   | 31/50 [00:06<00:01, 10.33it/s] 66%|██████▌   | 33/50 [00:06<00:01, 10.46it/s] 70%|███████   | 35/50 [00:07<00:01, 10.55it/s] 74%|███████▍  | 37/50 [00:07<00:01, 10.61it/s] 78%|███████▊  | 39/50 [00:07<00:01, 10.64it/s] 82%|████████▏ | 41/50 [00:07<00:00, 10.67it/s] 86%|████████▌ | 43/50 [00:07<00:00, 10.70it/s] 90%|█████████ | 45/50 [00:07<00:00, 10.72it/s] 94%|█████████▍| 47/50 [00:08<00:00, 10.73it/s] 98%|█████████▊| 49/50 [00:08<00:00, 10.72it/s]100%|██████████| 50/50 [00:12<00:00,  3.94it/s]
[I 2023-12-10 22:35:14,366] Trial 151 finished with value: 0.36812749003984063 and parameters: {'EMBEDDING_DIM': 1024, 'HIDDEN_DIM': 105, 'NUM_LAYERS': 1, 'DROPOUT': 0.34948041037229116, 'LR': 0.0013568150169279494, 'WEIGHT_0': 0.4863217311680692, 'WEIGHT_1': 0.7735562774370909, 'WEIGHT_2': 0.7012588169033714, 'WEIGHT_3': 0.934638788789921, 'WEIGHT_4': 0.6079244684736088, 'WEIGHT_5': 0.4742363884503969, 'WEIGHT_6': 0.931333049593183, 'WEIGHT_7': 0.4939405047481635, 'WEIGHT_8': 0.39284137283403103, 'optimizer': 'Adam'}. Best is trial 134 with value: 0.4158467115484205.
/userhome/cs2/dingruiw/conda/envs/py310/lib/python3.10/site-packages/torch/nn/modules/rnn.py:82: UserWarning: dropout option adds dropout after all but last recurrent layer, so non-zero dropout expects num_layers greater than 1, but got dropout=0.34797013281212535 and num_layers=1
  warnings.warn("dropout option adds dropout after all but last "
{'EMBEDDING_DIM': 1024, 'HIDDEN_DIM': 105, 'NUM_LAYERS': 1, 'DROPOUT': 0.34948041037229116, 'LR': 0.0013568150169279494, 'WEIGHT_0': 0.4863217311680692, 'WEIGHT_1': 0.7735562774370909, 'WEIGHT_2': 0.7012588169033714, 'WEIGHT_3': 0.934638788789921, 'WEIGHT_4': 0.6079244684736088, 'WEIGHT_5': 0.4742363884503969, 'WEIGHT_6': 0.931333049593183, 'WEIGHT_7': 0.4939405047481635, 'WEIGHT_8': 0.39284137283403103, 'optimizer': 'Adam'}
0
              precision    recall  f1-score   support

         LOC       0.04      0.09      0.05      1837
        MISC       0.02      0.07      0.03       922
         ORG       0.03      0.14      0.04      1341
         PER       0.02      0.04      0.02      1842

   micro avg       0.03      0.08      0.04      5942
   macro avg       0.02      0.08      0.04      5942
weighted avg       0.03      0.08      0.04      5942

{'EMBEDDING_DIM': 1024, 'HIDDEN_DIM': 105, 'NUM_LAYERS': 1, 'DROPOUT': 0.34948041037229116, 'LR': 0.0013568150169279494, 'WEIGHT_0': 0.4863217311680692, 'WEIGHT_1': 0.7735562774370909, 'WEIGHT_2': 0.7012588169033714, 'WEIGHT_3': 0.934638788789921, 'WEIGHT_4': 0.6079244684736088, 'WEIGHT_5': 0.4742363884503969, 'WEIGHT_6': 0.931333049593183, 'WEIGHT_7': 0.4939405047481635, 'WEIGHT_8': 0.39284137283403103, 'optimizer': 'Adam'}
49
              precision    recall  f1-score   support

         LOC       0.62      0.49      0.55      1837
        MISC       0.51      0.42      0.46       922
         ORG       0.26      0.23      0.25      1341
         PER       0.25      0.26      0.25      1842

   micro avg       0.39      0.35      0.37      5942
   macro avg       0.41      0.35      0.38      5942
weighted avg       0.41      0.35      0.37      5942

epoch 49
LSTM
  0%|          | 0/50 [00:00<?, ?it/s]  2%|▏         | 1/50 [00:04<03:59,  4.89s/it]  4%|▍         | 2/50 [00:05<01:40,  2.10s/it]  6%|▌         | 3/50 [00:05<00:59,  1.27s/it]  8%|▊         | 4/50 [00:05<00:40,  1.14it/s] 10%|█         | 5/50 [00:05<00:29,  1.52it/s] 12%|█▏        | 6/50 [00:06<00:23,  1.90it/s] 14%|█▍        | 7/50 [00:06<00:19,  2.26it/s] 16%|█▌        | 8/50 [00:06<00:16,  2.57it/s] 18%|█▊        | 9/50 [00:06<00:14,  2.84it/s] 20%|██        | 10/50 [00:07<00:13,  3.05it/s] 22%|██▏       | 11/50 [00:07<00:12,  3.22it/s] 24%|██▍       | 12/50 [00:07<00:11,  3.35it/s] 26%|██▌       | 13/50 [00:08<00:10,  3.44it/s] 28%|██▊       | 14/50 [00:08<00:10,  3.51it/s] 30%|███       | 15/50 [00:08<00:09,  3.56it/s] 32%|███▏      | 16/50 [00:08<00:09,  3.59it/s] 34%|███▍      | 17/50 [00:09<00:09,  3.61it/s] 36%|███▌      | 18/50 [00:09<00:08,  3.63it/s] 38%|███▊      | 19/50 [00:09<00:08,  3.64it/s] 40%|████      | 20/50 [00:09<00:08,  3.64it/s] 42%|████▏     | 21/50 [00:10<00:07,  3.65it/s] 44%|████▍     | 22/50 [00:10<00:07,  3.65it/s] 46%|████▌     | 23/50 [00:10<00:07,  3.66it/s] 48%|████▊     | 24/50 [00:11<00:07,  3.66it/s] 50%|█████     | 25/50 [00:11<00:06,  3.66it/s] 52%|█████▏    | 26/50 [00:11<00:06,  3.66it/s] 54%|█████▍    | 27/50 [00:11<00:06,  3.65it/s] 56%|█████▌    | 28/50 [00:12<00:06,  3.65it/s] 58%|█████▊    | 29/50 [00:12<00:05,  3.65it/s] 60%|██████    | 30/50 [00:12<00:05,  3.65it/s] 62%|██████▏   | 31/50 [00:12<00:05,  3.65it/s] 64%|██████▍   | 32/50 [00:13<00:04,  3.65it/s] 66%|██████▌   | 33/50 [00:13<00:04,  3.65it/s] 68%|██████▊   | 34/50 [00:13<00:04,  3.65it/s] 70%|███████   | 35/50 [00:14<00:04,  3.64it/s] 72%|███████▏  | 36/50 [00:14<00:03,  3.64it/s] 74%|███████▍  | 37/50 [00:14<00:03,  3.65it/s] 76%|███████▌  | 38/50 [00:14<00:03,  3.64it/s] 78%|███████▊  | 39/50 [00:15<00:03,  3.65it/s] 80%|████████  | 40/50 [00:15<00:02,  3.64it/s] 82%|████████▏ | 41/50 [00:15<00:02,  3.65it/s] 84%|████████▍ | 42/50 [00:15<00:02,  3.65it/s] 86%|████████▌ | 43/50 [00:16<00:01,  3.65it/s] 88%|████████▊ | 44/50 [00:16<00:01,  3.66it/s] 90%|█████████ | 45/50 [00:16<00:01,  3.66it/s] 92%|█████████▏| 46/50 [00:17<00:01,  3.66it/s] 94%|█████████▍| 47/50 [00:17<00:00,  3.66it/s] 96%|█████████▌| 48/50 [00:17<00:00,  3.66it/s] 98%|█████████▊| 49/50 [00:17<00:00,  3.66it/s]100%|██████████| 50/50 [00:22<00:00,  1.65s/it]100%|██████████| 50/50 [00:22<00:00,  2.20it/s]
[I 2023-12-10 22:35:41,205] Trial 152 finished with value: 0.384124009879908 and parameters: {'EMBEDDING_DIM': 374, 'HIDDEN_DIM': 565, 'NUM_LAYERS': 1, 'DROPOUT': 0.34797013281212535, 'LR': 0.0016200259385456117, 'WEIGHT_0': 0.5010197733338447, 'WEIGHT_1': 0.7621320873432461, 'WEIGHT_2': 0.6652679116992521, 'WEIGHT_3': 0.9519667940491446, 'WEIGHT_4': 0.9707163834212068, 'WEIGHT_5': 0.49148563770367104, 'WEIGHT_6': 0.7661037580355544, 'WEIGHT_7': 0.47152200350778833, 'WEIGHT_8': 0.4124785112715455, 'optimizer': 'Adam'}. Best is trial 134 with value: 0.4158467115484205.
/userhome/cs2/dingruiw/conda/envs/py310/lib/python3.10/site-packages/torch/nn/modules/rnn.py:82: UserWarning: dropout option adds dropout after all but last recurrent layer, so non-zero dropout expects num_layers greater than 1, but got dropout=0.33686182876770326 and num_layers=1
  warnings.warn("dropout option adds dropout after all but last "
{'EMBEDDING_DIM': 374, 'HIDDEN_DIM': 565, 'NUM_LAYERS': 1, 'DROPOUT': 0.34797013281212535, 'LR': 0.0016200259385456117, 'WEIGHT_0': 0.5010197733338447, 'WEIGHT_1': 0.7621320873432461, 'WEIGHT_2': 0.6652679116992521, 'WEIGHT_3': 0.9519667940491446, 'WEIGHT_4': 0.9707163834212068, 'WEIGHT_5': 0.49148563770367104, 'WEIGHT_6': 0.7661037580355544, 'WEIGHT_7': 0.47152200350778833, 'WEIGHT_8': 0.4124785112715455, 'optimizer': 'Adam'}
0
              precision    recall  f1-score   support

         LOC       0.05      0.04      0.04      1837
        MISC       0.02      0.03      0.02       922
         ORG       0.02      0.04      0.03      1341
         PER       0.02      0.06      0.03      1842

   micro avg       0.02      0.04      0.03      5942
   macro avg       0.03      0.04      0.03      5942
weighted avg       0.03      0.04      0.03      5942

{'EMBEDDING_DIM': 374, 'HIDDEN_DIM': 565, 'NUM_LAYERS': 1, 'DROPOUT': 0.34797013281212535, 'LR': 0.0016200259385456117, 'WEIGHT_0': 0.5010197733338447, 'WEIGHT_1': 0.7621320873432461, 'WEIGHT_2': 0.6652679116992521, 'WEIGHT_3': 0.9519667940491446, 'WEIGHT_4': 0.9707163834212068, 'WEIGHT_5': 0.49148563770367104, 'WEIGHT_6': 0.7661037580355544, 'WEIGHT_7': 0.47152200350778833, 'WEIGHT_8': 0.4124785112715455, 'optimizer': 'Adam'}
49
              precision    recall  f1-score   support

         LOC       0.54      0.52      0.53      1837
        MISC       0.40      0.39      0.40       922
         ORG       0.27      0.24      0.25      1341
         PER       0.32      0.33      0.33      1842

   micro avg       0.39      0.38      0.38      5942
   macro avg       0.38      0.37      0.38      5942
weighted avg       0.39      0.38      0.38      5942

epoch 49
LSTM
  0%|          | 0/50 [00:00<?, ?it/s]  2%|▏         | 1/50 [00:05<04:41,  5.75s/it]  4%|▍         | 2/50 [00:06<02:02,  2.56s/it]  6%|▌         | 3/50 [00:06<01:21,  1.73s/it]  8%|▊         | 4/50 [00:07<01:01,  1.33s/it] 10%|█         | 5/50 [00:08<00:50,  1.12s/it] 12%|█▏        | 6/50 [00:09<00:43,  1.02it/s] 14%|█▍        | 7/50 [00:09<00:38,  1.11it/s] 16%|█▌        | 8/50 [00:10<00:35,  1.18it/s] 18%|█▊        | 9/50 [00:11<00:33,  1.23it/s] 20%|██        | 10/50 [00:11<00:31,  1.27it/s] 22%|██▏       | 11/50 [00:12<00:30,  1.30it/s] 24%|██▍       | 12/50 [00:13<00:28,  1.32it/s] 26%|██▌       | 13/50 [00:14<00:27,  1.33it/s] 28%|██▊       | 14/50 [00:14<00:26,  1.34it/s] 30%|███       | 15/50 [00:15<00:25,  1.35it/s] 32%|███▏      | 16/50 [00:16<00:25,  1.35it/s] 34%|███▍      | 17/50 [00:17<00:24,  1.35it/s] 36%|███▌      | 18/50 [00:17<00:23,  1.35it/s] 38%|███▊      | 19/50 [00:18<00:22,  1.36it/s] 40%|████      | 20/50 [00:19<00:22,  1.36it/s] 42%|████▏     | 21/50 [00:20<00:21,  1.35it/s] 44%|████▍     | 22/50 [00:20<00:20,  1.35it/s] 46%|████▌     | 23/50 [00:21<00:19,  1.35it/s] 48%|████▊     | 24/50 [00:22<00:19,  1.35it/s] 50%|█████     | 25/50 [00:22<00:18,  1.35it/s] 52%|█████▏    | 26/50 [00:23<00:17,  1.35it/s] 54%|█████▍    | 27/50 [00:24<00:17,  1.35it/s] 56%|█████▌    | 28/50 [00:25<00:16,  1.34it/s] 58%|█████▊    | 29/50 [00:25<00:15,  1.34it/s] 60%|██████    | 30/50 [00:26<00:14,  1.34it/s] 62%|██████▏   | 31/50 [00:27<00:14,  1.34it/s] 64%|██████▍   | 32/50 [00:28<00:13,  1.34it/s] 66%|██████▌   | 33/50 [00:28<00:12,  1.34it/s] 68%|██████▊   | 34/50 [00:29<00:11,  1.34it/s] 70%|███████   | 35/50 [00:30<00:11,  1.34it/s] 72%|███████▏  | 36/50 [00:31<00:10,  1.34it/s] 74%|███████▍  | 37/50 [00:31<00:09,  1.34it/s] 76%|███████▌  | 38/50 [00:32<00:08,  1.34it/s] 78%|███████▊  | 39/50 [00:33<00:08,  1.34it/s] 80%|████████  | 40/50 [00:34<00:07,  1.33it/s] 82%|████████▏ | 41/50 [00:34<00:06,  1.33it/s] 84%|████████▍ | 42/50 [00:35<00:06,  1.33it/s] 86%|████████▌ | 43/50 [00:36<00:05,  1.33it/s] 88%|████████▊ | 44/50 [00:37<00:04,  1.33it/s] 90%|█████████ | 45/50 [00:37<00:03,  1.32it/s] 92%|█████████▏| 46/50 [00:38<00:03,  1.32it/s] 94%|█████████▍| 47/50 [00:39<00:02,  1.32it/s] 96%|█████████▌| 48/50 [00:40<00:01,  1.32it/s] 98%|█████████▊| 49/50 [00:41<00:00,  1.31it/s]100%|██████████| 50/50 [00:47<00:00,  2.37s/it]100%|██████████| 50/50 [00:47<00:00,  1.06it/s]
