[I 2023-12-11 00:21:40,400] Trial 369 finished with value: 0.4050901378579003 and parameters: {'EMBEDDING_DIM': 986, 'HIDDEN_DIM': 185, 'NUM_LAYERS': 1, 'DROPOUT': 0.03496569887327583, 'LR': 0.002424774442548268, 'WEIGHT_0': 0.20522949466617066, 'WEIGHT_1': 0.6819728657758438, 'WEIGHT_2': 0.4259928885160673, 'WEIGHT_3': 0.8966116833725064, 'WEIGHT_4': 0.780572628700981, 'WEIGHT_5': 0.6966184947541484, 'WEIGHT_6': 0.6879917141202616, 'WEIGHT_7': 0.33905678937852224, 'WEIGHT_8': 0.9227672019949171, 'optimizer': 'RMSprop'}. Best is trial 365 with value: 0.41910947782240837.
{'EMBEDDING_DIM': 986, 'HIDDEN_DIM': 185, 'NUM_LAYERS': 1, 'DROPOUT': 0.03496569887327583, 'LR': 0.002424774442548268, 'WEIGHT_0': 0.20522949466617066, 'WEIGHT_1': 0.6819728657758438, 'WEIGHT_2': 0.4259928885160673, 'WEIGHT_3': 0.8966116833725064, 'WEIGHT_4': 0.780572628700981, 'WEIGHT_5': 0.6966184947541484, 'WEIGHT_6': 0.6879917141202616, 'WEIGHT_7': 0.33905678937852224, 'WEIGHT_8': 0.9227672019949171, 'optimizer': 'RMSprop'}
0
              precision    recall  f1-score   support

         LOC       0.36      0.26      0.30      1837
        MISC       0.15      0.07      0.09       922
         ORG       0.23      0.05      0.09      1341
         PER       0.09      0.05      0.06      1842

   micro avg       0.24      0.12      0.16      5942
   macro avg       0.21      0.11      0.13      5942
weighted avg       0.22      0.12      0.15      5942

{'EMBEDDING_DIM': 986, 'HIDDEN_DIM': 185, 'NUM_LAYERS': 1, 'DROPOUT': 0.03496569887327583, 'LR': 0.002424774442548268, 'WEIGHT_0': 0.20522949466617066, 'WEIGHT_1': 0.6819728657758438, 'WEIGHT_2': 0.4259928885160673, 'WEIGHT_3': 0.8966116833725064, 'WEIGHT_4': 0.780572628700981, 'WEIGHT_5': 0.6966184947541484, 'WEIGHT_6': 0.6879917141202616, 'WEIGHT_7': 0.33905678937852224, 'WEIGHT_8': 0.9227672019949171, 'optimizer': 'RMSprop'}
49
              precision    recall  f1-score   support

         LOC       0.51      0.56      0.54      1837
        MISC       0.45      0.46      0.45       922
         ORG       0.26      0.27      0.26      1341
         PER       0.34      0.36      0.35      1842

   micro avg       0.39      0.42      0.41      5942
   macro avg       0.39      0.41      0.40      5942
weighted avg       0.39      0.42      0.40      5942

epoch 49
LSTM
  0%|          | 0/50 [00:00<?, ?it/s]  2%|▏         | 1/50 [00:05<04:21,  5.34s/it]  4%|▍         | 2/50 [00:05<01:48,  2.27s/it]  6%|▌         | 3/50 [00:05<01:04,  1.38s/it]  8%|▊         | 4/50 [00:06<00:43,  1.05it/s] 10%|█         | 5/50 [00:06<00:32,  1.38it/s] 12%|█▏        | 6/50 [00:06<00:25,  1.72it/s] 14%|█▍        | 7/50 [00:07<00:21,  2.03it/s] 16%|█▌        | 8/50 [00:07<00:18,  2.30it/s] 18%|█▊        | 9/50 [00:07<00:16,  2.53it/s] 20%|██        | 10/50 [00:07<00:14,  2.71it/s] 22%|██▏       | 11/50 [00:08<00:13,  2.85it/s] 24%|██▍       | 12/50 [00:08<00:12,  2.96it/s] 26%|██▌       | 13/50 [00:08<00:12,  3.03it/s] 28%|██▊       | 14/50 [00:09<00:11,  3.08it/s] 30%|███       | 15/50 [00:09<00:11,  3.13it/s] 32%|███▏      | 16/50 [00:09<00:10,  3.16it/s] 34%|███▍      | 17/50 [00:10<00:10,  3.17it/s] 36%|███▌      | 18/50 [00:10<00:10,  3.20it/s] 38%|███▊      | 19/50 [00:10<00:09,  3.21it/s] 40%|████      | 20/50 [00:11<00:09,  3.21it/s] 42%|████▏     | 21/50 [00:11<00:09,  3.21it/s] 44%|████▍     | 22/50 [00:11<00:08,  3.22it/s] 46%|████▌     | 23/50 [00:11<00:08,  3.21it/s] 48%|████▊     | 24/50 [00:12<00:08,  3.21it/s] 50%|█████     | 25/50 [00:12<00:07,  3.21it/s] 52%|█████▏    | 26/50 [00:12<00:07,  3.22it/s] 54%|█████▍    | 27/50 [00:13<00:07,  3.22it/s] 56%|█████▌    | 28/50 [00:13<00:06,  3.22it/s] 58%|█████▊    | 29/50 [00:13<00:06,  3.22it/s] 60%|██████    | 30/50 [00:14<00:06,  3.22it/s] 62%|██████▏   | 31/50 [00:14<00:05,  3.22it/s] 64%|██████▍   | 32/50 [00:14<00:05,  3.21it/s] 66%|██████▌   | 33/50 [00:15<00:05,  3.22it/s] 68%|██████▊   | 34/50 [00:15<00:04,  3.22it/s] 70%|███████   | 35/50 [00:15<00:04,  3.22it/s] 72%|███████▏  | 36/50 [00:16<00:04,  3.22it/s] 74%|███████▍  | 37/50 [00:16<00:04,  3.21it/s] 76%|███████▌  | 38/50 [00:16<00:03,  3.22it/s] 78%|███████▊  | 39/50 [00:16<00:03,  3.22it/s] 80%|████████  | 40/50 [00:17<00:03,  3.22it/s] 82%|████████▏ | 41/50 [00:17<00:02,  3.21it/s] 84%|████████▍ | 42/50 [00:17<00:02,  3.22it/s] 86%|████████▌ | 43/50 [00:18<00:02,  3.21it/s] 88%|████████▊ | 44/50 [00:18<00:01,  3.21it/s] 90%|█████████ | 45/50 [00:18<00:01,  3.21it/s] 92%|█████████▏| 46/50 [00:19<00:01,  3.21it/s] 94%|█████████▍| 47/50 [00:19<00:00,  3.22it/s] 96%|█████████▌| 48/50 [00:19<00:00,  3.21it/s] 98%|█████████▊| 49/50 [00:20<00:00,  3.21it/s]100%|██████████| 50/50 [00:25<00:00,  1.84s/it]100%|██████████| 50/50 [00:25<00:00,  1.96it/s]
[I 2023-12-11 00:22:10,641] Trial 370 finished with value: 0.3859649122807018 and parameters: {'EMBEDDING_DIM': 970, 'HIDDEN_DIM': 301, 'NUM_LAYERS': 2, 'DROPOUT': 0.019709249254682006, 'LR': 0.002164501075733986, 'WEIGHT_0': 0.18180419889294258, 'WEIGHT_1': 0.6623065654745546, 'WEIGHT_2': 0.4764099946622858, 'WEIGHT_3': 0.9108849431265933, 'WEIGHT_4': 0.7801581042230004, 'WEIGHT_5': 0.6585332522235104, 'WEIGHT_6': 0.6732580251960506, 'WEIGHT_7': 0.7919260613092989, 'WEIGHT_8': 0.9143390727286593, 'optimizer': 'RMSprop'}. Best is trial 365 with value: 0.41910947782240837.
/userhome/cs2/dingruiw/conda/envs/py310/lib/python3.10/site-packages/torch/nn/modules/rnn.py:82: UserWarning: dropout option adds dropout after all but last recurrent layer, so non-zero dropout expects num_layers greater than 1, but got dropout=0.04977896860803351 and num_layers=1
  warnings.warn("dropout option adds dropout after all but last "
{'EMBEDDING_DIM': 970, 'HIDDEN_DIM': 301, 'NUM_LAYERS': 2, 'DROPOUT': 0.019709249254682006, 'LR': 0.002164501075733986, 'WEIGHT_0': 0.18180419889294258, 'WEIGHT_1': 0.6623065654745546, 'WEIGHT_2': 0.4764099946622858, 'WEIGHT_3': 0.9108849431265933, 'WEIGHT_4': 0.7801581042230004, 'WEIGHT_5': 0.6585332522235104, 'WEIGHT_6': 0.6732580251960506, 'WEIGHT_7': 0.7919260613092989, 'WEIGHT_8': 0.9143390727286593, 'optimizer': 'RMSprop'}
0
              precision    recall  f1-score   support

         LOC       0.14      0.02      0.03      1837
        MISC       0.00      0.00      0.00       922
         ORG       0.12      0.00      0.01      1341
         PER       0.02      0.01      0.01      1842

   micro avg       0.07      0.01      0.01      5942
   macro avg       0.07      0.01      0.01      5942
weighted avg       0.08      0.01      0.01      5942

{'EMBEDDING_DIM': 970, 'HIDDEN_DIM': 301, 'NUM_LAYERS': 2, 'DROPOUT': 0.019709249254682006, 'LR': 0.002164501075733986, 'WEIGHT_0': 0.18180419889294258, 'WEIGHT_1': 0.6623065654745546, 'WEIGHT_2': 0.4764099946622858, 'WEIGHT_3': 0.9108849431265933, 'WEIGHT_4': 0.7801581042230004, 'WEIGHT_5': 0.6585332522235104, 'WEIGHT_6': 0.6732580251960506, 'WEIGHT_7': 0.7919260613092989, 'WEIGHT_8': 0.9143390727286593, 'optimizer': 'RMSprop'}
49
              precision    recall  f1-score   support

         LOC       0.55      0.50      0.52      1837
        MISC       0.44      0.36      0.40       922
         ORG       0.27      0.24      0.25      1341
         PER       0.33      0.36      0.34      1842

   micro avg       0.40      0.38      0.39      5942
   macro avg       0.40      0.37      0.38      5942
weighted avg       0.40      0.38      0.39      5942

epoch 49
LSTM
  0%|          | 0/50 [00:00<?, ?it/s]  2%|▏         | 1/50 [00:04<03:36,  4.41s/it]  6%|▌         | 3/50 [00:04<00:58,  1.25s/it]  8%|▊         | 4/50 [00:04<00:40,  1.15it/s] 10%|█         | 5/50 [00:05<00:28,  1.57it/s] 12%|█▏        | 6/50 [00:05<00:21,  2.05it/s] 14%|█▍        | 7/50 [00:05<00:16,  2.59it/s] 16%|█▌        | 8/50 [00:05<00:13,  3.14it/s] 18%|█▊        | 9/50 [00:05<00:11,  3.68it/s] 20%|██        | 10/50 [00:05<00:09,  4.17it/s] 22%|██▏       | 11/50 [00:06<00:08,  4.60it/s] 24%|██▍       | 12/50 [00:06<00:07,  4.94it/s] 26%|██▌       | 13/50 [00:06<00:07,  5.22it/s] 28%|██▊       | 14/50 [00:06<00:06,  5.44it/s] 30%|███       | 15/50 [00:06<00:06,  5.59it/s] 32%|███▏      | 16/50 [00:06<00:05,  5.70it/s] 34%|███▍      | 17/50 [00:07<00:05,  5.79it/s] 36%|███▌      | 18/50 [00:07<00:05,  5.85it/s] 38%|███▊      | 19/50 [00:07<00:05,  5.89it/s] 40%|████      | 20/50 [00:07<00:05,  5.92it/s] 42%|████▏     | 21/50 [00:07<00:04,  5.95it/s] 44%|████▍     | 22/50 [00:07<00:04,  5.96it/s] 46%|████▌     | 23/50 [00:08<00:04,  5.96it/s] 48%|████▊     | 24/50 [00:08<00:04,  5.97it/s] 50%|█████     | 25/50 [00:08<00:04,  5.98it/s] 52%|█████▏    | 26/50 [00:08<00:04,  5.99it/s] 54%|█████▍    | 27/50 [00:08<00:03,  5.98it/s] 56%|█████▌    | 28/50 [00:08<00:03,  5.99it/s] 58%|█████▊    | 29/50 [00:09<00:03,  5.99it/s] 60%|██████    | 30/50 [00:09<00:03,  6.00it/s] 62%|██████▏   | 31/50 [00:09<00:03,  5.98it/s] 64%|██████▍   | 32/50 [00:09<00:03,  5.98it/s] 66%|██████▌   | 33/50 [00:09<00:02,  5.97it/s] 68%|██████▊   | 34/50 [00:09<00:02,  5.98it/s] 70%|███████   | 35/50 [00:10<00:02,  5.98it/s] 72%|███████▏  | 36/50 [00:10<00:02,  5.97it/s] 74%|███████▍  | 37/50 [00:10<00:02,  5.97it/s] 76%|███████▌  | 38/50 [00:10<00:02,  5.98it/s] 78%|███████▊  | 39/50 [00:10<00:01,  5.98it/s] 80%|████████  | 40/50 [00:10<00:01,  5.98it/s] 82%|████████▏ | 41/50 [00:11<00:01,  5.97it/s] 84%|████████▍ | 42/50 [00:11<00:01,  5.97it/s] 86%|████████▌ | 43/50 [00:11<00:01,  5.97it/s] 88%|████████▊ | 44/50 [00:11<00:01,  5.97it/s] 90%|█████████ | 45/50 [00:11<00:00,  5.97it/s] 92%|█████████▏| 46/50 [00:11<00:00,  5.97it/s] 94%|█████████▍| 47/50 [00:12<00:00,  5.97it/s] 96%|█████████▌| 48/50 [00:12<00:00,  5.97it/s] 98%|█████████▊| 49/50 [00:12<00:00,  5.97it/s]100%|██████████| 50/50 [00:17<00:00,  1.51s/it]100%|██████████| 50/50 [00:17<00:00,  2.94it/s]
[I 2023-12-11 00:22:31,854] Trial 371 finished with value: 0.4057923586680847 and parameters: {'EMBEDDING_DIM': 990, 'HIDDEN_DIM': 238, 'NUM_LAYERS': 1, 'DROPOUT': 0.04977896860803351, 'LR': 0.0023552031215104794, 'WEIGHT_0': 0.23101645779208327, 'WEIGHT_1': 0.6650174169326604, 'WEIGHT_2': 0.482352065276079, 'WEIGHT_3': 0.9385287017519416, 'WEIGHT_4': 0.7676109562659016, 'WEIGHT_5': 0.6960953992586486, 'WEIGHT_6': 0.7007936297797305, 'WEIGHT_7': 0.33818171221992327, 'WEIGHT_8': 0.8994568415824216, 'optimizer': 'RMSprop'}. Best is trial 365 with value: 0.41910947782240837.
/userhome/cs2/dingruiw/conda/envs/py310/lib/python3.10/site-packages/torch/nn/modules/rnn.py:82: UserWarning: dropout option adds dropout after all but last recurrent layer, so non-zero dropout expects num_layers greater than 1, but got dropout=0.03265286391547459 and num_layers=1
  warnings.warn("dropout option adds dropout after all but last "
{'EMBEDDING_DIM': 990, 'HIDDEN_DIM': 238, 'NUM_LAYERS': 1, 'DROPOUT': 0.04977896860803351, 'LR': 0.0023552031215104794, 'WEIGHT_0': 0.23101645779208327, 'WEIGHT_1': 0.6650174169326604, 'WEIGHT_2': 0.482352065276079, 'WEIGHT_3': 0.9385287017519416, 'WEIGHT_4': 0.7676109562659016, 'WEIGHT_5': 0.6960953992586486, 'WEIGHT_6': 0.7007936297797305, 'WEIGHT_7': 0.33818171221992327, 'WEIGHT_8': 0.8994568415824216, 'optimizer': 'RMSprop'}
0
              precision    recall  f1-score   support

         LOC       0.37      0.28      0.32      1837
        MISC       0.13      0.03      0.04       922
         ORG       0.13      0.05      0.08      1341
         PER       0.08      0.06      0.07      1842

   micro avg       0.21      0.12      0.15      5942
   macro avg       0.18      0.10      0.13      5942
weighted avg       0.19      0.12      0.14      5942

{'EMBEDDING_DIM': 990, 'HIDDEN_DIM': 238, 'NUM_LAYERS': 1, 'DROPOUT': 0.04977896860803351, 'LR': 0.0023552031215104794, 'WEIGHT_0': 0.23101645779208327, 'WEIGHT_1': 0.6650174169326604, 'WEIGHT_2': 0.482352065276079, 'WEIGHT_3': 0.9385287017519416, 'WEIGHT_4': 0.7676109562659016, 'WEIGHT_5': 0.6960953992586486, 'WEIGHT_6': 0.7007936297797305, 'WEIGHT_7': 0.33818171221992327, 'WEIGHT_8': 0.8994568415824216, 'optimizer': 'RMSprop'}
49
              precision    recall  f1-score   support

         LOC       0.55      0.57      0.56      1837
        MISC       0.43      0.43      0.43       922
         ORG       0.27      0.26      0.27      1341
         PER       0.32      0.37      0.34      1842

   micro avg       0.39      0.42      0.41      5942
   macro avg       0.39      0.41      0.40      5942
weighted avg       0.40      0.42      0.41      5942

epoch 49
LSTM
  0%|          | 0/50 [00:00<?, ?it/s]  2%|▏         | 1/50 [00:04<03:40,  4.49s/it]  4%|▍         | 2/50 [00:04<01:31,  1.92s/it]  6%|▌         | 3/50 [00:04<00:53,  1.14s/it]  8%|▊         | 4/50 [00:05<00:35,  1.29it/s] 10%|█         | 5/50 [00:05<00:25,  1.75it/s] 12%|█▏        | 6/50 [00:05<00:19,  2.24it/s] 14%|█▍        | 7/50 [00:05<00:15,  2.71it/s] 16%|█▌        | 8/50 [00:05<00:13,  3.15it/s] 18%|█▊        | 9/50 [00:06<00:11,  3.53it/s] 20%|██        | 10/50 [00:06<00:10,  3.85it/s] 22%|██▏       | 11/50 [00:06<00:09,  4.10it/s] 24%|██▍       | 12/50 [00:06<00:08,  4.31it/s] 26%|██▌       | 13/50 [00:06<00:08,  4.44it/s] 28%|██▊       | 14/50 [00:07<00:07,  4.55it/s] 30%|███       | 15/50 [00:07<00:07,  4.63it/s] 32%|███▏      | 16/50 [00:07<00:07,  4.69it/s] 34%|███▍      | 17/50 [00:07<00:06,  4.72it/s] 36%|███▌      | 18/50 [00:07<00:06,  4.75it/s] 38%|███▊      | 19/50 [00:08<00:06,  4.77it/s] 40%|████      | 20/50 [00:08<00:06,  4.79it/s] 42%|████▏     | 21/50 [00:08<00:06,  4.80it/s] 44%|████▍     | 22/50 [00:08<00:05,  4.80it/s] 46%|████▌     | 23/50 [00:08<00:05,  4.80it/s] 48%|████▊     | 24/50 [00:09<00:05,  4.80it/s] 50%|█████     | 25/50 [00:09<00:05,  4.81it/s] 52%|█████▏    | 26/50 [00:09<00:04,  4.80it/s] 54%|█████▍    | 27/50 [00:09<00:04,  4.80it/s] 56%|█████▌    | 28/50 [00:10<00:04,  4.80it/s] 58%|█████▊    | 29/50 [00:10<00:04,  4.80it/s] 60%|██████    | 30/50 [00:10<00:04,  4.80it/s] 62%|██████▏   | 31/50 [00:10<00:03,  4.80it/s] 64%|██████▍   | 32/50 [00:10<00:03,  4.80it/s] 66%|██████▌   | 33/50 [00:11<00:03,  4.80it/s] 68%|██████▊   | 34/50 [00:11<00:03,  4.79it/s] 70%|███████   | 35/50 [00:11<00:03,  4.80it/s] 72%|███████▏  | 36/50 [00:11<00:02,  4.80it/s] 74%|███████▍  | 37/50 [00:11<00:02,  4.80it/s] 76%|███████▌  | 38/50 [00:12<00:02,  4.80it/s] 78%|███████▊  | 39/50 [00:12<00:02,  4.80it/s] 80%|████████  | 40/50 [00:12<00:02,  4.80it/s] 82%|████████▏ | 41/50 [00:12<00:01,  4.80it/s] 84%|████████▍ | 42/50 [00:12<00:01,  4.80it/s] 86%|████████▌ | 43/50 [00:13<00:01,  4.80it/s] 88%|████████▊ | 44/50 [00:13<00:01,  4.79it/s] 90%|█████████ | 45/50 [00:13<00:01,  4.79it/s] 92%|█████████▏| 46/50 [00:13<00:00,  4.79it/s] 94%|█████████▍| 47/50 [00:13<00:00,  4.79it/s] 96%|█████████▌| 48/50 [00:14<00:00,  4.79it/s] 98%|█████████▊| 49/50 [00:14<00:00,  4.78it/s]100%|██████████| 50/50 [00:19<00:00,  1.60s/it]100%|██████████| 50/50 [00:19<00:00,  2.60it/s]
[I 2023-12-11 00:22:55,302] Trial 372 finished with value: 0.41221374045801523 and parameters: {'EMBEDDING_DIM': 962, 'HIDDEN_DIM': 299, 'NUM_LAYERS': 1, 'DROPOUT': 0.03265286391547459, 'LR': 0.0019941113488813104, 'WEIGHT_0': 0.2404075255223257, 'WEIGHT_1': 0.7047480253357488, 'WEIGHT_2': 0.46190665603785364, 'WEIGHT_3': 0.8803745035885637, 'WEIGHT_4': 0.7411798679709415, 'WEIGHT_5': 0.6528472051091828, 'WEIGHT_6': 0.6554880963565899, 'WEIGHT_7': 0.4995126697201568, 'WEIGHT_8': 0.8705646156789393, 'optimizer': 'RMSprop'}. Best is trial 365 with value: 0.41910947782240837.
/userhome/cs2/dingruiw/conda/envs/py310/lib/python3.10/site-packages/torch/nn/modules/rnn.py:82: UserWarning: dropout option adds dropout after all but last recurrent layer, so non-zero dropout expects num_layers greater than 1, but got dropout=0.011631104666240039 and num_layers=1
  warnings.warn("dropout option adds dropout after all but last "
{'EMBEDDING_DIM': 962, 'HIDDEN_DIM': 299, 'NUM_LAYERS': 1, 'DROPOUT': 0.03265286391547459, 'LR': 0.0019941113488813104, 'WEIGHT_0': 0.2404075255223257, 'WEIGHT_1': 0.7047480253357488, 'WEIGHT_2': 0.46190665603785364, 'WEIGHT_3': 0.8803745035885637, 'WEIGHT_4': 0.7411798679709415, 'WEIGHT_5': 0.6528472051091828, 'WEIGHT_6': 0.6554880963565899, 'WEIGHT_7': 0.4995126697201568, 'WEIGHT_8': 0.8705646156789393, 'optimizer': 'RMSprop'}
0
              precision    recall  f1-score   support

         LOC       0.44      0.22      0.29      1837
        MISC       0.10      0.06      0.07       922
         ORG       0.18      0.07      0.10      1341
         PER       0.06      0.07      0.07      1842

   micro avg       0.17      0.11      0.14      5942
   macro avg       0.20      0.10      0.13      5942
weighted avg       0.21      0.11      0.14      5942

{'EMBEDDING_DIM': 962, 'HIDDEN_DIM': 299, 'NUM_LAYERS': 1, 'DROPOUT': 0.03265286391547459, 'LR': 0.0019941113488813104, 'WEIGHT_0': 0.2404075255223257, 'WEIGHT_1': 0.7047480253357488, 'WEIGHT_2': 0.46190665603785364, 'WEIGHT_3': 0.8803745035885637, 'WEIGHT_4': 0.7411798679709415, 'WEIGHT_5': 0.6528472051091828, 'WEIGHT_6': 0.6554880963565899, 'WEIGHT_7': 0.4995126697201568, 'WEIGHT_8': 0.8705646156789393, 'optimizer': 'RMSprop'}
49
              precision    recall  f1-score   support

         LOC       0.56      0.53      0.55      1837
        MISC       0.45      0.43      0.44       922
         ORG       0.29      0.26      0.28      1341
         PER       0.35      0.38      0.36      1842

   micro avg       0.42      0.41      0.41      5942
   macro avg       0.41      0.40      0.41      5942
weighted avg       0.42      0.41      0.41      5942

epoch 49
LSTM
  0%|          | 0/50 [00:00<?, ?it/s]  2%|▏         | 1/50 [00:04<03:45,  4.60s/it]  4%|▍         | 2/50 [00:04<01:33,  1.96s/it]  6%|▌         | 3/50 [00:04<00:54,  1.16s/it]  8%|▊         | 4/50 [00:05<00:35,  1.28it/s] 10%|█         | 5/50 [00:05<00:25,  1.75it/s] 12%|█▏        | 6/50 [00:05<00:19,  2.24it/s] 14%|█▍        | 7/50 [00:05<00:15,  2.72it/s] 16%|█▌        | 8/50 [00:05<00:13,  3.17it/s] 18%|█▊        | 9/50 [00:06<00:11,  3.56it/s] 20%|██        | 10/50 [00:06<00:10,  3.89it/s] 22%|██▏       | 11/50 [00:06<00:09,  4.14it/s] 24%|██▍       | 12/50 [00:06<00:08,  4.34it/s] 26%|██▌       | 13/50 [00:06<00:08,  4.50it/s] 28%|██▊       | 14/50 [00:07<00:07,  4.62it/s] 30%|███       | 15/50 [00:07<00:07,  4.70it/s] 32%|███▏      | 16/50 [00:07<00:07,  4.76it/s] 34%|███▍      | 17/50 [00:07<00:06,  4.79it/s] 36%|███▌      | 18/50 [00:07<00:06,  4.82it/s] 38%|███▊      | 19/50 [00:08<00:06,  4.84it/s] 40%|████      | 20/50 [00:08<00:06,  4.85it/s] 42%|████▏     | 21/50 [00:08<00:05,  4.86it/s] 44%|████▍     | 22/50 [00:08<00:05,  4.87it/s] 46%|████▌     | 23/50 [00:08<00:05,  4.87it/s] 48%|████▊     | 24/50 [00:09<00:05,  4.87it/s] 50%|█████     | 25/50 [00:09<00:05,  4.88it/s] 52%|█████▏    | 26/50 [00:09<00:04,  4.89it/s] 54%|█████▍    | 27/50 [00:09<00:04,  4.90it/s] 56%|█████▌    | 28/50 [00:10<00:04,  4.89it/s] 58%|█████▊    | 29/50 [00:10<00:04,  4.89it/s] 60%|██████    | 30/50 [00:10<00:04,  4.88it/s] 62%|██████▏   | 31/50 [00:10<00:03,  4.88it/s] 64%|██████▍   | 32/50 [00:10<00:03,  4.88it/s] 66%|██████▌   | 33/50 [00:11<00:03,  4.88it/s] 68%|██████▊   | 34/50 [00:11<00:03,  4.87it/s] 70%|███████   | 35/50 [00:11<00:03,  4.87it/s] 72%|███████▏  | 36/50 [00:11<00:02,  4.88it/s] 74%|███████▍  | 37/50 [00:11<00:02,  4.89it/s] 76%|███████▌  | 38/50 [00:12<00:02,  4.89it/s] 78%|███████▊  | 39/50 [00:12<00:02,  4.89it/s] 80%|████████  | 40/50 [00:12<00:02,  4.88it/s] 82%|████████▏ | 41/50 [00:12<00:01,  4.88it/s] 84%|████████▍ | 42/50 [00:12<00:01,  4.88it/s] 86%|████████▌ | 43/50 [00:13<00:01,  4.88it/s] 88%|████████▊ | 44/50 [00:13<00:01,  4.88it/s] 90%|█████████ | 45/50 [00:13<00:01,  4.87it/s] 92%|█████████▏| 46/50 [00:13<00:00,  4.87it/s] 94%|█████████▍| 47/50 [00:13<00:00,  4.88it/s] 96%|█████████▌| 48/50 [00:14<00:00,  4.88it/s] 98%|█████████▊| 49/50 [00:14<00:00,  4.88it/s]100%|██████████| 50/50 [00:19<00:00,  1.57s/it]100%|██████████| 50/50 [00:19<00:00,  2.62it/s]
