[I 2023-12-11 00:01:06,288] Trial 325 finished with value: 0.36529209621993125 and parameters: {'EMBEDDING_DIM': 933, 'HIDDEN_DIM': 262, 'NUM_LAYERS': 1, 'DROPOUT': 0.3667435876705523, 'LR': 0.0015888786452579928, 'WEIGHT_0': 0.4411620464099106, 'WEIGHT_1': 0.008264243017151895, 'WEIGHT_2': 0.4527065749667686, 'WEIGHT_3': 0.7053322466870618, 'WEIGHT_4': 0.7815216999132406, 'WEIGHT_5': 0.7162621041787881, 'WEIGHT_6': 0.6943802213471568, 'WEIGHT_7': 0.5629352689948078, 'WEIGHT_8': 0.7857168327006636, 'optimizer': 'Adam'}. Best is trial 221 with value: 0.418736930154747.
/userhome/cs2/dingruiw/conda/envs/py310/lib/python3.10/site-packages/torch/nn/modules/rnn.py:82: UserWarning: dropout option adds dropout after all but last recurrent layer, so non-zero dropout expects num_layers greater than 1, but got dropout=0.347573461388987 and num_layers=1
  warnings.warn("dropout option adds dropout after all but last "
{'EMBEDDING_DIM': 933, 'HIDDEN_DIM': 262, 'NUM_LAYERS': 1, 'DROPOUT': 0.3667435876705523, 'LR': 0.0015888786452579928, 'WEIGHT_0': 0.4411620464099106, 'WEIGHT_1': 0.008264243017151895, 'WEIGHT_2': 0.4527065749667686, 'WEIGHT_3': 0.7053322466870618, 'WEIGHT_4': 0.7815216999132406, 'WEIGHT_5': 0.7162621041787881, 'WEIGHT_6': 0.6943802213471568, 'WEIGHT_7': 0.5629352689948078, 'WEIGHT_8': 0.7857168327006636, 'optimizer': 'Adam'}
0
              precision    recall  f1-score   support

         LOC       0.06      0.16      0.09      1837
        MISC       0.02      0.04      0.02       922
         ORG       0.02      0.07      0.04      1341
         PER       0.03      0.07      0.04      1842

   micro avg       0.04      0.09      0.05      5942
   macro avg       0.03      0.08      0.05      5942
weighted avg       0.04      0.09      0.05      5942

{'EMBEDDING_DIM': 933, 'HIDDEN_DIM': 262, 'NUM_LAYERS': 1, 'DROPOUT': 0.3667435876705523, 'LR': 0.0015888786452579928, 'WEIGHT_0': 0.4411620464099106, 'WEIGHT_1': 0.008264243017151895, 'WEIGHT_2': 0.4527065749667686, 'WEIGHT_3': 0.7053322466870618, 'WEIGHT_4': 0.7815216999132406, 'WEIGHT_5': 0.7162621041787881, 'WEIGHT_6': 0.6943802213471568, 'WEIGHT_7': 0.5629352689948078, 'WEIGHT_8': 0.7857168327006636, 'optimizer': 'Adam'}
49
              precision    recall  f1-score   support

         LOC       0.49      0.55      0.52      1837
        MISC       0.42      0.46      0.44       922
         ORG       0.10      0.03      0.05      1341
         PER       0.29      0.35      0.32      1842

   micro avg       0.37      0.36      0.37      5942
   macro avg       0.33      0.35      0.33      5942
weighted avg       0.33      0.36      0.34      5942

epoch 49
LSTM
  0%|          | 0/50 [00:00<?, ?it/s]  2%|▏         | 1/50 [00:05<04:13,  5.17s/it]  4%|▍         | 2/50 [00:05<01:45,  2.21s/it]  6%|▌         | 3/50 [00:05<01:01,  1.32s/it]  8%|▊         | 4/50 [00:05<00:41,  1.12it/s] 10%|█         | 5/50 [00:06<00:29,  1.51it/s] 12%|█▏        | 6/50 [00:06<00:22,  1.92it/s] 14%|█▍        | 7/50 [00:06<00:18,  2.32it/s] 16%|█▌        | 8/50 [00:06<00:15,  2.69it/s] 18%|█▊        | 9/50 [00:07<00:13,  3.00it/s] 20%|██        | 10/50 [00:07<00:12,  3.26it/s] 22%|██▏       | 11/50 [00:07<00:11,  3.47it/s] 24%|██▍       | 12/50 [00:07<00:10,  3.62it/s] 26%|██▌       | 13/50 [00:08<00:09,  3.74it/s] 28%|██▊       | 14/50 [00:08<00:09,  3.83it/s] 30%|███       | 15/50 [00:08<00:08,  3.89it/s] 32%|███▏      | 16/50 [00:08<00:08,  3.93it/s] 34%|███▍      | 17/50 [00:09<00:08,  3.96it/s] 36%|███▌      | 18/50 [00:09<00:08,  3.99it/s] 38%|███▊      | 19/50 [00:09<00:07,  4.00it/s] 40%|████      | 20/50 [00:09<00:07,  4.01it/s] 42%|████▏     | 21/50 [00:10<00:07,  4.02it/s] 44%|████▍     | 22/50 [00:10<00:06,  4.02it/s] 46%|████▌     | 23/50 [00:10<00:06,  4.02it/s] 48%|████▊     | 24/50 [00:10<00:06,  4.02it/s] 50%|█████     | 25/50 [00:11<00:06,  4.02it/s] 52%|█████▏    | 26/50 [00:11<00:05,  4.03it/s] 54%|█████▍    | 27/50 [00:11<00:05,  4.03it/s] 56%|█████▌    | 28/50 [00:11<00:05,  4.03it/s] 58%|█████▊    | 29/50 [00:12<00:05,  4.03it/s] 60%|██████    | 30/50 [00:12<00:04,  4.03it/s] 62%|██████▏   | 31/50 [00:12<00:04,  4.03it/s] 64%|██████▍   | 32/50 [00:12<00:04,  4.03it/s] 66%|██████▌   | 33/50 [00:12<00:04,  4.03it/s] 68%|██████▊   | 34/50 [00:13<00:03,  4.02it/s] 70%|███████   | 35/50 [00:13<00:03,  4.02it/s] 72%|███████▏  | 36/50 [00:13<00:03,  4.02it/s] 74%|███████▍  | 37/50 [00:13<00:03,  4.01it/s] 76%|███████▌  | 38/50 [00:14<00:02,  4.01it/s] 78%|███████▊  | 39/50 [00:14<00:02,  4.01it/s] 80%|████████  | 40/50 [00:14<00:02,  4.01it/s] 82%|████████▏ | 41/50 [00:14<00:02,  4.01it/s] 84%|████████▍ | 42/50 [00:15<00:01,  4.01it/s] 86%|████████▌ | 43/50 [00:15<00:01,  4.01it/s] 88%|████████▊ | 44/50 [00:15<00:01,  4.01it/s] 90%|█████████ | 45/50 [00:15<00:01,  4.01it/s] 92%|█████████▏| 46/50 [00:16<00:00,  4.01it/s] 94%|█████████▍| 47/50 [00:16<00:00,  4.01it/s] 96%|█████████▌| 48/50 [00:16<00:00,  4.01it/s] 98%|█████████▊| 49/50 [00:16<00:00,  4.01it/s]100%|██████████| 50/50 [00:22<00:00,  1.69s/it]100%|██████████| 50/50 [00:22<00:00,  2.27it/s]
[I 2023-12-11 00:01:32,928] Trial 326 finished with value: 0.40172676485525644 and parameters: {'EMBEDDING_DIM': 894, 'HIDDEN_DIM': 408, 'NUM_LAYERS': 1, 'DROPOUT': 0.347573461388987, 'LR': 0.001180816622277131, 'WEIGHT_0': 0.39108187478589457, 'WEIGHT_1': 0.5621165652283858, 'WEIGHT_2': 0.5930958546300567, 'WEIGHT_3': 0.81457926951136, 'WEIGHT_4': 0.9609814668939654, 'WEIGHT_5': 0.6979132739508445, 'WEIGHT_6': 0.5526865930241011, 'WEIGHT_7': 0.6313487677760354, 'WEIGHT_8': 0.5031047988861844, 'optimizer': 'RMSprop'}. Best is trial 221 with value: 0.418736930154747.
/userhome/cs2/dingruiw/conda/envs/py310/lib/python3.10/site-packages/torch/nn/modules/rnn.py:82: UserWarning: dropout option adds dropout after all but last recurrent layer, so non-zero dropout expects num_layers greater than 1, but got dropout=0.36128814024672457 and num_layers=1
  warnings.warn("dropout option adds dropout after all but last "
{'EMBEDDING_DIM': 894, 'HIDDEN_DIM': 408, 'NUM_LAYERS': 1, 'DROPOUT': 0.347573461388987, 'LR': 0.001180816622277131, 'WEIGHT_0': 0.39108187478589457, 'WEIGHT_1': 0.5621165652283858, 'WEIGHT_2': 0.5930958546300567, 'WEIGHT_3': 0.81457926951136, 'WEIGHT_4': 0.9609814668939654, 'WEIGHT_5': 0.6979132739508445, 'WEIGHT_6': 0.5526865930241011, 'WEIGHT_7': 0.6313487677760354, 'WEIGHT_8': 0.5031047988861844, 'optimizer': 'RMSprop'}
0
              precision    recall  f1-score   support

         LOC       0.32      0.17      0.22      1837
        MISC       0.04      0.04      0.04       922
         ORG       0.08      0.08      0.08      1341
         PER       0.06      0.03      0.04      1842

   micro avg       0.13      0.08      0.10      5942
   macro avg       0.12      0.08      0.09      5942
weighted avg       0.14      0.08      0.10      5942

{'EMBEDDING_DIM': 894, 'HIDDEN_DIM': 408, 'NUM_LAYERS': 1, 'DROPOUT': 0.347573461388987, 'LR': 0.001180816622277131, 'WEIGHT_0': 0.39108187478589457, 'WEIGHT_1': 0.5621165652283858, 'WEIGHT_2': 0.5930958546300567, 'WEIGHT_3': 0.81457926951136, 'WEIGHT_4': 0.9609814668939654, 'WEIGHT_5': 0.6979132739508445, 'WEIGHT_6': 0.5526865930241011, 'WEIGHT_7': 0.6313487677760354, 'WEIGHT_8': 0.5031047988861844, 'optimizer': 'RMSprop'}
49
              precision    recall  f1-score   support

         LOC       0.55      0.54      0.54      1837
        MISC       0.44      0.44      0.44       922
         ORG       0.28      0.25      0.26      1341
         PER       0.33      0.35      0.34      1842

   micro avg       0.40      0.40      0.40      5942
   macro avg       0.40      0.39      0.40      5942
weighted avg       0.40      0.40      0.40      5942

epoch 49
LSTM
  0%|          | 0/50 [00:00<?, ?it/s]  2%|▏         | 1/50 [00:05<04:14,  5.19s/it]  4%|▍         | 2/50 [00:05<01:46,  2.21s/it]  6%|▌         | 3/50 [00:05<01:01,  1.31s/it]  8%|▊         | 4/50 [00:05<00:40,  1.14it/s] 10%|█         | 5/50 [00:05<00:28,  1.55it/s] 12%|█▏        | 6/50 [00:06<00:22,  1.99it/s] 14%|█▍        | 7/50 [00:06<00:17,  2.42it/s] 16%|█▌        | 8/50 [00:06<00:14,  2.83it/s] 18%|█▊        | 9/50 [00:06<00:12,  3.19it/s] 20%|██        | 10/50 [00:07<00:11,  3.49it/s] 22%|██▏       | 11/50 [00:07<00:10,  3.73it/s] 24%|██▍       | 12/50 [00:07<00:09,  3.91it/s] 26%|██▌       | 13/50 [00:07<00:09,  4.04it/s] 28%|██▊       | 14/50 [00:08<00:08,  4.15it/s] 30%|███       | 15/50 [00:08<00:08,  4.22it/s] 32%|███▏      | 16/50 [00:08<00:07,  4.28it/s] 34%|███▍      | 17/50 [00:08<00:07,  4.32it/s] 36%|███▌      | 18/50 [00:08<00:07,  4.34it/s] 38%|███▊      | 19/50 [00:09<00:07,  4.36it/s] 40%|████      | 20/50 [00:09<00:06,  4.38it/s] 42%|████▏     | 21/50 [00:09<00:06,  4.39it/s] 44%|████▍     | 22/50 [00:09<00:06,  4.39it/s] 46%|████▌     | 23/50 [00:10<00:06,  4.40it/s] 48%|████▊     | 24/50 [00:10<00:05,  4.39it/s] 50%|█████     | 25/50 [00:10<00:05,  4.40it/s] 52%|█████▏    | 26/50 [00:10<00:05,  4.41it/s] 54%|█████▍    | 27/50 [00:10<00:05,  4.41it/s] 56%|█████▌    | 28/50 [00:11<00:04,  4.41it/s] 58%|█████▊    | 29/50 [00:11<00:04,  4.40it/s] 60%|██████    | 30/50 [00:11<00:04,  4.40it/s] 62%|██████▏   | 31/50 [00:11<00:04,  4.40it/s] 64%|██████▍   | 32/50 [00:12<00:04,  4.41it/s] 66%|██████▌   | 33/50 [00:12<00:03,  4.40it/s] 68%|██████▊   | 34/50 [00:12<00:03,  4.40it/s] 70%|███████   | 35/50 [00:12<00:03,  4.40it/s] 72%|███████▏  | 36/50 [00:13<00:03,  4.40it/s] 74%|███████▍  | 37/50 [00:13<00:02,  4.39it/s] 76%|███████▌  | 38/50 [00:13<00:02,  4.39it/s] 78%|███████▊  | 39/50 [00:13<00:02,  4.39it/s] 80%|████████  | 40/50 [00:13<00:02,  4.39it/s] 82%|████████▏ | 41/50 [00:14<00:02,  4.39it/s] 84%|████████▍ | 42/50 [00:14<00:01,  4.39it/s] 86%|████████▌ | 43/50 [00:14<00:01,  4.39it/s] 88%|████████▊ | 44/50 [00:14<00:01,  4.39it/s] 90%|█████████ | 45/50 [00:15<00:01,  4.39it/s] 92%|█████████▏| 46/50 [00:15<00:00,  4.38it/s] 94%|█████████▍| 47/50 [00:15<00:00,  4.38it/s] 96%|█████████▌| 48/50 [00:15<00:00,  4.38it/s] 98%|█████████▊| 49/50 [00:16<00:00,  4.38it/s]100%|██████████| 50/50 [00:21<00:00,  1.69s/it]100%|██████████| 50/50 [00:21<00:00,  2.37it/s]
[I 2023-12-11 00:01:58,601] Trial 327 finished with value: 0.3969899665551839 and parameters: {'EMBEDDING_DIM': 985, 'HIDDEN_DIM': 328, 'NUM_LAYERS': 1, 'DROPOUT': 0.36128814024672457, 'LR': 0.0013578534727959565, 'WEIGHT_0': 0.3200341753425775, 'WEIGHT_1': 0.6468432251935916, 'WEIGHT_2': 0.5653910551855655, 'WEIGHT_3': 0.488794447863329, 'WEIGHT_4': 0.48496166097176324, 'WEIGHT_5': 0.763278091711013, 'WEIGHT_6': 0.5286672321418775, 'WEIGHT_7': 0.7023506249617903, 'WEIGHT_8': 0.3981975580016093, 'optimizer': 'Adam'}. Best is trial 221 with value: 0.418736930154747.
/userhome/cs2/dingruiw/conda/envs/py310/lib/python3.10/site-packages/torch/nn/modules/rnn.py:82: UserWarning: dropout option adds dropout after all but last recurrent layer, so non-zero dropout expects num_layers greater than 1, but got dropout=0.33467083424543664 and num_layers=1
  warnings.warn("dropout option adds dropout after all but last "
{'EMBEDDING_DIM': 985, 'HIDDEN_DIM': 328, 'NUM_LAYERS': 1, 'DROPOUT': 0.36128814024672457, 'LR': 0.0013578534727959565, 'WEIGHT_0': 0.3200341753425775, 'WEIGHT_1': 0.6468432251935916, 'WEIGHT_2': 0.5653910551855655, 'WEIGHT_3': 0.488794447863329, 'WEIGHT_4': 0.48496166097176324, 'WEIGHT_5': 0.763278091711013, 'WEIGHT_6': 0.5286672321418775, 'WEIGHT_7': 0.7023506249617903, 'WEIGHT_8': 0.3981975580016093, 'optimizer': 'Adam'}
0
              precision    recall  f1-score   support

         LOC       0.07      0.20      0.10      1837
        MISC       0.02      0.07      0.03       922
         ORG       0.04      0.07      0.05      1341
         PER       0.03      0.05      0.04      1842

   micro avg       0.04      0.10      0.06      5942
   macro avg       0.04      0.10      0.05      5942
weighted avg       0.04      0.10      0.06      5942

{'EMBEDDING_DIM': 985, 'HIDDEN_DIM': 328, 'NUM_LAYERS': 1, 'DROPOUT': 0.36128814024672457, 'LR': 0.0013578534727959565, 'WEIGHT_0': 0.3200341753425775, 'WEIGHT_1': 0.6468432251935916, 'WEIGHT_2': 0.5653910551855655, 'WEIGHT_3': 0.488794447863329, 'WEIGHT_4': 0.48496166097176324, 'WEIGHT_5': 0.763278091711013, 'WEIGHT_6': 0.5286672321418775, 'WEIGHT_7': 0.7023506249617903, 'WEIGHT_8': 0.3981975580016093, 'optimizer': 'Adam'}
49
              precision    recall  f1-score   support

         LOC       0.52      0.53      0.52      1837
        MISC       0.42      0.44      0.43       922
         ORG       0.31      0.27      0.29      1341
         PER       0.32      0.34      0.33      1842

   micro avg       0.39      0.40      0.40      5942
   macro avg       0.39      0.40      0.39      5942
weighted avg       0.39      0.40      0.40      5942

epoch 49
LSTM
  0%|          | 0/50 [00:00<?, ?it/s]  2%|▏         | 1/50 [00:05<04:20,  5.31s/it]  4%|▍         | 2/50 [00:05<01:50,  2.31s/it]  6%|▌         | 3/50 [00:05<01:07,  1.44s/it]  8%|▊         | 4/50 [00:06<00:47,  1.03s/it] 10%|█         | 5/50 [00:06<00:36,  1.24it/s] 12%|█▏        | 6/50 [00:07<00:29,  1.49it/s] 14%|█▍        | 7/50 [00:07<00:25,  1.71it/s] 16%|█▌        | 8/50 [00:07<00:22,  1.89it/s] 18%|█▊        | 9/50 [00:08<00:20,  2.03it/s] 20%|██        | 10/50 [00:08<00:18,  2.15it/s] 22%|██▏       | 11/50 [00:09<00:17,  2.24it/s] 24%|██▍       | 12/50 [00:09<00:16,  2.31it/s] 26%|██▌       | 13/50 [00:09<00:15,  2.35it/s] 28%|██▊       | 14/50 [00:10<00:15,  2.38it/s] 30%|███       | 15/50 [00:10<00:14,  2.41it/s] 32%|███▏      | 16/50 [00:11<00:14,  2.43it/s] 34%|███▍      | 17/50 [00:11<00:13,  2.45it/s] 36%|███▌      | 18/50 [00:12<00:13,  2.45it/s] 38%|███▊      | 19/50 [00:12<00:12,  2.45it/s] 40%|████      | 20/50 [00:12<00:12,  2.44it/s] 42%|████▏     | 21/50 [00:13<00:11,  2.44it/s] 44%|████▍     | 22/50 [00:13<00:11,  2.45it/s] 46%|████▌     | 23/50 [00:14<00:11,  2.45it/s] 48%|████▊     | 24/50 [00:14<00:10,  2.45it/s] 50%|█████     | 25/50 [00:14<00:10,  2.46it/s] 52%|█████▏    | 26/50 [00:15<00:09,  2.46it/s] 54%|█████▍    | 27/50 [00:15<00:09,  2.46it/s] 56%|█████▌    | 28/50 [00:16<00:09,  2.44it/s] 58%|█████▊    | 29/50 [00:16<00:08,  2.45it/s] 60%|██████    | 30/50 [00:16<00:08,  2.44it/s] 62%|██████▏   | 31/50 [00:17<00:07,  2.45it/s] 64%|██████▍   | 32/50 [00:17<00:07,  2.44it/s] 66%|██████▌   | 33/50 [00:18<00:06,  2.44it/s] 68%|██████▊   | 34/50 [00:18<00:06,  2.44it/s] 70%|███████   | 35/50 [00:18<00:06,  2.44it/s] 72%|███████▏  | 36/50 [00:19<00:05,  2.44it/s] 74%|███████▍  | 37/50 [00:19<00:05,  2.44it/s] 76%|███████▌  | 38/50 [00:20<00:04,  2.43it/s] 78%|███████▊  | 39/50 [00:20<00:04,  2.43it/s] 80%|████████  | 40/50 [00:21<00:04,  2.43it/s] 82%|████████▏ | 41/50 [00:21<00:03,  2.43it/s] 84%|████████▍ | 42/50 [00:21<00:03,  2.42it/s] 86%|████████▌ | 43/50 [00:22<00:02,  2.42it/s] 88%|████████▊ | 44/50 [00:22<00:02,  2.42it/s] 90%|█████████ | 45/50 [00:23<00:02,  2.42it/s] 92%|█████████▏| 46/50 [00:23<00:01,  2.42it/s] 94%|█████████▍| 47/50 [00:23<00:01,  2.43it/s] 96%|█████████▌| 48/50 [00:24<00:00,  2.43it/s] 98%|█████████▊| 49/50 [00:24<00:00,  2.43it/s]100%|██████████| 50/50 [00:29<00:00,  1.78s/it]100%|██████████| 50/50 [00:29<00:00,  1.68it/s]
[I 2023-12-11 00:02:32,649] Trial 328 finished with value: 0.3676058966225042 and parameters: {'EMBEDDING_DIM': 954, 'HIDDEN_DIM': 574, 'NUM_LAYERS': 1, 'DROPOUT': 0.33467083424543664, 'LR': 0.00040485368425853096, 'WEIGHT_0': 0.6193667937613485, 'WEIGHT_1': 0.7727786820024294, 'WEIGHT_2': 0.27631535969273907, 'WEIGHT_3': 0.7923147968183203, 'WEIGHT_4': 0.7332532534961478, 'WEIGHT_5': 0.6127862771638566, 'WEIGHT_6': 0.2476514333015185, 'WEIGHT_7': 0.543307076803849, 'WEIGHT_8': 0.5523745658831626, 'optimizer': 'RMSprop'}. Best is trial 221 with value: 0.418736930154747.
/userhome/cs2/dingruiw/conda/envs/py310/lib/python3.10/site-packages/torch/nn/modules/rnn.py:82: UserWarning: dropout option adds dropout after all but last recurrent layer, so non-zero dropout expects num_layers greater than 1, but got dropout=0.3905820999147336 and num_layers=1
  warnings.warn("dropout option adds dropout after all but last "
{'EMBEDDING_DIM': 954, 'HIDDEN_DIM': 574, 'NUM_LAYERS': 1, 'DROPOUT': 0.33467083424543664, 'LR': 0.00040485368425853096, 'WEIGHT_0': 0.6193667937613485, 'WEIGHT_1': 0.7727786820024294, 'WEIGHT_2': 0.27631535969273907, 'WEIGHT_3': 0.7923147968183203, 'WEIGHT_4': 0.7332532534961478, 'WEIGHT_5': 0.6127862771638566, 'WEIGHT_6': 0.2476514333015185, 'WEIGHT_7': 0.543307076803849, 'WEIGHT_8': 0.5523745658831626, 'optimizer': 'RMSprop'}
0
              precision    recall  f1-score   support

         LOC       0.11      0.04      0.06      1837
        MISC       0.01      0.00      0.01       922
         ORG       0.06      0.04      0.04      1341
         PER       0.05      0.04      0.04      1842

   micro avg       0.06      0.03      0.04      5942
   macro avg       0.06      0.03      0.04      5942
weighted avg       0.06      0.03      0.04      5942

{'EMBEDDING_DIM': 954, 'HIDDEN_DIM': 574, 'NUM_LAYERS': 1, 'DROPOUT': 0.33467083424543664, 'LR': 0.00040485368425853096, 'WEIGHT_0': 0.6193667937613485, 'WEIGHT_1': 0.7727786820024294, 'WEIGHT_2': 0.27631535969273907, 'WEIGHT_3': 0.7923147968183203, 'WEIGHT_4': 0.7332532534961478, 'WEIGHT_5': 0.6127862771638566, 'WEIGHT_6': 0.2476514333015185, 'WEIGHT_7': 0.543307076803849, 'WEIGHT_8': 0.5523745658831626, 'optimizer': 'RMSprop'}
49
              precision    recall  f1-score   support

         LOC       0.59      0.50      0.54      1837
        MISC       0.44      0.19      0.26       922
         ORG       0.28      0.19      0.23      1341
         PER       0.32      0.34      0.33      1842

   micro avg       0.41      0.33      0.37      5942
   macro avg       0.41      0.30      0.34      5942
weighted avg       0.42      0.33      0.36      5942

epoch 49
LSTM
  0%|          | 0/50 [00:00<?, ?it/s]  2%|▏         | 1/50 [00:04<03:56,  4.83s/it]  6%|▌         | 3/50 [00:05<01:03,  1.34s/it]  8%|▊         | 4/50 [00:05<00:42,  1.07it/s] 10%|█         | 5/50 [00:05<00:30,  1.48it/s] 12%|█▏        | 6/50 [00:05<00:22,  1.97it/s] 14%|█▍        | 7/50 [00:05<00:17,  2.52it/s] 16%|█▌        | 8/50 [00:05<00:13,  3.11it/s] 18%|█▊        | 9/50 [00:06<00:11,  3.69it/s] 20%|██        | 10/50 [00:06<00:09,  4.25it/s] 22%|██▏       | 11/50 [00:06<00:08,  4.74it/s] 24%|██▍       | 12/50 [00:06<00:07,  5.15it/s] 26%|██▌       | 13/50 [00:06<00:06,  5.49it/s] 28%|██▊       | 14/50 [00:06<00:06,  5.74it/s] 30%|███       | 15/50 [00:06<00:05,  5.94it/s] 32%|███▏      | 16/50 [00:07<00:05,  6.09it/s] 34%|███▍      | 17/50 [00:07<00:05,  6.18it/s] 36%|███▌      | 18/50 [00:07<00:05,  6.26it/s] 38%|███▊      | 19/50 [00:07<00:04,  6.33it/s] 40%|████      | 20/50 [00:07<00:04,  6.35it/s] 42%|████▏     | 21/50 [00:07<00:04,  6.38it/s] 44%|████▍     | 22/50 [00:08<00:04,  6.41it/s] 46%|████▌     | 23/50 [00:08<00:04,  6.41it/s] 48%|████▊     | 24/50 [00:08<00:04,  6.41it/s] 50%|█████     | 25/50 [00:08<00:03,  6.43it/s] 52%|█████▏    | 26/50 [00:08<00:03,  6.43it/s] 54%|█████▍    | 27/50 [00:08<00:03,  6.42it/s] 56%|█████▌    | 28/50 [00:08<00:03,  6.43it/s] 58%|█████▊    | 29/50 [00:09<00:03,  6.43it/s] 60%|██████    | 30/50 [00:09<00:03,  6.43it/s] 62%|██████▏   | 31/50 [00:09<00:02,  6.43it/s] 64%|██████▍   | 32/50 [00:09<00:02,  6.44it/s] 66%|██████▌   | 33/50 [00:09<00:02,  6.44it/s] 68%|██████▊   | 34/50 [00:09<00:02,  6.43it/s] 70%|███████   | 35/50 [00:10<00:02,  6.44it/s] 72%|███████▏  | 36/50 [00:10<00:02,  6.44it/s] 74%|███████▍  | 37/50 [00:10<00:02,  6.43it/s] 76%|███████▌  | 38/50 [00:10<00:01,  6.44it/s] 78%|███████▊  | 39/50 [00:10<00:01,  6.44it/s] 80%|████████  | 40/50 [00:10<00:01,  6.43it/s] 82%|████████▏ | 41/50 [00:10<00:01,  6.44it/s] 84%|████████▍ | 42/50 [00:11<00:01,  6.44it/s] 86%|████████▌ | 43/50 [00:11<00:01,  6.43it/s] 88%|████████▊ | 44/50 [00:11<00:00,  6.43it/s] 90%|█████████ | 45/50 [00:11<00:00,  6.44it/s] 92%|█████████▏| 46/50 [00:11<00:00,  6.42it/s] 94%|█████████▍| 47/50 [00:11<00:00,  6.43it/s] 96%|█████████▌| 48/50 [00:12<00:00,  6.43it/s] 98%|█████████▊| 49/50 [00:12<00:00,  6.43it/s]100%|██████████| 50/50 [00:17<00:00,  1.62s/it]100%|██████████| 50/50 [00:17<00:00,  2.90it/s]
