[I 2023-12-10 22:40:54,646] Trial 161 finished with value: 0.4051033875934888 and parameters: {'EMBEDDING_DIM': 987, 'HIDDEN_DIM': 590, 'NUM_LAYERS': 1, 'DROPOUT': 0.3433750074744022, 'LR': 0.0010956786282491663, 'WEIGHT_0': 0.3955143775607765, 'WEIGHT_1': 0.6475419001073088, 'WEIGHT_2': 0.6464502324617127, 'WEIGHT_3': 0.866887189529119, 'WEIGHT_4': 0.8143175013831463, 'WEIGHT_5': 0.4570041278475392, 'WEIGHT_6': 0.6644026354851273, 'WEIGHT_7': 0.3023567410467674, 'WEIGHT_8': 0.5954806549660294, 'optimizer': 'RMSprop'}. Best is trial 134 with value: 0.4158467115484205.
/userhome/cs2/dingruiw/conda/envs/py310/lib/python3.10/site-packages/torch/nn/modules/rnn.py:82: UserWarning: dropout option adds dropout after all but last recurrent layer, so non-zero dropout expects num_layers greater than 1, but got dropout=0.37437835948701054 and num_layers=1
  warnings.warn("dropout option adds dropout after all but last "
{'EMBEDDING_DIM': 987, 'HIDDEN_DIM': 590, 'NUM_LAYERS': 1, 'DROPOUT': 0.3433750074744022, 'LR': 0.0010956786282491663, 'WEIGHT_0': 0.3955143775607765, 'WEIGHT_1': 0.6475419001073088, 'WEIGHT_2': 0.6464502324617127, 'WEIGHT_3': 0.866887189529119, 'WEIGHT_4': 0.8143175013831463, 'WEIGHT_5': 0.4570041278475392, 'WEIGHT_6': 0.6644026354851273, 'WEIGHT_7': 0.3023567410467674, 'WEIGHT_8': 0.5954806549660294, 'optimizer': 'RMSprop'}
0
              precision    recall  f1-score   support

         LOC       0.26      0.19      0.22      1837
        MISC       0.03      0.03      0.03       922
         ORG       0.09      0.04      0.06      1341
         PER       0.06      0.02      0.03      1842

   micro avg       0.14      0.08      0.10      5942
   macro avg       0.11      0.07      0.08      5942
weighted avg       0.12      0.08      0.09      5942

{'EMBEDDING_DIM': 987, 'HIDDEN_DIM': 590, 'NUM_LAYERS': 1, 'DROPOUT': 0.3433750074744022, 'LR': 0.0010956786282491663, 'WEIGHT_0': 0.3955143775607765, 'WEIGHT_1': 0.6475419001073088, 'WEIGHT_2': 0.6464502324617127, 'WEIGHT_3': 0.866887189529119, 'WEIGHT_4': 0.8143175013831463, 'WEIGHT_5': 0.4570041278475392, 'WEIGHT_6': 0.6644026354851273, 'WEIGHT_7': 0.3023567410467674, 'WEIGHT_8': 0.5954806549660294, 'optimizer': 'RMSprop'}
49
              precision    recall  f1-score   support

         LOC       0.57      0.52      0.55      1837
        MISC       0.45      0.42      0.44       922
         ORG       0.31      0.26      0.28      1341
         PER       0.35      0.33      0.34      1842

   micro avg       0.42      0.39      0.41      5942
   macro avg       0.42      0.38      0.40      5942
weighted avg       0.42      0.39      0.40      5942

epoch 49
LSTM
  0%|          | 0/50 [00:00<?, ?it/s]  2%|▏         | 1/50 [00:05<04:07,  5.05s/it]  4%|▍         | 2/50 [00:05<01:45,  2.19s/it]  6%|▌         | 3/50 [00:05<01:03,  1.36s/it]  8%|▊         | 4/50 [00:05<00:44,  1.04it/s] 10%|█         | 5/50 [00:06<00:33,  1.35it/s] 12%|█▏        | 6/50 [00:06<00:26,  1.64it/s] 14%|█▍        | 7/50 [00:07<00:22,  1.90it/s] 16%|█▌        | 8/50 [00:07<00:19,  2.12it/s] 18%|█▊        | 9/50 [00:07<00:17,  2.30it/s] 20%|██        | 10/50 [00:08<00:16,  2.44it/s] 22%|██▏       | 11/50 [00:08<00:15,  2.55it/s] 24%|██▍       | 12/50 [00:08<00:14,  2.63it/s] 26%|██▌       | 13/50 [00:09<00:13,  2.69it/s] 28%|██▊       | 14/50 [00:09<00:13,  2.73it/s] 30%|███       | 15/50 [00:09<00:12,  2.76it/s] 32%|███▏      | 16/50 [00:10<00:12,  2.78it/s] 34%|███▍      | 17/50 [00:10<00:11,  2.80it/s] 36%|███▌      | 18/50 [00:10<00:11,  2.80it/s] 38%|███▊      | 19/50 [00:11<00:11,  2.81it/s] 40%|████      | 20/50 [00:11<00:10,  2.81it/s] 42%|████▏     | 21/50 [00:11<00:10,  2.82it/s] 44%|████▍     | 22/50 [00:12<00:09,  2.82it/s] 46%|████▌     | 23/50 [00:12<00:09,  2.82it/s] 48%|████▊     | 24/50 [00:13<00:09,  2.82it/s] 50%|█████     | 25/50 [00:13<00:08,  2.82it/s] 52%|█████▏    | 26/50 [00:13<00:08,  2.82it/s] 54%|█████▍    | 27/50 [00:14<00:08,  2.82it/s] 56%|█████▌    | 28/50 [00:14<00:07,  2.82it/s] 58%|█████▊    | 29/50 [00:14<00:07,  2.82it/s] 60%|██████    | 30/50 [00:15<00:07,  2.82it/s] 62%|██████▏   | 31/50 [00:15<00:06,  2.82it/s] 64%|██████▍   | 32/50 [00:15<00:06,  2.82it/s] 66%|██████▌   | 33/50 [00:16<00:06,  2.82it/s] 68%|██████▊   | 34/50 [00:16<00:05,  2.82it/s] 70%|███████   | 35/50 [00:16<00:05,  2.82it/s] 72%|███████▏  | 36/50 [00:17<00:04,  2.83it/s] 74%|███████▍  | 37/50 [00:17<00:04,  2.82it/s] 76%|███████▌  | 38/50 [00:17<00:04,  2.82it/s] 78%|███████▊  | 39/50 [00:18<00:03,  2.82it/s] 80%|████████  | 40/50 [00:18<00:03,  2.82it/s] 82%|████████▏ | 41/50 [00:19<00:03,  2.82it/s] 84%|████████▍ | 42/50 [00:19<00:02,  2.82it/s] 86%|████████▌ | 43/50 [00:19<00:02,  2.82it/s] 88%|████████▊ | 44/50 [00:20<00:02,  2.81it/s] 90%|█████████ | 45/50 [00:20<00:01,  2.81it/s] 92%|█████████▏| 46/50 [00:20<00:01,  2.81it/s] 94%|█████████▍| 47/50 [00:21<00:01,  2.81it/s] 96%|█████████▌| 48/50 [00:21<00:00,  2.80it/s] 98%|█████████▊| 49/50 [00:21<00:00,  2.80it/s]100%|██████████| 50/50 [00:26<00:00,  1.77s/it]100%|██████████| 50/50 [00:26<00:00,  1.85it/s]
[I 2023-12-10 22:41:25,940] Trial 162 finished with value: 0.4075491389806923 and parameters: {'EMBEDDING_DIM': 1023, 'HIDDEN_DIM': 523, 'NUM_LAYERS': 1, 'DROPOUT': 0.37437835948701054, 'LR': 0.0013480791826303033, 'WEIGHT_0': 0.43939823283531876, 'WEIGHT_1': 0.7387037585078424, 'WEIGHT_2': 0.6213608429125358, 'WEIGHT_3': 0.9861810345613811, 'WEIGHT_4': 0.8518591429383296, 'WEIGHT_5': 0.5258416155177834, 'WEIGHT_6': 0.6927445900640149, 'WEIGHT_7': 0.25164975916169546, 'WEIGHT_8': 0.45431168620598833, 'optimizer': 'RMSprop'}. Best is trial 134 with value: 0.4158467115484205.
/userhome/cs2/dingruiw/conda/envs/py310/lib/python3.10/site-packages/torch/nn/modules/rnn.py:82: UserWarning: dropout option adds dropout after all but last recurrent layer, so non-zero dropout expects num_layers greater than 1, but got dropout=0.3615699729491052 and num_layers=1
  warnings.warn("dropout option adds dropout after all but last "
{'EMBEDDING_DIM': 1023, 'HIDDEN_DIM': 523, 'NUM_LAYERS': 1, 'DROPOUT': 0.37437835948701054, 'LR': 0.0013480791826303033, 'WEIGHT_0': 0.43939823283531876, 'WEIGHT_1': 0.7387037585078424, 'WEIGHT_2': 0.6213608429125358, 'WEIGHT_3': 0.9861810345613811, 'WEIGHT_4': 0.8518591429383296, 'WEIGHT_5': 0.5258416155177834, 'WEIGHT_6': 0.6927445900640149, 'WEIGHT_7': 0.25164975916169546, 'WEIGHT_8': 0.45431168620598833, 'optimizer': 'RMSprop'}
0
              precision    recall  f1-score   support

         LOC       0.27      0.09      0.13      1837
        MISC       0.06      0.02      0.03       922
         ORG       0.16      0.04      0.07      1341
         PER       0.05      0.03      0.04      1842

   micro avg       0.13      0.05      0.07      5942
   macro avg       0.14      0.04      0.07      5942
weighted avg       0.15      0.05      0.07      5942

{'EMBEDDING_DIM': 1023, 'HIDDEN_DIM': 523, 'NUM_LAYERS': 1, 'DROPOUT': 0.37437835948701054, 'LR': 0.0013480791826303033, 'WEIGHT_0': 0.43939823283531876, 'WEIGHT_1': 0.7387037585078424, 'WEIGHT_2': 0.6213608429125358, 'WEIGHT_3': 0.9861810345613811, 'WEIGHT_4': 0.8518591429383296, 'WEIGHT_5': 0.5258416155177834, 'WEIGHT_6': 0.6927445900640149, 'WEIGHT_7': 0.25164975916169546, 'WEIGHT_8': 0.45431168620598833, 'optimizer': 'RMSprop'}
49
              precision    recall  f1-score   support

         LOC       0.61      0.53      0.57      1837
        MISC       0.42      0.42      0.42       922
         ORG       0.29      0.26      0.28      1341
         PER       0.34      0.34      0.34      1842

   micro avg       0.42      0.39      0.41      5942
   macro avg       0.42      0.39      0.40      5942
weighted avg       0.43      0.39      0.41      5942

epoch 49
LSTM
  0%|          | 0/50 [00:00<?, ?it/s]  2%|▏         | 1/50 [00:04<03:55,  4.82s/it]  4%|▍         | 2/50 [00:04<01:39,  2.08s/it]  6%|▌         | 3/50 [00:05<00:59,  1.27s/it]  8%|▊         | 4/50 [00:05<00:40,  1.13it/s] 10%|█         | 5/50 [00:05<00:30,  1.48it/s] 12%|█▏        | 6/50 [00:06<00:24,  1.82it/s] 14%|█▍        | 7/50 [00:06<00:20,  2.14it/s] 16%|█▌        | 8/50 [00:06<00:17,  2.41it/s] 18%|█▊        | 9/50 [00:07<00:15,  2.63it/s] 20%|██        | 10/50 [00:07<00:14,  2.81it/s] 22%|██▏       | 11/50 [00:07<00:13,  2.95it/s] 24%|██▍       | 12/50 [00:08<00:12,  3.04it/s] 26%|██▌       | 13/50 [00:08<00:11,  3.12it/s] 28%|██▊       | 14/50 [00:08<00:11,  3.17it/s] 30%|███       | 15/50 [00:08<00:10,  3.21it/s] 32%|███▏      | 16/50 [00:09<00:10,  3.23it/s] 34%|███▍      | 17/50 [00:09<00:10,  3.25it/s] 36%|███▌      | 18/50 [00:09<00:09,  3.26it/s] 38%|███▊      | 19/50 [00:10<00:09,  3.27it/s] 40%|████      | 20/50 [00:10<00:09,  3.27it/s] 42%|████▏     | 21/50 [00:10<00:08,  3.28it/s] 44%|████▍     | 22/50 [00:11<00:08,  3.28it/s] 46%|████▌     | 23/50 [00:11<00:08,  3.28it/s] 48%|████▊     | 24/50 [00:11<00:07,  3.28it/s] 50%|█████     | 25/50 [00:11<00:07,  3.28it/s] 52%|█████▏    | 26/50 [00:12<00:07,  3.29it/s] 54%|█████▍    | 27/50 [00:12<00:06,  3.29it/s] 56%|█████▌    | 28/50 [00:12<00:06,  3.29it/s] 58%|█████▊    | 29/50 [00:13<00:06,  3.29it/s] 60%|██████    | 30/50 [00:13<00:06,  3.28it/s] 62%|██████▏   | 31/50 [00:13<00:05,  3.28it/s] 64%|██████▍   | 32/50 [00:14<00:05,  3.28it/s] 66%|██████▌   | 33/50 [00:14<00:05,  3.29it/s] 68%|██████▊   | 34/50 [00:14<00:04,  3.29it/s] 70%|███████   | 35/50 [00:14<00:04,  3.29it/s] 72%|███████▏  | 36/50 [00:15<00:04,  3.29it/s] 74%|███████▍  | 37/50 [00:15<00:03,  3.28it/s] 76%|███████▌  | 38/50 [00:15<00:03,  3.29it/s] 78%|███████▊  | 39/50 [00:16<00:03,  3.28it/s] 80%|████████  | 40/50 [00:16<00:03,  3.28it/s] 82%|████████▏ | 41/50 [00:16<00:02,  3.28it/s] 84%|████████▍ | 42/50 [00:17<00:02,  3.29it/s] 86%|████████▌ | 43/50 [00:17<00:02,  3.29it/s] 88%|████████▊ | 44/50 [00:17<00:01,  3.28it/s] 90%|█████████ | 45/50 [00:18<00:01,  3.28it/s] 92%|█████████▏| 46/50 [00:18<00:01,  3.28it/s] 94%|█████████▍| 47/50 [00:18<00:00,  3.28it/s] 96%|█████████▌| 48/50 [00:18<00:00,  3.28it/s] 98%|█████████▊| 49/50 [00:19<00:00,  3.28it/s]100%|██████████| 50/50 [00:24<00:00,  1.71s/it]100%|██████████| 50/50 [00:24<00:00,  2.06it/s]
[I 2023-12-10 22:41:54,462] Trial 163 finished with value: 0.40804247541126293 and parameters: {'EMBEDDING_DIM': 962, 'HIDDEN_DIM': 461, 'NUM_LAYERS': 1, 'DROPOUT': 0.3615699729491052, 'LR': 0.000808222476687705, 'WEIGHT_0': 0.3652784369341357, 'WEIGHT_1': 0.7533499682171179, 'WEIGHT_2': 0.5633908524611356, 'WEIGHT_3': 0.8277356128084216, 'WEIGHT_4': 0.6651316640470867, 'WEIGHT_5': 0.48517376461955597, 'WEIGHT_6': 0.7159843235663599, 'WEIGHT_7': 0.3513873511318284, 'WEIGHT_8': 0.5509622382729648, 'optimizer': 'RMSprop'}. Best is trial 134 with value: 0.4158467115484205.
/userhome/cs2/dingruiw/conda/envs/py310/lib/python3.10/site-packages/torch/nn/modules/rnn.py:82: UserWarning: dropout option adds dropout after all but last recurrent layer, so non-zero dropout expects num_layers greater than 1, but got dropout=0.36929224409033723 and num_layers=1
  warnings.warn("dropout option adds dropout after all but last "
{'EMBEDDING_DIM': 962, 'HIDDEN_DIM': 461, 'NUM_LAYERS': 1, 'DROPOUT': 0.3615699729491052, 'LR': 0.000808222476687705, 'WEIGHT_0': 0.3652784369341357, 'WEIGHT_1': 0.7533499682171179, 'WEIGHT_2': 0.5633908524611356, 'WEIGHT_3': 0.8277356128084216, 'WEIGHT_4': 0.6651316640470867, 'WEIGHT_5': 0.48517376461955597, 'WEIGHT_6': 0.7159843235663599, 'WEIGHT_7': 0.3513873511318284, 'WEIGHT_8': 0.5509622382729648, 'optimizer': 'RMSprop'}
0
              precision    recall  f1-score   support

         LOC       0.24      0.08      0.12      1837
        MISC       0.02      0.02      0.02       922
         ORG       0.09      0.05      0.06      1341
         PER       0.05      0.02      0.03      1842

   micro avg       0.09      0.05      0.06      5942
   macro avg       0.10      0.04      0.06      5942
weighted avg       0.11      0.05      0.06      5942

{'EMBEDDING_DIM': 962, 'HIDDEN_DIM': 461, 'NUM_LAYERS': 1, 'DROPOUT': 0.3615699729491052, 'LR': 0.000808222476687705, 'WEIGHT_0': 0.3652784369341357, 'WEIGHT_1': 0.7533499682171179, 'WEIGHT_2': 0.5633908524611356, 'WEIGHT_3': 0.8277356128084216, 'WEIGHT_4': 0.6651316640470867, 'WEIGHT_5': 0.48517376461955597, 'WEIGHT_6': 0.7159843235663599, 'WEIGHT_7': 0.3513873511318284, 'WEIGHT_8': 0.5509622382729648, 'optimizer': 'RMSprop'}
49
              precision    recall  f1-score   support

         LOC       0.56      0.52      0.54      1837
        MISC       0.44      0.43      0.43       922
         ORG       0.30      0.25      0.27      1341
         PER       0.36      0.36      0.36      1842

   micro avg       0.42      0.39      0.41      5942
   macro avg       0.41      0.39      0.40      5942
weighted avg       0.42      0.39      0.41      5942

epoch 49
LSTM
  0%|          | 0/50 [00:00<?, ?it/s]  2%|▏         | 1/50 [00:04<03:56,  4.82s/it]  4%|▍         | 2/50 [00:04<01:39,  2.08s/it]  6%|▌         | 3/50 [00:05<00:59,  1.27s/it]  8%|▊         | 4/50 [00:05<00:40,  1.13it/s] 10%|█         | 5/50 [00:05<00:30,  1.48it/s] 12%|█▏        | 6/50 [00:06<00:24,  1.83it/s] 14%|█▍        | 7/50 [00:06<00:20,  2.14it/s] 16%|█▌        | 8/50 [00:06<00:17,  2.41it/s] 18%|█▊        | 9/50 [00:07<00:15,  2.63it/s] 20%|██        | 10/50 [00:07<00:14,  2.81it/s] 22%|██▏       | 11/50 [00:07<00:13,  2.94it/s] 24%|██▍       | 12/50 [00:08<00:12,  3.04it/s] 26%|██▌       | 13/50 [00:08<00:11,  3.12it/s] 28%|██▊       | 14/50 [00:08<00:11,  3.17it/s] 30%|███       | 15/50 [00:08<00:10,  3.22it/s] 32%|███▏      | 16/50 [00:09<00:10,  3.25it/s] 34%|███▍      | 17/50 [00:09<00:10,  3.27it/s] 36%|███▌      | 18/50 [00:09<00:09,  3.28it/s] 38%|███▊      | 19/50 [00:10<00:09,  3.28it/s] 40%|████      | 20/50 [00:10<00:09,  3.29it/s] 42%|████▏     | 21/50 [00:10<00:08,  3.29it/s] 44%|████▍     | 22/50 [00:11<00:08,  3.29it/s] 46%|████▌     | 23/50 [00:11<00:08,  3.29it/s] 48%|████▊     | 24/50 [00:11<00:07,  3.29it/s] 50%|█████     | 25/50 [00:11<00:07,  3.29it/s] 52%|█████▏    | 26/50 [00:12<00:07,  3.29it/s] 54%|█████▍    | 27/50 [00:12<00:06,  3.29it/s] 56%|█████▌    | 28/50 [00:12<00:06,  3.29it/s] 58%|█████▊    | 29/50 [00:13<00:06,  3.29it/s] 60%|██████    | 30/50 [00:13<00:06,  3.29it/s] 62%|██████▏   | 31/50 [00:13<00:05,  3.29it/s] 64%|██████▍   | 32/50 [00:14<00:05,  3.29it/s] 66%|██████▌   | 33/50 [00:14<00:05,  3.29it/s] 68%|██████▊   | 34/50 [00:14<00:04,  3.30it/s] 70%|███████   | 35/50 [00:14<00:04,  3.30it/s] 72%|███████▏  | 36/50 [00:15<00:04,  3.30it/s] 74%|███████▍  | 37/50 [00:15<00:03,  3.31it/s] 76%|███████▌  | 38/50 [00:15<00:03,  3.30it/s] 78%|███████▊  | 39/50 [00:16<00:03,  3.30it/s] 80%|████████  | 40/50 [00:16<00:03,  3.30it/s] 82%|████████▏ | 41/50 [00:16<00:02,  3.29it/s] 84%|████████▍ | 42/50 [00:17<00:02,  3.29it/s] 86%|████████▌ | 43/50 [00:17<00:02,  3.29it/s] 88%|████████▊ | 44/50 [00:17<00:01,  3.28it/s] 90%|█████████ | 45/50 [00:18<00:01,  3.28it/s] 92%|█████████▏| 46/50 [00:18<00:01,  3.28it/s] 94%|█████████▍| 47/50 [00:18<00:00,  3.28it/s] 96%|█████████▌| 48/50 [00:18<00:00,  3.28it/s] 98%|█████████▊| 49/50 [00:19<00:00,  3.28it/s]100%|██████████| 50/50 [00:24<00:00,  1.78s/it]100%|██████████| 50/50 [00:24<00:00,  2.05it/s]
[I 2023-12-10 22:42:23,238] Trial 164 finished with value: 0.3896873877111032 and parameters: {'EMBEDDING_DIM': 965, 'HIDDEN_DIM': 462, 'NUM_LAYERS': 1, 'DROPOUT': 0.36929224409033723, 'LR': 0.0004758991717736004, 'WEIGHT_0': 0.36730626716878223, 'WEIGHT_1': 0.7203845730453614, 'WEIGHT_2': 0.5529367599275812, 'WEIGHT_3': 0.8067193755856598, 'WEIGHT_4': 0.6466479716287185, 'WEIGHT_5': 0.4936817098649583, 'WEIGHT_6': 0.7892324929503202, 'WEIGHT_7': 0.33319128856048374, 'WEIGHT_8': 0.5656916803844404, 'optimizer': 'RMSprop'}. Best is trial 134 with value: 0.4158467115484205.
/userhome/cs2/dingruiw/conda/envs/py310/lib/python3.10/site-packages/torch/nn/modules/rnn.py:82: UserWarning: dropout option adds dropout after all but last recurrent layer, so non-zero dropout expects num_layers greater than 1, but got dropout=0.3575305084566753 and num_layers=1
  warnings.warn("dropout option adds dropout after all but last "
{'EMBEDDING_DIM': 965, 'HIDDEN_DIM': 462, 'NUM_LAYERS': 1, 'DROPOUT': 0.36929224409033723, 'LR': 0.0004758991717736004, 'WEIGHT_0': 0.36730626716878223, 'WEIGHT_1': 0.7203845730453614, 'WEIGHT_2': 0.5529367599275812, 'WEIGHT_3': 0.8067193755856598, 'WEIGHT_4': 0.6466479716287185, 'WEIGHT_5': 0.4936817098649583, 'WEIGHT_6': 0.7892324929503202, 'WEIGHT_7': 0.33319128856048374, 'WEIGHT_8': 0.5656916803844404, 'optimizer': 'RMSprop'}
0
              precision    recall  f1-score   support

         LOC       0.11      0.05      0.07      1837
        MISC       0.03      0.03      0.03       922
         ORG       0.07      0.03      0.04      1341
         PER       0.06      0.03      0.04      1842

   micro avg       0.07      0.04      0.05      5942
   macro avg       0.07      0.03      0.04      5942
weighted avg       0.07      0.04      0.05      5942

{'EMBEDDING_DIM': 965, 'HIDDEN_DIM': 462, 'NUM_LAYERS': 1, 'DROPOUT': 0.36929224409033723, 'LR': 0.0004758991717736004, 'WEIGHT_0': 0.36730626716878223, 'WEIGHT_1': 0.7203845730453614, 'WEIGHT_2': 0.5529367599275812, 'WEIGHT_3': 0.8067193755856598, 'WEIGHT_4': 0.6466479716287185, 'WEIGHT_5': 0.4936817098649583, 'WEIGHT_6': 0.7892324929503202, 'WEIGHT_7': 0.33319128856048374, 'WEIGHT_8': 0.5656916803844404, 'optimizer': 'RMSprop'}
49
              precision    recall  f1-score   support

         LOC       0.58      0.49      0.53      1837
        MISC       0.48      0.41      0.44       922
         ORG       0.28      0.23      0.25      1341
         PER       0.34      0.32      0.33      1842

   micro avg       0.42      0.37      0.39      5942
   macro avg       0.42      0.36      0.39      5942
weighted avg       0.42      0.37      0.39      5942

epoch 49
LSTM
  0%|          | 0/50 [00:00<?, ?it/s]  2%|▏         | 1/50 [00:04<03:53,  4.77s/it]  4%|▍         | 2/50 [00:04<01:37,  2.04s/it]  6%|▌         | 3/50 [00:05<00:57,  1.22s/it]  8%|▊         | 4/50 [00:05<00:37,  1.21it/s] 10%|█         | 5/50 [00:05<00:27,  1.65it/s] 12%|█▏        | 6/50 [00:05<00:20,  2.10it/s] 14%|█▍        | 7/50 [00:06<00:16,  2.54it/s] 16%|█▌        | 8/50 [00:06<00:14,  2.94it/s] 18%|█▊        | 9/50 [00:06<00:12,  3.29it/s] 20%|██        | 10/50 [00:06<00:11,  3.59it/s] 22%|██▏       | 11/50 [00:06<00:10,  3.82it/s] 24%|██▍       | 12/50 [00:07<00:09,  3.99it/s] 26%|██▌       | 13/50 [00:07<00:08,  4.12it/s] 28%|██▊       | 14/50 [00:07<00:08,  4.22it/s] 30%|███       | 15/50 [00:07<00:08,  4.29it/s] 32%|███▏      | 16/50 [00:08<00:07,  4.34it/s] 34%|███▍      | 17/50 [00:08<00:07,  4.38it/s] 36%|███▌      | 18/50 [00:08<00:07,  4.40it/s] 38%|███▊      | 19/50 [00:08<00:07,  4.42it/s] 40%|████      | 20/50 [00:08<00:06,  4.43it/s] 42%|████▏     | 21/50 [00:09<00:06,  4.42it/s] 44%|████▍     | 22/50 [00:09<00:06,  4.43it/s] 46%|████▌     | 23/50 [00:09<00:06,  4.44it/s] 48%|████▊     | 24/50 [00:09<00:05,  4.44it/s] 50%|█████     | 25/50 [00:10<00:05,  4.44it/s] 52%|█████▏    | 26/50 [00:10<00:05,  4.44it/s] 54%|█████▍    | 27/50 [00:10<00:05,  4.44it/s] 56%|█████▌    | 28/50 [00:10<00:04,  4.44it/s] 58%|█████▊    | 29/50 [00:10<00:04,  4.44it/s] 60%|██████    | 30/50 [00:11<00:04,  4.44it/s] 62%|██████▏   | 31/50 [00:11<00:04,  4.44it/s] 64%|██████▍   | 32/50 [00:11<00:04,  4.45it/s] 66%|██████▌   | 33/50 [00:11<00:03,  4.45it/s] 68%|██████▊   | 34/50 [00:12<00:03,  4.44it/s] 70%|███████   | 35/50 [00:12<00:03,  4.45it/s] 72%|███████▏  | 36/50 [00:12<00:03,  4.44it/s] 74%|███████▍  | 37/50 [00:12<00:02,  4.44it/s] 76%|███████▌  | 38/50 [00:12<00:02,  4.44it/s] 78%|███████▊  | 39/50 [00:13<00:02,  4.44it/s] 80%|████████  | 40/50 [00:13<00:02,  4.44it/s] 82%|████████▏ | 41/50 [00:13<00:02,  4.44it/s] 84%|████████▍ | 42/50 [00:13<00:01,  4.44it/s] 86%|████████▌ | 43/50 [00:14<00:01,  4.45it/s] 88%|████████▊ | 44/50 [00:14<00:01,  4.44it/s] 90%|█████████ | 45/50 [00:14<00:01,  4.44it/s] 92%|█████████▏| 46/50 [00:14<00:00,  4.44it/s] 94%|█████████▍| 47/50 [00:15<00:00,  4.44it/s] 96%|█████████▌| 48/50 [00:15<00:00,  4.44it/s] 98%|█████████▊| 49/50 [00:15<00:00,  4.44it/s]100%|██████████| 50/50 [00:20<00:00,  1.63s/it]100%|██████████| 50/50 [00:20<00:00,  2.46it/s]
