[I 2023-12-10 22:44:18,226] Trial 169 finished with value: 0.4023658192090396 and parameters: {'EMBEDDING_DIM': 1000, 'HIDDEN_DIM': 215, 'NUM_LAYERS': 1, 'DROPOUT': 0.3953667628978239, 'LR': 0.0007050351698359023, 'WEIGHT_0': 0.35755251886047773, 'WEIGHT_1': 0.7587710568721804, 'WEIGHT_2': 0.6059790402460095, 'WEIGHT_3': 0.8435262274733194, 'WEIGHT_4': 0.511709072234181, 'WEIGHT_5': 0.5940369680514849, 'WEIGHT_6': 0.7241435093357038, 'WEIGHT_7': 0.28030297431250434, 'WEIGHT_8': 0.5293912804934096, 'optimizer': 'RMSprop'}. Best is trial 134 with value: 0.4158467115484205.
/userhome/cs2/dingruiw/conda/envs/py310/lib/python3.10/site-packages/torch/nn/modules/rnn.py:82: UserWarning: dropout option adds dropout after all but last recurrent layer, so non-zero dropout expects num_layers greater than 1, but got dropout=0.36301336635714976 and num_layers=1
  warnings.warn("dropout option adds dropout after all but last "
{'EMBEDDING_DIM': 1000, 'HIDDEN_DIM': 215, 'NUM_LAYERS': 1, 'DROPOUT': 0.3953667628978239, 'LR': 0.0007050351698359023, 'WEIGHT_0': 0.35755251886047773, 'WEIGHT_1': 0.7587710568721804, 'WEIGHT_2': 0.6059790402460095, 'WEIGHT_3': 0.8435262274733194, 'WEIGHT_4': 0.511709072234181, 'WEIGHT_5': 0.5940369680514849, 'WEIGHT_6': 0.7241435093357038, 'WEIGHT_7': 0.28030297431250434, 'WEIGHT_8': 0.5293912804934096, 'optimizer': 'RMSprop'}
0
              precision    recall  f1-score   support

         LOC       0.20      0.06      0.09      1837
        MISC       0.05      0.02      0.03       922
         ORG       0.12      0.07      0.09      1341
         PER       0.04      0.02      0.02      1842

   micro avg       0.10      0.04      0.06      5942
   macro avg       0.10      0.04      0.06      5942
weighted avg       0.11      0.04      0.06      5942

{'EMBEDDING_DIM': 1000, 'HIDDEN_DIM': 215, 'NUM_LAYERS': 1, 'DROPOUT': 0.3953667628978239, 'LR': 0.0007050351698359023, 'WEIGHT_0': 0.35755251886047773, 'WEIGHT_1': 0.7587710568721804, 'WEIGHT_2': 0.6059790402460095, 'WEIGHT_3': 0.8435262274733194, 'WEIGHT_4': 0.511709072234181, 'WEIGHT_5': 0.5940369680514849, 'WEIGHT_6': 0.7241435093357038, 'WEIGHT_7': 0.28030297431250434, 'WEIGHT_8': 0.5293912804934096, 'optimizer': 'RMSprop'}
49
              precision    recall  f1-score   support

         LOC       0.58      0.50      0.54      1837
        MISC       0.46      0.44      0.45       922
         ORG       0.30      0.26      0.28      1341
         PER       0.34      0.33      0.34      1842

   micro avg       0.42      0.38      0.40      5942
   macro avg       0.42      0.38      0.40      5942
weighted avg       0.43      0.38      0.40      5942

epoch 49
LSTM
  0%|          | 0/50 [00:00<?, ?it/s]  2%|▏         | 1/50 [00:04<03:52,  4.75s/it]  4%|▍         | 2/50 [00:04<01:37,  2.04s/it]  6%|▌         | 3/50 [00:05<00:57,  1.22s/it]  8%|▊         | 4/50 [00:05<00:38,  1.20it/s] 10%|█         | 5/50 [00:05<00:27,  1.62it/s] 12%|█▏        | 6/50 [00:05<00:21,  2.04it/s] 14%|█▍        | 7/50 [00:06<00:17,  2.44it/s] 16%|█▌        | 8/50 [00:06<00:14,  2.80it/s] 18%|█▊        | 9/50 [00:06<00:13,  3.11it/s] 20%|██        | 10/50 [00:06<00:11,  3.37it/s] 22%|██▏       | 11/50 [00:07<00:10,  3.57it/s] 24%|██▍       | 12/50 [00:07<00:10,  3.72it/s] 26%|██▌       | 13/50 [00:07<00:09,  3.83it/s] 28%|██▊       | 14/50 [00:07<00:09,  3.91it/s] 30%|███       | 15/50 [00:08<00:08,  3.97it/s] 32%|███▏      | 16/50 [00:08<00:08,  4.01it/s] 34%|███▍      | 17/50 [00:08<00:08,  4.05it/s] 36%|███▌      | 18/50 [00:08<00:07,  4.06it/s] 38%|███▊      | 19/50 [00:09<00:07,  4.08it/s] 40%|████      | 20/50 [00:09<00:07,  4.09it/s] 42%|████▏     | 21/50 [00:09<00:07,  4.10it/s] 44%|████▍     | 22/50 [00:09<00:06,  4.10it/s] 46%|████▌     | 23/50 [00:09<00:06,  4.10it/s] 48%|████▊     | 24/50 [00:10<00:06,  4.10it/s] 50%|█████     | 25/50 [00:10<00:06,  4.11it/s] 52%|█████▏    | 26/50 [00:10<00:05,  4.11it/s] 54%|█████▍    | 27/50 [00:10<00:05,  4.11it/s] 56%|█████▌    | 28/50 [00:11<00:05,  4.11it/s] 58%|█████▊    | 29/50 [00:11<00:05,  4.11it/s] 60%|██████    | 30/50 [00:11<00:04,  4.11it/s] 62%|██████▏   | 31/50 [00:11<00:04,  4.11it/s] 64%|██████▍   | 32/50 [00:12<00:04,  4.11it/s] 66%|██████▌   | 33/50 [00:12<00:04,  4.11it/s] 68%|██████▊   | 34/50 [00:12<00:03,  4.10it/s] 70%|███████   | 35/50 [00:12<00:03,  4.10it/s] 72%|███████▏  | 36/50 [00:13<00:03,  4.10it/s] 74%|███████▍  | 37/50 [00:13<00:03,  4.10it/s] 76%|███████▌  | 38/50 [00:13<00:02,  4.10it/s] 78%|███████▊  | 39/50 [00:13<00:02,  4.10it/s] 80%|████████  | 40/50 [00:14<00:02,  4.10it/s] 82%|████████▏ | 41/50 [00:14<00:02,  4.10it/s] 84%|████████▍ | 42/50 [00:14<00:01,  4.10it/s] 86%|████████▌ | 43/50 [00:14<00:01,  4.10it/s] 88%|████████▊ | 44/50 [00:15<00:01,  4.10it/s] 90%|█████████ | 45/50 [00:15<00:01,  4.10it/s] 92%|█████████▏| 46/50 [00:15<00:00,  4.10it/s] 94%|█████████▍| 47/50 [00:15<00:00,  4.10it/s] 96%|█████████▌| 48/50 [00:16<00:00,  4.10it/s] 98%|█████████▊| 49/50 [00:16<00:00,  4.09it/s]100%|██████████| 50/50 [00:21<00:00,  1.63s/it]100%|██████████| 50/50 [00:21<00:00,  2.36it/s]
[I 2023-12-10 22:44:43,656] Trial 170 finished with value: 0.391674550614948 and parameters: {'EMBEDDING_DIM': 951, 'HIDDEN_DIM': 376, 'NUM_LAYERS': 1, 'DROPOUT': 0.36301336635714976, 'LR': 0.0025841616884788475, 'WEIGHT_0': 0.3032530773481803, 'WEIGHT_1': 0.734042156670611, 'WEIGHT_2': 0.535283701600502, 'WEIGHT_3': 0.7913048116699528, 'WEIGHT_4': 0.4549431111896449, 'WEIGHT_5': 0.6192913324290152, 'WEIGHT_6': 0.7114384164396336, 'WEIGHT_7': 0.31676735659465305, 'WEIGHT_8': 0.5864562992241663, 'optimizer': 'RMSprop'}. Best is trial 134 with value: 0.4158467115484205.
/userhome/cs2/dingruiw/conda/envs/py310/lib/python3.10/site-packages/torch/nn/modules/rnn.py:82: UserWarning: dropout option adds dropout after all but last recurrent layer, so non-zero dropout expects num_layers greater than 1, but got dropout=0.35514563590904974 and num_layers=1
  warnings.warn("dropout option adds dropout after all but last "
{'EMBEDDING_DIM': 951, 'HIDDEN_DIM': 376, 'NUM_LAYERS': 1, 'DROPOUT': 0.36301336635714976, 'LR': 0.0025841616884788475, 'WEIGHT_0': 0.3032530773481803, 'WEIGHT_1': 0.734042156670611, 'WEIGHT_2': 0.535283701600502, 'WEIGHT_3': 0.7913048116699528, 'WEIGHT_4': 0.4549431111896449, 'WEIGHT_5': 0.6192913324290152, 'WEIGHT_6': 0.7114384164396336, 'WEIGHT_7': 0.31676735659465305, 'WEIGHT_8': 0.5864562992241663, 'optimizer': 'RMSprop'}
0
              precision    recall  f1-score   support

         LOC       0.35      0.15      0.21      1837
        MISC       0.06      0.02      0.03       922
         ORG       0.17      0.04      0.06      1341
         PER       0.03      0.02      0.02      1842

   micro avg       0.15      0.06      0.09      5942
   macro avg       0.15      0.06      0.08      5942
weighted avg       0.16      0.06      0.09      5942

{'EMBEDDING_DIM': 951, 'HIDDEN_DIM': 376, 'NUM_LAYERS': 1, 'DROPOUT': 0.36301336635714976, 'LR': 0.0025841616884788475, 'WEIGHT_0': 0.3032530773481803, 'WEIGHT_1': 0.734042156670611, 'WEIGHT_2': 0.535283701600502, 'WEIGHT_3': 0.7913048116699528, 'WEIGHT_4': 0.4549431111896449, 'WEIGHT_5': 0.6192913324290152, 'WEIGHT_6': 0.7114384164396336, 'WEIGHT_7': 0.31676735659465305, 'WEIGHT_8': 0.5864562992241663, 'optimizer': 'RMSprop'}
49
              precision    recall  f1-score   support

         LOC       0.56      0.51      0.54      1837
        MISC       0.43      0.42      0.42       922
         ORG       0.26      0.25      0.25      1341
         PER       0.34      0.33      0.34      1842

   micro avg       0.40      0.38      0.39      5942
   macro avg       0.40      0.38      0.39      5942
weighted avg       0.40      0.38      0.39      5942

epoch 49
LSTM
  0%|          | 0/50 [00:00<?, ?it/s]  2%|▏         | 1/50 [00:04<03:47,  4.64s/it]  4%|▍         | 2/50 [00:04<01:34,  1.97s/it]  6%|▌         | 3/50 [00:04<00:54,  1.15s/it]  8%|▊         | 4/50 [00:05<00:35,  1.30it/s] 10%|█         | 5/50 [00:05<00:25,  1.80it/s] 12%|█▏        | 6/50 [00:05<00:18,  2.33it/s] 14%|█▍        | 7/50 [00:05<00:14,  2.87it/s] 16%|█▌        | 8/50 [00:05<00:12,  3.39it/s] 18%|█▊        | 9/50 [00:06<00:10,  3.85it/s] 20%|██        | 10/50 [00:06<00:09,  4.24it/s] 22%|██▏       | 11/50 [00:06<00:08,  4.56it/s] 24%|██▍       | 12/50 [00:06<00:07,  4.81it/s] 26%|██▌       | 13/50 [00:06<00:07,  5.00it/s] 28%|██▊       | 14/50 [00:06<00:07,  5.14it/s] 30%|███       | 15/50 [00:07<00:06,  5.25it/s] 32%|███▏      | 16/50 [00:07<00:06,  5.32it/s] 34%|███▍      | 17/50 [00:07<00:06,  5.37it/s] 36%|███▌      | 18/50 [00:07<00:05,  5.41it/s] 38%|███▊      | 19/50 [00:07<00:05,  5.44it/s] 40%|████      | 20/50 [00:08<00:05,  5.46it/s] 42%|████▏     | 21/50 [00:08<00:05,  5.47it/s] 44%|████▍     | 22/50 [00:08<00:05,  5.48it/s] 46%|████▌     | 23/50 [00:08<00:04,  5.49it/s] 48%|████▊     | 24/50 [00:08<00:04,  5.49it/s] 50%|█████     | 25/50 [00:08<00:04,  5.49it/s] 52%|█████▏    | 26/50 [00:09<00:04,  5.49it/s] 54%|█████▍    | 27/50 [00:09<00:04,  5.49it/s] 56%|█████▌    | 28/50 [00:09<00:04,  5.50it/s] 58%|█████▊    | 29/50 [00:09<00:03,  5.50it/s] 60%|██████    | 30/50 [00:09<00:03,  5.49it/s] 62%|██████▏   | 31/50 [00:10<00:03,  5.50it/s] 64%|██████▍   | 32/50 [00:10<00:03,  5.50it/s] 66%|██████▌   | 33/50 [00:10<00:03,  5.50it/s] 68%|██████▊   | 34/50 [00:10<00:02,  5.50it/s] 70%|███████   | 35/50 [00:10<00:02,  5.50it/s] 72%|███████▏  | 36/50 [00:10<00:02,  5.50it/s] 74%|███████▍  | 37/50 [00:11<00:02,  5.49it/s] 76%|███████▌  | 38/50 [00:11<00:02,  5.49it/s] 78%|███████▊  | 39/50 [00:11<00:02,  5.49it/s] 80%|████████  | 40/50 [00:11<00:01,  5.50it/s] 82%|████████▏ | 41/50 [00:11<00:01,  5.49it/s] 84%|████████▍ | 42/50 [00:12<00:01,  5.49it/s] 86%|████████▌ | 43/50 [00:12<00:01,  5.49it/s] 88%|████████▊ | 44/50 [00:12<00:01,  5.49it/s] 90%|█████████ | 45/50 [00:12<00:00,  5.49it/s] 92%|█████████▏| 46/50 [00:12<00:00,  5.49it/s] 94%|█████████▍| 47/50 [00:12<00:00,  5.49it/s] 96%|█████████▌| 48/50 [00:13<00:00,  5.49it/s] 98%|█████████▊| 49/50 [00:13<00:00,  5.49it/s]100%|██████████| 50/50 [00:17<00:00,  1.52s/it]100%|██████████| 50/50 [00:17<00:00,  2.79it/s]
[I 2023-12-10 22:45:05,819] Trial 171 finished with value: 0.41060936713110624 and parameters: {'EMBEDDING_DIM': 934, 'HIDDEN_DIM': 262, 'NUM_LAYERS': 1, 'DROPOUT': 0.35514563590904974, 'LR': 0.002928470128940507, 'WEIGHT_0': 0.33609176161741217, 'WEIGHT_1': 0.7846641619575164, 'WEIGHT_2': 0.5984762980974582, 'WEIGHT_3': 0.8227666883610149, 'WEIGHT_4': 0.7008744509588323, 'WEIGHT_5': 0.5354653666736003, 'WEIGHT_6': 0.7566083692346989, 'WEIGHT_7': 0.25818254468988333, 'WEIGHT_8': 0.5097255310089656, 'optimizer': 'RMSprop'}. Best is trial 134 with value: 0.4158467115484205.
/userhome/cs2/dingruiw/conda/envs/py310/lib/python3.10/site-packages/torch/nn/modules/rnn.py:82: UserWarning: dropout option adds dropout after all but last recurrent layer, so non-zero dropout expects num_layers greater than 1, but got dropout=0.38371282961261954 and num_layers=1
  warnings.warn("dropout option adds dropout after all but last "
{'EMBEDDING_DIM': 934, 'HIDDEN_DIM': 262, 'NUM_LAYERS': 1, 'DROPOUT': 0.35514563590904974, 'LR': 0.002928470128940507, 'WEIGHT_0': 0.33609176161741217, 'WEIGHT_1': 0.7846641619575164, 'WEIGHT_2': 0.5984762980974582, 'WEIGHT_3': 0.8227666883610149, 'WEIGHT_4': 0.7008744509588323, 'WEIGHT_5': 0.5354653666736003, 'WEIGHT_6': 0.7566083692346989, 'WEIGHT_7': 0.25818254468988333, 'WEIGHT_8': 0.5097255310089656, 'optimizer': 'RMSprop'}
0
              precision    recall  f1-score   support

         LOC       0.35      0.07      0.12      1837
        MISC       0.08      0.03      0.04       922
         ORG       0.16      0.04      0.07      1341
         PER       0.05      0.01      0.02      1842

   micro avg       0.16      0.04      0.06      5942
   macro avg       0.16      0.04      0.06      5942
weighted avg       0.17      0.04      0.06      5942

{'EMBEDDING_DIM': 934, 'HIDDEN_DIM': 262, 'NUM_LAYERS': 1, 'DROPOUT': 0.35514563590904974, 'LR': 0.002928470128940507, 'WEIGHT_0': 0.33609176161741217, 'WEIGHT_1': 0.7846641619575164, 'WEIGHT_2': 0.5984762980974582, 'WEIGHT_3': 0.8227666883610149, 'WEIGHT_4': 0.7008744509588323, 'WEIGHT_5': 0.5354653666736003, 'WEIGHT_6': 0.7566083692346989, 'WEIGHT_7': 0.25818254468988333, 'WEIGHT_8': 0.5097255310089656, 'optimizer': 'RMSprop'}
49
              precision    recall  f1-score   support

         LOC       0.59      0.55      0.57      1837
        MISC       0.43      0.46      0.45       922
         ORG       0.27      0.27      0.27      1341
         PER       0.34      0.35      0.34      1842

   micro avg       0.41      0.41      0.41      5942
   macro avg       0.41      0.41      0.41      5942
weighted avg       0.41      0.41      0.41      5942

epoch 49
LSTM
  0%|          | 0/50 [00:00<?, ?it/s]  2%|▏         | 1/50 [00:04<03:49,  4.68s/it]  4%|▍         | 2/50 [00:04<01:35,  2.00s/it]  6%|▌         | 3/50 [00:05<00:55,  1.19s/it]  8%|▊         | 4/50 [00:05<00:36,  1.25it/s] 10%|█         | 5/50 [00:05<00:26,  1.71it/s] 12%|█▏        | 6/50 [00:05<00:20,  2.19it/s] 14%|█▍        | 7/50 [00:05<00:16,  2.66it/s] 16%|█▌        | 8/50 [00:06<00:13,  3.10it/s] 18%|█▊        | 9/50 [00:06<00:11,  3.49it/s] 20%|██        | 10/50 [00:06<00:10,  3.82it/s] 22%|██▏       | 11/50 [00:06<00:09,  4.07it/s] 24%|██▍       | 12/50 [00:06<00:08,  4.27it/s] 26%|██▌       | 13/50 [00:07<00:08,  4.42it/s] 28%|██▊       | 14/50 [00:07<00:07,  4.54it/s] 30%|███       | 15/50 [00:07<00:07,  4.61it/s] 32%|███▏      | 16/50 [00:07<00:07,  4.67it/s] 34%|███▍      | 17/50 [00:07<00:07,  4.71it/s] 36%|███▌      | 18/50 [00:08<00:06,  4.75it/s] 38%|███▊      | 19/50 [00:08<00:06,  4.77it/s] 40%|████      | 20/50 [00:08<00:06,  4.78it/s] 42%|████▏     | 21/50 [00:08<00:06,  4.79it/s] 44%|████▍     | 22/50 [00:08<00:05,  4.80it/s] 46%|████▌     | 23/50 [00:09<00:05,  4.80it/s] 48%|████▊     | 24/50 [00:09<00:05,  4.80it/s] 50%|█████     | 25/50 [00:09<00:05,  4.80it/s] 52%|█████▏    | 26/50 [00:09<00:04,  4.81it/s] 54%|█████▍    | 27/50 [00:10<00:04,  4.80it/s] 56%|█████▌    | 28/50 [00:10<00:04,  4.81it/s] 58%|█████▊    | 29/50 [00:10<00:04,  4.80it/s] 60%|██████    | 30/50 [00:10<00:04,  4.81it/s] 62%|██████▏   | 31/50 [00:10<00:03,  4.80it/s] 64%|██████▍   | 32/50 [00:11<00:03,  4.81it/s] 66%|██████▌   | 33/50 [00:11<00:03,  4.80it/s] 68%|██████▊   | 34/50 [00:11<00:03,  4.81it/s] 70%|███████   | 35/50 [00:11<00:03,  4.81it/s] 72%|███████▏  | 36/50 [00:11<00:02,  4.81it/s] 74%|███████▍  | 37/50 [00:12<00:02,  4.81it/s] 76%|███████▌  | 38/50 [00:12<00:02,  4.81it/s] 78%|███████▊  | 39/50 [00:12<00:02,  4.81it/s] 80%|████████  | 40/50 [00:12<00:02,  4.81it/s] 82%|████████▏ | 41/50 [00:12<00:01,  4.80it/s] 84%|████████▍ | 42/50 [00:13<00:01,  4.80it/s] 86%|████████▌ | 43/50 [00:13<00:01,  4.80it/s] 88%|████████▊ | 44/50 [00:13<00:01,  4.80it/s] 90%|█████████ | 45/50 [00:13<00:01,  4.80it/s] 92%|█████████▏| 46/50 [00:13<00:00,  4.80it/s] 94%|█████████▍| 47/50 [00:14<00:00,  4.80it/s] 96%|█████████▌| 48/50 [00:14<00:00,  4.79it/s] 98%|█████████▊| 49/50 [00:14<00:00,  4.80it/s]100%|██████████| 50/50 [00:19<00:00,  1.61s/it]100%|██████████| 50/50 [00:19<00:00,  2.57it/s]
[I 2023-12-10 22:45:29,560] Trial 172 finished with value: 0.4013337893296854 and parameters: {'EMBEDDING_DIM': 977, 'HIDDEN_DIM': 303, 'NUM_LAYERS': 1, 'DROPOUT': 0.38371282961261954, 'LR': 0.0029771459436120145, 'WEIGHT_0': 0.3370290601760599, 'WEIGHT_1': 0.7773224720574277, 'WEIGHT_2': 0.5885454536991916, 'WEIGHT_3': 0.8474889627852948, 'WEIGHT_4': 0.6816614099078377, 'WEIGHT_5': 0.5297181336980342, 'WEIGHT_6': 0.7600118237313068, 'WEIGHT_7': 0.2263657393714355, 'WEIGHT_8': 0.547528332188288, 'optimizer': 'RMSprop'}. Best is trial 134 with value: 0.4158467115484205.
/userhome/cs2/dingruiw/conda/envs/py310/lib/python3.10/site-packages/torch/nn/modules/rnn.py:82: UserWarning: dropout option adds dropout after all but last recurrent layer, so non-zero dropout expects num_layers greater than 1, but got dropout=0.35179858916022577 and num_layers=1
  warnings.warn("dropout option adds dropout after all but last "
{'EMBEDDING_DIM': 977, 'HIDDEN_DIM': 303, 'NUM_LAYERS': 1, 'DROPOUT': 0.38371282961261954, 'LR': 0.0029771459436120145, 'WEIGHT_0': 0.3370290601760599, 'WEIGHT_1': 0.7773224720574277, 'WEIGHT_2': 0.5885454536991916, 'WEIGHT_3': 0.8474889627852948, 'WEIGHT_4': 0.6816614099078377, 'WEIGHT_5': 0.5297181336980342, 'WEIGHT_6': 0.7600118237313068, 'WEIGHT_7': 0.2263657393714355, 'WEIGHT_8': 0.547528332188288, 'optimizer': 'RMSprop'}
0
              precision    recall  f1-score   support

         LOC       0.34      0.06      0.11      1837
        MISC       0.05      0.04      0.04       922
         ORG       0.11      0.02      0.04      1341
         PER       0.05      0.02      0.03      1842

   micro avg       0.11      0.04      0.05      5942
   macro avg       0.14      0.04      0.05      5942
weighted avg       0.15      0.04      0.06      5942

{'EMBEDDING_DIM': 977, 'HIDDEN_DIM': 303, 'NUM_LAYERS': 1, 'DROPOUT': 0.38371282961261954, 'LR': 0.0029771459436120145, 'WEIGHT_0': 0.3370290601760599, 'WEIGHT_1': 0.7773224720574277, 'WEIGHT_2': 0.5885454536991916, 'WEIGHT_3': 0.8474889627852948, 'WEIGHT_4': 0.6816614099078377, 'WEIGHT_5': 0.5297181336980342, 'WEIGHT_6': 0.7600118237313068, 'WEIGHT_7': 0.2263657393714355, 'WEIGHT_8': 0.547528332188288, 'optimizer': 'RMSprop'}
49
              precision    recall  f1-score   support

         LOC       0.57      0.53      0.55      1837
        MISC       0.43      0.44      0.44       922
         ORG       0.26      0.25      0.26      1341
         PER       0.35      0.34      0.34      1842

   micro avg       0.41      0.39      0.40      5942
   macro avg       0.40      0.39      0.40      5942
weighted avg       0.41      0.39      0.40      5942

epoch 49
LSTM
  0%|          | 0/50 [00:00<?, ?it/s]  2%|▏         | 1/50 [00:04<03:48,  4.66s/it]  6%|▌         | 3/50 [00:04<01:01,  1.30s/it]  8%|▊         | 4/50 [00:05<00:41,  1.11it/s] 10%|█         | 5/50 [00:05<00:29,  1.53it/s] 12%|█▏        | 6/50 [00:05<00:21,  2.04it/s] 14%|█▍        | 7/50 [00:05<00:16,  2.61it/s] 16%|█▌        | 8/50 [00:05<00:13,  3.21it/s] 18%|█▊        | 9/50 [00:05<00:10,  3.82it/s] 20%|██        | 10/50 [00:05<00:09,  4.38it/s] 22%|██▏       | 11/50 [00:06<00:07,  4.89it/s] 24%|██▍       | 12/50 [00:06<00:07,  5.31it/s] 26%|██▌       | 13/50 [00:06<00:06,  5.65it/s] 28%|██▊       | 14/50 [00:06<00:06,  5.92it/s] 30%|███       | 15/50 [00:06<00:05,  6.11it/s] 32%|███▏      | 16/50 [00:06<00:05,  6.27it/s] 34%|███▍      | 17/50 [00:07<00:05,  6.39it/s] 36%|███▌      | 18/50 [00:07<00:04,  6.47it/s] 38%|███▊      | 19/50 [00:07<00:04,  6.53it/s] 40%|████      | 20/50 [00:07<00:04,  6.56it/s] 42%|████▏     | 21/50 [00:07<00:04,  6.58it/s] 44%|████▍     | 22/50 [00:07<00:04,  6.61it/s] 46%|████▌     | 23/50 [00:07<00:04,  6.63it/s] 48%|████▊     | 24/50 [00:08<00:03,  6.65it/s] 50%|█████     | 25/50 [00:08<00:03,  6.65it/s] 52%|█████▏    | 26/50 [00:08<00:03,  6.65it/s] 54%|█████▍    | 27/50 [00:08<00:03,  6.65it/s] 56%|█████▌    | 28/50 [00:08<00:03,  6.64it/s] 58%|█████▊    | 29/50 [00:08<00:03,  6.64it/s] 60%|██████    | 30/50 [00:08<00:03,  6.64it/s] 62%|██████▏   | 31/50 [00:09<00:02,  6.66it/s] 64%|██████▍   | 32/50 [00:09<00:02,  6.66it/s] 66%|██████▌   | 33/50 [00:09<00:02,  6.66it/s] 68%|██████▊   | 34/50 [00:09<00:02,  6.65it/s] 70%|███████   | 35/50 [00:09<00:02,  6.64it/s] 72%|███████▏  | 36/50 [00:09<00:02,  6.64it/s] 74%|███████▍  | 37/50 [00:10<00:01,  6.64it/s] 76%|███████▌  | 38/50 [00:10<00:01,  6.64it/s] 78%|███████▊  | 39/50 [00:10<00:01,  6.65it/s] 80%|████████  | 40/50 [00:10<00:01,  6.66it/s] 82%|████████▏ | 41/50 [00:10<00:01,  6.65it/s] 84%|████████▍ | 42/50 [00:10<00:01,  6.65it/s] 86%|████████▌ | 43/50 [00:10<00:01,  6.64it/s] 88%|████████▊ | 44/50 [00:11<00:00,  6.63it/s] 90%|█████████ | 45/50 [00:11<00:00,  6.63it/s] 92%|█████████▏| 46/50 [00:11<00:00,  6.62it/s] 94%|█████████▍| 47/50 [00:11<00:00,  6.64it/s] 96%|█████████▌| 48/50 [00:11<00:00,  6.65it/s] 98%|█████████▊| 49/50 [00:11<00:00,  6.65it/s]100%|██████████| 50/50 [00:16<00:00,  1.55s/it]100%|██████████| 50/50 [00:16<00:00,  3.00it/s]
