[I 2023-12-10 23:57:37,045] Trial 317 finished with value: 0.40200310827145574 and parameters: {'EMBEDDING_DIM': 1024, 'HIDDEN_DIM': 291, 'NUM_LAYERS': 1, 'DROPOUT': 0.3596417301219964, 'LR': 0.0010697453413021423, 'WEIGHT_0': 0.3483720217927964, 'WEIGHT_1': 0.8101884581109834, 'WEIGHT_2': 0.6370846105316516, 'WEIGHT_3': 0.87329237437605, 'WEIGHT_4': 0.9904366946113257, 'WEIGHT_5': 0.726734404258669, 'WEIGHT_6': 0.5569768544725607, 'WEIGHT_7': 0.7025497721681211, 'WEIGHT_8': 0.457153737217329, 'optimizer': 'Adam'}. Best is trial 221 with value: 0.418736930154747.
/userhome/cs2/dingruiw/conda/envs/py310/lib/python3.10/site-packages/torch/nn/modules/rnn.py:82: UserWarning: dropout option adds dropout after all but last recurrent layer, so non-zero dropout expects num_layers greater than 1, but got dropout=0.35632429715686753 and num_layers=1
  warnings.warn("dropout option adds dropout after all but last "
{'EMBEDDING_DIM': 1024, 'HIDDEN_DIM': 291, 'NUM_LAYERS': 1, 'DROPOUT': 0.3596417301219964, 'LR': 0.0010697453413021423, 'WEIGHT_0': 0.3483720217927964, 'WEIGHT_1': 0.8101884581109834, 'WEIGHT_2': 0.6370846105316516, 'WEIGHT_3': 0.87329237437605, 'WEIGHT_4': 0.9904366946113257, 'WEIGHT_5': 0.726734404258669, 'WEIGHT_6': 0.5569768544725607, 'WEIGHT_7': 0.7025497721681211, 'WEIGHT_8': 0.457153737217329, 'optimizer': 'Adam'}
0
              precision    recall  f1-score   support

         LOC       0.07      0.23      0.11      1837
        MISC       0.01      0.04      0.02       922
         ORG       0.03      0.04      0.04      1341
         PER       0.02      0.03      0.03      1842

   micro avg       0.04      0.10      0.06      5942
   macro avg       0.03      0.09      0.05      5942
weighted avg       0.04      0.10      0.05      5942

{'EMBEDDING_DIM': 1024, 'HIDDEN_DIM': 291, 'NUM_LAYERS': 1, 'DROPOUT': 0.3596417301219964, 'LR': 0.0010697453413021423, 'WEIGHT_0': 0.3483720217927964, 'WEIGHT_1': 0.8101884581109834, 'WEIGHT_2': 0.6370846105316516, 'WEIGHT_3': 0.87329237437605, 'WEIGHT_4': 0.9904366946113257, 'WEIGHT_5': 0.726734404258669, 'WEIGHT_6': 0.5569768544725607, 'WEIGHT_7': 0.7025497721681211, 'WEIGHT_8': 0.457153737217329, 'optimizer': 'Adam'}
49
              precision    recall  f1-score   support

         LOC       0.57      0.52      0.55      1837
        MISC       0.46      0.44      0.45       922
         ORG       0.30      0.25      0.27      1341
         PER       0.32      0.34      0.33      1842

   micro avg       0.41      0.39      0.40      5942
   macro avg       0.41      0.39      0.40      5942
weighted avg       0.41      0.39      0.40      5942

epoch 49
LSTM
  0%|          | 0/50 [00:00<?, ?it/s]  2%|▏         | 1/50 [00:04<03:51,  4.73s/it]  4%|▍         | 2/50 [00:04<01:37,  2.03s/it]  6%|▌         | 3/50 [00:05<00:57,  1.22s/it]  8%|▊         | 4/50 [00:05<00:38,  1.21it/s] 10%|█         | 5/50 [00:05<00:27,  1.63it/s] 12%|█▏        | 6/50 [00:05<00:21,  2.06it/s] 14%|█▍        | 7/50 [00:06<00:17,  2.48it/s] 16%|█▌        | 8/50 [00:06<00:14,  2.86it/s] 18%|█▊        | 9/50 [00:06<00:12,  3.19it/s] 20%|██        | 10/50 [00:06<00:11,  3.46it/s] 22%|██▏       | 11/50 [00:06<00:10,  3.67it/s] 24%|██▍       | 12/50 [00:07<00:09,  3.83it/s] 26%|██▌       | 13/50 [00:07<00:09,  3.95it/s] 28%|██▊       | 14/50 [00:07<00:08,  4.04it/s] 30%|███       | 15/50 [00:07<00:08,  4.10it/s] 32%|███▏      | 16/50 [00:08<00:08,  4.15it/s] 34%|███▍      | 17/50 [00:08<00:07,  4.18it/s] 36%|███▌      | 18/50 [00:08<00:07,  4.21it/s] 38%|███▊      | 19/50 [00:08<00:07,  4.22it/s] 40%|████      | 20/50 [00:09<00:07,  4.23it/s] 42%|████▏     | 21/50 [00:09<00:06,  4.24it/s] 44%|████▍     | 22/50 [00:09<00:06,  4.26it/s] 46%|████▌     | 23/50 [00:09<00:06,  4.25it/s] 48%|████▊     | 24/50 [00:10<00:06,  4.25it/s] 50%|█████     | 25/50 [00:10<00:05,  4.25it/s] 52%|█████▏    | 26/50 [00:10<00:05,  4.24it/s] 54%|█████▍    | 27/50 [00:10<00:05,  4.24it/s] 56%|█████▌    | 28/50 [00:10<00:05,  4.25it/s] 58%|█████▊    | 29/50 [00:11<00:04,  4.24it/s] 60%|██████    | 30/50 [00:11<00:04,  4.25it/s] 62%|██████▏   | 31/50 [00:11<00:04,  4.24it/s] 64%|██████▍   | 32/50 [00:11<00:04,  4.24it/s] 66%|██████▌   | 33/50 [00:12<00:04,  4.24it/s] 68%|██████▊   | 34/50 [00:12<00:03,  4.24it/s] 70%|███████   | 35/50 [00:12<00:03,  4.24it/s] 72%|███████▏  | 36/50 [00:12<00:03,  4.24it/s] 74%|███████▍  | 37/50 [00:13<00:03,  4.24it/s] 76%|███████▌  | 38/50 [00:13<00:02,  4.24it/s] 78%|███████▊  | 39/50 [00:13<00:02,  4.24it/s] 80%|████████  | 40/50 [00:13<00:02,  4.24it/s] 82%|████████▏ | 41/50 [00:14<00:02,  4.24it/s] 84%|████████▍ | 42/50 [00:14<00:01,  4.24it/s] 86%|████████▌ | 43/50 [00:14<00:01,  4.24it/s] 88%|████████▊ | 44/50 [00:14<00:01,  4.24it/s] 90%|█████████ | 45/50 [00:14<00:01,  4.23it/s] 92%|█████████▏| 46/50 [00:15<00:00,  4.24it/s] 94%|█████████▍| 47/50 [00:15<00:00,  4.23it/s] 96%|█████████▌| 48/50 [00:15<00:00,  4.23it/s] 98%|█████████▊| 49/50 [00:15<00:00,  4.23it/s]100%|██████████| 50/50 [00:20<00:00,  1.64s/it]100%|██████████| 50/50 [00:20<00:00,  2.40it/s]
[I 2023-12-10 23:58:02,152] Trial 318 finished with value: 0.4072573839662448 and parameters: {'EMBEDDING_DIM': 1008, 'HIDDEN_DIM': 350, 'NUM_LAYERS': 1, 'DROPOUT': 0.35632429715686753, 'LR': 0.0012013934968536655, 'WEIGHT_0': 0.32869696481128136, 'WEIGHT_1': 0.8225360759820463, 'WEIGHT_2': 0.6232308082596593, 'WEIGHT_3': 0.8367630754782198, 'WEIGHT_4': 0.9793848763085591, 'WEIGHT_5': 0.5074799244722745, 'WEIGHT_6': 0.5564618612598077, 'WEIGHT_7': 0.6121476655718163, 'WEIGHT_8': 0.49358631435825673, 'optimizer': 'Adam'}. Best is trial 221 with value: 0.418736930154747.
/userhome/cs2/dingruiw/conda/envs/py310/lib/python3.10/site-packages/torch/nn/modules/rnn.py:82: UserWarning: dropout option adds dropout after all but last recurrent layer, so non-zero dropout expects num_layers greater than 1, but got dropout=0.37376342805739754 and num_layers=1
  warnings.warn("dropout option adds dropout after all but last "
{'EMBEDDING_DIM': 1008, 'HIDDEN_DIM': 350, 'NUM_LAYERS': 1, 'DROPOUT': 0.35632429715686753, 'LR': 0.0012013934968536655, 'WEIGHT_0': 0.32869696481128136, 'WEIGHT_1': 0.8225360759820463, 'WEIGHT_2': 0.6232308082596593, 'WEIGHT_3': 0.8367630754782198, 'WEIGHT_4': 0.9793848763085591, 'WEIGHT_5': 0.5074799244722745, 'WEIGHT_6': 0.5564618612598077, 'WEIGHT_7': 0.6121476655718163, 'WEIGHT_8': 0.49358631435825673, 'optimizer': 'Adam'}
0
              precision    recall  f1-score   support

         LOC       0.05      0.11      0.07      1837
        MISC       0.02      0.08      0.03       922
         ORG       0.03      0.11      0.04      1341
         PER       0.02      0.03      0.02      1842

   micro avg       0.03      0.08      0.04      5942
   macro avg       0.03      0.08      0.04      5942
weighted avg       0.03      0.08      0.04      5942

{'EMBEDDING_DIM': 1008, 'HIDDEN_DIM': 350, 'NUM_LAYERS': 1, 'DROPOUT': 0.35632429715686753, 'LR': 0.0012013934968536655, 'WEIGHT_0': 0.32869696481128136, 'WEIGHT_1': 0.8225360759820463, 'WEIGHT_2': 0.6232308082596593, 'WEIGHT_3': 0.8367630754782198, 'WEIGHT_4': 0.9793848763085591, 'WEIGHT_5': 0.5074799244722745, 'WEIGHT_6': 0.5564618612598077, 'WEIGHT_7': 0.6121476655718163, 'WEIGHT_8': 0.49358631435825673, 'optimizer': 'Adam'}
49
              precision    recall  f1-score   support

         LOC       0.56      0.53      0.55      1837
        MISC       0.46      0.43      0.45       922
         ORG       0.29      0.27      0.28      1341
         PER       0.33      0.36      0.34      1842

   micro avg       0.41      0.41      0.41      5942
   macro avg       0.41      0.40      0.41      5942
weighted avg       0.41      0.41      0.41      5942

epoch 49
LSTM
  0%|          | 0/50 [00:00<?, ?it/s]  2%|▏         | 1/50 [00:04<03:51,  4.72s/it]  4%|▍         | 2/50 [00:04<01:37,  2.03s/it]  6%|▌         | 3/50 [00:05<00:57,  1.23s/it]  8%|▊         | 4/50 [00:05<00:39,  1.17it/s] 10%|█         | 5/50 [00:05<00:28,  1.55it/s] 12%|█▏        | 6/50 [00:05<00:22,  1.93it/s] 14%|█▍        | 7/50 [00:06<00:18,  2.28it/s] 16%|█▌        | 8/50 [00:06<00:16,  2.59it/s] 18%|█▊        | 9/50 [00:06<00:14,  2.84it/s] 20%|██        | 10/50 [00:07<00:13,  3.05it/s] 22%|██▏       | 11/50 [00:07<00:12,  3.21it/s] 24%|██▍       | 12/50 [00:07<00:11,  3.33it/s] 26%|██▌       | 13/50 [00:07<00:10,  3.41it/s] 28%|██▊       | 14/50 [00:08<00:10,  3.48it/s] 30%|███       | 15/50 [00:08<00:09,  3.52it/s] 32%|███▏      | 16/50 [00:08<00:09,  3.55it/s] 34%|███▍      | 17/50 [00:08<00:09,  3.58it/s] 36%|███▌      | 18/50 [00:09<00:08,  3.59it/s] 38%|███▊      | 19/50 [00:09<00:08,  3.60it/s] 40%|████      | 20/50 [00:09<00:08,  3.61it/s] 42%|████▏     | 21/50 [00:10<00:08,  3.62it/s] 44%|████▍     | 22/50 [00:10<00:07,  3.62it/s] 46%|████▌     | 23/50 [00:10<00:07,  3.62it/s] 48%|████▊     | 24/50 [00:10<00:07,  3.62it/s] 50%|█████     | 25/50 [00:11<00:06,  3.62it/s] 52%|█████▏    | 26/50 [00:11<00:06,  3.62it/s] 54%|█████▍    | 27/50 [00:11<00:06,  3.62it/s] 56%|█████▌    | 28/50 [00:12<00:06,  3.62it/s] 58%|█████▊    | 29/50 [00:12<00:05,  3.62it/s] 60%|██████    | 30/50 [00:12<00:05,  3.61it/s] 62%|██████▏   | 31/50 [00:12<00:05,  3.61it/s] 64%|██████▍   | 32/50 [00:13<00:04,  3.61it/s] 66%|██████▌   | 33/50 [00:13<00:04,  3.61it/s] 68%|██████▊   | 34/50 [00:13<00:04,  3.61it/s] 70%|███████   | 35/50 [00:13<00:04,  3.61it/s] 72%|███████▏  | 36/50 [00:14<00:03,  3.61it/s] 74%|███████▍  | 37/50 [00:14<00:03,  3.60it/s] 76%|███████▌  | 38/50 [00:14<00:03,  3.60it/s] 78%|███████▊  | 39/50 [00:15<00:03,  3.60it/s] 80%|████████  | 40/50 [00:15<00:02,  3.60it/s] 82%|████████▏ | 41/50 [00:15<00:02,  3.60it/s] 84%|████████▍ | 42/50 [00:15<00:02,  3.60it/s] 86%|████████▌ | 43/50 [00:16<00:01,  3.60it/s] 88%|████████▊ | 44/50 [00:16<00:01,  3.60it/s] 90%|█████████ | 45/50 [00:16<00:01,  3.59it/s] 92%|█████████▏| 46/50 [00:17<00:01,  3.59it/s] 94%|█████████▍| 47/50 [00:17<00:00,  3.59it/s] 96%|█████████▌| 48/50 [00:17<00:00,  3.59it/s] 98%|█████████▊| 49/50 [00:17<00:00,  3.59it/s]100%|██████████| 50/50 [00:22<00:00,  1.65s/it]100%|██████████| 50/50 [00:22<00:00,  2.20it/s]
[I 2023-12-10 23:58:29,227] Trial 319 finished with value: 0.40498286096480224 and parameters: {'EMBEDDING_DIM': 1005, 'HIDDEN_DIM': 403, 'NUM_LAYERS': 1, 'DROPOUT': 0.37376342805739754, 'LR': 0.0013884766975453876, 'WEIGHT_0': 0.3059146456937154, 'WEIGHT_1': 0.7935943808232969, 'WEIGHT_2': 0.6020721964238349, 'WEIGHT_3': 0.8210411155645131, 'WEIGHT_4': 0.9716778288739688, 'WEIGHT_5': 0.7424234186673255, 'WEIGHT_6': 0.5137547427100048, 'WEIGHT_7': 0.6837143851154186, 'WEIGHT_8': 0.42004738312846474, 'optimizer': 'Adam'}. Best is trial 221 with value: 0.418736930154747.
{'EMBEDDING_DIM': 1005, 'HIDDEN_DIM': 403, 'NUM_LAYERS': 1, 'DROPOUT': 0.37376342805739754, 'LR': 0.0013884766975453876, 'WEIGHT_0': 0.3059146456937154, 'WEIGHT_1': 0.7935943808232969, 'WEIGHT_2': 0.6020721964238349, 'WEIGHT_3': 0.8210411155645131, 'WEIGHT_4': 0.9716778288739688, 'WEIGHT_5': 0.7424234186673255, 'WEIGHT_6': 0.5137547427100048, 'WEIGHT_7': 0.6837143851154186, 'WEIGHT_8': 0.42004738312846474, 'optimizer': 'Adam'}
0
              precision    recall  f1-score   support

         LOC       0.07      0.17      0.10      1837
        MISC       0.01      0.02      0.01       922
         ORG       0.02      0.04      0.03      1341
         PER       0.03      0.06      0.04      1842

   micro avg       0.04      0.09      0.05      5942
   macro avg       0.03      0.07      0.05      5942
weighted avg       0.04      0.09      0.05      5942

{'EMBEDDING_DIM': 1005, 'HIDDEN_DIM': 403, 'NUM_LAYERS': 1, 'DROPOUT': 0.37376342805739754, 'LR': 0.0013884766975453876, 'WEIGHT_0': 0.3059146456937154, 'WEIGHT_1': 0.7935943808232969, 'WEIGHT_2': 0.6020721964238349, 'WEIGHT_3': 0.8210411155645131, 'WEIGHT_4': 0.9716778288739688, 'WEIGHT_5': 0.7424234186673255, 'WEIGHT_6': 0.5137547427100048, 'WEIGHT_7': 0.6837143851154186, 'WEIGHT_8': 0.42004738312846474, 'optimizer': 'Adam'}
49
              precision    recall  f1-score   support

         LOC       0.58      0.54      0.56      1837
        MISC       0.44      0.42      0.43       922
         ORG       0.27      0.26      0.27      1341
         PER       0.32      0.38      0.35      1842

   micro avg       0.40      0.41      0.40      5942
   macro avg       0.40      0.40      0.40      5942
weighted avg       0.41      0.41      0.41      5942

epoch 49
LSTM
  0%|          | 0/50 [00:00<?, ?it/s]  2%|▏         | 1/50 [00:05<04:22,  5.35s/it]  4%|▍         | 2/50 [00:05<01:48,  2.27s/it]  6%|▌         | 3/50 [00:05<01:04,  1.37s/it]  8%|▊         | 4/50 [00:06<00:43,  1.06it/s] 10%|█         | 5/50 [00:06<00:32,  1.40it/s] 12%|█▏        | 6/50 [00:06<00:25,  1.75it/s] 14%|█▍        | 7/50 [00:06<00:20,  2.07it/s] 16%|█▌        | 8/50 [00:07<00:17,  2.36it/s] 18%|█▊        | 9/50 [00:07<00:15,  2.60it/s] 20%|██        | 10/50 [00:07<00:14,  2.81it/s] 22%|██▏       | 11/50 [00:08<00:13,  2.95it/s] 24%|██▍       | 12/50 [00:08<00:12,  3.06it/s] 26%|██▌       | 13/50 [00:08<00:11,  3.14it/s] 28%|██▊       | 14/50 [00:09<00:11,  3.21it/s] 30%|███       | 15/50 [00:09<00:10,  3.25it/s] 32%|███▏      | 16/50 [00:09<00:10,  3.28it/s] 34%|███▍      | 17/50 [00:09<00:09,  3.31it/s] 36%|███▌      | 18/50 [00:10<00:09,  3.32it/s] 38%|███▊      | 19/50 [00:10<00:09,  3.32it/s] 40%|████      | 20/50 [00:10<00:09,  3.33it/s] 42%|████▏     | 21/50 [00:11<00:08,  3.35it/s] 44%|████▍     | 22/50 [00:11<00:08,  3.36it/s] 46%|████▌     | 23/50 [00:11<00:08,  3.37it/s] 48%|████▊     | 24/50 [00:12<00:07,  3.36it/s] 50%|█████     | 25/50 [00:12<00:07,  3.35it/s] 52%|█████▏    | 26/50 [00:12<00:07,  3.34it/s] 54%|█████▍    | 27/50 [00:12<00:06,  3.35it/s] 56%|█████▌    | 28/50 [00:13<00:06,  3.36it/s] 58%|█████▊    | 29/50 [00:13<00:06,  3.36it/s] 60%|██████    | 30/50 [00:13<00:05,  3.35it/s] 62%|██████▏   | 31/50 [00:14<00:05,  3.36it/s] 64%|██████▍   | 32/50 [00:14<00:05,  3.35it/s] 66%|██████▌   | 33/50 [00:14<00:05,  3.34it/s] 68%|██████▊   | 34/50 [00:14<00:04,  3.35it/s] 70%|███████   | 35/50 [00:15<00:04,  3.35it/s] 72%|███████▏  | 36/50 [00:15<00:04,  3.36it/s] 74%|███████▍  | 37/50 [00:15<00:03,  3.36it/s] 76%|███████▌  | 38/50 [00:16<00:03,  3.35it/s] 78%|███████▊  | 39/50 [00:16<00:03,  3.35it/s] 80%|████████  | 40/50 [00:16<00:02,  3.36it/s] 82%|████████▏ | 41/50 [00:17<00:02,  3.35it/s] 84%|████████▍ | 42/50 [00:17<00:02,  3.34it/s] 86%|████████▌ | 43/50 [00:17<00:02,  3.33it/s] 88%|████████▊ | 44/50 [00:17<00:01,  3.34it/s] 90%|█████████ | 45/50 [00:18<00:01,  3.34it/s] 92%|█████████▏| 46/50 [00:18<00:01,  3.34it/s] 94%|█████████▍| 47/50 [00:18<00:00,  3.32it/s] 96%|█████████▌| 48/50 [00:19<00:00,  3.33it/s] 98%|█████████▊| 49/50 [00:19<00:00,  3.33it/s]100%|██████████| 50/50 [00:24<00:00,  1.86s/it]100%|██████████| 50/50 [00:24<00:00,  2.00it/s]
[I 2023-12-10 23:58:59,122] Trial 320 finished with value: 0.34788977387164693 and parameters: {'EMBEDDING_DIM': 974, 'HIDDEN_DIM': 274, 'NUM_LAYERS': 2, 'DROPOUT': 0.3632803295501751, 'LR': 0.0007034501799022705, 'WEIGHT_0': 0.37216773198753256, 'WEIGHT_1': 0.8450759914112208, 'WEIGHT_2': 0.647151306164448, 'WEIGHT_3': 0.8421538438452808, 'WEIGHT_4': 0.9569534834107462, 'WEIGHT_5': 0.9955865660810502, 'WEIGHT_6': 0.5901060227839597, 'WEIGHT_7': 0.5758118267878126, 'WEIGHT_8': 0.4785315358377235, 'optimizer': 'Adam'}. Best is trial 221 with value: 0.418736930154747.
/userhome/cs2/dingruiw/conda/envs/py310/lib/python3.10/site-packages/torch/nn/modules/rnn.py:82: UserWarning: dropout option adds dropout after all but last recurrent layer, so non-zero dropout expects num_layers greater than 1, but got dropout=0.344635781376499 and num_layers=1
  warnings.warn("dropout option adds dropout after all but last "
{'EMBEDDING_DIM': 974, 'HIDDEN_DIM': 274, 'NUM_LAYERS': 2, 'DROPOUT': 0.3632803295501751, 'LR': 0.0007034501799022705, 'WEIGHT_0': 0.37216773198753256, 'WEIGHT_1': 0.8450759914112208, 'WEIGHT_2': 0.647151306164448, 'WEIGHT_3': 0.8421538438452808, 'WEIGHT_4': 0.9569534834107462, 'WEIGHT_5': 0.9955865660810502, 'WEIGHT_6': 0.5901060227839597, 'WEIGHT_7': 0.5758118267878126, 'WEIGHT_8': 0.4785315358377235, 'optimizer': 'Adam'}
0
              precision    recall  f1-score   support

         LOC       0.05      0.07      0.06      1837
        MISC       0.02      0.03      0.02       922
         ORG       0.01      0.00      0.00      1341
         PER       0.03      0.00      0.01      1842

   micro avg       0.03      0.03      0.03      5942
   macro avg       0.02      0.03      0.02      5942
weighted avg       0.03      0.03      0.02      5942

{'EMBEDDING_DIM': 974, 'HIDDEN_DIM': 274, 'NUM_LAYERS': 2, 'DROPOUT': 0.3632803295501751, 'LR': 0.0007034501799022705, 'WEIGHT_0': 0.37216773198753256, 'WEIGHT_1': 0.8450759914112208, 'WEIGHT_2': 0.647151306164448, 'WEIGHT_3': 0.8421538438452808, 'WEIGHT_4': 0.9569534834107462, 'WEIGHT_5': 0.9955865660810502, 'WEIGHT_6': 0.5901060227839597, 'WEIGHT_7': 0.5758118267878126, 'WEIGHT_8': 0.4785315358377235, 'optimizer': 'Adam'}
49
              precision    recall  f1-score   support

         LOC       0.49      0.50      0.49      1837
        MISC       0.41      0.28      0.33       922
         ORG       0.19      0.11      0.14      1341
         PER       0.34      0.32      0.33      1842

   micro avg       0.38      0.32      0.35      5942
   macro avg       0.36      0.30      0.32      5942
weighted avg       0.36      0.32      0.34      5942

epoch 49
LSTM
  0%|          | 0/50 [00:00<?, ?it/s]  2%|▏         | 1/50 [00:04<03:50,  4.70s/it]  4%|▍         | 2/50 [00:04<01:36,  2.01s/it]  6%|▌         | 3/50 [00:05<00:56,  1.20s/it]  8%|▊         | 4/50 [00:05<00:37,  1.23it/s] 10%|█         | 5/50 [00:05<00:27,  1.66it/s] 12%|█▏        | 6/50 [00:05<00:20,  2.10it/s] 14%|█▍        | 7/50 [00:05<00:16,  2.54it/s] 16%|█▌        | 8/50 [00:06<00:14,  2.93it/s] 18%|█▊        | 9/50 [00:06<00:12,  3.27it/s] 20%|██        | 10/50 [00:06<00:11,  3.54it/s] 22%|██▏       | 11/50 [00:06<00:10,  3.76it/s] 24%|██▍       | 12/50 [00:07<00:09,  3.94it/s] 26%|██▌       | 13/50 [00:07<00:09,  4.05it/s] 28%|██▊       | 14/50 [00:07<00:08,  4.15it/s] 30%|███       | 15/50 [00:07<00:08,  4.21it/s] 32%|███▏      | 16/50 [00:08<00:07,  4.27it/s] 34%|███▍      | 17/50 [00:08<00:07,  4.30it/s] 36%|███▌      | 18/50 [00:08<00:07,  4.32it/s] 38%|███▊      | 19/50 [00:08<00:07,  4.34it/s] 40%|████      | 20/50 [00:08<00:06,  4.35it/s] 42%|████▏     | 21/50 [00:09<00:06,  4.36it/s] 44%|████▍     | 22/50 [00:09<00:06,  4.36it/s] 46%|████▌     | 23/50 [00:09<00:06,  4.37it/s] 48%|████▊     | 24/50 [00:09<00:05,  4.37it/s] 50%|█████     | 25/50 [00:10<00:05,  4.37it/s] 52%|█████▏    | 26/50 [00:10<00:05,  4.37it/s] 54%|█████▍    | 27/50 [00:10<00:05,  4.37it/s] 56%|█████▌    | 28/50 [00:10<00:05,  4.37it/s] 58%|█████▊    | 29/50 [00:10<00:04,  4.37it/s] 60%|██████    | 30/50 [00:11<00:04,  4.37it/s] 62%|██████▏   | 31/50 [00:11<00:04,  4.37it/s] 64%|██████▍   | 32/50 [00:11<00:04,  4.38it/s] 66%|██████▌   | 33/50 [00:11<00:03,  4.37it/s] 68%|██████▊   | 34/50 [00:12<00:03,  4.38it/s] 70%|███████   | 35/50 [00:12<00:03,  4.37it/s] 72%|███████▏  | 36/50 [00:12<00:03,  4.37it/s] 74%|███████▍  | 37/50 [00:12<00:02,  4.38it/s] 76%|███████▌  | 38/50 [00:13<00:02,  4.38it/s] 78%|███████▊  | 39/50 [00:13<00:02,  4.37it/s] 80%|████████  | 40/50 [00:13<00:02,  4.37it/s] 82%|████████▏ | 41/50 [00:13<00:02,  4.37it/s] 84%|████████▍ | 42/50 [00:13<00:01,  4.37it/s] 86%|████████▌ | 43/50 [00:14<00:01,  4.37it/s] 88%|████████▊ | 44/50 [00:14<00:01,  4.37it/s] 90%|█████████ | 45/50 [00:14<00:01,  4.37it/s] 92%|█████████▏| 46/50 [00:14<00:00,  4.37it/s] 94%|█████████▍| 47/50 [00:15<00:00,  4.37it/s] 96%|█████████▌| 48/50 [00:15<00:00,  4.38it/s] 98%|█████████▊| 49/50 [00:15<00:00,  4.37it/s]100%|██████████| 50/50 [00:20<00:00,  1.61s/it]100%|██████████| 50/50 [00:20<00:00,  2.45it/s]
