[I 2023-12-10 21:41:30,798] Trial 49 finished with value: 0.3702365902113057 and parameters: {'EMBEDDING_DIM': 789, 'HIDDEN_DIM': 814, 'NUM_LAYERS': 1, 'DROPOUT': 0.34506012736176, 'LR': 0.0016735417977294604, 'WEIGHT_0': 0.4982600233977131, 'WEIGHT_1': 0.7857917229981315, 'WEIGHT_2': 0.7242695278764164, 'WEIGHT_3': 0.8570071962905537, 'WEIGHT_4': 0.8823650794686259, 'WEIGHT_5': 0.7447922670085501, 'WEIGHT_6': 0.9515897235440168, 'WEIGHT_7': 0.43335965340174354, 'WEIGHT_8': 0.625723443994513, 'optimizer': 'RMSprop'}. Best is trial 42 with value: 0.4124343257443082.
{'EMBEDDING_DIM': 789, 'HIDDEN_DIM': 814, 'NUM_LAYERS': 1, 'DROPOUT': 0.34506012736176, 'LR': 0.0016735417977294604, 'WEIGHT_0': 0.4982600233977131, 'WEIGHT_1': 0.7857917229981315, 'WEIGHT_2': 0.7242695278764164, 'WEIGHT_3': 0.8570071962905537, 'WEIGHT_4': 0.8823650794686259, 'WEIGHT_5': 0.7447922670085501, 'WEIGHT_6': 0.9515897235440168, 'WEIGHT_7': 0.43335965340174354, 'WEIGHT_8': 0.625723443994513, 'optimizer': 'RMSprop'}
0
              precision    recall  f1-score   support

         LOC       0.06      0.04      0.04      1837
        MISC       0.02      0.02      0.02       922
         ORG       0.03      0.02      0.03      1341
         PER       0.03      0.00      0.01      1842

   micro avg       0.04      0.02      0.03      5942
   macro avg       0.03      0.02      0.03      5942
weighted avg       0.04      0.02      0.03      5942

{'EMBEDDING_DIM': 789, 'HIDDEN_DIM': 814, 'NUM_LAYERS': 1, 'DROPOUT': 0.34506012736176, 'LR': 0.0016735417977294604, 'WEIGHT_0': 0.4982600233977131, 'WEIGHT_1': 0.7857917229981315, 'WEIGHT_2': 0.7242695278764164, 'WEIGHT_3': 0.8570071962905537, 'WEIGHT_4': 0.8823650794686259, 'WEIGHT_5': 0.7447922670085501, 'WEIGHT_6': 0.9515897235440168, 'WEIGHT_7': 0.43335965340174354, 'WEIGHT_8': 0.625723443994513, 'optimizer': 'RMSprop'}
49
              precision    recall  f1-score   support

         LOC       0.57      0.49      0.53      1837
        MISC       0.44      0.36      0.40       922
         ORG       0.28      0.20      0.24      1341
         PER       0.30      0.29      0.29      1842

   micro avg       0.40      0.35      0.37      5942
   macro avg       0.40      0.34      0.36      5942
weighted avg       0.40      0.35      0.37      5942

epoch 49
LSTM
  0%|          | 0/50 [00:00<?, ?it/s]  2%|▏         | 1/50 [00:09<07:47,  9.54s/it]  4%|▍         | 2/50 [00:10<03:32,  4.42s/it]  6%|▌         | 3/50 [00:12<02:30,  3.21s/it]  8%|▊         | 4/50 [00:13<02:01,  2.64s/it] 10%|█         | 5/50 [00:15<01:44,  2.33s/it] 12%|█▏        | 6/50 [00:17<01:33,  2.14s/it] 14%|█▍        | 7/50 [00:19<01:26,  2.01s/it] 16%|█▌        | 8/50 [00:20<01:21,  1.94s/it] 18%|█▊        | 9/50 [00:22<01:17,  1.89s/it] 20%|██        | 10/50 [00:24<01:14,  1.85s/it] 22%|██▏       | 11/50 [00:26<01:11,  1.83s/it] 24%|██▍       | 12/50 [00:28<01:09,  1.82s/it] 26%|██▌       | 13/50 [00:29<01:07,  1.81s/it] 28%|██▊       | 14/50 [00:31<01:05,  1.81s/it] 30%|███       | 15/50 [00:33<01:03,  1.81s/it] 32%|███▏      | 16/50 [00:35<01:01,  1.81s/it] 34%|███▍      | 17/50 [00:37<00:59,  1.81s/it] 36%|███▌      | 18/50 [00:38<00:57,  1.80s/it] 38%|███▊      | 19/50 [00:40<00:55,  1.80s/it] 40%|████      | 20/50 [00:42<00:54,  1.81s/it] 42%|████▏     | 21/50 [00:44<00:52,  1.82s/it] 44%|████▍     | 22/50 [00:46<00:51,  1.83s/it] 46%|████▌     | 23/50 [00:48<00:49,  1.83s/it] 48%|████▊     | 24/50 [00:49<00:47,  1.83s/it] 50%|█████     | 25/50 [00:51<00:45,  1.83s/it] 52%|█████▏    | 26/50 [00:53<00:43,  1.83s/it] 54%|█████▍    | 27/50 [00:55<00:42,  1.83s/it] 56%|█████▌    | 28/50 [00:57<00:40,  1.83s/it] 58%|█████▊    | 29/50 [00:59<00:38,  1.82s/it] 60%|██████    | 30/50 [01:00<00:36,  1.83s/it] 62%|██████▏   | 31/50 [01:02<00:34,  1.83s/it] 64%|██████▍   | 32/50 [01:04<00:32,  1.82s/it] 66%|██████▌   | 33/50 [01:06<00:31,  1.83s/it] 68%|██████▊   | 34/50 [01:08<00:29,  1.83s/it] 70%|███████   | 35/50 [01:10<00:27,  1.83s/it] 72%|███████▏  | 36/50 [01:11<00:25,  1.83s/it] 74%|███████▍  | 37/50 [01:13<00:23,  1.82s/it] 76%|███████▌  | 38/50 [01:15<00:21,  1.82s/it] 78%|███████▊  | 39/50 [01:17<00:20,  1.83s/it] 80%|████████  | 40/50 [01:19<00:18,  1.83s/it] 82%|████████▏ | 41/50 [01:20<00:16,  1.82s/it] 84%|████████▍ | 42/50 [01:22<00:14,  1.82s/it] 86%|████████▌ | 43/50 [01:24<00:12,  1.82s/it] 88%|████████▊ | 44/50 [01:26<00:11,  1.84s/it] 90%|█████████ | 45/50 [01:28<00:09,  1.84s/it] 92%|█████████▏| 46/50 [01:30<00:07,  1.84s/it] 94%|█████████▍| 47/50 [01:32<00:05,  1.84s/it] 96%|█████████▌| 48/50 [01:33<00:03,  1.84s/it] 98%|█████████▊| 49/50 [01:35<00:01,  1.83s/it]100%|██████████| 50/50 [01:46<00:00,  4.47s/it]100%|██████████| 50/50 [01:46<00:00,  2.13s/it]
[I 2023-12-10 21:43:24,751] Trial 50 finished with value: 0.21808590806330067 and parameters: {'EMBEDDING_DIM': 649, 'HIDDEN_DIM': 1103, 'NUM_LAYERS': 2, 'DROPOUT': 0.23012598866953354, 'LR': 0.003670140941119956, 'WEIGHT_0': 0.41482575960432394, 'WEIGHT_1': 0.7259309782009974, 'WEIGHT_2': 0.6097295566261227, 'WEIGHT_3': 0.6707267987570531, 'WEIGHT_4': 0.8042355053518471, 'WEIGHT_5': 0.8253810565579207, 'WEIGHT_6': 0.45822759165720794, 'WEIGHT_7': 0.20577967876317266, 'WEIGHT_8': 0.5840104942428753, 'optimizer': 'Adam'}. Best is trial 42 with value: 0.4124343257443082.
/userhome/cs2/dingruiw/conda/envs/py310/lib/python3.10/site-packages/torch/nn/modules/rnn.py:82: UserWarning: dropout option adds dropout after all but last recurrent layer, so non-zero dropout expects num_layers greater than 1, but got dropout=0.3575958417472058 and num_layers=1
  warnings.warn("dropout option adds dropout after all but last "
{'EMBEDDING_DIM': 649, 'HIDDEN_DIM': 1103, 'NUM_LAYERS': 2, 'DROPOUT': 0.23012598866953354, 'LR': 0.003670140941119956, 'WEIGHT_0': 0.41482575960432394, 'WEIGHT_1': 0.7259309782009974, 'WEIGHT_2': 0.6097295566261227, 'WEIGHT_3': 0.6707267987570531, 'WEIGHT_4': 0.8042355053518471, 'WEIGHT_5': 0.8253810565579207, 'WEIGHT_6': 0.45822759165720794, 'WEIGHT_7': 0.20577967876317266, 'WEIGHT_8': 0.5840104942428753, 'optimizer': 'Adam'}
0
              precision    recall  f1-score   support

         LOC       0.05      0.01      0.02      1837
        MISC       0.01      0.01      0.01       922
         ORG       0.00      0.00      0.00      1341
         PER       0.01      0.00      0.00      1842

   micro avg       0.02      0.01      0.01      5942
   macro avg       0.02      0.01      0.01      5942
weighted avg       0.02      0.01      0.01      5942

{'EMBEDDING_DIM': 649, 'HIDDEN_DIM': 1103, 'NUM_LAYERS': 2, 'DROPOUT': 0.23012598866953354, 'LR': 0.003670140941119956, 'WEIGHT_0': 0.41482575960432394, 'WEIGHT_1': 0.7259309782009974, 'WEIGHT_2': 0.6097295566261227, 'WEIGHT_3': 0.6707267987570531, 'WEIGHT_4': 0.8042355053518471, 'WEIGHT_5': 0.8253810565579207, 'WEIGHT_6': 0.45822759165720794, 'WEIGHT_7': 0.20577967876317266, 'WEIGHT_8': 0.5840104942428753, 'optimizer': 'Adam'}
49
              precision    recall  f1-score   support

         LOC       0.33      0.32      0.33      1837
        MISC       0.13      0.21      0.16       922
         ORG       0.17      0.16      0.17      1341
         PER       0.16      0.24      0.19      1842

   micro avg       0.20      0.24      0.22      5942
   macro avg       0.20      0.23      0.21      5942
weighted avg       0.21      0.24      0.22      5942

epoch 49
LSTM
  0%|          | 0/50 [00:00<?, ?it/s]  2%|▏         | 1/50 [00:04<03:57,  4.84s/it]  4%|▍         | 2/50 [00:04<01:40,  2.09s/it]  6%|▌         | 3/50 [00:05<00:59,  1.26s/it]  8%|▊         | 4/50 [00:05<00:40,  1.14it/s] 10%|█         | 5/50 [00:05<00:29,  1.50it/s] 12%|█▏        | 6/50 [00:06<00:23,  1.86it/s] 14%|█▍        | 7/50 [00:06<00:19,  2.19it/s] 16%|█▌        | 8/50 [00:06<00:16,  2.49it/s] 18%|█▊        | 9/50 [00:07<00:15,  2.73it/s] 20%|██        | 10/50 [00:07<00:13,  2.92it/s] 22%|██▏       | 11/50 [00:07<00:12,  3.06it/s] 24%|██▍       | 12/50 [00:07<00:11,  3.18it/s] 26%|██▌       | 13/50 [00:08<00:11,  3.26it/s] 28%|██▊       | 14/50 [00:08<00:10,  3.32it/s] 30%|███       | 15/50 [00:08<00:10,  3.36it/s] 32%|███▏      | 16/50 [00:09<00:10,  3.39it/s] 34%|███▍      | 17/50 [00:09<00:09,  3.41it/s] 36%|███▌      | 18/50 [00:09<00:09,  3.42it/s] 38%|███▊      | 19/50 [00:09<00:09,  3.43it/s] 40%|████      | 20/50 [00:10<00:08,  3.43it/s] 42%|████▏     | 21/50 [00:10<00:08,  3.43it/s] 44%|████▍     | 22/50 [00:10<00:08,  3.43it/s] 46%|████▌     | 23/50 [00:11<00:07,  3.43it/s] 48%|████▊     | 24/50 [00:11<00:07,  3.43it/s] 50%|█████     | 25/50 [00:11<00:07,  3.42it/s] 52%|█████▏    | 26/50 [00:11<00:07,  3.41it/s] 54%|█████▍    | 27/50 [00:12<00:06,  3.41it/s] 56%|█████▌    | 28/50 [00:12<00:06,  3.41it/s] 58%|█████▊    | 29/50 [00:12<00:06,  3.41it/s] 60%|██████    | 30/50 [00:13<00:05,  3.41it/s] 62%|██████▏   | 31/50 [00:13<00:05,  3.42it/s] 64%|██████▍   | 32/50 [00:13<00:05,  3.42it/s] 66%|██████▌   | 33/50 [00:14<00:04,  3.42it/s] 68%|██████▊   | 34/50 [00:14<00:04,  3.42it/s] 70%|███████   | 35/50 [00:14<00:04,  3.42it/s] 72%|███████▏  | 36/50 [00:14<00:04,  3.42it/s] 74%|███████▍  | 37/50 [00:15<00:03,  3.42it/s] 76%|███████▌  | 38/50 [00:15<00:03,  3.41it/s] 78%|███████▊  | 39/50 [00:15<00:03,  3.42it/s] 80%|████████  | 40/50 [00:16<00:02,  3.41it/s] 82%|████████▏ | 41/50 [00:16<00:02,  3.41it/s] 84%|████████▍ | 42/50 [00:16<00:02,  3.41it/s] 86%|████████▌ | 43/50 [00:16<00:02,  3.41it/s] 88%|████████▊ | 44/50 [00:17<00:01,  3.41it/s] 90%|█████████ | 45/50 [00:17<00:01,  3.41it/s] 92%|█████████▏| 46/50 [00:17<00:01,  3.41it/s] 94%|█████████▍| 47/50 [00:18<00:00,  3.40it/s] 96%|█████████▌| 48/50 [00:18<00:00,  3.41it/s] 98%|█████████▊| 49/50 [00:18<00:00,  3.41it/s]100%|██████████| 50/50 [00:23<00:00,  1.71s/it]100%|██████████| 50/50 [00:23<00:00,  2.11it/s]
[I 2023-12-10 21:43:52,698] Trial 51 finished with value: 0.41438326562364947 and parameters: {'EMBEDDING_DIM': 853, 'HIDDEN_DIM': 458, 'NUM_LAYERS': 1, 'DROPOUT': 0.3575958417472058, 'LR': 0.0012203382947039074, 'WEIGHT_0': 0.5212685766816213, 'WEIGHT_1': 0.7214279484147009, 'WEIGHT_2': 0.6809383600042356, 'WEIGHT_3': 0.7494145585676039, 'WEIGHT_4': 0.9716308213178624, 'WEIGHT_5': 0.5329217776423616, 'WEIGHT_6': 0.793972353519218, 'WEIGHT_7': 0.42839064444319996, 'WEIGHT_8': 0.4531323665287368, 'optimizer': 'Adam'}. Best is trial 51 with value: 0.41438326562364947.
/userhome/cs2/dingruiw/conda/envs/py310/lib/python3.10/site-packages/torch/nn/modules/rnn.py:82: UserWarning: dropout option adds dropout after all but last recurrent layer, so non-zero dropout expects num_layers greater than 1, but got dropout=0.31833531913332963 and num_layers=1
  warnings.warn("dropout option adds dropout after all but last "
{'EMBEDDING_DIM': 853, 'HIDDEN_DIM': 458, 'NUM_LAYERS': 1, 'DROPOUT': 0.3575958417472058, 'LR': 0.0012203382947039074, 'WEIGHT_0': 0.5212685766816213, 'WEIGHT_1': 0.7214279484147009, 'WEIGHT_2': 0.6809383600042356, 'WEIGHT_3': 0.7494145585676039, 'WEIGHT_4': 0.9716308213178624, 'WEIGHT_5': 0.5329217776423616, 'WEIGHT_6': 0.793972353519218, 'WEIGHT_7': 0.42839064444319996, 'WEIGHT_8': 0.4531323665287368, 'optimizer': 'Adam'}
0
              precision    recall  f1-score   support

         LOC       0.04      0.07      0.05      1837
        MISC       0.02      0.06      0.03       922
         ORG       0.04      0.07      0.05      1341
         PER       0.02      0.03      0.02      1842

   micro avg       0.03      0.06      0.04      5942
   macro avg       0.03      0.06      0.04      5942
weighted avg       0.03      0.06      0.04      5942

{'EMBEDDING_DIM': 853, 'HIDDEN_DIM': 458, 'NUM_LAYERS': 1, 'DROPOUT': 0.3575958417472058, 'LR': 0.0012203382947039074, 'WEIGHT_0': 0.5212685766816213, 'WEIGHT_1': 0.7214279484147009, 'WEIGHT_2': 0.6809383600042356, 'WEIGHT_3': 0.7494145585676039, 'WEIGHT_4': 0.9716308213178624, 'WEIGHT_5': 0.5329217776423616, 'WEIGHT_6': 0.793972353519218, 'WEIGHT_7': 0.42839064444319996, 'WEIGHT_8': 0.4531323665287368, 'optimizer': 'Adam'}
49
              precision    recall  f1-score   support

         LOC       0.61      0.54      0.58      1837
        MISC       0.43      0.45      0.44       922
         ORG       0.30      0.27      0.28      1341
         PER       0.35      0.34      0.34      1842

   micro avg       0.43      0.40      0.41      5942
   macro avg       0.42      0.40      0.41      5942
weighted avg       0.43      0.40      0.42      5942

epoch 49
LSTM
  0%|          | 0/50 [00:00<?, ?it/s]  2%|▏         | 1/50 [00:04<03:27,  4.23s/it]  4%|▍         | 2/50 [00:04<01:26,  1.80s/it]  6%|▌         | 3/50 [00:04<00:50,  1.07s/it]  8%|▊         | 4/50 [00:04<00:33,  1.39it/s] 10%|█         | 5/50 [00:04<00:23,  1.91it/s] 12%|█▏        | 6/50 [00:05<00:17,  2.45it/s] 14%|█▍        | 7/50 [00:05<00:14,  3.00it/s] 16%|█▌        | 8/50 [00:05<00:11,  3.51it/s] 18%|█▊        | 9/50 [00:05<00:10,  3.96it/s] 20%|██        | 10/50 [00:05<00:09,  4.34it/s] 22%|██▏       | 11/50 [00:05<00:08,  4.65it/s] 24%|██▍       | 12/50 [00:06<00:07,  4.88it/s] 26%|██▌       | 13/50 [00:06<00:07,  5.06it/s] 28%|██▊       | 14/50 [00:06<00:06,  5.19it/s] 30%|███       | 15/50 [00:06<00:06,  5.29it/s] 32%|███▏      | 16/50 [00:06<00:06,  5.35it/s] 34%|███▍      | 17/50 [00:07<00:06,  5.40it/s] 36%|███▌      | 18/50 [00:07<00:05,  5.44it/s] 38%|███▊      | 19/50 [00:07<00:05,  5.46it/s] 40%|████      | 20/50 [00:07<00:05,  5.48it/s] 42%|████▏     | 21/50 [00:07<00:05,  5.49it/s] 44%|████▍     | 22/50 [00:07<00:05,  5.50it/s] 46%|████▌     | 23/50 [00:08<00:04,  5.50it/s] 48%|████▊     | 24/50 [00:08<00:04,  5.51it/s] 50%|█████     | 25/50 [00:08<00:04,  5.51it/s] 52%|█████▏    | 26/50 [00:08<00:04,  5.51it/s] 54%|█████▍    | 27/50 [00:08<00:04,  5.51it/s] 56%|█████▌    | 28/50 [00:09<00:03,  5.51it/s] 58%|█████▊    | 29/50 [00:09<00:03,  5.51it/s] 60%|██████    | 30/50 [00:09<00:03,  5.52it/s] 62%|██████▏   | 31/50 [00:09<00:03,  5.52it/s] 64%|██████▍   | 32/50 [00:09<00:03,  5.52it/s] 66%|██████▌   | 33/50 [00:09<00:03,  5.52it/s] 68%|██████▊   | 34/50 [00:10<00:02,  5.51it/s] 70%|███████   | 35/50 [00:10<00:02,  5.51it/s] 72%|███████▏  | 36/50 [00:10<00:02,  5.52it/s] 74%|███████▍  | 37/50 [00:10<00:02,  5.52it/s] 76%|███████▌  | 38/50 [00:10<00:02,  5.52it/s] 78%|███████▊  | 39/50 [00:11<00:01,  5.52it/s] 80%|████████  | 40/50 [00:11<00:01,  5.52it/s] 82%|████████▏ | 41/50 [00:11<00:01,  5.51it/s] 84%|████████▍ | 42/50 [00:11<00:01,  5.51it/s] 86%|████████▌ | 43/50 [00:11<00:01,  5.51it/s] 88%|████████▊ | 44/50 [00:11<00:01,  5.51it/s] 90%|█████████ | 45/50 [00:12<00:00,  5.51it/s] 92%|█████████▏| 46/50 [00:12<00:00,  5.51it/s] 94%|█████████▍| 47/50 [00:12<00:00,  5.51it/s] 96%|█████████▌| 48/50 [00:12<00:00,  5.51it/s] 98%|█████████▊| 49/50 [00:12<00:00,  5.51it/s]100%|██████████| 50/50 [00:17<00:00,  1.39s/it]100%|██████████| 50/50 [00:17<00:00,  2.92it/s]
[I 2023-12-10 21:44:13,475] Trial 52 finished with value: 0.3496738117427773 and parameters: {'EMBEDDING_DIM': 883, 'HIDDEN_DIM': 157, 'NUM_LAYERS': 1, 'DROPOUT': 0.31833531913332963, 'LR': 0.0009011230673815866, 'WEIGHT_0': 0.5208397419129563, 'WEIGHT_1': 0.6747771917450095, 'WEIGHT_2': 0.6509180840327036, 'WEIGHT_3': 0.7565099173407532, 'WEIGHT_4': 0.9628349395853498, 'WEIGHT_5': 0.585580468691442, 'WEIGHT_6': 0.87068852251538, 'WEIGHT_7': 0.31649230686152835, 'WEIGHT_8': 0.44725308297524474, 'optimizer': 'Adam'}. Best is trial 51 with value: 0.41438326562364947.
/userhome/cs2/dingruiw/conda/envs/py310/lib/python3.10/site-packages/torch/nn/modules/rnn.py:82: UserWarning: dropout option adds dropout after all but last recurrent layer, so non-zero dropout expects num_layers greater than 1, but got dropout=0.36910128563671757 and num_layers=1
  warnings.warn("dropout option adds dropout after all but last "
{'EMBEDDING_DIM': 883, 'HIDDEN_DIM': 157, 'NUM_LAYERS': 1, 'DROPOUT': 0.31833531913332963, 'LR': 0.0009011230673815866, 'WEIGHT_0': 0.5208397419129563, 'WEIGHT_1': 0.6747771917450095, 'WEIGHT_2': 0.6509180840327036, 'WEIGHT_3': 0.7565099173407532, 'WEIGHT_4': 0.9628349395853498, 'WEIGHT_5': 0.585580468691442, 'WEIGHT_6': 0.87068852251538, 'WEIGHT_7': 0.31649230686152835, 'WEIGHT_8': 0.44725308297524474, 'optimizer': 'Adam'}
0
              precision    recall  f1-score   support

         LOC       0.05      0.26      0.08      1837
        MISC       0.01      0.06      0.02       922
         ORG       0.02      0.12      0.04      1341
         PER       0.02      0.03      0.02      1842

   micro avg       0.03      0.13      0.05      5942
   macro avg       0.02      0.12      0.04      5942
weighted avg       0.03      0.13      0.04      5942

{'EMBEDDING_DIM': 883, 'HIDDEN_DIM': 157, 'NUM_LAYERS': 1, 'DROPOUT': 0.31833531913332963, 'LR': 0.0009011230673815866, 'WEIGHT_0': 0.5208397419129563, 'WEIGHT_1': 0.6747771917450095, 'WEIGHT_2': 0.6509180840327036, 'WEIGHT_3': 0.7565099173407532, 'WEIGHT_4': 0.9628349395853498, 'WEIGHT_5': 0.585580468691442, 'WEIGHT_6': 0.87068852251538, 'WEIGHT_7': 0.31649230686152835, 'WEIGHT_8': 0.44725308297524474, 'optimizer': 'Adam'}
49
              precision    recall  f1-score   support

         LOC       0.52      0.48      0.50      1837
        MISC       0.53      0.26      0.35       922
         ORG       0.26      0.17      0.21      1341
         PER       0.30      0.28      0.29      1842

   micro avg       0.39      0.32      0.35      5942
   macro avg       0.40      0.30      0.34      5942
weighted avg       0.39      0.32      0.35      5942

epoch 49
LSTM
  0%|          | 0/50 [00:00<?, ?it/s]  2%|▏         | 1/50 [00:04<03:55,  4.81s/it]  4%|▍         | 2/50 [00:04<01:39,  2.08s/it]  6%|▌         | 3/50 [00:05<00:59,  1.27s/it]  8%|▊         | 4/50 [00:05<00:41,  1.12it/s] 10%|█         | 5/50 [00:05<00:30,  1.46it/s] 12%|█▏        | 6/50 [00:06<00:24,  1.79it/s] 14%|█▍        | 7/50 [00:06<00:20,  2.09it/s] 16%|█▌        | 8/50 [00:06<00:17,  2.34it/s] 18%|█▊        | 9/50 [00:07<00:16,  2.55it/s] 20%|██        | 10/50 [00:07<00:14,  2.71it/s] 22%|██▏       | 11/50 [00:07<00:13,  2.83it/s] 24%|██▍       | 12/50 [00:08<00:12,  2.92it/s] 26%|██▌       | 13/50 [00:08<00:12,  2.99it/s] 28%|██▊       | 14/50 [00:08<00:11,  3.04it/s] 30%|███       | 15/50 [00:09<00:11,  3.08it/s] 32%|███▏      | 16/50 [00:09<00:10,  3.10it/s] 34%|███▍      | 17/50 [00:09<00:10,  3.13it/s] 36%|███▌      | 18/50 [00:10<00:10,  3.14it/s] 38%|███▊      | 19/50 [00:10<00:09,  3.14it/s] 40%|████      | 20/50 [00:10<00:09,  3.15it/s] 42%|████▏     | 21/50 [00:10<00:09,  3.15it/s] 44%|████▍     | 22/50 [00:11<00:08,  3.16it/s] 46%|████▌     | 23/50 [00:11<00:08,  3.15it/s] 48%|████▊     | 24/50 [00:11<00:08,  3.16it/s] 50%|█████     | 25/50 [00:12<00:07,  3.16it/s] 52%|█████▏    | 26/50 [00:12<00:07,  3.15it/s] 54%|█████▍    | 27/50 [00:12<00:07,  3.15it/s] 56%|█████▌    | 28/50 [00:13<00:06,  3.15it/s] 58%|█████▊    | 29/50 [00:13<00:06,  3.16it/s] 60%|██████    | 30/50 [00:13<00:06,  3.15it/s] 62%|██████▏   | 31/50 [00:14<00:06,  3.14it/s] 64%|██████▍   | 32/50 [00:14<00:05,  3.14it/s] 66%|██████▌   | 33/50 [00:14<00:05,  3.15it/s] 68%|██████▊   | 34/50 [00:15<00:05,  3.15it/s] 70%|███████   | 35/50 [00:15<00:04,  3.16it/s] 72%|███████▏  | 36/50 [00:15<00:04,  3.15it/s] 74%|███████▍  | 37/50 [00:16<00:04,  3.14it/s] 76%|███████▌  | 38/50 [00:16<00:03,  3.15it/s] 78%|███████▊  | 39/50 [00:16<00:03,  3.15it/s] 80%|████████  | 40/50 [00:17<00:03,  3.14it/s] 82%|████████▏ | 41/50 [00:17<00:02,  3.15it/s] 84%|████████▍ | 42/50 [00:17<00:02,  3.15it/s] 86%|████████▌ | 43/50 [00:17<00:02,  3.14it/s] 88%|████████▊ | 44/50 [00:18<00:01,  3.14it/s] 90%|█████████ | 45/50 [00:18<00:01,  3.14it/s] 92%|█████████▏| 46/50 [00:18<00:01,  3.14it/s] 94%|█████████▍| 47/50 [00:19<00:00,  3.14it/s] 96%|█████████▌| 48/50 [00:19<00:00,  3.13it/s] 98%|█████████▊| 49/50 [00:19<00:00,  3.14it/s]100%|██████████| 50/50 [00:24<00:00,  1.70s/it]100%|██████████| 50/50 [00:24<00:00,  2.02it/s]
