[I 2023-12-10 23:51:18,198] Trial 305 finished with value: 0.393840488743828 and parameters: {'EMBEDDING_DIM': 981, 'HIDDEN_DIM': 519, 'NUM_LAYERS': 1, 'DROPOUT': 0.3820111904575594, 'LR': 0.002512636429069292, 'WEIGHT_0': 0.7042232818704153, 'WEIGHT_1': 0.6034426676013286, 'WEIGHT_2': 0.547703550794665, 'WEIGHT_3': 0.507656215202921, 'WEIGHT_4': 0.5078405588611482, 'WEIGHT_5': 0.5695476155816896, 'WEIGHT_6': 0.7935988893859149, 'WEIGHT_7': 0.49339608227590204, 'WEIGHT_8': 0.6854374990754644, 'optimizer': 'Adam'}. Best is trial 221 with value: 0.418736930154747.
/userhome/cs2/dingruiw/conda/envs/py310/lib/python3.10/site-packages/torch/nn/modules/rnn.py:82: UserWarning: dropout option adds dropout after all but last recurrent layer, so non-zero dropout expects num_layers greater than 1, but got dropout=0.3970720584712728 and num_layers=1
  warnings.warn("dropout option adds dropout after all but last "
{'EMBEDDING_DIM': 981, 'HIDDEN_DIM': 519, 'NUM_LAYERS': 1, 'DROPOUT': 0.3820111904575594, 'LR': 0.002512636429069292, 'WEIGHT_0': 0.7042232818704153, 'WEIGHT_1': 0.6034426676013286, 'WEIGHT_2': 0.547703550794665, 'WEIGHT_3': 0.507656215202921, 'WEIGHT_4': 0.5078405588611482, 'WEIGHT_5': 0.5695476155816896, 'WEIGHT_6': 0.7935988893859149, 'WEIGHT_7': 0.49339608227590204, 'WEIGHT_8': 0.6854374990754644, 'optimizer': 'Adam'}
0
              precision    recall  f1-score   support

         LOC       0.06      0.04      0.05      1837
        MISC       0.03      0.04      0.03       922
         ORG       0.03      0.03      0.03      1341
         PER       0.06      0.03      0.04      1842

   micro avg       0.05      0.03      0.04      5942
   macro avg       0.05      0.03      0.04      5942
weighted avg       0.05      0.03      0.04      5942

{'EMBEDDING_DIM': 981, 'HIDDEN_DIM': 519, 'NUM_LAYERS': 1, 'DROPOUT': 0.3820111904575594, 'LR': 0.002512636429069292, 'WEIGHT_0': 0.7042232818704153, 'WEIGHT_1': 0.6034426676013286, 'WEIGHT_2': 0.547703550794665, 'WEIGHT_3': 0.507656215202921, 'WEIGHT_4': 0.5078405588611482, 'WEIGHT_5': 0.5695476155816896, 'WEIGHT_6': 0.7935988893859149, 'WEIGHT_7': 0.49339608227590204, 'WEIGHT_8': 0.6854374990754644, 'optimizer': 'Adam'}
49
              precision    recall  f1-score   support

         LOC       0.56      0.55      0.55      1837
        MISC       0.41      0.43      0.42       922
         ORG       0.27      0.26      0.26      1341
         PER       0.31      0.33      0.32      1842

   micro avg       0.39      0.40      0.39      5942
   macro avg       0.39      0.39      0.39      5942
weighted avg       0.39      0.40      0.39      5942

epoch 49
LSTM
  0%|          | 0/50 [00:00<?, ?it/s]  2%|▏         | 1/50 [00:10<08:25, 10.32s/it]  4%|▍         | 2/50 [00:11<03:49,  4.78s/it]  6%|▌         | 3/50 [00:13<02:43,  3.47s/it]  8%|▊         | 4/50 [00:15<02:10,  2.84s/it] 10%|█         | 5/50 [00:16<01:52,  2.50s/it] 12%|█▏        | 6/50 [00:18<01:40,  2.29s/it] 14%|█▍        | 7/50 [00:20<01:32,  2.16s/it] 16%|█▌        | 8/50 [00:22<01:26,  2.07s/it] 18%|█▊        | 9/50 [00:24<01:22,  2.02s/it] 20%|██        | 10/50 [00:26<01:19,  1.98s/it] 22%|██▏       | 11/50 [00:28<01:16,  1.96s/it] 24%|██▍       | 12/50 [00:30<01:13,  1.94s/it] 26%|██▌       | 13/50 [00:32<01:11,  1.93s/it] 28%|██▊       | 14/50 [00:33<01:09,  1.93s/it] 30%|███       | 15/50 [00:35<01:07,  1.92s/it] 32%|███▏      | 16/50 [00:37<01:05,  1.92s/it] 34%|███▍      | 17/50 [00:39<01:03,  1.91s/it] 36%|███▌      | 18/50 [00:41<01:01,  1.92s/it] 38%|███▊      | 19/50 [00:43<00:59,  1.93s/it] 40%|████      | 20/50 [00:45<00:57,  1.92s/it] 42%|████▏     | 21/50 [00:47<00:55,  1.92s/it] 44%|████▍     | 22/50 [00:49<00:53,  1.92s/it] 46%|████▌     | 23/50 [00:51<00:52,  1.93s/it] 48%|████▊     | 24/50 [00:53<00:50,  1.94s/it] 50%|█████     | 25/50 [00:55<00:48,  1.93s/it] 52%|█████▏    | 26/50 [00:57<00:46,  1.94s/it] 54%|█████▍    | 27/50 [00:59<00:44,  1.95s/it] 56%|█████▌    | 28/50 [01:01<00:43,  1.96s/it] 58%|█████▊    | 29/50 [01:02<00:40,  1.95s/it] 60%|██████    | 30/50 [01:04<00:38,  1.94s/it] 62%|██████▏   | 31/50 [01:06<00:37,  1.95s/it] 64%|██████▍   | 32/50 [01:08<00:34,  1.94s/it] 66%|██████▌   | 33/50 [01:10<00:32,  1.93s/it] 68%|██████▊   | 34/50 [01:12<00:30,  1.94s/it] 70%|███████   | 35/50 [01:14<00:29,  1.94s/it] 72%|███████▏  | 36/50 [01:16<00:27,  1.94s/it] 74%|███████▍  | 37/50 [01:18<00:25,  1.95s/it] 76%|███████▌  | 38/50 [01:20<00:23,  1.95s/it] 78%|███████▊  | 39/50 [01:22<00:21,  1.94s/it] 80%|████████  | 40/50 [01:24<00:19,  1.94s/it] 82%|████████▏ | 41/50 [01:26<00:17,  1.95s/it] 84%|████████▍ | 42/50 [01:28<00:15,  1.94s/it] 86%|████████▌ | 43/50 [01:30<00:13,  1.94s/it] 88%|████████▊ | 44/50 [01:32<00:11,  1.94s/it] 90%|█████████ | 45/50 [01:34<00:09,  1.94s/it] 92%|█████████▏| 46/50 [01:35<00:07,  1.95s/it] 94%|█████████▍| 47/50 [01:37<00:05,  1.95s/it] 96%|█████████▌| 48/50 [01:39<00:03,  1.94s/it] 98%|█████████▊| 49/50 [01:41<00:01,  1.94s/it]100%|██████████| 50/50 [01:53<00:00,  4.79s/it]100%|██████████| 50/50 [01:53<00:00,  2.27s/it]
[I 2023-12-10 23:53:19,670] Trial 306 finished with value: 0.028811524609843937 and parameters: {'EMBEDDING_DIM': 685, 'HIDDEN_DIM': 1850, 'NUM_LAYERS': 1, 'DROPOUT': 0.3970720584712728, 'LR': 0.00217824208451249, 'WEIGHT_0': 0.5307019864198423, 'WEIGHT_1': 0.7698871779755581, 'WEIGHT_2': 0.6587385029733072, 'WEIGHT_3': 0.5352381892997232, 'WEIGHT_4': 0.5729490187993016, 'WEIGHT_5': 0.5361690041678021, 'WEIGHT_6': 0.7709082512020288, 'WEIGHT_7': 0.37860629006096674, 'WEIGHT_8': 0.4313117880810128, 'optimizer': 'SGD'}. Best is trial 221 with value: 0.418736930154747.
/userhome/cs2/dingruiw/conda/envs/py310/lib/python3.10/site-packages/torch/nn/modules/rnn.py:82: UserWarning: dropout option adds dropout after all but last recurrent layer, so non-zero dropout expects num_layers greater than 1, but got dropout=0.33370396469240815 and num_layers=1
  warnings.warn("dropout option adds dropout after all but last "
{'EMBEDDING_DIM': 685, 'HIDDEN_DIM': 1850, 'NUM_LAYERS': 1, 'DROPOUT': 0.3970720584712728, 'LR': 0.00217824208451249, 'WEIGHT_0': 0.5307019864198423, 'WEIGHT_1': 0.7698871779755581, 'WEIGHT_2': 0.6587385029733072, 'WEIGHT_3': 0.5352381892997232, 'WEIGHT_4': 0.5729490187993016, 'WEIGHT_5': 0.5361690041678021, 'WEIGHT_6': 0.7709082512020288, 'WEIGHT_7': 0.37860629006096674, 'WEIGHT_8': 0.4313117880810128, 'optimizer': 'SGD'}
0
              precision    recall  f1-score   support

         LOC       0.03      0.14      0.04      1837
        MISC       0.01      0.06      0.01       922
         ORG       0.02      0.06      0.02      1341
         PER       0.01      0.05      0.02      1842

   micro avg       0.02      0.08      0.03      5942
   macro avg       0.01      0.08      0.02      5942
weighted avg       0.02      0.08      0.03      5942

{'EMBEDDING_DIM': 685, 'HIDDEN_DIM': 1850, 'NUM_LAYERS': 1, 'DROPOUT': 0.3970720584712728, 'LR': 0.00217824208451249, 'WEIGHT_0': 0.5307019864198423, 'WEIGHT_1': 0.7698871779755581, 'WEIGHT_2': 0.6587385029733072, 'WEIGHT_3': 0.5352381892997232, 'WEIGHT_4': 0.5729490187993016, 'WEIGHT_5': 0.5361690041678021, 'WEIGHT_6': 0.7709082512020288, 'WEIGHT_7': 0.37860629006096674, 'WEIGHT_8': 0.4313117880810128, 'optimizer': 'SGD'}
49
              precision    recall  f1-score   support

         LOC       0.04      0.07      0.05      1837
        MISC       0.02      0.05      0.03       922
         ORG       0.02      0.02      0.02      1341
         PER       0.01      0.02      0.02      1842

   micro avg       0.02      0.04      0.03      5942
   macro avg       0.02      0.04      0.03      5942
weighted avg       0.02      0.04      0.03      5942

epoch 49
LSTM
  0%|          | 0/50 [00:00<?, ?it/s]  2%|▏         | 1/50 [00:04<03:42,  4.53s/it]  6%|▌         | 3/50 [00:04<01:00,  1.28s/it]  8%|▊         | 4/50 [00:05<00:41,  1.11it/s] 10%|█         | 5/50 [00:05<00:29,  1.51it/s] 12%|█▏        | 6/50 [00:05<00:22,  1.97it/s] 14%|█▍        | 7/50 [00:05<00:17,  2.47it/s] 16%|█▌        | 8/50 [00:05<00:14,  2.98it/s] 18%|█▊        | 9/50 [00:05<00:11,  3.48it/s] 20%|██        | 10/50 [00:06<00:10,  3.92it/s] 22%|██▏       | 11/50 [00:06<00:09,  4.31it/s] 24%|██▍       | 12/50 [00:06<00:08,  4.62it/s] 26%|██▌       | 13/50 [00:06<00:07,  4.86it/s] 28%|██▊       | 14/50 [00:06<00:07,  5.05it/s] 30%|███       | 15/50 [00:06<00:06,  5.19it/s] 32%|███▏      | 16/50 [00:07<00:06,  5.29it/s] 34%|███▍      | 17/50 [00:07<00:06,  5.36it/s] 36%|███▌      | 18/50 [00:07<00:05,  5.42it/s] 38%|███▊      | 19/50 [00:07<00:05,  5.45it/s] 40%|████      | 20/50 [00:07<00:05,  5.47it/s] 42%|████▏     | 21/50 [00:08<00:05,  5.49it/s] 44%|████▍     | 22/50 [00:08<00:05,  5.50it/s] 46%|████▌     | 23/50 [00:08<00:04,  5.50it/s] 48%|████▊     | 24/50 [00:08<00:04,  5.50it/s] 50%|█████     | 25/50 [00:08<00:04,  5.50it/s] 52%|█████▏    | 26/50 [00:08<00:04,  5.50it/s] 54%|█████▍    | 27/50 [00:09<00:04,  5.50it/s] 56%|█████▌    | 28/50 [00:09<00:03,  5.50it/s] 58%|█████▊    | 29/50 [00:09<00:03,  5.50it/s] 60%|██████    | 30/50 [00:09<00:03,  5.50it/s] 62%|██████▏   | 31/50 [00:09<00:03,  5.51it/s] 64%|██████▍   | 32/50 [00:10<00:03,  5.51it/s] 66%|██████▌   | 33/50 [00:10<00:03,  5.50it/s] 68%|██████▊   | 34/50 [00:10<00:02,  5.50it/s] 70%|███████   | 35/50 [00:10<00:02,  5.50it/s] 72%|███████▏  | 36/50 [00:10<00:02,  5.51it/s] 74%|███████▍  | 37/50 [00:10<00:02,  5.50it/s] 76%|███████▌  | 38/50 [00:11<00:02,  5.51it/s] 78%|███████▊  | 39/50 [00:11<00:01,  5.51it/s] 80%|████████  | 40/50 [00:11<00:01,  5.51it/s] 82%|████████▏ | 41/50 [00:11<00:01,  5.51it/s] 84%|████████▍ | 42/50 [00:11<00:01,  5.51it/s] 86%|████████▌ | 43/50 [00:12<00:01,  5.51it/s] 88%|████████▊ | 44/50 [00:12<00:01,  5.51it/s] 90%|█████████ | 45/50 [00:12<00:00,  5.48it/s] 92%|█████████▏| 46/50 [00:12<00:00,  5.48it/s] 94%|█████████▍| 47/50 [00:12<00:00,  5.47it/s] 96%|█████████▌| 48/50 [00:12<00:00,  5.46it/s] 98%|█████████▊| 49/50 [00:13<00:00,  5.48it/s]100%|██████████| 50/50 [00:17<00:00,  1.55s/it]100%|██████████| 50/50 [00:17<00:00,  2.79it/s]
[I 2023-12-10 23:53:41,672] Trial 307 finished with value: 0.3930856810437963 and parameters: {'EMBEDDING_DIM': 766, 'HIDDEN_DIM': 307, 'NUM_LAYERS': 1, 'DROPOUT': 0.33370396469240815, 'LR': 0.0013215361876450064, 'WEIGHT_0': 0.4464530747804574, 'WEIGHT_1': 0.23335998585187123, 'WEIGHT_2': 0.2617849566601389, 'WEIGHT_3': 0.6013234727992505, 'WEIGHT_4': 0.935752694853641, 'WEIGHT_5': 0.6660648484608755, 'WEIGHT_6': 0.7343261401636612, 'WEIGHT_7': 0.35244928627815697, 'WEIGHT_8': 0.8622579184036168, 'optimizer': 'RMSprop'}. Best is trial 221 with value: 0.418736930154747.
/userhome/cs2/dingruiw/conda/envs/py310/lib/python3.10/site-packages/torch/nn/modules/rnn.py:82: UserWarning: dropout option adds dropout after all but last recurrent layer, so non-zero dropout expects num_layers greater than 1, but got dropout=0.29422285196406556 and num_layers=1
  warnings.warn("dropout option adds dropout after all but last "
{'EMBEDDING_DIM': 766, 'HIDDEN_DIM': 307, 'NUM_LAYERS': 1, 'DROPOUT': 0.33370396469240815, 'LR': 0.0013215361876450064, 'WEIGHT_0': 0.4464530747804574, 'WEIGHT_1': 0.23335998585187123, 'WEIGHT_2': 0.2617849566601389, 'WEIGHT_3': 0.6013234727992505, 'WEIGHT_4': 0.935752694853641, 'WEIGHT_5': 0.6660648484608755, 'WEIGHT_6': 0.7343261401636612, 'WEIGHT_7': 0.35244928627815697, 'WEIGHT_8': 0.8622579184036168, 'optimizer': 'RMSprop'}
0
              precision    recall  f1-score   support

         LOC       0.17      0.04      0.07      1837
        MISC       0.03      0.02      0.03       922
         ORG       0.04      0.02      0.03      1341
         PER       0.04      0.01      0.02      1842

   micro avg       0.06      0.02      0.04      5942
   macro avg       0.07      0.02      0.03      5942
weighted avg       0.08      0.02      0.04      5942

{'EMBEDDING_DIM': 766, 'HIDDEN_DIM': 307, 'NUM_LAYERS': 1, 'DROPOUT': 0.33370396469240815, 'LR': 0.0013215361876450064, 'WEIGHT_0': 0.4464530747804574, 'WEIGHT_1': 0.23335998585187123, 'WEIGHT_2': 0.2617849566601389, 'WEIGHT_3': 0.6013234727992505, 'WEIGHT_4': 0.935752694853641, 'WEIGHT_5': 0.6660648484608755, 'WEIGHT_6': 0.7343261401636612, 'WEIGHT_7': 0.35244928627815697, 'WEIGHT_8': 0.8622579184036168, 'optimizer': 'RMSprop'}
49
              precision    recall  f1-score   support

         LOC       0.57      0.55      0.56      1837
        MISC       0.43      0.44      0.43       922
         ORG       0.26      0.23      0.24      1341
         PER       0.30      0.35      0.32      1842

   micro avg       0.39      0.40      0.39      5942
   macro avg       0.39      0.39      0.39      5942
weighted avg       0.39      0.40      0.39      5942

epoch 49
LSTM
  0%|          | 0/50 [00:00<?, ?it/s]  2%|▏         | 1/50 [00:04<03:52,  4.74s/it]  4%|▍         | 2/50 [00:04<01:38,  2.05s/it]  6%|▌         | 3/50 [00:05<00:58,  1.25s/it]  8%|▊         | 4/50 [00:05<00:40,  1.15it/s] 10%|█         | 5/50 [00:05<00:29,  1.51it/s] 12%|█▏        | 6/50 [00:06<00:23,  1.87it/s] 14%|█▍        | 7/50 [00:06<00:19,  2.20it/s] 16%|█▌        | 8/50 [00:06<00:16,  2.49it/s] 18%|█▊        | 9/50 [00:06<00:15,  2.73it/s] 20%|██        | 10/50 [00:07<00:13,  2.92it/s] 22%|██▏       | 11/50 [00:07<00:12,  3.06it/s] 24%|██▍       | 12/50 [00:07<00:11,  3.17it/s] 26%|██▌       | 13/50 [00:08<00:11,  3.25it/s] 28%|██▊       | 14/50 [00:08<00:10,  3.31it/s] 30%|███       | 15/50 [00:08<00:10,  3.35it/s] 32%|███▏      | 16/50 [00:08<00:10,  3.38it/s] 34%|███▍      | 17/50 [00:09<00:09,  3.40it/s] 36%|███▌      | 18/50 [00:09<00:09,  3.42it/s] 38%|███▊      | 19/50 [00:09<00:09,  3.43it/s] 40%|████      | 20/50 [00:10<00:08,  3.44it/s] 42%|████▏     | 21/50 [00:10<00:08,  3.44it/s] 44%|████▍     | 22/50 [00:10<00:08,  3.44it/s] 46%|████▌     | 23/50 [00:10<00:07,  3.45it/s] 48%|████▊     | 24/50 [00:11<00:07,  3.45it/s] 50%|█████     | 25/50 [00:11<00:07,  3.44it/s] 52%|█████▏    | 26/50 [00:11<00:06,  3.45it/s] 54%|█████▍    | 27/50 [00:12<00:06,  3.45it/s] 56%|█████▌    | 28/50 [00:12<00:06,  3.45it/s] 58%|█████▊    | 29/50 [00:12<00:06,  3.44it/s] 60%|██████    | 30/50 [00:13<00:05,  3.45it/s] 62%|██████▏   | 31/50 [00:13<00:05,  3.45it/s] 64%|██████▍   | 32/50 [00:13<00:05,  3.44it/s] 66%|██████▌   | 33/50 [00:13<00:04,  3.44it/s] 68%|██████▊   | 34/50 [00:14<00:04,  3.45it/s] 70%|███████   | 35/50 [00:14<00:04,  3.45it/s] 72%|███████▏  | 36/50 [00:14<00:04,  3.45it/s] 74%|███████▍  | 37/50 [00:15<00:03,  3.44it/s] 76%|███████▌  | 38/50 [00:15<00:03,  3.44it/s] 78%|███████▊  | 39/50 [00:15<00:03,  3.44it/s] 80%|████████  | 40/50 [00:15<00:02,  3.44it/s] 82%|████████▏ | 41/50 [00:16<00:02,  3.44it/s] 84%|████████▍ | 42/50 [00:16<00:02,  3.44it/s] 86%|████████▌ | 43/50 [00:16<00:02,  3.44it/s] 88%|████████▊ | 44/50 [00:17<00:01,  3.44it/s] 90%|█████████ | 45/50 [00:17<00:01,  3.44it/s] 92%|█████████▏| 46/50 [00:17<00:01,  3.44it/s] 94%|█████████▍| 47/50 [00:17<00:00,  3.44it/s] 96%|█████████▌| 48/50 [00:18<00:00,  3.43it/s] 98%|█████████▊| 49/50 [00:18<00:00,  3.44it/s]100%|██████████| 50/50 [00:23<00:00,  1.66s/it]100%|██████████| 50/50 [00:23<00:00,  2.14it/s]
[I 2023-12-10 23:54:09,264] Trial 308 finished with value: 0.32993464052287585 and parameters: {'EMBEDDING_DIM': 960, 'HIDDEN_DIM': 454, 'NUM_LAYERS': 1, 'DROPOUT': 0.29422285196406556, 'LR': 0.003951413372540098, 'WEIGHT_0': 0.42519018873276715, 'WEIGHT_1': 0.6326940671941688, 'WEIGHT_2': 0.3130314239102127, 'WEIGHT_3': 0.7352103673478433, 'WEIGHT_4': 0.9030861545143176, 'WEIGHT_5': 0.6922730453918527, 'WEIGHT_6': 0.6719966280948023, 'WEIGHT_7': 0.5885536001349206, 'WEIGHT_8': 0.6328439289229245, 'optimizer': 'RMSprop'}. Best is trial 221 with value: 0.418736930154747.
/userhome/cs2/dingruiw/conda/envs/py310/lib/python3.10/site-packages/torch/nn/modules/rnn.py:82: UserWarning: dropout option adds dropout after all but last recurrent layer, so non-zero dropout expects num_layers greater than 1, but got dropout=0.37118983193034794 and num_layers=1
  warnings.warn("dropout option adds dropout after all but last "
{'EMBEDDING_DIM': 960, 'HIDDEN_DIM': 454, 'NUM_LAYERS': 1, 'DROPOUT': 0.29422285196406556, 'LR': 0.003951413372540098, 'WEIGHT_0': 0.42519018873276715, 'WEIGHT_1': 0.6326940671941688, 'WEIGHT_2': 0.3130314239102127, 'WEIGHT_3': 0.7352103673478433, 'WEIGHT_4': 0.9030861545143176, 'WEIGHT_5': 0.6922730453918527, 'WEIGHT_6': 0.6719966280948023, 'WEIGHT_7': 0.5885536001349206, 'WEIGHT_8': 0.6328439289229245, 'optimizer': 'RMSprop'}
0
              precision    recall  f1-score   support

         LOC       0.04      0.04      0.04      1837
        MISC       0.02      0.11      0.04       922
         ORG       0.03      0.02      0.02      1341
         PER       0.02      0.02      0.02      1842

   micro avg       0.02      0.04      0.03      5942
   macro avg       0.03      0.05      0.03      5942
weighted avg       0.03      0.04      0.03      5942

{'EMBEDDING_DIM': 960, 'HIDDEN_DIM': 454, 'NUM_LAYERS': 1, 'DROPOUT': 0.29422285196406556, 'LR': 0.003951413372540098, 'WEIGHT_0': 0.42519018873276715, 'WEIGHT_1': 0.6326940671941688, 'WEIGHT_2': 0.3130314239102127, 'WEIGHT_3': 0.7352103673478433, 'WEIGHT_4': 0.9030861545143176, 'WEIGHT_5': 0.6922730453918527, 'WEIGHT_6': 0.6719966280948023, 'WEIGHT_7': 0.5885536001349206, 'WEIGHT_8': 0.6328439289229245, 'optimizer': 'RMSprop'}
49
              precision    recall  f1-score   support

         LOC       0.57      0.47      0.52      1837
        MISC       0.43      0.32      0.37       922
         ORG       0.20      0.21      0.21      1341
         PER       0.23      0.24      0.23      1842

   micro avg       0.34      0.32      0.33      5942
   macro avg       0.36      0.31      0.33      5942
weighted avg       0.36      0.32      0.34      5942

epoch 49
LSTM
  0%|          | 0/50 [00:00<?, ?it/s]  2%|▏         | 1/50 [00:04<03:50,  4.70s/it]  6%|▌         | 3/50 [00:04<01:01,  1.32s/it]  8%|▊         | 4/50 [00:05<00:42,  1.09it/s] 10%|█         | 5/50 [00:05<00:30,  1.50it/s] 12%|█▏        | 6/50 [00:05<00:22,  1.98it/s] 14%|█▍        | 7/50 [00:05<00:17,  2.52it/s] 16%|█▌        | 8/50 [00:05<00:13,  3.08it/s] 18%|█▊        | 9/50 [00:05<00:11,  3.63it/s] 20%|██        | 10/50 [00:06<00:09,  4.14it/s] 22%|██▏       | 11/50 [00:06<00:08,  4.59it/s] 24%|██▍       | 12/50 [00:06<00:07,  4.97it/s] 26%|██▌       | 13/50 [00:06<00:07,  5.27it/s] 28%|██▊       | 14/50 [00:06<00:06,  5.49it/s] 30%|███       | 15/50 [00:06<00:06,  5.68it/s] 32%|███▏      | 16/50 [00:07<00:05,  5.81it/s] 34%|███▍      | 17/50 [00:07<00:05,  5.90it/s] 36%|███▌      | 18/50 [00:07<00:05,  5.96it/s] 38%|███▊      | 19/50 [00:07<00:05,  6.01it/s] 40%|████      | 20/50 [00:07<00:04,  6.05it/s] 42%|████▏     | 21/50 [00:07<00:04,  6.07it/s] 44%|████▍     | 22/50 [00:08<00:04,  6.08it/s] 46%|████▌     | 23/50 [00:08<00:04,  6.09it/s] 48%|████▊     | 24/50 [00:08<00:04,  6.10it/s] 50%|█████     | 25/50 [00:08<00:04,  6.10it/s] 52%|█████▏    | 26/50 [00:08<00:03,  6.10it/s] 54%|█████▍    | 27/50 [00:08<00:03,  6.10it/s] 56%|█████▌    | 28/50 [00:09<00:03,  6.11it/s] 58%|█████▊    | 29/50 [00:09<00:03,  6.11it/s] 60%|██████    | 30/50 [00:09<00:03,  6.11it/s] 62%|██████▏   | 31/50 [00:09<00:03,  6.11it/s] 64%|██████▍   | 32/50 [00:09<00:02,  6.11it/s] 66%|██████▌   | 33/50 [00:09<00:02,  6.11it/s] 68%|██████▊   | 34/50 [00:10<00:02,  6.10it/s] 70%|███████   | 35/50 [00:10<00:02,  6.11it/s] 72%|███████▏  | 36/50 [00:10<00:02,  6.11it/s] 74%|███████▍  | 37/50 [00:10<00:02,  6.11it/s] 76%|███████▌  | 38/50 [00:10<00:01,  6.11it/s] 78%|███████▊  | 39/50 [00:10<00:01,  6.11it/s] 80%|████████  | 40/50 [00:11<00:01,  6.10it/s] 82%|████████▏ | 41/50 [00:11<00:01,  6.10it/s] 84%|████████▍ | 42/50 [00:11<00:01,  6.10it/s] 86%|████████▌ | 43/50 [00:11<00:01,  6.10it/s] 88%|████████▊ | 44/50 [00:11<00:00,  6.11it/s] 90%|█████████ | 45/50 [00:11<00:00,  6.11it/s] 92%|█████████▏| 46/50 [00:11<00:00,  6.11it/s] 94%|█████████▍| 47/50 [00:12<00:00,  6.11it/s] 96%|█████████▌| 48/50 [00:12<00:00,  6.11it/s] 98%|█████████▊| 49/50 [00:12<00:00,  6.11it/s]100%|██████████| 50/50 [00:17<00:00,  1.49s/it]100%|██████████| 50/50 [00:17<00:00,  2.93it/s]
