[I 2023-12-11 00:12:03,674] Trial 349 finished with value: 0.3911617469359572 and parameters: {'EMBEDDING_DIM': 865, 'HIDDEN_DIM': 379, 'NUM_LAYERS': 1, 'DROPOUT': 0.041595274577397714, 'LR': 0.0024376743117087312, 'WEIGHT_0': 0.2952024578034287, 'WEIGHT_1': 0.5392366472941245, 'WEIGHT_2': 0.5224474889715081, 'WEIGHT_3': 0.7741817802635942, 'WEIGHT_4': 0.796481423793362, 'WEIGHT_5': 0.44510279418208304, 'WEIGHT_6': 0.7533799999589851, 'WEIGHT_7': 0.253111477383977, 'WEIGHT_8': 0.9337779853596738, 'optimizer': 'RMSprop'}. Best is trial 221 with value: 0.418736930154747.
/userhome/cs2/dingruiw/conda/envs/py310/lib/python3.10/site-packages/torch/nn/modules/rnn.py:82: UserWarning: dropout option adds dropout after all but last recurrent layer, so non-zero dropout expects num_layers greater than 1, but got dropout=0.044300181091659896 and num_layers=1
  warnings.warn("dropout option adds dropout after all but last "
{'EMBEDDING_DIM': 865, 'HIDDEN_DIM': 379, 'NUM_LAYERS': 1, 'DROPOUT': 0.041595274577397714, 'LR': 0.0024376743117087312, 'WEIGHT_0': 0.2952024578034287, 'WEIGHT_1': 0.5392366472941245, 'WEIGHT_2': 0.5224474889715081, 'WEIGHT_3': 0.7741817802635942, 'WEIGHT_4': 0.796481423793362, 'WEIGHT_5': 0.44510279418208304, 'WEIGHT_6': 0.7533799999589851, 'WEIGHT_7': 0.253111477383977, 'WEIGHT_8': 0.9337779853596738, 'optimizer': 'RMSprop'}
0
              precision    recall  f1-score   support

         LOC       0.26      0.17      0.20      1837
        MISC       0.04      0.04      0.04       922
         ORG       0.06      0.03      0.04      1341
         PER       0.03      0.07      0.04      1842

   micro avg       0.08      0.08      0.08      5942
   macro avg       0.10      0.07      0.08      5942
weighted avg       0.11      0.08      0.09      5942

{'EMBEDDING_DIM': 865, 'HIDDEN_DIM': 379, 'NUM_LAYERS': 1, 'DROPOUT': 0.041595274577397714, 'LR': 0.0024376743117087312, 'WEIGHT_0': 0.2952024578034287, 'WEIGHT_1': 0.5392366472941245, 'WEIGHT_2': 0.5224474889715081, 'WEIGHT_3': 0.7741817802635942, 'WEIGHT_4': 0.796481423793362, 'WEIGHT_5': 0.44510279418208304, 'WEIGHT_6': 0.7533799999589851, 'WEIGHT_7': 0.253111477383977, 'WEIGHT_8': 0.9337779853596738, 'optimizer': 'RMSprop'}
49
              precision    recall  f1-score   support

         LOC       0.60      0.53      0.56      1837
        MISC       0.38      0.41      0.39       922
         ORG       0.28      0.24      0.26      1341
         PER       0.32      0.32      0.32      1842

   micro avg       0.40      0.38      0.39      5942
   macro avg       0.39      0.37      0.38      5942
weighted avg       0.41      0.38      0.39      5942

epoch 49
LSTM
  0%|          | 0/50 [00:00<?, ?it/s]  2%|▏         | 1/50 [00:06<05:07,  6.27s/it]  4%|▍         | 2/50 [00:06<02:16,  2.84s/it]  6%|▌         | 3/50 [00:07<01:32,  1.96s/it]  8%|▊         | 4/50 [00:08<01:11,  1.55s/it] 10%|█         | 5/50 [00:09<00:59,  1.32s/it] 12%|█▏        | 6/50 [00:10<00:52,  1.18s/it] 14%|█▍        | 7/50 [00:11<00:47,  1.10s/it] 16%|█▌        | 8/50 [00:12<00:43,  1.04s/it] 18%|█▊        | 9/50 [00:13<00:41,  1.01s/it] 20%|██        | 10/50 [00:14<00:39,  1.02it/s] 22%|██▏       | 11/50 [00:14<00:37,  1.04it/s] 24%|██▍       | 12/50 [00:15<00:35,  1.06it/s] 26%|██▌       | 13/50 [00:16<00:34,  1.06it/s] 28%|██▊       | 14/50 [00:17<00:33,  1.07it/s] 30%|███       | 15/50 [00:18<00:32,  1.07it/s] 32%|███▏      | 16/50 [00:19<00:31,  1.08it/s] 34%|███▍      | 17/50 [00:20<00:30,  1.08it/s] 36%|███▌      | 18/50 [00:21<00:29,  1.08it/s] 38%|███▊      | 19/50 [00:22<00:28,  1.08it/s] 40%|████      | 20/50 [00:23<00:27,  1.08it/s] 42%|████▏     | 21/50 [00:24<00:26,  1.08it/s] 44%|████▍     | 22/50 [00:25<00:26,  1.07it/s] 46%|████▌     | 23/50 [00:26<00:25,  1.07it/s] 48%|████▊     | 24/50 [00:27<00:24,  1.08it/s] 50%|█████     | 25/50 [00:27<00:23,  1.08it/s] 52%|█████▏    | 26/50 [00:28<00:22,  1.08it/s] 54%|█████▍    | 27/50 [00:29<00:21,  1.08it/s] 56%|█████▌    | 28/50 [00:30<00:20,  1.08it/s] 58%|█████▊    | 29/50 [00:31<00:19,  1.08it/s] 60%|██████    | 30/50 [00:32<00:18,  1.08it/s] 62%|██████▏   | 31/50 [00:33<00:17,  1.07it/s] 64%|██████▍   | 32/50 [00:34<00:16,  1.07it/s] 66%|██████▌   | 33/50 [00:35<00:15,  1.07it/s] 68%|██████▊   | 34/50 [00:36<00:14,  1.07it/s] 70%|███████   | 35/50 [00:37<00:13,  1.07it/s] 72%|███████▏  | 36/50 [00:38<00:13,  1.07it/s] 74%|███████▍  | 37/50 [00:39<00:12,  1.07it/s] 76%|███████▌  | 38/50 [00:40<00:11,  1.07it/s] 78%|███████▊  | 39/50 [00:41<00:10,  1.07it/s] 80%|████████  | 40/50 [00:41<00:09,  1.07it/s] 82%|████████▏ | 41/50 [00:42<00:08,  1.06it/s] 84%|████████▍ | 42/50 [00:43<00:07,  1.06it/s] 86%|████████▌ | 43/50 [00:44<00:06,  1.06it/s] 88%|████████▊ | 44/50 [00:45<00:05,  1.06it/s] 90%|█████████ | 45/50 [00:46<00:04,  1.06it/s] 92%|█████████▏| 46/50 [00:47<00:03,  1.05it/s] 94%|█████████▍| 47/50 [00:48<00:02,  1.05it/s] 96%|█████████▌| 48/50 [00:49<00:01,  1.05it/s] 98%|█████████▊| 49/50 [00:50<00:00,  1.05it/s]100%|██████████| 50/50 [00:57<00:00,  2.70s/it]100%|██████████| 50/50 [00:57<00:00,  1.15s/it]
[I 2023-12-11 00:13:06,213] Trial 350 finished with value: 0.21421746608064204 and parameters: {'EMBEDDING_DIM': 889, 'HIDDEN_DIM': 1164, 'NUM_LAYERS': 1, 'DROPOUT': 0.044300181091659896, 'LR': 0.002885034738616808, 'WEIGHT_0': 0.23816511550878805, 'WEIGHT_1': 0.5501551724692451, 'WEIGHT_2': 0.16808863031415544, 'WEIGHT_3': 0.7548253261975854, 'WEIGHT_4': 0.00335022523923334, 'WEIGHT_5': 0.46269218803959355, 'WEIGHT_6': 0.7223711321283345, 'WEIGHT_7': 0.29608775783592495, 'WEIGHT_8': 0.954895496276293, 'optimizer': 'RMSprop'}. Best is trial 221 with value: 0.418736930154747.
{'EMBEDDING_DIM': 889, 'HIDDEN_DIM': 1164, 'NUM_LAYERS': 1, 'DROPOUT': 0.044300181091659896, 'LR': 0.002885034738616808, 'WEIGHT_0': 0.23816511550878805, 'WEIGHT_1': 0.5501551724692451, 'WEIGHT_2': 0.16808863031415544, 'WEIGHT_3': 0.7548253261975854, 'WEIGHT_4': 0.00335022523923334, 'WEIGHT_5': 0.46269218803959355, 'WEIGHT_6': 0.7223711321283345, 'WEIGHT_7': 0.29608775783592495, 'WEIGHT_8': 0.954895496276293, 'optimizer': 'RMSprop'}
0
              precision    recall  f1-score   support

         LOC       0.13      0.01      0.02      1837
        MISC       0.04      0.01      0.01       922
         ORG       0.13      0.01      0.03      1341
         PER       0.03      0.01      0.02      1842

   micro avg       0.06      0.01      0.02      5942
   macro avg       0.08      0.01      0.02      5942
weighted avg       0.09      0.01      0.02      5942

{'EMBEDDING_DIM': 889, 'HIDDEN_DIM': 1164, 'NUM_LAYERS': 1, 'DROPOUT': 0.044300181091659896, 'LR': 0.002885034738616808, 'WEIGHT_0': 0.23816511550878805, 'WEIGHT_1': 0.5501551724692451, 'WEIGHT_2': 0.16808863031415544, 'WEIGHT_3': 0.7548253261975854, 'WEIGHT_4': 0.00335022523923334, 'WEIGHT_5': 0.46269218803959355, 'WEIGHT_6': 0.7223711321283345, 'WEIGHT_7': 0.29608775783592495, 'WEIGHT_8': 0.954895496276293, 'optimizer': 'RMSprop'}
49
              precision    recall  f1-score   support

         LOC       0.50      0.36      0.42      1837
        MISC       0.36      0.12      0.18       922
         ORG       0.23      0.16      0.19      1341
         PER       0.06      0.07      0.06      1842

   micro avg       0.25      0.19      0.21      5942
   macro avg       0.29      0.18      0.21      5942
weighted avg       0.28      0.19      0.22      5942

epoch 49
LSTM
  0%|          | 0/50 [00:00<?, ?it/s]  2%|▏         | 1/50 [00:06<05:13,  6.41s/it]  4%|▍         | 2/50 [00:06<02:13,  2.78s/it]  6%|▌         | 3/50 [00:07<01:20,  1.72s/it]  8%|▊         | 4/50 [00:07<00:56,  1.22s/it] 10%|█         | 5/50 [00:08<00:42,  1.06it/s] 12%|█▏        | 6/50 [00:08<00:34,  1.29it/s] 14%|█▍        | 7/50 [00:08<00:28,  1.49it/s] 16%|█▌        | 8/50 [00:09<00:25,  1.65it/s] 18%|█▊        | 9/50 [00:09<00:22,  1.79it/s] 20%|██        | 10/50 [00:10<00:21,  1.90it/s] 22%|██▏       | 11/50 [00:10<00:19,  1.98it/s] 24%|██▍       | 12/50 [00:11<00:18,  2.04it/s] 26%|██▌       | 13/50 [00:11<00:17,  2.09it/s] 28%|██▊       | 14/50 [00:12<00:17,  2.11it/s] 30%|███       | 15/50 [00:12<00:16,  2.13it/s] 32%|███▏      | 16/50 [00:13<00:15,  2.15it/s] 34%|███▍      | 17/50 [00:13<00:15,  2.16it/s] 36%|███▌      | 18/50 [00:13<00:14,  2.16it/s] 38%|███▊      | 19/50 [00:14<00:14,  2.17it/s] 40%|████      | 20/50 [00:14<00:13,  2.17it/s] 42%|████▏     | 21/50 [00:15<00:13,  2.17it/s] 44%|████▍     | 22/50 [00:15<00:12,  2.18it/s] 46%|████▌     | 23/50 [00:16<00:12,  2.19it/s] 48%|████▊     | 24/50 [00:16<00:11,  2.18it/s] 50%|█████     | 25/50 [00:17<00:11,  2.18it/s] 52%|█████▏    | 26/50 [00:17<00:10,  2.18it/s] 54%|█████▍    | 27/50 [00:18<00:10,  2.19it/s] 56%|█████▌    | 28/50 [00:18<00:10,  2.19it/s] 58%|█████▊    | 29/50 [00:18<00:09,  2.18it/s] 60%|██████    | 30/50 [00:19<00:09,  2.18it/s] 62%|██████▏   | 31/50 [00:19<00:08,  2.18it/s] 64%|██████▍   | 32/50 [00:20<00:08,  2.18it/s] 66%|██████▌   | 33/50 [00:20<00:07,  2.18it/s] 68%|██████▊   | 34/50 [00:21<00:07,  2.18it/s] 70%|███████   | 35/50 [00:21<00:06,  2.18it/s] 72%|███████▏  | 36/50 [00:22<00:06,  2.18it/s] 74%|███████▍  | 37/50 [00:22<00:05,  2.18it/s] 76%|███████▌  | 38/50 [00:23<00:05,  2.17it/s] 78%|███████▊  | 39/50 [00:23<00:05,  2.18it/s] 80%|████████  | 40/50 [00:24<00:04,  2.18it/s] 82%|████████▏ | 41/50 [00:24<00:04,  2.18it/s] 84%|████████▍ | 42/50 [00:24<00:03,  2.18it/s] 86%|████████▌ | 43/50 [00:25<00:03,  2.18it/s] 88%|████████▊ | 44/50 [00:25<00:02,  2.19it/s] 90%|█████████ | 45/50 [00:26<00:02,  2.18it/s] 92%|█████████▏| 46/50 [00:26<00:01,  2.18it/s] 94%|█████████▍| 47/50 [00:27<00:01,  2.18it/s] 96%|█████████▌| 48/50 [00:27<00:00,  2.18it/s] 98%|█████████▊| 49/50 [00:28<00:00,  2.18it/s]100%|██████████| 50/50 [00:34<00:00,  2.28s/it]100%|██████████| 50/50 [00:34<00:00,  1.44it/s]
[I 2023-12-11 00:13:46,597] Trial 351 finished with value: 0.1854991775275212 and parameters: {'EMBEDDING_DIM': 918, 'HIDDEN_DIM': 335, 'NUM_LAYERS': 3, 'DROPOUT': 0.06831271719592244, 'LR': 0.002604952582234194, 'WEIGHT_0': 0.11178984426146171, 'WEIGHT_1': 0.47455686006238645, 'WEIGHT_2': 0.44459859815120706, 'WEIGHT_3': 0.7832777871427727, 'WEIGHT_4': 0.9505658002156772, 'WEIGHT_5': 0.23395234639847062, 'WEIGHT_6': 0.7037688374723923, 'WEIGHT_7': 0.2824675764184363, 'WEIGHT_8': 0.956477527752287, 'optimizer': 'RMSprop'}. Best is trial 221 with value: 0.418736930154747.
/userhome/cs2/dingruiw/conda/envs/py310/lib/python3.10/site-packages/torch/nn/modules/rnn.py:82: UserWarning: dropout option adds dropout after all but last recurrent layer, so non-zero dropout expects num_layers greater than 1, but got dropout=0.025881233703013495 and num_layers=1
  warnings.warn("dropout option adds dropout after all but last "
{'EMBEDDING_DIM': 918, 'HIDDEN_DIM': 335, 'NUM_LAYERS': 3, 'DROPOUT': 0.06831271719592244, 'LR': 0.002604952582234194, 'WEIGHT_0': 0.11178984426146171, 'WEIGHT_1': 0.47455686006238645, 'WEIGHT_2': 0.44459859815120706, 'WEIGHT_3': 0.7832777871427727, 'WEIGHT_4': 0.9505658002156772, 'WEIGHT_5': 0.23395234639847062, 'WEIGHT_6': 0.7037688374723923, 'WEIGHT_7': 0.2824675764184363, 'WEIGHT_8': 0.956477527752287, 'optimizer': 'RMSprop'}
0
              precision    recall  f1-score   support

         LOC       0.00      0.00      0.00      1837
        MISC       0.25      0.00      0.00       922
         ORG       0.00      0.00      0.00      1341
         PER       0.00      0.00      0.00      1842

   micro avg       0.17      0.00      0.00      5942
   macro avg       0.06      0.00      0.00      5942
weighted avg       0.04      0.00      0.00      5942

{'EMBEDDING_DIM': 918, 'HIDDEN_DIM': 335, 'NUM_LAYERS': 3, 'DROPOUT': 0.06831271719592244, 'LR': 0.002604952582234194, 'WEIGHT_0': 0.11178984426146171, 'WEIGHT_1': 0.47455686006238645, 'WEIGHT_2': 0.44459859815120706, 'WEIGHT_3': 0.7832777871427727, 'WEIGHT_4': 0.9505658002156772, 'WEIGHT_5': 0.23395234639847062, 'WEIGHT_6': 0.7037688374723923, 'WEIGHT_7': 0.2824675764184363, 'WEIGHT_8': 0.956477527752287, 'optimizer': 'RMSprop'}
49
              precision    recall  f1-score   support

         LOC       0.27      0.26      0.26      1837
        MISC       0.07      0.17      0.09       922
         ORG       0.12      0.17      0.14      1341
         PER       0.16      0.33      0.22      1842

   micro avg       0.15      0.25      0.19      5942
   macro avg       0.15      0.23      0.18      5942
weighted avg       0.17      0.25      0.19      5942

epoch 49
LSTM
  0%|          | 0/50 [00:00<?, ?it/s]  2%|▏         | 1/50 [00:04<04:00,  4.90s/it]  4%|▍         | 2/50 [00:05<01:41,  2.11s/it]  6%|▌         | 3/50 [00:05<01:00,  1.28s/it]  8%|▊         | 4/50 [00:05<00:40,  1.13it/s] 10%|█         | 5/50 [00:05<00:30,  1.49it/s] 12%|█▏        | 6/50 [00:06<00:23,  1.85it/s] 14%|█▍        | 7/50 [00:06<00:19,  2.19it/s] 16%|█▌        | 8/50 [00:06<00:16,  2.48it/s] 18%|█▊        | 9/50 [00:07<00:15,  2.73it/s] 20%|██        | 10/50 [00:07<00:13,  2.92it/s] 22%|██▏       | 11/50 [00:07<00:12,  3.07it/s] 24%|██▍       | 12/50 [00:07<00:11,  3.18it/s] 26%|██▌       | 13/50 [00:08<00:11,  3.26it/s] 28%|██▊       | 14/50 [00:08<00:10,  3.32it/s] 30%|███       | 15/50 [00:08<00:10,  3.36it/s] 32%|███▏      | 16/50 [00:09<00:10,  3.39it/s] 34%|███▍      | 17/50 [00:09<00:09,  3.42it/s] 36%|███▌      | 18/50 [00:09<00:09,  3.43it/s] 38%|███▊      | 19/50 [00:09<00:09,  3.43it/s] 40%|████      | 20/50 [00:10<00:08,  3.44it/s] 42%|████▏     | 21/50 [00:10<00:08,  3.45it/s] 44%|████▍     | 22/50 [00:10<00:08,  3.46it/s] 46%|████▌     | 23/50 [00:11<00:07,  3.45it/s] 48%|████▊     | 24/50 [00:11<00:07,  3.45it/s] 50%|█████     | 25/50 [00:11<00:07,  3.46it/s] 52%|█████▏    | 26/50 [00:11<00:06,  3.47it/s] 54%|█████▍    | 27/50 [00:12<00:06,  3.46it/s] 56%|█████▌    | 28/50 [00:12<00:06,  3.46it/s] 58%|█████▊    | 29/50 [00:12<00:06,  3.46it/s] 60%|██████    | 30/50 [00:13<00:05,  3.47it/s] 62%|██████▏   | 31/50 [00:13<00:05,  3.46it/s] 64%|██████▍   | 32/50 [00:13<00:05,  3.46it/s] 66%|██████▌   | 33/50 [00:14<00:04,  3.46it/s] 68%|██████▊   | 34/50 [00:14<00:04,  3.46it/s] 70%|███████   | 35/50 [00:14<00:04,  3.46it/s] 72%|███████▏  | 36/50 [00:14<00:04,  3.46it/s] 74%|███████▍  | 37/50 [00:15<00:03,  3.45it/s] 76%|███████▌  | 38/50 [00:15<00:03,  3.46it/s] 78%|███████▊  | 39/50 [00:15<00:03,  3.45it/s] 80%|████████  | 40/50 [00:16<00:02,  3.45it/s] 82%|████████▏ | 41/50 [00:16<00:02,  3.45it/s] 84%|████████▍ | 42/50 [00:16<00:02,  3.44it/s] 86%|████████▌ | 43/50 [00:16<00:02,  3.44it/s] 88%|████████▊ | 44/50 [00:17<00:01,  3.44it/s] 90%|█████████ | 45/50 [00:17<00:01,  3.44it/s] 92%|█████████▏| 46/50 [00:17<00:01,  3.44it/s] 94%|█████████▍| 47/50 [00:18<00:00,  3.45it/s] 96%|█████████▌| 48/50 [00:18<00:00,  3.44it/s] 98%|█████████▊| 49/50 [00:18<00:00,  3.44it/s]100%|██████████| 50/50 [00:23<00:00,  1.68s/it]100%|██████████| 50/50 [00:23<00:00,  2.12it/s]
[I 2023-12-11 00:14:14,456] Trial 352 finished with value: 0.3719992991063606 and parameters: {'EMBEDDING_DIM': 995, 'HIDDEN_DIM': 430, 'NUM_LAYERS': 1, 'DROPOUT': 0.025881233703013495, 'LR': 0.0034502526433804405, 'WEIGHT_0': 0.24863690932648586, 'WEIGHT_1': 0.5189804489133034, 'WEIGHT_2': 0.3022288225990004, 'WEIGHT_3': 0.38015723635102944, 'WEIGHT_4': 0.7486759165409803, 'WEIGHT_5': 0.4155974178379219, 'WEIGHT_6': 0.8940086614368618, 'WEIGHT_7': 0.8723828898459238, 'WEIGHT_8': 0.9182392522086366, 'optimizer': 'RMSprop'}. Best is trial 221 with value: 0.418736930154747.
/userhome/cs2/dingruiw/conda/envs/py310/lib/python3.10/site-packages/torch/nn/modules/rnn.py:82: UserWarning: dropout option adds dropout after all but last recurrent layer, so non-zero dropout expects num_layers greater than 1, but got dropout=0.1030291609847058 and num_layers=1
  warnings.warn("dropout option adds dropout after all but last "
{'EMBEDDING_DIM': 995, 'HIDDEN_DIM': 430, 'NUM_LAYERS': 1, 'DROPOUT': 0.025881233703013495, 'LR': 0.0034502526433804405, 'WEIGHT_0': 0.24863690932648586, 'WEIGHT_1': 0.5189804489133034, 'WEIGHT_2': 0.3022288225990004, 'WEIGHT_3': 0.38015723635102944, 'WEIGHT_4': 0.7486759165409803, 'WEIGHT_5': 0.4155974178379219, 'WEIGHT_6': 0.8940086614368618, 'WEIGHT_7': 0.8723828898459238, 'WEIGHT_8': 0.9182392522086366, 'optimizer': 'RMSprop'}
0
              precision    recall  f1-score   support

         LOC       0.03      0.03      0.03      1837
        MISC       0.00      0.01      0.00       922
         ORG       0.09      0.03      0.05      1341
         PER       0.02      0.02      0.02      1842

   micro avg       0.03      0.03      0.03      5942
   macro avg       0.04      0.02      0.03      5942
weighted avg       0.04      0.03      0.03      5942

{'EMBEDDING_DIM': 995, 'HIDDEN_DIM': 430, 'NUM_LAYERS': 1, 'DROPOUT': 0.025881233703013495, 'LR': 0.0034502526433804405, 'WEIGHT_0': 0.24863690932648586, 'WEIGHT_1': 0.5189804489133034, 'WEIGHT_2': 0.3022288225990004, 'WEIGHT_3': 0.38015723635102944, 'WEIGHT_4': 0.7486759165409803, 'WEIGHT_5': 0.4155974178379219, 'WEIGHT_6': 0.8940086614368618, 'WEIGHT_7': 0.8723828898459238, 'WEIGHT_8': 0.9182392522086366, 'optimizer': 'RMSprop'}
49
              precision    recall  f1-score   support

         LOC       0.55      0.51      0.53      1837
        MISC       0.38      0.38      0.38       922
         ORG       0.28      0.24      0.25      1341
         PER       0.31      0.28      0.29      1842

   micro avg       0.39      0.36      0.37      5942
   macro avg       0.38      0.35      0.36      5942
weighted avg       0.39      0.36      0.37      5942

epoch 49
LSTM
  0%|          | 0/50 [00:00<?, ?it/s]  2%|▏         | 1/50 [00:04<03:42,  4.55s/it]  6%|▌         | 3/50 [00:04<00:59,  1.28s/it]  8%|▊         | 4/50 [00:04<00:40,  1.12it/s] 10%|█         | 5/50 [00:05<00:29,  1.54it/s] 12%|█▏        | 6/50 [00:05<00:21,  2.04it/s] 14%|█▍        | 7/50 [00:05<00:16,  2.59it/s] 16%|█▌        | 8/50 [00:05<00:13,  3.16it/s] 18%|█▊        | 9/50 [00:05<00:11,  3.72it/s] 20%|██        | 10/50 [00:05<00:09,  4.25it/s] 22%|██▏       | 11/50 [00:06<00:08,  4.71it/s] 24%|██▍       | 12/50 [00:06<00:07,  5.08it/s] 26%|██▌       | 13/50 [00:06<00:06,  5.39it/s] 28%|██▊       | 14/50 [00:06<00:06,  5.62it/s] 30%|███       | 15/50 [00:06<00:06,  5.79it/s] 32%|███▏      | 16/50 [00:06<00:05,  5.92it/s] 34%|███▍      | 17/50 [00:07<00:05,  6.02it/s] 36%|███▌      | 18/50 [00:07<00:05,  6.08it/s] 38%|███▊      | 19/50 [00:07<00:05,  6.14it/s] 40%|████      | 20/50 [00:07<00:04,  6.17it/s] 42%|████▏     | 21/50 [00:07<00:04,  6.19it/s] 44%|████▍     | 22/50 [00:07<00:04,  6.21it/s] 46%|████▌     | 23/50 [00:08<00:04,  6.22it/s] 48%|████▊     | 24/50 [00:08<00:04,  6.23it/s] 50%|█████     | 25/50 [00:08<00:04,  6.23it/s] 52%|█████▏    | 26/50 [00:08<00:03,  6.22it/s] 54%|█████▍    | 27/50 [00:08<00:03,  6.23it/s] 56%|█████▌    | 28/50 [00:08<00:03,  6.23it/s] 58%|█████▊    | 29/50 [00:08<00:03,  6.22it/s] 60%|██████    | 30/50 [00:09<00:03,  6.23it/s] 62%|██████▏   | 31/50 [00:09<00:03,  6.23it/s] 64%|██████▍   | 32/50 [00:09<00:02,  6.23it/s] 66%|██████▌   | 33/50 [00:09<00:02,  6.24it/s] 68%|██████▊   | 34/50 [00:09<00:02,  6.24it/s] 70%|███████   | 35/50 [00:09<00:02,  6.24it/s] 72%|███████▏  | 36/50 [00:10<00:02,  6.24it/s] 74%|███████▍  | 37/50 [00:10<00:02,  6.24it/s] 76%|███████▌  | 38/50 [00:10<00:01,  6.23it/s] 78%|███████▊  | 39/50 [00:10<00:01,  6.24it/s] 80%|████████  | 40/50 [00:10<00:01,  6.23it/s] 82%|████████▏ | 41/50 [00:10<00:01,  6.23it/s] 84%|████████▍ | 42/50 [00:11<00:01,  6.23it/s] 86%|████████▌ | 43/50 [00:11<00:01,  6.24it/s] 88%|████████▊ | 44/50 [00:11<00:00,  6.23it/s] 90%|█████████ | 45/50 [00:11<00:00,  6.24it/s] 92%|█████████▏| 46/50 [00:11<00:00,  6.24it/s] 94%|█████████▍| 47/50 [00:11<00:00,  6.22it/s] 96%|█████████▌| 48/50 [00:12<00:00,  6.23it/s] 98%|█████████▊| 49/50 [00:12<00:00,  6.24it/s]100%|██████████| 50/50 [00:17<00:00,  1.57s/it]100%|██████████| 50/50 [00:17<00:00,  2.94it/s]
