[I 2023-12-10 21:55:44,530] Trial 77 finished with value: 0.4122349669794926 and parameters: {'EMBEDDING_DIM': 1004, 'HIDDEN_DIM': 528, 'NUM_LAYERS': 1, 'DROPOUT': 0.3425188410998581, 'LR': 0.0009424179940291473, 'WEIGHT_0': 0.3810380107485205, 'WEIGHT_1': 0.5833274568759776, 'WEIGHT_2': 0.5098694308179745, 'WEIGHT_3': 0.8584354738005006, 'WEIGHT_4': 0.9252597905439524, 'WEIGHT_5': 0.5148078710962872, 'WEIGHT_6': 0.9410427300647881, 'WEIGHT_7': 0.3413613908388867, 'WEIGHT_8': 0.4087507032718991, 'optimizer': 'RMSprop'}. Best is trial 51 with value: 0.41438326562364947.
/userhome/cs2/dingruiw/conda/envs/py310/lib/python3.10/site-packages/torch/nn/modules/rnn.py:82: UserWarning: dropout option adds dropout after all but last recurrent layer, so non-zero dropout expects num_layers greater than 1, but got dropout=0.3273327568887112 and num_layers=1
  warnings.warn("dropout option adds dropout after all but last "
{'EMBEDDING_DIM': 1004, 'HIDDEN_DIM': 528, 'NUM_LAYERS': 1, 'DROPOUT': 0.3425188410998581, 'LR': 0.0009424179940291473, 'WEIGHT_0': 0.3810380107485205, 'WEIGHT_1': 0.5833274568759776, 'WEIGHT_2': 0.5098694308179745, 'WEIGHT_3': 0.8584354738005006, 'WEIGHT_4': 0.9252597905439524, 'WEIGHT_5': 0.5148078710962872, 'WEIGHT_6': 0.9410427300647881, 'WEIGHT_7': 0.3413613908388867, 'WEIGHT_8': 0.4087507032718991, 'optimizer': 'RMSprop'}
0
              precision    recall  f1-score   support

         LOC       0.25      0.16      0.19      1837
        MISC       0.04      0.02      0.03       922
         ORG       0.13      0.04      0.06      1341
         PER       0.05      0.04      0.04      1842

   micro avg       0.12      0.07      0.09      5942
   macro avg       0.12      0.06      0.08      5942
weighted avg       0.13      0.07      0.09      5942

{'EMBEDDING_DIM': 1004, 'HIDDEN_DIM': 528, 'NUM_LAYERS': 1, 'DROPOUT': 0.3425188410998581, 'LR': 0.0009424179940291473, 'WEIGHT_0': 0.3810380107485205, 'WEIGHT_1': 0.5833274568759776, 'WEIGHT_2': 0.5098694308179745, 'WEIGHT_3': 0.8584354738005006, 'WEIGHT_4': 0.9252597905439524, 'WEIGHT_5': 0.5148078710962872, 'WEIGHT_6': 0.9410427300647881, 'WEIGHT_7': 0.3413613908388867, 'WEIGHT_8': 0.4087507032718991, 'optimizer': 'RMSprop'}
49
              precision    recall  f1-score   support

         LOC       0.59      0.53      0.56      1837
        MISC       0.46      0.45      0.46       922
         ORG       0.28      0.25      0.26      1341
         PER       0.36      0.36      0.36      1842

   micro avg       0.43      0.40      0.41      5942
   macro avg       0.42      0.40      0.41      5942
weighted avg       0.43      0.40      0.41      5942

epoch 49
LSTM
  0%|          | 0/50 [00:00<?, ?it/s]  2%|▏         | 1/50 [00:04<04:02,  4.96s/it]  4%|▍         | 2/50 [00:05<01:43,  2.15s/it]  6%|▌         | 3/50 [00:05<01:02,  1.32s/it]  8%|▊         | 4/50 [00:05<00:42,  1.08it/s] 10%|█         | 5/50 [00:06<00:32,  1.40it/s] 12%|█▏        | 6/50 [00:06<00:25,  1.71it/s] 14%|█▍        | 7/50 [00:06<00:21,  2.00it/s] 16%|█▌        | 8/50 [00:07<00:18,  2.24it/s] 18%|█▊        | 9/50 [00:07<00:16,  2.43it/s] 20%|██        | 10/50 [00:07<00:15,  2.59it/s] 22%|██▏       | 11/50 [00:08<00:14,  2.70it/s] 24%|██▍       | 12/50 [00:08<00:13,  2.79it/s] 26%|██▌       | 13/50 [00:08<00:12,  2.86it/s] 28%|██▊       | 14/50 [00:09<00:12,  2.90it/s] 30%|███       | 15/50 [00:09<00:11,  2.93it/s] 32%|███▏      | 16/50 [00:09<00:11,  2.96it/s] 34%|███▍      | 17/50 [00:10<00:11,  2.98it/s] 36%|███▌      | 18/50 [00:10<00:10,  2.99it/s] 38%|███▊      | 19/50 [00:10<00:10,  3.00it/s] 40%|████      | 20/50 [00:11<00:09,  3.00it/s] 42%|████▏     | 21/50 [00:11<00:09,  3.01it/s] 44%|████▍     | 22/50 [00:11<00:09,  3.01it/s] 46%|████▌     | 23/50 [00:12<00:08,  3.01it/s] 48%|████▊     | 24/50 [00:12<00:08,  3.01it/s] 50%|█████     | 25/50 [00:12<00:08,  3.01it/s] 52%|█████▏    | 26/50 [00:13<00:07,  3.01it/s] 54%|█████▍    | 27/50 [00:13<00:07,  3.01it/s] 56%|█████▌    | 28/50 [00:13<00:07,  3.01it/s] 58%|█████▊    | 29/50 [00:14<00:06,  3.01it/s] 60%|██████    | 30/50 [00:14<00:06,  3.01it/s] 62%|██████▏   | 31/50 [00:14<00:06,  3.01it/s] 64%|██████▍   | 32/50 [00:15<00:05,  3.00it/s] 66%|██████▌   | 33/50 [00:15<00:05,  3.01it/s] 68%|██████▊   | 34/50 [00:15<00:05,  3.00it/s] 70%|███████   | 35/50 [00:16<00:04,  3.00it/s] 72%|███████▏  | 36/50 [00:16<00:04,  3.00it/s] 74%|███████▍  | 37/50 [00:16<00:04,  3.00it/s] 76%|███████▌  | 38/50 [00:17<00:04,  3.00it/s] 78%|███████▊  | 39/50 [00:17<00:03,  3.00it/s] 80%|████████  | 40/50 [00:17<00:03,  3.00it/s] 82%|████████▏ | 41/50 [00:18<00:03,  3.00it/s] 84%|████████▍ | 42/50 [00:18<00:02,  3.00it/s] 86%|████████▌ | 43/50 [00:18<00:02,  2.99it/s] 88%|████████▊ | 44/50 [00:19<00:02,  3.00it/s] 90%|█████████ | 45/50 [00:19<00:01,  2.99it/s] 92%|█████████▏| 46/50 [00:19<00:01,  2.99it/s] 94%|█████████▍| 47/50 [00:20<00:01,  2.99it/s] 96%|█████████▌| 48/50 [00:20<00:00,  2.99it/s] 98%|█████████▊| 49/50 [00:20<00:00,  2.99it/s]100%|██████████| 50/50 [00:25<00:00,  1.77s/it]100%|██████████| 50/50 [00:25<00:00,  1.93it/s]
[I 2023-12-10 21:56:14,682] Trial 78 finished with value: 0.23333333333333334 and parameters: {'EMBEDDING_DIM': 1002, 'HIDDEN_DIM': 512, 'NUM_LAYERS': 1, 'DROPOUT': 0.3273327568887112, 'LR': 0.00011371121630154271, 'WEIGHT_0': 0.3774286842768874, 'WEIGHT_1': 0.5636570417878558, 'WEIGHT_2': 0.5179970556665937, 'WEIGHT_3': 0.8533373150784022, 'WEIGHT_4': 0.9284820448125394, 'WEIGHT_5': 0.5116097969589128, 'WEIGHT_6': 0.9773469336991297, 'WEIGHT_7': 0.3490110014301625, 'WEIGHT_8': 0.4619161291613513, 'optimizer': 'RMSprop'}. Best is trial 51 with value: 0.41438326562364947.
{'EMBEDDING_DIM': 1002, 'HIDDEN_DIM': 512, 'NUM_LAYERS': 1, 'DROPOUT': 0.3273327568887112, 'LR': 0.00011371121630154271, 'WEIGHT_0': 0.3774286842768874, 'WEIGHT_1': 0.5636570417878558, 'WEIGHT_2': 0.5179970556665937, 'WEIGHT_3': 0.8533373150784022, 'WEIGHT_4': 0.9284820448125394, 'WEIGHT_5': 0.5116097969589128, 'WEIGHT_6': 0.9773469336991297, 'WEIGHT_7': 0.3490110014301625, 'WEIGHT_8': 0.4619161291613513, 'optimizer': 'RMSprop'}
0
              precision    recall  f1-score   support

         LOC       0.03      0.04      0.04      1837
        MISC       0.01      0.07      0.02       922
         ORG       0.03      0.11      0.05      1341
         PER       0.03      0.06      0.04      1842

   micro avg       0.02      0.07      0.04      5942
   macro avg       0.03      0.07      0.04      5942
weighted avg       0.03      0.07      0.04      5942

{'EMBEDDING_DIM': 1002, 'HIDDEN_DIM': 512, 'NUM_LAYERS': 1, 'DROPOUT': 0.3273327568887112, 'LR': 0.00011371121630154271, 'WEIGHT_0': 0.3774286842768874, 'WEIGHT_1': 0.5636570417878558, 'WEIGHT_2': 0.5179970556665937, 'WEIGHT_3': 0.8533373150784022, 'WEIGHT_4': 0.9284820448125394, 'WEIGHT_5': 0.5116097969589128, 'WEIGHT_6': 0.9773469336991297, 'WEIGHT_7': 0.3490110014301625, 'WEIGHT_8': 0.4619161291613513, 'optimizer': 'RMSprop'}
49
              precision    recall  f1-score   support

         LOC       0.58      0.27      0.37      1837
        MISC       0.23      0.07      0.11       922
         ORG       0.18      0.06      0.09      1341
         PER       0.26      0.23      0.24      1842

   micro avg       0.33      0.18      0.23      5942
   macro avg       0.31      0.16      0.20      5942
weighted avg       0.34      0.18      0.23      5942

epoch 49
LSTM
  0%|          | 0/50 [00:00<?, ?it/s]  2%|▏         | 1/50 [00:05<04:53,  6.00s/it]  4%|▍         | 2/50 [00:06<02:09,  2.70s/it]  6%|▌         | 3/50 [00:07<01:25,  1.82s/it]  8%|▊         | 4/50 [00:07<01:04,  1.41s/it] 10%|█         | 5/50 [00:08<00:53,  1.18s/it] 12%|█▏        | 6/50 [00:09<00:45,  1.04s/it] 14%|█▍        | 7/50 [00:10<00:41,  1.05it/s] 16%|█▌        | 8/50 [00:11<00:37,  1.11it/s] 18%|█▊        | 9/50 [00:11<00:35,  1.16it/s] 20%|██        | 10/50 [00:12<00:33,  1.20it/s] 22%|██▏       | 11/50 [00:13<00:31,  1.22it/s] 24%|██▍       | 12/50 [00:14<00:30,  1.24it/s] 26%|██▌       | 13/50 [00:14<00:29,  1.25it/s] 28%|██▊       | 14/50 [00:15<00:28,  1.26it/s] 30%|███       | 15/50 [00:16<00:27,  1.27it/s] 32%|███▏      | 16/50 [00:17<00:26,  1.27it/s] 34%|███▍      | 17/50 [00:18<00:25,  1.27it/s] 36%|███▌      | 18/50 [00:18<00:25,  1.27it/s] 38%|███▊      | 19/50 [00:19<00:24,  1.28it/s] 40%|████      | 20/50 [00:20<00:23,  1.28it/s] 42%|████▏     | 21/50 [00:21<00:22,  1.28it/s] 44%|████▍     | 22/50 [00:21<00:21,  1.28it/s] 46%|████▌     | 23/50 [00:22<00:21,  1.27it/s] 48%|████▊     | 24/50 [00:23<00:20,  1.27it/s] 50%|█████     | 25/50 [00:24<00:19,  1.27it/s] 52%|█████▏    | 26/50 [00:25<00:18,  1.27it/s] 54%|█████▍    | 27/50 [00:25<00:18,  1.27it/s] 56%|█████▌    | 28/50 [00:26<00:17,  1.27it/s] 58%|█████▊    | 29/50 [00:27<00:16,  1.27it/s] 60%|██████    | 30/50 [00:28<00:15,  1.27it/s] 62%|██████▏   | 31/50 [00:29<00:14,  1.27it/s] 64%|██████▍   | 32/50 [00:29<00:14,  1.27it/s] 66%|██████▌   | 33/50 [00:30<00:13,  1.27it/s] 68%|██████▊   | 34/50 [00:31<00:12,  1.27it/s] 70%|███████   | 35/50 [00:32<00:11,  1.27it/s] 72%|███████▏  | 36/50 [00:33<00:11,  1.26it/s] 74%|███████▍  | 37/50 [00:33<00:10,  1.26it/s] 76%|███████▌  | 38/50 [00:34<00:09,  1.26it/s] 78%|███████▊  | 39/50 [00:35<00:08,  1.27it/s] 80%|████████  | 40/50 [00:36<00:07,  1.26it/s] 82%|████████▏ | 41/50 [00:36<00:07,  1.26it/s] 84%|████████▍ | 42/50 [00:37<00:06,  1.26it/s] 86%|████████▌ | 43/50 [00:38<00:05,  1.26it/s] 88%|████████▊ | 44/50 [00:39<00:04,  1.26it/s] 90%|█████████ | 45/50 [00:40<00:03,  1.26it/s] 92%|█████████▏| 46/50 [00:40<00:03,  1.26it/s] 94%|█████████▍| 47/50 [00:41<00:02,  1.26it/s] 96%|█████████▌| 48/50 [00:42<00:01,  1.25it/s] 98%|█████████▊| 49/50 [00:43<00:00,  1.25it/s]100%|██████████| 50/50 [00:49<00:00,  2.48s/it]100%|██████████| 50/50 [00:49<00:00,  1.01it/s]
[I 2023-12-10 21:57:09,520] Trial 79 finished with value: 0.37605305610324424 and parameters: {'EMBEDDING_DIM': 1021, 'HIDDEN_DIM': 618, 'NUM_LAYERS': 2, 'DROPOUT': 0.30417512613655934, 'LR': 0.0009764356308349048, 'WEIGHT_0': 0.31281611837237805, 'WEIGHT_1': 0.5963831772056554, 'WEIGHT_2': 0.5155527526253381, 'WEIGHT_3': 0.8077861805535085, 'WEIGHT_4': 0.7299331935705896, 'WEIGHT_5': 0.5337158830261793, 'WEIGHT_6': 0.9339575443588141, 'WEIGHT_7': 0.2848658746640241, 'WEIGHT_8': 0.39143602496516794, 'optimizer': 'RMSprop'}. Best is trial 51 with value: 0.41438326562364947.
{'EMBEDDING_DIM': 1021, 'HIDDEN_DIM': 618, 'NUM_LAYERS': 2, 'DROPOUT': 0.30417512613655934, 'LR': 0.0009764356308349048, 'WEIGHT_0': 0.31281611837237805, 'WEIGHT_1': 0.5963831772056554, 'WEIGHT_2': 0.5155527526253381, 'WEIGHT_3': 0.8077861805535085, 'WEIGHT_4': 0.7299331935705896, 'WEIGHT_5': 0.5337158830261793, 'WEIGHT_6': 0.9339575443588141, 'WEIGHT_7': 0.2848658746640241, 'WEIGHT_8': 0.39143602496516794, 'optimizer': 'RMSprop'}
0
              precision    recall  f1-score   support

         LOC       0.13      0.13      0.13      1837
        MISC       0.02      0.00      0.00       922
         ORG       0.11      0.02      0.03      1341
         PER       0.02      0.00      0.00      1842

   micro avg       0.12      0.05      0.07      5942
   macro avg       0.07      0.04      0.04      5942
weighted avg       0.07      0.05      0.05      5942

{'EMBEDDING_DIM': 1021, 'HIDDEN_DIM': 618, 'NUM_LAYERS': 2, 'DROPOUT': 0.30417512613655934, 'LR': 0.0009764356308349048, 'WEIGHT_0': 0.31281611837237805, 'WEIGHT_1': 0.5963831772056554, 'WEIGHT_2': 0.5155527526253381, 'WEIGHT_3': 0.8077861805535085, 'WEIGHT_4': 0.7299331935705896, 'WEIGHT_5': 0.5337158830261793, 'WEIGHT_6': 0.9339575443588141, 'WEIGHT_7': 0.2848658746640241, 'WEIGHT_8': 0.39143602496516794, 'optimizer': 'RMSprop'}
49
              precision    recall  f1-score   support

         LOC       0.60      0.48      0.53      1837
        MISC       0.34      0.35      0.34       922
         ORG       0.25      0.24      0.25      1341
         PER       0.38      0.31      0.34      1842

   micro avg       0.40      0.35      0.38      5942
   macro avg       0.39      0.34      0.37      5942
weighted avg       0.41      0.35      0.38      5942

epoch 49
LSTM
  0%|          | 0/50 [00:00<?, ?it/s]  2%|▏         | 1/50 [00:07<06:12,  7.60s/it]  4%|▍         | 2/50 [00:08<02:50,  3.55s/it]  6%|▌         | 3/50 [00:09<01:55,  2.46s/it]  8%|▊         | 4/50 [00:10<01:29,  1.94s/it] 10%|█         | 5/50 [00:11<01:14,  1.66s/it] 12%|█▏        | 6/50 [00:12<01:05,  1.49s/it] 14%|█▍        | 7/50 [00:14<00:59,  1.38s/it] 16%|█▌        | 8/50 [00:15<00:54,  1.31s/it] 18%|█▊        | 9/50 [00:16<00:51,  1.26s/it] 20%|██        | 10/50 [00:17<00:49,  1.23s/it] 22%|██▏       | 11/50 [00:18<00:47,  1.21s/it] 24%|██▍       | 12/50 [00:19<00:45,  1.19s/it] 26%|██▌       | 13/50 [00:21<00:43,  1.18s/it] 28%|██▊       | 14/50 [00:22<00:42,  1.18s/it] 30%|███       | 15/50 [00:23<00:41,  1.17s/it] 32%|███▏      | 16/50 [00:24<00:39,  1.17s/it] 34%|███▍      | 17/50 [00:25<00:38,  1.17s/it] 36%|███▌      | 18/50 [00:26<00:37,  1.17s/it] 38%|███▊      | 19/50 [00:28<00:36,  1.17s/it] 40%|████      | 20/50 [00:29<00:35,  1.17s/it] 42%|████▏     | 21/50 [00:30<00:33,  1.17s/it] 44%|████▍     | 22/50 [00:31<00:32,  1.17s/it] 46%|████▌     | 23/50 [00:32<00:31,  1.17s/it] 48%|████▊     | 24/50 [00:33<00:30,  1.18s/it] 50%|█████     | 25/50 [00:35<00:29,  1.18s/it] 52%|█████▏    | 26/50 [00:36<00:28,  1.18s/it] 54%|█████▍    | 27/50 [00:37<00:27,  1.18s/it] 56%|█████▌    | 28/50 [00:38<00:25,  1.18s/it] 58%|█████▊    | 29/50 [00:39<00:24,  1.18s/it] 60%|██████    | 30/50 [00:41<00:23,  1.18s/it] 62%|██████▏   | 31/50 [00:42<00:22,  1.18s/it] 64%|██████▍   | 32/50 [00:43<00:21,  1.18s/it] 66%|██████▌   | 33/50 [00:44<00:20,  1.19s/it] 68%|██████▊   | 34/50 [00:45<00:18,  1.18s/it] 70%|███████   | 35/50 [00:46<00:17,  1.18s/it] 72%|███████▏  | 36/50 [00:48<00:16,  1.19s/it] 74%|███████▍  | 37/50 [00:49<00:15,  1.19s/it] 76%|███████▌  | 38/50 [00:50<00:14,  1.19s/it] 78%|███████▊  | 39/50 [00:51<00:13,  1.19s/it] 80%|████████  | 40/50 [00:52<00:11,  1.19s/it] 82%|████████▏ | 41/50 [00:54<00:10,  1.19s/it] 84%|████████▍ | 42/50 [00:55<00:09,  1.19s/it] 86%|████████▌ | 43/50 [00:56<00:08,  1.19s/it] 88%|████████▊ | 44/50 [00:57<00:07,  1.19s/it] 90%|█████████ | 45/50 [00:58<00:05,  1.19s/it] 92%|█████████▏| 46/50 [01:00<00:04,  1.19s/it] 94%|█████████▍| 47/50 [01:01<00:03,  1.19s/it] 96%|█████████▌| 48/50 [01:02<00:02,  1.19s/it] 98%|█████████▊| 49/50 [01:03<00:01,  1.19s/it]100%|██████████| 50/50 [01:11<00:00,  3.25s/it]100%|██████████| 50/50 [01:11<00:00,  1.43s/it]
[I 2023-12-10 21:58:27,471] Trial 80 finished with value: 0.2960363665364064 and parameters: {'EMBEDDING_DIM': 948, 'HIDDEN_DIM': 523, 'NUM_LAYERS': 4, 'DROPOUT': 0.3405412629660301, 'LR': 0.000603009369300838, 'WEIGHT_0': 0.36919618174771723, 'WEIGHT_1': 0.5838337310002798, 'WEIGHT_2': 0.46836622829842733, 'WEIGHT_3': 0.783594819352589, 'WEIGHT_4': 0.9697266327351249, 'WEIGHT_5': 0.4164242244628743, 'WEIGHT_6': 0.9787214295786207, 'WEIGHT_7': 0.33340036260341976, 'WEIGHT_8': 0.39820151293914097, 'optimizer': 'RMSprop'}. Best is trial 51 with value: 0.41438326562364947.
/userhome/cs2/dingruiw/conda/envs/py310/lib/python3.10/site-packages/torch/nn/modules/rnn.py:82: UserWarning: dropout option adds dropout after all but last recurrent layer, so non-zero dropout expects num_layers greater than 1, but got dropout=0.344583085806479 and num_layers=1
  warnings.warn("dropout option adds dropout after all but last "
{'EMBEDDING_DIM': 948, 'HIDDEN_DIM': 523, 'NUM_LAYERS': 4, 'DROPOUT': 0.3405412629660301, 'LR': 0.000603009369300838, 'WEIGHT_0': 0.36919618174771723, 'WEIGHT_1': 0.5838337310002798, 'WEIGHT_2': 0.46836622829842733, 'WEIGHT_3': 0.783594819352589, 'WEIGHT_4': 0.9697266327351249, 'WEIGHT_5': 0.4164242244628743, 'WEIGHT_6': 0.9787214295786207, 'WEIGHT_7': 0.33340036260341976, 'WEIGHT_8': 0.39820151293914097, 'optimizer': 'RMSprop'}
0
              precision    recall  f1-score   support

         LOC       0.00      0.00      0.00      1837
        MISC       0.00      0.00      0.00       922
         ORG       0.00      0.00      0.00      1341
         PER       0.00      0.00      0.00      1842

   micro avg       0.00      0.00      0.00      5942
   macro avg       0.00      0.00      0.00      5942
weighted avg       0.00      0.00      0.00      5942

{'EMBEDDING_DIM': 948, 'HIDDEN_DIM': 523, 'NUM_LAYERS': 4, 'DROPOUT': 0.3405412629660301, 'LR': 0.000603009369300838, 'WEIGHT_0': 0.36919618174771723, 'WEIGHT_1': 0.5838337310002798, 'WEIGHT_2': 0.46836622829842733, 'WEIGHT_3': 0.783594819352589, 'WEIGHT_4': 0.9697266327351249, 'WEIGHT_5': 0.4164242244628743, 'WEIGHT_6': 0.9787214295786207, 'WEIGHT_7': 0.33340036260341976, 'WEIGHT_8': 0.39820151293914097, 'optimizer': 'RMSprop'}
49
              precision    recall  f1-score   support

         LOC       0.31      0.42      0.36      1837
        MISC       0.14      0.25      0.18       922
         ORG       0.29      0.21      0.24      1341
         PER       0.37      0.31      0.34      1842

   micro avg       0.28      0.31      0.30      5942
   macro avg       0.28      0.30      0.28      5942
weighted avg       0.30      0.31      0.30      5942

epoch 49
LSTM
  0%|          | 0/50 [00:00<?, ?it/s]  2%|▏         | 1/50 [00:04<03:53,  4.77s/it]  4%|▍         | 2/50 [00:04<01:38,  2.06s/it]  6%|▌         | 3/50 [00:05<00:59,  1.26s/it]  8%|▊         | 4/50 [00:05<00:40,  1.14it/s] 10%|█         | 5/50 [00:05<00:30,  1.49it/s] 12%|█▏        | 6/50 [00:06<00:23,  1.84it/s] 14%|█▍        | 7/50 [00:06<00:19,  2.16it/s] 16%|█▌        | 8/50 [00:06<00:17,  2.43it/s] 18%|█▊        | 9/50 [00:07<00:15,  2.66it/s] 20%|██        | 10/50 [00:07<00:14,  2.84it/s] 22%|██▏       | 11/50 [00:07<00:13,  2.98it/s] 24%|██▍       | 12/50 [00:07<00:12,  3.09it/s] 26%|██▌       | 13/50 [00:08<00:11,  3.16it/s] 28%|██▊       | 14/50 [00:08<00:11,  3.21it/s] 30%|███       | 15/50 [00:08<00:10,  3.25it/s] 32%|███▏      | 16/50 [00:09<00:10,  3.28it/s] 34%|███▍      | 17/50 [00:09<00:09,  3.31it/s] 36%|███▌      | 18/50 [00:09<00:09,  3.31it/s] 38%|███▊      | 19/50 [00:10<00:09,  3.32it/s] 40%|████      | 20/50 [00:10<00:09,  3.33it/s] 42%|████▏     | 21/50 [00:10<00:08,  3.33it/s] 44%|████▍     | 22/50 [00:10<00:08,  3.33it/s] 46%|████▌     | 23/50 [00:11<00:08,  3.33it/s] 48%|████▊     | 24/50 [00:11<00:07,  3.33it/s] 50%|█████     | 25/50 [00:11<00:07,  3.33it/s] 52%|█████▏    | 26/50 [00:12<00:07,  3.33it/s] 54%|█████▍    | 27/50 [00:12<00:06,  3.33it/s] 56%|█████▌    | 28/50 [00:12<00:06,  3.33it/s] 58%|█████▊    | 29/50 [00:13<00:06,  3.33it/s] 60%|██████    | 30/50 [00:13<00:06,  3.33it/s] 62%|██████▏   | 31/50 [00:13<00:05,  3.33it/s] 64%|██████▍   | 32/50 [00:13<00:05,  3.32it/s] 66%|██████▌   | 33/50 [00:14<00:05,  3.31it/s] 68%|██████▊   | 34/50 [00:14<00:04,  3.31it/s] 70%|███████   | 35/50 [00:14<00:04,  3.31it/s] 72%|███████▏  | 36/50 [00:15<00:04,  3.32it/s] 74%|███████▍  | 37/50 [00:15<00:03,  3.32it/s] 76%|███████▌  | 38/50 [00:15<00:03,  3.32it/s] 78%|███████▊  | 39/50 [00:16<00:03,  3.31it/s] 80%|████████  | 40/50 [00:16<00:03,  3.31it/s] 82%|████████▏ | 41/50 [00:16<00:02,  3.30it/s] 84%|████████▍ | 42/50 [00:16<00:02,  3.30it/s] 86%|████████▌ | 43/50 [00:17<00:02,  3.29it/s] 88%|████████▊ | 44/50 [00:17<00:01,  3.29it/s] 90%|█████████ | 45/50 [00:17<00:01,  3.29it/s] 92%|█████████▏| 46/50 [00:18<00:01,  3.28it/s] 94%|█████████▍| 47/50 [00:18<00:00,  3.29it/s] 96%|█████████▌| 48/50 [00:18<00:00,  3.28it/s] 98%|█████████▊| 49/50 [00:19<00:00,  3.28it/s]100%|██████████| 50/50 [00:24<00:00,  1.71s/it]100%|██████████| 50/50 [00:24<00:00,  2.08it/s]
