[I 2023-12-10 23:04:08,836] Trial 205 finished with value: 0.4083003271913208 and parameters: {'EMBEDDING_DIM': 944, 'HIDDEN_DIM': 324, 'NUM_LAYERS': 1, 'DROPOUT': 0.11738341618812612, 'LR': 0.0012269199547394174, 'WEIGHT_0': 0.4666912912695918, 'WEIGHT_1': 0.5543403077327473, 'WEIGHT_2': 0.14797112017689762, 'WEIGHT_3': 0.9660720260511118, 'WEIGHT_4': 0.9311329581143981, 'WEIGHT_5': 0.5552845711745338, 'WEIGHT_6': 0.4992810903521931, 'WEIGHT_7': 0.4262980672131431, 'WEIGHT_8': 0.41196889476308257, 'optimizer': 'RMSprop'}. Best is trial 134 with value: 0.4158467115484205.
/userhome/cs2/dingruiw/conda/envs/py310/lib/python3.10/site-packages/torch/nn/modules/rnn.py:82: UserWarning: dropout option adds dropout after all but last recurrent layer, so non-zero dropout expects num_layers greater than 1, but got dropout=0.26136272214263384 and num_layers=1
  warnings.warn("dropout option adds dropout after all but last "
{'EMBEDDING_DIM': 944, 'HIDDEN_DIM': 324, 'NUM_LAYERS': 1, 'DROPOUT': 0.11738341618812612, 'LR': 0.0012269199547394174, 'WEIGHT_0': 0.4666912912695918, 'WEIGHT_1': 0.5543403077327473, 'WEIGHT_2': 0.14797112017689762, 'WEIGHT_3': 0.9660720260511118, 'WEIGHT_4': 0.9311329581143981, 'WEIGHT_5': 0.5552845711745338, 'WEIGHT_6': 0.4992810903521931, 'WEIGHT_7': 0.4262980672131431, 'WEIGHT_8': 0.41196889476308257, 'optimizer': 'RMSprop'}
0
              precision    recall  f1-score   support

         LOC       0.16      0.10      0.12      1837
        MISC       0.01      0.00      0.00       922
         ORG       0.07      0.04      0.05      1341
         PER       0.04      0.01      0.02      1842

   micro avg       0.10      0.04      0.06      5942
   macro avg       0.07      0.04      0.05      5942
weighted avg       0.08      0.04      0.06      5942

{'EMBEDDING_DIM': 944, 'HIDDEN_DIM': 324, 'NUM_LAYERS': 1, 'DROPOUT': 0.11738341618812612, 'LR': 0.0012269199547394174, 'WEIGHT_0': 0.4666912912695918, 'WEIGHT_1': 0.5543403077327473, 'WEIGHT_2': 0.14797112017689762, 'WEIGHT_3': 0.9660720260511118, 'WEIGHT_4': 0.9311329581143981, 'WEIGHT_5': 0.5552845711745338, 'WEIGHT_6': 0.4992810903521931, 'WEIGHT_7': 0.4262980672131431, 'WEIGHT_8': 0.41196889476308257, 'optimizer': 'RMSprop'}
49
              precision    recall  f1-score   support

         LOC       0.57      0.56      0.57      1837
        MISC       0.54      0.40      0.46       922
         ORG       0.29      0.26      0.27      1341
         PER       0.32      0.34      0.33      1842

   micro avg       0.42      0.40      0.41      5942
   macro avg       0.43      0.39      0.41      5942
weighted avg       0.42      0.40      0.41      5942

epoch 49
LSTM
  0%|          | 0/50 [00:00<?, ?it/s]  2%|▏         | 1/50 [00:04<03:49,  4.68s/it]  4%|▍         | 2/50 [00:04<01:35,  2.00s/it]  6%|▌         | 3/50 [00:05<00:55,  1.19s/it]  8%|▊         | 4/50 [00:05<00:37,  1.24it/s] 10%|█         | 5/50 [00:05<00:26,  1.68it/s] 12%|█▏        | 6/50 [00:05<00:20,  2.14it/s] 14%|█▍        | 7/50 [00:05<00:16,  2.59it/s] 16%|█▌        | 8/50 [00:06<00:13,  3.00it/s] 18%|█▊        | 9/50 [00:06<00:12,  3.36it/s] 20%|██        | 10/50 [00:06<00:10,  3.66it/s] 22%|██▏       | 11/50 [00:06<00:10,  3.90it/s] 24%|██▍       | 12/50 [00:06<00:09,  4.08it/s] 26%|██▌       | 13/50 [00:07<00:08,  4.21it/s] 28%|██▊       | 14/50 [00:07<00:08,  4.31it/s] 30%|███       | 15/50 [00:07<00:07,  4.38it/s] 32%|███▏      | 16/50 [00:07<00:07,  4.44it/s] 34%|███▍      | 17/50 [00:08<00:07,  4.47it/s] 36%|███▌      | 18/50 [00:08<00:07,  4.50it/s] 38%|███▊      | 19/50 [00:08<00:06,  4.51it/s] 40%|████      | 20/50 [00:08<00:06,  4.52it/s] 42%|████▏     | 21/50 [00:08<00:06,  4.53it/s] 44%|████▍     | 22/50 [00:09<00:06,  4.54it/s] 46%|████▌     | 23/50 [00:09<00:05,  4.54it/s] 48%|████▊     | 24/50 [00:09<00:05,  4.55it/s] 50%|█████     | 25/50 [00:09<00:05,  4.55it/s] 52%|█████▏    | 26/50 [00:10<00:05,  4.54it/s] 54%|█████▍    | 27/50 [00:10<00:05,  4.55it/s] 56%|█████▌    | 28/50 [00:10<00:04,  4.55it/s] 58%|█████▊    | 29/50 [00:10<00:04,  4.54it/s] 60%|██████    | 30/50 [00:10<00:04,  4.54it/s] 62%|██████▏   | 31/50 [00:11<00:04,  4.53it/s] 64%|██████▍   | 32/50 [00:11<00:03,  4.53it/s] 66%|██████▌   | 33/50 [00:11<00:03,  4.53it/s] 68%|██████▊   | 34/50 [00:11<00:03,  4.53it/s] 70%|███████   | 35/50 [00:12<00:03,  4.53it/s] 72%|███████▏  | 36/50 [00:12<00:03,  4.54it/s] 74%|███████▍  | 37/50 [00:12<00:02,  4.54it/s] 76%|███████▌  | 38/50 [00:12<00:02,  4.53it/s] 78%|███████▊  | 39/50 [00:12<00:02,  4.53it/s] 80%|████████  | 40/50 [00:13<00:02,  4.53it/s] 82%|████████▏ | 41/50 [00:13<00:01,  4.52it/s] 84%|████████▍ | 42/50 [00:13<00:01,  4.53it/s] 86%|████████▌ | 43/50 [00:13<00:01,  4.53it/s] 88%|████████▊ | 44/50 [00:14<00:01,  4.53it/s] 90%|█████████ | 45/50 [00:14<00:01,  4.53it/s] 92%|█████████▏| 46/50 [00:14<00:00,  4.53it/s] 94%|█████████▍| 47/50 [00:14<00:00,  4.53it/s] 96%|█████████▌| 48/50 [00:14<00:00,  4.52it/s] 98%|█████████▊| 49/50 [00:15<00:00,  4.53it/s]100%|██████████| 50/50 [00:19<00:00,  1.61s/it]100%|██████████| 50/50 [00:19<00:00,  2.50it/s]
[I 2023-12-10 23:04:33,055] Trial 206 finished with value: 0.39670963364993217 and parameters: {'EMBEDDING_DIM': 949, 'HIDDEN_DIM': 321, 'NUM_LAYERS': 1, 'DROPOUT': 0.26136272214263384, 'LR': 0.0012315881901412942, 'WEIGHT_0': 0.4089494014117733, 'WEIGHT_1': 0.5653213738414617, 'WEIGHT_2': 0.14686417502592208, 'WEIGHT_3': 0.9711135460969109, 'WEIGHT_4': 0.924317116357842, 'WEIGHT_5': 0.5695916382765829, 'WEIGHT_6': 0.4882105087632867, 'WEIGHT_7': 0.42501683729924256, 'WEIGHT_8': 0.40245694860664266, 'optimizer': 'RMSprop'}. Best is trial 134 with value: 0.4158467115484205.
/userhome/cs2/dingruiw/conda/envs/py310/lib/python3.10/site-packages/torch/nn/modules/rnn.py:82: UserWarning: dropout option adds dropout after all but last recurrent layer, so non-zero dropout expects num_layers greater than 1, but got dropout=0.1975698426079021 and num_layers=1
  warnings.warn("dropout option adds dropout after all but last "
{'EMBEDDING_DIM': 949, 'HIDDEN_DIM': 321, 'NUM_LAYERS': 1, 'DROPOUT': 0.26136272214263384, 'LR': 0.0012315881901412942, 'WEIGHT_0': 0.4089494014117733, 'WEIGHT_1': 0.5653213738414617, 'WEIGHT_2': 0.14686417502592208, 'WEIGHT_3': 0.9711135460969109, 'WEIGHT_4': 0.924317116357842, 'WEIGHT_5': 0.5695916382765829, 'WEIGHT_6': 0.4882105087632867, 'WEIGHT_7': 0.42501683729924256, 'WEIGHT_8': 0.40245694860664266, 'optimizer': 'RMSprop'}
0
              precision    recall  f1-score   support

         LOC       0.27      0.12      0.16      1837
        MISC       0.05      0.03      0.04       922
         ORG       0.07      0.07      0.07      1341
         PER       0.06      0.02      0.03      1842

   micro avg       0.11      0.06      0.08      5942
   macro avg       0.11      0.06      0.08      5942
weighted avg       0.12      0.06      0.08      5942

{'EMBEDDING_DIM': 949, 'HIDDEN_DIM': 321, 'NUM_LAYERS': 1, 'DROPOUT': 0.26136272214263384, 'LR': 0.0012315881901412942, 'WEIGHT_0': 0.4089494014117733, 'WEIGHT_1': 0.5653213738414617, 'WEIGHT_2': 0.14686417502592208, 'WEIGHT_3': 0.9711135460969109, 'WEIGHT_4': 0.924317116357842, 'WEIGHT_5': 0.5695916382765829, 'WEIGHT_6': 0.4882105087632867, 'WEIGHT_7': 0.42501683729924256, 'WEIGHT_8': 0.40245694860664266, 'optimizer': 'RMSprop'}
49
              precision    recall  f1-score   support

         LOC       0.55      0.53      0.54      1837
        MISC       0.45      0.39      0.42       922
         ORG       0.26      0.26      0.26      1341
         PER       0.34      0.36      0.35      1842

   micro avg       0.40      0.39      0.40      5942
   macro avg       0.40      0.38      0.39      5942
weighted avg       0.40      0.39      0.40      5942

epoch 49
LSTM
  0%|          | 0/50 [00:00<?, ?it/s]  2%|▏         | 1/50 [00:05<04:28,  5.48s/it]  4%|▍         | 2/50 [00:05<01:57,  2.44s/it]  6%|▌         | 3/50 [00:06<01:17,  1.65s/it]  8%|▊         | 4/50 [00:07<00:58,  1.28s/it] 10%|█         | 5/50 [00:07<00:48,  1.07s/it] 12%|█▏        | 6/50 [00:08<00:41,  1.06it/s] 14%|█▍        | 7/50 [00:09<00:37,  1.15it/s] 16%|█▌        | 8/50 [00:10<00:34,  1.23it/s] 18%|█▊        | 9/50 [00:10<00:32,  1.28it/s] 20%|██        | 10/50 [00:11<00:30,  1.32it/s] 22%|██▏       | 11/50 [00:12<00:28,  1.35it/s] 24%|██▍       | 12/50 [00:12<00:27,  1.37it/s] 26%|██▌       | 13/50 [00:13<00:26,  1.38it/s] 28%|██▊       | 14/50 [00:14<00:25,  1.39it/s] 30%|███       | 15/50 [00:14<00:25,  1.40it/s] 32%|███▏      | 16/50 [00:15<00:24,  1.40it/s] 34%|███▍      | 17/50 [00:16<00:23,  1.41it/s] 36%|███▌      | 18/50 [00:17<00:22,  1.41it/s] 38%|███▊      | 19/50 [00:17<00:21,  1.41it/s] 40%|████      | 20/50 [00:18<00:21,  1.41it/s] 42%|████▏     | 21/50 [00:19<00:20,  1.41it/s] 44%|████▍     | 22/50 [00:19<00:19,  1.41it/s] 46%|████▌     | 23/50 [00:20<00:19,  1.41it/s] 48%|████▊     | 24/50 [00:21<00:18,  1.41it/s] 50%|█████     | 25/50 [00:22<00:17,  1.41it/s] 52%|█████▏    | 26/50 [00:22<00:17,  1.41it/s] 54%|█████▍    | 27/50 [00:23<00:16,  1.41it/s] 56%|█████▌    | 28/50 [00:24<00:15,  1.41it/s] 58%|█████▊    | 29/50 [00:24<00:14,  1.41it/s] 60%|██████    | 30/50 [00:25<00:14,  1.41it/s] 62%|██████▏   | 31/50 [00:26<00:13,  1.41it/s] 64%|██████▍   | 32/50 [00:27<00:12,  1.40it/s] 66%|██████▌   | 33/50 [00:27<00:12,  1.40it/s] 68%|██████▊   | 34/50 [00:28<00:11,  1.40it/s] 70%|███████   | 35/50 [00:29<00:10,  1.40it/s] 72%|███████▏  | 36/50 [00:29<00:10,  1.40it/s] 74%|███████▍  | 37/50 [00:30<00:09,  1.40it/s] 76%|███████▌  | 38/50 [00:31<00:08,  1.40it/s] 78%|███████▊  | 39/50 [00:32<00:07,  1.40it/s] 80%|████████  | 40/50 [00:32<00:07,  1.40it/s] 82%|████████▏ | 41/50 [00:33<00:06,  1.39it/s] 84%|████████▍ | 42/50 [00:34<00:05,  1.39it/s] 86%|████████▌ | 43/50 [00:34<00:05,  1.40it/s] 88%|████████▊ | 44/50 [00:35<00:04,  1.39it/s] 90%|█████████ | 45/50 [00:36<00:03,  1.40it/s] 92%|█████████▏| 46/50 [00:37<00:02,  1.39it/s] 94%|█████████▍| 47/50 [00:37<00:02,  1.39it/s] 96%|█████████▌| 48/50 [00:38<00:01,  1.39it/s] 98%|█████████▊| 49/50 [00:39<00:00,  1.39it/s]100%|██████████| 50/50 [00:45<00:00,  2.26s/it]100%|██████████| 50/50 [00:45<00:00,  1.11it/s]
[I 2023-12-10 23:05:22,774] Trial 207 finished with value: 0.34919279063807984 and parameters: {'EMBEDDING_DIM': 1009, 'HIDDEN_DIM': 912, 'NUM_LAYERS': 1, 'DROPOUT': 0.1975698426079021, 'LR': 0.001041085104305743, 'WEIGHT_0': 0.35303681432017825, 'WEIGHT_1': 0.5477749226747425, 'WEIGHT_2': 0.049960608763223516, 'WEIGHT_3': 0.9537717205961452, 'WEIGHT_4': 0.9058071667093858, 'WEIGHT_5': 0.6308313866967518, 'WEIGHT_6': 0.5489551269692288, 'WEIGHT_7': 0.34727656483306973, 'WEIGHT_8': 0.41629825374918167, 'optimizer': 'RMSprop'}. Best is trial 134 with value: 0.4158467115484205.
/userhome/cs2/dingruiw/conda/envs/py310/lib/python3.10/site-packages/torch/nn/modules/rnn.py:82: UserWarning: dropout option adds dropout after all but last recurrent layer, so non-zero dropout expects num_layers greater than 1, but got dropout=0.1152220557545374 and num_layers=1
  warnings.warn("dropout option adds dropout after all but last "
{'EMBEDDING_DIM': 1009, 'HIDDEN_DIM': 912, 'NUM_LAYERS': 1, 'DROPOUT': 0.1975698426079021, 'LR': 0.001041085104305743, 'WEIGHT_0': 0.35303681432017825, 'WEIGHT_1': 0.5477749226747425, 'WEIGHT_2': 0.049960608763223516, 'WEIGHT_3': 0.9537717205961452, 'WEIGHT_4': 0.9058071667093858, 'WEIGHT_5': 0.6308313866967518, 'WEIGHT_6': 0.5489551269692288, 'WEIGHT_7': 0.34727656483306973, 'WEIGHT_8': 0.41629825374918167, 'optimizer': 'RMSprop'}
0
              precision    recall  f1-score   support

         LOC       0.11      0.15      0.13      1837
        MISC       0.01      0.05      0.02       922
         ORG       0.06      0.04      0.05      1341
         PER       0.02      0.05      0.03      1842

   micro avg       0.04      0.08      0.05      5942
   macro avg       0.05      0.07      0.06      5942
weighted avg       0.06      0.08      0.06      5942

{'EMBEDDING_DIM': 1009, 'HIDDEN_DIM': 912, 'NUM_LAYERS': 1, 'DROPOUT': 0.1975698426079021, 'LR': 0.001041085104305743, 'WEIGHT_0': 0.35303681432017825, 'WEIGHT_1': 0.5477749226747425, 'WEIGHT_2': 0.049960608763223516, 'WEIGHT_3': 0.9537717205961452, 'WEIGHT_4': 0.9058071667093858, 'WEIGHT_5': 0.6308313866967518, 'WEIGHT_6': 0.5489551269692288, 'WEIGHT_7': 0.34727656483306973, 'WEIGHT_8': 0.41629825374918167, 'optimizer': 'RMSprop'}
49
              precision    recall  f1-score   support

         LOC       0.57      0.54      0.55      1837
        MISC       0.28      0.13      0.18       922
         ORG       0.22      0.24      0.23      1341
         PER       0.28      0.33      0.31      1842

   micro avg       0.35      0.34      0.35      5942
   macro avg       0.34      0.31      0.32      5942
weighted avg       0.36      0.34      0.35      5942

epoch 49
LSTM
  0%|          | 0/50 [00:00<?, ?it/s]  2%|▏         | 1/50 [00:04<03:55,  4.80s/it]  4%|▍         | 2/50 [00:04<01:39,  2.06s/it]  6%|▌         | 3/50 [00:05<00:58,  1.25s/it]  8%|▊         | 4/50 [00:05<00:39,  1.16it/s] 10%|█         | 5/50 [00:05<00:29,  1.54it/s] 12%|█▏        | 6/50 [00:06<00:22,  1.92it/s] 14%|█▍        | 7/50 [00:06<00:18,  2.28it/s] 16%|█▌        | 8/50 [00:06<00:16,  2.59it/s] 18%|█▊        | 9/50 [00:06<00:14,  2.86it/s] 20%|██        | 10/50 [00:07<00:13,  3.07it/s] 22%|██▏       | 11/50 [00:07<00:12,  3.24it/s] 24%|██▍       | 12/50 [00:07<00:11,  3.36it/s] 26%|██▌       | 13/50 [00:07<00:10,  3.45it/s] 28%|██▊       | 14/50 [00:08<00:10,  3.52it/s] 30%|███       | 15/50 [00:08<00:09,  3.56it/s] 32%|███▏      | 16/50 [00:08<00:09,  3.60it/s] 34%|███▍      | 17/50 [00:09<00:09,  3.63it/s] 36%|███▌      | 18/50 [00:09<00:08,  3.64it/s] 38%|███▊      | 19/50 [00:09<00:08,  3.65it/s] 40%|████      | 20/50 [00:09<00:08,  3.66it/s] 42%|████▏     | 21/50 [00:10<00:07,  3.67it/s] 44%|████▍     | 22/50 [00:10<00:07,  3.67it/s] 46%|████▌     | 23/50 [00:10<00:07,  3.67it/s] 48%|████▊     | 24/50 [00:10<00:07,  3.67it/s] 50%|█████     | 25/50 [00:11<00:06,  3.67it/s] 52%|█████▏    | 26/50 [00:11<00:06,  3.66it/s] 54%|█████▍    | 27/50 [00:11<00:06,  3.66it/s] 56%|█████▌    | 28/50 [00:12<00:06,  3.66it/s] 58%|█████▊    | 29/50 [00:12<00:05,  3.66it/s] 60%|██████    | 30/50 [00:12<00:05,  3.67it/s] 62%|██████▏   | 31/50 [00:12<00:05,  3.66it/s] 64%|██████▍   | 32/50 [00:13<00:04,  3.66it/s] 66%|██████▌   | 33/50 [00:13<00:04,  3.66it/s] 68%|██████▊   | 34/50 [00:13<00:04,  3.66it/s] 70%|███████   | 35/50 [00:13<00:04,  3.65it/s] 72%|███████▏  | 36/50 [00:14<00:03,  3.65it/s] 74%|███████▍  | 37/50 [00:14<00:03,  3.66it/s] 76%|███████▌  | 38/50 [00:14<00:03,  3.65it/s] 78%|███████▊  | 39/50 [00:15<00:03,  3.65it/s] 80%|████████  | 40/50 [00:15<00:02,  3.65it/s] 82%|████████▏ | 41/50 [00:15<00:02,  3.65it/s] 84%|████████▍ | 42/50 [00:15<00:02,  3.64it/s] 86%|████████▌ | 43/50 [00:16<00:01,  3.64it/s] 88%|████████▊ | 44/50 [00:16<00:01,  3.63it/s] 90%|█████████ | 45/50 [00:16<00:01,  3.63it/s] 92%|█████████▏| 46/50 [00:16<00:01,  3.62it/s] 94%|█████████▍| 47/50 [00:17<00:00,  3.63it/s] 96%|█████████▌| 48/50 [00:17<00:00,  3.62it/s] 98%|█████████▊| 49/50 [00:17<00:00,  3.62it/s]100%|██████████| 50/50 [00:22<00:00,  1.67s/it]100%|██████████| 50/50 [00:22<00:00,  2.20it/s]
[I 2023-12-10 23:05:49,764] Trial 208 finished with value: 0.41497632025734965 and parameters: {'EMBEDDING_DIM': 981, 'HIDDEN_DIM': 405, 'NUM_LAYERS': 1, 'DROPOUT': 0.1152220557545374, 'LR': 0.000577785219105545, 'WEIGHT_0': 0.43960859654222695, 'WEIGHT_1': 0.5346629975339392, 'WEIGHT_2': 0.5429428713243255, 'WEIGHT_3': 0.9687710794455455, 'WEIGHT_4': 0.8257798893445486, 'WEIGHT_5': 0.5521942806404059, 'WEIGHT_6': 0.5382505625758816, 'WEIGHT_7': 0.3289220469831549, 'WEIGHT_8': 0.5528925520320802, 'optimizer': 'RMSprop'}. Best is trial 134 with value: 0.4158467115484205.
/userhome/cs2/dingruiw/conda/envs/py310/lib/python3.10/site-packages/torch/nn/modules/rnn.py:82: UserWarning: dropout option adds dropout after all but last recurrent layer, so non-zero dropout expects num_layers greater than 1, but got dropout=0.11892595064197947 and num_layers=1
  warnings.warn("dropout option adds dropout after all but last "
{'EMBEDDING_DIM': 981, 'HIDDEN_DIM': 405, 'NUM_LAYERS': 1, 'DROPOUT': 0.1152220557545374, 'LR': 0.000577785219105545, 'WEIGHT_0': 0.43960859654222695, 'WEIGHT_1': 0.5346629975339392, 'WEIGHT_2': 0.5429428713243255, 'WEIGHT_3': 0.9687710794455455, 'WEIGHT_4': 0.8257798893445486, 'WEIGHT_5': 0.5521942806404059, 'WEIGHT_6': 0.5382505625758816, 'WEIGHT_7': 0.3289220469831549, 'WEIGHT_8': 0.5528925520320802, 'optimizer': 'RMSprop'}
0
              precision    recall  f1-score   support

         LOC       0.06      0.03      0.04      1837
        MISC       0.02      0.02      0.02       922
         ORG       0.10      0.08      0.09      1341
         PER       0.07      0.02      0.03      1842

   micro avg       0.07      0.04      0.05      5942
   macro avg       0.06      0.04      0.05      5942
weighted avg       0.07      0.04      0.05      5942

{'EMBEDDING_DIM': 981, 'HIDDEN_DIM': 405, 'NUM_LAYERS': 1, 'DROPOUT': 0.1152220557545374, 'LR': 0.000577785219105545, 'WEIGHT_0': 0.43960859654222695, 'WEIGHT_1': 0.5346629975339392, 'WEIGHT_2': 0.5429428713243255, 'WEIGHT_3': 0.9687710794455455, 'WEIGHT_4': 0.8257798893445486, 'WEIGHT_5': 0.5521942806404059, 'WEIGHT_6': 0.5382505625758816, 'WEIGHT_7': 0.3289220469831549, 'WEIGHT_8': 0.5528925520320802, 'optimizer': 'RMSprop'}
49
              precision    recall  f1-score   support

         LOC       0.61      0.51      0.56      1837
        MISC       0.48      0.42      0.45       922
         ORG       0.31      0.24      0.27      1341
         PER       0.36      0.37      0.36      1842

   micro avg       0.44      0.39      0.41      5942
   macro avg       0.44      0.38      0.41      5942
weighted avg       0.44      0.39      0.41      5942

epoch 49
LSTM
  0%|          | 0/50 [00:00<?, ?it/s]  2%|▏         | 1/50 [00:04<03:56,  4.82s/it]  4%|▍         | 2/50 [00:04<01:39,  2.07s/it]  6%|▌         | 3/50 [00:05<00:58,  1.24s/it]  8%|▊         | 4/50 [00:05<00:39,  1.18it/s] 10%|█         | 5/50 [00:05<00:28,  1.58it/s] 12%|█▏        | 6/50 [00:05<00:22,  1.98it/s] 14%|█▍        | 7/50 [00:06<00:18,  2.37it/s] 16%|█▌        | 8/50 [00:06<00:15,  2.71it/s] 18%|█▊        | 9/50 [00:06<00:13,  3.00it/s] 20%|██        | 10/50 [00:06<00:12,  3.24it/s] 22%|██▏       | 11/50 [00:07<00:11,  3.42it/s] 24%|██▍       | 12/50 [00:07<00:10,  3.56it/s] 26%|██▌       | 13/50 [00:07<00:10,  3.66it/s] 28%|██▊       | 14/50 [00:08<00:09,  3.74it/s] 30%|███       | 15/50 [00:08<00:09,  3.80it/s] 32%|███▏      | 16/50 [00:08<00:08,  3.84it/s] 34%|███▍      | 17/50 [00:08<00:08,  3.87it/s] 36%|███▌      | 18/50 [00:09<00:08,  3.89it/s] 38%|███▊      | 19/50 [00:09<00:07,  3.90it/s] 40%|████      | 20/50 [00:09<00:07,  3.92it/s] 42%|████▏     | 21/50 [00:09<00:07,  3.93it/s] 44%|████▍     | 22/50 [00:10<00:07,  3.93it/s] 46%|████▌     | 23/50 [00:10<00:06,  3.93it/s] 48%|████▊     | 24/50 [00:10<00:06,  3.94it/s] 50%|█████     | 25/50 [00:10<00:06,  3.94it/s] 52%|█████▏    | 26/50 [00:11<00:06,  3.94it/s] 54%|█████▍    | 27/50 [00:11<00:05,  3.93it/s] 56%|█████▌    | 28/50 [00:11<00:05,  3.94it/s] 58%|█████▊    | 29/50 [00:11<00:05,  3.94it/s] 60%|██████    | 30/50 [00:12<00:05,  3.94it/s] 62%|██████▏   | 31/50 [00:12<00:04,  3.94it/s] 64%|██████▍   | 32/50 [00:12<00:04,  3.93it/s] 66%|██████▌   | 33/50 [00:12<00:04,  3.93it/s] 68%|██████▊   | 34/50 [00:13<00:04,  3.93it/s] 70%|███████   | 35/50 [00:13<00:03,  3.93it/s] 72%|███████▏  | 36/50 [00:13<00:03,  3.93it/s] 74%|███████▍  | 37/50 [00:13<00:03,  3.92it/s] 76%|███████▌  | 38/50 [00:14<00:03,  3.93it/s] 78%|███████▊  | 39/50 [00:14<00:02,  3.93it/s] 80%|████████  | 40/50 [00:14<00:02,  3.93it/s] 82%|████████▏ | 41/50 [00:14<00:02,  3.93it/s] 84%|████████▍ | 42/50 [00:15<00:02,  3.93it/s] 86%|████████▌ | 43/50 [00:15<00:01,  3.93it/s] 88%|████████▊ | 44/50 [00:15<00:01,  3.93it/s] 90%|█████████ | 45/50 [00:15<00:01,  3.92it/s] 92%|█████████▏| 46/50 [00:16<00:01,  3.92it/s] 94%|█████████▍| 47/50 [00:16<00:00,  3.92it/s] 96%|█████████▌| 48/50 [00:16<00:00,  3.92it/s] 98%|█████████▊| 49/50 [00:16<00:00,  3.92it/s]100%|██████████| 50/50 [00:21<00:00,  1.65s/it]100%|██████████| 50/50 [00:21<00:00,  2.29it/s]
