[I 2023-12-10 23:26:06,940] Trial 253 finished with value: 0.4053820941866483 and parameters: {'EMBEDDING_DIM': 973, 'HIDDEN_DIM': 399, 'NUM_LAYERS': 1, 'DROPOUT': 0.30930146355395716, 'LR': 0.002431629235731816, 'WEIGHT_0': 0.3973486839136316, 'WEIGHT_1': 0.555489540828934, 'WEIGHT_2': 0.18957615391769778, 'WEIGHT_3': 0.8947693266729265, 'WEIGHT_4': 0.6077507818476796, 'WEIGHT_5': 0.4910007999160504, 'WEIGHT_6': 0.5213224895218049, 'WEIGHT_7': 0.45782423405146494, 'WEIGHT_8': 0.5111442045769954, 'optimizer': 'RMSprop'}. Best is trial 221 with value: 0.418736930154747.
/userhome/cs2/dingruiw/conda/envs/py310/lib/python3.10/site-packages/torch/nn/modules/rnn.py:82: UserWarning: dropout option adds dropout after all but last recurrent layer, so non-zero dropout expects num_layers greater than 1, but got dropout=0.3643703123631078 and num_layers=1
  warnings.warn("dropout option adds dropout after all but last "
{'EMBEDDING_DIM': 973, 'HIDDEN_DIM': 399, 'NUM_LAYERS': 1, 'DROPOUT': 0.30930146355395716, 'LR': 0.002431629235731816, 'WEIGHT_0': 0.3973486839136316, 'WEIGHT_1': 0.555489540828934, 'WEIGHT_2': 0.18957615391769778, 'WEIGHT_3': 0.8947693266729265, 'WEIGHT_4': 0.6077507818476796, 'WEIGHT_5': 0.4910007999160504, 'WEIGHT_6': 0.5213224895218049, 'WEIGHT_7': 0.45782423405146494, 'WEIGHT_8': 0.5111442045769954, 'optimizer': 'RMSprop'}
0
              precision    recall  f1-score   support

         LOC       0.35      0.14      0.20      1837
        MISC       0.04      0.02      0.02       922
         ORG       0.13      0.02      0.04      1341
         PER       0.06      0.02      0.03      1842

   micro avg       0.16      0.06      0.09      5942
   macro avg       0.14      0.05      0.07      5942
weighted avg       0.16      0.06      0.09      5942

{'EMBEDDING_DIM': 973, 'HIDDEN_DIM': 399, 'NUM_LAYERS': 1, 'DROPOUT': 0.30930146355395716, 'LR': 0.002431629235731816, 'WEIGHT_0': 0.3973486839136316, 'WEIGHT_1': 0.555489540828934, 'WEIGHT_2': 0.18957615391769778, 'WEIGHT_3': 0.8947693266729265, 'WEIGHT_4': 0.6077507818476796, 'WEIGHT_5': 0.4910007999160504, 'WEIGHT_6': 0.5213224895218049, 'WEIGHT_7': 0.45782423405146494, 'WEIGHT_8': 0.5111442045769954, 'optimizer': 'RMSprop'}
49
              precision    recall  f1-score   support

         LOC       0.56      0.55      0.55      1837
        MISC       0.44      0.40      0.42       922
         ORG       0.29      0.25      0.27      1341
         PER       0.34      0.35      0.35      1842

   micro avg       0.42      0.40      0.41      5942
   macro avg       0.41      0.39      0.40      5942
weighted avg       0.41      0.40      0.40      5942

epoch 49
LSTM
  0%|          | 0/50 [00:00<?, ?it/s]  2%|▏         | 1/50 [00:04<03:59,  4.90s/it]  4%|▍         | 2/50 [00:05<01:40,  2.09s/it]  6%|▌         | 3/50 [00:05<00:58,  1.24s/it]  8%|▊         | 4/50 [00:05<00:38,  1.19it/s] 10%|█         | 5/50 [00:05<00:27,  1.61it/s] 12%|█▏        | 6/50 [00:05<00:21,  2.06it/s] 14%|█▍        | 7/50 [00:06<00:17,  2.49it/s] 16%|█▌        | 8/50 [00:06<00:14,  2.89it/s] 18%|█▊        | 9/50 [00:06<00:12,  3.24it/s] 20%|██        | 10/50 [00:06<00:11,  3.53it/s] 22%|██▏       | 11/50 [00:07<00:10,  3.76it/s] 24%|██▍       | 12/50 [00:07<00:09,  3.94it/s] 26%|██▌       | 13/50 [00:07<00:09,  4.07it/s] 28%|██▊       | 14/50 [00:07<00:08,  4.16it/s] 30%|███       | 15/50 [00:07<00:08,  4.23it/s] 32%|███▏      | 16/50 [00:08<00:07,  4.28it/s] 34%|███▍      | 17/50 [00:08<00:07,  4.32it/s] 36%|███▌      | 18/50 [00:08<00:07,  4.34it/s] 38%|███▊      | 19/50 [00:08<00:07,  4.36it/s] 40%|████      | 20/50 [00:09<00:06,  4.37it/s] 42%|████▏     | 21/50 [00:09<00:06,  4.38it/s] 44%|████▍     | 22/50 [00:09<00:06,  4.39it/s] 46%|████▌     | 23/50 [00:09<00:06,  4.39it/s] 48%|████▊     | 24/50 [00:10<00:05,  4.39it/s] 50%|█████     | 25/50 [00:10<00:05,  4.40it/s] 52%|█████▏    | 26/50 [00:10<00:05,  4.40it/s] 54%|█████▍    | 27/50 [00:10<00:05,  4.40it/s] 56%|█████▌    | 28/50 [00:10<00:04,  4.40it/s] 58%|█████▊    | 29/50 [00:11<00:04,  4.40it/s] 60%|██████    | 30/50 [00:11<00:04,  4.40it/s] 62%|██████▏   | 31/50 [00:11<00:04,  4.40it/s] 64%|██████▍   | 32/50 [00:11<00:04,  4.40it/s] 66%|██████▌   | 33/50 [00:12<00:03,  4.40it/s] 68%|██████▊   | 34/50 [00:12<00:03,  4.40it/s] 70%|███████   | 35/50 [00:12<00:03,  4.40it/s] 72%|███████▏  | 36/50 [00:12<00:03,  4.40it/s] 74%|███████▍  | 37/50 [00:12<00:02,  4.39it/s] 76%|███████▌  | 38/50 [00:13<00:02,  4.40it/s] 78%|███████▊  | 39/50 [00:13<00:02,  4.39it/s] 80%|████████  | 40/50 [00:13<00:02,  4.39it/s] 82%|████████▏ | 41/50 [00:13<00:02,  4.40it/s] 84%|████████▍ | 42/50 [00:14<00:01,  4.40it/s] 86%|████████▌ | 43/50 [00:14<00:01,  4.40it/s] 88%|████████▊ | 44/50 [00:14<00:01,  4.39it/s] 90%|█████████ | 45/50 [00:14<00:01,  4.39it/s] 92%|█████████▏| 46/50 [00:15<00:00,  4.39it/s] 94%|█████████▍| 47/50 [00:15<00:00,  4.39it/s] 96%|█████████▌| 48/50 [00:15<00:00,  4.39it/s] 98%|█████████▊| 49/50 [00:15<00:00,  4.39it/s]100%|██████████| 50/50 [00:20<00:00,  1.64s/it]100%|██████████| 50/50 [00:20<00:00,  2.42it/s]
[I 2023-12-10 23:26:31,949] Trial 254 finished with value: 0.3272586872586873 and parameters: {'EMBEDDING_DIM': 997, 'HIDDEN_DIM': 345, 'NUM_LAYERS': 1, 'DROPOUT': 0.3643703123631078, 'LR': 0.008826887668757978, 'WEIGHT_0': 0.4548542331781876, 'WEIGHT_1': 0.7140418898826196, 'WEIGHT_2': 0.32507303547541117, 'WEIGHT_3': 0.8538385857212551, 'WEIGHT_4': 0.9193611471679347, 'WEIGHT_5': 0.8566537526054181, 'WEIGHT_6': 0.49963097359186626, 'WEIGHT_7': 0.24849533249869857, 'WEIGHT_8': 0.8111527377871636, 'optimizer': 'RMSprop'}. Best is trial 221 with value: 0.418736930154747.
/userhome/cs2/dingruiw/conda/envs/py310/lib/python3.10/site-packages/torch/nn/modules/rnn.py:82: UserWarning: dropout option adds dropout after all but last recurrent layer, so non-zero dropout expects num_layers greater than 1, but got dropout=0.33292421471580264 and num_layers=1
  warnings.warn("dropout option adds dropout after all but last "
{'EMBEDDING_DIM': 997, 'HIDDEN_DIM': 345, 'NUM_LAYERS': 1, 'DROPOUT': 0.3643703123631078, 'LR': 0.008826887668757978, 'WEIGHT_0': 0.4548542331781876, 'WEIGHT_1': 0.7140418898826196, 'WEIGHT_2': 0.32507303547541117, 'WEIGHT_3': 0.8538385857212551, 'WEIGHT_4': 0.9193611471679347, 'WEIGHT_5': 0.8566537526054181, 'WEIGHT_6': 0.49963097359186626, 'WEIGHT_7': 0.24849533249869857, 'WEIGHT_8': 0.8111527377871636, 'optimizer': 'RMSprop'}
0
              precision    recall  f1-score   support

         LOC       0.10      0.01      0.02      1837
        MISC       0.02      0.01      0.01       922
         ORG       0.09      0.00      0.01      1341
         PER       0.09      0.00      0.00      1842

   micro avg       0.06      0.01      0.01      5942
   macro avg       0.07      0.01      0.01      5942
weighted avg       0.08      0.01      0.01      5942

{'EMBEDDING_DIM': 997, 'HIDDEN_DIM': 345, 'NUM_LAYERS': 1, 'DROPOUT': 0.3643703123631078, 'LR': 0.008826887668757978, 'WEIGHT_0': 0.4548542331781876, 'WEIGHT_1': 0.7140418898826196, 'WEIGHT_2': 0.32507303547541117, 'WEIGHT_3': 0.8538385857212551, 'WEIGHT_4': 0.9193611471679347, 'WEIGHT_5': 0.8566537526054181, 'WEIGHT_6': 0.49963097359186626, 'WEIGHT_7': 0.24849533249869857, 'WEIGHT_8': 0.8111527377871636, 'optimizer': 'RMSprop'}
49
              precision    recall  f1-score   support

         LOC       0.42      0.54      0.47      1837
        MISC       0.26      0.37      0.31       922
         ORG       0.20      0.22      0.21      1341
         PER       0.26      0.27      0.27      1842

   micro avg       0.30      0.36      0.33      5942
   macro avg       0.29      0.35      0.31      5942
weighted avg       0.30      0.36      0.32      5942

epoch 49
LSTM
  0%|          | 0/50 [00:00<?, ?it/s]  2%|▏         | 1/50 [00:04<03:59,  4.88s/it]  4%|▍         | 2/50 [00:05<01:40,  2.10s/it]  6%|▌         | 3/50 [00:05<01:00,  1.28s/it]  8%|▊         | 4/50 [00:05<00:40,  1.12it/s] 10%|█         | 5/50 [00:05<00:30,  1.49it/s] 12%|█▏        | 6/50 [00:06<00:23,  1.84it/s] 14%|█▍        | 7/50 [00:06<00:19,  2.16it/s] 16%|█▌        | 8/50 [00:06<00:17,  2.44it/s] 18%|█▊        | 9/50 [00:07<00:15,  2.68it/s] 20%|██        | 10/50 [00:07<00:13,  2.87it/s] 22%|██▏       | 11/50 [00:07<00:12,  3.01it/s] 24%|██▍       | 12/50 [00:07<00:12,  3.12it/s] 26%|██▌       | 13/50 [00:08<00:11,  3.20it/s] 28%|██▊       | 14/50 [00:08<00:11,  3.26it/s] 30%|███       | 15/50 [00:08<00:10,  3.30it/s] 32%|███▏      | 16/50 [00:09<00:10,  3.33it/s] 34%|███▍      | 17/50 [00:09<00:09,  3.35it/s] 36%|███▌      | 18/50 [00:09<00:09,  3.36it/s] 38%|███▊      | 19/50 [00:10<00:09,  3.38it/s] 40%|████      | 20/50 [00:10<00:08,  3.38it/s] 42%|████▏     | 21/50 [00:10<00:08,  3.39it/s] 44%|████▍     | 22/50 [00:10<00:08,  3.39it/s] 46%|████▌     | 23/50 [00:11<00:07,  3.39it/s] 48%|████▊     | 24/50 [00:11<00:07,  3.39it/s] 50%|█████     | 25/50 [00:11<00:07,  3.40it/s] 52%|█████▏    | 26/50 [00:12<00:07,  3.39it/s] 54%|█████▍    | 27/50 [00:12<00:06,  3.40it/s] 56%|█████▌    | 28/50 [00:12<00:06,  3.39it/s] 58%|█████▊    | 29/50 [00:12<00:06,  3.40it/s] 60%|██████    | 30/50 [00:13<00:05,  3.39it/s] 62%|██████▏   | 31/50 [00:13<00:05,  3.40it/s] 64%|██████▍   | 32/50 [00:13<00:05,  3.39it/s] 66%|██████▌   | 33/50 [00:14<00:05,  3.40it/s] 68%|██████▊   | 34/50 [00:14<00:04,  3.39it/s] 70%|███████   | 35/50 [00:14<00:04,  3.39it/s] 72%|███████▏  | 36/50 [00:15<00:04,  3.39it/s] 74%|███████▍  | 37/50 [00:15<00:03,  3.39it/s] 76%|███████▌  | 38/50 [00:15<00:03,  3.39it/s] 78%|███████▊  | 39/50 [00:15<00:03,  3.38it/s] 80%|████████  | 40/50 [00:16<00:02,  3.39it/s] 82%|████████▏ | 41/50 [00:16<00:02,  3.38it/s] 84%|████████▍ | 42/50 [00:16<00:02,  3.38it/s] 86%|████████▌ | 43/50 [00:17<00:02,  3.38it/s] 88%|████████▊ | 44/50 [00:17<00:01,  3.38it/s] 90%|█████████ | 45/50 [00:17<00:01,  3.38it/s] 92%|█████████▏| 46/50 [00:18<00:01,  3.38it/s] 94%|█████████▍| 47/50 [00:18<00:00,  3.38it/s] 96%|█████████▌| 48/50 [00:18<00:00,  3.38it/s] 98%|█████████▊| 49/50 [00:18<00:00,  3.38it/s]100%|██████████| 50/50 [00:23<00:00,  1.73s/it]100%|██████████| 50/50 [00:23<00:00,  2.09it/s]
[I 2023-12-10 23:27:00,290] Trial 255 finished with value: 0.4024640657084189 and parameters: {'EMBEDDING_DIM': 942, 'HIDDEN_DIM': 437, 'NUM_LAYERS': 1, 'DROPOUT': 0.33292421471580264, 'LR': 0.0020340681989635184, 'WEIGHT_0': 0.34077809708388607, 'WEIGHT_1': 0.5273759416433187, 'WEIGHT_2': 0.4664627588407701, 'WEIGHT_3': 0.7494121423126727, 'WEIGHT_4': 0.871489993129031, 'WEIGHT_5': 0.4446647293494224, 'WEIGHT_6': 0.5976566314594423, 'WEIGHT_7': 0.33069616725801476, 'WEIGHT_8': 0.8957278209527835, 'optimizer': 'Adam'}. Best is trial 221 with value: 0.418736930154747.
/userhome/cs2/dingruiw/conda/envs/py310/lib/python3.10/site-packages/torch/nn/modules/rnn.py:82: UserWarning: dropout option adds dropout after all but last recurrent layer, so non-zero dropout expects num_layers greater than 1, but got dropout=0.38090608519168284 and num_layers=1
  warnings.warn("dropout option adds dropout after all but last "
{'EMBEDDING_DIM': 942, 'HIDDEN_DIM': 437, 'NUM_LAYERS': 1, 'DROPOUT': 0.33292421471580264, 'LR': 0.0020340681989635184, 'WEIGHT_0': 0.34077809708388607, 'WEIGHT_1': 0.5273759416433187, 'WEIGHT_2': 0.4664627588407701, 'WEIGHT_3': 0.7494121423126727, 'WEIGHT_4': 0.871489993129031, 'WEIGHT_5': 0.4446647293494224, 'WEIGHT_6': 0.5976566314594423, 'WEIGHT_7': 0.33069616725801476, 'WEIGHT_8': 0.8957278209527835, 'optimizer': 'Adam'}
0
              precision    recall  f1-score   support

         LOC       0.04      0.03      0.04      1837
        MISC       0.03      0.05      0.04       922
         ORG       0.05      0.07      0.06      1341
         PER       0.02      0.02      0.02      1842

   micro avg       0.04      0.04      0.04      5942
   macro avg       0.04      0.04      0.04      5942
weighted avg       0.04      0.04      0.04      5942

{'EMBEDDING_DIM': 942, 'HIDDEN_DIM': 437, 'NUM_LAYERS': 1, 'DROPOUT': 0.33292421471580264, 'LR': 0.0020340681989635184, 'WEIGHT_0': 0.34077809708388607, 'WEIGHT_1': 0.5273759416433187, 'WEIGHT_2': 0.4664627588407701, 'WEIGHT_3': 0.7494121423126727, 'WEIGHT_4': 0.871489993129031, 'WEIGHT_5': 0.4446647293494224, 'WEIGHT_6': 0.5976566314594423, 'WEIGHT_7': 0.33069616725801476, 'WEIGHT_8': 0.8957278209527835, 'optimizer': 'Adam'}
49
              precision    recall  f1-score   support

         LOC       0.58      0.56      0.57      1837
        MISC       0.40      0.43      0.42       922
         ORG       0.26      0.26      0.26      1341
         PER       0.32      0.37      0.34      1842

   micro avg       0.39      0.41      0.40      5942
   macro avg       0.39      0.40      0.40      5942
weighted avg       0.40      0.41      0.40      5942

epoch 49
LSTM
  0%|          | 0/50 [00:00<?, ?it/s]  2%|▏         | 1/50 [00:04<03:53,  4.76s/it]  6%|▌         | 3/50 [00:05<01:02,  1.33s/it]  8%|▊         | 4/50 [00:05<00:42,  1.08it/s] 10%|█         | 5/50 [00:05<00:30,  1.50it/s] 12%|█▏        | 6/50 [00:05<00:22,  1.99it/s] 14%|█▍        | 7/50 [00:05<00:16,  2.55it/s] 16%|█▌        | 8/50 [00:05<00:13,  3.15it/s] 18%|█▊        | 9/50 [00:05<00:10,  3.75it/s] 20%|██        | 10/50 [00:06<00:09,  4.30it/s] 22%|██▏       | 11/50 [00:06<00:08,  4.80it/s] 24%|██▍       | 12/50 [00:06<00:07,  5.23it/s] 26%|██▌       | 13/50 [00:06<00:06,  5.57it/s] 28%|██▊       | 14/50 [00:06<00:06,  5.83it/s] 30%|███       | 15/50 [00:06<00:05,  6.04it/s] 32%|███▏      | 16/50 [00:07<00:05,  6.18it/s] 34%|███▍      | 17/50 [00:07<00:05,  6.29it/s] 36%|███▌      | 18/50 [00:07<00:05,  6.36it/s] 38%|███▊      | 19/50 [00:07<00:04,  6.41it/s] 40%|████      | 20/50 [00:07<00:04,  6.44it/s] 42%|████▏     | 21/50 [00:07<00:04,  6.48it/s] 44%|████▍     | 22/50 [00:07<00:04,  6.50it/s] 46%|████▌     | 23/50 [00:08<00:04,  6.51it/s] 48%|████▊     | 24/50 [00:08<00:03,  6.53it/s] 50%|█████     | 25/50 [00:08<00:03,  6.54it/s] 52%|█████▏    | 26/50 [00:08<00:03,  6.55it/s] 54%|█████▍    | 27/50 [00:08<00:03,  6.55it/s] 56%|█████▌    | 28/50 [00:08<00:03,  6.55it/s] 58%|█████▊    | 29/50 [00:08<00:03,  6.55it/s] 60%|██████    | 30/50 [00:09<00:03,  6.55it/s] 62%|██████▏   | 31/50 [00:09<00:02,  6.55it/s] 64%|██████▍   | 32/50 [00:09<00:02,  6.55it/s] 66%|██████▌   | 33/50 [00:09<00:02,  6.55it/s] 68%|██████▊   | 34/50 [00:09<00:02,  6.55it/s] 70%|███████   | 35/50 [00:09<00:02,  6.54it/s] 72%|███████▏  | 36/50 [00:10<00:02,  6.54it/s] 74%|███████▍  | 37/50 [00:10<00:01,  6.55it/s] 76%|███████▌  | 38/50 [00:10<00:01,  6.54it/s] 78%|███████▊  | 39/50 [00:10<00:01,  6.55it/s] 80%|████████  | 40/50 [00:10<00:01,  6.56it/s] 82%|████████▏ | 41/50 [00:10<00:01,  6.55it/s] 84%|████████▍ | 42/50 [00:10<00:01,  6.55it/s] 86%|████████▌ | 43/50 [00:11<00:01,  6.55it/s] 88%|████████▊ | 44/50 [00:11<00:00,  6.55it/s] 90%|█████████ | 45/50 [00:11<00:00,  6.55it/s] 92%|█████████▏| 46/50 [00:11<00:00,  6.54it/s] 94%|█████████▍| 47/50 [00:11<00:00,  6.54it/s] 96%|█████████▌| 48/50 [00:11<00:00,  6.54it/s] 98%|█████████▊| 49/50 [00:12<00:00,  6.53it/s]100%|██████████| 50/50 [00:16<00:00,  1.53s/it]100%|██████████| 50/50 [00:16<00:00,  2.98it/s]
[I 2023-12-10 23:27:21,455] Trial 256 finished with value: 0.3591796715417926 and parameters: {'EMBEDDING_DIM': 894, 'HIDDEN_DIM': 250, 'NUM_LAYERS': 1, 'DROPOUT': 0.38090608519168284, 'LR': 0.00502344934048889, 'WEIGHT_0': 0.508680575841779, 'WEIGHT_1': 0.742228494893407, 'WEIGHT_2': 0.2755461987385247, 'WEIGHT_3': 0.9505881530250431, 'WEIGHT_4': 0.5311619379552532, 'WEIGHT_5': 0.6578851013294733, 'WEIGHT_6': 0.9621299460619237, 'WEIGHT_7': 0.4021995842144714, 'WEIGHT_8': 0.8450477343597637, 'optimizer': 'RMSprop'}. Best is trial 221 with value: 0.418736930154747.
/userhome/cs2/dingruiw/conda/envs/py310/lib/python3.10/site-packages/torch/nn/modules/rnn.py:82: UserWarning: dropout option adds dropout after all but last recurrent layer, so non-zero dropout expects num_layers greater than 1, but got dropout=0.15239621569069117 and num_layers=1
  warnings.warn("dropout option adds dropout after all but last "
{'EMBEDDING_DIM': 894, 'HIDDEN_DIM': 250, 'NUM_LAYERS': 1, 'DROPOUT': 0.38090608519168284, 'LR': 0.00502344934048889, 'WEIGHT_0': 0.508680575841779, 'WEIGHT_1': 0.742228494893407, 'WEIGHT_2': 0.2755461987385247, 'WEIGHT_3': 0.9505881530250431, 'WEIGHT_4': 0.5311619379552532, 'WEIGHT_5': 0.6578851013294733, 'WEIGHT_6': 0.9621299460619237, 'WEIGHT_7': 0.4021995842144714, 'WEIGHT_8': 0.8450477343597637, 'optimizer': 'RMSprop'}
0
              precision    recall  f1-score   support

         LOC       0.45      0.09      0.15      1837
        MISC       0.05      0.01      0.02       922
         ORG       0.08      0.02      0.04      1341
         PER       0.04      0.01      0.01      1842

   micro avg       0.17      0.04      0.06      5942
   macro avg       0.16      0.03      0.05      5942
weighted avg       0.18      0.04      0.06      5942

{'EMBEDDING_DIM': 894, 'HIDDEN_DIM': 250, 'NUM_LAYERS': 1, 'DROPOUT': 0.38090608519168284, 'LR': 0.00502344934048889, 'WEIGHT_0': 0.508680575841779, 'WEIGHT_1': 0.742228494893407, 'WEIGHT_2': 0.2755461987385247, 'WEIGHT_3': 0.9505881530250431, 'WEIGHT_4': 0.5311619379552532, 'WEIGHT_5': 0.6578851013294733, 'WEIGHT_6': 0.9621299460619237, 'WEIGHT_7': 0.4021995842144714, 'WEIGHT_8': 0.8450477343597637, 'optimizer': 'RMSprop'}
49
              precision    recall  f1-score   support

         LOC       0.51      0.50      0.50      1837
        MISC       0.37      0.40      0.38       922
         ORG       0.21      0.25      0.23      1341
         PER       0.31      0.32      0.31      1842

   micro avg       0.35      0.37      0.36      5942
   macro avg       0.35      0.37      0.36      5942
weighted avg       0.36      0.37      0.36      5942

epoch 49
LSTM
  0%|          | 0/50 [00:00<?, ?it/s]  2%|▏         | 1/50 [00:04<03:56,  4.83s/it]  4%|▍         | 2/50 [00:04<01:38,  2.05s/it]  6%|▌         | 3/50 [00:05<00:56,  1.21s/it]  8%|▊         | 4/50 [00:05<00:37,  1.23it/s] 10%|█         | 5/50 [00:05<00:26,  1.69it/s] 12%|█▏        | 6/50 [00:05<00:20,  2.17it/s] 14%|█▍        | 7/50 [00:05<00:16,  2.66it/s] 16%|█▌        | 8/50 [00:06<00:13,  3.12it/s] 18%|█▊        | 9/50 [00:06<00:11,  3.52it/s] 20%|██        | 10/50 [00:06<00:10,  3.86it/s] 22%|██▏       | 11/50 [00:06<00:09,  4.13it/s] 24%|██▍       | 12/50 [00:06<00:08,  4.34it/s] 26%|██▌       | 13/50 [00:07<00:08,  4.50it/s] 28%|██▊       | 14/50 [00:07<00:07,  4.62it/s] 30%|███       | 15/50 [00:07<00:07,  4.70it/s] 32%|███▏      | 16/50 [00:07<00:07,  4.77it/s] 34%|███▍      | 17/50 [00:07<00:06,  4.81it/s] 36%|███▌      | 18/50 [00:08<00:06,  4.84it/s] 38%|███▊      | 19/50 [00:08<00:06,  4.87it/s] 40%|████      | 20/50 [00:08<00:06,  4.88it/s] 42%|████▏     | 21/50 [00:08<00:05,  4.89it/s] 44%|████▍     | 22/50 [00:09<00:05,  4.90it/s] 46%|████▌     | 23/50 [00:09<00:05,  4.91it/s] 48%|████▊     | 24/50 [00:09<00:05,  4.91it/s] 50%|█████     | 25/50 [00:09<00:05,  4.92it/s] 52%|█████▏    | 26/50 [00:09<00:04,  4.92it/s] 54%|█████▍    | 27/50 [00:10<00:04,  4.92it/s] 56%|█████▌    | 28/50 [00:10<00:04,  4.93it/s] 58%|█████▊    | 29/50 [00:10<00:04,  4.92it/s] 60%|██████    | 30/50 [00:10<00:04,  4.92it/s] 62%|██████▏   | 31/50 [00:10<00:03,  4.92it/s] 64%|██████▍   | 32/50 [00:11<00:03,  4.92it/s] 66%|██████▌   | 33/50 [00:11<00:03,  4.92it/s] 68%|██████▊   | 34/50 [00:11<00:03,  4.92it/s] 70%|███████   | 35/50 [00:11<00:03,  4.92it/s] 72%|███████▏  | 36/50 [00:11<00:02,  4.91it/s] 74%|███████▍  | 37/50 [00:12<00:02,  4.91it/s] 76%|███████▌  | 38/50 [00:12<00:02,  4.90it/s] 78%|███████▊  | 39/50 [00:12<00:02,  4.90it/s] 80%|████████  | 40/50 [00:12<00:02,  4.90it/s] 82%|████████▏ | 41/50 [00:12<00:01,  4.90it/s] 84%|████████▍ | 42/50 [00:13<00:01,  4.91it/s] 86%|████████▌ | 43/50 [00:13<00:01,  4.92it/s] 88%|████████▊ | 44/50 [00:13<00:01,  4.92it/s] 90%|█████████ | 45/50 [00:13<00:01,  4.92it/s] 92%|█████████▏| 46/50 [00:13<00:00,  4.92it/s] 94%|█████████▍| 47/50 [00:14<00:00,  4.92it/s] 96%|█████████▌| 48/50 [00:14<00:00,  4.92it/s] 98%|█████████▊| 49/50 [00:14<00:00,  4.92it/s]100%|██████████| 50/50 [00:19<00:00,  1.60s/it]100%|██████████| 50/50 [00:19<00:00,  2.58it/s]
