[I 2023-12-11 00:31:58,428] Trial 393 finished with value: 0.37592204717238864 and parameters: {'EMBEDDING_DIM': 956, 'HIDDEN_DIM': 837, 'NUM_LAYERS': 1, 'DROPOUT': 0.048343843488157755, 'LR': 0.0003954427359482611, 'WEIGHT_0': 0.2743638272711952, 'WEIGHT_1': 0.16144931035019439, 'WEIGHT_2': 0.4927853843506937, 'WEIGHT_3': 0.69486717752642, 'WEIGHT_4': 0.7439262721001348, 'WEIGHT_5': 0.7304083045754692, 'WEIGHT_6': 0.9064878977410871, 'WEIGHT_7': 0.15823933473478588, 'WEIGHT_8': 0.8908295403449908, 'optimizer': 'RMSprop'}. Best is trial 365 with value: 0.41910947782240837.
/userhome/cs2/dingruiw/conda/envs/py310/lib/python3.10/site-packages/torch/nn/modules/rnn.py:82: UserWarning: dropout option adds dropout after all but last recurrent layer, so non-zero dropout expects num_layers greater than 1, but got dropout=0.03650531450844683 and num_layers=1
  warnings.warn("dropout option adds dropout after all but last "
{'EMBEDDING_DIM': 956, 'HIDDEN_DIM': 837, 'NUM_LAYERS': 1, 'DROPOUT': 0.048343843488157755, 'LR': 0.0003954427359482611, 'WEIGHT_0': 0.2743638272711952, 'WEIGHT_1': 0.16144931035019439, 'WEIGHT_2': 0.4927853843506937, 'WEIGHT_3': 0.69486717752642, 'WEIGHT_4': 0.7439262721001348, 'WEIGHT_5': 0.7304083045754692, 'WEIGHT_6': 0.9064878977410871, 'WEIGHT_7': 0.15823933473478588, 'WEIGHT_8': 0.8908295403449908, 'optimizer': 'RMSprop'}
0
              precision    recall  f1-score   support

         LOC       0.21      0.13      0.16      1837
        MISC       0.02      0.03      0.02       922
         ORG       0.06      0.05      0.05      1341
         PER       0.04      0.03      0.03      1842

   micro avg       0.08      0.06      0.07      5942
   macro avg       0.08      0.06      0.07      5942
weighted avg       0.09      0.06      0.07      5942

{'EMBEDDING_DIM': 956, 'HIDDEN_DIM': 837, 'NUM_LAYERS': 1, 'DROPOUT': 0.048343843488157755, 'LR': 0.0003954427359482611, 'WEIGHT_0': 0.2743638272711952, 'WEIGHT_1': 0.16144931035019439, 'WEIGHT_2': 0.4927853843506937, 'WEIGHT_3': 0.69486717752642, 'WEIGHT_4': 0.7439262721001348, 'WEIGHT_5': 0.7304083045754692, 'WEIGHT_6': 0.9064878977410871, 'WEIGHT_7': 0.15823933473478588, 'WEIGHT_8': 0.8908295403449908, 'optimizer': 'RMSprop'}
49
              precision    recall  f1-score   support

         LOC       0.54      0.50      0.52      1837
        MISC       0.43      0.39      0.41       922
         ORG       0.25      0.11      0.15      1341
         PER       0.34      0.35      0.34      1842

   micro avg       0.41      0.35      0.38      5942
   macro avg       0.39      0.34      0.36      5942
weighted avg       0.39      0.35      0.36      5942

epoch 49
LSTM
  0%|          | 0/50 [00:00<?, ?it/s]  2%|▏         | 1/50 [00:04<03:39,  4.49s/it]  6%|▌         | 3/50 [00:04<00:59,  1.26s/it]  8%|▊         | 4/50 [00:04<00:40,  1.14it/s] 10%|█         | 5/50 [00:05<00:28,  1.57it/s] 12%|█▏        | 6/50 [00:05<00:21,  2.08it/s] 14%|█▍        | 7/50 [00:05<00:16,  2.65it/s] 16%|█▌        | 8/50 [00:05<00:12,  3.25it/s] 18%|█▊        | 9/50 [00:05<00:10,  3.84it/s] 20%|██        | 10/50 [00:05<00:09,  4.39it/s] 22%|██▏       | 11/50 [00:05<00:08,  4.87it/s] 24%|██▍       | 12/50 [00:06<00:07,  5.27it/s] 26%|██▌       | 13/50 [00:06<00:06,  5.60it/s] 28%|██▊       | 14/50 [00:06<00:06,  5.85it/s] 30%|███       | 15/50 [00:06<00:05,  6.05it/s] 32%|███▏      | 16/50 [00:06<00:05,  6.18it/s] 34%|███▍      | 17/50 [00:06<00:05,  6.29it/s] 36%|███▌      | 18/50 [00:07<00:05,  6.36it/s] 38%|███▊      | 19/50 [00:07<00:04,  6.39it/s] 40%|████      | 20/50 [00:07<00:04,  6.43it/s] 42%|████▏     | 21/50 [00:07<00:04,  6.45it/s] 44%|████▍     | 22/50 [00:07<00:04,  6.47it/s] 46%|████▌     | 23/50 [00:07<00:04,  6.49it/s] 48%|████▊     | 24/50 [00:07<00:03,  6.51it/s] 50%|█████     | 25/50 [00:08<00:03,  6.42it/s] 52%|█████▏    | 26/50 [00:08<00:03,  6.44it/s] 54%|█████▍    | 27/50 [00:08<00:03,  6.47it/s] 56%|█████▌    | 28/50 [00:08<00:03,  6.48it/s] 58%|█████▊    | 29/50 [00:08<00:03,  6.50it/s] 60%|██████    | 30/50 [00:08<00:03,  6.50it/s] 62%|██████▏   | 31/50 [00:09<00:02,  6.46it/s] 64%|██████▍   | 32/50 [00:09<00:02,  6.39it/s] 66%|██████▌   | 33/50 [00:09<00:02,  6.43it/s] 68%|██████▊   | 34/50 [00:09<00:02,  6.41it/s] 70%|███████   | 35/50 [00:09<00:02,  6.40it/s] 72%|███████▏  | 36/50 [00:09<00:02,  6.43it/s] 74%|███████▍  | 37/50 [00:09<00:02,  6.46it/s] 76%|███████▌  | 38/50 [00:10<00:01,  6.41it/s] 78%|███████▊  | 39/50 [00:10<00:01,  6.40it/s] 80%|████████  | 40/50 [00:10<00:01,  6.43it/s] 82%|████████▏ | 41/50 [00:10<00:01,  6.38it/s] 84%|████████▍ | 42/50 [00:10<00:01,  6.42it/s] 86%|████████▌ | 43/50 [00:10<00:01,  6.40it/s] 88%|████████▊ | 44/50 [00:11<00:00,  6.39it/s] 90%|█████████ | 45/50 [00:11<00:00,  6.43it/s] 92%|█████████▏| 46/50 [00:11<00:00,  6.37it/s] 94%|█████████▍| 47/50 [00:11<00:00,  6.38it/s] 96%|█████████▌| 48/50 [00:11<00:00,  6.41it/s] 98%|█████████▊| 49/50 [00:11<00:00,  6.44it/s]100%|██████████| 50/50 [00:16<00:00,  1.49s/it]100%|██████████| 50/50 [00:16<00:00,  3.04it/s]
[I 2023-12-11 00:32:18,955] Trial 394 finished with value: 0.30232991612301957 and parameters: {'EMBEDDING_DIM': 491, 'HIDDEN_DIM': 324, 'NUM_LAYERS': 1, 'DROPOUT': 0.03650531450844683, 'LR': 0.009039795398504722, 'WEIGHT_0': 0.19007533639251856, 'WEIGHT_1': 0.7341683018999495, 'WEIGHT_2': 0.5184382497820016, 'WEIGHT_3': 0.9659421701045198, 'WEIGHT_4': 0.7777178761981938, 'WEIGHT_5': 0.7093897195456125, 'WEIGHT_6': 0.44925979436060365, 'WEIGHT_7': 0.36964128347151176, 'WEIGHT_8': 0.3798791224341573, 'optimizer': 'RMSprop'}. Best is trial 365 with value: 0.41910947782240837.
/userhome/cs2/dingruiw/conda/envs/py310/lib/python3.10/site-packages/torch/nn/modules/rnn.py:82: UserWarning: dropout option adds dropout after all but last recurrent layer, so non-zero dropout expects num_layers greater than 1, but got dropout=0.02147242376520389 and num_layers=1
  warnings.warn("dropout option adds dropout after all but last "
{'EMBEDDING_DIM': 491, 'HIDDEN_DIM': 324, 'NUM_LAYERS': 1, 'DROPOUT': 0.03650531450844683, 'LR': 0.009039795398504722, 'WEIGHT_0': 0.19007533639251856, 'WEIGHT_1': 0.7341683018999495, 'WEIGHT_2': 0.5184382497820016, 'WEIGHT_3': 0.9659421701045198, 'WEIGHT_4': 0.7777178761981938, 'WEIGHT_5': 0.7093897195456125, 'WEIGHT_6': 0.44925979436060365, 'WEIGHT_7': 0.36964128347151176, 'WEIGHT_8': 0.3798791224341573, 'optimizer': 'RMSprop'}
0
              precision    recall  f1-score   support

         LOC       0.06      0.01      0.02      1837
        MISC       0.09      0.00      0.01       922
         ORG       0.08      0.01      0.02      1341
         PER       0.04      0.00      0.01      1842

   micro avg       0.06      0.01      0.01      5942
   macro avg       0.07      0.01      0.01      5942
