[I 2023-12-10 23:09:52,812] Trial 217 finished with value: 0.4082312755144547 and parameters: {'EMBEDDING_DIM': 955, 'HIDDEN_DIM': 477, 'NUM_LAYERS': 1, 'DROPOUT': 0.36153294405526937, 'LR': 0.0018102395475629973, 'WEIGHT_0': 0.48178067291534626, 'WEIGHT_1': 0.49252763735498173, 'WEIGHT_2': 0.49493661244837855, 'WEIGHT_3': 0.8055795669271311, 'WEIGHT_4': 0.9334776050917124, 'WEIGHT_5': 0.5661445067408465, 'WEIGHT_6': 0.6906762741826401, 'WEIGHT_7': 0.368561418306194, 'WEIGHT_8': 0.7593012862484078, 'optimizer': 'Adam'}. Best is trial 134 with value: 0.4158467115484205.
/userhome/cs2/dingruiw/conda/envs/py310/lib/python3.10/site-packages/torch/nn/modules/rnn.py:82: UserWarning: dropout option adds dropout after all but last recurrent layer, so non-zero dropout expects num_layers greater than 1, but got dropout=0.37672579550398744 and num_layers=1
  warnings.warn("dropout option adds dropout after all but last "
{'EMBEDDING_DIM': 955, 'HIDDEN_DIM': 477, 'NUM_LAYERS': 1, 'DROPOUT': 0.36153294405526937, 'LR': 0.0018102395475629973, 'WEIGHT_0': 0.48178067291534626, 'WEIGHT_1': 0.49252763735498173, 'WEIGHT_2': 0.49493661244837855, 'WEIGHT_3': 0.8055795669271311, 'WEIGHT_4': 0.9334776050917124, 'WEIGHT_5': 0.5661445067408465, 'WEIGHT_6': 0.6906762741826401, 'WEIGHT_7': 0.368561418306194, 'WEIGHT_8': 0.7593012862484078, 'optimizer': 'Adam'}
0
              precision    recall  f1-score   support

         LOC       0.04      0.04      0.04      1837
        MISC       0.02      0.03      0.02       922
         ORG       0.04      0.06      0.05      1341
         PER       0.02      0.03      0.03      1842

   micro avg       0.03      0.04      0.04      5942
   macro avg       0.03      0.04      0.03      5942
weighted avg       0.03      0.04      0.04      5942

{'EMBEDDING_DIM': 955, 'HIDDEN_DIM': 477, 'NUM_LAYERS': 1, 'DROPOUT': 0.36153294405526937, 'LR': 0.0018102395475629973, 'WEIGHT_0': 0.48178067291534626, 'WEIGHT_1': 0.49252763735498173, 'WEIGHT_2': 0.49493661244837855, 'WEIGHT_3': 0.8055795669271311, 'WEIGHT_4': 0.9334776050917124, 'WEIGHT_5': 0.5661445067408465, 'WEIGHT_6': 0.6906762741826401, 'WEIGHT_7': 0.368561418306194, 'WEIGHT_8': 0.7593012862484078, 'optimizer': 'Adam'}
49
              precision    recall  f1-score   support

         LOC       0.55      0.55      0.55      1837
        MISC       0.44      0.44      0.44       922
         ORG       0.30      0.28      0.29      1341
         PER       0.32      0.36      0.34      1842

   micro avg       0.40      0.41      0.41      5942
   macro avg       0.40      0.41      0.40      5942
weighted avg       0.41      0.41      0.41      5942

epoch 49
LSTM
  0%|          | 0/50 [00:00<?, ?it/s]  2%|▏         | 1/50 [00:04<03:54,  4.79s/it]  4%|▍         | 2/50 [00:04<01:38,  2.05s/it]  6%|▌         | 3/50 [00:05<00:57,  1.23s/it]  8%|▊         | 4/50 [00:05<00:38,  1.20it/s] 10%|█         | 5/50 [00:05<00:27,  1.63it/s] 12%|█▏        | 6/50 [00:05<00:21,  2.08it/s] 14%|█▍        | 7/50 [00:06<00:17,  2.51it/s] 16%|█▌        | 8/50 [00:06<00:14,  2.91it/s] 18%|█▊        | 9/50 [00:06<00:12,  3.25it/s] 20%|██        | 10/50 [00:06<00:11,  3.53it/s] 22%|██▏       | 11/50 [00:06<00:10,  3.76it/s] 24%|██▍       | 12/50 [00:07<00:09,  3.93it/s] 26%|██▌       | 13/50 [00:07<00:09,  4.06it/s] 28%|██▊       | 14/50 [00:07<00:08,  4.15it/s] 30%|███       | 15/50 [00:07<00:08,  4.22it/s] 32%|███▏      | 16/50 [00:08<00:07,  4.27it/s] 34%|███▍      | 17/50 [00:08<00:07,  4.30it/s] 36%|███▌      | 18/50 [00:08<00:07,  4.33it/s] 38%|███▊      | 19/50 [00:08<00:07,  4.35it/s] 40%|████      | 20/50 [00:09<00:06,  4.36it/s] 42%|████▏     | 21/50 [00:09<00:06,  4.37it/s] 44%|████▍     | 22/50 [00:09<00:06,  4.38it/s] 46%|████▌     | 23/50 [00:09<00:06,  4.38it/s] 48%|████▊     | 24/50 [00:09<00:05,  4.38it/s] 50%|█████     | 25/50 [00:10<00:05,  4.38it/s] 52%|█████▏    | 26/50 [00:10<00:05,  4.38it/s] 54%|█████▍    | 27/50 [00:10<00:05,  4.38it/s] 56%|█████▌    | 28/50 [00:10<00:05,  4.38it/s] 58%|█████▊    | 29/50 [00:11<00:04,  4.38it/s] 60%|██████    | 30/50 [00:11<00:04,  4.38it/s] 62%|██████▏   | 31/50 [00:11<00:04,  4.38it/s] 64%|██████▍   | 32/50 [00:11<00:04,  4.38it/s] 66%|██████▌   | 33/50 [00:12<00:03,  4.38it/s] 68%|██████▊   | 34/50 [00:12<00:03,  4.38it/s] 70%|███████   | 35/50 [00:12<00:03,  4.38it/s] 72%|███████▏  | 36/50 [00:12<00:03,  4.38it/s] 74%|███████▍  | 37/50 [00:12<00:02,  4.38it/s] 76%|███████▌  | 38/50 [00:13<00:02,  4.38it/s] 78%|███████▊  | 39/50 [00:13<00:02,  4.38it/s] 80%|████████  | 40/50 [00:13<00:02,  4.38it/s] 82%|████████▏ | 41/50 [00:13<00:02,  4.38it/s] 84%|████████▍ | 42/50 [00:14<00:01,  4.38it/s] 86%|████████▌ | 43/50 [00:14<00:01,  4.37it/s] 88%|████████▊ | 44/50 [00:14<00:01,  4.38it/s] 90%|█████████ | 45/50 [00:14<00:01,  4.38it/s] 92%|█████████▏| 46/50 [00:14<00:00,  4.38it/s] 94%|█████████▍| 47/50 [00:15<00:00,  4.38it/s] 96%|█████████▌| 48/50 [00:15<00:00,  4.38it/s] 98%|█████████▊| 49/50 [00:15<00:00,  4.37it/s]100%|██████████| 50/50 [00:20<00:00,  1.62s/it]100%|██████████| 50/50 [00:20<00:00,  2.43it/s]
[I 2023-12-10 23:10:17,614] Trial 218 finished with value: 0.4092420496205985 and parameters: {'EMBEDDING_DIM': 1008, 'HIDDEN_DIM': 327, 'NUM_LAYERS': 1, 'DROPOUT': 0.37672579550398744, 'LR': 0.0016836013654789757, 'WEIGHT_0': 0.48211756048891335, 'WEIGHT_1': 0.4958382280642116, 'WEIGHT_2': 0.33385297697326793, 'WEIGHT_3': 0.8043594174729722, 'WEIGHT_4': 0.9420876177790558, 'WEIGHT_5': 0.5673808645224983, 'WEIGHT_6': 0.6119327782817887, 'WEIGHT_7': 0.38865411184270593, 'WEIGHT_8': 0.8049340913419882, 'optimizer': 'Adam'}. Best is trial 134 with value: 0.4158467115484205.
/userhome/cs2/dingruiw/conda/envs/py310/lib/python3.10/site-packages/torch/nn/modules/rnn.py:82: UserWarning: dropout option adds dropout after all but last recurrent layer, so non-zero dropout expects num_layers greater than 1, but got dropout=0.3830063089247561 and num_layers=1
  warnings.warn("dropout option adds dropout after all but last "
{'EMBEDDING_DIM': 1008, 'HIDDEN_DIM': 327, 'NUM_LAYERS': 1, 'DROPOUT': 0.37672579550398744, 'LR': 0.0016836013654789757, 'WEIGHT_0': 0.48211756048891335, 'WEIGHT_1': 0.4958382280642116, 'WEIGHT_2': 0.33385297697326793, 'WEIGHT_3': 0.8043594174729722, 'WEIGHT_4': 0.9420876177790558, 'WEIGHT_5': 0.5673808645224983, 'WEIGHT_6': 0.6119327782817887, 'WEIGHT_7': 0.38865411184270593, 'WEIGHT_8': 0.8049340913419882, 'optimizer': 'Adam'}
0
              precision    recall  f1-score   support

         LOC       0.05      0.08      0.06      1837
        MISC       0.02      0.07      0.03       922
         ORG       0.03      0.05      0.04      1341
         PER       0.02      0.06      0.03      1842

   micro avg       0.02      0.06      0.04      5942
   macro avg       0.03      0.07      0.04      5942
weighted avg       0.03      0.06      0.04      5942

{'EMBEDDING_DIM': 1008, 'HIDDEN_DIM': 327, 'NUM_LAYERS': 1, 'DROPOUT': 0.37672579550398744, 'LR': 0.0016836013654789757, 'WEIGHT_0': 0.48211756048891335, 'WEIGHT_1': 0.4958382280642116, 'WEIGHT_2': 0.33385297697326793, 'WEIGHT_3': 0.8043594174729722, 'WEIGHT_4': 0.9420876177790558, 'WEIGHT_5': 0.5673808645224983, 'WEIGHT_6': 0.6119327782817887, 'WEIGHT_7': 0.38865411184270593, 'WEIGHT_8': 0.8049340913419882, 'optimizer': 'Adam'}
49
              precision    recall  f1-score   support

         LOC       0.59      0.56      0.57      1837
        MISC       0.47      0.43      0.45       922
         ORG       0.28      0.26      0.27      1341
         PER       0.32      0.35      0.33      1842

   micro avg       0.41      0.40      0.41      5942
   macro avg       0.41      0.40      0.41      5942
weighted avg       0.42      0.40      0.41      5942

epoch 49
LSTM
  0%|          | 0/50 [00:00<?, ?it/s]  2%|▏         | 1/50 [00:04<03:52,  4.74s/it]  4%|▍         | 2/50 [00:04<01:37,  2.03s/it]  6%|▌         | 3/50 [00:05<00:56,  1.21s/it]  8%|▊         | 4/50 [00:05<00:37,  1.22it/s] 10%|█         | 5/50 [00:05<00:27,  1.65it/s] 12%|█▏        | 6/50 [00:05<00:21,  2.09it/s] 14%|█▍        | 7/50 [00:06<00:17,  2.53it/s] 16%|█▌        | 8/50 [00:06<00:14,  2.92it/s] 18%|█▊        | 9/50 [00:06<00:12,  3.26it/s] 20%|██        | 10/50 [00:06<00:11,  3.55it/s] 22%|██▏       | 11/50 [00:06<00:10,  3.77it/s] 24%|██▍       | 12/50 [00:07<00:09,  3.94it/s] 26%|██▌       | 13/50 [00:07<00:09,  4.07it/s] 28%|██▊       | 14/50 [00:07<00:08,  4.16it/s] 30%|███       | 15/50 [00:07<00:08,  4.23it/s] 32%|███▏      | 16/50 [00:08<00:07,  4.28it/s] 34%|███▍      | 17/50 [00:08<00:07,  4.32it/s] 36%|███▌      | 18/50 [00:08<00:07,  4.34it/s] 38%|███▊      | 19/50 [00:08<00:07,  4.35it/s] 40%|████      | 20/50 [00:08<00:06,  4.37it/s] 42%|████▏     | 21/50 [00:09<00:06,  4.38it/s] 44%|████▍     | 22/50 [00:09<00:06,  4.39it/s] 46%|████▌     | 23/50 [00:09<00:06,  4.39it/s] 48%|████▊     | 24/50 [00:09<00:05,  4.37it/s] 50%|█████     | 25/50 [00:10<00:05,  4.38it/s] 52%|█████▏    | 26/50 [00:10<00:05,  4.38it/s] 54%|█████▍    | 27/50 [00:10<00:05,  4.38it/s] 56%|█████▌    | 28/50 [00:10<00:05,  4.38it/s] 58%|█████▊    | 29/50 [00:11<00:04,  4.38it/s] 60%|██████    | 30/50 [00:11<00:04,  4.38it/s] 62%|██████▏   | 31/50 [00:11<00:04,  4.38it/s] 64%|██████▍   | 32/50 [00:11<00:04,  4.38it/s] 66%|██████▌   | 33/50 [00:11<00:03,  4.38it/s] 68%|██████▊   | 34/50 [00:12<00:03,  4.39it/s] 70%|███████   | 35/50 [00:12<00:03,  4.38it/s] 72%|███████▏  | 36/50 [00:12<00:03,  4.38it/s] 74%|███████▍  | 37/50 [00:12<00:02,  4.37it/s] 76%|███████▌  | 38/50 [00:13<00:02,  4.38it/s] 78%|███████▊  | 39/50 [00:13<00:02,  4.38it/s] 80%|████████  | 40/50 [00:13<00:02,  4.37it/s] 82%|████████▏ | 41/50 [00:13<00:02,  4.38it/s] 84%|████████▍ | 42/50 [00:13<00:01,  4.37it/s] 86%|████████▌ | 43/50 [00:14<00:01,  4.37it/s] 88%|████████▊ | 44/50 [00:14<00:01,  4.37it/s] 90%|█████████ | 45/50 [00:14<00:01,  4.37it/s] 92%|█████████▏| 46/50 [00:14<00:00,  4.37it/s] 94%|█████████▍| 47/50 [00:15<00:00,  4.37it/s] 96%|█████████▌| 48/50 [00:15<00:00,  4.37it/s] 98%|█████████▊| 49/50 [00:15<00:00,  4.37it/s]100%|██████████| 50/50 [00:20<00:00,  1.63s/it]100%|██████████| 50/50 [00:20<00:00,  2.44it/s]
[I 2023-12-10 23:10:42,332] Trial 219 finished with value: 0.3921867072552004 and parameters: {'EMBEDDING_DIM': 941, 'HIDDEN_DIM': 318, 'NUM_LAYERS': 1, 'DROPOUT': 0.3830063089247561, 'LR': 0.0017522652266039789, 'WEIGHT_0': 0.48109908067882234, 'WEIGHT_1': 0.49115676599225133, 'WEIGHT_2': 0.3645644294055602, 'WEIGHT_3': 0.78971307826578, 'WEIGHT_4': 0.9385540536433105, 'WEIGHT_5': 0.5642881144552646, 'WEIGHT_6': 0.6157150736258904, 'WEIGHT_7': 0.3899758066083266, 'WEIGHT_8': 0.8254571611555639, 'optimizer': 'Adam'}. Best is trial 134 with value: 0.4158467115484205.
/userhome/cs2/dingruiw/conda/envs/py310/lib/python3.10/site-packages/torch/nn/modules/rnn.py:82: UserWarning: dropout option adds dropout after all but last recurrent layer, so non-zero dropout expects num_layers greater than 1, but got dropout=0.3745588600349401 and num_layers=1
  warnings.warn("dropout option adds dropout after all but last "
{'EMBEDDING_DIM': 941, 'HIDDEN_DIM': 318, 'NUM_LAYERS': 1, 'DROPOUT': 0.3830063089247561, 'LR': 0.0017522652266039789, 'WEIGHT_0': 0.48109908067882234, 'WEIGHT_1': 0.49115676599225133, 'WEIGHT_2': 0.3645644294055602, 'WEIGHT_3': 0.78971307826578, 'WEIGHT_4': 0.9385540536433105, 'WEIGHT_5': 0.5642881144552646, 'WEIGHT_6': 0.6157150736258904, 'WEIGHT_7': 0.3899758066083266, 'WEIGHT_8': 0.8254571611555639, 'optimizer': 'Adam'}
0
              precision    recall  f1-score   support

         LOC       0.03      0.03      0.03      1837
        MISC       0.01      0.03      0.02       922
         ORG       0.02      0.04      0.03      1341
         PER       0.03      0.03      0.03      1842

   micro avg       0.02      0.03      0.03      5942
   macro avg       0.02      0.03      0.03      5942
weighted avg       0.02      0.03      0.03      5942

{'EMBEDDING_DIM': 941, 'HIDDEN_DIM': 318, 'NUM_LAYERS': 1, 'DROPOUT': 0.3830063089247561, 'LR': 0.0017522652266039789, 'WEIGHT_0': 0.48109908067882234, 'WEIGHT_1': 0.49115676599225133, 'WEIGHT_2': 0.3645644294055602, 'WEIGHT_3': 0.78971307826578, 'WEIGHT_4': 0.9385540536433105, 'WEIGHT_5': 0.5642881144552646, 'WEIGHT_6': 0.6157150736258904, 'WEIGHT_7': 0.3899758066083266, 'WEIGHT_8': 0.8254571611555639, 'optimizer': 'Adam'}
49
              precision    recall  f1-score   support

         LOC       0.51      0.52      0.51      1837
        MISC       0.49      0.44      0.46       922
         ORG       0.28      0.24      0.26      1341
         PER       0.31      0.35      0.33      1842

   micro avg       0.39      0.39      0.39      5942
   macro avg       0.40      0.39      0.39      5942
weighted avg       0.40      0.39      0.39      5942

epoch 49
LSTM
  0%|          | 0/50 [00:00<?, ?it/s]  2%|▏         | 1/50 [00:04<03:50,  4.71s/it]  6%|▌         | 3/50 [00:04<01:02,  1.32s/it]  8%|▊         | 4/50 [00:05<00:42,  1.09it/s] 10%|█         | 5/50 [00:05<00:30,  1.50it/s] 12%|█▏        | 6/50 [00:05<00:22,  1.98it/s] 14%|█▍        | 7/50 [00:05<00:17,  2.53it/s] 16%|█▌        | 8/50 [00:05<00:13,  3.10it/s] 18%|█▊        | 9/50 [00:05<00:11,  3.67it/s] 20%|██        | 10/50 [00:06<00:09,  4.20it/s] 22%|██▏       | 11/50 [00:06<00:08,  4.67it/s] 24%|██▍       | 12/50 [00:06<00:07,  5.07it/s] 26%|██▌       | 13/50 [00:06<00:06,  5.39it/s] 28%|██▊       | 14/50 [00:06<00:06,  5.63it/s] 30%|███       | 15/50 [00:06<00:06,  5.82it/s] 32%|███▏      | 16/50 [00:07<00:05,  5.95it/s] 34%|███▍      | 17/50 [00:07<00:05,  6.04it/s] 36%|███▌      | 18/50 [00:07<00:05,  6.11it/s] 38%|███▊      | 19/50 [00:07<00:05,  6.16it/s] 40%|████      | 20/50 [00:07<00:04,  6.20it/s] 42%|████▏     | 21/50 [00:07<00:04,  6.23it/s] 44%|████▍     | 22/50 [00:08<00:04,  6.24it/s] 46%|████▌     | 23/50 [00:08<00:04,  6.26it/s] 48%|████▊     | 24/50 [00:08<00:04,  6.26it/s] 50%|█████     | 25/50 [00:08<00:03,  6.27it/s] 52%|█████▏    | 26/50 [00:08<00:03,  6.27it/s] 54%|█████▍    | 27/50 [00:08<00:03,  6.28it/s] 56%|█████▌    | 28/50 [00:08<00:03,  6.27it/s] 58%|█████▊    | 29/50 [00:09<00:03,  6.28it/s] 60%|██████    | 30/50 [00:09<00:03,  6.28it/s] 62%|██████▏   | 31/50 [00:09<00:03,  6.28it/s] 64%|██████▍   | 32/50 [00:09<00:02,  6.27it/s] 66%|██████▌   | 33/50 [00:09<00:02,  6.27it/s] 68%|██████▊   | 34/50 [00:09<00:02,  6.27it/s] 70%|███████   | 35/50 [00:10<00:02,  6.26it/s] 72%|███████▏  | 36/50 [00:10<00:02,  6.26it/s] 74%|███████▍  | 37/50 [00:10<00:02,  6.26it/s] 76%|███████▌  | 38/50 [00:10<00:01,  6.26it/s] 78%|███████▊  | 39/50 [00:10<00:01,  6.26it/s] 80%|████████  | 40/50 [00:10<00:01,  6.25it/s] 82%|████████▏ | 41/50 [00:11<00:01,  6.25it/s] 84%|████████▍ | 42/50 [00:11<00:01,  6.25it/s] 86%|████████▌ | 43/50 [00:11<00:01,  6.25it/s] 88%|████████▊ | 44/50 [00:11<00:00,  6.25it/s] 90%|█████████ | 45/50 [00:11<00:00,  6.25it/s] 92%|█████████▏| 46/50 [00:11<00:00,  6.24it/s] 94%|█████████▍| 47/50 [00:11<00:00,  6.25it/s] 96%|█████████▌| 48/50 [00:12<00:00,  6.24it/s] 98%|█████████▊| 49/50 [00:12<00:00,  6.24it/s]100%|██████████| 50/50 [00:17<00:00,  1.56s/it]100%|██████████| 50/50 [00:17<00:00,  2.91it/s]
[I 2023-12-10 23:11:03,791] Trial 220 finished with value: 0.40512476972031486 and parameters: {'EMBEDDING_DIM': 970, 'HIDDEN_DIM': 223, 'NUM_LAYERS': 1, 'DROPOUT': 0.3745588600349401, 'LR': 0.0019639107651781423, 'WEIGHT_0': 0.5004006887408069, 'WEIGHT_1': 0.48303645034586357, 'WEIGHT_2': 0.3916246502930479, 'WEIGHT_3': 0.800169816161957, 'WEIGHT_4': 0.9475230467686686, 'WEIGHT_5': 0.574683200055355, 'WEIGHT_6': 0.592595395822771, 'WEIGHT_7': 0.3648936833346972, 'WEIGHT_8': 0.729962613105931, 'optimizer': 'Adam'}. Best is trial 134 with value: 0.4158467115484205.
/userhome/cs2/dingruiw/conda/envs/py310/lib/python3.10/site-packages/torch/nn/modules/rnn.py:82: UserWarning: dropout option adds dropout after all but last recurrent layer, so non-zero dropout expects num_layers greater than 1, but got dropout=0.35587960409858715 and num_layers=1
  warnings.warn("dropout option adds dropout after all but last "
{'EMBEDDING_DIM': 970, 'HIDDEN_DIM': 223, 'NUM_LAYERS': 1, 'DROPOUT': 0.3745588600349401, 'LR': 0.0019639107651781423, 'WEIGHT_0': 0.5004006887408069, 'WEIGHT_1': 0.48303645034586357, 'WEIGHT_2': 0.3916246502930479, 'WEIGHT_3': 0.800169816161957, 'WEIGHT_4': 0.9475230467686686, 'WEIGHT_5': 0.574683200055355, 'WEIGHT_6': 0.592595395822771, 'WEIGHT_7': 0.3648936833346972, 'WEIGHT_8': 0.729962613105931, 'optimizer': 'Adam'}
0
              precision    recall  f1-score   support

         LOC       0.07      0.06      0.06      1837
        MISC       0.02      0.06      0.03       922
         ORG       0.03      0.09      0.04      1341
         PER       0.02      0.06      0.03      1842

   micro avg       0.03      0.06      0.04      5942
   macro avg       0.03      0.06      0.04      5942
weighted avg       0.04      0.06      0.04      5942

{'EMBEDDING_DIM': 970, 'HIDDEN_DIM': 223, 'NUM_LAYERS': 1, 'DROPOUT': 0.3745588600349401, 'LR': 0.0019639107651781423, 'WEIGHT_0': 0.5004006887408069, 'WEIGHT_1': 0.48303645034586357, 'WEIGHT_2': 0.3916246502930479, 'WEIGHT_3': 0.800169816161957, 'WEIGHT_4': 0.9475230467686686, 'WEIGHT_5': 0.574683200055355, 'WEIGHT_6': 0.592595395822771, 'WEIGHT_7': 0.3648936833346972, 'WEIGHT_8': 0.729962613105931, 'optimizer': 'Adam'}
49
              precision    recall  f1-score   support

         LOC       0.55      0.55      0.55      1837
        MISC       0.50      0.47      0.48       922
         ORG       0.28      0.24      0.26      1341
         PER       0.30      0.36      0.33      1842

   micro avg       0.40      0.41      0.41      5942
   macro avg       0.41      0.40      0.40      5942
weighted avg       0.41      0.41      0.40      5942

epoch 49
LSTM
  0%|          | 0/50 [00:00<?, ?it/s]  2%|▏         | 1/50 [00:04<03:55,  4.81s/it]  4%|▍         | 2/50 [00:04<01:38,  2.06s/it]  6%|▌         | 3/50 [00:05<00:58,  1.23s/it]  8%|▊         | 4/50 [00:05<00:38,  1.19it/s] 10%|█         | 5/50 [00:05<00:28,  1.60it/s] 12%|█▏        | 6/50 [00:05<00:21,  2.03it/s] 14%|█▍        | 7/50 [00:06<00:17,  2.44it/s] 16%|█▌        | 8/50 [00:06<00:14,  2.81it/s] 18%|█▊        | 9/50 [00:06<00:13,  3.13it/s] 20%|██        | 10/50 [00:06<00:11,  3.40it/s] 22%|██▏       | 11/50 [00:07<00:10,  3.60it/s] 24%|██▍       | 12/50 [00:07<00:10,  3.76it/s] 26%|██▌       | 13/50 [00:07<00:09,  3.88it/s] 28%|██▊       | 14/50 [00:07<00:09,  3.96it/s] 30%|███       | 15/50 [00:08<00:08,  4.03it/s] 32%|███▏      | 16/50 [00:08<00:08,  4.07it/s] 34%|███▍      | 17/50 [00:08<00:08,  4.11it/s] 36%|███▌      | 18/50 [00:08<00:07,  4.13it/s] 38%|███▊      | 19/50 [00:09<00:07,  4.14it/s] 40%|████      | 20/50 [00:09<00:07,  4.16it/s] 42%|████▏     | 21/50 [00:09<00:06,  4.17it/s] 44%|████▍     | 22/50 [00:09<00:06,  4.17it/s] 46%|████▌     | 23/50 [00:09<00:06,  4.17it/s] 48%|████▊     | 24/50 [00:10<00:06,  4.17it/s] 50%|█████     | 25/50 [00:10<00:05,  4.18it/s] 52%|█████▏    | 26/50 [00:10<00:05,  4.18it/s] 54%|█████▍    | 27/50 [00:10<00:05,  4.18it/s] 56%|█████▌    | 28/50 [00:11<00:05,  4.18it/s] 58%|█████▊    | 29/50 [00:11<00:05,  4.18it/s] 60%|██████    | 30/50 [00:11<00:04,  4.18it/s] 62%|██████▏   | 31/50 [00:11<00:04,  4.18it/s] 64%|██████▍   | 32/50 [00:12<00:04,  4.17it/s] 66%|██████▌   | 33/50 [00:12<00:04,  4.18it/s] 68%|██████▊   | 34/50 [00:12<00:03,  4.17it/s] 70%|███████   | 35/50 [00:12<00:03,  4.17it/s] 72%|███████▏  | 36/50 [00:13<00:03,  4.15it/s] 74%|███████▍  | 37/50 [00:13<00:03,  4.16it/s] 76%|███████▌  | 38/50 [00:13<00:02,  4.16it/s] 78%|███████▊  | 39/50 [00:13<00:02,  4.16it/s] 80%|████████  | 40/50 [00:14<00:02,  4.16it/s] 82%|████████▏ | 41/50 [00:14<00:02,  4.16it/s] 84%|████████▍ | 42/50 [00:14<00:01,  4.16it/s] 86%|████████▌ | 43/50 [00:14<00:01,  4.16it/s] 88%|████████▊ | 44/50 [00:15<00:01,  4.16it/s] 90%|█████████ | 45/50 [00:15<00:01,  4.15it/s] 92%|█████████▏| 46/50 [00:15<00:00,  4.15it/s] 94%|█████████▍| 47/50 [00:15<00:00,  4.15it/s] 96%|█████████▌| 48/50 [00:15<00:00,  4.15it/s] 98%|█████████▊| 49/50 [00:16<00:00,  4.15it/s]100%|██████████| 50/50 [00:21<00:00,  1.64s/it]100%|██████████| 50/50 [00:21<00:00,  2.37it/s]
