[I 2023-12-10 21:53:45,734] Trial 73 finished with value: 0.40383820001654397 and parameters: {'EMBEDDING_DIM': 944, 'HIDDEN_DIM': 236, 'NUM_LAYERS': 1, 'DROPOUT': 0.35717007459329103, 'LR': 0.001383277287599845, 'WEIGHT_0': 0.3245808327377354, 'WEIGHT_1': 0.6677779220991447, 'WEIGHT_2': 0.5490021314062561, 'WEIGHT_3': 0.8966505563249547, 'WEIGHT_4': 0.8644716630110028, 'WEIGHT_5': 0.5573437281654484, 'WEIGHT_6': 0.7786549157434147, 'WEIGHT_7': 0.4302036678170955, 'WEIGHT_8': 0.2774227033089907, 'optimizer': 'Adam'}. Best is trial 51 with value: 0.41438326562364947.
/userhome/cs2/dingruiw/conda/envs/py310/lib/python3.10/site-packages/torch/nn/modules/rnn.py:82: UserWarning: dropout option adds dropout after all but last recurrent layer, so non-zero dropout expects num_layers greater than 1, but got dropout=0.3835104327546375 and num_layers=1
  warnings.warn("dropout option adds dropout after all but last "
{'EMBEDDING_DIM': 944, 'HIDDEN_DIM': 236, 'NUM_LAYERS': 1, 'DROPOUT': 0.35717007459329103, 'LR': 0.001383277287599845, 'WEIGHT_0': 0.3245808327377354, 'WEIGHT_1': 0.6677779220991447, 'WEIGHT_2': 0.5490021314062561, 'WEIGHT_3': 0.8966505563249547, 'WEIGHT_4': 0.8644716630110028, 'WEIGHT_5': 0.5573437281654484, 'WEIGHT_6': 0.7786549157434147, 'WEIGHT_7': 0.4302036678170955, 'WEIGHT_8': 0.2774227033089907, 'optimizer': 'Adam'}
0
              precision    recall  f1-score   support

         LOC       0.06      0.11      0.08      1837
        MISC       0.02      0.13      0.04       922
         ORG       0.03      0.09      0.04      1341
         PER       0.02      0.09      0.04      1842

   micro avg       0.03      0.10      0.05      5942
   macro avg       0.03      0.10      0.05      5942
weighted avg       0.04      0.10      0.05      5942

{'EMBEDDING_DIM': 944, 'HIDDEN_DIM': 236, 'NUM_LAYERS': 1, 'DROPOUT': 0.35717007459329103, 'LR': 0.001383277287599845, 'WEIGHT_0': 0.3245808327377354, 'WEIGHT_1': 0.6677779220991447, 'WEIGHT_2': 0.5490021314062561, 'WEIGHT_3': 0.8966505563249547, 'WEIGHT_4': 0.8644716630110028, 'WEIGHT_5': 0.5573437281654484, 'WEIGHT_6': 0.7786549157434147, 'WEIGHT_7': 0.4302036678170955, 'WEIGHT_8': 0.2774227033089907, 'optimizer': 'Adam'}
49
              precision    recall  f1-score   support

         LOC       0.55      0.54      0.55      1837
        MISC       0.46      0.46      0.46       922
         ORG       0.27      0.25      0.26      1341
         PER       0.32      0.37      0.34      1842

   micro avg       0.40      0.41      0.40      5942
   macro avg       0.40      0.41      0.40      5942
weighted avg       0.40      0.41      0.41      5942

epoch 49
LSTM
  0%|          | 0/50 [00:00<?, ?it/s]  2%|▏         | 1/50 [00:04<04:01,  4.93s/it]  4%|▍         | 2/50 [00:05<01:43,  2.15s/it]  6%|▌         | 3/50 [00:05<01:03,  1.35s/it]  8%|▊         | 4/50 [00:05<00:44,  1.03it/s] 10%|█         | 5/50 [00:06<00:34,  1.32it/s] 12%|█▏        | 6/50 [00:06<00:27,  1.58it/s] 14%|█▍        | 7/50 [00:07<00:23,  1.81it/s] 16%|█▌        | 8/50 [00:07<00:21,  2.00it/s] 18%|█▊        | 9/50 [00:07<00:19,  2.15it/s] 20%|██        | 10/50 [00:08<00:17,  2.27it/s] 22%|██▏       | 11/50 [00:08<00:16,  2.35it/s] 24%|██▍       | 12/50 [00:09<00:15,  2.42it/s] 26%|██▌       | 13/50 [00:09<00:15,  2.46it/s] 28%|██▊       | 14/50 [00:09<00:14,  2.49it/s] 30%|███       | 15/50 [00:10<00:13,  2.51it/s] 32%|███▏      | 16/50 [00:10<00:13,  2.53it/s] 34%|███▍      | 17/50 [00:10<00:13,  2.54it/s] 36%|███▌      | 18/50 [00:11<00:12,  2.54it/s] 38%|███▊      | 19/50 [00:11<00:12,  2.55it/s] 40%|████      | 20/50 [00:12<00:11,  2.56it/s] 42%|████▏     | 21/50 [00:12<00:11,  2.57it/s] 44%|████▍     | 22/50 [00:12<00:10,  2.56it/s] 46%|████▌     | 23/50 [00:13<00:10,  2.57it/s] 48%|████▊     | 24/50 [00:13<00:10,  2.56it/s] 50%|█████     | 25/50 [00:14<00:09,  2.56it/s] 52%|█████▏    | 26/50 [00:14<00:09,  2.56it/s] 54%|█████▍    | 27/50 [00:14<00:08,  2.56it/s] 56%|█████▌    | 28/50 [00:15<00:08,  2.57it/s] 58%|█████▊    | 29/50 [00:15<00:08,  2.56it/s] 60%|██████    | 30/50 [00:16<00:07,  2.57it/s] 62%|██████▏   | 31/50 [00:16<00:07,  2.56it/s] 64%|██████▍   | 32/50 [00:16<00:07,  2.56it/s] 66%|██████▌   | 33/50 [00:17<00:06,  2.55it/s] 68%|██████▊   | 34/50 [00:17<00:06,  2.56it/s] 70%|███████   | 35/50 [00:17<00:05,  2.56it/s] 72%|███████▏  | 36/50 [00:18<00:05,  2.56it/s] 74%|███████▍  | 37/50 [00:18<00:05,  2.55it/s] 76%|███████▌  | 38/50 [00:19<00:04,  2.55it/s] 78%|███████▊  | 39/50 [00:19<00:04,  2.55it/s] 80%|████████  | 40/50 [00:19<00:03,  2.55it/s] 82%|████████▏ | 41/50 [00:20<00:03,  2.55it/s] 84%|████████▍ | 42/50 [00:20<00:03,  2.55it/s] 86%|████████▌ | 43/50 [00:21<00:02,  2.55it/s] 88%|████████▊ | 44/50 [00:21<00:02,  2.55it/s] 90%|█████████ | 45/50 [00:21<00:01,  2.55it/s] 92%|█████████▏| 46/50 [00:22<00:01,  2.55it/s] 94%|█████████▍| 47/50 [00:22<00:01,  2.55it/s] 96%|█████████▌| 48/50 [00:23<00:00,  2.55it/s] 98%|█████████▊| 49/50 [00:23<00:00,  2.54it/s]100%|██████████| 50/50 [00:28<00:00,  1.78s/it]100%|██████████| 50/50 [00:28<00:00,  1.75it/s]
[I 2023-12-10 21:54:18,465] Trial 74 finished with value: 0.40016842105263156 and parameters: {'EMBEDDING_DIM': 843, 'HIDDEN_DIM': 600, 'NUM_LAYERS': 1, 'DROPOUT': 0.3835104327546375, 'LR': 0.0017589143221908312, 'WEIGHT_0': 0.4075937338749025, 'WEIGHT_1': 0.7748708294791548, 'WEIGHT_2': 0.4827113433011539, 'WEIGHT_3': 0.9685766446337107, 'WEIGHT_4': 0.6494185133570787, 'WEIGHT_5': 0.4922120884582903, 'WEIGHT_6': 0.8311618257642168, 'WEIGHT_7': 0.46689916581559204, 'WEIGHT_8': 0.18933690416527935, 'optimizer': 'Adam'}. Best is trial 51 with value: 0.41438326562364947.
/userhome/cs2/dingruiw/conda/envs/py310/lib/python3.10/site-packages/torch/nn/modules/rnn.py:82: UserWarning: dropout option adds dropout after all but last recurrent layer, so non-zero dropout expects num_layers greater than 1, but got dropout=0.3665141451687856 and num_layers=1
  warnings.warn("dropout option adds dropout after all but last "
{'EMBEDDING_DIM': 843, 'HIDDEN_DIM': 600, 'NUM_LAYERS': 1, 'DROPOUT': 0.3835104327546375, 'LR': 0.0017589143221908312, 'WEIGHT_0': 0.4075937338749025, 'WEIGHT_1': 0.7748708294791548, 'WEIGHT_2': 0.4827113433011539, 'WEIGHT_3': 0.9685766446337107, 'WEIGHT_4': 0.6494185133570787, 'WEIGHT_5': 0.4922120884582903, 'WEIGHT_6': 0.8311618257642168, 'WEIGHT_7': 0.46689916581559204, 'WEIGHT_8': 0.18933690416527935, 'optimizer': 'Adam'}
0
              precision    recall  f1-score   support

         LOC       0.05      0.03      0.04      1837
        MISC       0.01      0.02      0.02       922
         ORG       0.04      0.05      0.05      1341
         PER       0.02      0.03      0.03      1842

   micro avg       0.03      0.04      0.03      5942
   macro avg       0.03      0.03      0.03      5942
weighted avg       0.03      0.04      0.03      5942

{'EMBEDDING_DIM': 843, 'HIDDEN_DIM': 600, 'NUM_LAYERS': 1, 'DROPOUT': 0.3835104327546375, 'LR': 0.0017589143221908312, 'WEIGHT_0': 0.4075937338749025, 'WEIGHT_1': 0.7748708294791548, 'WEIGHT_2': 0.4827113433011539, 'WEIGHT_3': 0.9685766446337107, 'WEIGHT_4': 0.6494185133570787, 'WEIGHT_5': 0.4922120884582903, 'WEIGHT_6': 0.8311618257642168, 'WEIGHT_7': 0.46689916581559204, 'WEIGHT_8': 0.18933690416527935, 'optimizer': 'Adam'}
49
              precision    recall  f1-score   support

         LOC       0.57      0.51      0.54      1837
        MISC       0.43      0.44      0.43       922
         ORG       0.27      0.27      0.27      1341
         PER       0.34      0.36      0.35      1842

   micro avg       0.40      0.40      0.40      5942
   macro avg       0.40      0.40      0.40      5942
weighted avg       0.41      0.40      0.40      5942

epoch 49
LSTM
  0%|          | 0/50 [00:00<?, ?it/s]  2%|▏         | 1/50 [00:04<03:53,  4.76s/it]  4%|▍         | 2/50 [00:04<01:37,  2.04s/it]  6%|▌         | 3/50 [00:05<00:57,  1.21s/it]  8%|▊         | 4/50 [00:05<00:38,  1.21it/s] 10%|█         | 5/50 [00:05<00:27,  1.63it/s] 12%|█▏        | 6/50 [00:05<00:21,  2.07it/s] 14%|█▍        | 7/50 [00:06<00:17,  2.49it/s] 16%|█▌        | 8/50 [00:06<00:14,  2.88it/s] 18%|█▊        | 9/50 [00:06<00:12,  3.21it/s] 20%|██        | 10/50 [00:06<00:11,  3.48it/s] 22%|██▏       | 11/50 [00:06<00:10,  3.69it/s] 24%|██▍       | 12/50 [00:07<00:09,  3.86it/s] 26%|██▌       | 13/50 [00:07<00:09,  3.97it/s] 28%|██▊       | 14/50 [00:07<00:08,  4.07it/s] 30%|███       | 15/50 [00:07<00:08,  4.13it/s] 32%|███▏      | 16/50 [00:08<00:08,  4.18it/s] 34%|███▍      | 17/50 [00:08<00:07,  4.21it/s] 36%|███▌      | 18/50 [00:08<00:07,  4.23it/s] 38%|███▊      | 19/50 [00:08<00:07,  4.24it/s] 40%|████      | 20/50 [00:09<00:07,  4.26it/s] 42%|████▏     | 21/50 [00:09<00:06,  4.26it/s] 44%|████▍     | 22/50 [00:09<00:06,  4.27it/s] 46%|████▌     | 23/50 [00:09<00:06,  4.27it/s] 48%|████▊     | 24/50 [00:10<00:06,  4.27it/s] 50%|█████     | 25/50 [00:10<00:05,  4.27it/s] 52%|█████▏    | 26/50 [00:10<00:05,  4.28it/s] 54%|█████▍    | 27/50 [00:10<00:05,  4.28it/s] 56%|█████▌    | 28/50 [00:10<00:05,  4.28it/s] 58%|█████▊    | 29/50 [00:11<00:04,  4.27it/s] 60%|██████    | 30/50 [00:11<00:04,  4.28it/s] 62%|██████▏   | 31/50 [00:11<00:04,  4.27it/s] 64%|██████▍   | 32/50 [00:11<00:04,  4.27it/s] 66%|██████▌   | 33/50 [00:12<00:03,  4.27it/s] 68%|██████▊   | 34/50 [00:12<00:03,  4.27it/s] 70%|███████   | 35/50 [00:12<00:03,  4.27it/s] 72%|███████▏  | 36/50 [00:12<00:03,  4.27it/s] 74%|███████▍  | 37/50 [00:13<00:03,  4.27it/s] 76%|███████▌  | 38/50 [00:13<00:02,  4.27it/s] 78%|███████▊  | 39/50 [00:13<00:02,  4.27it/s] 80%|████████  | 40/50 [00:13<00:02,  4.26it/s] 82%|████████▏ | 41/50 [00:14<00:02,  4.27it/s] 84%|████████▍ | 42/50 [00:14<00:01,  4.27it/s] 86%|████████▌ | 43/50 [00:14<00:01,  4.27it/s] 88%|████████▊ | 44/50 [00:14<00:01,  4.26it/s] 90%|█████████ | 45/50 [00:14<00:01,  4.27it/s] 92%|█████████▏| 46/50 [00:15<00:00,  4.26it/s] 94%|█████████▍| 47/50 [00:15<00:00,  4.27it/s] 96%|█████████▌| 48/50 [00:15<00:00,  4.27it/s] 98%|█████████▊| 49/50 [00:15<00:00,  4.26it/s]100%|██████████| 50/50 [00:20<00:00,  1.63s/it]100%|██████████| 50/50 [00:20<00:00,  2.41it/s]
[I 2023-12-10 21:54:43,486] Trial 75 finished with value: 0.38972686506318793 and parameters: {'EMBEDDING_DIM': 899, 'HIDDEN_DIM': 350, 'NUM_LAYERS': 1, 'DROPOUT': 0.3665141451687856, 'LR': 0.002149152165820172, 'WEIGHT_0': 0.4520757236053436, 'WEIGHT_1': 0.7024546705240002, 'WEIGHT_2': 0.6187625518401174, 'WEIGHT_3': 0.9363627695303939, 'WEIGHT_4': 0.8251465463825558, 'WEIGHT_5': 0.5960686956372974, 'WEIGHT_6': 0.8739202637551117, 'WEIGHT_7': 0.5591711438462392, 'WEIGHT_8': 0.3469468510365372, 'optimizer': 'Adam'}. Best is trial 51 with value: 0.41438326562364947.
/userhome/cs2/dingruiw/conda/envs/py310/lib/python3.10/site-packages/torch/nn/modules/rnn.py:82: UserWarning: dropout option adds dropout after all but last recurrent layer, so non-zero dropout expects num_layers greater than 1, but got dropout=0.3409207275531508 and num_layers=1
  warnings.warn("dropout option adds dropout after all but last "
{'EMBEDDING_DIM': 899, 'HIDDEN_DIM': 350, 'NUM_LAYERS': 1, 'DROPOUT': 0.3665141451687856, 'LR': 0.002149152165820172, 'WEIGHT_0': 0.4520757236053436, 'WEIGHT_1': 0.7024546705240002, 'WEIGHT_2': 0.6187625518401174, 'WEIGHT_3': 0.9363627695303939, 'WEIGHT_4': 0.8251465463825558, 'WEIGHT_5': 0.5960686956372974, 'WEIGHT_6': 0.8739202637551117, 'WEIGHT_7': 0.5591711438462392, 'WEIGHT_8': 0.3469468510365372, 'optimizer': 'Adam'}
0
              precision    recall  f1-score   support

         LOC       0.06      0.07      0.06      1837
        MISC       0.03      0.03      0.03       922
         ORG       0.05      0.08      0.06      1341
         PER       0.03      0.02      0.03      1842

   micro avg       0.05      0.05      0.05      5942
   macro avg       0.04      0.05      0.05      5942
weighted avg       0.04      0.05      0.05      5942

{'EMBEDDING_DIM': 899, 'HIDDEN_DIM': 350, 'NUM_LAYERS': 1, 'DROPOUT': 0.3665141451687856, 'LR': 0.002149152165820172, 'WEIGHT_0': 0.4520757236053436, 'WEIGHT_1': 0.7024546705240002, 'WEIGHT_2': 0.6187625518401174, 'WEIGHT_3': 0.9363627695303939, 'WEIGHT_4': 0.8251465463825558, 'WEIGHT_5': 0.5960686956372974, 'WEIGHT_6': 0.8739202637551117, 'WEIGHT_7': 0.5591711438462392, 'WEIGHT_8': 0.3469468510365372, 'optimizer': 'Adam'}
49
              precision    recall  f1-score   support

         LOC       0.54      0.53      0.53      1837
        MISC       0.38      0.43      0.40       922
         ORG       0.27      0.27      0.27      1341
         PER       0.31      0.36      0.33      1842

   micro avg       0.38      0.40      0.39      5942
   macro avg       0.37      0.40      0.38      5942
weighted avg       0.38      0.40      0.39      5942

epoch 49
LSTM
  0%|          | 0/50 [00:00<?, ?it/s]  2%|▏         | 1/50 [00:04<04:01,  4.94s/it]  4%|▍         | 2/50 [00:05<01:42,  2.14s/it]  6%|▌         | 3/50 [00:05<01:01,  1.31s/it]  8%|▊         | 4/50 [00:05<00:42,  1.09it/s] 10%|█         | 5/50 [00:06<00:31,  1.42it/s] 12%|█▏        | 6/50 [00:06<00:25,  1.74it/s] 14%|█▍        | 7/50 [00:06<00:21,  2.02it/s] 16%|█▌        | 8/50 [00:07<00:18,  2.27it/s] 18%|█▊        | 9/50 [00:07<00:16,  2.47it/s] 20%|██        | 10/50 [00:07<00:15,  2.62it/s] 22%|██▏       | 11/50 [00:08<00:14,  2.75it/s] 24%|██▍       | 12/50 [00:08<00:13,  2.84it/s] 26%|██▌       | 13/50 [00:08<00:12,  2.90it/s] 28%|██▊       | 14/50 [00:09<00:12,  2.95it/s] 30%|███       | 15/50 [00:09<00:11,  2.98it/s] 32%|███▏      | 16/50 [00:09<00:11,  3.00it/s] 34%|███▍      | 17/50 [00:10<00:10,  3.02it/s] 36%|███▌      | 18/50 [00:10<00:10,  3.03it/s] 38%|███▊      | 19/50 [00:10<00:10,  3.04it/s] 40%|████      | 20/50 [00:10<00:09,  3.04it/s] 42%|████▏     | 21/50 [00:11<00:09,  3.05it/s] 44%|████▍     | 22/50 [00:11<00:09,  3.05it/s] 46%|████▌     | 23/50 [00:11<00:08,  3.05it/s] 48%|████▊     | 24/50 [00:12<00:08,  3.05it/s] 50%|█████     | 25/50 [00:12<00:08,  3.05it/s] 52%|█████▏    | 26/50 [00:12<00:07,  3.05it/s] 54%|█████▍    | 27/50 [00:13<00:07,  3.05it/s] 56%|█████▌    | 28/50 [00:13<00:07,  3.05it/s] 58%|█████▊    | 29/50 [00:13<00:06,  3.05it/s] 60%|██████    | 30/50 [00:14<00:06,  3.04it/s] 62%|██████▏   | 31/50 [00:14<00:06,  3.04it/s] 64%|██████▍   | 32/50 [00:14<00:05,  3.04it/s] 66%|██████▌   | 33/50 [00:15<00:05,  3.04it/s] 68%|██████▊   | 34/50 [00:15<00:05,  3.04it/s] 70%|███████   | 35/50 [00:15<00:04,  3.04it/s] 72%|███████▏  | 36/50 [00:16<00:04,  3.04it/s] 74%|███████▍  | 37/50 [00:16<00:04,  3.03it/s] 76%|███████▌  | 38/50 [00:16<00:03,  3.03it/s] 78%|███████▊  | 39/50 [00:17<00:03,  3.03it/s] 80%|████████  | 40/50 [00:17<00:03,  3.03it/s] 82%|████████▏ | 41/50 [00:17<00:02,  3.03it/s] 84%|████████▍ | 42/50 [00:18<00:02,  3.03it/s] 86%|████████▌ | 43/50 [00:18<00:02,  3.03it/s] 88%|████████▊ | 44/50 [00:18<00:01,  3.02it/s] 90%|█████████ | 45/50 [00:19<00:01,  3.03it/s] 92%|█████████▏| 46/50 [00:19<00:01,  3.02it/s] 94%|█████████▍| 47/50 [00:19<00:00,  3.02it/s] 96%|█████████▌| 48/50 [00:20<00:00,  3.02it/s] 98%|█████████▊| 49/50 [00:20<00:00,  3.02it/s]100%|██████████| 50/50 [00:25<00:00,  1.76s/it]100%|██████████| 50/50 [00:25<00:00,  1.95it/s]
[I 2023-12-10 21:55:13,536] Trial 76 finished with value: 0.4064738657468825 and parameters: {'EMBEDDING_DIM': 996, 'HIDDEN_DIM': 487, 'NUM_LAYERS': 1, 'DROPOUT': 0.3409207275531508, 'LR': 0.001127078668860586, 'WEIGHT_0': 0.3823623883914003, 'WEIGHT_1': 0.5905971405009673, 'WEIGHT_2': 0.5147911720192105, 'WEIGHT_3': 0.8677406134392288, 'WEIGHT_4': 0.7659063211154647, 'WEIGHT_5': 0.5314286691076543, 'WEIGHT_6': 0.9708558664974067, 'WEIGHT_7': 0.34447129441318963, 'WEIGHT_8': 0.40409578207736263, 'optimizer': 'Adam'}. Best is trial 51 with value: 0.41438326562364947.
/userhome/cs2/dingruiw/conda/envs/py310/lib/python3.10/site-packages/torch/nn/modules/rnn.py:82: UserWarning: dropout option adds dropout after all but last recurrent layer, so non-zero dropout expects num_layers greater than 1, but got dropout=0.3425188410998581 and num_layers=1
  warnings.warn("dropout option adds dropout after all but last "
{'EMBEDDING_DIM': 996, 'HIDDEN_DIM': 487, 'NUM_LAYERS': 1, 'DROPOUT': 0.3409207275531508, 'LR': 0.001127078668860586, 'WEIGHT_0': 0.3823623883914003, 'WEIGHT_1': 0.5905971405009673, 'WEIGHT_2': 0.5147911720192105, 'WEIGHT_3': 0.8677406134392288, 'WEIGHT_4': 0.7659063211154647, 'WEIGHT_5': 0.5314286691076543, 'WEIGHT_6': 0.9708558664974067, 'WEIGHT_7': 0.34447129441318963, 'WEIGHT_8': 0.40409578207736263, 'optimizer': 'Adam'}
0
              precision    recall  f1-score   support

         LOC       0.06      0.05      0.05      1837
        MISC       0.02      0.08      0.03       922
         ORG       0.02      0.06      0.04      1341
         PER       0.03      0.07      0.04      1842

   micro avg       0.03      0.06      0.04      5942
   macro avg       0.03      0.06      0.04      5942
weighted avg       0.03      0.06      0.04      5942

{'EMBEDDING_DIM': 996, 'HIDDEN_DIM': 487, 'NUM_LAYERS': 1, 'DROPOUT': 0.3409207275531508, 'LR': 0.001127078668860586, 'WEIGHT_0': 0.3823623883914003, 'WEIGHT_1': 0.5905971405009673, 'WEIGHT_2': 0.5147911720192105, 'WEIGHT_3': 0.8677406134392288, 'WEIGHT_4': 0.7659063211154647, 'WEIGHT_5': 0.5314286691076543, 'WEIGHT_6': 0.9708558664974067, 'WEIGHT_7': 0.34447129441318963, 'WEIGHT_8': 0.40409578207736263, 'optimizer': 'Adam'}
49
              precision    recall  f1-score   support

         LOC       0.59      0.51      0.55      1837
        MISC       0.44      0.43      0.44       922
         ORG       0.31      0.24      0.27      1341
         PER       0.35      0.35      0.35      1842

   micro avg       0.43      0.39      0.41      5942
   macro avg       0.42      0.38      0.40      5942
weighted avg       0.43      0.39      0.41      5942

epoch 49
LSTM
  0%|          | 0/50 [00:00<?, ?it/s]  2%|▏         | 1/50 [00:04<04:02,  4.94s/it]  4%|▍         | 2/50 [00:05<01:42,  2.14s/it]  6%|▌         | 3/50 [00:05<01:02,  1.32s/it]  8%|▊         | 4/50 [00:05<00:43,  1.06it/s] 10%|█         | 5/50 [00:06<00:32,  1.37it/s] 12%|█▏        | 6/50 [00:06<00:26,  1.67it/s] 14%|█▍        | 7/50 [00:06<00:22,  1.93it/s] 16%|█▌        | 8/50 [00:07<00:19,  2.15it/s] 18%|█▊        | 9/50 [00:07<00:17,  2.32it/s] 20%|██        | 10/50 [00:07<00:16,  2.46it/s] 22%|██▏       | 11/50 [00:08<00:15,  2.56it/s] 24%|██▍       | 12/50 [00:08<00:14,  2.64it/s] 26%|██▌       | 13/50 [00:08<00:13,  2.70it/s] 28%|██▊       | 14/50 [00:09<00:13,  2.73it/s] 30%|███       | 15/50 [00:09<00:12,  2.77it/s] 32%|███▏      | 16/50 [00:10<00:12,  2.79it/s] 34%|███▍      | 17/50 [00:10<00:11,  2.80it/s] 36%|███▌      | 18/50 [00:10<00:11,  2.81it/s] 38%|███▊      | 19/50 [00:11<00:11,  2.81it/s] 40%|████      | 20/50 [00:11<00:10,  2.82it/s] 42%|████▏     | 21/50 [00:11<00:10,  2.82it/s] 44%|████▍     | 22/50 [00:12<00:09,  2.82it/s] 46%|████▌     | 23/50 [00:12<00:09,  2.83it/s] 48%|████▊     | 24/50 [00:12<00:09,  2.83it/s] 50%|█████     | 25/50 [00:13<00:08,  2.83it/s] 52%|█████▏    | 26/50 [00:13<00:08,  2.83it/s] 54%|█████▍    | 27/50 [00:13<00:08,  2.83it/s] 56%|█████▌    | 28/50 [00:14<00:07,  2.82it/s] 58%|█████▊    | 29/50 [00:14<00:07,  2.83it/s] 60%|██████    | 30/50 [00:15<00:07,  2.83it/s] 62%|██████▏   | 31/50 [00:15<00:06,  2.83it/s] 64%|██████▍   | 32/50 [00:15<00:06,  2.83it/s] 66%|██████▌   | 33/50 [00:16<00:06,  2.83it/s] 68%|██████▊   | 34/50 [00:16<00:05,  2.83it/s] 70%|███████   | 35/50 [00:16<00:05,  2.83it/s] 72%|███████▏  | 36/50 [00:17<00:04,  2.83it/s] 74%|███████▍  | 37/50 [00:17<00:04,  2.83it/s] 76%|███████▌  | 38/50 [00:17<00:04,  2.83it/s] 78%|███████▊  | 39/50 [00:18<00:03,  2.83it/s] 80%|████████  | 40/50 [00:18<00:03,  2.83it/s] 82%|████████▏ | 41/50 [00:18<00:03,  2.83it/s] 84%|████████▍ | 42/50 [00:19<00:02,  2.84it/s] 86%|████████▌ | 43/50 [00:19<00:02,  2.84it/s] 88%|████████▊ | 44/50 [00:19<00:02,  2.84it/s] 90%|█████████ | 45/50 [00:20<00:01,  2.84it/s] 92%|█████████▏| 46/50 [00:20<00:01,  2.84it/s] 94%|█████████▍| 47/50 [00:21<00:01,  2.83it/s] 96%|█████████▌| 48/50 [00:21<00:00,  2.83it/s] 98%|█████████▊| 49/50 [00:21<00:00,  2.82it/s]100%|██████████| 50/50 [00:26<00:00,  1.74s/it]100%|██████████| 50/50 [00:26<00:00,  1.87it/s]
