[I 2023-12-10 23:18:05,066] Trial 237 finished with value: 0.395083253421672 and parameters: {'EMBEDDING_DIM': 983, 'HIDDEN_DIM': 273, 'NUM_LAYERS': 1, 'DROPOUT': 0.2756804342008252, 'LR': 0.002684594700178072, 'WEIGHT_0': 0.5572900894731245, 'WEIGHT_1': 0.4623857708025162, 'WEIGHT_2': 0.14294370429075992, 'WEIGHT_3': 0.42872182490834776, 'WEIGHT_4': 0.9450466099420992, 'WEIGHT_5': 0.6765191093472984, 'WEIGHT_6': 0.6599440829018456, 'WEIGHT_7': 0.17114440166366132, 'WEIGHT_8': 0.8477177577538709, 'optimizer': 'RMSprop'}. Best is trial 221 with value: 0.418736930154747.
/userhome/cs2/dingruiw/conda/envs/py310/lib/python3.10/site-packages/torch/nn/modules/rnn.py:82: UserWarning: dropout option adds dropout after all but last recurrent layer, so non-zero dropout expects num_layers greater than 1, but got dropout=0.3394302853742224 and num_layers=1
  warnings.warn("dropout option adds dropout after all but last "
{'EMBEDDING_DIM': 983, 'HIDDEN_DIM': 273, 'NUM_LAYERS': 1, 'DROPOUT': 0.2756804342008252, 'LR': 0.002684594700178072, 'WEIGHT_0': 0.5572900894731245, 'WEIGHT_1': 0.4623857708025162, 'WEIGHT_2': 0.14294370429075992, 'WEIGHT_3': 0.42872182490834776, 'WEIGHT_4': 0.9450466099420992, 'WEIGHT_5': 0.6765191093472984, 'WEIGHT_6': 0.6599440829018456, 'WEIGHT_7': 0.17114440166366132, 'WEIGHT_8': 0.8477177577538709, 'optimizer': 'RMSprop'}
0
              precision    recall  f1-score   support

         LOC       0.35      0.05      0.09      1837
        MISC       0.01      0.00      0.00       922
         ORG       0.17      0.04      0.07      1341
         PER       0.08      0.02      0.03      1842

   micro avg       0.17      0.03      0.05      5942
   macro avg       0.15      0.03      0.05      5942
weighted avg       0.17      0.03      0.05      5942

{'EMBEDDING_DIM': 983, 'HIDDEN_DIM': 273, 'NUM_LAYERS': 1, 'DROPOUT': 0.2756804342008252, 'LR': 0.002684594700178072, 'WEIGHT_0': 0.5572900894731245, 'WEIGHT_1': 0.4623857708025162, 'WEIGHT_2': 0.14294370429075992, 'WEIGHT_3': 0.42872182490834776, 'WEIGHT_4': 0.9450466099420992, 'WEIGHT_5': 0.6765191093472984, 'WEIGHT_6': 0.6599440829018456, 'WEIGHT_7': 0.17114440166366132, 'WEIGHT_8': 0.8477177577538709, 'optimizer': 'RMSprop'}
49
              precision    recall  f1-score   support

         LOC       0.57      0.53      0.55      1837
        MISC       0.50      0.42      0.46       922
         ORG       0.26      0.25      0.26      1341
         PER       0.32      0.31      0.32      1842

   micro avg       0.41      0.38      0.40      5942
   macro avg       0.41      0.38      0.40      5942
weighted avg       0.41      0.38      0.40      5942

epoch 49
LSTM
  0%|          | 0/50 [00:00<?, ?it/s]  2%|▏         | 1/50 [00:04<03:19,  4.08s/it] 10%|█         | 5/50 [00:04<00:28,  1.57it/s] 14%|█▍        | 7/50 [00:04<00:18,  2.32it/s] 18%|█▊        | 9/50 [00:04<00:12,  3.20it/s] 22%|██▏       | 11/50 [00:04<00:09,  4.18it/s] 26%|██▌       | 13/50 [00:04<00:07,  5.20it/s] 30%|███       | 15/50 [00:05<00:05,  6.21it/s] 34%|███▍      | 17/50 [00:05<00:04,  7.13it/s] 38%|███▊      | 19/50 [00:05<00:03,  7.94it/s] 42%|████▏     | 21/50 [00:05<00:03,  8.62it/s] 46%|████▌     | 23/50 [00:05<00:02,  9.16it/s] 50%|█████     | 25/50 [00:06<00:02,  9.57it/s] 54%|█████▍    | 27/50 [00:06<00:02,  9.87it/s] 58%|█████▊    | 29/50 [00:06<00:02, 10.11it/s] 62%|██████▏   | 31/50 [00:06<00:01, 10.27it/s] 66%|██████▌   | 33/50 [00:06<00:01, 10.39it/s] 70%|███████   | 35/50 [00:07<00:01, 10.48it/s] 74%|███████▍  | 37/50 [00:07<00:01, 10.54it/s] 78%|███████▊  | 39/50 [00:07<00:01, 10.58it/s] 82%|████████▏ | 41/50 [00:07<00:00, 10.60it/s] 86%|████████▌ | 43/50 [00:07<00:00, 10.63it/s] 90%|█████████ | 45/50 [00:07<00:00, 10.65it/s] 94%|█████████▍| 47/50 [00:08<00:00, 10.65it/s] 98%|█████████▊| 49/50 [00:08<00:00, 10.66it/s]100%|██████████| 50/50 [00:12<00:00,  3.96it/s]
[I 2023-12-10 23:18:21,317] Trial 238 finished with value: 0.38653882308704646 and parameters: {'EMBEDDING_DIM': 925, 'HIDDEN_DIM': 118, 'NUM_LAYERS': 1, 'DROPOUT': 0.3394302853742224, 'LR': 0.0023868787327625276, 'WEIGHT_0': 0.6127767293617337, 'WEIGHT_1': 0.480033118016464, 'WEIGHT_2': 0.17349697061284058, 'WEIGHT_3': 0.06370579851788072, 'WEIGHT_4': 0.8730373959610189, 'WEIGHT_5': 0.5276056450000274, 'WEIGHT_6': 0.5722296098386161, 'WEIGHT_7': 0.5117781507706197, 'WEIGHT_8': 0.7787469747127361, 'optimizer': 'Adam'}. Best is trial 221 with value: 0.418736930154747.
/userhome/cs2/dingruiw/conda/envs/py310/lib/python3.10/site-packages/torch/nn/modules/rnn.py:82: UserWarning: dropout option adds dropout after all but last recurrent layer, so non-zero dropout expects num_layers greater than 1, but got dropout=0.37515089025132436 and num_layers=1
  warnings.warn("dropout option adds dropout after all but last "
{'EMBEDDING_DIM': 925, 'HIDDEN_DIM': 118, 'NUM_LAYERS': 1, 'DROPOUT': 0.3394302853742224, 'LR': 0.0023868787327625276, 'WEIGHT_0': 0.6127767293617337, 'WEIGHT_1': 0.480033118016464, 'WEIGHT_2': 0.17349697061284058, 'WEIGHT_3': 0.06370579851788072, 'WEIGHT_4': 0.8730373959610189, 'WEIGHT_5': 0.5276056450000274, 'WEIGHT_6': 0.5722296098386161, 'WEIGHT_7': 0.5117781507706197, 'WEIGHT_8': 0.7787469747127361, 'optimizer': 'Adam'}
0
              precision    recall  f1-score   support

         LOC       0.05      0.08      0.06      1837
        MISC       0.02      0.05      0.03       922
         ORG       0.03      0.10      0.05      1341
         PER       0.03      0.05      0.04      1842

   micro avg       0.03      0.07      0.05      5942
   macro avg       0.03      0.07      0.04      5942
weighted avg       0.03      0.07      0.05      5942

{'EMBEDDING_DIM': 925, 'HIDDEN_DIM': 118, 'NUM_LAYERS': 1, 'DROPOUT': 0.3394302853742224, 'LR': 0.0023868787327625276, 'WEIGHT_0': 0.6127767293617337, 'WEIGHT_1': 0.480033118016464, 'WEIGHT_2': 0.17349697061284058, 'WEIGHT_3': 0.06370579851788072, 'WEIGHT_4': 0.8730373959610189, 'WEIGHT_5': 0.5276056450000274, 'WEIGHT_6': 0.5722296098386161, 'WEIGHT_7': 0.5117781507706197, 'WEIGHT_8': 0.7787469747127361, 'optimizer': 'Adam'}
49
              precision    recall  f1-score   support

         LOC       0.60      0.57      0.59      1837
        MISC       0.51      0.33      0.40       922
         ORG       0.29      0.27      0.28      1341
         PER       0.30      0.19      0.23      1842

   micro avg       0.44      0.35      0.39      5942
   macro avg       0.43      0.34      0.38      5942
weighted avg       0.43      0.35      0.38      5942

epoch 49
LSTM
  0%|          | 0/50 [00:00<?, ?it/s]  2%|▏         | 1/50 [00:04<03:46,  4.63s/it]  6%|▌         | 3/50 [00:04<01:00,  1.29s/it]  8%|▊         | 4/50 [00:05<00:41,  1.12it/s] 10%|█         | 5/50 [00:05<00:29,  1.54it/s] 12%|█▏        | 6/50 [00:05<00:21,  2.05it/s] 14%|█▍        | 7/50 [00:05<00:16,  2.62it/s] 16%|█▌        | 8/50 [00:05<00:12,  3.24it/s] 18%|█▊        | 9/50 [00:05<00:10,  3.85it/s] 20%|██        | 10/50 [00:05<00:09,  4.43it/s] 22%|██▏       | 11/50 [00:06<00:07,  4.94it/s] 24%|██▍       | 12/50 [00:06<00:07,  5.37it/s] 26%|██▌       | 13/50 [00:06<00:06,  5.72it/s] 28%|██▊       | 14/50 [00:06<00:06,  6.00it/s] 30%|███       | 15/50 [00:06<00:05,  6.18it/s] 32%|███▏      | 16/50 [00:06<00:05,  6.34it/s] 34%|███▍      | 17/50 [00:06<00:05,  6.46it/s] 36%|███▌      | 18/50 [00:07<00:04,  6.55it/s] 38%|███▊      | 19/50 [00:07<00:04,  6.61it/s] 40%|████      | 20/50 [00:07<00:04,  6.66it/s] 42%|████▏     | 21/50 [00:07<00:04,  6.67it/s] 44%|████▍     | 22/50 [00:07<00:04,  6.70it/s] 46%|████▌     | 23/50 [00:07<00:04,  6.71it/s] 48%|████▊     | 24/50 [00:07<00:03,  6.72it/s] 50%|█████     | 25/50 [00:08<00:03,  6.73it/s] 52%|█████▏    | 26/50 [00:08<00:03,  6.74it/s] 54%|█████▍    | 27/50 [00:08<00:03,  6.74it/s] 56%|█████▌    | 28/50 [00:08<00:03,  6.74it/s] 58%|█████▊    | 29/50 [00:08<00:03,  6.74it/s] 60%|██████    | 30/50 [00:08<00:02,  6.73it/s] 62%|██████▏   | 31/50 [00:09<00:02,  6.75it/s] 64%|██████▍   | 32/50 [00:09<00:02,  6.74it/s] 66%|██████▌   | 33/50 [00:09<00:02,  6.74it/s] 68%|██████▊   | 34/50 [00:09<00:02,  6.74it/s] 70%|███████   | 35/50 [00:09<00:02,  6.73it/s] 72%|███████▏  | 36/50 [00:09<00:02,  6.74it/s] 74%|███████▍  | 37/50 [00:09<00:01,  6.74it/s] 76%|███████▌  | 38/50 [00:10<00:01,  6.73it/s] 78%|███████▊  | 39/50 [00:10<00:01,  6.73it/s] 80%|████████  | 40/50 [00:10<00:01,  6.73it/s] 82%|████████▏ | 41/50 [00:10<00:01,  6.73it/s] 84%|████████▍ | 42/50 [00:10<00:01,  6.72it/s] 86%|████████▌ | 43/50 [00:10<00:01,  6.73it/s] 88%|████████▊ | 44/50 [00:10<00:00,  6.73it/s] 90%|█████████ | 45/50 [00:11<00:00,  6.72it/s] 92%|█████████▏| 46/50 [00:11<00:00,  6.73it/s] 94%|█████████▍| 47/50 [00:11<00:00,  6.73it/s] 96%|█████████▌| 48/50 [00:11<00:00,  6.72it/s] 98%|█████████▊| 49/50 [00:11<00:00,  6.72it/s]100%|██████████| 50/50 [00:16<00:00,  1.54s/it]100%|██████████| 50/50 [00:16<00:00,  3.03it/s]
[I 2023-12-10 23:18:42,049] Trial 239 finished with value: 0.3231741573033708 and parameters: {'EMBEDDING_DIM': 945, 'HIDDEN_DIM': 222, 'NUM_LAYERS': 1, 'DROPOUT': 0.37515089025132436, 'LR': 0.0070928961947365355, 'WEIGHT_0': 0.1262499910213103, 'WEIGHT_1': 0.06911800058925721, 'WEIGHT_2': 0.40627621465931907, 'WEIGHT_3': 0.8620191119230545, 'WEIGHT_4': 0.3386189598116305, 'WEIGHT_5': 0.07319670719347227, 'WEIGHT_6': 0.776365499520488, 'WEIGHT_7': 0.3416463302334816, 'WEIGHT_8': 0.7111502691918548, 'optimizer': 'RMSprop'}. Best is trial 221 with value: 0.418736930154747.
/userhome/cs2/dingruiw/conda/envs/py310/lib/python3.10/site-packages/torch/nn/modules/rnn.py:82: UserWarning: dropout option adds dropout after all but last recurrent layer, so non-zero dropout expects num_layers greater than 1, but got dropout=0.3475198700496108 and num_layers=1
  warnings.warn("dropout option adds dropout after all but last "
{'EMBEDDING_DIM': 945, 'HIDDEN_DIM': 222, 'NUM_LAYERS': 1, 'DROPOUT': 0.37515089025132436, 'LR': 0.0070928961947365355, 'WEIGHT_0': 0.1262499910213103, 'WEIGHT_1': 0.06911800058925721, 'WEIGHT_2': 0.40627621465931907, 'WEIGHT_3': 0.8620191119230545, 'WEIGHT_4': 0.3386189598116305, 'WEIGHT_5': 0.07319670719347227, 'WEIGHT_6': 0.776365499520488, 'WEIGHT_7': 0.3416463302334816, 'WEIGHT_8': 0.7111502691918548, 'optimizer': 'RMSprop'}
0
              precision    recall  f1-score   support

         LOC       0.16      0.03      0.05      1837
        MISC       0.03      0.00      0.01       922
         ORG       0.07      0.01      0.02      1341
         PER       0.02      0.02      0.02      1842

   micro avg       0.05      0.02      0.03      5942
   macro avg       0.07      0.02      0.02      5942
weighted avg       0.08      0.02      0.03      5942

{'EMBEDDING_DIM': 945, 'HIDDEN_DIM': 222, 'NUM_LAYERS': 1, 'DROPOUT': 0.37515089025132436, 'LR': 0.0070928961947365355, 'WEIGHT_0': 0.1262499910213103, 'WEIGHT_1': 0.06911800058925721, 'WEIGHT_2': 0.40627621465931907, 'WEIGHT_3': 0.8620191119230545, 'WEIGHT_4': 0.3386189598116305, 'WEIGHT_5': 0.07319670719347227, 'WEIGHT_6': 0.776365499520488, 'WEIGHT_7': 0.3416463302334816, 'WEIGHT_8': 0.7111502691918548, 'optimizer': 'RMSprop'}
49
              precision    recall  f1-score   support

         LOC       0.45      0.50      0.47      1837
        MISC       0.28      0.44      0.34       922
         ORG       0.16      0.26      0.20      1341
         PER       0.24      0.34      0.28      1842

   micro avg       0.28      0.39      0.32      5942
   macro avg       0.28      0.39      0.32      5942
weighted avg       0.29      0.39      0.33      5942

epoch 49
LSTM
  0%|          | 0/50 [00:00<?, ?it/s]  2%|▏         | 1/50 [00:04<03:48,  4.66s/it]  4%|▍         | 2/50 [00:04<01:35,  1.99s/it]  6%|▌         | 3/50 [00:05<00:55,  1.19s/it]  8%|▊         | 4/50 [00:05<00:37,  1.24it/s] 10%|█         | 5/50 [00:05<00:26,  1.68it/s] 12%|█▏        | 6/50 [00:05<00:20,  2.14it/s] 14%|█▍        | 7/50 [00:05<00:16,  2.59it/s] 16%|█▌        | 8/50 [00:06<00:14,  3.00it/s] 18%|█▊        | 9/50 [00:06<00:12,  3.35it/s] 20%|██        | 10/50 [00:06<00:10,  3.64it/s] 22%|██▏       | 11/50 [00:06<00:10,  3.87it/s] 24%|██▍       | 12/50 [00:07<00:09,  4.05it/s] 26%|██▌       | 13/50 [00:07<00:08,  4.19it/s] 28%|██▊       | 14/50 [00:07<00:08,  4.28it/s] 30%|███       | 15/50 [00:07<00:08,  4.35it/s] 32%|███▏      | 16/50 [00:07<00:07,  4.40it/s] 34%|███▍      | 17/50 [00:08<00:07,  4.44it/s] 36%|███▌      | 18/50 [00:08<00:07,  4.47it/s] 38%|███▊      | 19/50 [00:08<00:06,  4.48it/s] 40%|████      | 20/50 [00:08<00:06,  4.50it/s] 42%|████▏     | 21/50 [00:08<00:06,  4.51it/s] 44%|████▍     | 22/50 [00:09<00:06,  4.51it/s] 46%|████▌     | 23/50 [00:09<00:05,  4.52it/s] 48%|████▊     | 24/50 [00:09<00:05,  4.52it/s] 50%|█████     | 25/50 [00:09<00:05,  4.52it/s] 52%|█████▏    | 26/50 [00:10<00:05,  4.52it/s] 54%|█████▍    | 27/50 [00:10<00:05,  4.52it/s] 56%|█████▌    | 28/50 [00:10<00:04,  4.52it/s] 58%|█████▊    | 29/50 [00:10<00:04,  4.52it/s] 60%|██████    | 30/50 [00:10<00:04,  4.52it/s] 62%|██████▏   | 31/50 [00:11<00:04,  4.52it/s] 64%|██████▍   | 32/50 [00:11<00:03,  4.52it/s] 66%|██████▌   | 33/50 [00:11<00:03,  4.52it/s] 68%|██████▊   | 34/50 [00:11<00:03,  4.52it/s] 70%|███████   | 35/50 [00:12<00:03,  4.52it/s] 72%|███████▏  | 36/50 [00:12<00:03,  4.52it/s] 74%|███████▍  | 37/50 [00:12<00:02,  4.52it/s] 76%|███████▌  | 38/50 [00:12<00:02,  4.52it/s] 78%|███████▊  | 39/50 [00:12<00:02,  4.52it/s] 80%|████████  | 40/50 [00:13<00:02,  4.52it/s] 82%|████████▏ | 41/50 [00:13<00:01,  4.52it/s] 84%|████████▍ | 42/50 [00:13<00:01,  4.51it/s] 86%|████████▌ | 43/50 [00:13<00:01,  4.51it/s] 88%|████████▊ | 44/50 [00:14<00:01,  4.51it/s] 90%|█████████ | 45/50 [00:14<00:01,  4.50it/s] 92%|█████████▏| 46/50 [00:14<00:00,  4.51it/s] 94%|█████████▍| 47/50 [00:14<00:00,  4.50it/s] 96%|█████████▌| 48/50 [00:14<00:00,  4.50it/s] 98%|█████████▊| 49/50 [00:15<00:00,  4.51it/s]100%|██████████| 50/50 [00:20<00:00,  1.65s/it]100%|██████████| 50/50 [00:20<00:00,  2.48it/s]
[I 2023-12-10 23:19:06,484] Trial 240 finished with value: 0.39122331413080313 and parameters: {'EMBEDDING_DIM': 1002, 'HIDDEN_DIM': 321, 'NUM_LAYERS': 1, 'DROPOUT': 0.3475198700496108, 'LR': 0.0019841054850848663, 'WEIGHT_0': 0.43642035099936455, 'WEIGHT_1': 0.5668298844821311, 'WEIGHT_2': 0.2177126911819044, 'WEIGHT_3': 0.962721063391209, 'WEIGHT_4': 0.5759993622847167, 'WEIGHT_5': 0.9016912854198265, 'WEIGHT_6': 0.9870395542900822, 'WEIGHT_7': 0.2686516917700256, 'WEIGHT_8': 0.8169814218792399, 'optimizer': 'RMSprop'}. Best is trial 221 with value: 0.418736930154747.
/userhome/cs2/dingruiw/conda/envs/py310/lib/python3.10/site-packages/torch/nn/modules/rnn.py:82: UserWarning: dropout option adds dropout after all but last recurrent layer, so non-zero dropout expects num_layers greater than 1, but got dropout=0.35890156578830623 and num_layers=1
  warnings.warn("dropout option adds dropout after all but last "
{'EMBEDDING_DIM': 1002, 'HIDDEN_DIM': 321, 'NUM_LAYERS': 1, 'DROPOUT': 0.3475198700496108, 'LR': 0.0019841054850848663, 'WEIGHT_0': 0.43642035099936455, 'WEIGHT_1': 0.5668298844821311, 'WEIGHT_2': 0.2177126911819044, 'WEIGHT_3': 0.962721063391209, 'WEIGHT_4': 0.5759993622847167, 'WEIGHT_5': 0.9016912854198265, 'WEIGHT_6': 0.9870395542900822, 'WEIGHT_7': 0.2686516917700256, 'WEIGHT_8': 0.8169814218792399, 'optimizer': 'RMSprop'}
0
              precision    recall  f1-score   support

         LOC       0.37      0.15      0.21      1837
        MISC       0.05      0.02      0.03       922
         ORG       0.12      0.01      0.03      1341
         PER       0.06      0.02      0.03      1842

   micro avg       0.18      0.06      0.09      5942
   macro avg       0.15      0.05      0.07      5942
weighted avg       0.17      0.06      0.09      5942

{'EMBEDDING_DIM': 1002, 'HIDDEN_DIM': 321, 'NUM_LAYERS': 1, 'DROPOUT': 0.3475198700496108, 'LR': 0.0019841054850848663, 'WEIGHT_0': 0.43642035099936455, 'WEIGHT_1': 0.5668298844821311, 'WEIGHT_2': 0.2177126911819044, 'WEIGHT_3': 0.962721063391209, 'WEIGHT_4': 0.5759993622847167, 'WEIGHT_5': 0.9016912854198265, 'WEIGHT_6': 0.9870395542900822, 'WEIGHT_7': 0.2686516917700256, 'WEIGHT_8': 0.8169814218792399, 'optimizer': 'RMSprop'}
49
              precision    recall  f1-score   support

         LOC       0.53      0.55      0.54      1837
        MISC       0.42      0.42      0.42       922
         ORG       0.27      0.23      0.25      1341
         PER       0.33      0.33      0.33      1842

   micro avg       0.39      0.39      0.39      5942
   macro avg       0.38      0.38      0.38      5942
weighted avg       0.39      0.39      0.39      5942

epoch 49
LSTM
  0%|          | 0/50 [00:00<?, ?it/s]  2%|▏         | 1/50 [00:04<03:54,  4.78s/it]  4%|▍         | 2/50 [00:04<01:38,  2.05s/it]  6%|▌         | 3/50 [00:05<00:58,  1.24s/it]  8%|▊         | 4/50 [00:05<00:38,  1.18it/s] 10%|█         | 5/50 [00:05<00:28,  1.58it/s] 12%|█▏        | 6/50 [00:05<00:22,  1.99it/s] 14%|█▍        | 7/50 [00:06<00:18,  2.39it/s] 16%|█▌        | 8/50 [00:06<00:15,  2.74it/s] 18%|█▊        | 9/50 [00:06<00:13,  3.04it/s] 20%|██        | 10/50 [00:06<00:12,  3.28it/s] 22%|██▏       | 11/50 [00:07<00:11,  3.48it/s] 24%|██▍       | 12/50 [00:07<00:10,  3.62it/s] 26%|██▌       | 13/50 [00:07<00:09,  3.73it/s] 28%|██▊       | 14/50 [00:07<00:09,  3.81it/s] 30%|███       | 15/50 [00:08<00:09,  3.87it/s] 32%|███▏      | 16/50 [00:08<00:08,  3.91it/s] 34%|███▍      | 17/50 [00:08<00:08,  3.94it/s] 36%|███▌      | 18/50 [00:08<00:08,  3.96it/s] 38%|███▊      | 19/50 [00:09<00:07,  3.97it/s] 40%|████      | 20/50 [00:09<00:07,  3.98it/s] 42%|████▏     | 21/50 [00:09<00:07,  3.99it/s] 44%|████▍     | 22/50 [00:09<00:07,  3.99it/s] 46%|████▌     | 23/50 [00:10<00:06,  3.99it/s] 48%|████▊     | 24/50 [00:10<00:06,  4.00it/s] 50%|█████     | 25/50 [00:10<00:06,  3.99it/s] 52%|█████▏    | 26/50 [00:10<00:06,  4.00it/s] 54%|█████▍    | 27/50 [00:11<00:05,  4.00it/s] 56%|█████▌    | 28/50 [00:11<00:05,  4.00it/s] 58%|█████▊    | 29/50 [00:11<00:05,  4.00it/s] 60%|██████    | 30/50 [00:11<00:04,  4.00it/s] 62%|██████▏   | 31/50 [00:12<00:04,  4.00it/s] 64%|██████▍   | 32/50 [00:12<00:04,  4.00it/s] 66%|██████▌   | 33/50 [00:12<00:04,  4.00it/s] 68%|██████▊   | 34/50 [00:12<00:04,  3.99it/s] 70%|███████   | 35/50 [00:13<00:03,  4.00it/s] 72%|███████▏  | 36/50 [00:13<00:03,  4.00it/s] 74%|███████▍  | 37/50 [00:13<00:03,  4.00it/s] 76%|███████▌  | 38/50 [00:13<00:03,  3.99it/s] 78%|███████▊  | 39/50 [00:14<00:02,  3.99it/s] 80%|████████  | 40/50 [00:14<00:02,  3.99it/s] 82%|████████▏ | 41/50 [00:14<00:02,  3.99it/s] 84%|████████▍ | 42/50 [00:14<00:02,  3.99it/s] 86%|████████▌ | 43/50 [00:15<00:01,  3.99it/s] 88%|████████▊ | 44/50 [00:15<00:01,  3.99it/s] 90%|█████████ | 45/50 [00:15<00:01,  3.98it/s] 92%|█████████▏| 46/50 [00:15<00:01,  3.98it/s] 94%|█████████▍| 47/50 [00:16<00:00,  3.98it/s] 96%|█████████▌| 48/50 [00:16<00:00,  3.98it/s] 98%|█████████▊| 49/50 [00:16<00:00,  3.98it/s]100%|██████████| 50/50 [00:21<00:00,  1.66s/it]100%|██████████| 50/50 [00:21<00:00,  2.31it/s]
