[I 2023-12-10 22:57:16,111] Trial 193 finished with value: 0.40610348648879036 and parameters: {'EMBEDDING_DIM': 998, 'HIDDEN_DIM': 213, 'NUM_LAYERS': 1, 'DROPOUT': 0.31463103206888676, 'LR': 0.002788328638632507, 'WEIGHT_0': 0.40161790470048825, 'WEIGHT_1': 0.7416030588157406, 'WEIGHT_2': 0.6405388880971996, 'WEIGHT_3': 0.9531944396196218, 'WEIGHT_4': 0.9766832051598635, 'WEIGHT_5': 0.7001336320282892, 'WEIGHT_6': 0.8361250191931099, 'WEIGHT_7': 0.3676969163265634, 'WEIGHT_8': 0.40639509068276924, 'optimizer': 'RMSprop'}. Best is trial 134 with value: 0.4158467115484205.
/userhome/cs2/dingruiw/conda/envs/py310/lib/python3.10/site-packages/torch/nn/modules/rnn.py:82: UserWarning: dropout option adds dropout after all but last recurrent layer, so non-zero dropout expects num_layers greater than 1, but got dropout=0.3560487313018562 and num_layers=1
  warnings.warn("dropout option adds dropout after all but last "
{'EMBEDDING_DIM': 998, 'HIDDEN_DIM': 213, 'NUM_LAYERS': 1, 'DROPOUT': 0.31463103206888676, 'LR': 0.002788328638632507, 'WEIGHT_0': 0.40161790470048825, 'WEIGHT_1': 0.7416030588157406, 'WEIGHT_2': 0.6405388880971996, 'WEIGHT_3': 0.9531944396196218, 'WEIGHT_4': 0.9766832051598635, 'WEIGHT_5': 0.7001336320282892, 'WEIGHT_6': 0.8361250191931099, 'WEIGHT_7': 0.3676969163265634, 'WEIGHT_8': 0.40639509068276924, 'optimizer': 'RMSprop'}
0
              precision    recall  f1-score   support

         LOC       0.42      0.15      0.22      1837
        MISC       0.05      0.01      0.02       922
         ORG       0.20      0.04      0.07      1341
         PER       0.13      0.02      0.04      1842

   micro avg       0.26      0.06      0.10      5942
   macro avg       0.20      0.05      0.08      5942
weighted avg       0.22      0.06      0.10      5942

{'EMBEDDING_DIM': 998, 'HIDDEN_DIM': 213, 'NUM_LAYERS': 1, 'DROPOUT': 0.31463103206888676, 'LR': 0.002788328638632507, 'WEIGHT_0': 0.40161790470048825, 'WEIGHT_1': 0.7416030588157406, 'WEIGHT_2': 0.6405388880971996, 'WEIGHT_3': 0.9531944396196218, 'WEIGHT_4': 0.9766832051598635, 'WEIGHT_5': 0.7001336320282892, 'WEIGHT_6': 0.8361250191931099, 'WEIGHT_7': 0.3676969163265634, 'WEIGHT_8': 0.40639509068276924, 'optimizer': 'RMSprop'}
49
              precision    recall  f1-score   support

         LOC       0.57      0.52      0.55      1837
        MISC       0.44      0.44      0.44       922
         ORG       0.29      0.26      0.27      1341
         PER       0.33      0.36      0.35      1842

   micro avg       0.41      0.40      0.41      5942
   macro avg       0.41      0.40      0.40      5942
weighted avg       0.41      0.40      0.41      5942

epoch 49
LSTM
  0%|          | 0/50 [00:00<?, ?it/s]  2%|▏         | 1/50 [00:04<03:54,  4.79s/it]  4%|▍         | 2/50 [00:04<01:39,  2.07s/it]  6%|▌         | 3/50 [00:05<00:59,  1.28s/it]  8%|▊         | 4/50 [00:05<00:41,  1.11it/s] 10%|█         | 5/50 [00:05<00:31,  1.45it/s] 12%|█▏        | 6/50 [00:06<00:24,  1.77it/s] 14%|█▍        | 7/50 [00:06<00:20,  2.07it/s] 16%|█▌        | 8/50 [00:06<00:18,  2.32it/s] 18%|█▊        | 9/50 [00:07<00:16,  2.52it/s] 20%|██        | 10/50 [00:07<00:14,  2.68it/s] 22%|██▏       | 11/50 [00:07<00:13,  2.81it/s] 24%|██▍       | 12/50 [00:08<00:13,  2.91it/s] 26%|██▌       | 13/50 [00:08<00:12,  2.97it/s] 28%|██▊       | 14/50 [00:08<00:11,  3.02it/s] 30%|███       | 15/50 [00:09<00:11,  3.06it/s] 32%|███▏      | 16/50 [00:09<00:11,  3.08it/s] 34%|███▍      | 17/50 [00:09<00:10,  3.09it/s] 36%|███▌      | 18/50 [00:10<00:10,  3.11it/s] 38%|███▊      | 19/50 [00:10<00:09,  3.12it/s] 40%|████      | 20/50 [00:10<00:09,  3.12it/s] 42%|████▏     | 21/50 [00:11<00:09,  3.12it/s] 44%|████▍     | 22/50 [00:11<00:08,  3.12it/s] 46%|████▌     | 23/50 [00:11<00:08,  3.13it/s] 48%|████▊     | 24/50 [00:11<00:08,  3.13it/s] 50%|█████     | 25/50 [00:12<00:08,  3.12it/s] 52%|█████▏    | 26/50 [00:12<00:07,  3.12it/s] 54%|█████▍    | 27/50 [00:12<00:07,  3.13it/s] 56%|█████▌    | 28/50 [00:13<00:07,  3.13it/s] 58%|█████▊    | 29/50 [00:13<00:06,  3.13it/s] 60%|██████    | 30/50 [00:13<00:06,  3.13it/s] 62%|██████▏   | 31/50 [00:14<00:06,  3.13it/s] 64%|██████▍   | 32/50 [00:14<00:05,  3.13it/s] 66%|██████▌   | 33/50 [00:14<00:05,  3.12it/s] 68%|██████▊   | 34/50 [00:15<00:05,  3.13it/s] 70%|███████   | 35/50 [00:15<00:04,  3.12it/s] 72%|███████▏  | 36/50 [00:15<00:04,  3.13it/s] 74%|███████▍  | 37/50 [00:16<00:04,  3.13it/s] 76%|███████▌  | 38/50 [00:16<00:03,  3.13it/s] 78%|███████▊  | 39/50 [00:16<00:03,  3.13it/s] 80%|████████  | 40/50 [00:17<00:03,  3.13it/s] 82%|████████▏ | 41/50 [00:17<00:02,  3.12it/s] 84%|████████▍ | 42/50 [00:17<00:02,  3.12it/s] 86%|████████▌ | 43/50 [00:18<00:02,  3.12it/s] 88%|████████▊ | 44/50 [00:18<00:01,  3.13it/s] 90%|█████████ | 45/50 [00:18<00:01,  3.12it/s] 92%|█████████▏| 46/50 [00:19<00:01,  3.12it/s] 94%|█████████▍| 47/50 [00:19<00:00,  3.12it/s] 96%|█████████▌| 48/50 [00:19<00:00,  3.11it/s] 98%|█████████▊| 49/50 [00:19<00:00,  3.12it/s]100%|██████████| 50/50 [00:24<00:00,  1.72s/it]100%|██████████| 50/50 [00:24<00:00,  2.00it/s]
[I 2023-12-10 22:57:45,344] Trial 194 finished with value: 0.3939015691868759 and parameters: {'EMBEDDING_DIM': 960, 'HIDDEN_DIM': 483, 'NUM_LAYERS': 1, 'DROPOUT': 0.3560487313018562, 'LR': 0.0023153520497853066, 'WEIGHT_0': 0.4616589536552671, 'WEIGHT_1': 0.6245307951148902, 'WEIGHT_2': 0.7010106731436913, 'WEIGHT_3': 0.6748911396969564, 'WEIGHT_4': 0.8927334937273335, 'WEIGHT_5': 0.4916611501548438, 'WEIGHT_6': 0.7510466563464822, 'WEIGHT_7': 0.39755345908386264, 'WEIGHT_8': 0.43628461242730016, 'optimizer': 'RMSprop'}. Best is trial 134 with value: 0.4158467115484205.
/userhome/cs2/dingruiw/conda/envs/py310/lib/python3.10/site-packages/torch/nn/modules/rnn.py:82: UserWarning: dropout option adds dropout after all but last recurrent layer, so non-zero dropout expects num_layers greater than 1, but got dropout=0.3287678911810272 and num_layers=1
  warnings.warn("dropout option adds dropout after all but last "
{'EMBEDDING_DIM': 960, 'HIDDEN_DIM': 483, 'NUM_LAYERS': 1, 'DROPOUT': 0.3560487313018562, 'LR': 0.0023153520497853066, 'WEIGHT_0': 0.4616589536552671, 'WEIGHT_1': 0.6245307951148902, 'WEIGHT_2': 0.7010106731436913, 'WEIGHT_3': 0.6748911396969564, 'WEIGHT_4': 0.8927334937273335, 'WEIGHT_5': 0.4916611501548438, 'WEIGHT_6': 0.7510466563464822, 'WEIGHT_7': 0.39755345908386264, 'WEIGHT_8': 0.43628461242730016, 'optimizer': 'RMSprop'}
0
              precision    recall  f1-score   support

         LOC       0.18      0.05      0.08      1837
        MISC       0.04      0.03      0.04       922
         ORG       0.10      0.02      0.04      1341
         PER       0.03      0.01      0.02      1842

   micro avg       0.08      0.03      0.04      5942
   macro avg       0.09      0.03      0.04      5942
weighted avg       0.10      0.03      0.04      5942

{'EMBEDDING_DIM': 960, 'HIDDEN_DIM': 483, 'NUM_LAYERS': 1, 'DROPOUT': 0.3560487313018562, 'LR': 0.0023153520497853066, 'WEIGHT_0': 0.4616589536552671, 'WEIGHT_1': 0.6245307951148902, 'WEIGHT_2': 0.7010106731436913, 'WEIGHT_3': 0.6748911396969564, 'WEIGHT_4': 0.8927334937273335, 'WEIGHT_5': 0.4916611501548438, 'WEIGHT_6': 0.7510466563464822, 'WEIGHT_7': 0.39755345908386264, 'WEIGHT_8': 0.43628461242730016, 'optimizer': 'RMSprop'}
49
              precision    recall  f1-score   support

         LOC       0.59      0.48      0.53      1837
        MISC       0.45      0.42      0.43       922
         ORG       0.30      0.24      0.26      1341
         PER       0.33      0.33      0.33      1842

   micro avg       0.42      0.37      0.39      5942
   macro avg       0.42      0.37      0.39      5942
weighted avg       0.42      0.37      0.40      5942

epoch 49
LSTM
  0%|          | 0/50 [00:00<?, ?it/s]  2%|▏         | 1/50 [00:04<03:52,  4.75s/it]  4%|▍         | 2/50 [00:04<01:38,  2.04s/it]  6%|▌         | 3/50 [00:05<00:58,  1.24s/it]  8%|▊         | 4/50 [00:05<00:39,  1.17it/s] 10%|█         | 5/50 [00:05<00:28,  1.55it/s] 12%|█▏        | 6/50 [00:05<00:22,  1.94it/s] 14%|█▍        | 7/50 [00:06<00:18,  2.30it/s] 16%|█▌        | 8/50 [00:06<00:16,  2.62it/s] 18%|█▊        | 9/50 [00:06<00:14,  2.89it/s] 20%|██        | 10/50 [00:07<00:12,  3.11it/s] 22%|██▏       | 11/50 [00:07<00:11,  3.28it/s] 24%|██▍       | 12/50 [00:07<00:11,  3.41it/s] 26%|██▌       | 13/50 [00:07<00:10,  3.50it/s] 28%|██▊       | 14/50 [00:08<00:10,  3.57it/s] 30%|███       | 15/50 [00:08<00:09,  3.62it/s] 32%|███▏      | 16/50 [00:08<00:09,  3.66it/s] 34%|███▍      | 17/50 [00:08<00:08,  3.68it/s] 36%|███▌      | 18/50 [00:09<00:08,  3.70it/s] 38%|███▊      | 19/50 [00:09<00:08,  3.71it/s] 40%|████      | 20/50 [00:09<00:08,  3.72it/s] 42%|████▏     | 21/50 [00:09<00:07,  3.72it/s] 44%|████▍     | 22/50 [00:10<00:07,  3.73it/s] 46%|████▌     | 23/50 [00:10<00:07,  3.73it/s] 48%|████▊     | 24/50 [00:10<00:06,  3.73it/s] 50%|█████     | 25/50 [00:11<00:06,  3.73it/s] 52%|█████▏    | 26/50 [00:11<00:06,  3.73it/s] 54%|█████▍    | 27/50 [00:11<00:06,  3.73it/s] 56%|█████▌    | 28/50 [00:11<00:05,  3.73it/s] 58%|█████▊    | 29/50 [00:12<00:05,  3.73it/s] 60%|██████    | 30/50 [00:12<00:05,  3.73it/s] 62%|██████▏   | 31/50 [00:12<00:05,  3.73it/s] 64%|██████▍   | 32/50 [00:12<00:04,  3.73it/s] 66%|██████▌   | 33/50 [00:13<00:04,  3.73it/s] 68%|██████▊   | 34/50 [00:13<00:04,  3.73it/s] 70%|███████   | 35/50 [00:13<00:04,  3.73it/s] 72%|███████▏  | 36/50 [00:14<00:03,  3.72it/s] 74%|███████▍  | 37/50 [00:14<00:03,  3.72it/s] 76%|███████▌  | 38/50 [00:14<00:03,  3.72it/s] 78%|███████▊  | 39/50 [00:14<00:02,  3.72it/s] 80%|████████  | 40/50 [00:15<00:02,  3.72it/s] 82%|████████▏ | 41/50 [00:15<00:02,  3.72it/s] 84%|████████▍ | 42/50 [00:15<00:02,  3.72it/s] 86%|████████▌ | 43/50 [00:15<00:01,  3.72it/s] 88%|████████▊ | 44/50 [00:16<00:01,  3.72it/s] 90%|█████████ | 45/50 [00:16<00:01,  3.72it/s] 92%|█████████▏| 46/50 [00:16<00:01,  3.72it/s] 94%|█████████▍| 47/50 [00:16<00:00,  3.72it/s] 96%|█████████▌| 48/50 [00:17<00:00,  3.72it/s] 98%|█████████▊| 49/50 [00:17<00:00,  3.72it/s]100%|██████████| 50/50 [00:22<00:00,  1.66s/it]100%|██████████| 50/50 [00:22<00:00,  2.23it/s]
[I 2023-12-10 22:58:12,022] Trial 195 finished with value: 0.37753902971294273 and parameters: {'EMBEDDING_DIM': 985, 'HIDDEN_DIM': 404, 'NUM_LAYERS': 1, 'DROPOUT': 0.3287678911810272, 'LR': 0.0025359835353073396, 'WEIGHT_0': 0.3647049864317938, 'WEIGHT_1': 0.40156784525837347, 'WEIGHT_2': 0.5390160017663951, 'WEIGHT_3': 0.7144012344966746, 'WEIGHT_4': 0.9199076794265802, 'WEIGHT_5': 0.5191101801179948, 'WEIGHT_6': 0.8255639550902409, 'WEIGHT_7': 0.2846749528525037, 'WEIGHT_8': 0.47570244577503173, 'optimizer': 'RMSprop'}. Best is trial 134 with value: 0.4158467115484205.
/userhome/cs2/dingruiw/conda/envs/py310/lib/python3.10/site-packages/torch/nn/modules/rnn.py:82: UserWarning: dropout option adds dropout after all but last recurrent layer, so non-zero dropout expects num_layers greater than 1, but got dropout=0.367311448857295 and num_layers=1
  warnings.warn("dropout option adds dropout after all but last "
{'EMBEDDING_DIM': 985, 'HIDDEN_DIM': 404, 'NUM_LAYERS': 1, 'DROPOUT': 0.3287678911810272, 'LR': 0.0025359835353073396, 'WEIGHT_0': 0.3647049864317938, 'WEIGHT_1': 0.40156784525837347, 'WEIGHT_2': 0.5390160017663951, 'WEIGHT_3': 0.7144012344966746, 'WEIGHT_4': 0.9199076794265802, 'WEIGHT_5': 0.5191101801179948, 'WEIGHT_6': 0.8255639550902409, 'WEIGHT_7': 0.2846749528525037, 'WEIGHT_8': 0.47570244577503173, 'optimizer': 'RMSprop'}
0
              precision    recall  f1-score   support

         LOC       0.16      0.06      0.09      1837
        MISC       0.09      0.02      0.04       922
         ORG       0.07      0.02      0.04      1341
         PER       0.07      0.02      0.04      1842

   micro avg       0.11      0.04      0.05      5942
   macro avg       0.10      0.03      0.05      5942
weighted avg       0.10      0.04      0.05      5942

{'EMBEDDING_DIM': 985, 'HIDDEN_DIM': 404, 'NUM_LAYERS': 1, 'DROPOUT': 0.3287678911810272, 'LR': 0.0025359835353073396, 'WEIGHT_0': 0.3647049864317938, 'WEIGHT_1': 0.40156784525837347, 'WEIGHT_2': 0.5390160017663951, 'WEIGHT_3': 0.7144012344966746, 'WEIGHT_4': 0.9199076794265802, 'WEIGHT_5': 0.5191101801179948, 'WEIGHT_6': 0.8255639550902409, 'WEIGHT_7': 0.2846749528525037, 'WEIGHT_8': 0.47570244577503173, 'optimizer': 'RMSprop'}
49
              precision    recall  f1-score   support

         LOC       0.53      0.52      0.53      1837
        MISC       0.45      0.44      0.44       922
         ORG       0.24      0.22      0.23      1341
         PER       0.29      0.32      0.31      1842

   micro avg       0.38      0.38      0.38      5942
   macro avg       0.38      0.38      0.38      5942
weighted avg       0.38      0.38      0.38      5942

epoch 49
LSTM
  0%|          | 0/50 [00:00<?, ?it/s]  2%|▏         | 1/50 [00:04<03:50,  4.71s/it]  4%|▍         | 2/50 [00:04<01:36,  2.01s/it]  6%|▌         | 3/50 [00:05<00:56,  1.19s/it]  8%|▊         | 4/50 [00:05<00:37,  1.24it/s] 10%|█         | 5/50 [00:05<00:26,  1.68it/s] 12%|█▏        | 6/50 [00:05<00:20,  2.13it/s] 14%|█▍        | 7/50 [00:05<00:16,  2.58it/s] 16%|█▌        | 8/50 [00:06<00:14,  2.99it/s] 18%|█▊        | 9/50 [00:06<00:12,  3.34it/s] 20%|██        | 10/50 [00:06<00:11,  3.64it/s] 22%|██▏       | 11/50 [00:06<00:10,  3.87it/s] 24%|██▍       | 12/50 [00:07<00:09,  4.05it/s] 26%|██▌       | 13/50 [00:07<00:08,  4.18it/s] 28%|██▊       | 14/50 [00:07<00:08,  4.28it/s] 30%|███       | 15/50 [00:07<00:08,  4.35it/s] 32%|███▏      | 16/50 [00:07<00:07,  4.40it/s] 34%|███▍      | 17/50 [00:08<00:07,  4.43it/s] 36%|███▌      | 18/50 [00:08<00:07,  4.46it/s] 38%|███▊      | 19/50 [00:08<00:06,  4.47it/s] 40%|████      | 20/50 [00:08<00:06,  4.48it/s] 42%|████▏     | 21/50 [00:09<00:06,  4.50it/s] 44%|████▍     | 22/50 [00:09<00:06,  4.50it/s] 46%|████▌     | 23/50 [00:09<00:05,  4.51it/s] 48%|████▊     | 24/50 [00:09<00:05,  4.51it/s] 50%|█████     | 25/50 [00:09<00:05,  4.51it/s] 52%|█████▏    | 26/50 [00:10<00:05,  4.51it/s] 54%|█████▍    | 27/50 [00:10<00:05,  4.51it/s] 56%|█████▌    | 28/50 [00:10<00:04,  4.51it/s] 58%|█████▊    | 29/50 [00:10<00:04,  4.51it/s] 60%|██████    | 30/50 [00:11<00:04,  4.51it/s] 62%|██████▏   | 31/50 [00:11<00:04,  4.51it/s] 64%|██████▍   | 32/50 [00:11<00:03,  4.51it/s] 66%|██████▌   | 33/50 [00:11<00:03,  4.51it/s] 68%|██████▊   | 34/50 [00:11<00:03,  4.50it/s] 70%|███████   | 35/50 [00:12<00:03,  4.51it/s] 72%|███████▏  | 36/50 [00:12<00:03,  4.51it/s] 74%|███████▍  | 37/50 [00:12<00:02,  4.51it/s] 76%|███████▌  | 38/50 [00:12<00:02,  4.51it/s] 78%|███████▊  | 39/50 [00:13<00:02,  4.50it/s] 80%|████████  | 40/50 [00:13<00:02,  4.50it/s] 82%|████████▏ | 41/50 [00:13<00:01,  4.51it/s] 84%|████████▍ | 42/50 [00:13<00:01,  4.51it/s] 86%|████████▌ | 43/50 [00:13<00:01,  4.51it/s] 88%|████████▊ | 44/50 [00:14<00:01,  4.50it/s] 90%|█████████ | 45/50 [00:14<00:01,  4.50it/s] 92%|█████████▏| 46/50 [00:14<00:00,  4.50it/s] 94%|█████████▍| 47/50 [00:14<00:00,  4.50it/s] 96%|█████████▌| 48/50 [00:15<00:00,  4.50it/s] 98%|█████████▊| 49/50 [00:15<00:00,  4.50it/s]100%|██████████| 50/50 [00:20<00:00,  1.63s/it]100%|██████████| 50/50 [00:20<00:00,  2.48it/s]
[I 2023-12-10 22:58:36,429] Trial 196 finished with value: 0.3861597607859889 and parameters: {'EMBEDDING_DIM': 930, 'HIDDEN_DIM': 333, 'NUM_LAYERS': 1, 'DROPOUT': 0.367311448857295, 'LR': 0.003252598412720861, 'WEIGHT_0': 0.4186978688684832, 'WEIGHT_1': 0.7240801541687136, 'WEIGHT_2': 0.6257171472381806, 'WEIGHT_3': 0.9046302630732941, 'WEIGHT_4': 0.9554442899583864, 'WEIGHT_5': 0.4743408584824948, 'WEIGHT_6': 0.7919050918497159, 'WEIGHT_7': 0.3452642370088221, 'WEIGHT_8': 0.45855081580956086, 'optimizer': 'RMSprop'}. Best is trial 134 with value: 0.4158467115484205.
/userhome/cs2/dingruiw/conda/envs/py310/lib/python3.10/site-packages/torch/nn/modules/rnn.py:82: UserWarning: dropout option adds dropout after all but last recurrent layer, so non-zero dropout expects num_layers greater than 1, but got dropout=0.341563108681323 and num_layers=1
  warnings.warn("dropout option adds dropout after all but last "
{'EMBEDDING_DIM': 930, 'HIDDEN_DIM': 333, 'NUM_LAYERS': 1, 'DROPOUT': 0.367311448857295, 'LR': 0.003252598412720861, 'WEIGHT_0': 0.4186978688684832, 'WEIGHT_1': 0.7240801541687136, 'WEIGHT_2': 0.6257171472381806, 'WEIGHT_3': 0.9046302630732941, 'WEIGHT_4': 0.9554442899583864, 'WEIGHT_5': 0.4743408584824948, 'WEIGHT_6': 0.7919050918497159, 'WEIGHT_7': 0.3452642370088221, 'WEIGHT_8': 0.45855081580956086, 'optimizer': 'RMSprop'}
0
              precision    recall  f1-score   support

         LOC       0.16      0.10      0.12      1837
        MISC       0.02      0.02      0.02       922
         ORG       0.06      0.02      0.03      1341
         PER       0.03      0.02      0.02      1842

   micro avg       0.08      0.04      0.06      5942
   macro avg       0.07      0.04      0.05      5942
weighted avg       0.08      0.04      0.05      5942

{'EMBEDDING_DIM': 930, 'HIDDEN_DIM': 333, 'NUM_LAYERS': 1, 'DROPOUT': 0.367311448857295, 'LR': 0.003252598412720861, 'WEIGHT_0': 0.4186978688684832, 'WEIGHT_1': 0.7240801541687136, 'WEIGHT_2': 0.6257171472381806, 'WEIGHT_3': 0.9046302630732941, 'WEIGHT_4': 0.9554442899583864, 'WEIGHT_5': 0.4743408584824948, 'WEIGHT_6': 0.7919050918497159, 'WEIGHT_7': 0.3452642370088221, 'WEIGHT_8': 0.45855081580956086, 'optimizer': 'RMSprop'}
49
              precision    recall  f1-score   support

         LOC       0.58      0.51      0.54      1837
        MISC       0.44      0.44      0.44       922
         ORG       0.26      0.23      0.25      1341
         PER       0.30      0.33      0.31      1842

   micro avg       0.39      0.38      0.39      5942
   macro avg       0.40      0.38      0.39      5942
weighted avg       0.40      0.38      0.39      5942

epoch 49
LSTM
  0%|          | 0/50 [00:00<?, ?it/s]  2%|▏         | 1/50 [00:04<03:52,  4.75s/it]  6%|▌         | 3/50 [00:05<01:03,  1.34s/it]  8%|▊         | 4/50 [00:05<00:43,  1.07it/s] 10%|█         | 5/50 [00:05<00:30,  1.46it/s] 12%|█▏        | 6/50 [00:05<00:22,  1.92it/s] 14%|█▍        | 7/50 [00:05<00:17,  2.43it/s] 16%|█▌        | 8/50 [00:05<00:14,  2.95it/s] 18%|█▊        | 9/50 [00:06<00:11,  3.47it/s] 20%|██        | 10/50 [00:06<00:10,  3.94it/s] 22%|██▏       | 11/50 [00:06<00:08,  4.35it/s] 24%|██▍       | 12/50 [00:06<00:08,  4.70it/s] 26%|██▌       | 13/50 [00:06<00:07,  4.96it/s] 28%|██▊       | 14/50 [00:06<00:06,  5.17it/s] 30%|███       | 15/50 [00:07<00:06,  5.33it/s] 32%|███▏      | 16/50 [00:07<00:06,  5.44it/s] 34%|███▍      | 17/50 [00:07<00:05,  5.53it/s] 36%|███▌      | 18/50 [00:07<00:05,  5.59it/s] 38%|███▊      | 19/50 [00:07<00:05,  5.63it/s] 40%|████      | 20/50 [00:08<00:05,  5.66it/s] 42%|████▏     | 21/50 [00:08<00:05,  5.67it/s] 44%|████▍     | 22/50 [00:08<00:04,  5.69it/s] 46%|████▌     | 23/50 [00:08<00:04,  5.69it/s] 48%|████▊     | 24/50 [00:08<00:04,  5.69it/s] 50%|█████     | 25/50 [00:08<00:04,  5.70it/s] 52%|█████▏    | 26/50 [00:09<00:04,  5.69it/s] 54%|█████▍    | 27/50 [00:09<00:04,  5.70it/s] 56%|█████▌    | 28/50 [00:09<00:03,  5.70it/s] 58%|█████▊    | 29/50 [00:09<00:03,  5.68it/s] 60%|██████    | 30/50 [00:09<00:03,  5.70it/s] 62%|██████▏   | 31/50 [00:09<00:03,  5.70it/s] 64%|██████▍   | 32/50 [00:10<00:03,  5.69it/s] 66%|██████▌   | 33/50 [00:10<00:02,  5.69it/s] 68%|██████▊   | 34/50 [00:10<00:02,  5.69it/s] 70%|███████   | 35/50 [00:10<00:02,  5.68it/s] 72%|███████▏  | 36/50 [00:10<00:02,  5.69it/s] 74%|███████▍  | 37/50 [00:10<00:02,  5.69it/s] 76%|███████▌  | 38/50 [00:11<00:02,  5.69it/s] 78%|███████▊  | 39/50 [00:11<00:01,  5.68it/s] 80%|████████  | 40/50 [00:11<00:01,  5.69it/s] 82%|████████▏ | 41/50 [00:11<00:01,  5.68it/s] 84%|████████▍ | 42/50 [00:11<00:01,  5.69it/s] 86%|████████▌ | 43/50 [00:12<00:01,  5.68it/s] 88%|████████▊ | 44/50 [00:12<00:01,  5.68it/s] 90%|█████████ | 45/50 [00:12<00:00,  5.68it/s] 92%|█████████▏| 46/50 [00:12<00:00,  5.69it/s] 94%|█████████▍| 47/50 [00:12<00:00,  5.68it/s] 96%|█████████▌| 48/50 [00:12<00:00,  5.68it/s] 98%|█████████▊| 49/50 [00:13<00:00,  5.68it/s]100%|██████████| 50/50 [00:17<00:00,  1.53s/it]100%|██████████| 50/50 [00:17<00:00,  2.81it/s]
