[I 2023-12-10 22:47:26,488] Trial 177 finished with value: 0.39280774550484093 and parameters: {'EMBEDDING_DIM': 984, 'HIDDEN_DIM': 172, 'NUM_LAYERS': 1, 'DROPOUT': 0.3523634328737281, 'LR': 0.0022635869277217993, 'WEIGHT_0': 0.37827907866711286, 'WEIGHT_1': 0.7069851772153825, 'WEIGHT_2': 0.6394573879514285, 'WEIGHT_3': 0.745063766930137, 'WEIGHT_4': 0.6307991764086461, 'WEIGHT_5': 0.5614959166753801, 'WEIGHT_6': 0.6956283357091939, 'WEIGHT_7': 0.2560746261648777, 'WEIGHT_8': 0.4880746676223923, 'optimizer': 'RMSprop'}. Best is trial 134 with value: 0.4158467115484205.
{'EMBEDDING_DIM': 984, 'HIDDEN_DIM': 172, 'NUM_LAYERS': 1, 'DROPOUT': 0.3523634328737281, 'LR': 0.0022635869277217993, 'WEIGHT_0': 0.37827907866711286, 'WEIGHT_1': 0.7069851772153825, 'WEIGHT_2': 0.6394573879514285, 'WEIGHT_3': 0.745063766930137, 'WEIGHT_4': 0.6307991764086461, 'WEIGHT_5': 0.5614959166753801, 'WEIGHT_6': 0.6956283357091939, 'WEIGHT_7': 0.2560746261648777, 'WEIGHT_8': 0.4880746676223923, 'optimizer': 'RMSprop'}
0
              precision    recall  f1-score   support

         LOC       0.44      0.16      0.24      1837
        MISC       0.10      0.02      0.04       922
         ORG       0.13      0.09      0.10      1341
         PER       0.06      0.01      0.02      1842

   micro avg       0.20      0.08      0.11      5942
   macro avg       0.18      0.07      0.10      5942
weighted avg       0.20      0.08      0.11      5942

{'EMBEDDING_DIM': 984, 'HIDDEN_DIM': 172, 'NUM_LAYERS': 1, 'DROPOUT': 0.3523634328737281, 'LR': 0.0022635869277217993, 'WEIGHT_0': 0.37827907866711286, 'WEIGHT_1': 0.7069851772153825, 'WEIGHT_2': 0.6394573879514285, 'WEIGHT_3': 0.745063766930137, 'WEIGHT_4': 0.6307991764086461, 'WEIGHT_5': 0.5614959166753801, 'WEIGHT_6': 0.6956283357091939, 'WEIGHT_7': 0.2560746261648777, 'WEIGHT_8': 0.4880746676223923, 'optimizer': 'RMSprop'}
49
              precision    recall  f1-score   support

         LOC       0.52      0.54      0.53      1837
        MISC       0.44      0.45      0.45       922
         ORG       0.28      0.29      0.28      1341
         PER       0.29      0.33      0.31      1842

   micro avg       0.38      0.41      0.39      5942
   macro avg       0.38      0.40      0.39      5942
weighted avg       0.38      0.41      0.39      5942

epoch 49
LSTM
  0%|          | 0/50 [00:00<?, ?it/s]  2%|▏         | 1/50 [00:07<05:57,  7.29s/it]  4%|▍         | 2/50 [00:07<02:35,  3.24s/it]  6%|▌         | 3/50 [00:08<01:39,  2.12s/it]  8%|▊         | 4/50 [00:09<01:13,  1.60s/it] 10%|█         | 5/50 [00:10<00:58,  1.31s/it] 12%|█▏        | 6/50 [00:10<00:49,  1.13s/it] 14%|█▍        | 7/50 [00:11<00:44,  1.02s/it] 16%|█▌        | 8/50 [00:12<00:40,  1.05it/s] 18%|█▊        | 9/50 [00:13<00:37,  1.11it/s] 20%|██        | 10/50 [00:14<00:34,  1.15it/s] 22%|██▏       | 11/50 [00:14<00:32,  1.18it/s] 24%|██▍       | 12/50 [00:15<00:31,  1.20it/s] 26%|██▌       | 13/50 [00:16<00:30,  1.22it/s] 28%|██▊       | 14/50 [00:17<00:29,  1.23it/s] 30%|███       | 15/50 [00:18<00:28,  1.24it/s] 32%|███▏      | 16/50 [00:18<00:27,  1.24it/s] 34%|███▍      | 17/50 [00:19<00:26,  1.24it/s] 36%|███▌      | 18/50 [00:20<00:25,  1.25it/s] 38%|███▊      | 19/50 [00:21<00:24,  1.25it/s] 40%|████      | 20/50 [00:22<00:24,  1.25it/s] 42%|████▏     | 21/50 [00:22<00:23,  1.25it/s] 44%|████▍     | 22/50 [00:23<00:22,  1.25it/s] 46%|████▌     | 23/50 [00:24<00:21,  1.25it/s] 48%|████▊     | 24/50 [00:25<00:20,  1.25it/s] 50%|█████     | 25/50 [00:26<00:20,  1.25it/s] 52%|█████▏    | 26/50 [00:26<00:19,  1.25it/s] 54%|█████▍    | 27/50 [00:27<00:18,  1.25it/s] 56%|█████▌    | 28/50 [00:28<00:17,  1.25it/s] 58%|█████▊    | 29/50 [00:29<00:16,  1.25it/s] 60%|██████    | 30/50 [00:30<00:16,  1.24it/s] 62%|██████▏   | 31/50 [00:30<00:15,  1.24it/s] 64%|██████▍   | 32/50 [00:31<00:14,  1.24it/s] 66%|██████▌   | 33/50 [00:32<00:13,  1.24it/s] 68%|██████▊   | 34/50 [00:33<00:12,  1.24it/s] 70%|███████   | 35/50 [00:34<00:12,  1.24it/s] 72%|███████▏  | 36/50 [00:34<00:11,  1.24it/s] 74%|███████▍  | 37/50 [00:35<00:10,  1.24it/s] 76%|███████▌  | 38/50 [00:36<00:09,  1.24it/s] 78%|███████▊  | 39/50 [00:37<00:08,  1.24it/s] 80%|████████  | 40/50 [00:38<00:08,  1.24it/s] 82%|████████▏ | 41/50 [00:38<00:07,  1.24it/s] 84%|████████▍ | 42/50 [00:39<00:06,  1.24it/s] 86%|████████▌ | 43/50 [00:40<00:05,  1.24it/s] 88%|████████▊ | 44/50 [00:41<00:04,  1.24it/s] 90%|█████████ | 45/50 [00:42<00:04,  1.24it/s] 92%|█████████▏| 46/50 [00:42<00:03,  1.24it/s] 94%|█████████▍| 47/50 [00:43<00:02,  1.24it/s] 96%|█████████▌| 48/50 [00:44<00:01,  1.24it/s] 98%|█████████▊| 49/50 [00:45<00:00,  1.24it/s]100%|██████████| 50/50 [00:53<00:00,  2.85s/it]100%|██████████| 50/50 [00:53<00:00,  1.06s/it]
[I 2023-12-10 22:48:25,821] Trial 178 finished with value: 0.27628865979381445 and parameters: {'EMBEDDING_DIM': 1009, 'HIDDEN_DIM': 421, 'NUM_LAYERS': 4, 'DROPOUT': 0.3350996076112649, 'LR': 0.0026678311649651386, 'WEIGHT_0': 0.404176102312859, 'WEIGHT_1': 0.513933546385508, 'WEIGHT_2': 0.5045398097249639, 'WEIGHT_3': 0.795511256012269, 'WEIGHT_4': 0.6157910728334822, 'WEIGHT_5': 0.58215335297843, 'WEIGHT_6': 0.7316498423319524, 'WEIGHT_7': 0.3066057896312603, 'WEIGHT_8': 0.6200135573441958, 'optimizer': 'RMSprop'}. Best is trial 134 with value: 0.4158467115484205.
/userhome/cs2/dingruiw/conda/envs/py310/lib/python3.10/site-packages/torch/nn/modules/rnn.py:82: UserWarning: dropout option adds dropout after all but last recurrent layer, so non-zero dropout expects num_layers greater than 1, but got dropout=0.2943624654553337 and num_layers=1
  warnings.warn("dropout option adds dropout after all but last "
{'EMBEDDING_DIM': 1009, 'HIDDEN_DIM': 421, 'NUM_LAYERS': 4, 'DROPOUT': 0.3350996076112649, 'LR': 0.0026678311649651386, 'WEIGHT_0': 0.404176102312859, 'WEIGHT_1': 0.513933546385508, 'WEIGHT_2': 0.5045398097249639, 'WEIGHT_3': 0.795511256012269, 'WEIGHT_4': 0.6157910728334822, 'WEIGHT_5': 0.58215335297843, 'WEIGHT_6': 0.7316498423319524, 'WEIGHT_7': 0.3066057896312603, 'WEIGHT_8': 0.6200135573441958, 'optimizer': 'RMSprop'}
0
              precision    recall  f1-score   support

         LOC       0.24      0.00      0.01      1837
        MISC       0.04      0.01      0.01       922
         ORG       0.00      0.00      0.00      1341
         PER       0.00      0.00      0.00      1842

   micro avg       0.06      0.00      0.00      5942
   macro avg       0.07      0.00      0.01      5942
weighted avg       0.08      0.00      0.00      5942

{'EMBEDDING_DIM': 1009, 'HIDDEN_DIM': 421, 'NUM_LAYERS': 4, 'DROPOUT': 0.3350996076112649, 'LR': 0.0026678311649651386, 'WEIGHT_0': 0.404176102312859, 'WEIGHT_1': 0.513933546385508, 'WEIGHT_2': 0.5045398097249639, 'WEIGHT_3': 0.795511256012269, 'WEIGHT_4': 0.6157910728334822, 'WEIGHT_5': 0.58215335297843, 'WEIGHT_6': 0.7316498423319524, 'WEIGHT_7': 0.3066057896312603, 'WEIGHT_8': 0.6200135573441958, 'optimizer': 'RMSprop'}
49
              precision    recall  f1-score   support

         LOC       0.45      0.36      0.40      1837
        MISC       0.17      0.30      0.21       922
         ORG       0.21      0.18      0.20      1341
         PER       0.30      0.24      0.26      1842

   micro avg       0.28      0.27      0.28      5942
   macro avg       0.28      0.27      0.27      5942
weighted avg       0.31      0.27      0.28      5942

epoch 49
LSTM
  0%|          | 0/50 [00:00<?, ?it/s]  2%|▏         | 1/50 [00:04<03:49,  4.69s/it]  4%|▍         | 2/50 [00:04<01:35,  2.00s/it]  6%|▌         | 3/50 [00:05<00:55,  1.18s/it]  8%|▊         | 4/50 [00:05<00:36,  1.27it/s] 10%|█         | 5/50 [00:05<00:25,  1.75it/s] 12%|█▏        | 6/50 [00:05<00:19,  2.26it/s] 14%|█▍        | 7/50 [00:05<00:15,  2.78it/s] 16%|█▌        | 8/50 [00:05<00:12,  3.28it/s] 18%|█▊        | 9/50 [00:06<00:11,  3.71it/s] 20%|██        | 10/50 [00:06<00:09,  4.08it/s] 22%|██▏       | 11/50 [00:06<00:08,  4.39it/s] 24%|██▍       | 12/50 [00:06<00:08,  4.62it/s] 26%|██▌       | 13/50 [00:06<00:07,  4.79it/s] 28%|██▊       | 14/50 [00:07<00:07,  4.92it/s] 30%|███       | 15/50 [00:07<00:06,  5.01it/s] 32%|███▏      | 16/50 [00:07<00:06,  5.09it/s] 34%|███▍      | 17/50 [00:07<00:06,  5.13it/s] 36%|███▌      | 18/50 [00:07<00:06,  5.17it/s] 38%|███▊      | 19/50 [00:08<00:05,  5.19it/s] 40%|████      | 20/50 [00:08<00:05,  5.21it/s] 42%|████▏     | 21/50 [00:08<00:05,  5.23it/s] 44%|████▍     | 22/50 [00:08<00:05,  5.23it/s] 46%|████▌     | 23/50 [00:08<00:05,  5.24it/s] 48%|████▊     | 24/50 [00:08<00:04,  5.25it/s] 50%|█████     | 25/50 [00:09<00:04,  5.24it/s] 52%|█████▏    | 26/50 [00:09<00:04,  5.26it/s] 54%|█████▍    | 27/50 [00:09<00:04,  5.24it/s] 56%|█████▌    | 28/50 [00:09<00:04,  5.25it/s] 58%|█████▊    | 29/50 [00:09<00:03,  5.25it/s] 60%|██████    | 30/50 [00:10<00:03,  5.23it/s] 62%|██████▏   | 31/50 [00:10<00:03,  5.24it/s] 64%|██████▍   | 32/50 [00:10<00:03,  5.24it/s] 66%|██████▌   | 33/50 [00:10<00:03,  5.24it/s] 68%|██████▊   | 34/50 [00:10<00:03,  5.24it/s] 70%|███████   | 35/50 [00:11<00:02,  5.24it/s] 72%|███████▏  | 36/50 [00:11<00:02,  5.24it/s] 74%|███████▍  | 37/50 [00:11<00:02,  5.24it/s] 76%|███████▌  | 38/50 [00:11<00:02,  5.24it/s] 78%|███████▊  | 39/50 [00:11<00:02,  5.24it/s] 80%|████████  | 40/50 [00:12<00:01,  5.23it/s] 82%|████████▏ | 41/50 [00:12<00:01,  5.24it/s] 84%|████████▍ | 42/50 [00:12<00:01,  5.23it/s] 86%|████████▌ | 43/50 [00:12<00:01,  5.24it/s] 88%|████████▊ | 44/50 [00:12<00:01,  5.24it/s] 90%|█████████ | 45/50 [00:13<00:00,  5.23it/s] 92%|█████████▏| 46/50 [00:13<00:00,  5.24it/s] 94%|█████████▍| 47/50 [00:13<00:00,  5.24it/s] 96%|█████████▌| 48/50 [00:13<00:00,  5.24it/s] 98%|█████████▊| 49/50 [00:13<00:00,  5.24it/s]100%|██████████| 50/50 [00:18<00:00,  1.60s/it]100%|██████████| 50/50 [00:18<00:00,  2.68it/s]
[I 2023-12-10 22:48:48,660] Trial 179 finished with value: 0.396016976820111 and parameters: {'EMBEDDING_DIM': 708, 'HIDDEN_DIM': 319, 'NUM_LAYERS': 1, 'DROPOUT': 0.2943624654553337, 'LR': 0.0021055800464877625, 'WEIGHT_0': 0.4147101045302815, 'WEIGHT_1': 0.7563727523993014, 'WEIGHT_2': 0.586216776235958, 'WEIGHT_3': 0.7591938898107526, 'WEIGHT_4': 0.8843175828666693, 'WEIGHT_5': 0.690374796780236, 'WEIGHT_6': 0.6200224449594455, 'WEIGHT_7': 0.25943010579867953, 'WEIGHT_8': 0.5028522752816651, 'optimizer': 'RMSprop'}. Best is trial 134 with value: 0.4158467115484205.
/userhome/cs2/dingruiw/conda/envs/py310/lib/python3.10/site-packages/torch/nn/modules/rnn.py:82: UserWarning: dropout option adds dropout after all but last recurrent layer, so non-zero dropout expects num_layers greater than 1, but got dropout=0.40020369769891584 and num_layers=1
  warnings.warn("dropout option adds dropout after all but last "
{'EMBEDDING_DIM': 708, 'HIDDEN_DIM': 319, 'NUM_LAYERS': 1, 'DROPOUT': 0.2943624654553337, 'LR': 0.0021055800464877625, 'WEIGHT_0': 0.4147101045302815, 'WEIGHT_1': 0.7563727523993014, 'WEIGHT_2': 0.586216776235958, 'WEIGHT_3': 0.7591938898107526, 'WEIGHT_4': 0.8843175828666693, 'WEIGHT_5': 0.690374796780236, 'WEIGHT_6': 0.6200224449594455, 'WEIGHT_7': 0.25943010579867953, 'WEIGHT_8': 0.5028522752816651, 'optimizer': 'RMSprop'}
0
              precision    recall  f1-score   support

         LOC       0.28      0.07      0.11      1837
        MISC       0.04      0.01      0.02       922
         ORG       0.13      0.05      0.07      1341
         PER       0.06      0.01      0.01      1842

   micro avg       0.15      0.03      0.06      5942
   macro avg       0.13      0.03      0.05      5942
weighted avg       0.14      0.03      0.05      5942

{'EMBEDDING_DIM': 708, 'HIDDEN_DIM': 319, 'NUM_LAYERS': 1, 'DROPOUT': 0.2943624654553337, 'LR': 0.0021055800464877625, 'WEIGHT_0': 0.4147101045302815, 'WEIGHT_1': 0.7563727523993014, 'WEIGHT_2': 0.586216776235958, 'WEIGHT_3': 0.7591938898107526, 'WEIGHT_4': 0.8843175828666693, 'WEIGHT_5': 0.690374796780236, 'WEIGHT_6': 0.6200224449594455, 'WEIGHT_7': 0.25943010579867953, 'WEIGHT_8': 0.5028522752816651, 'optimizer': 'RMSprop'}
49
              precision    recall  f1-score   support

         LOC       0.52      0.53      0.53      1837
        MISC       0.38      0.43      0.40       922
         ORG       0.29      0.28      0.28      1341
         PER       0.32      0.37      0.35      1842

   micro avg       0.38      0.41      0.40      5942
   macro avg       0.38      0.40      0.39      5942
weighted avg       0.39      0.41      0.40      5942

epoch 49
LSTM
  0%|          | 0/50 [00:00<?, ?it/s]  2%|▏         | 1/50 [00:11<09:33, 11.71s/it]  4%|▍         | 2/50 [00:12<04:22,  5.46s/it]  6%|▌         | 3/50 [00:15<03:10,  4.05s/it]  8%|▊         | 4/50 [00:17<02:35,  3.37s/it] 10%|█         | 5/50 [00:19<02:15,  3.00s/it] 12%|█▏        | 6/50 [00:22<02:02,  2.78s/it] 14%|█▍        | 7/50 [00:24<01:53,  2.65s/it] 16%|█▌        | 8/50 [00:26<01:47,  2.56s/it] 18%|█▊        | 9/50 [00:29<01:42,  2.50s/it] 20%|██        | 10/50 [00:31<01:38,  2.45s/it] 22%|██▏       | 11/50 [00:34<01:34,  2.43s/it] 24%|██▍       | 12/50 [00:36<01:31,  2.41s/it] 26%|██▌       | 13/50 [00:38<01:29,  2.41s/it] 28%|██▊       | 14/50 [00:41<01:26,  2.40s/it] 30%|███       | 15/50 [00:43<01:23,  2.39s/it] 32%|███▏      | 16/50 [00:45<01:21,  2.40s/it] 34%|███▍      | 17/50 [00:48<01:19,  2.41s/it] 36%|███▌      | 18/50 [00:50<01:17,  2.41s/it] 38%|███▊      | 19/50 [00:53<01:14,  2.41s/it] 40%|████      | 20/50 [00:55<01:12,  2.42s/it] 42%|████▏     | 21/50 [00:58<01:10,  2.42s/it] 44%|████▍     | 22/50 [01:00<01:07,  2.42s/it] 46%|████▌     | 23/50 [01:02<01:05,  2.42s/it] 48%|████▊     | 24/50 [01:05<01:02,  2.42s/it] 50%|█████     | 25/50 [01:07<01:00,  2.42s/it] 52%|█████▏    | 26/50 [01:10<00:58,  2.42s/it] 54%|█████▍    | 27/50 [01:12<00:55,  2.42s/it] 56%|█████▌    | 28/50 [01:15<00:53,  2.42s/it] 58%|█████▊    | 29/50 [01:17<00:50,  2.43s/it] 60%|██████    | 30/50 [01:19<00:48,  2.42s/it] 62%|██████▏   | 31/50 [01:22<00:45,  2.42s/it] 64%|██████▍   | 32/50 [01:24<00:43,  2.43s/it] 66%|██████▌   | 33/50 [01:27<00:41,  2.43s/it] 68%|██████▊   | 34/50 [01:29<00:38,  2.43s/it] 70%|███████   | 35/50 [01:32<00:36,  2.43s/it] 72%|███████▏  | 36/50 [01:34<00:34,  2.44s/it] 74%|███████▍  | 37/50 [01:36<00:31,  2.43s/it] 76%|███████▌  | 38/50 [01:39<00:29,  2.43s/it] 78%|███████▊  | 39/50 [01:41<00:26,  2.43s/it] 80%|████████  | 40/50 [01:44<00:24,  2.43s/it] 82%|████████▏ | 41/50 [01:46<00:21,  2.43s/it] 84%|████████▍ | 42/50 [01:49<00:19,  2.43s/it] 86%|████████▌ | 43/50 [01:51<00:17,  2.43s/it] 88%|████████▊ | 44/50 [01:53<00:14,  2.42s/it] 90%|█████████ | 45/50 [01:56<00:12,  2.44s/it] 92%|█████████▏| 46/50 [01:58<00:09,  2.44s/it] 94%|█████████▍| 47/50 [02:01<00:07,  2.43s/it] 96%|█████████▌| 48/50 [02:03<00:04,  2.44s/it] 98%|█████████▊| 49/50 [02:06<00:02,  2.43s/it]100%|██████████| 50/50 [02:19<00:00,  5.67s/it]100%|██████████| 50/50 [02:19<00:00,  2.79s/it]
[I 2023-12-10 22:51:17,352] Trial 180 finished with value: 0.2098429951690821 and parameters: {'EMBEDDING_DIM': 904, 'HIDDEN_DIM': 2013, 'NUM_LAYERS': 1, 'DROPOUT': 0.40020369769891584, 'LR': 0.0031794937833713533, 'WEIGHT_0': 0.34926613402182505, 'WEIGHT_1': 0.8164947044651062, 'WEIGHT_2': 0.6275107020632532, 'WEIGHT_3': 0.8675367181267603, 'WEIGHT_4': 0.49738910804680864, 'WEIGHT_5': 0.5311644118149137, 'WEIGHT_6': 0.7723962550398257, 'WEIGHT_7': 0.29498786667928045, 'WEIGHT_8': 0.5346281816183468, 'optimizer': 'RMSprop'}. Best is trial 134 with value: 0.4158467115484205.
/userhome/cs2/dingruiw/conda/envs/py310/lib/python3.10/site-packages/torch/nn/modules/rnn.py:82: UserWarning: dropout option adds dropout after all but last recurrent layer, so non-zero dropout expects num_layers greater than 1, but got dropout=0.3605095642325831 and num_layers=1
  warnings.warn("dropout option adds dropout after all but last "
{'EMBEDDING_DIM': 904, 'HIDDEN_DIM': 2013, 'NUM_LAYERS': 1, 'DROPOUT': 0.40020369769891584, 'LR': 0.0031794937833713533, 'WEIGHT_0': 0.34926613402182505, 'WEIGHT_1': 0.8164947044651062, 'WEIGHT_2': 0.6275107020632532, 'WEIGHT_3': 0.8675367181267603, 'WEIGHT_4': 0.49738910804680864, 'WEIGHT_5': 0.5311644118149137, 'WEIGHT_6': 0.7723962550398257, 'WEIGHT_7': 0.29498786667928045, 'WEIGHT_8': 0.5346281816183468, 'optimizer': 'RMSprop'}
0
              precision    recall  f1-score   support

         LOC       0.21      0.03      0.06      1837
        MISC       0.02      0.01      0.02       922
         ORG       0.00      0.00      0.00      1341
         PER       0.05      0.00      0.01      1842

   micro avg       0.08      0.01      0.02      5942
   macro avg       0.07      0.01      0.02      5942
weighted avg       0.08      0.01      0.02      5942

{'EMBEDDING_DIM': 904, 'HIDDEN_DIM': 2013, 'NUM_LAYERS': 1, 'DROPOUT': 0.40020369769891584, 'LR': 0.0031794937833713533, 'WEIGHT_0': 0.34926613402182505, 'WEIGHT_1': 0.8164947044651062, 'WEIGHT_2': 0.6275107020632532, 'WEIGHT_3': 0.8675367181267603, 'WEIGHT_4': 0.49738910804680864, 'WEIGHT_5': 0.5311644118149137, 'WEIGHT_6': 0.7723962550398257, 'WEIGHT_7': 0.29498786667928045, 'WEIGHT_8': 0.5346281816183468, 'optimizer': 'RMSprop'}
49
              precision    recall  f1-score   support

         LOC       0.33      0.38      0.35      1837
        MISC       0.11      0.24      0.15       922
         ORG       0.19      0.15      0.17      1341
         PER       0.13      0.15      0.14      1842

   micro avg       0.19      0.23      0.21      5942
   macro avg       0.19      0.23      0.20      5942
weighted avg       0.20      0.23      0.21      5942

epoch 49
LSTM
  0%|          | 0/50 [00:00<?, ?it/s]  2%|▏         | 1/50 [00:06<05:22,  6.57s/it]  4%|▍         | 2/50 [00:07<02:23,  2.99s/it]  6%|▌         | 3/50 [00:08<01:38,  2.09s/it]  8%|▊         | 4/50 [00:09<01:15,  1.65s/it] 10%|█         | 5/50 [00:10<01:03,  1.42s/it] 12%|█▏        | 6/50 [00:11<00:56,  1.27s/it] 14%|█▍        | 7/50 [00:12<00:51,  1.19s/it] 16%|█▌        | 8/50 [00:13<00:47,  1.13s/it] 18%|█▊        | 9/50 [00:14<00:44,  1.09s/it] 20%|██        | 10/50 [00:15<00:42,  1.06s/it] 22%|██▏       | 11/50 [00:16<00:40,  1.04s/it] 24%|██▍       | 12/50 [00:17<00:39,  1.03s/it] 26%|██▌       | 13/50 [00:18<00:37,  1.03s/it] 28%|██▊       | 14/50 [00:19<00:36,  1.02s/it] 30%|███       | 15/50 [00:20<00:35,  1.02s/it] 32%|███▏      | 16/50 [00:21<00:34,  1.01s/it] 34%|███▍      | 17/50 [00:22<00:33,  1.01s/it] 36%|███▌      | 18/50 [00:23<00:32,  1.02s/it] 38%|███▊      | 19/50 [00:24<00:31,  1.02s/it] 40%|████      | 20/50 [00:25<00:30,  1.01s/it] 42%|████▏     | 21/50 [00:26<00:29,  1.01s/it] 44%|████▍     | 22/50 [00:27<00:28,  1.01s/it] 46%|████▌     | 23/50 [00:28<00:27,  1.01s/it] 48%|████▊     | 24/50 [00:29<00:26,  1.02s/it] 50%|█████     | 25/50 [00:30<00:25,  1.02s/it] 52%|█████▏    | 26/50 [00:31<00:24,  1.02s/it] 54%|█████▍    | 27/50 [00:32<00:23,  1.02s/it] 56%|█████▌    | 28/50 [00:33<00:22,  1.02s/it] 58%|█████▊    | 29/50 [00:34<00:21,  1.03s/it] 60%|██████    | 30/50 [00:35<00:20,  1.02s/it] 62%|██████▏   | 31/50 [00:36<00:19,  1.02s/it] 64%|██████▍   | 32/50 [00:37<00:18,  1.02s/it] 66%|██████▌   | 33/50 [00:38<00:17,  1.02s/it] 68%|██████▊   | 34/50 [00:39<00:16,  1.03s/it] 70%|███████   | 35/50 [00:40<00:15,  1.02s/it] 72%|███████▏  | 36/50 [00:41<00:14,  1.02s/it] 74%|███████▍  | 37/50 [00:42<00:13,  1.02s/it] 76%|███████▌  | 38/50 [00:43<00:12,  1.03s/it] 78%|███████▊  | 39/50 [00:44<00:11,  1.02s/it] 80%|████████  | 40/50 [00:45<00:10,  1.03s/it] 82%|████████▏ | 41/50 [00:46<00:09,  1.03s/it] 84%|████████▍ | 42/50 [00:47<00:08,  1.03s/it] 86%|████████▌ | 43/50 [00:48<00:07,  1.03s/it] 88%|████████▊ | 44/50 [00:49<00:06,  1.03s/it] 90%|█████████ | 45/50 [00:50<00:05,  1.02s/it] 92%|█████████▏| 46/50 [00:51<00:04,  1.02s/it] 94%|█████████▍| 47/50 [00:52<00:03,  1.02s/it] 96%|█████████▌| 48/50 [00:53<00:02,  1.03s/it] 98%|█████████▊| 49/50 [00:54<00:01,  1.03s/it]100%|██████████| 50/50 [01:02<00:00,  2.87s/it]100%|██████████| 50/50 [01:02<00:00,  1.24s/it]
