[I 2023-12-10 23:37:07,588] Trial 277 finished with value: 0.40657571392254893 and parameters: {'EMBEDDING_DIM': 878, 'HIDDEN_DIM': 217, 'NUM_LAYERS': 1, 'DROPOUT': 0.06338143822841574, 'LR': 0.002678355076265903, 'WEIGHT_0': 0.4079096466312511, 'WEIGHT_1': 0.8126531099570932, 'WEIGHT_2': 0.6501834345602024, 'WEIGHT_3': 0.6191279089073357, 'WEIGHT_4': 0.8239688720414904, 'WEIGHT_5': 0.6101820807167824, 'WEIGHT_6': 0.8055750351999351, 'WEIGHT_7': 0.5375420581822333, 'WEIGHT_8': 0.5973813837873647, 'optimizer': 'RMSprop'}. Best is trial 221 with value: 0.418736930154747.
/userhome/cs2/dingruiw/conda/envs/py310/lib/python3.10/site-packages/torch/nn/modules/rnn.py:82: UserWarning: dropout option adds dropout after all but last recurrent layer, so non-zero dropout expects num_layers greater than 1, but got dropout=0.34391126583090426 and num_layers=1
  warnings.warn("dropout option adds dropout after all but last "
{'EMBEDDING_DIM': 878, 'HIDDEN_DIM': 217, 'NUM_LAYERS': 1, 'DROPOUT': 0.06338143822841574, 'LR': 0.002678355076265903, 'WEIGHT_0': 0.4079096466312511, 'WEIGHT_1': 0.8126531099570932, 'WEIGHT_2': 0.6501834345602024, 'WEIGHT_3': 0.6191279089073357, 'WEIGHT_4': 0.8239688720414904, 'WEIGHT_5': 0.6101820807167824, 'WEIGHT_6': 0.8055750351999351, 'WEIGHT_7': 0.5375420581822333, 'WEIGHT_8': 0.5973813837873647, 'optimizer': 'RMSprop'}
0
              precision    recall  f1-score   support

         LOC       0.38      0.09      0.15      1837
        MISC       0.08      0.03      0.04       922
         ORG       0.20      0.04      0.07      1341
         PER       0.08      0.01      0.02      1842

   micro avg       0.21      0.04      0.07      5942
   macro avg       0.19      0.04      0.07      5942
weighted avg       0.20      0.04      0.07      5942

{'EMBEDDING_DIM': 878, 'HIDDEN_DIM': 217, 'NUM_LAYERS': 1, 'DROPOUT': 0.06338143822841574, 'LR': 0.002678355076265903, 'WEIGHT_0': 0.4079096466312511, 'WEIGHT_1': 0.8126531099570932, 'WEIGHT_2': 0.6501834345602024, 'WEIGHT_3': 0.6191279089073357, 'WEIGHT_4': 0.8239688720414904, 'WEIGHT_5': 0.6101820807167824, 'WEIGHT_6': 0.8055750351999351, 'WEIGHT_7': 0.5375420581822333, 'WEIGHT_8': 0.5973813837873647, 'optimizer': 'RMSprop'}
49
              precision    recall  f1-score   support

         LOC       0.57      0.54      0.55      1837
        MISC       0.43      0.46      0.44       922
         ORG       0.29      0.29      0.29      1341
         PER       0.33      0.32      0.33      1842

   micro avg       0.41      0.40      0.41      5942
   macro avg       0.41      0.40      0.40      5942
weighted avg       0.41      0.40      0.41      5942

epoch 49
LSTM
  0%|          | 0/50 [00:00<?, ?it/s]  2%|▏         | 1/50 [00:04<03:49,  4.68s/it]  6%|▌         | 3/50 [00:04<00:59,  1.27s/it]  8%|▊         | 4/50 [00:04<00:40,  1.15it/s] 12%|█▏        | 6/50 [00:05<00:21,  2.06it/s] 16%|█▌        | 8/50 [00:05<00:13,  3.10it/s] 20%|██        | 10/50 [00:05<00:09,  4.22it/s] 24%|██▍       | 12/50 [00:05<00:07,  5.33it/s] 28%|██▊       | 14/50 [00:05<00:05,  6.39it/s] 32%|███▏      | 16/50 [00:06<00:04,  7.31it/s] 36%|███▌      | 18/50 [00:06<00:03,  8.10it/s] 40%|████      | 20/50 [00:06<00:03,  8.74it/s] 44%|████▍     | 22/50 [00:06<00:03,  9.23it/s] 48%|████▊     | 24/50 [00:06<00:02,  9.62it/s] 52%|█████▏    | 26/50 [00:07<00:02,  9.88it/s] 56%|█████▌    | 28/50 [00:07<00:02, 10.09it/s] 60%|██████    | 30/50 [00:07<00:01, 10.24it/s] 64%|██████▍   | 32/50 [00:07<00:01, 10.35it/s] 68%|██████▊   | 34/50 [00:07<00:01, 10.43it/s] 72%|███████▏  | 36/50 [00:07<00:01, 10.48it/s] 76%|███████▌  | 38/50 [00:08<00:01, 10.51it/s] 80%|████████  | 40/50 [00:08<00:00, 10.55it/s] 84%|████████▍ | 42/50 [00:08<00:00, 10.56it/s] 88%|████████▊ | 44/50 [00:08<00:00, 10.58it/s] 92%|█████████▏| 46/50 [00:08<00:00, 10.59it/s] 96%|█████████▌| 48/50 [00:09<00:00, 10.58it/s]100%|██████████| 50/50 [00:13<00:00,  1.25it/s]100%|██████████| 50/50 [00:13<00:00,  3.58it/s]
[I 2023-12-10 23:37:25,596] Trial 278 finished with value: 0.30306345733041573 and parameters: {'EMBEDDING_DIM': 174, 'HIDDEN_DIM': 268, 'NUM_LAYERS': 1, 'DROPOUT': 0.34391126583090426, 'LR': 0.0097992885298613, 'WEIGHT_0': 0.4322649654119909, 'WEIGHT_1': 0.6868690865563033, 'WEIGHT_2': 0.6996921251694554, 'WEIGHT_3': 0.49360867797188734, 'WEIGHT_4': 0.6958941112486546, 'WEIGHT_5': 0.5157035989062334, 'WEIGHT_6': 0.762640546863558, 'WEIGHT_7': 0.4905345421008144, 'WEIGHT_8': 0.5721732122077713, 'optimizer': 'RMSprop'}. Best is trial 221 with value: 0.418736930154747.
/userhome/cs2/dingruiw/conda/envs/py310/lib/python3.10/site-packages/torch/nn/modules/rnn.py:82: UserWarning: dropout option adds dropout after all but last recurrent layer, so non-zero dropout expects num_layers greater than 1, but got dropout=0.35284920473712106 and num_layers=1
  warnings.warn("dropout option adds dropout after all but last "
{'EMBEDDING_DIM': 174, 'HIDDEN_DIM': 268, 'NUM_LAYERS': 1, 'DROPOUT': 0.34391126583090426, 'LR': 0.0097992885298613, 'WEIGHT_0': 0.4322649654119909, 'WEIGHT_1': 0.6868690865563033, 'WEIGHT_2': 0.6996921251694554, 'WEIGHT_3': 0.49360867797188734, 'WEIGHT_4': 0.6958941112486546, 'WEIGHT_5': 0.5157035989062334, 'WEIGHT_6': 0.762640546863558, 'WEIGHT_7': 0.4905345421008144, 'WEIGHT_8': 0.5721732122077713, 'optimizer': 'RMSprop'}
0
              precision    recall  f1-score   support

         LOC       0.05      0.02      0.03      1837
        MISC       0.01      0.00      0.00       922
         ORG       0.15      0.01      0.03      1341
         PER       0.03      0.01      0.02      1842

   micro avg       0.05      0.01      0.02      5942
   macro avg       0.06      0.01      0.02      5942
weighted avg       0.06      0.01      0.02      5942

{'EMBEDDING_DIM': 174, 'HIDDEN_DIM': 268, 'NUM_LAYERS': 1, 'DROPOUT': 0.34391126583090426, 'LR': 0.0097992885298613, 'WEIGHT_0': 0.4322649654119909, 'WEIGHT_1': 0.6868690865563033, 'WEIGHT_2': 0.6996921251694554, 'WEIGHT_3': 0.49360867797188734, 'WEIGHT_4': 0.6958941112486546, 'WEIGHT_5': 0.5157035989062334, 'WEIGHT_6': 0.762640546863558, 'WEIGHT_7': 0.4905345421008144, 'WEIGHT_8': 0.5721732122077713, 'optimizer': 'RMSprop'}
49
              precision    recall  f1-score   support

         LOC       0.43      0.48      0.45      1837
        MISC       0.25      0.37      0.30       922
         ORG       0.24      0.23      0.24      1341
         PER       0.19      0.22      0.20      1842

   micro avg       0.28      0.33      0.30      5942
   macro avg       0.28      0.33      0.30      5942
weighted avg       0.28      0.33      0.30      5942

epoch 49
LSTM
  0%|          | 0/50 [00:00<?, ?it/s]  2%|▏         | 1/50 [00:04<03:49,  4.69s/it]  4%|▍         | 2/50 [00:04<01:36,  2.01s/it]  6%|▌         | 3/50 [00:05<00:56,  1.20s/it]  8%|▊         | 4/50 [00:05<00:37,  1.22it/s] 10%|█         | 5/50 [00:05<00:27,  1.64it/s] 12%|█▏        | 6/50 [00:05<00:21,  2.08it/s] 14%|█▍        | 7/50 [00:06<00:17,  2.50it/s] 16%|█▌        | 8/50 [00:06<00:14,  2.88it/s] 18%|█▊        | 9/50 [00:06<00:12,  3.21it/s] 20%|██        | 10/50 [00:06<00:11,  3.48it/s] 22%|██▏       | 11/50 [00:06<00:10,  3.69it/s] 24%|██▍       | 12/50 [00:07<00:09,  3.85it/s] 26%|██▌       | 13/50 [00:07<00:09,  3.97it/s] 28%|██▊       | 14/50 [00:07<00:08,  4.07it/s] 30%|███       | 15/50 [00:07<00:08,  4.13it/s] 32%|███▏      | 16/50 [00:08<00:08,  4.18it/s] 34%|███▍      | 17/50 [00:08<00:07,  4.21it/s] 36%|███▌      | 18/50 [00:08<00:07,  4.23it/s] 38%|███▊      | 19/50 [00:08<00:07,  4.25it/s] 40%|████      | 20/50 [00:09<00:07,  4.26it/s] 42%|████▏     | 21/50 [00:09<00:06,  4.26it/s] 44%|████▍     | 22/50 [00:09<00:06,  4.27it/s] 46%|████▌     | 23/50 [00:09<00:06,  4.27it/s] 48%|████▊     | 24/50 [00:09<00:06,  4.28it/s] 50%|█████     | 25/50 [00:10<00:05,  4.28it/s] 52%|█████▏    | 26/50 [00:10<00:05,  4.29it/s] 54%|█████▍    | 27/50 [00:10<00:05,  4.28it/s] 56%|█████▌    | 28/50 [00:10<00:05,  4.29it/s] 58%|█████▊    | 29/50 [00:11<00:04,  4.29it/s] 60%|██████    | 30/50 [00:11<00:04,  4.29it/s] 62%|██████▏   | 31/50 [00:11<00:04,  4.29it/s] 64%|██████▍   | 32/50 [00:11<00:04,  4.29it/s] 66%|██████▌   | 33/50 [00:12<00:03,  4.27it/s] 68%|██████▊   | 34/50 [00:12<00:03,  4.29it/s] 70%|███████   | 35/50 [00:12<00:03,  4.28it/s] 72%|███████▏  | 36/50 [00:12<00:03,  4.29it/s] 74%|███████▍  | 37/50 [00:13<00:03,  4.28it/s] 76%|███████▌  | 38/50 [00:13<00:02,  4.28it/s] 78%|███████▊  | 39/50 [00:13<00:02,  4.28it/s] 80%|████████  | 40/50 [00:13<00:02,  4.28it/s] 82%|████████▏ | 41/50 [00:13<00:02,  4.28it/s] 84%|████████▍ | 42/50 [00:14<00:01,  4.28it/s] 86%|████████▌ | 43/50 [00:14<00:01,  4.28it/s] 88%|████████▊ | 44/50 [00:14<00:01,  4.28it/s] 90%|█████████ | 45/50 [00:14<00:01,  4.28it/s] 92%|█████████▏| 46/50 [00:15<00:00,  4.28it/s] 94%|█████████▍| 47/50 [00:15<00:00,  4.27it/s] 96%|█████████▌| 48/50 [00:15<00:00,  4.27it/s] 98%|█████████▊| 49/50 [00:15<00:00,  4.27it/s]100%|██████████| 50/50 [00:20<00:00,  1.61s/it]100%|██████████| 50/50 [00:20<00:00,  2.42it/s]
[I 2023-12-10 23:37:50,460] Trial 279 finished with value: 0.3870417732310315 and parameters: {'EMBEDDING_DIM': 909, 'HIDDEN_DIM': 361, 'NUM_LAYERS': 1, 'DROPOUT': 0.35284920473712106, 'LR': 0.003235777283424842, 'WEIGHT_0': 0.38372747369605115, 'WEIGHT_1': 0.6596921893299837, 'WEIGHT_2': 0.6206858499908375, 'WEIGHT_3': 0.9989797664181632, 'WEIGHT_4': 0.6733447020924876, 'WEIGHT_5': 0.6285132708603518, 'WEIGHT_6': 0.6401670880540565, 'WEIGHT_7': 0.5670733024388646, 'WEIGHT_8': 0.5148228898299394, 'optimizer': 'RMSprop'}. Best is trial 221 with value: 0.418736930154747.
/userhome/cs2/dingruiw/conda/envs/py310/lib/python3.10/site-packages/torch/nn/modules/rnn.py:82: UserWarning: dropout option adds dropout after all but last recurrent layer, so non-zero dropout expects num_layers greater than 1, but got dropout=0.31870269275394975 and num_layers=1
  warnings.warn("dropout option adds dropout after all but last "
{'EMBEDDING_DIM': 909, 'HIDDEN_DIM': 361, 'NUM_LAYERS': 1, 'DROPOUT': 0.35284920473712106, 'LR': 0.003235777283424842, 'WEIGHT_0': 0.38372747369605115, 'WEIGHT_1': 0.6596921893299837, 'WEIGHT_2': 0.6206858499908375, 'WEIGHT_3': 0.9989797664181632, 'WEIGHT_4': 0.6733447020924876, 'WEIGHT_5': 0.6285132708603518, 'WEIGHT_6': 0.6401670880540565, 'WEIGHT_7': 0.5670733024388646, 'WEIGHT_8': 0.5148228898299394, 'optimizer': 'RMSprop'}
0
              precision    recall  f1-score   support

         LOC       0.28      0.07      0.11      1837
        MISC       0.05      0.02      0.02       922
         ORG       0.04      0.00      0.01      1341
         PER       0.05      0.02      0.03      1842

   micro avg       0.11      0.03      0.05      5942
   macro avg       0.10      0.03      0.04      5942
weighted avg       0.12      0.03      0.05      5942

{'EMBEDDING_DIM': 909, 'HIDDEN_DIM': 361, 'NUM_LAYERS': 1, 'DROPOUT': 0.35284920473712106, 'LR': 0.003235777283424842, 'WEIGHT_0': 0.38372747369605115, 'WEIGHT_1': 0.6596921893299837, 'WEIGHT_2': 0.6206858499908375, 'WEIGHT_3': 0.9989797664181632, 'WEIGHT_4': 0.6733447020924876, 'WEIGHT_5': 0.6285132708603518, 'WEIGHT_6': 0.6401670880540565, 'WEIGHT_7': 0.5670733024388646, 'WEIGHT_8': 0.5148228898299394, 'optimizer': 'RMSprop'}
49
              precision    recall  f1-score   support

         LOC       0.54      0.52      0.53      1837
        MISC       0.42      0.41      0.42       922
         ORG       0.26      0.23      0.25      1341
         PER       0.33      0.34      0.33      1842

   micro avg       0.39      0.38      0.39      5942
   macro avg       0.39      0.38      0.38      5942
weighted avg       0.39      0.38      0.39      5942

epoch 49
LSTM
  0%|          | 0/50 [00:00<?, ?it/s]  2%|▏         | 1/50 [00:04<03:22,  4.13s/it]  4%|▍         | 2/50 [00:04<01:25,  1.78s/it]  6%|▌         | 3/50 [00:04<00:50,  1.08s/it]  8%|▊         | 4/50 [00:04<00:34,  1.34it/s] 10%|█         | 5/50 [00:04<00:25,  1.79it/s] 12%|█▏        | 6/50 [00:05<00:19,  2.23it/s] 14%|█▍        | 7/50 [00:05<00:16,  2.65it/s] 16%|█▌        | 8/50 [00:05<00:13,  3.01it/s] 18%|█▊        | 9/50 [00:05<00:12,  3.32it/s] 20%|██        | 10/50 [00:06<00:11,  3.57it/s] 22%|██▏       | 11/50 [00:06<00:10,  3.76it/s] 24%|██▍       | 12/50 [00:06<00:09,  3.91it/s] 26%|██▌       | 13/50 [00:06<00:09,  4.02it/s] 28%|██▊       | 14/50 [00:07<00:08,  4.10it/s] 30%|███       | 15/50 [00:07<00:08,  4.16it/s] 32%|███▏      | 16/50 [00:07<00:08,  4.20it/s] 34%|███▍      | 17/50 [00:07<00:07,  4.22it/s] 36%|███▌      | 18/50 [00:08<00:07,  4.25it/s] 38%|███▊      | 19/50 [00:08<00:07,  4.26it/s] 40%|████      | 20/50 [00:08<00:07,  4.27it/s] 42%|████▏     | 21/50 [00:08<00:06,  4.27it/s] 44%|████▍     | 22/50 [00:08<00:06,  4.28it/s] 46%|████▌     | 23/50 [00:09<00:06,  4.28it/s] 48%|████▊     | 24/50 [00:09<00:06,  4.29it/s] 50%|█████     | 25/50 [00:09<00:05,  4.29it/s] 52%|█████▏    | 26/50 [00:09<00:05,  4.29it/s] 54%|█████▍    | 27/50 [00:10<00:05,  4.29it/s] 56%|█████▌    | 28/50 [00:10<00:05,  4.29it/s] 58%|█████▊    | 29/50 [00:10<00:04,  4.29it/s] 60%|██████    | 30/50 [00:10<00:04,  4.29it/s] 62%|██████▏   | 31/50 [00:11<00:04,  4.29it/s] 64%|██████▍   | 32/50 [00:11<00:04,  4.29it/s] 66%|██████▌   | 33/50 [00:11<00:03,  4.29it/s] 68%|██████▊   | 34/50 [00:11<00:03,  4.29it/s] 70%|███████   | 35/50 [00:11<00:03,  4.29it/s] 72%|███████▏  | 36/50 [00:12<00:03,  4.29it/s] 74%|███████▍  | 37/50 [00:12<00:03,  4.29it/s] 76%|███████▌  | 38/50 [00:12<00:02,  4.29it/s] 78%|███████▊  | 39/50 [00:12<00:02,  4.29it/s] 80%|████████  | 40/50 [00:13<00:02,  4.29it/s] 82%|████████▏ | 41/50 [00:13<00:02,  4.29it/s] 84%|████████▍ | 42/50 [00:13<00:01,  4.29it/s] 86%|████████▌ | 43/50 [00:13<00:01,  4.29it/s] 88%|████████▊ | 44/50 [00:14<00:01,  4.29it/s] 90%|█████████ | 45/50 [00:14<00:01,  4.29it/s] 92%|█████████▏| 46/50 [00:14<00:00,  4.29it/s] 94%|█████████▍| 47/50 [00:14<00:00,  4.29it/s] 96%|█████████▌| 48/50 [00:14<00:00,  4.29it/s] 98%|█████████▊| 49/50 [00:15<00:00,  4.29it/s]100%|██████████| 50/50 [00:19<00:00,  1.47s/it]100%|██████████| 50/50 [00:19<00:00,  2.55it/s]
[I 2023-12-10 23:38:13,791] Trial 280 finished with value: 0.39544495993251794 and parameters: {'EMBEDDING_DIM': 989, 'HIDDEN_DIM': 166, 'NUM_LAYERS': 1, 'DROPOUT': 0.31870269275394975, 'LR': 0.0023416786604024313, 'WEIGHT_0': 0.535834830984274, 'WEIGHT_1': 0.44061800518048877, 'WEIGHT_2': 0.6087564311613515, 'WEIGHT_3': 0.6788328364749199, 'WEIGHT_4': 0.8894487154437222, 'WEIGHT_5': 0.5439241392486378, 'WEIGHT_6': 0.9998322164324878, 'WEIGHT_7': 0.3021942607961109, 'WEIGHT_8': 0.614592978593726, 'optimizer': 'RMSprop'}. Best is trial 221 with value: 0.418736930154747.
/userhome/cs2/dingruiw/conda/envs/py310/lib/python3.10/site-packages/torch/nn/modules/rnn.py:82: UserWarning: dropout option adds dropout after all but last recurrent layer, so non-zero dropout expects num_layers greater than 1, but got dropout=0.35971537579201435 and num_layers=1
  warnings.warn("dropout option adds dropout after all but last "
{'EMBEDDING_DIM': 989, 'HIDDEN_DIM': 166, 'NUM_LAYERS': 1, 'DROPOUT': 0.31870269275394975, 'LR': 0.0023416786604024313, 'WEIGHT_0': 0.535834830984274, 'WEIGHT_1': 0.44061800518048877, 'WEIGHT_2': 0.6087564311613515, 'WEIGHT_3': 0.6788328364749199, 'WEIGHT_4': 0.8894487154437222, 'WEIGHT_5': 0.5439241392486378, 'WEIGHT_6': 0.9998322164324878, 'WEIGHT_7': 0.3021942607961109, 'WEIGHT_8': 0.614592978593726, 'optimizer': 'RMSprop'}
0
              precision    recall  f1-score   support

         LOC       0.24      0.06      0.09      1837
        MISC       0.05      0.03      0.04       922
         ORG       0.10      0.02      0.03      1341
         PER       0.11      0.04      0.06      1842

   micro avg       0.12      0.04      0.06      5942
   macro avg       0.13      0.04      0.06      5942
weighted avg       0.14      0.04      0.06      5942

{'EMBEDDING_DIM': 989, 'HIDDEN_DIM': 166, 'NUM_LAYERS': 1, 'DROPOUT': 0.31870269275394975, 'LR': 0.0023416786604024313, 'WEIGHT_0': 0.535834830984274, 'WEIGHT_1': 0.44061800518048877, 'WEIGHT_2': 0.6087564311613515, 'WEIGHT_3': 0.6788328364749199, 'WEIGHT_4': 0.8894487154437222, 'WEIGHT_5': 0.5439241392486378, 'WEIGHT_6': 0.9998322164324878, 'WEIGHT_7': 0.3021942607961109, 'WEIGHT_8': 0.614592978593726, 'optimizer': 'RMSprop'}
49
              precision    recall  f1-score   support

         LOC       0.57      0.53      0.55      1837
        MISC       0.41      0.45      0.43       922
         ORG       0.28      0.26      0.27      1341
         PER       0.31      0.34      0.32      1842

   micro avg       0.40      0.39      0.40      5942
   macro avg       0.39      0.39      0.39      5942
weighted avg       0.40      0.39      0.40      5942

epoch 49
LSTM
  0%|          | 0/50 [00:00<?, ?it/s]  2%|▏         | 1/50 [00:04<03:48,  4.66s/it]  6%|▌         | 3/50 [00:04<01:00,  1.29s/it]  8%|▊         | 4/50 [00:05<00:40,  1.13it/s] 10%|█         | 5/50 [00:05<00:28,  1.57it/s] 12%|█▏        | 6/50 [00:05<00:20,  2.10it/s] 14%|█▍        | 7/50 [00:05<00:15,  2.72it/s] 16%|█▌        | 8/50 [00:05<00:12,  3.39it/s] 18%|█▊        | 9/50 [00:05<00:10,  4.08it/s] 20%|██        | 10/50 [00:05<00:08,  4.74it/s] 22%|██▏       | 11/50 [00:05<00:07,  5.35it/s] 24%|██▍       | 12/50 [00:06<00:06,  5.86it/s] 26%|██▌       | 13/50 [00:06<00:05,  6.28it/s] 28%|██▊       | 14/50 [00:06<00:05,  6.61it/s] 30%|███       | 15/50 [00:06<00:05,  6.87it/s] 32%|███▏      | 16/50 [00:06<00:04,  7.06it/s] 34%|███▍      | 17/50 [00:06<00:04,  7.20it/s] 36%|███▌      | 18/50 [00:06<00:04,  7.30it/s] 38%|███▊      | 19/50 [00:06<00:04,  7.37it/s] 40%|████      | 20/50 [00:07<00:04,  7.41it/s] 42%|████▏     | 21/50 [00:07<00:03,  7.45it/s] 44%|████▍     | 22/50 [00:07<00:03,  7.47it/s] 46%|████▌     | 23/50 [00:07<00:03,  7.50it/s] 48%|████▊     | 24/50 [00:07<00:03,  7.50it/s] 50%|█████     | 25/50 [00:07<00:03,  7.51it/s] 52%|█████▏    | 26/50 [00:07<00:03,  7.52it/s] 54%|█████▍    | 27/50 [00:08<00:03,  7.53it/s] 56%|█████▌    | 28/50 [00:08<00:02,  7.53it/s] 58%|█████▊    | 29/50 [00:08<00:02,  7.52it/s] 60%|██████    | 30/50 [00:08<00:02,  7.54it/s] 62%|██████▏   | 31/50 [00:08<00:02,  7.53it/s] 64%|██████▍   | 32/50 [00:08<00:02,  7.53it/s] 66%|██████▌   | 33/50 [00:08<00:02,  7.53it/s] 68%|██████▊   | 34/50 [00:08<00:02,  7.54it/s] 70%|███████   | 35/50 [00:09<00:01,  7.53it/s] 72%|███████▏  | 36/50 [00:09<00:01,  7.53it/s] 74%|███████▍  | 37/50 [00:09<00:01,  7.53it/s] 76%|███████▌  | 38/50 [00:09<00:01,  7.54it/s] 78%|███████▊  | 39/50 [00:09<00:01,  7.54it/s] 80%|████████  | 40/50 [00:09<00:01,  7.53it/s] 82%|████████▏ | 41/50 [00:09<00:01,  7.53it/s] 84%|████████▍ | 42/50 [00:10<00:01,  7.53it/s] 86%|████████▌ | 43/50 [00:10<00:00,  7.54it/s] 88%|████████▊ | 44/50 [00:10<00:00,  7.53it/s] 90%|█████████ | 45/50 [00:10<00:00,  7.53it/s] 92%|█████████▏| 46/50 [00:10<00:00,  7.52it/s] 94%|█████████▍| 47/50 [00:10<00:00,  7.53it/s] 96%|█████████▌| 48/50 [00:10<00:00,  7.53it/s] 98%|█████████▊| 49/50 [00:10<00:00,  7.52it/s]100%|██████████| 50/50 [00:15<00:00,  1.52s/it]100%|██████████| 50/50 [00:15<00:00,  3.18it/s]
