[I 2023-12-10 21:46:41,001] Trial 57 finished with value: 0.0 and parameters: {'EMBEDDING_DIM': 840, 'HIDDEN_DIM': 172, 'NUM_LAYERS': 3, 'DROPOUT': 0.3542330753604128, 'LR': 0.00047292113786342386, 'WEIGHT_0': 0.28971619913406327, 'WEIGHT_1': 0.6183678654323276, 'WEIGHT_2': 0.49002118485964047, 'WEIGHT_3': 0.9107950203124379, 'WEIGHT_4': 0.8179777828376656, 'WEIGHT_5': 0.412542806538289, 'WEIGHT_6': 0.7450567157227914, 'WEIGHT_7': 0.4663332498003025, 'WEIGHT_8': 0.41161831721873976, 'optimizer': 'SGD'}. Best is trial 51 with value: 0.41438326562364947.
/userhome/cs2/dingruiw/conda/envs/py310/lib/python3.10/site-packages/torch/nn/modules/rnn.py:82: UserWarning: dropout option adds dropout after all but last recurrent layer, so non-zero dropout expects num_layers greater than 1, but got dropout=0.3923655099903965 and num_layers=1
  warnings.warn("dropout option adds dropout after all but last "
{'EMBEDDING_DIM': 840, 'HIDDEN_DIM': 172, 'NUM_LAYERS': 3, 'DROPOUT': 0.3542330753604128, 'LR': 0.00047292113786342386, 'WEIGHT_0': 0.28971619913406327, 'WEIGHT_1': 0.6183678654323276, 'WEIGHT_2': 0.49002118485964047, 'WEIGHT_3': 0.9107950203124379, 'WEIGHT_4': 0.8179777828376656, 'WEIGHT_5': 0.412542806538289, 'WEIGHT_6': 0.7450567157227914, 'WEIGHT_7': 0.4663332498003025, 'WEIGHT_8': 0.41161831721873976, 'optimizer': 'SGD'}
0
              precision    recall  f1-score   support

         LOC       0.00      0.00      0.00      1837
        MISC       0.01      0.00      0.00       922
         ORG       0.00      0.00      0.00      1341
         PER       0.01      0.01      0.01      1842

   micro avg       0.01      0.00      0.01      5942
   macro avg       0.01      0.00      0.00      5942
weighted avg       0.00      0.00      0.00      5942

{'EMBEDDING_DIM': 840, 'HIDDEN_DIM': 172, 'NUM_LAYERS': 3, 'DROPOUT': 0.3542330753604128, 'LR': 0.00047292113786342386, 'WEIGHT_0': 0.28971619913406327, 'WEIGHT_1': 0.6183678654323276, 'WEIGHT_2': 0.49002118485964047, 'WEIGHT_3': 0.9107950203124379, 'WEIGHT_4': 0.8179777828376656, 'WEIGHT_5': 0.412542806538289, 'WEIGHT_6': 0.7450567157227914, 'WEIGHT_7': 0.4663332498003025, 'WEIGHT_8': 0.41161831721873976, 'optimizer': 'SGD'}
49
              precision    recall  f1-score   support

         LOC       0.00      0.00      0.00      1837
        MISC       0.00      0.00      0.00       922
         ORG       0.00      0.00      0.00      1341
         PER       0.00      0.00      0.00      1842

   micro avg       0.00      0.00      0.00      5942
   macro avg       0.00      0.00      0.00      5942
weighted avg       0.00      0.00      0.00      5942

epoch 49
LSTM
  0%|          | 0/50 [00:00<?, ?it/s]  2%|▏         | 1/50 [00:04<03:54,  4.78s/it]  4%|▍         | 2/50 [00:04<01:38,  2.05s/it]  6%|▌         | 3/50 [00:05<00:58,  1.24s/it]  8%|▊         | 4/50 [00:05<00:39,  1.17it/s] 10%|█         | 5/50 [00:05<00:28,  1.55it/s] 12%|█▏        | 6/50 [00:06<00:22,  1.93it/s] 14%|█▍        | 7/50 [00:06<00:18,  2.29it/s] 16%|█▌        | 8/50 [00:06<00:16,  2.61it/s] 18%|█▊        | 9/50 [00:06<00:14,  2.87it/s] 20%|██        | 10/50 [00:07<00:12,  3.09it/s] 22%|██▏       | 11/50 [00:07<00:11,  3.25it/s] 24%|██▍       | 12/50 [00:07<00:11,  3.38it/s] 26%|██▌       | 13/50 [00:07<00:10,  3.47it/s] 28%|██▊       | 14/50 [00:08<00:10,  3.54it/s] 30%|███       | 15/50 [00:08<00:09,  3.58it/s] 32%|███▏      | 16/50 [00:08<00:09,  3.62it/s] 34%|███▍      | 17/50 [00:08<00:09,  3.64it/s] 36%|███▌      | 18/50 [00:09<00:08,  3.66it/s] 38%|███▊      | 19/50 [00:09<00:08,  3.67it/s] 40%|████      | 20/50 [00:09<00:08,  3.68it/s] 42%|████▏     | 21/50 [00:10<00:07,  3.68it/s] 44%|████▍     | 22/50 [00:10<00:07,  3.69it/s] 46%|████▌     | 23/50 [00:10<00:07,  3.69it/s] 48%|████▊     | 24/50 [00:10<00:07,  3.69it/s] 50%|█████     | 25/50 [00:11<00:06,  3.70it/s] 52%|█████▏    | 26/50 [00:11<00:06,  3.69it/s] 54%|█████▍    | 27/50 [00:11<00:06,  3.69it/s] 56%|█████▌    | 28/50 [00:11<00:05,  3.69it/s] 58%|█████▊    | 29/50 [00:12<00:05,  3.69it/s] 60%|██████    | 30/50 [00:12<00:05,  3.69it/s] 62%|██████▏   | 31/50 [00:12<00:05,  3.69it/s] 64%|██████▍   | 32/50 [00:13<00:04,  3.69it/s] 66%|██████▌   | 33/50 [00:13<00:04,  3.69it/s] 68%|██████▊   | 34/50 [00:13<00:04,  3.69it/s] 70%|███████   | 35/50 [00:13<00:04,  3.69it/s] 72%|███████▏  | 36/50 [00:14<00:03,  3.69it/s] 74%|███████▍  | 37/50 [00:14<00:03,  3.69it/s] 76%|███████▌  | 38/50 [00:14<00:03,  3.69it/s] 78%|███████▊  | 39/50 [00:14<00:02,  3.69it/s] 80%|████████  | 40/50 [00:15<00:02,  3.69it/s] 82%|████████▏ | 41/50 [00:15<00:02,  3.69it/s] 84%|████████▍ | 42/50 [00:15<00:02,  3.69it/s] 86%|████████▌ | 43/50 [00:16<00:01,  3.68it/s] 88%|████████▊ | 44/50 [00:16<00:01,  3.68it/s] 90%|█████████ | 45/50 [00:16<00:01,  3.68it/s] 92%|█████████▏| 46/50 [00:16<00:01,  3.68it/s] 94%|█████████▍| 47/50 [00:17<00:00,  3.68it/s] 96%|█████████▌| 48/50 [00:17<00:00,  3.67it/s] 98%|█████████▊| 49/50 [00:17<00:00,  3.67it/s]100%|██████████| 50/50 [00:22<00:00,  1.69s/it]100%|██████████| 50/50 [00:22<00:00,  2.21it/s]
[I 2023-12-10 21:47:07,946] Trial 58 finished with value: 0.4046406810783741 and parameters: {'EMBEDDING_DIM': 905, 'HIDDEN_DIM': 399, 'NUM_LAYERS': 1, 'DROPOUT': 0.3923655099903965, 'LR': 0.0013487545022541647, 'WEIGHT_0': 0.39858949576931635, 'WEIGHT_1': 0.6400788574312093, 'WEIGHT_2': 0.4415349114749841, 'WEIGHT_3': 0.9486277375915552, 'WEIGHT_4': 0.7763208451911241, 'WEIGHT_5': 0.6282085813831746, 'WEIGHT_6': 0.8272558468316737, 'WEIGHT_7': 0.5277853619297179, 'WEIGHT_8': 0.3029574805611207, 'optimizer': 'Adam'}. Best is trial 51 with value: 0.41438326562364947.
/userhome/cs2/dingruiw/conda/envs/py310/lib/python3.10/site-packages/torch/nn/modules/rnn.py:82: UserWarning: dropout option adds dropout after all but last recurrent layer, so non-zero dropout expects num_layers greater than 1, but got dropout=0.4288819926046973 and num_layers=1
  warnings.warn("dropout option adds dropout after all but last "
{'EMBEDDING_DIM': 905, 'HIDDEN_DIM': 399, 'NUM_LAYERS': 1, 'DROPOUT': 0.3923655099903965, 'LR': 0.0013487545022541647, 'WEIGHT_0': 0.39858949576931635, 'WEIGHT_1': 0.6400788574312093, 'WEIGHT_2': 0.4415349114749841, 'WEIGHT_3': 0.9486277375915552, 'WEIGHT_4': 0.7763208451911241, 'WEIGHT_5': 0.6282085813831746, 'WEIGHT_6': 0.8272558468316737, 'WEIGHT_7': 0.5277853619297179, 'WEIGHT_8': 0.3029574805611207, 'optimizer': 'Adam'}
0
              precision    recall  f1-score   support

         LOC       0.03      0.04      0.03      1837
        MISC       0.02      0.03      0.02       922
         ORG       0.03      0.11      0.05      1341
         PER       0.02      0.04      0.03      1842

   micro avg       0.03      0.05      0.03      5942
   macro avg       0.02      0.05      0.03      5942
weighted avg       0.02      0.05      0.03      5942

{'EMBEDDING_DIM': 905, 'HIDDEN_DIM': 399, 'NUM_LAYERS': 1, 'DROPOUT': 0.3923655099903965, 'LR': 0.0013487545022541647, 'WEIGHT_0': 0.39858949576931635, 'WEIGHT_1': 0.6400788574312093, 'WEIGHT_2': 0.4415349114749841, 'WEIGHT_3': 0.9486277375915552, 'WEIGHT_4': 0.7763208451911241, 'WEIGHT_5': 0.6282085813831746, 'WEIGHT_6': 0.8272558468316737, 'WEIGHT_7': 0.5277853619297179, 'WEIGHT_8': 0.3029574805611207, 'optimizer': 'Adam'}
49
              precision    recall  f1-score   support

         LOC       0.56      0.53      0.55      1837
        MISC       0.43      0.44      0.44       922
         ORG       0.27      0.26      0.26      1341
         PER       0.34      0.37      0.35      1842

   micro avg       0.40      0.41      0.40      5942
   macro avg       0.40      0.40      0.40      5942
weighted avg       0.40      0.41      0.41      5942

epoch 49
LSTM
  0%|          | 0/50 [00:00<?, ?it/s]  2%|▏         | 1/50 [00:04<04:01,  4.93s/it]  4%|▍         | 2/50 [00:05<01:41,  2.12s/it]  6%|▌         | 3/50 [00:05<01:00,  1.29s/it]  8%|▊         | 4/50 [00:05<00:41,  1.11it/s] 10%|█         | 5/50 [00:05<00:30,  1.46it/s] 12%|█▏        | 6/50 [00:06<00:24,  1.80it/s] 14%|█▍        | 7/50 [00:06<00:20,  2.12it/s] 16%|█▌        | 8/50 [00:06<00:17,  2.40it/s] 18%|█▊        | 9/50 [00:07<00:15,  2.63it/s] 20%|██        | 10/50 [00:07<00:14,  2.80it/s] 22%|██▏       | 11/50 [00:07<00:13,  2.93it/s] 24%|██▍       | 12/50 [00:08<00:12,  3.04it/s] 26%|██▌       | 13/50 [00:08<00:11,  3.11it/s] 28%|██▊       | 14/50 [00:08<00:11,  3.17it/s] 30%|███       | 15/50 [00:09<00:10,  3.23it/s] 32%|███▏      | 16/50 [00:09<00:10,  3.26it/s] 34%|███▍      | 17/50 [00:09<00:10,  3.27it/s] 36%|███▌      | 18/50 [00:09<00:09,  3.27it/s] 38%|███▊      | 19/50 [00:10<00:09,  3.29it/s] 40%|████      | 20/50 [00:10<00:09,  3.28it/s] 42%|████▏     | 21/50 [00:10<00:08,  3.27it/s] 44%|████▍     | 22/50 [00:11<00:08,  3.29it/s] 46%|████▌     | 23/50 [00:11<00:08,  3.28it/s] 48%|████▊     | 24/50 [00:11<00:07,  3.27it/s] 50%|█████     | 25/50 [00:12<00:07,  3.29it/s] 52%|█████▏    | 26/50 [00:12<00:07,  3.28it/s] 54%|█████▍    | 27/50 [00:12<00:06,  3.29it/s] 56%|█████▌    | 28/50 [00:12<00:06,  3.28it/s] 58%|█████▊    | 29/50 [00:13<00:06,  3.29it/s] 60%|██████    | 30/50 [00:13<00:06,  3.28it/s] 62%|██████▏   | 31/50 [00:13<00:05,  3.27it/s] 64%|██████▍   | 32/50 [00:14<00:05,  3.27it/s] 66%|██████▌   | 33/50 [00:14<00:05,  3.28it/s] 68%|██████▊   | 34/50 [00:14<00:04,  3.30it/s] 70%|███████   | 35/50 [00:15<00:04,  3.29it/s] 72%|███████▏  | 36/50 [00:15<00:04,  3.29it/s] 74%|███████▍  | 37/50 [00:15<00:03,  3.29it/s] 76%|███████▌  | 38/50 [00:15<00:03,  3.30it/s] 78%|███████▊  | 39/50 [00:16<00:03,  3.32it/s] 80%|████████  | 40/50 [00:16<00:03,  3.32it/s] 82%|████████▏ | 41/50 [00:16<00:02,  3.31it/s] 84%|████████▍ | 42/50 [00:17<00:02,  3.30it/s] 86%|████████▌ | 43/50 [00:17<00:02,  3.29it/s] 88%|████████▊ | 44/50 [00:17<00:01,  3.29it/s] 90%|█████████ | 45/50 [00:18<00:01,  3.29it/s] 92%|█████████▏| 46/50 [00:18<00:01,  3.31it/s] 94%|█████████▍| 47/50 [00:18<00:00,  3.30it/s] 96%|█████████▌| 48/50 [00:19<00:00,  3.29it/s] 98%|█████████▊| 49/50 [00:19<00:00,  3.29it/s]100%|██████████| 50/50 [00:24<00:00,  1.74s/it]100%|██████████| 50/50 [00:24<00:00,  2.05it/s]
[I 2023-12-10 21:47:36,691] Trial 59 finished with value: 0.39939024390243905 and parameters: {'EMBEDDING_DIM': 909, 'HIDDEN_DIM': 425, 'NUM_LAYERS': 1, 'DROPOUT': 0.4288819926046973, 'LR': 0.0013194511388288372, 'WEIGHT_0': 0.39523961890078907, 'WEIGHT_1': 0.7962830244087347, 'WEIGHT_2': 0.43107360382401616, 'WEIGHT_3': 0.9634766762989917, 'WEIGHT_4': 0.9158740680762304, 'WEIGHT_5': 0.5651332705892298, 'WEIGHT_6': 0.8058546721113913, 'WEIGHT_7': 0.5356156515442965, 'WEIGHT_8': 0.29639061842590675, 'optimizer': 'Adam'}. Best is trial 51 with value: 0.41438326562364947.
{'EMBEDDING_DIM': 909, 'HIDDEN_DIM': 425, 'NUM_LAYERS': 1, 'DROPOUT': 0.4288819926046973, 'LR': 0.0013194511388288372, 'WEIGHT_0': 0.39523961890078907, 'WEIGHT_1': 0.7962830244087347, 'WEIGHT_2': 0.43107360382401616, 'WEIGHT_3': 0.9634766762989917, 'WEIGHT_4': 0.9158740680762304, 'WEIGHT_5': 0.5651332705892298, 'WEIGHT_6': 0.8058546721113913, 'WEIGHT_7': 0.5356156515442965, 'WEIGHT_8': 0.29639061842590675, 'optimizer': 'Adam'}
0
              precision    recall  f1-score   support

         LOC       0.05      0.05      0.05      1837
        MISC       0.01      0.07      0.02       922
         ORG       0.02      0.08      0.03      1341
         PER       0.02      0.06      0.03      1842

   micro avg       0.02      0.06      0.03      5942
   macro avg       0.03      0.07      0.03      5942
weighted avg       0.03      0.06      0.04      5942

{'EMBEDDING_DIM': 909, 'HIDDEN_DIM': 425, 'NUM_LAYERS': 1, 'DROPOUT': 0.4288819926046973, 'LR': 0.0013194511388288372, 'WEIGHT_0': 0.39523961890078907, 'WEIGHT_1': 0.7962830244087347, 'WEIGHT_2': 0.43107360382401616, 'WEIGHT_3': 0.9634766762989917, 'WEIGHT_4': 0.9158740680762304, 'WEIGHT_5': 0.5651332705892298, 'WEIGHT_6': 0.8058546721113913, 'WEIGHT_7': 0.5356156515442965, 'WEIGHT_8': 0.29639061842590675, 'optimizer': 'Adam'}
49
              precision    recall  f1-score   support

         LOC       0.57      0.50      0.53      1837
        MISC       0.42      0.43      0.43       922
         ORG       0.26      0.27      0.27      1341
         PER       0.35      0.37      0.36      1842

   micro avg       0.40      0.40      0.40      5942
   macro avg       0.40      0.39      0.40      5942
weighted avg       0.41      0.40      0.40      5942

epoch 49
LSTM
  0%|          | 0/50 [00:00<?, ?it/s]  2%|▏         | 1/50 [00:04<03:37,  4.45s/it] 10%|█         | 5/50 [00:04<00:31,  1.43it/s] 14%|█▍        | 7/50 [00:04<00:20,  2.07it/s] 18%|█▊        | 9/50 [00:05<00:14,  2.81it/s] 20%|██        | 10/50 [00:05<00:12,  3.23it/s] 22%|██▏       | 11/50 [00:05<00:10,  3.74it/s] 24%|██▍       | 12/50 [00:05<00:08,  4.31it/s] 26%|██▌       | 13/50 [00:05<00:07,  4.90it/s] 28%|██▊       | 14/50 [00:05<00:06,  5.49it/s] 30%|███       | 15/50 [00:05<00:05,  6.04it/s] 32%|███▏      | 16/50 [00:05<00:05,  6.52it/s] 34%|███▍      | 17/50 [00:06<00:04,  6.93it/s] 36%|███▌      | 18/50 [00:06<00:04,  7.28it/s] 38%|███▊      | 19/50 [00:06<00:04,  7.52it/s] 40%|████      | 20/50 [00:06<00:03,  7.71it/s] 42%|████▏     | 21/50 [00:06<00:03,  7.84it/s] 44%|████▍     | 22/50 [00:06<00:03,  7.93it/s] 46%|████▌     | 23/50 [00:06<00:03,  8.00it/s] 48%|████▊     | 24/50 [00:06<00:03,  8.05it/s] 50%|█████     | 25/50 [00:07<00:03,  8.09it/s] 52%|█████▏    | 26/50 [00:07<00:02,  8.11it/s] 54%|█████▍    | 27/50 [00:07<00:02,  8.12it/s] 56%|█████▌    | 28/50 [00:07<00:02,  8.15it/s] 58%|█████▊    | 29/50 [00:07<00:02,  8.16it/s] 60%|██████    | 30/50 [00:07<00:02,  8.16it/s] 62%|██████▏   | 31/50 [00:07<00:02,  8.16it/s] 64%|██████▍   | 32/50 [00:07<00:02,  8.17it/s] 66%|██████▌   | 33/50 [00:08<00:02,  8.17it/s] 68%|██████▊   | 34/50 [00:08<00:01,  8.17it/s] 70%|███████   | 35/50 [00:08<00:01,  8.17it/s] 72%|███████▏  | 36/50 [00:08<00:01,  8.17it/s] 74%|███████▍  | 37/50 [00:08<00:01,  8.18it/s] 76%|███████▌  | 38/50 [00:08<00:01,  8.17it/s] 78%|███████▊  | 39/50 [00:08<00:01,  8.17it/s] 80%|████████  | 40/50 [00:08<00:01,  8.17it/s] 82%|████████▏ | 41/50 [00:09<00:01,  8.16it/s] 84%|████████▍ | 42/50 [00:09<00:00,  8.17it/s] 86%|████████▌ | 43/50 [00:09<00:00,  8.17it/s] 88%|████████▊ | 44/50 [00:09<00:00,  8.17it/s] 90%|█████████ | 45/50 [00:09<00:00,  8.17it/s] 92%|█████████▏| 46/50 [00:09<00:00,  8.17it/s] 94%|█████████▍| 47/50 [00:09<00:00,  8.17it/s] 96%|█████████▌| 48/50 [00:09<00:00,  8.17it/s] 98%|█████████▊| 49/50 [00:10<00:00,  8.16it/s]100%|██████████| 50/50 [00:14<00:00,  1.41s/it]100%|██████████| 50/50 [00:14<00:00,  3.46it/s]
[I 2023-12-10 21:47:55,069] Trial 60 finished with value: 0.14028934677772906 and parameters: {'EMBEDDING_DIM': 999, 'HIDDEN_DIM': 114, 'NUM_LAYERS': 2, 'DROPOUT': 0.39376805518963587, 'LR': 0.0005577050701659322, 'WEIGHT_0': 0.2851139632169696, 'WEIGHT_1': 0.8535047542558765, 'WEIGHT_2': 0.4484542466616897, 'WEIGHT_3': 0.8870106628626221, 'WEIGHT_4': 0.7608377449266042, 'WEIGHT_5': 0.6204066274961387, 'WEIGHT_6': 0.9525163147127531, 'WEIGHT_7': 0.6362739173354466, 'WEIGHT_8': 0.4747090815685704, 'optimizer': 'Adam'}. Best is trial 51 with value: 0.41438326562364947.
/userhome/cs2/dingruiw/conda/envs/py310/lib/python3.10/site-packages/torch/nn/modules/rnn.py:82: UserWarning: dropout option adds dropout after all but last recurrent layer, so non-zero dropout expects num_layers greater than 1, but got dropout=0.36934621563830666 and num_layers=1
  warnings.warn("dropout option adds dropout after all but last "
{'EMBEDDING_DIM': 999, 'HIDDEN_DIM': 114, 'NUM_LAYERS': 2, 'DROPOUT': 0.39376805518963587, 'LR': 0.0005577050701659322, 'WEIGHT_0': 0.2851139632169696, 'WEIGHT_1': 0.8535047542558765, 'WEIGHT_2': 0.4484542466616897, 'WEIGHT_3': 0.8870106628626221, 'WEIGHT_4': 0.7608377449266042, 'WEIGHT_5': 0.6204066274961387, 'WEIGHT_6': 0.9525163147127531, 'WEIGHT_7': 0.6362739173354466, 'WEIGHT_8': 0.4747090815685704, 'optimizer': 'Adam'}
0
              precision    recall  f1-score   support

         LOC       0.04      0.43      0.07      1837
        MISC       0.01      0.06      0.02       922
         ORG       0.01      0.01      0.01      1341
         PER       0.01      0.06      0.02      1842

   micro avg       0.03      0.16      0.05      5942
   macro avg       0.02      0.14      0.03      5942
weighted avg       0.02      0.16      0.03      5942

{'EMBEDDING_DIM': 999, 'HIDDEN_DIM': 114, 'NUM_LAYERS': 2, 'DROPOUT': 0.39376805518963587, 'LR': 0.0005577050701659322, 'WEIGHT_0': 0.2851139632169696, 'WEIGHT_1': 0.8535047542558765, 'WEIGHT_2': 0.4484542466616897, 'WEIGHT_3': 0.8870106628626221, 'WEIGHT_4': 0.7608377449266042, 'WEIGHT_5': 0.6204066274961387, 'WEIGHT_6': 0.9525163147127531, 'WEIGHT_7': 0.6362739173354466, 'WEIGHT_8': 0.4747090815685704, 'optimizer': 'Adam'}
49
              precision    recall  f1-score   support

         LOC       0.41      0.24      0.30      1837
        MISC       0.00      0.00      0.00       922
         ORG       0.16      0.01      0.02      1341
         PER       0.09      0.10      0.10      1842

   micro avg       0.20      0.11      0.14      5942
   macro avg       0.17      0.09      0.10      5942
weighted avg       0.19      0.11      0.13      5942

epoch 49
LSTM
  0%|          | 0/50 [00:00<?, ?it/s]  2%|▏         | 1/50 [00:04<03:57,  4.85s/it]  4%|▍         | 2/50 [00:04<01:39,  2.07s/it]  6%|▌         | 3/50 [00:05<00:58,  1.23s/it]  8%|▊         | 4/50 [00:05<00:38,  1.19it/s] 10%|█         | 5/50 [00:05<00:27,  1.62it/s] 12%|█▏        | 6/50 [00:05<00:21,  2.06it/s] 14%|█▍        | 7/50 [00:06<00:17,  2.48it/s] 16%|█▌        | 8/50 [00:06<00:14,  2.88it/s] 18%|█▊        | 9/50 [00:06<00:12,  3.22it/s] 20%|██        | 10/50 [00:06<00:11,  3.50it/s] 22%|██▏       | 11/50 [00:07<00:10,  3.73it/s] 24%|██▍       | 12/50 [00:07<00:09,  3.90it/s] 26%|██▌       | 13/50 [00:07<00:09,  4.02it/s] 28%|██▊       | 14/50 [00:07<00:08,  4.12it/s] 30%|███       | 15/50 [00:07<00:08,  4.19it/s] 32%|███▏      | 16/50 [00:08<00:08,  4.23it/s] 34%|███▍      | 17/50 [00:08<00:07,  4.27it/s] 36%|███▌      | 18/50 [00:08<00:07,  4.30it/s] 38%|███▊      | 19/50 [00:08<00:07,  4.31it/s] 40%|████      | 20/50 [00:09<00:06,  4.32it/s] 42%|████▏     | 21/50 [00:09<00:06,  4.33it/s] 44%|████▍     | 22/50 [00:09<00:06,  4.33it/s] 46%|████▌     | 23/50 [00:09<00:06,  4.34it/s] 48%|████▊     | 24/50 [00:10<00:05,  4.34it/s] 50%|█████     | 25/50 [00:10<00:05,  4.34it/s] 52%|█████▏    | 26/50 [00:10<00:05,  4.34it/s] 54%|█████▍    | 27/50 [00:10<00:05,  4.35it/s] 56%|█████▌    | 28/50 [00:10<00:05,  4.35it/s] 58%|█████▊    | 29/50 [00:11<00:04,  4.34it/s] 60%|██████    | 30/50 [00:11<00:04,  4.35it/s] 62%|██████▏   | 31/50 [00:11<00:04,  4.34it/s] 64%|██████▍   | 32/50 [00:11<00:04,  4.35it/s] 66%|██████▌   | 33/50 [00:12<00:03,  4.35it/s] 68%|██████▊   | 34/50 [00:12<00:03,  4.34it/s] 70%|███████   | 35/50 [00:12<00:03,  4.34it/s] 72%|███████▏  | 36/50 [00:12<00:03,  4.35it/s] 74%|███████▍  | 37/50 [00:13<00:03,  4.33it/s] 76%|███████▌  | 38/50 [00:13<00:02,  4.33it/s] 78%|███████▊  | 39/50 [00:13<00:02,  4.33it/s] 80%|████████  | 40/50 [00:13<00:02,  4.33it/s] 82%|████████▏ | 41/50 [00:13<00:02,  4.33it/s] 84%|████████▍ | 42/50 [00:14<00:01,  4.33it/s] 86%|████████▌ | 43/50 [00:14<00:01,  4.33it/s] 88%|████████▊ | 44/50 [00:14<00:01,  4.33it/s] 90%|█████████ | 45/50 [00:14<00:01,  4.32it/s] 92%|█████████▏| 46/50 [00:15<00:00,  4.33it/s] 94%|█████████▍| 47/50 [00:15<00:00,  4.33it/s] 96%|█████████▌| 48/50 [00:15<00:00,  4.32it/s] 98%|█████████▊| 49/50 [00:15<00:00,  4.33it/s]100%|██████████| 50/50 [00:20<00:00,  1.64s/it]100%|██████████| 50/50 [00:20<00:00,  2.41it/s]
