[I 2023-12-10 21:36:30,478] Trial 45 finished with value: 0.20501174628034455 and parameters: {'EMBEDDING_DIM': 242, 'HIDDEN_DIM': 1034, 'NUM_LAYERS': 4, 'DROPOUT': 0.24610722491816625, 'LR': 0.002399653491752326, 'WEIGHT_0': 0.47217016109961524, 'WEIGHT_1': 0.6614933501542711, 'WEIGHT_2': 0.6455794823267602, 'WEIGHT_3': 0.4661256551957685, 'WEIGHT_4': 0.8696545240479467, 'WEIGHT_5': 0.6720476659837107, 'WEIGHT_6': 0.7627069226969154, 'WEIGHT_7': 0.36066586720983934, 'WEIGHT_8': 0.5357948433110394, 'optimizer': 'Adam'}. Best is trial 42 with value: 0.4124343257443082.
/userhome/cs2/dingruiw/conda/envs/py310/lib/python3.10/site-packages/torch/nn/modules/rnn.py:82: UserWarning: dropout option adds dropout after all but last recurrent layer, so non-zero dropout expects num_layers greater than 1, but got dropout=0.3507083042001536 and num_layers=1
  warnings.warn("dropout option adds dropout after all but last "
{'EMBEDDING_DIM': 242, 'HIDDEN_DIM': 1034, 'NUM_LAYERS': 4, 'DROPOUT': 0.24610722491816625, 'LR': 0.002399653491752326, 'WEIGHT_0': 0.47217016109961524, 'WEIGHT_1': 0.6614933501542711, 'WEIGHT_2': 0.6455794823267602, 'WEIGHT_3': 0.4661256551957685, 'WEIGHT_4': 0.8696545240479467, 'WEIGHT_5': 0.6720476659837107, 'WEIGHT_6': 0.7627069226969154, 'WEIGHT_7': 0.36066586720983934, 'WEIGHT_8': 0.5357948433110394, 'optimizer': 'Adam'}
0
              precision    recall  f1-score   support

         LOC       0.07      0.00      0.00      1837
        MISC       0.00      0.00      0.00       922
         ORG       0.00      0.00      0.00      1341
         PER       0.00      0.00      0.00      1842

   micro avg       0.03      0.00      0.00      5942
   macro avg       0.02      0.00      0.00      5942
weighted avg       0.02      0.00      0.00      5942

{'EMBEDDING_DIM': 242, 'HIDDEN_DIM': 1034, 'NUM_LAYERS': 4, 'DROPOUT': 0.24610722491816625, 'LR': 0.002399653491752326, 'WEIGHT_0': 0.47217016109961524, 'WEIGHT_1': 0.6614933501542711, 'WEIGHT_2': 0.6455794823267602, 'WEIGHT_3': 0.4661256551957685, 'WEIGHT_4': 0.8696545240479467, 'WEIGHT_5': 0.6720476659837107, 'WEIGHT_6': 0.7627069226969154, 'WEIGHT_7': 0.36066586720983934, 'WEIGHT_8': 0.5357948433110394, 'optimizer': 'Adam'}
49
              precision    recall  f1-score   support

         LOC       0.43      0.29      0.35      1837
        MISC       0.11      0.15      0.13       922
         ORG       0.16      0.14      0.15      1341
         PER       0.14      0.24      0.18      1842

   micro avg       0.19      0.22      0.21      5942
   macro avg       0.21      0.21      0.20      5942
weighted avg       0.23      0.22      0.22      5942

epoch 49
LSTM
  0%|          | 0/50 [00:00<?, ?it/s]  2%|▏         | 1/50 [00:04<03:56,  4.82s/it]  4%|▍         | 2/50 [00:04<01:39,  2.08s/it]  6%|▌         | 3/50 [00:05<00:59,  1.27s/it]  8%|▊         | 4/50 [00:05<00:40,  1.13it/s] 10%|█         | 5/50 [00:05<00:30,  1.47it/s] 12%|█▏        | 6/50 [00:06<00:24,  1.81it/s] 14%|█▍        | 7/50 [00:06<00:20,  2.12it/s] 16%|█▌        | 8/50 [00:06<00:17,  2.39it/s] 18%|█▊        | 9/50 [00:07<00:15,  2.61it/s] 20%|██        | 10/50 [00:07<00:14,  2.79it/s] 22%|██▏       | 11/50 [00:07<00:13,  2.93it/s] 24%|██▍       | 12/50 [00:08<00:12,  3.03it/s] 26%|██▌       | 13/50 [00:08<00:11,  3.10it/s] 28%|██▊       | 14/50 [00:08<00:11,  3.16it/s] 30%|███       | 15/50 [00:08<00:10,  3.19it/s] 32%|███▏      | 16/50 [00:09<00:10,  3.22it/s] 34%|███▍      | 17/50 [00:09<00:10,  3.24it/s] 36%|███▌      | 18/50 [00:09<00:09,  3.25it/s] 38%|███▊      | 19/50 [00:10<00:09,  3.26it/s] 40%|████      | 20/50 [00:10<00:09,  3.27it/s] 42%|████▏     | 21/50 [00:10<00:08,  3.27it/s] 44%|████▍     | 22/50 [00:11<00:08,  3.28it/s] 46%|████▌     | 23/50 [00:11<00:08,  3.28it/s] 48%|████▊     | 24/50 [00:11<00:07,  3.27it/s] 50%|█████     | 25/50 [00:11<00:07,  3.28it/s] 52%|█████▏    | 26/50 [00:12<00:07,  3.28it/s] 54%|█████▍    | 27/50 [00:12<00:07,  3.27it/s] 56%|█████▌    | 28/50 [00:12<00:06,  3.27it/s] 58%|█████▊    | 29/50 [00:13<00:06,  3.27it/s] 60%|██████    | 30/50 [00:13<00:06,  3.26it/s] 62%|██████▏   | 31/50 [00:13<00:05,  3.26it/s] 64%|██████▍   | 32/50 [00:14<00:05,  3.26it/s] 66%|██████▌   | 33/50 [00:14<00:05,  3.27it/s] 68%|██████▊   | 34/50 [00:14<00:04,  3.27it/s] 70%|███████   | 35/50 [00:15<00:04,  3.27it/s] 72%|███████▏  | 36/50 [00:15<00:04,  3.26it/s] 74%|███████▍  | 37/50 [00:15<00:03,  3.26it/s] 76%|███████▌  | 38/50 [00:15<00:03,  3.25it/s] 78%|███████▊  | 39/50 [00:16<00:03,  3.25it/s] 80%|████████  | 40/50 [00:16<00:03,  3.25it/s] 82%|████████▏ | 41/50 [00:16<00:02,  3.25it/s] 84%|████████▍ | 42/50 [00:17<00:02,  3.24it/s] 86%|████████▌ | 43/50 [00:17<00:02,  3.24it/s] 88%|████████▊ | 44/50 [00:17<00:01,  3.25it/s] 90%|█████████ | 45/50 [00:18<00:01,  3.25it/s] 92%|█████████▏| 46/50 [00:18<00:01,  3.24it/s] 94%|█████████▍| 47/50 [00:18<00:00,  3.24it/s] 96%|█████████▌| 48/50 [00:19<00:00,  3.24it/s] 98%|█████████▊| 49/50 [00:19<00:00,  3.24it/s]100%|██████████| 50/50 [00:24<00:00,  1.71s/it]100%|██████████| 50/50 [00:24<00:00,  2.05it/s]
[I 2023-12-10 21:36:59,039] Trial 46 finished with value: 0.395760336370007 and parameters: {'EMBEDDING_DIM': 870, 'HIDDEN_DIM': 491, 'NUM_LAYERS': 1, 'DROPOUT': 0.3507083042001536, 'LR': 0.0012723872562797319, 'WEIGHT_0': 0.5099278937356474, 'WEIGHT_1': 0.7352568508320538, 'WEIGHT_2': 0.6872786336286376, 'WEIGHT_3': 0.7449984214473833, 'WEIGHT_4': 0.8948576511901688, 'WEIGHT_5': 0.5339691041688482, 'WEIGHT_6': 0.7974468309781115, 'WEIGHT_7': 0.4335467552901182, 'WEIGHT_8': 0.43096407817223215, 'optimizer': 'Adam'}. Best is trial 42 with value: 0.4124343257443082.
{'EMBEDDING_DIM': 870, 'HIDDEN_DIM': 491, 'NUM_LAYERS': 1, 'DROPOUT': 0.3507083042001536, 'LR': 0.0012723872562797319, 'WEIGHT_0': 0.5099278937356474, 'WEIGHT_1': 0.7352568508320538, 'WEIGHT_2': 0.6872786336286376, 'WEIGHT_3': 0.7449984214473833, 'WEIGHT_4': 0.8948576511901688, 'WEIGHT_5': 0.5339691041688482, 'WEIGHT_6': 0.7974468309781115, 'WEIGHT_7': 0.4335467552901182, 'WEIGHT_8': 0.43096407817223215, 'optimizer': 'Adam'}
0
              precision    recall  f1-score   support

         LOC       0.04      0.11      0.06      1837
        MISC       0.01      0.03      0.02       922
         ORG       0.02      0.03      0.03      1341
         PER       0.03      0.03      0.03      1842

   micro avg       0.03      0.05      0.04      5942
   macro avg       0.03      0.05      0.03      5942
weighted avg       0.03      0.05      0.04      5942

{'EMBEDDING_DIM': 870, 'HIDDEN_DIM': 491, 'NUM_LAYERS': 1, 'DROPOUT': 0.3507083042001536, 'LR': 0.0012723872562797319, 'WEIGHT_0': 0.5099278937356474, 'WEIGHT_1': 0.7352568508320538, 'WEIGHT_2': 0.6872786336286376, 'WEIGHT_3': 0.7449984214473833, 'WEIGHT_4': 0.8948576511901688, 'WEIGHT_5': 0.5339691041688482, 'WEIGHT_6': 0.7974468309781115, 'WEIGHT_7': 0.4335467552901182, 'WEIGHT_8': 0.43096407817223215, 'optimizer': 'Adam'}
49
              precision    recall  f1-score   support

         LOC       0.58      0.50      0.54      1837
        MISC       0.43      0.43      0.43       922
         ORG       0.30      0.24      0.27      1341
         PER       0.33      0.34      0.33      1842

   micro avg       0.41      0.38      0.40      5942
   macro avg       0.41      0.38      0.39      5942
weighted avg       0.41      0.38      0.40      5942

epoch 49
LSTM
  0%|          | 0/50 [00:00<?, ?it/s]  2%|▏         | 1/50 [00:07<06:16,  7.67s/it]  4%|▍         | 2/50 [00:08<02:42,  3.39s/it]  6%|▌         | 3/50 [00:09<01:54,  2.44s/it]  8%|▊         | 4/50 [00:10<01:31,  2.00s/it] 10%|█         | 5/50 [00:12<01:18,  1.75s/it] 12%|█▏        | 6/50 [00:13<01:10,  1.60s/it] 14%|█▍        | 7/50 [00:14<01:04,  1.51s/it] 16%|█▌        | 8/50 [00:15<01:00,  1.45s/it] 18%|█▊        | 9/50 [00:17<00:57,  1.41s/it] 20%|██        | 10/50 [00:18<00:55,  1.38s/it] 22%|██▏       | 11/50 [00:19<00:52,  1.36s/it] 24%|██▍       | 12/50 [00:21<00:51,  1.34s/it] 26%|██▌       | 13/50 [00:22<00:49,  1.33s/it] 28%|██▊       | 14/50 [00:23<00:47,  1.33s/it] 30%|███       | 15/50 [00:25<00:46,  1.32s/it] 32%|███▏      | 16/50 [00:26<00:44,  1.32s/it] 34%|███▍      | 17/50 [00:27<00:43,  1.32s/it] 36%|███▌      | 18/50 [00:29<00:42,  1.32s/it] 38%|███▊      | 19/50 [00:30<00:40,  1.32s/it] 40%|████      | 20/50 [00:31<00:39,  1.32s/it] 42%|████▏     | 21/50 [00:33<00:38,  1.32s/it] 44%|████▍     | 22/50 [00:34<00:37,  1.33s/it] 46%|████▌     | 23/50 [00:35<00:35,  1.33s/it] 48%|████▊     | 24/50 [00:37<00:34,  1.33s/it] 50%|█████     | 25/50 [00:38<00:33,  1.33s/it] 52%|█████▏    | 26/50 [00:39<00:32,  1.33s/it] 54%|█████▍    | 27/50 [00:41<00:30,  1.34s/it] 56%|█████▌    | 28/50 [00:42<00:29,  1.34s/it] 58%|█████▊    | 29/50 [00:43<00:28,  1.34s/it] 60%|██████    | 30/50 [00:45<00:26,  1.34s/it] 62%|██████▏   | 31/50 [00:46<00:25,  1.34s/it] 64%|██████▍   | 32/50 [00:47<00:24,  1.35s/it] 66%|██████▌   | 33/50 [00:49<00:22,  1.35s/it] 68%|██████▊   | 34/50 [00:50<00:21,  1.35s/it] 70%|███████   | 35/50 [00:51<00:20,  1.35s/it] 72%|███████▏  | 36/50 [00:53<00:18,  1.36s/it] 74%|███████▍  | 37/50 [00:54<00:17,  1.36s/it] 76%|███████▌  | 38/50 [00:55<00:16,  1.35s/it] 78%|███████▊  | 39/50 [00:57<00:14,  1.36s/it] 80%|████████  | 40/50 [00:58<00:13,  1.36s/it] 82%|████████▏ | 41/50 [01:00<00:12,  1.36s/it] 84%|████████▍ | 42/50 [01:01<00:10,  1.36s/it] 86%|████████▌ | 43/50 [01:02<00:09,  1.36s/it] 88%|████████▊ | 44/50 [01:04<00:08,  1.36s/it] 90%|█████████ | 45/50 [01:05<00:06,  1.36s/it] 92%|█████████▏| 46/50 [01:06<00:05,  1.36s/it] 94%|█████████▍| 47/50 [01:08<00:04,  1.36s/it] 96%|█████████▌| 48/50 [01:09<00:02,  1.36s/it] 98%|█████████▊| 49/50 [01:10<00:01,  1.36s/it]100%|██████████| 50/50 [01:19<00:00,  3.59s/it]100%|██████████| 50/50 [01:19<00:00,  1.59s/it]
[I 2023-12-10 21:38:25,048] Trial 47 finished with value: 0.3297773654916512 and parameters: {'EMBEDDING_DIM': 593, 'HIDDEN_DIM': 898, 'NUM_LAYERS': 2, 'DROPOUT': 0.36668698687401496, 'LR': 0.0020017078227621645, 'WEIGHT_0': 0.6377414157851857, 'WEIGHT_1': 0.6738412955785241, 'WEIGHT_2': 0.5683829231880834, 'WEIGHT_3': 0.625799751877126, 'WEIGHT_4': 0.7881134678310293, 'WEIGHT_5': 0.6135593418510749, 'WEIGHT_6': 0.8485379262143523, 'WEIGHT_7': 0.3864969907552994, 'WEIGHT_8': 0.7108006276268801, 'optimizer': 'Adam'}. Best is trial 42 with value: 0.4124343257443082.
/userhome/cs2/dingruiw/conda/envs/py310/lib/python3.10/site-packages/torch/nn/modules/rnn.py:82: UserWarning: dropout option adds dropout after all but last recurrent layer, so non-zero dropout expects num_layers greater than 1, but got dropout=0.2770859222733013 and num_layers=1
  warnings.warn("dropout option adds dropout after all but last "
{'EMBEDDING_DIM': 593, 'HIDDEN_DIM': 898, 'NUM_LAYERS': 2, 'DROPOUT': 0.36668698687401496, 'LR': 0.0020017078227621645, 'WEIGHT_0': 0.6377414157851857, 'WEIGHT_1': 0.6738412955785241, 'WEIGHT_2': 0.5683829231880834, 'WEIGHT_3': 0.625799751877126, 'WEIGHT_4': 0.7881134678310293, 'WEIGHT_5': 0.6135593418510749, 'WEIGHT_6': 0.8485379262143523, 'WEIGHT_7': 0.3864969907552994, 'WEIGHT_8': 0.7108006276268801, 'optimizer': 'Adam'}
0
              precision    recall  f1-score   support

         LOC       0.00      0.00      0.00      1837
        MISC       0.00      0.00      0.00       922
         ORG       0.06      0.01      0.01      1341
         PER       0.04      0.02      0.02      1842

   micro avg       0.04      0.01      0.01      5942
   macro avg       0.03      0.01      0.01      5942
weighted avg       0.03      0.01      0.01      5942

{'EMBEDDING_DIM': 593, 'HIDDEN_DIM': 898, 'NUM_LAYERS': 2, 'DROPOUT': 0.36668698687401496, 'LR': 0.0020017078227621645, 'WEIGHT_0': 0.6377414157851857, 'WEIGHT_1': 0.6738412955785241, 'WEIGHT_2': 0.5683829231880834, 'WEIGHT_3': 0.625799751877126, 'WEIGHT_4': 0.7881134678310293, 'WEIGHT_5': 0.6135593418510749, 'WEIGHT_6': 0.8485379262143523, 'WEIGHT_7': 0.3864969907552994, 'WEIGHT_8': 0.7108006276268801, 'optimizer': 'Adam'}
49
              precision    recall  f1-score   support

         LOC       0.51      0.49      0.50      1837
        MISC       0.20      0.36      0.26       922
         ORG       0.18      0.27      0.22      1341
         PER       0.34      0.30      0.32      1842

   micro avg       0.30      0.36      0.33      5942
   macro avg       0.31      0.35      0.32      5942
weighted avg       0.33      0.36      0.34      5942

epoch 49
LSTM
  0%|          | 0/50 [00:00<?, ?it/s]  2%|▏         | 1/50 [00:11<09:14, 11.32s/it]  4%|▍         | 2/50 [00:12<04:13,  5.29s/it]  6%|▌         | 3/50 [00:14<03:02,  3.89s/it]  8%|▊         | 4/50 [00:16<02:29,  3.24s/it] 10%|█         | 5/50 [00:19<02:10,  2.89s/it] 12%|█▏        | 6/50 [00:21<01:57,  2.67s/it] 14%|█▍        | 7/50 [00:23<01:49,  2.54s/it] 16%|█▌        | 8/50 [00:25<01:43,  2.46s/it] 18%|█▊        | 9/50 [00:28<01:38,  2.39s/it] 20%|██        | 10/50 [00:30<01:34,  2.37s/it] 22%|██▏       | 11/50 [00:32<01:31,  2.34s/it] 24%|██▍       | 12/50 [00:35<01:28,  2.33s/it] 26%|██▌       | 13/50 [00:37<01:25,  2.32s/it] 28%|██▊       | 14/50 [00:39<01:23,  2.32s/it] 30%|███       | 15/50 [00:41<01:21,  2.32s/it] 32%|███▏      | 16/50 [00:44<01:18,  2.32s/it] 34%|███▍      | 17/50 [00:46<01:16,  2.32s/it] 36%|███▌      | 18/50 [00:48<01:14,  2.32s/it] 38%|███▊      | 19/50 [00:51<01:11,  2.32s/it] 40%|████      | 20/50 [00:53<01:09,  2.32s/it] 42%|████▏     | 21/50 [00:55<01:07,  2.32s/it] 44%|████▍     | 22/50 [00:58<01:04,  2.32s/it] 46%|████▌     | 23/50 [01:00<01:02,  2.32s/it] 48%|████▊     | 24/50 [01:02<01:00,  2.32s/it] 50%|█████     | 25/50 [01:05<00:58,  2.32s/it] 52%|█████▏    | 26/50 [01:07<00:55,  2.33s/it] 54%|█████▍    | 27/50 [01:09<00:53,  2.33s/it] 56%|█████▌    | 28/50 [01:12<00:51,  2.32s/it] 58%|█████▊    | 29/50 [01:14<00:48,  2.32s/it] 60%|██████    | 30/50 [01:16<00:46,  2.32s/it] 62%|██████▏   | 31/50 [01:19<00:44,  2.33s/it] 64%|██████▍   | 32/50 [01:21<00:41,  2.32s/it] 66%|██████▌   | 33/50 [01:23<00:39,  2.33s/it] 68%|██████▊   | 34/50 [01:26<00:37,  2.31s/it] 70%|███████   | 35/50 [01:28<00:34,  2.33s/it] 72%|███████▏  | 36/50 [01:30<00:32,  2.32s/it] 74%|███████▍  | 37/50 [01:33<00:30,  2.32s/it] 76%|███████▌  | 38/50 [01:35<00:27,  2.32s/it] 78%|███████▊  | 39/50 [01:37<00:25,  2.32s/it] 80%|████████  | 40/50 [01:40<00:23,  2.32s/it] 82%|████████▏ | 41/50 [01:42<00:20,  2.33s/it] 84%|████████▍ | 42/50 [01:44<00:18,  2.33s/it] 86%|████████▌ | 43/50 [01:47<00:16,  2.33s/it] 88%|████████▊ | 44/50 [01:49<00:13,  2.31s/it] 90%|█████████ | 45/50 [01:51<00:11,  2.32s/it] 92%|█████████▏| 46/50 [01:54<00:09,  2.33s/it] 94%|█████████▍| 47/50 [01:56<00:06,  2.32s/it] 96%|█████████▌| 48/50 [01:58<00:04,  2.31s/it] 98%|█████████▊| 49/50 [02:00<00:02,  2.31s/it]100%|██████████| 50/50 [02:13<00:00,  5.39s/it]100%|██████████| 50/50 [02:13<00:00,  2.67s/it]
[I 2023-12-10 21:40:47,738] Trial 48 finished with value: 0.201050135501355 and parameters: {'EMBEDDING_DIM': 964, 'HIDDEN_DIM': 1951, 'NUM_LAYERS': 1, 'DROPOUT': 0.2770859222733013, 'LR': 0.003357092441164284, 'WEIGHT_0': 0.5712958425567733, 'WEIGHT_1': 0.6061187206407692, 'WEIGHT_2': 0.8052865622326948, 'WEIGHT_3': 0.9549855458231195, 'WEIGHT_4': 0.9466377903821681, 'WEIGHT_5': 0.6509848028912119, 'WEIGHT_6': 0.6811173995690203, 'WEIGHT_7': 0.26370275355185774, 'WEIGHT_8': 0.5469072435221477, 'optimizer': 'Adam'}. Best is trial 42 with value: 0.4124343257443082.
/userhome/cs2/dingruiw/conda/envs/py310/lib/python3.10/site-packages/torch/nn/modules/rnn.py:82: UserWarning: dropout option adds dropout after all but last recurrent layer, so non-zero dropout expects num_layers greater than 1, but got dropout=0.34506012736176 and num_layers=1
  warnings.warn("dropout option adds dropout after all but last "
{'EMBEDDING_DIM': 964, 'HIDDEN_DIM': 1951, 'NUM_LAYERS': 1, 'DROPOUT': 0.2770859222733013, 'LR': 0.003357092441164284, 'WEIGHT_0': 0.5712958425567733, 'WEIGHT_1': 0.6061187206407692, 'WEIGHT_2': 0.8052865622326948, 'WEIGHT_3': 0.9549855458231195, 'WEIGHT_4': 0.9466377903821681, 'WEIGHT_5': 0.6509848028912119, 'WEIGHT_6': 0.6811173995690203, 'WEIGHT_7': 0.26370275355185774, 'WEIGHT_8': 0.5469072435221477, 'optimizer': 'Adam'}
0
              precision    recall  f1-score   support

         LOC       0.07      0.03      0.04      1837
        MISC       0.03      0.04      0.03       922
         ORG       0.09      0.03      0.05      1341
         PER       0.04      0.01      0.01      1842

   micro avg       0.05      0.03      0.03      5942
   macro avg       0.06      0.03      0.03      5942
weighted avg       0.06      0.03      0.03      5942

{'EMBEDDING_DIM': 964, 'HIDDEN_DIM': 1951, 'NUM_LAYERS': 1, 'DROPOUT': 0.2770859222733013, 'LR': 0.003357092441164284, 'WEIGHT_0': 0.5712958425567733, 'WEIGHT_1': 0.6061187206407692, 'WEIGHT_2': 0.8052865622326948, 'WEIGHT_3': 0.9549855458231195, 'WEIGHT_4': 0.9466377903821681, 'WEIGHT_5': 0.6509848028912119, 'WEIGHT_6': 0.6811173995690203, 'WEIGHT_7': 0.26370275355185774, 'WEIGHT_8': 0.5469072435221477, 'optimizer': 'Adam'}
49
              precision    recall  f1-score   support

         LOC       0.31      0.31      0.31      1837
        MISC       0.30      0.23      0.26       922
         ORG       0.19      0.11      0.14      1341
         PER       0.10      0.14      0.12      1842

   micro avg       0.20      0.20      0.20      5942
   macro avg       0.23      0.20      0.21      5942
weighted avg       0.22      0.20      0.20      5942

epoch 49
LSTM
  0%|          | 0/50 [00:00<?, ?it/s]  2%|▏         | 1/50 [00:05<04:12,  5.16s/it]  4%|▍         | 2/50 [00:05<01:49,  2.29s/it]  6%|▌         | 3/50 [00:06<01:11,  1.51s/it]  8%|▊         | 4/50 [00:06<00:52,  1.15s/it] 10%|█         | 5/50 [00:07<00:42,  1.06it/s] 12%|█▏        | 6/50 [00:07<00:36,  1.21it/s] 14%|█▍        | 7/50 [00:08<00:32,  1.34it/s] 16%|█▌        | 8/50 [00:08<00:29,  1.44it/s] 18%|█▊        | 9/50 [00:09<00:27,  1.51it/s] 20%|██        | 10/50 [00:10<00:25,  1.57it/s] 22%|██▏       | 11/50 [00:10<00:24,  1.61it/s] 24%|██▍       | 12/50 [00:11<00:23,  1.65it/s] 26%|██▌       | 13/50 [00:11<00:22,  1.67it/s] 28%|██▊       | 14/50 [00:12<00:21,  1.69it/s] 30%|███       | 15/50 [00:13<00:20,  1.69it/s] 32%|███▏      | 16/50 [00:13<00:20,  1.69it/s] 34%|███▍      | 17/50 [00:14<00:19,  1.70it/s] 36%|███▌      | 18/50 [00:14<00:18,  1.70it/s] 38%|███▊      | 19/50 [00:15<00:18,  1.71it/s] 40%|████      | 20/50 [00:15<00:17,  1.71it/s] 42%|████▏     | 21/50 [00:16<00:16,  1.71it/s] 44%|████▍     | 22/50 [00:17<00:16,  1.70it/s] 46%|████▌     | 23/50 [00:17<00:15,  1.70it/s] 48%|████▊     | 24/50 [00:18<00:15,  1.70it/s] 50%|█████     | 25/50 [00:18<00:14,  1.70it/s] 52%|█████▏    | 26/50 [00:19<00:14,  1.70it/s] 54%|█████▍    | 27/50 [00:20<00:13,  1.70it/s] 56%|█████▌    | 28/50 [00:20<00:12,  1.70it/s] 58%|█████▊    | 29/50 [00:21<00:12,  1.69it/s] 60%|██████    | 30/50 [00:21<00:11,  1.70it/s] 62%|██████▏   | 31/50 [00:22<00:11,  1.70it/s] 64%|██████▍   | 32/50 [00:23<00:10,  1.70it/s] 66%|██████▌   | 33/50 [00:23<00:09,  1.70it/s] 68%|██████▊   | 34/50 [00:24<00:09,  1.70it/s] 70%|███████   | 35/50 [00:24<00:08,  1.69it/s] 72%|███████▏  | 36/50 [00:25<00:08,  1.69it/s] 74%|███████▍  | 37/50 [00:26<00:07,  1.68it/s] 76%|███████▌  | 38/50 [00:26<00:07,  1.70it/s] 78%|███████▊  | 39/50 [00:27<00:06,  1.70it/s] 80%|████████  | 40/50 [00:27<00:05,  1.69it/s] 82%|████████▏ | 41/50 [00:28<00:05,  1.68it/s] 84%|████████▍ | 42/50 [00:28<00:04,  1.68it/s] 86%|████████▌ | 43/50 [00:29<00:04,  1.68it/s] 88%|████████▊ | 44/50 [00:30<00:03,  1.69it/s] 90%|█████████ | 45/50 [00:30<00:02,  1.69it/s] 92%|█████████▏| 46/50 [00:31<00:02,  1.68it/s] 94%|█████████▍| 47/50 [00:31<00:01,  1.68it/s] 96%|█████████▌| 48/50 [00:32<00:01,  1.68it/s] 98%|█████████▊| 49/50 [00:33<00:00,  1.67it/s]100%|██████████| 50/50 [00:38<00:00,  2.07s/it]100%|██████████| 50/50 [00:38<00:00,  1.29it/s]
