[I 2023-12-10 23:35:43,806] Trial 273 finished with value: 0.39793902962644917 and parameters: {'EMBEDDING_DIM': 958, 'HIDDEN_DIM': 185, 'NUM_LAYERS': 1, 'DROPOUT': 0.3043700061698426, 'LR': 0.0010224328552174812, 'WEIGHT_0': 0.49450303313756033, 'WEIGHT_1': 0.5109930025499297, 'WEIGHT_2': 0.7203642887993188, 'WEIGHT_3': 0.6932859896178076, 'WEIGHT_4': 0.9521590425192509, 'WEIGHT_5': 0.4943477476360321, 'WEIGHT_6': 0.6029216951942825, 'WEIGHT_7': 0.1290561022449218, 'WEIGHT_8': 0.5498782807903297, 'optimizer': 'RMSprop'}. Best is trial 221 with value: 0.418736930154747.
/userhome/cs2/dingruiw/conda/envs/py310/lib/python3.10/site-packages/torch/nn/modules/rnn.py:82: UserWarning: dropout option adds dropout after all but last recurrent layer, so non-zero dropout expects num_layers greater than 1, but got dropout=0.33720552500301193 and num_layers=1
  warnings.warn("dropout option adds dropout after all but last "
{'EMBEDDING_DIM': 958, 'HIDDEN_DIM': 185, 'NUM_LAYERS': 1, 'DROPOUT': 0.3043700061698426, 'LR': 0.0010224328552174812, 'WEIGHT_0': 0.49450303313756033, 'WEIGHT_1': 0.5109930025499297, 'WEIGHT_2': 0.7203642887993188, 'WEIGHT_3': 0.6932859896178076, 'WEIGHT_4': 0.9521590425192509, 'WEIGHT_5': 0.4943477476360321, 'WEIGHT_6': 0.6029216951942825, 'WEIGHT_7': 0.1290561022449218, 'WEIGHT_8': 0.5498782807903297, 'optimizer': 'RMSprop'}
0
              precision    recall  f1-score   support

         LOC       0.08      0.03      0.04      1837
        MISC       0.04      0.02      0.03       922
         ORG       0.11      0.06      0.07      1341
         PER       0.08      0.03      0.04      1842

   micro avg       0.08      0.04      0.05      5942
   macro avg       0.08      0.04      0.05      5942
weighted avg       0.08      0.04      0.05      5942

{'EMBEDDING_DIM': 958, 'HIDDEN_DIM': 185, 'NUM_LAYERS': 1, 'DROPOUT': 0.3043700061698426, 'LR': 0.0010224328552174812, 'WEIGHT_0': 0.49450303313756033, 'WEIGHT_1': 0.5109930025499297, 'WEIGHT_2': 0.7203642887993188, 'WEIGHT_3': 0.6932859896178076, 'WEIGHT_4': 0.9521590425192509, 'WEIGHT_5': 0.4943477476360321, 'WEIGHT_6': 0.6029216951942825, 'WEIGHT_7': 0.1290561022449218, 'WEIGHT_8': 0.5498782807903297, 'optimizer': 'RMSprop'}
49
              precision    recall  f1-score   support

         LOC       0.57      0.51      0.54      1837
        MISC       0.42      0.43      0.43       922
         ORG       0.29      0.26      0.27      1341
         PER       0.33      0.34      0.33      1842

   micro avg       0.41      0.39      0.40      5942
   macro avg       0.40      0.39      0.39      5942
weighted avg       0.41      0.39      0.40      5942

epoch 49
LSTM
  0%|          | 0/50 [00:00<?, ?it/s]  2%|▏         | 1/50 [00:04<03:49,  4.68s/it]  4%|▍         | 2/50 [00:04<01:35,  1.99s/it]  6%|▌         | 3/50 [00:04<00:54,  1.17s/it]  8%|▊         | 4/50 [00:05<00:35,  1.28it/s] 10%|█         | 5/50 [00:05<00:25,  1.77it/s] 12%|█▏        | 6/50 [00:05<00:19,  2.29it/s] 14%|█▍        | 7/50 [00:05<00:15,  2.83it/s] 16%|█▌        | 8/50 [00:05<00:12,  3.33it/s] 18%|█▊        | 9/50 [00:06<00:10,  3.79it/s] 20%|██        | 10/50 [00:06<00:09,  4.18it/s] 22%|██▏       | 11/50 [00:06<00:08,  4.49it/s] 24%|██▍       | 12/50 [00:06<00:08,  4.74it/s] 26%|██▌       | 13/50 [00:06<00:07,  4.90it/s] 28%|██▊       | 14/50 [00:07<00:07,  5.04it/s] 30%|███       | 15/50 [00:07<00:06,  5.13it/s] 32%|███▏      | 16/50 [00:07<00:06,  5.21it/s] 34%|███▍      | 17/50 [00:07<00:06,  5.26it/s] 36%|███▌      | 18/50 [00:07<00:06,  5.30it/s] 38%|███▊      | 19/50 [00:07<00:05,  5.31it/s] 40%|████      | 20/50 [00:08<00:05,  5.33it/s] 42%|████▏     | 21/50 [00:08<00:05,  5.34it/s] 44%|████▍     | 22/50 [00:08<00:05,  5.35it/s] 46%|████▌     | 23/50 [00:08<00:05,  5.36it/s] 48%|████▊     | 24/50 [00:08<00:04,  5.36it/s] 50%|█████     | 25/50 [00:09<00:04,  5.36it/s] 52%|█████▏    | 26/50 [00:09<00:04,  5.35it/s] 54%|█████▍    | 27/50 [00:09<00:04,  5.37it/s] 56%|█████▌    | 28/50 [00:09<00:04,  5.36it/s] 58%|█████▊    | 29/50 [00:09<00:03,  5.38it/s] 60%|██████    | 30/50 [00:09<00:03,  5.38it/s] 62%|██████▏   | 31/50 [00:10<00:03,  5.38it/s] 64%|██████▍   | 32/50 [00:10<00:03,  5.39it/s] 66%|██████▌   | 33/50 [00:10<00:03,  5.38it/s] 68%|██████▊   | 34/50 [00:10<00:02,  5.38it/s] 70%|███████   | 35/50 [00:10<00:02,  5.37it/s] 72%|███████▏  | 36/50 [00:11<00:02,  5.37it/s] 74%|███████▍  | 37/50 [00:11<00:02,  5.38it/s] 76%|███████▌  | 38/50 [00:11<00:02,  5.37it/s] 78%|███████▊  | 39/50 [00:11<00:02,  5.37it/s] 80%|████████  | 40/50 [00:11<00:01,  5.38it/s] 82%|████████▏ | 41/50 [00:12<00:01,  5.37it/s] 84%|████████▍ | 42/50 [00:12<00:01,  5.38it/s] 86%|████████▌ | 43/50 [00:12<00:01,  5.37it/s] 88%|████████▊ | 44/50 [00:12<00:01,  5.36it/s] 90%|█████████ | 45/50 [00:12<00:00,  5.38it/s] 92%|█████████▏| 46/50 [00:12<00:00,  5.38it/s] 94%|█████████▍| 47/50 [00:13<00:00,  5.39it/s] 96%|█████████▌| 48/50 [00:13<00:00,  5.39it/s] 98%|█████████▊| 49/50 [00:13<00:00,  5.37it/s]100%|██████████| 50/50 [00:18<00:00,  1.57s/it]100%|██████████| 50/50 [00:18<00:00,  2.73it/s]
[I 2023-12-10 23:36:06,363] Trial 274 finished with value: 0.41725625539257977 and parameters: {'EMBEDDING_DIM': 916, 'HIDDEN_DIM': 278, 'NUM_LAYERS': 1, 'DROPOUT': 0.33720552500301193, 'LR': 0.002583603535571275, 'WEIGHT_0': 0.4194948959795182, 'WEIGHT_1': 0.664361920259601, 'WEIGHT_2': 0.6570487776377407, 'WEIGHT_3': 0.5490330508946287, 'WEIGHT_4': 0.8671744122543652, 'WEIGHT_5': 0.6044289069739778, 'WEIGHT_6': 0.8149388358075959, 'WEIGHT_7': 0.5003969126602662, 'WEIGHT_8': 0.6020872857086704, 'optimizer': 'RMSprop'}. Best is trial 221 with value: 0.418736930154747.
/userhome/cs2/dingruiw/conda/envs/py310/lib/python3.10/site-packages/torch/nn/modules/rnn.py:82: UserWarning: dropout option adds dropout after all but last recurrent layer, so non-zero dropout expects num_layers greater than 1, but got dropout=0.33654272486774844 and num_layers=1
  warnings.warn("dropout option adds dropout after all but last "
{'EMBEDDING_DIM': 916, 'HIDDEN_DIM': 278, 'NUM_LAYERS': 1, 'DROPOUT': 0.33720552500301193, 'LR': 0.002583603535571275, 'WEIGHT_0': 0.4194948959795182, 'WEIGHT_1': 0.664361920259601, 'WEIGHT_2': 0.6570487776377407, 'WEIGHT_3': 0.5490330508946287, 'WEIGHT_4': 0.8671744122543652, 'WEIGHT_5': 0.6044289069739778, 'WEIGHT_6': 0.8149388358075959, 'WEIGHT_7': 0.5003969126602662, 'WEIGHT_8': 0.6020872857086704, 'optimizer': 'RMSprop'}
0
              precision    recall  f1-score   support

         LOC       0.57      0.09      0.15      1837
        MISC       0.05      0.01      0.02       922
         ORG       0.15      0.07      0.10      1341
         PER       0.03      0.00      0.01      1842

   micro avg       0.20      0.05      0.08      5942
   macro avg       0.20      0.04      0.07      5942
weighted avg       0.23      0.05      0.07      5942

{'EMBEDDING_DIM': 916, 'HIDDEN_DIM': 278, 'NUM_LAYERS': 1, 'DROPOUT': 0.33720552500301193, 'LR': 0.002583603535571275, 'WEIGHT_0': 0.4194948959795182, 'WEIGHT_1': 0.664361920259601, 'WEIGHT_2': 0.6570487776377407, 'WEIGHT_3': 0.5490330508946287, 'WEIGHT_4': 0.8671744122543652, 'WEIGHT_5': 0.6044289069739778, 'WEIGHT_6': 0.8149388358075959, 'WEIGHT_7': 0.5003969126602662, 'WEIGHT_8': 0.6020872857086704, 'optimizer': 'RMSprop'}
49
              precision    recall  f1-score   support

         LOC       0.60      0.53      0.56      1837
        MISC       0.45      0.45      0.45       922
         ORG       0.31      0.28      0.30      1341
         PER       0.35      0.35      0.35      1842

   micro avg       0.43      0.41      0.42      5942
   macro avg       0.43      0.40      0.41      5942
weighted avg       0.43      0.41      0.42      5942

epoch 49
LSTM
  0%|          | 0/50 [00:00<?, ?it/s]  2%|▏         | 1/50 [00:04<03:45,  4.61s/it]  6%|▌         | 3/50 [00:04<01:00,  1.29s/it]  8%|▊         | 4/50 [00:05<00:41,  1.12it/s] 10%|█         | 5/50 [00:05<00:29,  1.54it/s] 12%|█▏        | 6/50 [00:05<00:21,  2.04it/s] 14%|█▍        | 7/50 [00:05<00:16,  2.61it/s] 16%|█▌        | 8/50 [00:05<00:13,  3.21it/s] 18%|█▊        | 9/50 [00:05<00:10,  3.80it/s] 20%|██        | 10/50 [00:05<00:09,  4.36it/s] 22%|██▏       | 11/50 [00:06<00:08,  4.85it/s] 24%|██▍       | 12/50 [00:06<00:07,  5.26it/s] 26%|██▌       | 13/50 [00:06<00:06,  5.59it/s] 28%|██▊       | 14/50 [00:06<00:06,  5.83it/s] 30%|███       | 15/50 [00:06<00:05,  6.02it/s] 32%|███▏      | 16/50 [00:06<00:05,  6.17it/s] 34%|███▍      | 17/50 [00:06<00:05,  6.28it/s] 36%|███▌      | 18/50 [00:07<00:05,  6.34it/s] 38%|███▊      | 19/50 [00:07<00:04,  6.40it/s] 40%|████      | 20/50 [00:07<00:04,  6.45it/s] 42%|████▏     | 21/50 [00:07<00:04,  6.47it/s] 44%|████▍     | 22/50 [00:07<00:04,  6.49it/s] 46%|████▌     | 23/50 [00:07<00:04,  6.50it/s] 48%|████▊     | 24/50 [00:08<00:03,  6.50it/s] 50%|█████     | 25/50 [00:08<00:03,  6.51it/s] 52%|█████▏    | 26/50 [00:08<00:03,  6.52it/s] 54%|█████▍    | 27/50 [00:08<00:03,  6.53it/s] 56%|█████▌    | 28/50 [00:08<00:03,  6.53it/s] 58%|█████▊    | 29/50 [00:08<00:03,  6.54it/s] 60%|██████    | 30/50 [00:08<00:03,  6.53it/s] 62%|██████▏   | 31/50 [00:09<00:02,  6.54it/s] 64%|██████▍   | 32/50 [00:09<00:02,  6.53it/s] 66%|██████▌   | 33/50 [00:09<00:02,  6.53it/s] 68%|██████▊   | 34/50 [00:09<00:02,  6.52it/s] 70%|███████   | 35/50 [00:09<00:02,  6.51it/s] 72%|███████▏  | 36/50 [00:09<00:02,  6.52it/s] 74%|███████▍  | 37/50 [00:10<00:01,  6.51it/s] 76%|███████▌  | 38/50 [00:10<00:01,  6.52it/s] 78%|███████▊  | 39/50 [00:10<00:01,  6.52it/s] 80%|████████  | 40/50 [00:10<00:01,  6.52it/s] 82%|████████▏ | 41/50 [00:10<00:01,  6.51it/s] 84%|████████▍ | 42/50 [00:10<00:01,  6.52it/s] 86%|████████▌ | 43/50 [00:10<00:01,  6.52it/s] 88%|████████▊ | 44/50 [00:11<00:00,  6.52it/s] 90%|█████████ | 45/50 [00:11<00:00,  6.53it/s] 92%|█████████▏| 46/50 [00:11<00:00,  6.53it/s] 94%|█████████▍| 47/50 [00:11<00:00,  6.53it/s] 96%|█████████▌| 48/50 [00:11<00:00,  6.52it/s] 98%|█████████▊| 49/50 [00:11<00:00,  6.52it/s]100%|██████████| 50/50 [00:16<00:00,  1.56s/it]100%|██████████| 50/50 [00:16<00:00,  2.99it/s]
[I 2023-12-10 23:36:27,297] Trial 275 finished with value: 0.38943627846874496 and parameters: {'EMBEDDING_DIM': 641, 'HIDDEN_DIM': 276, 'NUM_LAYERS': 1, 'DROPOUT': 0.33654272486774844, 'LR': 0.0025108125295574763, 'WEIGHT_0': 0.42442618740160887, 'WEIGHT_1': 0.6139137604710384, 'WEIGHT_2': 0.674830400072928, 'WEIGHT_3': 0.6487085135859703, 'WEIGHT_4': 0.8435475751063632, 'WEIGHT_5': 0.5793239583859325, 'WEIGHT_6': 0.8080533775940337, 'WEIGHT_7': 0.5131658516038139, 'WEIGHT_8': 0.6435188914514269, 'optimizer': 'RMSprop'}. Best is trial 221 with value: 0.418736930154747.
/userhome/cs2/dingruiw/conda/envs/py310/lib/python3.10/site-packages/torch/nn/modules/rnn.py:82: UserWarning: dropout option adds dropout after all but last recurrent layer, so non-zero dropout expects num_layers greater than 1, but got dropout=0.33059895765174974 and num_layers=1
  warnings.warn("dropout option adds dropout after all but last "
{'EMBEDDING_DIM': 641, 'HIDDEN_DIM': 276, 'NUM_LAYERS': 1, 'DROPOUT': 0.33654272486774844, 'LR': 0.0025108125295574763, 'WEIGHT_0': 0.42442618740160887, 'WEIGHT_1': 0.6139137604710384, 'WEIGHT_2': 0.674830400072928, 'WEIGHT_3': 0.6487085135859703, 'WEIGHT_4': 0.8435475751063632, 'WEIGHT_5': 0.5793239583859325, 'WEIGHT_6': 0.8080533775940337, 'WEIGHT_7': 0.5131658516038139, 'WEIGHT_8': 0.6435188914514269, 'optimizer': 'RMSprop'}
0
              precision    recall  f1-score   support

         LOC       0.24      0.14      0.18      1837
        MISC       0.06      0.02      0.03       922
         ORG       0.09      0.04      0.05      1341
         PER       0.04      0.02      0.03      1842

   micro avg       0.12      0.06      0.08      5942
   macro avg       0.11      0.06      0.07      5942
weighted avg       0.12      0.06      0.08      5942

{'EMBEDDING_DIM': 641, 'HIDDEN_DIM': 276, 'NUM_LAYERS': 1, 'DROPOUT': 0.33654272486774844, 'LR': 0.0025108125295574763, 'WEIGHT_0': 0.42442618740160887, 'WEIGHT_1': 0.6139137604710384, 'WEIGHT_2': 0.674830400072928, 'WEIGHT_3': 0.6487085135859703, 'WEIGHT_4': 0.8435475751063632, 'WEIGHT_5': 0.5793239583859325, 'WEIGHT_6': 0.8080533775940337, 'WEIGHT_7': 0.5131658516038139, 'WEIGHT_8': 0.6435188914514269, 'optimizer': 'RMSprop'}
49
              precision    recall  f1-score   support

         LOC       0.53      0.55      0.54      1837
        MISC       0.36      0.42      0.39       922
         ORG       0.25      0.26      0.26      1341
         PER       0.32      0.36      0.34      1842

   micro avg       0.37      0.41      0.39      5942
   macro avg       0.37      0.40      0.38      5942
weighted avg       0.38      0.41      0.39      5942

epoch 49
LSTM
  0%|          | 0/50 [00:00<?, ?it/s]  2%|▏         | 1/50 [00:04<03:23,  4.15s/it]  6%|▌         | 3/50 [00:04<00:54,  1.17s/it]  8%|▊         | 4/50 [00:04<00:37,  1.22it/s] 10%|█         | 5/50 [00:04<00:27,  1.66it/s] 12%|█▏        | 6/50 [00:04<00:20,  2.18it/s] 14%|█▍        | 7/50 [00:05<00:15,  2.74it/s] 16%|█▌        | 8/50 [00:05<00:12,  3.32it/s] 18%|█▊        | 9/50 [00:05<00:10,  3.89it/s] 20%|██        | 10/50 [00:05<00:09,  4.40it/s] 22%|██▏       | 11/50 [00:05<00:08,  4.84it/s] 24%|██▍       | 12/50 [00:05<00:07,  5.20it/s] 26%|██▌       | 13/50 [00:05<00:06,  5.49it/s] 28%|██▊       | 14/50 [00:06<00:06,  5.71it/s] 30%|███       | 15/50 [00:06<00:05,  5.88it/s] 32%|███▏      | 16/50 [00:06<00:05,  5.99it/s] 34%|███▍      | 17/50 [00:06<00:05,  6.07it/s] 36%|███▌      | 18/50 [00:06<00:05,  6.14it/s] 38%|███▊      | 19/50 [00:06<00:05,  6.18it/s] 40%|████      | 20/50 [00:07<00:04,  6.21it/s] 42%|████▏     | 21/50 [00:07<00:04,  6.24it/s] 44%|████▍     | 22/50 [00:07<00:04,  6.25it/s] 46%|████▌     | 23/50 [00:07<00:04,  6.26it/s] 48%|████▊     | 24/50 [00:07<00:04,  6.27it/s] 50%|█████     | 25/50 [00:07<00:03,  6.27it/s] 52%|█████▏    | 26/50 [00:08<00:03,  6.28it/s] 54%|█████▍    | 27/50 [00:08<00:03,  6.28it/s] 56%|█████▌    | 28/50 [00:08<00:03,  6.28it/s] 58%|█████▊    | 29/50 [00:08<00:03,  6.28it/s] 60%|██████    | 30/50 [00:08<00:03,  6.28it/s] 62%|██████▏   | 31/50 [00:08<00:03,  6.29it/s] 64%|██████▍   | 32/50 [00:09<00:02,  6.29it/s] 66%|██████▌   | 33/50 [00:09<00:02,  6.29it/s] 68%|██████▊   | 34/50 [00:09<00:02,  6.29it/s] 70%|███████   | 35/50 [00:09<00:02,  6.29it/s] 72%|███████▏  | 36/50 [00:09<00:02,  6.28it/s] 74%|███████▍  | 37/50 [00:09<00:02,  6.27it/s] 76%|███████▌  | 38/50 [00:09<00:01,  6.28it/s] 78%|███████▊  | 39/50 [00:10<00:01,  6.28it/s] 80%|████████  | 40/50 [00:10<00:01,  6.28it/s] 82%|████████▏ | 41/50 [00:10<00:01,  6.28it/s] 84%|████████▍ | 42/50 [00:10<00:01,  6.29it/s] 86%|████████▌ | 43/50 [00:10<00:01,  6.28it/s] 88%|████████▊ | 44/50 [00:10<00:00,  6.28it/s] 90%|█████████ | 45/50 [00:11<00:00,  6.29it/s] 92%|█████████▏| 46/50 [00:11<00:00,  6.29it/s] 94%|█████████▍| 47/50 [00:11<00:00,  6.28it/s] 96%|█████████▌| 48/50 [00:11<00:00,  6.28it/s] 98%|█████████▊| 49/50 [00:11<00:00,  6.28it/s]100%|██████████| 50/50 [00:16<00:00,  1.40s/it]100%|██████████| 50/50 [00:16<00:00,  3.12it/s]
[I 2023-12-10 23:36:47,016] Trial 276 finished with value: 0.4067474048442906 and parameters: {'EMBEDDING_DIM': 922, 'HIDDEN_DIM': 130, 'NUM_LAYERS': 1, 'DROPOUT': 0.33059895765174974, 'LR': 0.0029448054569701206, 'WEIGHT_0': 0.3957928504651696, 'WEIGHT_1': 0.6559380209551477, 'WEIGHT_2': 0.6551993775776516, 'WEIGHT_3': 0.6395009901905743, 'WEIGHT_4': 0.8711514442709596, 'WEIGHT_5': 0.8033861423262466, 'WEIGHT_6': 0.8311187696655741, 'WEIGHT_7': 0.4968145848264975, 'WEIGHT_8': 0.5908249828530369, 'optimizer': 'RMSprop'}. Best is trial 221 with value: 0.418736930154747.
/userhome/cs2/dingruiw/conda/envs/py310/lib/python3.10/site-packages/torch/nn/modules/rnn.py:82: UserWarning: dropout option adds dropout after all but last recurrent layer, so non-zero dropout expects num_layers greater than 1, but got dropout=0.06338143822841574 and num_layers=1
  warnings.warn("dropout option adds dropout after all but last "
{'EMBEDDING_DIM': 922, 'HIDDEN_DIM': 130, 'NUM_LAYERS': 1, 'DROPOUT': 0.33059895765174974, 'LR': 0.0029448054569701206, 'WEIGHT_0': 0.3957928504651696, 'WEIGHT_1': 0.6559380209551477, 'WEIGHT_2': 0.6551993775776516, 'WEIGHT_3': 0.6395009901905743, 'WEIGHT_4': 0.8711514442709596, 'WEIGHT_5': 0.8033861423262466, 'WEIGHT_6': 0.8311187696655741, 'WEIGHT_7': 0.4968145848264975, 'WEIGHT_8': 0.5908249828530369, 'optimizer': 'RMSprop'}
0
              precision    recall  f1-score   support

         LOC       0.52      0.16      0.25      1837
        MISC       0.08      0.04      0.05       922
         ORG       0.12      0.02      0.03      1341
         PER       0.11      0.04      0.06      1842

   micro avg       0.22      0.07      0.11      5942
   macro avg       0.21      0.07      0.10      5942
weighted avg       0.23      0.07      0.11      5942

{'EMBEDDING_DIM': 922, 'HIDDEN_DIM': 130, 'NUM_LAYERS': 1, 'DROPOUT': 0.33059895765174974, 'LR': 0.0029448054569701206, 'WEIGHT_0': 0.3957928504651696, 'WEIGHT_1': 0.6559380209551477, 'WEIGHT_2': 0.6551993775776516, 'WEIGHT_3': 0.6395009901905743, 'WEIGHT_4': 0.8711514442709596, 'WEIGHT_5': 0.8033861423262466, 'WEIGHT_6': 0.8311187696655741, 'WEIGHT_7': 0.4968145848264975, 'WEIGHT_8': 0.5908249828530369, 'optimizer': 'RMSprop'}
49
              precision    recall  f1-score   support

         LOC       0.59      0.54      0.56      1837
        MISC       0.44      0.46      0.45       922
         ORG       0.28      0.25      0.27      1341
         PER       0.34      0.33      0.33      1842

   micro avg       0.42      0.40      0.41      5942
   macro avg       0.41      0.39      0.40      5942
weighted avg       0.42      0.40      0.41      5942

epoch 49
LSTM
  0%|          | 0/50 [00:00<?, ?it/s]  2%|▏         | 1/50 [00:04<03:48,  4.66s/it]  6%|▌         | 3/50 [00:04<01:00,  1.30s/it]  8%|▊         | 4/50 [00:05<00:41,  1.11it/s] 10%|█         | 5/50 [00:05<00:29,  1.53it/s] 12%|█▏        | 6/50 [00:05<00:21,  2.05it/s] 14%|█▍        | 7/50 [00:05<00:16,  2.63it/s] 16%|█▌        | 8/50 [00:05<00:12,  3.26it/s] 18%|█▊        | 9/50 [00:05<00:10,  3.90it/s] 20%|██        | 10/50 [00:05<00:08,  4.49it/s] 22%|██▏       | 11/50 [00:06<00:07,  5.04it/s] 24%|██▍       | 12/50 [00:06<00:06,  5.50it/s] 26%|██▌       | 13/50 [00:06<00:06,  5.86it/s] 28%|██▊       | 14/50 [00:06<00:05,  6.17it/s] 30%|███       | 15/50 [00:06<00:05,  6.39it/s] 32%|███▏      | 16/50 [00:06<00:05,  6.55it/s] 34%|███▍      | 17/50 [00:06<00:04,  6.68it/s] 36%|███▌      | 18/50 [00:07<00:04,  6.76it/s] 38%|███▊      | 19/50 [00:07<00:04,  6.81it/s] 40%|████      | 20/50 [00:07<00:04,  6.85it/s] 42%|████▏     | 21/50 [00:07<00:04,  6.89it/s] 44%|████▍     | 22/50 [00:07<00:04,  6.91it/s] 46%|████▌     | 23/50 [00:07<00:03,  6.93it/s] 48%|████▊     | 24/50 [00:07<00:03,  6.94it/s] 50%|█████     | 25/50 [00:08<00:03,  6.94it/s] 52%|█████▏    | 26/50 [00:08<00:03,  6.95it/s] 54%|█████▍    | 27/50 [00:08<00:03,  6.95it/s] 56%|█████▌    | 28/50 [00:08<00:03,  6.95it/s] 58%|█████▊    | 29/50 [00:08<00:03,  6.95it/s] 60%|██████    | 30/50 [00:08<00:02,  6.95it/s] 62%|██████▏   | 31/50 [00:08<00:02,  6.94it/s] 64%|██████▍   | 32/50 [00:09<00:02,  6.96it/s] 66%|██████▌   | 33/50 [00:09<00:02,  6.97it/s] 68%|██████▊   | 34/50 [00:09<00:02,  6.97it/s] 70%|███████   | 35/50 [00:09<00:02,  6.96it/s] 72%|███████▏  | 36/50 [00:09<00:02,  6.96it/s] 74%|███████▍  | 37/50 [00:09<00:01,  6.96it/s] 76%|███████▌  | 38/50 [00:09<00:01,  6.97it/s] 78%|███████▊  | 39/50 [00:10<00:01,  6.96it/s] 80%|████████  | 40/50 [00:10<00:01,  6.95it/s] 82%|████████▏ | 41/50 [00:10<00:01,  6.96it/s] 84%|████████▍ | 42/50 [00:10<00:01,  6.95it/s] 86%|████████▌ | 43/50 [00:10<00:01,  6.95it/s] 88%|████████▊ | 44/50 [00:10<00:00,  6.95it/s] 90%|█████████ | 45/50 [00:10<00:00,  6.95it/s] 92%|█████████▏| 46/50 [00:11<00:00,  6.95it/s] 94%|█████████▍| 47/50 [00:11<00:00,  6.95it/s] 96%|█████████▌| 48/50 [00:11<00:00,  6.94it/s] 98%|█████████▊| 49/50 [00:11<00:00,  6.95it/s]100%|██████████| 50/50 [00:16<00:00,  1.53s/it]100%|██████████| 50/50 [00:16<00:00,  3.07it/s]
