[I 2023-12-10 22:25:39,618] Trial 125 finished with value: 0.3965123169389656 and parameters: {'EMBEDDING_DIM': 1014, 'HIDDEN_DIM': 111, 'NUM_LAYERS': 1, 'DROPOUT': 0.2677026557179828, 'LR': 0.0017338299159889853, 'WEIGHT_0': 0.40895564840235415, 'WEIGHT_1': 0.4863171538831181, 'WEIGHT_2': 0.6646191246202374, 'WEIGHT_3': 0.9588334810801494, 'WEIGHT_4': 0.998972168375187, 'WEIGHT_5': 0.48894791985066616, 'WEIGHT_6': 0.6950246506732264, 'WEIGHT_7': 0.45340302011494227, 'WEIGHT_8': 0.4793524606604651, 'optimizer': 'RMSprop'}. Best is trial 123 with value: 0.4154373927958834.
/userhome/cs2/dingruiw/conda/envs/py310/lib/python3.10/site-packages/torch/nn/modules/rnn.py:82: UserWarning: dropout option adds dropout after all but last recurrent layer, so non-zero dropout expects num_layers greater than 1, but got dropout=0.3210977592798208 and num_layers=1
  warnings.warn("dropout option adds dropout after all but last "
{'EMBEDDING_DIM': 1014, 'HIDDEN_DIM': 111, 'NUM_LAYERS': 1, 'DROPOUT': 0.2677026557179828, 'LR': 0.0017338299159889853, 'WEIGHT_0': 0.40895564840235415, 'WEIGHT_1': 0.4863171538831181, 'WEIGHT_2': 0.6646191246202374, 'WEIGHT_3': 0.9588334810801494, 'WEIGHT_4': 0.998972168375187, 'WEIGHT_5': 0.48894791985066616, 'WEIGHT_6': 0.6950246506732264, 'WEIGHT_7': 0.45340302011494227, 'WEIGHT_8': 0.4793524606604651, 'optimizer': 'RMSprop'}
0
              precision    recall  f1-score   support

         LOC       0.17      0.08      0.11      1837
        MISC       0.10      0.05      0.07       922
         ORG       0.10      0.02      0.03      1341
         PER       0.08      0.02      0.04      1842

   micro avg       0.12      0.04      0.06      5942
   macro avg       0.11      0.04      0.06      5942
weighted avg       0.12      0.04      0.06      5942

{'EMBEDDING_DIM': 1014, 'HIDDEN_DIM': 111, 'NUM_LAYERS': 1, 'DROPOUT': 0.2677026557179828, 'LR': 0.0017338299159889853, 'WEIGHT_0': 0.40895564840235415, 'WEIGHT_1': 0.4863171538831181, 'WEIGHT_2': 0.6646191246202374, 'WEIGHT_3': 0.9588334810801494, 'WEIGHT_4': 0.998972168375187, 'WEIGHT_5': 0.48894791985066616, 'WEIGHT_6': 0.6950246506732264, 'WEIGHT_7': 0.45340302011494227, 'WEIGHT_8': 0.4793524606604651, 'optimizer': 'RMSprop'}
49
              precision    recall  f1-score   support

         LOC       0.54      0.52      0.53      1837
        MISC       0.41      0.48      0.44       922
         ORG       0.29      0.24      0.26      1341
         PER       0.33      0.34      0.33      1842

   micro avg       0.40      0.39      0.40      5942
   macro avg       0.39      0.39      0.39      5942
weighted avg       0.40      0.39      0.39      5942

epoch 49
LSTM
  0%|          | 0/50 [00:00<?, ?it/s]  2%|▏         | 1/50 [00:04<03:51,  4.72s/it]  4%|▍         | 2/50 [00:04<01:36,  2.01s/it]  6%|▌         | 3/50 [00:05<00:56,  1.20s/it]  8%|▊         | 4/50 [00:05<00:37,  1.24it/s] 10%|█         | 5/50 [00:05<00:26,  1.69it/s] 12%|█▏        | 6/50 [00:05<00:20,  2.17it/s] 14%|█▍        | 7/50 [00:05<00:16,  2.64it/s] 16%|█▌        | 8/50 [00:06<00:13,  3.08it/s] 18%|█▊        | 9/50 [00:06<00:11,  3.47it/s] 20%|██        | 10/50 [00:06<00:10,  3.79it/s] 22%|██▏       | 11/50 [00:06<00:09,  4.05it/s] 24%|██▍       | 12/50 [00:06<00:08,  4.25it/s] 26%|██▌       | 13/50 [00:07<00:08,  4.39it/s] 28%|██▊       | 14/50 [00:07<00:07,  4.50it/s] 30%|███       | 15/50 [00:07<00:07,  4.59it/s] 32%|███▏      | 16/50 [00:07<00:07,  4.65it/s] 34%|███▍      | 17/50 [00:07<00:07,  4.69it/s] 36%|███▌      | 18/50 [00:08<00:06,  4.72it/s] 38%|███▊      | 19/50 [00:08<00:06,  4.74it/s] 40%|████      | 20/50 [00:08<00:06,  4.75it/s] 42%|████▏     | 21/50 [00:08<00:06,  4.77it/s] 44%|████▍     | 22/50 [00:09<00:05,  4.77it/s] 46%|████▌     | 23/50 [00:09<00:05,  4.78it/s] 48%|████▊     | 24/50 [00:09<00:05,  4.78it/s] 50%|█████     | 25/50 [00:09<00:05,  4.78it/s] 52%|█████▏    | 26/50 [00:09<00:05,  4.78it/s] 54%|█████▍    | 27/50 [00:10<00:04,  4.78it/s] 56%|█████▌    | 28/50 [00:10<00:04,  4.78it/s] 58%|█████▊    | 29/50 [00:10<00:04,  4.79it/s] 60%|██████    | 30/50 [00:10<00:04,  4.78it/s] 62%|██████▏   | 31/50 [00:10<00:03,  4.78it/s] 64%|██████▍   | 32/50 [00:11<00:03,  4.78it/s] 66%|██████▌   | 33/50 [00:11<00:03,  4.77it/s] 68%|██████▊   | 34/50 [00:11<00:03,  4.78it/s] 70%|███████   | 35/50 [00:11<00:03,  4.78it/s] 72%|███████▏  | 36/50 [00:11<00:02,  4.78it/s] 74%|███████▍  | 37/50 [00:12<00:02,  4.78it/s] 76%|███████▌  | 38/50 [00:12<00:02,  4.78it/s] 78%|███████▊  | 39/50 [00:12<00:02,  4.78it/s] 80%|████████  | 40/50 [00:12<00:02,  4.77it/s] 82%|████████▏ | 41/50 [00:13<00:01,  4.78it/s] 84%|████████▍ | 42/50 [00:13<00:01,  4.77it/s] 86%|████████▌ | 43/50 [00:13<00:01,  4.77it/s] 88%|████████▊ | 44/50 [00:13<00:01,  4.78it/s] 90%|█████████ | 45/50 [00:13<00:01,  4.77it/s] 92%|█████████▏| 46/50 [00:14<00:00,  4.77it/s] 94%|█████████▍| 47/50 [00:14<00:00,  4.78it/s] 96%|█████████▌| 48/50 [00:14<00:00,  4.77it/s] 98%|█████████▊| 49/50 [00:14<00:00,  4.77it/s]100%|██████████| 50/50 [00:19<00:00,  1.64s/it]100%|██████████| 50/50 [00:19<00:00,  2.54it/s]
[I 2023-12-10 22:26:03,526] Trial 126 finished with value: 0.3897838243886153 and parameters: {'EMBEDDING_DIM': 1019, 'HIDDEN_DIM': 308, 'NUM_LAYERS': 1, 'DROPOUT': 0.3210977592798208, 'LR': 0.00147820761636961, 'WEIGHT_0': 0.26075179640667545, 'WEIGHT_1': 0.7954381011545851, 'WEIGHT_2': 0.7066475574714686, 'WEIGHT_3': 0.9430491711051431, 'WEIGHT_4': 0.9772865586695112, 'WEIGHT_5': 0.45618799861604203, 'WEIGHT_6': 0.7719065232160494, 'WEIGHT_7': 0.42321658304029786, 'WEIGHT_8': 0.432623292921503, 'optimizer': 'RMSprop'}. Best is trial 123 with value: 0.4154373927958834.
/userhome/cs2/dingruiw/conda/envs/py310/lib/python3.10/site-packages/torch/nn/modules/rnn.py:82: UserWarning: dropout option adds dropout after all but last recurrent layer, so non-zero dropout expects num_layers greater than 1, but got dropout=0.3034337594889078 and num_layers=1
  warnings.warn("dropout option adds dropout after all but last "
{'EMBEDDING_DIM': 1019, 'HIDDEN_DIM': 308, 'NUM_LAYERS': 1, 'DROPOUT': 0.3210977592798208, 'LR': 0.00147820761636961, 'WEIGHT_0': 0.26075179640667545, 'WEIGHT_1': 0.7954381011545851, 'WEIGHT_2': 0.7066475574714686, 'WEIGHT_3': 0.9430491711051431, 'WEIGHT_4': 0.9772865586695112, 'WEIGHT_5': 0.45618799861604203, 'WEIGHT_6': 0.7719065232160494, 'WEIGHT_7': 0.42321658304029786, 'WEIGHT_8': 0.432623292921503, 'optimizer': 'RMSprop'}
0
              precision    recall  f1-score   support

         LOC       0.38      0.05      0.08      1837
        MISC       0.06      0.05      0.06       922
         ORG       0.15      0.03      0.05      1341
         PER       0.09      0.05      0.06      1842

   micro avg       0.12      0.04      0.06      5942
   macro avg       0.17      0.04      0.06      5942
weighted avg       0.19      0.04      0.06      5942

{'EMBEDDING_DIM': 1019, 'HIDDEN_DIM': 308, 'NUM_LAYERS': 1, 'DROPOUT': 0.3210977592798208, 'LR': 0.00147820761636961, 'WEIGHT_0': 0.26075179640667545, 'WEIGHT_1': 0.7954381011545851, 'WEIGHT_2': 0.7066475574714686, 'WEIGHT_3': 0.9430491711051431, 'WEIGHT_4': 0.9772865586695112, 'WEIGHT_5': 0.45618799861604203, 'WEIGHT_6': 0.7719065232160494, 'WEIGHT_7': 0.42321658304029786, 'WEIGHT_8': 0.432623292921503, 'optimizer': 'RMSprop'}
49
              precision    recall  f1-score   support

         LOC       0.56      0.49      0.52      1837
        MISC       0.42      0.47      0.44       922
         ORG       0.26      0.26      0.26      1341
         PER       0.32      0.35      0.33      1842

   micro avg       0.39      0.39      0.39      5942
   macro avg       0.39      0.39      0.39      5942
weighted avg       0.39      0.39      0.39      5942

epoch 49
LSTM
  0%|          | 0/50 [00:00<?, ?it/s]  2%|▏         | 1/50 [00:04<03:24,  4.17s/it]  4%|▍         | 2/50 [00:04<01:26,  1.80s/it]  6%|▌         | 3/50 [00:04<00:51,  1.10s/it]  8%|▊         | 4/50 [00:04<00:35,  1.31it/s] 10%|█         | 5/50 [00:05<00:26,  1.73it/s] 12%|█▏        | 6/50 [00:05<00:20,  2.13it/s] 14%|█▍        | 7/50 [00:05<00:17,  2.51it/s] 16%|█▌        | 8/50 [00:05<00:14,  2.84it/s] 18%|█▊        | 9/50 [00:06<00:13,  3.11it/s] 20%|██        | 10/50 [00:06<00:12,  3.33it/s] 22%|██▏       | 11/50 [00:06<00:11,  3.50it/s] 24%|██▍       | 12/50 [00:06<00:10,  3.62it/s] 26%|██▌       | 13/50 [00:07<00:09,  3.71it/s] 28%|██▊       | 14/50 [00:07<00:09,  3.78it/s] 30%|███       | 15/50 [00:07<00:09,  3.82it/s] 32%|███▏      | 16/50 [00:07<00:08,  3.86it/s] 34%|███▍      | 17/50 [00:08<00:08,  3.89it/s] 36%|███▌      | 18/50 [00:08<00:08,  3.90it/s] 38%|███▊      | 19/50 [00:08<00:07,  3.91it/s] 40%|████      | 20/50 [00:08<00:07,  3.92it/s] 42%|████▏     | 21/50 [00:09<00:07,  3.93it/s] 44%|████▍     | 22/50 [00:09<00:07,  3.93it/s] 46%|████▌     | 23/50 [00:09<00:06,  3.93it/s] 48%|████▊     | 24/50 [00:09<00:06,  3.94it/s] 50%|█████     | 25/50 [00:10<00:06,  3.94it/s] 52%|█████▏    | 26/50 [00:10<00:06,  3.94it/s] 54%|█████▍    | 27/50 [00:10<00:05,  3.94it/s] 56%|█████▌    | 28/50 [00:10<00:05,  3.94it/s] 58%|█████▊    | 29/50 [00:11<00:05,  3.94it/s] 60%|██████    | 30/50 [00:11<00:05,  3.94it/s] 62%|██████▏   | 31/50 [00:11<00:04,  3.94it/s] 64%|██████▍   | 32/50 [00:11<00:04,  3.94it/s] 66%|██████▌   | 33/50 [00:12<00:04,  3.94it/s] 68%|██████▊   | 34/50 [00:12<00:04,  3.94it/s] 70%|███████   | 35/50 [00:12<00:03,  3.94it/s] 72%|███████▏  | 36/50 [00:12<00:03,  3.94it/s] 74%|███████▍  | 37/50 [00:13<00:03,  3.94it/s] 76%|███████▌  | 38/50 [00:13<00:03,  3.94it/s] 78%|███████▊  | 39/50 [00:13<00:02,  3.93it/s] 80%|████████  | 40/50 [00:13<00:02,  3.94it/s] 82%|████████▏ | 41/50 [00:14<00:02,  3.93it/s] 84%|████████▍ | 42/50 [00:14<00:02,  3.94it/s] 86%|████████▌ | 43/50 [00:14<00:01,  3.94it/s] 88%|████████▊ | 44/50 [00:14<00:01,  3.94it/s] 90%|█████████ | 45/50 [00:15<00:01,  3.93it/s] 92%|█████████▏| 46/50 [00:15<00:01,  3.94it/s] 94%|█████████▍| 47/50 [00:15<00:00,  3.94it/s] 96%|█████████▌| 48/50 [00:15<00:00,  3.94it/s] 98%|█████████▊| 49/50 [00:16<00:00,  3.94it/s]100%|██████████| 50/50 [00:20<00:00,  1.48s/it]100%|██████████| 50/50 [00:20<00:00,  2.43it/s]
[I 2023-12-10 22:26:27,786] Trial 127 finished with value: 0.4086244070720138 and parameters: {'EMBEDDING_DIM': 985, 'HIDDEN_DIM': 187, 'NUM_LAYERS': 1, 'DROPOUT': 0.3034337594889078, 'LR': 0.0023218698713882782, 'WEIGHT_0': 0.5072928117049573, 'WEIGHT_1': 0.45060758623990704, 'WEIGHT_2': 0.6882080347306864, 'WEIGHT_3': 0.9769919348514454, 'WEIGHT_4': 0.9407955337828225, 'WEIGHT_5': 0.4806244323126525, 'WEIGHT_6': 0.8128559780038356, 'WEIGHT_7': 0.4767273739566046, 'WEIGHT_8': 0.5160920732977297, 'optimizer': 'RMSprop'}. Best is trial 123 with value: 0.4154373927958834.
/userhome/cs2/dingruiw/conda/envs/py310/lib/python3.10/site-packages/torch/nn/modules/rnn.py:82: UserWarning: dropout option adds dropout after all but last recurrent layer, so non-zero dropout expects num_layers greater than 1, but got dropout=0.2892915611115374 and num_layers=1
  warnings.warn("dropout option adds dropout after all but last "
{'EMBEDDING_DIM': 985, 'HIDDEN_DIM': 187, 'NUM_LAYERS': 1, 'DROPOUT': 0.3034337594889078, 'LR': 0.0023218698713882782, 'WEIGHT_0': 0.5072928117049573, 'WEIGHT_1': 0.45060758623990704, 'WEIGHT_2': 0.6882080347306864, 'WEIGHT_3': 0.9769919348514454, 'WEIGHT_4': 0.9407955337828225, 'WEIGHT_5': 0.4806244323126525, 'WEIGHT_6': 0.8128559780038356, 'WEIGHT_7': 0.4767273739566046, 'WEIGHT_8': 0.5160920732977297, 'optimizer': 'RMSprop'}
0
              precision    recall  f1-score   support

         LOC       0.23      0.09      0.13      1837
        MISC       0.08      0.04      0.06       922
         ORG       0.16      0.03      0.04      1341
         PER       0.09      0.02      0.04      1842

   micro avg       0.15      0.05      0.07      5942
   macro avg       0.14      0.05      0.07      5942
weighted avg       0.15      0.05      0.07      5942

{'EMBEDDING_DIM': 985, 'HIDDEN_DIM': 187, 'NUM_LAYERS': 1, 'DROPOUT': 0.3034337594889078, 'LR': 0.0023218698713882782, 'WEIGHT_0': 0.5072928117049573, 'WEIGHT_1': 0.45060758623990704, 'WEIGHT_2': 0.6882080347306864, 'WEIGHT_3': 0.9769919348514454, 'WEIGHT_4': 0.9407955337828225, 'WEIGHT_5': 0.4806244323126525, 'WEIGHT_6': 0.8128559780038356, 'WEIGHT_7': 0.4767273739566046, 'WEIGHT_8': 0.5160920732977297, 'optimizer': 'RMSprop'}
49
              precision    recall  f1-score   support

         LOC       0.60      0.54      0.57      1837
        MISC       0.42      0.46      0.44       922
         ORG       0.32      0.26      0.29      1341
         PER       0.32      0.33      0.32      1842

   micro avg       0.42      0.40      0.41      5942
   macro avg       0.42      0.40      0.40      5942
weighted avg       0.42      0.40      0.41      5942

epoch 49
LSTM
  0%|          | 0/50 [00:00<?, ?it/s]  2%|▏         | 1/50 [00:04<03:47,  4.64s/it]  6%|▌         | 3/50 [00:04<01:00,  1.29s/it]  8%|▊         | 4/50 [00:05<00:41,  1.12it/s] 10%|█         | 5/50 [00:05<00:29,  1.55it/s] 12%|█▏        | 6/50 [00:05<00:21,  2.07it/s] 14%|█▍        | 7/50 [00:05<00:16,  2.66it/s] 16%|█▌        | 8/50 [00:05<00:12,  3.29it/s] 18%|█▊        | 9/50 [00:05<00:10,  3.93it/s] 20%|██        | 10/50 [00:05<00:08,  4.54it/s] 22%|██▏       | 11/50 [00:06<00:07,  5.09it/s] 24%|██▍       | 12/50 [00:06<00:06,  5.54it/s] 26%|██▌       | 13/50 [00:06<00:06,  5.92it/s] 28%|██▊       | 14/50 [00:06<00:05,  6.22it/s] 30%|███       | 15/50 [00:06<00:05,  6.43it/s] 32%|███▏      | 16/50 [00:06<00:05,  6.58it/s] 34%|███▍      | 17/50 [00:06<00:04,  6.71it/s] 36%|███▌      | 18/50 [00:07<00:04,  6.79it/s] 38%|███▊      | 19/50 [00:07<00:04,  6.86it/s] 40%|████      | 20/50 [00:07<00:04,  6.91it/s] 42%|████▏     | 21/50 [00:07<00:04,  6.94it/s] 44%|████▍     | 22/50 [00:07<00:04,  6.97it/s] 46%|████▌     | 23/50 [00:07<00:03,  6.97it/s] 48%|████▊     | 24/50 [00:07<00:03,  6.99it/s] 50%|█████     | 25/50 [00:08<00:03,  7.00it/s] 52%|█████▏    | 26/50 [00:08<00:03,  7.00it/s] 54%|█████▍    | 27/50 [00:08<00:03,  7.00it/s] 56%|█████▌    | 28/50 [00:08<00:03,  7.01it/s] 58%|█████▊    | 29/50 [00:08<00:02,  7.01it/s] 60%|██████    | 30/50 [00:08<00:02,  7.01it/s] 62%|██████▏   | 31/50 [00:08<00:02,  7.02it/s] 64%|██████▍   | 32/50 [00:09<00:02,  7.01it/s] 66%|██████▌   | 33/50 [00:09<00:02,  7.01it/s] 68%|██████▊   | 34/50 [00:09<00:02,  7.01it/s] 70%|███████   | 35/50 [00:09<00:02,  7.00it/s] 72%|███████▏  | 36/50 [00:09<00:01,  7.01it/s] 74%|███████▍  | 37/50 [00:09<00:01,  7.02it/s] 76%|███████▌  | 38/50 [00:09<00:01,  7.00it/s] 78%|███████▊  | 39/50 [00:10<00:01,  7.00it/s] 80%|████████  | 40/50 [00:10<00:01,  7.01it/s] 82%|████████▏ | 41/50 [00:10<00:01,  7.00it/s] 84%|████████▍ | 42/50 [00:10<00:01,  7.00it/s] 86%|████████▌ | 43/50 [00:10<00:00,  7.01it/s] 88%|████████▊ | 44/50 [00:10<00:00,  7.00it/s] 90%|█████████ | 45/50 [00:10<00:00,  7.00it/s] 92%|█████████▏| 46/50 [00:11<00:00,  7.01it/s] 94%|█████████▍| 47/50 [00:11<00:00,  6.99it/s] 96%|█████████▌| 48/50 [00:11<00:00,  7.01it/s] 98%|█████████▊| 49/50 [00:11<00:00,  7.02it/s]100%|██████████| 50/50 [00:16<00:00,  1.53s/it]100%|██████████| 50/50 [00:16<00:00,  3.08it/s]
[I 2023-12-10 22:26:48,223] Trial 128 finished with value: 0.4087355540448675 and parameters: {'EMBEDDING_DIM': 985, 'HIDDEN_DIM': 195, 'NUM_LAYERS': 1, 'DROPOUT': 0.2892915611115374, 'LR': 0.002285630781666104, 'WEIGHT_0': 0.5126863195742155, 'WEIGHT_1': 0.7596996120427447, 'WEIGHT_2': 0.7338197503960153, 'WEIGHT_3': 0.9955373861938265, 'WEIGHT_4': 0.9369100387302383, 'WEIGHT_5': 0.5524507731801067, 'WEIGHT_6': 0.8106055635522763, 'WEIGHT_7': 0.4711591380596341, 'WEIGHT_8': 0.5213905609899876, 'optimizer': 'RMSprop'}. Best is trial 123 with value: 0.4154373927958834.
/userhome/cs2/dingruiw/conda/envs/py310/lib/python3.10/site-packages/torch/nn/modules/rnn.py:82: UserWarning: dropout option adds dropout after all but last recurrent layer, so non-zero dropout expects num_layers greater than 1, but got dropout=0.28248536221847226 and num_layers=1
  warnings.warn("dropout option adds dropout after all but last "
{'EMBEDDING_DIM': 985, 'HIDDEN_DIM': 195, 'NUM_LAYERS': 1, 'DROPOUT': 0.2892915611115374, 'LR': 0.002285630781666104, 'WEIGHT_0': 0.5126863195742155, 'WEIGHT_1': 0.7596996120427447, 'WEIGHT_2': 0.7338197503960153, 'WEIGHT_3': 0.9955373861938265, 'WEIGHT_4': 0.9369100387302383, 'WEIGHT_5': 0.5524507731801067, 'WEIGHT_6': 0.8106055635522763, 'WEIGHT_7': 0.4711591380596341, 'WEIGHT_8': 0.5213905609899876, 'optimizer': 'RMSprop'}
0
              precision    recall  f1-score   support

         LOC       0.40      0.13      0.20      1837
        MISC       0.10      0.02      0.04       922
         ORG       0.13      0.05      0.07      1341
         PER       0.06      0.01      0.02      1842

   micro avg       0.21      0.06      0.09      5942
   macro avg       0.17      0.05      0.08      5942
weighted avg       0.19      0.06      0.09      5942

{'EMBEDDING_DIM': 985, 'HIDDEN_DIM': 195, 'NUM_LAYERS': 1, 'DROPOUT': 0.2892915611115374, 'LR': 0.002285630781666104, 'WEIGHT_0': 0.5126863195742155, 'WEIGHT_1': 0.7596996120427447, 'WEIGHT_2': 0.7338197503960153, 'WEIGHT_3': 0.9955373861938265, 'WEIGHT_4': 0.9369100387302383, 'WEIGHT_5': 0.5524507731801067, 'WEIGHT_6': 0.8106055635522763, 'WEIGHT_7': 0.4711591380596341, 'WEIGHT_8': 0.5213905609899876, 'optimizer': 'RMSprop'}
49
              precision    recall  f1-score   support

         LOC       0.60      0.55      0.57      1837
        MISC       0.44      0.46      0.45       922
         ORG       0.28      0.28      0.28      1341
         PER       0.33      0.33      0.33      1842

   micro avg       0.41      0.40      0.41      5942
   macro avg       0.41      0.40      0.41      5942
weighted avg       0.42      0.40      0.41      5942

epoch 49
LSTM
  0%|          | 0/50 [00:00<?, ?it/s]  2%|▏         | 1/50 [00:04<03:22,  4.14s/it]  4%|▍         | 2/50 [00:04<01:25,  1.79s/it]  6%|▌         | 3/50 [00:04<00:51,  1.09s/it]  8%|▊         | 4/50 [00:04<00:35,  1.31it/s] 10%|█         | 5/50 [00:05<00:26,  1.73it/s] 12%|█▏        | 6/50 [00:05<00:20,  2.13it/s] 14%|█▍        | 7/50 [00:05<00:17,  2.51it/s] 16%|█▌        | 8/50 [00:05<00:14,  2.83it/s] 18%|█▊        | 9/50 [00:06<00:13,  3.10it/s] 20%|██        | 10/50 [00:06<00:12,  3.32it/s] 22%|██▏       | 11/50 [00:06<00:11,  3.48it/s] 24%|██▍       | 12/50 [00:06<00:10,  3.61it/s] 26%|██▌       | 13/50 [00:07<00:09,  3.70it/s] 28%|██▊       | 14/50 [00:07<00:09,  3.77it/s] 30%|███       | 15/50 [00:07<00:09,  3.81it/s] 32%|███▏      | 16/50 [00:07<00:08,  3.85it/s] 34%|███▍      | 17/50 [00:08<00:08,  3.87it/s] 36%|███▌      | 18/50 [00:08<00:08,  3.89it/s] 38%|███▊      | 19/50 [00:08<00:07,  3.90it/s] 40%|████      | 20/50 [00:08<00:07,  3.91it/s] 42%|████▏     | 21/50 [00:09<00:07,  3.91it/s] 44%|████▍     | 22/50 [00:09<00:07,  3.92it/s] 46%|████▌     | 23/50 [00:09<00:06,  3.92it/s] 48%|████▊     | 24/50 [00:09<00:06,  3.93it/s] 50%|█████     | 25/50 [00:10<00:06,  3.93it/s] 52%|█████▏    | 26/50 [00:10<00:06,  3.93it/s] 54%|█████▍    | 27/50 [00:10<00:05,  3.93it/s] 56%|█████▌    | 28/50 [00:10<00:05,  3.93it/s] 58%|█████▊    | 29/50 [00:11<00:05,  3.93it/s] 60%|██████    | 30/50 [00:11<00:05,  3.93it/s] 62%|██████▏   | 31/50 [00:11<00:04,  3.93it/s] 64%|██████▍   | 32/50 [00:11<00:04,  3.92it/s] 66%|██████▌   | 33/50 [00:12<00:04,  3.93it/s] 68%|██████▊   | 34/50 [00:12<00:04,  3.92it/s] 70%|███████   | 35/50 [00:12<00:03,  3.92it/s] 72%|███████▏  | 36/50 [00:12<00:03,  3.92it/s] 74%|███████▍  | 37/50 [00:13<00:03,  3.92it/s] 76%|███████▌  | 38/50 [00:13<00:03,  3.92it/s] 78%|███████▊  | 39/50 [00:13<00:02,  3.92it/s] 80%|████████  | 40/50 [00:13<00:02,  3.92it/s] 82%|████████▏ | 41/50 [00:14<00:02,  3.93it/s] 84%|████████▍ | 42/50 [00:14<00:02,  3.92it/s] 86%|████████▌ | 43/50 [00:14<00:01,  3.92it/s] 88%|████████▊ | 44/50 [00:14<00:01,  3.92it/s] 90%|█████████ | 45/50 [00:15<00:01,  3.93it/s] 92%|█████████▏| 46/50 [00:15<00:01,  3.92it/s] 94%|█████████▍| 47/50 [00:15<00:00,  3.92it/s] 96%|█████████▌| 48/50 [00:16<00:00,  3.93it/s] 98%|█████████▊| 49/50 [00:16<00:00,  3.92it/s]100%|██████████| 50/50 [00:20<00:00,  1.48s/it]100%|██████████| 50/50 [00:20<00:00,  2.43it/s]
