[I 2023-12-10 23:32:51,113] Trial 265 finished with value: 0.4073535699016674 and parameters: {'EMBEDDING_DIM': 992, 'HIDDEN_DIM': 317, 'NUM_LAYERS': 1, 'DROPOUT': 0.34174104011684026, 'LR': 0.0013182738866165619, 'WEIGHT_0': 0.5649805616553413, 'WEIGHT_1': 0.689761598823029, 'WEIGHT_2': 0.6942255896899885, 'WEIGHT_3': 0.9137955544128453, 'WEIGHT_4': 0.7595749955876044, 'WEIGHT_5': 0.6855037459418022, 'WEIGHT_6': 0.6117879163790891, 'WEIGHT_7': 0.28532140994876626, 'WEIGHT_8': 0.6865866748509933, 'optimizer': 'RMSprop'}. Best is trial 221 with value: 0.418736930154747.
/userhome/cs2/dingruiw/conda/envs/py310/lib/python3.10/site-packages/torch/nn/modules/rnn.py:82: UserWarning: dropout option adds dropout after all but last recurrent layer, so non-zero dropout expects num_layers greater than 1, but got dropout=0.3136416480998124 and num_layers=1
  warnings.warn("dropout option adds dropout after all but last "
{'EMBEDDING_DIM': 992, 'HIDDEN_DIM': 317, 'NUM_LAYERS': 1, 'DROPOUT': 0.34174104011684026, 'LR': 0.0013182738866165619, 'WEIGHT_0': 0.5649805616553413, 'WEIGHT_1': 0.689761598823029, 'WEIGHT_2': 0.6942255896899885, 'WEIGHT_3': 0.9137955544128453, 'WEIGHT_4': 0.7595749955876044, 'WEIGHT_5': 0.6855037459418022, 'WEIGHT_6': 0.6117879163790891, 'WEIGHT_7': 0.28532140994876626, 'WEIGHT_8': 0.6865866748509933, 'optimizer': 'RMSprop'}
0
              precision    recall  f1-score   support

         LOC       0.21      0.06      0.10      1837
        MISC       0.05      0.04      0.04       922
         ORG       0.10      0.03      0.05      1341
         PER       0.10      0.03      0.04      1842

   micro avg       0.11      0.04      0.06      5942
   macro avg       0.11      0.04      0.06      5942
weighted avg       0.13      0.04      0.06      5942

{'EMBEDDING_DIM': 992, 'HIDDEN_DIM': 317, 'NUM_LAYERS': 1, 'DROPOUT': 0.34174104011684026, 'LR': 0.0013182738866165619, 'WEIGHT_0': 0.5649805616553413, 'WEIGHT_1': 0.689761598823029, 'WEIGHT_2': 0.6942255896899885, 'WEIGHT_3': 0.9137955544128453, 'WEIGHT_4': 0.7595749955876044, 'WEIGHT_5': 0.6855037459418022, 'WEIGHT_6': 0.6117879163790891, 'WEIGHT_7': 0.28532140994876626, 'WEIGHT_8': 0.6865866748509933, 'optimizer': 'RMSprop'}
49
              precision    recall  f1-score   support

         LOC       0.56      0.54      0.55      1837
        MISC       0.42      0.46      0.44       922
         ORG       0.31      0.27      0.29      1341
         PER       0.33      0.32      0.33      1842

   micro avg       0.41      0.40      0.41      5942
   macro avg       0.41      0.40      0.40      5942
weighted avg       0.41      0.40      0.41      5942

epoch 49
LSTM
  0%|          | 0/50 [00:00<?, ?it/s]  2%|▏         | 1/50 [00:04<03:20,  4.10s/it]  4%|▍         | 2/50 [00:04<01:23,  1.75s/it]  6%|▌         | 3/50 [00:04<00:48,  1.03s/it]  8%|▊         | 4/50 [00:04<00:31,  1.44it/s] 10%|█         | 5/50 [00:04<00:22,  1.97it/s] 12%|█▏        | 6/50 [00:04<00:17,  2.54it/s] 14%|█▍        | 7/50 [00:05<00:13,  3.10it/s] 16%|█▌        | 8/50 [00:05<00:11,  3.63it/s] 18%|█▊        | 9/50 [00:05<00:10,  4.10it/s] 20%|██        | 10/50 [00:05<00:08,  4.49it/s] 22%|██▏       | 11/50 [00:05<00:08,  4.81it/s] 24%|██▍       | 12/50 [00:05<00:07,  5.05it/s] 26%|██▌       | 13/50 [00:06<00:07,  5.23it/s] 28%|██▊       | 14/50 [00:06<00:06,  5.37it/s] 30%|███       | 15/50 [00:06<00:06,  5.46it/s] 32%|███▏      | 16/50 [00:06<00:06,  5.54it/s] 34%|███▍      | 17/50 [00:06<00:05,  5.59it/s] 36%|███▌      | 18/50 [00:07<00:05,  5.63it/s] 38%|███▊      | 19/50 [00:07<00:05,  5.65it/s] 40%|████      | 20/50 [00:07<00:05,  5.66it/s] 42%|████▏     | 21/50 [00:07<00:05,  5.68it/s] 44%|████▍     | 22/50 [00:07<00:04,  5.69it/s] 46%|████▌     | 23/50 [00:07<00:04,  5.69it/s] 48%|████▊     | 24/50 [00:08<00:04,  5.68it/s] 50%|█████     | 25/50 [00:08<00:04,  5.69it/s] 52%|█████▏    | 26/50 [00:08<00:04,  5.69it/s] 54%|█████▍    | 27/50 [00:08<00:04,  5.69it/s] 56%|█████▌    | 28/50 [00:08<00:03,  5.70it/s] 58%|█████▊    | 29/50 [00:08<00:03,  5.69it/s] 60%|██████    | 30/50 [00:09<00:03,  5.70it/s] 62%|██████▏   | 31/50 [00:09<00:03,  5.70it/s] 64%|██████▍   | 32/50 [00:09<00:03,  5.70it/s] 66%|██████▌   | 33/50 [00:09<00:02,  5.70it/s] 68%|██████▊   | 34/50 [00:09<00:02,  5.70it/s] 70%|███████   | 35/50 [00:09<00:02,  5.70it/s] 72%|███████▏  | 36/50 [00:10<00:02,  5.70it/s] 74%|███████▍  | 37/50 [00:10<00:02,  5.71it/s] 76%|███████▌  | 38/50 [00:10<00:02,  5.70it/s] 78%|███████▊  | 39/50 [00:10<00:01,  5.70it/s] 80%|████████  | 40/50 [00:10<00:01,  5.70it/s] 82%|████████▏ | 41/50 [00:11<00:01,  5.70it/s] 84%|████████▍ | 42/50 [00:11<00:01,  5.70it/s] 86%|████████▌ | 43/50 [00:11<00:01,  5.70it/s] 88%|████████▊ | 44/50 [00:11<00:01,  5.70it/s] 90%|█████████ | 45/50 [00:11<00:00,  5.70it/s] 92%|█████████▏| 46/50 [00:11<00:00,  5.70it/s] 94%|█████████▍| 47/50 [00:12<00:00,  5.69it/s] 96%|█████████▌| 48/50 [00:12<00:00,  5.70it/s] 98%|█████████▊| 49/50 [00:12<00:00,  5.70it/s]100%|██████████| 50/50 [00:16<00:00,  1.39s/it]100%|██████████| 50/50 [00:16<00:00,  3.00it/s]
[I 2023-12-10 23:33:11,487] Trial 266 finished with value: 0.4066481059647347 and parameters: {'EMBEDDING_DIM': 1007, 'HIDDEN_DIM': 145, 'NUM_LAYERS': 1, 'DROPOUT': 0.3136416480998124, 'LR': 0.0027174099339968318, 'WEIGHT_0': 0.49865801565382867, 'WEIGHT_1': 0.7501688467762839, 'WEIGHT_2': 0.15873892512546006, 'WEIGHT_3': 0.7078017503257277, 'WEIGHT_4': 0.9168728853236294, 'WEIGHT_5': 0.5160330437293268, 'WEIGHT_6': 0.8542438665054048, 'WEIGHT_7': 0.216143407293279, 'WEIGHT_8': 0.5450139825759654, 'optimizer': 'RMSprop'}. Best is trial 221 with value: 0.418736930154747.
/userhome/cs2/dingruiw/conda/envs/py310/lib/python3.10/site-packages/torch/nn/modules/rnn.py:82: UserWarning: dropout option adds dropout after all but last recurrent layer, so non-zero dropout expects num_layers greater than 1, but got dropout=0.34674919080459926 and num_layers=1
  warnings.warn("dropout option adds dropout after all but last "
{'EMBEDDING_DIM': 1007, 'HIDDEN_DIM': 145, 'NUM_LAYERS': 1, 'DROPOUT': 0.3136416480998124, 'LR': 0.0027174099339968318, 'WEIGHT_0': 0.49865801565382867, 'WEIGHT_1': 0.7501688467762839, 'WEIGHT_2': 0.15873892512546006, 'WEIGHT_3': 0.7078017503257277, 'WEIGHT_4': 0.9168728853236294, 'WEIGHT_5': 0.5160330437293268, 'WEIGHT_6': 0.8542438665054048, 'WEIGHT_7': 0.216143407293279, 'WEIGHT_8': 0.5450139825759654, 'optimizer': 'RMSprop'}
0
              precision    recall  f1-score   support

         LOC       0.29      0.06      0.09      1837
        MISC       0.04      0.01      0.02       922
         ORG       0.11      0.03      0.05      1341
         PER       0.12      0.05      0.07      1842

   micro avg       0.14      0.04      0.06      5942
   macro avg       0.14      0.04      0.06      5942
weighted avg       0.16      0.04      0.06      5942

{'EMBEDDING_DIM': 1007, 'HIDDEN_DIM': 145, 'NUM_LAYERS': 1, 'DROPOUT': 0.3136416480998124, 'LR': 0.0027174099339968318, 'WEIGHT_0': 0.49865801565382867, 'WEIGHT_1': 0.7501688467762839, 'WEIGHT_2': 0.15873892512546006, 'WEIGHT_3': 0.7078017503257277, 'WEIGHT_4': 0.9168728853236294, 'WEIGHT_5': 0.5160330437293268, 'WEIGHT_6': 0.8542438665054048, 'WEIGHT_7': 0.216143407293279, 'WEIGHT_8': 0.5450139825759654, 'optimizer': 'RMSprop'}
49
              precision    recall  f1-score   support

         LOC       0.56      0.54      0.55      1837
        MISC       0.50      0.44      0.47       922
         ORG       0.28      0.27      0.27      1341
         PER       0.32      0.36      0.34      1842

   micro avg       0.41      0.41      0.41      5942
   macro avg       0.41      0.40      0.41      5942
weighted avg       0.41      0.41      0.41      5942

epoch 49
LSTM
  0%|          | 0/50 [00:00<?, ?it/s]  2%|▏         | 1/50 [00:04<03:51,  4.72s/it]  4%|▍         | 2/50 [00:04<01:36,  2.01s/it]  6%|▌         | 3/50 [00:05<00:55,  1.19s/it]  8%|▊         | 4/50 [00:05<00:36,  1.26it/s] 10%|█         | 5/50 [00:05<00:25,  1.74it/s] 12%|█▏        | 6/50 [00:05<00:19,  2.25it/s] 14%|█▍        | 7/50 [00:05<00:15,  2.76it/s] 16%|█▌        | 8/50 [00:05<00:12,  3.25it/s] 18%|█▊        | 9/50 [00:06<00:11,  3.69it/s] 20%|██        | 10/50 [00:06<00:09,  4.06it/s] 22%|██▏       | 11/50 [00:06<00:08,  4.36it/s] 24%|██▍       | 12/50 [00:06<00:08,  4.59it/s] 26%|██▌       | 13/50 [00:06<00:07,  4.77it/s] 28%|██▊       | 14/50 [00:07<00:07,  4.90it/s] 30%|███       | 15/50 [00:07<00:07,  5.00it/s] 32%|███▏      | 16/50 [00:07<00:06,  5.06it/s] 34%|███▍      | 17/50 [00:07<00:06,  5.11it/s] 36%|███▌      | 18/50 [00:07<00:06,  5.15it/s] 38%|███▊      | 19/50 [00:08<00:05,  5.17it/s] 40%|████      | 20/50 [00:08<00:05,  5.19it/s] 42%|████▏     | 21/50 [00:08<00:05,  5.20it/s] 44%|████▍     | 22/50 [00:08<00:05,  5.21it/s] 46%|████▌     | 23/50 [00:08<00:05,  5.22it/s] 48%|████▊     | 24/50 [00:09<00:04,  5.22it/s] 50%|█████     | 25/50 [00:09<00:04,  5.22it/s] 52%|█████▏    | 26/50 [00:09<00:04,  5.22it/s] 54%|█████▍    | 27/50 [00:09<00:04,  5.23it/s] 56%|█████▌    | 28/50 [00:09<00:04,  5.22it/s] 58%|█████▊    | 29/50 [00:10<00:04,  5.22it/s] 60%|██████    | 30/50 [00:10<00:03,  5.22it/s] 62%|██████▏   | 31/50 [00:10<00:03,  5.22it/s] 64%|██████▍   | 32/50 [00:10<00:03,  5.22it/s] 66%|██████▌   | 33/50 [00:10<00:03,  5.21it/s] 68%|██████▊   | 34/50 [00:10<00:03,  5.22it/s] 70%|███████   | 35/50 [00:11<00:02,  5.22it/s] 72%|███████▏  | 36/50 [00:11<00:02,  5.21it/s] 74%|███████▍  | 37/50 [00:11<00:02,  5.21it/s] 76%|███████▌  | 38/50 [00:11<00:02,  5.21it/s] 78%|███████▊  | 39/50 [00:11<00:02,  5.21it/s] 80%|████████  | 40/50 [00:12<00:01,  5.21it/s] 82%|████████▏ | 41/50 [00:12<00:01,  5.22it/s] 84%|████████▍ | 42/50 [00:12<00:01,  5.20it/s] 86%|████████▌ | 43/50 [00:12<00:01,  5.21it/s] 88%|████████▊ | 44/50 [00:12<00:01,  5.21it/s] 90%|█████████ | 45/50 [00:13<00:00,  5.21it/s] 92%|█████████▏| 46/50 [00:13<00:00,  5.21it/s] 94%|█████████▍| 47/50 [00:13<00:00,  5.21it/s] 96%|█████████▌| 48/50 [00:13<00:00,  5.21it/s] 98%|█████████▊| 49/50 [00:13<00:00,  5.21it/s]100%|██████████| 50/50 [00:18<00:00,  1.59s/it]100%|██████████| 50/50 [00:18<00:00,  2.67it/s]
[I 2023-12-10 23:33:34,487] Trial 267 finished with value: 0.39025598678777873 and parameters: {'EMBEDDING_DIM': 975, 'HIDDEN_DIM': 282, 'NUM_LAYERS': 1, 'DROPOUT': 0.34674919080459926, 'LR': 0.003433422341171306, 'WEIGHT_0': 0.3935826353066746, 'WEIGHT_1': 0.7170910928794962, 'WEIGHT_2': 0.6332809963746822, 'WEIGHT_3': 0.6516304812986853, 'WEIGHT_4': 0.7987965549443852, 'WEIGHT_5': 0.7079212266895203, 'WEIGHT_6': 0.5874139930716884, 'WEIGHT_7': 0.20343435665367307, 'WEIGHT_8': 0.47055575735676813, 'optimizer': 'RMSprop'}. Best is trial 221 with value: 0.418736930154747.
/userhome/cs2/dingruiw/conda/envs/py310/lib/python3.10/site-packages/torch/nn/modules/rnn.py:82: UserWarning: dropout option adds dropout after all but last recurrent layer, so non-zero dropout expects num_layers greater than 1, but got dropout=0.3011982455078777 and num_layers=1
  warnings.warn("dropout option adds dropout after all but last "
{'EMBEDDING_DIM': 975, 'HIDDEN_DIM': 282, 'NUM_LAYERS': 1, 'DROPOUT': 0.34674919080459926, 'LR': 0.003433422341171306, 'WEIGHT_0': 0.3935826353066746, 'WEIGHT_1': 0.7170910928794962, 'WEIGHT_2': 0.6332809963746822, 'WEIGHT_3': 0.6516304812986853, 'WEIGHT_4': 0.7987965549443852, 'WEIGHT_5': 0.7079212266895203, 'WEIGHT_6': 0.5874139930716884, 'WEIGHT_7': 0.20343435665367307, 'WEIGHT_8': 0.47055575735676813, 'optimizer': 'RMSprop'}
0
              precision    recall  f1-score   support

         LOC       0.48      0.09      0.16      1837
        MISC       0.05      0.01      0.02       922
         ORG       0.20      0.03      0.05      1341
         PER       0.05      0.01      0.01      1842

   micro avg       0.23      0.04      0.07      5942
   macro avg       0.19      0.04      0.06      5942
weighted avg       0.21      0.04      0.07      5942

{'EMBEDDING_DIM': 975, 'HIDDEN_DIM': 282, 'NUM_LAYERS': 1, 'DROPOUT': 0.34674919080459926, 'LR': 0.003433422341171306, 'WEIGHT_0': 0.3935826353066746, 'WEIGHT_1': 0.7170910928794962, 'WEIGHT_2': 0.6332809963746822, 'WEIGHT_3': 0.6516304812986853, 'WEIGHT_4': 0.7987965549443852, 'WEIGHT_5': 0.7079212266895203, 'WEIGHT_6': 0.5874139930716884, 'WEIGHT_7': 0.20343435665367307, 'WEIGHT_8': 0.47055575735676813, 'optimizer': 'RMSprop'}
49
              precision    recall  f1-score   support

         LOC       0.56      0.54      0.55      1837
        MISC       0.39      0.42      0.40       922
         ORG       0.24      0.25      0.24      1341
         PER       0.33      0.35      0.34      1842

   micro avg       0.38      0.40      0.39      5942
   macro avg       0.38      0.39      0.38      5942
weighted avg       0.39      0.40      0.39      5942

epoch 49
LSTM
  0%|          | 0/50 [00:00<?, ?it/s]  2%|▏         | 1/50 [00:04<03:50,  4.70s/it]  6%|▌         | 3/50 [00:04<01:02,  1.32s/it]  8%|▊         | 4/50 [00:05<00:42,  1.08it/s] 10%|█         | 5/50 [00:05<00:30,  1.49it/s] 12%|█▏        | 6/50 [00:05<00:22,  1.96it/s] 14%|█▍        | 7/50 [00:05<00:17,  2.49it/s] 16%|█▌        | 8/50 [00:05<00:13,  3.04it/s] 18%|█▊        | 9/50 [00:05<00:11,  3.58it/s] 20%|██        | 10/50 [00:06<00:09,  4.08it/s] 22%|██▏       | 11/50 [00:06<00:08,  4.52it/s] 24%|██▍       | 12/50 [00:06<00:07,  4.88it/s] 26%|██▌       | 13/50 [00:06<00:07,  5.17it/s] 28%|██▊       | 14/50 [00:06<00:06,  5.39it/s] 30%|███       | 15/50 [00:06<00:06,  5.57it/s] 32%|███▏      | 16/50 [00:07<00:05,  5.70it/s] 34%|███▍      | 17/50 [00:07<00:05,  5.78it/s] 36%|███▌      | 18/50 [00:07<00:05,  5.84it/s] 38%|███▊      | 19/50 [00:07<00:05,  5.89it/s] 40%|████      | 20/50 [00:07<00:05,  5.93it/s] 42%|████▏     | 21/50 [00:07<00:04,  5.95it/s] 44%|████▍     | 22/50 [00:08<00:04,  5.97it/s] 46%|████▌     | 23/50 [00:08<00:04,  5.98it/s] 48%|████▊     | 24/50 [00:08<00:04,  5.99it/s] 50%|█████     | 25/50 [00:08<00:04,  5.99it/s] 52%|█████▏    | 26/50 [00:08<00:04,  6.00it/s] 54%|█████▍    | 27/50 [00:08<00:03,  6.00it/s] 56%|█████▌    | 28/50 [00:09<00:03,  6.00it/s] 58%|█████▊    | 29/50 [00:09<00:03,  6.00it/s] 60%|██████    | 30/50 [00:09<00:03,  6.00it/s] 62%|██████▏   | 31/50 [00:09<00:03,  6.00it/s] 64%|██████▍   | 32/50 [00:09<00:02,  6.01it/s] 66%|██████▌   | 33/50 [00:09<00:02,  6.00it/s] 68%|██████▊   | 34/50 [00:10<00:02,  6.00it/s] 70%|███████   | 35/50 [00:10<00:02,  6.00it/s] 72%|███████▏  | 36/50 [00:10<00:02,  6.00it/s] 74%|███████▍  | 37/50 [00:10<00:02,  6.00it/s] 76%|███████▌  | 38/50 [00:10<00:01,  6.00it/s] 78%|███████▊  | 39/50 [00:10<00:01,  6.00it/s] 80%|████████  | 40/50 [00:11<00:01,  5.99it/s] 82%|████████▏ | 41/50 [00:11<00:01,  5.99it/s] 84%|████████▍ | 42/50 [00:11<00:01,  5.99it/s] 86%|████████▌ | 43/50 [00:11<00:01,  5.99it/s] 88%|████████▊ | 44/50 [00:11<00:01,  5.97it/s] 90%|█████████ | 45/50 [00:11<00:00,  5.99it/s] 92%|█████████▏| 46/50 [00:12<00:00,  5.99it/s] 94%|█████████▍| 47/50 [00:12<00:00,  5.98it/s] 96%|█████████▌| 48/50 [00:12<00:00,  5.98it/s] 98%|█████████▊| 49/50 [00:12<00:00,  5.99it/s]100%|██████████| 50/50 [00:17<00:00,  1.53s/it]100%|██████████| 50/50 [00:17<00:00,  2.88it/s]
[I 2023-12-10 23:33:56,143] Trial 268 finished with value: 0.4114656381486676 and parameters: {'EMBEDDING_DIM': 990, 'HIDDEN_DIM': 244, 'NUM_LAYERS': 1, 'DROPOUT': 0.3011982455078777, 'LR': 0.002947278420893288, 'WEIGHT_0': 0.45876805352876177, 'WEIGHT_1': 0.5518705112091239, 'WEIGHT_2': 0.1819826002908474, 'WEIGHT_3': 0.6183382988989845, 'WEIGHT_4': 0.8939951716963057, 'WEIGHT_5': 0.5346026317614618, 'WEIGHT_6': 0.6406825918587113, 'WEIGHT_7': 0.18552706016196321, 'WEIGHT_8': 0.5731134917624153, 'optimizer': 'RMSprop'}. Best is trial 221 with value: 0.418736930154747.
/userhome/cs2/dingruiw/conda/envs/py310/lib/python3.10/site-packages/torch/nn/modules/rnn.py:82: UserWarning: dropout option adds dropout after all but last recurrent layer, so non-zero dropout expects num_layers greater than 1, but got dropout=0.32382777681797625 and num_layers=1
  warnings.warn("dropout option adds dropout after all but last "
{'EMBEDDING_DIM': 990, 'HIDDEN_DIM': 244, 'NUM_LAYERS': 1, 'DROPOUT': 0.3011982455078777, 'LR': 0.002947278420893288, 'WEIGHT_0': 0.45876805352876177, 'WEIGHT_1': 0.5518705112091239, 'WEIGHT_2': 0.1819826002908474, 'WEIGHT_3': 0.6183382988989845, 'WEIGHT_4': 0.8939951716963057, 'WEIGHT_5': 0.5346026317614618, 'WEIGHT_6': 0.6406825918587113, 'WEIGHT_7': 0.18552706016196321, 'WEIGHT_8': 0.5731134917624153, 'optimizer': 'RMSprop'}
0
              precision    recall  f1-score   support

         LOC       0.34      0.08      0.13      1837
        MISC       0.04      0.00      0.01       922
         ORG       0.17      0.02      0.03      1341
         PER       0.10      0.02      0.03      1842

   micro avg       0.20      0.04      0.06      5942
   macro avg       0.16      0.03      0.05      5942
weighted avg       0.18      0.04      0.06      5942

{'EMBEDDING_DIM': 990, 'HIDDEN_DIM': 244, 'NUM_LAYERS': 1, 'DROPOUT': 0.3011982455078777, 'LR': 0.002947278420893288, 'WEIGHT_0': 0.45876805352876177, 'WEIGHT_1': 0.5518705112091239, 'WEIGHT_2': 0.1819826002908474, 'WEIGHT_3': 0.6183382988989845, 'WEIGHT_4': 0.8939951716963057, 'WEIGHT_5': 0.5346026317614618, 'WEIGHT_6': 0.6406825918587113, 'WEIGHT_7': 0.18552706016196321, 'WEIGHT_8': 0.5731134917624153, 'optimizer': 'RMSprop'}
49
              precision    recall  f1-score   support

         LOC       0.60      0.54      0.57      1837
        MISC       0.46      0.43      0.45       922
         ORG       0.29      0.25      0.27      1341
         PER       0.35      0.34      0.34      1842

   micro avg       0.43      0.39      0.41      5942
   macro avg       0.42      0.39      0.41      5942
weighted avg       0.43      0.39      0.41      5942

epoch 49
LSTM
  0%|          | 0/50 [00:00<?, ?it/s]  2%|▏         | 1/50 [00:04<03:26,  4.22s/it]  4%|▍         | 2/50 [00:04<01:27,  1.82s/it]  6%|▌         | 3/50 [00:04<00:52,  1.11s/it]  8%|▊         | 4/50 [00:04<00:35,  1.30it/s] 10%|█         | 5/50 [00:05<00:26,  1.72it/s] 12%|█▏        | 6/50 [00:05<00:20,  2.13it/s] 14%|█▍        | 7/50 [00:05<00:17,  2.51it/s] 16%|█▌        | 8/50 [00:05<00:14,  2.84it/s] 18%|█▊        | 9/50 [00:06<00:13,  3.11it/s] 20%|██        | 10/50 [00:06<00:11,  3.34it/s] 22%|██▏       | 11/50 [00:06<00:11,  3.51it/s] 24%|██▍       | 12/50 [00:06<00:10,  3.64it/s] 26%|██▌       | 13/50 [00:07<00:09,  3.73it/s] 28%|██▊       | 14/50 [00:07<00:09,  3.80it/s] 30%|███       | 15/50 [00:07<00:09,  3.85it/s] 32%|███▏      | 16/50 [00:07<00:08,  3.88it/s] 34%|███▍      | 17/50 [00:08<00:08,  3.91it/s] 36%|███▌      | 18/50 [00:08<00:08,  3.92it/s] 38%|███▊      | 19/50 [00:08<00:07,  3.94it/s] 40%|████      | 20/50 [00:08<00:07,  3.95it/s] 42%|████▏     | 21/50 [00:09<00:07,  3.96it/s] 44%|████▍     | 22/50 [00:09<00:07,  3.96it/s] 46%|████▌     | 23/50 [00:09<00:06,  3.96it/s] 48%|████▊     | 24/50 [00:09<00:06,  3.96it/s] 50%|█████     | 25/50 [00:10<00:06,  3.97it/s] 52%|█████▏    | 26/50 [00:10<00:06,  3.97it/s] 54%|█████▍    | 27/50 [00:10<00:05,  3.97it/s] 56%|█████▌    | 28/50 [00:10<00:05,  3.97it/s] 58%|█████▊    | 29/50 [00:11<00:05,  3.97it/s] 60%|██████    | 30/50 [00:11<00:05,  3.97it/s] 62%|██████▏   | 31/50 [00:11<00:04,  3.97it/s] 64%|██████▍   | 32/50 [00:11<00:04,  3.97it/s] 66%|██████▌   | 33/50 [00:12<00:04,  3.97it/s] 68%|██████▊   | 34/50 [00:12<00:04,  3.97it/s] 70%|███████   | 35/50 [00:12<00:03,  3.97it/s] 72%|███████▏  | 36/50 [00:12<00:03,  3.97it/s] 74%|███████▍  | 37/50 [00:13<00:03,  3.97it/s] 76%|███████▌  | 38/50 [00:13<00:03,  3.97it/s] 78%|███████▊  | 39/50 [00:13<00:02,  3.97it/s] 80%|████████  | 40/50 [00:13<00:02,  3.97it/s] 82%|████████▏ | 41/50 [00:14<00:02,  3.97it/s] 84%|████████▍ | 42/50 [00:14<00:02,  3.97it/s] 86%|████████▌ | 43/50 [00:14<00:01,  3.97it/s] 88%|████████▊ | 44/50 [00:14<00:01,  3.97it/s] 90%|█████████ | 45/50 [00:15<00:01,  3.96it/s] 92%|█████████▏| 46/50 [00:15<00:01,  3.96it/s] 94%|█████████▍| 47/50 [00:15<00:00,  3.96it/s] 96%|█████████▌| 48/50 [00:15<00:00,  3.96it/s] 98%|█████████▊| 49/50 [00:16<00:00,  3.97it/s]100%|██████████| 50/50 [00:20<00:00,  1.51s/it]100%|██████████| 50/50 [00:20<00:00,  2.42it/s]
