[I 2023-12-11 00:08:00,717] Trial 341 finished with value: 0.4035404313826587 and parameters: {'EMBEDDING_DIM': 928, 'HIDDEN_DIM': 454, 'NUM_LAYERS': 1, 'DROPOUT': 0.24361570701978233, 'LR': 0.0016129173888249943, 'WEIGHT_0': 0.4912361285425472, 'WEIGHT_1': 0.498829686477314, 'WEIGHT_2': 0.3049003383467581, 'WEIGHT_3': 0.7412229235189716, 'WEIGHT_4': 0.5789570979840273, 'WEIGHT_5': 0.7154450726975642, 'WEIGHT_6': 0.6781355304656606, 'WEIGHT_7': 0.7613930226295728, 'WEIGHT_8': 0.9771128276105362, 'optimizer': 'RMSprop'}. Best is trial 221 with value: 0.418736930154747.
/userhome/cs2/dingruiw/conda/envs/py310/lib/python3.10/site-packages/torch/nn/modules/rnn.py:82: UserWarning: dropout option adds dropout after all but last recurrent layer, so non-zero dropout expects num_layers greater than 1, but got dropout=0.05955077224008227 and num_layers=1
  warnings.warn("dropout option adds dropout after all but last "
{'EMBEDDING_DIM': 928, 'HIDDEN_DIM': 454, 'NUM_LAYERS': 1, 'DROPOUT': 0.24361570701978233, 'LR': 0.0016129173888249943, 'WEIGHT_0': 0.4912361285425472, 'WEIGHT_1': 0.498829686477314, 'WEIGHT_2': 0.3049003383467581, 'WEIGHT_3': 0.7412229235189716, 'WEIGHT_4': 0.5789570979840273, 'WEIGHT_5': 0.7154450726975642, 'WEIGHT_6': 0.6781355304656606, 'WEIGHT_7': 0.7613930226295728, 'WEIGHT_8': 0.9771128276105362, 'optimizer': 'RMSprop'}
0
              precision    recall  f1-score   support

         LOC       0.24      0.09      0.13      1837
        MISC       0.04      0.03      0.03       922
         ORG       0.11      0.02      0.03      1341
         PER       0.06      0.01      0.02      1842

   micro avg       0.13      0.04      0.06      5942
   macro avg       0.11      0.04      0.05      5942
weighted avg       0.13      0.04      0.06      5942

{'EMBEDDING_DIM': 928, 'HIDDEN_DIM': 454, 'NUM_LAYERS': 1, 'DROPOUT': 0.24361570701978233, 'LR': 0.0016129173888249943, 'WEIGHT_0': 0.4912361285425472, 'WEIGHT_1': 0.498829686477314, 'WEIGHT_2': 0.3049003383467581, 'WEIGHT_3': 0.7412229235189716, 'WEIGHT_4': 0.5789570979840273, 'WEIGHT_5': 0.7154450726975642, 'WEIGHT_6': 0.6781355304656606, 'WEIGHT_7': 0.7613930226295728, 'WEIGHT_8': 0.9771128276105362, 'optimizer': 'RMSprop'}
49
              precision    recall  f1-score   support

         LOC       0.59      0.55      0.57      1837
        MISC       0.42      0.42      0.42       922
         ORG       0.27      0.26      0.27      1341
         PER       0.33      0.32      0.33      1842

   micro avg       0.41      0.40      0.40      5942
   macro avg       0.41      0.39      0.40      5942
weighted avg       0.41      0.40      0.40      5942

epoch 49
LSTM
  0%|          | 0/50 [00:00<?, ?it/s]  2%|▏         | 1/50 [00:04<03:47,  4.64s/it]  4%|▍         | 2/50 [00:04<01:35,  2.00s/it]  6%|▌         | 3/50 [00:05<00:56,  1.21s/it]  8%|▊         | 4/50 [00:05<00:38,  1.19it/s] 10%|█         | 5/50 [00:05<00:28,  1.58it/s] 12%|█▏        | 6/50 [00:05<00:22,  1.97it/s] 14%|█▍        | 7/50 [00:06<00:18,  2.34it/s] 16%|█▌        | 8/50 [00:06<00:15,  2.66it/s] 18%|█▊        | 9/50 [00:06<00:14,  2.93it/s] 20%|██        | 10/50 [00:06<00:12,  3.14it/s] 22%|██▏       | 11/50 [00:07<00:11,  3.31it/s] 24%|██▍       | 12/50 [00:07<00:11,  3.44it/s] 26%|██▌       | 13/50 [00:07<00:10,  3.53it/s] 28%|██▊       | 14/50 [00:07<00:10,  3.60it/s] 30%|███       | 15/50 [00:08<00:09,  3.65it/s] 32%|███▏      | 16/50 [00:08<00:09,  3.68it/s] 34%|███▍      | 17/50 [00:08<00:08,  3.71it/s] 36%|███▌      | 18/50 [00:09<00:08,  3.73it/s] 38%|███▊      | 19/50 [00:09<00:08,  3.74it/s] 40%|████      | 20/50 [00:09<00:08,  3.75it/s] 42%|████▏     | 21/50 [00:09<00:07,  3.75it/s] 44%|████▍     | 22/50 [00:10<00:07,  3.75it/s] 46%|████▌     | 23/50 [00:10<00:07,  3.76it/s] 48%|████▊     | 24/50 [00:10<00:06,  3.76it/s] 50%|█████     | 25/50 [00:10<00:06,  3.76it/s] 52%|█████▏    | 26/50 [00:11<00:06,  3.76it/s] 54%|█████▍    | 27/50 [00:11<00:06,  3.76it/s] 56%|█████▌    | 28/50 [00:11<00:05,  3.76it/s] 58%|█████▊    | 29/50 [00:11<00:05,  3.76it/s] 60%|██████    | 30/50 [00:12<00:05,  3.76it/s] 62%|██████▏   | 31/50 [00:12<00:05,  3.76it/s] 64%|██████▍   | 32/50 [00:12<00:04,  3.76it/s] 66%|██████▌   | 33/50 [00:13<00:04,  3.76it/s] 68%|██████▊   | 34/50 [00:13<00:04,  3.76it/s] 70%|███████   | 35/50 [00:13<00:03,  3.76it/s] 72%|███████▏  | 36/50 [00:13<00:03,  3.75it/s] 74%|███████▍  | 37/50 [00:14<00:03,  3.76it/s] 76%|███████▌  | 38/50 [00:14<00:03,  3.76it/s] 78%|███████▊  | 39/50 [00:14<00:02,  3.75it/s] 80%|████████  | 40/50 [00:14<00:02,  3.75it/s] 82%|████████▏ | 41/50 [00:15<00:02,  3.75it/s] 84%|████████▍ | 42/50 [00:15<00:02,  3.75it/s] 86%|████████▌ | 43/50 [00:15<00:01,  3.75it/s] 88%|████████▊ | 44/50 [00:15<00:01,  3.75it/s] 90%|█████████ | 45/50 [00:16<00:01,  3.75it/s] 92%|█████████▏| 46/50 [00:16<00:01,  3.75it/s] 94%|█████████▍| 47/50 [00:16<00:00,  3.75it/s] 96%|█████████▌| 48/50 [00:17<00:00,  3.75it/s] 98%|█████████▊| 49/50 [00:17<00:00,  3.75it/s]100%|██████████| 50/50 [00:22<00:00,  1.67s/it]100%|██████████| 50/50 [00:22<00:00,  2.25it/s]
[I 2023-12-11 00:08:27,304] Trial 342 finished with value: 0.3711216158143532 and parameters: {'EMBEDDING_DIM': 982, 'HIDDEN_DIM': 403, 'NUM_LAYERS': 1, 'DROPOUT': 0.05955077224008227, 'LR': 0.0031943011090022726, 'WEIGHT_0': 0.47441556130610474, 'WEIGHT_1': 0.4947036996038444, 'WEIGHT_2': 0.41564513511141765, 'WEIGHT_3': 0.8063785188073141, 'WEIGHT_4': 0.9276223836427474, 'WEIGHT_5': 0.5586142034105809, 'WEIGHT_6': 0.7091414885557489, 'WEIGHT_7': 0.7785815238746053, 'WEIGHT_8': 0.9679416878485545, 'optimizer': 'RMSprop'}. Best is trial 221 with value: 0.418736930154747.
/userhome/cs2/dingruiw/conda/envs/py310/lib/python3.10/site-packages/torch/nn/modules/rnn.py:82: UserWarning: dropout option adds dropout after all but last recurrent layer, so non-zero dropout expects num_layers greater than 1, but got dropout=0.041251861773306746 and num_layers=1
  warnings.warn("dropout option adds dropout after all but last "
{'EMBEDDING_DIM': 982, 'HIDDEN_DIM': 403, 'NUM_LAYERS': 1, 'DROPOUT': 0.05955077224008227, 'LR': 0.0031943011090022726, 'WEIGHT_0': 0.47441556130610474, 'WEIGHT_1': 0.4947036996038444, 'WEIGHT_2': 0.41564513511141765, 'WEIGHT_3': 0.8063785188073141, 'WEIGHT_4': 0.9276223836427474, 'WEIGHT_5': 0.5586142034105809, 'WEIGHT_6': 0.7091414885557489, 'WEIGHT_7': 0.7785815238746053, 'WEIGHT_8': 0.9679416878485545, 'optimizer': 'RMSprop'}
0
              precision    recall  f1-score   support

         LOC       0.18      0.03      0.05      1837
        MISC       0.03      0.01      0.01       922
         ORG       0.11      0.02      0.03      1341
         PER       0.02      0.00      0.01      1842

   micro avg       0.07      0.01      0.02      5942
   macro avg       0.08      0.01      0.02      5942
weighted avg       0.09      0.01      0.03      5942

{'EMBEDDING_DIM': 982, 'HIDDEN_DIM': 403, 'NUM_LAYERS': 1, 'DROPOUT': 0.05955077224008227, 'LR': 0.0031943011090022726, 'WEIGHT_0': 0.47441556130610474, 'WEIGHT_1': 0.4947036996038444, 'WEIGHT_2': 0.41564513511141765, 'WEIGHT_3': 0.8063785188073141, 'WEIGHT_4': 0.9276223836427474, 'WEIGHT_5': 0.5586142034105809, 'WEIGHT_6': 0.7091414885557489, 'WEIGHT_7': 0.7785815238746053, 'WEIGHT_8': 0.9679416878485545, 'optimizer': 'RMSprop'}
49
              precision    recall  f1-score   support

         LOC       0.58      0.49      0.53      1837
        MISC       0.42      0.40      0.41       922
         ORG       0.25      0.23      0.24      1341
         PER       0.29      0.31      0.30      1842

   micro avg       0.38      0.36      0.37      5942
   macro avg       0.38      0.36      0.37      5942
weighted avg       0.39      0.36      0.37      5942

epoch 49
LSTM
  0%|          | 0/50 [00:00<?, ?it/s]  2%|▏         | 1/50 [00:04<03:49,  4.68s/it]  4%|▍         | 2/50 [00:04<01:36,  2.02s/it]  6%|▌         | 3/50 [00:05<00:57,  1.23s/it]  8%|▊         | 4/50 [00:05<00:39,  1.17it/s] 10%|█         | 5/50 [00:05<00:29,  1.54it/s] 12%|█▏        | 6/50 [00:05<00:23,  1.89it/s] 14%|█▍        | 7/50 [00:06<00:19,  2.22it/s] 16%|█▌        | 8/50 [00:06<00:16,  2.51it/s] 18%|█▊        | 9/50 [00:06<00:14,  2.75it/s] 20%|██        | 10/50 [00:07<00:13,  2.94it/s] 22%|██▏       | 11/50 [00:07<00:12,  3.08it/s] 24%|██▍       | 12/50 [00:07<00:11,  3.19it/s] 26%|██▌       | 13/50 [00:08<00:11,  3.27it/s] 28%|██▊       | 14/50 [00:08<00:10,  3.33it/s] 30%|███       | 15/50 [00:08<00:10,  3.37it/s] 32%|███▏      | 16/50 [00:08<00:10,  3.40it/s] 34%|███▍      | 17/50 [00:09<00:09,  3.41it/s] 36%|███▌      | 18/50 [00:09<00:09,  3.43it/s] 38%|███▊      | 19/50 [00:09<00:09,  3.44it/s] 40%|████      | 20/50 [00:10<00:08,  3.45it/s] 42%|████▏     | 21/50 [00:10<00:08,  3.45it/s] 44%|████▍     | 22/50 [00:10<00:08,  3.46it/s] 46%|████▌     | 23/50 [00:10<00:07,  3.46it/s] 48%|████▊     | 24/50 [00:11<00:07,  3.46it/s] 50%|█████     | 25/50 [00:11<00:07,  3.46it/s] 52%|█████▏    | 26/50 [00:11<00:06,  3.46it/s] 54%|█████▍    | 27/50 [00:12<00:06,  3.46it/s] 56%|█████▌    | 28/50 [00:12<00:06,  3.46it/s] 58%|█████▊    | 29/50 [00:12<00:06,  3.46it/s] 60%|██████    | 30/50 [00:12<00:05,  3.46it/s] 62%|██████▏   | 31/50 [00:13<00:05,  3.46it/s] 64%|██████▍   | 32/50 [00:13<00:05,  3.46it/s] 66%|██████▌   | 33/50 [00:13<00:04,  3.45it/s] 68%|██████▊   | 34/50 [00:14<00:04,  3.45it/s] 70%|███████   | 35/50 [00:14<00:04,  3.46it/s] 72%|███████▏  | 36/50 [00:14<00:04,  3.45it/s] 74%|███████▍  | 37/50 [00:14<00:03,  3.45it/s] 76%|███████▌  | 38/50 [00:15<00:03,  3.45it/s] 78%|███████▊  | 39/50 [00:15<00:03,  3.45it/s] 80%|████████  | 40/50 [00:15<00:02,  3.45it/s] 82%|████████▏ | 41/50 [00:16<00:02,  3.45it/s] 84%|████████▍ | 42/50 [00:16<00:02,  3.45it/s] 86%|████████▌ | 43/50 [00:16<00:02,  3.45it/s] 88%|████████▊ | 44/50 [00:16<00:01,  3.45it/s] 90%|█████████ | 45/50 [00:17<00:01,  3.45it/s] 92%|█████████▏| 46/50 [00:17<00:01,  3.45it/s] 94%|█████████▍| 47/50 [00:17<00:00,  3.45it/s] 96%|█████████▌| 48/50 [00:18<00:00,  3.45it/s] 98%|█████████▊| 49/50 [00:18<00:00,  3.45it/s]100%|██████████| 50/50 [00:23<00:00,  1.68s/it]100%|██████████| 50/50 [00:23<00:00,  2.14it/s]
[I 2023-12-11 00:08:54,964] Trial 343 finished with value: 0.40285083997963683 and parameters: {'EMBEDDING_DIM': 967, 'HIDDEN_DIM': 436, 'NUM_LAYERS': 1, 'DROPOUT': 0.041251861773306746, 'LR': 0.0014545137187257648, 'WEIGHT_0': 0.4942175068191102, 'WEIGHT_1': 0.5401703235090148, 'WEIGHT_2': 0.3270322686065953, 'WEIGHT_3': 0.9355371367707024, 'WEIGHT_4': 0.8806272415923303, 'WEIGHT_5': 0.5009853173351198, 'WEIGHT_6': 0.6638493584785878, 'WEIGHT_7': 0.37673628714892593, 'WEIGHT_8': 0.890804676138549, 'optimizer': 'RMSprop'}. Best is trial 221 with value: 0.418736930154747.
/userhome/cs2/dingruiw/conda/envs/py310/lib/python3.10/site-packages/torch/nn/modules/rnn.py:82: UserWarning: dropout option adds dropout after all but last recurrent layer, so non-zero dropout expects num_layers greater than 1, but got dropout=0.4048546337219775 and num_layers=1
  warnings.warn("dropout option adds dropout after all but last "
{'EMBEDDING_DIM': 967, 'HIDDEN_DIM': 436, 'NUM_LAYERS': 1, 'DROPOUT': 0.041251861773306746, 'LR': 0.0014545137187257648, 'WEIGHT_0': 0.4942175068191102, 'WEIGHT_1': 0.5401703235090148, 'WEIGHT_2': 0.3270322686065953, 'WEIGHT_3': 0.9355371367707024, 'WEIGHT_4': 0.8806272415923303, 'WEIGHT_5': 0.5009853173351198, 'WEIGHT_6': 0.6638493584785878, 'WEIGHT_7': 0.37673628714892593, 'WEIGHT_8': 0.890804676138549, 'optimizer': 'RMSprop'}
0
              precision    recall  f1-score   support

         LOC       0.12      0.04      0.05      1837
        MISC       0.03      0.01      0.02       922
         ORG       0.10      0.06      0.07      1341
         PER       0.06      0.02      0.03      1842

   micro avg       0.08      0.03      0.04      5942
   macro avg       0.08      0.03      0.04      5942
weighted avg       0.08      0.03      0.04      5942

{'EMBEDDING_DIM': 967, 'HIDDEN_DIM': 436, 'NUM_LAYERS': 1, 'DROPOUT': 0.041251861773306746, 'LR': 0.0014545137187257648, 'WEIGHT_0': 0.4942175068191102, 'WEIGHT_1': 0.5401703235090148, 'WEIGHT_2': 0.3270322686065953, 'WEIGHT_3': 0.9355371367707024, 'WEIGHT_4': 0.8806272415923303, 'WEIGHT_5': 0.5009853173351198, 'WEIGHT_6': 0.6638493584785878, 'WEIGHT_7': 0.37673628714892593, 'WEIGHT_8': 0.890804676138549, 'optimizer': 'RMSprop'}
49
              precision    recall  f1-score   support

         LOC       0.57      0.53      0.55      1837
        MISC       0.47      0.44      0.45       922
         ORG       0.28      0.26      0.27      1341
         PER       0.32      0.35      0.34      1842

   micro avg       0.41      0.40      0.40      5942
   macro avg       0.41      0.39      0.40      5942
weighted avg       0.41      0.40      0.40      5942

epoch 49
LSTM
  0%|          | 0/50 [00:00<?, ?it/s]  2%|▏         | 1/50 [00:04<03:50,  4.70s/it]  4%|▍         | 2/50 [00:04<01:36,  2.01s/it]  6%|▌         | 3/50 [00:05<00:56,  1.21s/it]  8%|▊         | 4/50 [00:05<00:37,  1.21it/s] 10%|█         | 5/50 [00:05<00:27,  1.64it/s] 12%|█▏        | 6/50 [00:05<00:21,  2.06it/s] 14%|█▍        | 7/50 [00:06<00:17,  2.48it/s] 16%|█▌        | 8/50 [00:06<00:14,  2.85it/s] 18%|█▊        | 9/50 [00:06<00:12,  3.17it/s] 20%|██        | 10/50 [00:06<00:11,  3.43it/s] 22%|██▏       | 11/50 [00:06<00:10,  3.64it/s] 24%|██▍       | 12/50 [00:07<00:10,  3.79it/s] 26%|██▌       | 13/50 [00:07<00:09,  3.91it/s] 28%|██▊       | 14/50 [00:07<00:09,  3.99it/s] 30%|███       | 15/50 [00:07<00:08,  4.06it/s] 32%|███▏      | 16/50 [00:08<00:08,  4.10it/s] 34%|███▍      | 17/50 [00:08<00:07,  4.13it/s] 36%|███▌      | 18/50 [00:08<00:07,  4.15it/s] 38%|███▊      | 19/50 [00:08<00:07,  4.17it/s] 40%|████      | 20/50 [00:09<00:07,  4.18it/s] 42%|████▏     | 21/50 [00:09<00:06,  4.18it/s] 44%|████▍     | 22/50 [00:09<00:06,  4.19it/s] 46%|████▌     | 23/50 [00:09<00:06,  4.19it/s] 48%|████▊     | 24/50 [00:10<00:06,  4.19it/s] 50%|█████     | 25/50 [00:10<00:05,  4.19it/s] 52%|█████▏    | 26/50 [00:10<00:05,  4.20it/s] 54%|█████▍    | 27/50 [00:10<00:05,  4.19it/s] 56%|█████▌    | 28/50 [00:11<00:05,  4.19it/s] 58%|█████▊    | 29/50 [00:11<00:05,  4.19it/s] 60%|██████    | 30/50 [00:11<00:04,  4.19it/s] 62%|██████▏   | 31/50 [00:11<00:04,  4.20it/s] 64%|██████▍   | 32/50 [00:11<00:04,  4.20it/s] 66%|██████▌   | 33/50 [00:12<00:04,  4.19it/s] 68%|██████▊   | 34/50 [00:12<00:03,  4.20it/s] 70%|███████   | 35/50 [00:12<00:03,  4.20it/s] 72%|███████▏  | 36/50 [00:12<00:03,  4.20it/s] 74%|███████▍  | 37/50 [00:13<00:03,  4.20it/s] 76%|███████▌  | 38/50 [00:13<00:02,  4.20it/s] 78%|███████▊  | 39/50 [00:13<00:02,  4.19it/s] 80%|████████  | 40/50 [00:13<00:02,  4.19it/s] 82%|████████▏ | 41/50 [00:14<00:02,  4.19it/s] 84%|████████▍ | 42/50 [00:14<00:01,  4.19it/s] 86%|████████▌ | 43/50 [00:14<00:01,  4.19it/s] 88%|████████▊ | 44/50 [00:14<00:01,  4.19it/s] 90%|█████████ | 45/50 [00:15<00:01,  4.19it/s] 92%|█████████▏| 46/50 [00:15<00:00,  4.19it/s] 94%|█████████▍| 47/50 [00:15<00:00,  4.19it/s] 96%|█████████▌| 48/50 [00:15<00:00,  4.19it/s] 98%|█████████▊| 49/50 [00:16<00:00,  4.19it/s]100%|██████████| 50/50 [00:20<00:00,  1.62s/it]100%|██████████| 50/50 [00:20<00:00,  2.39it/s]
[I 2023-12-11 00:09:19,959] Trial 344 finished with value: 0.364137195663764 and parameters: {'EMBEDDING_DIM': 520, 'HIDDEN_DIM': 488, 'NUM_LAYERS': 1, 'DROPOUT': 0.4048546337219775, 'LR': 0.0006425813602581401, 'WEIGHT_0': 0.5191680148136887, 'WEIGHT_1': 0.5261048327036983, 'WEIGHT_2': 0.2592051678888936, 'WEIGHT_3': 0.8259440690201642, 'WEIGHT_4': 0.9666242802819607, 'WEIGHT_5': 0.5353948035000321, 'WEIGHT_6': 0.6865469113701934, 'WEIGHT_7': 0.6376394270670296, 'WEIGHT_8': 0.980364013086408, 'optimizer': 'RMSprop'}. Best is trial 221 with value: 0.418736930154747.
/userhome/cs2/dingruiw/conda/envs/py310/lib/python3.10/site-packages/torch/nn/modules/rnn.py:82: UserWarning: dropout option adds dropout after all but last recurrent layer, so non-zero dropout expects num_layers greater than 1, but got dropout=0.07548029197567718 and num_layers=1
  warnings.warn("dropout option adds dropout after all but last "
{'EMBEDDING_DIM': 520, 'HIDDEN_DIM': 488, 'NUM_LAYERS': 1, 'DROPOUT': 0.4048546337219775, 'LR': 0.0006425813602581401, 'WEIGHT_0': 0.5191680148136887, 'WEIGHT_1': 0.5261048327036983, 'WEIGHT_2': 0.2592051678888936, 'WEIGHT_3': 0.8259440690201642, 'WEIGHT_4': 0.9666242802819607, 'WEIGHT_5': 0.5353948035000321, 'WEIGHT_6': 0.6865469113701934, 'WEIGHT_7': 0.6376394270670296, 'WEIGHT_8': 0.980364013086408, 'optimizer': 'RMSprop'}
0
              precision    recall  f1-score   support

         LOC       0.06      0.03      0.04      1837
        MISC       0.04      0.02      0.03       922
         ORG       0.08      0.03      0.05      1341
         PER       0.02      0.00      0.01      1842

   micro avg       0.06      0.02      0.03      5942
   macro avg       0.05      0.02      0.03      5942
weighted avg       0.05      0.02      0.03      5942

{'EMBEDDING_DIM': 520, 'HIDDEN_DIM': 488, 'NUM_LAYERS': 1, 'DROPOUT': 0.4048546337219775, 'LR': 0.0006425813602581401, 'WEIGHT_0': 0.5191680148136887, 'WEIGHT_1': 0.5261048327036983, 'WEIGHT_2': 0.2592051678888936, 'WEIGHT_3': 0.8259440690201642, 'WEIGHT_4': 0.9666242802819607, 'WEIGHT_5': 0.5353948035000321, 'WEIGHT_6': 0.6865469113701934, 'WEIGHT_7': 0.6376394270670296, 'WEIGHT_8': 0.980364013086408, 'optimizer': 'RMSprop'}
49
              precision    recall  f1-score   support

         LOC       0.55      0.50      0.52      1837
        MISC       0.48      0.29      0.36       922
         ORG       0.24      0.20      0.22      1341
         PER       0.31      0.32      0.31      1842

   micro avg       0.39      0.34      0.36      5942
   macro avg       0.39      0.33      0.35      5942
weighted avg       0.39      0.34      0.36      5942

epoch 49
LSTM
  0%|          | 0/50 [00:00<?, ?it/s]  2%|▏         | 1/50 [00:04<03:53,  4.77s/it]  4%|▍         | 2/50 [00:04<01:37,  2.04s/it]  6%|▌         | 3/50 [00:05<00:57,  1.22s/it]  8%|▊         | 4/50 [00:05<00:38,  1.20it/s] 10%|█         | 5/50 [00:05<00:27,  1.62it/s] 12%|█▏        | 6/50 [00:05<00:21,  2.04it/s] 14%|█▍        | 7/50 [00:06<00:17,  2.45it/s] 16%|█▌        | 8/50 [00:06<00:14,  2.82it/s] 18%|█▊        | 9/50 [00:06<00:13,  3.15it/s] 20%|██        | 10/50 [00:06<00:11,  3.41it/s] 22%|██▏       | 11/50 [00:07<00:10,  3.62it/s] 24%|██▍       | 12/50 [00:07<00:10,  3.77it/s] 26%|██▌       | 13/50 [00:07<00:09,  3.89it/s] 28%|██▊       | 14/50 [00:07<00:09,  3.98it/s] 30%|███       | 15/50 [00:08<00:08,  4.04it/s] 32%|███▏      | 16/50 [00:08<00:08,  4.09it/s] 34%|███▍      | 17/50 [00:08<00:08,  4.12it/s] 36%|███▌      | 18/50 [00:08<00:07,  4.14it/s] 38%|███▊      | 19/50 [00:08<00:07,  4.16it/s] 40%|████      | 20/50 [00:09<00:07,  4.17it/s] 42%|████▏     | 21/50 [00:09<00:06,  4.18it/s] 44%|████▍     | 22/50 [00:09<00:06,  4.18it/s] 46%|████▌     | 23/50 [00:09<00:06,  4.19it/s] 48%|████▊     | 24/50 [00:10<00:06,  4.19it/s] 50%|█████     | 25/50 [00:10<00:05,  4.19it/s] 52%|█████▏    | 26/50 [00:10<00:05,  4.19it/s] 54%|█████▍    | 27/50 [00:10<00:05,  4.19it/s] 56%|█████▌    | 28/50 [00:11<00:05,  4.19it/s] 58%|█████▊    | 29/50 [00:11<00:05,  4.19it/s] 60%|██████    | 30/50 [00:11<00:04,  4.19it/s] 62%|██████▏   | 31/50 [00:11<00:04,  4.19it/s] 64%|██████▍   | 32/50 [00:12<00:04,  4.19it/s] 66%|██████▌   | 33/50 [00:12<00:04,  4.19it/s] 68%|██████▊   | 34/50 [00:12<00:03,  4.19it/s] 70%|███████   | 35/50 [00:12<00:03,  4.19it/s] 72%|███████▏  | 36/50 [00:13<00:03,  4.19it/s] 74%|███████▍  | 37/50 [00:13<00:03,  4.19it/s] 76%|███████▌  | 38/50 [00:13<00:02,  4.19it/s] 78%|███████▊  | 39/50 [00:13<00:02,  4.19it/s] 80%|████████  | 40/50 [00:13<00:02,  4.19it/s] 82%|████████▏ | 41/50 [00:14<00:02,  4.19it/s] 84%|████████▍ | 42/50 [00:14<00:01,  4.19it/s] 86%|████████▌ | 43/50 [00:14<00:01,  4.18it/s] 88%|████████▊ | 44/50 [00:14<00:01,  4.18it/s] 90%|█████████ | 45/50 [00:15<00:01,  4.19it/s] 92%|█████████▏| 46/50 [00:15<00:00,  4.18it/s] 94%|█████████▍| 47/50 [00:15<00:00,  4.18it/s] 96%|█████████▌| 48/50 [00:15<00:00,  4.18it/s] 98%|█████████▊| 49/50 [00:16<00:00,  4.18it/s]100%|██████████| 50/50 [00:20<00:00,  1.62s/it]100%|██████████| 50/50 [00:20<00:00,  2.38it/s]
