[I 2023-12-10 22:33:01,405] Trial 145 finished with value: 0.03498278049664673 and parameters: {'EMBEDDING_DIM': 1000, 'HIDDEN_DIM': 409, 'NUM_LAYERS': 1, 'DROPOUT': 0.33189825661376576, 'LR': 0.0019158975921299709, 'WEIGHT_0': 0.47304672472446296, 'WEIGHT_1': 0.4522694017195983, 'WEIGHT_2': 0.7170294167080462, 'WEIGHT_3': 0.9244102410168128, 'WEIGHT_4': 0.9990845316285916, 'WEIGHT_5': 0.46712445341217446, 'WEIGHT_6': 0.7817969516138692, 'WEIGHT_7': 0.45432859101209233, 'WEIGHT_8': 0.4225491250083192, 'optimizer': 'SGD'}. Best is trial 134 with value: 0.4158467115484205.
/userhome/cs2/dingruiw/conda/envs/py310/lib/python3.10/site-packages/torch/nn/modules/rnn.py:82: UserWarning: dropout option adds dropout after all but last recurrent layer, so non-zero dropout expects num_layers greater than 1, but got dropout=0.3619345679603393 and num_layers=1
  warnings.warn("dropout option adds dropout after all but last "
{'EMBEDDING_DIM': 1000, 'HIDDEN_DIM': 409, 'NUM_LAYERS': 1, 'DROPOUT': 0.33189825661376576, 'LR': 0.0019158975921299709, 'WEIGHT_0': 0.47304672472446296, 'WEIGHT_1': 0.4522694017195983, 'WEIGHT_2': 0.7170294167080462, 'WEIGHT_3': 0.9244102410168128, 'WEIGHT_4': 0.9990845316285916, 'WEIGHT_5': 0.46712445341217446, 'WEIGHT_6': 0.7817969516138692, 'WEIGHT_7': 0.45432859101209233, 'WEIGHT_8': 0.4225491250083192, 'optimizer': 'SGD'}
0
              precision    recall  f1-score   support

         LOC       0.04      0.21      0.07      1837
        MISC       0.01      0.08      0.02       922
         ORG       0.01      0.06      0.02      1341
         PER       0.02      0.07      0.03      1842

   micro avg       0.02      0.11      0.04      5942
   macro avg       0.02      0.11      0.03      5942
weighted avg       0.02      0.11      0.04      5942

{'EMBEDDING_DIM': 1000, 'HIDDEN_DIM': 409, 'NUM_LAYERS': 1, 'DROPOUT': 0.33189825661376576, 'LR': 0.0019158975921299709, 'WEIGHT_0': 0.47304672472446296, 'WEIGHT_1': 0.4522694017195983, 'WEIGHT_2': 0.7170294167080462, 'WEIGHT_3': 0.9244102410168128, 'WEIGHT_4': 0.9990845316285916, 'WEIGHT_5': 0.46712445341217446, 'WEIGHT_6': 0.7817969516138692, 'WEIGHT_7': 0.45432859101209233, 'WEIGHT_8': 0.4225491250083192, 'optimizer': 'SGD'}
49
              precision    recall  f1-score   support

         LOC       0.04      0.12      0.06      1837
        MISC       0.02      0.06      0.02       922
         ORG       0.02      0.04      0.02      1341
         PER       0.01      0.04      0.02      1842

   micro avg       0.02      0.06      0.03      5942
   macro avg       0.02      0.06      0.03      5942
weighted avg       0.02      0.06      0.03      5942

epoch 49
LSTM
  0%|          | 0/50 [00:00<?, ?it/s]  2%|▏         | 1/50 [00:04<03:53,  4.76s/it]  4%|▍         | 2/50 [00:04<01:37,  2.03s/it]  6%|▌         | 3/50 [00:05<00:57,  1.22s/it]  8%|▊         | 4/50 [00:05<00:37,  1.21it/s] 10%|█         | 5/50 [00:05<00:27,  1.65it/s] 12%|█▏        | 6/50 [00:05<00:20,  2.10it/s] 14%|█▍        | 7/50 [00:06<00:16,  2.53it/s] 16%|█▌        | 8/50 [00:06<00:14,  2.94it/s] 18%|█▊        | 9/50 [00:06<00:12,  3.29it/s] 20%|██        | 10/50 [00:06<00:11,  3.57it/s] 22%|██▏       | 11/50 [00:06<00:10,  3.80it/s] 24%|██▍       | 12/50 [00:07<00:09,  3.97it/s] 26%|██▌       | 13/50 [00:07<00:09,  4.11it/s] 28%|██▊       | 14/50 [00:07<00:08,  4.21it/s] 30%|███       | 15/50 [00:07<00:08,  4.28it/s] 32%|███▏      | 16/50 [00:08<00:07,  4.33it/s] 34%|███▍      | 17/50 [00:08<00:07,  4.37it/s] 36%|███▌      | 18/50 [00:08<00:07,  4.39it/s] 38%|███▊      | 19/50 [00:08<00:07,  4.40it/s] 40%|████      | 20/50 [00:08<00:06,  4.41it/s] 42%|████▏     | 21/50 [00:09<00:06,  4.43it/s] 44%|████▍     | 22/50 [00:09<00:06,  4.43it/s] 46%|████▌     | 23/50 [00:09<00:06,  4.43it/s] 48%|████▊     | 24/50 [00:09<00:05,  4.43it/s] 50%|█████     | 25/50 [00:10<00:05,  4.44it/s] 52%|█████▏    | 26/50 [00:10<00:05,  4.44it/s] 54%|█████▍    | 27/50 [00:10<00:05,  4.44it/s] 56%|█████▌    | 28/50 [00:10<00:04,  4.44it/s] 58%|█████▊    | 29/50 [00:10<00:04,  4.44it/s] 60%|██████    | 30/50 [00:11<00:04,  4.44it/s] 62%|██████▏   | 31/50 [00:11<00:04,  4.44it/s] 64%|██████▍   | 32/50 [00:11<00:04,  4.44it/s] 66%|██████▌   | 33/50 [00:11<00:03,  4.44it/s] 68%|██████▊   | 34/50 [00:12<00:03,  4.44it/s] 70%|███████   | 35/50 [00:12<00:03,  4.44it/s] 72%|███████▏  | 36/50 [00:12<00:03,  4.44it/s] 74%|███████▍  | 37/50 [00:12<00:02,  4.44it/s] 76%|███████▌  | 38/50 [00:13<00:02,  4.44it/s] 78%|███████▊  | 39/50 [00:13<00:02,  4.44it/s] 80%|████████  | 40/50 [00:13<00:02,  4.44it/s] 82%|████████▏ | 41/50 [00:13<00:02,  4.44it/s] 84%|████████▍ | 42/50 [00:13<00:01,  4.44it/s] 86%|████████▌ | 43/50 [00:14<00:01,  4.43it/s] 88%|████████▊ | 44/50 [00:14<00:01,  4.43it/s] 90%|█████████ | 45/50 [00:14<00:01,  4.43it/s] 92%|█████████▏| 46/50 [00:14<00:00,  4.44it/s] 94%|█████████▍| 47/50 [00:15<00:00,  4.43it/s] 96%|█████████▌| 48/50 [00:15<00:00,  4.44it/s] 98%|█████████▊| 49/50 [00:15<00:00,  4.43it/s]100%|██████████| 50/50 [00:20<00:00,  1.62s/it]100%|██████████| 50/50 [00:20<00:00,  2.45it/s]
[I 2023-12-10 22:33:26,057] Trial 146 finished with value: 0.40475767796911066 and parameters: {'EMBEDDING_DIM': 965, 'HIDDEN_DIM': 340, 'NUM_LAYERS': 1, 'DROPOUT': 0.3619345679603393, 'LR': 0.0025990755158617034, 'WEIGHT_0': 0.3689515153300866, 'WEIGHT_1': 0.7477331248960519, 'WEIGHT_2': 0.5817621408144846, 'WEIGHT_3': 0.687573429354262, 'WEIGHT_4': 0.8874717171793337, 'WEIGHT_5': 0.5451883972030813, 'WEIGHT_6': 0.7241775827816399, 'WEIGHT_7': 0.37384750663843186, 'WEIGHT_8': 0.48434101706025956, 'optimizer': 'RMSprop'}. Best is trial 134 with value: 0.4158467115484205.
/userhome/cs2/dingruiw/conda/envs/py310/lib/python3.10/site-packages/torch/nn/modules/rnn.py:82: UserWarning: dropout option adds dropout after all but last recurrent layer, so non-zero dropout expects num_layers greater than 1, but got dropout=0.38193173809516057 and num_layers=1
  warnings.warn("dropout option adds dropout after all but last "
{'EMBEDDING_DIM': 965, 'HIDDEN_DIM': 340, 'NUM_LAYERS': 1, 'DROPOUT': 0.3619345679603393, 'LR': 0.0025990755158617034, 'WEIGHT_0': 0.3689515153300866, 'WEIGHT_1': 0.7477331248960519, 'WEIGHT_2': 0.5817621408144846, 'WEIGHT_3': 0.687573429354262, 'WEIGHT_4': 0.8874717171793337, 'WEIGHT_5': 0.5451883972030813, 'WEIGHT_6': 0.7241775827816399, 'WEIGHT_7': 0.37384750663843186, 'WEIGHT_8': 0.48434101706025956, 'optimizer': 'RMSprop'}
0
              precision    recall  f1-score   support

         LOC       0.26      0.09      0.13      1837
        MISC       0.13      0.03      0.05       922
         ORG       0.16      0.05      0.08      1341
         PER       0.06      0.02      0.03      1842

   micro avg       0.15      0.05      0.08      5942
   macro avg       0.15      0.05      0.07      5942
weighted avg       0.15      0.05      0.08      5942

{'EMBEDDING_DIM': 965, 'HIDDEN_DIM': 340, 'NUM_LAYERS': 1, 'DROPOUT': 0.3619345679603393, 'LR': 0.0025990755158617034, 'WEIGHT_0': 0.3689515153300866, 'WEIGHT_1': 0.7477331248960519, 'WEIGHT_2': 0.5817621408144846, 'WEIGHT_3': 0.687573429354262, 'WEIGHT_4': 0.8874717171793337, 'WEIGHT_5': 0.5451883972030813, 'WEIGHT_6': 0.7241775827816399, 'WEIGHT_7': 0.37384750663843186, 'WEIGHT_8': 0.48434101706025956, 'optimizer': 'RMSprop'}
49
              precision    recall  f1-score   support

         LOC       0.56      0.52      0.54      1837
        MISC       0.47      0.42      0.44       922
         ORG       0.28      0.25      0.27      1341
         PER       0.38      0.33      0.35      1842

   micro avg       0.43      0.38      0.40      5942
   macro avg       0.42      0.38      0.40      5942
weighted avg       0.43      0.38      0.40      5942

epoch 49
LSTM
  0%|          | 0/50 [00:00<?, ?it/s]  2%|▏         | 1/50 [00:04<03:22,  4.13s/it]  6%|▌         | 3/50 [00:04<00:55,  1.17s/it]  8%|▊         | 4/50 [00:04<00:38,  1.21it/s] 10%|█         | 5/50 [00:04<00:27,  1.64it/s] 12%|█▏        | 6/50 [00:04<00:20,  2.14it/s] 14%|█▍        | 7/50 [00:05<00:16,  2.68it/s] 16%|█▌        | 8/50 [00:05<00:12,  3.24it/s] 18%|█▊        | 9/50 [00:05<00:10,  3.76it/s] 20%|██        | 10/50 [00:05<00:09,  4.24it/s] 22%|██▏       | 11/50 [00:05<00:08,  4.65it/s] 24%|██▍       | 12/50 [00:05<00:07,  4.98it/s] 26%|██▌       | 13/50 [00:06<00:07,  5.24it/s] 28%|██▊       | 14/50 [00:06<00:06,  5.44it/s] 30%|███       | 15/50 [00:06<00:06,  5.59it/s] 32%|███▏      | 16/50 [00:06<00:05,  5.70it/s] 34%|███▍      | 17/50 [00:06<00:05,  5.78it/s] 36%|███▌      | 18/50 [00:06<00:05,  5.83it/s] 38%|███▊      | 19/50 [00:07<00:05,  5.88it/s] 40%|████      | 20/50 [00:07<00:05,  5.91it/s] 42%|████▏     | 21/50 [00:07<00:04,  5.92it/s] 44%|████▍     | 22/50 [00:07<00:04,  5.94it/s] 46%|████▌     | 23/50 [00:07<00:04,  5.95it/s] 48%|████▊     | 24/50 [00:07<00:04,  5.95it/s] 50%|█████     | 25/50 [00:08<00:04,  5.96it/s] 52%|█████▏    | 26/50 [00:08<00:04,  5.96it/s] 54%|█████▍    | 27/50 [00:08<00:03,  5.96it/s] 56%|█████▌    | 28/50 [00:08<00:03,  5.96it/s] 58%|█████▊    | 29/50 [00:08<00:03,  5.97it/s] 60%|██████    | 30/50 [00:08<00:03,  5.97it/s] 62%|██████▏   | 31/50 [00:09<00:03,  5.97it/s] 64%|██████▍   | 32/50 [00:09<00:03,  5.96it/s] 66%|██████▌   | 33/50 [00:09<00:02,  5.97it/s] 68%|██████▊   | 34/50 [00:09<00:02,  5.97it/s] 70%|███████   | 35/50 [00:09<00:02,  5.97it/s] 72%|███████▏  | 36/50 [00:09<00:02,  5.97it/s] 74%|███████▍  | 37/50 [00:10<00:02,  5.97it/s] 76%|███████▌  | 38/50 [00:10<00:02,  5.97it/s] 78%|███████▊  | 39/50 [00:10<00:01,  5.97it/s] 80%|████████  | 40/50 [00:10<00:01,  5.97it/s] 82%|████████▏ | 41/50 [00:10<00:01,  5.97it/s] 84%|████████▍ | 42/50 [00:10<00:01,  5.97it/s] 86%|████████▌ | 43/50 [00:11<00:01,  5.96it/s] 88%|████████▊ | 44/50 [00:11<00:01,  5.97it/s] 90%|█████████ | 45/50 [00:11<00:00,  5.97it/s] 92%|█████████▏| 46/50 [00:11<00:00,  5.97it/s] 94%|█████████▍| 47/50 [00:11<00:00,  5.97it/s] 96%|█████████▌| 48/50 [00:11<00:00,  5.97it/s] 98%|█████████▊| 49/50 [00:12<00:00,  5.97it/s]100%|██████████| 50/50 [00:16<00:00,  1.42s/it]100%|██████████| 50/50 [00:16<00:00,  3.04it/s]
[I 2023-12-10 22:33:46,236] Trial 147 finished with value: 0.3850594227504245 and parameters: {'EMBEDDING_DIM': 979, 'HIDDEN_DIM': 140, 'NUM_LAYERS': 1, 'DROPOUT': 0.38193173809516057, 'LR': 0.0039016107675021996, 'WEIGHT_0': 0.42210588522832304, 'WEIGHT_1': 0.71921278758116, 'WEIGHT_2': 0.6538006908704184, 'WEIGHT_3': 0.6442628485518227, 'WEIGHT_4': 0.9507644563197817, 'WEIGHT_5': 0.4958915654865219, 'WEIGHT_6': 0.8333501476355494, 'WEIGHT_7': 0.39911241671144315, 'WEIGHT_8': 0.5159885139695131, 'optimizer': 'RMSprop'}. Best is trial 134 with value: 0.4158467115484205.
/userhome/cs2/dingruiw/conda/envs/py310/lib/python3.10/site-packages/torch/nn/modules/rnn.py:82: UserWarning: dropout option adds dropout after all but last recurrent layer, so non-zero dropout expects num_layers greater than 1, but got dropout=0.3007669533705954 and num_layers=1
  warnings.warn("dropout option adds dropout after all but last "
{'EMBEDDING_DIM': 979, 'HIDDEN_DIM': 140, 'NUM_LAYERS': 1, 'DROPOUT': 0.38193173809516057, 'LR': 0.0039016107675021996, 'WEIGHT_0': 0.42210588522832304, 'WEIGHT_1': 0.71921278758116, 'WEIGHT_2': 0.6538006908704184, 'WEIGHT_3': 0.6442628485518227, 'WEIGHT_4': 0.9507644563197817, 'WEIGHT_5': 0.4958915654865219, 'WEIGHT_6': 0.8333501476355494, 'WEIGHT_7': 0.39911241671144315, 'WEIGHT_8': 0.5159885139695131, 'optimizer': 'RMSprop'}
0
              precision    recall  f1-score   support

         LOC       0.41      0.15      0.22      1837
        MISC       0.10      0.02      0.04       922
         ORG       0.32      0.01      0.02      1341
         PER       0.13      0.01      0.03      1842

   micro avg       0.29      0.06      0.09      5942
   macro avg       0.24      0.05      0.08      5942
weighted avg       0.25      0.06      0.09      5942

{'EMBEDDING_DIM': 979, 'HIDDEN_DIM': 140, 'NUM_LAYERS': 1, 'DROPOUT': 0.38193173809516057, 'LR': 0.0039016107675021996, 'WEIGHT_0': 0.42210588522832304, 'WEIGHT_1': 0.71921278758116, 'WEIGHT_2': 0.6538006908704184, 'WEIGHT_3': 0.6442628485518227, 'WEIGHT_4': 0.9507644563197817, 'WEIGHT_5': 0.4958915654865219, 'WEIGHT_6': 0.8333501476355494, 'WEIGHT_7': 0.39911241671144315, 'WEIGHT_8': 0.5159885139695131, 'optimizer': 'RMSprop'}
49
              precision    recall  f1-score   support

         LOC       0.56      0.52      0.54      1837
        MISC       0.41      0.46      0.43       922
         ORG       0.27      0.27      0.27      1341
         PER       0.30      0.29      0.29      1842

   micro avg       0.39      0.38      0.39      5942
   macro avg       0.39      0.38      0.38      5942
weighted avg       0.39      0.38      0.39      5942

epoch 49
LSTM
  0%|          | 0/50 [00:00<?, ?it/s]  2%|▏         | 1/50 [00:04<03:50,  4.70s/it]  4%|▍         | 2/50 [00:04<01:35,  2.00s/it]  6%|▌         | 3/50 [00:05<00:55,  1.18s/it]  8%|▊         | 4/50 [00:05<00:36,  1.27it/s] 10%|█         | 5/50 [00:05<00:25,  1.76it/s] 12%|█▏        | 6/50 [00:05<00:19,  2.28it/s] 14%|█▍        | 7/50 [00:05<00:15,  2.82it/s] 16%|█▌        | 8/50 [00:05<00:12,  3.33it/s] 18%|█▊        | 9/50 [00:06<00:10,  3.79it/s] 20%|██        | 10/50 [00:06<00:09,  4.18it/s] 22%|██▏       | 11/50 [00:06<00:08,  4.50it/s] 24%|██▍       | 12/50 [00:06<00:08,  4.75it/s] 26%|██▌       | 13/50 [00:06<00:07,  4.93it/s] 28%|██▊       | 14/50 [00:07<00:07,  5.08it/s] 30%|███       | 15/50 [00:07<00:06,  5.18it/s] 32%|███▏      | 16/50 [00:07<00:06,  5.25it/s] 34%|███▍      | 17/50 [00:07<00:06,  5.31it/s] 36%|███▌      | 18/50 [00:07<00:05,  5.35it/s] 38%|███▊      | 19/50 [00:07<00:05,  5.37it/s] 40%|████      | 20/50 [00:08<00:05,  5.39it/s] 42%|████▏     | 21/50 [00:08<00:05,  5.40it/s] 44%|████▍     | 22/50 [00:08<00:05,  5.41it/s] 46%|████▌     | 23/50 [00:08<00:04,  5.42it/s] 48%|████▊     | 24/50 [00:08<00:04,  5.42it/s] 50%|█████     | 25/50 [00:09<00:04,  5.43it/s] 52%|█████▏    | 26/50 [00:09<00:04,  5.43it/s] 54%|█████▍    | 27/50 [00:09<00:04,  5.43it/s] 56%|█████▌    | 28/50 [00:09<00:04,  5.43it/s] 58%|█████▊    | 29/50 [00:09<00:03,  5.43it/s] 60%|██████    | 30/50 [00:09<00:03,  5.43it/s] 62%|██████▏   | 31/50 [00:10<00:03,  5.43it/s] 64%|██████▍   | 32/50 [00:10<00:03,  5.44it/s] 66%|██████▌   | 33/50 [00:10<00:03,  5.44it/s] 68%|██████▊   | 34/50 [00:10<00:02,  5.43it/s] 70%|███████   | 35/50 [00:10<00:02,  5.43it/s] 72%|███████▏  | 36/50 [00:11<00:02,  5.43it/s] 74%|███████▍  | 37/50 [00:11<00:02,  5.42it/s] 76%|███████▌  | 38/50 [00:11<00:02,  5.41it/s] 78%|███████▊  | 39/50 [00:11<00:02,  5.41it/s] 80%|████████  | 40/50 [00:11<00:01,  5.41it/s] 82%|████████▏ | 41/50 [00:12<00:01,  5.41it/s] 84%|████████▍ | 42/50 [00:12<00:01,  5.41it/s] 86%|████████▌ | 43/50 [00:12<00:01,  5.41it/s] 88%|████████▊ | 44/50 [00:12<00:01,  5.41it/s] 90%|█████████ | 45/50 [00:12<00:00,  5.40it/s] 92%|█████████▏| 46/50 [00:12<00:00,  5.40it/s] 94%|█████████▍| 47/50 [00:13<00:00,  5.40it/s] 96%|█████████▌| 48/50 [00:13<00:00,  5.40it/s] 98%|█████████▊| 49/50 [00:13<00:00,  5.40it/s]100%|██████████| 50/50 [00:18<00:00,  1.57s/it]100%|██████████| 50/50 [00:18<00:00,  2.73it/s]
[I 2023-12-10 22:34:08,778] Trial 148 finished with value: 0.39824945295404807 and parameters: {'EMBEDDING_DIM': 944, 'HIDDEN_DIM': 276, 'NUM_LAYERS': 1, 'DROPOUT': 0.3007669533705954, 'LR': 0.00243466464343678, 'WEIGHT_0': 0.38990496370678057, 'WEIGHT_1': 0.5320110324272743, 'WEIGHT_2': 0.613840214406178, 'WEIGHT_3': 0.8503119637938656, 'WEIGHT_4': 0.8609368192457004, 'WEIGHT_5': 0.6707274664749184, 'WEIGHT_6': 0.6939593849098366, 'WEIGHT_7': 0.4253881499927694, 'WEIGHT_8': 0.5616907213017535, 'optimizer': 'RMSprop'}. Best is trial 134 with value: 0.4158467115484205.
/userhome/cs2/dingruiw/conda/envs/py310/lib/python3.10/site-packages/torch/nn/modules/rnn.py:82: UserWarning: dropout option adds dropout after all but last recurrent layer, so non-zero dropout expects num_layers greater than 1, but got dropout=0.33819682624370406 and num_layers=1
  warnings.warn("dropout option adds dropout after all but last "
{'EMBEDDING_DIM': 944, 'HIDDEN_DIM': 276, 'NUM_LAYERS': 1, 'DROPOUT': 0.3007669533705954, 'LR': 0.00243466464343678, 'WEIGHT_0': 0.38990496370678057, 'WEIGHT_1': 0.5320110324272743, 'WEIGHT_2': 0.613840214406178, 'WEIGHT_3': 0.8503119637938656, 'WEIGHT_4': 0.8609368192457004, 'WEIGHT_5': 0.6707274664749184, 'WEIGHT_6': 0.6939593849098366, 'WEIGHT_7': 0.4253881499927694, 'WEIGHT_8': 0.5616907213017535, 'optimizer': 'RMSprop'}
0
              precision    recall  f1-score   support

         LOC       0.34      0.11      0.17      1837
        MISC       0.08      0.01      0.02       922
         ORG       0.17      0.01      0.02      1341
         PER       0.07      0.03      0.05      1842

   micro avg       0.18      0.05      0.08      5942
   macro avg       0.17      0.04      0.06      5942
weighted avg       0.18      0.05      0.07      5942

{'EMBEDDING_DIM': 944, 'HIDDEN_DIM': 276, 'NUM_LAYERS': 1, 'DROPOUT': 0.3007669533705954, 'LR': 0.00243466464343678, 'WEIGHT_0': 0.38990496370678057, 'WEIGHT_1': 0.5320110324272743, 'WEIGHT_2': 0.613840214406178, 'WEIGHT_3': 0.8503119637938656, 'WEIGHT_4': 0.8609368192457004, 'WEIGHT_5': 0.6707274664749184, 'WEIGHT_6': 0.6939593849098366, 'WEIGHT_7': 0.4253881499927694, 'WEIGHT_8': 0.5616907213017535, 'optimizer': 'RMSprop'}
49
              precision    recall  f1-score   support

         LOC       0.57      0.53      0.55      1837
        MISC       0.42      0.43      0.42       922
         ORG       0.28      0.24      0.26      1341
         PER       0.31      0.36      0.33      1842

   micro avg       0.40      0.40      0.40      5942
   macro avg       0.40      0.39      0.39      5942
weighted avg       0.40      0.40      0.40      5942

epoch 49
LSTM
  0%|          | 0/50 [00:00<?, ?it/s]  2%|▏         | 1/50 [00:04<03:52,  4.74s/it]  6%|▌         | 3/50 [00:05<01:02,  1.33s/it]  8%|▊         | 4/50 [00:05<00:42,  1.08it/s] 10%|█         | 5/50 [00:05<00:30,  1.48it/s] 12%|█▏        | 6/50 [00:05<00:22,  1.96it/s] 14%|█▍        | 7/50 [00:05<00:17,  2.50it/s] 16%|█▌        | 8/50 [00:05<00:13,  3.06it/s] 18%|█▊        | 9/50 [00:05<00:11,  3.62it/s] 20%|██        | 10/50 [00:06<00:09,  4.14it/s] 22%|██▏       | 11/50 [00:06<00:08,  4.60it/s] 24%|██▍       | 12/50 [00:06<00:07,  4.98it/s] 26%|██▌       | 13/50 [00:06<00:06,  5.29it/s] 28%|██▊       | 14/50 [00:06<00:06,  5.53it/s] 30%|███       | 15/50 [00:06<00:06,  5.70it/s] 32%|███▏      | 16/50 [00:07<00:05,  5.83it/s] 34%|███▍      | 17/50 [00:07<00:05,  5.93it/s] 36%|███▌      | 18/50 [00:07<00:05,  6.00it/s] 38%|███▊      | 19/50 [00:07<00:05,  6.05it/s] 40%|████      | 20/50 [00:07<00:04,  6.09it/s] 42%|████▏     | 21/50 [00:07<00:04,  6.11it/s] 44%|████▍     | 22/50 [00:08<00:04,  6.13it/s] 46%|████▌     | 23/50 [00:08<00:04,  6.14it/s] 48%|████▊     | 24/50 [00:08<00:04,  6.15it/s] 50%|█████     | 25/50 [00:08<00:04,  6.16it/s] 52%|█████▏    | 26/50 [00:08<00:03,  6.16it/s] 54%|█████▍    | 27/50 [00:08<00:03,  6.16it/s] 56%|█████▌    | 28/50 [00:09<00:03,  6.16it/s] 58%|█████▊    | 29/50 [00:09<00:03,  6.16it/s] 60%|██████    | 30/50 [00:09<00:03,  6.16it/s] 62%|██████▏   | 31/50 [00:09<00:03,  6.16it/s] 64%|██████▍   | 32/50 [00:09<00:02,  6.16it/s] 66%|██████▌   | 33/50 [00:09<00:02,  6.16it/s] 68%|██████▊   | 34/50 [00:10<00:02,  6.16it/s] 70%|███████   | 35/50 [00:10<00:02,  6.16it/s] 72%|███████▏  | 36/50 [00:10<00:02,  6.16it/s] 74%|███████▍  | 37/50 [00:10<00:02,  6.16it/s] 76%|███████▌  | 38/50 [00:10<00:01,  6.16it/s] 78%|███████▊  | 39/50 [00:10<00:01,  6.16it/s] 80%|████████  | 40/50 [00:11<00:01,  6.16it/s] 82%|████████▏ | 41/50 [00:11<00:01,  6.17it/s] 84%|████████▍ | 42/50 [00:11<00:01,  6.17it/s] 86%|████████▌ | 43/50 [00:11<00:01,  6.16it/s] 88%|████████▊ | 44/50 [00:11<00:00,  6.16it/s] 90%|█████████ | 45/50 [00:11<00:00,  6.15it/s] 92%|█████████▏| 46/50 [00:11<00:00,  6.15it/s] 94%|█████████▍| 47/50 [00:12<00:00,  6.15it/s] 96%|█████████▌| 48/50 [00:12<00:00,  6.14it/s] 98%|█████████▊| 49/50 [00:12<00:00,  6.14it/s]100%|██████████| 50/50 [00:17<00:00,  1.56s/it]100%|██████████| 50/50 [00:17<00:00,  2.89it/s]
