[I 2023-12-10 23:08:03,809] Trial 213 finished with value: 0.3994887089902003 and parameters: {'EMBEDDING_DIM': 1003, 'HIDDEN_DIM': 351, 'NUM_LAYERS': 1, 'DROPOUT': 0.18811033548992612, 'LR': 0.0011338186040708515, 'WEIGHT_0': 0.46403818052938706, 'WEIGHT_1': 0.5325545331898194, 'WEIGHT_2': 0.5268384111493161, 'WEIGHT_3': 0.9807933997396233, 'WEIGHT_4': 0.8774265325150424, 'WEIGHT_5': 0.5362503493793598, 'WEIGHT_6': 0.429090877758948, 'WEIGHT_7': 0.29947461785165996, 'WEIGHT_8': 0.5565579739952555, 'optimizer': 'RMSprop'}. Best is trial 134 with value: 0.4158467115484205.
/userhome/cs2/dingruiw/conda/envs/py310/lib/python3.10/site-packages/torch/nn/modules/rnn.py:82: UserWarning: dropout option adds dropout after all but last recurrent layer, so non-zero dropout expects num_layers greater than 1, but got dropout=0.3703180541893155 and num_layers=1
  warnings.warn("dropout option adds dropout after all but last "
{'EMBEDDING_DIM': 1003, 'HIDDEN_DIM': 351, 'NUM_LAYERS': 1, 'DROPOUT': 0.18811033548992612, 'LR': 0.0011338186040708515, 'WEIGHT_0': 0.46403818052938706, 'WEIGHT_1': 0.5325545331898194, 'WEIGHT_2': 0.5268384111493161, 'WEIGHT_3': 0.9807933997396233, 'WEIGHT_4': 0.8774265325150424, 'WEIGHT_5': 0.5362503493793598, 'WEIGHT_6': 0.429090877758948, 'WEIGHT_7': 0.29947461785165996, 'WEIGHT_8': 0.5565579739952555, 'optimizer': 'RMSprop'}
0
              precision    recall  f1-score   support

         LOC       0.25      0.07      0.11      1837
        MISC       0.05      0.02      0.03       922
         ORG       0.08      0.04      0.06      1341
         PER       0.06      0.02      0.03      1842

   micro avg       0.11      0.04      0.06      5942
   macro avg       0.11      0.04      0.06      5942
weighted avg       0.12      0.04      0.06      5942

{'EMBEDDING_DIM': 1003, 'HIDDEN_DIM': 351, 'NUM_LAYERS': 1, 'DROPOUT': 0.18811033548992612, 'LR': 0.0011338186040708515, 'WEIGHT_0': 0.46403818052938706, 'WEIGHT_1': 0.5325545331898194, 'WEIGHT_2': 0.5268384111493161, 'WEIGHT_3': 0.9807933997396233, 'WEIGHT_4': 0.8774265325150424, 'WEIGHT_5': 0.5362503493793598, 'WEIGHT_6': 0.429090877758948, 'WEIGHT_7': 0.29947461785165996, 'WEIGHT_8': 0.5565579739952555, 'optimizer': 'RMSprop'}
49
              precision    recall  f1-score   support

         LOC       0.57      0.51      0.54      1837
        MISC       0.44      0.43      0.43       922
         ORG       0.29      0.26      0.27      1341
         PER       0.32      0.36      0.34      1842

   micro avg       0.40      0.39      0.40      5942
   macro avg       0.41      0.39      0.40      5942
weighted avg       0.41      0.39      0.40      5942

epoch 49
LSTM
  0%|          | 0/50 [00:00<?, ?it/s]  2%|▏         | 1/50 [00:04<03:56,  4.83s/it]  4%|▍         | 2/50 [00:05<01:40,  2.09s/it]  6%|▌         | 3/50 [00:05<01:00,  1.29s/it]  8%|▊         | 4/50 [00:05<00:41,  1.10it/s] 10%|█         | 5/50 [00:06<00:31,  1.43it/s] 12%|█▏        | 6/50 [00:06<00:25,  1.74it/s] 14%|█▍        | 7/50 [00:06<00:21,  2.02it/s] 16%|█▌        | 8/50 [00:06<00:18,  2.27it/s] 18%|█▊        | 9/50 [00:07<00:16,  2.46it/s] 20%|██        | 10/50 [00:07<00:15,  2.62it/s] 22%|██▏       | 11/50 [00:07<00:14,  2.74it/s] 24%|██▍       | 12/50 [00:08<00:13,  2.82it/s] 26%|██▌       | 13/50 [00:08<00:12,  2.88it/s] 28%|██▊       | 14/50 [00:08<00:12,  2.93it/s] 30%|███       | 15/50 [00:09<00:11,  2.96it/s] 32%|███▏      | 16/50 [00:09<00:11,  2.98it/s] 34%|███▍      | 17/50 [00:09<00:11,  3.00it/s] 36%|███▌      | 18/50 [00:10<00:10,  3.01it/s] 38%|███▊      | 19/50 [00:10<00:10,  3.02it/s] 40%|████      | 20/50 [00:10<00:09,  3.03it/s] 42%|████▏     | 21/50 [00:11<00:09,  3.03it/s] 44%|████▍     | 22/50 [00:11<00:09,  3.04it/s] 46%|████▌     | 23/50 [00:11<00:08,  3.04it/s] 48%|████▊     | 24/50 [00:12<00:08,  3.04it/s] 50%|█████     | 25/50 [00:12<00:08,  3.04it/s] 52%|█████▏    | 26/50 [00:12<00:07,  3.04it/s] 54%|█████▍    | 27/50 [00:13<00:07,  3.04it/s] 56%|█████▌    | 28/50 [00:13<00:07,  3.04it/s] 58%|█████▊    | 29/50 [00:13<00:06,  3.04it/s] 60%|██████    | 30/50 [00:14<00:06,  3.04it/s] 62%|██████▏   | 31/50 [00:14<00:06,  3.04it/s] 64%|██████▍   | 32/50 [00:14<00:05,  3.04it/s] 66%|██████▌   | 33/50 [00:15<00:05,  3.04it/s] 68%|██████▊   | 34/50 [00:15<00:05,  3.04it/s] 70%|███████   | 35/50 [00:15<00:04,  3.04it/s] 72%|███████▏  | 36/50 [00:16<00:04,  3.04it/s] 74%|███████▍  | 37/50 [00:16<00:04,  3.04it/s] 76%|███████▌  | 38/50 [00:16<00:03,  3.04it/s] 78%|███████▊  | 39/50 [00:17<00:03,  3.04it/s] 80%|████████  | 40/50 [00:17<00:03,  3.03it/s] 82%|████████▏ | 41/50 [00:17<00:02,  3.03it/s] 84%|████████▍ | 42/50 [00:18<00:02,  3.04it/s] 86%|████████▌ | 43/50 [00:18<00:02,  3.03it/s] 88%|████████▊ | 44/50 [00:18<00:01,  3.03it/s] 90%|█████████ | 45/50 [00:19<00:01,  3.03it/s] 92%|█████████▏| 46/50 [00:19<00:01,  3.03it/s] 94%|█████████▍| 47/50 [00:19<00:00,  3.03it/s] 96%|█████████▌| 48/50 [00:20<00:00,  3.03it/s] 98%|█████████▊| 49/50 [00:20<00:00,  3.03it/s]100%|██████████| 50/50 [00:25<00:00,  1.73s/it]100%|██████████| 50/50 [00:25<00:00,  1.96it/s]
[I 2023-12-10 23:08:33,542] Trial 214 finished with value: 0.35900159320233666 and parameters: {'EMBEDDING_DIM': 973, 'HIDDEN_DIM': 507, 'NUM_LAYERS': 1, 'DROPOUT': 0.3703180541893155, 'LR': 0.0013939527131636071, 'WEIGHT_0': 0.5171092604087792, 'WEIGHT_1': 0.5237098839843592, 'WEIGHT_2': 0.0026681006220621584, 'WEIGHT_3': 0.941165961994761, 'WEIGHT_4': 0.7700835552969854, 'WEIGHT_5': 0.709641380769169, 'WEIGHT_6': 0.6727480173034281, 'WEIGHT_7': 0.35250345511532066, 'WEIGHT_8': 0.5168853433759406, 'optimizer': 'RMSprop'}. Best is trial 134 with value: 0.4158467115484205.
/userhome/cs2/dingruiw/conda/envs/py310/lib/python3.10/site-packages/torch/nn/modules/rnn.py:82: UserWarning: dropout option adds dropout after all but last recurrent layer, so non-zero dropout expects num_layers greater than 1, but got dropout=0.2916922919893603 and num_layers=1
  warnings.warn("dropout option adds dropout after all but last "
{'EMBEDDING_DIM': 973, 'HIDDEN_DIM': 507, 'NUM_LAYERS': 1, 'DROPOUT': 0.3703180541893155, 'LR': 0.0013939527131636071, 'WEIGHT_0': 0.5171092604087792, 'WEIGHT_1': 0.5237098839843592, 'WEIGHT_2': 0.0026681006220621584, 'WEIGHT_3': 0.941165961994761, 'WEIGHT_4': 0.7700835552969854, 'WEIGHT_5': 0.709641380769169, 'WEIGHT_6': 0.6727480173034281, 'WEIGHT_7': 0.35250345511532066, 'WEIGHT_8': 0.5168853433759406, 'optimizer': 'RMSprop'}
0
              precision    recall  f1-score   support

         LOC       0.20      0.08      0.12      1837
        MISC       0.02      0.02      0.02       922
         ORG       0.10      0.04      0.06      1341
         PER       0.04      0.01      0.02      1842

   micro avg       0.09      0.04      0.06      5942
   macro avg       0.09      0.04      0.05      5942
weighted avg       0.10      0.04      0.06      5942

{'EMBEDDING_DIM': 973, 'HIDDEN_DIM': 507, 'NUM_LAYERS': 1, 'DROPOUT': 0.3703180541893155, 'LR': 0.0013939527131636071, 'WEIGHT_0': 0.5171092604087792, 'WEIGHT_1': 0.5237098839843592, 'WEIGHT_2': 0.0026681006220621584, 'WEIGHT_3': 0.941165961994761, 'WEIGHT_4': 0.7700835552969854, 'WEIGHT_5': 0.709641380769169, 'WEIGHT_6': 0.6727480173034281, 'WEIGHT_7': 0.35250345511532066, 'WEIGHT_8': 0.5168853433759406, 'optimizer': 'RMSprop'}
49
              precision    recall  f1-score   support

         LOC       0.52      0.56      0.54      1837
        MISC       0.09      0.02      0.03       922
         ORG       0.26      0.26      0.26      1341
         PER       0.34      0.34      0.34      1842

   micro avg       0.38      0.34      0.36      5942
   macro avg       0.30      0.30      0.29      5942
weighted avg       0.34      0.34      0.34      5942

epoch 49
LSTM
  0%|          | 0/50 [00:00<?, ?it/s]  2%|▏         | 1/50 [00:04<03:49,  4.68s/it]  4%|▍         | 2/50 [00:04<01:35,  1.99s/it]  6%|▌         | 3/50 [00:04<00:55,  1.18s/it]  8%|▊         | 4/50 [00:05<00:36,  1.26it/s] 10%|█         | 5/50 [00:05<00:26,  1.73it/s] 12%|█▏        | 6/50 [00:05<00:19,  2.22it/s] 14%|█▍        | 7/50 [00:05<00:15,  2.71it/s] 16%|█▌        | 8/50 [00:06<00:13,  3.16it/s] 18%|█▊        | 9/50 [00:06<00:11,  3.56it/s] 20%|██        | 10/50 [00:06<00:10,  3.90it/s] 22%|██▏       | 11/50 [00:06<00:09,  4.16it/s] 24%|██▍       | 12/50 [00:06<00:08,  4.37it/s] 26%|██▌       | 13/50 [00:07<00:08,  4.52it/s] 28%|██▊       | 14/50 [00:07<00:07,  4.64it/s] 30%|███       | 15/50 [00:07<00:07,  4.72it/s] 32%|███▏      | 16/50 [00:07<00:07,  4.78it/s] 34%|███▍      | 17/50 [00:07<00:06,  4.82it/s] 36%|███▌      | 18/50 [00:08<00:06,  4.85it/s] 38%|███▊      | 19/50 [00:08<00:06,  4.87it/s] 40%|████      | 20/50 [00:08<00:06,  4.89it/s] 42%|████▏     | 21/50 [00:08<00:05,  4.90it/s] 44%|████▍     | 22/50 [00:08<00:05,  4.91it/s] 46%|████▌     | 23/50 [00:09<00:05,  4.91it/s] 48%|████▊     | 24/50 [00:09<00:05,  4.91it/s] 50%|█████     | 25/50 [00:09<00:05,  4.92it/s] 52%|█████▏    | 26/50 [00:09<00:04,  4.92it/s] 54%|█████▍    | 27/50 [00:09<00:04,  4.92it/s] 56%|█████▌    | 28/50 [00:10<00:04,  4.92it/s] 58%|█████▊    | 29/50 [00:10<00:04,  4.92it/s] 60%|██████    | 30/50 [00:10<00:04,  4.92it/s] 62%|██████▏   | 31/50 [00:10<00:03,  4.92it/s] 64%|██████▍   | 32/50 [00:10<00:03,  4.92it/s] 66%|██████▌   | 33/50 [00:11<00:03,  4.92it/s] 68%|██████▊   | 34/50 [00:11<00:03,  4.92it/s] 70%|███████   | 35/50 [00:11<00:03,  4.92it/s] 72%|███████▏  | 36/50 [00:11<00:02,  4.91it/s] 74%|███████▍  | 37/50 [00:11<00:02,  4.91it/s] 76%|███████▌  | 38/50 [00:12<00:02,  4.91it/s] 78%|███████▊  | 39/50 [00:12<00:02,  4.91it/s] 80%|████████  | 40/50 [00:12<00:02,  4.91it/s] 82%|████████▏ | 41/50 [00:12<00:01,  4.92it/s] 84%|████████▍ | 42/50 [00:12<00:01,  4.92it/s] 86%|████████▌ | 43/50 [00:13<00:01,  4.92it/s] 88%|████████▊ | 44/50 [00:13<00:01,  4.92it/s] 90%|█████████ | 45/50 [00:13<00:01,  4.92it/s] 92%|█████████▏| 46/50 [00:13<00:00,  4.92it/s] 94%|█████████▍| 47/50 [00:13<00:00,  4.92it/s] 96%|█████████▌| 48/50 [00:14<00:00,  4.92it/s] 98%|█████████▊| 49/50 [00:14<00:00,  4.92it/s]100%|██████████| 50/50 [00:19<00:00,  1.62s/it]100%|██████████| 50/50 [00:19<00:00,  2.60it/s]
[I 2023-12-10 23:08:57,027] Trial 215 finished with value: 0.40102276476410426 and parameters: {'EMBEDDING_DIM': 937, 'HIDDEN_DIM': 293, 'NUM_LAYERS': 1, 'DROPOUT': 0.2916922919893603, 'LR': 0.0015995921424808686, 'WEIGHT_0': 0.36900041552418966, 'WEIGHT_1': 0.7585273827028451, 'WEIGHT_2': 0.34859031874529656, 'WEIGHT_3': 0.9643424438015364, 'WEIGHT_4': 0.8262473655716528, 'WEIGHT_5': 0.5979992537641422, 'WEIGHT_6': 0.5334265133023762, 'WEIGHT_7': 0.33147844655169256, 'WEIGHT_8': 0.43249506487561495, 'optimizer': 'RMSprop'}. Best is trial 134 with value: 0.4158467115484205.
/userhome/cs2/dingruiw/conda/envs/py310/lib/python3.10/site-packages/torch/nn/modules/rnn.py:82: UserWarning: dropout option adds dropout after all but last recurrent layer, so non-zero dropout expects num_layers greater than 1, but got dropout=0.34924720320592156 and num_layers=1
  warnings.warn("dropout option adds dropout after all but last "
{'EMBEDDING_DIM': 937, 'HIDDEN_DIM': 293, 'NUM_LAYERS': 1, 'DROPOUT': 0.2916922919893603, 'LR': 0.0015995921424808686, 'WEIGHT_0': 0.36900041552418966, 'WEIGHT_1': 0.7585273827028451, 'WEIGHT_2': 0.34859031874529656, 'WEIGHT_3': 0.9643424438015364, 'WEIGHT_4': 0.8262473655716528, 'WEIGHT_5': 0.5979992537641422, 'WEIGHT_6': 0.5334265133023762, 'WEIGHT_7': 0.33147844655169256, 'WEIGHT_8': 0.43249506487561495, 'optimizer': 'RMSprop'}
0
              precision    recall  f1-score   support

         LOC       0.32      0.22      0.26      1837
        MISC       0.05      0.03      0.04       922
         ORG       0.16      0.06      0.09      1341
         PER       0.05      0.03      0.03      1842

   micro avg       0.17      0.09      0.12      5942
   macro avg       0.15      0.08      0.11      5942
weighted avg       0.16      0.09      0.12      5942

{'EMBEDDING_DIM': 937, 'HIDDEN_DIM': 293, 'NUM_LAYERS': 1, 'DROPOUT': 0.2916922919893603, 'LR': 0.0015995921424808686, 'WEIGHT_0': 0.36900041552418966, 'WEIGHT_1': 0.7585273827028451, 'WEIGHT_2': 0.34859031874529656, 'WEIGHT_3': 0.9643424438015364, 'WEIGHT_4': 0.8262473655716528, 'WEIGHT_5': 0.5979992537641422, 'WEIGHT_6': 0.5334265133023762, 'WEIGHT_7': 0.33147844655169256, 'WEIGHT_8': 0.43249506487561495, 'optimizer': 'RMSprop'}
49
              precision    recall  f1-score   support

         LOC       0.54      0.55      0.54      1837
        MISC       0.47      0.43      0.45       922
         ORG       0.26      0.27      0.26      1341
         PER       0.32      0.37      0.34      1842

   micro avg       0.39      0.41      0.40      5942
   macro avg       0.40      0.40      0.40      5942
weighted avg       0.40      0.41      0.40      5942

epoch 49
LSTM
  0%|          | 0/50 [00:00<?, ?it/s]  2%|▏         | 1/50 [00:04<03:52,  4.74s/it]  4%|▍         | 2/50 [00:04<01:37,  2.04s/it]  6%|▌         | 3/50 [00:05<00:57,  1.23s/it]  8%|▊         | 4/50 [00:05<00:39,  1.18it/s] 10%|█         | 5/50 [00:05<00:28,  1.57it/s] 12%|█▏        | 6/50 [00:05<00:22,  1.95it/s] 14%|█▍        | 7/50 [00:06<00:18,  2.32it/s] 16%|█▌        | 8/50 [00:06<00:15,  2.64it/s] 18%|█▊        | 9/50 [00:06<00:14,  2.91it/s] 20%|██        | 10/50 [00:07<00:12,  3.13it/s] 22%|██▏       | 11/50 [00:07<00:11,  3.30it/s] 24%|██▍       | 12/50 [00:07<00:11,  3.43it/s] 26%|██▌       | 13/50 [00:07<00:10,  3.52it/s] 28%|██▊       | 14/50 [00:08<00:10,  3.59it/s] 30%|███       | 15/50 [00:08<00:09,  3.64it/s] 32%|███▏      | 16/50 [00:08<00:09,  3.67it/s] 34%|███▍      | 17/50 [00:08<00:08,  3.70it/s] 36%|███▌      | 18/50 [00:09<00:08,  3.72it/s] 38%|███▊      | 19/50 [00:09<00:08,  3.73it/s] 40%|████      | 20/50 [00:09<00:08,  3.74it/s] 42%|████▏     | 21/50 [00:09<00:07,  3.74it/s] 44%|████▍     | 22/50 [00:10<00:07,  3.75it/s] 46%|████▌     | 23/50 [00:10<00:07,  3.75it/s] 48%|████▊     | 24/50 [00:10<00:06,  3.75it/s] 50%|█████     | 25/50 [00:11<00:06,  3.75it/s] 52%|█████▏    | 26/50 [00:11<00:06,  3.75it/s] 54%|█████▍    | 27/50 [00:11<00:06,  3.75it/s] 56%|█████▌    | 28/50 [00:11<00:05,  3.75it/s] 58%|█████▊    | 29/50 [00:12<00:05,  3.75it/s] 60%|██████    | 30/50 [00:12<00:05,  3.75it/s] 62%|██████▏   | 31/50 [00:12<00:05,  3.75it/s] 64%|██████▍   | 32/50 [00:12<00:04,  3.75it/s] 66%|██████▌   | 33/50 [00:13<00:04,  3.75it/s] 68%|██████▊   | 34/50 [00:13<00:04,  3.75it/s] 70%|███████   | 35/50 [00:13<00:03,  3.75it/s] 72%|███████▏  | 36/50 [00:13<00:03,  3.75it/s] 74%|███████▍  | 37/50 [00:14<00:03,  3.75it/s] 76%|███████▌  | 38/50 [00:14<00:03,  3.75it/s] 78%|███████▊  | 39/50 [00:14<00:02,  3.75it/s] 80%|████████  | 40/50 [00:15<00:02,  3.75it/s] 82%|████████▏ | 41/50 [00:15<00:02,  3.75it/s] 84%|████████▍ | 42/50 [00:15<00:02,  3.75it/s] 86%|████████▌ | 43/50 [00:15<00:01,  3.75it/s] 88%|████████▊ | 44/50 [00:16<00:01,  3.74it/s] 90%|█████████ | 45/50 [00:16<00:01,  3.74it/s] 92%|█████████▏| 46/50 [00:16<00:01,  3.74it/s] 94%|█████████▍| 47/50 [00:16<00:00,  3.74it/s] 96%|█████████▌| 48/50 [00:17<00:00,  3.74it/s] 98%|█████████▊| 49/50 [00:17<00:00,  3.74it/s]100%|██████████| 50/50 [00:22<00:00,  1.69s/it]100%|██████████| 50/50 [00:22<00:00,  2.23it/s]
[I 2023-12-10 23:09:23,705] Trial 216 finished with value: 0.40131351538195636 and parameters: {'EMBEDDING_DIM': 991, 'HIDDEN_DIM': 398, 'NUM_LAYERS': 1, 'DROPOUT': 0.34924720320592156, 'LR': 0.0009172217980212977, 'WEIGHT_0': 0.4199214291283025, 'WEIGHT_1': 0.592213380403446, 'WEIGHT_2': 0.5760476037714067, 'WEIGHT_3': 0.7597870865771708, 'WEIGHT_4': 0.5327369615148267, 'WEIGHT_5': 0.5275254279059262, 'WEIGHT_6': 0.5801606379404087, 'WEIGHT_7': 0.4131235320070251, 'WEIGHT_8': 0.5897796746014271, 'optimizer': 'RMSprop'}. Best is trial 134 with value: 0.4158467115484205.
/userhome/cs2/dingruiw/conda/envs/py310/lib/python3.10/site-packages/torch/nn/modules/rnn.py:82: UserWarning: dropout option adds dropout after all but last recurrent layer, so non-zero dropout expects num_layers greater than 1, but got dropout=0.36153294405526937 and num_layers=1
  warnings.warn("dropout option adds dropout after all but last "
{'EMBEDDING_DIM': 991, 'HIDDEN_DIM': 398, 'NUM_LAYERS': 1, 'DROPOUT': 0.34924720320592156, 'LR': 0.0009172217980212977, 'WEIGHT_0': 0.4199214291283025, 'WEIGHT_1': 0.592213380403446, 'WEIGHT_2': 0.5760476037714067, 'WEIGHT_3': 0.7597870865771708, 'WEIGHT_4': 0.5327369615148267, 'WEIGHT_5': 0.5275254279059262, 'WEIGHT_6': 0.5801606379404087, 'WEIGHT_7': 0.4131235320070251, 'WEIGHT_8': 0.5897796746014271, 'optimizer': 'RMSprop'}
0
              precision    recall  f1-score   support

         LOC       0.15      0.05      0.08      1837
        MISC       0.04      0.02      0.02       922
         ORG       0.08      0.05      0.06      1341
         PER       0.06      0.02      0.03      1842

   micro avg       0.08      0.04      0.05      5942
   macro avg       0.08      0.04      0.05      5942
weighted avg       0.09      0.04      0.05      5942

{'EMBEDDING_DIM': 991, 'HIDDEN_DIM': 398, 'NUM_LAYERS': 1, 'DROPOUT': 0.34924720320592156, 'LR': 0.0009172217980212977, 'WEIGHT_0': 0.4199214291283025, 'WEIGHT_1': 0.592213380403446, 'WEIGHT_2': 0.5760476037714067, 'WEIGHT_3': 0.7597870865771708, 'WEIGHT_4': 0.5327369615148267, 'WEIGHT_5': 0.5275254279059262, 'WEIGHT_6': 0.5801606379404087, 'WEIGHT_7': 0.4131235320070251, 'WEIGHT_8': 0.5897796746014271, 'optimizer': 'RMSprop'}
49
              precision    recall  f1-score   support

         LOC       0.57      0.52      0.55      1837
        MISC       0.40      0.45      0.42       922
         ORG       0.29      0.24      0.27      1341
         PER       0.34      0.33      0.34      1842

   micro avg       0.41      0.39      0.40      5942
   macro avg       0.40      0.39      0.39      5942
weighted avg       0.41      0.39      0.40      5942

epoch 49
LSTM
  0%|          | 0/50 [00:00<?, ?it/s]  2%|▏         | 1/50 [00:04<03:55,  4.82s/it]  4%|▍         | 2/50 [00:04<01:39,  2.08s/it]  6%|▌         | 3/50 [00:05<00:59,  1.27s/it]  8%|▊         | 4/50 [00:05<00:41,  1.12it/s] 10%|█         | 5/50 [00:05<00:30,  1.46it/s] 12%|█▏        | 6/50 [00:06<00:24,  1.79it/s] 14%|█▍        | 7/50 [00:06<00:20,  2.09it/s] 16%|█▌        | 8/50 [00:06<00:17,  2.34it/s] 18%|█▊        | 9/50 [00:07<00:16,  2.55it/s] 20%|██        | 10/50 [00:07<00:14,  2.72it/s] 22%|██▏       | 11/50 [00:07<00:13,  2.84it/s] 24%|██▍       | 12/50 [00:08<00:12,  2.94it/s] 26%|██▌       | 13/50 [00:08<00:12,  3.01it/s] 28%|██▊       | 14/50 [00:08<00:11,  3.06it/s] 30%|███       | 15/50 [00:09<00:11,  3.09it/s] 32%|███▏      | 16/50 [00:09<00:10,  3.12it/s] 34%|███▍      | 17/50 [00:09<00:10,  3.14it/s] 36%|███▌      | 18/50 [00:10<00:10,  3.15it/s] 38%|███▊      | 19/50 [00:10<00:09,  3.16it/s] 40%|████      | 20/50 [00:10<00:09,  3.16it/s] 42%|████▏     | 21/50 [00:10<00:09,  3.17it/s] 44%|████▍     | 22/50 [00:11<00:08,  3.17it/s] 46%|████▌     | 23/50 [00:11<00:08,  3.17it/s] 48%|████▊     | 24/50 [00:11<00:08,  3.17it/s] 50%|█████     | 25/50 [00:12<00:07,  3.17it/s] 52%|█████▏    | 26/50 [00:12<00:07,  3.17it/s] 54%|█████▍    | 27/50 [00:12<00:07,  3.17it/s] 56%|█████▌    | 28/50 [00:13<00:06,  3.17it/s] 58%|█████▊    | 29/50 [00:13<00:06,  3.17it/s] 60%|██████    | 30/50 [00:13<00:06,  3.17it/s] 62%|██████▏   | 31/50 [00:14<00:06,  3.16it/s] 64%|██████▍   | 32/50 [00:14<00:05,  3.16it/s] 66%|██████▌   | 33/50 [00:14<00:05,  3.16it/s] 68%|██████▊   | 34/50 [00:15<00:05,  3.16it/s] 70%|███████   | 35/50 [00:15<00:04,  3.16it/s] 72%|███████▏  | 36/50 [00:15<00:04,  3.16it/s] 74%|███████▍  | 37/50 [00:16<00:04,  3.16it/s] 76%|███████▌  | 38/50 [00:16<00:03,  3.15it/s] 78%|███████▊  | 39/50 [00:16<00:03,  3.15it/s] 80%|████████  | 40/50 [00:16<00:03,  3.16it/s] 82%|████████▏ | 41/50 [00:17<00:02,  3.15it/s] 84%|████████▍ | 42/50 [00:17<00:02,  3.15it/s] 86%|████████▌ | 43/50 [00:17<00:02,  3.15it/s] 88%|████████▊ | 44/50 [00:18<00:01,  3.15it/s] 90%|█████████ | 45/50 [00:18<00:01,  3.15it/s] 92%|█████████▏| 46/50 [00:18<00:01,  3.15it/s] 94%|█████████▍| 47/50 [00:19<00:00,  3.15it/s] 96%|█████████▌| 48/50 [00:19<00:00,  3.15it/s] 98%|█████████▊| 49/50 [00:19<00:00,  3.15it/s]100%|██████████| 50/50 [00:24<00:00,  1.73s/it]100%|██████████| 50/50 [00:24<00:00,  2.01it/s]
