[I 2023-12-10 23:38:33,595] Trial 281 finished with value: 0.3644770408163265 and parameters: {'EMBEDDING_DIM': 400, 'HIDDEN_DIM': 300, 'NUM_LAYERS': 1, 'DROPOUT': 0.35971537579201435, 'LR': 0.0028419333043748405, 'WEIGHT_0': 0.4461603644910868, 'WEIGHT_1': 0.4747144733578929, 'WEIGHT_2': 0.7406375678704924, 'WEIGHT_3': 0.5640830059962305, 'WEIGHT_4': 0.46990802985337343, 'WEIGHT_5': 0.4863529399315474, 'WEIGHT_6': 0.8441093412207183, 'WEIGHT_7': 0.9852506325570722, 'WEIGHT_8': 0.9157255397949385, 'optimizer': 'RMSprop'}. Best is trial 221 with value: 0.418736930154747.
{'EMBEDDING_DIM': 400, 'HIDDEN_DIM': 300, 'NUM_LAYERS': 1, 'DROPOUT': 0.35971537579201435, 'LR': 0.0028419333043748405, 'WEIGHT_0': 0.4461603644910868, 'WEIGHT_1': 0.4747144733578929, 'WEIGHT_2': 0.7406375678704924, 'WEIGHT_3': 0.5640830059962305, 'WEIGHT_4': 0.46990802985337343, 'WEIGHT_5': 0.4863529399315474, 'WEIGHT_6': 0.8441093412207183, 'WEIGHT_7': 0.9852506325570722, 'WEIGHT_8': 0.9157255397949385, 'optimizer': 'RMSprop'}
0
              precision    recall  f1-score   support

         LOC       0.10      0.02      0.04      1837
        MISC       0.07      0.00      0.01       922
         ORG       0.09      0.04      0.06      1341
         PER       0.05      0.01      0.02      1842

   micro avg       0.08      0.02      0.03      5942
   macro avg       0.08      0.02      0.03      5942
weighted avg       0.08      0.02      0.03      5942

{'EMBEDDING_DIM': 400, 'HIDDEN_DIM': 300, 'NUM_LAYERS': 1, 'DROPOUT': 0.35971537579201435, 'LR': 0.0028419333043748405, 'WEIGHT_0': 0.4461603644910868, 'WEIGHT_1': 0.4747144733578929, 'WEIGHT_2': 0.7406375678704924, 'WEIGHT_3': 0.5640830059962305, 'WEIGHT_4': 0.46990802985337343, 'WEIGHT_5': 0.4863529399315474, 'WEIGHT_6': 0.8441093412207183, 'WEIGHT_7': 0.9852506325570722, 'WEIGHT_8': 0.9157255397949385, 'optimizer': 'RMSprop'}
49
              precision    recall  f1-score   support

         LOC       0.55      0.50      0.53      1837
        MISC       0.29      0.42      0.34       922
         ORG       0.25      0.26      0.26      1341
         PER       0.28      0.34      0.31      1842

   micro avg       0.35      0.38      0.36      5942
   macro avg       0.34      0.38      0.36      5942
weighted avg       0.36      0.38      0.37      5942

epoch 49
LSTM
  0%|          | 0/50 [00:00<?, ?it/s]  2%|▏         | 1/50 [00:06<04:58,  6.10s/it]  4%|▍         | 2/50 [00:06<02:11,  2.74s/it]  6%|▌         | 3/50 [00:07<01:26,  1.84s/it]  8%|▊         | 4/50 [00:08<01:05,  1.41s/it] 10%|█         | 5/50 [00:08<00:53,  1.18s/it] 12%|█▏        | 6/50 [00:09<00:45,  1.04s/it] 14%|█▍        | 7/50 [00:10<00:41,  1.05it/s] 16%|█▌        | 8/50 [00:11<00:37,  1.12it/s] 18%|█▊        | 9/50 [00:11<00:35,  1.17it/s] 20%|██        | 10/50 [00:12<00:33,  1.21it/s] 22%|██▏       | 11/50 [00:13<00:31,  1.24it/s] 24%|██▍       | 12/50 [00:14<00:30,  1.26it/s] 26%|██▌       | 13/50 [00:14<00:29,  1.27it/s] 28%|██▊       | 14/50 [00:15<00:28,  1.28it/s] 30%|███       | 15/50 [00:16<00:27,  1.28it/s] 32%|███▏      | 16/50 [00:17<00:26,  1.29it/s] 34%|███▍      | 17/50 [00:18<00:25,  1.29it/s] 36%|███▌      | 18/50 [00:18<00:24,  1.29it/s] 38%|███▊      | 19/50 [00:19<00:23,  1.29it/s] 40%|████      | 20/50 [00:20<00:23,  1.29it/s] 42%|████▏     | 21/50 [00:21<00:22,  1.29it/s] 44%|████▍     | 22/50 [00:21<00:21,  1.29it/s] 46%|████▌     | 23/50 [00:22<00:20,  1.29it/s] 48%|████▊     | 24/50 [00:23<00:20,  1.29it/s] 50%|█████     | 25/50 [00:24<00:19,  1.29it/s] 52%|█████▏    | 26/50 [00:24<00:18,  1.29it/s] 54%|█████▍    | 27/50 [00:25<00:17,  1.29it/s] 56%|█████▌    | 28/50 [00:26<00:17,  1.29it/s] 58%|█████▊    | 29/50 [00:27<00:16,  1.29it/s] 60%|██████    | 30/50 [00:28<00:15,  1.29it/s] 62%|██████▏   | 31/50 [00:28<00:14,  1.29it/s] 64%|██████▍   | 32/50 [00:29<00:13,  1.29it/s] 66%|██████▌   | 33/50 [00:30<00:13,  1.29it/s] 68%|██████▊   | 34/50 [00:31<00:12,  1.28it/s] 70%|███████   | 35/50 [00:31<00:11,  1.28it/s] 72%|███████▏  | 36/50 [00:32<00:10,  1.29it/s] 74%|███████▍  | 37/50 [00:33<00:10,  1.28it/s] 76%|███████▌  | 38/50 [00:34<00:09,  1.29it/s] 78%|███████▊  | 39/50 [00:35<00:08,  1.29it/s] 80%|████████  | 40/50 [00:35<00:07,  1.29it/s] 82%|████████▏ | 41/50 [00:36<00:06,  1.29it/s] 84%|████████▍ | 42/50 [00:37<00:06,  1.29it/s] 86%|████████▌ | 43/50 [00:38<00:05,  1.29it/s] 88%|████████▊ | 44/50 [00:38<00:04,  1.28it/s] 90%|█████████ | 45/50 [00:39<00:03,  1.28it/s] 92%|█████████▏| 46/50 [00:40<00:03,  1.28it/s] 94%|█████████▍| 47/50 [00:41<00:02,  1.28it/s] 96%|█████████▌| 48/50 [00:42<00:01,  1.28it/s] 98%|█████████▊| 49/50 [00:42<00:00,  1.28it/s]100%|██████████| 50/50 [00:49<00:00,  2.52s/it]100%|██████████| 50/50 [00:49<00:00,  1.01it/s]
[I 2023-12-10 23:39:28,283] Trial 282 finished with value: 0.27578436470792167 and parameters: {'EMBEDDING_DIM': 1009, 'HIDDEN_DIM': 636, 'NUM_LAYERS': 2, 'DROPOUT': 0.3890199253547261, 'LR': 0.002628042240805533, 'WEIGHT_0': 0.3331730750768995, 'WEIGHT_1': 0.7749001104658663, 'WEIGHT_2': 0.6687385293800506, 'WEIGHT_3': 0.9356334117356654, 'WEIGHT_4': 0.8588640993923385, 'WEIGHT_5': 0.5951340498376121, 'WEIGHT_6': 0.9457814922622753, 'WEIGHT_7': 0.2562366520945212, 'WEIGHT_8': 0.5399006334973416, 'optimizer': 'RMSprop'}. Best is trial 221 with value: 0.418736930154747.
/userhome/cs2/dingruiw/conda/envs/py310/lib/python3.10/site-packages/torch/nn/modules/rnn.py:82: UserWarning: dropout option adds dropout after all but last recurrent layer, so non-zero dropout expects num_layers greater than 1, but got dropout=0.2612601029321936 and num_layers=1
  warnings.warn("dropout option adds dropout after all but last "
{'EMBEDDING_DIM': 1009, 'HIDDEN_DIM': 636, 'NUM_LAYERS': 2, 'DROPOUT': 0.3890199253547261, 'LR': 0.002628042240805533, 'WEIGHT_0': 0.3331730750768995, 'WEIGHT_1': 0.7749001104658663, 'WEIGHT_2': 0.6687385293800506, 'WEIGHT_3': 0.9356334117356654, 'WEIGHT_4': 0.8588640993923385, 'WEIGHT_5': 0.5951340498376121, 'WEIGHT_6': 0.9457814922622753, 'WEIGHT_7': 0.2562366520945212, 'WEIGHT_8': 0.5399006334973416, 'optimizer': 'RMSprop'}
0
              precision    recall  f1-score   support

         LOC       0.00      0.00      0.00      1837
        MISC       0.01      0.00      0.00       922
         ORG       0.07      0.00      0.00      1341
         PER       0.03      0.00      0.01      1842

   micro avg       0.02      0.00      0.00      5942
   macro avg       0.03      0.00      0.00      5942
weighted avg       0.03      0.00      0.00      5942

{'EMBEDDING_DIM': 1009, 'HIDDEN_DIM': 636, 'NUM_LAYERS': 2, 'DROPOUT': 0.3890199253547261, 'LR': 0.002628042240805533, 'WEIGHT_0': 0.3331730750768995, 'WEIGHT_1': 0.7749001104658663, 'WEIGHT_2': 0.6687385293800506, 'WEIGHT_3': 0.9356334117356654, 'WEIGHT_4': 0.8588640993923385, 'WEIGHT_5': 0.5951340498376121, 'WEIGHT_6': 0.9457814922622753, 'WEIGHT_7': 0.2562366520945212, 'WEIGHT_8': 0.5399006334973416, 'optimizer': 'RMSprop'}
49
              precision    recall  f1-score   support

         LOC       0.46      0.37      0.41      1837
        MISC       0.21      0.28      0.24       922
         ORG       0.22      0.17      0.19      1341
         PER       0.23      0.23      0.23      1842

   micro avg       0.28      0.27      0.28      5942
   macro avg       0.28      0.26      0.27      5942
weighted avg       0.30      0.27      0.28      5942

epoch 49
LSTM
  0%|          | 0/50 [00:00<?, ?it/s]  2%|▏         | 1/50 [00:05<04:37,  5.66s/it]  4%|▍         | 2/50 [00:05<02:00,  2.52s/it]  6%|▌         | 3/50 [00:06<01:19,  1.70s/it]  8%|▊         | 4/50 [00:07<01:00,  1.31s/it] 10%|█         | 5/50 [00:08<00:49,  1.10s/it] 12%|█▏        | 6/50 [00:08<00:42,  1.03it/s] 14%|█▍        | 7/50 [00:09<00:38,  1.12it/s] 16%|█▌        | 8/50 [00:10<00:35,  1.20it/s] 18%|█▊        | 9/50 [00:11<00:32,  1.25it/s] 20%|██        | 10/50 [00:11<00:31,  1.29it/s] 22%|██▏       | 11/50 [00:12<00:29,  1.32it/s] 24%|██▍       | 12/50 [00:13<00:28,  1.34it/s] 26%|██▌       | 13/50 [00:13<00:27,  1.35it/s] 28%|██▊       | 14/50 [00:14<00:26,  1.36it/s] 30%|███       | 15/50 [00:15<00:25,  1.36it/s] 32%|███▏      | 16/50 [00:16<00:24,  1.37it/s] 34%|███▍      | 17/50 [00:16<00:24,  1.37it/s] 36%|███▌      | 18/50 [00:17<00:23,  1.37it/s] 38%|███▊      | 19/50 [00:18<00:22,  1.38it/s] 40%|████      | 20/50 [00:18<00:21,  1.38it/s] 42%|████▏     | 21/50 [00:19<00:20,  1.38it/s] 44%|████▍     | 22/50 [00:20<00:20,  1.38it/s] 46%|████▌     | 23/50 [00:21<00:19,  1.38it/s] 48%|████▊     | 24/50 [00:21<00:18,  1.38it/s] 50%|█████     | 25/50 [00:22<00:18,  1.38it/s] 52%|█████▏    | 26/50 [00:23<00:17,  1.38it/s] 54%|█████▍    | 27/50 [00:24<00:16,  1.38it/s] 56%|█████▌    | 28/50 [00:24<00:16,  1.37it/s] 58%|█████▊    | 29/50 [00:25<00:15,  1.37it/s] 60%|██████    | 30/50 [00:26<00:14,  1.37it/s] 62%|██████▏   | 31/50 [00:26<00:13,  1.37it/s] 64%|██████▍   | 32/50 [00:27<00:13,  1.36it/s] 66%|██████▌   | 33/50 [00:28<00:12,  1.36it/s] 68%|██████▊   | 34/50 [00:29<00:11,  1.36it/s] 70%|███████   | 35/50 [00:29<00:11,  1.36it/s] 72%|███████▏  | 36/50 [00:30<00:10,  1.35it/s] 74%|███████▍  | 37/50 [00:31<00:09,  1.35it/s] 76%|███████▌  | 38/50 [00:32<00:08,  1.35it/s] 78%|███████▊  | 39/50 [00:32<00:08,  1.35it/s] 80%|████████  | 40/50 [00:33<00:07,  1.35it/s] 82%|████████▏ | 41/50 [00:34<00:06,  1.35it/s] 84%|████████▍ | 42/50 [00:35<00:05,  1.35it/s] 86%|████████▌ | 43/50 [00:35<00:05,  1.35it/s] 88%|████████▊ | 44/50 [00:36<00:04,  1.35it/s] 90%|█████████ | 45/50 [00:37<00:03,  1.35it/s] 92%|█████████▏| 46/50 [00:38<00:02,  1.35it/s] 94%|█████████▍| 47/50 [00:38<00:02,  1.35it/s] 96%|█████████▌| 48/50 [00:39<00:01,  1.35it/s] 98%|█████████▊| 49/50 [00:40<00:00,  1.35it/s]100%|██████████| 50/50 [00:46<00:00,  2.34s/it]100%|██████████| 50/50 [00:46<00:00,  1.08it/s]
[I 2023-12-10 23:40:19,448] Trial 283 finished with value: 0.2306025994486018 and parameters: {'EMBEDDING_DIM': 798, 'HIDDEN_DIM': 986, 'NUM_LAYERS': 1, 'DROPOUT': 0.2612601029321936, 'LR': 0.002280472387753483, 'WEIGHT_0': 0.4130784124785355, 'WEIGHT_1': 0.4605823467941058, 'WEIGHT_2': 0.6362624533426947, 'WEIGHT_3': 0.6016839857173789, 'WEIGHT_4': 0.044895735183060004, 'WEIGHT_5': 0.5259868852415565, 'WEIGHT_6': 0.7881223896339132, 'WEIGHT_7': 0.5200899107636571, 'WEIGHT_8': 0.5036817936845693, 'optimizer': 'RMSprop'}. Best is trial 221 with value: 0.418736930154747.
/userhome/cs2/dingruiw/conda/envs/py310/lib/python3.10/site-packages/torch/nn/modules/rnn.py:82: UserWarning: dropout option adds dropout after all but last recurrent layer, so non-zero dropout expects num_layers greater than 1, but got dropout=0.33780705128588345 and num_layers=1
  warnings.warn("dropout option adds dropout after all but last "
{'EMBEDDING_DIM': 798, 'HIDDEN_DIM': 986, 'NUM_LAYERS': 1, 'DROPOUT': 0.2612601029321936, 'LR': 0.002280472387753483, 'WEIGHT_0': 0.4130784124785355, 'WEIGHT_1': 0.4605823467941058, 'WEIGHT_2': 0.6362624533426947, 'WEIGHT_3': 0.6016839857173789, 'WEIGHT_4': 0.044895735183060004, 'WEIGHT_5': 0.5259868852415565, 'WEIGHT_6': 0.7881223896339132, 'WEIGHT_7': 0.5200899107636571, 'WEIGHT_8': 0.5036817936845693, 'optimizer': 'RMSprop'}
0
              precision    recall  f1-score   support

         LOC       0.06      0.02      0.03      1837
        MISC       0.02      0.00      0.01       922
         ORG       0.03      0.00      0.01      1341
         PER       0.03      0.02      0.02      1842

   micro avg       0.03      0.01      0.02      5942
   macro avg       0.03      0.01      0.02      5942
weighted avg       0.04      0.01      0.02      5942

{'EMBEDDING_DIM': 798, 'HIDDEN_DIM': 986, 'NUM_LAYERS': 1, 'DROPOUT': 0.2612601029321936, 'LR': 0.002280472387753483, 'WEIGHT_0': 0.4130784124785355, 'WEIGHT_1': 0.4605823467941058, 'WEIGHT_2': 0.6362624533426947, 'WEIGHT_3': 0.6016839857173789, 'WEIGHT_4': 0.044895735183060004, 'WEIGHT_5': 0.5259868852415565, 'WEIGHT_6': 0.7881223896339132, 'WEIGHT_7': 0.5200899107636571, 'WEIGHT_8': 0.5036817936845693, 'optimizer': 'RMSprop'}
49
              precision    recall  f1-score   support

         LOC       0.57      0.36      0.44      1837
        MISC       0.32      0.22      0.26       922
         ORG       0.28      0.15      0.20      1341
         PER       0.06      0.06      0.06      1842

   micro avg       0.28      0.20      0.23      5942
   macro avg       0.31      0.20      0.24      5942
weighted avg       0.31      0.20      0.24      5942

epoch 49
LSTM
  0%|          | 0/50 [00:00<?, ?it/s]  2%|▏         | 1/50 [00:04<03:47,  4.65s/it]  6%|▌         | 3/50 [00:04<01:01,  1.30s/it]  8%|▊         | 4/50 [00:05<00:41,  1.10it/s] 10%|█         | 5/50 [00:05<00:29,  1.51it/s] 12%|█▏        | 6/50 [00:05<00:22,  1.99it/s] 14%|█▍        | 7/50 [00:05<00:17,  2.53it/s] 16%|█▌        | 8/50 [00:05<00:13,  3.08it/s] 18%|█▊        | 9/50 [00:05<00:11,  3.63it/s] 20%|██        | 10/50 [00:06<00:09,  4.14it/s] 22%|██▏       | 11/50 [00:06<00:08,  4.58it/s] 24%|██▍       | 12/50 [00:06<00:07,  4.94it/s] 26%|██▌       | 13/50 [00:06<00:07,  5.23it/s] 28%|██▊       | 14/50 [00:06<00:06,  5.45it/s] 30%|███       | 15/50 [00:06<00:06,  5.62it/s] 32%|███▏      | 16/50 [00:07<00:05,  5.74it/s] 34%|███▍      | 17/50 [00:07<00:05,  5.83it/s] 36%|███▌      | 18/50 [00:07<00:05,  5.89it/s] 38%|███▊      | 19/50 [00:07<00:05,  5.94it/s] 40%|████      | 20/50 [00:07<00:05,  5.97it/s] 42%|████▏     | 21/50 [00:07<00:04,  5.99it/s] 44%|████▍     | 22/50 [00:08<00:04,  6.01it/s] 46%|████▌     | 23/50 [00:08<00:04,  6.02it/s] 48%|████▊     | 24/50 [00:08<00:04,  6.02it/s] 50%|█████     | 25/50 [00:08<00:04,  6.03it/s] 52%|█████▏    | 26/50 [00:08<00:03,  6.04it/s] 54%|█████▍    | 27/50 [00:08<00:03,  6.04it/s] 56%|█████▌    | 28/50 [00:09<00:03,  6.04it/s] 58%|█████▊    | 29/50 [00:09<00:03,  6.05it/s] 60%|██████    | 30/50 [00:09<00:03,  6.05it/s] 62%|██████▏   | 31/50 [00:09<00:03,  6.04it/s] 64%|██████▍   | 32/50 [00:09<00:02,  6.04it/s] 66%|██████▌   | 33/50 [00:09<00:02,  6.04it/s] 68%|██████▊   | 34/50 [00:10<00:02,  6.04it/s] 70%|███████   | 35/50 [00:10<00:02,  6.04it/s] 72%|███████▏  | 36/50 [00:10<00:02,  6.03it/s] 74%|███████▍  | 37/50 [00:10<00:02,  6.03it/s] 76%|███████▌  | 38/50 [00:10<00:01,  6.01it/s] 78%|███████▊  | 39/50 [00:10<00:01,  6.02it/s] 80%|████████  | 40/50 [00:11<00:01,  6.03it/s] 82%|████████▏ | 41/50 [00:11<00:01,  6.02it/s] 84%|████████▍ | 42/50 [00:11<00:01,  6.00it/s] 86%|████████▌ | 43/50 [00:11<00:01,  5.99it/s] 88%|████████▊ | 44/50 [00:11<00:00,  6.00it/s] 90%|█████████ | 45/50 [00:11<00:00,  5.97it/s] 92%|█████████▏| 46/50 [00:12<00:00,  5.98it/s] 94%|█████████▍| 47/50 [00:12<00:00,  6.00it/s] 96%|█████████▌| 48/50 [00:12<00:00,  6.00it/s] 98%|█████████▊| 49/50 [00:12<00:00,  6.01it/s]100%|██████████| 50/50 [00:17<00:00,  1.55s/it]100%|██████████| 50/50 [00:17<00:00,  2.89it/s]
[I 2023-12-10 23:40:41,021] Trial 284 finished with value: 0.4037367303609342 and parameters: {'EMBEDDING_DIM': 974, 'HIDDEN_DIM': 233, 'NUM_LAYERS': 1, 'DROPOUT': 0.33780705128588345, 'LR': 0.0025171482061819087, 'WEIGHT_0': 0.47599203023168773, 'WEIGHT_1': 0.6722636885695027, 'WEIGHT_2': 0.2548983236375759, 'WEIGHT_3': 0.7457374558775797, 'WEIGHT_4': 0.2107724250069426, 'WEIGHT_5': 0.6513034399166674, 'WEIGHT_6': 0.9145729399105041, 'WEIGHT_7': 0.2319705195479339, 'WEIGHT_8': 0.48020547658327306, 'optimizer': 'RMSprop'}. Best is trial 221 with value: 0.418736930154747.
/userhome/cs2/dingruiw/conda/envs/py310/lib/python3.10/site-packages/torch/nn/modules/rnn.py:82: UserWarning: dropout option adds dropout after all but last recurrent layer, so non-zero dropout expects num_layers greater than 1, but got dropout=0.3510659870861382 and num_layers=1
  warnings.warn("dropout option adds dropout after all but last "
{'EMBEDDING_DIM': 974, 'HIDDEN_DIM': 233, 'NUM_LAYERS': 1, 'DROPOUT': 0.33780705128588345, 'LR': 0.0025171482061819087, 'WEIGHT_0': 0.47599203023168773, 'WEIGHT_1': 0.6722636885695027, 'WEIGHT_2': 0.2548983236375759, 'WEIGHT_3': 0.7457374558775797, 'WEIGHT_4': 0.2107724250069426, 'WEIGHT_5': 0.6513034399166674, 'WEIGHT_6': 0.9145729399105041, 'WEIGHT_7': 0.2319705195479339, 'WEIGHT_8': 0.48020547658327306, 'optimizer': 'RMSprop'}
0
              precision    recall  f1-score   support

         LOC       0.31      0.07      0.11      1837
        MISC       0.10      0.02      0.03       922
         ORG       0.16      0.02      0.04      1341
         PER       0.05      0.01      0.01      1842

   micro avg       0.18      0.03      0.05      5942
   macro avg       0.16      0.03      0.05      5942
weighted avg       0.16      0.03      0.05      5942

{'EMBEDDING_DIM': 974, 'HIDDEN_DIM': 233, 'NUM_LAYERS': 1, 'DROPOUT': 0.33780705128588345, 'LR': 0.0025171482061819087, 'WEIGHT_0': 0.47599203023168773, 'WEIGHT_1': 0.6722636885695027, 'WEIGHT_2': 0.2548983236375759, 'WEIGHT_3': 0.7457374558775797, 'WEIGHT_4': 0.2107724250069426, 'WEIGHT_5': 0.6513034399166674, 'WEIGHT_6': 0.9145729399105041, 'WEIGHT_7': 0.2319705195479339, 'WEIGHT_8': 0.48020547658327306, 'optimizer': 'RMSprop'}
49
              precision    recall  f1-score   support

         LOC       0.57      0.54      0.56      1837
        MISC       0.47      0.44      0.45       922
         ORG       0.26      0.26      0.26      1341
         PER       0.33      0.34      0.33      1842

   micro avg       0.41      0.40      0.40      5942
   macro avg       0.41      0.40      0.40      5942
weighted avg       0.41      0.40      0.41      5942

epoch 49
LSTM
  0%|          | 0/50 [00:00<?, ?it/s]  2%|▏         | 1/50 [00:04<03:35,  4.39s/it]  6%|▌         | 3/50 [00:04<00:57,  1.22s/it]  8%|▊         | 4/50 [00:04<00:38,  1.18it/s] 10%|█         | 5/50 [00:04<00:27,  1.64it/s] 12%|█▏        | 6/50 [00:05<00:20,  2.20it/s] 14%|█▍        | 7/50 [00:05<00:15,  2.84it/s] 16%|█▌        | 8/50 [00:05<00:11,  3.52it/s] 18%|█▊        | 9/50 [00:05<00:09,  4.22it/s] 20%|██        | 10/50 [00:05<00:08,  4.90it/s] 22%|██▏       | 11/50 [00:05<00:07,  5.49it/s] 24%|██▍       | 12/50 [00:05<00:06,  6.01it/s] 26%|██▌       | 13/50 [00:05<00:05,  6.44it/s] 28%|██▊       | 14/50 [00:06<00:05,  6.76it/s] 30%|███       | 15/50 [00:06<00:04,  7.01it/s] 32%|███▏      | 16/50 [00:06<00:04,  7.19it/s] 34%|███▍      | 17/50 [00:06<00:04,  7.34it/s] 36%|███▌      | 18/50 [00:06<00:04,  7.43it/s] 38%|███▊      | 19/50 [00:06<00:04,  7.51it/s] 40%|████      | 20/50 [00:06<00:03,  7.55it/s] 42%|████▏     | 21/50 [00:06<00:03,  7.58it/s] 44%|████▍     | 22/50 [00:07<00:03,  7.60it/s] 46%|████▌     | 23/50 [00:07<00:03,  7.63it/s] 48%|████▊     | 24/50 [00:07<00:03,  7.63it/s] 50%|█████     | 25/50 [00:07<00:03,  7.64it/s] 52%|█████▏    | 26/50 [00:07<00:03,  7.65it/s] 54%|█████▍    | 27/50 [00:07<00:03,  7.66it/s] 56%|█████▌    | 28/50 [00:07<00:02,  7.64it/s] 58%|█████▊    | 29/50 [00:08<00:02,  7.64it/s] 60%|██████    | 30/50 [00:08<00:02,  7.64it/s] 62%|██████▏   | 31/50 [00:08<00:02,  7.64it/s] 64%|██████▍   | 32/50 [00:08<00:02,  7.65it/s] 66%|██████▌   | 33/50 [00:08<00:02,  7.64it/s] 68%|██████▊   | 34/50 [00:08<00:02,  7.64it/s] 70%|███████   | 35/50 [00:08<00:01,  7.64it/s] 72%|███████▏  | 36/50 [00:08<00:01,  7.63it/s] 74%|███████▍  | 37/50 [00:09<00:01,  7.62it/s] 76%|███████▌  | 38/50 [00:09<00:01,  7.63it/s] 78%|███████▊  | 39/50 [00:09<00:01,  7.63it/s] 80%|████████  | 40/50 [00:09<00:01,  7.63it/s] 82%|████████▏ | 41/50 [00:09<00:01,  7.64it/s] 84%|████████▍ | 42/50 [00:09<00:01,  7.64it/s] 86%|████████▌ | 43/50 [00:09<00:00,  7.64it/s] 88%|████████▊ | 44/50 [00:09<00:00,  7.63it/s] 90%|█████████ | 45/50 [00:10<00:00,  7.64it/s] 92%|█████████▏| 46/50 [00:10<00:00,  7.63it/s] 94%|█████████▍| 47/50 [00:10<00:00,  7.64it/s] 96%|█████████▌| 48/50 [00:10<00:00,  7.63it/s] 98%|█████████▊| 49/50 [00:10<00:00,  7.63it/s]100%|██████████| 50/50 [00:15<00:00,  1.46s/it]100%|██████████| 50/50 [00:15<00:00,  3.29it/s]
