[I 2023-12-10 23:30:57,903] Trial 261 finished with value: 0.41256471001140654 and parameters: {'EMBEDDING_DIM': 1022, 'HIDDEN_DIM': 275, 'NUM_LAYERS': 1, 'DROPOUT': 0.34298349105145104, 'LR': 0.0012262268233205326, 'WEIGHT_0': 0.4931582664729963, 'WEIGHT_1': 0.46954191427682734, 'WEIGHT_2': 0.6925951092928696, 'WEIGHT_3': 0.6571590642652622, 'WEIGHT_4': 0.8882373982318099, 'WEIGHT_5': 0.5142495130994766, 'WEIGHT_6': 0.6315481054490477, 'WEIGHT_7': 0.21638764949189787, 'WEIGHT_8': 0.5303486686739444, 'optimizer': 'RMSprop'}. Best is trial 221 with value: 0.418736930154747.
/userhome/cs2/dingruiw/conda/envs/py310/lib/python3.10/site-packages/torch/nn/modules/rnn.py:82: UserWarning: dropout option adds dropout after all but last recurrent layer, so non-zero dropout expects num_layers greater than 1, but got dropout=0.03909894457412051 and num_layers=1
  warnings.warn("dropout option adds dropout after all but last "
{'EMBEDDING_DIM': 1022, 'HIDDEN_DIM': 275, 'NUM_LAYERS': 1, 'DROPOUT': 0.34298349105145104, 'LR': 0.0012262268233205326, 'WEIGHT_0': 0.4931582664729963, 'WEIGHT_1': 0.46954191427682734, 'WEIGHT_2': 0.6925951092928696, 'WEIGHT_3': 0.6571590642652622, 'WEIGHT_4': 0.8882373982318099, 'WEIGHT_5': 0.5142495130994766, 'WEIGHT_6': 0.6315481054490477, 'WEIGHT_7': 0.21638764949189787, 'WEIGHT_8': 0.5303486686739444, 'optimizer': 'RMSprop'}
0
              precision    recall  f1-score   support

         LOC       0.14      0.06      0.08      1837
        MISC       0.06      0.02      0.03       922
         ORG       0.12      0.03      0.05      1341
         PER       0.06      0.01      0.02      1842

   micro avg       0.11      0.03      0.05      5942
   macro avg       0.10      0.03      0.05      5942
weighted avg       0.10      0.03      0.05      5942

{'EMBEDDING_DIM': 1022, 'HIDDEN_DIM': 275, 'NUM_LAYERS': 1, 'DROPOUT': 0.34298349105145104, 'LR': 0.0012262268233205326, 'WEIGHT_0': 0.4931582664729963, 'WEIGHT_1': 0.46954191427682734, 'WEIGHT_2': 0.6925951092928696, 'WEIGHT_3': 0.6571590642652622, 'WEIGHT_4': 0.8882373982318099, 'WEIGHT_5': 0.5142495130994766, 'WEIGHT_6': 0.6315481054490477, 'WEIGHT_7': 0.21638764949189787, 'WEIGHT_8': 0.5303486686739444, 'optimizer': 'RMSprop'}
49
              precision    recall  f1-score   support

         LOC       0.59      0.54      0.56      1837
        MISC       0.45      0.46      0.45       922
         ORG       0.30      0.25      0.28      1341
         PER       0.35      0.33      0.34      1842

   micro avg       0.43      0.40      0.41      5942
   macro avg       0.42      0.39      0.41      5942
weighted avg       0.43      0.40      0.41      5942

epoch 49
LSTM
  0%|          | 0/50 [00:00<?, ?it/s]  2%|▏         | 1/50 [00:04<03:49,  4.69s/it]  4%|▍         | 2/50 [00:04<01:35,  1.99s/it]  6%|▌         | 3/50 [00:04<00:55,  1.17s/it]  8%|▊         | 4/50 [00:05<00:35,  1.28it/s] 10%|█         | 5/50 [00:05<00:25,  1.76it/s] 12%|█▏        | 6/50 [00:05<00:19,  2.29it/s] 14%|█▍        | 7/50 [00:05<00:15,  2.82it/s] 16%|█▌        | 8/50 [00:05<00:12,  3.32it/s] 18%|█▊        | 9/50 [00:06<00:10,  3.76it/s] 20%|██        | 10/50 [00:06<00:09,  4.15it/s] 22%|██▏       | 11/50 [00:06<00:08,  4.46it/s] 24%|██▍       | 12/50 [00:06<00:08,  4.70it/s] 26%|██▌       | 13/50 [00:06<00:07,  4.88it/s] 28%|██▊       | 14/50 [00:07<00:07,  5.02it/s] 30%|███       | 15/50 [00:07<00:06,  5.11it/s] 32%|███▏      | 16/50 [00:07<00:06,  5.18it/s] 34%|███▍      | 17/50 [00:07<00:06,  5.23it/s] 36%|███▌      | 18/50 [00:07<00:06,  5.27it/s] 38%|███▊      | 19/50 [00:07<00:05,  5.30it/s] 40%|████      | 20/50 [00:08<00:05,  5.32it/s] 42%|████▏     | 21/50 [00:08<00:05,  5.33it/s] 44%|████▍     | 22/50 [00:08<00:05,  5.34it/s] 46%|████▌     | 23/50 [00:08<00:05,  5.34it/s] 48%|████▊     | 24/50 [00:08<00:04,  5.34it/s] 50%|█████     | 25/50 [00:09<00:04,  5.35it/s] 52%|█████▏    | 26/50 [00:09<00:04,  5.35it/s] 54%|█████▍    | 27/50 [00:09<00:04,  5.35it/s] 56%|█████▌    | 28/50 [00:09<00:04,  5.35it/s] 58%|█████▊    | 29/50 [00:09<00:03,  5.35it/s] 60%|██████    | 30/50 [00:10<00:03,  5.35it/s] 62%|██████▏   | 31/50 [00:10<00:03,  5.36it/s] 64%|██████▍   | 32/50 [00:10<00:03,  5.36it/s] 66%|██████▌   | 33/50 [00:10<00:03,  5.37it/s] 68%|██████▊   | 34/50 [00:10<00:02,  5.36it/s] 70%|███████   | 35/50 [00:10<00:02,  5.36it/s] 72%|███████▏  | 36/50 [00:11<00:02,  5.35it/s] 74%|███████▍  | 37/50 [00:11<00:02,  5.35it/s] 76%|███████▌  | 38/50 [00:11<00:02,  5.35it/s] 78%|███████▊  | 39/50 [00:11<00:02,  5.35it/s] 80%|████████  | 40/50 [00:11<00:01,  5.35it/s] 82%|████████▏ | 41/50 [00:12<00:01,  5.35it/s] 84%|████████▍ | 42/50 [00:12<00:01,  5.35it/s] 86%|████████▌ | 43/50 [00:12<00:01,  5.35it/s] 88%|████████▊ | 44/50 [00:12<00:01,  5.34it/s] 90%|█████████ | 45/50 [00:12<00:00,  5.34it/s] 92%|█████████▏| 46/50 [00:13<00:00,  5.35it/s] 94%|█████████▍| 47/50 [00:13<00:00,  5.35it/s] 96%|█████████▌| 48/50 [00:13<00:00,  5.35it/s] 98%|█████████▊| 49/50 [00:13<00:00,  5.35it/s]100%|██████████| 50/50 [00:18<00:00,  1.58s/it]100%|██████████| 50/50 [00:18<00:00,  2.72it/s]
[I 2023-12-10 23:31:20,578] Trial 262 finished with value: 0.40428082191780823 and parameters: {'EMBEDDING_DIM': 1020, 'HIDDEN_DIM': 263, 'NUM_LAYERS': 1, 'DROPOUT': 0.03909894457412051, 'LR': 0.0012170967721317485, 'WEIGHT_0': 0.5398369744198404, 'WEIGHT_1': 0.46889061149821054, 'WEIGHT_2': 0.671211358275174, 'WEIGHT_3': 0.6887077381508991, 'WEIGHT_4': 0.8853128460914148, 'WEIGHT_5': 0.5137191631089563, 'WEIGHT_6': 0.6306019495361401, 'WEIGHT_7': 0.2082886571970731, 'WEIGHT_8': 0.5326791102878303, 'optimizer': 'RMSprop'}. Best is trial 221 with value: 0.418736930154747.
/userhome/cs2/dingruiw/conda/envs/py310/lib/python3.10/site-packages/torch/nn/modules/rnn.py:82: UserWarning: dropout option adds dropout after all but last recurrent layer, so non-zero dropout expects num_layers greater than 1, but got dropout=0.28848320209192013 and num_layers=1
  warnings.warn("dropout option adds dropout after all but last "
{'EMBEDDING_DIM': 1020, 'HIDDEN_DIM': 263, 'NUM_LAYERS': 1, 'DROPOUT': 0.03909894457412051, 'LR': 0.0012170967721317485, 'WEIGHT_0': 0.5398369744198404, 'WEIGHT_1': 0.46889061149821054, 'WEIGHT_2': 0.671211358275174, 'WEIGHT_3': 0.6887077381508991, 'WEIGHT_4': 0.8853128460914148, 'WEIGHT_5': 0.5137191631089563, 'WEIGHT_6': 0.6306019495361401, 'WEIGHT_7': 0.2082886571970731, 'WEIGHT_8': 0.5326791102878303, 'optimizer': 'RMSprop'}
0
              precision    recall  f1-score   support

         LOC       0.10      0.03      0.05      1837
        MISC       0.06      0.03      0.04       922
         ORG       0.09      0.05      0.06      1341
         PER       0.06      0.02      0.03      1842

   micro avg       0.08      0.03      0.05      5942
   macro avg       0.08      0.03      0.05      5942
weighted avg       0.08      0.03      0.04      5942

{'EMBEDDING_DIM': 1020, 'HIDDEN_DIM': 263, 'NUM_LAYERS': 1, 'DROPOUT': 0.03909894457412051, 'LR': 0.0012170967721317485, 'WEIGHT_0': 0.5398369744198404, 'WEIGHT_1': 0.46889061149821054, 'WEIGHT_2': 0.671211358275174, 'WEIGHT_3': 0.6887077381508991, 'WEIGHT_4': 0.8853128460914148, 'WEIGHT_5': 0.5137191631089563, 'WEIGHT_6': 0.6306019495361401, 'WEIGHT_7': 0.2082886571970731, 'WEIGHT_8': 0.5326791102878303, 'optimizer': 'RMSprop'}
49
              precision    recall  f1-score   support

         LOC       0.60      0.51      0.55      1837
        MISC       0.45      0.46      0.45       922
         ORG       0.28      0.26      0.27      1341
         PER       0.33      0.36      0.34      1842

   micro avg       0.41      0.40      0.40      5942
   macro avg       0.41      0.40      0.40      5942
weighted avg       0.42      0.40      0.41      5942

epoch 49
LSTM
  0%|          | 0/50 [00:00<?, ?it/s]  2%|▏         | 1/50 [00:05<04:15,  5.21s/it]  4%|▍         | 2/50 [00:05<01:51,  2.32s/it]  6%|▌         | 3/50 [00:06<01:12,  1.54s/it]  8%|▊         | 4/50 [00:06<00:54,  1.18s/it] 10%|█         | 5/50 [00:07<00:43,  1.02it/s] 12%|█▏        | 6/50 [00:07<00:37,  1.17it/s] 14%|█▍        | 7/50 [00:08<00:33,  1.29it/s] 16%|█▌        | 8/50 [00:09<00:30,  1.38it/s] 18%|█▊        | 9/50 [00:09<00:28,  1.44it/s] 20%|██        | 10/50 [00:10<00:26,  1.49it/s] 22%|██▏       | 11/50 [00:11<00:25,  1.53it/s] 24%|██▍       | 12/50 [00:11<00:24,  1.56it/s] 26%|██▌       | 13/50 [00:12<00:23,  1.58it/s] 28%|██▊       | 14/50 [00:12<00:22,  1.59it/s] 30%|███       | 15/50 [00:13<00:21,  1.60it/s] 32%|███▏      | 16/50 [00:14<00:21,  1.60it/s] 34%|███▍      | 17/50 [00:14<00:20,  1.61it/s] 36%|███▌      | 18/50 [00:15<00:19,  1.61it/s] 38%|███▊      | 19/50 [00:16<00:19,  1.61it/s] 40%|████      | 20/50 [00:16<00:18,  1.61it/s] 42%|████▏     | 21/50 [00:17<00:17,  1.61it/s] 44%|████▍     | 22/50 [00:17<00:17,  1.61it/s] 46%|████▌     | 23/50 [00:18<00:16,  1.62it/s] 48%|████▊     | 24/50 [00:19<00:16,  1.62it/s] 50%|█████     | 25/50 [00:19<00:15,  1.62it/s] 52%|█████▏    | 26/50 [00:20<00:14,  1.61it/s] 54%|█████▍    | 27/50 [00:20<00:14,  1.61it/s] 56%|█████▌    | 28/50 [00:21<00:13,  1.61it/s] 58%|█████▊    | 29/50 [00:22<00:13,  1.61it/s] 60%|██████    | 30/50 [00:22<00:12,  1.61it/s] 62%|██████▏   | 31/50 [00:23<00:11,  1.61it/s] 64%|██████▍   | 32/50 [00:24<00:11,  1.61it/s] 66%|██████▌   | 33/50 [00:24<00:10,  1.61it/s] 68%|██████▊   | 34/50 [00:25<00:09,  1.61it/s] 70%|███████   | 35/50 [00:25<00:09,  1.60it/s] 72%|███████▏  | 36/50 [00:26<00:08,  1.61it/s] 74%|███████▍  | 37/50 [00:27<00:08,  1.60it/s] 76%|███████▌  | 38/50 [00:27<00:07,  1.60it/s] 78%|███████▊  | 39/50 [00:28<00:06,  1.60it/s] 80%|████████  | 40/50 [00:29<00:06,  1.60it/s] 82%|████████▏ | 41/50 [00:29<00:05,  1.60it/s] 84%|████████▍ | 42/50 [00:30<00:05,  1.60it/s] 86%|████████▌ | 43/50 [00:30<00:04,  1.60it/s] 88%|████████▊ | 44/50 [00:31<00:03,  1.60it/s] 90%|█████████ | 45/50 [00:32<00:03,  1.60it/s] 92%|█████████▏| 46/50 [00:32<00:02,  1.60it/s] 94%|█████████▍| 47/50 [00:33<00:01,  1.59it/s] 96%|█████████▌| 48/50 [00:34<00:01,  1.59it/s] 98%|█████████▊| 49/50 [00:34<00:00,  1.59it/s]100%|██████████| 50/50 [00:40<00:00,  2.08s/it]100%|██████████| 50/50 [00:40<00:00,  1.24it/s]
[I 2023-12-10 23:32:05,225] Trial 263 finished with value: 0.35857776101103467 and parameters: {'EMBEDDING_DIM': 1023, 'HIDDEN_DIM': 794, 'NUM_LAYERS': 1, 'DROPOUT': 0.28848320209192013, 'LR': 0.00025942860421135567, 'WEIGHT_0': 0.35896668593770176, 'WEIGHT_1': 0.5949196739510227, 'WEIGHT_2': 0.6873011974840438, 'WEIGHT_3': 0.7276058335191203, 'WEIGHT_4': 0.8534329140728941, 'WEIGHT_5': 0.471833079280233, 'WEIGHT_6': 0.56325513726616, 'WEIGHT_7': 0.22855036278928867, 'WEIGHT_8': 0.4884169712533785, 'optimizer': 'RMSprop'}. Best is trial 221 with value: 0.418736930154747.
/userhome/cs2/dingruiw/conda/envs/py310/lib/python3.10/site-packages/torch/nn/modules/rnn.py:82: UserWarning: dropout option adds dropout after all but last recurrent layer, so non-zero dropout expects num_layers greater than 1, but got dropout=0.3298687991605125 and num_layers=1
  warnings.warn("dropout option adds dropout after all but last "
{'EMBEDDING_DIM': 1023, 'HIDDEN_DIM': 794, 'NUM_LAYERS': 1, 'DROPOUT': 0.28848320209192013, 'LR': 0.00025942860421135567, 'WEIGHT_0': 0.35896668593770176, 'WEIGHT_1': 0.5949196739510227, 'WEIGHT_2': 0.6873011974840438, 'WEIGHT_3': 0.7276058335191203, 'WEIGHT_4': 0.8534329140728941, 'WEIGHT_5': 0.471833079280233, 'WEIGHT_6': 0.56325513726616, 'WEIGHT_7': 0.22855036278928867, 'WEIGHT_8': 0.4884169712533785, 'optimizer': 'RMSprop'}
0
              precision    recall  f1-score   support

         LOC       0.06      0.04      0.05      1837
        MISC       0.02      0.02      0.02       922
         ORG       0.06      0.03      0.04      1341
         PER       0.03      0.03      0.03      1842

   micro avg       0.04      0.03      0.04      5942
   macro avg       0.04      0.03      0.04      5942
weighted avg       0.04      0.03      0.04      5942

{'EMBEDDING_DIM': 1023, 'HIDDEN_DIM': 794, 'NUM_LAYERS': 1, 'DROPOUT': 0.28848320209192013, 'LR': 0.00025942860421135567, 'WEIGHT_0': 0.35896668593770176, 'WEIGHT_1': 0.5949196739510227, 'WEIGHT_2': 0.6873011974840438, 'WEIGHT_3': 0.7276058335191203, 'WEIGHT_4': 0.8534329140728941, 'WEIGHT_5': 0.471833079280233, 'WEIGHT_6': 0.56325513726616, 'WEIGHT_7': 0.22855036278928867, 'WEIGHT_8': 0.4884169712533785, 'optimizer': 'RMSprop'}
49
              precision    recall  f1-score   support

         LOC       0.62      0.44      0.51      1837
        MISC       0.42      0.31      0.36       922
         ORG       0.29      0.18      0.23      1341
         PER       0.30      0.30      0.30      1842

   micro avg       0.41      0.32      0.36      5942
   macro avg       0.41      0.31      0.35      5942
weighted avg       0.42      0.32      0.36      5942

epoch 49
LSTM
  0%|          | 0/50 [00:00<?, ?it/s]  2%|▏         | 1/50 [00:04<03:56,  4.82s/it]  6%|▌         | 3/50 [00:05<01:03,  1.34s/it]  8%|▊         | 4/50 [00:05<00:42,  1.07it/s] 10%|█         | 5/50 [00:05<00:30,  1.49it/s] 12%|█▏        | 6/50 [00:05<00:22,  1.99it/s] 14%|█▍        | 7/50 [00:05<00:16,  2.55it/s] 16%|█▌        | 8/50 [00:05<00:13,  3.17it/s] 18%|█▊        | 9/50 [00:05<00:10,  3.78it/s] 20%|██        | 10/50 [00:06<00:09,  4.37it/s] 22%|██▏       | 11/50 [00:06<00:07,  4.89it/s] 24%|██▍       | 12/50 [00:06<00:07,  5.33it/s] 26%|██▌       | 13/50 [00:06<00:06,  5.71it/s] 28%|██▊       | 14/50 [00:06<00:06,  5.99it/s] 30%|███       | 15/50 [00:06<00:05,  6.19it/s] 32%|███▏      | 16/50 [00:06<00:05,  6.36it/s] 34%|███▍      | 17/50 [00:07<00:05,  6.47it/s] 36%|███▌      | 18/50 [00:07<00:04,  6.56it/s] 38%|███▊      | 19/50 [00:07<00:04,  6.61it/s] 40%|████      | 20/50 [00:07<00:04,  6.65it/s] 42%|████▏     | 21/50 [00:07<00:04,  6.68it/s] 44%|████▍     | 22/50 [00:07<00:04,  6.70it/s] 46%|████▌     | 23/50 [00:08<00:04,  6.71it/s] 48%|████▊     | 24/50 [00:08<00:03,  6.72it/s] 50%|█████     | 25/50 [00:08<00:03,  6.72it/s] 52%|█████▏    | 26/50 [00:08<00:03,  6.73it/s] 54%|█████▍    | 27/50 [00:08<00:03,  6.73it/s] 56%|█████▌    | 28/50 [00:08<00:03,  6.73it/s] 58%|█████▊    | 29/50 [00:08<00:03,  6.73it/s] 60%|██████    | 30/50 [00:09<00:02,  6.74it/s] 62%|██████▏   | 31/50 [00:09<00:02,  6.74it/s] 64%|██████▍   | 32/50 [00:09<00:02,  6.75it/s] 66%|██████▌   | 33/50 [00:09<00:02,  6.74it/s] 68%|██████▊   | 34/50 [00:09<00:02,  6.73it/s] 70%|███████   | 35/50 [00:09<00:02,  6.74it/s] 72%|███████▏  | 36/50 [00:09<00:02,  6.74it/s] 74%|███████▍  | 37/50 [00:10<00:01,  6.74it/s] 76%|███████▌  | 38/50 [00:10<00:01,  6.74it/s] 78%|███████▊  | 39/50 [00:10<00:01,  6.74it/s] 80%|████████  | 40/50 [00:10<00:01,  6.73it/s] 82%|████████▏ | 41/50 [00:10<00:01,  6.72it/s] 84%|████████▍ | 42/50 [00:10<00:01,  6.72it/s] 86%|████████▌ | 43/50 [00:11<00:01,  6.72it/s] 88%|████████▊ | 44/50 [00:11<00:00,  6.72it/s] 90%|█████████ | 45/50 [00:11<00:00,  6.73it/s] 92%|█████████▏| 46/50 [00:11<00:00,  6.71it/s] 94%|█████████▍| 47/50 [00:11<00:00,  6.71it/s] 96%|█████████▌| 48/50 [00:11<00:00,  6.67it/s] 98%|█████████▊| 49/50 [00:11<00:00,  6.65it/s]100%|██████████| 50/50 [00:16<00:00,  1.60s/it]100%|██████████| 50/50 [00:16<00:00,  2.96it/s]
[I 2023-12-10 23:32:26,486] Trial 264 finished with value: 0.4080678670360111 and parameters: {'EMBEDDING_DIM': 1003, 'HIDDEN_DIM': 208, 'NUM_LAYERS': 1, 'DROPOUT': 0.3298687991605125, 'LR': 0.0008448618776218668, 'WEIGHT_0': 0.4420033930731336, 'WEIGHT_1': 0.7954059328995068, 'WEIGHT_2': 0.7507999298833552, 'WEIGHT_3': 0.9655247208261838, 'WEIGHT_4': 0.8943980073223751, 'WEIGHT_5': 0.49864763721914124, 'WEIGHT_6': 0.7851078551235063, 'WEIGHT_7': 0.26795519624429315, 'WEIGHT_8': 0.5166528809669128, 'optimizer': 'RMSprop'}. Best is trial 221 with value: 0.418736930154747.
/userhome/cs2/dingruiw/conda/envs/py310/lib/python3.10/site-packages/torch/nn/modules/rnn.py:82: UserWarning: dropout option adds dropout after all but last recurrent layer, so non-zero dropout expects num_layers greater than 1, but got dropout=0.34174104011684026 and num_layers=1
  warnings.warn("dropout option adds dropout after all but last "
{'EMBEDDING_DIM': 1003, 'HIDDEN_DIM': 208, 'NUM_LAYERS': 1, 'DROPOUT': 0.3298687991605125, 'LR': 0.0008448618776218668, 'WEIGHT_0': 0.4420033930731336, 'WEIGHT_1': 0.7954059328995068, 'WEIGHT_2': 0.7507999298833552, 'WEIGHT_3': 0.9655247208261838, 'WEIGHT_4': 0.8943980073223751, 'WEIGHT_5': 0.49864763721914124, 'WEIGHT_6': 0.7851078551235063, 'WEIGHT_7': 0.26795519624429315, 'WEIGHT_8': 0.5166528809669128, 'optimizer': 'RMSprop'}
0
              precision    recall  f1-score   support

         LOC       0.09      0.03      0.05      1837
        MISC       0.03      0.02      0.02       922
         ORG       0.11      0.05      0.06      1341
         PER       0.06      0.03      0.04      1842

   micro avg       0.07      0.03      0.05      5942
   macro avg       0.07      0.03      0.05      5942
weighted avg       0.08      0.03      0.05      5942

{'EMBEDDING_DIM': 1003, 'HIDDEN_DIM': 208, 'NUM_LAYERS': 1, 'DROPOUT': 0.3298687991605125, 'LR': 0.0008448618776218668, 'WEIGHT_0': 0.4420033930731336, 'WEIGHT_1': 0.7954059328995068, 'WEIGHT_2': 0.7507999298833552, 'WEIGHT_3': 0.9655247208261838, 'WEIGHT_4': 0.8943980073223751, 'WEIGHT_5': 0.49864763721914124, 'WEIGHT_6': 0.7851078551235063, 'WEIGHT_7': 0.26795519624429315, 'WEIGHT_8': 0.5166528809669128, 'optimizer': 'RMSprop'}
49
              precision    recall  f1-score   support

         LOC       0.56      0.52      0.54      1837
        MISC       0.44      0.46      0.45       922
         ORG       0.30      0.26      0.28      1341
         PER       0.35      0.34      0.34      1842

   micro avg       0.42      0.40      0.41      5942
   macro avg       0.41      0.40      0.40      5942
weighted avg       0.42      0.40      0.41      5942

epoch 49
LSTM
  0%|          | 0/50 [00:00<?, ?it/s]  2%|▏         | 1/50 [00:04<04:04,  4.98s/it]  4%|▍         | 2/50 [00:05<01:41,  2.12s/it]  6%|▌         | 3/50 [00:05<00:59,  1.26s/it]  8%|▊         | 4/50 [00:05<00:39,  1.18it/s] 10%|█         | 5/50 [00:05<00:28,  1.61it/s] 12%|█▏        | 6/50 [00:05<00:21,  2.06it/s] 14%|█▍        | 7/50 [00:06<00:17,  2.51it/s] 16%|█▌        | 8/50 [00:06<00:14,  2.92it/s] 18%|█▊        | 9/50 [00:06<00:12,  3.29it/s] 20%|██        | 10/50 [00:06<00:11,  3.59it/s] 22%|██▏       | 11/50 [00:07<00:10,  3.83it/s] 24%|██▍       | 12/50 [00:07<00:09,  4.02it/s] 26%|██▌       | 13/50 [00:07<00:08,  4.16it/s] 28%|██▊       | 14/50 [00:07<00:08,  4.27it/s] 30%|███       | 15/50 [00:07<00:08,  4.35it/s] 32%|███▏      | 16/50 [00:08<00:07,  4.39it/s] 34%|███▍      | 17/50 [00:08<00:07,  4.43it/s] 36%|███▌      | 18/50 [00:08<00:07,  4.46it/s] 38%|███▊      | 19/50 [00:08<00:06,  4.48it/s] 40%|████      | 20/50 [00:09<00:06,  4.49it/s] 42%|████▏     | 21/50 [00:09<00:06,  4.51it/s] 44%|████▍     | 22/50 [00:09<00:06,  4.51it/s] 46%|████▌     | 23/50 [00:09<00:05,  4.52it/s] 48%|████▊     | 24/50 [00:09<00:05,  4.52it/s] 50%|█████     | 25/50 [00:10<00:05,  4.51it/s] 52%|█████▏    | 26/50 [00:10<00:05,  4.52it/s] 54%|█████▍    | 27/50 [00:10<00:05,  4.52it/s] 56%|█████▌    | 28/50 [00:10<00:04,  4.52it/s] 58%|█████▊    | 29/50 [00:11<00:04,  4.52it/s] 60%|██████    | 30/50 [00:11<00:04,  4.52it/s] 62%|██████▏   | 31/50 [00:11<00:04,  4.52it/s] 64%|██████▍   | 32/50 [00:11<00:03,  4.52it/s] 66%|██████▌   | 33/50 [00:11<00:03,  4.53it/s] 68%|██████▊   | 34/50 [00:12<00:03,  4.52it/s] 70%|███████   | 35/50 [00:12<00:03,  4.52it/s] 72%|███████▏  | 36/50 [00:12<00:03,  4.52it/s] 74%|███████▍  | 37/50 [00:12<00:02,  4.52it/s] 76%|███████▌  | 38/50 [00:13<00:02,  4.52it/s] 78%|███████▊  | 39/50 [00:13<00:02,  4.52it/s] 80%|████████  | 40/50 [00:13<00:02,  4.52it/s] 82%|████████▏ | 41/50 [00:13<00:01,  4.52it/s] 84%|████████▍ | 42/50 [00:13<00:01,  4.51it/s] 86%|████████▌ | 43/50 [00:14<00:01,  4.51it/s] 88%|████████▊ | 44/50 [00:14<00:01,  4.51it/s] 90%|█████████ | 45/50 [00:14<00:01,  4.51it/s] 92%|█████████▏| 46/50 [00:14<00:00,  4.52it/s] 94%|█████████▍| 47/50 [00:15<00:00,  4.52it/s] 96%|█████████▌| 48/50 [00:15<00:00,  4.51it/s] 98%|█████████▊| 49/50 [00:15<00:00,  4.51it/s]100%|██████████| 50/50 [00:20<00:00,  1.61s/it]100%|██████████| 50/50 [00:20<00:00,  2.46it/s]
