[I 2023-12-10 23:02:23,778] Trial 201 finished with value: 0.3914487692700792 and parameters: {'EMBEDDING_DIM': 972, 'HIDDEN_DIM': 486, 'NUM_LAYERS': 1, 'DROPOUT': 0.33559284976969184, 'LR': 0.0008858492304857086, 'WEIGHT_0': 0.4296164851916595, 'WEIGHT_1': 0.6706874059758221, 'WEIGHT_2': 0.6632368806263333, 'WEIGHT_3': 0.9262936509610545, 'WEIGHT_4': 0.8402860941609505, 'WEIGHT_5': 0.4833499007764956, 'WEIGHT_6': 0.946225676513318, 'WEIGHT_7': 0.4004814899018565, 'WEIGHT_8': 0.43461019898685804, 'optimizer': 'RMSprop'}. Best is trial 134 with value: 0.4158467115484205.
/userhome/cs2/dingruiw/conda/envs/py310/lib/python3.10/site-packages/torch/nn/modules/rnn.py:82: UserWarning: dropout option adds dropout after all but last recurrent layer, so non-zero dropout expects num_layers greater than 1, but got dropout=0.34636407072859426 and num_layers=1
  warnings.warn("dropout option adds dropout after all but last "
{'EMBEDDING_DIM': 972, 'HIDDEN_DIM': 486, 'NUM_LAYERS': 1, 'DROPOUT': 0.33559284976969184, 'LR': 0.0008858492304857086, 'WEIGHT_0': 0.4296164851916595, 'WEIGHT_1': 0.6706874059758221, 'WEIGHT_2': 0.6632368806263333, 'WEIGHT_3': 0.9262936509610545, 'WEIGHT_4': 0.8402860941609505, 'WEIGHT_5': 0.4833499007764956, 'WEIGHT_6': 0.946225676513318, 'WEIGHT_7': 0.4004814899018565, 'WEIGHT_8': 0.43461019898685804, 'optimizer': 'RMSprop'}
0
              precision    recall  f1-score   support

         LOC       0.18      0.10      0.13      1837
        MISC       0.04      0.01      0.01       922
         ORG       0.07      0.05      0.06      1341
         PER       0.06      0.02      0.02      1842

   micro avg       0.11      0.05      0.07      5942
   macro avg       0.09      0.04      0.06      5942
weighted avg       0.10      0.05      0.06      5942

{'EMBEDDING_DIM': 972, 'HIDDEN_DIM': 486, 'NUM_LAYERS': 1, 'DROPOUT': 0.33559284976969184, 'LR': 0.0008858492304857086, 'WEIGHT_0': 0.4296164851916595, 'WEIGHT_1': 0.6706874059758221, 'WEIGHT_2': 0.6632368806263333, 'WEIGHT_3': 0.9262936509610545, 'WEIGHT_4': 0.8402860941609505, 'WEIGHT_5': 0.4833499007764956, 'WEIGHT_6': 0.946225676513318, 'WEIGHT_7': 0.4004814899018565, 'WEIGHT_8': 0.43461019898685804, 'optimizer': 'RMSprop'}
49
              precision    recall  f1-score   support

         LOC       0.56      0.51      0.53      1837
        MISC       0.42      0.43      0.43       922
         ORG       0.28      0.24      0.26      1341
         PER       0.32      0.34      0.33      1842

   micro avg       0.40      0.39      0.39      5942
   macro avg       0.39      0.38      0.39      5942
weighted avg       0.40      0.39      0.39      5942

epoch 49
LSTM
  0%|          | 0/50 [00:00<?, ?it/s]  2%|▏         | 1/50 [00:04<03:53,  4.77s/it]  4%|▍         | 2/50 [00:04<01:38,  2.06s/it]  6%|▌         | 3/50 [00:05<00:58,  1.25s/it]  8%|▊         | 4/50 [00:05<00:39,  1.15it/s] 10%|█         | 5/50 [00:05<00:29,  1.52it/s] 12%|█▏        | 6/50 [00:06<00:23,  1.89it/s] 14%|█▍        | 7/50 [00:06<00:19,  2.23it/s] 16%|█▌        | 8/50 [00:06<00:16,  2.52it/s] 18%|█▊        | 9/50 [00:06<00:14,  2.77it/s] 20%|██        | 10/50 [00:07<00:13,  2.96it/s] 22%|██▏       | 11/50 [00:07<00:12,  3.12it/s] 24%|██▍       | 12/50 [00:07<00:11,  3.23it/s] 26%|██▌       | 13/50 [00:08<00:11,  3.31it/s] 28%|██▊       | 14/50 [00:08<00:10,  3.37it/s] 30%|███       | 15/50 [00:08<00:10,  3.41it/s] 32%|███▏      | 16/50 [00:08<00:09,  3.44it/s] 34%|███▍      | 17/50 [00:09<00:09,  3.46it/s] 36%|███▌      | 18/50 [00:09<00:09,  3.48it/s] 38%|███▊      | 19/50 [00:09<00:08,  3.49it/s] 40%|████      | 20/50 [00:10<00:08,  3.50it/s] 42%|████▏     | 21/50 [00:10<00:08,  3.50it/s] 44%|████▍     | 22/50 [00:10<00:07,  3.51it/s] 46%|████▌     | 23/50 [00:10<00:07,  3.51it/s] 48%|████▊     | 24/50 [00:11<00:07,  3.52it/s] 50%|█████     | 25/50 [00:11<00:07,  3.52it/s] 52%|█████▏    | 26/50 [00:11<00:06,  3.51it/s] 54%|█████▍    | 27/50 [00:12<00:06,  3.51it/s] 56%|█████▌    | 28/50 [00:12<00:06,  3.51it/s] 58%|█████▊    | 29/50 [00:12<00:05,  3.51it/s] 60%|██████    | 30/50 [00:12<00:05,  3.51it/s] 62%|██████▏   | 31/50 [00:13<00:05,  3.51it/s] 64%|██████▍   | 32/50 [00:13<00:05,  3.51it/s] 66%|██████▌   | 33/50 [00:13<00:04,  3.51it/s] 68%|██████▊   | 34/50 [00:14<00:04,  3.51it/s] 70%|███████   | 35/50 [00:14<00:04,  3.51it/s] 72%|███████▏  | 36/50 [00:14<00:03,  3.50it/s] 74%|███████▍  | 37/50 [00:14<00:03,  3.50it/s] 76%|███████▌  | 38/50 [00:15<00:03,  3.51it/s] 78%|███████▊  | 39/50 [00:15<00:03,  3.50it/s] 80%|████████  | 40/50 [00:15<00:02,  3.50it/s] 82%|████████▏ | 41/50 [00:16<00:02,  3.50it/s] 84%|████████▍ | 42/50 [00:16<00:02,  3.50it/s] 86%|████████▌ | 43/50 [00:16<00:01,  3.50it/s] 88%|████████▊ | 44/50 [00:16<00:01,  3.50it/s] 90%|█████████ | 45/50 [00:17<00:01,  3.50it/s] 92%|█████████▏| 46/50 [00:17<00:01,  3.50it/s] 94%|█████████▍| 47/50 [00:17<00:00,  3.50it/s] 96%|█████████▌| 48/50 [00:18<00:00,  3.50it/s] 98%|█████████▊| 49/50 [00:18<00:00,  3.50it/s]100%|██████████| 50/50 [00:23<00:00,  1.68s/it]100%|██████████| 50/50 [00:23<00:00,  2.15it/s]
[I 2023-12-10 23:02:51,311] Trial 202 finished with value: 0.41138114997036157 and parameters: {'EMBEDDING_DIM': 996, 'HIDDEN_DIM': 423, 'NUM_LAYERS': 1, 'DROPOUT': 0.34636407072859426, 'LR': 0.0012656002780503195, 'WEIGHT_0': 0.4096938996123765, 'WEIGHT_1': 0.5988902512538516, 'WEIGHT_2': 0.7084584195677213, 'WEIGHT_3': 0.9688190688757616, 'WEIGHT_4': 0.861127307079487, 'WEIGHT_5': 0.5076607800668106, 'WEIGHT_6': 0.5325478095483862, 'WEIGHT_7': 0.37114110457915606, 'WEIGHT_8': 0.45295104997904595, 'optimizer': 'RMSprop'}. Best is trial 134 with value: 0.4158467115484205.
/userhome/cs2/dingruiw/conda/envs/py310/lib/python3.10/site-packages/torch/nn/modules/rnn.py:82: UserWarning: dropout option adds dropout after all but last recurrent layer, so non-zero dropout expects num_layers greater than 1, but got dropout=0.3591067132827883 and num_layers=1
  warnings.warn("dropout option adds dropout after all but last "
{'EMBEDDING_DIM': 996, 'HIDDEN_DIM': 423, 'NUM_LAYERS': 1, 'DROPOUT': 0.34636407072859426, 'LR': 0.0012656002780503195, 'WEIGHT_0': 0.4096938996123765, 'WEIGHT_1': 0.5988902512538516, 'WEIGHT_2': 0.7084584195677213, 'WEIGHT_3': 0.9688190688757616, 'WEIGHT_4': 0.861127307079487, 'WEIGHT_5': 0.5076607800668106, 'WEIGHT_6': 0.5325478095483862, 'WEIGHT_7': 0.37114110457915606, 'WEIGHT_8': 0.45295104997904595, 'optimizer': 'RMSprop'}
0
              precision    recall  f1-score   support

         LOC       0.26      0.13      0.17      1837
        MISC       0.05      0.02      0.03       922
         ORG       0.09      0.07      0.08      1341
         PER       0.08      0.02      0.03      1842

   micro avg       0.13      0.06      0.09      5942
   macro avg       0.12      0.06      0.08      5942
weighted avg       0.13      0.06      0.08      5942

{'EMBEDDING_DIM': 996, 'HIDDEN_DIM': 423, 'NUM_LAYERS': 1, 'DROPOUT': 0.34636407072859426, 'LR': 0.0012656002780503195, 'WEIGHT_0': 0.4096938996123765, 'WEIGHT_1': 0.5988902512538516, 'WEIGHT_2': 0.7084584195677213, 'WEIGHT_3': 0.9688190688757616, 'WEIGHT_4': 0.861127307079487, 'WEIGHT_5': 0.5076607800668106, 'WEIGHT_6': 0.5325478095483862, 'WEIGHT_7': 0.37114110457915606, 'WEIGHT_8': 0.45295104997904595, 'optimizer': 'RMSprop'}
49
              precision    recall  f1-score   support

         LOC       0.57      0.54      0.55      1837
        MISC       0.45      0.46      0.46       922
         ORG       0.28      0.27      0.28      1341
         PER       0.35      0.35      0.35      1842

   micro avg       0.41      0.41      0.41      5942
   macro avg       0.41      0.41      0.41      5942
weighted avg       0.42      0.41      0.41      5942

epoch 49
LSTM
  0%|          | 0/50 [00:00<?, ?it/s]  2%|▏         | 1/50 [00:04<03:52,  4.75s/it]  4%|▍         | 2/50 [00:04<01:37,  2.03s/it]  6%|▌         | 3/50 [00:05<00:57,  1.21s/it]  8%|▊         | 4/50 [00:05<00:38,  1.21it/s] 10%|█         | 5/50 [00:05<00:27,  1.62it/s] 12%|█▏        | 6/50 [00:05<00:21,  2.05it/s] 14%|█▍        | 7/50 [00:06<00:17,  2.46it/s] 16%|█▌        | 8/50 [00:06<00:14,  2.83it/s] 18%|█▊        | 9/50 [00:06<00:13,  3.15it/s] 20%|██        | 10/50 [00:06<00:11,  3.41it/s] 22%|██▏       | 11/50 [00:07<00:10,  3.61it/s] 24%|██▍       | 12/50 [00:07<00:10,  3.76it/s] 26%|██▌       | 13/50 [00:07<00:09,  3.87it/s] 28%|██▊       | 14/50 [00:07<00:09,  3.96it/s] 30%|███       | 15/50 [00:07<00:08,  4.02it/s] 32%|███▏      | 16/50 [00:08<00:08,  4.06it/s] 34%|███▍      | 17/50 [00:08<00:08,  4.09it/s] 36%|███▌      | 18/50 [00:08<00:07,  4.11it/s] 38%|███▊      | 19/50 [00:08<00:07,  4.13it/s] 40%|████      | 20/50 [00:09<00:07,  4.14it/s] 42%|████▏     | 21/50 [00:09<00:06,  4.15it/s] 44%|████▍     | 22/50 [00:09<00:06,  4.15it/s] 46%|████▌     | 23/50 [00:09<00:06,  4.16it/s] 48%|████▊     | 24/50 [00:10<00:06,  4.16it/s] 50%|█████     | 25/50 [00:10<00:06,  4.16it/s] 52%|█████▏    | 26/50 [00:10<00:05,  4.16it/s] 54%|█████▍    | 27/50 [00:10<00:05,  4.16it/s] 56%|█████▌    | 28/50 [00:11<00:05,  4.16it/s] 58%|█████▊    | 29/50 [00:11<00:05,  4.16it/s] 60%|██████    | 30/50 [00:11<00:04,  4.16it/s] 62%|██████▏   | 31/50 [00:11<00:04,  4.16it/s] 64%|██████▍   | 32/50 [00:12<00:04,  4.16it/s] 66%|██████▌   | 33/50 [00:12<00:04,  4.16it/s] 68%|██████▊   | 34/50 [00:12<00:03,  4.16it/s] 70%|███████   | 35/50 [00:12<00:03,  4.16it/s] 72%|███████▏  | 36/50 [00:13<00:03,  4.16it/s] 74%|███████▍  | 37/50 [00:13<00:03,  4.16it/s] 76%|███████▌  | 38/50 [00:13<00:02,  4.16it/s] 78%|███████▊  | 39/50 [00:13<00:02,  4.15it/s] 80%|████████  | 40/50 [00:14<00:02,  4.15it/s] 82%|████████▏ | 41/50 [00:14<00:02,  4.15it/s] 84%|████████▍ | 42/50 [00:14<00:01,  4.16it/s] 86%|████████▌ | 43/50 [00:14<00:01,  4.15it/s] 88%|████████▊ | 44/50 [00:14<00:01,  4.15it/s] 90%|█████████ | 45/50 [00:15<00:01,  4.15it/s] 92%|█████████▏| 46/50 [00:15<00:00,  4.15it/s] 94%|█████████▍| 47/50 [00:15<00:00,  4.15it/s] 96%|█████████▌| 48/50 [00:15<00:00,  4.15it/s] 98%|█████████▊| 49/50 [00:16<00:00,  4.15it/s]100%|██████████| 50/50 [00:21<00:00,  1.64s/it]100%|██████████| 50/50 [00:21<00:00,  2.37it/s]
[I 2023-12-10 23:03:16,657] Trial 203 finished with value: 0.40440423352680094 and parameters: {'EMBEDDING_DIM': 1007, 'HIDDEN_DIM': 368, 'NUM_LAYERS': 1, 'DROPOUT': 0.3591067132827883, 'LR': 0.0013067999255230675, 'WEIGHT_0': 0.3975002144267841, 'WEIGHT_1': 0.5749785430413382, 'WEIGHT_2': 0.732026704993413, 'WEIGHT_3': 0.9714616332528855, 'WEIGHT_4': 0.899510547786425, 'WEIGHT_5': 0.5245749952372514, 'WEIGHT_6': 0.6263286109862708, 'WEIGHT_7': 0.36397915780503654, 'WEIGHT_8': 0.49541100612145045, 'optimizer': 'RMSprop'}. Best is trial 134 with value: 0.4158467115484205.
/userhome/cs2/dingruiw/conda/envs/py310/lib/python3.10/site-packages/torch/nn/modules/rnn.py:82: UserWarning: dropout option adds dropout after all but last recurrent layer, so non-zero dropout expects num_layers greater than 1, but got dropout=0.3213268600536636 and num_layers=1
  warnings.warn("dropout option adds dropout after all but last "
{'EMBEDDING_DIM': 1007, 'HIDDEN_DIM': 368, 'NUM_LAYERS': 1, 'DROPOUT': 0.3591067132827883, 'LR': 0.0013067999255230675, 'WEIGHT_0': 0.3975002144267841, 'WEIGHT_1': 0.5749785430413382, 'WEIGHT_2': 0.732026704993413, 'WEIGHT_3': 0.9714616332528855, 'WEIGHT_4': 0.899510547786425, 'WEIGHT_5': 0.5245749952372514, 'WEIGHT_6': 0.6263286109862708, 'WEIGHT_7': 0.36397915780503654, 'WEIGHT_8': 0.49541100612145045, 'optimizer': 'RMSprop'}
0
              precision    recall  f1-score   support

         LOC       0.39      0.11      0.18      1837
        MISC       0.04      0.03      0.03       922
         ORG       0.12      0.06      0.07      1341
         PER       0.07      0.03      0.04      1842

   micro avg       0.14      0.06      0.08      5942
   macro avg       0.15      0.06      0.08      5942
weighted avg       0.18      0.06      0.09      5942

{'EMBEDDING_DIM': 1007, 'HIDDEN_DIM': 368, 'NUM_LAYERS': 1, 'DROPOUT': 0.3591067132827883, 'LR': 0.0013067999255230675, 'WEIGHT_0': 0.3975002144267841, 'WEIGHT_1': 0.5749785430413382, 'WEIGHT_2': 0.732026704993413, 'WEIGHT_3': 0.9714616332528855, 'WEIGHT_4': 0.899510547786425, 'WEIGHT_5': 0.5245749952372514, 'WEIGHT_6': 0.6263286109862708, 'WEIGHT_7': 0.36397915780503654, 'WEIGHT_8': 0.49541100612145045, 'optimizer': 'RMSprop'}
49
              precision    recall  f1-score   support

         LOC       0.58      0.53      0.56      1837
        MISC       0.45      0.46      0.45       922
         ORG       0.30      0.26      0.28      1341
         PER       0.31      0.34      0.33      1842

   micro avg       0.41      0.40      0.40      5942
   macro avg       0.41      0.40      0.40      5942
weighted avg       0.41      0.40      0.41      5942

epoch 49
LSTM
  0%|          | 0/50 [00:00<?, ?it/s]  2%|▏         | 1/50 [00:04<03:54,  4.79s/it]  4%|▍         | 2/50 [00:04<01:39,  2.07s/it]  6%|▌         | 3/50 [00:05<00:59,  1.26s/it]  8%|▊         | 4/50 [00:05<00:40,  1.14it/s] 10%|█         | 5/50 [00:05<00:30,  1.50it/s] 12%|█▏        | 6/50 [00:06<00:23,  1.85it/s] 14%|█▍        | 7/50 [00:06<00:19,  2.17it/s] 16%|█▌        | 8/50 [00:06<00:17,  2.45it/s] 18%|█▊        | 9/50 [00:07<00:15,  2.68it/s] 20%|██        | 10/50 [00:07<00:13,  2.86it/s] 22%|██▏       | 11/50 [00:07<00:12,  3.01it/s] 24%|██▍       | 12/50 [00:07<00:12,  3.11it/s] 26%|██▌       | 13/50 [00:08<00:11,  3.19it/s] 28%|██▊       | 14/50 [00:08<00:11,  3.24it/s] 30%|███       | 15/50 [00:08<00:10,  3.28it/s] 32%|███▏      | 16/50 [00:09<00:10,  3.31it/s] 34%|███▍      | 17/50 [00:09<00:09,  3.32it/s] 36%|███▌      | 18/50 [00:09<00:09,  3.34it/s] 38%|███▊      | 19/50 [00:09<00:09,  3.35it/s] 40%|████      | 20/50 [00:10<00:08,  3.35it/s] 42%|████▏     | 21/50 [00:10<00:08,  3.36it/s] 44%|████▍     | 22/50 [00:10<00:08,  3.36it/s] 46%|████▌     | 23/50 [00:11<00:08,  3.36it/s] 48%|████▊     | 24/50 [00:11<00:07,  3.36it/s] 50%|█████     | 25/50 [00:11<00:07,  3.36it/s] 52%|█████▏    | 26/50 [00:12<00:07,  3.36it/s] 54%|█████▍    | 27/50 [00:12<00:06,  3.37it/s] 56%|█████▌    | 28/50 [00:12<00:06,  3.36it/s] 58%|█████▊    | 29/50 [00:12<00:06,  3.36it/s] 60%|██████    | 30/50 [00:13<00:05,  3.37it/s] 62%|██████▏   | 31/50 [00:13<00:05,  3.36it/s] 64%|██████▍   | 32/50 [00:13<00:05,  3.36it/s] 66%|██████▌   | 33/50 [00:14<00:05,  3.37it/s] 68%|██████▊   | 34/50 [00:14<00:04,  3.36it/s] 70%|███████   | 35/50 [00:14<00:04,  3.36it/s] 72%|███████▏  | 36/50 [00:15<00:04,  3.36it/s] 74%|███████▍  | 37/50 [00:15<00:03,  3.36it/s] 76%|███████▌  | 38/50 [00:15<00:03,  3.35it/s] 78%|███████▊  | 39/50 [00:15<00:03,  3.36it/s] 80%|████████  | 40/50 [00:16<00:02,  3.36it/s] 82%|████████▏ | 41/50 [00:16<00:02,  3.35it/s] 84%|████████▍ | 42/50 [00:16<00:02,  3.35it/s] 86%|████████▌ | 43/50 [00:17<00:02,  3.35it/s] 88%|████████▊ | 44/50 [00:17<00:01,  3.35it/s] 90%|█████████ | 45/50 [00:17<00:01,  3.35it/s] 92%|█████████▏| 46/50 [00:18<00:01,  3.35it/s] 94%|█████████▍| 47/50 [00:18<00:00,  3.35it/s] 96%|█████████▌| 48/50 [00:18<00:00,  3.35it/s] 98%|█████████▊| 49/50 [00:18<00:00,  3.34it/s]100%|██████████| 50/50 [00:24<00:00,  1.73s/it]100%|██████████| 50/50 [00:24<00:00,  2.08it/s]
[I 2023-12-10 23:03:44,906] Trial 204 finished with value: 0.3999305977270756 and parameters: {'EMBEDDING_DIM': 993, 'HIDDEN_DIM': 441, 'NUM_LAYERS': 1, 'DROPOUT': 0.3213268600536636, 'LR': 0.001473545525811861, 'WEIGHT_0': 0.380883469175589, 'WEIGHT_1': 0.6082750245288555, 'WEIGHT_2': 0.7073412786441062, 'WEIGHT_3': 0.9939366861423459, 'WEIGHT_4': 0.8648873632636896, 'WEIGHT_5': 0.50513437810155, 'WEIGHT_6': 0.5606241331351909, 'WEIGHT_7': 0.9432876181648663, 'WEIGHT_8': 0.4595212569028822, 'optimizer': 'RMSprop'}. Best is trial 134 with value: 0.4158467115484205.
/userhome/cs2/dingruiw/conda/envs/py310/lib/python3.10/site-packages/torch/nn/modules/rnn.py:82: UserWarning: dropout option adds dropout after all but last recurrent layer, so non-zero dropout expects num_layers greater than 1, but got dropout=0.11738341618812612 and num_layers=1
  warnings.warn("dropout option adds dropout after all but last "
{'EMBEDDING_DIM': 993, 'HIDDEN_DIM': 441, 'NUM_LAYERS': 1, 'DROPOUT': 0.3213268600536636, 'LR': 0.001473545525811861, 'WEIGHT_0': 0.380883469175589, 'WEIGHT_1': 0.6082750245288555, 'WEIGHT_2': 0.7073412786441062, 'WEIGHT_3': 0.9939366861423459, 'WEIGHT_4': 0.8648873632636896, 'WEIGHT_5': 0.50513437810155, 'WEIGHT_6': 0.5606241331351909, 'WEIGHT_7': 0.9432876181648663, 'WEIGHT_8': 0.4595212569028822, 'optimizer': 'RMSprop'}
0
              precision    recall  f1-score   support

         LOC       0.26      0.15      0.19      1837
        MISC       0.03      0.03      0.03       922
         ORG       0.09      0.03      0.05      1341
         PER       0.04      0.06      0.05      1842

   micro avg       0.09      0.08      0.08      5942
   macro avg       0.10      0.07      0.08      5942
weighted avg       0.12      0.08      0.09      5942

{'EMBEDDING_DIM': 993, 'HIDDEN_DIM': 441, 'NUM_LAYERS': 1, 'DROPOUT': 0.3213268600536636, 'LR': 0.001473545525811861, 'WEIGHT_0': 0.380883469175589, 'WEIGHT_1': 0.6082750245288555, 'WEIGHT_2': 0.7073412786441062, 'WEIGHT_3': 0.9939366861423459, 'WEIGHT_4': 0.8648873632636896, 'WEIGHT_5': 0.50513437810155, 'WEIGHT_6': 0.5606241331351909, 'WEIGHT_7': 0.9432876181648663, 'WEIGHT_8': 0.4595212569028822, 'optimizer': 'RMSprop'}
49
              precision    recall  f1-score   support

         LOC       0.59      0.51      0.55      1837
        MISC       0.40      0.46      0.43       922
         ORG       0.29      0.24      0.26      1341
         PER       0.34      0.34      0.34      1842

   micro avg       0.41      0.39      0.40      5942
   macro avg       0.41      0.39      0.39      5942
weighted avg       0.42      0.39      0.40      5942

epoch 49
LSTM
  0%|          | 0/50 [00:00<?, ?it/s]  2%|▏         | 1/50 [00:04<03:48,  4.66s/it]  4%|▍         | 2/50 [00:04<01:35,  1.99s/it]  6%|▌         | 3/50 [00:04<00:55,  1.18s/it]  8%|▊         | 4/50 [00:05<00:36,  1.25it/s] 10%|█         | 5/50 [00:05<00:26,  1.70it/s] 12%|█▏        | 6/50 [00:05<00:20,  2.17it/s] 14%|█▍        | 7/50 [00:05<00:16,  2.63it/s] 16%|█▌        | 8/50 [00:06<00:13,  3.06it/s] 18%|█▊        | 9/50 [00:06<00:11,  3.43it/s] 20%|██        | 10/50 [00:06<00:10,  3.73it/s] 22%|██▏       | 11/50 [00:06<00:09,  3.97it/s] 24%|██▍       | 12/50 [00:06<00:09,  4.15it/s] 26%|██▌       | 13/50 [00:07<00:08,  4.30it/s] 28%|██▊       | 14/50 [00:07<00:08,  4.39it/s] 30%|███       | 15/50 [00:07<00:07,  4.47it/s] 32%|███▏      | 16/50 [00:07<00:07,  4.53it/s] 34%|███▍      | 17/50 [00:07<00:07,  4.56it/s] 36%|███▌      | 18/50 [00:08<00:06,  4.59it/s] 38%|███▊      | 19/50 [00:08<00:06,  4.60it/s] 40%|████      | 20/50 [00:08<00:06,  4.62it/s] 42%|████▏     | 21/50 [00:08<00:06,  4.63it/s] 44%|████▍     | 22/50 [00:09<00:06,  4.63it/s] 46%|████▌     | 23/50 [00:09<00:05,  4.64it/s] 48%|████▊     | 24/50 [00:09<00:05,  4.64it/s] 50%|█████     | 25/50 [00:09<00:05,  4.64it/s] 52%|█████▏    | 26/50 [00:09<00:05,  4.64it/s] 54%|█████▍    | 27/50 [00:10<00:04,  4.64it/s] 56%|█████▌    | 28/50 [00:10<00:04,  4.64it/s] 58%|█████▊    | 29/50 [00:10<00:04,  4.64it/s] 60%|██████    | 30/50 [00:10<00:04,  4.63it/s] 62%|██████▏   | 31/50 [00:11<00:04,  4.64it/s] 64%|██████▍   | 32/50 [00:11<00:03,  4.64it/s] 66%|██████▌   | 33/50 [00:11<00:03,  4.65it/s] 68%|██████▊   | 34/50 [00:11<00:03,  4.64it/s] 70%|███████   | 35/50 [00:11<00:03,  4.65it/s] 72%|███████▏  | 36/50 [00:12<00:03,  4.65it/s] 74%|███████▍  | 37/50 [00:12<00:02,  4.64it/s] 76%|███████▌  | 38/50 [00:12<00:02,  4.65it/s] 78%|███████▊  | 39/50 [00:12<00:02,  4.64it/s] 80%|████████  | 40/50 [00:12<00:02,  4.64it/s] 82%|████████▏ | 41/50 [00:13<00:01,  4.64it/s] 84%|████████▍ | 42/50 [00:13<00:01,  4.64it/s] 86%|████████▌ | 43/50 [00:13<00:01,  4.64it/s] 88%|████████▊ | 44/50 [00:13<00:01,  4.64it/s] 90%|█████████ | 45/50 [00:14<00:01,  4.63it/s] 92%|█████████▏| 46/50 [00:14<00:00,  4.64it/s] 94%|█████████▍| 47/50 [00:14<00:00,  4.63it/s] 96%|█████████▌| 48/50 [00:14<00:00,  4.64it/s] 98%|█████████▊| 49/50 [00:14<00:00,  4.64it/s]100%|██████████| 50/50 [00:19<00:00,  1.60s/it]100%|██████████| 50/50 [00:19<00:00,  2.54it/s]
