[I 2023-12-10 22:02:32,371] Trial 89 finished with value: 0.3927845079140508 and parameters: {'EMBEDDING_DIM': 922, 'HIDDEN_DIM': 715, 'NUM_LAYERS': 1, 'DROPOUT': 0.35962888664502596, 'LR': 0.0007615792408140655, 'WEIGHT_0': 0.4503213782698295, 'WEIGHT_1': 0.7661648266558527, 'WEIGHT_2': 0.6929188043615909, 'WEIGHT_3': 0.7761160206304281, 'WEIGHT_4': 0.8565698403372008, 'WEIGHT_5': 0.3937299096123005, 'WEIGHT_6': 0.8835546178834109, 'WEIGHT_7': 0.3552484107064673, 'WEIGHT_8': 0.34800319138682245, 'optimizer': 'RMSprop'}. Best is trial 51 with value: 0.41438326562364947.
/userhome/cs2/dingruiw/conda/envs/py310/lib/python3.10/site-packages/torch/nn/modules/rnn.py:82: UserWarning: dropout option adds dropout after all but last recurrent layer, so non-zero dropout expects num_layers greater than 1, but got dropout=0.3397643129861111 and num_layers=1
  warnings.warn("dropout option adds dropout after all but last "
{'EMBEDDING_DIM': 922, 'HIDDEN_DIM': 715, 'NUM_LAYERS': 1, 'DROPOUT': 0.35962888664502596, 'LR': 0.0007615792408140655, 'WEIGHT_0': 0.4503213782698295, 'WEIGHT_1': 0.7661648266558527, 'WEIGHT_2': 0.6929188043615909, 'WEIGHT_3': 0.7761160206304281, 'WEIGHT_4': 0.8565698403372008, 'WEIGHT_5': 0.3937299096123005, 'WEIGHT_6': 0.8835546178834109, 'WEIGHT_7': 0.3552484107064673, 'WEIGHT_8': 0.34800319138682245, 'optimizer': 'RMSprop'}
0
              precision    recall  f1-score   support

         LOC       0.11      0.08      0.10      1837
        MISC       0.03      0.02      0.02       922
         ORG       0.04      0.01      0.02      1341
         PER       0.04      0.01      0.02      1842

   micro avg       0.07      0.03      0.05      5942
   macro avg       0.05      0.03      0.04      5942
weighted avg       0.06      0.03      0.04      5942

{'EMBEDDING_DIM': 922, 'HIDDEN_DIM': 715, 'NUM_LAYERS': 1, 'DROPOUT': 0.35962888664502596, 'LR': 0.0007615792408140655, 'WEIGHT_0': 0.4503213782698295, 'WEIGHT_1': 0.7661648266558527, 'WEIGHT_2': 0.6929188043615909, 'WEIGHT_3': 0.7761160206304281, 'WEIGHT_4': 0.8565698403372008, 'WEIGHT_5': 0.3937299096123005, 'WEIGHT_6': 0.8835546178834109, 'WEIGHT_7': 0.3552484107064673, 'WEIGHT_8': 0.34800319138682245, 'optimizer': 'RMSprop'}
49
              precision    recall  f1-score   support

         LOC       0.58      0.49      0.53      1837
        MISC       0.45      0.43      0.44       922
         ORG       0.30      0.24      0.27      1341
         PER       0.32      0.32      0.32      1842

   micro avg       0.41      0.37      0.39      5942
   macro avg       0.41      0.37      0.39      5942
weighted avg       0.42      0.37      0.39      5942

epoch 49
LSTM
  0%|          | 0/50 [00:00<?, ?it/s]  2%|▏         | 1/50 [00:04<03:50,  4.70s/it]  4%|▍         | 2/50 [00:04<01:36,  2.01s/it]  6%|▌         | 3/50 [00:05<00:56,  1.20s/it]  8%|▊         | 4/50 [00:05<00:37,  1.23it/s] 10%|█         | 5/50 [00:05<00:27,  1.65it/s] 12%|█▏        | 6/50 [00:05<00:21,  2.09it/s] 14%|█▍        | 7/50 [00:05<00:17,  2.51it/s] 16%|█▌        | 8/50 [00:06<00:14,  2.90it/s] 18%|█▊        | 9/50 [00:06<00:12,  3.23it/s] 20%|██        | 10/50 [00:06<00:11,  3.50it/s] 22%|██▏       | 11/50 [00:06<00:10,  3.71it/s] 24%|██▍       | 12/50 [00:07<00:09,  3.87it/s] 26%|██▌       | 13/50 [00:07<00:09,  3.99it/s] 28%|██▊       | 14/50 [00:07<00:08,  4.09it/s] 30%|███       | 15/50 [00:07<00:08,  4.15it/s] 32%|███▏      | 16/50 [00:08<00:08,  4.19it/s] 34%|███▍      | 17/50 [00:08<00:07,  4.23it/s] 36%|███▌      | 18/50 [00:08<00:07,  4.25it/s] 38%|███▊      | 19/50 [00:08<00:07,  4.26it/s] 40%|████      | 20/50 [00:09<00:07,  4.27it/s] 42%|████▏     | 21/50 [00:09<00:06,  4.28it/s] 44%|████▍     | 22/50 [00:09<00:06,  4.28it/s] 46%|████▌     | 23/50 [00:09<00:06,  4.29it/s] 48%|████▊     | 24/50 [00:09<00:06,  4.29it/s] 50%|█████     | 25/50 [00:10<00:05,  4.29it/s] 52%|█████▏    | 26/50 [00:10<00:05,  4.30it/s] 54%|█████▍    | 27/50 [00:10<00:05,  4.30it/s] 56%|█████▌    | 28/50 [00:10<00:05,  4.29it/s] 58%|█████▊    | 29/50 [00:11<00:04,  4.30it/s] 60%|██████    | 30/50 [00:11<00:04,  4.30it/s] 62%|██████▏   | 31/50 [00:11<00:04,  4.30it/s] 64%|██████▍   | 32/50 [00:11<00:04,  4.30it/s] 66%|██████▌   | 33/50 [00:12<00:03,  4.29it/s] 68%|██████▊   | 34/50 [00:12<00:03,  4.30it/s] 70%|███████   | 35/50 [00:12<00:03,  4.30it/s] 72%|███████▏  | 36/50 [00:12<00:03,  4.28it/s] 74%|███████▍  | 37/50 [00:12<00:03,  4.27it/s] 76%|███████▌  | 38/50 [00:13<00:02,  4.28it/s] 78%|███████▊  | 39/50 [00:13<00:02,  4.28it/s] 80%|████████  | 40/50 [00:13<00:02,  4.28it/s] 82%|████████▏ | 41/50 [00:13<00:02,  4.28it/s] 84%|████████▍ | 42/50 [00:14<00:01,  4.28it/s] 86%|████████▌ | 43/50 [00:14<00:01,  4.27it/s] 88%|████████▊ | 44/50 [00:14<00:01,  4.26it/s] 90%|█████████ | 45/50 [00:14<00:01,  4.27it/s] 92%|█████████▏| 46/50 [00:15<00:00,  4.27it/s] 94%|█████████▍| 47/50 [00:15<00:00,  4.25it/s] 96%|█████████▌| 48/50 [00:15<00:00,  4.26it/s] 98%|█████████▊| 49/50 [00:15<00:00,  4.26it/s]100%|██████████| 50/50 [00:20<00:00,  1.66s/it]100%|██████████| 50/50 [00:20<00:00,  2.41it/s]
[I 2023-12-10 22:02:57,314] Trial 90 finished with value: 0.4010510757102972 and parameters: {'EMBEDDING_DIM': 884, 'HIDDEN_DIM': 383, 'NUM_LAYERS': 1, 'DROPOUT': 0.3397643129861111, 'LR': 0.0014760995531241544, 'WEIGHT_0': 0.34500077706287163, 'WEIGHT_1': 0.6824921233158745, 'WEIGHT_2': 0.6689321399494519, 'WEIGHT_3': 0.9173726058780863, 'WEIGHT_4': 0.8877294506318748, 'WEIGHT_5': 0.4489496072003206, 'WEIGHT_6': 0.9398909199166903, 'WEIGHT_7': 0.30753578118080593, 'WEIGHT_8': 0.4255363330822865, 'optimizer': 'RMSprop'}. Best is trial 51 with value: 0.41438326562364947.
/userhome/cs2/dingruiw/conda/envs/py310/lib/python3.10/site-packages/torch/nn/modules/rnn.py:82: UserWarning: dropout option adds dropout after all but last recurrent layer, so non-zero dropout expects num_layers greater than 1, but got dropout=0.3387370501159581 and num_layers=1
  warnings.warn("dropout option adds dropout after all but last "
{'EMBEDDING_DIM': 884, 'HIDDEN_DIM': 383, 'NUM_LAYERS': 1, 'DROPOUT': 0.3397643129861111, 'LR': 0.0014760995531241544, 'WEIGHT_0': 0.34500077706287163, 'WEIGHT_1': 0.6824921233158745, 'WEIGHT_2': 0.6689321399494519, 'WEIGHT_3': 0.9173726058780863, 'WEIGHT_4': 0.8877294506318748, 'WEIGHT_5': 0.4489496072003206, 'WEIGHT_6': 0.9398909199166903, 'WEIGHT_7': 0.30753578118080593, 'WEIGHT_8': 0.4255363330822865, 'optimizer': 'RMSprop'}
0
              precision    recall  f1-score   support

         LOC       0.26      0.14      0.18      1837
        MISC       0.07      0.04      0.05       922
         ORG       0.10      0.02      0.03      1341
         PER       0.06      0.03      0.04      1842

   micro avg       0.15      0.06      0.09      5942
   macro avg       0.12      0.06      0.08      5942
weighted avg       0.13      0.06      0.08      5942

{'EMBEDDING_DIM': 884, 'HIDDEN_DIM': 383, 'NUM_LAYERS': 1, 'DROPOUT': 0.3397643129861111, 'LR': 0.0014760995531241544, 'WEIGHT_0': 0.34500077706287163, 'WEIGHT_1': 0.6824921233158745, 'WEIGHT_2': 0.6689321399494519, 'WEIGHT_3': 0.9173726058780863, 'WEIGHT_4': 0.8877294506318748, 'WEIGHT_5': 0.4489496072003206, 'WEIGHT_6': 0.9398909199166903, 'WEIGHT_7': 0.30753578118080593, 'WEIGHT_8': 0.4255363330822865, 'optimizer': 'RMSprop'}
49
              precision    recall  f1-score   support

         LOC       0.55      0.54      0.55      1837
        MISC       0.43      0.46      0.45       922
         ORG       0.26      0.25      0.25      1341
         PER       0.32      0.37      0.34      1842

   micro avg       0.39      0.41      0.40      5942
   macro avg       0.39      0.41      0.40      5942
weighted avg       0.39      0.41      0.40      5942

epoch 49
LSTM
  0%|          | 0/50 [00:00<?, ?it/s]  2%|▏         | 1/50 [00:04<03:54,  4.78s/it]  4%|▍         | 2/50 [00:04<01:39,  2.08s/it]  6%|▌         | 3/50 [00:05<01:00,  1.30s/it]  8%|▊         | 4/50 [00:05<00:42,  1.08it/s] 10%|█         | 5/50 [00:06<00:32,  1.39it/s] 12%|█▏        | 6/50 [00:06<00:26,  1.68it/s] 14%|█▍        | 7/50 [00:06<00:22,  1.94it/s] 16%|█▌        | 8/50 [00:07<00:19,  2.15it/s] 18%|█▊        | 9/50 [00:07<00:17,  2.33it/s] 20%|██        | 10/50 [00:07<00:16,  2.45it/s] 22%|██▏       | 11/50 [00:08<00:15,  2.55it/s] 24%|██▍       | 12/50 [00:08<00:14,  2.63it/s] 26%|██▌       | 13/50 [00:08<00:13,  2.68it/s] 28%|██▊       | 14/50 [00:09<00:13,  2.72it/s] 30%|███       | 15/50 [00:09<00:12,  2.75it/s] 32%|███▏      | 16/50 [00:09<00:12,  2.77it/s] 34%|███▍      | 17/50 [00:10<00:11,  2.78it/s] 36%|███▌      | 18/50 [00:10<00:11,  2.79it/s] 38%|███▊      | 19/50 [00:11<00:11,  2.80it/s] 40%|████      | 20/50 [00:11<00:10,  2.80it/s] 42%|████▏     | 21/50 [00:11<00:10,  2.81it/s] 44%|████▍     | 22/50 [00:12<00:09,  2.81it/s] 46%|████▌     | 23/50 [00:12<00:09,  2.81it/s] 48%|████▊     | 24/50 [00:12<00:09,  2.80it/s] 50%|█████     | 25/50 [00:13<00:08,  2.80it/s] 52%|█████▏    | 26/50 [00:13<00:08,  2.80it/s] 54%|█████▍    | 27/50 [00:13<00:08,  2.80it/s] 56%|█████▌    | 28/50 [00:14<00:07,  2.80it/s] 58%|█████▊    | 29/50 [00:14<00:07,  2.81it/s] 60%|██████    | 30/50 [00:14<00:07,  2.80it/s] 62%|██████▏   | 31/50 [00:15<00:06,  2.80it/s] 64%|██████▍   | 32/50 [00:15<00:06,  2.80it/s] 66%|██████▌   | 33/50 [00:16<00:06,  2.80it/s] 68%|██████▊   | 34/50 [00:16<00:05,  2.80it/s] 70%|███████   | 35/50 [00:16<00:05,  2.80it/s] 72%|███████▏  | 36/50 [00:17<00:04,  2.80it/s] 74%|███████▍  | 37/50 [00:17<00:04,  2.80it/s] 76%|███████▌  | 38/50 [00:17<00:04,  2.80it/s] 78%|███████▊  | 39/50 [00:18<00:03,  2.80it/s] 80%|████████  | 40/50 [00:18<00:03,  2.80it/s] 82%|████████▏ | 41/50 [00:18<00:03,  2.80it/s] 84%|████████▍ | 42/50 [00:19<00:02,  2.80it/s] 86%|████████▌ | 43/50 [00:19<00:02,  2.80it/s] 88%|████████▊ | 44/50 [00:19<00:02,  2.80it/s] 90%|█████████ | 45/50 [00:20<00:01,  2.79it/s] 92%|█████████▏| 46/50 [00:20<00:01,  2.79it/s] 94%|█████████▍| 47/50 [00:21<00:01,  2.79it/s] 96%|█████████▌| 48/50 [00:21<00:00,  2.79it/s] 98%|█████████▊| 49/50 [00:21<00:00,  2.79it/s]100%|██████████| 50/50 [00:26<00:00,  1.72s/it]100%|██████████| 50/50 [00:26<00:00,  1.88it/s]
[I 2023-12-10 22:03:28,199] Trial 91 finished with value: 0.4024995719910974 and parameters: {'EMBEDDING_DIM': 984, 'HIDDEN_DIM': 529, 'NUM_LAYERS': 1, 'DROPOUT': 0.3387370501159581, 'LR': 0.0011688202809087653, 'WEIGHT_0': 0.3913673992510735, 'WEIGHT_1': 0.6673947877530868, 'WEIGHT_2': 0.5578369770627822, 'WEIGHT_3': 0.8612302316571402, 'WEIGHT_4': 0.7623870622660672, 'WEIGHT_5': 0.5225414926066622, 'WEIGHT_6': 0.9727487596834318, 'WEIGHT_7': 0.3408145859451846, 'WEIGHT_8': 0.4094889328606666, 'optimizer': 'RMSprop'}. Best is trial 51 with value: 0.41438326562364947.
/userhome/cs2/dingruiw/conda/envs/py310/lib/python3.10/site-packages/torch/nn/modules/rnn.py:82: UserWarning: dropout option adds dropout after all but last recurrent layer, so non-zero dropout expects num_layers greater than 1, but got dropout=0.3129256247033174 and num_layers=1
  warnings.warn("dropout option adds dropout after all but last "
{'EMBEDDING_DIM': 984, 'HIDDEN_DIM': 529, 'NUM_LAYERS': 1, 'DROPOUT': 0.3387370501159581, 'LR': 0.0011688202809087653, 'WEIGHT_0': 0.3913673992510735, 'WEIGHT_1': 0.6673947877530868, 'WEIGHT_2': 0.5578369770627822, 'WEIGHT_3': 0.8612302316571402, 'WEIGHT_4': 0.7623870622660672, 'WEIGHT_5': 0.5225414926066622, 'WEIGHT_6': 0.9727487596834318, 'WEIGHT_7': 0.3408145859451846, 'WEIGHT_8': 0.4094889328606666, 'optimizer': 'RMSprop'}
0
              precision    recall  f1-score   support

         LOC       0.22      0.09      0.13      1837
        MISC       0.06      0.03      0.04       922
         ORG       0.09      0.02      0.03      1341
         PER       0.07      0.05      0.06      1842

   micro avg       0.11      0.05      0.07      5942
   macro avg       0.11      0.05      0.06      5942
weighted avg       0.12      0.05      0.07      5942

{'EMBEDDING_DIM': 984, 'HIDDEN_DIM': 529, 'NUM_LAYERS': 1, 'DROPOUT': 0.3387370501159581, 'LR': 0.0011688202809087653, 'WEIGHT_0': 0.3913673992510735, 'WEIGHT_1': 0.6673947877530868, 'WEIGHT_2': 0.5578369770627822, 'WEIGHT_3': 0.8612302316571402, 'WEIGHT_4': 0.7623870622660672, 'WEIGHT_5': 0.5225414926066622, 'WEIGHT_6': 0.9727487596834318, 'WEIGHT_7': 0.3408145859451846, 'WEIGHT_8': 0.4094889328606666, 'optimizer': 'RMSprop'}
49
              precision    recall  f1-score   support

         LOC       0.56      0.51      0.54      1837
        MISC       0.44      0.44      0.44       922
         ORG       0.28      0.26      0.27      1341
         PER       0.34      0.36      0.35      1842

   micro avg       0.41      0.40      0.40      5942
   macro avg       0.41      0.39      0.40      5942
weighted avg       0.41      0.40      0.40      5942

epoch 49
LSTM
  0%|          | 0/50 [00:00<?, ?it/s]  2%|▏         | 1/50 [00:04<03:54,  4.78s/it]  4%|▍         | 2/50 [00:04<01:39,  2.07s/it]  6%|▌         | 3/50 [00:05<00:59,  1.27s/it]  8%|▊         | 4/50 [00:05<00:41,  1.12it/s] 10%|█         | 5/50 [00:05<00:30,  1.46it/s] 12%|█▏        | 6/50 [00:06<00:24,  1.80it/s] 14%|█▍        | 7/50 [00:06<00:20,  2.10it/s] 16%|█▌        | 8/50 [00:06<00:17,  2.35it/s] 18%|█▊        | 9/50 [00:07<00:15,  2.57it/s] 20%|██        | 10/50 [00:07<00:14,  2.73it/s] 22%|██▏       | 11/50 [00:07<00:13,  2.86it/s] 24%|██▍       | 12/50 [00:08<00:12,  2.95it/s] 26%|██▌       | 13/50 [00:08<00:12,  3.02it/s] 28%|██▊       | 14/50 [00:08<00:11,  3.07it/s] 30%|███       | 15/50 [00:09<00:11,  3.11it/s] 32%|███▏      | 16/50 [00:09<00:10,  3.13it/s] 34%|███▍      | 17/50 [00:09<00:10,  3.15it/s] 36%|███▌      | 18/50 [00:09<00:10,  3.16it/s] 38%|███▊      | 19/50 [00:10<00:09,  3.17it/s] 40%|████      | 20/50 [00:10<00:09,  3.17it/s] 42%|████▏     | 21/50 [00:10<00:09,  3.18it/s] 44%|████▍     | 22/50 [00:11<00:08,  3.18it/s] 46%|████▌     | 23/50 [00:11<00:08,  3.18it/s] 48%|████▊     | 24/50 [00:11<00:08,  3.18it/s] 50%|█████     | 25/50 [00:12<00:07,  3.18it/s] 52%|█████▏    | 26/50 [00:12<00:07,  3.18it/s] 54%|█████▍    | 27/50 [00:12<00:07,  3.18it/s] 56%|█████▌    | 28/50 [00:13<00:06,  3.18it/s] 58%|█████▊    | 29/50 [00:13<00:06,  3.18it/s] 60%|██████    | 30/50 [00:13<00:06,  3.18it/s] 62%|██████▏   | 31/50 [00:14<00:05,  3.18it/s] 64%|██████▍   | 32/50 [00:14<00:05,  3.18it/s] 66%|██████▌   | 33/50 [00:14<00:05,  3.18it/s] 68%|██████▊   | 34/50 [00:14<00:05,  3.18it/s] 70%|███████   | 35/50 [00:15<00:04,  3.18it/s] 72%|███████▏  | 36/50 [00:15<00:04,  3.18it/s] 74%|███████▍  | 37/50 [00:15<00:04,  3.18it/s] 76%|███████▌  | 38/50 [00:16<00:03,  3.18it/s] 78%|███████▊  | 39/50 [00:16<00:03,  3.17it/s] 80%|████████  | 40/50 [00:16<00:03,  3.17it/s] 82%|████████▏ | 41/50 [00:17<00:02,  3.17it/s] 84%|████████▍ | 42/50 [00:17<00:02,  3.17it/s] 86%|████████▌ | 43/50 [00:17<00:02,  3.17it/s] 88%|████████▊ | 44/50 [00:18<00:01,  3.17it/s] 90%|█████████ | 45/50 [00:18<00:01,  3.17it/s] 92%|█████████▏| 46/50 [00:18<00:01,  3.17it/s] 94%|█████████▍| 47/50 [00:19<00:00,  3.17it/s] 96%|█████████▌| 48/50 [00:19<00:00,  3.16it/s] 98%|█████████▊| 49/50 [00:19<00:00,  3.17it/s]100%|██████████| 50/50 [00:24<00:00,  1.71s/it]100%|██████████| 50/50 [00:24<00:00,  2.03it/s]
[I 2023-12-10 22:03:57,131] Trial 92 finished with value: 0.4013736493843706 and parameters: {'EMBEDDING_DIM': 993, 'HIDDEN_DIM': 479, 'NUM_LAYERS': 1, 'DROPOUT': 0.3129256247033174, 'LR': 0.0010797391128398327, 'WEIGHT_0': 0.38035636869819145, 'WEIGHT_1': 0.7196873888594011, 'WEIGHT_2': 0.5827168889837752, 'WEIGHT_3': 0.8796474928531046, 'WEIGHT_4': 0.8332199907382206, 'WEIGHT_5': 0.5453596814356798, 'WEIGHT_6': 0.969310658959176, 'WEIGHT_7': 0.33706473656838004, 'WEIGHT_8': 0.4593642287678726, 'optimizer': 'RMSprop'}. Best is trial 51 with value: 0.41438326562364947.
/userhome/cs2/dingruiw/conda/envs/py310/lib/python3.10/site-packages/torch/nn/modules/rnn.py:82: UserWarning: dropout option adds dropout after all but last recurrent layer, so non-zero dropout expects num_layers greater than 1, but got dropout=0.34917672855455995 and num_layers=1
  warnings.warn("dropout option adds dropout after all but last "
{'EMBEDDING_DIM': 993, 'HIDDEN_DIM': 479, 'NUM_LAYERS': 1, 'DROPOUT': 0.3129256247033174, 'LR': 0.0010797391128398327, 'WEIGHT_0': 0.38035636869819145, 'WEIGHT_1': 0.7196873888594011, 'WEIGHT_2': 0.5827168889837752, 'WEIGHT_3': 0.8796474928531046, 'WEIGHT_4': 0.8332199907382206, 'WEIGHT_5': 0.5453596814356798, 'WEIGHT_6': 0.969310658959176, 'WEIGHT_7': 0.33706473656838004, 'WEIGHT_8': 0.4593642287678726, 'optimizer': 'RMSprop'}
0
              precision    recall  f1-score   support

         LOC       0.31      0.17      0.22      1837
        MISC       0.06      0.05      0.05       922
         ORG       0.10      0.05      0.07      1341
         PER       0.04      0.04      0.04      1842

   micro avg       0.12      0.08      0.10      5942
   macro avg       0.13      0.08      0.10      5942
weighted avg       0.14      0.08      0.10      5942

{'EMBEDDING_DIM': 993, 'HIDDEN_DIM': 479, 'NUM_LAYERS': 1, 'DROPOUT': 0.3129256247033174, 'LR': 0.0010797391128398327, 'WEIGHT_0': 0.38035636869819145, 'WEIGHT_1': 0.7196873888594011, 'WEIGHT_2': 0.5827168889837752, 'WEIGHT_3': 0.8796474928531046, 'WEIGHT_4': 0.8332199907382206, 'WEIGHT_5': 0.5453596814356798, 'WEIGHT_6': 0.969310658959176, 'WEIGHT_7': 0.33706473656838004, 'WEIGHT_8': 0.4593642287678726, 'optimizer': 'RMSprop'}
49
              precision    recall  f1-score   support

         LOC       0.56      0.52      0.54      1837
        MISC       0.41      0.44      0.42       922
         ORG       0.28      0.26      0.27      1341
         PER       0.33      0.37      0.35      1842

   micro avg       0.40      0.40      0.40      5942
   macro avg       0.40      0.40      0.40      5942
weighted avg       0.40      0.40      0.40      5942

epoch 49
LSTM
  0%|          | 0/50 [00:00<?, ?it/s]  2%|▏         | 1/50 [00:05<04:10,  5.11s/it]  4%|▍         | 2/50 [00:05<01:46,  2.23s/it]  6%|▌         | 3/50 [00:05<01:05,  1.39s/it]  8%|▊         | 4/50 [00:06<00:46,  1.00s/it] 10%|█         | 5/50 [00:06<00:35,  1.27it/s] 12%|█▏        | 6/50 [00:06<00:28,  1.53it/s] 14%|█▍        | 7/50 [00:07<00:24,  1.75it/s] 16%|█▌        | 8/50 [00:07<00:21,  1.93it/s] 18%|█▊        | 9/50 [00:08<00:19,  2.07it/s] 20%|██        | 10/50 [00:08<00:18,  2.18it/s] 22%|██▏       | 11/50 [00:08<00:17,  2.27it/s] 24%|██▍       | 12/50 [00:09<00:16,  2.32it/s] 26%|██▌       | 13/50 [00:09<00:15,  2.38it/s] 28%|██▊       | 14/50 [00:10<00:14,  2.41it/s] 30%|███       | 15/50 [00:10<00:14,  2.43it/s] 32%|███▏      | 16/50 [00:10<00:13,  2.44it/s] 34%|███▍      | 17/50 [00:11<00:13,  2.44it/s] 36%|███▌      | 18/50 [00:11<00:13,  2.45it/s] 38%|███▊      | 19/50 [00:12<00:12,  2.46it/s] 40%|████      | 20/50 [00:12<00:12,  2.47it/s] 42%|████▏     | 21/50 [00:12<00:11,  2.46it/s] 44%|████▍     | 22/50 [00:13<00:11,  2.46it/s] 46%|████▌     | 23/50 [00:13<00:10,  2.47it/s] 48%|████▊     | 24/50 [00:14<00:10,  2.47it/s] 50%|█████     | 25/50 [00:14<00:10,  2.48it/s] 52%|█████▏    | 26/50 [00:14<00:09,  2.48it/s] 54%|█████▍    | 27/50 [00:15<00:09,  2.47it/s] 56%|█████▌    | 28/50 [00:15<00:08,  2.48it/s] 58%|█████▊    | 29/50 [00:16<00:08,  2.47it/s] 60%|██████    | 30/50 [00:16<00:08,  2.47it/s] 62%|██████▏   | 31/50 [00:17<00:07,  2.46it/s] 64%|██████▍   | 32/50 [00:17<00:07,  2.46it/s] 66%|██████▌   | 33/50 [00:17<00:06,  2.46it/s] 68%|██████▊   | 34/50 [00:18<00:06,  2.47it/s] 70%|███████   | 35/50 [00:18<00:06,  2.47it/s] 72%|███████▏  | 36/50 [00:19<00:05,  2.47it/s] 74%|███████▍  | 37/50 [00:19<00:05,  2.46it/s] 76%|███████▌  | 38/50 [00:19<00:04,  2.46it/s] 78%|███████▊  | 39/50 [00:20<00:04,  2.45it/s] 80%|████████  | 40/50 [00:20<00:04,  2.45it/s] 82%|████████▏ | 41/50 [00:21<00:03,  2.46it/s] 84%|████████▍ | 42/50 [00:21<00:03,  2.46it/s] 86%|████████▌ | 43/50 [00:21<00:02,  2.45it/s] 88%|████████▊ | 44/50 [00:22<00:02,  2.46it/s] 90%|█████████ | 45/50 [00:22<00:02,  2.45it/s] 92%|█████████▏| 46/50 [00:23<00:01,  2.46it/s] 94%|█████████▍| 47/50 [00:23<00:01,  2.47it/s] 96%|█████████▌| 48/50 [00:23<00:00,  2.46it/s] 98%|█████████▊| 49/50 [00:24<00:00,  2.45it/s]100%|██████████| 50/50 [00:29<00:00,  1.84s/it]100%|██████████| 50/50 [00:29<00:00,  1.69it/s]
