[I 2023-12-10 23:59:23,782] Trial 321 finished with value: 0.4004436103054086 and parameters: {'EMBEDDING_DIM': 1006, 'HIDDEN_DIM': 324, 'NUM_LAYERS': 1, 'DROPOUT': 0.344635781376499, 'LR': 0.0009933999773079375, 'WEIGHT_0': 0.40717629928646243, 'WEIGHT_1': 0.7989450838679808, 'WEIGHT_2': 0.6207547992929342, 'WEIGHT_3': 0.7618464070304644, 'WEIGHT_4': 0.8565306106598302, 'WEIGHT_5': 0.7550076044706835, 'WEIGHT_6': 0.5757573792553017, 'WEIGHT_7': 0.7434553951592673, 'WEIGHT_8': 0.8182382735890855, 'optimizer': 'Adam'}. Best is trial 221 with value: 0.418736930154747.
/userhome/cs2/dingruiw/conda/envs/py310/lib/python3.10/site-packages/torch/nn/modules/rnn.py:82: UserWarning: dropout option adds dropout after all but last recurrent layer, so non-zero dropout expects num_layers greater than 1, but got dropout=0.33746930592507973 and num_layers=1
  warnings.warn("dropout option adds dropout after all but last "
{'EMBEDDING_DIM': 1006, 'HIDDEN_DIM': 324, 'NUM_LAYERS': 1, 'DROPOUT': 0.344635781376499, 'LR': 0.0009933999773079375, 'WEIGHT_0': 0.40717629928646243, 'WEIGHT_1': 0.7989450838679808, 'WEIGHT_2': 0.6207547992929342, 'WEIGHT_3': 0.7618464070304644, 'WEIGHT_4': 0.8565306106598302, 'WEIGHT_5': 0.7550076044706835, 'WEIGHT_6': 0.5757573792553017, 'WEIGHT_7': 0.7434553951592673, 'WEIGHT_8': 0.8182382735890855, 'optimizer': 'Adam'}
0
              precision    recall  f1-score   support

         LOC       0.05      0.12      0.08      1837
        MISC       0.04      0.07      0.05       922
         ORG       0.03      0.10      0.04      1341
         PER       0.03      0.06      0.04      1842

   micro avg       0.04      0.09      0.05      5942
   macro avg       0.04      0.09      0.05      5942
weighted avg       0.04      0.09      0.05      5942

{'EMBEDDING_DIM': 1006, 'HIDDEN_DIM': 324, 'NUM_LAYERS': 1, 'DROPOUT': 0.344635781376499, 'LR': 0.0009933999773079375, 'WEIGHT_0': 0.40717629928646243, 'WEIGHT_1': 0.7989450838679808, 'WEIGHT_2': 0.6207547992929342, 'WEIGHT_3': 0.7618464070304644, 'WEIGHT_4': 0.8565306106598302, 'WEIGHT_5': 0.7550076044706835, 'WEIGHT_6': 0.5757573792553017, 'WEIGHT_7': 0.7434553951592673, 'WEIGHT_8': 0.8182382735890855, 'optimizer': 'Adam'}
49
              precision    recall  f1-score   support

         LOC       0.55      0.53      0.54      1837
        MISC       0.45      0.43      0.44       922
         ORG       0.28      0.25      0.26      1341
         PER       0.33      0.35      0.34      1842

   micro avg       0.41      0.39      0.40      5942
   macro avg       0.40      0.39      0.40      5942
weighted avg       0.41      0.39      0.40      5942

epoch 49
LSTM
  0%|          | 0/50 [00:00<?, ?it/s]  2%|▏         | 1/50 [00:05<04:08,  5.07s/it]  4%|▍         | 2/50 [00:05<01:44,  2.18s/it]  6%|▌         | 3/50 [00:05<01:02,  1.32s/it]  8%|▊         | 4/50 [00:05<00:42,  1.09it/s] 10%|█         | 5/50 [00:06<00:31,  1.44it/s] 12%|█▏        | 6/50 [00:06<00:24,  1.78it/s] 14%|█▍        | 7/50 [00:06<00:20,  2.10it/s] 16%|█▌        | 8/50 [00:07<00:17,  2.37it/s] 18%|█▊        | 9/50 [00:07<00:15,  2.60it/s] 20%|██        | 10/50 [00:07<00:14,  2.78it/s] 22%|██▏       | 11/50 [00:07<00:13,  2.92it/s] 24%|██▍       | 12/50 [00:08<00:12,  3.03it/s] 26%|██▌       | 13/50 [00:08<00:11,  3.12it/s] 28%|██▊       | 14/50 [00:08<00:11,  3.18it/s] 30%|███       | 15/50 [00:09<00:10,  3.22it/s] 32%|███▏      | 16/50 [00:09<00:10,  3.24it/s] 34%|███▍      | 17/50 [00:09<00:10,  3.26it/s] 36%|███▌      | 18/50 [00:10<00:09,  3.27it/s] 38%|███▊      | 19/50 [00:10<00:09,  3.28it/s] 40%|████      | 20/50 [00:10<00:09,  3.28it/s] 42%|████▏     | 21/50 [00:10<00:08,  3.29it/s] 44%|████▍     | 22/50 [00:11<00:08,  3.30it/s] 46%|████▌     | 23/50 [00:11<00:08,  3.30it/s] 48%|████▊     | 24/50 [00:11<00:07,  3.31it/s] 50%|█████     | 25/50 [00:12<00:07,  3.31it/s] 52%|█████▏    | 26/50 [00:12<00:07,  3.31it/s] 54%|█████▍    | 27/50 [00:12<00:06,  3.31it/s] 56%|█████▌    | 28/50 [00:13<00:06,  3.30it/s] 58%|█████▊    | 29/50 [00:13<00:06,  3.30it/s] 60%|██████    | 30/50 [00:13<00:06,  3.30it/s] 62%|██████▏   | 31/50 [00:13<00:05,  3.30it/s] 64%|██████▍   | 32/50 [00:14<00:05,  3.29it/s] 66%|██████▌   | 33/50 [00:14<00:05,  3.29it/s] 68%|██████▊   | 34/50 [00:14<00:04,  3.29it/s] 70%|███████   | 35/50 [00:15<00:04,  3.29it/s] 72%|███████▏  | 36/50 [00:15<00:04,  3.30it/s] 74%|███████▍  | 37/50 [00:15<00:03,  3.30it/s] 76%|███████▌  | 38/50 [00:16<00:03,  3.31it/s] 78%|███████▊  | 39/50 [00:16<00:03,  3.31it/s] 80%|████████  | 40/50 [00:16<00:03,  3.30it/s] 82%|████████▏ | 41/50 [00:17<00:02,  3.30it/s] 84%|████████▍ | 42/50 [00:17<00:02,  3.30it/s] 86%|████████▌ | 43/50 [00:17<00:02,  3.29it/s] 88%|████████▊ | 44/50 [00:17<00:01,  3.29it/s] 90%|█████████ | 45/50 [00:18<00:01,  3.29it/s] 92%|█████████▏| 46/50 [00:18<00:01,  3.29it/s] 94%|█████████▍| 47/50 [00:18<00:00,  3.29it/s] 96%|█████████▌| 48/50 [00:19<00:00,  3.28it/s] 98%|█████████▊| 49/50 [00:19<00:00,  3.29it/s]100%|██████████| 50/50 [00:24<00:00,  1.68s/it]100%|██████████| 50/50 [00:24<00:00,  2.05it/s]
[I 2023-12-10 23:59:52,417] Trial 322 finished with value: 0.4030981360115754 and parameters: {'EMBEDDING_DIM': 1024, 'HIDDEN_DIM': 443, 'NUM_LAYERS': 1, 'DROPOUT': 0.33746930592507973, 'LR': 0.0012022291942984297, 'WEIGHT_0': 0.3430978202943358, 'WEIGHT_1': 0.7820634920712425, 'WEIGHT_2': 0.6666692184986804, 'WEIGHT_3': 0.8586474621170198, 'WEIGHT_4': 0.9986206513842175, 'WEIGHT_5': 0.7767679107847321, 'WEIGHT_6': 0.5188226199868201, 'WEIGHT_7': 0.6019899353680012, 'WEIGHT_8': 0.6949672830755218, 'optimizer': 'Adam'}. Best is trial 221 with value: 0.418736930154747.
/userhome/cs2/dingruiw/conda/envs/py310/lib/python3.10/site-packages/torch/nn/modules/rnn.py:82: UserWarning: dropout option adds dropout after all but last recurrent layer, so non-zero dropout expects num_layers greater than 1, but got dropout=0.35388580212592047 and num_layers=1
  warnings.warn("dropout option adds dropout after all but last "
{'EMBEDDING_DIM': 1024, 'HIDDEN_DIM': 443, 'NUM_LAYERS': 1, 'DROPOUT': 0.33746930592507973, 'LR': 0.0012022291942984297, 'WEIGHT_0': 0.3430978202943358, 'WEIGHT_1': 0.7820634920712425, 'WEIGHT_2': 0.6666692184986804, 'WEIGHT_3': 0.8586474621170198, 'WEIGHT_4': 0.9986206513842175, 'WEIGHT_5': 0.7767679107847321, 'WEIGHT_6': 0.5188226199868201, 'WEIGHT_7': 0.6019899353680012, 'WEIGHT_8': 0.6949672830755218, 'optimizer': 'Adam'}
0
              precision    recall  f1-score   support

         LOC       0.09      0.14      0.11      1837
        MISC       0.02      0.11      0.03       922
         ORG       0.02      0.03      0.02      1341
         PER       0.02      0.04      0.02      1842

   micro avg       0.03      0.08      0.05      5942
   macro avg       0.04      0.08      0.05      5942
weighted avg       0.04      0.08      0.05      5942

{'EMBEDDING_DIM': 1024, 'HIDDEN_DIM': 443, 'NUM_LAYERS': 1, 'DROPOUT': 0.33746930592507973, 'LR': 0.0012022291942984297, 'WEIGHT_0': 0.3430978202943358, 'WEIGHT_1': 0.7820634920712425, 'WEIGHT_2': 0.6666692184986804, 'WEIGHT_3': 0.8586474621170198, 'WEIGHT_4': 0.9986206513842175, 'WEIGHT_5': 0.7767679107847321, 'WEIGHT_6': 0.5188226199868201, 'WEIGHT_7': 0.6019899353680012, 'WEIGHT_8': 0.6949672830755218, 'optimizer': 'Adam'}
49
              precision    recall  f1-score   support

         LOC       0.57      0.52      0.54      1837
        MISC       0.40      0.44      0.42       922
         ORG       0.28      0.26      0.27      1341
         PER       0.35      0.35      0.35      1842

   micro avg       0.41      0.40      0.40      5942
   macro avg       0.40      0.39      0.40      5942
weighted avg       0.41      0.40      0.40      5942

epoch 49
LSTM
  0%|          | 0/50 [00:00<?, ?it/s]  2%|▏         | 1/50 [00:04<03:51,  4.73s/it]  4%|▍         | 2/50 [00:04<01:36,  2.02s/it]  6%|▌         | 3/50 [00:05<00:55,  1.19s/it]  8%|▊         | 4/50 [00:05<00:36,  1.24it/s] 10%|█         | 5/50 [00:05<00:26,  1.70it/s] 12%|█▏        | 6/50 [00:05<00:20,  2.18it/s] 14%|█▍        | 7/50 [00:05<00:16,  2.65it/s] 16%|█▌        | 8/50 [00:06<00:13,  3.08it/s] 18%|█▊        | 9/50 [00:06<00:11,  3.46it/s] 20%|██        | 10/50 [00:06<00:10,  3.78it/s] 22%|██▏       | 11/50 [00:06<00:09,  4.04it/s] 24%|██▍       | 12/50 [00:06<00:08,  4.23it/s] 26%|██▌       | 13/50 [00:07<00:08,  4.39it/s] 28%|██▊       | 14/50 [00:07<00:08,  4.49it/s] 30%|███       | 15/50 [00:07<00:07,  4.56it/s] 32%|███▏      | 16/50 [00:07<00:07,  4.63it/s] 34%|███▍      | 17/50 [00:07<00:07,  4.66it/s] 36%|███▌      | 18/50 [00:08<00:06,  4.69it/s] 38%|███▊      | 19/50 [00:08<00:06,  4.71it/s] 40%|████      | 20/50 [00:08<00:06,  4.73it/s] 42%|████▏     | 21/50 [00:08<00:06,  4.74it/s] 44%|████▍     | 22/50 [00:09<00:05,  4.75it/s] 46%|████▌     | 23/50 [00:09<00:05,  4.75it/s] 48%|████▊     | 24/50 [00:09<00:05,  4.75it/s] 50%|█████     | 25/50 [00:09<00:05,  4.76it/s] 52%|█████▏    | 26/50 [00:09<00:05,  4.76it/s] 54%|█████▍    | 27/50 [00:10<00:04,  4.76it/s] 56%|█████▌    | 28/50 [00:10<00:04,  4.76it/s] 58%|█████▊    | 29/50 [00:10<00:04,  4.76it/s] 60%|██████    | 30/50 [00:10<00:04,  4.76it/s] 62%|██████▏   | 31/50 [00:10<00:03,  4.76it/s] 64%|██████▍   | 32/50 [00:11<00:03,  4.76it/s] 66%|██████▌   | 33/50 [00:11<00:03,  4.76it/s] 68%|██████▊   | 34/50 [00:11<00:03,  4.76it/s] 70%|███████   | 35/50 [00:11<00:03,  4.76it/s] 72%|███████▏  | 36/50 [00:11<00:02,  4.76it/s] 74%|███████▍  | 37/50 [00:12<00:02,  4.76it/s] 76%|███████▌  | 38/50 [00:12<00:02,  4.75it/s] 78%|███████▊  | 39/50 [00:12<00:02,  4.76it/s] 80%|████████  | 40/50 [00:12<00:02,  4.76it/s] 82%|████████▏ | 41/50 [00:13<00:01,  4.75it/s] 84%|████████▍ | 42/50 [00:13<00:01,  4.76it/s] 86%|████████▌ | 43/50 [00:13<00:01,  4.76it/s] 88%|████████▊ | 44/50 [00:13<00:01,  4.76it/s] 90%|█████████ | 45/50 [00:13<00:01,  4.75it/s] 92%|█████████▏| 46/50 [00:14<00:00,  4.75it/s] 94%|█████████▍| 47/50 [00:14<00:00,  4.75it/s] 96%|█████████▌| 48/50 [00:14<00:00,  4.75it/s] 98%|█████████▊| 49/50 [00:14<00:00,  4.74it/s]100%|██████████| 50/50 [00:19<00:00,  1.64s/it]100%|██████████| 50/50 [00:19<00:00,  2.54it/s]
[I 2023-12-11 00:00:16,643] Trial 323 finished with value: 0.39325745069076373 and parameters: {'EMBEDDING_DIM': 996, 'HIDDEN_DIM': 295, 'NUM_LAYERS': 1, 'DROPOUT': 0.35388580212592047, 'LR': 0.0014551593257078606, 'WEIGHT_0': 0.3642511426251849, 'WEIGHT_1': 0.8037190252132466, 'WEIGHT_2': 0.09294936325999714, 'WEIGHT_3': 0.7848466908136309, 'WEIGHT_4': 0.6769259608017552, 'WEIGHT_5': 0.6720096615054573, 'WEIGHT_6': 0.5721000725511896, 'WEIGHT_7': 0.6735734369973698, 'WEIGHT_8': 0.4622522250682017, 'optimizer': 'Adam'}. Best is trial 221 with value: 0.418736930154747.
/userhome/cs2/dingruiw/conda/envs/py310/lib/python3.10/site-packages/torch/nn/modules/rnn.py:82: UserWarning: dropout option adds dropout after all but last recurrent layer, so non-zero dropout expects num_layers greater than 1, but got dropout=0.38191800706870965 and num_layers=1
  warnings.warn("dropout option adds dropout after all but last "
{'EMBEDDING_DIM': 996, 'HIDDEN_DIM': 295, 'NUM_LAYERS': 1, 'DROPOUT': 0.35388580212592047, 'LR': 0.0014551593257078606, 'WEIGHT_0': 0.3642511426251849, 'WEIGHT_1': 0.8037190252132466, 'WEIGHT_2': 0.09294936325999714, 'WEIGHT_3': 0.7848466908136309, 'WEIGHT_4': 0.6769259608017552, 'WEIGHT_5': 0.6720096615054573, 'WEIGHT_6': 0.5721000725511896, 'WEIGHT_7': 0.6735734369973698, 'WEIGHT_8': 0.4622522250682017, 'optimizer': 'Adam'}
0
              precision    recall  f1-score   support

         LOC       0.05      0.13      0.07      1837
        MISC       0.01      0.05      0.02       922
         ORG       0.03      0.05      0.04      1341
         PER       0.02      0.04      0.03      1842

   micro avg       0.03      0.07      0.04      5942
   macro avg       0.03      0.07      0.04      5942
weighted avg       0.03      0.07      0.04      5942

{'EMBEDDING_DIM': 996, 'HIDDEN_DIM': 295, 'NUM_LAYERS': 1, 'DROPOUT': 0.35388580212592047, 'LR': 0.0014551593257078606, 'WEIGHT_0': 0.3642511426251849, 'WEIGHT_1': 0.8037190252132466, 'WEIGHT_2': 0.09294936325999714, 'WEIGHT_3': 0.7848466908136309, 'WEIGHT_4': 0.6769259608017552, 'WEIGHT_5': 0.6720096615054573, 'WEIGHT_6': 0.5721000725511896, 'WEIGHT_7': 0.6735734369973698, 'WEIGHT_8': 0.4622522250682017, 'optimizer': 'Adam'}
49
              precision    recall  f1-score   support

         LOC       0.55      0.56      0.55      1837
        MISC       0.48      0.28      0.35       922
         ORG       0.28      0.26      0.27      1341
         PER       0.33      0.35      0.34      1842

   micro avg       0.41      0.38      0.39      5942
   macro avg       0.41      0.36      0.38      5942
weighted avg       0.41      0.38      0.39      5942

epoch 49
LSTM
  0%|          | 0/50 [00:00<?, ?it/s]  2%|▏         | 1/50 [00:05<04:18,  5.27s/it]  4%|▍         | 2/50 [00:05<01:47,  2.25s/it]  6%|▌         | 3/50 [00:05<01:02,  1.33s/it]  8%|▊         | 4/50 [00:05<00:41,  1.11it/s] 10%|█         | 5/50 [00:06<00:29,  1.50it/s] 12%|█▏        | 6/50 [00:06<00:23,  1.91it/s] 14%|█▍        | 7/50 [00:06<00:18,  2.31it/s] 16%|█▌        | 8/50 [00:06<00:15,  2.68it/s] 18%|█▊        | 9/50 [00:07<00:13,  3.00it/s] 20%|██        | 10/50 [00:07<00:12,  3.26it/s] 22%|██▏       | 11/50 [00:07<00:11,  3.47it/s] 24%|██▍       | 12/50 [00:07<00:10,  3.63it/s] 26%|██▌       | 13/50 [00:08<00:09,  3.75it/s] 28%|██▊       | 14/50 [00:08<00:09,  3.84it/s] 30%|███       | 15/50 [00:08<00:08,  3.90it/s] 32%|███▏      | 16/50 [00:08<00:08,  3.95it/s] 34%|███▍      | 17/50 [00:09<00:08,  3.98it/s] 36%|███▌      | 18/50 [00:09<00:07,  4.00it/s] 38%|███▊      | 19/50 [00:09<00:07,  4.02it/s] 40%|████      | 20/50 [00:09<00:07,  4.03it/s] 42%|████▏     | 21/50 [00:10<00:07,  4.03it/s] 44%|████▍     | 22/50 [00:10<00:06,  4.04it/s] 46%|████▌     | 23/50 [00:10<00:06,  4.04it/s] 48%|████▊     | 24/50 [00:10<00:06,  4.05it/s] 50%|█████     | 25/50 [00:11<00:06,  4.05it/s] 52%|█████▏    | 26/50 [00:11<00:05,  4.04it/s] 54%|█████▍    | 27/50 [00:11<00:05,  4.04it/s] 56%|█████▌    | 28/50 [00:11<00:05,  4.04it/s] 58%|█████▊    | 29/50 [00:12<00:05,  4.04it/s] 60%|██████    | 30/50 [00:12<00:04,  4.04it/s] 62%|██████▏   | 31/50 [00:12<00:04,  4.04it/s] 64%|██████▍   | 32/50 [00:12<00:04,  4.04it/s] 66%|██████▌   | 33/50 [00:13<00:04,  4.04it/s] 68%|██████▊   | 34/50 [00:13<00:03,  4.04it/s] 70%|███████   | 35/50 [00:13<00:03,  4.04it/s] 72%|███████▏  | 36/50 [00:13<00:03,  4.04it/s] 74%|███████▍  | 37/50 [00:14<00:03,  4.04it/s] 76%|███████▌  | 38/50 [00:14<00:02,  4.04it/s] 78%|███████▊  | 39/50 [00:14<00:02,  4.04it/s] 80%|████████  | 40/50 [00:14<00:02,  4.04it/s] 82%|████████▏ | 41/50 [00:15<00:02,  4.04it/s] 84%|████████▍ | 42/50 [00:15<00:01,  4.04it/s] 86%|████████▌ | 43/50 [00:15<00:01,  4.04it/s] 88%|████████▊ | 44/50 [00:15<00:01,  4.03it/s] 90%|█████████ | 45/50 [00:16<00:01,  4.04it/s] 92%|█████████▏| 46/50 [00:16<00:00,  4.03it/s] 94%|█████████▍| 47/50 [00:16<00:00,  4.03it/s] 96%|█████████▌| 48/50 [00:16<00:00,  4.03it/s] 98%|█████████▊| 49/50 [00:17<00:00,  4.03it/s]100%|██████████| 50/50 [00:22<00:00,  1.69s/it]100%|██████████| 50/50 [00:22<00:00,  2.26it/s]
[I 2023-12-11 00:00:43,106] Trial 324 finished with value: 0.38819240686405265 and parameters: {'EMBEDDING_DIM': 965, 'HIDDEN_DIM': 366, 'NUM_LAYERS': 1, 'DROPOUT': 0.38191800706870965, 'LR': 0.0009141723435662505, 'WEIGHT_0': 0.4253818551862989, 'WEIGHT_1': 0.82821311350214, 'WEIGHT_2': 0.6362581534071778, 'WEIGHT_3': 0.13516355486251322, 'WEIGHT_4': 0.8191274965169245, 'WEIGHT_5': 0.7931239995616669, 'WEIGHT_6': 0.5341607417520459, 'WEIGHT_7': 0.7119152504748574, 'WEIGHT_8': 0.4374162998555893, 'optimizer': 'Adam'}. Best is trial 221 with value: 0.418736930154747.
/userhome/cs2/dingruiw/conda/envs/py310/lib/python3.10/site-packages/torch/nn/modules/rnn.py:82: UserWarning: dropout option adds dropout after all but last recurrent layer, so non-zero dropout expects num_layers greater than 1, but got dropout=0.3667435876705523 and num_layers=1
  warnings.warn("dropout option adds dropout after all but last "
{'EMBEDDING_DIM': 965, 'HIDDEN_DIM': 366, 'NUM_LAYERS': 1, 'DROPOUT': 0.38191800706870965, 'LR': 0.0009141723435662505, 'WEIGHT_0': 0.4253818551862989, 'WEIGHT_1': 0.82821311350214, 'WEIGHT_2': 0.6362581534071778, 'WEIGHT_3': 0.13516355486251322, 'WEIGHT_4': 0.8191274965169245, 'WEIGHT_5': 0.7931239995616669, 'WEIGHT_6': 0.5341607417520459, 'WEIGHT_7': 0.7119152504748574, 'WEIGHT_8': 0.4374162998555893, 'optimizer': 'Adam'}
0
              precision    recall  f1-score   support

         LOC       0.06      0.10      0.08      1837
        MISC       0.02      0.13      0.03       922
         ORG       0.03      0.11      0.04      1341
         PER       0.02      0.08      0.03      1842

   micro avg       0.03      0.10      0.04      5942
   macro avg       0.03      0.10      0.05      5942
weighted avg       0.03      0.10      0.05      5942

{'EMBEDDING_DIM': 965, 'HIDDEN_DIM': 366, 'NUM_LAYERS': 1, 'DROPOUT': 0.38191800706870965, 'LR': 0.0009141723435662505, 'WEIGHT_0': 0.4253818551862989, 'WEIGHT_1': 0.82821311350214, 'WEIGHT_2': 0.6362581534071778, 'WEIGHT_3': 0.13516355486251322, 'WEIGHT_4': 0.8191274965169245, 'WEIGHT_5': 0.7931239995616669, 'WEIGHT_6': 0.5341607417520459, 'WEIGHT_7': 0.7119152504748574, 'WEIGHT_8': 0.4374162998555893, 'optimizer': 'Adam'}
49
              precision    recall  f1-score   support

         LOC       0.55      0.53      0.54      1837
        MISC       0.43      0.42      0.43       922
         ORG       0.30      0.26      0.28      1341
         PER       0.32      0.25      0.28      1842

   micro avg       0.41      0.37      0.39      5942
   macro avg       0.40      0.37      0.38      5942
weighted avg       0.40      0.37      0.38      5942

epoch 49
LSTM
  0%|          | 0/50 [00:00<?, ?it/s]  2%|▏         | 1/50 [00:04<04:00,  4.92s/it]  4%|▍         | 2/50 [00:05<01:40,  2.09s/it]  6%|▌         | 3/50 [00:05<00:57,  1.23s/it]  8%|▊         | 4/50 [00:05<00:37,  1.22it/s] 10%|█         | 5/50 [00:05<00:26,  1.69it/s] 12%|█▏        | 6/50 [00:05<00:19,  2.20it/s] 14%|█▍        | 7/50 [00:05<00:15,  2.72it/s] 16%|█▌        | 8/50 [00:06<00:13,  3.22it/s] 18%|█▊        | 9/50 [00:06<00:11,  3.67it/s] 20%|██        | 10/50 [00:06<00:09,  4.06it/s] 22%|██▏       | 11/50 [00:06<00:08,  4.37it/s] 24%|██▍       | 12/50 [00:06<00:08,  4.61it/s] 26%|██▌       | 13/50 [00:07<00:07,  4.80it/s] 28%|██▊       | 14/50 [00:07<00:07,  4.94it/s] 30%|███       | 15/50 [00:07<00:06,  5.05it/s] 32%|███▏      | 16/50 [00:07<00:06,  5.12it/s] 34%|███▍      | 17/50 [00:07<00:06,  5.17it/s] 36%|███▌      | 18/50 [00:08<00:06,  5.21it/s] 38%|███▊      | 19/50 [00:08<00:05,  5.23it/s] 40%|████      | 20/50 [00:08<00:05,  5.25it/s] 42%|████▏     | 21/50 [00:08<00:05,  5.27it/s] 44%|████▍     | 22/50 [00:08<00:05,  5.27it/s] 46%|████▌     | 23/50 [00:09<00:05,  5.28it/s] 48%|████▊     | 24/50 [00:09<00:04,  5.29it/s] 50%|█████     | 25/50 [00:09<00:04,  5.29it/s] 52%|█████▏    | 26/50 [00:09<00:04,  5.29it/s] 54%|█████▍    | 27/50 [00:09<00:04,  5.29it/s] 56%|█████▌    | 28/50 [00:09<00:04,  5.29it/s] 58%|█████▊    | 29/50 [00:10<00:03,  5.29it/s] 60%|██████    | 30/50 [00:10<00:03,  5.29it/s] 62%|██████▏   | 31/50 [00:10<00:03,  5.29it/s] 64%|██████▍   | 32/50 [00:10<00:03,  5.28it/s] 66%|██████▌   | 33/50 [00:10<00:03,  5.29it/s] 68%|██████▊   | 34/50 [00:11<00:03,  5.28it/s] 70%|███████   | 35/50 [00:11<00:02,  5.28it/s] 72%|███████▏  | 36/50 [00:11<00:02,  5.28it/s] 74%|███████▍  | 37/50 [00:11<00:02,  5.29it/s] 76%|███████▌  | 38/50 [00:11<00:02,  5.27it/s] 78%|███████▊  | 39/50 [00:12<00:02,  5.27it/s] 80%|████████  | 40/50 [00:12<00:01,  5.27it/s] 82%|████████▏ | 41/50 [00:12<00:01,  5.26it/s] 84%|████████▍ | 42/50 [00:12<00:01,  5.26it/s] 86%|████████▌ | 43/50 [00:12<00:01,  5.25it/s] 88%|████████▊ | 44/50 [00:12<00:01,  5.25it/s] 90%|█████████ | 45/50 [00:13<00:00,  5.26it/s] 92%|█████████▏| 46/50 [00:13<00:00,  5.26it/s] 94%|█████████▍| 47/50 [00:13<00:00,  5.25it/s] 96%|█████████▌| 48/50 [00:13<00:00,  5.25it/s] 98%|█████████▊| 49/50 [00:13<00:00,  5.25it/s]100%|██████████| 50/50 [00:18<00:00,  1.57s/it]100%|██████████| 50/50 [00:18<00:00,  2.67it/s]
