[I 2023-12-10 22:22:01,618] Trial 117 finished with value: 0.3882490402270072 and parameters: {'EMBEDDING_DIM': 914, 'HIDDEN_DIM': 372, 'NUM_LAYERS': 1, 'DROPOUT': 0.32860346158273396, 'LR': 0.0021135613775973457, 'WEIGHT_0': 0.3580410633069608, 'WEIGHT_1': 0.8324435581413514, 'WEIGHT_2': 0.4160900106026346, 'WEIGHT_3': 0.838538616068275, 'WEIGHT_4': 0.8672227914238214, 'WEIGHT_5': 0.46898033192353566, 'WEIGHT_6': 0.8857944033863745, 'WEIGHT_7': 0.4217284728899273, 'WEIGHT_8': 0.40975626349227384, 'optimizer': 'RMSprop'}. Best is trial 51 with value: 0.41438326562364947.
/userhome/cs2/dingruiw/conda/envs/py310/lib/python3.10/site-packages/torch/nn/modules/rnn.py:82: UserWarning: dropout option adds dropout after all but last recurrent layer, so non-zero dropout expects num_layers greater than 1, but got dropout=0.36343317515523943 and num_layers=1
  warnings.warn("dropout option adds dropout after all but last "
{'EMBEDDING_DIM': 914, 'HIDDEN_DIM': 372, 'NUM_LAYERS': 1, 'DROPOUT': 0.32860346158273396, 'LR': 0.0021135613775973457, 'WEIGHT_0': 0.3580410633069608, 'WEIGHT_1': 0.8324435581413514, 'WEIGHT_2': 0.4160900106026346, 'WEIGHT_3': 0.838538616068275, 'WEIGHT_4': 0.8672227914238214, 'WEIGHT_5': 0.46898033192353566, 'WEIGHT_6': 0.8857944033863745, 'WEIGHT_7': 0.4217284728899273, 'WEIGHT_8': 0.40975626349227384, 'optimizer': 'RMSprop'}
0
              precision    recall  f1-score   support

         LOC       0.21      0.06      0.09      1837
        MISC       0.08      0.02      0.03       922
         ORG       0.14      0.04      0.06      1341
         PER       0.11      0.02      0.04      1842

   micro avg       0.15      0.04      0.06      5942
   macro avg       0.13      0.03      0.05      5942
weighted avg       0.14      0.04      0.06      5942

{'EMBEDDING_DIM': 914, 'HIDDEN_DIM': 372, 'NUM_LAYERS': 1, 'DROPOUT': 0.32860346158273396, 'LR': 0.0021135613775973457, 'WEIGHT_0': 0.3580410633069608, 'WEIGHT_1': 0.8324435581413514, 'WEIGHT_2': 0.4160900106026346, 'WEIGHT_3': 0.838538616068275, 'WEIGHT_4': 0.8672227914238214, 'WEIGHT_5': 0.46898033192353566, 'WEIGHT_6': 0.8857944033863745, 'WEIGHT_7': 0.4217284728899273, 'WEIGHT_8': 0.40975626349227384, 'optimizer': 'RMSprop'}
49
              precision    recall  f1-score   support

         LOC       0.58      0.51      0.54      1837
        MISC       0.42      0.40      0.41       922
         ORG       0.25      0.28      0.27      1341
         PER       0.31      0.35      0.33      1842

   micro avg       0.39      0.39      0.39      5942
   macro avg       0.39      0.39      0.39      5942
weighted avg       0.40      0.39      0.39      5942

epoch 49
LSTM
  0%|          | 0/50 [00:00<?, ?it/s]  2%|▏         | 1/50 [00:04<04:02,  4.94s/it]  4%|▍         | 2/50 [00:05<01:43,  2.15s/it]  6%|▌         | 3/50 [00:05<01:02,  1.33s/it]  8%|▊         | 4/50 [00:05<00:43,  1.05it/s] 10%|█         | 5/50 [00:06<00:33,  1.36it/s] 12%|█▏        | 6/50 [00:06<00:26,  1.64it/s] 14%|█▍        | 7/50 [00:06<00:22,  1.90it/s] 16%|█▌        | 8/50 [00:07<00:19,  2.11it/s] 18%|█▊        | 9/50 [00:07<00:17,  2.28it/s] 20%|██        | 10/50 [00:08<00:16,  2.41it/s] 22%|██▏       | 11/50 [00:08<00:15,  2.51it/s] 24%|██▍       | 12/50 [00:08<00:14,  2.59it/s] 26%|██▌       | 13/50 [00:09<00:14,  2.64it/s] 28%|██▊       | 14/50 [00:09<00:13,  2.68it/s] 30%|███       | 15/50 [00:09<00:12,  2.71it/s] 32%|███▏      | 16/50 [00:10<00:12,  2.72it/s] 34%|███▍      | 17/50 [00:10<00:12,  2.74it/s] 36%|███▌      | 18/50 [00:10<00:11,  2.75it/s] 38%|███▊      | 19/50 [00:11<00:11,  2.75it/s] 40%|████      | 20/50 [00:11<00:10,  2.76it/s] 42%|████▏     | 21/50 [00:11<00:10,  2.76it/s] 44%|████▍     | 22/50 [00:12<00:10,  2.75it/s] 46%|████▌     | 23/50 [00:12<00:09,  2.75it/s] 48%|████▊     | 24/50 [00:13<00:09,  2.76it/s] 50%|█████     | 25/50 [00:13<00:09,  2.75it/s] 52%|█████▏    | 26/50 [00:13<00:08,  2.75it/s] 54%|█████▍    | 27/50 [00:14<00:08,  2.75it/s] 56%|█████▌    | 28/50 [00:14<00:07,  2.75it/s] 58%|█████▊    | 29/50 [00:14<00:07,  2.76it/s] 60%|██████    | 30/50 [00:15<00:07,  2.76it/s] 62%|██████▏   | 31/50 [00:15<00:06,  2.76it/s] 64%|██████▍   | 32/50 [00:15<00:06,  2.75it/s] 66%|██████▌   | 33/50 [00:16<00:06,  2.75it/s] 68%|██████▊   | 34/50 [00:16<00:05,  2.75it/s] 70%|███████   | 35/50 [00:17<00:05,  2.75it/s] 72%|███████▏  | 36/50 [00:17<00:05,  2.75it/s] 74%|███████▍  | 37/50 [00:17<00:04,  2.75it/s] 76%|███████▌  | 38/50 [00:18<00:04,  2.75it/s] 78%|███████▊  | 39/50 [00:18<00:03,  2.75it/s] 80%|████████  | 40/50 [00:18<00:03,  2.75it/s] 82%|████████▏ | 41/50 [00:19<00:03,  2.75it/s] 84%|████████▍ | 42/50 [00:19<00:02,  2.75it/s] 86%|████████▌ | 43/50 [00:19<00:02,  2.75it/s] 88%|████████▊ | 44/50 [00:20<00:02,  2.75it/s] 90%|█████████ | 45/50 [00:20<00:01,  2.75it/s] 92%|█████████▏| 46/50 [00:21<00:01,  2.75it/s] 94%|█████████▍| 47/50 [00:21<00:01,  2.75it/s] 96%|█████████▌| 48/50 [00:21<00:00,  2.75it/s] 98%|█████████▊| 49/50 [00:22<00:00,  2.75it/s]100%|██████████| 50/50 [00:27<00:00,  1.74s/it]100%|██████████| 50/50 [00:27<00:00,  1.84it/s]
[I 2023-12-10 22:22:32,938] Trial 118 finished with value: 0.39669421487603307 and parameters: {'EMBEDDING_DIM': 855, 'HIDDEN_DIM': 560, 'NUM_LAYERS': 1, 'DROPOUT': 0.36343317515523943, 'LR': 0.0017526585578474356, 'WEIGHT_0': 0.45031406997864365, 'WEIGHT_1': 0.6619923497998645, 'WEIGHT_2': 0.5208985616471237, 'WEIGHT_3': 0.7919664172838929, 'WEIGHT_4': 0.9184426487650421, 'WEIGHT_5': 0.4063648653164917, 'WEIGHT_6': 0.8459184432785537, 'WEIGHT_7': 0.40189045722990274, 'WEIGHT_8': 0.3597326089224419, 'optimizer': 'Adam'}. Best is trial 51 with value: 0.41438326562364947.
/userhome/cs2/dingruiw/conda/envs/py310/lib/python3.10/site-packages/torch/nn/modules/rnn.py:82: UserWarning: dropout option adds dropout after all but last recurrent layer, so non-zero dropout expects num_layers greater than 1, but got dropout=0.3413482071633379 and num_layers=1
  warnings.warn("dropout option adds dropout after all but last "
{'EMBEDDING_DIM': 855, 'HIDDEN_DIM': 560, 'NUM_LAYERS': 1, 'DROPOUT': 0.36343317515523943, 'LR': 0.0017526585578474356, 'WEIGHT_0': 0.45031406997864365, 'WEIGHT_1': 0.6619923497998645, 'WEIGHT_2': 0.5208985616471237, 'WEIGHT_3': 0.7919664172838929, 'WEIGHT_4': 0.9184426487650421, 'WEIGHT_5': 0.4063648653164917, 'WEIGHT_6': 0.8459184432785537, 'WEIGHT_7': 0.40189045722990274, 'WEIGHT_8': 0.3597326089224419, 'optimizer': 'Adam'}
0
              precision    recall  f1-score   support

         LOC       0.08      0.06      0.07      1837
        MISC       0.01      0.02      0.02       922
         ORG       0.04      0.07      0.05      1341
         PER       0.03      0.04      0.04      1842

   micro avg       0.04      0.05      0.04      5942
   macro avg       0.04      0.05      0.04      5942
weighted avg       0.04      0.05      0.05      5942

{'EMBEDDING_DIM': 855, 'HIDDEN_DIM': 560, 'NUM_LAYERS': 1, 'DROPOUT': 0.36343317515523943, 'LR': 0.0017526585578474356, 'WEIGHT_0': 0.45031406997864365, 'WEIGHT_1': 0.6619923497998645, 'WEIGHT_2': 0.5208985616471237, 'WEIGHT_3': 0.7919664172838929, 'WEIGHT_4': 0.9184426487650421, 'WEIGHT_5': 0.4063648653164917, 'WEIGHT_6': 0.8459184432785537, 'WEIGHT_7': 0.40189045722990274, 'WEIGHT_8': 0.3597326089224419, 'optimizer': 'Adam'}
49
              precision    recall  f1-score   support

         LOC       0.58      0.53      0.55      1837
        MISC       0.41      0.42      0.42       922
         ORG       0.24      0.26      0.25      1341
         PER       0.34      0.35      0.35      1842

   micro avg       0.40      0.40      0.40      5942
   macro avg       0.39      0.39      0.39      5942
weighted avg       0.40      0.40      0.40      5942

epoch 49
LSTM
  0%|          | 0/50 [00:00<?, ?it/s]  2%|▏         | 1/50 [00:04<04:01,  4.93s/it]  4%|▍         | 2/50 [00:05<01:43,  2.16s/it]  6%|▌         | 3/50 [00:05<01:04,  1.37s/it]  8%|▊         | 4/50 [00:06<00:45,  1.00it/s] 10%|█         | 5/50 [00:06<00:35,  1.26it/s] 12%|█▏        | 6/50 [00:06<00:29,  1.49it/s] 14%|█▍        | 7/50 [00:07<00:25,  1.69it/s] 16%|█▌        | 8/50 [00:07<00:22,  1.86it/s] 18%|█▊        | 9/50 [00:08<00:20,  1.98it/s] 20%|██        | 10/50 [00:08<00:19,  2.08it/s] 22%|██▏       | 11/50 [00:09<00:18,  2.15it/s] 24%|██▍       | 12/50 [00:09<00:17,  2.20it/s] 26%|██▌       | 13/50 [00:09<00:16,  2.24it/s] 28%|██▊       | 14/50 [00:10<00:15,  2.27it/s] 30%|███       | 15/50 [00:10<00:15,  2.29it/s] 32%|███▏      | 16/50 [00:11<00:14,  2.30it/s] 34%|███▍      | 17/50 [00:11<00:14,  2.31it/s] 36%|███▌      | 18/50 [00:12<00:13,  2.32it/s] 38%|███▊      | 19/50 [00:12<00:13,  2.33it/s] 40%|████      | 20/50 [00:12<00:12,  2.33it/s] 42%|████▏     | 21/50 [00:13<00:12,  2.33it/s] 44%|████▍     | 22/50 [00:13<00:12,  2.33it/s] 46%|████▌     | 23/50 [00:14<00:11,  2.33it/s] 48%|████▊     | 24/50 [00:14<00:11,  2.33it/s] 50%|█████     | 25/50 [00:15<00:10,  2.33it/s] 52%|█████▏    | 26/50 [00:15<00:10,  2.33it/s] 54%|█████▍    | 27/50 [00:15<00:09,  2.33it/s] 56%|█████▌    | 28/50 [00:16<00:09,  2.33it/s] 58%|█████▊    | 29/50 [00:16<00:09,  2.33it/s] 60%|██████    | 30/50 [00:17<00:08,  2.33it/s] 62%|██████▏   | 31/50 [00:17<00:08,  2.33it/s] 64%|██████▍   | 32/50 [00:18<00:07,  2.33it/s] 66%|██████▌   | 33/50 [00:18<00:07,  2.33it/s] 68%|██████▊   | 34/50 [00:18<00:06,  2.33it/s] 70%|███████   | 35/50 [00:19<00:06,  2.33it/s] 72%|███████▏  | 36/50 [00:19<00:06,  2.33it/s] 74%|███████▍  | 37/50 [00:20<00:05,  2.33it/s] 76%|███████▌  | 38/50 [00:20<00:05,  2.33it/s] 78%|███████▊  | 39/50 [00:21<00:04,  2.33it/s] 80%|████████  | 40/50 [00:21<00:04,  2.33it/s] 82%|████████▏ | 41/50 [00:21<00:03,  2.33it/s] 84%|████████▍ | 42/50 [00:22<00:03,  2.32it/s] 86%|████████▌ | 43/50 [00:22<00:03,  2.32it/s] 88%|████████▊ | 44/50 [00:23<00:02,  2.32it/s] 90%|█████████ | 45/50 [00:23<00:02,  2.32it/s] 92%|█████████▏| 46/50 [00:24<00:01,  2.32it/s] 94%|█████████▍| 47/50 [00:24<00:01,  2.32it/s] 96%|█████████▌| 48/50 [00:24<00:00,  2.32it/s] 98%|█████████▊| 49/50 [00:25<00:00,  2.32it/s]100%|██████████| 50/50 [00:30<00:00,  1.83s/it]100%|██████████| 50/50 [00:30<00:00,  1.64it/s]
[I 2023-12-10 22:23:07,670] Trial 119 finished with value: 0.39329517579721995 and parameters: {'EMBEDDING_DIM': 1000, 'HIDDEN_DIM': 633, 'NUM_LAYERS': 1, 'DROPOUT': 0.3413482071633379, 'LR': 0.002992803133831199, 'WEIGHT_0': 0.30502700153014517, 'WEIGHT_1': 0.77609928472656, 'WEIGHT_2': 0.4569297684433855, 'WEIGHT_3': 0.8220791197581462, 'WEIGHT_4': 0.8111887092326279, 'WEIGHT_5': 0.3765069272409991, 'WEIGHT_6': 0.9148321455090739, 'WEIGHT_7': 0.48085895115269384, 'WEIGHT_8': 0.5461774716494965, 'optimizer': 'Adam'}. Best is trial 51 with value: 0.41438326562364947.
/userhome/cs2/dingruiw/conda/envs/py310/lib/python3.10/site-packages/torch/nn/modules/rnn.py:82: UserWarning: dropout option adds dropout after all but last recurrent layer, so non-zero dropout expects num_layers greater than 1, but got dropout=0.2986901936304636 and num_layers=1
  warnings.warn("dropout option adds dropout after all but last "
{'EMBEDDING_DIM': 1000, 'HIDDEN_DIM': 633, 'NUM_LAYERS': 1, 'DROPOUT': 0.3413482071633379, 'LR': 0.002992803133831199, 'WEIGHT_0': 0.30502700153014517, 'WEIGHT_1': 0.77609928472656, 'WEIGHT_2': 0.4569297684433855, 'WEIGHT_3': 0.8220791197581462, 'WEIGHT_4': 0.8111887092326279, 'WEIGHT_5': 0.3765069272409991, 'WEIGHT_6': 0.9148321455090739, 'WEIGHT_7': 0.48085895115269384, 'WEIGHT_8': 0.5461774716494965, 'optimizer': 'Adam'}
0
              precision    recall  f1-score   support

         LOC       0.07      0.08      0.08      1837
        MISC       0.02      0.04      0.03       922
         ORG       0.06      0.05      0.06      1341
         PER       0.02      0.03      0.03      1842

   micro avg       0.04      0.05      0.05      5942
   macro avg       0.05      0.05      0.05      5942
weighted avg       0.05      0.05      0.05      5942

{'EMBEDDING_DIM': 1000, 'HIDDEN_DIM': 633, 'NUM_LAYERS': 1, 'DROPOUT': 0.3413482071633379, 'LR': 0.002992803133831199, 'WEIGHT_0': 0.30502700153014517, 'WEIGHT_1': 0.77609928472656, 'WEIGHT_2': 0.4569297684433855, 'WEIGHT_3': 0.8220791197581462, 'WEIGHT_4': 0.8111887092326279, 'WEIGHT_5': 0.3765069272409991, 'WEIGHT_6': 0.9148321455090739, 'WEIGHT_7': 0.48085895115269384, 'WEIGHT_8': 0.5461774716494965, 'optimizer': 'Adam'}
49
              precision    recall  f1-score   support

         LOC       0.55      0.53      0.54      1837
        MISC       0.39      0.42      0.40       922
         ORG       0.26      0.26      0.26      1341
         PER       0.32      0.38      0.35      1842

   micro avg       0.38      0.40      0.39      5942
   macro avg       0.38      0.40      0.39      5942
weighted avg       0.39      0.40      0.40      5942

epoch 49
LSTM
  0%|          | 0/50 [00:00<?, ?it/s]  2%|▏         | 1/50 [00:04<03:58,  4.86s/it]  4%|▍         | 2/50 [00:05<01:40,  2.10s/it]  6%|▌         | 3/50 [00:05<01:00,  1.29s/it]  8%|▊         | 4/50 [00:05<00:41,  1.10it/s] 10%|█         | 5/50 [00:05<00:31,  1.44it/s] 12%|█▏        | 6/50 [00:06<00:24,  1.76it/s] 14%|█▍        | 7/50 [00:06<00:20,  2.06it/s] 16%|█▌        | 8/50 [00:06<00:18,  2.31it/s] 18%|█▊        | 9/50 [00:07<00:16,  2.52it/s] 20%|██        | 10/50 [00:07<00:14,  2.68it/s] 22%|██▏       | 11/50 [00:07<00:13,  2.80it/s] 24%|██▍       | 12/50 [00:08<00:13,  2.90it/s] 26%|██▌       | 13/50 [00:08<00:12,  2.97it/s] 28%|██▊       | 14/50 [00:08<00:11,  3.01it/s] 30%|███       | 15/50 [00:09<00:11,  3.05it/s] 32%|███▏      | 16/50 [00:09<00:11,  3.07it/s] 34%|███▍      | 17/50 [00:09<00:10,  3.09it/s] 36%|███▌      | 18/50 [00:10<00:10,  3.10it/s] 38%|███▊      | 19/50 [00:10<00:09,  3.11it/s] 40%|████      | 20/50 [00:10<00:09,  3.11it/s] 42%|████▏     | 21/50 [00:11<00:09,  3.12it/s] 44%|████▍     | 22/50 [00:11<00:08,  3.12it/s] 46%|████▌     | 23/50 [00:11<00:08,  3.12it/s] 48%|████▊     | 24/50 [00:12<00:08,  3.12it/s] 50%|█████     | 25/50 [00:12<00:08,  3.12it/s] 52%|█████▏    | 26/50 [00:12<00:07,  3.12it/s] 54%|█████▍    | 27/50 [00:13<00:07,  3.12it/s] 56%|█████▌    | 28/50 [00:13<00:07,  3.12it/s] 58%|█████▊    | 29/50 [00:13<00:06,  3.12it/s] 60%|██████    | 30/50 [00:13<00:06,  3.12it/s] 62%|██████▏   | 31/50 [00:14<00:06,  3.12it/s] 64%|██████▍   | 32/50 [00:14<00:05,  3.12it/s] 66%|██████▌   | 33/50 [00:14<00:05,  3.12it/s] 68%|██████▊   | 34/50 [00:15<00:05,  3.12it/s] 70%|███████   | 35/50 [00:15<00:04,  3.12it/s] 72%|███████▏  | 36/50 [00:15<00:04,  3.12it/s] 74%|███████▍  | 37/50 [00:16<00:04,  3.11it/s] 76%|███████▌  | 38/50 [00:16<00:03,  3.12it/s] 78%|███████▊  | 39/50 [00:16<00:03,  3.11it/s] 80%|████████  | 40/50 [00:17<00:03,  3.11it/s] 82%|████████▏ | 41/50 [00:17<00:02,  3.11it/s] 84%|████████▍ | 42/50 [00:17<00:02,  3.11it/s] 86%|████████▌ | 43/50 [00:18<00:02,  3.11it/s] 88%|████████▊ | 44/50 [00:18<00:01,  3.11it/s] 90%|█████████ | 45/50 [00:18<00:01,  3.10it/s] 92%|█████████▏| 46/50 [00:19<00:01,  3.10it/s] 94%|█████████▍| 47/50 [00:19<00:00,  3.10it/s] 96%|█████████▌| 48/50 [00:19<00:00,  3.10it/s] 98%|█████████▊| 49/50 [00:20<00:00,  3.10it/s]100%|██████████| 50/50 [00:25<00:00,  1.76s/it]100%|██████████| 50/50 [00:25<00:00,  1.98it/s]
[I 2023-12-10 22:23:37,144] Trial 120 finished with value: 0.4073814937904495 and parameters: {'EMBEDDING_DIM': 966, 'HIDDEN_DIM': 490, 'NUM_LAYERS': 1, 'DROPOUT': 0.2986901936304636, 'LR': 0.0011661296366288034, 'WEIGHT_0': 0.34258282599311435, 'WEIGHT_1': 0.515688287494426, 'WEIGHT_2': 0.6067293236044007, 'WEIGHT_3': 0.892390669156218, 'WEIGHT_4': 0.8356471815449146, 'WEIGHT_5': 0.43243999726331994, 'WEIGHT_6': 0.7486808323769454, 'WEIGHT_7': 0.3691476627250535, 'WEIGHT_8': 0.3903732264875732, 'optimizer': 'RMSprop'}. Best is trial 51 with value: 0.41438326562364947.
/userhome/cs2/dingruiw/conda/envs/py310/lib/python3.10/site-packages/torch/nn/modules/rnn.py:82: UserWarning: dropout option adds dropout after all but last recurrent layer, so non-zero dropout expects num_layers greater than 1, but got dropout=0.29589545453423804 and num_layers=1
  warnings.warn("dropout option adds dropout after all but last "
{'EMBEDDING_DIM': 966, 'HIDDEN_DIM': 490, 'NUM_LAYERS': 1, 'DROPOUT': 0.2986901936304636, 'LR': 0.0011661296366288034, 'WEIGHT_0': 0.34258282599311435, 'WEIGHT_1': 0.515688287494426, 'WEIGHT_2': 0.6067293236044007, 'WEIGHT_3': 0.892390669156218, 'WEIGHT_4': 0.8356471815449146, 'WEIGHT_5': 0.43243999726331994, 'WEIGHT_6': 0.7486808323769454, 'WEIGHT_7': 0.3691476627250535, 'WEIGHT_8': 0.3903732264875732, 'optimizer': 'RMSprop'}
0
              precision    recall  f1-score   support

         LOC       0.32      0.10      0.15      1837
        MISC       0.04      0.04      0.04       922
         ORG       0.09      0.06      0.07      1341
         PER       0.05      0.02      0.03      1842

   micro avg       0.11      0.06      0.08      5942
   macro avg       0.13      0.06      0.07      5942
weighted avg       0.14      0.06      0.08      5942

{'EMBEDDING_DIM': 966, 'HIDDEN_DIM': 490, 'NUM_LAYERS': 1, 'DROPOUT': 0.2986901936304636, 'LR': 0.0011661296366288034, 'WEIGHT_0': 0.34258282599311435, 'WEIGHT_1': 0.515688287494426, 'WEIGHT_2': 0.6067293236044007, 'WEIGHT_3': 0.892390669156218, 'WEIGHT_4': 0.8356471815449146, 'WEIGHT_5': 0.43243999726331994, 'WEIGHT_6': 0.7486808323769454, 'WEIGHT_7': 0.3691476627250535, 'WEIGHT_8': 0.3903732264875732, 'optimizer': 'RMSprop'}
49
              precision    recall  f1-score   support

         LOC       0.63      0.53      0.57      1837
        MISC       0.43      0.43      0.43       922
         ORG       0.29      0.27      0.28      1341
         PER       0.34      0.32      0.33      1842

   micro avg       0.42      0.39      0.41      5942
   macro avg       0.42      0.39      0.40      5942
weighted avg       0.43      0.39      0.41      5942

epoch 49
LSTM
  0%|          | 0/50 [00:00<?, ?it/s]  2%|▏         | 1/50 [00:04<03:57,  4.85s/it]  4%|▍         | 2/50 [00:05<01:40,  2.10s/it]  6%|▌         | 3/50 [00:05<01:00,  1.29s/it]  8%|▊         | 4/50 [00:05<00:41,  1.11it/s] 10%|█         | 5/50 [00:05<00:31,  1.45it/s] 12%|█▏        | 6/50 [00:06<00:24,  1.78it/s] 14%|█▍        | 7/50 [00:06<00:20,  2.07it/s] 16%|█▌        | 8/50 [00:06<00:18,  2.33it/s] 18%|█▊        | 9/50 [00:07<00:16,  2.54it/s] 20%|██        | 10/50 [00:07<00:14,  2.70it/s] 22%|██▏       | 11/50 [00:07<00:13,  2.83it/s] 24%|██▍       | 12/50 [00:08<00:12,  2.92it/s] 26%|██▌       | 13/50 [00:08<00:12,  2.99it/s] 28%|██▊       | 14/50 [00:08<00:11,  3.04it/s] 30%|███       | 15/50 [00:09<00:11,  3.08it/s] 32%|███▏      | 16/50 [00:09<00:10,  3.10it/s] 34%|███▍      | 17/50 [00:09<00:10,  3.09it/s] 36%|███▌      | 18/50 [00:10<00:10,  3.14it/s] 38%|███▊      | 19/50 [00:10<00:09,  3.15it/s] 40%|████      | 20/50 [00:10<00:09,  3.15it/s] 42%|████▏     | 21/50 [00:11<00:09,  3.16it/s] 44%|████▍     | 22/50 [00:11<00:08,  3.16it/s] 46%|████▌     | 23/50 [00:11<00:08,  3.15it/s] 48%|████▊     | 24/50 [00:11<00:08,  3.16it/s] 50%|█████     | 25/50 [00:12<00:07,  3.16it/s] 52%|█████▏    | 26/50 [00:12<00:07,  3.16it/s] 54%|█████▍    | 27/50 [00:12<00:07,  3.16it/s] 56%|█████▌    | 28/50 [00:13<00:06,  3.16it/s] 58%|█████▊    | 29/50 [00:13<00:06,  3.16it/s] 60%|██████    | 30/50 [00:13<00:06,  3.16it/s] 62%|██████▏   | 31/50 [00:14<00:06,  3.16it/s] 64%|██████▍   | 32/50 [00:14<00:05,  3.16it/s] 66%|██████▌   | 33/50 [00:14<00:05,  3.15it/s] 68%|██████▊   | 34/50 [00:15<00:05,  3.16it/s] 70%|███████   | 35/50 [00:15<00:04,  3.16it/s] 72%|███████▏  | 36/50 [00:15<00:04,  3.15it/s] 74%|███████▍  | 37/50 [00:16<00:04,  3.15it/s] 76%|███████▌  | 38/50 [00:16<00:03,  3.15it/s] 78%|███████▊  | 39/50 [00:16<00:03,  3.15it/s] 80%|████████  | 40/50 [00:17<00:03,  3.15it/s] 82%|████████▏ | 41/50 [00:17<00:02,  3.15it/s] 84%|████████▍ | 42/50 [00:17<00:02,  3.15it/s] 86%|████████▌ | 43/50 [00:18<00:02,  3.15it/s] 88%|████████▊ | 44/50 [00:18<00:01,  3.15it/s] 90%|█████████ | 45/50 [00:18<00:01,  3.15it/s] 92%|█████████▏| 46/50 [00:18<00:01,  3.15it/s] 94%|█████████▍| 47/50 [00:19<00:00,  3.14it/s] 96%|█████████▌| 48/50 [00:19<00:00,  3.14it/s] 98%|█████████▊| 49/50 [00:19<00:00,  3.14it/s]100%|██████████| 50/50 [00:24<00:00,  1.71s/it]100%|██████████| 50/50 [00:24<00:00,  2.01it/s]
