[I 2023-12-10 22:52:24,886] Trial 181 finished with value: 0.2984816452046896 and parameters: {'EMBEDDING_DIM': 961, 'HIDDEN_DIM': 1212, 'NUM_LAYERS': 1, 'DROPOUT': 0.3605095642325831, 'LR': 0.00435400581593665, 'WEIGHT_0': 0.3738267154117805, 'WEIGHT_1': 0.7413750335076813, 'WEIGHT_2': 0.557266333476057, 'WEIGHT_3': 0.8251848234616268, 'WEIGHT_4': 0.6975977903869878, 'WEIGHT_5': 0.5116712536571262, 'WEIGHT_6': 0.7175771857026033, 'WEIGHT_7': 0.3468770430202375, 'WEIGHT_8': 0.562132431759234, 'optimizer': 'RMSprop'}. Best is trial 134 with value: 0.4158467115484205.
/userhome/cs2/dingruiw/conda/envs/py310/lib/python3.10/site-packages/torch/nn/modules/rnn.py:82: UserWarning: dropout option adds dropout after all but last recurrent layer, so non-zero dropout expects num_layers greater than 1, but got dropout=0.3689138519282515 and num_layers=1
  warnings.warn("dropout option adds dropout after all but last "
{'EMBEDDING_DIM': 961, 'HIDDEN_DIM': 1212, 'NUM_LAYERS': 1, 'DROPOUT': 0.3605095642325831, 'LR': 0.00435400581593665, 'WEIGHT_0': 0.3738267154117805, 'WEIGHT_1': 0.7413750335076813, 'WEIGHT_2': 0.557266333476057, 'WEIGHT_3': 0.8251848234616268, 'WEIGHT_4': 0.6975977903869878, 'WEIGHT_5': 0.5116712536571262, 'WEIGHT_6': 0.7175771857026033, 'WEIGHT_7': 0.3468770430202375, 'WEIGHT_8': 0.562132431759234, 'optimizer': 'RMSprop'}
0
              precision    recall  f1-score   support

         LOC       0.05      0.01      0.02      1837
        MISC       0.02      0.01      0.01       922
         ORG       0.11      0.00      0.01      1341
         PER       0.07      0.01      0.02      1842

   micro avg       0.05      0.01      0.01      5942
   macro avg       0.06      0.01      0.01      5942
weighted avg       0.06      0.01      0.01      5942

{'EMBEDDING_DIM': 961, 'HIDDEN_DIM': 1212, 'NUM_LAYERS': 1, 'DROPOUT': 0.3605095642325831, 'LR': 0.00435400581593665, 'WEIGHT_0': 0.3738267154117805, 'WEIGHT_1': 0.7413750335076813, 'WEIGHT_2': 0.557266333476057, 'WEIGHT_3': 0.8251848234616268, 'WEIGHT_4': 0.6975977903869878, 'WEIGHT_5': 0.5116712536571262, 'WEIGHT_6': 0.7175771857026033, 'WEIGHT_7': 0.3468770430202375, 'WEIGHT_8': 0.562132431759234, 'optimizer': 'RMSprop'}
49
              precision    recall  f1-score   support

         LOC       0.53      0.39      0.45      1837
        MISC       0.37      0.31      0.34       922
         ORG       0.28      0.16      0.21      1341
         PER       0.21      0.18      0.20      1842

   micro avg       0.35      0.26      0.30      5942
   macro avg       0.35      0.26      0.30      5942
weighted avg       0.35      0.26      0.30      5942

epoch 49
LSTM
  0%|          | 0/50 [00:00<?, ?it/s]  2%|▏         | 1/50 [00:04<03:53,  4.76s/it]  4%|▍         | 2/50 [00:04<01:38,  2.04s/it]  6%|▌         | 3/50 [00:05<00:57,  1.23s/it]  8%|▊         | 4/50 [00:05<00:38,  1.19it/s] 10%|█         | 5/50 [00:05<00:28,  1.59it/s] 12%|█▏        | 6/50 [00:05<00:22,  1.99it/s] 14%|█▍        | 7/50 [00:06<00:18,  2.38it/s] 16%|█▌        | 8/50 [00:06<00:15,  2.73it/s] 18%|█▊        | 9/50 [00:06<00:13,  3.03it/s] 20%|██        | 10/50 [00:06<00:12,  3.27it/s] 22%|██▏       | 11/50 [00:07<00:11,  3.46it/s] 24%|██▍       | 12/50 [00:07<00:10,  3.60it/s] 26%|██▌       | 13/50 [00:07<00:09,  3.71it/s] 28%|██▊       | 14/50 [00:07<00:09,  3.79it/s] 30%|███       | 15/50 [00:08<00:09,  3.84it/s] 32%|███▏      | 16/50 [00:08<00:08,  3.88it/s] 34%|███▍      | 17/50 [00:08<00:08,  3.90it/s] 36%|███▌      | 18/50 [00:08<00:08,  3.92it/s] 38%|███▊      | 19/50 [00:09<00:07,  3.94it/s] 40%|████      | 20/50 [00:09<00:07,  3.95it/s] 42%|████▏     | 21/50 [00:09<00:07,  3.95it/s] 44%|████▍     | 22/50 [00:09<00:07,  3.96it/s] 46%|████▌     | 23/50 [00:10<00:06,  3.96it/s] 48%|████▊     | 24/50 [00:10<00:06,  3.96it/s] 50%|█████     | 25/50 [00:10<00:06,  3.97it/s] 52%|█████▏    | 26/50 [00:10<00:06,  3.97it/s] 54%|█████▍    | 27/50 [00:11<00:05,  3.96it/s] 56%|█████▌    | 28/50 [00:11<00:05,  3.96it/s] 58%|█████▊    | 29/50 [00:11<00:05,  3.96it/s] 60%|██████    | 30/50 [00:11<00:05,  3.96it/s] 62%|██████▏   | 31/50 [00:12<00:04,  3.94it/s] 64%|██████▍   | 32/50 [00:12<00:04,  3.94it/s] 66%|██████▌   | 33/50 [00:12<00:04,  3.94it/s] 68%|██████▊   | 34/50 [00:12<00:04,  3.93it/s] 70%|███████   | 35/50 [00:13<00:03,  3.94it/s] 72%|███████▏  | 36/50 [00:13<00:03,  3.95it/s] 74%|███████▍  | 37/50 [00:13<00:03,  3.95it/s] 76%|███████▌  | 38/50 [00:13<00:03,  3.96it/s] 78%|███████▊  | 39/50 [00:14<00:02,  3.96it/s] 80%|████████  | 40/50 [00:14<00:02,  3.97it/s] 82%|████████▏ | 41/50 [00:14<00:02,  3.96it/s] 84%|████████▍ | 42/50 [00:15<00:02,  3.96it/s] 86%|████████▌ | 43/50 [00:15<00:01,  3.96it/s] 88%|████████▊ | 44/50 [00:15<00:01,  3.95it/s] 90%|█████████ | 45/50 [00:15<00:01,  3.93it/s] 92%|█████████▏| 46/50 [00:16<00:01,  3.91it/s] 94%|█████████▍| 47/50 [00:16<00:00,  3.91it/s] 96%|█████████▌| 48/50 [00:16<00:00,  3.91it/s] 98%|█████████▊| 49/50 [00:16<00:00,  3.91it/s]100%|██████████| 50/50 [00:21<00:00,  1.65s/it]100%|██████████| 50/50 [00:21<00:00,  2.30it/s]
[I 2023-12-10 22:52:50,824] Trial 182 finished with value: 0.4013635171750721 and parameters: {'EMBEDDING_DIM': 973, 'HIDDEN_DIM': 383, 'NUM_LAYERS': 1, 'DROPOUT': 0.3689138519282515, 'LR': 0.0029044869167770427, 'WEIGHT_0': 0.3625008154651711, 'WEIGHT_1': 0.7579333906516553, 'WEIGHT_2': 0.5728822772771734, 'WEIGHT_3': 0.8319546130592163, 'WEIGHT_4': 0.7319289579931698, 'WEIGHT_5': 0.5428799418334997, 'WEIGHT_6': 0.7071289991988148, 'WEIGHT_7': 0.32412822219280013, 'WEIGHT_8': 0.5280526787977252, 'optimizer': 'RMSprop'}. Best is trial 134 with value: 0.4158467115484205.
/userhome/cs2/dingruiw/conda/envs/py310/lib/python3.10/site-packages/torch/nn/modules/rnn.py:82: UserWarning: dropout option adds dropout after all but last recurrent layer, so non-zero dropout expects num_layers greater than 1, but got dropout=0.3462048333274677 and num_layers=1
  warnings.warn("dropout option adds dropout after all but last "
{'EMBEDDING_DIM': 973, 'HIDDEN_DIM': 383, 'NUM_LAYERS': 1, 'DROPOUT': 0.3689138519282515, 'LR': 0.0029044869167770427, 'WEIGHT_0': 0.3625008154651711, 'WEIGHT_1': 0.7579333906516553, 'WEIGHT_2': 0.5728822772771734, 'WEIGHT_3': 0.8319546130592163, 'WEIGHT_4': 0.7319289579931698, 'WEIGHT_5': 0.5428799418334997, 'WEIGHT_6': 0.7071289991988148, 'WEIGHT_7': 0.32412822219280013, 'WEIGHT_8': 0.5280526787977252, 'optimizer': 'RMSprop'}
0
              precision    recall  f1-score   support

         LOC       0.29      0.12      0.17      1837
        MISC       0.04      0.01      0.02       922
         ORG       0.12      0.02      0.04      1341
         PER       0.02      0.01      0.01      1842

   micro avg       0.12      0.05      0.07      5942
   macro avg       0.12      0.04      0.06      5942
weighted avg       0.13      0.05      0.07      5942

{'EMBEDDING_DIM': 973, 'HIDDEN_DIM': 383, 'NUM_LAYERS': 1, 'DROPOUT': 0.3689138519282515, 'LR': 0.0029044869167770427, 'WEIGHT_0': 0.3625008154651711, 'WEIGHT_1': 0.7579333906516553, 'WEIGHT_2': 0.5728822772771734, 'WEIGHT_3': 0.8319546130592163, 'WEIGHT_4': 0.7319289579931698, 'WEIGHT_5': 0.5428799418334997, 'WEIGHT_6': 0.7071289991988148, 'WEIGHT_7': 0.32412822219280013, 'WEIGHT_8': 0.5280526787977252, 'optimizer': 'RMSprop'}
49
              precision    recall  f1-score   support

         LOC       0.59      0.51      0.55      1837
        MISC       0.41      0.42      0.41       922
         ORG       0.28      0.24      0.26      1341
         PER       0.35      0.35      0.35      1842

   micro avg       0.42      0.39      0.40      5942
   macro avg       0.41      0.38      0.39      5942
weighted avg       0.42      0.39      0.40      5942

epoch 49
LSTM
  0%|          | 0/50 [00:00<?, ?it/s]  2%|▏         | 1/50 [00:04<03:46,  4.62s/it]  4%|▍         | 2/50 [00:04<01:34,  1.96s/it]  6%|▌         | 3/50 [00:04<00:54,  1.16s/it]  8%|▊         | 4/50 [00:05<00:35,  1.28it/s] 10%|█         | 5/50 [00:05<00:25,  1.76it/s] 12%|█▏        | 6/50 [00:05<00:19,  2.28it/s] 14%|█▍        | 7/50 [00:05<00:15,  2.79it/s] 16%|█▌        | 8/50 [00:05<00:12,  3.29it/s] 18%|█▊        | 9/50 [00:06<00:11,  3.72it/s] 20%|██        | 10/50 [00:06<00:09,  4.08it/s] 22%|██▏       | 11/50 [00:06<00:08,  4.38it/s] 24%|██▍       | 12/50 [00:06<00:08,  4.61it/s] 26%|██▌       | 13/50 [00:06<00:07,  4.79it/s] 28%|██▊       | 14/50 [00:07<00:07,  4.92it/s] 30%|███       | 15/50 [00:07<00:06,  5.01it/s] 32%|███▏      | 16/50 [00:07<00:06,  5.08it/s] 34%|███▍      | 17/50 [00:07<00:06,  5.12it/s] 36%|███▌      | 18/50 [00:07<00:06,  5.16it/s] 38%|███▊      | 19/50 [00:07<00:05,  5.17it/s] 40%|████      | 20/50 [00:08<00:05,  5.19it/s] 42%|████▏     | 21/50 [00:08<00:05,  5.21it/s] 44%|████▍     | 22/50 [00:08<00:05,  5.21it/s] 46%|████▌     | 23/50 [00:08<00:05,  5.22it/s] 48%|████▊     | 24/50 [00:08<00:04,  5.22it/s] 50%|█████     | 25/50 [00:09<00:04,  5.23it/s] 52%|█████▏    | 26/50 [00:09<00:04,  5.22it/s] 54%|█████▍    | 27/50 [00:09<00:04,  5.22it/s] 56%|█████▌    | 28/50 [00:09<00:04,  5.23it/s] 58%|█████▊    | 29/50 [00:09<00:04,  5.23it/s] 60%|██████    | 30/50 [00:10<00:03,  5.23it/s] 62%|██████▏   | 31/50 [00:10<00:03,  5.23it/s] 64%|██████▍   | 32/50 [00:10<00:03,  5.23it/s] 66%|██████▌   | 33/50 [00:10<00:03,  5.23it/s] 68%|██████▊   | 34/50 [00:10<00:03,  5.23it/s] 70%|███████   | 35/50 [00:11<00:02,  5.23it/s] 72%|███████▏  | 36/50 [00:11<00:02,  5.22it/s] 74%|███████▍  | 37/50 [00:11<00:02,  5.22it/s] 76%|███████▌  | 38/50 [00:11<00:02,  5.22it/s] 78%|███████▊  | 39/50 [00:11<00:02,  5.23it/s] 80%|████████  | 40/50 [00:12<00:01,  5.22it/s] 82%|████████▏ | 41/50 [00:12<00:01,  5.22it/s] 84%|████████▍ | 42/50 [00:12<00:01,  5.22it/s] 86%|████████▌ | 43/50 [00:12<00:01,  5.22it/s] 88%|████████▊ | 44/50 [00:12<00:01,  5.23it/s] 90%|█████████ | 45/50 [00:12<00:00,  5.22it/s] 92%|█████████▏| 46/50 [00:13<00:00,  5.23it/s] 94%|█████████▍| 47/50 [00:13<00:00,  5.22it/s] 96%|█████████▌| 48/50 [00:13<00:00,  5.22it/s] 98%|█████████▊| 49/50 [00:13<00:00,  5.22it/s]100%|██████████| 50/50 [00:18<00:00,  1.57s/it]100%|██████████| 50/50 [00:18<00:00,  2.70it/s]
[I 2023-12-10 22:53:13,587] Trial 183 finished with value: 0.3980558116148496 and parameters: {'EMBEDDING_DIM': 1023, 'HIDDEN_DIM': 263, 'NUM_LAYERS': 1, 'DROPOUT': 0.3462048333274677, 'LR': 0.0023695396199352936, 'WEIGHT_0': 0.3106688401650824, 'WEIGHT_1': 0.7850939939041134, 'WEIGHT_2': 0.522820350626873, 'WEIGHT_3': 0.7796667078947046, 'WEIGHT_4': 0.7471487341851877, 'WEIGHT_5': 0.4712444095237041, 'WEIGHT_6': 0.7527984080353416, 'WEIGHT_7': 0.3592635992081749, 'WEIGHT_8': 0.46735081394740075, 'optimizer': 'RMSprop'}. Best is trial 134 with value: 0.4158467115484205.
/userhome/cs2/dingruiw/conda/envs/py310/lib/python3.10/site-packages/torch/nn/modules/rnn.py:82: UserWarning: dropout option adds dropout after all but last recurrent layer, so non-zero dropout expects num_layers greater than 1, but got dropout=0.3599666532300512 and num_layers=1
  warnings.warn("dropout option adds dropout after all but last "
{'EMBEDDING_DIM': 1023, 'HIDDEN_DIM': 263, 'NUM_LAYERS': 1, 'DROPOUT': 0.3462048333274677, 'LR': 0.0023695396199352936, 'WEIGHT_0': 0.3106688401650824, 'WEIGHT_1': 0.7850939939041134, 'WEIGHT_2': 0.522820350626873, 'WEIGHT_3': 0.7796667078947046, 'WEIGHT_4': 0.7471487341851877, 'WEIGHT_5': 0.4712444095237041, 'WEIGHT_6': 0.7527984080353416, 'WEIGHT_7': 0.3592635992081749, 'WEIGHT_8': 0.46735081394740075, 'optimizer': 'RMSprop'}
0
              precision    recall  f1-score   support

         LOC       0.48      0.14      0.22      1837
        MISC       0.10      0.04      0.06       922
         ORG       0.23      0.03      0.05      1341
         PER       0.09      0.05      0.06      1842

   micro avg       0.21      0.07      0.10      5942
   macro avg       0.23      0.06      0.10      5942
weighted avg       0.25      0.07      0.11      5942

{'EMBEDDING_DIM': 1023, 'HIDDEN_DIM': 263, 'NUM_LAYERS': 1, 'DROPOUT': 0.3462048333274677, 'LR': 0.0023695396199352936, 'WEIGHT_0': 0.3106688401650824, 'WEIGHT_1': 0.7850939939041134, 'WEIGHT_2': 0.522820350626873, 'WEIGHT_3': 0.7796667078947046, 'WEIGHT_4': 0.7471487341851877, 'WEIGHT_5': 0.4712444095237041, 'WEIGHT_6': 0.7527984080353416, 'WEIGHT_7': 0.3592635992081749, 'WEIGHT_8': 0.46735081394740075, 'optimizer': 'RMSprop'}
49
              precision    recall  f1-score   support

         LOC       0.60      0.54      0.57      1837
        MISC       0.42      0.44      0.43       922
         ORG       0.25      0.26      0.26      1341
         PER       0.32      0.34      0.33      1842

   micro avg       0.40      0.40      0.40      5942
   macro avg       0.40      0.40      0.40      5942
weighted avg       0.41      0.40      0.40      5942

epoch 49
LSTM
  0%|          | 0/50 [00:00<?, ?it/s]  2%|▏         | 1/50 [00:04<03:43,  4.57s/it]  6%|▌         | 3/50 [00:04<00:59,  1.27s/it]  8%|▊         | 4/50 [00:04<00:40,  1.13it/s] 10%|█         | 5/50 [00:05<00:28,  1.57it/s] 12%|█▏        | 6/50 [00:05<00:21,  2.09it/s] 14%|█▍        | 7/50 [00:05<00:16,  2.68it/s] 16%|█▌        | 8/50 [00:05<00:12,  3.31it/s] 18%|█▊        | 9/50 [00:05<00:10,  3.94it/s] 20%|██        | 10/50 [00:05<00:08,  4.55it/s] 22%|██▏       | 11/50 [00:05<00:07,  5.08it/s] 24%|██▍       | 12/50 [00:06<00:06,  5.53it/s] 26%|██▌       | 13/50 [00:06<00:06,  5.90it/s] 28%|██▊       | 14/50 [00:06<00:05,  6.18it/s] 30%|███       | 15/50 [00:06<00:05,  6.40it/s] 32%|███▏      | 16/50 [00:06<00:05,  6.58it/s] 34%|███▍      | 17/50 [00:06<00:04,  6.67it/s] 36%|███▌      | 18/50 [00:06<00:04,  6.75it/s] 38%|███▊      | 19/50 [00:07<00:04,  6.81it/s] 40%|████      | 20/50 [00:07<00:04,  6.83it/s] 42%|████▏     | 21/50 [00:07<00:04,  6.86it/s] 44%|████▍     | 22/50 [00:07<00:04,  6.87it/s] 46%|████▌     | 23/50 [00:07<00:03,  6.88it/s] 48%|████▊     | 24/50 [00:07<00:03,  6.88it/s] 50%|█████     | 25/50 [00:07<00:03,  6.89it/s] 52%|█████▏    | 26/50 [00:08<00:03,  6.90it/s] 54%|█████▍    | 27/50 [00:08<00:03,  6.92it/s] 56%|█████▌    | 28/50 [00:08<00:03,  6.93it/s] 58%|█████▊    | 29/50 [00:08<00:03,  6.92it/s] 60%|██████    | 30/50 [00:08<00:02,  6.93it/s] 62%|██████▏   | 31/50 [00:08<00:02,  6.94it/s] 64%|██████▍   | 32/50 [00:08<00:02,  6.93it/s] 66%|██████▌   | 33/50 [00:09<00:02,  6.93it/s] 68%|██████▊   | 34/50 [00:09<00:02,  6.93it/s] 70%|███████   | 35/50 [00:09<00:02,  6.92it/s] 72%|███████▏  | 36/50 [00:09<00:02,  6.92it/s] 74%|███████▍  | 37/50 [00:09<00:01,  6.93it/s] 76%|███████▌  | 38/50 [00:09<00:01,  6.92it/s] 78%|███████▊  | 39/50 [00:09<00:01,  6.92it/s] 80%|████████  | 40/50 [00:10<00:01,  6.93it/s] 82%|████████▏ | 41/50 [00:10<00:01,  6.92it/s] 84%|████████▍ | 42/50 [00:10<00:01,  6.93it/s] 86%|████████▌ | 43/50 [00:10<00:01,  6.93it/s] 88%|████████▊ | 44/50 [00:10<00:00,  6.91it/s] 90%|█████████ | 45/50 [00:10<00:00,  6.92it/s] 92%|█████████▏| 46/50 [00:11<00:00,  6.93it/s] 94%|█████████▍| 47/50 [00:11<00:00,  6.92it/s] 96%|█████████▌| 48/50 [00:11<00:00,  6.93it/s] 98%|█████████▊| 49/50 [00:11<00:00,  6.92it/s]100%|██████████| 50/50 [00:16<00:00,  1.53s/it]100%|██████████| 50/50 [00:16<00:00,  3.09it/s]
[I 2023-12-10 22:53:33,988] Trial 184 finished with value: 0.3992752429583265 and parameters: {'EMBEDDING_DIM': 933, 'HIDDEN_DIM': 198, 'NUM_LAYERS': 1, 'DROPOUT': 0.3599666532300512, 'LR': 0.0019049190064723406, 'WEIGHT_0': 0.33178646512239696, 'WEIGHT_1': 0.7257471822991347, 'WEIGHT_2': 0.6036469128382657, 'WEIGHT_3': 0.8560508882426857, 'WEIGHT_4': 0.9085565975395176, 'WEIGHT_5': 0.5040035701470097, 'WEIGHT_6': 0.6835213846194405, 'WEIGHT_7': 0.2671007115048711, 'WEIGHT_8': 0.5815884799256418, 'optimizer': 'RMSprop'}. Best is trial 134 with value: 0.4158467115484205.
/userhome/cs2/dingruiw/conda/envs/py310/lib/python3.10/site-packages/torch/nn/modules/rnn.py:82: UserWarning: dropout option adds dropout after all but last recurrent layer, so non-zero dropout expects num_layers greater than 1, but got dropout=0.3396351902714364 and num_layers=1
  warnings.warn("dropout option adds dropout after all but last "
{'EMBEDDING_DIM': 933, 'HIDDEN_DIM': 198, 'NUM_LAYERS': 1, 'DROPOUT': 0.3599666532300512, 'LR': 0.0019049190064723406, 'WEIGHT_0': 0.33178646512239696, 'WEIGHT_1': 0.7257471822991347, 'WEIGHT_2': 0.6036469128382657, 'WEIGHT_3': 0.8560508882426857, 'WEIGHT_4': 0.9085565975395176, 'WEIGHT_5': 0.5040035701470097, 'WEIGHT_6': 0.6835213846194405, 'WEIGHT_7': 0.2671007115048711, 'WEIGHT_8': 0.5815884799256418, 'optimizer': 'RMSprop'}
0
              precision    recall  f1-score   support

         LOC       0.19      0.10      0.13      1837
        MISC       0.09      0.06      0.07       922
         ORG       0.16      0.05      0.07      1341
         PER       0.06      0.02      0.03      1842

   micro avg       0.13      0.05      0.08      5942
   macro avg       0.12      0.05      0.07      5942
weighted avg       0.13      0.05      0.08      5942

{'EMBEDDING_DIM': 933, 'HIDDEN_DIM': 198, 'NUM_LAYERS': 1, 'DROPOUT': 0.3599666532300512, 'LR': 0.0019049190064723406, 'WEIGHT_0': 0.33178646512239696, 'WEIGHT_1': 0.7257471822991347, 'WEIGHT_2': 0.6036469128382657, 'WEIGHT_3': 0.8560508882426857, 'WEIGHT_4': 0.9085565975395176, 'WEIGHT_5': 0.5040035701470097, 'WEIGHT_6': 0.6835213846194405, 'WEIGHT_7': 0.2671007115048711, 'WEIGHT_8': 0.5815884799256418, 'optimizer': 'RMSprop'}
49
              precision    recall  f1-score   support

         LOC       0.53      0.53      0.53      1837
        MISC       0.41      0.46      0.43       922
         ORG       0.29      0.26      0.28      1341
         PER       0.32      0.37      0.34      1842

   micro avg       0.39      0.41      0.40      5942
   macro avg       0.39      0.40      0.39      5942
weighted avg       0.39      0.41      0.40      5942

epoch 49
LSTM
  0%|          | 0/50 [00:00<?, ?it/s]  2%|▏         | 1/50 [00:04<03:51,  4.72s/it]  4%|▍         | 2/50 [00:04<01:36,  2.02s/it]  6%|▌         | 3/50 [00:05<00:56,  1.20s/it]  8%|▊         | 4/50 [00:05<00:37,  1.22it/s] 10%|█         | 5/50 [00:05<00:27,  1.66it/s] 12%|█▏        | 6/50 [00:05<00:20,  2.10it/s] 14%|█▍        | 7/50 [00:05<00:16,  2.54it/s] 16%|█▌        | 8/50 [00:06<00:14,  2.93it/s] 18%|█▊        | 9/50 [00:06<00:12,  3.27it/s] 20%|██        | 10/50 [00:06<00:11,  3.56it/s] 22%|██▏       | 11/50 [00:06<00:10,  3.78it/s] 24%|██▍       | 12/50 [00:07<00:09,  3.95it/s] 26%|██▌       | 13/50 [00:07<00:09,  4.08it/s] 28%|██▊       | 14/50 [00:07<00:08,  4.17it/s] 30%|███       | 15/50 [00:07<00:08,  4.24it/s] 32%|███▏      | 16/50 [00:08<00:07,  4.29it/s] 34%|███▍      | 17/50 [00:08<00:07,  4.32it/s] 36%|███▌      | 18/50 [00:08<00:07,  4.34it/s] 38%|███▊      | 19/50 [00:08<00:07,  4.36it/s] 40%|████      | 20/50 [00:08<00:06,  4.38it/s] 42%|████▏     | 21/50 [00:09<00:06,  4.38it/s] 44%|████▍     | 22/50 [00:09<00:06,  4.39it/s] 46%|████▌     | 23/50 [00:09<00:06,  4.39it/s] 48%|████▊     | 24/50 [00:09<00:05,  4.39it/s] 50%|█████     | 25/50 [00:10<00:05,  4.40it/s] 52%|█████▏    | 26/50 [00:10<00:05,  4.40it/s] 54%|█████▍    | 27/50 [00:10<00:05,  4.40it/s] 56%|█████▌    | 28/50 [00:10<00:05,  4.39it/s] 58%|█████▊    | 29/50 [00:10<00:04,  4.37it/s] 60%|██████    | 30/50 [00:11<00:04,  4.37it/s] 62%|██████▏   | 31/50 [00:11<00:04,  4.38it/s] 64%|██████▍   | 32/50 [00:11<00:04,  4.38it/s] 66%|██████▌   | 33/50 [00:11<00:03,  4.38it/s] 68%|██████▊   | 34/50 [00:12<00:03,  4.39it/s] 70%|███████   | 35/50 [00:12<00:03,  4.38it/s] 72%|███████▏  | 36/50 [00:12<00:03,  4.38it/s] 74%|███████▍  | 37/50 [00:12<00:02,  4.38it/s] 76%|███████▌  | 38/50 [00:13<00:02,  4.38it/s] 78%|███████▊  | 39/50 [00:13<00:02,  4.38it/s] 80%|████████  | 40/50 [00:13<00:02,  4.38it/s] 82%|████████▏ | 41/50 [00:13<00:02,  4.38it/s] 84%|████████▍ | 42/50 [00:13<00:01,  4.38it/s] 86%|████████▌ | 43/50 [00:14<00:01,  4.38it/s] 88%|████████▊ | 44/50 [00:14<00:01,  4.37it/s] 90%|█████████ | 45/50 [00:14<00:01,  4.37it/s] 92%|█████████▏| 46/50 [00:14<00:00,  4.37it/s] 94%|█████████▍| 47/50 [00:15<00:00,  4.37it/s] 96%|█████████▌| 48/50 [00:15<00:00,  4.37it/s] 98%|█████████▊| 49/50 [00:15<00:00,  4.38it/s]100%|██████████| 50/50 [00:20<00:00,  1.61s/it]100%|██████████| 50/50 [00:20<00:00,  2.45it/s]
