[I 2023-12-11 00:14:35,732] Trial 353 finished with value: 0.3948361136725627 and parameters: {'EMBEDDING_DIM': 943, 'HIDDEN_DIM': 228, 'NUM_LAYERS': 1, 'DROPOUT': 0.1030291609847058, 'LR': 0.0009059027333052566, 'WEIGHT_0': 0.1361028806170453, 'WEIGHT_1': 0.4541235703298269, 'WEIGHT_2': 0.41102990545964396, 'WEIGHT_3': 0.44496247413288786, 'WEIGHT_4': 0.4045767038385957, 'WEIGHT_5': 0.48712828797491897, 'WEIGHT_6': 0.7378350681809085, 'WEIGHT_7': 0.2522148062340699, 'WEIGHT_8': 0.9213356400357502, 'optimizer': 'RMSprop'}. Best is trial 221 with value: 0.418736930154747.
/userhome/cs2/dingruiw/conda/envs/py310/lib/python3.10/site-packages/torch/nn/modules/rnn.py:82: UserWarning: dropout option adds dropout after all but last recurrent layer, so non-zero dropout expects num_layers greater than 1, but got dropout=0.030516666355054865 and num_layers=1
  warnings.warn("dropout option adds dropout after all but last "
{'EMBEDDING_DIM': 943, 'HIDDEN_DIM': 228, 'NUM_LAYERS': 1, 'DROPOUT': 0.1030291609847058, 'LR': 0.0009059027333052566, 'WEIGHT_0': 0.1361028806170453, 'WEIGHT_1': 0.4541235703298269, 'WEIGHT_2': 0.41102990545964396, 'WEIGHT_3': 0.44496247413288786, 'WEIGHT_4': 0.4045767038385957, 'WEIGHT_5': 0.48712828797491897, 'WEIGHT_6': 0.7378350681809085, 'WEIGHT_7': 0.2522148062340699, 'WEIGHT_8': 0.9213356400357502, 'optimizer': 'RMSprop'}
0
              precision    recall  f1-score   support

         LOC       0.22      0.14      0.17      1837
        MISC       0.05      0.03      0.04       922
         ORG       0.14      0.05      0.07      1341
         PER       0.09      0.03      0.04      1842

   micro avg       0.15      0.07      0.09      5942
   macro avg       0.13      0.06      0.08      5942
weighted avg       0.14      0.07      0.09      5942

{'EMBEDDING_DIM': 943, 'HIDDEN_DIM': 228, 'NUM_LAYERS': 1, 'DROPOUT': 0.1030291609847058, 'LR': 0.0009059027333052566, 'WEIGHT_0': 0.1361028806170453, 'WEIGHT_1': 0.4541235703298269, 'WEIGHT_2': 0.41102990545964396, 'WEIGHT_3': 0.44496247413288786, 'WEIGHT_4': 0.4045767038385957, 'WEIGHT_5': 0.48712828797491897, 'WEIGHT_6': 0.7378350681809085, 'WEIGHT_7': 0.2522148062340699, 'WEIGHT_8': 0.9213356400357502, 'optimizer': 'RMSprop'}
49
              precision    recall  f1-score   support

         LOC       0.52      0.52      0.52      1837
        MISC       0.40      0.45      0.42       922
         ORG       0.29      0.25      0.27      1341
         PER       0.33      0.35      0.34      1842

   micro avg       0.39      0.40      0.39      5942
   macro avg       0.39      0.39      0.39      5942
weighted avg       0.39      0.40      0.39      5942

epoch 49
LSTM
  0%|          | 0/50 [00:00<?, ?it/s]  2%|▏         | 1/50 [00:05<04:07,  5.05s/it]  4%|▍         | 2/50 [00:05<01:43,  2.16s/it]  6%|▌         | 3/50 [00:05<01:00,  1.28s/it]  8%|▊         | 4/50 [00:05<00:40,  1.15it/s] 10%|█         | 5/50 [00:05<00:29,  1.55it/s] 12%|█▏        | 6/50 [00:06<00:22,  1.96it/s] 14%|█▍        | 7/50 [00:06<00:18,  2.37it/s] 16%|█▌        | 8/50 [00:06<00:15,  2.74it/s] 18%|█▊        | 9/50 [00:06<00:13,  3.06it/s] 20%|██        | 10/50 [00:07<00:12,  3.32it/s] 22%|██▏       | 11/50 [00:07<00:11,  3.53it/s] 24%|██▍       | 12/50 [00:07<00:10,  3.69it/s] 26%|██▌       | 13/50 [00:07<00:09,  3.80it/s] 28%|██▊       | 14/50 [00:08<00:09,  3.90it/s] 30%|███       | 15/50 [00:08<00:08,  3.96it/s] 32%|███▏      | 16/50 [00:08<00:08,  4.00it/s] 34%|███▍      | 17/50 [00:08<00:08,  4.04it/s] 36%|███▌      | 18/50 [00:09<00:07,  4.06it/s] 38%|███▊      | 19/50 [00:09<00:07,  4.07it/s] 40%|████      | 20/50 [00:09<00:07,  4.08it/s] 42%|████▏     | 21/50 [00:09<00:07,  4.09it/s] 44%|████▍     | 22/50 [00:10<00:06,  4.10it/s] 46%|████▌     | 23/50 [00:10<00:06,  4.10it/s] 48%|████▊     | 24/50 [00:10<00:06,  4.10it/s] 50%|█████     | 25/50 [00:10<00:06,  4.10it/s] 52%|█████▏    | 26/50 [00:11<00:05,  4.11it/s] 54%|█████▍    | 27/50 [00:11<00:05,  4.10it/s] 56%|█████▌    | 28/50 [00:11<00:05,  4.11it/s] 58%|█████▊    | 29/50 [00:11<00:05,  4.10it/s] 60%|██████    | 30/50 [00:11<00:04,  4.11it/s] 62%|██████▏   | 31/50 [00:12<00:04,  4.10it/s] 64%|██████▍   | 32/50 [00:12<00:04,  4.10it/s] 66%|██████▌   | 33/50 [00:12<00:04,  4.10it/s] 68%|██████▊   | 34/50 [00:12<00:03,  4.10it/s] 70%|███████   | 35/50 [00:13<00:03,  4.10it/s] 72%|███████▏  | 36/50 [00:13<00:03,  4.10it/s] 74%|███████▍  | 37/50 [00:13<00:03,  4.10it/s] 76%|███████▌  | 38/50 [00:13<00:02,  4.10it/s] 78%|███████▊  | 39/50 [00:14<00:02,  4.09it/s] 80%|████████  | 40/50 [00:14<00:02,  4.09it/s] 82%|████████▏ | 41/50 [00:14<00:02,  4.09it/s] 84%|████████▍ | 42/50 [00:14<00:01,  4.09it/s] 86%|████████▌ | 43/50 [00:15<00:01,  4.09it/s] 88%|████████▊ | 44/50 [00:15<00:01,  4.09it/s] 90%|█████████ | 45/50 [00:15<00:01,  4.09it/s] 92%|█████████▏| 46/50 [00:15<00:00,  4.09it/s] 94%|█████████▍| 47/50 [00:16<00:00,  4.09it/s] 96%|█████████▌| 48/50 [00:16<00:00,  4.09it/s] 98%|█████████▊| 49/50 [00:16<00:00,  4.09it/s]100%|██████████| 50/50 [00:21<00:00,  1.65s/it]100%|██████████| 50/50 [00:21<00:00,  2.32it/s]
[I 2023-12-11 00:15:01,538] Trial 354 finished with value: 0.4053530551153372 and parameters: {'EMBEDDING_DIM': 973, 'HIDDEN_DIM': 376, 'NUM_LAYERS': 1, 'DROPOUT': 0.030516666355054865, 'LR': 0.003138492685056513, 'WEIGHT_0': 0.46813085790522546, 'WEIGHT_1': 0.5721238034200447, 'WEIGHT_2': 0.24019392770589812, 'WEIGHT_3': 0.8173216471497926, 'WEIGHT_4': 0.7223135512058891, 'WEIGHT_5': 0.5096918179254524, 'WEIGHT_6': 0.6841481975533463, 'WEIGHT_7': 0.34944378697691175, 'WEIGHT_8': 0.8704313703602262, 'optimizer': 'RMSprop'}. Best is trial 221 with value: 0.418736930154747.
/userhome/cs2/dingruiw/conda/envs/py310/lib/python3.10/site-packages/torch/nn/modules/rnn.py:82: UserWarning: dropout option adds dropout after all but last recurrent layer, so non-zero dropout expects num_layers greater than 1, but got dropout=0.014854058939874668 and num_layers=1
  warnings.warn("dropout option adds dropout after all but last "
{'EMBEDDING_DIM': 973, 'HIDDEN_DIM': 376, 'NUM_LAYERS': 1, 'DROPOUT': 0.030516666355054865, 'LR': 0.003138492685056513, 'WEIGHT_0': 0.46813085790522546, 'WEIGHT_1': 0.5721238034200447, 'WEIGHT_2': 0.24019392770589812, 'WEIGHT_3': 0.8173216471497926, 'WEIGHT_4': 0.7223135512058891, 'WEIGHT_5': 0.5096918179254524, 'WEIGHT_6': 0.6841481975533463, 'WEIGHT_7': 0.34944378697691175, 'WEIGHT_8': 0.8704313703602262, 'optimizer': 'RMSprop'}
0
              precision    recall  f1-score   support

         LOC       0.28      0.06      0.10      1837
        MISC       0.02      0.02      0.02       922
         ORG       0.15      0.02      0.03      1341
         PER       0.04      0.01      0.02      1842

   micro avg       0.10      0.03      0.05      5942
   macro avg       0.12      0.03      0.04      5942
weighted avg       0.14      0.03      0.05      5942

{'EMBEDDING_DIM': 973, 'HIDDEN_DIM': 376, 'NUM_LAYERS': 1, 'DROPOUT': 0.030516666355054865, 'LR': 0.003138492685056513, 'WEIGHT_0': 0.46813085790522546, 'WEIGHT_1': 0.5721238034200447, 'WEIGHT_2': 0.24019392770589812, 'WEIGHT_3': 0.8173216471497926, 'WEIGHT_4': 0.7223135512058891, 'WEIGHT_5': 0.5096918179254524, 'WEIGHT_6': 0.6841481975533463, 'WEIGHT_7': 0.34944378697691175, 'WEIGHT_8': 0.8704313703602262, 'optimizer': 'RMSprop'}
49
              precision    recall  f1-score   support

         LOC       0.59      0.54      0.57      1837
        MISC       0.48      0.41      0.44       922
         ORG       0.30      0.24      0.26      1341
         PER       0.32      0.33      0.33      1842

   micro avg       0.43      0.39      0.41      5942
   macro avg       0.42      0.38      0.40      5942
weighted avg       0.43      0.39      0.40      5942

epoch 49
LSTM
  0%|          | 0/50 [00:00<?, ?it/s]  2%|▏         | 1/50 [00:04<03:49,  4.68s/it]  4%|▍         | 2/50 [00:04<01:36,  2.00s/it]  6%|▌         | 3/50 [00:05<00:56,  1.19s/it]  8%|▊         | 4/50 [00:05<00:37,  1.23it/s] 10%|█         | 5/50 [00:05<00:27,  1.66it/s] 12%|█▏        | 6/50 [00:05<00:20,  2.11it/s] 14%|█▍        | 7/50 [00:05<00:16,  2.53it/s] 16%|█▌        | 8/50 [00:06<00:14,  2.93it/s] 18%|█▊        | 9/50 [00:06<00:12,  3.26it/s] 20%|██        | 10/50 [00:06<00:11,  3.54it/s] 22%|██▏       | 11/50 [00:06<00:10,  3.76it/s] 24%|██▍       | 12/50 [00:07<00:09,  3.92it/s] 26%|██▌       | 13/50 [00:07<00:09,  4.04it/s] 28%|██▊       | 14/50 [00:07<00:08,  4.14it/s] 30%|███       | 15/50 [00:07<00:08,  4.20it/s] 32%|███▏      | 16/50 [00:08<00:08,  4.24it/s] 34%|███▍      | 17/50 [00:08<00:07,  4.28it/s] 36%|███▌      | 18/50 [00:08<00:07,  4.31it/s] 38%|███▊      | 19/50 [00:08<00:07,  4.32it/s] 40%|████      | 20/50 [00:08<00:06,  4.33it/s] 42%|████▏     | 21/50 [00:09<00:06,  4.34it/s] 44%|████▍     | 22/50 [00:09<00:06,  4.35it/s] 46%|████▌     | 23/50 [00:09<00:06,  4.35it/s] 48%|████▊     | 24/50 [00:09<00:05,  4.35it/s] 50%|█████     | 25/50 [00:10<00:05,  4.35it/s] 52%|█████▏    | 26/50 [00:10<00:05,  4.35it/s] 54%|█████▍    | 27/50 [00:10<00:05,  4.36it/s] 56%|█████▌    | 28/50 [00:10<00:05,  4.36it/s] 58%|█████▊    | 29/50 [00:10<00:04,  4.36it/s] 60%|██████    | 30/50 [00:11<00:04,  4.36it/s] 62%|██████▏   | 31/50 [00:11<00:04,  4.36it/s] 64%|██████▍   | 32/50 [00:11<00:04,  4.36it/s] 66%|██████▌   | 33/50 [00:11<00:03,  4.35it/s] 68%|██████▊   | 34/50 [00:12<00:03,  4.35it/s] 70%|███████   | 35/50 [00:12<00:03,  4.35it/s] 72%|███████▏  | 36/50 [00:12<00:03,  4.35it/s] 74%|███████▍  | 37/50 [00:12<00:02,  4.35it/s] 76%|███████▌  | 38/50 [00:13<00:02,  4.35it/s] 78%|███████▊  | 39/50 [00:13<00:02,  4.35it/s] 80%|████████  | 40/50 [00:13<00:02,  4.35it/s] 82%|████████▏ | 41/50 [00:13<00:02,  4.35it/s] 84%|████████▍ | 42/50 [00:13<00:01,  4.35it/s] 86%|████████▌ | 43/50 [00:14<00:01,  4.35it/s] 88%|████████▊ | 44/50 [00:14<00:01,  4.35it/s] 90%|█████████ | 45/50 [00:14<00:01,  4.34it/s] 92%|█████████▏| 46/50 [00:14<00:00,  4.35it/s] 94%|█████████▍| 47/50 [00:15<00:00,  4.35it/s] 96%|█████████▌| 48/50 [00:15<00:00,  4.34it/s] 98%|█████████▊| 49/50 [00:15<00:00,  4.34it/s]100%|██████████| 50/50 [00:20<00:00,  1.63s/it]100%|██████████| 50/50 [00:20<00:00,  2.44it/s]
[I 2023-12-11 00:15:26,357] Trial 355 finished with value: 0.3671815649531527 and parameters: {'EMBEDDING_DIM': 1003, 'HIDDEN_DIM': 345, 'NUM_LAYERS': 1, 'DROPOUT': 0.014854058939874668, 'LR': 0.005055314731997544, 'WEIGHT_0': 0.4229420569211343, 'WEIGHT_1': 0.5140163936495908, 'WEIGHT_2': 0.37604400417011946, 'WEIGHT_3': 0.7041941862950316, 'WEIGHT_4': 0.9225274178052104, 'WEIGHT_5': 0.5202935001439748, 'WEIGHT_6': 0.9978952768502013, 'WEIGHT_7': 0.38858548508897567, 'WEIGHT_8': 0.9982982741448323, 'optimizer': 'RMSprop'}. Best is trial 221 with value: 0.418736930154747.
/userhome/cs2/dingruiw/conda/envs/py310/lib/python3.10/site-packages/torch/nn/modules/rnn.py:82: UserWarning: dropout option adds dropout after all but last recurrent layer, so non-zero dropout expects num_layers greater than 1, but got dropout=0.01631019915859934 and num_layers=1
  warnings.warn("dropout option adds dropout after all but last "
{'EMBEDDING_DIM': 1003, 'HIDDEN_DIM': 345, 'NUM_LAYERS': 1, 'DROPOUT': 0.014854058939874668, 'LR': 0.005055314731997544, 'WEIGHT_0': 0.4229420569211343, 'WEIGHT_1': 0.5140163936495908, 'WEIGHT_2': 0.37604400417011946, 'WEIGHT_3': 0.7041941862950316, 'WEIGHT_4': 0.9225274178052104, 'WEIGHT_5': 0.5202935001439748, 'WEIGHT_6': 0.9978952768502013, 'WEIGHT_7': 0.38858548508897567, 'WEIGHT_8': 0.9982982741448323, 'optimizer': 'RMSprop'}
0
              precision    recall  f1-score   support

         LOC       0.15      0.03      0.05      1837
        MISC       0.02      0.01      0.01       922
         ORG       0.09      0.02      0.04      1341
         PER       0.04      0.01      0.01      1842

   micro avg       0.07      0.02      0.03      5942
   macro avg       0.07      0.02      0.03      5942
weighted avg       0.08      0.02      0.03      5942

{'EMBEDDING_DIM': 1003, 'HIDDEN_DIM': 345, 'NUM_LAYERS': 1, 'DROPOUT': 0.014854058939874668, 'LR': 0.005055314731997544, 'WEIGHT_0': 0.4229420569211343, 'WEIGHT_1': 0.5140163936495908, 'WEIGHT_2': 0.37604400417011946, 'WEIGHT_3': 0.7041941862950316, 'WEIGHT_4': 0.9225274178052104, 'WEIGHT_5': 0.5202935001439748, 'WEIGHT_6': 0.9978952768502013, 'WEIGHT_7': 0.38858548508897567, 'WEIGHT_8': 0.9982982741448323, 'optimizer': 'RMSprop'}
49
              precision    recall  f1-score   support

         LOC       0.53      0.50      0.52      1837
        MISC       0.38      0.39      0.38       922
         ORG       0.27      0.23      0.25      1341
         PER       0.28      0.32      0.30      1842

   micro avg       0.37      0.37      0.37      5942
   macro avg       0.36      0.36      0.36      5942
weighted avg       0.37      0.37      0.37      5942

epoch 49
LSTM
  0%|          | 0/50 [00:00<?, ?it/s]  2%|▏         | 1/50 [00:04<04:04,  4.98s/it]  6%|▌         | 3/50 [00:05<01:04,  1.38s/it]  8%|▊         | 4/50 [00:05<00:43,  1.06it/s] 10%|█         | 5/50 [00:05<00:30,  1.47it/s] 12%|█▏        | 6/50 [00:05<00:22,  1.98it/s] 14%|█▍        | 7/50 [00:05<00:16,  2.57it/s] 16%|█▌        | 8/50 [00:05<00:13,  3.22it/s] 18%|█▊        | 9/50 [00:06<00:10,  3.89it/s] 20%|██        | 10/50 [00:06<00:08,  4.53it/s] 22%|██▏       | 11/50 [00:06<00:07,  5.13it/s] 24%|██▍       | 12/50 [00:06<00:06,  5.64it/s] 26%|██▌       | 13/50 [00:06<00:06,  6.06it/s] 28%|██▊       | 14/50 [00:06<00:05,  6.39it/s] 30%|███       | 15/50 [00:06<00:05,  6.64it/s] 32%|███▏      | 16/50 [00:06<00:04,  6.83it/s] 34%|███▍      | 17/50 [00:07<00:04,  6.96it/s] 36%|███▌      | 18/50 [00:07<00:04,  7.06it/s] 38%|███▊      | 19/50 [00:07<00:04,  7.14it/s] 40%|████      | 20/50 [00:07<00:04,  7.18it/s] 42%|████▏     | 21/50 [00:07<00:04,  7.22it/s] 44%|████▍     | 22/50 [00:07<00:03,  7.24it/s] 46%|████▌     | 23/50 [00:07<00:03,  7.25it/s] 48%|████▊     | 24/50 [00:08<00:03,  7.28it/s] 50%|█████     | 25/50 [00:08<00:03,  7.29it/s] 52%|█████▏    | 26/50 [00:08<00:03,  7.29it/s] 54%|█████▍    | 27/50 [00:08<00:03,  7.30it/s] 56%|█████▌    | 28/50 [00:08<00:03,  7.31it/s] 58%|█████▊    | 29/50 [00:08<00:02,  7.30it/s] 60%|██████    | 30/50 [00:08<00:02,  7.31it/s] 62%|██████▏   | 31/50 [00:09<00:02,  7.30it/s] 64%|██████▍   | 32/50 [00:09<00:02,  7.30it/s] 66%|██████▌   | 33/50 [00:09<00:02,  7.30it/s] 68%|██████▊   | 34/50 [00:09<00:02,  7.31it/s] 70%|███████   | 35/50 [00:09<00:02,  7.30it/s] 72%|███████▏  | 36/50 [00:09<00:01,  7.29it/s] 74%|███████▍  | 37/50 [00:09<00:01,  7.31it/s] 76%|███████▌  | 38/50 [00:09<00:01,  7.31it/s] 78%|███████▊  | 39/50 [00:10<00:01,  7.31it/s] 80%|████████  | 40/50 [00:10<00:01,  7.31it/s] 82%|████████▏ | 41/50 [00:10<00:01,  7.32it/s] 84%|████████▍ | 42/50 [00:10<00:01,  7.33it/s] 86%|████████▌ | 43/50 [00:10<00:00,  7.31it/s] 88%|████████▊ | 44/50 [00:10<00:00,  7.31it/s] 90%|█████████ | 45/50 [00:10<00:00,  7.32it/s] 92%|█████████▏| 46/50 [00:11<00:00,  7.30it/s] 94%|█████████▍| 47/50 [00:11<00:00,  7.30it/s] 96%|█████████▌| 48/50 [00:11<00:00,  7.30it/s] 98%|█████████▊| 49/50 [00:11<00:00,  7.30it/s]100%|██████████| 50/50 [00:16<00:00,  1.52s/it]100%|██████████| 50/50 [00:16<00:00,  3.08it/s]
[I 2023-12-11 00:15:46,842] Trial 356 finished with value: 0.024901241534988714 and parameters: {'EMBEDDING_DIM': 950, 'HIDDEN_DIM': 207, 'NUM_LAYERS': 1, 'DROPOUT': 0.01631019915859934, 'LR': 0.0026248686293183043, 'WEIGHT_0': 0.2775778600836862, 'WEIGHT_1': 0.7395343152745226, 'WEIGHT_2': 0.5798775421998322, 'WEIGHT_3': 0.7359960265977618, 'WEIGHT_4': 0.8297093737277846, 'WEIGHT_5': 0.4937210730806927, 'WEIGHT_6': 0.9631385184984436, 'WEIGHT_7': 0.8902674611383099, 'WEIGHT_8': 0.8564652576633909, 'optimizer': 'SGD'}. Best is trial 221 with value: 0.418736930154747.
/userhome/cs2/dingruiw/conda/envs/py310/lib/python3.10/site-packages/torch/nn/modules/rnn.py:82: UserWarning: dropout option adds dropout after all but last recurrent layer, so non-zero dropout expects num_layers greater than 1, but got dropout=0.022881568531596275 and num_layers=1
  warnings.warn("dropout option adds dropout after all but last "
{'EMBEDDING_DIM': 950, 'HIDDEN_DIM': 207, 'NUM_LAYERS': 1, 'DROPOUT': 0.01631019915859934, 'LR': 0.0026248686293183043, 'WEIGHT_0': 0.2775778600836862, 'WEIGHT_1': 0.7395343152745226, 'WEIGHT_2': 0.5798775421998322, 'WEIGHT_3': 0.7359960265977618, 'WEIGHT_4': 0.8297093737277846, 'WEIGHT_5': 0.4937210730806927, 'WEIGHT_6': 0.9631385184984436, 'WEIGHT_7': 0.8902674611383099, 'WEIGHT_8': 0.8564652576633909, 'optimizer': 'SGD'}
0
              precision    recall  f1-score   support

         LOC       0.02      0.07      0.03      1837
        MISC       0.01      0.19      0.02       922
         ORG       0.02      0.08      0.03      1341
         PER       0.01      0.07      0.02      1842

   micro avg       0.02      0.09      0.03      5942
   macro avg       0.02      0.10      0.03      5942
weighted avg       0.02      0.09      0.03      5942

{'EMBEDDING_DIM': 950, 'HIDDEN_DIM': 207, 'NUM_LAYERS': 1, 'DROPOUT': 0.01631019915859934, 'LR': 0.0026248686293183043, 'WEIGHT_0': 0.2775778600836862, 'WEIGHT_1': 0.7395343152745226, 'WEIGHT_2': 0.5798775421998322, 'WEIGHT_3': 0.7359960265977618, 'WEIGHT_4': 0.8297093737277846, 'WEIGHT_5': 0.4937210730806927, 'WEIGHT_6': 0.9631385184984436, 'WEIGHT_7': 0.8902674611383099, 'WEIGHT_8': 0.8564652576633909, 'optimizer': 'SGD'}
49
              precision    recall  f1-score   support

         LOC       0.02      0.04      0.03      1837
        MISC       0.01      0.13      0.02       922
         ORG       0.02      0.05      0.03      1341
         PER       0.01      0.05      0.02      1842

   micro avg       0.02      0.06      0.02      5942
   macro avg       0.02      0.07      0.03      5942
weighted avg       0.02      0.06      0.03      5942

epoch 49
LSTM
  0%|          | 0/50 [00:00<?, ?it/s]  2%|▏         | 1/50 [00:04<04:02,  4.95s/it]  4%|▍         | 2/50 [00:05<01:42,  2.13s/it]  6%|▌         | 3/50 [00:05<01:00,  1.30s/it]  8%|▊         | 4/50 [00:05<00:41,  1.11it/s] 10%|█         | 5/50 [00:06<00:30,  1.46it/s] 12%|█▏        | 6/50 [00:06<00:24,  1.80it/s] 14%|█▍        | 7/50 [00:06<00:20,  2.11it/s] 16%|█▌        | 8/50 [00:06<00:17,  2.38it/s] 18%|█▊        | 9/50 [00:07<00:15,  2.60it/s] 20%|██        | 10/50 [00:07<00:14,  2.78it/s] 22%|██▏       | 11/50 [00:07<00:13,  2.92it/s] 24%|██▍       | 12/50 [00:08<00:12,  3.02it/s] 26%|██▌       | 13/50 [00:08<00:11,  3.09it/s] 28%|██▊       | 14/50 [00:08<00:11,  3.15it/s] 30%|███       | 15/50 [00:09<00:10,  3.19it/s] 32%|███▏      | 16/50 [00:09<00:10,  3.22it/s] 34%|███▍      | 17/50 [00:09<00:10,  3.24it/s] 36%|███▌      | 18/50 [00:09<00:09,  3.25it/s] 38%|███▊      | 19/50 [00:10<00:09,  3.26it/s] 40%|████      | 20/50 [00:10<00:09,  3.27it/s] 42%|████▏     | 21/50 [00:10<00:08,  3.27it/s] 44%|████▍     | 22/50 [00:11<00:08,  3.28it/s] 46%|████▌     | 23/50 [00:11<00:08,  3.28it/s] 48%|████▊     | 24/50 [00:11<00:07,  3.28it/s] 50%|█████     | 25/50 [00:12<00:07,  3.28it/s] 52%|█████▏    | 26/50 [00:12<00:07,  3.28it/s] 54%|█████▍    | 27/50 [00:12<00:07,  3.28it/s] 56%|█████▌    | 28/50 [00:13<00:06,  3.28it/s] 58%|█████▊    | 29/50 [00:13<00:06,  3.28it/s] 60%|██████    | 30/50 [00:13<00:06,  3.28it/s] 62%|██████▏   | 31/50 [00:13<00:05,  3.28it/s] 64%|██████▍   | 32/50 [00:14<00:05,  3.28it/s] 66%|██████▌   | 33/50 [00:14<00:05,  3.28it/s] 68%|██████▊   | 34/50 [00:14<00:04,  3.28it/s] 70%|███████   | 35/50 [00:15<00:04,  3.28it/s] 72%|███████▏  | 36/50 [00:15<00:04,  3.28it/s] 74%|███████▍  | 37/50 [00:15<00:03,  3.28it/s] 76%|███████▌  | 38/50 [00:16<00:03,  3.28it/s] 78%|███████▊  | 39/50 [00:16<00:03,  3.28it/s] 80%|████████  | 40/50 [00:16<00:03,  3.28it/s] 82%|████████▏ | 41/50 [00:16<00:02,  3.28it/s] 84%|████████▍ | 42/50 [00:17<00:02,  3.28it/s] 86%|████████▌ | 43/50 [00:17<00:02,  3.28it/s] 88%|████████▊ | 44/50 [00:17<00:01,  3.28it/s] 90%|█████████ | 45/50 [00:18<00:01,  3.28it/s] 92%|█████████▏| 46/50 [00:18<00:01,  3.28it/s] 94%|█████████▍| 47/50 [00:18<00:00,  3.28it/s] 96%|█████████▌| 48/50 [00:19<00:00,  3.28it/s] 98%|█████████▊| 49/50 [00:19<00:00,  3.28it/s]100%|██████████| 50/50 [00:24<00:00,  1.67s/it]100%|██████████| 50/50 [00:24<00:00,  2.06it/s]
