[I 2023-12-10 22:53:58,617] Trial 185 finished with value: 0.40598326713428545 and parameters: {'EMBEDDING_DIM': 988, 'HIDDEN_DIM': 352, 'NUM_LAYERS': 1, 'DROPOUT': 0.3396351902714364, 'LR': 0.0012439093265006066, 'WEIGHT_0': 0.3858585851576724, 'WEIGHT_1': 0.6728663196888529, 'WEIGHT_2': 0.6505353450208942, 'WEIGHT_3': 0.8159657430631695, 'WEIGHT_4': 0.5922965212529321, 'WEIGHT_5': 0.6100230413018447, 'WEIGHT_6': 0.7841049471533279, 'WEIGHT_7': 0.32751691392337345, 'WEIGHT_8': 0.4921124159899036, 'optimizer': 'RMSprop'}. Best is trial 134 with value: 0.4158467115484205.
/userhome/cs2/dingruiw/conda/envs/py310/lib/python3.10/site-packages/torch/nn/modules/rnn.py:82: UserWarning: dropout option adds dropout after all but last recurrent layer, so non-zero dropout expects num_layers greater than 1, but got dropout=0.3871352745014159 and num_layers=1
  warnings.warn("dropout option adds dropout after all but last "
{'EMBEDDING_DIM': 988, 'HIDDEN_DIM': 352, 'NUM_LAYERS': 1, 'DROPOUT': 0.3396351902714364, 'LR': 0.0012439093265006066, 'WEIGHT_0': 0.3858585851576724, 'WEIGHT_1': 0.6728663196888529, 'WEIGHT_2': 0.6505353450208942, 'WEIGHT_3': 0.8159657430631695, 'WEIGHT_4': 0.5922965212529321, 'WEIGHT_5': 0.6100230413018447, 'WEIGHT_6': 0.7841049471533279, 'WEIGHT_7': 0.32751691392337345, 'WEIGHT_8': 0.4921124159899036, 'optimizer': 'RMSprop'}
0
              precision    recall  f1-score   support

         LOC       0.30      0.11      0.17      1837
        MISC       0.07      0.07      0.07       922
         ORG       0.09      0.04      0.06      1341
         PER       0.06      0.02      0.03      1842

   micro avg       0.13      0.06      0.08      5942
   macro avg       0.13      0.06      0.08      5942
weighted avg       0.14      0.06      0.08      5942

{'EMBEDDING_DIM': 988, 'HIDDEN_DIM': 352, 'NUM_LAYERS': 1, 'DROPOUT': 0.3396351902714364, 'LR': 0.0012439093265006066, 'WEIGHT_0': 0.3858585851576724, 'WEIGHT_1': 0.6728663196888529, 'WEIGHT_2': 0.6505353450208942, 'WEIGHT_3': 0.8159657430631695, 'WEIGHT_4': 0.5922965212529321, 'WEIGHT_5': 0.6100230413018447, 'WEIGHT_6': 0.7841049471533279, 'WEIGHT_7': 0.32751691392337345, 'WEIGHT_8': 0.4921124159899036, 'optimizer': 'RMSprop'}
49
              precision    recall  f1-score   support

         LOC       0.58      0.55      0.56      1837
        MISC       0.42      0.46      0.44       922
         ORG       0.29      0.26      0.27      1341
         PER       0.32      0.34      0.33      1842

   micro avg       0.41      0.40      0.41      5942
   macro avg       0.40      0.40      0.40      5942
weighted avg       0.41      0.40      0.41      5942

epoch 49
LSTM
  0%|          | 0/50 [00:00<?, ?it/s]  2%|▏         | 1/50 [00:04<03:54,  4.79s/it]  4%|▍         | 2/50 [00:04<01:38,  2.06s/it]  6%|▌         | 3/50 [00:05<00:59,  1.26s/it]  8%|▊         | 4/50 [00:05<00:40,  1.15it/s] 10%|█         | 5/50 [00:05<00:29,  1.51it/s] 12%|█▏        | 6/50 [00:06<00:23,  1.88it/s] 14%|█▍        | 7/50 [00:06<00:19,  2.21it/s] 16%|█▌        | 8/50 [00:06<00:16,  2.51it/s] 18%|█▊        | 9/50 [00:06<00:14,  2.75it/s] 20%|██        | 10/50 [00:07<00:13,  2.95it/s] 22%|██▏       | 11/50 [00:07<00:12,  3.10it/s] 24%|██▍       | 12/50 [00:07<00:11,  3.22it/s] 26%|██▌       | 13/50 [00:08<00:11,  3.30it/s] 28%|██▊       | 14/50 [00:08<00:10,  3.37it/s] 30%|███       | 15/50 [00:08<00:10,  3.41it/s] 32%|███▏      | 16/50 [00:08<00:09,  3.44it/s] 34%|███▍      | 17/50 [00:09<00:09,  3.47it/s] 36%|███▌      | 18/50 [00:09<00:09,  3.47it/s] 38%|███▊      | 19/50 [00:09<00:08,  3.49it/s] 40%|████      | 20/50 [00:10<00:08,  3.49it/s] 42%|████▏     | 21/50 [00:10<00:08,  3.50it/s] 44%|████▍     | 22/50 [00:10<00:08,  3.50it/s] 46%|████▌     | 23/50 [00:10<00:07,  3.50it/s] 48%|████▊     | 24/50 [00:11<00:07,  3.50it/s] 50%|█████     | 25/50 [00:11<00:07,  3.51it/s] 52%|█████▏    | 26/50 [00:11<00:06,  3.51it/s] 54%|█████▍    | 27/50 [00:12<00:06,  3.51it/s] 56%|█████▌    | 28/50 [00:12<00:06,  3.50it/s] 58%|█████▊    | 29/50 [00:12<00:05,  3.50it/s] 60%|██████    | 30/50 [00:12<00:05,  3.50it/s] 62%|██████▏   | 31/50 [00:13<00:05,  3.50it/s] 64%|██████▍   | 32/50 [00:13<00:05,  3.50it/s] 66%|██████▌   | 33/50 [00:13<00:04,  3.51it/s] 68%|██████▊   | 34/50 [00:14<00:04,  3.51it/s] 70%|███████   | 35/50 [00:14<00:04,  3.51it/s] 72%|███████▏  | 36/50 [00:14<00:03,  3.51it/s] 74%|███████▍  | 37/50 [00:14<00:03,  3.51it/s] 76%|███████▌  | 38/50 [00:15<00:03,  3.50it/s] 78%|███████▊  | 39/50 [00:15<00:03,  3.50it/s] 80%|████████  | 40/50 [00:15<00:02,  3.50it/s] 82%|████████▏ | 41/50 [00:16<00:02,  3.50it/s] 84%|████████▍ | 42/50 [00:16<00:02,  3.50it/s] 86%|████████▌ | 43/50 [00:16<00:02,  3.50it/s] 88%|████████▊ | 44/50 [00:16<00:01,  3.50it/s] 90%|█████████ | 45/50 [00:17<00:01,  3.50it/s] 92%|█████████▏| 46/50 [00:17<00:01,  3.50it/s] 94%|█████████▍| 47/50 [00:17<00:00,  3.50it/s] 96%|█████████▌| 48/50 [00:18<00:00,  3.50it/s] 98%|█████████▊| 49/50 [00:18<00:00,  3.50it/s]100%|██████████| 50/50 [00:23<00:00,  1.73s/it]100%|██████████| 50/50 [00:23<00:00,  2.13it/s]
[I 2023-12-10 22:54:26,332] Trial 186 finished with value: 0.4072285143237842 and parameters: {'EMBEDDING_DIM': 956, 'HIDDEN_DIM': 432, 'NUM_LAYERS': 1, 'DROPOUT': 0.3871352745014159, 'LR': 0.0009472010568920114, 'WEIGHT_0': 0.28841965727699265, 'WEIGHT_1': 0.7597433040838213, 'WEIGHT_2': 0.5451431194065558, 'WEIGHT_3': 0.7350369372252193, 'WEIGHT_4': 0.934511094437624, 'WEIGHT_5': 0.7325071780349806, 'WEIGHT_6': 0.7340199101682051, 'WEIGHT_7': 0.21077008842256584, 'WEIGHT_8': 0.5500440123861761, 'optimizer': 'RMSprop'}. Best is trial 134 with value: 0.4158467115484205.
/userhome/cs2/dingruiw/conda/envs/py310/lib/python3.10/site-packages/torch/nn/modules/rnn.py:82: UserWarning: dropout option adds dropout after all but last recurrent layer, so non-zero dropout expects num_layers greater than 1, but got dropout=0.352599773108623 and num_layers=1
  warnings.warn("dropout option adds dropout after all but last "
{'EMBEDDING_DIM': 956, 'HIDDEN_DIM': 432, 'NUM_LAYERS': 1, 'DROPOUT': 0.3871352745014159, 'LR': 0.0009472010568920114, 'WEIGHT_0': 0.28841965727699265, 'WEIGHT_1': 0.7597433040838213, 'WEIGHT_2': 0.5451431194065558, 'WEIGHT_3': 0.7350369372252193, 'WEIGHT_4': 0.934511094437624, 'WEIGHT_5': 0.7325071780349806, 'WEIGHT_6': 0.7340199101682051, 'WEIGHT_7': 0.21077008842256584, 'WEIGHT_8': 0.5500440123861761, 'optimizer': 'RMSprop'}
0
              precision    recall  f1-score   support

         LOC       0.18      0.29      0.22      1837
        MISC       0.04      0.03      0.03       922
         ORG       0.07      0.03      0.04      1341
         PER       0.04      0.04      0.04      1842

   micro avg       0.12      0.11      0.12      5942
   macro avg       0.09      0.10      0.09      5942
weighted avg       0.09      0.11      0.10      5942

{'EMBEDDING_DIM': 956, 'HIDDEN_DIM': 432, 'NUM_LAYERS': 1, 'DROPOUT': 0.3871352745014159, 'LR': 0.0009472010568920114, 'WEIGHT_0': 0.28841965727699265, 'WEIGHT_1': 0.7597433040838213, 'WEIGHT_2': 0.5451431194065558, 'WEIGHT_3': 0.7350369372252193, 'WEIGHT_4': 0.934511094437624, 'WEIGHT_5': 0.7325071780349806, 'WEIGHT_6': 0.7340199101682051, 'WEIGHT_7': 0.21077008842256584, 'WEIGHT_8': 0.5500440123861761, 'optimizer': 'RMSprop'}
49
              precision    recall  f1-score   support

         LOC       0.53      0.55      0.54      1837
        MISC       0.46      0.44      0.45       922
         ORG       0.30      0.26      0.28      1341
         PER       0.32      0.37      0.34      1842

   micro avg       0.40      0.41      0.41      5942
   macro avg       0.40      0.40      0.40      5942
weighted avg       0.40      0.41      0.41      5942

epoch 49
LSTM
  0%|          | 0/50 [00:00<?, ?it/s]  2%|▏         | 1/50 [00:05<04:08,  5.06s/it]  4%|▍         | 2/50 [00:05<01:47,  2.23s/it]  6%|▌         | 3/50 [00:05<01:07,  1.45s/it]  8%|▊         | 4/50 [00:06<00:49,  1.08s/it] 10%|█         | 5/50 [00:06<00:39,  1.14it/s] 12%|█▏        | 6/50 [00:07<00:33,  1.33it/s] 14%|█▍        | 7/50 [00:07<00:28,  1.48it/s] 16%|█▌        | 8/50 [00:08<00:26,  1.60it/s] 18%|█▊        | 9/50 [00:08<00:24,  1.70it/s] 20%|██        | 10/50 [00:09<00:22,  1.77it/s] 22%|██▏       | 11/50 [00:09<00:21,  1.82it/s] 24%|██▍       | 12/50 [00:10<00:20,  1.85it/s] 26%|██▌       | 13/50 [00:10<00:19,  1.88it/s] 28%|██▊       | 14/50 [00:11<00:18,  1.90it/s] 30%|███       | 15/50 [00:12<00:18,  1.91it/s] 32%|███▏      | 16/50 [00:12<00:17,  1.92it/s] 34%|███▍      | 17/50 [00:13<00:17,  1.92it/s] 36%|███▌      | 18/50 [00:13<00:16,  1.93it/s] 38%|███▊      | 19/50 [00:14<00:16,  1.93it/s] 40%|████      | 20/50 [00:14<00:15,  1.93it/s] 42%|████▏     | 21/50 [00:15<00:15,  1.93it/s] 44%|████▍     | 22/50 [00:15<00:14,  1.93it/s] 46%|████▌     | 23/50 [00:16<00:13,  1.93it/s] 48%|████▊     | 24/50 [00:16<00:13,  1.93it/s] 50%|█████     | 25/50 [00:17<00:12,  1.93it/s] 52%|█████▏    | 26/50 [00:17<00:12,  1.93it/s] 54%|█████▍    | 27/50 [00:18<00:11,  1.93it/s] 56%|█████▌    | 28/50 [00:18<00:11,  1.93it/s] 58%|█████▊    | 29/50 [00:19<00:10,  1.93it/s] 60%|██████    | 30/50 [00:19<00:10,  1.93it/s] 62%|██████▏   | 31/50 [00:20<00:09,  1.93it/s] 64%|██████▍   | 32/50 [00:20<00:09,  1.93it/s] 66%|██████▌   | 33/50 [00:21<00:08,  1.92it/s] 68%|██████▊   | 34/50 [00:21<00:08,  1.92it/s] 70%|███████   | 35/50 [00:22<00:07,  1.92it/s] 72%|███████▏  | 36/50 [00:22<00:07,  1.91it/s] 74%|███████▍  | 37/50 [00:23<00:06,  1.91it/s] 76%|███████▌  | 38/50 [00:23<00:06,  1.91it/s] 78%|███████▊  | 39/50 [00:24<00:05,  1.91it/s] 80%|████████  | 40/50 [00:24<00:05,  1.91it/s] 82%|████████▏ | 41/50 [00:25<00:04,  1.91it/s] 84%|████████▍ | 42/50 [00:26<00:04,  1.91it/s] 86%|████████▌ | 43/50 [00:26<00:03,  1.90it/s] 88%|████████▊ | 44/50 [00:27<00:03,  1.90it/s] 90%|█████████ | 45/50 [00:27<00:02,  1.90it/s] 92%|█████████▏| 46/50 [00:28<00:02,  1.90it/s] 94%|█████████▍| 47/50 [00:28<00:01,  1.90it/s] 96%|█████████▌| 48/50 [00:29<00:01,  1.90it/s] 98%|█████████▊| 49/50 [00:29<00:00,  1.90it/s]100%|██████████| 50/50 [00:35<00:00,  1.95s/it]100%|██████████| 50/50 [00:35<00:00,  1.43it/s]
[I 2023-12-10 22:55:05,690] Trial 187 finished with value: 0.39230769230769225 and parameters: {'EMBEDDING_DIM': 975, 'HIDDEN_DIM': 748, 'NUM_LAYERS': 1, 'DROPOUT': 0.352599773108623, 'LR': 0.001723382462507025, 'WEIGHT_0': 0.3610035923822392, 'WEIGHT_1': 0.7012209796284639, 'WEIGHT_2': 0.5730640776244547, 'WEIGHT_3': 0.7977552890463692, 'WEIGHT_4': 0.6603821396231422, 'WEIGHT_5': 0.5378917969771587, 'WEIGHT_6': 0.6587982813882225, 'WEIGHT_7': 0.3845908014455972, 'WEIGHT_8': 0.5192320693758968, 'optimizer': 'RMSprop'}. Best is trial 134 with value: 0.4158467115484205.
/userhome/cs2/dingruiw/conda/envs/py310/lib/python3.10/site-packages/torch/nn/modules/rnn.py:82: UserWarning: dropout option adds dropout after all but last recurrent layer, so non-zero dropout expects num_layers greater than 1, but got dropout=0.37516494557797253 and num_layers=1
  warnings.warn("dropout option adds dropout after all but last "
{'EMBEDDING_DIM': 975, 'HIDDEN_DIM': 748, 'NUM_LAYERS': 1, 'DROPOUT': 0.352599773108623, 'LR': 0.001723382462507025, 'WEIGHT_0': 0.3610035923822392, 'WEIGHT_1': 0.7012209796284639, 'WEIGHT_2': 0.5730640776244547, 'WEIGHT_3': 0.7977552890463692, 'WEIGHT_4': 0.6603821396231422, 'WEIGHT_5': 0.5378917969771587, 'WEIGHT_6': 0.6587982813882225, 'WEIGHT_7': 0.3845908014455972, 'WEIGHT_8': 0.5192320693758968, 'optimizer': 'RMSprop'}
0
              precision    recall  f1-score   support

         LOC       0.09      0.04      0.06      1837
        MISC       0.03      0.04      0.04       922
         ORG       0.08      0.02      0.04      1341
         PER       0.03      0.01      0.02      1842

   micro avg       0.06      0.03      0.04      5942
   macro avg       0.06      0.03      0.04      5942
weighted avg       0.06      0.03      0.04      5942

{'EMBEDDING_DIM': 975, 'HIDDEN_DIM': 748, 'NUM_LAYERS': 1, 'DROPOUT': 0.352599773108623, 'LR': 0.001723382462507025, 'WEIGHT_0': 0.3610035923822392, 'WEIGHT_1': 0.7012209796284639, 'WEIGHT_2': 0.5730640776244547, 'WEIGHT_3': 0.7977552890463692, 'WEIGHT_4': 0.6603821396231422, 'WEIGHT_5': 0.5378917969771587, 'WEIGHT_6': 0.6587982813882225, 'WEIGHT_7': 0.3845908014455972, 'WEIGHT_8': 0.5192320693758968, 'optimizer': 'RMSprop'}
49
              precision    recall  f1-score   support

         LOC       0.58      0.52      0.55      1837
        MISC       0.44      0.41      0.42       922
         ORG       0.32      0.27      0.29      1341
         PER       0.30      0.30      0.30      1842

   micro avg       0.41      0.38      0.39      5942
   macro avg       0.41      0.37      0.39      5942
weighted avg       0.41      0.38      0.39      5942

epoch 49
LSTM
  0%|          | 0/50 [00:00<?, ?it/s]  2%|▏         | 1/50 [00:04<03:52,  4.74s/it]  4%|▍         | 2/50 [00:04<01:37,  2.02s/it]  6%|▌         | 3/50 [00:05<00:56,  1.21s/it]  8%|▊         | 4/50 [00:05<00:37,  1.23it/s] 10%|█         | 5/50 [00:05<00:26,  1.67it/s] 12%|█▏        | 6/50 [00:05<00:20,  2.13it/s] 14%|█▍        | 7/50 [00:05<00:16,  2.60it/s] 16%|█▌        | 8/50 [00:06<00:13,  3.02it/s] 18%|█▊        | 9/50 [00:06<00:12,  3.39it/s] 20%|██        | 10/50 [00:06<00:10,  3.70it/s] 22%|██▏       | 11/50 [00:06<00:09,  3.94it/s] 24%|██▍       | 12/50 [00:07<00:09,  4.14it/s] 26%|██▌       | 13/50 [00:07<00:08,  4.28it/s] 28%|██▊       | 14/50 [00:07<00:08,  4.38it/s] 30%|███       | 15/50 [00:07<00:07,  4.46it/s] 32%|███▏      | 16/50 [00:07<00:07,  4.51it/s] 34%|███▍      | 17/50 [00:08<00:07,  4.55it/s] 36%|███▌      | 18/50 [00:08<00:06,  4.58it/s] 38%|███▊      | 19/50 [00:08<00:06,  4.60it/s] 40%|████      | 20/50 [00:08<00:06,  4.61it/s] 42%|████▏     | 21/50 [00:08<00:06,  4.62it/s] 44%|████▍     | 22/50 [00:09<00:06,  4.62it/s] 46%|████▌     | 23/50 [00:09<00:05,  4.62it/s] 48%|████▊     | 24/50 [00:09<00:05,  4.62it/s] 50%|█████     | 25/50 [00:09<00:05,  4.63it/s] 52%|█████▏    | 26/50 [00:10<00:05,  4.63it/s] 54%|█████▍    | 27/50 [00:10<00:04,  4.63it/s] 56%|█████▌    | 28/50 [00:10<00:04,  4.63it/s] 58%|█████▊    | 29/50 [00:10<00:04,  4.63it/s] 60%|██████    | 30/50 [00:10<00:04,  4.63it/s] 62%|██████▏   | 31/50 [00:11<00:04,  4.63it/s] 64%|██████▍   | 32/50 [00:11<00:03,  4.63it/s] 66%|██████▌   | 33/50 [00:11<00:03,  4.63it/s] 68%|██████▊   | 34/50 [00:11<00:03,  4.63it/s] 70%|███████   | 35/50 [00:11<00:03,  4.62it/s] 72%|███████▏  | 36/50 [00:12<00:03,  4.62it/s] 74%|███████▍  | 37/50 [00:12<00:02,  4.62it/s] 76%|███████▌  | 38/50 [00:12<00:02,  4.62it/s] 78%|███████▊  | 39/50 [00:12<00:02,  4.60it/s] 80%|████████  | 40/50 [00:13<00:02,  4.60it/s] 82%|████████▏ | 41/50 [00:13<00:01,  4.61it/s] 84%|████████▍ | 42/50 [00:13<00:01,  4.59it/s] 86%|████████▌ | 43/50 [00:13<00:01,  4.59it/s] 88%|████████▊ | 44/50 [00:13<00:01,  4.60it/s] 90%|█████████ | 45/50 [00:14<00:01,  4.57it/s] 92%|█████████▏| 46/50 [00:14<00:00,  4.59it/s] 94%|█████████▍| 47/50 [00:14<00:00,  4.59it/s] 96%|█████████▌| 48/50 [00:14<00:00,  4.59it/s] 98%|█████████▊| 49/50 [00:15<00:00,  4.58it/s]100%|██████████| 50/50 [00:19<00:00,  1.62s/it]100%|██████████| 50/50 [00:19<00:00,  2.51it/s]
[I 2023-12-10 22:55:29,936] Trial 188 finished with value: 0.394169835234474 and parameters: {'EMBEDDING_DIM': 1024, 'HIDDEN_DIM': 300, 'NUM_LAYERS': 1, 'DROPOUT': 0.37516494557797253, 'LR': 0.00364390253246721, 'WEIGHT_0': 0.41314010036687515, 'WEIGHT_1': 0.8034891479815148, 'WEIGHT_2': 0.48893179384715435, 'WEIGHT_3': 0.8866709505744718, 'WEIGHT_4': 0.7841339951780015, 'WEIGHT_5': 0.561709934698861, 'WEIGHT_6': 0.8012235872113617, 'WEIGHT_7': 0.3401586352575333, 'WEIGHT_8': 0.4704560172949555, 'optimizer': 'Adam'}. Best is trial 134 with value: 0.4158467115484205.
/userhome/cs2/dingruiw/conda/envs/py310/lib/python3.10/site-packages/torch/nn/modules/rnn.py:82: UserWarning: dropout option adds dropout after all but last recurrent layer, so non-zero dropout expects num_layers greater than 1, but got dropout=0.3304913495894606 and num_layers=1
  warnings.warn("dropout option adds dropout after all but last "
{'EMBEDDING_DIM': 1024, 'HIDDEN_DIM': 300, 'NUM_LAYERS': 1, 'DROPOUT': 0.37516494557797253, 'LR': 0.00364390253246721, 'WEIGHT_0': 0.41314010036687515, 'WEIGHT_1': 0.8034891479815148, 'WEIGHT_2': 0.48893179384715435, 'WEIGHT_3': 0.8866709505744718, 'WEIGHT_4': 0.7841339951780015, 'WEIGHT_5': 0.561709934698861, 'WEIGHT_6': 0.8012235872113617, 'WEIGHT_7': 0.3401586352575333, 'WEIGHT_8': 0.4704560172949555, 'optimizer': 'Adam'}
0
              precision    recall  f1-score   support

         LOC       0.08      0.04      0.05      1837
        MISC       0.03      0.06      0.04       922
         ORG       0.05      0.02      0.03      1341
         PER       0.05      0.03      0.04      1842

   micro avg       0.05      0.03      0.04      5942
   macro avg       0.05      0.04      0.04      5942
weighted avg       0.06      0.03      0.04      5942

{'EMBEDDING_DIM': 1024, 'HIDDEN_DIM': 300, 'NUM_LAYERS': 1, 'DROPOUT': 0.37516494557797253, 'LR': 0.00364390253246721, 'WEIGHT_0': 0.41314010036687515, 'WEIGHT_1': 0.8034891479815148, 'WEIGHT_2': 0.48893179384715435, 'WEIGHT_3': 0.8866709505744718, 'WEIGHT_4': 0.7841339951780015, 'WEIGHT_5': 0.561709934698861, 'WEIGHT_6': 0.8012235872113617, 'WEIGHT_7': 0.3401586352575333, 'WEIGHT_8': 0.4704560172949555, 'optimizer': 'Adam'}
49
              precision    recall  f1-score   support

         LOC       0.52      0.55      0.54      1837
        MISC       0.40      0.41      0.40       922
         ORG       0.28      0.29      0.28      1341
         PER       0.30      0.38      0.34      1842

   micro avg       0.37      0.42      0.39      5942
   macro avg       0.37      0.41      0.39      5942
weighted avg       0.38      0.42      0.40      5942

epoch 49
LSTM
  0%|          | 0/50 [00:00<?, ?it/s]  2%|▏         | 1/50 [00:04<03:58,  4.87s/it]  6%|▌         | 3/50 [00:05<01:03,  1.35s/it]  8%|▊         | 4/50 [00:05<00:42,  1.07it/s] 10%|█         | 5/50 [00:05<00:30,  1.48it/s] 12%|█▏        | 6/50 [00:05<00:22,  1.98it/s] 14%|█▍        | 7/50 [00:05<00:16,  2.55it/s] 16%|█▌        | 8/50 [00:05<00:13,  3.16it/s] 18%|█▊        | 9/50 [00:05<00:10,  3.78it/s] 20%|██        | 10/50 [00:06<00:09,  4.37it/s] 22%|██▏       | 11/50 [00:06<00:07,  4.90it/s] 24%|██▍       | 12/50 [00:06<00:07,  5.35it/s] 26%|██▌       | 13/50 [00:06<00:06,  5.71it/s] 28%|██▊       | 14/50 [00:06<00:06,  6.00it/s] 30%|███       | 15/50 [00:06<00:05,  6.21it/s] 32%|███▏      | 16/50 [00:07<00:05,  6.38it/s] 34%|███▍      | 17/50 [00:07<00:05,  6.49it/s] 36%|███▌      | 18/50 [00:07<00:04,  6.58it/s] 38%|███▊      | 19/50 [00:07<00:04,  6.64it/s] 40%|████      | 20/50 [00:07<00:04,  6.69it/s] 42%|████▏     | 21/50 [00:07<00:04,  6.72it/s] 44%|████▍     | 22/50 [00:07<00:04,  6.74it/s] 46%|████▌     | 23/50 [00:08<00:04,  6.75it/s] 48%|████▊     | 24/50 [00:08<00:03,  6.76it/s] 50%|█████     | 25/50 [00:08<00:03,  6.77it/s] 52%|█████▏    | 26/50 [00:08<00:03,  6.77it/s] 54%|█████▍    | 27/50 [00:08<00:03,  6.77it/s] 56%|█████▌    | 28/50 [00:08<00:03,  6.77it/s] 58%|█████▊    | 29/50 [00:08<00:03,  6.78it/s] 60%|██████    | 30/50 [00:09<00:02,  6.78it/s] 62%|██████▏   | 31/50 [00:09<00:02,  6.77it/s] 64%|██████▍   | 32/50 [00:09<00:02,  6.77it/s] 66%|██████▌   | 33/50 [00:09<00:02,  6.77it/s] 68%|██████▊   | 34/50 [00:09<00:02,  6.76it/s] 70%|███████   | 35/50 [00:09<00:02,  6.77it/s] 72%|███████▏  | 36/50 [00:09<00:02,  6.77it/s] 74%|███████▍  | 37/50 [00:10<00:01,  6.78it/s] 76%|███████▌  | 38/50 [00:10<00:01,  6.77it/s] 78%|███████▊  | 39/50 [00:10<00:01,  6.77it/s] 80%|████████  | 40/50 [00:10<00:01,  6.78it/s] 82%|████████▏ | 41/50 [00:10<00:01,  6.77it/s] 84%|████████▍ | 42/50 [00:10<00:01,  6.77it/s] 86%|████████▌ | 43/50 [00:11<00:01,  6.77it/s] 88%|████████▊ | 44/50 [00:11<00:00,  6.77it/s] 90%|█████████ | 45/50 [00:11<00:00,  6.76it/s] 92%|█████████▏| 46/50 [00:11<00:00,  6.77it/s] 94%|█████████▍| 47/50 [00:11<00:00,  6.77it/s] 96%|█████████▌| 48/50 [00:11<00:00,  6.76it/s] 98%|█████████▊| 49/50 [00:11<00:00,  6.77it/s]100%|██████████| 50/50 [00:16<00:00,  1.55s/it]100%|██████████| 50/50 [00:16<00:00,  2.99it/s]
