[I 2023-12-10 21:18:52,750] Trial 25 finished with value: 0.0 and parameters: {'EMBEDDING_DIM': 724, 'HIDDEN_DIM': 559, 'NUM_LAYERS': 2, 'DROPOUT': 0.3172169011966534, 'LR': 0.003264742745145756, 'WEIGHT_0': 0.7348003761558697, 'WEIGHT_1': 0.5921339589472046, 'WEIGHT_2': 0.5099583214719816, 'WEIGHT_3': 0.777412852162449, 'WEIGHT_4': 0.8183975774040833, 'WEIGHT_5': 0.9909813166608246, 'WEIGHT_6': 0.8042712034726809, 'WEIGHT_7': 0.2289545417497235, 'WEIGHT_8': 0.6711522496138932, 'optimizer': 'SGD'}. Best is trial 19 with value: 0.3947319948425124.
/userhome/cs2/dingruiw/conda/envs/py310/lib/python3.10/site-packages/torch/nn/modules/rnn.py:82: UserWarning: dropout option adds dropout after all but last recurrent layer, so non-zero dropout expects num_layers greater than 1, but got dropout=0.38346955185763504 and num_layers=1
  warnings.warn("dropout option adds dropout after all but last "
{'EMBEDDING_DIM': 724, 'HIDDEN_DIM': 559, 'NUM_LAYERS': 2, 'DROPOUT': 0.3172169011966534, 'LR': 0.003264742745145756, 'WEIGHT_0': 0.7348003761558697, 'WEIGHT_1': 0.5921339589472046, 'WEIGHT_2': 0.5099583214719816, 'WEIGHT_3': 0.777412852162449, 'WEIGHT_4': 0.8183975774040833, 'WEIGHT_5': 0.9909813166608246, 'WEIGHT_6': 0.8042712034726809, 'WEIGHT_7': 0.2289545417497235, 'WEIGHT_8': 0.6711522496138932, 'optimizer': 'SGD'}
0
              precision    recall  f1-score   support

         LOC       0.03      0.11      0.05      1837
        MISC       0.01      0.01      0.01       922
         ORG       0.02      0.09      0.03      1341
         PER       0.02      0.07      0.03      1842

   micro avg       0.02      0.08      0.03      5942
   macro avg       0.02      0.07      0.03      5942
weighted avg       0.02      0.08      0.03      5942

{'EMBEDDING_DIM': 724, 'HIDDEN_DIM': 559, 'NUM_LAYERS': 2, 'DROPOUT': 0.3172169011966534, 'LR': 0.003264742745145756, 'WEIGHT_0': 0.7348003761558697, 'WEIGHT_1': 0.5921339589472046, 'WEIGHT_2': 0.5099583214719816, 'WEIGHT_3': 0.777412852162449, 'WEIGHT_4': 0.8183975774040833, 'WEIGHT_5': 0.9909813166608246, 'WEIGHT_6': 0.8042712034726809, 'WEIGHT_7': 0.2289545417497235, 'WEIGHT_8': 0.6711522496138932, 'optimizer': 'SGD'}
49
              precision    recall  f1-score   support

         LOC       0.00      0.00      0.00      1837
        MISC       0.00      0.00      0.00       922
         ORG       0.00      0.00      0.00      1341
         PER       0.00      0.00      0.00      1842

   micro avg       0.00      0.00      0.00      5942
   macro avg       0.00      0.00      0.00      5942
weighted avg       0.00      0.00      0.00      5942

epoch 49
LSTM
  0%|          | 0/50 [00:00<?, ?it/s]  2%|▏         | 1/50 [00:04<03:53,  4.77s/it]  4%|▍         | 2/50 [00:04<01:38,  2.06s/it]  6%|▌         | 3/50 [00:05<00:59,  1.26s/it]  8%|▊         | 4/50 [00:05<00:40,  1.13it/s] 10%|█         | 5/50 [00:05<00:30,  1.49it/s] 12%|█▏        | 6/50 [00:06<00:24,  1.83it/s] 14%|█▍        | 7/50 [00:06<00:20,  2.14it/s] 16%|█▌        | 8/50 [00:06<00:17,  2.40it/s] 18%|█▊        | 9/50 [00:07<00:15,  2.62it/s] 20%|██        | 10/50 [00:07<00:14,  2.80it/s] 22%|██▏       | 11/50 [00:07<00:13,  2.93it/s] 24%|██▍       | 12/50 [00:07<00:12,  3.04it/s] 26%|██▌       | 13/50 [00:08<00:11,  3.11it/s] 28%|██▊       | 14/50 [00:08<00:11,  3.16it/s] 30%|███       | 15/50 [00:08<00:10,  3.20it/s] 32%|███▏      | 16/50 [00:09<00:10,  3.22it/s] 34%|███▍      | 17/50 [00:09<00:10,  3.24it/s] 36%|███▌      | 18/50 [00:09<00:09,  3.25it/s] 38%|███▊      | 19/50 [00:10<00:09,  3.26it/s] 40%|████      | 20/50 [00:10<00:09,  3.27it/s] 42%|████▏     | 21/50 [00:10<00:08,  3.27it/s] 44%|████▍     | 22/50 [00:11<00:08,  3.28it/s] 46%|████▌     | 23/50 [00:11<00:08,  3.27it/s] 48%|████▊     | 24/50 [00:11<00:07,  3.27it/s] 50%|█████     | 25/50 [00:11<00:07,  3.28it/s] 52%|█████▏    | 26/50 [00:12<00:07,  3.27it/s] 54%|█████▍    | 27/50 [00:12<00:07,  3.27it/s] 56%|█████▌    | 28/50 [00:12<00:06,  3.28it/s] 58%|█████▊    | 29/50 [00:13<00:06,  3.29it/s] 60%|██████    | 30/50 [00:13<00:06,  3.28it/s] 62%|██████▏   | 31/50 [00:13<00:05,  3.27it/s] 64%|██████▍   | 32/50 [00:14<00:05,  3.27it/s] 66%|██████▌   | 33/50 [00:14<00:05,  3.26it/s] 68%|██████▊   | 34/50 [00:14<00:04,  3.27it/s] 70%|███████   | 35/50 [00:14<00:04,  3.26it/s] 72%|███████▏  | 36/50 [00:15<00:04,  3.27it/s] 74%|███████▍  | 37/50 [00:15<00:03,  3.28it/s] 76%|███████▌  | 38/50 [00:15<00:03,  3.27it/s] 78%|███████▊  | 39/50 [00:16<00:03,  3.26it/s] 80%|████████  | 40/50 [00:16<00:03,  3.26it/s] 82%|████████▏ | 41/50 [00:16<00:02,  3.25it/s] 84%|████████▍ | 42/50 [00:17<00:02,  3.26it/s] 86%|████████▌ | 43/50 [00:17<00:02,  3.28it/s] 88%|████████▊ | 44/50 [00:17<00:01,  3.28it/s] 90%|█████████ | 45/50 [00:18<00:01,  3.26it/s] 92%|█████████▏| 46/50 [00:18<00:01,  3.25it/s] 94%|█████████▍| 47/50 [00:18<00:00,  3.25it/s] 96%|█████████▌| 48/50 [00:18<00:00,  3.26it/s] 98%|█████████▊| 49/50 [00:19<00:00,  3.26it/s]100%|██████████| 50/50 [00:24<00:00,  1.71s/it]100%|██████████| 50/50 [00:24<00:00,  2.06it/s]
[I 2023-12-10 21:19:21,255] Trial 26 finished with value: 0.4051425745838141 and parameters: {'EMBEDDING_DIM': 960, 'HIDDEN_DIM': 451, 'NUM_LAYERS': 1, 'DROPOUT': 0.38346955185763504, 'LR': 0.0026142560131294968, 'WEIGHT_0': 0.563542646188527, 'WEIGHT_1': 0.6560438660024637, 'WEIGHT_2': 0.6224219657403066, 'WEIGHT_3': 0.9222568487106801, 'WEIGHT_4': 0.873446791162657, 'WEIGHT_5': 0.804471697771726, 'WEIGHT_6': 0.9292209899003796, 'WEIGHT_7': 0.46055944321405273, 'WEIGHT_8': 0.6101836251976028, 'optimizer': 'Adam'}. Best is trial 26 with value: 0.4051425745838141.
{'EMBEDDING_DIM': 960, 'HIDDEN_DIM': 451, 'NUM_LAYERS': 1, 'DROPOUT': 0.38346955185763504, 'LR': 0.0026142560131294968, 'WEIGHT_0': 0.563542646188527, 'WEIGHT_1': 0.6560438660024637, 'WEIGHT_2': 0.6224219657403066, 'WEIGHT_3': 0.9222568487106801, 'WEIGHT_4': 0.873446791162657, 'WEIGHT_5': 0.804471697771726, 'WEIGHT_6': 0.9292209899003796, 'WEIGHT_7': 0.46055944321405273, 'WEIGHT_8': 0.6101836251976028, 'optimizer': 'Adam'}
0
              precision    recall  f1-score   support

         LOC       0.06      0.03      0.04      1837
        MISC       0.03      0.02      0.03       922
         ORG       0.04      0.03      0.04      1341
         PER       0.03      0.03      0.03      1842

   micro avg       0.04      0.03      0.03      5942
   macro avg       0.04      0.03      0.03      5942
weighted avg       0.04      0.03      0.03      5942

{'EMBEDDING_DIM': 960, 'HIDDEN_DIM': 451, 'NUM_LAYERS': 1, 'DROPOUT': 0.38346955185763504, 'LR': 0.0026142560131294968, 'WEIGHT_0': 0.563542646188527, 'WEIGHT_1': 0.6560438660024637, 'WEIGHT_2': 0.6224219657403066, 'WEIGHT_3': 0.9222568487106801, 'WEIGHT_4': 0.873446791162657, 'WEIGHT_5': 0.804471697771726, 'WEIGHT_6': 0.9292209899003796, 'WEIGHT_7': 0.46055944321405273, 'WEIGHT_8': 0.6101836251976028, 'optimizer': 'Adam'}
49
              precision    recall  f1-score   support

         LOC       0.57      0.56      0.56      1837
        MISC       0.42      0.43      0.43       922
         ORG       0.25      0.27      0.26      1341
         PER       0.33      0.36      0.35      1842

   micro avg       0.40      0.41      0.41      5942
   macro avg       0.39      0.41      0.40      5942
weighted avg       0.40      0.41      0.41      5942

epoch 49
LSTM
  0%|          | 0/50 [00:00<?, ?it/s]  2%|▏         | 1/50 [00:05<04:36,  5.64s/it]  4%|▍         | 2/50 [00:05<01:56,  2.42s/it]  6%|▌         | 3/50 [00:06<01:12,  1.54s/it]  8%|▊         | 4/50 [00:06<00:51,  1.13s/it] 10%|█         | 5/50 [00:07<00:40,  1.11it/s] 12%|█▏        | 6/50 [00:07<00:33,  1.32it/s] 14%|█▍        | 7/50 [00:08<00:28,  1.49it/s] 16%|█▌        | 8/50 [00:08<00:25,  1.63it/s] 18%|█▊        | 9/50 [00:09<00:23,  1.73it/s] 20%|██        | 10/50 [00:09<00:22,  1.81it/s] 22%|██▏       | 11/50 [00:10<00:20,  1.87it/s] 24%|██▍       | 12/50 [00:10<00:19,  1.92it/s] 26%|██▌       | 13/50 [00:11<00:18,  1.95it/s] 28%|██▊       | 14/50 [00:11<00:18,  1.97it/s] 30%|███       | 15/50 [00:12<00:17,  1.99it/s] 32%|███▏      | 16/50 [00:12<00:17,  2.00it/s] 34%|███▍      | 17/50 [00:13<00:16,  2.00it/s] 36%|███▌      | 18/50 [00:13<00:15,  2.01it/s] 38%|███▊      | 19/50 [00:14<00:15,  2.02it/s] 40%|████      | 20/50 [00:14<00:14,  2.01it/s] 42%|████▏     | 21/50 [00:15<00:14,  2.01it/s] 44%|████▍     | 22/50 [00:15<00:13,  2.01it/s] 46%|████▌     | 23/50 [00:16<00:13,  1.99it/s] 48%|████▊     | 24/50 [00:16<00:12,  2.02it/s] 50%|█████     | 25/50 [00:17<00:12,  2.02it/s] 52%|█████▏    | 26/50 [00:17<00:11,  2.02it/s] 54%|█████▍    | 27/50 [00:18<00:11,  2.01it/s] 56%|█████▌    | 28/50 [00:18<00:10,  2.01it/s] 58%|█████▊    | 29/50 [00:19<00:10,  2.01it/s] 60%|██████    | 30/50 [00:19<00:09,  2.01it/s] 62%|██████▏   | 31/50 [00:20<00:09,  2.02it/s] 64%|██████▍   | 32/50 [00:20<00:08,  2.02it/s] 66%|██████▌   | 33/50 [00:21<00:08,  2.01it/s] 68%|██████▊   | 34/50 [00:21<00:07,  2.01it/s] 70%|███████   | 35/50 [00:22<00:07,  2.02it/s] 72%|███████▏  | 36/50 [00:22<00:06,  2.02it/s] 74%|███████▍  | 37/50 [00:23<00:06,  2.02it/s] 76%|███████▌  | 38/50 [00:23<00:05,  2.02it/s] 78%|███████▊  | 39/50 [00:24<00:05,  2.01it/s] 80%|████████  | 40/50 [00:24<00:04,  2.01it/s] 82%|████████▏ | 41/50 [00:25<00:04,  2.01it/s] 84%|████████▍ | 42/50 [00:25<00:03,  2.01it/s] 86%|████████▌ | 43/50 [00:26<00:03,  2.01it/s] 88%|████████▊ | 44/50 [00:26<00:02,  2.01it/s] 90%|█████████ | 45/50 [00:27<00:02,  2.01it/s] 92%|█████████▏| 46/50 [00:27<00:01,  2.01it/s] 94%|█████████▍| 47/50 [00:28<00:01,  2.01it/s] 96%|█████████▌| 48/50 [00:28<00:00,  2.01it/s] 98%|█████████▊| 49/50 [00:29<00:00,  2.01it/s]100%|██████████| 50/50 [00:35<00:00,  2.14s/it]100%|██████████| 50/50 [00:35<00:00,  1.42it/s]
[I 2023-12-10 21:20:01,283] Trial 27 finished with value: 0.3560225369270596 and parameters: {'EMBEDDING_DIM': 779, 'HIDDEN_DIM': 476, 'NUM_LAYERS': 2, 'DROPOUT': 0.3824440857446281, 'LR': 0.002409348187852612, 'WEIGHT_0': 0.7317058251756082, 'WEIGHT_1': 0.6867309427832466, 'WEIGHT_2': 0.6567825361198438, 'WEIGHT_3': 0.9239150231888063, 'WEIGHT_4': 0.9211611415662874, 'WEIGHT_5': 0.7738452688779758, 'WEIGHT_6': 0.7217674233594322, 'WEIGHT_7': 0.48610172188786016, 'WEIGHT_8': 0.6031447124817705, 'optimizer': 'Adam'}. Best is trial 26 with value: 0.4051425745838141.
/userhome/cs2/dingruiw/conda/envs/py310/lib/python3.10/site-packages/torch/nn/modules/rnn.py:82: UserWarning: dropout option adds dropout after all but last recurrent layer, so non-zero dropout expects num_layers greater than 1, but got dropout=0.31839631682117325 and num_layers=1
  warnings.warn("dropout option adds dropout after all but last "
{'EMBEDDING_DIM': 779, 'HIDDEN_DIM': 476, 'NUM_LAYERS': 2, 'DROPOUT': 0.3824440857446281, 'LR': 0.002409348187852612, 'WEIGHT_0': 0.7317058251756082, 'WEIGHT_1': 0.6867309427832466, 'WEIGHT_2': 0.6567825361198438, 'WEIGHT_3': 0.9239150231888063, 'WEIGHT_4': 0.9211611415662874, 'WEIGHT_5': 0.7738452688779758, 'WEIGHT_6': 0.7217674233594322, 'WEIGHT_7': 0.48610172188786016, 'WEIGHT_8': 0.6031447124817705, 'optimizer': 'Adam'}
0
              precision    recall  f1-score   support

         LOC       0.00      0.00      0.00      1837
        MISC       0.01      0.00      0.00       922
         ORG       0.05      0.01      0.01      1341
         PER       0.05      0.01      0.01      1842

   micro avg       0.04      0.00      0.01      5942
   macro avg       0.03      0.00      0.01      5942
weighted avg       0.03      0.00      0.01      5942

{'EMBEDDING_DIM': 779, 'HIDDEN_DIM': 476, 'NUM_LAYERS': 2, 'DROPOUT': 0.3824440857446281, 'LR': 0.002409348187852612, 'WEIGHT_0': 0.7317058251756082, 'WEIGHT_1': 0.6867309427832466, 'WEIGHT_2': 0.6567825361198438, 'WEIGHT_3': 0.9239150231888063, 'WEIGHT_4': 0.9211611415662874, 'WEIGHT_5': 0.7738452688779758, 'WEIGHT_6': 0.7217674233594322, 'WEIGHT_7': 0.48610172188786016, 'WEIGHT_8': 0.6031447124817705, 'optimizer': 'Adam'}
49
              precision    recall  f1-score   support

         LOC       0.56      0.52      0.54      1837
        MISC       0.27      0.42      0.33       922
         ORG       0.17      0.27      0.21      1341
         PER       0.34      0.34      0.34      1842

   micro avg       0.33      0.39      0.36      5942
   macro avg       0.33      0.39      0.35      5942
weighted avg       0.36      0.39      0.37      5942

epoch 49
LSTM
  0%|          | 0/50 [00:00<?, ?it/s]  2%|▏         | 1/50 [00:04<03:57,  4.85s/it]  4%|▍         | 2/50 [00:05<01:41,  2.12s/it]  6%|▌         | 3/50 [00:05<01:02,  1.33s/it]  8%|▊         | 4/50 [00:05<00:44,  1.04it/s] 10%|█         | 5/50 [00:06<00:34,  1.32it/s] 12%|█▏        | 6/50 [00:06<00:27,  1.58it/s] 14%|█▍        | 7/50 [00:07<00:23,  1.80it/s] 16%|█▌        | 8/50 [00:07<00:21,  1.98it/s] 18%|█▊        | 9/50 [00:07<00:19,  2.13it/s] 20%|██        | 10/50 [00:08<00:17,  2.24it/s] 22%|██▏       | 11/50 [00:08<00:16,  2.33it/s] 24%|██▍       | 12/50 [00:08<00:15,  2.39it/s] 26%|██▌       | 13/50 [00:09<00:15,  2.42it/s] 28%|██▊       | 14/50 [00:09<00:14,  2.45it/s] 30%|███       | 15/50 [00:10<00:14,  2.48it/s] 32%|███▏      | 16/50 [00:10<00:13,  2.49it/s] 34%|███▍      | 17/50 [00:10<00:13,  2.50it/s] 36%|███▌      | 18/50 [00:11<00:12,  2.51it/s] 38%|███▊      | 19/50 [00:11<00:12,  2.52it/s] 40%|████      | 20/50 [00:12<00:11,  2.52it/s] 42%|████▏     | 21/50 [00:12<00:11,  2.52it/s] 44%|████▍     | 22/50 [00:12<00:11,  2.52it/s] 46%|████▌     | 23/50 [00:13<00:10,  2.52it/s] 48%|████▊     | 24/50 [00:13<00:10,  2.53it/s] 50%|█████     | 25/50 [00:14<00:09,  2.52it/s] 52%|█████▏    | 26/50 [00:14<00:09,  2.53it/s] 54%|█████▍    | 27/50 [00:14<00:09,  2.53it/s] 56%|█████▌    | 28/50 [00:15<00:08,  2.53it/s] 58%|█████▊    | 29/50 [00:15<00:08,  2.53it/s] 60%|██████    | 30/50 [00:16<00:07,  2.53it/s] 62%|██████▏   | 31/50 [00:16<00:07,  2.53it/s] 64%|██████▍   | 32/50 [00:16<00:07,  2.53it/s] 66%|██████▌   | 33/50 [00:17<00:06,  2.52it/s] 68%|██████▊   | 34/50 [00:17<00:06,  2.52it/s] 70%|███████   | 35/50 [00:18<00:05,  2.52it/s] 72%|███████▏  | 36/50 [00:18<00:05,  2.51it/s] 74%|███████▍  | 37/50 [00:18<00:05,  2.52it/s] 76%|███████▌  | 38/50 [00:19<00:04,  2.51it/s] 78%|███████▊  | 39/50 [00:19<00:04,  2.51it/s] 80%|████████  | 40/50 [00:20<00:03,  2.51it/s] 82%|████████▏ | 41/50 [00:20<00:03,  2.51it/s] 84%|████████▍ | 42/50 [00:20<00:03,  2.51it/s] 86%|████████▌ | 43/50 [00:21<00:02,  2.52it/s] 88%|████████▊ | 44/50 [00:21<00:02,  2.51it/s] 90%|█████████ | 45/50 [00:22<00:01,  2.51it/s] 92%|█████████▏| 46/50 [00:22<00:01,  2.51it/s] 94%|█████████▍| 47/50 [00:22<00:01,  2.50it/s] 96%|█████████▌| 48/50 [00:23<00:00,  2.51it/s] 98%|█████████▊| 49/50 [00:23<00:00,  2.51it/s]100%|██████████| 50/50 [00:28<00:00,  1.80s/it]100%|██████████| 50/50 [00:28<00:00,  1.74it/s]
[I 2023-12-10 21:20:34,243] Trial 28 finished with value: 0.39641417879759844 and parameters: {'EMBEDDING_DIM': 619, 'HIDDEN_DIM': 663, 'NUM_LAYERS': 1, 'DROPOUT': 0.31839631682117325, 'LR': 0.0025839507650467167, 'WEIGHT_0': 0.4454370414725554, 'WEIGHT_1': 0.7818385591110273, 'WEIGHT_2': 0.632630792591069, 'WEIGHT_3': 0.8109730522631365, 'WEIGHT_4': 0.9234311989728976, 'WEIGHT_5': 0.7067168494252851, 'WEIGHT_6': 0.9000069895920638, 'WEIGHT_7': 0.32037735721973176, 'WEIGHT_8': 0.7470219330747574, 'optimizer': 'Adam'}. Best is trial 26 with value: 0.4051425745838141.
/userhome/cs2/dingruiw/conda/envs/py310/lib/python3.10/site-packages/torch/nn/modules/rnn.py:82: UserWarning: dropout option adds dropout after all but last recurrent layer, so non-zero dropout expects num_layers greater than 1, but got dropout=0.2992414337186001 and num_layers=1
  warnings.warn("dropout option adds dropout after all but last "
{'EMBEDDING_DIM': 619, 'HIDDEN_DIM': 663, 'NUM_LAYERS': 1, 'DROPOUT': 0.31839631682117325, 'LR': 0.0025839507650467167, 'WEIGHT_0': 0.4454370414725554, 'WEIGHT_1': 0.7818385591110273, 'WEIGHT_2': 0.632630792591069, 'WEIGHT_3': 0.8109730522631365, 'WEIGHT_4': 0.9234311989728976, 'WEIGHT_5': 0.7067168494252851, 'WEIGHT_6': 0.9000069895920638, 'WEIGHT_7': 0.32037735721973176, 'WEIGHT_8': 0.7470219330747574, 'optimizer': 'Adam'}
0
              precision    recall  f1-score   support

         LOC       0.13      0.05      0.07      1837
        MISC       0.02      0.03      0.02       922
         ORG       0.05      0.04      0.04      1341
         PER       0.05      0.02      0.03      1842

   micro avg       0.06      0.04      0.04      5942
   macro avg       0.06      0.04      0.04      5942
weighted avg       0.07      0.04      0.05      5942

{'EMBEDDING_DIM': 619, 'HIDDEN_DIM': 663, 'NUM_LAYERS': 1, 'DROPOUT': 0.31839631682117325, 'LR': 0.0025839507650467167, 'WEIGHT_0': 0.4454370414725554, 'WEIGHT_1': 0.7818385591110273, 'WEIGHT_2': 0.632630792591069, 'WEIGHT_3': 0.8109730522631365, 'WEIGHT_4': 0.9234311989728976, 'WEIGHT_5': 0.7067168494252851, 'WEIGHT_6': 0.9000069895920638, 'WEIGHT_7': 0.32037735721973176, 'WEIGHT_8': 0.7470219330747574, 'optimizer': 'Adam'}
49
              precision    recall  f1-score   support

         LOC       0.55      0.56      0.55      1837
        MISC       0.37      0.41      0.39       922
         ORG       0.29      0.28      0.29      1341
         PER       0.31      0.34      0.33      1842

   micro avg       0.39      0.41      0.40      5942
   macro avg       0.38      0.40      0.39      5942
weighted avg       0.39      0.41      0.40      5942

epoch 49
LSTM
  0%|          | 0/50 [00:00<?, ?it/s]  2%|▏         | 1/50 [00:05<04:36,  5.63s/it]  4%|▍         | 2/50 [00:05<01:57,  2.44s/it]  6%|▌         | 3/50 [00:06<01:12,  1.55s/it]  8%|▊         | 4/50 [00:06<00:51,  1.13s/it] 10%|█         | 5/50 [00:07<00:40,  1.12it/s] 12%|█▏        | 6/50 [00:07<00:33,  1.32it/s] 14%|█▍        | 7/50 [00:08<00:28,  1.49it/s] 16%|█▌        | 8/50 [00:08<00:25,  1.63it/s] 18%|█▊        | 9/50 [00:09<00:23,  1.74it/s] 20%|██        | 10/50 [00:09<00:21,  1.82it/s] 22%|██▏       | 11/50 [00:10<00:20,  1.88it/s] 24%|██▍       | 12/50 [00:10<00:19,  1.94it/s] 26%|██▌       | 13/50 [00:11<00:18,  1.97it/s] 28%|██▊       | 14/50 [00:11<00:18,  1.99it/s] 30%|███       | 15/50 [00:12<00:17,  2.01it/s] 32%|███▏      | 16/50 [00:12<00:16,  2.02it/s] 34%|███▍      | 17/50 [00:13<00:16,  2.03it/s] 36%|███▌      | 18/50 [00:13<00:15,  2.04it/s] 38%|███▊      | 19/50 [00:14<00:15,  2.04it/s] 40%|████      | 20/50 [00:14<00:14,  2.04it/s] 42%|████▏     | 21/50 [00:15<00:14,  2.04it/s] 44%|████▍     | 22/50 [00:15<00:13,  2.05it/s] 46%|████▌     | 23/50 [00:16<00:13,  2.06it/s] 48%|████▊     | 24/50 [00:16<00:12,  2.04it/s] 50%|█████     | 25/50 [00:17<00:12,  2.04it/s] 52%|█████▏    | 26/50 [00:17<00:11,  2.04it/s] 54%|█████▍    | 27/50 [00:18<00:11,  2.05it/s] 56%|█████▌    | 28/50 [00:18<00:10,  2.05it/s] 58%|█████▊    | 29/50 [00:19<00:10,  2.05it/s] 60%|██████    | 30/50 [00:19<00:09,  2.04it/s] 62%|██████▏   | 31/50 [00:19<00:09,  2.04it/s] 64%|██████▍   | 32/50 [00:20<00:08,  2.05it/s] 66%|██████▌   | 33/50 [00:20<00:08,  2.04it/s] 68%|██████▊   | 34/50 [00:21<00:07,  2.05it/s] 70%|███████   | 35/50 [00:21<00:07,  2.05it/s] 72%|███████▏  | 36/50 [00:22<00:06,  2.04it/s] 74%|███████▍  | 37/50 [00:22<00:06,  2.04it/s] 76%|███████▌  | 38/50 [00:23<00:05,  2.04it/s] 78%|███████▊  | 39/50 [00:23<00:05,  2.04it/s] 80%|████████  | 40/50 [00:24<00:04,  2.03it/s] 82%|████████▏ | 41/50 [00:24<00:04,  2.03it/s] 84%|████████▍ | 42/50 [00:25<00:03,  2.02it/s] 86%|████████▌ | 43/50 [00:25<00:03,  2.01it/s] 88%|████████▊ | 44/50 [00:26<00:02,  2.02it/s] 90%|█████████ | 45/50 [00:26<00:02,  2.02it/s] 92%|█████████▏| 46/50 [00:27<00:01,  2.03it/s] 94%|█████████▍| 47/50 [00:27<00:01,  2.02it/s] 96%|█████████▌| 48/50 [00:28<00:00,  2.02it/s] 98%|█████████▊| 49/50 [00:28<00:00,  2.02it/s]100%|██████████| 50/50 [00:34<00:00,  2.04s/it]100%|██████████| 50/50 [00:34<00:00,  1.45it/s]
