[I 2023-12-10 23:34:20,659] Trial 269 finished with value: 0.39284802043422734 and parameters: {'EMBEDDING_DIM': 1024, 'HIDDEN_DIM': 185, 'NUM_LAYERS': 1, 'DROPOUT': 0.32382777681797625, 'LR': 0.003064976753838967, 'WEIGHT_0': 0.4623475215423932, 'WEIGHT_1': 0.5304154781097401, 'WEIGHT_2': 0.1935414521285264, 'WEIGHT_3': 0.6606250559772209, 'WEIGHT_4': 0.9988427548656263, 'WEIGHT_5': 0.5515835863300826, 'WEIGHT_6': 0.6454719191020718, 'WEIGHT_7': 0.18462899592729715, 'WEIGHT_8': 0.5784020877819012, 'optimizer': 'RMSprop'}. Best is trial 221 with value: 0.418736930154747.
/userhome/cs2/dingruiw/conda/envs/py310/lib/python3.10/site-packages/torch/nn/modules/rnn.py:82: UserWarning: dropout option adds dropout after all but last recurrent layer, so non-zero dropout expects num_layers greater than 1, but got dropout=0.2842040107692023 and num_layers=1
  warnings.warn("dropout option adds dropout after all but last "
{'EMBEDDING_DIM': 1024, 'HIDDEN_DIM': 185, 'NUM_LAYERS': 1, 'DROPOUT': 0.32382777681797625, 'LR': 0.003064976753838967, 'WEIGHT_0': 0.4623475215423932, 'WEIGHT_1': 0.5304154781097401, 'WEIGHT_2': 0.1935414521285264, 'WEIGHT_3': 0.6606250559772209, 'WEIGHT_4': 0.9988427548656263, 'WEIGHT_5': 0.5515835863300826, 'WEIGHT_6': 0.6454719191020718, 'WEIGHT_7': 0.18462899592729715, 'WEIGHT_8': 0.5784020877819012, 'optimizer': 'RMSprop'}
0
              precision    recall  f1-score   support

         LOC       0.48      0.20      0.28      1837
        MISC       0.03      0.01      0.01       922
         ORG       0.14      0.02      0.04      1341
         PER       0.09      0.02      0.04      1842

   micro avg       0.28      0.08      0.12      5942
   macro avg       0.19      0.06      0.09      5942
weighted avg       0.21      0.08      0.11      5942

{'EMBEDDING_DIM': 1024, 'HIDDEN_DIM': 185, 'NUM_LAYERS': 1, 'DROPOUT': 0.32382777681797625, 'LR': 0.003064976753838967, 'WEIGHT_0': 0.4623475215423932, 'WEIGHT_1': 0.5304154781097401, 'WEIGHT_2': 0.1935414521285264, 'WEIGHT_3': 0.6606250559772209, 'WEIGHT_4': 0.9988427548656263, 'WEIGHT_5': 0.5515835863300826, 'WEIGHT_6': 0.6454719191020718, 'WEIGHT_7': 0.18462899592729715, 'WEIGHT_8': 0.5784020877819012, 'optimizer': 'RMSprop'}
49
              precision    recall  f1-score   support

         LOC       0.53      0.51      0.52      1837
        MISC       0.47      0.44      0.45       922
         ORG       0.27      0.25      0.26      1341
         PER       0.33      0.34      0.33      1842

   micro avg       0.40      0.39      0.39      5942
   macro avg       0.40      0.39      0.39      5942
weighted avg       0.40      0.39      0.39      5942

epoch 49
LSTM
  0%|          | 0/50 [00:00<?, ?it/s]  2%|▏         | 1/50 [00:04<03:52,  4.74s/it]  6%|▌         | 3/50 [00:05<01:02,  1.33s/it]  8%|▊         | 4/50 [00:05<00:42,  1.08it/s] 10%|█         | 5/50 [00:05<00:30,  1.49it/s] 12%|█▏        | 6/50 [00:05<00:22,  1.96it/s] 14%|█▍        | 7/50 [00:05<00:17,  2.50it/s] 16%|█▌        | 8/50 [00:05<00:13,  3.05it/s] 18%|█▊        | 9/50 [00:05<00:11,  3.60it/s] 20%|██        | 10/50 [00:06<00:09,  4.12it/s] 22%|██▏       | 11/50 [00:06<00:08,  4.56it/s] 24%|██▍       | 12/50 [00:06<00:07,  4.93it/s] 26%|██▌       | 13/50 [00:06<00:07,  5.23it/s] 28%|██▊       | 14/50 [00:06<00:06,  5.46it/s] 30%|███       | 15/50 [00:06<00:06,  5.64it/s] 32%|███▏      | 16/50 [00:07<00:05,  5.77it/s] 34%|███▍      | 17/50 [00:07<00:05,  5.86it/s] 36%|███▌      | 18/50 [00:07<00:05,  5.94it/s] 38%|███▊      | 19/50 [00:07<00:05,  5.98it/s] 40%|████      | 20/50 [00:07<00:04,  6.01it/s] 42%|████▏     | 21/50 [00:07<00:04,  6.03it/s] 44%|████▍     | 22/50 [00:08<00:04,  6.05it/s] 46%|████▌     | 23/50 [00:08<00:04,  6.06it/s] 48%|████▊     | 24/50 [00:08<00:04,  6.06it/s] 50%|█████     | 25/50 [00:08<00:04,  6.08it/s] 52%|█████▏    | 26/50 [00:08<00:03,  6.09it/s] 54%|█████▍    | 27/50 [00:08<00:03,  6.09it/s] 56%|█████▌    | 28/50 [00:09<00:03,  6.09it/s] 58%|█████▊    | 29/50 [00:09<00:03,  6.08it/s] 60%|██████    | 30/50 [00:09<00:03,  6.08it/s] 62%|██████▏   | 31/50 [00:09<00:03,  6.08it/s] 64%|██████▍   | 32/50 [00:09<00:02,  6.08it/s] 66%|██████▌   | 33/50 [00:09<00:02,  6.08it/s] 68%|██████▊   | 34/50 [00:10<00:02,  6.08it/s] 70%|███████   | 35/50 [00:10<00:02,  6.08it/s] 72%|███████▏  | 36/50 [00:10<00:02,  6.08it/s] 74%|███████▍  | 37/50 [00:10<00:02,  6.08it/s] 76%|███████▌  | 38/50 [00:10<00:01,  6.08it/s] 78%|███████▊  | 39/50 [00:10<00:01,  6.08it/s] 80%|████████  | 40/50 [00:11<00:01,  6.08it/s] 82%|████████▏ | 41/50 [00:11<00:01,  6.08it/s] 84%|████████▍ | 42/50 [00:11<00:01,  6.08it/s] 86%|████████▌ | 43/50 [00:11<00:01,  6.08it/s] 88%|████████▊ | 44/50 [00:11<00:00,  6.08it/s] 90%|█████████ | 45/50 [00:11<00:00,  6.09it/s] 92%|█████████▏| 46/50 [00:12<00:00,  6.08it/s] 94%|█████████▍| 47/50 [00:12<00:00,  6.09it/s] 96%|█████████▌| 48/50 [00:12<00:00,  6.08it/s] 98%|█████████▊| 49/50 [00:12<00:00,  6.08it/s]100%|██████████| 50/50 [00:17<00:00,  1.61s/it]100%|██████████| 50/50 [00:17<00:00,  2.85it/s]
[I 2023-12-10 23:34:42,511] Trial 270 finished with value: 0.40279475982532753 and parameters: {'EMBEDDING_DIM': 992, 'HIDDEN_DIM': 237, 'NUM_LAYERS': 1, 'DROPOUT': 0.2842040107692023, 'LR': 0.0028589685870959486, 'WEIGHT_0': 0.5214210454587117, 'WEIGHT_1': 0.5528635276901277, 'WEIGHT_2': 0.1568540750062956, 'WEIGHT_3': 0.6250905622070301, 'WEIGHT_4': 0.6233578385879828, 'WEIGHT_5': 0.5297098242135182, 'WEIGHT_6': 0.9056647625050995, 'WEIGHT_7': 0.24613682250476124, 'WEIGHT_8': 0.5300072619506135, 'optimizer': 'RMSprop'}. Best is trial 221 with value: 0.418736930154747.
/userhome/cs2/dingruiw/conda/envs/py310/lib/python3.10/site-packages/torch/nn/modules/rnn.py:82: UserWarning: dropout option adds dropout after all but last recurrent layer, so non-zero dropout expects num_layers greater than 1, but got dropout=0.4183196838277023 and num_layers=1
  warnings.warn("dropout option adds dropout after all but last "
{'EMBEDDING_DIM': 992, 'HIDDEN_DIM': 237, 'NUM_LAYERS': 1, 'DROPOUT': 0.2842040107692023, 'LR': 0.0028589685870959486, 'WEIGHT_0': 0.5214210454587117, 'WEIGHT_1': 0.5528635276901277, 'WEIGHT_2': 0.1568540750062956, 'WEIGHT_3': 0.6250905622070301, 'WEIGHT_4': 0.6233578385879828, 'WEIGHT_5': 0.5297098242135182, 'WEIGHT_6': 0.9056647625050995, 'WEIGHT_7': 0.24613682250476124, 'WEIGHT_8': 0.5300072619506135, 'optimizer': 'RMSprop'}
0
              precision    recall  f1-score   support

         LOC       0.27      0.06      0.10      1837
        MISC       0.07      0.01      0.02       922
         ORG       0.28      0.01      0.03      1341
         PER       0.11      0.02      0.04      1842

   micro avg       0.18      0.03      0.05      5942
   macro avg       0.18      0.03      0.05      5942
weighted avg       0.19      0.03      0.05      5942

{'EMBEDDING_DIM': 992, 'HIDDEN_DIM': 237, 'NUM_LAYERS': 1, 'DROPOUT': 0.2842040107692023, 'LR': 0.0028589685870959486, 'WEIGHT_0': 0.5214210454587117, 'WEIGHT_1': 0.5528635276901277, 'WEIGHT_2': 0.1568540750062956, 'WEIGHT_3': 0.6250905622070301, 'WEIGHT_4': 0.6233578385879828, 'WEIGHT_5': 0.5297098242135182, 'WEIGHT_6': 0.9056647625050995, 'WEIGHT_7': 0.24613682250476124, 'WEIGHT_8': 0.5300072619506135, 'optimizer': 'RMSprop'}
49
              precision    recall  f1-score   support

         LOC       0.60      0.51      0.55      1837
        MISC       0.49      0.42      0.45       922
         ORG       0.27      0.27      0.27      1341
         PER       0.35      0.33      0.34      1842

   micro avg       0.42      0.39      0.40      5942
   macro avg       0.42      0.38      0.40      5942
weighted avg       0.43      0.39      0.41      5942

epoch 49
LSTM
  0%|          | 0/50 [00:00<?, ?it/s]  2%|▏         | 1/50 [00:04<03:51,  4.73s/it]  6%|▌         | 3/50 [00:04<01:02,  1.32s/it]  8%|▊         | 4/50 [00:05<00:42,  1.09it/s] 10%|█         | 5/50 [00:05<00:30,  1.50it/s] 12%|█▏        | 6/50 [00:05<00:22,  1.98it/s] 14%|█▍        | 7/50 [00:05<00:17,  2.52it/s] 16%|█▌        | 8/50 [00:05<00:13,  3.09it/s] 18%|█▊        | 9/50 [00:05<00:11,  3.65it/s] 20%|██        | 10/50 [00:06<00:09,  4.17it/s] 22%|██▏       | 11/50 [00:06<00:08,  4.63it/s] 24%|██▍       | 12/50 [00:06<00:07,  5.01it/s] 26%|██▌       | 13/50 [00:06<00:06,  5.32it/s] 28%|██▊       | 14/50 [00:06<00:06,  5.55it/s] 30%|███       | 15/50 [00:06<00:06,  5.73it/s] 32%|███▏      | 16/50 [00:07<00:05,  5.86it/s] 34%|███▍      | 17/50 [00:07<00:05,  5.96it/s] 36%|███▌      | 18/50 [00:07<00:05,  6.03it/s] 38%|███▊      | 19/50 [00:07<00:05,  6.08it/s] 40%|████      | 20/50 [00:07<00:04,  6.12it/s] 42%|████▏     | 21/50 [00:07<00:04,  6.14it/s] 44%|████▍     | 22/50 [00:08<00:04,  6.15it/s] 46%|████▌     | 23/50 [00:08<00:04,  6.16it/s] 48%|████▊     | 24/50 [00:08<00:04,  6.17it/s] 50%|█████     | 25/50 [00:08<00:04,  6.18it/s] 52%|█████▏    | 26/50 [00:08<00:03,  6.18it/s] 54%|█████▍    | 27/50 [00:08<00:03,  6.19it/s] 56%|█████▌    | 28/50 [00:09<00:03,  6.19it/s] 58%|█████▊    | 29/50 [00:09<00:03,  6.19it/s] 60%|██████    | 30/50 [00:09<00:03,  6.18it/s] 62%|██████▏   | 31/50 [00:09<00:03,  6.18it/s] 64%|██████▍   | 32/50 [00:09<00:02,  6.18it/s] 66%|██████▌   | 33/50 [00:09<00:02,  6.20it/s] 68%|██████▊   | 34/50 [00:09<00:02,  6.18it/s] 70%|███████   | 35/50 [00:10<00:02,  6.18it/s] 72%|███████▏  | 36/50 [00:10<00:02,  6.18it/s] 74%|███████▍  | 37/50 [00:10<00:02,  6.18it/s] 76%|███████▌  | 38/50 [00:10<00:01,  6.18it/s] 78%|███████▊  | 39/50 [00:10<00:01,  6.18it/s] 80%|████████  | 40/50 [00:10<00:01,  6.18it/s] 82%|████████▏ | 41/50 [00:11<00:01,  6.18it/s] 84%|████████▍ | 42/50 [00:11<00:01,  6.18it/s] 86%|████████▌ | 43/50 [00:11<00:01,  6.18it/s] 88%|████████▊ | 44/50 [00:11<00:00,  6.18it/s] 90%|█████████ | 45/50 [00:11<00:00,  6.18it/s] 92%|█████████▏| 46/50 [00:11<00:00,  6.17it/s] 94%|█████████▍| 47/50 [00:12<00:00,  6.18it/s] 96%|█████████▌| 48/50 [00:12<00:00,  6.18it/s] 98%|█████████▊| 49/50 [00:12<00:00,  6.18it/s]100%|██████████| 50/50 [00:17<00:00,  1.57s/it]100%|██████████| 50/50 [00:17<00:00,  2.89it/s]
[I 2023-12-10 23:35:04,177] Trial 271 finished with value: 0.40092126588757143 and parameters: {'EMBEDDING_DIM': 972, 'HIDDEN_DIM': 238, 'NUM_LAYERS': 1, 'DROPOUT': 0.4183196838277023, 'LR': 0.003097634064805754, 'WEIGHT_0': 0.4365161217978708, 'WEIGHT_1': 0.5665123358350235, 'WEIGHT_2': 0.18934886892138372, 'WEIGHT_3': 0.668071864184307, 'WEIGHT_4': 0.8959572281883923, 'WEIGHT_5': 0.7208114907853661, 'WEIGHT_6': 0.6285420106287115, 'WEIGHT_7': 0.15710627003377706, 'WEIGHT_8': 0.5646909258533976, 'optimizer': 'RMSprop'}. Best is trial 221 with value: 0.418736930154747.
/userhome/cs2/dingruiw/conda/envs/py310/lib/python3.10/site-packages/torch/nn/modules/rnn.py:82: UserWarning: dropout option adds dropout after all but last recurrent layer, so non-zero dropout expects num_layers greater than 1, but got dropout=0.3699829491863252 and num_layers=1
  warnings.warn("dropout option adds dropout after all but last "
{'EMBEDDING_DIM': 972, 'HIDDEN_DIM': 238, 'NUM_LAYERS': 1, 'DROPOUT': 0.4183196838277023, 'LR': 0.003097634064805754, 'WEIGHT_0': 0.4365161217978708, 'WEIGHT_1': 0.5665123358350235, 'WEIGHT_2': 0.18934886892138372, 'WEIGHT_3': 0.668071864184307, 'WEIGHT_4': 0.8959572281883923, 'WEIGHT_5': 0.7208114907853661, 'WEIGHT_6': 0.6285420106287115, 'WEIGHT_7': 0.15710627003377706, 'WEIGHT_8': 0.5646909258533976, 'optimizer': 'RMSprop'}
0
              precision    recall  f1-score   support

         LOC       0.39      0.14      0.20      1837
        MISC       0.07      0.01      0.02       922
         ORG       0.19      0.05      0.08      1341
         PER       0.09      0.01      0.02      1842

   micro avg       0.25      0.06      0.10      5942
   macro avg       0.19      0.05      0.08      5942
weighted avg       0.20      0.06      0.09      5942

{'EMBEDDING_DIM': 972, 'HIDDEN_DIM': 238, 'NUM_LAYERS': 1, 'DROPOUT': 0.4183196838277023, 'LR': 0.003097634064805754, 'WEIGHT_0': 0.4365161217978708, 'WEIGHT_1': 0.5665123358350235, 'WEIGHT_2': 0.18934886892138372, 'WEIGHT_3': 0.668071864184307, 'WEIGHT_4': 0.8959572281883923, 'WEIGHT_5': 0.7208114907853661, 'WEIGHT_6': 0.6285420106287115, 'WEIGHT_7': 0.15710627003377706, 'WEIGHT_8': 0.5646909258533976, 'optimizer': 'RMSprop'}
49
              precision    recall  f1-score   support

         LOC       0.59      0.54      0.57      1837
        MISC       0.48      0.41      0.44       922
         ORG       0.27      0.25      0.26      1341
         PER       0.31      0.34      0.33      1842

   micro avg       0.41      0.40      0.40      5942
   macro avg       0.41      0.39      0.40      5942
weighted avg       0.41      0.40      0.40      5942

epoch 49
LSTM
  0%|          | 0/50 [00:00<?, ?it/s]  2%|▏         | 1/50 [00:04<03:19,  4.07s/it] 10%|█         | 5/50 [00:04<00:28,  1.59it/s] 16%|█▌        | 8/50 [00:04<00:15,  2.75it/s] 20%|██        | 10/50 [00:04<00:10,  3.67it/s] 24%|██▍       | 12/50 [00:04<00:07,  4.75it/s] 28%|██▊       | 14/50 [00:04<00:06,  5.96it/s] 32%|███▏      | 16/50 [00:04<00:04,  7.23it/s] 36%|███▌      | 18/50 [00:05<00:03,  8.46it/s] 40%|████      | 20/50 [00:05<00:03,  9.61it/s] 44%|████▍     | 22/50 [00:05<00:02, 10.60it/s] 48%|████▊     | 24/50 [00:05<00:02, 11.44it/s] 52%|█████▏    | 26/50 [00:05<00:01, 12.10it/s] 56%|█████▌    | 28/50 [00:05<00:01, 12.62it/s] 60%|██████    | 30/50 [00:05<00:01, 13.01it/s] 64%|██████▍   | 32/50 [00:06<00:01, 13.29it/s] 68%|██████▊   | 34/50 [00:06<00:01, 13.49it/s] 72%|███████▏  | 36/50 [00:06<00:01, 13.64it/s] 76%|███████▌  | 38/50 [00:06<00:00, 13.75it/s] 80%|████████  | 40/50 [00:06<00:00, 13.82it/s] 84%|████████▍ | 42/50 [00:06<00:00, 13.87it/s] 88%|████████▊ | 44/50 [00:06<00:00, 13.91it/s] 92%|█████████▏| 46/50 [00:07<00:00, 13.95it/s] 96%|█████████▌| 48/50 [00:07<00:00, 13.96it/s]100%|██████████| 50/50 [00:11<00:00,  1.42it/s]100%|██████████| 50/50 [00:11<00:00,  4.30it/s]
[I 2023-12-10 23:35:19,534] Trial 272 finished with value: 0.3987210508123055 and parameters: {'EMBEDDING_DIM': 1006, 'HIDDEN_DIM': 85, 'NUM_LAYERS': 1, 'DROPOUT': 0.3699829491863252, 'LR': 0.003770696791803553, 'WEIGHT_0': 0.46346859728145823, 'WEIGHT_1': 0.5466134711146268, 'WEIGHT_2': 0.11388709873953629, 'WEIGHT_3': 0.6208087690029787, 'WEIGHT_4': 0.5509244175124894, 'WEIGHT_5': 0.5321886741688361, 'WEIGHT_6': 0.6654422455491293, 'WEIGHT_7': 0.18025064809543123, 'WEIGHT_8': 0.5013628559346062, 'optimizer': 'RMSprop'}. Best is trial 221 with value: 0.418736930154747.
/userhome/cs2/dingruiw/conda/envs/py310/lib/python3.10/site-packages/torch/nn/modules/rnn.py:82: UserWarning: dropout option adds dropout after all but last recurrent layer, so non-zero dropout expects num_layers greater than 1, but got dropout=0.3043700061698426 and num_layers=1
  warnings.warn("dropout option adds dropout after all but last "
{'EMBEDDING_DIM': 1006, 'HIDDEN_DIM': 85, 'NUM_LAYERS': 1, 'DROPOUT': 0.3699829491863252, 'LR': 0.003770696791803553, 'WEIGHT_0': 0.46346859728145823, 'WEIGHT_1': 0.5466134711146268, 'WEIGHT_2': 0.11388709873953629, 'WEIGHT_3': 0.6208087690029787, 'WEIGHT_4': 0.5509244175124894, 'WEIGHT_5': 0.5321886741688361, 'WEIGHT_6': 0.6654422455491293, 'WEIGHT_7': 0.18025064809543123, 'WEIGHT_8': 0.5013628559346062, 'optimizer': 'RMSprop'}
0
              precision    recall  f1-score   support

         LOC       0.41      0.05      0.09      1837
        MISC       0.03      0.01      0.01       922
         ORG       0.18      0.07      0.10      1341
         PER       0.11      0.05      0.06      1842

   micro avg       0.16      0.05      0.07      5942
   macro avg       0.18      0.04      0.07      5942
weighted avg       0.21      0.05      0.07      5942

{'EMBEDDING_DIM': 1006, 'HIDDEN_DIM': 85, 'NUM_LAYERS': 1, 'DROPOUT': 0.3699829491863252, 'LR': 0.003770696791803553, 'WEIGHT_0': 0.46346859728145823, 'WEIGHT_1': 0.5466134711146268, 'WEIGHT_2': 0.11388709873953629, 'WEIGHT_3': 0.6208087690029787, 'WEIGHT_4': 0.5509244175124894, 'WEIGHT_5': 0.5321886741688361, 'WEIGHT_6': 0.6654422455491293, 'WEIGHT_7': 0.18025064809543123, 'WEIGHT_8': 0.5013628559346062, 'optimizer': 'RMSprop'}
49
              precision    recall  f1-score   support

         LOC       0.56      0.54      0.55      1837
        MISC       0.52      0.43      0.47       922
         ORG       0.28      0.26      0.27      1341
         PER       0.30      0.31      0.31      1842

   micro avg       0.41      0.39      0.40      5942
   macro avg       0.42      0.39      0.40      5942
weighted avg       0.41      0.39      0.40      5942

epoch 49
LSTM
  0%|          | 0/50 [00:00<?, ?it/s]  2%|▏         | 1/50 [00:04<03:26,  4.21s/it]  4%|▍         | 2/50 [00:04<01:27,  1.82s/it]  6%|▌         | 3/50 [00:04<00:52,  1.11s/it]  8%|▊         | 4/50 [00:04<00:35,  1.30it/s] 10%|█         | 5/50 [00:05<00:26,  1.71it/s] 12%|█▏        | 6/50 [00:05<00:20,  2.13it/s] 14%|█▍        | 7/50 [00:05<00:17,  2.51it/s] 16%|█▌        | 8/50 [00:05<00:14,  2.85it/s] 18%|█▊        | 9/50 [00:06<00:13,  3.13it/s] 20%|██        | 10/50 [00:06<00:11,  3.35it/s] 22%|██▏       | 11/50 [00:06<00:11,  3.53it/s] 24%|██▍       | 12/50 [00:06<00:10,  3.66it/s] 26%|██▌       | 13/50 [00:07<00:09,  3.75it/s] 28%|██▊       | 14/50 [00:07<00:09,  3.82it/s] 30%|███       | 15/50 [00:07<00:09,  3.87it/s] 32%|███▏      | 16/50 [00:07<00:08,  3.91it/s] 34%|███▍      | 17/50 [00:08<00:08,  3.93it/s] 36%|███▌      | 18/50 [00:08<00:08,  3.95it/s] 38%|███▊      | 19/50 [00:08<00:07,  3.97it/s] 40%|████      | 20/50 [00:08<00:07,  3.97it/s] 42%|████▏     | 21/50 [00:09<00:07,  3.98it/s] 44%|████▍     | 22/50 [00:09<00:07,  3.98it/s] 46%|████▌     | 23/50 [00:09<00:06,  3.99it/s] 48%|████▊     | 24/50 [00:09<00:06,  3.99it/s] 50%|█████     | 25/50 [00:10<00:06,  3.99it/s] 52%|█████▏    | 26/50 [00:10<00:06,  3.99it/s] 54%|█████▍    | 27/50 [00:10<00:05,  3.99it/s] 56%|█████▌    | 28/50 [00:10<00:05,  3.99it/s] 58%|█████▊    | 29/50 [00:11<00:05,  3.99it/s] 60%|██████    | 30/50 [00:11<00:05,  3.99it/s] 62%|██████▏   | 31/50 [00:11<00:04,  3.99it/s] 64%|██████▍   | 32/50 [00:11<00:04,  3.99it/s] 66%|██████▌   | 33/50 [00:12<00:04,  3.99it/s] 68%|██████▊   | 34/50 [00:12<00:04,  3.99it/s] 70%|███████   | 35/50 [00:12<00:03,  3.99it/s] 72%|███████▏  | 36/50 [00:12<00:03,  3.99it/s] 74%|███████▍  | 37/50 [00:13<00:03,  3.99it/s] 76%|███████▌  | 38/50 [00:13<00:03,  3.99it/s] 78%|███████▊  | 39/50 [00:13<00:02,  3.99it/s] 80%|████████  | 40/50 [00:13<00:02,  3.99it/s] 82%|████████▏ | 41/50 [00:14<00:02,  3.99it/s] 84%|████████▍ | 42/50 [00:14<00:02,  3.98it/s] 86%|████████▌ | 43/50 [00:14<00:01,  3.98it/s] 88%|████████▊ | 44/50 [00:14<00:01,  3.99it/s] 90%|█████████ | 45/50 [00:15<00:01,  3.98it/s] 92%|█████████▏| 46/50 [00:15<00:01,  3.98it/s] 94%|█████████▍| 47/50 [00:15<00:00,  3.98it/s] 96%|█████████▌| 48/50 [00:15<00:00,  3.98it/s] 98%|█████████▊| 49/50 [00:16<00:00,  3.98it/s]100%|██████████| 50/50 [00:20<00:00,  1.48s/it]100%|██████████| 50/50 [00:20<00:00,  2.44it/s]
