[I 2023-12-10 23:48:05,506] Trial 297 finished with value: 0.3974228552051543 and parameters: {'EMBEDDING_DIM': 945, 'HIDDEN_DIM': 244, 'NUM_LAYERS': 1, 'DROPOUT': 0.32590159725168, 'LR': 0.0032850997231608317, 'WEIGHT_0': 0.5067779544581149, 'WEIGHT_1': 0.4515403816599239, 'WEIGHT_2': 0.7289352231785151, 'WEIGHT_3': 0.6104896826396373, 'WEIGHT_4': 0.9445872043055622, 'WEIGHT_5': 0.5239645840388295, 'WEIGHT_6': 0.6484808197475037, 'WEIGHT_7': 0.6199502534166572, 'WEIGHT_8': 0.4532022161260025, 'optimizer': 'RMSprop'}. Best is trial 221 with value: 0.418736930154747.
/userhome/cs2/dingruiw/conda/envs/py310/lib/python3.10/site-packages/torch/nn/modules/rnn.py:82: UserWarning: dropout option adds dropout after all but last recurrent layer, so non-zero dropout expects num_layers greater than 1, but got dropout=0.2834774699527415 and num_layers=1
  warnings.warn("dropout option adds dropout after all but last "
{'EMBEDDING_DIM': 945, 'HIDDEN_DIM': 244, 'NUM_LAYERS': 1, 'DROPOUT': 0.32590159725168, 'LR': 0.0032850997231608317, 'WEIGHT_0': 0.5067779544581149, 'WEIGHT_1': 0.4515403816599239, 'WEIGHT_2': 0.7289352231785151, 'WEIGHT_3': 0.6104896826396373, 'WEIGHT_4': 0.9445872043055622, 'WEIGHT_5': 0.5239645840388295, 'WEIGHT_6': 0.6484808197475037, 'WEIGHT_7': 0.6199502534166572, 'WEIGHT_8': 0.4532022161260025, 'optimizer': 'RMSprop'}
0
              precision    recall  f1-score   support

         LOC       0.35      0.09      0.14      1837
        MISC       0.05      0.01      0.02       922
         ORG       0.13      0.04      0.06      1341
         PER       0.13      0.01      0.03      1842

   micro avg       0.20      0.04      0.07      5942
   macro avg       0.17      0.04      0.06      5942
weighted avg       0.19      0.04      0.07      5942

{'EMBEDDING_DIM': 945, 'HIDDEN_DIM': 244, 'NUM_LAYERS': 1, 'DROPOUT': 0.32590159725168, 'LR': 0.0032850997231608317, 'WEIGHT_0': 0.5067779544581149, 'WEIGHT_1': 0.4515403816599239, 'WEIGHT_2': 0.7289352231785151, 'WEIGHT_3': 0.6104896826396373, 'WEIGHT_4': 0.9445872043055622, 'WEIGHT_5': 0.5239645840388295, 'WEIGHT_6': 0.6484808197475037, 'WEIGHT_7': 0.6199502534166572, 'WEIGHT_8': 0.4532022161260025, 'optimizer': 'RMSprop'}
49
              precision    recall  f1-score   support

         LOC       0.59      0.52      0.56      1837
        MISC       0.40      0.43      0.42       922
         ORG       0.28      0.26      0.27      1341
         PER       0.32      0.35      0.33      1842

   micro avg       0.40      0.39      0.40      5942
   macro avg       0.40      0.39      0.39      5942
weighted avg       0.41      0.39      0.40      5942

epoch 49
LSTM
  0%|          | 0/50 [00:00<?, ?it/s]  2%|▏         | 1/50 [00:04<03:47,  4.64s/it]  4%|▍         | 2/50 [00:04<01:34,  1.98s/it]  6%|▌         | 3/50 [00:04<00:54,  1.17s/it]  8%|▊         | 4/50 [00:05<00:36,  1.27it/s] 10%|█         | 5/50 [00:05<00:26,  1.73it/s] 12%|█▏        | 6/50 [00:05<00:19,  2.21it/s] 14%|█▍        | 7/50 [00:05<00:15,  2.69it/s] 16%|█▌        | 8/50 [00:05<00:13,  3.14it/s] 18%|█▊        | 9/50 [00:06<00:11,  3.53it/s] 20%|██        | 10/50 [00:06<00:10,  3.86it/s] 22%|██▏       | 11/50 [00:06<00:09,  4.12it/s] 24%|██▍       | 12/50 [00:06<00:08,  4.32it/s] 26%|██▌       | 13/50 [00:07<00:08,  4.47it/s] 28%|██▊       | 14/50 [00:07<00:07,  4.58it/s] 30%|███       | 15/50 [00:07<00:07,  4.67it/s] 32%|███▏      | 16/50 [00:07<00:07,  4.72it/s] 34%|███▍      | 17/50 [00:07<00:06,  4.76it/s] 36%|███▌      | 18/50 [00:08<00:06,  4.79it/s] 38%|███▊      | 19/50 [00:08<00:06,  4.81it/s] 40%|████      | 20/50 [00:08<00:06,  4.82it/s] 42%|████▏     | 21/50 [00:08<00:05,  4.84it/s] 44%|████▍     | 22/50 [00:08<00:05,  4.84it/s] 46%|████▌     | 23/50 [00:09<00:05,  4.85it/s] 48%|████▊     | 24/50 [00:09<00:05,  4.85it/s] 50%|█████     | 25/50 [00:09<00:05,  4.85it/s] 52%|█████▏    | 26/50 [00:09<00:04,  4.85it/s] 54%|█████▍    | 27/50 [00:09<00:04,  4.85it/s] 56%|█████▌    | 28/50 [00:10<00:04,  4.86it/s] 58%|█████▊    | 29/50 [00:10<00:04,  4.85it/s] 60%|██████    | 30/50 [00:10<00:04,  4.86it/s] 62%|██████▏   | 31/50 [00:10<00:03,  4.85it/s] 64%|██████▍   | 32/50 [00:10<00:03,  4.84it/s] 66%|██████▌   | 33/50 [00:11<00:03,  4.85it/s] 68%|██████▊   | 34/50 [00:11<00:03,  4.85it/s] 70%|███████   | 35/50 [00:11<00:03,  4.85it/s] 72%|███████▏  | 36/50 [00:11<00:02,  4.85it/s] 74%|███████▍  | 37/50 [00:11<00:02,  4.84it/s] 76%|███████▌  | 38/50 [00:12<00:02,  4.83it/s] 78%|███████▊  | 39/50 [00:12<00:02,  4.83it/s] 80%|████████  | 40/50 [00:12<00:02,  4.83it/s] 82%|████████▏ | 41/50 [00:12<00:01,  4.83it/s] 84%|████████▍ | 42/50 [00:12<00:01,  4.82it/s] 86%|████████▌ | 43/50 [00:13<00:01,  4.83it/s] 88%|████████▊ | 44/50 [00:13<00:01,  4.83it/s] 90%|█████████ | 45/50 [00:13<00:01,  4.83it/s] 92%|█████████▏| 46/50 [00:13<00:00,  4.82it/s] 94%|█████████▍| 47/50 [00:14<00:00,  4.82it/s] 96%|█████████▌| 48/50 [00:14<00:00,  4.83it/s] 98%|█████████▊| 49/50 [00:14<00:00,  4.82it/s]100%|██████████| 50/50 [00:19<00:00,  1.59s/it]100%|██████████| 50/50 [00:19<00:00,  2.60it/s]
[I 2023-12-10 23:48:29,118] Trial 298 finished with value: 0.40247624029993895 and parameters: {'EMBEDDING_DIM': 974, 'HIDDEN_DIM': 308, 'NUM_LAYERS': 1, 'DROPOUT': 0.2834774699527415, 'LR': 0.0007308015015151948, 'WEIGHT_0': 0.2022162934600521, 'WEIGHT_1': 0.657372943019335, 'WEIGHT_2': 0.2864872336211252, 'WEIGHT_3': 0.6591340344421229, 'WEIGHT_4': 0.8821880300257071, 'WEIGHT_5': 0.551072978857323, 'WEIGHT_6': 0.8932166800316452, 'WEIGHT_7': 0.5827493338027907, 'WEIGHT_8': 0.8499723039508001, 'optimizer': 'RMSprop'}. Best is trial 221 with value: 0.418736930154747.
/userhome/cs2/dingruiw/conda/envs/py310/lib/python3.10/site-packages/torch/nn/modules/rnn.py:82: UserWarning: dropout option adds dropout after all but last recurrent layer, so non-zero dropout expects num_layers greater than 1, but got dropout=0.3183952146482672 and num_layers=1
  warnings.warn("dropout option adds dropout after all but last "
{'EMBEDDING_DIM': 974, 'HIDDEN_DIM': 308, 'NUM_LAYERS': 1, 'DROPOUT': 0.2834774699527415, 'LR': 0.0007308015015151948, 'WEIGHT_0': 0.2022162934600521, 'WEIGHT_1': 0.657372943019335, 'WEIGHT_2': 0.2864872336211252, 'WEIGHT_3': 0.6591340344421229, 'WEIGHT_4': 0.8821880300257071, 'WEIGHT_5': 0.551072978857323, 'WEIGHT_6': 0.8932166800316452, 'WEIGHT_7': 0.5827493338027907, 'WEIGHT_8': 0.8499723039508001, 'optimizer': 'RMSprop'}
0
              precision    recall  f1-score   support

         LOC       0.19      0.09      0.12      1837
        MISC       0.03      0.02      0.03       922
         ORG       0.11      0.05      0.07      1341
         PER       0.07      0.03      0.04      1842

   micro avg       0.10      0.05      0.07      5942
   macro avg       0.10      0.05      0.06      5942
weighted avg       0.11      0.05      0.07      5942

{'EMBEDDING_DIM': 974, 'HIDDEN_DIM': 308, 'NUM_LAYERS': 1, 'DROPOUT': 0.2834774699527415, 'LR': 0.0007308015015151948, 'WEIGHT_0': 0.2022162934600521, 'WEIGHT_1': 0.657372943019335, 'WEIGHT_2': 0.2864872336211252, 'WEIGHT_3': 0.6591340344421229, 'WEIGHT_4': 0.8821880300257071, 'WEIGHT_5': 0.551072978857323, 'WEIGHT_6': 0.8932166800316452, 'WEIGHT_7': 0.5827493338027907, 'WEIGHT_8': 0.8499723039508001, 'optimizer': 'RMSprop'}
49
              precision    recall  f1-score   support

         LOC       0.57      0.53      0.55      1837
        MISC       0.47      0.39      0.43       922
         ORG       0.29      0.26      0.28      1341
         PER       0.34      0.34      0.34      1842

   micro avg       0.42      0.39      0.40      5942
   macro avg       0.42      0.38      0.40      5942
weighted avg       0.42      0.39      0.40      5942

epoch 49
LSTM
  0%|          | 0/50 [00:00<?, ?it/s]  2%|▏         | 1/50 [00:04<03:50,  4.70s/it]  4%|▍         | 2/50 [00:04<01:36,  2.02s/it]  6%|▌         | 3/50 [00:05<00:57,  1.23s/it]  8%|▊         | 4/50 [00:05<00:39,  1.18it/s] 10%|█         | 5/50 [00:05<00:28,  1.56it/s] 12%|█▏        | 6/50 [00:05<00:22,  1.94it/s] 14%|█▍        | 7/50 [00:06<00:18,  2.30it/s] 16%|█▌        | 8/50 [00:06<00:16,  2.62it/s] 18%|█▊        | 9/50 [00:06<00:14,  2.89it/s] 20%|██        | 10/50 [00:07<00:12,  3.10it/s] 22%|██▏       | 11/50 [00:07<00:11,  3.27it/s] 24%|██▍       | 12/50 [00:07<00:11,  3.40it/s] 26%|██▌       | 13/50 [00:07<00:10,  3.49it/s] 28%|██▊       | 14/50 [00:08<00:10,  3.56it/s] 30%|███       | 15/50 [00:08<00:09,  3.61it/s] 32%|███▏      | 16/50 [00:08<00:09,  3.65it/s] 34%|███▍      | 17/50 [00:08<00:08,  3.67it/s] 36%|███▌      | 18/50 [00:09<00:08,  3.68it/s] 38%|███▊      | 19/50 [00:09<00:08,  3.70it/s] 40%|████      | 20/50 [00:09<00:08,  3.71it/s] 42%|████▏     | 21/50 [00:09<00:07,  3.71it/s] 44%|████▍     | 22/50 [00:10<00:07,  3.72it/s] 46%|████▌     | 23/50 [00:10<00:07,  3.72it/s] 48%|████▊     | 24/50 [00:10<00:06,  3.72it/s] 50%|█████     | 25/50 [00:11<00:06,  3.72it/s] 52%|█████▏    | 26/50 [00:11<00:06,  3.72it/s] 54%|█████▍    | 27/50 [00:11<00:06,  3.72it/s] 56%|█████▌    | 28/50 [00:11<00:05,  3.72it/s] 58%|█████▊    | 29/50 [00:12<00:05,  3.72it/s] 60%|██████    | 30/50 [00:12<00:05,  3.72it/s] 62%|██████▏   | 31/50 [00:12<00:05,  3.72it/s] 64%|██████▍   | 32/50 [00:12<00:04,  3.72it/s] 66%|██████▌   | 33/50 [00:13<00:04,  3.72it/s] 68%|██████▊   | 34/50 [00:13<00:04,  3.71it/s] 70%|███████   | 35/50 [00:13<00:04,  3.72it/s] 72%|███████▏  | 36/50 [00:14<00:03,  3.71it/s] 74%|███████▍  | 37/50 [00:14<00:03,  3.71it/s] 76%|███████▌  | 38/50 [00:14<00:03,  3.71it/s] 78%|███████▊  | 39/50 [00:14<00:02,  3.71it/s] 80%|████████  | 40/50 [00:15<00:02,  3.71it/s] 82%|████████▏ | 41/50 [00:15<00:02,  3.71it/s] 84%|████████▍ | 42/50 [00:15<00:02,  3.71it/s] 86%|████████▌ | 43/50 [00:15<00:01,  3.71it/s] 88%|████████▊ | 44/50 [00:16<00:01,  3.71it/s] 90%|█████████ | 45/50 [00:16<00:01,  3.71it/s] 92%|█████████▏| 46/50 [00:16<00:01,  3.70it/s] 94%|█████████▍| 47/50 [00:16<00:00,  3.70it/s] 96%|█████████▌| 48/50 [00:17<00:00,  3.70it/s] 98%|█████████▊| 49/50 [00:17<00:00,  3.70it/s]100%|██████████| 50/50 [00:22<00:00,  1.65s/it]100%|██████████| 50/50 [00:22<00:00,  2.24it/s]
[I 2023-12-10 23:48:55,719] Trial 299 finished with value: 0.39291918272809995 and parameters: {'EMBEDDING_DIM': 925, 'HIDDEN_DIM': 393, 'NUM_LAYERS': 1, 'DROPOUT': 0.3183952146482672, 'LR': 0.0020638905076066135, 'WEIGHT_0': 0.35217518666282455, 'WEIGHT_1': 0.5908530661897133, 'WEIGHT_2': 0.18044883918318858, 'WEIGHT_3': 0.68275654952335, 'WEIGHT_4': 0.8671021307257074, 'WEIGHT_5': 0.761076948811864, 'WEIGHT_6': 0.4282610316466596, 'WEIGHT_7': 0.6130708723980347, 'WEIGHT_8': 0.43655592532479476, 'optimizer': 'Adam'}. Best is trial 221 with value: 0.418736930154747.
/userhome/cs2/dingruiw/conda/envs/py310/lib/python3.10/site-packages/torch/nn/modules/rnn.py:82: UserWarning: dropout option adds dropout after all but last recurrent layer, so non-zero dropout expects num_layers greater than 1, but got dropout=0.34159128331350763 and num_layers=1
  warnings.warn("dropout option adds dropout after all but last "
{'EMBEDDING_DIM': 925, 'HIDDEN_DIM': 393, 'NUM_LAYERS': 1, 'DROPOUT': 0.3183952146482672, 'LR': 0.0020638905076066135, 'WEIGHT_0': 0.35217518666282455, 'WEIGHT_1': 0.5908530661897133, 'WEIGHT_2': 0.18044883918318858, 'WEIGHT_3': 0.68275654952335, 'WEIGHT_4': 0.8671021307257074, 'WEIGHT_5': 0.761076948811864, 'WEIGHT_6': 0.4282610316466596, 'WEIGHT_7': 0.6130708723980347, 'WEIGHT_8': 0.43655592532479476, 'optimizer': 'Adam'}
0
              precision    recall  f1-score   support

         LOC       0.07      0.08      0.07      1837
        MISC       0.02      0.04      0.03       922
         ORG       0.04      0.07      0.05      1341
         PER       0.02      0.02      0.02      1842

   micro avg       0.04      0.05      0.04      5942
   macro avg       0.04      0.05      0.04      5942
weighted avg       0.04      0.05      0.04      5942

{'EMBEDDING_DIM': 925, 'HIDDEN_DIM': 393, 'NUM_LAYERS': 1, 'DROPOUT': 0.3183952146482672, 'LR': 0.0020638905076066135, 'WEIGHT_0': 0.35217518666282455, 'WEIGHT_1': 0.5908530661897133, 'WEIGHT_2': 0.18044883918318858, 'WEIGHT_3': 0.68275654952335, 'WEIGHT_4': 0.8671021307257074, 'WEIGHT_5': 0.761076948811864, 'WEIGHT_6': 0.4282610316466596, 'WEIGHT_7': 0.6130708723980347, 'WEIGHT_8': 0.43655592532479476, 'optimizer': 'Adam'}
49
              precision    recall  f1-score   support

         LOC       0.51      0.54      0.52      1837
        MISC       0.43      0.41      0.42       922
         ORG       0.27      0.27      0.27      1341
         PER       0.33      0.35      0.34      1842

   micro avg       0.39      0.40      0.39      5942
   macro avg       0.38      0.39      0.39      5942
weighted avg       0.39      0.40      0.39      5942

epoch 49
LSTM
  0%|          | 0/50 [00:00<?, ?it/s]  2%|▏         | 1/50 [00:04<03:48,  4.65s/it]  4%|▍         | 2/50 [00:04<01:35,  1.99s/it]  6%|▌         | 3/50 [00:05<00:55,  1.19s/it]  8%|▊         | 4/50 [00:05<00:37,  1.23it/s] 10%|█         | 5/50 [00:05<00:27,  1.66it/s] 12%|█▏        | 6/50 [00:05<00:20,  2.10it/s] 14%|█▍        | 7/50 [00:05<00:17,  2.53it/s] 16%|█▌        | 8/50 [00:06<00:14,  2.91it/s] 18%|█▊        | 9/50 [00:06<00:12,  3.24it/s] 20%|██        | 10/50 [00:06<00:11,  3.52it/s] 22%|██▏       | 11/50 [00:06<00:10,  3.73it/s] 24%|██▍       | 12/50 [00:07<00:09,  3.89it/s] 26%|██▌       | 13/50 [00:07<00:09,  4.01it/s] 28%|██▊       | 14/50 [00:07<00:08,  4.10it/s] 30%|███       | 15/50 [00:07<00:08,  4.17it/s] 32%|███▏      | 16/50 [00:08<00:08,  4.21it/s] 34%|███▍      | 17/50 [00:08<00:07,  4.25it/s] 36%|███▌      | 18/50 [00:08<00:07,  4.27it/s] 38%|███▊      | 19/50 [00:08<00:07,  4.29it/s] 40%|████      | 20/50 [00:08<00:06,  4.30it/s] 42%|████▏     | 21/50 [00:09<00:06,  4.30it/s] 44%|████▍     | 22/50 [00:09<00:06,  4.31it/s] 46%|████▌     | 23/50 [00:09<00:06,  4.31it/s] 48%|████▊     | 24/50 [00:09<00:06,  4.31it/s] 50%|█████     | 25/50 [00:10<00:05,  4.31it/s] 52%|█████▏    | 26/50 [00:10<00:05,  4.31it/s] 54%|█████▍    | 27/50 [00:10<00:05,  4.32it/s] 56%|█████▌    | 28/50 [00:10<00:05,  4.32it/s] 58%|█████▊    | 29/50 [00:11<00:04,  4.32it/s] 60%|██████    | 30/50 [00:11<00:04,  4.32it/s] 62%|██████▏   | 31/50 [00:11<00:04,  4.31it/s] 64%|██████▍   | 32/50 [00:11<00:04,  4.31it/s] 66%|██████▌   | 33/50 [00:11<00:03,  4.31it/s] 68%|██████▊   | 34/50 [00:12<00:03,  4.31it/s] 70%|███████   | 35/50 [00:12<00:03,  4.30it/s] 72%|███████▏  | 36/50 [00:12<00:03,  4.31it/s] 74%|███████▍  | 37/50 [00:12<00:03,  4.30it/s] 76%|███████▌  | 38/50 [00:13<00:02,  4.30it/s] 78%|███████▊  | 39/50 [00:13<00:02,  4.30it/s] 80%|████████  | 40/50 [00:13<00:02,  4.30it/s] 82%|████████▏ | 41/50 [00:13<00:02,  4.30it/s] 84%|████████▍ | 42/50 [00:14<00:01,  4.30it/s] 86%|████████▌ | 43/50 [00:14<00:01,  4.30it/s] 88%|████████▊ | 44/50 [00:14<00:01,  4.30it/s] 90%|█████████ | 45/50 [00:14<00:01,  4.30it/s] 92%|█████████▏| 46/50 [00:14<00:00,  4.30it/s] 94%|█████████▍| 47/50 [00:15<00:00,  4.30it/s] 96%|█████████▌| 48/50 [00:15<00:00,  4.30it/s] 98%|█████████▊| 49/50 [00:15<00:00,  4.30it/s]100%|██████████| 50/50 [00:20<00:00,  1.60s/it]100%|██████████| 50/50 [00:20<00:00,  2.44it/s]
[I 2023-12-10 23:49:20,370] Trial 300 finished with value: 0.40735068912710565 and parameters: {'EMBEDDING_DIM': 995, 'HIDDEN_DIM': 347, 'NUM_LAYERS': 1, 'DROPOUT': 0.34159128331350763, 'LR': 0.0015299808562117875, 'WEIGHT_0': 0.4695800412929948, 'WEIGHT_1': 0.8200251132743057, 'WEIGHT_2': 0.3648875594413239, 'WEIGHT_3': 0.5658753379354493, 'WEIGHT_4': 0.8962104119652695, 'WEIGHT_5': 0.9264743901953855, 'WEIGHT_6': 0.9573050287173244, 'WEIGHT_7': 0.5322574524807178, 'WEIGHT_8': 0.4858225470776958, 'optimizer': 'RMSprop'}. Best is trial 221 with value: 0.418736930154747.
/userhome/cs2/dingruiw/conda/envs/py310/lib/python3.10/site-packages/torch/nn/modules/rnn.py:82: UserWarning: dropout option adds dropout after all but last recurrent layer, so non-zero dropout expects num_layers greater than 1, but got dropout=0.07439704802156671 and num_layers=1
  warnings.warn("dropout option adds dropout after all but last "
{'EMBEDDING_DIM': 995, 'HIDDEN_DIM': 347, 'NUM_LAYERS': 1, 'DROPOUT': 0.34159128331350763, 'LR': 0.0015299808562117875, 'WEIGHT_0': 0.4695800412929948, 'WEIGHT_1': 0.8200251132743057, 'WEIGHT_2': 0.3648875594413239, 'WEIGHT_3': 0.5658753379354493, 'WEIGHT_4': 0.8962104119652695, 'WEIGHT_5': 0.9264743901953855, 'WEIGHT_6': 0.9573050287173244, 'WEIGHT_7': 0.5322574524807178, 'WEIGHT_8': 0.4858225470776958, 'optimizer': 'RMSprop'}
0
              precision    recall  f1-score   support

         LOC       0.37      0.19      0.25      1837
        MISC       0.07      0.02      0.03       922
         ORG       0.14      0.03      0.05      1341
         PER       0.08      0.05      0.06      1842

   micro avg       0.19      0.08      0.12      5942
   macro avg       0.17      0.07      0.10      5942
weighted avg       0.18      0.08      0.11      5942

{'EMBEDDING_DIM': 995, 'HIDDEN_DIM': 347, 'NUM_LAYERS': 1, 'DROPOUT': 0.34159128331350763, 'LR': 0.0015299808562117875, 'WEIGHT_0': 0.4695800412929948, 'WEIGHT_1': 0.8200251132743057, 'WEIGHT_2': 0.3648875594413239, 'WEIGHT_3': 0.5658753379354493, 'WEIGHT_4': 0.8962104119652695, 'WEIGHT_5': 0.9264743901953855, 'WEIGHT_6': 0.9573050287173244, 'WEIGHT_7': 0.5322574524807178, 'WEIGHT_8': 0.4858225470776958, 'optimizer': 'RMSprop'}
49
              precision    recall  f1-score   support

         LOC       0.54      0.54      0.54      1837
        MISC       0.50      0.43      0.46       922
         ORG       0.27      0.24      0.26      1341
         PER       0.34      0.37      0.35      1842

   micro avg       0.41      0.40      0.41      5942
   macro avg       0.41      0.40      0.40      5942
weighted avg       0.41      0.40      0.41      5942

epoch 49
LSTM
  0%|          | 0/50 [00:00<?, ?it/s]  2%|▏         | 1/50 [00:04<03:34,  4.38s/it]  6%|▌         | 3/50 [00:04<00:57,  1.22s/it]  8%|▊         | 4/50 [00:04<00:38,  1.18it/s] 10%|█         | 5/50 [00:04<00:27,  1.64it/s] 12%|█▏        | 6/50 [00:05<00:20,  2.19it/s] 14%|█▍        | 7/50 [00:05<00:15,  2.81it/s] 16%|█▌        | 8/50 [00:05<00:12,  3.48it/s] 18%|█▊        | 9/50 [00:05<00:09,  4.15it/s] 20%|██        | 10/50 [00:05<00:08,  4.79it/s] 22%|██▏       | 11/50 [00:05<00:07,  5.36it/s] 24%|██▍       | 12/50 [00:05<00:06,  5.86it/s] 26%|██▌       | 13/50 [00:05<00:05,  6.25it/s] 28%|██▊       | 14/50 [00:06<00:05,  6.56it/s] 30%|███       | 15/50 [00:06<00:05,  6.79it/s] 32%|███▏      | 16/50 [00:06<00:04,  6.97it/s] 34%|███▍      | 17/50 [00:06<00:04,  7.10it/s] 36%|███▌      | 18/50 [00:06<00:04,  7.18it/s] 38%|███▊      | 19/50 [00:06<00:04,  7.24it/s] 40%|████      | 20/50 [00:06<00:04,  7.29it/s] 42%|████▏     | 21/50 [00:07<00:03,  7.33it/s] 44%|████▍     | 22/50 [00:07<00:03,  7.35it/s] 46%|████▌     | 23/50 [00:07<00:03,  7.36it/s] 48%|████▊     | 24/50 [00:07<00:03,  7.39it/s] 50%|█████     | 25/50 [00:07<00:03,  7.39it/s] 52%|█████▏    | 26/50 [00:07<00:03,  7.39it/s] 54%|█████▍    | 27/50 [00:07<00:03,  7.40it/s] 56%|█████▌    | 28/50 [00:07<00:02,  7.39it/s] 58%|█████▊    | 29/50 [00:08<00:02,  7.40it/s] 60%|██████    | 30/50 [00:08<00:02,  7.39it/s] 62%|██████▏   | 31/50 [00:08<00:02,  7.41it/s] 64%|██████▍   | 32/50 [00:08<00:02,  7.41it/s] 66%|██████▌   | 33/50 [00:08<00:02,  7.41it/s] 68%|██████▊   | 34/50 [00:08<00:02,  7.41it/s] 70%|███████   | 35/50 [00:08<00:02,  7.41it/s] 72%|███████▏  | 36/50 [00:09<00:01,  7.41it/s] 74%|███████▍  | 37/50 [00:09<00:01,  7.40it/s] 76%|███████▌  | 38/50 [00:09<00:01,  7.40it/s] 78%|███████▊  | 39/50 [00:09<00:01,  7.40it/s] 80%|████████  | 40/50 [00:09<00:01,  7.41it/s] 82%|████████▏ | 41/50 [00:09<00:01,  7.42it/s] 84%|████████▍ | 42/50 [00:09<00:01,  7.40it/s] 86%|████████▌ | 43/50 [00:10<00:00,  7.40it/s] 88%|████████▊ | 44/50 [00:10<00:00,  7.40it/s] 90%|█████████ | 45/50 [00:10<00:00,  7.40it/s] 92%|█████████▏| 46/50 [00:10<00:00,  7.39it/s] 94%|█████████▍| 47/50 [00:10<00:00,  7.40it/s] 96%|█████████▌| 48/50 [00:10<00:00,  7.40it/s] 98%|█████████▊| 49/50 [00:10<00:00,  7.40it/s]100%|██████████| 50/50 [00:15<00:00,  1.45s/it]100%|██████████| 50/50 [00:15<00:00,  3.26it/s]
