[I 2023-12-11 00:26:50,288] Trial 381 finished with value: 0.40506329113924056 and parameters: {'EMBEDDING_DIM': 1024, 'HIDDEN_DIM': 318, 'NUM_LAYERS': 1, 'DROPOUT': 0.021166567709191213, 'LR': 0.0018060964596661555, 'WEIGHT_0': 0.19285475421427287, 'WEIGHT_1': 0.6019420847723455, 'WEIGHT_2': 0.49623056735535476, 'WEIGHT_3': 0.9039876600703718, 'WEIGHT_4': 0.7268272586085482, 'WEIGHT_5': 0.6928441960837377, 'WEIGHT_6': 0.6293423573988716, 'WEIGHT_7': 0.5533197479524424, 'WEIGHT_8': 0.9017928488172586, 'optimizer': 'RMSprop'}. Best is trial 365 with value: 0.41910947782240837.
/userhome/cs2/dingruiw/conda/envs/py310/lib/python3.10/site-packages/torch/nn/modules/rnn.py:82: UserWarning: dropout option adds dropout after all but last recurrent layer, so non-zero dropout expects num_layers greater than 1, but got dropout=0.08313660716157067 and num_layers=1
  warnings.warn("dropout option adds dropout after all but last "
{'EMBEDDING_DIM': 1024, 'HIDDEN_DIM': 318, 'NUM_LAYERS': 1, 'DROPOUT': 0.021166567709191213, 'LR': 0.0018060964596661555, 'WEIGHT_0': 0.19285475421427287, 'WEIGHT_1': 0.6019420847723455, 'WEIGHT_2': 0.49623056735535476, 'WEIGHT_3': 0.9039876600703718, 'WEIGHT_4': 0.7268272586085482, 'WEIGHT_5': 0.6928441960837377, 'WEIGHT_6': 0.6293423573988716, 'WEIGHT_7': 0.5533197479524424, 'WEIGHT_8': 0.9017928488172586, 'optimizer': 'RMSprop'}
0
              precision    recall  f1-score   support

         LOC       0.17      0.37      0.23      1837
        MISC       0.11      0.06      0.08       922
         ORG       0.10      0.12      0.11      1341
         PER       0.03      0.07      0.04      1842

   micro avg       0.10      0.17      0.12      5942
   macro avg       0.10      0.15      0.11      5942
weighted avg       0.10      0.17      0.12      5942

{'EMBEDDING_DIM': 1024, 'HIDDEN_DIM': 318, 'NUM_LAYERS': 1, 'DROPOUT': 0.021166567709191213, 'LR': 0.0018060964596661555, 'WEIGHT_0': 0.19285475421427287, 'WEIGHT_1': 0.6019420847723455, 'WEIGHT_2': 0.49623056735535476, 'WEIGHT_3': 0.9039876600703718, 'WEIGHT_4': 0.7268272586085482, 'WEIGHT_5': 0.6928441960837377, 'WEIGHT_6': 0.6293423573988716, 'WEIGHT_7': 0.5533197479524424, 'WEIGHT_8': 0.9017928488172586, 'optimizer': 'RMSprop'}
49
              precision    recall  f1-score   support

         LOC       0.53      0.54      0.53      1837
        MISC       0.45      0.45      0.45       922
         ORG       0.28      0.25      0.26      1341
         PER       0.35      0.36      0.35      1842

   micro avg       0.41      0.40      0.41      5942
   macro avg       0.40      0.40      0.40      5942
weighted avg       0.40      0.40      0.40      5942

epoch 49
LSTM
  0%|          | 0/50 [00:00<?, ?it/s]  2%|▏         | 1/50 [00:04<03:42,  4.53s/it]  6%|▌         | 3/50 [00:04<00:59,  1.28s/it]  8%|▊         | 4/50 [00:04<00:41,  1.12it/s] 10%|█         | 5/50 [00:05<00:29,  1.53it/s] 12%|█▏        | 6/50 [00:05<00:21,  2.01it/s] 14%|█▍        | 7/50 [00:05<00:16,  2.54it/s] 16%|█▌        | 8/50 [00:05<00:13,  3.09it/s] 18%|█▊        | 9/50 [00:05<00:11,  3.62it/s] 20%|██        | 10/50 [00:05<00:09,  4.11it/s] 22%|██▏       | 11/50 [00:06<00:08,  4.54it/s] 24%|██▍       | 12/50 [00:06<00:07,  4.89it/s] 26%|██▌       | 13/50 [00:06<00:07,  5.17it/s] 28%|██▊       | 14/50 [00:06<00:06,  5.39it/s] 30%|███       | 15/50 [00:06<00:06,  5.55it/s] 32%|███▏      | 16/50 [00:06<00:06,  5.66it/s] 34%|███▍      | 17/50 [00:07<00:05,  5.74it/s] 36%|███▌      | 18/50 [00:07<00:05,  5.80it/s] 38%|███▊      | 19/50 [00:07<00:05,  5.85it/s] 40%|████      | 20/50 [00:07<00:05,  5.87it/s] 42%|████▏     | 21/50 [00:07<00:04,  5.91it/s] 44%|████▍     | 22/50 [00:07<00:04,  5.92it/s] 46%|████▌     | 23/50 [00:08<00:04,  5.92it/s] 48%|████▊     | 24/50 [00:08<00:04,  5.93it/s] 50%|█████     | 25/50 [00:08<00:04,  5.94it/s] 52%|█████▏    | 26/50 [00:08<00:04,  5.93it/s] 54%|█████▍    | 27/50 [00:08<00:03,  5.94it/s] 56%|█████▌    | 28/50 [00:09<00:03,  5.94it/s] 58%|█████▊    | 29/50 [00:09<00:03,  5.95it/s] 60%|██████    | 30/50 [00:09<00:03,  5.94it/s] 62%|██████▏   | 31/50 [00:09<00:03,  5.93it/s] 64%|██████▍   | 32/50 [00:09<00:03,  5.93it/s] 66%|██████▌   | 33/50 [00:09<00:02,  5.93it/s] 68%|██████▊   | 34/50 [00:10<00:02,  5.91it/s] 70%|███████   | 35/50 [00:10<00:02,  5.93it/s] 72%|███████▏  | 36/50 [00:10<00:02,  5.93it/s] 74%|███████▍  | 37/50 [00:10<00:02,  5.92it/s] 76%|███████▌  | 38/50 [00:10<00:02,  5.93it/s] 78%|███████▊  | 39/50 [00:10<00:01,  5.92it/s] 80%|████████  | 40/50 [00:11<00:01,  5.92it/s] 82%|████████▏ | 41/50 [00:11<00:01,  5.93it/s] 84%|████████▍ | 42/50 [00:11<00:01,  5.93it/s] 86%|████████▌ | 43/50 [00:11<00:01,  5.92it/s] 88%|████████▊ | 44/50 [00:11<00:01,  5.93it/s] 90%|█████████ | 45/50 [00:11<00:00,  5.92it/s] 92%|█████████▏| 46/50 [00:12<00:00,  5.92it/s] 94%|█████████▍| 47/50 [00:12<00:00,  5.92it/s] 96%|█████████▌| 48/50 [00:12<00:00,  5.92it/s] 98%|█████████▊| 49/50 [00:12<00:00,  5.92it/s]100%|██████████| 50/50 [00:17<00:00,  1.50s/it]100%|██████████| 50/50 [00:17<00:00,  2.91it/s]
[I 2023-12-11 00:27:11,751] Trial 382 finished with value: 0.39788445890968277 and parameters: {'EMBEDDING_DIM': 950, 'HIDDEN_DIM': 244, 'NUM_LAYERS': 1, 'DROPOUT': 0.08313660716157067, 'LR': 0.0018489319617657509, 'WEIGHT_0': 0.15814063426213493, 'WEIGHT_1': 0.7117729535669662, 'WEIGHT_2': 0.4006273067167282, 'WEIGHT_3': 0.9220867155191855, 'WEIGHT_4': 0.7842965330523687, 'WEIGHT_5': 0.731243283327649, 'WEIGHT_6': 0.589128548712661, 'WEIGHT_7': 0.16208852685230324, 'WEIGHT_8': 0.8678409116464592, 'optimizer': 'RMSprop'}. Best is trial 365 with value: 0.41910947782240837.
/userhome/cs2/dingruiw/conda/envs/py310/lib/python3.10/site-packages/torch/nn/modules/rnn.py:82: UserWarning: dropout option adds dropout after all but last recurrent layer, so non-zero dropout expects num_layers greater than 1, but got dropout=0.03901661470391646 and num_layers=1
  warnings.warn("dropout option adds dropout after all but last "
{'EMBEDDING_DIM': 950, 'HIDDEN_DIM': 244, 'NUM_LAYERS': 1, 'DROPOUT': 0.08313660716157067, 'LR': 0.0018489319617657509, 'WEIGHT_0': 0.15814063426213493, 'WEIGHT_1': 0.7117729535669662, 'WEIGHT_2': 0.4006273067167282, 'WEIGHT_3': 0.9220867155191855, 'WEIGHT_4': 0.7842965330523687, 'WEIGHT_5': 0.731243283327649, 'WEIGHT_6': 0.589128548712661, 'WEIGHT_7': 0.16208852685230324, 'WEIGHT_8': 0.8678409116464592, 'optimizer': 'RMSprop'}
0
              precision    recall  f1-score   support

         LOC       0.47      0.28      0.35      1837
        MISC       0.10      0.04      0.06       922
         ORG       0.18      0.05      0.08      1341
         PER       0.12      0.07      0.09      1842

   micro avg       0.26      0.13      0.17      5942
   macro avg       0.22      0.11      0.14      5942
weighted avg       0.24      0.13      0.16      5942

{'EMBEDDING_DIM': 950, 'HIDDEN_DIM': 244, 'NUM_LAYERS': 1, 'DROPOUT': 0.08313660716157067, 'LR': 0.0018489319617657509, 'WEIGHT_0': 0.15814063426213493, 'WEIGHT_1': 0.7117729535669662, 'WEIGHT_2': 0.4006273067167282, 'WEIGHT_3': 0.9220867155191855, 'WEIGHT_4': 0.7842965330523687, 'WEIGHT_5': 0.731243283327649, 'WEIGHT_6': 0.589128548712661, 'WEIGHT_7': 0.16208852685230324, 'WEIGHT_8': 0.8678409116464592, 'optimizer': 'RMSprop'}
49
              precision    recall  f1-score   support

         LOC       0.52      0.54      0.53      1837
        MISC       0.44      0.46      0.45       922
         ORG       0.27      0.26      0.26      1341
         PER       0.32      0.38      0.34      1842

   micro avg       0.39      0.41      0.40      5942
   macro avg       0.38      0.41      0.39      5942
weighted avg       0.39      0.41      0.40      5942

epoch 49
LSTM
  0%|          | 0/50 [00:00<?, ?it/s]  2%|▏         | 1/50 [00:04<03:45,  4.61s/it]  4%|▍         | 2/50 [00:04<01:33,  1.96s/it]  6%|▌         | 3/50 [00:04<00:54,  1.15s/it]  8%|▊         | 4/50 [00:05<00:35,  1.30it/s] 10%|█         | 5/50 [00:05<00:25,  1.79it/s] 12%|█▏        | 6/50 [00:05<00:18,  2.32it/s] 14%|█▍        | 7/50 [00:05<00:15,  2.85it/s] 16%|█▌        | 8/50 [00:05<00:12,  3.36it/s] 18%|█▊        | 9/50 [00:06<00:10,  3.82it/s] 20%|██        | 10/50 [00:06<00:09,  4.20it/s] 22%|██▏       | 11/50 [00:06<00:08,  4.52it/s] 24%|██▍       | 12/50 [00:06<00:07,  4.76it/s] 26%|██▌       | 13/50 [00:06<00:07,  4.94it/s] 28%|██▊       | 14/50 [00:06<00:07,  5.08it/s] 30%|███       | 15/50 [00:07<00:06,  5.18it/s] 32%|███▏      | 16/50 [00:07<00:06,  5.25it/s] 34%|███▍      | 17/50 [00:07<00:06,  5.30it/s] 36%|███▌      | 18/50 [00:07<00:05,  5.34it/s] 38%|███▊      | 19/50 [00:07<00:05,  5.37it/s] 40%|████      | 20/50 [00:08<00:05,  5.38it/s] 42%|████▏     | 21/50 [00:08<00:05,  5.40it/s] 44%|████▍     | 22/50 [00:08<00:05,  5.41it/s] 46%|████▌     | 23/50 [00:08<00:04,  5.41it/s] 48%|████▊     | 24/50 [00:08<00:04,  5.42it/s] 50%|█████     | 25/50 [00:08<00:04,  5.43it/s] 52%|█████▏    | 26/50 [00:09<00:04,  5.42it/s] 54%|█████▍    | 27/50 [00:09<00:04,  5.42it/s] 56%|█████▌    | 28/50 [00:09<00:04,  5.42it/s] 58%|█████▊    | 29/50 [00:09<00:03,  5.42it/s] 60%|██████    | 30/50 [00:09<00:03,  5.42it/s] 62%|██████▏   | 31/50 [00:10<00:03,  5.42it/s] 64%|██████▍   | 32/50 [00:10<00:03,  5.42it/s] 66%|██████▌   | 33/50 [00:10<00:03,  5.43it/s] 68%|██████▊   | 34/50 [00:10<00:02,  5.43it/s] 70%|███████   | 35/50 [00:10<00:02,  5.42it/s] 72%|███████▏  | 36/50 [00:10<00:02,  5.43it/s] 74%|███████▍  | 37/50 [00:11<00:02,  5.42it/s] 76%|███████▌  | 38/50 [00:11<00:02,  5.41it/s] 78%|███████▊  | 39/50 [00:11<00:02,  5.41it/s] 80%|████████  | 40/50 [00:11<00:01,  5.41it/s] 82%|████████▏ | 41/50 [00:11<00:01,  5.40it/s] 84%|████████▍ | 42/50 [00:12<00:01,  5.41it/s] 86%|████████▌ | 43/50 [00:12<00:01,  5.41it/s] 88%|████████▊ | 44/50 [00:12<00:01,  5.41it/s] 90%|█████████ | 45/50 [00:12<00:00,  5.40it/s] 92%|█████████▏| 46/50 [00:12<00:00,  5.40it/s] 94%|█████████▍| 47/50 [00:13<00:00,  5.40it/s] 96%|█████████▌| 48/50 [00:13<00:00,  5.40it/s] 98%|█████████▊| 49/50 [00:13<00:00,  5.39it/s]100%|██████████| 50/50 [00:18<00:00,  1.53s/it]100%|██████████| 50/50 [00:18<00:00,  2.77it/s]
[I 2023-12-11 00:27:33,917] Trial 383 finished with value: 0.41605590591443664 and parameters: {'EMBEDDING_DIM': 988, 'HIDDEN_DIM': 266, 'NUM_LAYERS': 1, 'DROPOUT': 0.03901661470391646, 'LR': 0.0022113849390146575, 'WEIGHT_0': 0.2659929675082328, 'WEIGHT_1': 0.6454807987063647, 'WEIGHT_2': 0.3810030743931877, 'WEIGHT_3': 0.8761042311278446, 'WEIGHT_4': 0.7636797106166842, 'WEIGHT_5': 0.7010642003282965, 'WEIGHT_6': 0.6679122781903358, 'WEIGHT_7': 0.1887779978515411, 'WEIGHT_8': 0.9303867237504899, 'optimizer': 'RMSprop'}. Best is trial 365 with value: 0.41910947782240837.
/userhome/cs2/dingruiw/conda/envs/py310/lib/python3.10/site-packages/torch/nn/modules/rnn.py:82: UserWarning: dropout option adds dropout after all but last recurrent layer, so non-zero dropout expects num_layers greater than 1, but got dropout=0.04529546694034953 and num_layers=1
  warnings.warn("dropout option adds dropout after all but last "
{'EMBEDDING_DIM': 988, 'HIDDEN_DIM': 266, 'NUM_LAYERS': 1, 'DROPOUT': 0.03901661470391646, 'LR': 0.0022113849390146575, 'WEIGHT_0': 0.2659929675082328, 'WEIGHT_1': 0.6454807987063647, 'WEIGHT_2': 0.3810030743931877, 'WEIGHT_3': 0.8761042311278446, 'WEIGHT_4': 0.7636797106166842, 'WEIGHT_5': 0.7010642003282965, 'WEIGHT_6': 0.6679122781903358, 'WEIGHT_7': 0.1887779978515411, 'WEIGHT_8': 0.9303867237504899, 'optimizer': 'RMSprop'}
0
              precision    recall  f1-score   support

         LOC       0.61      0.15      0.24      1837
        MISC       0.04      0.01      0.02       922
         ORG       0.14      0.05      0.07      1341
         PER       0.11      0.03      0.04      1842

   micro avg       0.25      0.07      0.11      5942
   macro avg       0.22      0.06      0.09      5942
weighted avg       0.26      0.07      0.11      5942

{'EMBEDDING_DIM': 988, 'HIDDEN_DIM': 266, 'NUM_LAYERS': 1, 'DROPOUT': 0.03901661470391646, 'LR': 0.0022113849390146575, 'WEIGHT_0': 0.2659929675082328, 'WEIGHT_1': 0.6454807987063647, 'WEIGHT_2': 0.3810030743931877, 'WEIGHT_3': 0.8761042311278446, 'WEIGHT_4': 0.7636797106166842, 'WEIGHT_5': 0.7010642003282965, 'WEIGHT_6': 0.6679122781903358, 'WEIGHT_7': 0.1887779978515411, 'WEIGHT_8': 0.9303867237504899, 'optimizer': 'RMSprop'}
49
              precision    recall  f1-score   support

         LOC       0.57      0.54      0.56      1837
        MISC       0.50      0.45      0.47       922
         ORG       0.28      0.27      0.27      1341
         PER       0.35      0.36      0.36      1842

   micro avg       0.42      0.41      0.42      5942
   macro avg       0.42      0.41      0.41      5942
weighted avg       0.42      0.41      0.42      5942

epoch 49
LSTM
  0%|          | 0/50 [00:00<?, ?it/s]  2%|▏         | 1/50 [00:04<03:42,  4.55s/it]  6%|▌         | 3/50 [00:04<00:59,  1.27s/it]  8%|▊         | 4/50 [00:04<00:40,  1.14it/s] 10%|█         | 5/50 [00:05<00:28,  1.58it/s] 12%|█▏        | 6/50 [00:05<00:20,  2.11it/s] 14%|█▍        | 7/50 [00:05<00:15,  2.71it/s] 16%|█▌        | 8/50 [00:05<00:12,  3.35it/s] 18%|█▊        | 9/50 [00:05<00:10,  4.01it/s] 20%|██        | 10/50 [00:05<00:08,  4.63it/s] 22%|██▏       | 11/50 [00:05<00:07,  5.18it/s] 24%|██▍       | 12/50 [00:06<00:06,  5.66it/s] 26%|██▌       | 13/50 [00:06<00:06,  6.04it/s] 28%|██▊       | 14/50 [00:06<00:05,  6.33it/s] 30%|███       | 15/50 [00:06<00:05,  6.56it/s] 32%|███▏      | 16/50 [00:06<00:05,  6.72it/s] 34%|███▍      | 17/50 [00:06<00:04,  6.84it/s] 36%|███▌      | 18/50 [00:06<00:04,  6.93it/s] 38%|███▊      | 19/50 [00:07<00:04,  6.98it/s] 40%|████      | 20/50 [00:07<00:04,  7.04it/s] 42%|████▏     | 21/50 [00:07<00:04,  7.07it/s] 44%|████▍     | 22/50 [00:07<00:03,  7.07it/s] 46%|████▌     | 23/50 [00:07<00:03,  7.10it/s] 48%|████▊     | 24/50 [00:07<00:03,  7.12it/s] 50%|█████     | 25/50 [00:07<00:03,  7.12it/s] 52%|█████▏    | 26/50 [00:08<00:03,  7.14it/s] 54%|█████▍    | 27/50 [00:08<00:03,  7.15it/s] 56%|█████▌    | 28/50 [00:08<00:03,  7.14it/s] 58%|█████▊    | 29/50 [00:08<00:02,  7.15it/s] 60%|██████    | 30/50 [00:08<00:02,  7.15it/s] 62%|██████▏   | 31/50 [00:08<00:02,  7.14it/s] 64%|██████▍   | 32/50 [00:08<00:02,  7.15it/s] 66%|██████▌   | 33/50 [00:08<00:02,  7.15it/s] 68%|██████▊   | 34/50 [00:09<00:02,  7.14it/s] 70%|███████   | 35/50 [00:09<00:02,  7.14it/s] 72%|███████▏  | 36/50 [00:09<00:01,  7.15it/s] 74%|███████▍  | 37/50 [00:09<00:01,  7.14it/s] 76%|███████▌  | 38/50 [00:09<00:01,  7.14it/s] 78%|███████▊  | 39/50 [00:09<00:01,  7.15it/s] 80%|████████  | 40/50 [00:09<00:01,  7.14it/s] 82%|████████▏ | 41/50 [00:10<00:01,  7.14it/s] 84%|████████▍ | 42/50 [00:10<00:01,  7.14it/s] 86%|████████▌ | 43/50 [00:10<00:00,  7.14it/s] 88%|████████▊ | 44/50 [00:10<00:00,  7.15it/s] 90%|█████████ | 45/50 [00:10<00:00,  7.14it/s] 92%|█████████▏| 46/50 [00:10<00:00,  7.14it/s] 94%|█████████▍| 47/50 [00:10<00:00,  7.14it/s] 96%|█████████▌| 48/50 [00:11<00:00,  7.14it/s] 98%|█████████▊| 49/50 [00:11<00:00,  7.14it/s]100%|██████████| 50/50 [00:16<00:00,  1.53s/it]100%|██████████| 50/50 [00:16<00:00,  3.12it/s]
[I 2023-12-11 00:27:54,205] Trial 384 finished with value: 0.40548166062071744 and parameters: {'EMBEDDING_DIM': 968, 'HIDDEN_DIM': 193, 'NUM_LAYERS': 1, 'DROPOUT': 0.04529546694034953, 'LR': 0.0020784860801388344, 'WEIGHT_0': 0.22390646444386203, 'WEIGHT_1': 0.9337532108361629, 'WEIGHT_2': 0.48422323548385166, 'WEIGHT_3': 0.8863943371898709, 'WEIGHT_4': 0.8135146019564827, 'WEIGHT_5': 0.6979997801532289, 'WEIGHT_6': 0.6600425231231953, 'WEIGHT_7': 0.201618262839283, 'WEIGHT_8': 0.9397112616626864, 'optimizer': 'RMSprop'}. Best is trial 365 with value: 0.41910947782240837.
/userhome/cs2/dingruiw/conda/envs/py310/lib/python3.10/site-packages/torch/nn/modules/rnn.py:82: UserWarning: dropout option adds dropout after all but last recurrent layer, so non-zero dropout expects num_layers greater than 1, but got dropout=0.04629135447977409 and num_layers=1
  warnings.warn("dropout option adds dropout after all but last "
{'EMBEDDING_DIM': 968, 'HIDDEN_DIM': 193, 'NUM_LAYERS': 1, 'DROPOUT': 0.04529546694034953, 'LR': 0.0020784860801388344, 'WEIGHT_0': 0.22390646444386203, 'WEIGHT_1': 0.9337532108361629, 'WEIGHT_2': 0.48422323548385166, 'WEIGHT_3': 0.8863943371898709, 'WEIGHT_4': 0.8135146019564827, 'WEIGHT_5': 0.6979997801532289, 'WEIGHT_6': 0.6600425231231953, 'WEIGHT_7': 0.201618262839283, 'WEIGHT_8': 0.9397112616626864, 'optimizer': 'RMSprop'}
0
              precision    recall  f1-score   support

         LOC       0.32      0.32      0.32      1837
        MISC       0.16      0.02      0.03       922
         ORG       0.13      0.05      0.08      1341
         PER       0.08      0.07      0.07      1842

   micro avg       0.19      0.13      0.16      5942
   macro avg       0.17      0.11      0.12      5942
weighted avg       0.18      0.13      0.14      5942

{'EMBEDDING_DIM': 968, 'HIDDEN_DIM': 193, 'NUM_LAYERS': 1, 'DROPOUT': 0.04529546694034953, 'LR': 0.0020784860801388344, 'WEIGHT_0': 0.22390646444386203, 'WEIGHT_1': 0.9337532108361629, 'WEIGHT_2': 0.48422323548385166, 'WEIGHT_3': 0.8863943371898709, 'WEIGHT_4': 0.8135146019564827, 'WEIGHT_5': 0.6979997801532289, 'WEIGHT_6': 0.6600425231231953, 'WEIGHT_7': 0.201618262839283, 'WEIGHT_8': 0.9397112616626864, 'optimizer': 'RMSprop'}
49
              precision    recall  f1-score   support

         LOC       0.52      0.56      0.54      1837
        MISC       0.44      0.45      0.44       922
         ORG       0.27      0.28      0.27      1341
         PER       0.32      0.38      0.35      1842

   micro avg       0.39      0.42      0.41      5942
   macro avg       0.39      0.42      0.40      5942
weighted avg       0.39      0.42      0.41      5942

epoch 49
LSTM
  0%|          | 0/50 [00:00<?, ?it/s]  2%|▏         | 1/50 [00:04<03:44,  4.59s/it]  4%|▍         | 2/50 [00:04<01:33,  1.95s/it]  6%|▌         | 3/50 [00:04<00:54,  1.15s/it]  8%|▊         | 4/50 [00:05<00:35,  1.30it/s] 10%|█         | 5/50 [00:05<00:25,  1.79it/s] 12%|█▏        | 6/50 [00:05<00:18,  2.32it/s] 14%|█▍        | 7/50 [00:05<00:15,  2.86it/s] 16%|█▌        | 8/50 [00:05<00:12,  3.37it/s] 18%|█▊        | 9/50 [00:05<00:10,  3.83it/s] 20%|██        | 10/50 [00:06<00:09,  4.22it/s] 22%|██▏       | 11/50 [00:06<00:08,  4.54it/s] 24%|██▍       | 12/50 [00:06<00:07,  4.79it/s] 26%|██▌       | 13/50 [00:06<00:07,  4.98it/s] 28%|██▊       | 14/50 [00:06<00:07,  5.11it/s] 30%|███       | 15/50 [00:07<00:06,  5.22it/s] 32%|███▏      | 16/50 [00:07<00:06,  5.29it/s] 34%|███▍      | 17/50 [00:07<00:06,  5.34it/s] 36%|███▌      | 18/50 [00:07<00:05,  5.37it/s] 38%|███▊      | 19/50 [00:07<00:05,  5.41it/s] 40%|████      | 20/50 [00:08<00:05,  5.42it/s] 42%|████▏     | 21/50 [00:08<00:05,  5.43it/s] 44%|████▍     | 22/50 [00:08<00:05,  5.45it/s] 46%|████▌     | 23/50 [00:08<00:04,  5.45it/s] 48%|████▊     | 24/50 [00:08<00:04,  5.45it/s] 50%|█████     | 25/50 [00:08<00:04,  5.46it/s] 52%|█████▏    | 26/50 [00:09<00:04,  5.46it/s] 54%|█████▍    | 27/50 [00:09<00:04,  5.46it/s] 56%|█████▌    | 28/50 [00:09<00:04,  5.47it/s] 58%|█████▊    | 29/50 [00:09<00:03,  5.46it/s] 60%|██████    | 30/50 [00:09<00:03,  5.46it/s] 62%|██████▏   | 31/50 [00:10<00:03,  5.46it/s] 64%|██████▍   | 32/50 [00:10<00:03,  5.46it/s] 66%|██████▌   | 33/50 [00:10<00:03,  5.46it/s] 68%|██████▊   | 34/50 [00:10<00:02,  5.46it/s] 70%|███████   | 35/50 [00:10<00:02,  5.46it/s] 72%|███████▏  | 36/50 [00:10<00:02,  5.46it/s] 74%|███████▍  | 37/50 [00:11<00:02,  5.46it/s] 76%|███████▌  | 38/50 [00:11<00:02,  5.46it/s] 78%|███████▊  | 39/50 [00:11<00:02,  5.46it/s] 80%|████████  | 40/50 [00:11<00:01,  5.45it/s] 82%|████████▏ | 41/50 [00:11<00:01,  5.45it/s] 84%|████████▍ | 42/50 [00:12<00:01,  5.45it/s] 86%|████████▌ | 43/50 [00:12<00:01,  5.45it/s] 88%|████████▊ | 44/50 [00:12<00:01,  5.45it/s] 90%|█████████ | 45/50 [00:12<00:00,  5.45it/s] 92%|█████████▏| 46/50 [00:12<00:00,  5.44it/s] 94%|█████████▍| 47/50 [00:12<00:00,  5.43it/s] 96%|█████████▌| 48/50 [00:13<00:00,  5.44it/s] 98%|█████████▊| 49/50 [00:13<00:00,  5.44it/s]100%|██████████| 50/50 [00:17<00:00,  1.51s/it]100%|██████████| 50/50 [00:17<00:00,  2.79it/s]
