[I 2023-12-10 23:21:18,971] Trial 245 finished with value: 0.40197473014810475 and parameters: {'EMBEDDING_DIM': 1006, 'HIDDEN_DIM': 373, 'NUM_LAYERS': 1, 'DROPOUT': 0.37644598272241203, 'LR': 0.0018487976568084398, 'WEIGHT_0': 0.5183069035605158, 'WEIGHT_1': 0.46340642931467785, 'WEIGHT_2': 0.2082007812715433, 'WEIGHT_3': 0.8790812167087432, 'WEIGHT_4': 0.9377296997652207, 'WEIGHT_5': 0.7960513275012421, 'WEIGHT_6': 0.6905940197433986, 'WEIGHT_7': 0.5269969374144158, 'WEIGHT_8': 0.7314758023064691, 'optimizer': 'Adam'}. Best is trial 221 with value: 0.418736930154747.
/userhome/cs2/dingruiw/conda/envs/py310/lib/python3.10/site-packages/torch/nn/modules/rnn.py:82: UserWarning: dropout option adds dropout after all but last recurrent layer, so non-zero dropout expects num_layers greater than 1, but got dropout=0.3375053620640043 and num_layers=1
  warnings.warn("dropout option adds dropout after all but last "
{'EMBEDDING_DIM': 1006, 'HIDDEN_DIM': 373, 'NUM_LAYERS': 1, 'DROPOUT': 0.37644598272241203, 'LR': 0.0018487976568084398, 'WEIGHT_0': 0.5183069035605158, 'WEIGHT_1': 0.46340642931467785, 'WEIGHT_2': 0.2082007812715433, 'WEIGHT_3': 0.8790812167087432, 'WEIGHT_4': 0.9377296997652207, 'WEIGHT_5': 0.7960513275012421, 'WEIGHT_6': 0.6905940197433986, 'WEIGHT_7': 0.5269969374144158, 'WEIGHT_8': 0.7314758023064691, 'optimizer': 'Adam'}
0
              precision    recall  f1-score   support

         LOC       0.10      0.06      0.08      1837
        MISC       0.02      0.04      0.03       922
         ORG       0.03      0.07      0.04      1341
         PER       0.02      0.03      0.03      1842

   micro avg       0.04      0.05      0.04      5942
   macro avg       0.05      0.05      0.04      5942
weighted avg       0.05      0.05      0.05      5942

{'EMBEDDING_DIM': 1006, 'HIDDEN_DIM': 373, 'NUM_LAYERS': 1, 'DROPOUT': 0.37644598272241203, 'LR': 0.0018487976568084398, 'WEIGHT_0': 0.5183069035605158, 'WEIGHT_1': 0.46340642931467785, 'WEIGHT_2': 0.2082007812715433, 'WEIGHT_3': 0.8790812167087432, 'WEIGHT_4': 0.9377296997652207, 'WEIGHT_5': 0.7960513275012421, 'WEIGHT_6': 0.6905940197433986, 'WEIGHT_7': 0.5269969374144158, 'WEIGHT_8': 0.7314758023064691, 'optimizer': 'Adam'}
49
              precision    recall  f1-score   support

         LOC       0.55      0.58      0.57      1837
        MISC       0.46      0.41      0.43       922
         ORG       0.28      0.25      0.26      1341
         PER       0.30      0.34      0.32      1842

   micro avg       0.40      0.40      0.40      5942
   macro avg       0.40      0.39      0.40      5942
weighted avg       0.40      0.40      0.40      5942

epoch 49
LSTM
  0%|          | 0/50 [00:00<?, ?it/s]  2%|▏         | 1/50 [00:04<03:25,  4.19s/it]  4%|▍         | 2/50 [00:04<01:25,  1.79s/it]  6%|▌         | 3/50 [00:04<00:49,  1.06s/it]  8%|▊         | 4/50 [00:04<00:32,  1.40it/s] 10%|█         | 5/50 [00:04<00:23,  1.91it/s] 12%|█▏        | 6/50 [00:05<00:18,  2.44it/s] 14%|█▍        | 7/50 [00:05<00:14,  2.97it/s] 16%|█▌        | 8/50 [00:05<00:12,  3.47it/s] 18%|█▊        | 9/50 [00:05<00:10,  3.90it/s] 20%|██        | 10/50 [00:05<00:09,  4.26it/s] 22%|██▏       | 11/50 [00:05<00:08,  4.55it/s] 24%|██▍       | 12/50 [00:06<00:07,  4.77it/s] 26%|██▌       | 13/50 [00:06<00:07,  4.94it/s] 28%|██▊       | 14/50 [00:06<00:07,  5.07it/s] 30%|███       | 15/50 [00:06<00:06,  5.16it/s] 32%|███▏      | 16/50 [00:06<00:06,  5.22it/s] 34%|███▍      | 17/50 [00:07<00:06,  5.27it/s] 36%|███▌      | 18/50 [00:07<00:06,  5.30it/s] 38%|███▊      | 19/50 [00:07<00:05,  5.32it/s] 40%|████      | 20/50 [00:07<00:05,  5.34it/s] 42%|████▏     | 21/50 [00:07<00:05,  5.35it/s] 44%|████▍     | 22/50 [00:08<00:05,  5.36it/s] 46%|████▌     | 23/50 [00:08<00:05,  5.36it/s] 48%|████▊     | 24/50 [00:08<00:04,  5.36it/s] 50%|█████     | 25/50 [00:08<00:04,  5.37it/s] 52%|█████▏    | 26/50 [00:08<00:04,  5.37it/s] 54%|█████▍    | 27/50 [00:08<00:04,  5.37it/s] 56%|█████▌    | 28/50 [00:09<00:04,  5.37it/s] 58%|█████▊    | 29/50 [00:09<00:03,  5.37it/s] 60%|██████    | 30/50 [00:09<00:03,  5.37it/s] 62%|██████▏   | 31/50 [00:09<00:03,  5.38it/s] 64%|██████▍   | 32/50 [00:09<00:03,  5.38it/s] 66%|██████▌   | 33/50 [00:10<00:03,  5.37it/s] 68%|██████▊   | 34/50 [00:10<00:02,  5.37it/s] 70%|███████   | 35/50 [00:10<00:02,  5.38it/s] 72%|███████▏  | 36/50 [00:10<00:02,  5.37it/s] 74%|███████▍  | 37/50 [00:10<00:02,  5.37it/s] 76%|███████▌  | 38/50 [00:11<00:02,  5.37it/s] 78%|███████▊  | 39/50 [00:11<00:02,  5.37it/s] 80%|████████  | 40/50 [00:11<00:01,  5.37it/s] 82%|████████▏ | 41/50 [00:11<00:01,  5.37it/s] 84%|████████▍ | 42/50 [00:11<00:01,  5.37it/s] 86%|████████▌ | 43/50 [00:11<00:01,  5.37it/s] 88%|████████▊ | 44/50 [00:12<00:01,  5.37it/s] 90%|█████████ | 45/50 [00:12<00:00,  5.37it/s] 92%|█████████▏| 46/50 [00:12<00:00,  5.37it/s] 94%|█████████▍| 47/50 [00:12<00:00,  5.37it/s] 96%|█████████▌| 48/50 [00:12<00:00,  5.37it/s] 98%|█████████▊| 49/50 [00:13<00:00,  5.37it/s]100%|██████████| 50/50 [00:17<00:00,  1.44s/it]100%|██████████| 50/50 [00:17<00:00,  2.87it/s]
[I 2023-12-10 23:21:40,082] Trial 246 finished with value: 0.38104314676832446 and parameters: {'EMBEDDING_DIM': 909, 'HIDDEN_DIM': 159, 'NUM_LAYERS': 1, 'DROPOUT': 0.3375053620640043, 'LR': 0.0013927257759649124, 'WEIGHT_0': 0.38797467721417744, 'WEIGHT_1': 0.3845985864977971, 'WEIGHT_2': 0.2538782039559113, 'WEIGHT_3': 0.638353926414816, 'WEIGHT_4': 0.5939064755947376, 'WEIGHT_5': 0.5499156487847715, 'WEIGHT_6': 0.7488073807105967, 'WEIGHT_7': 0.4315253123115248, 'WEIGHT_8': 0.7909000242323164, 'optimizer': 'Adam'}. Best is trial 221 with value: 0.418736930154747.
/userhome/cs2/dingruiw/conda/envs/py310/lib/python3.10/site-packages/torch/nn/modules/rnn.py:82: UserWarning: dropout option adds dropout after all but last recurrent layer, so non-zero dropout expects num_layers greater than 1, but got dropout=0.40633863670769443 and num_layers=1
  warnings.warn("dropout option adds dropout after all but last "
{'EMBEDDING_DIM': 909, 'HIDDEN_DIM': 159, 'NUM_LAYERS': 1, 'DROPOUT': 0.3375053620640043, 'LR': 0.0013927257759649124, 'WEIGHT_0': 0.38797467721417744, 'WEIGHT_1': 0.3845985864977971, 'WEIGHT_2': 0.2538782039559113, 'WEIGHT_3': 0.638353926414816, 'WEIGHT_4': 0.5939064755947376, 'WEIGHT_5': 0.5499156487847715, 'WEIGHT_6': 0.7488073807105967, 'WEIGHT_7': 0.4315253123115248, 'WEIGHT_8': 0.7909000242323164, 'optimizer': 'Adam'}
0
              precision    recall  f1-score   support

         LOC       0.06      0.15      0.09      1837
        MISC       0.02      0.07      0.03       922
         ORG       0.03      0.10      0.05      1341
         PER       0.02      0.07      0.04      1842

   micro avg       0.03      0.10      0.05      5942
   macro avg       0.03      0.10      0.05      5942
weighted avg       0.04      0.10      0.05      5942

{'EMBEDDING_DIM': 909, 'HIDDEN_DIM': 159, 'NUM_LAYERS': 1, 'DROPOUT': 0.3375053620640043, 'LR': 0.0013927257759649124, 'WEIGHT_0': 0.38797467721417744, 'WEIGHT_1': 0.3845985864977971, 'WEIGHT_2': 0.2538782039559113, 'WEIGHT_3': 0.638353926414816, 'WEIGHT_4': 0.5939064755947376, 'WEIGHT_5': 0.5499156487847715, 'WEIGHT_6': 0.7488073807105967, 'WEIGHT_7': 0.4315253123115248, 'WEIGHT_8': 0.7909000242323164, 'optimizer': 'Adam'}
49
              precision    recall  f1-score   support

         LOC       0.55      0.54      0.55      1837
        MISC       0.55      0.32      0.41       922
         ORG       0.28      0.23      0.25      1341
         PER       0.28      0.32      0.30      1842

   micro avg       0.39      0.37      0.38      5942
   macro avg       0.41      0.35      0.38      5942
weighted avg       0.40      0.37      0.38      5942

epoch 49
LSTM
  0%|          | 0/50 [00:00<?, ?it/s]  2%|▏         | 1/50 [00:09<07:32,  9.23s/it]  4%|▍         | 2/50 [00:10<03:25,  4.28s/it]  6%|▌         | 3/50 [00:11<02:25,  3.10s/it]  8%|▊         | 4/50 [00:13<01:57,  2.54s/it] 10%|█         | 5/50 [00:15<01:40,  2.24s/it] 12%|█▏        | 6/50 [00:16<01:30,  2.06s/it] 14%|█▍        | 7/50 [00:18<01:23,  1.95s/it] 16%|█▌        | 8/50 [00:20<01:18,  1.88s/it] 18%|█▊        | 9/50 [00:22<01:15,  1.83s/it] 20%|██        | 10/50 [00:23<01:11,  1.80s/it] 22%|██▏       | 11/50 [00:25<01:09,  1.78s/it] 24%|██▍       | 12/50 [00:27<01:07,  1.77s/it] 26%|██▌       | 13/50 [00:28<01:05,  1.76s/it] 28%|██▊       | 14/50 [00:30<01:03,  1.75s/it] 30%|███       | 15/50 [00:32<01:01,  1.75s/it] 32%|███▏      | 16/50 [00:34<00:59,  1.75s/it] 34%|███▍      | 17/50 [00:35<00:57,  1.75s/it] 36%|███▌      | 18/50 [00:37<00:56,  1.76s/it] 38%|███▊      | 19/50 [00:39<00:54,  1.76s/it] 40%|████      | 20/50 [00:41<00:52,  1.76s/it] 42%|████▏     | 21/50 [00:43<00:51,  1.76s/it] 44%|████▍     | 22/50 [00:44<00:49,  1.77s/it] 46%|████▌     | 23/50 [00:46<00:47,  1.77s/it] 48%|████▊     | 24/50 [00:48<00:46,  1.78s/it] 50%|█████     | 25/50 [00:50<00:44,  1.78s/it] 52%|█████▏    | 26/50 [00:51<00:42,  1.78s/it] 54%|█████▍    | 27/50 [00:53<00:40,  1.78s/it] 56%|█████▌    | 28/50 [00:55<00:39,  1.78s/it] 58%|█████▊    | 29/50 [00:57<00:37,  1.77s/it] 60%|██████    | 30/50 [00:59<00:35,  1.78s/it] 62%|██████▏   | 31/50 [01:00<00:33,  1.78s/it] 64%|██████▍   | 32/50 [01:02<00:31,  1.78s/it] 66%|██████▌   | 33/50 [01:04<00:30,  1.78s/it] 68%|██████▊   | 34/50 [01:06<00:28,  1.79s/it] 70%|███████   | 35/50 [01:08<00:26,  1.79s/it] 72%|███████▏  | 36/50 [01:09<00:25,  1.79s/it] 74%|███████▍  | 37/50 [01:11<00:23,  1.79s/it] 76%|███████▌  | 38/50 [01:13<00:21,  1.79s/it] 78%|███████▊  | 39/50 [01:15<00:19,  1.79s/it] 80%|████████  | 40/50 [01:16<00:17,  1.80s/it] 82%|████████▏ | 41/50 [01:18<00:16,  1.79s/it] 84%|████████▍ | 42/50 [01:20<00:14,  1.79s/it] 86%|████████▌ | 43/50 [01:22<00:12,  1.79s/it] 88%|████████▊ | 44/50 [01:24<00:10,  1.80s/it] 90%|█████████ | 45/50 [01:25<00:08,  1.79s/it] 92%|█████████▏| 46/50 [01:27<00:07,  1.80s/it] 94%|█████████▍| 47/50 [01:29<00:05,  1.80s/it] 96%|█████████▌| 48/50 [01:31<00:03,  1.80s/it] 98%|█████████▊| 49/50 [01:33<00:01,  1.80s/it]100%|██████████| 50/50 [01:43<00:00,  4.36s/it]100%|██████████| 50/50 [01:43<00:00,  2.07s/it]
[I 2023-12-10 23:23:31,148] Trial 247 finished with value: 0.2690661055075829 and parameters: {'EMBEDDING_DIM': 1024, 'HIDDEN_DIM': 1682, 'NUM_LAYERS': 1, 'DROPOUT': 0.40633863670769443, 'LR': 0.0026085599772724256, 'WEIGHT_0': 0.43997502280268475, 'WEIGHT_1': 0.10877928634072476, 'WEIGHT_2': 0.42426318467541707, 'WEIGHT_3': 0.6716222208007414, 'WEIGHT_4': 0.9826791216031622, 'WEIGHT_5': 0.500813580900848, 'WEIGHT_6': 0.6714180337780677, 'WEIGHT_7': 0.31714139690864146, 'WEIGHT_8': 0.8338533637656304, 'optimizer': 'RMSprop'}. Best is trial 221 with value: 0.418736930154747.
/userhome/cs2/dingruiw/conda/envs/py310/lib/python3.10/site-packages/torch/nn/modules/rnn.py:82: UserWarning: dropout option adds dropout after all but last recurrent layer, so non-zero dropout expects num_layers greater than 1, but got dropout=0.37001373631936574 and num_layers=1
  warnings.warn("dropout option adds dropout after all but last "
{'EMBEDDING_DIM': 1024, 'HIDDEN_DIM': 1682, 'NUM_LAYERS': 1, 'DROPOUT': 0.40633863670769443, 'LR': 0.0026085599772724256, 'WEIGHT_0': 0.43997502280268475, 'WEIGHT_1': 0.10877928634072476, 'WEIGHT_2': 0.42426318467541707, 'WEIGHT_3': 0.6716222208007414, 'WEIGHT_4': 0.9826791216031622, 'WEIGHT_5': 0.500813580900848, 'WEIGHT_6': 0.6714180337780677, 'WEIGHT_7': 0.31714139690864146, 'WEIGHT_8': 0.8338533637656304, 'optimizer': 'RMSprop'}
0
              precision    recall  f1-score   support

         LOC       0.08      0.00      0.01      1837
        MISC       0.04      0.01      0.02       922
         ORG       0.10      0.05      0.06      1341
         PER       0.10      0.01      0.01      1842

   micro avg       0.09      0.02      0.03      5942
   macro avg       0.08      0.02      0.03      5942
weighted avg       0.09      0.02      0.02      5942

{'EMBEDDING_DIM': 1024, 'HIDDEN_DIM': 1682, 'NUM_LAYERS': 1, 'DROPOUT': 0.40633863670769443, 'LR': 0.0026085599772724256, 'WEIGHT_0': 0.43997502280268475, 'WEIGHT_1': 0.10877928634072476, 'WEIGHT_2': 0.42426318467541707, 'WEIGHT_3': 0.6716222208007414, 'WEIGHT_4': 0.9826791216031622, 'WEIGHT_5': 0.500813580900848, 'WEIGHT_6': 0.6714180337780677, 'WEIGHT_7': 0.31714139690864146, 'WEIGHT_8': 0.8338533637656304, 'optimizer': 'RMSprop'}
49
              precision    recall  f1-score   support

         LOC       0.51      0.43      0.47      1837
        MISC       0.15      0.48      0.23       922
         ORG       0.13      0.08      0.10      1341
         PER       0.21      0.28      0.24      1842

   micro avg       0.24      0.31      0.27      5942
   macro avg       0.25      0.32      0.26      5942
weighted avg       0.27      0.31      0.28      5942

epoch 49
LSTM
  0%|          | 0/50 [00:00<?, ?it/s]  2%|▏         | 1/50 [00:04<03:58,  4.86s/it]  4%|▍         | 2/50 [00:05<01:40,  2.10s/it]  6%|▌         | 3/50 [00:05<01:00,  1.28s/it]  8%|▊         | 4/50 [00:05<00:41,  1.11it/s] 10%|█         | 5/50 [00:05<00:30,  1.46it/s] 12%|█▏        | 6/50 [00:06<00:24,  1.80it/s] 14%|█▍        | 7/50 [00:06<00:20,  2.10it/s] 16%|█▌        | 8/50 [00:06<00:17,  2.36it/s] 18%|█▊        | 9/50 [00:07<00:15,  2.59it/s] 20%|██        | 10/50 [00:07<00:14,  2.76it/s] 22%|██▏       | 11/50 [00:07<00:13,  2.90it/s] 24%|██▍       | 12/50 [00:08<00:12,  3.00it/s] 26%|██▌       | 13/50 [00:08<00:12,  3.07it/s] 28%|██▊       | 14/50 [00:08<00:11,  3.12it/s] 30%|███       | 15/50 [00:09<00:11,  3.16it/s] 32%|███▏      | 16/50 [00:09<00:10,  3.19it/s] 34%|███▍      | 17/50 [00:09<00:10,  3.20it/s] 36%|███▌      | 18/50 [00:09<00:09,  3.21it/s] 38%|███▊      | 19/50 [00:10<00:09,  3.22it/s] 40%|████      | 20/50 [00:10<00:09,  3.23it/s] 42%|████▏     | 21/50 [00:10<00:08,  3.23it/s] 44%|████▍     | 22/50 [00:11<00:08,  3.23it/s] 46%|████▌     | 23/50 [00:11<00:08,  3.22it/s] 48%|████▊     | 24/50 [00:11<00:08,  3.23it/s] 50%|█████     | 25/50 [00:12<00:07,  3.23it/s] 52%|█████▏    | 26/50 [00:12<00:07,  3.23it/s] 54%|█████▍    | 27/50 [00:12<00:07,  3.23it/s] 56%|█████▌    | 28/50 [00:13<00:06,  3.23it/s] 58%|█████▊    | 29/50 [00:13<00:06,  3.23it/s] 60%|██████    | 30/50 [00:13<00:06,  3.22it/s] 62%|██████▏   | 31/50 [00:13<00:05,  3.22it/s] 64%|██████▍   | 32/50 [00:14<00:05,  3.22it/s] 66%|██████▌   | 33/50 [00:14<00:05,  3.22it/s] 68%|██████▊   | 34/50 [00:14<00:04,  3.21it/s] 70%|███████   | 35/50 [00:15<00:04,  3.21it/s] 72%|███████▏  | 36/50 [00:15<00:04,  3.20it/s] 74%|███████▍  | 37/50 [00:15<00:04,  3.21it/s] 76%|███████▌  | 38/50 [00:16<00:03,  3.20it/s] 78%|███████▊  | 39/50 [00:16<00:03,  3.21it/s] 80%|████████  | 40/50 [00:16<00:03,  3.21it/s] 82%|████████▏ | 41/50 [00:17<00:02,  3.20it/s] 84%|████████▍ | 42/50 [00:17<00:02,  3.21it/s] 86%|████████▌ | 43/50 [00:17<00:02,  3.20it/s] 88%|████████▊ | 44/50 [00:18<00:01,  3.20it/s] 90%|█████████ | 45/50 [00:18<00:01,  3.20it/s] 92%|█████████▏| 46/50 [00:18<00:01,  3.20it/s] 94%|█████████▍| 47/50 [00:18<00:00,  3.20it/s] 96%|█████████▌| 48/50 [00:19<00:00,  3.20it/s] 98%|█████████▊| 49/50 [00:19<00:00,  3.20it/s]100%|██████████| 50/50 [00:24<00:00,  1.74s/it]100%|██████████| 50/50 [00:24<00:00,  2.03it/s]
[I 2023-12-10 23:24:00,154] Trial 248 finished with value: 0.365717281146252 and parameters: {'EMBEDDING_DIM': 930, 'HIDDEN_DIM': 476, 'NUM_LAYERS': 1, 'DROPOUT': 0.37001373631936574, 'LR': 0.002172931119686209, 'WEIGHT_0': 0.7682932389560463, 'WEIGHT_1': 0.6443892184035804, 'WEIGHT_2': 0.2873575132754067, 'WEIGHT_3': 0.7670508351147538, 'WEIGHT_4': 0.5174077185186443, 'WEIGHT_5': 0.5883544181511312, 'WEIGHT_6': 0.6481005978477102, 'WEIGHT_7': 0.4937998811252096, 'WEIGHT_8': 0.7517679548519832, 'optimizer': 'RMSprop'}. Best is trial 221 with value: 0.418736930154747.
/userhome/cs2/dingruiw/conda/envs/py310/lib/python3.10/site-packages/torch/nn/modules/rnn.py:82: UserWarning: dropout option adds dropout after all but last recurrent layer, so non-zero dropout expects num_layers greater than 1, but got dropout=0.3552628738059988 and num_layers=1
  warnings.warn("dropout option adds dropout after all but last "
{'EMBEDDING_DIM': 930, 'HIDDEN_DIM': 476, 'NUM_LAYERS': 1, 'DROPOUT': 0.37001373631936574, 'LR': 0.002172931119686209, 'WEIGHT_0': 0.7682932389560463, 'WEIGHT_1': 0.6443892184035804, 'WEIGHT_2': 0.2873575132754067, 'WEIGHT_3': 0.7670508351147538, 'WEIGHT_4': 0.5174077185186443, 'WEIGHT_5': 0.5883544181511312, 'WEIGHT_6': 0.6481005978477102, 'WEIGHT_7': 0.4937998811252096, 'WEIGHT_8': 0.7517679548519832, 'optimizer': 'RMSprop'}
0
              precision    recall  f1-score   support

         LOC       0.11      0.08      0.09      1837
        MISC       0.03      0.01      0.01       922
         ORG       0.05      0.00      0.01      1341
         PER       0.02      0.01      0.01      1842

   micro avg       0.08      0.03      0.04      5942
   macro avg       0.05      0.02      0.03      5942
weighted avg       0.06      0.03      0.03      5942

{'EMBEDDING_DIM': 930, 'HIDDEN_DIM': 476, 'NUM_LAYERS': 1, 'DROPOUT': 0.37001373631936574, 'LR': 0.002172931119686209, 'WEIGHT_0': 0.7682932389560463, 'WEIGHT_1': 0.6443892184035804, 'WEIGHT_2': 0.2873575132754067, 'WEIGHT_3': 0.7670508351147538, 'WEIGHT_4': 0.5174077185186443, 'WEIGHT_5': 0.5883544181511312, 'WEIGHT_6': 0.6481005978477102, 'WEIGHT_7': 0.4937998811252096, 'WEIGHT_8': 0.7517679548519832, 'optimizer': 'RMSprop'}
49
              precision    recall  f1-score   support

         LOC       0.55      0.47      0.51      1837
        MISC       0.43      0.36      0.40       922
         ORG       0.25      0.23      0.24      1341
         PER       0.30      0.31      0.31      1842

   micro avg       0.38      0.35      0.37      5942
   macro avg       0.38      0.35      0.36      5942
weighted avg       0.39      0.35      0.37      5942

epoch 49
LSTM
  0%|          | 0/50 [00:00<?, ?it/s]  2%|▏         | 1/50 [00:04<03:56,  4.82s/it]  6%|▌         | 3/50 [00:05<01:03,  1.35s/it]  8%|▊         | 4/50 [00:05<00:43,  1.06it/s] 10%|█         | 5/50 [00:05<00:30,  1.46it/s] 12%|█▏        | 6/50 [00:05<00:22,  1.93it/s] 14%|█▍        | 7/50 [00:05<00:17,  2.45it/s] 16%|█▌        | 8/50 [00:05<00:13,  3.00it/s] 18%|█▊        | 9/50 [00:06<00:11,  3.56it/s] 20%|██        | 10/50 [00:06<00:09,  4.06it/s] 22%|██▏       | 11/50 [00:06<00:08,  4.51it/s] 24%|██▍       | 12/50 [00:06<00:07,  4.88it/s] 26%|██▌       | 13/50 [00:06<00:07,  5.18it/s] 28%|██▊       | 14/50 [00:06<00:06,  5.41it/s] 30%|███       | 15/50 [00:07<00:06,  5.58it/s] 32%|███▏      | 16/50 [00:07<00:05,  5.70it/s] 34%|███▍      | 17/50 [00:07<00:05,  5.80it/s] 36%|███▌      | 18/50 [00:07<00:05,  5.86it/s] 38%|███▊      | 19/50 [00:07<00:05,  5.92it/s] 40%|████      | 20/50 [00:07<00:05,  5.96it/s] 42%|████▏     | 21/50 [00:08<00:04,  5.98it/s] 44%|████▍     | 22/50 [00:08<00:04,  5.99it/s] 46%|████▌     | 23/50 [00:08<00:04,  6.00it/s] 48%|████▊     | 24/50 [00:08<00:04,  6.01it/s] 50%|█████     | 25/50 [00:08<00:04,  6.01it/s] 52%|█████▏    | 26/50 [00:08<00:03,  6.02it/s] 54%|█████▍    | 27/50 [00:09<00:03,  6.02it/s] 56%|█████▌    | 28/50 [00:09<00:03,  6.03it/s] 58%|█████▊    | 29/50 [00:09<00:03,  6.03it/s] 60%|██████    | 30/50 [00:09<00:03,  6.03it/s] 62%|██████▏   | 31/50 [00:09<00:03,  6.02it/s] 64%|██████▍   | 32/50 [00:09<00:02,  6.03it/s] 66%|██████▌   | 33/50 [00:10<00:02,  6.02it/s] 68%|██████▊   | 34/50 [00:10<00:02,  6.02it/s] 70%|███████   | 35/50 [00:10<00:02,  6.04it/s] 72%|███████▏  | 36/50 [00:10<00:02,  6.03it/s] 74%|███████▍  | 37/50 [00:10<00:02,  6.03it/s] 76%|███████▌  | 38/50 [00:10<00:01,  6.02it/s] 78%|███████▊  | 39/50 [00:11<00:01,  6.02it/s] 80%|████████  | 40/50 [00:11<00:01,  6.03it/s] 82%|████████▏ | 41/50 [00:11<00:01,  6.02it/s] 84%|████████▍ | 42/50 [00:11<00:01,  6.01it/s] 86%|████████▌ | 43/50 [00:11<00:01,  6.02it/s] 88%|████████▊ | 44/50 [00:11<00:00,  6.02it/s] 90%|█████████ | 45/50 [00:12<00:00,  6.02it/s] 92%|█████████▏| 46/50 [00:12<00:00,  6.02it/s] 94%|█████████▍| 47/50 [00:12<00:00,  6.02it/s] 96%|█████████▌| 48/50 [00:12<00:00,  6.02it/s] 98%|█████████▊| 49/50 [00:12<00:00,  6.02it/s]100%|██████████| 50/50 [00:17<00:00,  1.58s/it]100%|██████████| 50/50 [00:17<00:00,  2.84it/s]
