[I 2023-12-10 21:52:02,108] Trial 69 finished with value: 0.3956906631033907 and parameters: {'EMBEDDING_DIM': 868, 'HIDDEN_DIM': 454, 'NUM_LAYERS': 1, 'DROPOUT': 0.308868292071752, 'LR': 0.002174883508375282, 'WEIGHT_0': 0.5467072875900243, 'WEIGHT_1': 0.8558578346843345, 'WEIGHT_2': 0.49814307711345757, 'WEIGHT_3': 0.9977888601639704, 'WEIGHT_4': 0.7752895908390897, 'WEIGHT_5': 0.44228961065153066, 'WEIGHT_6': 0.9606750919752542, 'WEIGHT_7': 0.5038760452524039, 'WEIGHT_8': 0.44950678195632693, 'optimizer': 'Adam'}. Best is trial 51 with value: 0.41438326562364947.
/userhome/cs2/dingruiw/conda/envs/py310/lib/python3.10/site-packages/torch/nn/modules/rnn.py:82: UserWarning: dropout option adds dropout after all but last recurrent layer, so non-zero dropout expects num_layers greater than 1, but got dropout=0.3298454684608808 and num_layers=1
  warnings.warn("dropout option adds dropout after all but last "
{'EMBEDDING_DIM': 868, 'HIDDEN_DIM': 454, 'NUM_LAYERS': 1, 'DROPOUT': 0.308868292071752, 'LR': 0.002174883508375282, 'WEIGHT_0': 0.5467072875900243, 'WEIGHT_1': 0.8558578346843345, 'WEIGHT_2': 0.49814307711345757, 'WEIGHT_3': 0.9977888601639704, 'WEIGHT_4': 0.7752895908390897, 'WEIGHT_5': 0.44228961065153066, 'WEIGHT_6': 0.9606750919752542, 'WEIGHT_7': 0.5038760452524039, 'WEIGHT_8': 0.44950678195632693, 'optimizer': 'Adam'}
0
              precision    recall  f1-score   support

         LOC       0.05      0.03      0.04      1837
        MISC       0.02      0.05      0.03       922
         ORG       0.04      0.05      0.05      1341
         PER       0.03      0.03      0.03      1842

   micro avg       0.03      0.04      0.04      5942
   macro avg       0.04      0.04      0.04      5942
weighted avg       0.04      0.04      0.04      5942

{'EMBEDDING_DIM': 868, 'HIDDEN_DIM': 454, 'NUM_LAYERS': 1, 'DROPOUT': 0.308868292071752, 'LR': 0.002174883508375282, 'WEIGHT_0': 0.5467072875900243, 'WEIGHT_1': 0.8558578346843345, 'WEIGHT_2': 0.49814307711345757, 'WEIGHT_3': 0.9977888601639704, 'WEIGHT_4': 0.7752895908390897, 'WEIGHT_5': 0.44228961065153066, 'WEIGHT_6': 0.9606750919752542, 'WEIGHT_7': 0.5038760452524039, 'WEIGHT_8': 0.44950678195632693, 'optimizer': 'Adam'}
49
              precision    recall  f1-score   support

         LOC       0.56      0.53      0.54      1837
        MISC       0.40      0.43      0.42       922
         ORG       0.29      0.25      0.27      1341
         PER       0.31      0.36      0.33      1842

   micro avg       0.39      0.40      0.40      5942
   macro avg       0.39      0.39      0.39      5942
weighted avg       0.40      0.40      0.40      5942

epoch 49
LSTM
  0%|          | 0/50 [00:00<?, ?it/s]  2%|▏         | 1/50 [00:05<04:08,  5.08s/it]  4%|▍         | 2/50 [00:05<01:47,  2.24s/it]  6%|▌         | 3/50 [00:05<01:08,  1.46s/it]  8%|▊         | 4/50 [00:06<00:50,  1.10s/it] 10%|█         | 5/50 [00:06<00:40,  1.12it/s] 12%|█▏        | 6/50 [00:07<00:34,  1.29it/s] 14%|█▍        | 7/50 [00:08<00:30,  1.43it/s] 16%|█▌        | 8/50 [00:08<00:27,  1.54it/s] 18%|█▊        | 9/50 [00:09<00:25,  1.63it/s] 20%|██        | 10/50 [00:09<00:23,  1.69it/s] 22%|██▏       | 11/50 [00:10<00:22,  1.74it/s] 24%|██▍       | 12/50 [00:10<00:21,  1.77it/s] 26%|██▌       | 13/50 [00:11<00:20,  1.80it/s] 28%|██▊       | 14/50 [00:11<00:19,  1.81it/s] 30%|███       | 15/50 [00:12<00:19,  1.82it/s] 32%|███▏      | 16/50 [00:12<00:18,  1.83it/s] 34%|███▍      | 17/50 [00:13<00:17,  1.85it/s] 36%|███▌      | 18/50 [00:13<00:17,  1.85it/s] 38%|███▊      | 19/50 [00:14<00:16,  1.85it/s] 40%|████      | 20/50 [00:15<00:16,  1.85it/s] 42%|████▏     | 21/50 [00:15<00:15,  1.85it/s] 44%|████▍     | 22/50 [00:16<00:15,  1.85it/s] 46%|████▌     | 23/50 [00:16<00:14,  1.85it/s] 48%|████▊     | 24/50 [00:17<00:14,  1.84it/s] 50%|█████     | 25/50 [00:17<00:13,  1.84it/s] 52%|█████▏    | 26/50 [00:18<00:13,  1.84it/s] 54%|█████▍    | 27/50 [00:18<00:12,  1.84it/s] 56%|█████▌    | 28/50 [00:19<00:11,  1.85it/s] 58%|█████▊    | 29/50 [00:19<00:11,  1.84it/s] 60%|██████    | 30/50 [00:20<00:10,  1.84it/s] 62%|██████▏   | 31/50 [00:20<00:10,  1.84it/s] 64%|██████▍   | 32/50 [00:21<00:09,  1.84it/s] 66%|██████▌   | 33/50 [00:22<00:09,  1.84it/s] 68%|██████▊   | 34/50 [00:22<00:08,  1.84it/s] 70%|███████   | 35/50 [00:23<00:08,  1.84it/s] 72%|███████▏  | 36/50 [00:23<00:07,  1.83it/s] 74%|███████▍  | 37/50 [00:24<00:07,  1.84it/s] 76%|███████▌  | 38/50 [00:24<00:06,  1.84it/s] 78%|███████▊  | 39/50 [00:25<00:05,  1.83it/s] 80%|████████  | 40/50 [00:25<00:05,  1.83it/s] 82%|████████▏ | 41/50 [00:26<00:04,  1.83it/s] 84%|████████▍ | 42/50 [00:27<00:04,  1.83it/s] 86%|████████▌ | 43/50 [00:27<00:03,  1.83it/s] 88%|████████▊ | 44/50 [00:28<00:03,  1.83it/s] 90%|█████████ | 45/50 [00:28<00:02,  1.82it/s] 92%|█████████▏| 46/50 [00:29<00:02,  1.82it/s] 94%|█████████▍| 47/50 [00:29<00:01,  1.82it/s] 96%|█████████▌| 48/50 [00:30<00:01,  1.82it/s] 98%|█████████▊| 49/50 [00:30<00:00,  1.83it/s]100%|██████████| 50/50 [00:36<00:00,  1.97s/it]100%|██████████| 50/50 [00:36<00:00,  1.38it/s]
[I 2023-12-10 21:52:42,555] Trial 70 finished with value: 0.4027172966382163 and parameters: {'EMBEDDING_DIM': 927, 'HIDDEN_DIM': 744, 'NUM_LAYERS': 1, 'DROPOUT': 0.3298454684608808, 'LR': 0.0015370941513836883, 'WEIGHT_0': 0.4969404376730901, 'WEIGHT_1': 0.7607835229965196, 'WEIGHT_2': 0.39157107227763904, 'WEIGHT_3': 0.8743125496637428, 'WEIGHT_4': 0.7015711108184102, 'WEIGHT_5': 0.4681600778904541, 'WEIGHT_6': 0.9152142131031875, 'WEIGHT_7': 0.3667404947868009, 'WEIGHT_8': 0.42457968059055784, 'optimizer': 'Adam'}. Best is trial 51 with value: 0.41438326562364947.
/userhome/cs2/dingruiw/conda/envs/py310/lib/python3.10/site-packages/torch/nn/modules/rnn.py:82: UserWarning: dropout option adds dropout after all but last recurrent layer, so non-zero dropout expects num_layers greater than 1, but got dropout=0.3928005431047581 and num_layers=1
  warnings.warn("dropout option adds dropout after all but last "
{'EMBEDDING_DIM': 927, 'HIDDEN_DIM': 744, 'NUM_LAYERS': 1, 'DROPOUT': 0.3298454684608808, 'LR': 0.0015370941513836883, 'WEIGHT_0': 0.4969404376730901, 'WEIGHT_1': 0.7607835229965196, 'WEIGHT_2': 0.39157107227763904, 'WEIGHT_3': 0.8743125496637428, 'WEIGHT_4': 0.7015711108184102, 'WEIGHT_5': 0.4681600778904541, 'WEIGHT_6': 0.9152142131031875, 'WEIGHT_7': 0.3667404947868009, 'WEIGHT_8': 0.42457968059055784, 'optimizer': 'Adam'}
0
              precision    recall  f1-score   support

         LOC       0.06      0.05      0.05      1837
        MISC       0.00      0.01      0.00       922
         ORG       0.05      0.04      0.05      1341
         PER       0.03      0.02      0.02      1842

   micro avg       0.04      0.03      0.03      5942
   macro avg       0.04      0.03      0.03      5942
weighted avg       0.04      0.03      0.03      5942

{'EMBEDDING_DIM': 927, 'HIDDEN_DIM': 744, 'NUM_LAYERS': 1, 'DROPOUT': 0.3298454684608808, 'LR': 0.0015370941513836883, 'WEIGHT_0': 0.4969404376730901, 'WEIGHT_1': 0.7607835229965196, 'WEIGHT_2': 0.39157107227763904, 'WEIGHT_3': 0.8743125496637428, 'WEIGHT_4': 0.7015711108184102, 'WEIGHT_5': 0.4681600778904541, 'WEIGHT_6': 0.9152142131031875, 'WEIGHT_7': 0.3667404947868009, 'WEIGHT_8': 0.42457968059055784, 'optimizer': 'Adam'}
49
              precision    recall  f1-score   support

         LOC       0.61      0.52      0.56      1837
        MISC       0.43      0.41      0.42       922
         ORG       0.29      0.27      0.28      1341
         PER       0.34      0.34      0.34      1842

   micro avg       0.42      0.39      0.40      5942
   macro avg       0.42      0.38      0.40      5942
weighted avg       0.42      0.39      0.41      5942

epoch 49
LSTM
  0%|          | 0/50 [00:00<?, ?it/s]  2%|▏         | 1/50 [00:04<03:56,  4.82s/it]  4%|▍         | 2/50 [00:04<01:38,  2.06s/it]  6%|▌         | 3/50 [00:05<00:58,  1.24s/it]  8%|▊         | 4/50 [00:05<00:39,  1.18it/s] 10%|█         | 5/50 [00:05<00:28,  1.58it/s] 12%|█▏        | 6/50 [00:05<00:22,  1.99it/s] 14%|█▍        | 7/50 [00:06<00:18,  2.38it/s] 16%|█▌        | 8/50 [00:06<00:15,  2.73it/s] 18%|█▊        | 9/50 [00:06<00:13,  3.03it/s] 20%|██        | 10/50 [00:06<00:12,  3.27it/s] 22%|██▏       | 11/50 [00:07<00:11,  3.46it/s] 24%|██▍       | 12/50 [00:07<00:10,  3.60it/s] 26%|██▌       | 13/50 [00:07<00:09,  3.71it/s] 28%|██▊       | 14/50 [00:07<00:09,  3.79it/s] 30%|███       | 15/50 [00:08<00:09,  3.84it/s] 32%|███▏      | 16/50 [00:08<00:08,  3.88it/s] 34%|███▍      | 17/50 [00:08<00:08,  3.91it/s] 36%|███▌      | 18/50 [00:08<00:08,  3.93it/s] 38%|███▊      | 19/50 [00:09<00:07,  3.95it/s] 40%|████      | 20/50 [00:09<00:07,  3.96it/s] 42%|████▏     | 21/50 [00:09<00:07,  3.96it/s] 44%|████▍     | 22/50 [00:09<00:07,  3.97it/s] 46%|████▌     | 23/50 [00:10<00:06,  3.97it/s] 48%|████▊     | 24/50 [00:10<00:06,  3.97it/s] 50%|█████     | 25/50 [00:10<00:06,  3.97it/s] 52%|█████▏    | 26/50 [00:10<00:06,  3.97it/s] 54%|█████▍    | 27/50 [00:11<00:05,  3.97it/s] 56%|█████▌    | 28/50 [00:11<00:05,  3.98it/s] 58%|█████▊    | 29/50 [00:11<00:05,  3.98it/s] 60%|██████    | 30/50 [00:11<00:05,  3.97it/s] 62%|██████▏   | 31/50 [00:12<00:04,  3.97it/s] 64%|██████▍   | 32/50 [00:12<00:04,  3.97it/s] 66%|██████▌   | 33/50 [00:12<00:04,  3.98it/s] 68%|██████▊   | 34/50 [00:12<00:04,  3.97it/s] 70%|███████   | 35/50 [00:13<00:03,  3.97it/s] 72%|███████▏  | 36/50 [00:13<00:03,  3.97it/s] 74%|███████▍  | 37/50 [00:13<00:03,  3.97it/s] 76%|███████▌  | 38/50 [00:14<00:03,  3.97it/s] 78%|███████▊  | 39/50 [00:14<00:02,  3.96it/s] 80%|████████  | 40/50 [00:14<00:02,  3.95it/s] 82%|████████▏ | 41/50 [00:14<00:02,  3.94it/s] 84%|████████▍ | 42/50 [00:15<00:02,  3.94it/s] 86%|████████▌ | 43/50 [00:15<00:01,  3.93it/s] 88%|████████▊ | 44/50 [00:15<00:01,  3.93it/s] 90%|█████████ | 45/50 [00:15<00:01,  3.93it/s] 92%|█████████▏| 46/50 [00:16<00:01,  3.94it/s] 94%|█████████▍| 47/50 [00:16<00:00,  3.95it/s] 96%|█████████▌| 48/50 [00:16<00:00,  3.95it/s] 98%|█████████▊| 49/50 [00:16<00:00,  3.95it/s]100%|██████████| 50/50 [00:21<00:00,  1.64s/it]100%|██████████| 50/50 [00:21<00:00,  2.31it/s]
[I 2023-12-10 21:53:08,459] Trial 71 finished with value: 0.40214158239143366 and parameters: {'EMBEDDING_DIM': 900, 'HIDDEN_DIM': 382, 'NUM_LAYERS': 1, 'DROPOUT': 0.3928005431047581, 'LR': 0.001241609796940789, 'WEIGHT_0': 0.40355358870286595, 'WEIGHT_1': 0.7119859827300614, 'WEIGHT_2': 0.362881321169811, 'WEIGHT_3': 0.948415501838103, 'WEIGHT_4': 0.7797442882487372, 'WEIGHT_5': 0.5177793584440372, 'WEIGHT_6': 0.8634318782221562, 'WEIGHT_7': 0.5122974568318285, 'WEIGHT_8': 0.3202640391089123, 'optimizer': 'Adam'}. Best is trial 51 with value: 0.41438326562364947.
/userhome/cs2/dingruiw/conda/envs/py310/lib/python3.10/site-packages/torch/nn/modules/rnn.py:82: UserWarning: dropout option adds dropout after all but last recurrent layer, so non-zero dropout expects num_layers greater than 1, but got dropout=0.40656007747709866 and num_layers=1
  warnings.warn("dropout option adds dropout after all but last "
{'EMBEDDING_DIM': 900, 'HIDDEN_DIM': 382, 'NUM_LAYERS': 1, 'DROPOUT': 0.3928005431047581, 'LR': 0.001241609796940789, 'WEIGHT_0': 0.40355358870286595, 'WEIGHT_1': 0.7119859827300614, 'WEIGHT_2': 0.362881321169811, 'WEIGHT_3': 0.948415501838103, 'WEIGHT_4': 0.7797442882487372, 'WEIGHT_5': 0.5177793584440372, 'WEIGHT_6': 0.8634318782221562, 'WEIGHT_7': 0.5122974568318285, 'WEIGHT_8': 0.3202640391089123, 'optimizer': 'Adam'}
0
              precision    recall  f1-score   support

         LOC       0.07      0.10      0.08      1837
        MISC       0.03      0.08      0.04       922
         ORG       0.03      0.08      0.04      1341
         PER       0.02      0.11      0.04      1842

   micro avg       0.03      0.10      0.05      5942
   macro avg       0.04      0.09      0.05      5942
weighted avg       0.04      0.10      0.05      5942

{'EMBEDDING_DIM': 900, 'HIDDEN_DIM': 382, 'NUM_LAYERS': 1, 'DROPOUT': 0.3928005431047581, 'LR': 0.001241609796940789, 'WEIGHT_0': 0.40355358870286595, 'WEIGHT_1': 0.7119859827300614, 'WEIGHT_2': 0.362881321169811, 'WEIGHT_3': 0.948415501838103, 'WEIGHT_4': 0.7797442882487372, 'WEIGHT_5': 0.5177793584440372, 'WEIGHT_6': 0.8634318782221562, 'WEIGHT_7': 0.5122974568318285, 'WEIGHT_8': 0.3202640391089123, 'optimizer': 'Adam'}
49
              precision    recall  f1-score   support

         LOC       0.57      0.53      0.55      1837
        MISC       0.48      0.42      0.45       922
         ORG       0.27      0.26      0.26      1341
         PER       0.33      0.35      0.34      1842

   micro avg       0.41      0.40      0.40      5942
   macro avg       0.41      0.39      0.40      5942
weighted avg       0.41      0.40      0.40      5942

epoch 49
LSTM
  0%|          | 0/50 [00:00<?, ?it/s]  2%|▏         | 1/50 [00:04<03:24,  4.17s/it] 10%|█         | 5/50 [00:04<00:28,  1.55it/s] 16%|█▌        | 8/50 [00:04<00:15,  2.67it/s] 20%|██        | 10/50 [00:04<00:11,  3.55it/s] 24%|██▍       | 12/50 [00:04<00:08,  4.58it/s] 28%|██▊       | 14/50 [00:04<00:06,  5.71it/s] 32%|███▏      | 16/50 [00:05<00:04,  6.89it/s] 36%|███▌      | 18/50 [00:05<00:03,  8.03it/s] 40%|████      | 20/50 [00:05<00:03,  9.07it/s] 44%|████▍     | 22/50 [00:05<00:02,  9.98it/s] 48%|████▊     | 24/50 [00:05<00:02, 10.73it/s] 52%|█████▏    | 26/50 [00:05<00:02, 11.31it/s] 56%|█████▌    | 28/50 [00:06<00:01, 11.76it/s] 60%|██████    | 30/50 [00:06<00:01, 12.11it/s] 64%|██████▍   | 32/50 [00:06<00:01, 12.35it/s] 68%|██████▊   | 34/50 [00:06<00:01, 12.54it/s] 72%|███████▏  | 36/50 [00:06<00:01, 12.66it/s] 76%|███████▌  | 38/50 [00:06<00:00, 12.77it/s] 80%|████████  | 40/50 [00:06<00:00, 12.83it/s] 84%|████████▍ | 42/50 [00:07<00:00, 12.88it/s] 88%|████████▊ | 44/50 [00:07<00:00, 12.91it/s] 92%|█████████▏| 46/50 [00:07<00:00, 12.92it/s] 96%|█████████▌| 48/50 [00:07<00:00, 12.93it/s]100%|██████████| 50/50 [00:11<00:00,  1.42it/s]100%|██████████| 50/50 [00:11<00:00,  4.19it/s]
[I 2023-12-10 21:53:24,183] Trial 72 finished with value: 0.25822731573966984 and parameters: {'EMBEDDING_DIM': 983, 'HIDDEN_DIM': 85, 'NUM_LAYERS': 1, 'DROPOUT': 0.40656007747709866, 'LR': 0.000734628942942972, 'WEIGHT_0': 0.4421660520219734, 'WEIGHT_1': 0.7541052726654713, 'WEIGHT_2': 0.43822101168767785, 'WEIGHT_3': 0.9415523536834528, 'WEIGHT_4': 0.753769617283164, 'WEIGHT_5': 0.640607118526167, 'WEIGHT_6': 0.9077989501216426, 'WEIGHT_7': 0.5918374860768754, 'WEIGHT_8': 0.3641671164851471, 'optimizer': 'Adam'}. Best is trial 51 with value: 0.41438326562364947.
/userhome/cs2/dingruiw/conda/envs/py310/lib/python3.10/site-packages/torch/nn/modules/rnn.py:82: UserWarning: dropout option adds dropout after all but last recurrent layer, so non-zero dropout expects num_layers greater than 1, but got dropout=0.35717007459329103 and num_layers=1
  warnings.warn("dropout option adds dropout after all but last "
{'EMBEDDING_DIM': 983, 'HIDDEN_DIM': 85, 'NUM_LAYERS': 1, 'DROPOUT': 0.40656007747709866, 'LR': 0.000734628942942972, 'WEIGHT_0': 0.4421660520219734, 'WEIGHT_1': 0.7541052726654713, 'WEIGHT_2': 0.43822101168767785, 'WEIGHT_3': 0.9415523536834528, 'WEIGHT_4': 0.753769617283164, 'WEIGHT_5': 0.640607118526167, 'WEIGHT_6': 0.9077989501216426, 'WEIGHT_7': 0.5918374860768754, 'WEIGHT_8': 0.3641671164851471, 'optimizer': 'Adam'}
0
              precision    recall  f1-score   support

         LOC       0.03      0.05      0.04      1837
        MISC       0.02      0.15      0.03       922
         ORG       0.01      0.15      0.03      1341
         PER       0.01      0.10      0.02      1842

   micro avg       0.02      0.10      0.03      5942
   macro avg       0.02      0.11      0.03      5942
weighted avg       0.02      0.10      0.03      5942

{'EMBEDDING_DIM': 983, 'HIDDEN_DIM': 85, 'NUM_LAYERS': 1, 'DROPOUT': 0.40656007747709866, 'LR': 0.000734628942942972, 'WEIGHT_0': 0.4421660520219734, 'WEIGHT_1': 0.7541052726654713, 'WEIGHT_2': 0.43822101168767785, 'WEIGHT_3': 0.9415523536834528, 'WEIGHT_4': 0.753769617283164, 'WEIGHT_5': 0.640607118526167, 'WEIGHT_6': 0.9077989501216426, 'WEIGHT_7': 0.5918374860768754, 'WEIGHT_8': 0.3641671164851471, 'optimizer': 'Adam'}
49
              precision    recall  f1-score   support

         LOC       0.67      0.38      0.48      1837
        MISC       0.39      0.11      0.17       922
         ORG       0.31      0.15      0.20      1341
         PER       0.14      0.13      0.13      1842

   micro avg       0.34      0.21      0.26      5942
   macro avg       0.38      0.19      0.25      5942
weighted avg       0.38      0.21      0.26      5942

epoch 49
LSTM
  0%|          | 0/50 [00:00<?, ?it/s]  2%|▏         | 1/50 [00:04<03:52,  4.74s/it]  6%|▌         | 3/50 [00:05<01:02,  1.33s/it]  8%|▊         | 4/50 [00:05<00:42,  1.08it/s] 10%|█         | 5/50 [00:05<00:30,  1.49it/s] 12%|█▏        | 6/50 [00:05<00:22,  1.97it/s] 14%|█▍        | 7/50 [00:05<00:17,  2.50it/s] 16%|█▌        | 8/50 [00:05<00:13,  3.06it/s] 18%|█▊        | 9/50 [00:05<00:11,  3.61it/s] 20%|██        | 10/50 [00:06<00:09,  4.13it/s] 22%|██▏       | 11/50 [00:06<00:08,  4.58it/s] 24%|██▍       | 12/50 [00:06<00:07,  4.95it/s] 26%|██▌       | 13/50 [00:06<00:07,  5.26it/s] 28%|██▊       | 14/50 [00:06<00:06,  5.50it/s] 30%|███       | 15/50 [00:06<00:06,  5.67it/s] 32%|███▏      | 16/50 [00:07<00:05,  5.80it/s] 34%|███▍      | 17/50 [00:07<00:05,  5.89it/s] 36%|███▌      | 18/50 [00:07<00:05,  5.96it/s] 38%|███▊      | 19/50 [00:07<00:05,  6.01it/s] 40%|████      | 20/50 [00:07<00:04,  6.04it/s] 42%|████▏     | 21/50 [00:07<00:04,  6.07it/s] 44%|████▍     | 22/50 [00:08<00:04,  6.08it/s] 46%|████▌     | 23/50 [00:08<00:04,  6.09it/s] 48%|████▊     | 24/50 [00:08<00:04,  6.10it/s] 50%|█████     | 25/50 [00:08<00:04,  6.10it/s] 52%|█████▏    | 26/50 [00:08<00:03,  6.10it/s] 54%|█████▍    | 27/50 [00:08<00:03,  6.11it/s] 56%|█████▌    | 28/50 [00:09<00:03,  6.11it/s] 58%|█████▊    | 29/50 [00:09<00:03,  6.11it/s] 60%|██████    | 30/50 [00:09<00:03,  6.11it/s] 62%|██████▏   | 31/50 [00:09<00:03,  6.11it/s] 64%|██████▍   | 32/50 [00:09<00:02,  6.11it/s] 66%|██████▌   | 33/50 [00:09<00:02,  6.12it/s] 68%|██████▊   | 34/50 [00:10<00:02,  6.11it/s] 70%|███████   | 35/50 [00:10<00:02,  6.11it/s] 72%|███████▏  | 36/50 [00:10<00:02,  6.11it/s] 74%|███████▍  | 37/50 [00:10<00:02,  6.10it/s] 76%|███████▌  | 38/50 [00:10<00:01,  6.11it/s] 78%|███████▊  | 39/50 [00:10<00:01,  6.11it/s] 80%|████████  | 40/50 [00:11<00:01,  6.12it/s] 82%|████████▏ | 41/50 [00:11<00:01,  6.11it/s] 84%|████████▍ | 42/50 [00:11<00:01,  6.10it/s] 86%|████████▌ | 43/50 [00:11<00:01,  6.11it/s] 88%|████████▊ | 44/50 [00:11<00:00,  6.11it/s] 90%|█████████ | 45/50 [00:11<00:00,  6.10it/s] 92%|█████████▏| 46/50 [00:12<00:00,  6.10it/s] 94%|█████████▍| 47/50 [00:12<00:00,  6.11it/s] 96%|█████████▌| 48/50 [00:12<00:00,  6.11it/s] 98%|█████████▊| 49/50 [00:12<00:00,  6.10it/s]100%|██████████| 50/50 [00:17<00:00,  1.56s/it]100%|██████████| 50/50 [00:17<00:00,  2.88it/s]
