[I 2023-12-10 23:19:32,465] Trial 241 finished with value: 0.3968267364334543 and parameters: {'EMBEDDING_DIM': 955, 'HIDDEN_DIM': 369, 'NUM_LAYERS': 1, 'DROPOUT': 0.35890156578830623, 'LR': 0.0018460621387550535, 'WEIGHT_0': 0.506449383289589, 'WEIGHT_1': 0.5058140106560008, 'WEIGHT_2': 0.4388520612784048, 'WEIGHT_3': 0.7241235283084522, 'WEIGHT_4': 0.9323854206875486, 'WEIGHT_5': 0.7429947923329013, 'WEIGHT_6': 0.6845148194369721, 'WEIGHT_7': 0.3643731159521272, 'WEIGHT_8': 0.7649933005318647, 'optimizer': 'Adam'}. Best is trial 221 with value: 0.418736930154747.
/userhome/cs2/dingruiw/conda/envs/py310/lib/python3.10/site-packages/torch/nn/modules/rnn.py:82: UserWarning: dropout option adds dropout after all but last recurrent layer, so non-zero dropout expects num_layers greater than 1, but got dropout=0.48206852880201667 and num_layers=1
  warnings.warn("dropout option adds dropout after all but last "
{'EMBEDDING_DIM': 955, 'HIDDEN_DIM': 369, 'NUM_LAYERS': 1, 'DROPOUT': 0.35890156578830623, 'LR': 0.0018460621387550535, 'WEIGHT_0': 0.506449383289589, 'WEIGHT_1': 0.5058140106560008, 'WEIGHT_2': 0.4388520612784048, 'WEIGHT_3': 0.7241235283084522, 'WEIGHT_4': 0.9323854206875486, 'WEIGHT_5': 0.7429947923329013, 'WEIGHT_6': 0.6845148194369721, 'WEIGHT_7': 0.3643731159521272, 'WEIGHT_8': 0.7649933005318647, 'optimizer': 'Adam'}
0
              precision    recall  f1-score   support

         LOC       0.06      0.09      0.07      1837
        MISC       0.01      0.03      0.02       922
         ORG       0.04      0.05      0.05      1341
         PER       0.03      0.06      0.04      1842

   micro avg       0.04      0.06      0.05      5942
   macro avg       0.04      0.06      0.05      5942
weighted avg       0.04      0.06      0.05      5942

{'EMBEDDING_DIM': 955, 'HIDDEN_DIM': 369, 'NUM_LAYERS': 1, 'DROPOUT': 0.35890156578830623, 'LR': 0.0018460621387550535, 'WEIGHT_0': 0.506449383289589, 'WEIGHT_1': 0.5058140106560008, 'WEIGHT_2': 0.4388520612784048, 'WEIGHT_3': 0.7241235283084522, 'WEIGHT_4': 0.9323854206875486, 'WEIGHT_5': 0.7429947923329013, 'WEIGHT_6': 0.6845148194369721, 'WEIGHT_7': 0.3643731159521272, 'WEIGHT_8': 0.7649933005318647, 'optimizer': 'Adam'}
49
              precision    recall  f1-score   support

         LOC       0.53      0.55      0.54      1837
        MISC       0.44      0.41      0.43       922
         ORG       0.28      0.25      0.27      1341
         PER       0.32      0.34      0.33      1842

   micro avg       0.40      0.40      0.40      5942
   macro avg       0.39      0.39      0.39      5942
weighted avg       0.40      0.40      0.40      5942

epoch 49
LSTM
  0%|          | 0/50 [00:00<?, ?it/s]  2%|▏         | 1/50 [00:04<04:03,  4.96s/it]  4%|▍         | 2/50 [00:05<01:42,  2.14s/it]  6%|▌         | 3/50 [00:05<01:00,  1.30s/it]  8%|▊         | 4/50 [00:05<00:41,  1.11it/s] 10%|█         | 5/50 [00:06<00:30,  1.46it/s] 12%|█▏        | 6/50 [00:06<00:24,  1.80it/s] 14%|█▍        | 7/50 [00:06<00:20,  2.11it/s] 16%|█▌        | 8/50 [00:06<00:17,  2.38it/s] 18%|█▊        | 9/50 [00:07<00:15,  2.60it/s] 20%|██        | 10/50 [00:07<00:14,  2.78it/s] 22%|██▏       | 11/50 [00:07<00:13,  2.92it/s] 24%|██▍       | 12/50 [00:08<00:12,  3.02it/s] 26%|██▌       | 13/50 [00:08<00:11,  3.10it/s] 28%|██▊       | 14/50 [00:08<00:11,  3.15it/s] 30%|███       | 15/50 [00:09<00:10,  3.19it/s] 32%|███▏      | 16/50 [00:09<00:10,  3.22it/s] 34%|███▍      | 17/50 [00:09<00:10,  3.24it/s] 36%|███▌      | 18/50 [00:09<00:09,  3.25it/s] 38%|███▊      | 19/50 [00:10<00:09,  3.26it/s] 40%|████      | 20/50 [00:10<00:09,  3.27it/s] 42%|████▏     | 21/50 [00:10<00:08,  3.27it/s] 44%|████▍     | 22/50 [00:11<00:08,  3.28it/s] 46%|████▌     | 23/50 [00:11<00:08,  3.28it/s] 48%|████▊     | 24/50 [00:11<00:07,  3.28it/s] 50%|█████     | 25/50 [00:12<00:07,  3.28it/s] 52%|█████▏    | 26/50 [00:12<00:07,  3.28it/s] 54%|█████▍    | 27/50 [00:12<00:07,  3.28it/s] 56%|█████▌    | 28/50 [00:13<00:06,  3.28it/s] 58%|█████▊    | 29/50 [00:13<00:06,  3.28it/s] 60%|██████    | 30/50 [00:13<00:06,  3.28it/s] 62%|██████▏   | 31/50 [00:13<00:05,  3.28it/s] 64%|██████▍   | 32/50 [00:14<00:05,  3.28it/s] 66%|██████▌   | 33/50 [00:14<00:05,  3.28it/s] 68%|██████▊   | 34/50 [00:14<00:04,  3.28it/s] 70%|███████   | 35/50 [00:15<00:04,  3.28it/s] 72%|███████▏  | 36/50 [00:15<00:04,  3.28it/s] 74%|███████▍  | 37/50 [00:15<00:03,  3.28it/s] 76%|███████▌  | 38/50 [00:16<00:03,  3.29it/s] 78%|███████▊  | 39/50 [00:16<00:03,  3.28it/s] 80%|████████  | 40/50 [00:16<00:03,  3.28it/s] 82%|████████▏ | 41/50 [00:16<00:02,  3.28it/s] 84%|████████▍ | 42/50 [00:17<00:02,  3.28it/s] 86%|████████▌ | 43/50 [00:17<00:02,  3.28it/s] 88%|████████▊ | 44/50 [00:17<00:01,  3.28it/s] 90%|█████████ | 45/50 [00:18<00:01,  3.28it/s] 92%|█████████▏| 46/50 [00:18<00:01,  3.28it/s] 94%|█████████▍| 47/50 [00:18<00:00,  3.28it/s] 96%|█████████▌| 48/50 [00:19<00:00,  3.28it/s] 98%|█████████▊| 49/50 [00:19<00:00,  3.28it/s]100%|██████████| 50/50 [00:24<00:00,  1.71s/it]100%|██████████| 50/50 [00:24<00:00,  2.05it/s]
[I 2023-12-10 23:20:01,141] Trial 242 finished with value: 0.40536221590909094 and parameters: {'EMBEDDING_DIM': 970, 'HIDDEN_DIM': 454, 'NUM_LAYERS': 1, 'DROPOUT': 0.48206852880201667, 'LR': 0.0013294931819705866, 'WEIGHT_0': 0.9252144623888742, 'WEIGHT_1': 0.48484928795219145, 'WEIGHT_2': 0.332700691048252, 'WEIGHT_3': 0.8404454486353395, 'WEIGHT_4': 0.9161980456233285, 'WEIGHT_5': 0.7722359305630105, 'WEIGHT_6': 0.7173019093882183, 'WEIGHT_7': 0.3769436997777564, 'WEIGHT_8': 0.7487607654887728, 'optimizer': 'Adam'}. Best is trial 221 with value: 0.418736930154747.
/userhome/cs2/dingruiw/conda/envs/py310/lib/python3.10/site-packages/torch/nn/modules/rnn.py:82: UserWarning: dropout option adds dropout after all but last recurrent layer, so non-zero dropout expects num_layers greater than 1, but got dropout=0.36301058380057766 and num_layers=1
  warnings.warn("dropout option adds dropout after all but last "
{'EMBEDDING_DIM': 970, 'HIDDEN_DIM': 454, 'NUM_LAYERS': 1, 'DROPOUT': 0.48206852880201667, 'LR': 0.0013294931819705866, 'WEIGHT_0': 0.9252144623888742, 'WEIGHT_1': 0.48484928795219145, 'WEIGHT_2': 0.332700691048252, 'WEIGHT_3': 0.8404454486353395, 'WEIGHT_4': 0.9161980456233285, 'WEIGHT_5': 0.7722359305630105, 'WEIGHT_6': 0.7173019093882183, 'WEIGHT_7': 0.3769436997777564, 'WEIGHT_8': 0.7487607654887728, 'optimizer': 'Adam'}
0
              precision    recall  f1-score   support

         LOC       0.06      0.12      0.08      1837
        MISC       0.01      0.04      0.02       922
         ORG       0.02      0.08      0.03      1341
         PER       0.02      0.03      0.02      1842

   micro avg       0.03      0.07      0.04      5942
   macro avg       0.03      0.07      0.04      5942
weighted avg       0.03      0.07      0.04      5942

{'EMBEDDING_DIM': 970, 'HIDDEN_DIM': 454, 'NUM_LAYERS': 1, 'DROPOUT': 0.48206852880201667, 'LR': 0.0013294931819705866, 'WEIGHT_0': 0.9252144623888742, 'WEIGHT_1': 0.48484928795219145, 'WEIGHT_2': 0.332700691048252, 'WEIGHT_3': 0.8404454486353395, 'WEIGHT_4': 0.9161980456233285, 'WEIGHT_5': 0.7722359305630105, 'WEIGHT_6': 0.7173019093882183, 'WEIGHT_7': 0.3769436997777564, 'WEIGHT_8': 0.7487607654887728, 'optimizer': 'Adam'}
49
              precision    recall  f1-score   support

         LOC       0.56      0.57      0.56      1837
        MISC       0.53      0.35      0.42       922
         ORG       0.29      0.20      0.24      1341
         PER       0.34      0.35      0.34      1842

   micro avg       0.43      0.38      0.41      5942
   macro avg       0.43      0.37      0.39      5942
weighted avg       0.43      0.38      0.40      5942

epoch 49
LSTM
  0%|          | 0/50 [00:00<?, ?it/s]  2%|▏         | 1/50 [00:04<03:51,  4.72s/it]  4%|▍         | 2/50 [00:04<01:36,  2.01s/it]  6%|▌         | 3/50 [00:05<00:55,  1.19s/it]  8%|▊         | 4/50 [00:05<00:36,  1.26it/s] 10%|█         | 5/50 [00:05<00:26,  1.72it/s] 12%|█▏        | 6/50 [00:05<00:19,  2.21it/s] 14%|█▍        | 7/50 [00:05<00:15,  2.71it/s] 16%|█▌        | 8/50 [00:06<00:13,  3.16it/s] 18%|█▊        | 9/50 [00:06<00:11,  3.56it/s] 20%|██        | 10/50 [00:06<00:10,  3.89it/s] 22%|██▏       | 11/50 [00:06<00:09,  4.16it/s] 24%|██▍       | 12/50 [00:06<00:08,  4.37it/s] 26%|██▌       | 13/50 [00:07<00:08,  4.53it/s] 28%|██▊       | 14/50 [00:07<00:07,  4.64it/s] 30%|███       | 15/50 [00:07<00:07,  4.73it/s] 32%|███▏      | 16/50 [00:07<00:07,  4.78it/s] 34%|███▍      | 17/50 [00:07<00:06,  4.82it/s] 36%|███▌      | 18/50 [00:08<00:06,  4.85it/s] 38%|███▊      | 19/50 [00:08<00:06,  4.88it/s] 40%|████      | 20/50 [00:08<00:06,  4.89it/s] 42%|████▏     | 21/50 [00:08<00:05,  4.90it/s] 44%|████▍     | 22/50 [00:08<00:05,  4.91it/s] 46%|████▌     | 23/50 [00:09<00:05,  4.92it/s] 48%|████▊     | 24/50 [00:09<00:05,  4.91it/s] 50%|█████     | 25/50 [00:09<00:05,  4.92it/s] 52%|█████▏    | 26/50 [00:09<00:04,  4.94it/s] 54%|█████▍    | 27/50 [00:09<00:04,  4.93it/s] 56%|█████▌    | 28/50 [00:10<00:04,  4.92it/s] 58%|█████▊    | 29/50 [00:10<00:04,  4.92it/s] 60%|██████    | 30/50 [00:10<00:04,  4.92it/s] 62%|██████▏   | 31/50 [00:10<00:03,  4.93it/s] 64%|██████▍   | 32/50 [00:10<00:03,  4.93it/s] 66%|██████▌   | 33/50 [00:11<00:03,  4.92it/s] 68%|██████▊   | 34/50 [00:11<00:03,  4.93it/s] 70%|███████   | 35/50 [00:11<00:03,  4.92it/s] 72%|███████▏  | 36/50 [00:11<00:02,  4.92it/s] 74%|███████▍  | 37/50 [00:11<00:02,  4.93it/s] 76%|███████▌  | 38/50 [00:12<00:02,  4.95it/s] 78%|███████▊  | 39/50 [00:12<00:02,  4.95it/s] 80%|████████  | 40/50 [00:12<00:02,  4.94it/s] 82%|████████▏ | 41/50 [00:12<00:01,  4.94it/s] 84%|████████▍ | 42/50 [00:12<00:01,  4.93it/s] 86%|████████▌ | 43/50 [00:13<00:01,  4.93it/s] 88%|████████▊ | 44/50 [00:13<00:01,  4.93it/s] 90%|█████████ | 45/50 [00:13<00:01,  4.92it/s] 92%|█████████▏| 46/50 [00:13<00:00,  4.92it/s] 94%|█████████▍| 47/50 [00:13<00:00,  4.93it/s] 96%|█████████▌| 48/50 [00:14<00:00,  4.93it/s] 98%|█████████▊| 49/50 [00:14<00:00,  4.92it/s]100%|██████████| 50/50 [00:19<00:00,  1.61s/it]100%|██████████| 50/50 [00:19<00:00,  2.60it/s]
[I 2023-12-10 23:20:24,678] Trial 243 finished with value: 0.4067477307758178 and parameters: {'EMBEDDING_DIM': 954, 'HIDDEN_DIM': 285, 'NUM_LAYERS': 1, 'DROPOUT': 0.36301058380057766, 'LR': 0.0016547557400444178, 'WEIGHT_0': 0.48006617461266, 'WEIGHT_1': 0.5221302159305401, 'WEIGHT_2': 0.23821135625132722, 'WEIGHT_3': 0.32767920347388113, 'WEIGHT_4': 0.9639976704555084, 'WEIGHT_5': 0.5625192822779354, 'WEIGHT_6': 0.6291126623864224, 'WEIGHT_7': 0.3496558584100285, 'WEIGHT_8': 0.7529055167164501, 'optimizer': 'Adam'}. Best is trial 221 with value: 0.418736930154747.
/userhome/cs2/dingruiw/conda/envs/py310/lib/python3.10/site-packages/torch/nn/modules/rnn.py:82: UserWarning: dropout option adds dropout after all but last recurrent layer, so non-zero dropout expects num_layers greater than 1, but got dropout=0.3550493917385319 and num_layers=1
  warnings.warn("dropout option adds dropout after all but last "
{'EMBEDDING_DIM': 954, 'HIDDEN_DIM': 285, 'NUM_LAYERS': 1, 'DROPOUT': 0.36301058380057766, 'LR': 0.0016547557400444178, 'WEIGHT_0': 0.48006617461266, 'WEIGHT_1': 0.5221302159305401, 'WEIGHT_2': 0.23821135625132722, 'WEIGHT_3': 0.32767920347388113, 'WEIGHT_4': 0.9639976704555084, 'WEIGHT_5': 0.5625192822779354, 'WEIGHT_6': 0.6291126623864224, 'WEIGHT_7': 0.3496558584100285, 'WEIGHT_8': 0.7529055167164501, 'optimizer': 'Adam'}
0
              precision    recall  f1-score   support

         LOC       0.06      0.12      0.08      1837
        MISC       0.02      0.05      0.03       922
         ORG       0.03      0.13      0.05      1341
         PER       0.02      0.02      0.02      1842

   micro avg       0.03      0.08      0.05      5942
   macro avg       0.03      0.08      0.04      5942
weighted avg       0.03      0.08      0.05      5942

{'EMBEDDING_DIM': 954, 'HIDDEN_DIM': 285, 'NUM_LAYERS': 1, 'DROPOUT': 0.36301058380057766, 'LR': 0.0016547557400444178, 'WEIGHT_0': 0.48006617461266, 'WEIGHT_1': 0.5221302159305401, 'WEIGHT_2': 0.23821135625132722, 'WEIGHT_3': 0.32767920347388113, 'WEIGHT_4': 0.9639976704555084, 'WEIGHT_5': 0.5625192822779354, 'WEIGHT_6': 0.6291126623864224, 'WEIGHT_7': 0.3496558584100285, 'WEIGHT_8': 0.7529055167164501, 'optimizer': 'Adam'}
49
              precision    recall  f1-score   support

         LOC       0.53      0.56      0.54      1837
        MISC       0.54      0.42      0.47       922
         ORG       0.30      0.27      0.28      1341
         PER       0.32      0.33      0.33      1842

   micro avg       0.41      0.40      0.41      5942
   macro avg       0.42      0.39      0.41      5942
weighted avg       0.41      0.40      0.41      5942

epoch 49
LSTM
  0%|          | 0/50 [00:00<?, ?it/s]  2%|▏         | 1/50 [00:05<04:05,  5.02s/it]  4%|▍         | 2/50 [00:05<01:43,  2.16s/it]  6%|▌         | 3/50 [00:05<01:01,  1.31s/it]  8%|▊         | 4/50 [00:05<00:41,  1.11it/s] 10%|█         | 5/50 [00:06<00:30,  1.46it/s] 12%|█▏        | 6/50 [00:06<00:24,  1.82it/s] 14%|█▍        | 7/50 [00:06<00:19,  2.15it/s] 16%|█▌        | 8/50 [00:06<00:17,  2.45it/s] 18%|█▊        | 9/50 [00:07<00:15,  2.69it/s] 20%|██        | 10/50 [00:07<00:13,  2.88it/s] 22%|██▏       | 11/50 [00:07<00:12,  3.03it/s] 24%|██▍       | 12/50 [00:08<00:12,  3.14it/s] 26%|██▌       | 13/50 [00:08<00:11,  3.23it/s] 28%|██▊       | 14/50 [00:08<00:10,  3.29it/s] 30%|███       | 15/50 [00:08<00:10,  3.33it/s] 32%|███▏      | 16/50 [00:09<00:10,  3.36it/s] 34%|███▍      | 17/50 [00:09<00:09,  3.39it/s] 36%|███▌      | 18/50 [00:09<00:09,  3.40it/s] 38%|███▊      | 19/50 [00:10<00:09,  3.41it/s] 40%|████      | 20/50 [00:10<00:08,  3.42it/s] 42%|████▏     | 21/50 [00:10<00:08,  3.42it/s] 44%|████▍     | 22/50 [00:10<00:08,  3.43it/s] 46%|████▌     | 23/50 [00:11<00:07,  3.43it/s] 48%|████▊     | 24/50 [00:11<00:07,  3.42it/s] 50%|█████     | 25/50 [00:11<00:07,  3.43it/s] 52%|█████▏    | 26/50 [00:12<00:07,  3.43it/s] 54%|█████▍    | 27/50 [00:12<00:06,  3.43it/s] 56%|█████▌    | 28/50 [00:12<00:06,  3.43it/s] 58%|█████▊    | 29/50 [00:13<00:06,  3.43it/s] 60%|██████    | 30/50 [00:13<00:05,  3.43it/s] 62%|██████▏   | 31/50 [00:13<00:05,  3.43it/s] 64%|██████▍   | 32/50 [00:13<00:05,  3.42it/s] 66%|██████▌   | 33/50 [00:14<00:04,  3.43it/s] 68%|██████▊   | 34/50 [00:14<00:04,  3.42it/s] 70%|███████   | 35/50 [00:14<00:04,  3.43it/s] 72%|███████▏  | 36/50 [00:15<00:04,  3.42it/s] 74%|███████▍  | 37/50 [00:15<00:03,  3.42it/s] 76%|███████▌  | 38/50 [00:15<00:03,  3.43it/s] 78%|███████▊  | 39/50 [00:15<00:03,  3.42it/s] 80%|████████  | 40/50 [00:16<00:02,  3.42it/s] 82%|████████▏ | 41/50 [00:16<00:02,  3.42it/s] 84%|████████▍ | 42/50 [00:16<00:02,  3.42it/s] 86%|████████▌ | 43/50 [00:17<00:02,  3.42it/s] 88%|████████▊ | 44/50 [00:17<00:01,  3.42it/s] 90%|█████████ | 45/50 [00:17<00:01,  3.42it/s] 92%|█████████▏| 46/50 [00:18<00:01,  3.42it/s] 94%|█████████▍| 47/50 [00:18<00:00,  3.42it/s] 96%|█████████▌| 48/50 [00:18<00:00,  3.41it/s] 98%|█████████▊| 49/50 [00:18<00:00,  3.42it/s]100%|██████████| 50/50 [00:23<00:00,  1.71s/it]100%|██████████| 50/50 [00:23<00:00,  2.09it/s]
[I 2023-12-10 23:20:52,900] Trial 244 finished with value: 0.395154261809308 and parameters: {'EMBEDDING_DIM': 982, 'HIDDEN_DIM': 420, 'NUM_LAYERS': 1, 'DROPOUT': 0.3550493917385319, 'LR': 0.0010680107718978884, 'WEIGHT_0': 0.46561346191059644, 'WEIGHT_1': 0.49757216407332056, 'WEIGHT_2': 0.37957101647045394, 'WEIGHT_3': 0.5261271942409897, 'WEIGHT_4': 0.47784604321295515, 'WEIGHT_5': 0.6190430686003482, 'WEIGHT_6': 0.6983271593071607, 'WEIGHT_7': 0.4067325113776488, 'WEIGHT_8': 0.79072325648951, 'optimizer': 'Adam'}. Best is trial 221 with value: 0.418736930154747.
/userhome/cs2/dingruiw/conda/envs/py310/lib/python3.10/site-packages/torch/nn/modules/rnn.py:82: UserWarning: dropout option adds dropout after all but last recurrent layer, so non-zero dropout expects num_layers greater than 1, but got dropout=0.37644598272241203 and num_layers=1
  warnings.warn("dropout option adds dropout after all but last "
{'EMBEDDING_DIM': 982, 'HIDDEN_DIM': 420, 'NUM_LAYERS': 1, 'DROPOUT': 0.3550493917385319, 'LR': 0.0010680107718978884, 'WEIGHT_0': 0.46561346191059644, 'WEIGHT_1': 0.49757216407332056, 'WEIGHT_2': 0.37957101647045394, 'WEIGHT_3': 0.5261271942409897, 'WEIGHT_4': 0.47784604321295515, 'WEIGHT_5': 0.6190430686003482, 'WEIGHT_6': 0.6983271593071607, 'WEIGHT_7': 0.4067325113776488, 'WEIGHT_8': 0.79072325648951, 'optimizer': 'Adam'}
0
              precision    recall  f1-score   support

         LOC       0.06      0.11      0.08      1837
        MISC       0.01      0.04      0.02       922
         ORG       0.02      0.07      0.04      1341
         PER       0.03      0.07      0.04      1842

   micro avg       0.03      0.08      0.04      5942
   macro avg       0.03      0.07      0.04      5942
weighted avg       0.03      0.08      0.05      5942

{'EMBEDDING_DIM': 982, 'HIDDEN_DIM': 420, 'NUM_LAYERS': 1, 'DROPOUT': 0.3550493917385319, 'LR': 0.0010680107718978884, 'WEIGHT_0': 0.46561346191059644, 'WEIGHT_1': 0.49757216407332056, 'WEIGHT_2': 0.37957101647045394, 'WEIGHT_3': 0.5261271942409897, 'WEIGHT_4': 0.47784604321295515, 'WEIGHT_5': 0.6190430686003482, 'WEIGHT_6': 0.6983271593071607, 'WEIGHT_7': 0.4067325113776488, 'WEIGHT_8': 0.79072325648951, 'optimizer': 'Adam'}
49
              precision    recall  f1-score   support

         LOC       0.51      0.53      0.52      1837
        MISC       0.52      0.39      0.45       922
         ORG       0.28      0.24      0.25      1341
         PER       0.34      0.33      0.34      1842

   micro avg       0.41      0.38      0.40      5942
   macro avg       0.41      0.37      0.39      5942
weighted avg       0.41      0.38      0.39      5942

epoch 49
LSTM
  0%|          | 0/50 [00:00<?, ?it/s]  2%|▏         | 1/50 [00:04<03:58,  4.86s/it]  4%|▍         | 2/50 [00:04<01:39,  2.08s/it]  6%|▌         | 3/50 [00:05<00:58,  1.25s/it]  8%|▊         | 4/50 [00:05<00:39,  1.17it/s] 10%|█         | 5/50 [00:05<00:28,  1.57it/s] 12%|█▏        | 6/50 [00:05<00:22,  1.98it/s] 14%|█▍        | 7/50 [00:06<00:18,  2.37it/s] 16%|█▌        | 8/50 [00:06<00:15,  2.72it/s] 18%|█▊        | 9/50 [00:06<00:13,  3.02it/s] 20%|██        | 10/50 [00:07<00:12,  3.26it/s] 22%|██▏       | 11/50 [00:07<00:11,  3.45it/s] 24%|██▍       | 12/50 [00:07<00:10,  3.59it/s] 26%|██▌       | 13/50 [00:07<00:09,  3.70it/s] 28%|██▊       | 14/50 [00:08<00:09,  3.78it/s] 30%|███       | 15/50 [00:08<00:09,  3.84it/s] 32%|███▏      | 16/50 [00:08<00:08,  3.88it/s] 34%|███▍      | 17/50 [00:08<00:08,  3.90it/s] 36%|███▌      | 18/50 [00:09<00:08,  3.92it/s] 38%|███▊      | 19/50 [00:09<00:07,  3.94it/s] 40%|████      | 20/50 [00:09<00:07,  3.95it/s] 42%|████▏     | 21/50 [00:09<00:07,  3.96it/s] 44%|████▍     | 22/50 [00:10<00:07,  3.96it/s] 46%|████▌     | 23/50 [00:10<00:06,  3.96it/s] 48%|████▊     | 24/50 [00:10<00:06,  3.97it/s] 50%|█████     | 25/50 [00:10<00:06,  3.97it/s] 52%|█████▏    | 26/50 [00:11<00:06,  3.97it/s] 54%|█████▍    | 27/50 [00:11<00:05,  3.97it/s] 56%|█████▌    | 28/50 [00:11<00:05,  3.96it/s] 58%|█████▊    | 29/50 [00:11<00:05,  3.96it/s] 60%|██████    | 30/50 [00:12<00:05,  3.97it/s] 62%|██████▏   | 31/50 [00:12<00:04,  3.96it/s] 64%|██████▍   | 32/50 [00:12<00:04,  3.96it/s] 66%|██████▌   | 33/50 [00:12<00:04,  3.96it/s] 68%|██████▊   | 34/50 [00:13<00:04,  3.96it/s] 70%|███████   | 35/50 [00:13<00:03,  3.96it/s] 72%|███████▏  | 36/50 [00:13<00:03,  3.95it/s] 74%|███████▍  | 37/50 [00:13<00:03,  3.95it/s] 76%|███████▌  | 38/50 [00:14<00:03,  3.95it/s] 78%|███████▊  | 39/50 [00:14<00:02,  3.95it/s] 80%|████████  | 40/50 [00:14<00:02,  3.95it/s] 82%|████████▏ | 41/50 [00:14<00:02,  3.94it/s] 84%|████████▍ | 42/50 [00:15<00:02,  3.94it/s] 86%|████████▌ | 43/50 [00:15<00:01,  3.94it/s] 88%|████████▊ | 44/50 [00:15<00:01,  3.94it/s] 90%|█████████ | 45/50 [00:15<00:01,  3.94it/s] 92%|█████████▏| 46/50 [00:16<00:01,  3.94it/s] 94%|█████████▍| 47/50 [00:16<00:00,  3.94it/s] 96%|█████████▌| 48/50 [00:16<00:00,  3.94it/s] 98%|█████████▊| 49/50 [00:16<00:00,  3.94it/s]100%|██████████| 50/50 [00:21<00:00,  1.65s/it]100%|██████████| 50/50 [00:21<00:00,  2.30it/s]
