[I 2023-12-11 00:16:15,376] Trial 357 finished with value: 0.28770898401616757 and parameters: {'EMBEDDING_DIM': 1023, 'HIDDEN_DIM': 466, 'NUM_LAYERS': 1, 'DROPOUT': 0.022881568531596275, 'LR': 0.006336984843383131, 'WEIGHT_0': 0.4531083900375328, 'WEIGHT_1': 0.4908882075097924, 'WEIGHT_2': 0.34751745150517516, 'WEIGHT_3': 0.917141504128425, 'WEIGHT_4': 0.5276361230636105, 'WEIGHT_5': 0.46889106505189126, 'WEIGHT_6': 0.9169697980093499, 'WEIGHT_7': 0.4152136159547973, 'WEIGHT_8': 0.9133761948312901, 'optimizer': 'RMSprop'}. Best is trial 221 with value: 0.418736930154747.
/userhome/cs2/dingruiw/conda/envs/py310/lib/python3.10/site-packages/torch/nn/modules/rnn.py:82: UserWarning: dropout option adds dropout after all but last recurrent layer, so non-zero dropout expects num_layers greater than 1, but got dropout=0.019588988614820977 and num_layers=1
  warnings.warn("dropout option adds dropout after all but last "
{'EMBEDDING_DIM': 1023, 'HIDDEN_DIM': 466, 'NUM_LAYERS': 1, 'DROPOUT': 0.022881568531596275, 'LR': 0.006336984843383131, 'WEIGHT_0': 0.4531083900375328, 'WEIGHT_1': 0.4908882075097924, 'WEIGHT_2': 0.34751745150517516, 'WEIGHT_3': 0.917141504128425, 'WEIGHT_4': 0.5276361230636105, 'WEIGHT_5': 0.46889106505189126, 'WEIGHT_6': 0.9169697980093499, 'WEIGHT_7': 0.4152136159547973, 'WEIGHT_8': 0.9133761948312901, 'optimizer': 'RMSprop'}
0
              precision    recall  f1-score   support

         LOC       0.02      0.01      0.01      1837
        MISC       0.02      0.07      0.03       922
         ORG       0.01      0.08      0.02      1341
         PER       0.02      0.01      0.01      1842

   micro avg       0.01      0.04      0.02      5942
   macro avg       0.02      0.04      0.02      5942
weighted avg       0.02      0.04      0.02      5942

{'EMBEDDING_DIM': 1023, 'HIDDEN_DIM': 466, 'NUM_LAYERS': 1, 'DROPOUT': 0.022881568531596275, 'LR': 0.006336984843383131, 'WEIGHT_0': 0.4531083900375328, 'WEIGHT_1': 0.4908882075097924, 'WEIGHT_2': 0.34751745150517516, 'WEIGHT_3': 0.917141504128425, 'WEIGHT_4': 0.5276361230636105, 'WEIGHT_5': 0.46889106505189126, 'WEIGHT_6': 0.9169697980093499, 'WEIGHT_7': 0.4152136159547973, 'WEIGHT_8': 0.9133761948312901, 'optimizer': 'RMSprop'}
49
              precision    recall  f1-score   support

         LOC       0.55      0.42      0.48      1837
        MISC       0.30      0.26      0.28       922
         ORG       0.24      0.20      0.22      1341
         PER       0.17      0.15      0.16      1842

   micro avg       0.32      0.26      0.29      5942
   macro avg       0.32      0.26      0.28      5942
weighted avg       0.33      0.26      0.29      5942

epoch 49
LSTM
  0%|          | 0/50 [00:00<?, ?it/s]  2%|▏         | 1/50 [00:05<04:14,  5.20s/it]  4%|▍         | 2/50 [00:05<01:46,  2.21s/it]  6%|▌         | 3/50 [00:05<01:01,  1.31s/it]  8%|▊         | 4/50 [00:05<00:40,  1.14it/s] 10%|█         | 5/50 [00:05<00:28,  1.56it/s] 12%|█▏        | 6/50 [00:06<00:21,  2.01it/s] 14%|█▍        | 7/50 [00:06<00:17,  2.45it/s] 16%|█▌        | 8/50 [00:06<00:14,  2.87it/s] 18%|█▊        | 9/50 [00:06<00:12,  3.24it/s] 20%|██        | 10/50 [00:07<00:11,  3.54it/s] 22%|██▏       | 11/50 [00:07<00:10,  3.79it/s] 24%|██▍       | 12/50 [00:07<00:09,  3.98it/s] 26%|██▌       | 13/50 [00:07<00:08,  4.13it/s] 28%|██▊       | 14/50 [00:07<00:08,  4.23it/s] 30%|███       | 15/50 [00:08<00:08,  4.31it/s] 32%|███▏      | 16/50 [00:08<00:07,  4.37it/s] 34%|███▍      | 17/50 [00:08<00:07,  4.41it/s] 36%|███▌      | 18/50 [00:08<00:07,  4.43it/s] 38%|███▊      | 19/50 [00:09<00:06,  4.45it/s] 40%|████      | 20/50 [00:09<00:06,  4.47it/s] 42%|████▏     | 21/50 [00:09<00:06,  4.47it/s] 44%|████▍     | 22/50 [00:09<00:06,  4.48it/s] 46%|████▌     | 23/50 [00:09<00:06,  4.49it/s] 48%|████▊     | 24/50 [00:10<00:05,  4.49it/s] 50%|█████     | 25/50 [00:10<00:05,  4.49it/s] 52%|█████▏    | 26/50 [00:10<00:05,  4.50it/s] 54%|█████▍    | 27/50 [00:10<00:05,  4.49it/s] 56%|█████▌    | 28/50 [00:11<00:04,  4.49it/s] 58%|█████▊    | 29/50 [00:11<00:04,  4.49it/s] 60%|██████    | 30/50 [00:11<00:04,  4.49it/s] 62%|██████▏   | 31/50 [00:11<00:04,  4.49it/s] 64%|██████▍   | 32/50 [00:11<00:04,  4.50it/s] 66%|██████▌   | 33/50 [00:12<00:03,  4.49it/s] 68%|██████▊   | 34/50 [00:12<00:03,  4.49it/s] 70%|███████   | 35/50 [00:12<00:03,  4.49it/s] 72%|███████▏  | 36/50 [00:12<00:03,  4.49it/s] 74%|███████▍  | 37/50 [00:13<00:02,  4.49it/s] 76%|███████▌  | 38/50 [00:13<00:02,  4.49it/s] 78%|███████▊  | 39/50 [00:13<00:02,  4.49it/s] 80%|████████  | 40/50 [00:13<00:02,  4.49it/s] 82%|████████▏ | 41/50 [00:14<00:02,  4.49it/s] 84%|████████▍ | 42/50 [00:14<00:01,  4.49it/s] 86%|████████▌ | 43/50 [00:14<00:01,  4.49it/s] 88%|████████▊ | 44/50 [00:14<00:01,  4.49it/s] 90%|█████████ | 45/50 [00:14<00:01,  4.49it/s] 92%|█████████▏| 46/50 [00:15<00:00,  4.49it/s] 94%|█████████▍| 47/50 [00:15<00:00,  4.49it/s] 96%|█████████▌| 48/50 [00:15<00:00,  4.48it/s] 98%|█████████▊| 49/50 [00:15<00:00,  4.49it/s]100%|██████████| 50/50 [00:20<00:00,  1.57s/it]100%|██████████| 50/50 [00:20<00:00,  2.44it/s]
[I 2023-12-11 00:16:40,027] Trial 358 finished with value: 0.41108904050436135 and parameters: {'EMBEDDING_DIM': 989, 'HIDDEN_DIM': 313, 'NUM_LAYERS': 1, 'DROPOUT': 0.019588988614820977, 'LR': 0.0023390990672961555, 'WEIGHT_0': 0.20052438013707677, 'WEIGHT_1': 0.7065864910397575, 'WEIGHT_2': 0.3923772053042231, 'WEIGHT_3': 0.8722340928212974, 'WEIGHT_4': 0.7699197515477785, 'WEIGHT_5': 0.5289263954103023, 'WEIGHT_6': 0.7270680666997005, 'WEIGHT_7': 0.31989403601957306, 'WEIGHT_8': 0.9068705421460488, 'optimizer': 'RMSprop'}. Best is trial 221 with value: 0.418736930154747.
/userhome/cs2/dingruiw/conda/envs/py310/lib/python3.10/site-packages/torch/nn/modules/rnn.py:82: UserWarning: dropout option adds dropout after all but last recurrent layer, so non-zero dropout expects num_layers greater than 1, but got dropout=0.051151308831261434 and num_layers=1
  warnings.warn("dropout option adds dropout after all but last "
{'EMBEDDING_DIM': 989, 'HIDDEN_DIM': 313, 'NUM_LAYERS': 1, 'DROPOUT': 0.019588988614820977, 'LR': 0.0023390990672961555, 'WEIGHT_0': 0.20052438013707677, 'WEIGHT_1': 0.7065864910397575, 'WEIGHT_2': 0.3923772053042231, 'WEIGHT_3': 0.8722340928212974, 'WEIGHT_4': 0.7699197515477785, 'WEIGHT_5': 0.5289263954103023, 'WEIGHT_6': 0.7270680666997005, 'WEIGHT_7': 0.31989403601957306, 'WEIGHT_8': 0.9068705421460488, 'optimizer': 'RMSprop'}
0
              precision    recall  f1-score   support

         LOC       0.35      0.24      0.29      1837
        MISC       0.14      0.02      0.04       922
         ORG       0.18      0.04      0.06      1341
         PER       0.05      0.03      0.04      1842

   micro avg       0.20      0.10      0.13      5942
   macro avg       0.18      0.08      0.11      5942
weighted avg       0.19      0.10      0.12      5942

{'EMBEDDING_DIM': 989, 'HIDDEN_DIM': 313, 'NUM_LAYERS': 1, 'DROPOUT': 0.019588988614820977, 'LR': 0.0023390990672961555, 'WEIGHT_0': 0.20052438013707677, 'WEIGHT_1': 0.7065864910397575, 'WEIGHT_2': 0.3923772053042231, 'WEIGHT_3': 0.8722340928212974, 'WEIGHT_4': 0.7699197515477785, 'WEIGHT_5': 0.5289263954103023, 'WEIGHT_6': 0.7270680666997005, 'WEIGHT_7': 0.31989403601957306, 'WEIGHT_8': 0.9068705421460488, 'optimizer': 'RMSprop'}
49
              precision    recall  f1-score   support

         LOC       0.56      0.55      0.55      1837
        MISC       0.46      0.40      0.43       922
         ORG       0.29      0.27      0.28      1341
         PER       0.36      0.34      0.35      1842

   micro avg       0.42      0.40      0.41      5942
   macro avg       0.42      0.39      0.40      5942
weighted avg       0.42      0.40      0.41      5942

epoch 49
LSTM
  0%|          | 0/50 [00:00<?, ?it/s]  2%|▏         | 1/50 [00:04<03:40,  4.49s/it]  6%|▌         | 3/50 [00:04<00:59,  1.27s/it]  8%|▊         | 4/50 [00:04<00:41,  1.12it/s] 10%|█         | 5/50 [00:05<00:29,  1.52it/s] 12%|█▏        | 6/50 [00:05<00:22,  1.98it/s] 14%|█▍        | 7/50 [00:05<00:17,  2.48it/s] 16%|█▌        | 8/50 [00:05<00:14,  2.99it/s] 18%|█▊        | 9/50 [00:05<00:11,  3.48it/s] 20%|██        | 10/50 [00:06<00:10,  3.92it/s] 22%|██▏       | 11/50 [00:06<00:09,  4.30it/s] 24%|██▍       | 12/50 [00:06<00:08,  4.60it/s] 26%|██▌       | 13/50 [00:06<00:07,  4.84it/s] 28%|██▊       | 14/50 [00:06<00:07,  5.03it/s] 30%|███       | 15/50 [00:06<00:06,  5.17it/s] 32%|███▏      | 16/50 [00:07<00:06,  5.26it/s] 34%|███▍      | 17/50 [00:07<00:06,  5.34it/s] 36%|███▌      | 18/50 [00:07<00:05,  5.39it/s] 38%|███▊      | 19/50 [00:07<00:05,  5.42it/s] 40%|████      | 20/50 [00:07<00:05,  5.45it/s] 42%|████▏     | 21/50 [00:08<00:05,  5.47it/s] 44%|████▍     | 22/50 [00:08<00:05,  5.48it/s] 46%|████▌     | 23/50 [00:08<00:04,  5.49it/s] 48%|████▊     | 24/50 [00:08<00:04,  5.50it/s] 50%|█████     | 25/50 [00:08<00:04,  5.49it/s] 52%|█████▏    | 26/50 [00:08<00:04,  5.50it/s] 54%|█████▍    | 27/50 [00:09<00:04,  5.50it/s] 56%|█████▌    | 28/50 [00:09<00:03,  5.50it/s] 58%|█████▊    | 29/50 [00:09<00:03,  5.50it/s] 60%|██████    | 30/50 [00:09<00:03,  5.50it/s] 62%|██████▏   | 31/50 [00:09<00:03,  5.50it/s] 64%|██████▍   | 32/50 [00:10<00:03,  5.51it/s] 66%|██████▌   | 33/50 [00:10<00:03,  5.50it/s] 68%|██████▊   | 34/50 [00:10<00:02,  5.50it/s] 70%|███████   | 35/50 [00:10<00:02,  5.50it/s] 72%|███████▏  | 36/50 [00:10<00:02,  5.49it/s] 74%|███████▍  | 37/50 [00:10<00:02,  5.49it/s] 76%|███████▌  | 38/50 [00:11<00:02,  5.50it/s] 78%|███████▊  | 39/50 [00:11<00:02,  5.49it/s] 80%|████████  | 40/50 [00:11<00:01,  5.49it/s] 82%|████████▏ | 41/50 [00:11<00:01,  5.50it/s] 84%|████████▍ | 42/50 [00:11<00:01,  5.49it/s] 86%|████████▌ | 43/50 [00:12<00:01,  5.49it/s] 88%|████████▊ | 44/50 [00:12<00:01,  5.49it/s] 90%|█████████ | 45/50 [00:12<00:00,  5.49it/s] 92%|█████████▏| 46/50 [00:12<00:00,  5.50it/s] 94%|█████████▍| 47/50 [00:12<00:00,  5.50it/s] 96%|█████████▌| 48/50 [00:12<00:00,  5.49it/s] 98%|█████████▊| 49/50 [00:13<00:00,  5.50it/s]100%|██████████| 50/50 [00:17<00:00,  1.48s/it]100%|██████████| 50/50 [00:17<00:00,  2.83it/s]
[I 2023-12-11 00:17:01,973] Trial 359 finished with value: 0.41573221757322176 and parameters: {'EMBEDDING_DIM': 967, 'HIDDEN_DIM': 259, 'NUM_LAYERS': 1, 'DROPOUT': 0.051151308831261434, 'LR': 0.0023745869780580314, 'WEIGHT_0': 0.19093770502049306, 'WEIGHT_1': 0.7020712857314605, 'WEIGHT_2': 0.4557900000259024, 'WEIGHT_3': 0.8735913399519055, 'WEIGHT_4': 0.7611618996705217, 'WEIGHT_5': 0.7469546033895513, 'WEIGHT_6': 0.7248238544716764, 'WEIGHT_7': 0.31308161695665193, 'WEIGHT_8': 0.8699368185251698, 'optimizer': 'RMSprop'}. Best is trial 221 with value: 0.418736930154747.
/userhome/cs2/dingruiw/conda/envs/py310/lib/python3.10/site-packages/torch/nn/modules/rnn.py:82: UserWarning: dropout option adds dropout after all but last recurrent layer, so non-zero dropout expects num_layers greater than 1, but got dropout=0.02892141409997306 and num_layers=1
  warnings.warn("dropout option adds dropout after all but last "
{'EMBEDDING_DIM': 967, 'HIDDEN_DIM': 259, 'NUM_LAYERS': 1, 'DROPOUT': 0.051151308831261434, 'LR': 0.0023745869780580314, 'WEIGHT_0': 0.19093770502049306, 'WEIGHT_1': 0.7020712857314605, 'WEIGHT_2': 0.4557900000259024, 'WEIGHT_3': 0.8735913399519055, 'WEIGHT_4': 0.7611618996705217, 'WEIGHT_5': 0.7469546033895513, 'WEIGHT_6': 0.7248238544716764, 'WEIGHT_7': 0.31308161695665193, 'WEIGHT_8': 0.8699368185251698, 'optimizer': 'RMSprop'}
0
              precision    recall  f1-score   support

         LOC       0.33      0.32      0.32      1837
        MISC       0.07      0.05      0.06       922
         ORG       0.16      0.05      0.08      1341
         PER       0.06      0.07      0.07      1842

   micro avg       0.17      0.14      0.15      5942
   macro avg       0.16      0.12      0.13      5942
weighted avg       0.17      0.14      0.15      5942

{'EMBEDDING_DIM': 967, 'HIDDEN_DIM': 259, 'NUM_LAYERS': 1, 'DROPOUT': 0.051151308831261434, 'LR': 0.0023745869780580314, 'WEIGHT_0': 0.19093770502049306, 'WEIGHT_1': 0.7020712857314605, 'WEIGHT_2': 0.4557900000259024, 'WEIGHT_3': 0.8735913399519055, 'WEIGHT_4': 0.7611618996705217, 'WEIGHT_5': 0.7469546033895513, 'WEIGHT_6': 0.7248238544716764, 'WEIGHT_7': 0.31308161695665193, 'WEIGHT_8': 0.8699368185251698, 'optimizer': 'RMSprop'}
49
              precision    recall  f1-score   support

         LOC       0.56      0.56      0.56      1837
        MISC       0.46      0.43      0.44       922
         ORG       0.29      0.27      0.28      1341
         PER       0.34      0.38      0.36      1842

   micro avg       0.41      0.42      0.42      5942
   macro avg       0.41      0.41      0.41      5942
weighted avg       0.41      0.42      0.42      5942

epoch 49
LSTM
  0%|          | 0/50 [00:00<?, ?it/s]  2%|▏         | 1/50 [00:04<03:49,  4.68s/it]  6%|▌         | 3/50 [00:04<01:01,  1.31s/it]  8%|▊         | 4/50 [00:05<00:42,  1.09it/s] 10%|█         | 5/50 [00:05<00:30,  1.49it/s] 12%|█▏        | 6/50 [00:05<00:22,  1.95it/s] 14%|█▍        | 7/50 [00:05<00:17,  2.45it/s] 16%|█▌        | 8/50 [00:05<00:14,  2.98it/s] 18%|█▊        | 9/50 [00:06<00:11,  3.49it/s] 20%|██        | 10/50 [00:06<00:10,  3.96it/s] 22%|██▏       | 11/50 [00:06<00:08,  4.36it/s] 24%|██▍       | 12/50 [00:06<00:08,  4.70it/s] 26%|██▌       | 13/50 [00:06<00:07,  4.96it/s] 28%|██▊       | 14/50 [00:06<00:06,  5.16it/s] 30%|███       | 15/50 [00:07<00:06,  5.31it/s] 32%|███▏      | 16/50 [00:07<00:06,  5.41it/s] 34%|███▍      | 17/50 [00:07<00:06,  5.49it/s] 36%|███▌      | 18/50 [00:07<00:05,  5.55it/s] 38%|███▊      | 19/50 [00:07<00:05,  5.59it/s] 40%|████      | 20/50 [00:07<00:05,  5.62it/s] 42%|████▏     | 21/50 [00:08<00:05,  5.64it/s] 44%|████▍     | 22/50 [00:08<00:04,  5.63it/s] 46%|████▌     | 23/50 [00:08<00:04,  5.67it/s] 48%|████▊     | 24/50 [00:08<00:04,  5.68it/s] 50%|█████     | 25/50 [00:08<00:04,  5.68it/s] 52%|█████▏    | 26/50 [00:08<00:04,  5.68it/s] 54%|█████▍    | 27/50 [00:09<00:04,  5.68it/s] 56%|█████▌    | 28/50 [00:09<00:03,  5.68it/s] 58%|█████▊    | 29/50 [00:09<00:03,  5.68it/s] 60%|██████    | 30/50 [00:09<00:03,  5.68it/s] 62%|██████▏   | 31/50 [00:09<00:03,  5.69it/s] 64%|██████▍   | 32/50 [00:10<00:03,  5.68it/s] 66%|██████▌   | 33/50 [00:10<00:02,  5.68it/s] 68%|██████▊   | 34/50 [00:10<00:02,  5.67it/s] 70%|███████   | 35/50 [00:10<00:02,  5.68it/s] 72%|███████▏  | 36/50 [00:10<00:02,  5.66it/s] 74%|███████▍  | 37/50 [00:10<00:02,  5.69it/s] 76%|███████▌  | 38/50 [00:11<00:02,  5.69it/s] 78%|███████▊  | 39/50 [00:11<00:01,  5.69it/s] 80%|████████  | 40/50 [00:11<00:01,  5.68it/s] 82%|████████▏ | 41/50 [00:11<00:01,  5.68it/s] 84%|████████▍ | 42/50 [00:11<00:01,  5.68it/s] 86%|████████▌ | 43/50 [00:11<00:01,  5.68it/s] 88%|████████▊ | 44/50 [00:12<00:01,  5.67it/s] 90%|█████████ | 45/50 [00:12<00:00,  5.67it/s] 92%|█████████▏| 46/50 [00:12<00:00,  5.68it/s] 94%|█████████▍| 47/50 [00:12<00:00,  5.67it/s] 96%|█████████▌| 48/50 [00:12<00:00,  5.67it/s] 98%|█████████▊| 49/50 [00:13<00:00,  5.68it/s]100%|██████████| 50/50 [00:17<00:00,  1.51s/it]100%|██████████| 50/50 [00:17<00:00,  2.83it/s]
[I 2023-12-11 00:17:23,867] Trial 360 finished with value: 0.399670510708402 and parameters: {'EMBEDDING_DIM': 929, 'HIDDEN_DIM': 258, 'NUM_LAYERS': 1, 'DROPOUT': 0.02892141409997306, 'LR': 0.0022899164307803098, 'WEIGHT_0': 0.16885952001879467, 'WEIGHT_1': 0.6861652194660888, 'WEIGHT_2': 0.39602207014430946, 'WEIGHT_3': 0.8870652513362938, 'WEIGHT_4': 0.7896335674956716, 'WEIGHT_5': 0.7439091461920695, 'WEIGHT_6': 0.7199265495848093, 'WEIGHT_7': 0.3101279122858708, 'WEIGHT_8': 0.8957779948869035, 'optimizer': 'RMSprop'}. Best is trial 221 with value: 0.418736930154747.
/userhome/cs2/dingruiw/conda/envs/py310/lib/python3.10/site-packages/torch/nn/modules/rnn.py:82: UserWarning: dropout option adds dropout after all but last recurrent layer, so non-zero dropout expects num_layers greater than 1, but got dropout=0.04838211822549862 and num_layers=1
  warnings.warn("dropout option adds dropout after all but last "
{'EMBEDDING_DIM': 929, 'HIDDEN_DIM': 258, 'NUM_LAYERS': 1, 'DROPOUT': 0.02892141409997306, 'LR': 0.0022899164307803098, 'WEIGHT_0': 0.16885952001879467, 'WEIGHT_1': 0.6861652194660888, 'WEIGHT_2': 0.39602207014430946, 'WEIGHT_3': 0.8870652513362938, 'WEIGHT_4': 0.7896335674956716, 'WEIGHT_5': 0.7439091461920695, 'WEIGHT_6': 0.7199265495848093, 'WEIGHT_7': 0.3101279122858708, 'WEIGHT_8': 0.8957779948869035, 'optimizer': 'RMSprop'}
0
              precision    recall  f1-score   support

         LOC       0.20      0.33      0.25      1837
        MISC       0.07      0.03      0.04       922
         ORG       0.15      0.06      0.08      1341
         PER       0.04      0.11      0.06      1842

   micro avg       0.10      0.15      0.12      5942
   macro avg       0.11      0.13      0.11      5942
weighted avg       0.12      0.15      0.12      5942

{'EMBEDDING_DIM': 929, 'HIDDEN_DIM': 258, 'NUM_LAYERS': 1, 'DROPOUT': 0.02892141409997306, 'LR': 0.0022899164307803098, 'WEIGHT_0': 0.16885952001879467, 'WEIGHT_1': 0.6861652194660888, 'WEIGHT_2': 0.39602207014430946, 'WEIGHT_3': 0.8870652513362938, 'WEIGHT_4': 0.7896335674956716, 'WEIGHT_5': 0.7439091461920695, 'WEIGHT_6': 0.7199265495848093, 'WEIGHT_7': 0.3101279122858708, 'WEIGHT_8': 0.8957779948869035, 'optimizer': 'RMSprop'}
49
              precision    recall  f1-score   support

         LOC       0.50      0.53      0.51      1837
        MISC       0.44      0.44      0.44       922
         ORG       0.27      0.26      0.26      1341
         PER       0.35      0.38      0.36      1842

   micro avg       0.39      0.41      0.40      5942
   macro avg       0.39      0.40      0.39      5942
weighted avg       0.39      0.41      0.40      5942

epoch 49
LSTM
  0%|          | 0/50 [00:00<?, ?it/s]  2%|▏         | 1/50 [00:04<03:39,  4.47s/it]  6%|▌         | 3/50 [00:04<00:58,  1.25s/it]  8%|▊         | 4/50 [00:04<00:39,  1.15it/s] 10%|█         | 5/50 [00:05<00:28,  1.59it/s] 12%|█▏        | 6/50 [00:05<00:20,  2.11it/s] 14%|█▍        | 7/50 [00:05<00:15,  2.71it/s] 16%|█▌        | 8/50 [00:05<00:12,  3.34it/s] 18%|█▊        | 9/50 [00:05<00:10,  3.97it/s] 20%|██        | 10/50 [00:05<00:08,  4.55it/s] 22%|██▏       | 11/50 [00:05<00:07,  5.08it/s] 24%|██▍       | 12/50 [00:06<00:06,  5.52it/s] 26%|██▌       | 13/50 [00:06<00:06,  5.87it/s] 28%|██▊       | 14/50 [00:06<00:05,  6.16it/s] 30%|███       | 15/50 [00:06<00:05,  6.36it/s] 32%|███▏      | 16/50 [00:06<00:05,  6.52it/s] 34%|███▍      | 17/50 [00:06<00:04,  6.63it/s] 36%|███▌      | 18/50 [00:06<00:04,  6.71it/s] 38%|███▊      | 19/50 [00:07<00:04,  6.78it/s] 40%|████      | 20/50 [00:07<00:04,  6.82it/s] 42%|████▏     | 21/50 [00:07<00:04,  6.84it/s] 44%|████▍     | 22/50 [00:07<00:04,  6.86it/s] 46%|████▌     | 23/50 [00:07<00:03,  6.88it/s] 48%|████▊     | 24/50 [00:07<00:03,  6.88it/s] 50%|█████     | 25/50 [00:07<00:03,  6.90it/s] 52%|█████▏    | 26/50 [00:08<00:03,  6.89it/s] 54%|█████▍    | 27/50 [00:08<00:03,  6.89it/s] 56%|█████▌    | 28/50 [00:08<00:03,  6.90it/s] 58%|█████▊    | 29/50 [00:08<00:03,  6.90it/s] 60%|██████    | 30/50 [00:08<00:02,  6.90it/s] 62%|██████▏   | 31/50 [00:08<00:02,  6.91it/s] 64%|██████▍   | 32/50 [00:08<00:02,  6.90it/s] 66%|██████▌   | 33/50 [00:09<00:02,  6.91it/s] 68%|██████▊   | 34/50 [00:09<00:02,  6.92it/s] 70%|███████   | 35/50 [00:09<00:02,  6.91it/s] 72%|███████▏  | 36/50 [00:09<00:02,  6.91it/s] 74%|███████▍  | 37/50 [00:09<00:01,  6.91it/s] 76%|███████▌  | 38/50 [00:09<00:01,  6.91it/s] 78%|███████▊  | 39/50 [00:09<00:01,  6.90it/s] 80%|████████  | 40/50 [00:10<00:01,  6.91it/s] 82%|████████▏ | 41/50 [00:10<00:01,  6.90it/s] 84%|████████▍ | 42/50 [00:10<00:01,  6.90it/s] 86%|████████▌ | 43/50 [00:10<00:01,  6.91it/s] 88%|████████▊ | 44/50 [00:10<00:00,  6.91it/s] 90%|█████████ | 45/50 [00:10<00:00,  6.90it/s] 92%|█████████▏| 46/50 [00:10<00:00,  6.90it/s] 94%|█████████▍| 47/50 [00:11<00:00,  6.90it/s] 96%|█████████▌| 48/50 [00:11<00:00,  6.91it/s] 98%|█████████▊| 49/50 [00:11<00:00,  6.90it/s]100%|██████████| 50/50 [00:16<00:00,  1.49s/it]100%|██████████| 50/50 [00:16<00:00,  3.12it/s]
