[I 2023-12-10 23:49:39,784] Trial 301 finished with value: 0.4010764823335359 and parameters: {'EMBEDDING_DIM': 896, 'HIDDEN_DIM': 208, 'NUM_LAYERS': 1, 'DROPOUT': 0.07439704802156671, 'LR': 0.002783799838955648, 'WEIGHT_0': 0.37666472882909313, 'WEIGHT_1': 0.7846396308500311, 'WEIGHT_2': 0.5841976938897521, 'WEIGHT_3': 0.5749517693736783, 'WEIGHT_4': 0.9217584425161419, 'WEIGHT_5': 0.4712024215918994, 'WEIGHT_6': 0.7133298197035496, 'WEIGHT_7': 0.6522819318104806, 'WEIGHT_8': 0.7878600804356485, 'optimizer': 'RMSprop'}. Best is trial 221 with value: 0.418736930154747.
/userhome/cs2/dingruiw/conda/envs/py310/lib/python3.10/site-packages/torch/nn/modules/rnn.py:82: UserWarning: dropout option adds dropout after all but last recurrent layer, so non-zero dropout expects num_layers greater than 1, but got dropout=0.3639179586398525 and num_layers=1
  warnings.warn("dropout option adds dropout after all but last "
{'EMBEDDING_DIM': 896, 'HIDDEN_DIM': 208, 'NUM_LAYERS': 1, 'DROPOUT': 0.07439704802156671, 'LR': 0.002783799838955648, 'WEIGHT_0': 0.37666472882909313, 'WEIGHT_1': 0.7846396308500311, 'WEIGHT_2': 0.5841976938897521, 'WEIGHT_3': 0.5749517693736783, 'WEIGHT_4': 0.9217584425161419, 'WEIGHT_5': 0.4712024215918994, 'WEIGHT_6': 0.7133298197035496, 'WEIGHT_7': 0.6522819318104806, 'WEIGHT_8': 0.7878600804356485, 'optimizer': 'RMSprop'}
0
              precision    recall  f1-score   support

         LOC       0.27      0.08      0.13      1837
        MISC       0.04      0.01      0.02       922
         ORG       0.22      0.04      0.06      1341
         PER       0.10      0.02      0.04      1842

   micro avg       0.18      0.04      0.07      5942
   macro avg       0.16      0.04      0.06      5942
weighted avg       0.17      0.04      0.07      5942

{'EMBEDDING_DIM': 896, 'HIDDEN_DIM': 208, 'NUM_LAYERS': 1, 'DROPOUT': 0.07439704802156671, 'LR': 0.002783799838955648, 'WEIGHT_0': 0.37666472882909313, 'WEIGHT_1': 0.7846396308500311, 'WEIGHT_2': 0.5841976938897521, 'WEIGHT_3': 0.5749517693736783, 'WEIGHT_4': 0.9217584425161419, 'WEIGHT_5': 0.4712024215918994, 'WEIGHT_6': 0.7133298197035496, 'WEIGHT_7': 0.6522819318104806, 'WEIGHT_8': 0.7878600804356485, 'optimizer': 'RMSprop'}
49
              precision    recall  f1-score   support

         LOC       0.58      0.53      0.55      1837
        MISC       0.43      0.45      0.44       922
         ORG       0.29      0.25      0.27      1341
         PER       0.33      0.32      0.32      1842

   micro avg       0.41      0.39      0.40      5942
   macro avg       0.41      0.39      0.40      5942
weighted avg       0.41      0.39      0.40      5942

epoch 49
LSTM
  0%|          | 0/50 [00:00<?, ?it/s]  2%|▏         | 1/50 [00:03<03:13,  3.96s/it]  4%|▍         | 2/50 [00:04<01:21,  1.69s/it]  6%|▌         | 3/50 [00:04<00:47,  1.01s/it]  8%|▊         | 4/50 [00:04<00:31,  1.47it/s] 10%|█         | 5/50 [00:04<00:22,  2.00it/s] 12%|█▏        | 6/50 [00:04<00:17,  2.54it/s] 14%|█▍        | 7/50 [00:04<00:13,  3.08it/s] 16%|█▌        | 8/50 [00:05<00:11,  3.58it/s] 18%|█▊        | 9/50 [00:05<00:10,  4.01it/s] 20%|██        | 10/50 [00:05<00:09,  4.37it/s] 22%|██▏       | 11/50 [00:05<00:08,  4.65it/s] 24%|██▍       | 12/50 [00:05<00:07,  4.87it/s] 26%|██▌       | 13/50 [00:06<00:07,  5.04it/s] 28%|██▊       | 14/50 [00:06<00:06,  5.16it/s] 30%|███       | 15/50 [00:06<00:06,  5.25it/s] 32%|███▏      | 16/50 [00:06<00:06,  5.31it/s] 34%|███▍      | 17/50 [00:06<00:06,  5.35it/s] 36%|███▌      | 18/50 [00:06<00:05,  5.38it/s] 38%|███▊      | 19/50 [00:07<00:05,  5.41it/s] 40%|████      | 20/50 [00:07<00:05,  5.42it/s] 42%|████▏     | 21/50 [00:07<00:05,  5.43it/s] 44%|████▍     | 22/50 [00:07<00:05,  5.44it/s] 46%|████▌     | 23/50 [00:07<00:04,  5.45it/s] 48%|████▊     | 24/50 [00:08<00:04,  5.45it/s] 50%|█████     | 25/50 [00:08<00:04,  5.45it/s] 52%|█████▏    | 26/50 [00:08<00:04,  5.45it/s] 54%|█████▍    | 27/50 [00:08<00:04,  5.46it/s] 56%|█████▌    | 28/50 [00:08<00:04,  5.46it/s] 58%|█████▊    | 29/50 [00:09<00:03,  5.46it/s] 60%|██████    | 30/50 [00:09<00:03,  5.46it/s] 62%|██████▏   | 31/50 [00:09<00:03,  5.46it/s] 64%|██████▍   | 32/50 [00:09<00:03,  5.46it/s] 66%|██████▌   | 33/50 [00:09<00:03,  5.46it/s] 68%|██████▊   | 34/50 [00:09<00:02,  5.46it/s] 70%|███████   | 35/50 [00:10<00:02,  5.46it/s] 72%|███████▏  | 36/50 [00:10<00:02,  5.46it/s] 74%|███████▍  | 37/50 [00:10<00:02,  5.46it/s] 76%|███████▌  | 38/50 [00:10<00:02,  5.46it/s] 78%|███████▊  | 39/50 [00:10<00:02,  5.46it/s] 80%|████████  | 40/50 [00:11<00:01,  5.45it/s] 82%|████████▏ | 41/50 [00:11<00:01,  5.45it/s] 84%|████████▍ | 42/50 [00:11<00:01,  5.45it/s] 86%|████████▌ | 43/50 [00:11<00:01,  5.45it/s] 88%|████████▊ | 44/50 [00:11<00:01,  5.45it/s] 90%|█████████ | 45/50 [00:11<00:00,  5.46it/s] 92%|█████████▏| 46/50 [00:12<00:00,  5.46it/s] 94%|█████████▍| 47/50 [00:12<00:00,  5.46it/s] 96%|█████████▌| 48/50 [00:12<00:00,  5.46it/s] 98%|█████████▊| 49/50 [00:12<00:00,  5.46it/s]100%|██████████| 50/50 [00:16<00:00,  1.37s/it]100%|██████████| 50/50 [00:16<00:00,  2.97it/s]
[I 2023-12-10 23:50:00,208] Trial 302 finished with value: 0.38746223564954685 and parameters: {'EMBEDDING_DIM': 964, 'HIDDEN_DIM': 153, 'NUM_LAYERS': 1, 'DROPOUT': 0.3639179586398525, 'LR': 0.00821086223276156, 'WEIGHT_0': 0.4084509350047862, 'WEIGHT_1': 0.5146486993347393, 'WEIGHT_2': 0.6861253762959714, 'WEIGHT_3': 0.5586511424648118, 'WEIGHT_4': 0.795456456608564, 'WEIGHT_5': 0.8720258803905878, 'WEIGHT_6': 0.817440010459106, 'WEIGHT_7': 0.47522715070888655, 'WEIGHT_8': 0.7211146331433654, 'optimizer': 'Adam'}. Best is trial 221 with value: 0.418736930154747.
/userhome/cs2/dingruiw/conda/envs/py310/lib/python3.10/site-packages/torch/nn/modules/rnn.py:82: UserWarning: dropout option adds dropout after all but last recurrent layer, so non-zero dropout expects num_layers greater than 1, but got dropout=0.3099200063959389 and num_layers=1
  warnings.warn("dropout option adds dropout after all but last "
{'EMBEDDING_DIM': 964, 'HIDDEN_DIM': 153, 'NUM_LAYERS': 1, 'DROPOUT': 0.3639179586398525, 'LR': 0.00821086223276156, 'WEIGHT_0': 0.4084509350047862, 'WEIGHT_1': 0.5146486993347393, 'WEIGHT_2': 0.6861253762959714, 'WEIGHT_3': 0.5586511424648118, 'WEIGHT_4': 0.795456456608564, 'WEIGHT_5': 0.8720258803905878, 'WEIGHT_6': 0.817440010459106, 'WEIGHT_7': 0.47522715070888655, 'WEIGHT_8': 0.7211146331433654, 'optimizer': 'Adam'}
0
              precision    recall  f1-score   support

         LOC       0.31      0.08      0.13      1837
        MISC       0.04      0.02      0.03       922
         ORG       0.10      0.05      0.06      1341
         PER       0.08      0.02      0.03      1842

   micro avg       0.14      0.04      0.07      5942
   macro avg       0.13      0.04      0.06      5942
weighted avg       0.15      0.04      0.07      5942

{'EMBEDDING_DIM': 964, 'HIDDEN_DIM': 153, 'NUM_LAYERS': 1, 'DROPOUT': 0.3639179586398525, 'LR': 0.00821086223276156, 'WEIGHT_0': 0.4084509350047862, 'WEIGHT_1': 0.5146486993347393, 'WEIGHT_2': 0.6861253762959714, 'WEIGHT_3': 0.5586511424648118, 'WEIGHT_4': 0.795456456608564, 'WEIGHT_5': 0.8720258803905878, 'WEIGHT_6': 0.817440010459106, 'WEIGHT_7': 0.47522715070888655, 'WEIGHT_8': 0.7211146331433654, 'optimizer': 'Adam'}
49
              precision    recall  f1-score   support

         LOC       0.49      0.57      0.53      1837
        MISC       0.44      0.50      0.46       922
         ORG       0.25      0.28      0.26      1341
         PER       0.27      0.37      0.31      1842

   micro avg       0.35      0.43      0.39      5942
   macro avg       0.36      0.43      0.39      5942
weighted avg       0.36      0.43      0.39      5942

epoch 49
LSTM
  0%|          | 0/50 [00:00<?, ?it/s]  2%|▏         | 1/50 [00:04<03:42,  4.53s/it]  4%|▍         | 2/50 [00:04<01:32,  1.93s/it]  6%|▌         | 3/50 [00:04<00:53,  1.14s/it]  8%|▊         | 4/50 [00:05<00:35,  1.31it/s] 10%|█         | 5/50 [00:05<00:24,  1.80it/s] 12%|█▏        | 6/50 [00:05<00:18,  2.32it/s] 14%|█▍        | 7/50 [00:05<00:15,  2.85it/s] 16%|█▌        | 8/50 [00:05<00:12,  3.34it/s] 18%|█▊        | 9/50 [00:05<00:10,  3.78it/s] 20%|██        | 10/50 [00:06<00:09,  4.15it/s] 22%|██▏       | 11/50 [00:06<00:08,  4.45it/s] 24%|██▍       | 12/50 [00:06<00:08,  4.68it/s] 26%|██▌       | 13/50 [00:06<00:07,  4.85it/s] 28%|██▊       | 14/50 [00:06<00:07,  4.99it/s] 30%|███       | 15/50 [00:07<00:06,  5.08it/s] 32%|███▏      | 16/50 [00:07<00:06,  5.15it/s] 34%|███▍      | 17/50 [00:07<00:06,  5.20it/s] 36%|███▌      | 18/50 [00:07<00:06,  5.23it/s] 38%|███▊      | 19/50 [00:07<00:05,  5.26it/s] 40%|████      | 20/50 [00:08<00:05,  5.28it/s] 42%|████▏     | 21/50 [00:08<00:05,  5.29it/s] 44%|████▍     | 22/50 [00:08<00:05,  5.30it/s] 46%|████▌     | 23/50 [00:08<00:05,  5.31it/s] 48%|████▊     | 24/50 [00:08<00:04,  5.30it/s] 50%|█████     | 25/50 [00:08<00:04,  5.31it/s] 52%|█████▏    | 26/50 [00:09<00:04,  5.31it/s] 54%|█████▍    | 27/50 [00:09<00:04,  5.30it/s] 56%|█████▌    | 28/50 [00:09<00:04,  5.30it/s] 58%|█████▊    | 29/50 [00:09<00:03,  5.31it/s] 60%|██████    | 30/50 [00:09<00:03,  5.31it/s] 62%|██████▏   | 31/50 [00:10<00:03,  5.32it/s] 64%|██████▍   | 32/50 [00:10<00:03,  5.30it/s] 66%|██████▌   | 33/50 [00:10<00:03,  5.31it/s] 68%|██████▊   | 34/50 [00:10<00:03,  5.29it/s] 70%|███████   | 35/50 [00:10<00:02,  5.29it/s] 72%|███████▏  | 36/50 [00:11<00:02,  5.30it/s] 74%|███████▍  | 37/50 [00:11<00:02,  5.30it/s] 76%|███████▌  | 38/50 [00:11<00:02,  5.29it/s] 78%|███████▊  | 39/50 [00:11<00:02,  5.30it/s] 80%|████████  | 40/50 [00:11<00:01,  5.30it/s] 82%|████████▏ | 41/50 [00:11<00:01,  5.29it/s] 84%|████████▍ | 42/50 [00:12<00:01,  5.29it/s] 86%|████████▌ | 43/50 [00:12<00:01,  5.30it/s] 88%|████████▊ | 44/50 [00:12<00:01,  5.29it/s] 90%|█████████ | 45/50 [00:12<00:00,  5.28it/s] 92%|█████████▏| 46/50 [00:12<00:00,  5.29it/s] 94%|█████████▍| 47/50 [00:13<00:00,  5.28it/s] 96%|█████████▌| 48/50 [00:13<00:00,  5.29it/s] 98%|█████████▊| 49/50 [00:13<00:00,  5.29it/s]100%|██████████| 50/50 [00:18<00:00,  1.53s/it]100%|██████████| 50/50 [00:18<00:00,  2.75it/s]
[I 2023-12-10 23:50:22,571] Trial 303 finished with value: 0.4063427456965997 and parameters: {'EMBEDDING_DIM': 1003, 'HIDDEN_DIM': 272, 'NUM_LAYERS': 1, 'DROPOUT': 0.3099200063959389, 'LR': 0.0017196217826296353, 'WEIGHT_0': 0.5710138916600487, 'WEIGHT_1': 0.2884252122791188, 'WEIGHT_2': 0.22855513437003397, 'WEIGHT_3': 0.7783244578035718, 'WEIGHT_4': 0.9612530690497747, 'WEIGHT_5': 0.5982510631188592, 'WEIGHT_6': 0.9805259495383981, 'WEIGHT_7': 0.19852815099763024, 'WEIGHT_8': 0.8126296372505115, 'optimizer': 'RMSprop'}. Best is trial 221 with value: 0.418736930154747.
/userhome/cs2/dingruiw/conda/envs/py310/lib/python3.10/site-packages/torch/nn/modules/rnn.py:82: UserWarning: dropout option adds dropout after all but last recurrent layer, so non-zero dropout expects num_layers greater than 1, but got dropout=0.3502744888138697 and num_layers=1
  warnings.warn("dropout option adds dropout after all but last "
{'EMBEDDING_DIM': 1003, 'HIDDEN_DIM': 272, 'NUM_LAYERS': 1, 'DROPOUT': 0.3099200063959389, 'LR': 0.0017196217826296353, 'WEIGHT_0': 0.5710138916600487, 'WEIGHT_1': 0.2884252122791188, 'WEIGHT_2': 0.22855513437003397, 'WEIGHT_3': 0.7783244578035718, 'WEIGHT_4': 0.9612530690497747, 'WEIGHT_5': 0.5982510631188592, 'WEIGHT_6': 0.9805259495383981, 'WEIGHT_7': 0.19852815099763024, 'WEIGHT_8': 0.8126296372505115, 'optimizer': 'RMSprop'}
0
              precision    recall  f1-score   support

         LOC       0.22      0.05      0.08      1837
        MISC       0.05      0.03      0.04       922
         ORG       0.12      0.01      0.02      1341
         PER       0.10      0.03      0.05      1842

   micro avg       0.12      0.03      0.05      5942
   macro avg       0.12      0.03      0.05      5942
weighted avg       0.13      0.03      0.05      5942

{'EMBEDDING_DIM': 1003, 'HIDDEN_DIM': 272, 'NUM_LAYERS': 1, 'DROPOUT': 0.3099200063959389, 'LR': 0.0017196217826296353, 'WEIGHT_0': 0.5710138916600487, 'WEIGHT_1': 0.2884252122791188, 'WEIGHT_2': 0.22855513437003397, 'WEIGHT_3': 0.7783244578035718, 'WEIGHT_4': 0.9612530690497747, 'WEIGHT_5': 0.5982510631188592, 'WEIGHT_6': 0.9805259495383981, 'WEIGHT_7': 0.19852815099763024, 'WEIGHT_8': 0.8126296372505115, 'optimizer': 'RMSprop'}
49
              precision    recall  f1-score   support

         LOC       0.54      0.54      0.54      1837
        MISC       0.48      0.44      0.46       922
         ORG       0.28      0.24      0.26      1341
         PER       0.34      0.37      0.35      1842

   micro avg       0.41      0.40      0.41      5942
   macro avg       0.41      0.40      0.40      5942
weighted avg       0.41      0.40      0.41      5942

epoch 49
LSTM
  0%|          | 0/50 [00:00<?, ?it/s]  2%|▏         | 1/50 [00:04<03:43,  4.56s/it]  4%|▍         | 2/50 [00:04<01:33,  1.95s/it]  6%|▌         | 3/50 [00:04<00:54,  1.17s/it]  8%|▊         | 4/50 [00:05<00:36,  1.25it/s] 10%|█         | 5/50 [00:05<00:26,  1.68it/s] 12%|█▏        | 6/50 [00:05<00:20,  2.12it/s] 14%|█▍        | 7/50 [00:05<00:16,  2.54it/s] 16%|█▌        | 8/50 [00:06<00:14,  2.92it/s] 18%|█▊        | 9/50 [00:06<00:12,  3.24it/s] 20%|██        | 10/50 [00:06<00:11,  3.50it/s] 22%|██▏       | 11/50 [00:06<00:10,  3.71it/s] 24%|██▍       | 12/50 [00:07<00:09,  3.87it/s] 26%|██▌       | 13/50 [00:07<00:09,  3.99it/s] 28%|██▊       | 14/50 [00:07<00:08,  4.07it/s] 30%|███       | 15/50 [00:07<00:08,  4.13it/s] 32%|███▏      | 16/50 [00:07<00:08,  4.18it/s] 34%|███▍      | 17/50 [00:08<00:07,  4.21it/s] 36%|███▌      | 18/50 [00:08<00:07,  4.23it/s] 38%|███▊      | 19/50 [00:08<00:07,  4.25it/s] 40%|████      | 20/50 [00:08<00:07,  4.26it/s] 42%|████▏     | 21/50 [00:09<00:06,  4.26it/s] 44%|████▍     | 22/50 [00:09<00:06,  4.27it/s] 46%|████▌     | 23/50 [00:09<00:06,  4.28it/s] 48%|████▊     | 24/50 [00:09<00:06,  4.29it/s] 50%|█████     | 25/50 [00:10<00:05,  4.29it/s] 52%|█████▏    | 26/50 [00:10<00:05,  4.28it/s] 54%|█████▍    | 27/50 [00:10<00:05,  4.28it/s] 56%|█████▌    | 28/50 [00:10<00:05,  4.27it/s] 58%|█████▊    | 29/50 [00:10<00:04,  4.27it/s] 60%|██████    | 30/50 [00:11<00:04,  4.26it/s] 62%|██████▏   | 31/50 [00:11<00:04,  4.26it/s] 64%|██████▍   | 32/50 [00:11<00:04,  4.26it/s] 66%|██████▌   | 33/50 [00:11<00:03,  4.26it/s] 68%|██████▊   | 34/50 [00:12<00:03,  4.26it/s] 70%|███████   | 35/50 [00:12<00:03,  4.26it/s] 72%|███████▏  | 36/50 [00:12<00:03,  4.26it/s] 74%|███████▍  | 37/50 [00:12<00:03,  4.26it/s] 76%|███████▌  | 38/50 [00:13<00:02,  4.26it/s] 78%|███████▊  | 39/50 [00:13<00:02,  4.26it/s] 80%|████████  | 40/50 [00:13<00:02,  4.26it/s] 82%|████████▏ | 41/50 [00:13<00:02,  4.26it/s] 84%|████████▍ | 42/50 [00:14<00:01,  4.26it/s] 86%|████████▌ | 43/50 [00:14<00:01,  4.26it/s] 88%|████████▊ | 44/50 [00:14<00:01,  4.26it/s] 90%|█████████ | 45/50 [00:14<00:01,  4.26it/s] 92%|█████████▏| 46/50 [00:14<00:00,  4.25it/s] 94%|█████████▍| 47/50 [00:15<00:00,  4.25it/s] 96%|█████████▌| 48/50 [00:15<00:00,  4.25it/s] 98%|█████████▊| 49/50 [00:15<00:00,  4.25it/s]100%|██████████| 50/50 [00:20<00:00,  1.59s/it]100%|██████████| 50/50 [00:20<00:00,  2.45it/s]
[I 2023-12-10 23:50:47,164] Trial 304 finished with value: 0.4018129521485226 and parameters: {'EMBEDDING_DIM': 940, 'HIDDEN_DIM': 359, 'NUM_LAYERS': 1, 'DROPOUT': 0.3502744888138697, 'LR': 0.0010093272395435575, 'WEIGHT_0': 0.4833067196634766, 'WEIGHT_1': 0.7392315686667466, 'WEIGHT_2': 0.7067807265609978, 'WEIGHT_3': 0.5553631995336381, 'WEIGHT_4': 0.6085940706697445, 'WEIGHT_5': 0.5103152667961993, 'WEIGHT_6': 0.8556325577814479, 'WEIGHT_7': 0.4504394606101684, 'WEIGHT_8': 0.5973848028312384, 'optimizer': 'RMSprop'}. Best is trial 221 with value: 0.418736930154747.
/userhome/cs2/dingruiw/conda/envs/py310/lib/python3.10/site-packages/torch/nn/modules/rnn.py:82: UserWarning: dropout option adds dropout after all but last recurrent layer, so non-zero dropout expects num_layers greater than 1, but got dropout=0.3820111904575594 and num_layers=1
  warnings.warn("dropout option adds dropout after all but last "
{'EMBEDDING_DIM': 940, 'HIDDEN_DIM': 359, 'NUM_LAYERS': 1, 'DROPOUT': 0.3502744888138697, 'LR': 0.0010093272395435575, 'WEIGHT_0': 0.4833067196634766, 'WEIGHT_1': 0.7392315686667466, 'WEIGHT_2': 0.7067807265609978, 'WEIGHT_3': 0.5553631995336381, 'WEIGHT_4': 0.6085940706697445, 'WEIGHT_5': 0.5103152667961993, 'WEIGHT_6': 0.8556325577814479, 'WEIGHT_7': 0.4504394606101684, 'WEIGHT_8': 0.5973848028312384, 'optimizer': 'RMSprop'}
0
              precision    recall  f1-score   support

         LOC       0.10      0.05      0.06      1837
        MISC       0.06      0.04      0.05       922
         ORG       0.10      0.04      0.05      1341
         PER       0.07      0.02      0.03      1842

   micro avg       0.09      0.03      0.05      5942
   macro avg       0.08      0.03      0.05      5942
weighted avg       0.08      0.03      0.05      5942

{'EMBEDDING_DIM': 940, 'HIDDEN_DIM': 359, 'NUM_LAYERS': 1, 'DROPOUT': 0.3502744888138697, 'LR': 0.0010093272395435575, 'WEIGHT_0': 0.4833067196634766, 'WEIGHT_1': 0.7392315686667466, 'WEIGHT_2': 0.7067807265609978, 'WEIGHT_3': 0.5553631995336381, 'WEIGHT_4': 0.6085940706697445, 'WEIGHT_5': 0.5103152667961993, 'WEIGHT_6': 0.8556325577814479, 'WEIGHT_7': 0.4504394606101684, 'WEIGHT_8': 0.5973848028312384, 'optimizer': 'RMSprop'}
49
              precision    recall  f1-score   support

         LOC       0.59      0.53      0.56      1837
        MISC       0.43      0.43      0.43       922
         ORG       0.27      0.25      0.26      1341
         PER       0.35      0.33      0.34      1842

   micro avg       0.42      0.39      0.40      5942
   macro avg       0.41      0.38      0.40      5942
weighted avg       0.42      0.39      0.40      5942

epoch 49
LSTM
  0%|          | 0/50 [00:00<?, ?it/s]  2%|▏         | 1/50 [00:04<03:58,  4.87s/it]  4%|▍         | 2/50 [00:05<01:41,  2.12s/it]  6%|▌         | 3/50 [00:05<01:01,  1.31s/it]  8%|▊         | 4/50 [00:05<00:42,  1.07it/s] 10%|█         | 5/50 [00:06<00:32,  1.38it/s] 12%|█▏        | 6/50 [00:06<00:26,  1.67it/s] 14%|█▍        | 7/50 [00:06<00:22,  1.92it/s] 16%|█▌        | 8/50 [00:07<00:19,  2.14it/s] 18%|█▊        | 9/50 [00:07<00:17,  2.31it/s] 20%|██        | 10/50 [00:07<00:16,  2.44it/s] 22%|██▏       | 11/50 [00:08<00:15,  2.54it/s] 24%|██▍       | 12/50 [00:08<00:14,  2.62it/s] 26%|██▌       | 13/50 [00:08<00:13,  2.68it/s] 28%|██▊       | 14/50 [00:09<00:13,  2.72it/s] 30%|███       | 15/50 [00:09<00:12,  2.75it/s] 32%|███▏      | 16/50 [00:10<00:12,  2.77it/s] 34%|███▍      | 17/50 [00:10<00:11,  2.78it/s] 36%|███▌      | 18/50 [00:10<00:11,  2.79it/s] 38%|███▊      | 19/50 [00:11<00:11,  2.80it/s] 40%|████      | 20/50 [00:11<00:10,  2.80it/s] 42%|████▏     | 21/50 [00:11<00:10,  2.80it/s] 44%|████▍     | 22/50 [00:12<00:09,  2.81it/s] 46%|████▌     | 23/50 [00:12<00:09,  2.81it/s] 48%|████▊     | 24/50 [00:12<00:09,  2.81it/s] 50%|█████     | 25/50 [00:13<00:08,  2.81it/s] 52%|█████▏    | 26/50 [00:13<00:08,  2.81it/s] 54%|█████▍    | 27/50 [00:13<00:08,  2.81it/s] 56%|█████▌    | 28/50 [00:14<00:07,  2.81it/s] 58%|█████▊    | 29/50 [00:14<00:07,  2.81it/s] 60%|██████    | 30/50 [00:15<00:07,  2.81it/s] 62%|██████▏   | 31/50 [00:15<00:06,  2.81it/s] 64%|██████▍   | 32/50 [00:15<00:06,  2.81it/s] 66%|██████▌   | 33/50 [00:16<00:06,  2.81it/s] 68%|██████▊   | 34/50 [00:16<00:05,  2.81it/s] 70%|███████   | 35/50 [00:16<00:05,  2.81it/s] 72%|███████▏  | 36/50 [00:17<00:04,  2.80it/s] 74%|███████▍  | 37/50 [00:17<00:04,  2.80it/s] 76%|███████▌  | 38/50 [00:17<00:04,  2.80it/s] 78%|███████▊  | 39/50 [00:18<00:03,  2.80it/s] 80%|████████  | 40/50 [00:18<00:03,  2.80it/s] 82%|████████▏ | 41/50 [00:18<00:03,  2.80it/s] 84%|████████▍ | 42/50 [00:19<00:02,  2.80it/s] 86%|████████▌ | 43/50 [00:19<00:02,  2.80it/s] 88%|████████▊ | 44/50 [00:20<00:02,  2.80it/s] 90%|█████████ | 45/50 [00:20<00:01,  2.80it/s] 92%|█████████▏| 46/50 [00:20<00:01,  2.80it/s] 94%|█████████▍| 47/50 [00:21<00:01,  2.80it/s] 96%|█████████▌| 48/50 [00:21<00:00,  2.80it/s] 98%|█████████▊| 49/50 [00:21<00:00,  2.80it/s]100%|██████████| 50/50 [00:26<00:00,  1.75s/it]100%|██████████| 50/50 [00:26<00:00,  1.87it/s]
