[I 2023-12-10 22:28:29,404] Trial 133 finished with value: 0.40707669198030544 and parameters: {'EMBEDDING_DIM': 941, 'HIDDEN_DIM': 129, 'NUM_LAYERS': 1, 'DROPOUT': 0.31178189783964044, 'LR': 0.001823862183604203, 'WEIGHT_0': 0.5401817040726639, 'WEIGHT_1': 0.7483379425665455, 'WEIGHT_2': 0.6820562375531349, 'WEIGHT_3': 0.9747674902782064, 'WEIGHT_4': 0.8852530062256306, 'WEIGHT_5': 0.5842202043808427, 'WEIGHT_6': 0.8377161109605461, 'WEIGHT_7': 0.4030125269506037, 'WEIGHT_8': 0.542249689966269, 'optimizer': 'RMSprop'}. Best is trial 123 with value: 0.4154373927958834.
/userhome/cs2/dingruiw/conda/envs/py310/lib/python3.10/site-packages/torch/nn/modules/rnn.py:82: UserWarning: dropout option adds dropout after all but last recurrent layer, so non-zero dropout expects num_layers greater than 1, but got dropout=0.35260380000618347 and num_layers=1
  warnings.warn("dropout option adds dropout after all but last "
{'EMBEDDING_DIM': 941, 'HIDDEN_DIM': 129, 'NUM_LAYERS': 1, 'DROPOUT': 0.31178189783964044, 'LR': 0.001823862183604203, 'WEIGHT_0': 0.5401817040726639, 'WEIGHT_1': 0.7483379425665455, 'WEIGHT_2': 0.6820562375531349, 'WEIGHT_3': 0.9747674902782064, 'WEIGHT_4': 0.8852530062256306, 'WEIGHT_5': 0.5842202043808427, 'WEIGHT_6': 0.8377161109605461, 'WEIGHT_7': 0.4030125269506037, 'WEIGHT_8': 0.542249689966269, 'optimizer': 'RMSprop'}
0
              precision    recall  f1-score   support

         LOC       0.15      0.03      0.05      1837
        MISC       0.02      0.01      0.02       922
         ORG       0.13      0.03      0.05      1341
         PER       0.07      0.03      0.04      1842

   micro avg       0.08      0.03      0.04      5942
   macro avg       0.09      0.03      0.04      5942
weighted avg       0.10      0.03      0.04      5942

{'EMBEDDING_DIM': 941, 'HIDDEN_DIM': 129, 'NUM_LAYERS': 1, 'DROPOUT': 0.31178189783964044, 'LR': 0.001823862183604203, 'WEIGHT_0': 0.5401817040726639, 'WEIGHT_1': 0.7483379425665455, 'WEIGHT_2': 0.6820562375531349, 'WEIGHT_3': 0.9747674902782064, 'WEIGHT_4': 0.8852530062256306, 'WEIGHT_5': 0.5842202043808427, 'WEIGHT_6': 0.8377161109605461, 'WEIGHT_7': 0.4030125269506037, 'WEIGHT_8': 0.542249689966269, 'optimizer': 'RMSprop'}
49
              precision    recall  f1-score   support

         LOC       0.58      0.55      0.57      1837
        MISC       0.46      0.48      0.47       922
         ORG       0.28      0.26      0.27      1341
         PER       0.31      0.34      0.32      1842

   micro avg       0.40      0.41      0.41      5942
   macro avg       0.41      0.41      0.41      5942
weighted avg       0.41      0.41      0.41      5942

epoch 49
LSTM
  0%|          | 0/50 [00:00<?, ?it/s]  2%|▏         | 1/50 [00:04<03:49,  4.68s/it]  6%|▌         | 3/50 [00:04<01:01,  1.30s/it]  8%|▊         | 4/50 [00:05<00:41,  1.11it/s] 10%|█         | 5/50 [00:05<00:29,  1.53it/s] 12%|█▏        | 6/50 [00:05<00:21,  2.04it/s] 14%|█▍        | 7/50 [00:05<00:16,  2.62it/s] 16%|█▌        | 8/50 [00:05<00:12,  3.24it/s] 18%|█▊        | 9/50 [00:05<00:10,  3.87it/s] 20%|██        | 10/50 [00:05<00:08,  4.47it/s] 22%|██▏       | 11/50 [00:06<00:07,  5.01it/s] 24%|██▍       | 12/50 [00:06<00:06,  5.45it/s] 26%|██▌       | 13/50 [00:06<00:06,  5.82it/s] 28%|██▊       | 14/50 [00:06<00:05,  6.10it/s] 30%|███       | 15/50 [00:06<00:05,  6.31it/s] 32%|███▏      | 16/50 [00:06<00:05,  6.48it/s] 34%|███▍      | 17/50 [00:06<00:04,  6.60it/s] 36%|███▌      | 18/50 [00:07<00:04,  6.68it/s] 38%|███▊      | 19/50 [00:07<00:04,  6.75it/s] 40%|████      | 20/50 [00:07<00:04,  6.79it/s] 42%|████▏     | 21/50 [00:07<00:04,  6.81it/s] 44%|████▍     | 22/50 [00:07<00:04,  6.84it/s] 46%|████▌     | 23/50 [00:07<00:03,  6.86it/s] 48%|████▊     | 24/50 [00:07<00:03,  6.85it/s] 50%|█████     | 25/50 [00:08<00:03,  6.86it/s] 52%|█████▏    | 26/50 [00:08<00:03,  6.87it/s] 54%|█████▍    | 27/50 [00:08<00:03,  6.87it/s] 56%|█████▌    | 28/50 [00:08<00:03,  6.88it/s] 58%|█████▊    | 29/50 [00:08<00:03,  6.89it/s] 60%|██████    | 30/50 [00:08<00:02,  6.88it/s] 62%|██████▏   | 31/50 [00:08<00:02,  6.89it/s] 64%|██████▍   | 32/50 [00:09<00:02,  6.90it/s] 66%|██████▌   | 33/50 [00:09<00:02,  6.88it/s] 68%|██████▊   | 34/50 [00:09<00:02,  6.89it/s] 70%|███████   | 35/50 [00:09<00:02,  6.88it/s] 72%|███████▏  | 36/50 [00:09<00:02,  6.88it/s] 74%|███████▍  | 37/50 [00:09<00:01,  6.89it/s] 76%|███████▌  | 38/50 [00:10<00:01,  6.89it/s] 78%|███████▊  | 39/50 [00:10<00:01,  6.88it/s] 80%|████████  | 40/50 [00:10<00:01,  6.89it/s] 82%|████████▏ | 41/50 [00:10<00:01,  6.88it/s] 84%|████████▍ | 42/50 [00:10<00:01,  6.85it/s] 86%|████████▌ | 43/50 [00:10<00:01,  6.89it/s] 88%|████████▊ | 44/50 [00:10<00:00,  6.87it/s] 90%|█████████ | 45/50 [00:11<00:00,  6.87it/s] 92%|█████████▏| 46/50 [00:11<00:00,  6.88it/s] 94%|█████████▍| 47/50 [00:11<00:00,  6.87it/s] 96%|█████████▌| 48/50 [00:11<00:00,  6.88it/s] 98%|█████████▊| 49/50 [00:11<00:00,  6.87it/s]100%|██████████| 50/50 [00:16<00:00,  1.53s/it]100%|██████████| 50/50 [00:16<00:00,  3.05it/s]
[I 2023-12-10 22:28:50,043] Trial 134 finished with value: 0.4158467115484205 and parameters: {'EMBEDDING_DIM': 997, 'HIDDEN_DIM': 207, 'NUM_LAYERS': 1, 'DROPOUT': 0.35260380000618347, 'LR': 0.002781039374097998, 'WEIGHT_0': 0.4767885553861586, 'WEIGHT_1': 0.7874668475637165, 'WEIGHT_2': 0.679787856870747, 'WEIGHT_3': 0.9119073991613706, 'WEIGHT_4': 0.9287221041553961, 'WEIGHT_5': 0.49887792899121286, 'WEIGHT_6': 0.8135570741979444, 'WEIGHT_7': 0.5231533819761434, 'WEIGHT_8': 0.45868005429451136, 'optimizer': 'RMSprop'}. Best is trial 134 with value: 0.4158467115484205.
/userhome/cs2/dingruiw/conda/envs/py310/lib/python3.10/site-packages/torch/nn/modules/rnn.py:82: UserWarning: dropout option adds dropout after all but last recurrent layer, so non-zero dropout expects num_layers greater than 1, but got dropout=0.353994417367698 and num_layers=1
  warnings.warn("dropout option adds dropout after all but last "
{'EMBEDDING_DIM': 997, 'HIDDEN_DIM': 207, 'NUM_LAYERS': 1, 'DROPOUT': 0.35260380000618347, 'LR': 0.002781039374097998, 'WEIGHT_0': 0.4767885553861586, 'WEIGHT_1': 0.7874668475637165, 'WEIGHT_2': 0.679787856870747, 'WEIGHT_3': 0.9119073991613706, 'WEIGHT_4': 0.9287221041553961, 'WEIGHT_5': 0.49887792899121286, 'WEIGHT_6': 0.8135570741979444, 'WEIGHT_7': 0.5231533819761434, 'WEIGHT_8': 0.45868005429451136, 'optimizer': 'RMSprop'}
0
              precision    recall  f1-score   support

         LOC       0.30      0.06      0.10      1837
        MISC       0.08      0.01      0.02       922
         ORG       0.31      0.04      0.06      1341
         PER       0.10      0.02      0.03      1842

   micro avg       0.20      0.03      0.06      5942
   macro avg       0.20      0.03      0.05      5942
weighted avg       0.20      0.03      0.06      5942

{'EMBEDDING_DIM': 997, 'HIDDEN_DIM': 207, 'NUM_LAYERS': 1, 'DROPOUT': 0.35260380000618347, 'LR': 0.002781039374097998, 'WEIGHT_0': 0.4767885553861586, 'WEIGHT_1': 0.7874668475637165, 'WEIGHT_2': 0.679787856870747, 'WEIGHT_3': 0.9119073991613706, 'WEIGHT_4': 0.9287221041553961, 'WEIGHT_5': 0.49887792899121286, 'WEIGHT_6': 0.8135570741979444, 'WEIGHT_7': 0.5231533819761434, 'WEIGHT_8': 0.45868005429451136, 'optimizer': 'RMSprop'}
49
              precision    recall  f1-score   support

         LOC       0.60      0.52      0.56      1837
        MISC       0.45      0.48      0.46       922
         ORG       0.32      0.28      0.30      1341
         PER       0.34      0.34      0.34      1842

   micro avg       0.43      0.41      0.42      5942
   macro avg       0.43      0.41      0.41      5942
weighted avg       0.43      0.41      0.42      5942

epoch 49
LSTM
  0%|          | 0/50 [00:00<?, ?it/s]  2%|▏         | 1/50 [00:04<03:50,  4.69s/it]  6%|▌         | 3/50 [00:04<01:01,  1.31s/it]  8%|▊         | 4/50 [00:05<00:41,  1.10it/s] 10%|█         | 5/50 [00:05<00:29,  1.52it/s] 12%|█▏        | 6/50 [00:05<00:21,  2.02it/s] 14%|█▍        | 7/50 [00:05<00:16,  2.58it/s] 16%|█▌        | 8/50 [00:05<00:13,  3.17it/s] 18%|█▊        | 9/50 [00:05<00:10,  3.77it/s] 20%|██        | 10/50 [00:06<00:09,  4.32it/s] 22%|██▏       | 11/50 [00:06<00:08,  4.81it/s] 24%|██▍       | 12/50 [00:06<00:07,  5.23it/s] 26%|██▌       | 13/50 [00:06<00:06,  5.57it/s] 28%|██▊       | 14/50 [00:06<00:06,  5.83it/s] 30%|███       | 15/50 [00:06<00:05,  6.04it/s] 32%|███▏      | 16/50 [00:06<00:05,  6.18it/s] 34%|███▍      | 17/50 [00:07<00:05,  6.29it/s] 36%|███▌      | 18/50 [00:07<00:05,  6.35it/s] 38%|███▊      | 19/50 [00:07<00:04,  6.40it/s] 40%|████      | 20/50 [00:07<00:04,  6.43it/s] 42%|████▏     | 21/50 [00:07<00:04,  6.46it/s] 44%|████▍     | 22/50 [00:07<00:04,  6.48it/s] 46%|████▌     | 23/50 [00:08<00:04,  6.51it/s] 48%|████▊     | 24/50 [00:08<00:03,  6.53it/s] 50%|█████     | 25/50 [00:08<00:03,  6.54it/s] 52%|█████▏    | 26/50 [00:08<00:03,  6.54it/s] 54%|█████▍    | 27/50 [00:08<00:03,  6.53it/s] 56%|█████▌    | 28/50 [00:08<00:03,  6.53it/s] 58%|█████▊    | 29/50 [00:08<00:03,  6.50it/s] 60%|██████    | 30/50 [00:09<00:03,  6.53it/s] 62%|██████▏   | 31/50 [00:09<00:02,  6.54it/s] 64%|██████▍   | 32/50 [00:09<00:02,  6.54it/s] 66%|██████▌   | 33/50 [00:09<00:02,  6.55it/s] 68%|██████▊   | 34/50 [00:09<00:02,  6.55it/s] 70%|███████   | 35/50 [00:09<00:02,  6.54it/s] 72%|███████▏  | 36/50 [00:09<00:02,  6.53it/s] 74%|███████▍  | 37/50 [00:10<00:01,  6.53it/s] 76%|███████▌  | 38/50 [00:10<00:01,  6.52it/s] 78%|███████▊  | 39/50 [00:10<00:01,  6.54it/s] 80%|████████  | 40/50 [00:10<00:01,  6.54it/s] 82%|████████▏ | 41/50 [00:10<00:01,  6.54it/s] 84%|████████▍ | 42/50 [00:10<00:01,  6.54it/s] 86%|████████▌ | 43/50 [00:11<00:01,  6.52it/s] 88%|████████▊ | 44/50 [00:11<00:00,  6.52it/s] 90%|█████████ | 45/50 [00:11<00:00,  6.52it/s] 92%|█████████▏| 46/50 [00:11<00:00,  6.53it/s] 94%|█████████▍| 47/50 [00:11<00:00,  6.53it/s] 96%|█████████▌| 48/50 [00:11<00:00,  6.54it/s] 98%|█████████▊| 49/50 [00:11<00:00,  6.55it/s]100%|██████████| 50/50 [00:16<00:00,  1.54s/it]100%|██████████| 50/50 [00:16<00:00,  2.99it/s]
[I 2023-12-10 22:29:11,032] Trial 135 finished with value: 0.3938952242133242 and parameters: {'EMBEDDING_DIM': 954, 'HIDDEN_DIM': 222, 'NUM_LAYERS': 1, 'DROPOUT': 0.353994417367698, 'LR': 0.0025982436178122255, 'WEIGHT_0': 0.4312030562661066, 'WEIGHT_1': 0.7836003302401723, 'WEIGHT_2': 0.7543475336216134, 'WEIGHT_3': 0.9559495179338413, 'WEIGHT_4': 0.9344298986248308, 'WEIGHT_5': 0.5389875018746244, 'WEIGHT_6': 0.8047965080539949, 'WEIGHT_7': 0.5130982047221153, 'WEIGHT_8': 0.504000213714143, 'optimizer': 'RMSprop'}. Best is trial 134 with value: 0.4158467115484205.
/userhome/cs2/dingruiw/conda/envs/py310/lib/python3.10/site-packages/torch/nn/modules/rnn.py:82: UserWarning: dropout option adds dropout after all but last recurrent layer, so non-zero dropout expects num_layers greater than 1, but got dropout=0.32499095111340204 and num_layers=1
  warnings.warn("dropout option adds dropout after all but last "
{'EMBEDDING_DIM': 954, 'HIDDEN_DIM': 222, 'NUM_LAYERS': 1, 'DROPOUT': 0.353994417367698, 'LR': 0.0025982436178122255, 'WEIGHT_0': 0.4312030562661066, 'WEIGHT_1': 0.7836003302401723, 'WEIGHT_2': 0.7543475336216134, 'WEIGHT_3': 0.9559495179338413, 'WEIGHT_4': 0.9344298986248308, 'WEIGHT_5': 0.5389875018746244, 'WEIGHT_6': 0.8047965080539949, 'WEIGHT_7': 0.5130982047221153, 'WEIGHT_8': 0.504000213714143, 'optimizer': 'RMSprop'}
0
              precision    recall  f1-score   support

         LOC       0.29      0.07      0.11      1837
        MISC       0.11      0.02      0.03       922
         ORG       0.11      0.01      0.03      1341
         PER       0.12      0.02      0.03      1842

   micro avg       0.19      0.03      0.06      5942
   macro avg       0.16      0.03      0.05      5942
weighted avg       0.17      0.03      0.06      5942

{'EMBEDDING_DIM': 954, 'HIDDEN_DIM': 222, 'NUM_LAYERS': 1, 'DROPOUT': 0.353994417367698, 'LR': 0.0025982436178122255, 'WEIGHT_0': 0.4312030562661066, 'WEIGHT_1': 0.7836003302401723, 'WEIGHT_2': 0.7543475336216134, 'WEIGHT_3': 0.9559495179338413, 'WEIGHT_4': 0.9344298986248308, 'WEIGHT_5': 0.5389875018746244, 'WEIGHT_6': 0.8047965080539949, 'WEIGHT_7': 0.5130982047221153, 'WEIGHT_8': 0.504000213714143, 'optimizer': 'RMSprop'}
49
              precision    recall  f1-score   support

         LOC       0.61      0.52      0.56      1837
        MISC       0.42      0.43      0.42       922
         ORG       0.25      0.25      0.25      1341
         PER       0.32      0.33      0.33      1842

   micro avg       0.40      0.39      0.39      5942
   macro avg       0.40      0.38      0.39      5942
weighted avg       0.41      0.39      0.40      5942

epoch 49
LSTM
  0%|          | 0/50 [00:00<?, ?it/s]  2%|▏         | 1/50 [00:04<03:49,  4.68s/it]  4%|▍         | 2/50 [00:04<01:35,  1.99s/it]  6%|▌         | 3/50 [00:04<00:54,  1.17s/it]  8%|▊         | 4/50 [00:05<00:35,  1.29it/s] 10%|█         | 5/50 [00:05<00:25,  1.78it/s] 12%|█▏        | 6/50 [00:05<00:18,  2.32it/s] 14%|█▍        | 7/50 [00:05<00:15,  2.87it/s] 16%|█▌        | 8/50 [00:05<00:12,  3.39it/s] 18%|█▊        | 9/50 [00:06<00:10,  3.86it/s] 20%|██        | 10/50 [00:06<00:09,  4.26it/s] 22%|██▏       | 11/50 [00:06<00:08,  4.58it/s] 24%|██▍       | 12/50 [00:06<00:07,  4.84it/s] 26%|██▌       | 13/50 [00:06<00:07,  5.03it/s] 28%|██▊       | 14/50 [00:06<00:06,  5.18it/s] 30%|███       | 15/50 [00:07<00:06,  5.28it/s] 32%|███▏      | 16/50 [00:07<00:06,  5.36it/s] 34%|███▍      | 17/50 [00:07<00:06,  5.42it/s] 36%|███▌      | 18/50 [00:07<00:05,  5.47it/s] 38%|███▊      | 19/50 [00:07<00:05,  5.50it/s] 40%|████      | 20/50 [00:08<00:05,  5.52it/s] 42%|████▏     | 21/50 [00:08<00:05,  5.53it/s] 44%|████▍     | 22/50 [00:08<00:05,  5.54it/s] 46%|████▌     | 23/50 [00:08<00:04,  5.55it/s] 48%|████▊     | 24/50 [00:08<00:04,  5.55it/s] 50%|█████     | 25/50 [00:08<00:04,  5.56it/s] 52%|█████▏    | 26/50 [00:09<00:04,  5.56it/s] 54%|█████▍    | 27/50 [00:09<00:04,  5.56it/s] 56%|█████▌    | 28/50 [00:09<00:03,  5.56it/s] 58%|█████▊    | 29/50 [00:09<00:03,  5.56it/s] 60%|██████    | 30/50 [00:09<00:03,  5.56it/s] 62%|██████▏   | 31/50 [00:10<00:03,  5.57it/s] 64%|██████▍   | 32/50 [00:10<00:03,  5.57it/s] 66%|██████▌   | 33/50 [00:10<00:03,  5.56it/s] 68%|██████▊   | 34/50 [00:10<00:02,  5.57it/s] 70%|███████   | 35/50 [00:10<00:02,  5.57it/s] 72%|███████▏  | 36/50 [00:10<00:02,  5.57it/s] 74%|███████▍  | 37/50 [00:11<00:02,  5.57it/s] 76%|███████▌  | 38/50 [00:11<00:02,  5.56it/s] 78%|███████▊  | 39/50 [00:11<00:01,  5.56it/s] 80%|████████  | 40/50 [00:11<00:01,  5.56it/s] 82%|████████▏ | 41/50 [00:11<00:01,  5.56it/s] 84%|████████▍ | 42/50 [00:11<00:01,  5.56it/s] 86%|████████▌ | 43/50 [00:12<00:01,  5.56it/s] 88%|████████▊ | 44/50 [00:12<00:01,  5.55it/s] 90%|█████████ | 45/50 [00:12<00:00,  5.56it/s] 92%|█████████▏| 46/50 [00:12<00:00,  5.56it/s] 94%|█████████▍| 47/50 [00:12<00:00,  5.56it/s] 96%|█████████▌| 48/50 [00:13<00:00,  5.56it/s] 98%|█████████▊| 49/50 [00:13<00:00,  5.56it/s]100%|██████████| 50/50 [00:18<00:00,  1.57s/it]100%|██████████| 50/50 [00:18<00:00,  2.77it/s]
[I 2023-12-10 22:29:33,317] Trial 136 finished with value: 0.40799865568811966 and parameters: {'EMBEDDING_DIM': 918, 'HIDDEN_DIM': 263, 'NUM_LAYERS': 1, 'DROPOUT': 0.32499095111340204, 'LR': 0.0028219662791523097, 'WEIGHT_0': 0.47151795315624717, 'WEIGHT_1': 0.8482168898936756, 'WEIGHT_2': 0.6772356552693198, 'WEIGHT_3': 0.916164640011918, 'WEIGHT_4': 0.9672969964948381, 'WEIGHT_5': 0.4958971582234054, 'WEIGHT_6': 0.8215357486662547, 'WEIGHT_7': 0.45586553185905715, 'WEIGHT_8': 0.4474762353325493, 'optimizer': 'RMSprop'}. Best is trial 134 with value: 0.4158467115484205.
/userhome/cs2/dingruiw/conda/envs/py310/lib/python3.10/site-packages/torch/nn/modules/rnn.py:82: UserWarning: dropout option adds dropout after all but last recurrent layer, so non-zero dropout expects num_layers greater than 1, but got dropout=0.26973254355232473 and num_layers=1
  warnings.warn("dropout option adds dropout after all but last "
{'EMBEDDING_DIM': 918, 'HIDDEN_DIM': 263, 'NUM_LAYERS': 1, 'DROPOUT': 0.32499095111340204, 'LR': 0.0028219662791523097, 'WEIGHT_0': 0.47151795315624717, 'WEIGHT_1': 0.8482168898936756, 'WEIGHT_2': 0.6772356552693198, 'WEIGHT_3': 0.916164640011918, 'WEIGHT_4': 0.9672969964948381, 'WEIGHT_5': 0.4958971582234054, 'WEIGHT_6': 0.8215357486662547, 'WEIGHT_7': 0.45586553185905715, 'WEIGHT_8': 0.4474762353325493, 'optimizer': 'RMSprop'}
0
              precision    recall  f1-score   support

         LOC       0.35      0.16      0.22      1837
        MISC       0.08      0.03      0.04       922
         ORG       0.18      0.05      0.07      1341
         PER       0.08      0.03      0.04      1842

   micro avg       0.20      0.08      0.11      5942
   macro avg       0.17      0.07      0.10      5942
weighted avg       0.19      0.08      0.11      5942

{'EMBEDDING_DIM': 918, 'HIDDEN_DIM': 263, 'NUM_LAYERS': 1, 'DROPOUT': 0.32499095111340204, 'LR': 0.0028219662791523097, 'WEIGHT_0': 0.47151795315624717, 'WEIGHT_1': 0.8482168898936756, 'WEIGHT_2': 0.6772356552693198, 'WEIGHT_3': 0.916164640011918, 'WEIGHT_4': 0.9672969964948381, 'WEIGHT_5': 0.4958971582234054, 'WEIGHT_6': 0.8215357486662547, 'WEIGHT_7': 0.45586553185905715, 'WEIGHT_8': 0.4474762353325493, 'optimizer': 'RMSprop'}
49
              precision    recall  f1-score   support

         LOC       0.55      0.54      0.54      1837
        MISC       0.42      0.43      0.43       922
         ORG       0.28      0.27      0.28      1341
         PER       0.35      0.37      0.36      1842

   micro avg       0.41      0.41      0.41      5942
   macro avg       0.40      0.40      0.40      5942
weighted avg       0.41      0.41      0.41      5942

epoch 49
LSTM
  0%|          | 0/50 [00:00<?, ?it/s]  2%|▏         | 1/50 [00:04<03:24,  4.18s/it]  4%|▍         | 2/50 [00:04<01:26,  1.81s/it]  6%|▌         | 3/50 [00:04<00:51,  1.10s/it]  8%|▊         | 4/50 [00:04<00:35,  1.31it/s] 10%|█         | 5/50 [00:05<00:26,  1.73it/s] 12%|█▏        | 6/50 [00:05<00:20,  2.13it/s] 14%|█▍        | 7/50 [00:05<00:17,  2.51it/s] 16%|█▌        | 8/50 [00:05<00:14,  2.84it/s] 18%|█▊        | 9/50 [00:06<00:13,  3.12it/s] 20%|██        | 10/50 [00:06<00:12,  3.33it/s] 22%|██▏       | 11/50 [00:06<00:11,  3.50it/s] 24%|██▍       | 12/50 [00:06<00:10,  3.62it/s] 26%|██▌       | 13/50 [00:07<00:09,  3.72it/s] 28%|██▊       | 14/50 [00:07<00:09,  3.79it/s] 30%|███       | 15/50 [00:07<00:09,  3.84it/s] 32%|███▏      | 16/50 [00:07<00:08,  3.87it/s] 34%|███▍      | 17/50 [00:08<00:08,  3.90it/s] 36%|███▌      | 18/50 [00:08<00:08,  3.91it/s] 38%|███▊      | 19/50 [00:08<00:07,  3.93it/s] 40%|████      | 20/50 [00:08<00:07,  3.93it/s] 42%|████▏     | 21/50 [00:09<00:07,  3.94it/s] 44%|████▍     | 22/50 [00:09<00:07,  3.95it/s] 46%|████▌     | 23/50 [00:09<00:06,  3.95it/s] 48%|████▊     | 24/50 [00:09<00:06,  3.95it/s] 50%|█████     | 25/50 [00:10<00:06,  3.95it/s] 52%|█████▏    | 26/50 [00:10<00:06,  3.95it/s] 54%|█████▍    | 27/50 [00:10<00:05,  3.95it/s] 56%|█████▌    | 28/50 [00:10<00:05,  3.96it/s] 58%|█████▊    | 29/50 [00:11<00:05,  3.96it/s] 60%|██████    | 30/50 [00:11<00:05,  3.95it/s] 62%|██████▏   | 31/50 [00:11<00:04,  3.95it/s] 64%|██████▍   | 32/50 [00:11<00:04,  3.95it/s] 66%|██████▌   | 33/50 [00:12<00:04,  3.96it/s] 68%|██████▊   | 34/50 [00:12<00:04,  3.96it/s] 70%|███████   | 35/50 [00:12<00:03,  3.95it/s] 72%|███████▏  | 36/50 [00:12<00:03,  3.96it/s] 74%|███████▍  | 37/50 [00:13<00:03,  3.96it/s] 76%|███████▌  | 38/50 [00:13<00:03,  3.96it/s] 78%|███████▊  | 39/50 [00:13<00:02,  3.96it/s] 80%|████████  | 40/50 [00:13<00:02,  3.96it/s] 82%|████████▏ | 41/50 [00:14<00:02,  3.95it/s] 84%|████████▍ | 42/50 [00:14<00:02,  3.96it/s] 86%|████████▌ | 43/50 [00:14<00:01,  3.96it/s] 88%|████████▊ | 44/50 [00:14<00:01,  3.95it/s] 90%|█████████ | 45/50 [00:15<00:01,  3.95it/s] 92%|█████████▏| 46/50 [00:15<00:01,  3.96it/s] 94%|█████████▍| 47/50 [00:15<00:00,  3.95it/s] 96%|█████████▌| 48/50 [00:15<00:00,  3.96it/s] 98%|█████████▊| 49/50 [00:16<00:00,  3.96it/s]100%|██████████| 50/50 [00:20<00:00,  1.48s/it]100%|██████████| 50/50 [00:20<00:00,  2.43it/s]
