[I 2023-12-10 22:04:30,929] Trial 93 finished with value: 0.030064825685263637 and parameters: {'EMBEDDING_DIM': 956, 'HIDDEN_DIM': 577, 'NUM_LAYERS': 1, 'DROPOUT': 0.34917672855455995, 'LR': 0.0013583909731905834, 'WEIGHT_0': 0.45914357863507754, 'WEIGHT_1': 0.643540909504606, 'WEIGHT_2': 0.6285238160016237, 'WEIGHT_3': 0.8354677663738139, 'WEIGHT_4': 0.8020252007286072, 'WEIGHT_5': 0.5870275412663327, 'WEIGHT_6': 0.9071423697483071, 'WEIGHT_7': 0.3927185117186747, 'WEIGHT_8': 0.48891973197031746, 'optimizer': 'SGD'}. Best is trial 51 with value: 0.41438326562364947.
/userhome/cs2/dingruiw/conda/envs/py310/lib/python3.10/site-packages/torch/nn/modules/rnn.py:82: UserWarning: dropout option adds dropout after all but last recurrent layer, so non-zero dropout expects num_layers greater than 1, but got dropout=0.3242875021748195 and num_layers=1
  warnings.warn("dropout option adds dropout after all but last "
{'EMBEDDING_DIM': 956, 'HIDDEN_DIM': 577, 'NUM_LAYERS': 1, 'DROPOUT': 0.34917672855455995, 'LR': 0.0013583909731905834, 'WEIGHT_0': 0.45914357863507754, 'WEIGHT_1': 0.643540909504606, 'WEIGHT_2': 0.6285238160016237, 'WEIGHT_3': 0.8354677663738139, 'WEIGHT_4': 0.8020252007286072, 'WEIGHT_5': 0.5870275412663327, 'WEIGHT_6': 0.9071423697483071, 'WEIGHT_7': 0.3927185117186747, 'WEIGHT_8': 0.48891973197031746, 'optimizer': 'SGD'}
0
              precision    recall  f1-score   support

         LOC       0.02      0.16      0.04      1837
        MISC       0.01      0.21      0.03       922
         ORG       0.02      0.07      0.03      1341
         PER       0.02      0.07      0.03      1842

   micro avg       0.02      0.12      0.03      5942
   macro avg       0.02      0.13      0.03      5942
weighted avg       0.02      0.12      0.03      5942

{'EMBEDDING_DIM': 956, 'HIDDEN_DIM': 577, 'NUM_LAYERS': 1, 'DROPOUT': 0.34917672855455995, 'LR': 0.0013583909731905834, 'WEIGHT_0': 0.45914357863507754, 'WEIGHT_1': 0.643540909504606, 'WEIGHT_2': 0.6285238160016237, 'WEIGHT_3': 0.8354677663738139, 'WEIGHT_4': 0.8020252007286072, 'WEIGHT_5': 0.5870275412663327, 'WEIGHT_6': 0.9071423697483071, 'WEIGHT_7': 0.3927185117186747, 'WEIGHT_8': 0.48891973197031746, 'optimizer': 'SGD'}
49
              precision    recall  f1-score   support

         LOC       0.02      0.14      0.04      1837
        MISC       0.01      0.17      0.03       922
         ORG       0.02      0.06      0.03      1341
         PER       0.01      0.05      0.02      1842

   micro avg       0.02      0.10      0.03      5942
   macro avg       0.02      0.11      0.03      5942
weighted avg       0.02      0.10      0.03      5942

epoch 49
LSTM
  0%|          | 0/50 [00:00<?, ?it/s]  2%|▏         | 1/50 [00:04<03:54,  4.79s/it]  4%|▍         | 2/50 [00:04<01:39,  2.07s/it]  6%|▌         | 3/50 [00:05<00:58,  1.25s/it]  8%|▊         | 4/50 [00:05<00:40,  1.14it/s] 10%|█         | 5/50 [00:05<00:29,  1.51it/s] 12%|█▏        | 6/50 [00:06<00:23,  1.87it/s] 14%|█▍        | 7/50 [00:06<00:19,  2.19it/s] 16%|█▌        | 8/50 [00:06<00:16,  2.48it/s] 18%|█▊        | 9/50 [00:06<00:15,  2.72it/s] 20%|██        | 10/50 [00:07<00:13,  2.91it/s] 22%|██▏       | 11/50 [00:07<00:12,  3.05it/s] 24%|██▍       | 12/50 [00:07<00:12,  3.16it/s] 26%|██▌       | 13/50 [00:08<00:11,  3.24it/s] 28%|██▊       | 14/50 [00:08<00:10,  3.29it/s] 30%|███       | 15/50 [00:08<00:10,  3.34it/s] 32%|███▏      | 16/50 [00:09<00:10,  3.36it/s] 34%|███▍      | 17/50 [00:09<00:09,  3.38it/s] 36%|███▌      | 18/50 [00:09<00:09,  3.40it/s] 38%|███▊      | 19/50 [00:09<00:09,  3.41it/s] 40%|████      | 20/50 [00:10<00:08,  3.41it/s] 42%|████▏     | 21/50 [00:10<00:08,  3.42it/s] 44%|████▍     | 22/50 [00:10<00:08,  3.42it/s] 46%|████▌     | 23/50 [00:11<00:07,  3.42it/s] 48%|████▊     | 24/50 [00:11<00:07,  3.42it/s] 50%|█████     | 25/50 [00:11<00:07,  3.42it/s] 52%|█████▏    | 26/50 [00:11<00:07,  3.42it/s] 54%|█████▍    | 27/50 [00:12<00:06,  3.42it/s] 56%|█████▌    | 28/50 [00:12<00:06,  3.42it/s] 58%|█████▊    | 29/50 [00:12<00:06,  3.43it/s] 60%|██████    | 30/50 [00:13<00:05,  3.43it/s] 62%|██████▏   | 31/50 [00:13<00:05,  3.42it/s] 64%|██████▍   | 32/50 [00:13<00:05,  3.42it/s] 66%|██████▌   | 33/50 [00:13<00:04,  3.42it/s] 68%|██████▊   | 34/50 [00:14<00:04,  3.42it/s] 70%|███████   | 35/50 [00:14<00:04,  3.42it/s] 72%|███████▏  | 36/50 [00:14<00:04,  3.42it/s] 74%|███████▍  | 37/50 [00:15<00:03,  3.41it/s] 76%|███████▌  | 38/50 [00:15<00:03,  3.41it/s] 78%|███████▊  | 39/50 [00:15<00:03,  3.41it/s] 80%|████████  | 40/50 [00:16<00:02,  3.41it/s] 82%|████████▏ | 41/50 [00:16<00:02,  3.41it/s] 84%|████████▍ | 42/50 [00:16<00:02,  3.41it/s] 86%|████████▌ | 43/50 [00:16<00:02,  3.41it/s] 88%|████████▊ | 44/50 [00:17<00:01,  3.41it/s] 90%|█████████ | 45/50 [00:17<00:01,  3.41it/s] 92%|█████████▏| 46/50 [00:17<00:01,  3.40it/s] 94%|█████████▍| 47/50 [00:18<00:00,  3.40it/s] 96%|█████████▌| 48/50 [00:18<00:00,  3.40it/s] 98%|█████████▊| 49/50 [00:18<00:00,  3.40it/s]100%|██████████| 50/50 [00:23<00:00,  1.69s/it]100%|██████████| 50/50 [00:23<00:00,  2.12it/s]
[I 2023-12-10 22:04:58,799] Trial 94 finished with value: 0.3806734992679356 and parameters: {'EMBEDDING_DIM': 1002, 'HIDDEN_DIM': 417, 'NUM_LAYERS': 1, 'DROPOUT': 0.3242875021748195, 'LR': 0.00038633016528459097, 'WEIGHT_0': 0.41564147801779144, 'WEIGHT_1': 0.7919842223722661, 'WEIGHT_2': 0.5010232215028552, 'WEIGHT_3': 0.8042530955185363, 'WEIGHT_4': 0.87345421488278, 'WEIGHT_5': 0.5157593993790375, 'WEIGHT_6': 0.8619306989831119, 'WEIGHT_7': 0.37455128874201654, 'WEIGHT_8': 0.3751544410018587, 'optimizer': 'RMSprop'}. Best is trial 51 with value: 0.41438326562364947.
/userhome/cs2/dingruiw/conda/envs/py310/lib/python3.10/site-packages/torch/nn/modules/rnn.py:82: UserWarning: dropout option adds dropout after all but last recurrent layer, so non-zero dropout expects num_layers greater than 1, but got dropout=0.36873423564459207 and num_layers=1
  warnings.warn("dropout option adds dropout after all but last "
{'EMBEDDING_DIM': 1002, 'HIDDEN_DIM': 417, 'NUM_LAYERS': 1, 'DROPOUT': 0.3242875021748195, 'LR': 0.00038633016528459097, 'WEIGHT_0': 0.41564147801779144, 'WEIGHT_1': 0.7919842223722661, 'WEIGHT_2': 0.5010232215028552, 'WEIGHT_3': 0.8042530955185363, 'WEIGHT_4': 0.87345421488278, 'WEIGHT_5': 0.5157593993790375, 'WEIGHT_6': 0.8619306989831119, 'WEIGHT_7': 0.37455128874201654, 'WEIGHT_8': 0.3751544410018587, 'optimizer': 'RMSprop'}
0
              precision    recall  f1-score   support

         LOC       0.08      0.07      0.07      1837
        MISC       0.03      0.06      0.04       922
         ORG       0.04      0.04      0.04      1341
         PER       0.04      0.02      0.03      1842

   micro avg       0.05      0.05      0.05      5942
   macro avg       0.05      0.05      0.05      5942
weighted avg       0.05      0.05      0.05      5942

{'EMBEDDING_DIM': 1002, 'HIDDEN_DIM': 417, 'NUM_LAYERS': 1, 'DROPOUT': 0.3242875021748195, 'LR': 0.00038633016528459097, 'WEIGHT_0': 0.41564147801779144, 'WEIGHT_1': 0.7919842223722661, 'WEIGHT_2': 0.5010232215028552, 'WEIGHT_3': 0.8042530955185363, 'WEIGHT_4': 0.87345421488278, 'WEIGHT_5': 0.5157593993790375, 'WEIGHT_6': 0.8619306989831119, 'WEIGHT_7': 0.37455128874201654, 'WEIGHT_8': 0.3751544410018587, 'optimizer': 'RMSprop'}
49
              precision    recall  f1-score   support

         LOC       0.61      0.46      0.53      1837
        MISC       0.48      0.34      0.40       922
         ORG       0.30      0.26      0.28      1341
         PER       0.32      0.31      0.31      1842

   micro avg       0.42      0.35      0.38      5942
   macro avg       0.43      0.34      0.38      5942
weighted avg       0.43      0.35      0.38      5942

epoch 49
LSTM
  0%|          | 0/50 [00:00<?, ?it/s]  2%|▏         | 1/50 [00:04<04:04,  4.98s/it]  4%|▍         | 2/50 [00:05<01:45,  2.20s/it]  6%|▌         | 3/50 [00:05<01:06,  1.42s/it]  8%|▊         | 4/50 [00:06<00:48,  1.05s/it] 10%|█         | 5/50 [00:06<00:38,  1.18it/s] 12%|█▏        | 6/50 [00:07<00:31,  1.38it/s] 14%|█▍        | 7/50 [00:07<00:27,  1.54it/s] 16%|█▌        | 8/50 [00:08<00:25,  1.67it/s] 18%|█▊        | 9/50 [00:08<00:23,  1.77it/s] 20%|██        | 10/50 [00:09<00:21,  1.85it/s] 22%|██▏       | 11/50 [00:09<00:20,  1.91it/s] 24%|██▍       | 12/50 [00:10<00:19,  1.94it/s] 26%|██▌       | 13/50 [00:10<00:18,  1.97it/s] 28%|██▊       | 14/50 [00:11<00:18,  1.99it/s] 30%|███       | 15/50 [00:11<00:17,  2.00it/s] 32%|███▏      | 16/50 [00:12<00:16,  2.01it/s] 34%|███▍      | 17/50 [00:12<00:16,  2.02it/s] 36%|███▌      | 18/50 [00:13<00:15,  2.02it/s] 38%|███▊      | 19/50 [00:13<00:15,  2.02it/s] 40%|████      | 20/50 [00:14<00:14,  2.03it/s] 42%|████▏     | 21/50 [00:14<00:14,  2.03it/s] 44%|████▍     | 22/50 [00:15<00:13,  2.03it/s] 46%|████▌     | 23/50 [00:15<00:13,  2.04it/s] 48%|████▊     | 24/50 [00:16<00:12,  2.04it/s] 50%|█████     | 25/50 [00:16<00:12,  2.04it/s] 52%|█████▏    | 26/50 [00:16<00:11,  2.04it/s] 54%|█████▍    | 27/50 [00:17<00:11,  2.04it/s] 56%|█████▌    | 28/50 [00:17<00:10,  2.03it/s] 58%|█████▊    | 29/50 [00:18<00:10,  2.04it/s] 60%|██████    | 30/50 [00:18<00:09,  2.03it/s] 62%|██████▏   | 31/50 [00:19<00:09,  2.03it/s] 64%|██████▍   | 32/50 [00:19<00:08,  2.03it/s] 66%|██████▌   | 33/50 [00:20<00:08,  2.03it/s] 68%|██████▊   | 34/50 [00:20<00:07,  2.03it/s] 70%|███████   | 35/50 [00:21<00:07,  2.03it/s] 72%|███████▏  | 36/50 [00:21<00:06,  2.03it/s] 74%|███████▍  | 37/50 [00:22<00:06,  2.02it/s] 76%|███████▌  | 38/50 [00:22<00:05,  2.02it/s] 78%|███████▊  | 39/50 [00:23<00:05,  2.02it/s] 80%|████████  | 40/50 [00:23<00:04,  2.02it/s] 82%|████████▏ | 41/50 [00:24<00:04,  2.02it/s] 84%|████████▍ | 42/50 [00:24<00:03,  2.02it/s] 86%|████████▌ | 43/50 [00:25<00:03,  2.02it/s] 88%|████████▊ | 44/50 [00:25<00:02,  2.02it/s] 90%|█████████ | 45/50 [00:26<00:02,  2.02it/s] 92%|█████████▏| 46/50 [00:26<00:01,  2.01it/s] 94%|█████████▍| 47/50 [00:27<00:01,  2.01it/s] 96%|█████████▌| 48/50 [00:27<00:00,  2.01it/s] 98%|█████████▊| 49/50 [00:28<00:00,  2.01it/s]100%|██████████| 50/50 [00:33<00:00,  1.91s/it]100%|██████████| 50/50 [00:33<00:00,  1.49it/s]
[I 2023-12-10 22:05:36,710] Trial 95 finished with value: 0.40189410245372365 and parameters: {'EMBEDDING_DIM': 1024, 'HIDDEN_DIM': 661, 'NUM_LAYERS': 1, 'DROPOUT': 0.36873423564459207, 'LR': 0.0016080231835482778, 'WEIGHT_0': 0.4973185197998225, 'WEIGHT_1': 0.6911702658774995, 'WEIGHT_2': 0.742344675023204, 'WEIGHT_3': 0.9294837900427826, 'WEIGHT_4': 0.9699794144003215, 'WEIGHT_5': 0.47885959054292143, 'WEIGHT_6': 0.9275367355160802, 'WEIGHT_7': 0.4395934881529531, 'WEIGHT_8': 0.41697828501667333, 'optimizer': 'Adam'}. Best is trial 51 with value: 0.41438326562364947.
/userhome/cs2/dingruiw/conda/envs/py310/lib/python3.10/site-packages/torch/nn/modules/rnn.py:82: UserWarning: dropout option adds dropout after all but last recurrent layer, so non-zero dropout expects num_layers greater than 1, but got dropout=0.29235812682172196 and num_layers=1
  warnings.warn("dropout option adds dropout after all but last "
{'EMBEDDING_DIM': 1024, 'HIDDEN_DIM': 661, 'NUM_LAYERS': 1, 'DROPOUT': 0.36873423564459207, 'LR': 0.0016080231835482778, 'WEIGHT_0': 0.4973185197998225, 'WEIGHT_1': 0.6911702658774995, 'WEIGHT_2': 0.742344675023204, 'WEIGHT_3': 0.9294837900427826, 'WEIGHT_4': 0.9699794144003215, 'WEIGHT_5': 0.47885959054292143, 'WEIGHT_6': 0.9275367355160802, 'WEIGHT_7': 0.4395934881529531, 'WEIGHT_8': 0.41697828501667333, 'optimizer': 'Adam'}
0
              precision    recall  f1-score   support

         LOC       0.05      0.03      0.03      1837
        MISC       0.02      0.04      0.03       922
         ORG       0.04      0.05      0.04      1341
         PER       0.03      0.04      0.04      1842

   micro avg       0.03      0.04      0.04      5942
   macro avg       0.03      0.04      0.03      5942
weighted avg       0.03      0.04      0.04      5942

{'EMBEDDING_DIM': 1024, 'HIDDEN_DIM': 661, 'NUM_LAYERS': 1, 'DROPOUT': 0.36873423564459207, 'LR': 0.0016080231835482778, 'WEIGHT_0': 0.4973185197998225, 'WEIGHT_1': 0.6911702658774995, 'WEIGHT_2': 0.742344675023204, 'WEIGHT_3': 0.9294837900427826, 'WEIGHT_4': 0.9699794144003215, 'WEIGHT_5': 0.47885959054292143, 'WEIGHT_6': 0.9275367355160802, 'WEIGHT_7': 0.4395934881529531, 'WEIGHT_8': 0.41697828501667333, 'optimizer': 'Adam'}
49
              precision    recall  f1-score   support

         LOC       0.57      0.52      0.54      1837
        MISC       0.44      0.44      0.44       922
         ORG       0.28      0.25      0.26      1341
         PER       0.35      0.34      0.35      1842

   micro avg       0.41      0.39      0.40      5942
   macro avg       0.41      0.39      0.40      5942
weighted avg       0.41      0.39      0.40      5942

epoch 49
LSTM
  0%|          | 0/50 [00:00<?, ?it/s]  2%|▏         | 1/50 [00:04<03:58,  4.86s/it]  4%|▍         | 2/50 [00:05<01:41,  2.11s/it]  6%|▌         | 3/50 [00:05<01:00,  1.29s/it]  8%|▊         | 4/50 [00:05<00:41,  1.10it/s] 10%|█         | 5/50 [00:06<00:31,  1.43it/s] 12%|█▏        | 6/50 [00:06<00:25,  1.75it/s] 14%|█▍        | 7/50 [00:06<00:21,  2.03it/s] 16%|█▌        | 8/50 [00:06<00:18,  2.28it/s] 18%|█▊        | 9/50 [00:07<00:16,  2.47it/s] 20%|██        | 10/50 [00:07<00:15,  2.63it/s] 22%|██▏       | 11/50 [00:07<00:14,  2.75it/s] 24%|██▍       | 12/50 [00:08<00:13,  2.84it/s] 26%|██▌       | 13/50 [00:08<00:12,  2.90it/s] 28%|██▊       | 14/50 [00:08<00:12,  2.95it/s] 30%|███       | 15/50 [00:09<00:11,  2.98it/s] 32%|███▏      | 16/50 [00:09<00:11,  3.00it/s] 34%|███▍      | 17/50 [00:09<00:10,  3.02it/s] 36%|███▌      | 18/50 [00:10<00:10,  3.03it/s] 38%|███▊      | 19/50 [00:10<00:10,  3.04it/s] 40%|████      | 20/50 [00:10<00:09,  3.04it/s] 42%|████▏     | 21/50 [00:11<00:09,  3.05it/s] 44%|████▍     | 22/50 [00:11<00:09,  3.05it/s] 46%|████▌     | 23/50 [00:11<00:08,  3.05it/s] 48%|████▊     | 24/50 [00:12<00:08,  3.05it/s] 50%|█████     | 25/50 [00:12<00:08,  3.05it/s] 52%|█████▏    | 26/50 [00:12<00:07,  3.05it/s] 54%|█████▍    | 27/50 [00:13<00:07,  3.05it/s] 56%|█████▌    | 28/50 [00:13<00:07,  3.05it/s] 58%|█████▊    | 29/50 [00:13<00:06,  3.05it/s] 60%|██████    | 30/50 [00:14<00:06,  3.04it/s] 62%|██████▏   | 31/50 [00:14<00:06,  3.03it/s] 64%|██████▍   | 32/50 [00:14<00:05,  3.02it/s] 66%|██████▌   | 33/50 [00:15<00:05,  3.02it/s] 68%|██████▊   | 34/50 [00:15<00:05,  3.03it/s] 70%|███████   | 35/50 [00:15<00:04,  3.03it/s] 72%|███████▏  | 36/50 [00:16<00:04,  3.02it/s] 74%|███████▍  | 37/50 [00:16<00:04,  3.02it/s] 76%|███████▌  | 38/50 [00:16<00:03,  3.02it/s] 78%|███████▊  | 39/50 [00:17<00:03,  3.02it/s] 80%|████████  | 40/50 [00:17<00:03,  3.02it/s] 82%|████████▏ | 41/50 [00:17<00:02,  3.01it/s] 84%|████████▍ | 42/50 [00:18<00:02,  3.01it/s] 86%|████████▌ | 43/50 [00:18<00:02,  3.01it/s] 88%|████████▊ | 44/50 [00:18<00:01,  3.00it/s] 90%|█████████ | 45/50 [00:19<00:01,  3.01it/s] 92%|█████████▏| 46/50 [00:19<00:01,  3.02it/s] 94%|█████████▍| 47/50 [00:19<00:00,  3.02it/s] 96%|█████████▌| 48/50 [00:20<00:00,  3.02it/s] 98%|█████████▊| 49/50 [00:20<00:00,  3.02it/s]100%|██████████| 50/50 [00:25<00:00,  1.77s/it]100%|██████████| 50/50 [00:25<00:00,  1.95it/s]
[I 2023-12-10 22:06:06,585] Trial 96 finished with value: 0.40290620871862615 and parameters: {'EMBEDDING_DIM': 963, 'HIDDEN_DIM': 485, 'NUM_LAYERS': 1, 'DROPOUT': 0.29235812682172196, 'LR': 0.0022817011955169873, 'WEIGHT_0': 0.43685106636640636, 'WEIGHT_1': 0.6116124234615324, 'WEIGHT_2': 0.6395527735834009, 'WEIGHT_3': 0.9467713983357032, 'WEIGHT_4': 0.723037658808246, 'WEIGHT_5': 0.553422524874102, 'WEIGHT_6': 0.8886811953351577, 'WEIGHT_7': 0.41675064891773106, 'WEIGHT_8': 0.4007388123606922, 'optimizer': 'Adam'}. Best is trial 51 with value: 0.41438326562364947.
/userhome/cs2/dingruiw/conda/envs/py310/lib/python3.10/site-packages/torch/nn/modules/rnn.py:82: UserWarning: dropout option adds dropout after all but last recurrent layer, so non-zero dropout expects num_layers greater than 1, but got dropout=0.35104870694561235 and num_layers=1
  warnings.warn("dropout option adds dropout after all but last "
{'EMBEDDING_DIM': 963, 'HIDDEN_DIM': 485, 'NUM_LAYERS': 1, 'DROPOUT': 0.29235812682172196, 'LR': 0.0022817011955169873, 'WEIGHT_0': 0.43685106636640636, 'WEIGHT_1': 0.6116124234615324, 'WEIGHT_2': 0.6395527735834009, 'WEIGHT_3': 0.9467713983357032, 'WEIGHT_4': 0.723037658808246, 'WEIGHT_5': 0.553422524874102, 'WEIGHT_6': 0.8886811953351577, 'WEIGHT_7': 0.41675064891773106, 'WEIGHT_8': 0.4007388123606922, 'optimizer': 'Adam'}
0
              precision    recall  f1-score   support

         LOC       0.12      0.04      0.06      1837
        MISC       0.02      0.03      0.02       922
         ORG       0.09      0.04      0.06      1341
         PER       0.03      0.04      0.04      1842

   micro avg       0.05      0.04      0.04      5942
   macro avg       0.06      0.04      0.04      5942
weighted avg       0.07      0.04      0.05      5942

{'EMBEDDING_DIM': 963, 'HIDDEN_DIM': 485, 'NUM_LAYERS': 1, 'DROPOUT': 0.29235812682172196, 'LR': 0.0022817011955169873, 'WEIGHT_0': 0.43685106636640636, 'WEIGHT_1': 0.6116124234615324, 'WEIGHT_2': 0.6395527735834009, 'WEIGHT_3': 0.9467713983357032, 'WEIGHT_4': 0.723037658808246, 'WEIGHT_5': 0.553422524874102, 'WEIGHT_6': 0.8886811953351577, 'WEIGHT_7': 0.41675064891773106, 'WEIGHT_8': 0.4007388123606922, 'optimizer': 'Adam'}
49
              precision    recall  f1-score   support

         LOC       0.55      0.56      0.55      1837
        MISC       0.41      0.43      0.42       922
         ORG       0.29      0.28      0.28      1341
         PER       0.32      0.35      0.33      1842

   micro avg       0.40      0.41      0.40      5942
   macro avg       0.39      0.40      0.40      5942
weighted avg       0.40      0.41      0.40      5942

epoch 49
LSTM
  0%|          | 0/50 [00:00<?, ?it/s]  2%|▏         | 1/50 [00:04<03:50,  4.71s/it]  4%|▍         | 2/50 [00:04<01:36,  2.00s/it]  6%|▌         | 3/50 [00:05<00:55,  1.18s/it]  8%|▊         | 4/50 [00:05<00:36,  1.26it/s] 10%|█         | 5/50 [00:05<00:26,  1.72it/s] 12%|█▏        | 6/50 [00:05<00:19,  2.21it/s] 14%|█▍        | 7/50 [00:05<00:15,  2.70it/s] 16%|█▌        | 8/50 [00:06<00:13,  3.16it/s] 18%|█▊        | 9/50 [00:06<00:11,  3.56it/s] 20%|██        | 10/50 [00:06<00:10,  3.90it/s] 22%|██▏       | 11/50 [00:06<00:09,  4.18it/s] 24%|██▍       | 12/50 [00:06<00:08,  4.39it/s] 26%|██▌       | 13/50 [00:07<00:08,  4.54it/s] 28%|██▊       | 14/50 [00:07<00:07,  4.66it/s] 30%|███       | 15/50 [00:07<00:07,  4.74it/s] 32%|███▏      | 16/50 [00:07<00:07,  4.80it/s] 34%|███▍      | 17/50 [00:07<00:06,  4.84it/s] 36%|███▌      | 18/50 [00:08<00:06,  4.87it/s] 38%|███▊      | 19/50 [00:08<00:06,  4.89it/s] 40%|████      | 20/50 [00:08<00:06,  4.90it/s] 42%|████▏     | 21/50 [00:08<00:05,  4.91it/s] 44%|████▍     | 22/50 [00:08<00:05,  4.91it/s] 46%|████▌     | 23/50 [00:09<00:05,  4.92it/s] 48%|████▊     | 24/50 [00:09<00:05,  4.92it/s] 50%|█████     | 25/50 [00:09<00:05,  4.92it/s] 52%|█████▏    | 26/50 [00:09<00:04,  4.92it/s] 54%|█████▍    | 27/50 [00:09<00:04,  4.93it/s] 56%|█████▌    | 28/50 [00:10<00:04,  4.94it/s] 58%|█████▊    | 29/50 [00:10<00:04,  4.93it/s] 60%|██████    | 30/50 [00:10<00:04,  4.93it/s] 62%|██████▏   | 31/50 [00:10<00:03,  4.93it/s] 64%|██████▍   | 32/50 [00:10<00:03,  4.92it/s] 66%|██████▌   | 33/50 [00:11<00:03,  4.92it/s] 68%|██████▊   | 34/50 [00:11<00:03,  4.92it/s] 70%|███████   | 35/50 [00:11<00:03,  4.92it/s] 72%|███████▏  | 36/50 [00:11<00:02,  4.92it/s] 74%|███████▍  | 37/50 [00:11<00:02,  4.92it/s] 76%|███████▌  | 38/50 [00:12<00:02,  4.92it/s] 78%|███████▊  | 39/50 [00:12<00:02,  4.92it/s] 80%|████████  | 40/50 [00:12<00:02,  4.92it/s] 82%|████████▏ | 41/50 [00:12<00:01,  4.92it/s] 84%|████████▍ | 42/50 [00:12<00:01,  4.92it/s] 86%|████████▌ | 43/50 [00:13<00:01,  4.92it/s] 88%|████████▊ | 44/50 [00:13<00:01,  4.91it/s] 90%|█████████ | 45/50 [00:13<00:01,  4.91it/s] 92%|█████████▏| 46/50 [00:13<00:00,  4.91it/s] 94%|█████████▍| 47/50 [00:13<00:00,  4.91it/s] 96%|█████████▌| 48/50 [00:14<00:00,  4.91it/s] 98%|█████████▊| 49/50 [00:14<00:00,  4.91it/s]100%|██████████| 50/50 [00:19<00:00,  1.66s/it]100%|██████████| 50/50 [00:19<00:00,  2.57it/s]
