[I 2023-12-10 20:57:55,237] Trial 8 finished with value: 0.0 and parameters: {'EMBEDDING_DIM': 608, 'HIDDEN_DIM': 1816, 'NUM_LAYERS': 2, 'DROPOUT': 0.3562385894473965, 'LR': 0.0018986191749624805, 'WEIGHT_0': 0.9023571785565973, 'WEIGHT_1': 0.2957322919884695, 'WEIGHT_2': 0.12731451894888746, 'WEIGHT_3': 0.6342347362522265, 'WEIGHT_4': 0.997619358321048, 'WEIGHT_5': 0.4645978501189958, 'WEIGHT_6': 0.8788693735002607, 'WEIGHT_7': 0.8724594843674157, 'WEIGHT_8': 0.23285871177036432, 'optimizer': 'SGD'}. Best is trial 3 with value: 0.3694009216589862.
{'EMBEDDING_DIM': 608, 'HIDDEN_DIM': 1816, 'NUM_LAYERS': 2, 'DROPOUT': 0.3562385894473965, 'LR': 0.0018986191749624805, 'WEIGHT_0': 0.9023571785565973, 'WEIGHT_1': 0.2957322919884695, 'WEIGHT_2': 0.12731451894888746, 'WEIGHT_3': 0.6342347362522265, 'WEIGHT_4': 0.997619358321048, 'WEIGHT_5': 0.4645978501189958, 'WEIGHT_6': 0.8788693735002607, 'WEIGHT_7': 0.8724594843674157, 'WEIGHT_8': 0.23285871177036432, 'optimizer': 'SGD'}
0
              precision    recall  f1-score   support

         LOC       0.02      0.11      0.04      1837
        MISC       0.01      0.06      0.02       922
         ORG       0.02      0.28      0.04      1341
         PER       0.01      0.00      0.01      1842

   micro avg       0.02      0.11      0.04      5942
   macro avg       0.02      0.11      0.03      5942
weighted avg       0.02      0.11      0.03      5942

{'EMBEDDING_DIM': 608, 'HIDDEN_DIM': 1816, 'NUM_LAYERS': 2, 'DROPOUT': 0.3562385894473965, 'LR': 0.0018986191749624805, 'WEIGHT_0': 0.9023571785565973, 'WEIGHT_1': 0.2957322919884695, 'WEIGHT_2': 0.12731451894888746, 'WEIGHT_3': 0.6342347362522265, 'WEIGHT_4': 0.997619358321048, 'WEIGHT_5': 0.4645978501189958, 'WEIGHT_6': 0.8788693735002607, 'WEIGHT_7': 0.8724594843674157, 'WEIGHT_8': 0.23285871177036432, 'optimizer': 'SGD'}
49
              precision    recall  f1-score   support

         LOC       0.00      0.00      0.00      1837
        MISC       0.00      0.00      0.00       922
         ORG       0.00      0.00      0.00      1341
         PER       0.00      0.00      0.00      1842

   micro avg       0.00      0.00      0.00      5942
   macro avg       0.00      0.00      0.00      5942
weighted avg       0.00      0.00      0.00      5942

epoch 49
LSTM
  0%|          | 0/50 [00:00<?, ?it/s]  2%|▏         | 1/50 [00:28<23:36, 28.90s/it]  4%|▍         | 2/50 [00:33<11:32, 14.42s/it]  6%|▌         | 3/50 [00:40<08:35, 10.96s/it]  8%|▊         | 4/50 [00:46<07:10,  9.36s/it] 10%|█         | 5/50 [00:53<06:21,  8.49s/it] 12%|█▏        | 6/50 [01:00<05:51,  7.98s/it] 14%|█▍        | 7/50 [01:07<05:31,  7.70s/it] 16%|█▌        | 8/50 [01:15<05:15,  7.50s/it] 18%|█▊        | 9/50 [01:22<05:03,  7.39s/it] 20%|██        | 10/50 [01:29<04:52,  7.30s/it] 22%|██▏       | 11/50 [01:36<04:42,  7.23s/it] 24%|██▍       | 12/50 [01:43<04:32,  7.18s/it] 26%|██▌       | 13/50 [01:50<04:23,  7.13s/it] 28%|██▊       | 14/50 [01:57<04:15,  7.09s/it] 30%|███       | 15/50 [02:04<04:07,  7.06s/it] 32%|███▏      | 16/50 [02:11<03:59,  7.04s/it] 34%|███▍      | 17/50 [02:18<03:51,  7.02s/it] 36%|███▌      | 18/50 [02:25<03:43,  7.00s/it] 38%|███▊      | 19/50 [02:32<03:36,  6.99s/it] 40%|████      | 20/50 [02:39<03:29,  6.98s/it] 42%|████▏     | 21/50 [02:46<03:22,  6.98s/it] 44%|████▍     | 22/50 [02:53<03:15,  6.97s/it] 46%|████▌     | 23/50 [03:00<03:07,  6.96s/it] 48%|████▊     | 24/50 [03:07<03:00,  6.95s/it] 50%|█████     | 25/50 [03:14<02:53,  6.95s/it] 52%|█████▏    | 26/50 [03:20<02:46,  6.94s/it] 54%|█████▍    | 27/50 [03:27<02:39,  6.93s/it] 56%|█████▌    | 28/50 [03:34<02:32,  6.93s/it] 58%|█████▊    | 29/50 [03:41<02:25,  6.93s/it] 60%|██████    | 30/50 [03:48<02:18,  6.93s/it] 62%|██████▏   | 31/50 [03:55<02:11,  6.92s/it] 64%|██████▍   | 32/50 [04:02<02:04,  6.92s/it] 66%|██████▌   | 33/50 [04:09<01:57,  6.92s/it] 68%|██████▊   | 34/50 [04:16<01:50,  6.92s/it] 70%|███████   | 35/50 [04:23<01:43,  6.92s/it] 72%|███████▏  | 36/50 [04:30<01:36,  6.92s/it] 74%|███████▍  | 37/50 [04:37<01:29,  6.91s/it] 76%|███████▌  | 38/50 [04:43<01:22,  6.91s/it] 78%|███████▊  | 39/50 [04:50<01:16,  6.91s/it] 80%|████████  | 40/50 [04:57<01:09,  6.92s/it] 82%|████████▏ | 41/50 [05:04<01:02,  6.92s/it] 84%|████████▍ | 42/50 [05:11<00:55,  6.91s/it] 86%|████████▌ | 43/50 [05:18<00:48,  6.92s/it] 88%|████████▊ | 44/50 [05:25<00:41,  6.92s/it] 90%|█████████ | 45/50 [05:32<00:34,  6.91s/it] 92%|█████████▏| 46/50 [05:39<00:27,  6.91s/it] 94%|█████████▍| 47/50 [05:46<00:20,  6.91s/it] 96%|█████████▌| 48/50 [05:53<00:13,  6.90s/it] 98%|█████████▊| 49/50 [05:59<00:06,  6.90s/it]100%|██████████| 50/50 [06:31<00:00, 14.26s/it]100%|██████████| 50/50 [06:31<00:00,  7.83s/it]
[I 2023-12-10 21:04:49,068] Trial 9 finished with value: 0.015348595213319459 and parameters: {'EMBEDDING_DIM': 919, 'HIDDEN_DIM': 1576, 'NUM_LAYERS': 4, 'DROPOUT': 0.02479015843811665, 'LR': 0.0018043179103264786, 'WEIGHT_0': 0.06027519644017432, 'WEIGHT_1': 0.08551358571146384, 'WEIGHT_2': 0.03009170352065138, 'WEIGHT_3': 0.17278780484446, 'WEIGHT_4': 0.3849983714478237, 'WEIGHT_5': 0.3710465082305765, 'WEIGHT_6': 0.6783175766765212, 'WEIGHT_7': 0.6247713159533366, 'WEIGHT_8': 0.9792070639951288, 'optimizer': 'RMSprop'}. Best is trial 3 with value: 0.3694009216589862.
/userhome/cs2/dingruiw/conda/envs/py310/lib/python3.10/site-packages/torch/nn/modules/rnn.py:82: UserWarning: dropout option adds dropout after all but last recurrent layer, so non-zero dropout expects num_layers greater than 1, but got dropout=0.49663940297282594 and num_layers=1
  warnings.warn("dropout option adds dropout after all but last "
{'EMBEDDING_DIM': 919, 'HIDDEN_DIM': 1576, 'NUM_LAYERS': 4, 'DROPOUT': 0.02479015843811665, 'LR': 0.0018043179103264786, 'WEIGHT_0': 0.06027519644017432, 'WEIGHT_1': 0.08551358571146384, 'WEIGHT_2': 0.03009170352065138, 'WEIGHT_3': 0.17278780484446, 'WEIGHT_4': 0.3849983714478237, 'WEIGHT_5': 0.3710465082305765, 'WEIGHT_6': 0.6783175766765212, 'WEIGHT_7': 0.6247713159533366, 'WEIGHT_8': 0.9792070639951288, 'optimizer': 'RMSprop'}
0
              precision    recall  f1-score   support

         LOC       0.05      0.00      0.01      1837
        MISC       0.00      0.00      0.00       922
         ORG       0.00      0.00      0.00      1341
         PER       0.00      0.00      0.00      1842

   micro avg       0.05      0.00      0.00      5942
   macro avg       0.01      0.00      0.00      5942
weighted avg       0.02      0.00      0.00      5942

{'EMBEDDING_DIM': 919, 'HIDDEN_DIM': 1576, 'NUM_LAYERS': 4, 'DROPOUT': 0.02479015843811665, 'LR': 0.0018043179103264786, 'WEIGHT_0': 0.06027519644017432, 'WEIGHT_1': 0.08551358571146384, 'WEIGHT_2': 0.03009170352065138, 'WEIGHT_3': 0.17278780484446, 'WEIGHT_4': 0.3849983714478237, 'WEIGHT_5': 0.3710465082305765, 'WEIGHT_6': 0.6783175766765212, 'WEIGHT_7': 0.6247713159533366, 'WEIGHT_8': 0.9792070639951288, 'optimizer': 'RMSprop'}
49
              precision    recall  f1-score   support

         LOC       0.06      0.03      0.04      1837
        MISC       0.00      0.00      0.00       922
         ORG       0.01      0.00      0.01      1341
         PER       0.02      0.00      0.00      1842

   micro avg       0.03      0.01      0.02      5942
   macro avg       0.02      0.01      0.01      5942
weighted avg       0.03      0.01      0.01      5942

epoch 49
LSTM
  0%|          | 0/50 [00:00<?, ?it/s]  2%|▏         | 1/50 [00:04<03:23,  4.15s/it] 10%|█         | 5/50 [00:04<00:28,  1.56it/s] 16%|█▌        | 8/50 [00:04<00:15,  2.74it/s] 20%|██        | 10/50 [00:04<00:10,  3.68it/s] 24%|██▍       | 12/50 [00:04<00:07,  4.81it/s] 28%|██▊       | 14/50 [00:04<00:05,  6.08it/s] 32%|███▏      | 16/50 [00:04<00:04,  7.45it/s] 36%|███▌      | 18/50 [00:05<00:03,  8.82it/s] 40%|████      | 20/50 [00:05<00:02, 10.10it/s] 44%|████▍     | 22/50 [00:05<00:02, 11.24it/s] 48%|████▊     | 24/50 [00:05<00:02, 12.21it/s] 52%|█████▏    | 26/50 [00:05<00:01, 13.00it/s] 56%|█████▌    | 28/50 [00:05<00:01, 13.59it/s] 60%|██████    | 30/50 [00:05<00:01, 14.06it/s] 64%|██████▍   | 32/50 [00:06<00:01, 14.40it/s] 68%|██████▊   | 34/50 [00:06<00:01, 14.65it/s] 72%|███████▏  | 36/50 [00:06<00:00, 14.80it/s] 76%|███████▌  | 38/50 [00:06<00:00, 14.93it/s] 80%|████████  | 40/50 [00:06<00:00, 15.01it/s] 84%|████████▍ | 42/50 [00:06<00:00, 15.07it/s] 88%|████████▊ | 44/50 [00:06<00:00, 15.14it/s] 92%|█████████▏| 46/50 [00:06<00:00, 15.17it/s] 96%|█████████▌| 48/50 [00:07<00:00, 15.20it/s]100%|██████████| 50/50 [00:11<00:00,  1.44it/s]100%|██████████| 50/50 [00:11<00:00,  4.39it/s]
[I 2023-12-10 21:05:04,163] Trial 10 finished with value: 0.3870380484252685 and parameters: {'EMBEDDING_DIM': 1015, 'HIDDEN_DIM': 51, 'NUM_LAYERS': 1, 'DROPOUT': 0.49663940297282594, 'LR': 0.004224480622438706, 'WEIGHT_0': 0.5517571020090088, 'WEIGHT_1': 0.5698868021532394, 'WEIGHT_2': 0.34024183062967595, 'WEIGHT_3': 0.9322005596927789, 'WEIGHT_4': 0.6879128268611562, 'WEIGHT_5': 0.8560603844211283, 'WEIGHT_6': 0.9860388575101096, 'WEIGHT_7': 0.38544456114883263, 'WEIGHT_8': 0.4748589155390333, 'optimizer': 'Adam'}. Best is trial 10 with value: 0.3870380484252685.
/userhome/cs2/dingruiw/conda/envs/py310/lib/python3.10/site-packages/torch/nn/modules/rnn.py:82: UserWarning: dropout option adds dropout after all but last recurrent layer, so non-zero dropout expects num_layers greater than 1, but got dropout=0.4843470582816884 and num_layers=1
  warnings.warn("dropout option adds dropout after all but last "
{'EMBEDDING_DIM': 1015, 'HIDDEN_DIM': 51, 'NUM_LAYERS': 1, 'DROPOUT': 0.49663940297282594, 'LR': 0.004224480622438706, 'WEIGHT_0': 0.5517571020090088, 'WEIGHT_1': 0.5698868021532394, 'WEIGHT_2': 0.34024183062967595, 'WEIGHT_3': 0.9322005596927789, 'WEIGHT_4': 0.6879128268611562, 'WEIGHT_5': 0.8560603844211283, 'WEIGHT_6': 0.9860388575101096, 'WEIGHT_7': 0.38544456114883263, 'WEIGHT_8': 0.4748589155390333, 'optimizer': 'Adam'}
0
              precision    recall  f1-score   support

         LOC       0.06      0.18      0.09      1837
        MISC       0.02      0.02      0.02       922
         ORG       0.05      0.07      0.06      1341
         PER       0.03      0.04      0.04      1842

   micro avg       0.05      0.09      0.06      5942
   macro avg       0.04      0.08      0.05      5942
weighted avg       0.04      0.09      0.06      5942

{'EMBEDDING_DIM': 1015, 'HIDDEN_DIM': 51, 'NUM_LAYERS': 1, 'DROPOUT': 0.49663940297282594, 'LR': 0.004224480622438706, 'WEIGHT_0': 0.5517571020090088, 'WEIGHT_1': 0.5698868021532394, 'WEIGHT_2': 0.34024183062967595, 'WEIGHT_3': 0.9322005596927789, 'WEIGHT_4': 0.6879128268611562, 'WEIGHT_5': 0.8560603844211283, 'WEIGHT_6': 0.9860388575101096, 'WEIGHT_7': 0.38544456114883263, 'WEIGHT_8': 0.4748589155390333, 'optimizer': 'Adam'}
49
              precision    recall  f1-score   support

         LOC       0.57      0.53      0.55      1837
        MISC       0.58      0.39      0.47       922
         ORG       0.29      0.25      0.27      1341
         PER       0.29      0.25      0.27      1842

   micro avg       0.42      0.36      0.39      5942
   macro avg       0.43      0.36      0.39      5942
weighted avg       0.42      0.36      0.39      5942

epoch 49
LSTM
  0%|          | 0/50 [00:00<?, ?it/s]  2%|▏         | 1/50 [00:04<03:21,  4.10s/it] 10%|█         | 5/50 [00:04<00:28,  1.58it/s] 16%|█▌        | 8/50 [00:04<00:14,  2.83it/s] 22%|██▏       | 11/50 [00:04<00:09,  4.32it/s] 28%|██▊       | 14/50 [00:04<00:05,  6.04it/s] 34%|███▍      | 17/50 [00:04<00:04,  7.89it/s] 38%|███▊      | 19/50 [00:04<00:03,  9.22it/s] 42%|████▏     | 21/50 [00:05<00:02, 10.65it/s] 46%|████▌     | 23/50 [00:05<00:02, 12.10it/s] 50%|█████     | 25/50 [00:05<00:01, 13.47it/s] 54%|█████▍    | 27/50 [00:05<00:01, 14.69it/s] 58%|█████▊    | 29/50 [00:05<00:01, 15.74it/s] 62%|██████▏   | 31/50 [00:05<00:01, 16.59it/s] 66%|██████▌   | 33/50 [00:05<00:00, 17.25it/s] 70%|███████   | 35/50 [00:05<00:00, 17.75it/s] 74%|███████▍  | 37/50 [00:05<00:00, 18.12it/s] 78%|███████▊  | 39/50 [00:05<00:00, 18.38it/s] 82%|████████▏ | 41/50 [00:06<00:00, 18.57it/s] 86%|████████▌ | 43/50 [00:06<00:00, 18.71it/s] 90%|█████████ | 45/50 [00:06<00:00, 18.81it/s] 94%|█████████▍| 47/50 [00:06<00:00, 18.89it/s] 98%|█████████▊| 49/50 [00:06<00:00, 18.94it/s]100%|██████████| 50/50 [00:10<00:00,  4.67it/s]
[I 2023-12-10 21:05:18,574] Trial 11 finished with value: 0.27093273458695855 and parameters: {'EMBEDDING_DIM': 1005, 'HIDDEN_DIM': 16, 'NUM_LAYERS': 1, 'DROPOUT': 0.4843470582816884, 'LR': 0.004329801306244007, 'WEIGHT_0': 0.506480547376202, 'WEIGHT_1': 0.5494339657177647, 'WEIGHT_2': 0.3758694986914858, 'WEIGHT_3': 0.9617751412126533, 'WEIGHT_4': 0.7305848335679002, 'WEIGHT_5': 0.9844264271501988, 'WEIGHT_6': 0.9985792596932109, 'WEIGHT_7': 0.41491649054777313, 'WEIGHT_8': 0.4946088940877313, 'optimizer': 'Adam'}. Best is trial 10 with value: 0.3870380484252685.
/userhome/cs2/dingruiw/conda/envs/py310/lib/python3.10/site-packages/torch/nn/modules/rnn.py:82: UserWarning: dropout option adds dropout after all but last recurrent layer, so non-zero dropout expects num_layers greater than 1, but got dropout=0.4918228662131663 and num_layers=1
  warnings.warn("dropout option adds dropout after all but last "
{'EMBEDDING_DIM': 1005, 'HIDDEN_DIM': 16, 'NUM_LAYERS': 1, 'DROPOUT': 0.4843470582816884, 'LR': 0.004329801306244007, 'WEIGHT_0': 0.506480547376202, 'WEIGHT_1': 0.5494339657177647, 'WEIGHT_2': 0.3758694986914858, 'WEIGHT_3': 0.9617751412126533, 'WEIGHT_4': 0.7305848335679002, 'WEIGHT_5': 0.9844264271501988, 'WEIGHT_6': 0.9985792596932109, 'WEIGHT_7': 0.41491649054777313, 'WEIGHT_8': 0.4946088940877313, 'optimizer': 'Adam'}
0
              precision    recall  f1-score   support

         LOC       0.06      0.29      0.10      1837
        MISC       0.01      0.16      0.03       922
         ORG       0.02      0.01      0.01      1341
         PER       0.02      0.08      0.03      1842

   micro avg       0.03      0.14      0.05      5942
   macro avg       0.03      0.13      0.04      5942
weighted avg       0.03      0.14      0.04      5942

{'EMBEDDING_DIM': 1005, 'HIDDEN_DIM': 16, 'NUM_LAYERS': 1, 'DROPOUT': 0.4843470582816884, 'LR': 0.004329801306244007, 'WEIGHT_0': 0.506480547376202, 'WEIGHT_1': 0.5494339657177647, 'WEIGHT_2': 0.3758694986914858, 'WEIGHT_3': 0.9617751412126533, 'WEIGHT_4': 0.7305848335679002, 'WEIGHT_5': 0.9844264271501988, 'WEIGHT_6': 0.9985792596932109, 'WEIGHT_7': 0.41491649054777313, 'WEIGHT_8': 0.4946088940877313, 'optimizer': 'Adam'}
49
              precision    recall  f1-score   support

         LOC       0.45      0.48      0.46      1837
        MISC       0.38      0.18      0.24       922
         ORG       0.26      0.11      0.16      1341
         PER       0.14      0.14      0.14      1842

   micro avg       0.31      0.24      0.27      5942
   macro avg       0.31      0.23      0.25      5942
weighted avg       0.30      0.24      0.26      5942

epoch 49
LSTM
  0%|          | 0/50 [00:00<?, ?it/s]  2%|▏         | 1/50 [00:04<03:17,  4.04s/it] 10%|█         | 5/50 [00:04<00:28,  1.60it/s] 16%|█▌        | 8/50 [00:04<00:14,  2.86it/s] 22%|██▏       | 11/50 [00:04<00:08,  4.35it/s] 28%|██▊       | 14/50 [00:04<00:05,  6.04it/s] 32%|███▏      | 16/50 [00:04<00:04,  7.31it/s] 36%|███▌      | 18/50 [00:04<00:03,  8.73it/s] 40%|████      | 20/50 [00:04<00:02, 10.23it/s] 44%|████▍     | 22/50 [00:05<00:02, 11.70it/s] 48%|████▊     | 24/50 [00:05<00:01, 13.06it/s] 52%|█████▏    | 26/50 [00:05<00:01, 14.22it/s] 56%|█████▌    | 28/50 [00:05<00:01, 15.23it/s] 60%|██████    | 30/50 [00:05<00:01, 16.05it/s] 64%|██████▍   | 32/50 [00:05<00:01, 16.68it/s] 68%|██████▊   | 34/50 [00:05<00:00, 17.16it/s] 72%|███████▏  | 36/50 [00:05<00:00, 17.50it/s] 76%|███████▌  | 38/50 [00:05<00:00, 17.75it/s] 80%|████████  | 40/50 [00:06<00:00, 17.93it/s] 84%|████████▍ | 42/50 [00:06<00:00, 18.05it/s] 88%|████████▊ | 44/50 [00:06<00:00, 18.13it/s] 92%|█████████▏| 46/50 [00:06<00:00, 18.19it/s] 96%|█████████▌| 48/50 [00:06<00:00, 18.26it/s]100%|██████████| 50/50 [00:10<00:00,  1.47it/s]100%|██████████| 50/50 [00:10<00:00,  4.65it/s]
[I 2023-12-10 21:05:32,975] Trial 12 finished with value: 0.38023347669621693 and parameters: {'EMBEDDING_DIM': 844, 'HIDDEN_DIM': 58, 'NUM_LAYERS': 1, 'DROPOUT': 0.4918228662131663, 'LR': 0.003920027257461454, 'WEIGHT_0': 0.6815155480562409, 'WEIGHT_1': 0.5241517245349541, 'WEIGHT_2': 0.32725194500450805, 'WEIGHT_3': 0.991788099058883, 'WEIGHT_4': 0.6835615329923864, 'WEIGHT_5': 0.6375165869960064, 'WEIGHT_6': 0.9858567638056974, 'WEIGHT_7': 0.0004581658619627893, 'WEIGHT_8': 0.5266386750419033, 'optimizer': 'Adam'}. Best is trial 10 with value: 0.3870380484252685.
{'EMBEDDING_DIM': 844, 'HIDDEN_DIM': 58, 'NUM_LAYERS': 1, 'DROPOUT': 0.4918228662131663, 'LR': 0.003920027257461454, 'WEIGHT_0': 0.6815155480562409, 'WEIGHT_1': 0.5241517245349541, 'WEIGHT_2': 0.32725194500450805, 'WEIGHT_3': 0.991788099058883, 'WEIGHT_4': 0.6835615329923864, 'WEIGHT_5': 0.6375165869960064, 'WEIGHT_6': 0.9858567638056974, 'WEIGHT_7': 0.0004581658619627893, 'WEIGHT_8': 0.5266386750419033, 'optimizer': 'Adam'}
0
              precision    recall  f1-score   support

         LOC       0.06      0.15      0.09      1837
        MISC       0.02      0.05      0.03       922
         ORG       0.03      0.13      0.05      1341
         PER       0.02      0.05      0.03      1842

   micro avg       0.03      0.10      0.05      5942
   macro avg       0.03      0.10      0.05      5942
weighted avg       0.03      0.10      0.05      5942

{'EMBEDDING_DIM': 844, 'HIDDEN_DIM': 58, 'NUM_LAYERS': 1, 'DROPOUT': 0.4918228662131663, 'LR': 0.003920027257461454, 'WEIGHT_0': 0.6815155480562409, 'WEIGHT_1': 0.5241517245349541, 'WEIGHT_2': 0.32725194500450805, 'WEIGHT_3': 0.991788099058883, 'WEIGHT_4': 0.6835615329923864, 'WEIGHT_5': 0.6375165869960064, 'WEIGHT_6': 0.9858567638056974, 'WEIGHT_7': 0.0004581658619627893, 'WEIGHT_8': 0.5266386750419033, 'optimizer': 'Adam'}
49
              precision    recall  f1-score   support

         LOC       0.57      0.56      0.56      1837
        MISC       0.54      0.34      0.42       922
         ORG       0.29      0.24      0.27      1341
         PER       0.26      0.27      0.26      1842

   micro avg       0.40      0.36      0.38      5942
   macro avg       0.41      0.35      0.38      5942
weighted avg       0.40      0.36      0.38      5942

epoch 49
LSTM
  0%|          | 0/50 [00:00<?, ?it/s]  2%|▏         | 1/50 [00:08<07:03,  8.65s/it]  4%|▍         | 2/50 [00:09<03:18,  4.14s/it]  6%|▌         | 3/50 [00:11<02:16,  2.90s/it]  8%|▊         | 4/50 [00:12<01:46,  2.32s/it] 10%|█         | 5/50 [00:13<01:29,  2.00s/it] 12%|█▏        | 6/50 [00:15<01:19,  1.80s/it] 14%|█▍        | 7/50 [00:16<01:12,  1.68s/it] 16%|█▌        | 8/50 [00:18<01:07,  1.60s/it] 18%|█▊        | 9/50 [00:19<01:03,  1.55s/it] 20%|██        | 10/50 [00:21<01:00,  1.51s/it] 22%|██▏       | 11/50 [00:22<00:57,  1.48s/it] 24%|██▍       | 12/50 [00:23<00:55,  1.47s/it] 26%|██▌       | 13/50 [00:25<00:53,  1.46s/it] 28%|██▊       | 14/50 [00:26<00:52,  1.45s/it] 30%|███       | 15/50 [00:28<00:50,  1.45s/it] 32%|███▏      | 16/50 [00:29<00:49,  1.45s/it] 34%|███▍      | 17/50 [00:31<00:47,  1.45s/it] 36%|███▌      | 18/50 [00:32<00:46,  1.45s/it] 38%|███▊      | 19/50 [00:34<00:44,  1.45s/it] 40%|████      | 20/50 [00:35<00:43,  1.45s/it] 42%|████▏     | 21/50 [00:36<00:42,  1.45s/it] 44%|████▍     | 22/50 [00:38<00:40,  1.45s/it] 46%|████▌     | 23/50 [00:39<00:39,  1.45s/it] 48%|████▊     | 24/50 [00:41<00:37,  1.45s/it] 50%|█████     | 25/50 [00:42<00:36,  1.45s/it] 52%|█████▏    | 26/50 [00:44<00:34,  1.45s/it] 54%|█████▍    | 27/50 [00:45<00:33,  1.46s/it] 56%|█████▌    | 28/50 [00:47<00:32,  1.46s/it] 58%|█████▊    | 29/50 [00:48<00:30,  1.46s/it] 60%|██████    | 30/50 [00:50<00:29,  1.47s/it] 62%|██████▏   | 31/50 [00:51<00:27,  1.46s/it] 64%|██████▍   | 32/50 [00:52<00:26,  1.47s/it] 66%|██████▌   | 33/50 [00:54<00:25,  1.47s/it] 68%|██████▊   | 34/50 [00:55<00:23,  1.48s/it] 70%|███████   | 35/50 [00:57<00:22,  1.48s/it] 72%|███████▏  | 36/50 [00:58<00:20,  1.48s/it] 74%|███████▍  | 37/50 [01:00<00:19,  1.48s/it] 76%|███████▌  | 38/50 [01:01<00:17,  1.48s/it] 78%|███████▊  | 39/50 [01:03<00:16,  1.48s/it] 80%|████████  | 40/50 [01:04<00:14,  1.48s/it] 82%|████████▏ | 41/50 [01:06<00:13,  1.49s/it] 84%|████████▍ | 42/50 [01:07<00:11,  1.49s/it] 86%|████████▌ | 43/50 [01:09<00:10,  1.49s/it] 88%|████████▊ | 44/50 [01:10<00:08,  1.49s/it] 90%|█████████ | 45/50 [01:12<00:07,  1.49s/it] 92%|█████████▏| 46/50 [01:13<00:05,  1.49s/it] 94%|█████████▍| 47/50 [01:15<00:04,  1.49s/it] 96%|█████████▌| 48/50 [01:16<00:02,  1.49s/it] 98%|█████████▊| 49/50 [01:18<00:01,  1.49s/it]100%|██████████| 50/50 [01:27<00:00,  3.80s/it]100%|██████████| 50/50 [01:27<00:00,  1.75s/it]
