[I 2023-12-10 22:42:47,869] Trial 165 finished with value: 0.4098915989159892 and parameters: {'EMBEDDING_DIM': 927, 'HIDDEN_DIM': 341, 'NUM_LAYERS': 1, 'DROPOUT': 0.3575305084566753, 'LR': 0.0009865175689569915, 'WEIGHT_0': 0.382797779589461, 'WEIGHT_1': 0.6988664258444276, 'WEIGHT_2': 0.5749568516813174, 'WEIGHT_3': 0.8267052921091365, 'WEIGHT_4': 0.9116411919225746, 'WEIGHT_5': 0.5573271526148632, 'WEIGHT_6': 0.73140978715762, 'WEIGHT_7': 0.3522127618253938, 'WEIGHT_8': 0.4879577456419176, 'optimizer': 'RMSprop'}. Best is trial 134 with value: 0.4158467115484205.
/userhome/cs2/dingruiw/conda/envs/py310/lib/python3.10/site-packages/torch/nn/modules/rnn.py:82: UserWarning: dropout option adds dropout after all but last recurrent layer, so non-zero dropout expects num_layers greater than 1, but got dropout=0.35814167195121216 and num_layers=1
  warnings.warn("dropout option adds dropout after all but last "
{'EMBEDDING_DIM': 927, 'HIDDEN_DIM': 341, 'NUM_LAYERS': 1, 'DROPOUT': 0.3575305084566753, 'LR': 0.0009865175689569915, 'WEIGHT_0': 0.382797779589461, 'WEIGHT_1': 0.6988664258444276, 'WEIGHT_2': 0.5749568516813174, 'WEIGHT_3': 0.8267052921091365, 'WEIGHT_4': 0.9116411919225746, 'WEIGHT_5': 0.5573271526148632, 'WEIGHT_6': 0.73140978715762, 'WEIGHT_7': 0.3522127618253938, 'WEIGHT_8': 0.4879577456419176, 'optimizer': 'RMSprop'}
0
              precision    recall  f1-score   support

         LOC       0.27      0.13      0.17      1837
        MISC       0.04      0.02      0.02       922
         ORG       0.11      0.05      0.07      1341
         PER       0.06      0.03      0.04      1842

   micro avg       0.13      0.06      0.08      5942
   macro avg       0.12      0.06      0.08      5942
weighted avg       0.13      0.06      0.09      5942

{'EMBEDDING_DIM': 927, 'HIDDEN_DIM': 341, 'NUM_LAYERS': 1, 'DROPOUT': 0.3575305084566753, 'LR': 0.0009865175689569915, 'WEIGHT_0': 0.382797779589461, 'WEIGHT_1': 0.6988664258444276, 'WEIGHT_2': 0.5749568516813174, 'WEIGHT_3': 0.8267052921091365, 'WEIGHT_4': 0.9116411919225746, 'WEIGHT_5': 0.5573271526148632, 'WEIGHT_6': 0.73140978715762, 'WEIGHT_7': 0.3522127618253938, 'WEIGHT_8': 0.4879577456419176, 'optimizer': 'RMSprop'}
49
              precision    recall  f1-score   support

         LOC       0.57      0.53      0.55      1837
        MISC       0.42      0.45      0.44       922
         ORG       0.31      0.27      0.29      1341
         PER       0.34      0.36      0.35      1842

   micro avg       0.41      0.41      0.41      5942
   macro avg       0.41      0.40      0.41      5942
weighted avg       0.42      0.41      0.41      5942

epoch 49
LSTM
  0%|          | 0/50 [00:00<?, ?it/s]  2%|▏         | 1/50 [00:04<03:53,  4.77s/it]  4%|▍         | 2/50 [00:04<01:37,  2.03s/it]  6%|▌         | 3/50 [00:05<00:56,  1.20s/it]  8%|▊         | 4/50 [00:05<00:36,  1.25it/s] 10%|█         | 5/50 [00:05<00:26,  1.73it/s] 12%|█▏        | 6/50 [00:05<00:19,  2.24it/s] 14%|█▍        | 7/50 [00:05<00:15,  2.76it/s] 16%|█▌        | 8/50 [00:06<00:12,  3.26it/s] 18%|█▊        | 9/50 [00:06<00:11,  3.70it/s] 20%|██        | 10/50 [00:06<00:09,  4.08it/s] 22%|██▏       | 11/50 [00:06<00:08,  4.38it/s] 24%|██▍       | 12/50 [00:06<00:08,  4.62it/s] 26%|██▌       | 13/50 [00:06<00:07,  4.80it/s] 28%|██▊       | 14/50 [00:07<00:07,  4.93it/s] 30%|███       | 15/50 [00:07<00:06,  5.03it/s] 32%|███▏      | 16/50 [00:07<00:06,  5.11it/s] 34%|███▍      | 17/50 [00:07<00:06,  5.15it/s] 36%|███▌      | 18/50 [00:07<00:06,  5.19it/s] 38%|███▊      | 19/50 [00:08<00:05,  5.22it/s] 40%|████      | 20/50 [00:08<00:05,  5.22it/s] 42%|████▏     | 21/50 [00:08<00:05,  5.24it/s] 44%|████▍     | 22/50 [00:08<00:05,  5.26it/s] 46%|████▌     | 23/50 [00:08<00:05,  5.26it/s] 48%|████▊     | 24/50 [00:09<00:04,  5.26it/s] 50%|█████     | 25/50 [00:09<00:04,  5.27it/s] 52%|█████▏    | 26/50 [00:09<00:04,  5.26it/s] 54%|█████▍    | 27/50 [00:09<00:04,  5.27it/s] 56%|█████▌    | 28/50 [00:09<00:04,  5.28it/s] 58%|█████▊    | 29/50 [00:10<00:03,  5.27it/s] 60%|██████    | 30/50 [00:10<00:03,  5.27it/s] 62%|██████▏   | 31/50 [00:10<00:03,  5.28it/s] 64%|██████▍   | 32/50 [00:10<00:03,  5.27it/s] 66%|██████▌   | 33/50 [00:10<00:03,  5.27it/s] 68%|██████▊   | 34/50 [00:10<00:03,  5.27it/s] 70%|███████   | 35/50 [00:11<00:02,  5.26it/s] 72%|███████▏  | 36/50 [00:11<00:02,  5.26it/s] 74%|███████▍  | 37/50 [00:11<00:02,  5.26it/s] 76%|███████▌  | 38/50 [00:11<00:02,  5.26it/s] 78%|███████▊  | 39/50 [00:11<00:02,  5.26it/s] 80%|████████  | 40/50 [00:12<00:01,  5.25it/s] 82%|████████▏ | 41/50 [00:12<00:01,  5.25it/s] 84%|████████▍ | 42/50 [00:12<00:01,  5.26it/s] 86%|████████▌ | 43/50 [00:12<00:01,  5.25it/s] 88%|████████▊ | 44/50 [00:12<00:01,  5.26it/s] 90%|█████████ | 45/50 [00:13<00:00,  5.25it/s] 92%|█████████▏| 46/50 [00:13<00:00,  5.25it/s] 94%|█████████▍| 47/50 [00:13<00:00,  5.25it/s] 96%|█████████▌| 48/50 [00:13<00:00,  5.25it/s] 98%|█████████▊| 49/50 [00:13<00:00,  5.25it/s]100%|██████████| 50/50 [00:18<00:00,  1.59s/it]100%|██████████| 50/50 [00:18<00:00,  2.68it/s]
[I 2023-12-10 22:43:10,796] Trial 166 finished with value: 0.4049918796478332 and parameters: {'EMBEDDING_DIM': 889, 'HIDDEN_DIM': 290, 'NUM_LAYERS': 1, 'DROPOUT': 0.35814167195121216, 'LR': 0.0008123538483472137, 'WEIGHT_0': 0.3241006694346883, 'WEIGHT_1': 0.6932027555625226, 'WEIGHT_2': 0.567010039496215, 'WEIGHT_3': 0.8243719507833026, 'WEIGHT_4': 0.9153044610506982, 'WEIGHT_5': 0.5538423044370729, 'WEIGHT_6': 0.7106990765072059, 'WEIGHT_7': 0.34741659460797486, 'WEIGHT_8': 0.48741516986935557, 'optimizer': 'RMSprop'}. Best is trial 134 with value: 0.4158467115484205.
/userhome/cs2/dingruiw/conda/envs/py310/lib/python3.10/site-packages/torch/nn/modules/rnn.py:82: UserWarning: dropout option adds dropout after all but last recurrent layer, so non-zero dropout expects num_layers greater than 1, but got dropout=0.3782147524421192 and num_layers=1
  warnings.warn("dropout option adds dropout after all but last "
{'EMBEDDING_DIM': 889, 'HIDDEN_DIM': 290, 'NUM_LAYERS': 1, 'DROPOUT': 0.35814167195121216, 'LR': 0.0008123538483472137, 'WEIGHT_0': 0.3241006694346883, 'WEIGHT_1': 0.6932027555625226, 'WEIGHT_2': 0.567010039496215, 'WEIGHT_3': 0.8243719507833026, 'WEIGHT_4': 0.9153044610506982, 'WEIGHT_5': 0.5538423044370729, 'WEIGHT_6': 0.7106990765072059, 'WEIGHT_7': 0.34741659460797486, 'WEIGHT_8': 0.48741516986935557, 'optimizer': 'RMSprop'}
0
              precision    recall  f1-score   support

         LOC       0.14      0.04      0.06      1837
        MISC       0.04      0.03      0.03       922
         ORG       0.12      0.08      0.10      1341
         PER       0.10      0.04      0.05      1842

   micro avg       0.10      0.05      0.06      5942
   macro avg       0.10      0.05      0.06      5942
weighted avg       0.11      0.05      0.06      5942

{'EMBEDDING_DIM': 889, 'HIDDEN_DIM': 290, 'NUM_LAYERS': 1, 'DROPOUT': 0.35814167195121216, 'LR': 0.0008123538483472137, 'WEIGHT_0': 0.3241006694346883, 'WEIGHT_1': 0.6932027555625226, 'WEIGHT_2': 0.567010039496215, 'WEIGHT_3': 0.8243719507833026, 'WEIGHT_4': 0.9153044610506982, 'WEIGHT_5': 0.5538423044370729, 'WEIGHT_6': 0.7106990765072059, 'WEIGHT_7': 0.34741659460797486, 'WEIGHT_8': 0.48741516986935557, 'optimizer': 'RMSprop'}
49
              precision    recall  f1-score   support

         LOC       0.59      0.51      0.55      1837
        MISC       0.41      0.45      0.43       922
         ORG       0.28      0.26      0.27      1341
         PER       0.35      0.36      0.35      1842

   micro avg       0.41      0.40      0.40      5942
   macro avg       0.41      0.40      0.40      5942
weighted avg       0.42      0.40      0.41      5942

epoch 49
LSTM
  0%|          | 0/50 [00:00<?, ?it/s]  2%|▏         | 1/50 [00:04<03:55,  4.80s/it]  4%|▍         | 2/50 [00:04<01:38,  2.05s/it]  6%|▌         | 3/50 [00:05<00:57,  1.22s/it]  8%|▊         | 4/50 [00:05<00:37,  1.21it/s] 10%|█         | 5/50 [00:05<00:27,  1.65it/s] 12%|█▏        | 6/50 [00:05<00:20,  2.12it/s] 14%|█▍        | 7/50 [00:06<00:16,  2.57it/s] 16%|█▌        | 8/50 [00:06<00:14,  2.99it/s] 18%|█▊        | 9/50 [00:06<00:12,  3.36it/s] 20%|██        | 10/50 [00:06<00:10,  3.67it/s] 22%|██▏       | 11/50 [00:06<00:09,  3.91it/s] 24%|██▍       | 12/50 [00:07<00:09,  4.10it/s] 26%|██▌       | 13/50 [00:07<00:08,  4.24it/s] 28%|██▊       | 14/50 [00:07<00:08,  4.34it/s] 30%|███       | 15/50 [00:07<00:07,  4.41it/s] 32%|███▏      | 16/50 [00:07<00:07,  4.47it/s] 34%|███▍      | 17/50 [00:08<00:07,  4.51it/s] 36%|███▌      | 18/50 [00:08<00:07,  4.54it/s] 38%|███▊      | 19/50 [00:08<00:06,  4.56it/s] 40%|████      | 20/50 [00:08<00:06,  4.58it/s] 42%|████▏     | 21/50 [00:09<00:06,  4.58it/s] 44%|████▍     | 22/50 [00:09<00:06,  4.58it/s] 46%|████▌     | 23/50 [00:09<00:05,  4.59it/s] 48%|████▊     | 24/50 [00:09<00:05,  4.60it/s] 50%|█████     | 25/50 [00:09<00:05,  4.60it/s] 52%|█████▏    | 26/50 [00:10<00:05,  4.60it/s] 54%|█████▍    | 27/50 [00:10<00:04,  4.60it/s] 56%|█████▌    | 28/50 [00:10<00:04,  4.60it/s] 58%|█████▊    | 29/50 [00:10<00:04,  4.60it/s] 60%|██████    | 30/50 [00:11<00:04,  4.60it/s] 62%|██████▏   | 31/50 [00:11<00:04,  4.60it/s] 64%|██████▍   | 32/50 [00:11<00:03,  4.59it/s] 66%|██████▌   | 33/50 [00:11<00:03,  4.59it/s] 68%|██████▊   | 34/50 [00:11<00:03,  4.59it/s] 70%|███████   | 35/50 [00:12<00:03,  4.59it/s] 72%|███████▏  | 36/50 [00:12<00:03,  4.59it/s] 74%|███████▍  | 37/50 [00:12<00:02,  4.59it/s] 76%|███████▌  | 38/50 [00:12<00:02,  4.59it/s] 78%|███████▊  | 39/50 [00:12<00:02,  4.59it/s] 80%|████████  | 40/50 [00:13<00:02,  4.59it/s] 82%|████████▏ | 41/50 [00:13<00:01,  4.59it/s] 84%|████████▍ | 42/50 [00:13<00:01,  4.59it/s] 86%|████████▌ | 43/50 [00:13<00:01,  4.58it/s] 88%|████████▊ | 44/50 [00:14<00:01,  4.58it/s] 90%|█████████ | 45/50 [00:14<00:01,  4.58it/s] 92%|█████████▏| 46/50 [00:14<00:00,  4.58it/s] 94%|█████████▍| 47/50 [00:14<00:00,  4.58it/s] 96%|█████████▌| 48/50 [00:14<00:00,  4.57it/s] 98%|█████████▊| 49/50 [00:15<00:00,  4.57it/s]100%|██████████| 50/50 [00:20<00:00,  1.62s/it]100%|██████████| 50/50 [00:20<00:00,  2.49it/s]
[I 2023-12-10 22:43:35,142] Trial 167 finished with value: 0.3776456183312926 and parameters: {'EMBEDDING_DIM': 928, 'HIDDEN_DIM': 336, 'NUM_LAYERS': 1, 'DROPOUT': 0.3782147524421192, 'LR': 0.0003339468576690237, 'WEIGHT_0': 0.38619013439034905, 'WEIGHT_1': 0.7070194012030875, 'WEIGHT_2': 0.5800747829132709, 'WEIGHT_3': 0.7668502475630095, 'WEIGHT_4': 0.9561943951529309, 'WEIGHT_5': 0.6449371803569564, 'WEIGHT_6': 0.7430118139349161, 'WEIGHT_7': 0.3716019791903432, 'WEIGHT_8': 0.5440974367811395, 'optimizer': 'RMSprop'}. Best is trial 134 with value: 0.4158467115484205.
/userhome/cs2/dingruiw/conda/envs/py310/lib/python3.10/site-packages/torch/nn/modules/rnn.py:82: UserWarning: dropout option adds dropout after all but last recurrent layer, so non-zero dropout expects num_layers greater than 1, but got dropout=0.35714805275569184 and num_layers=1
  warnings.warn("dropout option adds dropout after all but last "
{'EMBEDDING_DIM': 928, 'HIDDEN_DIM': 336, 'NUM_LAYERS': 1, 'DROPOUT': 0.3782147524421192, 'LR': 0.0003339468576690237, 'WEIGHT_0': 0.38619013439034905, 'WEIGHT_1': 0.7070194012030875, 'WEIGHT_2': 0.5800747829132709, 'WEIGHT_3': 0.7668502475630095, 'WEIGHT_4': 0.9561943951529309, 'WEIGHT_5': 0.6449371803569564, 'WEIGHT_6': 0.7430118139349161, 'WEIGHT_7': 0.3716019791903432, 'WEIGHT_8': 0.5440974367811395, 'optimizer': 'RMSprop'}
0
              precision    recall  f1-score   support

         LOC       0.08      0.11      0.10      1837
        MISC       0.02      0.07      0.03       922
         ORG       0.05      0.05      0.05      1341
         PER       0.03      0.03      0.03      1842

   micro avg       0.04      0.06      0.05      5942
   macro avg       0.04      0.06      0.05      5942
weighted avg       0.05      0.06      0.05      5942

{'EMBEDDING_DIM': 928, 'HIDDEN_DIM': 336, 'NUM_LAYERS': 1, 'DROPOUT': 0.3782147524421192, 'LR': 0.0003339468576690237, 'WEIGHT_0': 0.38619013439034905, 'WEIGHT_1': 0.7070194012030875, 'WEIGHT_2': 0.5800747829132709, 'WEIGHT_3': 0.7668502475630095, 'WEIGHT_4': 0.9561943951529309, 'WEIGHT_5': 0.6449371803569564, 'WEIGHT_6': 0.7430118139349161, 'WEIGHT_7': 0.3716019791903432, 'WEIGHT_8': 0.5440974367811395, 'optimizer': 'RMSprop'}
49
              precision    recall  f1-score   support

         LOC       0.54      0.50      0.52      1837
        MISC       0.49      0.35      0.41       922
         ORG       0.25      0.21      0.23      1341
         PER       0.32      0.34      0.33      1842

   micro avg       0.39      0.36      0.38      5942
   macro avg       0.40      0.35      0.37      5942
weighted avg       0.40      0.36      0.38      5942

epoch 49
LSTM
  0%|          | 0/50 [00:00<?, ?it/s]  2%|▏         | 1/50 [00:04<03:50,  4.70s/it]  6%|▌         | 3/50 [00:04<01:02,  1.33s/it]  8%|▊         | 4/50 [00:05<00:42,  1.08it/s] 10%|█         | 5/50 [00:05<00:30,  1.47it/s] 12%|█▏        | 6/50 [00:05<00:22,  1.93it/s] 14%|█▍        | 7/50 [00:05<00:17,  2.43it/s] 16%|█▌        | 8/50 [00:05<00:14,  2.95it/s] 18%|█▊        | 9/50 [00:06<00:11,  3.45it/s] 20%|██        | 10/50 [00:06<00:10,  3.91it/s] 22%|██▏       | 11/50 [00:06<00:09,  4.31it/s] 24%|██▍       | 12/50 [00:06<00:08,  4.64it/s] 26%|██▌       | 13/50 [00:06<00:07,  4.90it/s] 28%|██▊       | 14/50 [00:06<00:07,  5.10it/s] 30%|███       | 15/50 [00:07<00:06,  5.25it/s] 32%|███▏      | 16/50 [00:07<00:06,  5.37it/s] 34%|███▍      | 17/50 [00:07<00:06,  5.44it/s] 36%|███▌      | 18/50 [00:07<00:05,  5.49it/s] 38%|███▊      | 19/50 [00:07<00:05,  5.54it/s] 40%|████      | 20/50 [00:08<00:05,  5.57it/s] 42%|████▏     | 21/50 [00:08<00:05,  5.58it/s] 44%|████▍     | 22/50 [00:08<00:04,  5.60it/s] 46%|████▌     | 23/50 [00:08<00:04,  5.61it/s] 48%|████▊     | 24/50 [00:08<00:04,  5.62it/s] 50%|█████     | 25/50 [00:08<00:04,  5.62it/s] 52%|█████▏    | 26/50 [00:09<00:04,  5.63it/s] 54%|█████▍    | 27/50 [00:09<00:04,  5.63it/s] 56%|█████▌    | 28/50 [00:09<00:03,  5.63it/s] 58%|█████▊    | 29/50 [00:09<00:03,  5.63it/s] 60%|██████    | 30/50 [00:09<00:03,  5.63it/s] 62%|██████▏   | 31/50 [00:09<00:03,  5.63it/s] 64%|██████▍   | 32/50 [00:10<00:03,  5.63it/s] 66%|██████▌   | 33/50 [00:10<00:03,  5.63it/s] 68%|██████▊   | 34/50 [00:10<00:02,  5.62it/s] 70%|███████   | 35/50 [00:10<00:02,  5.62it/s] 72%|███████▏  | 36/50 [00:10<00:02,  5.63it/s] 74%|███████▍  | 37/50 [00:11<00:02,  5.62it/s] 76%|███████▌  | 38/50 [00:11<00:02,  5.61it/s] 78%|███████▊  | 39/50 [00:11<00:01,  5.62it/s] 80%|████████  | 40/50 [00:11<00:01,  5.62it/s] 82%|████████▏ | 41/50 [00:11<00:01,  5.62it/s] 84%|████████▍ | 42/50 [00:11<00:01,  5.59it/s] 86%|████████▌ | 43/50 [00:12<00:01,  5.63it/s] 88%|████████▊ | 44/50 [00:12<00:01,  5.62it/s] 90%|█████████ | 45/50 [00:12<00:00,  5.62it/s] 92%|█████████▏| 46/50 [00:12<00:00,  5.61it/s] 94%|█████████▍| 47/50 [00:12<00:00,  5.61it/s] 96%|█████████▌| 48/50 [00:12<00:00,  5.61it/s] 98%|█████████▊| 49/50 [00:13<00:00,  5.61it/s]100%|██████████| 50/50 [00:18<00:00,  1.58s/it]100%|██████████| 50/50 [00:18<00:00,  2.78it/s]
[I 2023-12-10 22:43:57,438] Trial 168 finished with value: 0.4110232113361732 and parameters: {'EMBEDDING_DIM': 950, 'HIDDEN_DIM': 258, 'NUM_LAYERS': 1, 'DROPOUT': 0.35714805275569184, 'LR': 0.002670877750194356, 'WEIGHT_0': 0.35499216206544915, 'WEIGHT_1': 0.7572139825364145, 'WEIGHT_2': 0.6058012472191944, 'WEIGHT_3': 0.8491711392728271, 'WEIGHT_4': 0.5056488503560607, 'WEIGHT_5': 0.5342957057962509, 'WEIGHT_6': 0.7280495121290342, 'WEIGHT_7': 0.29634342867729596, 'WEIGHT_8': 0.5290758323870866, 'optimizer': 'RMSprop'}. Best is trial 134 with value: 0.4158467115484205.
/userhome/cs2/dingruiw/conda/envs/py310/lib/python3.10/site-packages/torch/nn/modules/rnn.py:82: UserWarning: dropout option adds dropout after all but last recurrent layer, so non-zero dropout expects num_layers greater than 1, but got dropout=0.3953667628978239 and num_layers=1
  warnings.warn("dropout option adds dropout after all but last "
{'EMBEDDING_DIM': 950, 'HIDDEN_DIM': 258, 'NUM_LAYERS': 1, 'DROPOUT': 0.35714805275569184, 'LR': 0.002670877750194356, 'WEIGHT_0': 0.35499216206544915, 'WEIGHT_1': 0.7572139825364145, 'WEIGHT_2': 0.6058012472191944, 'WEIGHT_3': 0.8491711392728271, 'WEIGHT_4': 0.5056488503560607, 'WEIGHT_5': 0.5342957057962509, 'WEIGHT_6': 0.7280495121290342, 'WEIGHT_7': 0.29634342867729596, 'WEIGHT_8': 0.5290758323870866, 'optimizer': 'RMSprop'}
0
              precision    recall  f1-score   support

         LOC       0.52      0.10      0.17      1837
        MISC       0.05      0.02      0.03       922
         ORG       0.08      0.01      0.02      1341
         PER       0.11      0.01      0.02      1842

   micro avg       0.21      0.04      0.07      5942
   macro avg       0.19      0.04      0.06      5942
weighted avg       0.22      0.04      0.07      5942

{'EMBEDDING_DIM': 950, 'HIDDEN_DIM': 258, 'NUM_LAYERS': 1, 'DROPOUT': 0.35714805275569184, 'LR': 0.002670877750194356, 'WEIGHT_0': 0.35499216206544915, 'WEIGHT_1': 0.7572139825364145, 'WEIGHT_2': 0.6058012472191944, 'WEIGHT_3': 0.8491711392728271, 'WEIGHT_4': 0.5056488503560607, 'WEIGHT_5': 0.5342957057962509, 'WEIGHT_6': 0.7280495121290342, 'WEIGHT_7': 0.29634342867729596, 'WEIGHT_8': 0.5290758323870866, 'optimizer': 'RMSprop'}
49
              precision    recall  f1-score   support

         LOC       0.58      0.53      0.56      1837
        MISC       0.45      0.46      0.46       922
         ORG       0.27      0.26      0.26      1341
         PER       0.36      0.34      0.35      1842

   micro avg       0.43      0.40      0.41      5942
   macro avg       0.42      0.40      0.41      5942
weighted avg       0.43      0.40      0.41      5942

epoch 49
LSTM
  0%|          | 0/50 [00:00<?, ?it/s]  2%|▏         | 1/50 [00:04<03:49,  4.69s/it]  6%|▌         | 3/50 [00:04<01:01,  1.31s/it]  8%|▊         | 4/50 [00:05<00:41,  1.10it/s] 10%|█         | 5/50 [00:05<00:29,  1.53it/s] 12%|█▏        | 6/50 [00:05<00:21,  2.03it/s] 14%|█▍        | 7/50 [00:05<00:16,  2.61it/s] 16%|█▌        | 8/50 [00:05<00:13,  3.23it/s] 18%|█▊        | 9/50 [00:05<00:10,  3.85it/s] 20%|██        | 10/50 [00:05<00:09,  4.43it/s] 22%|██▏       | 11/50 [00:06<00:07,  4.95it/s] 24%|██▍       | 12/50 [00:06<00:07,  5.40it/s] 26%|██▌       | 13/50 [00:06<00:06,  5.75it/s] 28%|██▊       | 14/50 [00:06<00:05,  6.03it/s] 30%|███       | 15/50 [00:06<00:05,  6.25it/s] 32%|███▏      | 16/50 [00:06<00:05,  6.40it/s] 34%|███▍      | 17/50 [00:06<00:05,  6.52it/s] 36%|███▌      | 18/50 [00:07<00:04,  6.60it/s] 38%|███▊      | 19/50 [00:07<00:04,  6.66it/s] 40%|████      | 20/50 [00:07<00:04,  6.70it/s] 42%|████▏     | 21/50 [00:07<00:04,  6.71it/s] 44%|████▍     | 22/50 [00:07<00:04,  6.76it/s] 46%|████▌     | 23/50 [00:07<00:03,  6.76it/s] 48%|████▊     | 24/50 [00:08<00:03,  6.77it/s] 50%|█████     | 25/50 [00:08<00:03,  6.77it/s] 52%|█████▏    | 26/50 [00:08<00:03,  6.78it/s] 54%|█████▍    | 27/50 [00:08<00:03,  6.78it/s] 56%|█████▌    | 28/50 [00:08<00:03,  6.77it/s] 58%|█████▊    | 29/50 [00:08<00:03,  6.78it/s] 60%|██████    | 30/50 [00:08<00:02,  6.78it/s] 62%|██████▏   | 31/50 [00:09<00:02,  6.78it/s] 64%|██████▍   | 32/50 [00:09<00:02,  6.78it/s] 66%|██████▌   | 33/50 [00:09<00:02,  6.78it/s] 68%|██████▊   | 34/50 [00:09<00:02,  6.78it/s] 70%|███████   | 35/50 [00:09<00:02,  6.78it/s] 72%|███████▏  | 36/50 [00:09<00:02,  6.79it/s] 74%|███████▍  | 37/50 [00:09<00:01,  6.78it/s] 76%|███████▌  | 38/50 [00:10<00:01,  6.77it/s] 78%|███████▊  | 39/50 [00:10<00:01,  6.78it/s] 80%|████████  | 40/50 [00:10<00:01,  6.77it/s] 82%|████████▏ | 41/50 [00:10<00:01,  6.78it/s] 84%|████████▍ | 42/50 [00:10<00:01,  6.79it/s] 86%|████████▌ | 43/50 [00:10<00:01,  6.78it/s] 88%|████████▊ | 44/50 [00:10<00:00,  6.78it/s] 90%|█████████ | 45/50 [00:11<00:00,  6.79it/s] 92%|█████████▏| 46/50 [00:11<00:00,  6.78it/s] 94%|█████████▍| 47/50 [00:11<00:00,  6.77it/s] 96%|█████████▌| 48/50 [00:11<00:00,  6.78it/s] 98%|█████████▊| 49/50 [00:11<00:00,  6.77it/s]100%|██████████| 50/50 [00:16<00:00,  1.54s/it]100%|██████████| 50/50 [00:16<00:00,  3.03it/s]
