[I 2023-12-10 22:27:12,553] Trial 129 finished with value: 0.39430374349791075 and parameters: {'EMBEDDING_DIM': 1022, 'HIDDEN_DIM': 187, 'NUM_LAYERS': 1, 'DROPOUT': 0.28248536221847226, 'LR': 0.0026861964476457096, 'WEIGHT_0': 0.5704392278643389, 'WEIGHT_1': 0.5625296715437821, 'WEIGHT_2': 0.7273297924225008, 'WEIGHT_3': 0.9712014401200019, 'WEIGHT_4': 0.9475642981620747, 'WEIGHT_5': 0.5533443347182069, 'WEIGHT_6': 0.8149313198780731, 'WEIGHT_7': 0.46405737720001167, 'WEIGHT_8': 0.5196775827347534, 'optimizer': 'RMSprop'}. Best is trial 123 with value: 0.4154373927958834.
/userhome/cs2/dingruiw/conda/envs/py310/lib/python3.10/site-packages/torch/nn/modules/rnn.py:82: UserWarning: dropout option adds dropout after all but last recurrent layer, so non-zero dropout expects num_layers greater than 1, but got dropout=0.28971271075701144 and num_layers=1
  warnings.warn("dropout option adds dropout after all but last "
{'EMBEDDING_DIM': 1022, 'HIDDEN_DIM': 187, 'NUM_LAYERS': 1, 'DROPOUT': 0.28248536221847226, 'LR': 0.0026861964476457096, 'WEIGHT_0': 0.5704392278643389, 'WEIGHT_1': 0.5625296715437821, 'WEIGHT_2': 0.7273297924225008, 'WEIGHT_3': 0.9712014401200019, 'WEIGHT_4': 0.9475642981620747, 'WEIGHT_5': 0.5533443347182069, 'WEIGHT_6': 0.8149313198780731, 'WEIGHT_7': 0.46405737720001167, 'WEIGHT_8': 0.5196775827347534, 'optimizer': 'RMSprop'}
0
              precision    recall  f1-score   support

         LOC       0.41      0.07      0.12      1837
        MISC       0.04      0.03      0.04       922
         ORG       0.13      0.01      0.02      1341
         PER       0.09      0.02      0.03      1842

   micro avg       0.13      0.04      0.06      5942
   macro avg       0.17      0.03      0.05      5942
weighted avg       0.19      0.04      0.06      5942

{'EMBEDDING_DIM': 1022, 'HIDDEN_DIM': 187, 'NUM_LAYERS': 1, 'DROPOUT': 0.28248536221847226, 'LR': 0.0026861964476457096, 'WEIGHT_0': 0.5704392278643389, 'WEIGHT_1': 0.5625296715437821, 'WEIGHT_2': 0.7273297924225008, 'WEIGHT_3': 0.9712014401200019, 'WEIGHT_4': 0.9475642981620747, 'WEIGHT_5': 0.5533443347182069, 'WEIGHT_6': 0.8149313198780731, 'WEIGHT_7': 0.46405737720001167, 'WEIGHT_8': 0.5196775827347534, 'optimizer': 'RMSprop'}
49
              precision    recall  f1-score   support

         LOC       0.57      0.53      0.55      1837
        MISC       0.41      0.44      0.42       922
         ORG       0.28      0.26      0.27      1341
         PER       0.32      0.32      0.32      1842

   micro avg       0.40      0.39      0.39      5942
   macro avg       0.39      0.39      0.39      5942
weighted avg       0.40      0.39      0.39      5942

epoch 49
LSTM
  0%|          | 0/50 [00:00<?, ?it/s]  2%|▏         | 1/50 [00:03<03:13,  3.95s/it] 10%|█         | 5/50 [00:04<00:27,  1.64it/s] 16%|█▌        | 8/50 [00:04<00:14,  2.90it/s] 22%|██▏       | 11/50 [00:04<00:08,  4.35it/s] 26%|██▌       | 13/50 [00:04<00:06,  5.47it/s] 30%|███       | 15/50 [00:04<00:05,  6.75it/s] 34%|███▍      | 17/50 [00:04<00:04,  8.13it/s] 38%|███▊      | 19/50 [00:04<00:03,  9.53it/s] 42%|████▏     | 21/50 [00:05<00:02, 10.87it/s] 46%|████▌     | 23/50 [00:05<00:02, 12.05it/s] 50%|█████     | 25/50 [00:05<00:01, 13.06it/s] 54%|█████▍    | 27/50 [00:05<00:01, 13.90it/s] 58%|█████▊    | 29/50 [00:05<00:01, 14.55it/s] 62%|██████▏   | 31/50 [00:05<00:01, 15.06it/s] 66%|██████▌   | 33/50 [00:05<00:01, 15.43it/s] 70%|███████   | 35/50 [00:05<00:00, 15.71it/s] 74%|███████▍  | 37/50 [00:05<00:00, 15.89it/s] 78%|███████▊  | 39/50 [00:06<00:00, 16.00it/s] 82%|████████▏ | 41/50 [00:06<00:00, 16.11it/s] 86%|████████▌ | 43/50 [00:06<00:00, 16.17it/s] 90%|█████████ | 45/50 [00:06<00:00, 16.21it/s] 94%|█████████▍| 47/50 [00:06<00:00, 16.25it/s] 98%|█████████▊| 49/50 [00:06<00:00, 16.29it/s]100%|██████████| 50/50 [00:11<00:00,  4.53it/s]
[I 2023-12-10 22:27:27,322] Trial 130 finished with value: 0.40037610052141204 and parameters: {'EMBEDDING_DIM': 893, 'HIDDEN_DIM': 69, 'NUM_LAYERS': 1, 'DROPOUT': 0.28971271075701144, 'LR': 0.0024587544570616048, 'WEIGHT_0': 0.4537584422242959, 'WEIGHT_1': 0.819745848602494, 'WEIGHT_2': 0.6949789168238134, 'WEIGHT_3': 0.9996825180485311, 'WEIGHT_4': 0.9555049810497807, 'WEIGHT_5': 0.6268072362550418, 'WEIGHT_6': 0.7293049808183258, 'WEIGHT_7': 0.5066156315400969, 'WEIGHT_8': 0.572936555431701, 'optimizer': 'RMSprop'}. Best is trial 123 with value: 0.4154373927958834.
/userhome/cs2/dingruiw/conda/envs/py310/lib/python3.10/site-packages/torch/nn/modules/rnn.py:82: UserWarning: dropout option adds dropout after all but last recurrent layer, so non-zero dropout expects num_layers greater than 1, but got dropout=0.308559848085224 and num_layers=1
  warnings.warn("dropout option adds dropout after all but last "
{'EMBEDDING_DIM': 893, 'HIDDEN_DIM': 69, 'NUM_LAYERS': 1, 'DROPOUT': 0.28971271075701144, 'LR': 0.0024587544570616048, 'WEIGHT_0': 0.4537584422242959, 'WEIGHT_1': 0.819745848602494, 'WEIGHT_2': 0.6949789168238134, 'WEIGHT_3': 0.9996825180485311, 'WEIGHT_4': 0.9555049810497807, 'WEIGHT_5': 0.6268072362550418, 'WEIGHT_6': 0.7293049808183258, 'WEIGHT_7': 0.5066156315400969, 'WEIGHT_8': 0.572936555431701, 'optimizer': 'RMSprop'}
0
              precision    recall  f1-score   support

         LOC       0.53      0.06      0.10      1837
        MISC       0.08      0.02      0.03       922
         ORG       0.11      0.05      0.07      1341
         PER       0.11      0.02      0.04      1842

   micro avg       0.17      0.04      0.06      5942
   macro avg       0.21      0.04      0.06      5942
weighted avg       0.23      0.04      0.06      5942

{'EMBEDDING_DIM': 893, 'HIDDEN_DIM': 69, 'NUM_LAYERS': 1, 'DROPOUT': 0.28971271075701144, 'LR': 0.0024587544570616048, 'WEIGHT_0': 0.4537584422242959, 'WEIGHT_1': 0.819745848602494, 'WEIGHT_2': 0.6949789168238134, 'WEIGHT_3': 0.9996825180485311, 'WEIGHT_4': 0.9555049810497807, 'WEIGHT_5': 0.6268072362550418, 'WEIGHT_6': 0.7293049808183258, 'WEIGHT_7': 0.5066156315400969, 'WEIGHT_8': 0.572936555431701, 'optimizer': 'RMSprop'}
49
              precision    recall  f1-score   support

         LOC       0.59      0.54      0.57      1837
        MISC       0.47      0.47      0.47       922
         ORG       0.29      0.26      0.27      1341
         PER       0.29      0.31      0.30      1842

   micro avg       0.41      0.39      0.40      5942
   macro avg       0.41      0.39      0.40      5942
weighted avg       0.41      0.39      0.40      5942

epoch 49
LSTM
  0%|          | 0/50 [00:00<?, ?it/s]  2%|▏         | 1/50 [00:04<03:23,  4.15s/it]  4%|▍         | 2/50 [00:04<01:24,  1.77s/it]  6%|▌         | 3/50 [00:04<00:49,  1.05s/it]  8%|▊         | 4/50 [00:04<00:32,  1.41it/s] 10%|█         | 5/50 [00:04<00:23,  1.93it/s] 12%|█▏        | 6/50 [00:04<00:17,  2.48it/s] 14%|█▍        | 7/50 [00:05<00:14,  3.03it/s] 16%|█▌        | 8/50 [00:05<00:11,  3.54it/s] 18%|█▊        | 9/50 [00:05<00:10,  3.99it/s] 20%|██        | 10/50 [00:05<00:09,  4.37it/s] 22%|██▏       | 11/50 [00:05<00:08,  4.67it/s] 24%|██▍       | 12/50 [00:06<00:07,  4.91it/s] 26%|██▌       | 13/50 [00:06<00:07,  5.08it/s] 28%|██▊       | 14/50 [00:06<00:06,  5.21it/s] 30%|███       | 15/50 [00:06<00:06,  5.31it/s] 32%|███▏      | 16/50 [00:06<00:06,  5.38it/s] 34%|███▍      | 17/50 [00:06<00:06,  5.42it/s] 36%|███▌      | 18/50 [00:07<00:05,  5.46it/s] 38%|███▊      | 19/50 [00:07<00:05,  5.49it/s] 40%|████      | 20/50 [00:07<00:05,  5.50it/s] 42%|████▏     | 21/50 [00:07<00:05,  5.51it/s] 44%|████▍     | 22/50 [00:07<00:05,  5.52it/s] 46%|████▌     | 23/50 [00:08<00:04,  5.53it/s] 48%|████▊     | 24/50 [00:08<00:04,  5.53it/s] 50%|█████     | 25/50 [00:08<00:04,  5.54it/s] 52%|█████▏    | 26/50 [00:08<00:04,  5.54it/s] 54%|█████▍    | 27/50 [00:08<00:04,  5.54it/s] 56%|█████▌    | 28/50 [00:08<00:03,  5.54it/s] 58%|█████▊    | 29/50 [00:09<00:03,  5.54it/s] 60%|██████    | 30/50 [00:09<00:03,  5.54it/s] 62%|██████▏   | 31/50 [00:09<00:03,  5.54it/s] 64%|██████▍   | 32/50 [00:09<00:03,  5.54it/s] 66%|██████▌   | 33/50 [00:09<00:03,  5.54it/s] 68%|██████▊   | 34/50 [00:10<00:02,  5.54it/s] 70%|███████   | 35/50 [00:10<00:02,  5.54it/s] 72%|███████▏  | 36/50 [00:10<00:02,  5.54it/s] 74%|███████▍  | 37/50 [00:10<00:02,  5.53it/s] 76%|███████▌  | 38/50 [00:10<00:02,  5.53it/s] 78%|███████▊  | 39/50 [00:10<00:01,  5.53it/s] 80%|████████  | 40/50 [00:11<00:01,  5.54it/s] 82%|████████▏ | 41/50 [00:11<00:01,  5.54it/s] 84%|████████▍ | 42/50 [00:11<00:01,  5.54it/s] 86%|████████▌ | 43/50 [00:11<00:01,  5.54it/s] 88%|████████▊ | 44/50 [00:11<00:01,  5.54it/s] 90%|█████████ | 45/50 [00:12<00:00,  5.54it/s] 92%|█████████▏| 46/50 [00:12<00:00,  5.54it/s] 94%|█████████▍| 47/50 [00:12<00:00,  5.54it/s] 96%|█████████▌| 48/50 [00:12<00:00,  5.53it/s] 98%|█████████▊| 49/50 [00:12<00:00,  5.54it/s]100%|██████████| 50/50 [00:16<00:00,  1.38s/it]100%|██████████| 50/50 [00:16<00:00,  2.95it/s]
[I 2023-12-10 22:27:47,941] Trial 131 finished with value: 0.40242963469928994 and parameters: {'EMBEDDING_DIM': 986, 'HIDDEN_DIM': 155, 'NUM_LAYERS': 1, 'DROPOUT': 0.308559848085224, 'LR': 0.002328440326519741, 'WEIGHT_0': 0.5182088088703978, 'WEIGHT_1': 0.7572385574460762, 'WEIGHT_2': 0.7280889697449868, 'WEIGHT_3': 0.9215994976801606, 'WEIGHT_4': 0.9183233447035465, 'WEIGHT_5': 0.5157180417342991, 'WEIGHT_6': 0.7912659315527123, 'WEIGHT_7': 0.4900911569546813, 'WEIGHT_8': 0.4976246768804892, 'optimizer': 'RMSprop'}. Best is trial 123 with value: 0.4154373927958834.
/userhome/cs2/dingruiw/conda/envs/py310/lib/python3.10/site-packages/torch/nn/modules/rnn.py:82: UserWarning: dropout option adds dropout after all but last recurrent layer, so non-zero dropout expects num_layers greater than 1, but got dropout=0.3318595331934871 and num_layers=1
  warnings.warn("dropout option adds dropout after all but last "
{'EMBEDDING_DIM': 986, 'HIDDEN_DIM': 155, 'NUM_LAYERS': 1, 'DROPOUT': 0.308559848085224, 'LR': 0.002328440326519741, 'WEIGHT_0': 0.5182088088703978, 'WEIGHT_1': 0.7572385574460762, 'WEIGHT_2': 0.7280889697449868, 'WEIGHT_3': 0.9215994976801606, 'WEIGHT_4': 0.9183233447035465, 'WEIGHT_5': 0.5157180417342991, 'WEIGHT_6': 0.7912659315527123, 'WEIGHT_7': 0.4900911569546813, 'WEIGHT_8': 0.4976246768804892, 'optimizer': 'RMSprop'}
0
              precision    recall  f1-score   support

         LOC       0.29      0.12      0.17      1837
        MISC       0.12      0.02      0.04       922
         ORG       0.14      0.06      0.08      1341
         PER       0.12      0.04      0.06      1842

   micro avg       0.18      0.06      0.09      5942
   macro avg       0.17      0.06      0.09      5942
weighted avg       0.18      0.06      0.09      5942

{'EMBEDDING_DIM': 986, 'HIDDEN_DIM': 155, 'NUM_LAYERS': 1, 'DROPOUT': 0.308559848085224, 'LR': 0.002328440326519741, 'WEIGHT_0': 0.5182088088703978, 'WEIGHT_1': 0.7572385574460762, 'WEIGHT_2': 0.7280889697449868, 'WEIGHT_3': 0.9215994976801606, 'WEIGHT_4': 0.9183233447035465, 'WEIGHT_5': 0.5157180417342991, 'WEIGHT_6': 0.7912659315527123, 'WEIGHT_7': 0.4900911569546813, 'WEIGHT_8': 0.4976246768804892, 'optimizer': 'RMSprop'}
49
              precision    recall  f1-score   support

         LOC       0.61      0.53      0.57      1837
        MISC       0.42      0.45      0.44       922
         ORG       0.27      0.27      0.27      1341
         PER       0.33      0.33      0.33      1842

   micro avg       0.41      0.40      0.40      5942
   macro avg       0.41      0.39      0.40      5942
weighted avg       0.42      0.40      0.41      5942

epoch 49
LSTM
  0%|          | 0/50 [00:00<?, ?it/s]  2%|▏         | 1/50 [00:04<03:46,  4.63s/it]  6%|▌         | 3/50 [00:04<01:00,  1.30s/it]  8%|▊         | 4/50 [00:05<00:41,  1.11it/s] 10%|█         | 5/50 [00:05<00:29,  1.52it/s] 12%|█▏        | 6/50 [00:05<00:22,  2.00it/s] 14%|█▍        | 7/50 [00:05<00:16,  2.53it/s] 16%|█▌        | 8/50 [00:05<00:13,  3.09it/s] 18%|█▊        | 9/50 [00:05<00:11,  3.64it/s] 20%|██        | 10/50 [00:06<00:09,  4.15it/s] 22%|██▏       | 11/50 [00:06<00:08,  4.60it/s] 24%|██▍       | 12/50 [00:06<00:07,  4.97it/s] 26%|██▌       | 13/50 [00:06<00:07,  5.27it/s] 28%|██▊       | 14/50 [00:06<00:06,  5.49it/s] 30%|███       | 15/50 [00:06<00:06,  5.66it/s] 32%|███▏      | 16/50 [00:07<00:05,  5.78it/s] 34%|███▍      | 17/50 [00:07<00:05,  5.88it/s] 36%|███▌      | 18/50 [00:07<00:05,  5.95it/s] 38%|███▊      | 19/50 [00:07<00:05,  5.99it/s] 40%|████      | 20/50 [00:07<00:04,  6.02it/s] 42%|████▏     | 21/50 [00:07<00:04,  6.05it/s] 44%|████▍     | 22/50 [00:08<00:04,  6.06it/s] 46%|████▌     | 23/50 [00:08<00:04,  6.08it/s] 48%|████▊     | 24/50 [00:08<00:04,  6.09it/s] 50%|█████     | 25/50 [00:08<00:04,  6.09it/s] 52%|█████▏    | 26/50 [00:08<00:03,  6.09it/s] 54%|█████▍    | 27/50 [00:08<00:03,  6.10it/s] 56%|█████▌    | 28/50 [00:08<00:03,  6.10it/s] 58%|█████▊    | 29/50 [00:09<00:03,  6.10it/s] 60%|██████    | 30/50 [00:09<00:03,  6.09it/s] 62%|██████▏   | 31/50 [00:09<00:03,  6.10it/s] 64%|██████▍   | 32/50 [00:09<00:02,  6.10it/s] 66%|██████▌   | 33/50 [00:09<00:02,  6.11it/s] 68%|██████▊   | 34/50 [00:09<00:02,  6.11it/s] 70%|███████   | 35/50 [00:10<00:02,  6.10it/s] 72%|███████▏  | 36/50 [00:10<00:02,  6.10it/s] 74%|███████▍  | 37/50 [00:10<00:02,  6.10it/s] 76%|███████▌  | 38/50 [00:10<00:01,  6.10it/s] 78%|███████▊  | 39/50 [00:10<00:01,  6.10it/s] 80%|████████  | 40/50 [00:10<00:01,  6.10it/s] 82%|████████▏ | 41/50 [00:11<00:01,  6.10it/s] 84%|████████▍ | 42/50 [00:11<00:01,  6.10it/s] 86%|████████▌ | 43/50 [00:11<00:01,  6.10it/s] 88%|████████▊ | 44/50 [00:11<00:00,  6.10it/s] 90%|█████████ | 45/50 [00:11<00:00,  6.10it/s] 92%|█████████▏| 46/50 [00:11<00:00,  6.09it/s] 94%|█████████▍| 47/50 [00:12<00:00,  6.10it/s] 96%|█████████▌| 48/50 [00:12<00:00,  6.09it/s] 98%|█████████▊| 49/50 [00:12<00:00,  6.09it/s]100%|██████████| 50/50 [00:17<00:00,  1.60s/it]100%|██████████| 50/50 [00:17<00:00,  2.87it/s]
[I 2023-12-10 22:28:09,630] Trial 132 finished with value: 0.39570397717737876 and parameters: {'EMBEDDING_DIM': 988, 'HIDDEN_DIM': 239, 'NUM_LAYERS': 1, 'DROPOUT': 0.3318595331934871, 'LR': 0.0021320170824590317, 'WEIGHT_0': 0.507054032714459, 'WEIGHT_1': 0.713412116500533, 'WEIGHT_2': 0.6345815692415075, 'WEIGHT_3': 0.9793022675327313, 'WEIGHT_4': 0.9418909775427522, 'WEIGHT_5': 0.4625273530604943, 'WEIGHT_6': 0.8667014217287697, 'WEIGHT_7': 0.4777789369683586, 'WEIGHT_8': 0.4678437309953225, 'optimizer': 'RMSprop'}. Best is trial 123 with value: 0.4154373927958834.
/userhome/cs2/dingruiw/conda/envs/py310/lib/python3.10/site-packages/torch/nn/modules/rnn.py:82: UserWarning: dropout option adds dropout after all but last recurrent layer, so non-zero dropout expects num_layers greater than 1, but got dropout=0.31178189783964044 and num_layers=1
  warnings.warn("dropout option adds dropout after all but last "
{'EMBEDDING_DIM': 988, 'HIDDEN_DIM': 239, 'NUM_LAYERS': 1, 'DROPOUT': 0.3318595331934871, 'LR': 0.0021320170824590317, 'WEIGHT_0': 0.507054032714459, 'WEIGHT_1': 0.713412116500533, 'WEIGHT_2': 0.6345815692415075, 'WEIGHT_3': 0.9793022675327313, 'WEIGHT_4': 0.9418909775427522, 'WEIGHT_5': 0.4625273530604943, 'WEIGHT_6': 0.8667014217287697, 'WEIGHT_7': 0.4777789369683586, 'WEIGHT_8': 0.4678437309953225, 'optimizer': 'RMSprop'}
0
              precision    recall  f1-score   support

         LOC       0.36      0.12      0.18      1837
        MISC       0.04      0.01      0.01       922
         ORG       0.11      0.03      0.05      1341
         PER       0.09      0.04      0.05      1842

   micro avg       0.17      0.06      0.08      5942
   macro avg       0.15      0.05      0.07      5942
weighted avg       0.17      0.06      0.08      5942

{'EMBEDDING_DIM': 988, 'HIDDEN_DIM': 239, 'NUM_LAYERS': 1, 'DROPOUT': 0.3318595331934871, 'LR': 0.0021320170824590317, 'WEIGHT_0': 0.507054032714459, 'WEIGHT_1': 0.713412116500533, 'WEIGHT_2': 0.6345815692415075, 'WEIGHT_3': 0.9793022675327313, 'WEIGHT_4': 0.9418909775427522, 'WEIGHT_5': 0.4625273530604943, 'WEIGHT_6': 0.8667014217287697, 'WEIGHT_7': 0.4777789369683586, 'WEIGHT_8': 0.4678437309953225, 'optimizer': 'RMSprop'}
49
              precision    recall  f1-score   support

         LOC       0.58      0.53      0.55      1837
        MISC       0.44      0.45      0.45       922
         ORG       0.28      0.26      0.27      1341
         PER       0.30      0.34      0.32      1842

   micro avg       0.39      0.40      0.40      5942
   macro avg       0.40      0.39      0.40      5942
weighted avg       0.40      0.40      0.40      5942

epoch 49
LSTM
  0%|          | 0/50 [00:00<?, ?it/s]  2%|▏         | 1/50 [00:04<03:22,  4.13s/it]  6%|▌         | 3/50 [00:04<00:54,  1.17s/it]  8%|▊         | 4/50 [00:04<00:37,  1.22it/s] 10%|█         | 5/50 [00:04<00:27,  1.66it/s] 12%|█▏        | 6/50 [00:04<00:20,  2.17it/s] 14%|█▍        | 7/50 [00:05<00:15,  2.73it/s] 16%|█▌        | 8/50 [00:05<00:12,  3.30it/s] 18%|█▊        | 9/50 [00:05<00:10,  3.85it/s] 20%|██        | 10/50 [00:05<00:09,  4.35it/s] 22%|██▏       | 11/50 [00:05<00:08,  4.79it/s] 24%|██▍       | 12/50 [00:05<00:07,  5.17it/s] 26%|██▌       | 13/50 [00:05<00:06,  5.45it/s] 28%|██▊       | 14/50 [00:06<00:06,  5.66it/s] 30%|███       | 15/50 [00:06<00:06,  5.81it/s] 32%|███▏      | 16/50 [00:06<00:05,  5.92it/s] 34%|███▍      | 17/50 [00:06<00:05,  6.01it/s] 36%|███▌      | 18/50 [00:06<00:05,  6.05it/s] 38%|███▊      | 19/50 [00:06<00:05,  6.08it/s] 40%|████      | 20/50 [00:07<00:04,  6.12it/s] 42%|████▏     | 21/50 [00:07<00:04,  6.15it/s] 44%|████▍     | 22/50 [00:07<00:04,  6.19it/s] 46%|████▌     | 23/50 [00:07<00:04,  6.21it/s] 48%|████▊     | 24/50 [00:07<00:04,  6.24it/s] 50%|█████     | 25/50 [00:07<00:04,  6.22it/s] 52%|█████▏    | 26/50 [00:08<00:03,  6.20it/s] 54%|█████▍    | 27/50 [00:08<00:03,  6.20it/s] 56%|█████▌    | 28/50 [00:08<00:03,  6.22it/s] 58%|█████▊    | 29/50 [00:08<00:03,  6.22it/s] 60%|██████    | 30/50 [00:08<00:03,  6.22it/s] 62%|██████▏   | 31/50 [00:08<00:03,  6.20it/s] 64%|██████▍   | 32/50 [00:09<00:02,  6.19it/s] 66%|██████▌   | 33/50 [00:09<00:02,  6.21it/s] 68%|██████▊   | 34/50 [00:09<00:02,  6.20it/s] 70%|███████   | 35/50 [00:09<00:02,  6.21it/s] 72%|███████▏  | 36/50 [00:09<00:02,  6.21it/s] 74%|███████▍  | 37/50 [00:09<00:02,  6.20it/s] 76%|███████▌  | 38/50 [00:10<00:01,  6.21it/s] 78%|███████▊  | 39/50 [00:10<00:01,  6.21it/s] 80%|████████  | 40/50 [00:10<00:01,  6.21it/s] 82%|████████▏ | 41/50 [00:10<00:01,  6.19it/s] 84%|████████▍ | 42/50 [00:10<00:01,  6.20it/s] 86%|████████▌ | 43/50 [00:10<00:01,  6.20it/s] 88%|████████▊ | 44/50 [00:10<00:00,  6.21it/s] 90%|█████████ | 45/50 [00:11<00:00,  6.20it/s] 92%|█████████▏| 46/50 [00:11<00:00,  6.19it/s] 94%|█████████▍| 47/50 [00:11<00:00,  6.19it/s] 96%|█████████▌| 48/50 [00:11<00:00,  6.19it/s] 98%|█████████▊| 49/50 [00:11<00:00,  6.17it/s]100%|██████████| 50/50 [00:16<00:00,  1.39s/it]100%|██████████| 50/50 [00:16<00:00,  3.11it/s]
