[I 2023-12-10 23:44:37,063] Trial 289 finished with value: 0.2835171663818549 and parameters: {'EMBEDDING_DIM': 845, 'HIDDEN_DIM': 555, 'NUM_LAYERS': 3, 'DROPOUT': 0.30245986219453447, 'LR': 0.0022243930380537427, 'WEIGHT_0': 0.312902088430319, 'WEIGHT_1': 0.6402500970359165, 'WEIGHT_2': 0.7160976516010634, 'WEIGHT_3': 0.5063121702329156, 'WEIGHT_4': 0.5897388065548119, 'WEIGHT_5': 0.5863173836221126, 'WEIGHT_6': 0.7771231577552069, 'WEIGHT_7': 0.6423292459748721, 'WEIGHT_8': 0.7363347340973703, 'optimizer': 'RMSprop'}. Best is trial 221 with value: 0.418736930154747.
/userhome/cs2/dingruiw/conda/envs/py310/lib/python3.10/site-packages/torch/nn/modules/rnn.py:82: UserWarning: dropout option adds dropout after all but last recurrent layer, so non-zero dropout expects num_layers greater than 1, but got dropout=0.3145404868173971 and num_layers=1
  warnings.warn("dropout option adds dropout after all but last "
{'EMBEDDING_DIM': 845, 'HIDDEN_DIM': 555, 'NUM_LAYERS': 3, 'DROPOUT': 0.30245986219453447, 'LR': 0.0022243930380537427, 'WEIGHT_0': 0.312902088430319, 'WEIGHT_1': 0.6402500970359165, 'WEIGHT_2': 0.7160976516010634, 'WEIGHT_3': 0.5063121702329156, 'WEIGHT_4': 0.5897388065548119, 'WEIGHT_5': 0.5863173836221126, 'WEIGHT_6': 0.7771231577552069, 'WEIGHT_7': 0.6423292459748721, 'WEIGHT_8': 0.7363347340973703, 'optimizer': 'RMSprop'}
0
              precision    recall  f1-score   support

         LOC       0.11      0.02      0.04      1837
        MISC       0.03      0.01      0.01       922
         ORG       0.00      0.00      0.00      1341
         PER       0.00      0.00      0.00      1842

   micro avg       0.08      0.01      0.02      5942
   macro avg       0.03      0.01      0.01      5942
weighted avg       0.04      0.01      0.01      5942

{'EMBEDDING_DIM': 845, 'HIDDEN_DIM': 555, 'NUM_LAYERS': 3, 'DROPOUT': 0.30245986219453447, 'LR': 0.0022243930380537427, 'WEIGHT_0': 0.312902088430319, 'WEIGHT_1': 0.6402500970359165, 'WEIGHT_2': 0.7160976516010634, 'WEIGHT_3': 0.5063121702329156, 'WEIGHT_4': 0.5897388065548119, 'WEIGHT_5': 0.5863173836221126, 'WEIGHT_6': 0.7771231577552069, 'WEIGHT_7': 0.6423292459748721, 'WEIGHT_8': 0.7363347340973703, 'optimizer': 'RMSprop'}
49
              precision    recall  f1-score   support

         LOC       0.40      0.40      0.40      1837
        MISC       0.19      0.29      0.23       922
         ORG       0.16      0.23      0.19      1341
         PER       0.28      0.28      0.28      1842

   micro avg       0.26      0.31      0.28      5942
   macro avg       0.26      0.30      0.28      5942
weighted avg       0.28      0.31      0.29      5942

epoch 49
LSTM
  0%|          | 0/50 [00:00<?, ?it/s]  2%|▏         | 1/50 [00:04<03:44,  4.58s/it]  4%|▍         | 2/50 [00:04<01:33,  1.96s/it]  6%|▌         | 3/50 [00:04<00:54,  1.17s/it]  8%|▊         | 4/50 [00:05<00:36,  1.26it/s] 10%|█         | 5/50 [00:05<00:26,  1.70it/s] 12%|█▏        | 6/50 [00:05<00:20,  2.15it/s] 14%|█▍        | 7/50 [00:05<00:16,  2.59it/s] 16%|█▌        | 8/50 [00:06<00:14,  3.00it/s] 18%|█▊        | 9/50 [00:06<00:12,  3.34it/s] 20%|██        | 10/50 [00:06<00:11,  3.63it/s] 22%|██▏       | 11/50 [00:06<00:10,  3.85it/s] 24%|██▍       | 12/50 [00:06<00:09,  4.02it/s] 26%|██▌       | 13/50 [00:07<00:08,  4.15it/s] 28%|██▊       | 14/50 [00:07<00:08,  4.24it/s] 30%|███       | 15/50 [00:07<00:08,  4.31it/s] 32%|███▏      | 16/50 [00:07<00:07,  4.36it/s] 34%|███▍      | 17/50 [00:08<00:07,  4.40it/s] 36%|███▌      | 18/50 [00:08<00:07,  4.42it/s] 38%|███▊      | 19/50 [00:08<00:06,  4.43it/s] 40%|████      | 20/50 [00:08<00:06,  4.44it/s] 42%|████▏     | 21/50 [00:08<00:06,  4.45it/s] 44%|████▍     | 22/50 [00:09<00:06,  4.45it/s] 46%|████▌     | 23/50 [00:09<00:06,  4.46it/s] 48%|████▊     | 24/50 [00:09<00:05,  4.45it/s] 50%|█████     | 25/50 [00:09<00:05,  4.45it/s] 52%|█████▏    | 26/50 [00:10<00:05,  4.44it/s] 54%|█████▍    | 27/50 [00:10<00:05,  4.44it/s] 56%|█████▌    | 28/50 [00:10<00:04,  4.45it/s] 58%|█████▊    | 29/50 [00:10<00:04,  4.46it/s] 60%|██████    | 30/50 [00:10<00:04,  4.45it/s] 62%|██████▏   | 31/50 [00:11<00:04,  4.44it/s] 64%|██████▍   | 32/50 [00:11<00:04,  4.44it/s] 66%|██████▌   | 33/50 [00:11<00:03,  4.44it/s] 68%|██████▊   | 34/50 [00:11<00:03,  4.43it/s] 70%|███████   | 35/50 [00:12<00:03,  4.44it/s] 72%|███████▏  | 36/50 [00:12<00:03,  4.45it/s] 74%|███████▍  | 37/50 [00:12<00:02,  4.43it/s] 76%|███████▌  | 38/50 [00:12<00:02,  4.44it/s] 78%|███████▊  | 39/50 [00:13<00:02,  4.42it/s] 80%|████████  | 40/50 [00:13<00:02,  4.43it/s] 82%|████████▏ | 41/50 [00:13<00:02,  4.43it/s] 84%|████████▍ | 42/50 [00:13<00:01,  4.43it/s] 86%|████████▌ | 43/50 [00:13<00:01,  4.43it/s] 88%|████████▊ | 44/50 [00:14<00:01,  4.43it/s] 90%|█████████ | 45/50 [00:14<00:01,  4.43it/s] 92%|█████████▏| 46/50 [00:14<00:00,  4.44it/s] 94%|█████████▍| 47/50 [00:14<00:00,  4.43it/s] 96%|█████████▌| 48/50 [00:15<00:00,  4.44it/s] 98%|█████████▊| 49/50 [00:15<00:00,  4.43it/s]100%|██████████| 50/50 [00:20<00:00,  1.60s/it]100%|██████████| 50/50 [00:20<00:00,  2.49it/s]
[I 2023-12-10 23:45:01,325] Trial 290 finished with value: 0.40091077753415416 and parameters: {'EMBEDDING_DIM': 925, 'HIDDEN_DIM': 333, 'NUM_LAYERS': 1, 'DROPOUT': 0.3145404868173971, 'LR': 0.0019701712190362186, 'WEIGHT_0': 0.3492582886036255, 'WEIGHT_1': 0.6114581946171846, 'WEIGHT_2': 0.6906842456205552, 'WEIGHT_3': 0.5458254182411929, 'WEIGHT_4': 0.5198493578845194, 'WEIGHT_5': 0.6061230016760116, 'WEIGHT_6': 0.9721356001466522, 'WEIGHT_7': 0.7327130891974197, 'WEIGHT_8': 0.6269095265315974, 'optimizer': 'RMSprop'}. Best is trial 221 with value: 0.418736930154747.
/userhome/cs2/dingruiw/conda/envs/py310/lib/python3.10/site-packages/torch/nn/modules/rnn.py:82: UserWarning: dropout option adds dropout after all but last recurrent layer, so non-zero dropout expects num_layers greater than 1, but got dropout=0.3278435284181467 and num_layers=1
  warnings.warn("dropout option adds dropout after all but last "
{'EMBEDDING_DIM': 925, 'HIDDEN_DIM': 333, 'NUM_LAYERS': 1, 'DROPOUT': 0.3145404868173971, 'LR': 0.0019701712190362186, 'WEIGHT_0': 0.3492582886036255, 'WEIGHT_1': 0.6114581946171846, 'WEIGHT_2': 0.6906842456205552, 'WEIGHT_3': 0.5458254182411929, 'WEIGHT_4': 0.5198493578845194, 'WEIGHT_5': 0.6061230016760116, 'WEIGHT_6': 0.9721356001466522, 'WEIGHT_7': 0.7327130891974197, 'WEIGHT_8': 0.6269095265315974, 'optimizer': 'RMSprop'}
0
              precision    recall  f1-score   support

         LOC       0.32      0.10      0.16      1837
        MISC       0.07      0.02      0.03       922
         ORG       0.11      0.02      0.04      1341
         PER       0.11      0.04      0.05      1842

   micro avg       0.17      0.05      0.08      5942
   macro avg       0.15      0.05      0.07      5942
weighted avg       0.17      0.05      0.08      5942

{'EMBEDDING_DIM': 925, 'HIDDEN_DIM': 333, 'NUM_LAYERS': 1, 'DROPOUT': 0.3145404868173971, 'LR': 0.0019701712190362186, 'WEIGHT_0': 0.3492582886036255, 'WEIGHT_1': 0.6114581946171846, 'WEIGHT_2': 0.6906842456205552, 'WEIGHT_3': 0.5458254182411929, 'WEIGHT_4': 0.5198493578845194, 'WEIGHT_5': 0.6061230016760116, 'WEIGHT_6': 0.9721356001466522, 'WEIGHT_7': 0.7327130891974197, 'WEIGHT_8': 0.6269095265315974, 'optimizer': 'RMSprop'}
49
              precision    recall  f1-score   support

         LOC       0.56      0.55      0.56      1837
        MISC       0.41      0.45      0.43       922
         ORG       0.26      0.26      0.26      1341
         PER       0.34      0.33      0.33      1842

   micro avg       0.40      0.40      0.40      5942
   macro avg       0.39      0.40      0.39      5942
weighted avg       0.40      0.40      0.40      5942

epoch 49
LSTM
  0%|          | 0/50 [00:00<?, ?it/s]  2%|▏         | 1/50 [00:04<03:36,  4.42s/it]  6%|▌         | 3/50 [00:04<00:57,  1.23s/it]  8%|▊         | 4/50 [00:04<00:39,  1.17it/s] 10%|█         | 5/50 [00:04<00:27,  1.61it/s] 12%|█▏        | 6/50 [00:05<00:20,  2.14it/s] 14%|█▍        | 7/50 [00:05<00:15,  2.73it/s] 16%|█▌        | 8/50 [00:05<00:12,  3.36it/s] 18%|█▊        | 9/50 [00:05<00:10,  3.99it/s] 20%|██        | 10/50 [00:05<00:08,  4.58it/s] 22%|██▏       | 11/50 [00:05<00:07,  5.11it/s] 24%|██▍       | 12/50 [00:05<00:06,  5.54it/s] 26%|██▌       | 13/50 [00:06<00:06,  5.89it/s] 28%|██▊       | 14/50 [00:06<00:05,  6.17it/s] 30%|███       | 15/50 [00:06<00:05,  6.37it/s] 32%|███▏      | 16/50 [00:06<00:05,  6.52it/s] 34%|███▍      | 17/50 [00:06<00:04,  6.64it/s] 36%|███▌      | 18/50 [00:06<00:04,  6.72it/s] 38%|███▊      | 19/50 [00:06<00:04,  6.77it/s] 40%|████      | 20/50 [00:07<00:04,  6.81it/s] 42%|████▏     | 21/50 [00:07<00:04,  6.83it/s] 44%|████▍     | 22/50 [00:07<00:04,  6.85it/s] 46%|████▌     | 23/50 [00:07<00:03,  6.87it/s] 48%|████▊     | 24/50 [00:07<00:03,  6.88it/s] 50%|█████     | 25/50 [00:07<00:03,  6.89it/s] 52%|█████▏    | 26/50 [00:07<00:03,  6.90it/s] 54%|█████▍    | 27/50 [00:08<00:03,  6.90it/s] 56%|█████▌    | 28/50 [00:08<00:03,  6.90it/s] 58%|█████▊    | 29/50 [00:08<00:03,  6.90it/s] 60%|██████    | 30/50 [00:08<00:02,  6.90it/s] 62%|██████▏   | 31/50 [00:08<00:02,  6.91it/s] 64%|██████▍   | 32/50 [00:08<00:02,  6.91it/s] 66%|██████▌   | 33/50 [00:08<00:02,  6.91it/s] 68%|██████▊   | 34/50 [00:09<00:02,  6.91it/s] 70%|███████   | 35/50 [00:09<00:02,  6.90it/s] 72%|███████▏  | 36/50 [00:09<00:02,  6.90it/s] 74%|███████▍  | 37/50 [00:09<00:01,  6.90it/s] 76%|███████▌  | 38/50 [00:09<00:01,  6.89it/s] 78%|███████▊  | 39/50 [00:09<00:01,  6.90it/s] 80%|████████  | 40/50 [00:10<00:01,  6.91it/s] 82%|████████▏ | 41/50 [00:10<00:01,  6.90it/s] 84%|████████▍ | 42/50 [00:10<00:01,  6.90it/s] 86%|████████▌ | 43/50 [00:10<00:01,  6.91it/s] 88%|████████▊ | 44/50 [00:10<00:00,  6.90it/s] 90%|█████████ | 45/50 [00:10<00:00,  6.90it/s] 92%|█████████▏| 46/50 [00:10<00:00,  6.90it/s] 94%|█████████▍| 47/50 [00:11<00:00,  6.89it/s] 96%|█████████▌| 48/50 [00:11<00:00,  6.89it/s] 98%|█████████▊| 49/50 [00:11<00:00,  6.90it/s]100%|██████████| 50/50 [00:15<00:00,  1.48s/it]100%|██████████| 50/50 [00:15<00:00,  3.14it/s]
[I 2023-12-10 23:45:21,278] Trial 291 finished with value: 0.3949914627205464 and parameters: {'EMBEDDING_DIM': 951, 'HIDDEN_DIM': 195, 'NUM_LAYERS': 1, 'DROPOUT': 0.3278435284181467, 'LR': 0.0035461385124071396, 'WEIGHT_0': 0.2800841581887066, 'WEIGHT_1': 0.6281581799700645, 'WEIGHT_2': 0.7011548750744601, 'WEIGHT_3': 0.581127892454173, 'WEIGHT_4': 0.9082286620855967, 'WEIGHT_5': 0.7438698813878364, 'WEIGHT_6': 0.6191408320062214, 'WEIGHT_7': 0.7345899566180588, 'WEIGHT_8': 0.7175968464222918, 'optimizer': 'RMSprop'}. Best is trial 221 with value: 0.418736930154747.
/userhome/cs2/dingruiw/conda/envs/py310/lib/python3.10/site-packages/torch/nn/modules/rnn.py:82: UserWarning: dropout option adds dropout after all but last recurrent layer, so non-zero dropout expects num_layers greater than 1, but got dropout=0.1866249869381037 and num_layers=1
  warnings.warn("dropout option adds dropout after all but last "
{'EMBEDDING_DIM': 951, 'HIDDEN_DIM': 195, 'NUM_LAYERS': 1, 'DROPOUT': 0.3278435284181467, 'LR': 0.0035461385124071396, 'WEIGHT_0': 0.2800841581887066, 'WEIGHT_1': 0.6281581799700645, 'WEIGHT_2': 0.7011548750744601, 'WEIGHT_3': 0.581127892454173, 'WEIGHT_4': 0.9082286620855967, 'WEIGHT_5': 0.7438698813878364, 'WEIGHT_6': 0.6191408320062214, 'WEIGHT_7': 0.7345899566180588, 'WEIGHT_8': 0.7175968464222918, 'optimizer': 'RMSprop'}
0
              precision    recall  f1-score   support

         LOC       0.50      0.22      0.31      1837
        MISC       0.08      0.04      0.05       922
         ORG       0.19      0.02      0.04      1341
         PER       0.13      0.04      0.06      1842

   micro avg       0.28      0.09      0.14      5942
   macro avg       0.23      0.08      0.11      5942
weighted avg       0.25      0.09      0.13      5942

{'EMBEDDING_DIM': 951, 'HIDDEN_DIM': 195, 'NUM_LAYERS': 1, 'DROPOUT': 0.3278435284181467, 'LR': 0.0035461385124071396, 'WEIGHT_0': 0.2800841581887066, 'WEIGHT_1': 0.6281581799700645, 'WEIGHT_2': 0.7011548750744601, 'WEIGHT_3': 0.581127892454173, 'WEIGHT_4': 0.9082286620855967, 'WEIGHT_5': 0.7438698813878364, 'WEIGHT_6': 0.6191408320062214, 'WEIGHT_7': 0.7345899566180588, 'WEIGHT_8': 0.7175968464222918, 'optimizer': 'RMSprop'}
49
              precision    recall  f1-score   support

         LOC       0.53      0.56      0.54      1837
        MISC       0.38      0.43      0.41       922
         ORG       0.26      0.26      0.26      1341
         PER       0.32      0.36      0.34      1842

   micro avg       0.38      0.41      0.39      5942
   macro avg       0.37      0.40      0.39      5942
weighted avg       0.38      0.41      0.39      5942

epoch 49
LSTM
  0%|          | 0/50 [00:00<?, ?it/s]  2%|▏         | 1/50 [00:04<03:49,  4.68s/it]  4%|▍         | 2/50 [00:04<01:37,  2.04s/it]  6%|▌         | 3/50 [00:05<00:59,  1.27s/it]  8%|▊         | 4/50 [00:05<00:41,  1.10it/s] 10%|█         | 5/50 [00:05<00:31,  1.41it/s] 12%|█▏        | 6/50 [00:06<00:25,  1.70it/s] 14%|█▍        | 7/50 [00:06<00:22,  1.95it/s] 16%|█▌        | 8/50 [00:06<00:19,  2.16it/s] 18%|█▊        | 9/50 [00:07<00:17,  2.33it/s] 20%|██        | 10/50 [00:07<00:16,  2.46it/s] 22%|██▏       | 11/50 [00:08<00:15,  2.56it/s] 24%|██▍       | 12/50 [00:08<00:14,  2.62it/s] 26%|██▌       | 13/50 [00:08<00:13,  2.67it/s] 28%|██▊       | 14/50 [00:09<00:13,  2.71it/s] 30%|███       | 15/50 [00:09<00:12,  2.74it/s] 32%|███▏      | 16/50 [00:09<00:12,  2.76it/s] 34%|███▍      | 17/50 [00:10<00:11,  2.77it/s] 36%|███▌      | 18/50 [00:10<00:11,  2.78it/s] 38%|███▊      | 19/50 [00:10<00:11,  2.79it/s] 40%|████      | 20/50 [00:11<00:10,  2.79it/s] 42%|████▏     | 21/50 [00:11<00:10,  2.79it/s] 44%|████▍     | 22/50 [00:11<00:10,  2.79it/s] 46%|████▌     | 23/50 [00:12<00:09,  2.80it/s] 48%|████▊     | 24/50 [00:12<00:09,  2.79it/s] 50%|█████     | 25/50 [00:13<00:08,  2.79it/s] 52%|█████▏    | 26/50 [00:13<00:08,  2.79it/s] 54%|█████▍    | 27/50 [00:13<00:08,  2.80it/s] 56%|█████▌    | 28/50 [00:14<00:07,  2.79it/s] 58%|█████▊    | 29/50 [00:14<00:07,  2.79it/s] 60%|██████    | 30/50 [00:14<00:07,  2.79it/s] 62%|██████▏   | 31/50 [00:15<00:06,  2.79it/s] 64%|██████▍   | 32/50 [00:15<00:06,  2.79it/s] 66%|██████▌   | 33/50 [00:15<00:06,  2.79it/s] 68%|██████▊   | 34/50 [00:16<00:05,  2.79it/s] 70%|███████   | 35/50 [00:16<00:05,  2.79it/s] 72%|███████▏  | 36/50 [00:17<00:05,  2.79it/s] 74%|███████▍  | 37/50 [00:17<00:04,  2.79it/s] 76%|███████▌  | 38/50 [00:17<00:04,  2.79it/s] 78%|███████▊  | 39/50 [00:18<00:03,  2.79it/s] 80%|████████  | 40/50 [00:18<00:03,  2.79it/s] 82%|████████▏ | 41/50 [00:18<00:03,  2.79it/s] 84%|████████▍ | 42/50 [00:19<00:02,  2.78it/s] 86%|████████▌ | 43/50 [00:19<00:02,  2.78it/s] 88%|████████▊ | 44/50 [00:19<00:02,  2.78it/s] 90%|█████████ | 45/50 [00:20<00:01,  2.78it/s] 92%|█████████▏| 46/50 [00:20<00:01,  2.78it/s] 94%|█████████▍| 47/50 [00:20<00:01,  2.78it/s] 96%|█████████▌| 48/50 [00:21<00:00,  2.78it/s] 98%|█████████▊| 49/50 [00:21<00:00,  2.78it/s]100%|██████████| 50/50 [00:26<00:00,  1.69s/it]100%|██████████| 50/50 [00:26<00:00,  1.89it/s]
[I 2023-12-10 23:45:51,927] Trial 292 finished with value: 0.4083202237371089 and parameters: {'EMBEDDING_DIM': 938, 'HIDDEN_DIM': 535, 'NUM_LAYERS': 1, 'DROPOUT': 0.1866249869381037, 'LR': 0.0017833635029129015, 'WEIGHT_0': 0.48755594480266284, 'WEIGHT_1': 0.426194004756011, 'WEIGHT_2': 0.6746763555635257, 'WEIGHT_3': 0.5829532514524397, 'WEIGHT_4': 0.8213647335595737, 'WEIGHT_5': 0.5704846859800842, 'WEIGHT_6': 0.9285236559668674, 'WEIGHT_7': 0.4439331594249816, 'WEIGHT_8': 0.6564683609422651, 'optimizer': 'RMSprop'}. Best is trial 221 with value: 0.418736930154747.
/userhome/cs2/dingruiw/conda/envs/py310/lib/python3.10/site-packages/torch/nn/modules/rnn.py:82: UserWarning: dropout option adds dropout after all but last recurrent layer, so non-zero dropout expects num_layers greater than 1, but got dropout=0.2943239636061509 and num_layers=1
  warnings.warn("dropout option adds dropout after all but last "
{'EMBEDDING_DIM': 938, 'HIDDEN_DIM': 535, 'NUM_LAYERS': 1, 'DROPOUT': 0.1866249869381037, 'LR': 0.0017833635029129015, 'WEIGHT_0': 0.48755594480266284, 'WEIGHT_1': 0.426194004756011, 'WEIGHT_2': 0.6746763555635257, 'WEIGHT_3': 0.5829532514524397, 'WEIGHT_4': 0.8213647335595737, 'WEIGHT_5': 0.5704846859800842, 'WEIGHT_6': 0.9285236559668674, 'WEIGHT_7': 0.4439331594249816, 'WEIGHT_8': 0.6564683609422651, 'optimizer': 'RMSprop'}
0
              precision    recall  f1-score   support

         LOC       0.07      0.02      0.03      1837
        MISC       0.03      0.02      0.02       922
         ORG       0.08      0.01      0.02      1341
         PER       0.05      0.02      0.02      1842

   micro avg       0.05      0.02      0.03      5942
   macro avg       0.06      0.02      0.03      5942
weighted avg       0.06      0.02      0.03      5942

{'EMBEDDING_DIM': 938, 'HIDDEN_DIM': 535, 'NUM_LAYERS': 1, 'DROPOUT': 0.1866249869381037, 'LR': 0.0017833635029129015, 'WEIGHT_0': 0.48755594480266284, 'WEIGHT_1': 0.426194004756011, 'WEIGHT_2': 0.6746763555635257, 'WEIGHT_3': 0.5829532514524397, 'WEIGHT_4': 0.8213647335595737, 'WEIGHT_5': 0.5704846859800842, 'WEIGHT_6': 0.9285236559668674, 'WEIGHT_7': 0.4439331594249816, 'WEIGHT_8': 0.6564683609422651, 'optimizer': 'RMSprop'}
49
              precision    recall  f1-score   support

         LOC       0.59      0.53      0.55      1837
        MISC       0.40      0.43      0.42       922
         ORG       0.31      0.22      0.26      1341
         PER       0.36      0.37      0.36      1842

   micro avg       0.42      0.39      0.41      5942
   macro avg       0.41      0.39      0.40      5942
weighted avg       0.42      0.39      0.41      5942

epoch 49
LSTM
  0%|          | 0/50 [00:00<?, ?it/s]  2%|▏         | 1/50 [00:04<03:43,  4.56s/it]  4%|▍         | 2/50 [00:04<01:33,  1.94s/it]  6%|▌         | 3/50 [00:04<00:53,  1.15s/it]  8%|▊         | 4/50 [00:05<00:35,  1.30it/s] 10%|█         | 5/50 [00:05<00:25,  1.79it/s] 12%|█▏        | 6/50 [00:05<00:19,  2.30it/s] 14%|█▍        | 7/50 [00:05<00:15,  2.83it/s] 16%|█▌        | 8/50 [00:05<00:12,  3.31it/s] 18%|█▊        | 9/50 [00:06<00:10,  3.74it/s] 20%|██        | 10/50 [00:06<00:09,  4.10it/s] 22%|██▏       | 11/50 [00:06<00:08,  4.40it/s] 24%|██▍       | 12/50 [00:06<00:08,  4.64it/s] 26%|██▌       | 13/50 [00:06<00:07,  4.80it/s] 28%|██▊       | 14/50 [00:06<00:07,  4.92it/s] 30%|███       | 15/50 [00:07<00:06,  5.01it/s] 32%|███▏      | 16/50 [00:07<00:06,  5.08it/s] 34%|███▍      | 17/50 [00:07<00:06,  5.14it/s] 36%|███▌      | 18/50 [00:07<00:06,  5.18it/s] 38%|███▊      | 19/50 [00:07<00:05,  5.19it/s] 40%|████      | 20/50 [00:08<00:05,  5.22it/s] 42%|████▏     | 21/50 [00:08<00:05,  5.22it/s] 44%|████▍     | 22/50 [00:08<00:05,  5.21it/s] 46%|████▌     | 23/50 [00:08<00:05,  5.21it/s] 48%|████▊     | 24/50 [00:08<00:04,  5.23it/s] 50%|█████     | 25/50 [00:09<00:04,  5.23it/s] 52%|█████▏    | 26/50 [00:09<00:04,  5.23it/s] 54%|█████▍    | 27/50 [00:09<00:04,  5.23it/s] 56%|█████▌    | 28/50 [00:09<00:04,  5.25it/s] 58%|█████▊    | 29/50 [00:09<00:03,  5.25it/s] 60%|██████    | 30/50 [00:10<00:03,  5.25it/s] 62%|██████▏   | 31/50 [00:10<00:03,  5.25it/s] 64%|██████▍   | 32/50 [00:10<00:03,  5.23it/s] 66%|██████▌   | 33/50 [00:10<00:03,  5.22it/s] 68%|██████▊   | 34/50 [00:10<00:03,  5.22it/s] 70%|███████   | 35/50 [00:10<00:02,  5.22it/s] 72%|███████▏  | 36/50 [00:11<00:02,  5.22it/s] 74%|███████▍  | 37/50 [00:11<00:02,  5.21it/s] 76%|███████▌  | 38/50 [00:11<00:02,  5.23it/s] 78%|███████▊  | 39/50 [00:11<00:02,  5.23it/s] 80%|████████  | 40/50 [00:11<00:01,  5.23it/s] 82%|████████▏ | 41/50 [00:12<00:01,  5.22it/s] 84%|████████▍ | 42/50 [00:12<00:01,  5.23it/s] 86%|████████▌ | 43/50 [00:12<00:01,  5.22it/s] 88%|████████▊ | 44/50 [00:12<00:01,  5.21it/s] 90%|█████████ | 45/50 [00:12<00:00,  5.20it/s] 92%|█████████▏| 46/50 [00:13<00:00,  5.20it/s] 94%|█████████▍| 47/50 [00:13<00:00,  5.22it/s] 96%|█████████▌| 48/50 [00:13<00:00,  5.21it/s] 98%|█████████▊| 49/50 [00:13<00:00,  5.19it/s]100%|██████████| 50/50 [00:18<00:00,  1.56s/it]100%|██████████| 50/50 [00:18<00:00,  2.72it/s]
