[I 2023-12-11 00:19:13,110] Trial 365 finished with value: 0.41910947782240837 and parameters: {'EMBEDDING_DIM': 954, 'HIDDEN_DIM': 293, 'NUM_LAYERS': 1, 'DROPOUT': 0.03824613870064812, 'LR': 0.0021533663120404355, 'WEIGHT_0': 0.22184010708553725, 'WEIGHT_1': 0.666844001261332, 'WEIGHT_2': 0.4326412097278432, 'WEIGHT_3': 0.9078407476657174, 'WEIGHT_4': 0.7610288955388689, 'WEIGHT_5': 0.6975621700054646, 'WEIGHT_6': 0.6875471847244702, 'WEIGHT_7': 0.33127308593783844, 'WEIGHT_8': 0.9238086486570515, 'optimizer': 'RMSprop'}. Best is trial 365 with value: 0.41910947782240837.
/userhome/cs2/dingruiw/conda/envs/py310/lib/python3.10/site-packages/torch/nn/modules/rnn.py:82: UserWarning: dropout option adds dropout after all but last recurrent layer, so non-zero dropout expects num_layers greater than 1, but got dropout=0.04067313725004926 and num_layers=1
  warnings.warn("dropout option adds dropout after all but last "
{'EMBEDDING_DIM': 954, 'HIDDEN_DIM': 293, 'NUM_LAYERS': 1, 'DROPOUT': 0.03824613870064812, 'LR': 0.0021533663120404355, 'WEIGHT_0': 0.22184010708553725, 'WEIGHT_1': 0.666844001261332, 'WEIGHT_2': 0.4326412097278432, 'WEIGHT_3': 0.9078407476657174, 'WEIGHT_4': 0.7610288955388689, 'WEIGHT_5': 0.6975621700054646, 'WEIGHT_6': 0.6875471847244702, 'WEIGHT_7': 0.33127308593783844, 'WEIGHT_8': 0.9238086486570515, 'optimizer': 'RMSprop'}
0
              precision    recall  f1-score   support

         LOC       0.39      0.30      0.34      1837
        MISC       0.12      0.03      0.05       922
         ORG       0.13      0.04      0.07      1341
         PER       0.10      0.09      0.09      1842

   micro avg       0.21      0.14      0.16      5942
   macro avg       0.18      0.12      0.14      5942
weighted avg       0.20      0.14      0.16      5942

{'EMBEDDING_DIM': 954, 'HIDDEN_DIM': 293, 'NUM_LAYERS': 1, 'DROPOUT': 0.03824613870064812, 'LR': 0.0021533663120404355, 'WEIGHT_0': 0.22184010708553725, 'WEIGHT_1': 0.666844001261332, 'WEIGHT_2': 0.4326412097278432, 'WEIGHT_3': 0.9078407476657174, 'WEIGHT_4': 0.7610288955388689, 'WEIGHT_5': 0.6975621700054646, 'WEIGHT_6': 0.6875471847244702, 'WEIGHT_7': 0.33127308593783844, 'WEIGHT_8': 0.9238086486570515, 'optimizer': 'RMSprop'}
49
              precision    recall  f1-score   support

         LOC       0.57      0.54      0.55      1837
        MISC       0.47      0.45      0.46       922
         ORG       0.31      0.27      0.29      1341
         PER       0.35      0.38      0.36      1842

   micro avg       0.43      0.41      0.42      5942
   macro avg       0.42      0.41      0.42      5942
weighted avg       0.43      0.41      0.42      5942

epoch 49
LSTM
  0%|          | 0/50 [00:00<?, ?it/s]  2%|▏         | 1/50 [00:04<03:46,  4.63s/it]  4%|▍         | 2/50 [00:04<01:34,  1.97s/it]  6%|▌         | 3/50 [00:04<00:54,  1.16s/it]  8%|▊         | 4/50 [00:05<00:35,  1.28it/s] 10%|█         | 5/50 [00:05<00:25,  1.76it/s] 12%|█▏        | 6/50 [00:05<00:19,  2.27it/s] 14%|█▍        | 7/50 [00:05<00:15,  2.79it/s] 16%|█▌        | 8/50 [00:05<00:12,  3.27it/s] 18%|█▊        | 9/50 [00:06<00:11,  3.70it/s] 20%|██        | 10/50 [00:06<00:09,  4.06it/s] 22%|██▏       | 11/50 [00:06<00:08,  4.37it/s] 24%|██▍       | 12/50 [00:06<00:08,  4.59it/s] 26%|██▌       | 13/50 [00:06<00:07,  4.75it/s] 28%|██▊       | 14/50 [00:07<00:07,  4.89it/s] 30%|███       | 15/50 [00:07<00:07,  4.99it/s] 32%|███▏      | 16/50 [00:07<00:06,  5.06it/s] 34%|███▍      | 17/50 [00:07<00:06,  5.11it/s] 36%|███▌      | 18/50 [00:07<00:06,  5.14it/s] 38%|███▊      | 19/50 [00:08<00:06,  5.16it/s] 40%|████      | 20/50 [00:08<00:05,  5.18it/s] 42%|████▏     | 21/50 [00:08<00:05,  5.19it/s] 44%|████▍     | 22/50 [00:08<00:05,  5.19it/s] 46%|████▌     | 23/50 [00:08<00:05,  5.20it/s] 48%|████▊     | 24/50 [00:08<00:05,  5.20it/s] 50%|█████     | 25/50 [00:09<00:04,  5.20it/s] 52%|█████▏    | 26/50 [00:09<00:04,  5.20it/s] 54%|█████▍    | 27/50 [00:09<00:04,  5.20it/s] 56%|█████▌    | 28/50 [00:09<00:04,  5.20it/s] 58%|█████▊    | 29/50 [00:09<00:04,  5.20it/s] 60%|██████    | 30/50 [00:10<00:03,  5.20it/s] 62%|██████▏   | 31/50 [00:10<00:03,  5.19it/s] 64%|██████▍   | 32/50 [00:10<00:03,  5.19it/s] 66%|██████▌   | 33/50 [00:10<00:03,  5.19it/s] 68%|██████▊   | 34/50 [00:10<00:03,  5.20it/s] 70%|███████   | 35/50 [00:11<00:02,  5.20it/s] 72%|███████▏  | 36/50 [00:11<00:02,  5.19it/s] 74%|███████▍  | 37/50 [00:11<00:02,  5.21it/s] 76%|███████▌  | 38/50 [00:11<00:02,  5.21it/s] 78%|███████▊  | 39/50 [00:11<00:02,  5.20it/s] 80%|████████  | 40/50 [00:12<00:01,  5.19it/s] 82%|████████▏ | 41/50 [00:12<00:01,  5.20it/s] 84%|████████▍ | 42/50 [00:12<00:01,  5.19it/s] 86%|████████▌ | 43/50 [00:12<00:01,  5.20it/s] 88%|████████▊ | 44/50 [00:12<00:01,  5.20it/s] 90%|█████████ | 45/50 [00:13<00:00,  5.20it/s] 92%|█████████▏| 46/50 [00:13<00:00,  5.20it/s] 94%|█████████▍| 47/50 [00:13<00:00,  5.19it/s] 96%|█████████▌| 48/50 [00:13<00:00,  5.19it/s] 98%|█████████▊| 49/50 [00:13<00:00,  5.19it/s]100%|██████████| 50/50 [00:18<00:00,  1.57s/it]100%|██████████| 50/50 [00:18<00:00,  2.69it/s]
[I 2023-12-11 00:19:35,896] Trial 366 finished with value: 0.4107249594398429 and parameters: {'EMBEDDING_DIM': 946, 'HIDDEN_DIM': 284, 'NUM_LAYERS': 1, 'DROPOUT': 0.04067313725004926, 'LR': 0.0021454012484028603, 'WEIGHT_0': 0.25823156486809185, 'WEIGHT_1': 0.6514336063671676, 'WEIGHT_2': 0.43740809425802607, 'WEIGHT_3': 0.9122558807374886, 'WEIGHT_4': 0.7647207534842879, 'WEIGHT_5': 0.6819064401150635, 'WEIGHT_6': 0.6656208608271933, 'WEIGHT_7': 0.3261174260406861, 'WEIGHT_8': 0.8866268804490457, 'optimizer': 'RMSprop'}. Best is trial 365 with value: 0.41910947782240837.
/userhome/cs2/dingruiw/conda/envs/py310/lib/python3.10/site-packages/torch/nn/modules/rnn.py:82: UserWarning: dropout option adds dropout after all but last recurrent layer, so non-zero dropout expects num_layers greater than 1, but got dropout=0.037399065937805606 and num_layers=1
  warnings.warn("dropout option adds dropout after all but last "
{'EMBEDDING_DIM': 946, 'HIDDEN_DIM': 284, 'NUM_LAYERS': 1, 'DROPOUT': 0.04067313725004926, 'LR': 0.0021454012484028603, 'WEIGHT_0': 0.25823156486809185, 'WEIGHT_1': 0.6514336063671676, 'WEIGHT_2': 0.43740809425802607, 'WEIGHT_3': 0.9122558807374886, 'WEIGHT_4': 0.7647207534842879, 'WEIGHT_5': 0.6819064401150635, 'WEIGHT_6': 0.6656208608271933, 'WEIGHT_7': 0.3261174260406861, 'WEIGHT_8': 0.8866268804490457, 'optimizer': 'RMSprop'}
0
              precision    recall  f1-score   support

         LOC       0.48      0.19      0.27      1837
        MISC       0.13      0.04      0.07       922
         ORG       0.22      0.04      0.07      1341
         PER       0.07      0.02      0.04      1842

   micro avg       0.25      0.08      0.13      5942
   macro avg       0.23      0.08      0.11      5942
weighted avg       0.24      0.08      0.12      5942

{'EMBEDDING_DIM': 946, 'HIDDEN_DIM': 284, 'NUM_LAYERS': 1, 'DROPOUT': 0.04067313725004926, 'LR': 0.0021454012484028603, 'WEIGHT_0': 0.25823156486809185, 'WEIGHT_1': 0.6514336063671676, 'WEIGHT_2': 0.43740809425802607, 'WEIGHT_3': 0.9122558807374886, 'WEIGHT_4': 0.7647207534842879, 'WEIGHT_5': 0.6819064401150635, 'WEIGHT_6': 0.6656208608271933, 'WEIGHT_7': 0.3261174260406861, 'WEIGHT_8': 0.8866268804490457, 'optimizer': 'RMSprop'}
49
              precision    recall  f1-score   support

         LOC       0.60      0.54      0.57      1837
        MISC       0.42      0.43      0.42       922
         ORG       0.30      0.27      0.28      1341
         PER       0.34      0.35      0.34      1842

   micro avg       0.42      0.40      0.41      5942
   macro avg       0.41      0.40      0.40      5942
weighted avg       0.42      0.40      0.41      5942

epoch 49
LSTM
  0%|          | 0/50 [00:00<?, ?it/s]  2%|▏         | 1/50 [00:04<03:42,  4.55s/it]  4%|▍         | 2/50 [00:04<01:33,  1.94s/it]  6%|▌         | 3/50 [00:04<00:53,  1.15s/it]  8%|▊         | 4/50 [00:05<00:35,  1.29it/s] 10%|█         | 5/50 [00:05<00:25,  1.76it/s] 12%|█▏        | 6/50 [00:05<00:19,  2.25it/s] 14%|█▍        | 7/50 [00:05<00:15,  2.73it/s] 16%|█▌        | 8/50 [00:05<00:13,  3.18it/s] 18%|█▊        | 9/50 [00:06<00:11,  3.57it/s] 20%|██        | 10/50 [00:06<00:10,  3.89it/s] 22%|██▏       | 11/50 [00:06<00:09,  4.15it/s] 24%|██▍       | 12/50 [00:06<00:08,  4.35it/s] 26%|██▌       | 13/50 [00:06<00:08,  4.51it/s] 28%|██▊       | 14/50 [00:07<00:07,  4.62it/s] 30%|███       | 15/50 [00:07<00:07,  4.69it/s] 32%|███▏      | 16/50 [00:07<00:07,  4.74it/s] 34%|███▍      | 17/50 [00:07<00:06,  4.79it/s] 36%|███▌      | 18/50 [00:07<00:06,  4.81it/s] 38%|███▊      | 19/50 [00:08<00:06,  4.84it/s] 40%|████      | 20/50 [00:08<00:06,  4.85it/s] 42%|████▏     | 21/50 [00:08<00:05,  4.86it/s] 44%|████▍     | 22/50 [00:08<00:05,  4.87it/s] 46%|████▌     | 23/50 [00:08<00:05,  4.88it/s] 48%|████▊     | 24/50 [00:09<00:05,  4.88it/s] 50%|█████     | 25/50 [00:09<00:05,  4.88it/s] 52%|█████▏    | 26/50 [00:09<00:04,  4.87it/s] 54%|█████▍    | 27/50 [00:09<00:04,  4.87it/s] 56%|█████▌    | 28/50 [00:09<00:04,  4.87it/s] 58%|█████▊    | 29/50 [00:10<00:04,  4.88it/s] 60%|██████    | 30/50 [00:10<00:04,  4.88it/s] 62%|██████▏   | 31/50 [00:10<00:03,  4.87it/s] 64%|██████▍   | 32/50 [00:10<00:03,  4.88it/s] 66%|██████▌   | 33/50 [00:11<00:03,  4.89it/s] 68%|██████▊   | 34/50 [00:11<00:03,  4.89it/s] 70%|███████   | 35/50 [00:11<00:03,  4.87it/s] 72%|███████▏  | 36/50 [00:11<00:02,  4.87it/s] 74%|███████▍  | 37/50 [00:11<00:02,  4.87it/s] 76%|███████▌  | 38/50 [00:12<00:02,  4.88it/s] 78%|███████▊  | 39/50 [00:12<00:02,  4.88it/s] 80%|████████  | 40/50 [00:12<00:02,  4.88it/s] 82%|████████▏ | 41/50 [00:12<00:01,  4.87it/s] 84%|████████▍ | 42/50 [00:12<00:01,  4.88it/s] 86%|████████▌ | 43/50 [00:13<00:01,  4.88it/s] 88%|████████▊ | 44/50 [00:13<00:01,  4.87it/s] 90%|█████████ | 45/50 [00:13<00:01,  4.86it/s] 92%|█████████▏| 46/50 [00:13<00:00,  4.87it/s] 94%|█████████▍| 47/50 [00:13<00:00,  4.87it/s] 96%|█████████▌| 48/50 [00:14<00:00,  4.87it/s] 98%|█████████▊| 49/50 [00:14<00:00,  4.87it/s]100%|██████████| 50/50 [00:18<00:00,  1.55s/it]100%|██████████| 50/50 [00:18<00:00,  2.63it/s]
[I 2023-12-11 00:19:59,102] Trial 367 finished with value: 0.413235794487921 and parameters: {'EMBEDDING_DIM': 988, 'HIDDEN_DIM': 298, 'NUM_LAYERS': 1, 'DROPOUT': 0.037399065937805606, 'LR': 0.0020895085227463123, 'WEIGHT_0': 0.2593900101098645, 'WEIGHT_1': 0.6585426840733338, 'WEIGHT_2': 0.4533841170316135, 'WEIGHT_3': 0.9236836787437546, 'WEIGHT_4': 0.742578168536013, 'WEIGHT_5': 0.6802431432800562, 'WEIGHT_6': 0.6648105483893203, 'WEIGHT_7': 0.32661121309256835, 'WEIGHT_8': 0.8960589743202507, 'optimizer': 'RMSprop'}. Best is trial 365 with value: 0.41910947782240837.
/userhome/cs2/dingruiw/conda/envs/py310/lib/python3.10/site-packages/torch/nn/modules/rnn.py:82: UserWarning: dropout option adds dropout after all but last recurrent layer, so non-zero dropout expects num_layers greater than 1, but got dropout=0.016195253691384456 and num_layers=1
  warnings.warn("dropout option adds dropout after all but last "
{'EMBEDDING_DIM': 988, 'HIDDEN_DIM': 298, 'NUM_LAYERS': 1, 'DROPOUT': 0.037399065937805606, 'LR': 0.0020895085227463123, 'WEIGHT_0': 0.2593900101098645, 'WEIGHT_1': 0.6585426840733338, 'WEIGHT_2': 0.4533841170316135, 'WEIGHT_3': 0.9236836787437546, 'WEIGHT_4': 0.742578168536013, 'WEIGHT_5': 0.6802431432800562, 'WEIGHT_6': 0.6648105483893203, 'WEIGHT_7': 0.32661121309256835, 'WEIGHT_8': 0.8960589743202507, 'optimizer': 'RMSprop'}
0
              precision    recall  f1-score   support

         LOC       0.37      0.26      0.30      1837
        MISC       0.13      0.03      0.05       922
         ORG       0.17      0.04      0.06      1341
         PER       0.06      0.02      0.04      1842

   micro avg       0.24      0.10      0.14      5942
   macro avg       0.19      0.09      0.11      5942
weighted avg       0.19      0.10      0.13      5942

{'EMBEDDING_DIM': 988, 'HIDDEN_DIM': 298, 'NUM_LAYERS': 1, 'DROPOUT': 0.037399065937805606, 'LR': 0.0020895085227463123, 'WEIGHT_0': 0.2593900101098645, 'WEIGHT_1': 0.6585426840733338, 'WEIGHT_2': 0.4533841170316135, 'WEIGHT_3': 0.9236836787437546, 'WEIGHT_4': 0.742578168536013, 'WEIGHT_5': 0.6802431432800562, 'WEIGHT_6': 0.6648105483893203, 'WEIGHT_7': 0.32661121309256835, 'WEIGHT_8': 0.8960589743202507, 'optimizer': 'RMSprop'}
49
              precision    recall  f1-score   support

         LOC       0.55      0.54      0.55      1837
        MISC       0.47      0.44      0.46       922
         ORG       0.30      0.27      0.29      1341
         PER       0.35      0.36      0.35      1842

   micro avg       0.42      0.41      0.41      5942
   macro avg       0.42      0.40      0.41      5942
weighted avg       0.42      0.41      0.41      5942

epoch 49
LSTM
  0%|          | 0/50 [00:00<?, ?it/s]  2%|▏         | 1/50 [00:06<05:40,  6.95s/it]  4%|▍         | 2/50 [00:07<02:33,  3.19s/it]  6%|▌         | 3/50 [00:08<01:46,  2.27s/it]  8%|▊         | 4/50 [00:09<01:24,  1.83s/it] 10%|█         | 5/50 [00:10<01:11,  1.59s/it] 12%|█▏        | 6/50 [00:12<01:03,  1.44s/it] 14%|█▍        | 7/50 [00:13<00:58,  1.35s/it] 16%|█▌        | 8/50 [00:14<00:54,  1.29s/it] 18%|█▊        | 9/50 [00:15<00:51,  1.25s/it] 20%|██        | 10/50 [00:16<00:49,  1.23s/it] 22%|██▏       | 11/50 [00:18<00:47,  1.22s/it] 24%|██▍       | 12/50 [00:19<00:45,  1.20s/it] 26%|██▌       | 13/50 [00:20<00:44,  1.19s/it] 28%|██▊       | 14/50 [00:21<00:42,  1.19s/it] 30%|███       | 15/50 [00:22<00:41,  1.18s/it] 32%|███▏      | 16/50 [00:23<00:40,  1.18s/it] 34%|███▍      | 17/50 [00:25<00:38,  1.18s/it] 36%|███▌      | 18/50 [00:26<00:37,  1.18s/it] 38%|███▊      | 19/50 [00:27<00:36,  1.17s/it] 40%|████      | 20/50 [00:28<00:35,  1.17s/it] 42%|████▏     | 21/50 [00:29<00:34,  1.17s/it] 44%|████▍     | 22/50 [00:30<00:32,  1.18s/it] 46%|████▌     | 23/50 [00:32<00:31,  1.17s/it] 48%|████▊     | 24/50 [00:33<00:30,  1.18s/it] 50%|█████     | 25/50 [00:34<00:29,  1.18s/it] 52%|█████▏    | 26/50 [00:35<00:28,  1.19s/it] 54%|█████▍    | 27/50 [00:36<00:27,  1.19s/it] 56%|█████▌    | 28/50 [00:38<00:26,  1.19s/it] 58%|█████▊    | 29/50 [00:39<00:24,  1.19s/it] 60%|██████    | 30/50 [00:40<00:23,  1.19s/it] 62%|██████▏   | 31/50 [00:41<00:22,  1.20s/it] 64%|██████▍   | 32/50 [00:42<00:21,  1.20s/it] 66%|██████▌   | 33/50 [00:44<00:20,  1.20s/it] 68%|██████▊   | 34/50 [00:45<00:19,  1.21s/it] 70%|███████   | 35/50 [00:46<00:18,  1.21s/it] 72%|███████▏  | 36/50 [00:47<00:16,  1.21s/it] 74%|███████▍  | 37/50 [00:48<00:15,  1.21s/it] 76%|███████▌  | 38/50 [00:50<00:14,  1.21s/it] 78%|███████▊  | 39/50 [00:51<00:13,  1.21s/it] 80%|████████  | 40/50 [00:52<00:12,  1.21s/it] 82%|████████▏ | 41/50 [00:53<00:10,  1.21s/it] 84%|████████▍ | 42/50 [00:54<00:09,  1.21s/it] 86%|████████▌ | 43/50 [00:56<00:08,  1.21s/it] 88%|████████▊ | 44/50 [00:57<00:07,  1.21s/it] 90%|█████████ | 45/50 [00:58<00:06,  1.21s/it] 92%|█████████▏| 46/50 [00:59<00:04,  1.21s/it] 94%|█████████▍| 47/50 [01:01<00:03,  1.21s/it] 96%|█████████▌| 48/50 [01:02<00:02,  1.21s/it] 98%|█████████▊| 49/50 [01:03<00:01,  1.22s/it]100%|██████████| 50/50 [01:11<00:00,  3.15s/it]100%|██████████| 50/50 [01:11<00:00,  1.42s/it]
[I 2023-12-11 00:21:15,995] Trial 368 finished with value: 0.32649699365785356 and parameters: {'EMBEDDING_DIM': 986, 'HIDDEN_DIM': 1303, 'NUM_LAYERS': 1, 'DROPOUT': 0.016195253691384456, 'LR': 0.002018528065972952, 'WEIGHT_0': 0.21622707012303102, 'WEIGHT_1': 0.6799132250124231, 'WEIGHT_2': 0.46215401437375175, 'WEIGHT_3': 0.9334503602335293, 'WEIGHT_4': 0.7571253091819801, 'WEIGHT_5': 0.7196627307967707, 'WEIGHT_6': 0.6861722641653412, 'WEIGHT_7': 0.31273414441584724, 'WEIGHT_8': 0.936938169762161, 'optimizer': 'RMSprop'}. Best is trial 365 with value: 0.41910947782240837.
/userhome/cs2/dingruiw/conda/envs/py310/lib/python3.10/site-packages/torch/nn/modules/rnn.py:82: UserWarning: dropout option adds dropout after all but last recurrent layer, so non-zero dropout expects num_layers greater than 1, but got dropout=0.03496569887327583 and num_layers=1
  warnings.warn("dropout option adds dropout after all but last "
{'EMBEDDING_DIM': 986, 'HIDDEN_DIM': 1303, 'NUM_LAYERS': 1, 'DROPOUT': 0.016195253691384456, 'LR': 0.002018528065972952, 'WEIGHT_0': 0.21622707012303102, 'WEIGHT_1': 0.6799132250124231, 'WEIGHT_2': 0.46215401437375175, 'WEIGHT_3': 0.9334503602335293, 'WEIGHT_4': 0.7571253091819801, 'WEIGHT_5': 0.7196627307967707, 'WEIGHT_6': 0.6861722641653412, 'WEIGHT_7': 0.31273414441584724, 'WEIGHT_8': 0.936938169762161, 'optimizer': 'RMSprop'}
0
              precision    recall  f1-score   support

         LOC       0.11      0.05      0.07      1837
        MISC       0.02      0.02      0.02       922
         ORG       0.10      0.01      0.01      1341
         PER       0.06      0.01      0.01      1842

   micro avg       0.06      0.02      0.03      5942
   macro avg       0.07      0.02      0.03      5942
weighted avg       0.08      0.02      0.03      5942

{'EMBEDDING_DIM': 986, 'HIDDEN_DIM': 1303, 'NUM_LAYERS': 1, 'DROPOUT': 0.016195253691384456, 'LR': 0.002018528065972952, 'WEIGHT_0': 0.21622707012303102, 'WEIGHT_1': 0.6799132250124231, 'WEIGHT_2': 0.46215401437375175, 'WEIGHT_3': 0.9334503602335293, 'WEIGHT_4': 0.7571253091819801, 'WEIGHT_5': 0.7196627307967707, 'WEIGHT_6': 0.6861722641653412, 'WEIGHT_7': 0.31273414441584724, 'WEIGHT_8': 0.936938169762161, 'optimizer': 'RMSprop'}
49
              precision    recall  f1-score   support

         LOC       0.47      0.47      0.47      1837
        MISC       0.32      0.34      0.33       922
         ORG       0.23      0.20      0.22      1341
         PER       0.24      0.29      0.26      1842

   micro avg       0.32      0.33      0.33      5942
   macro avg       0.32      0.33      0.32      5942
weighted avg       0.32      0.33      0.33      5942

epoch 49
LSTM
  0%|          | 0/50 [00:00<?, ?it/s]  2%|▏         | 1/50 [00:04<03:21,  4.11s/it]  4%|▍         | 2/50 [00:04<01:25,  1.78s/it]  6%|▌         | 3/50 [00:04<00:50,  1.08s/it]  8%|▊         | 4/50 [00:04<00:34,  1.32it/s] 10%|█         | 5/50 [00:05<00:25,  1.74it/s] 12%|█▏        | 6/50 [00:05<00:20,  2.15it/s] 14%|█▍        | 7/50 [00:05<00:17,  2.52it/s] 16%|█▌        | 8/50 [00:05<00:14,  2.85it/s] 18%|█▊        | 9/50 [00:06<00:13,  3.12it/s] 20%|██        | 10/50 [00:06<00:12,  3.33it/s] 22%|██▏       | 11/50 [00:06<00:11,  3.49it/s] 24%|██▍       | 12/50 [00:06<00:10,  3.61it/s] 26%|██▌       | 13/50 [00:07<00:10,  3.69it/s] 28%|██▊       | 14/50 [00:07<00:09,  3.76it/s] 30%|███       | 15/50 [00:07<00:09,  3.79it/s] 32%|███▏      | 16/50 [00:07<00:08,  3.83it/s] 34%|███▍      | 17/50 [00:08<00:08,  3.84it/s] 36%|███▌      | 18/50 [00:08<00:08,  3.86it/s] 38%|███▊      | 19/50 [00:08<00:08,  3.85it/s] 40%|████      | 20/50 [00:08<00:07,  3.88it/s] 42%|████▏     | 21/50 [00:09<00:07,  3.88it/s] 44%|████▍     | 22/50 [00:09<00:07,  3.88it/s] 46%|████▌     | 23/50 [00:09<00:06,  3.90it/s] 48%|████▊     | 24/50 [00:09<00:06,  3.89it/s] 50%|█████     | 25/50 [00:10<00:06,  3.90it/s] 52%|█████▏    | 26/50 [00:10<00:06,  3.90it/s] 54%|█████▍    | 27/50 [00:10<00:05,  3.91it/s] 56%|█████▌    | 28/50 [00:10<00:05,  3.89it/s] 58%|█████▊    | 29/50 [00:11<00:05,  3.89it/s] 60%|██████    | 30/50 [00:11<00:05,  3.89it/s] 62%|██████▏   | 31/50 [00:11<00:04,  3.89it/s] 64%|██████▍   | 32/50 [00:11<00:04,  3.90it/s] 66%|██████▌   | 33/50 [00:12<00:04,  3.90it/s] 68%|██████▊   | 34/50 [00:12<00:04,  3.91it/s] 70%|███████   | 35/50 [00:12<00:03,  3.89it/s] 72%|███████▏  | 36/50 [00:12<00:03,  3.90it/s] 74%|███████▍  | 37/50 [00:13<00:03,  3.89it/s] 76%|███████▌  | 38/50 [00:13<00:03,  3.89it/s] 78%|███████▊  | 39/50 [00:13<00:02,  3.90it/s] 80%|████████  | 40/50 [00:13<00:02,  3.90it/s] 82%|████████▏ | 41/50 [00:14<00:02,  3.91it/s] 84%|████████▍ | 42/50 [00:14<00:02,  3.92it/s] 86%|████████▌ | 43/50 [00:14<00:01,  3.90it/s] 88%|████████▊ | 44/50 [00:15<00:01,  3.90it/s] 90%|█████████ | 45/50 [00:15<00:01,  3.89it/s] 92%|█████████▏| 46/50 [00:15<00:01,  3.89it/s] 94%|█████████▍| 47/50 [00:15<00:00,  3.91it/s] 96%|█████████▌| 48/50 [00:16<00:00,  3.90it/s] 98%|█████████▊| 49/50 [00:16<00:00,  3.90it/s]100%|██████████| 50/50 [00:20<00:00,  1.53s/it]100%|██████████| 50/50 [00:20<00:00,  2.40it/s]
