[I 2023-12-11 00:24:45,609] Trial 377 finished with value: 0.3859234766178554 and parameters: {'EMBEDDING_DIM': 1008, 'HIDDEN_DIM': 160, 'NUM_LAYERS': 1, 'DROPOUT': 0.026455404900169958, 'LR': 0.0019285743806537838, 'WEIGHT_0': 0.166644811021606, 'WEIGHT_1': 0.9993635747339997, 'WEIGHT_2': 0.4304930466705453, 'WEIGHT_3': 0.9332830321016569, 'WEIGHT_4': 0.7694770646585393, 'WEIGHT_5': 0.7125110487917182, 'WEIGHT_6': 0.6519052756365897, 'WEIGHT_7': 0.17609336858080382, 'WEIGHT_8': 0.9040657588245653, 'optimizer': 'RMSprop'}. Best is trial 365 with value: 0.41910947782240837.
/userhome/cs2/dingruiw/conda/envs/py310/lib/python3.10/site-packages/torch/nn/modules/rnn.py:82: UserWarning: dropout option adds dropout after all but last recurrent layer, so non-zero dropout expects num_layers greater than 1, but got dropout=0.03605595070558941 and num_layers=1
  warnings.warn("dropout option adds dropout after all but last "
{'EMBEDDING_DIM': 1008, 'HIDDEN_DIM': 160, 'NUM_LAYERS': 1, 'DROPOUT': 0.026455404900169958, 'LR': 0.0019285743806537838, 'WEIGHT_0': 0.166644811021606, 'WEIGHT_1': 0.9993635747339997, 'WEIGHT_2': 0.4304930466705453, 'WEIGHT_3': 0.9332830321016569, 'WEIGHT_4': 0.7694770646585393, 'WEIGHT_5': 0.7125110487917182, 'WEIGHT_6': 0.6519052756365897, 'WEIGHT_7': 0.17609336858080382, 'WEIGHT_8': 0.9040657588245653, 'optimizer': 'RMSprop'}
0
              precision    recall  f1-score   support

         LOC       0.47      0.29      0.36      1837
        MISC       0.14      0.06      0.09       922
         ORG       0.15      0.09      0.11      1341
         PER       0.05      0.06      0.06      1842

   micro avg       0.18      0.14      0.16      5942
   macro avg       0.21      0.13      0.15      5942
weighted avg       0.22      0.14      0.17      5942

{'EMBEDDING_DIM': 1008, 'HIDDEN_DIM': 160, 'NUM_LAYERS': 1, 'DROPOUT': 0.026455404900169958, 'LR': 0.0019285743806537838, 'WEIGHT_0': 0.166644811021606, 'WEIGHT_1': 0.9993635747339997, 'WEIGHT_2': 0.4304930466705453, 'WEIGHT_3': 0.9332830321016569, 'WEIGHT_4': 0.7694770646585393, 'WEIGHT_5': 0.7125110487917182, 'WEIGHT_6': 0.6519052756365897, 'WEIGHT_7': 0.17609336858080382, 'WEIGHT_8': 0.9040657588245653, 'optimizer': 'RMSprop'}
49
              precision    recall  f1-score   support

         LOC       0.52      0.56      0.54      1837
        MISC       0.45      0.46      0.45       922
         ORG       0.24      0.27      0.25      1341
         PER       0.27      0.35      0.31      1842

   micro avg       0.36      0.41      0.39      5942
   macro avg       0.37      0.41      0.39      5942
weighted avg       0.37      0.41      0.39      5942

epoch 49
LSTM
  0%|          | 0/50 [00:00<?, ?it/s]  2%|▏         | 1/50 [00:05<04:41,  5.75s/it]  4%|▍         | 2/50 [00:06<02:04,  2.60s/it]  6%|▌         | 3/50 [00:06<01:24,  1.79s/it]  8%|▊         | 4/50 [00:07<01:04,  1.41s/it] 10%|█         | 5/50 [00:08<00:53,  1.20s/it] 12%|█▏        | 6/50 [00:09<00:47,  1.07s/it] 14%|█▍        | 7/50 [00:10<00:42,  1.01it/s] 16%|█▌        | 8/50 [00:11<00:39,  1.07it/s] 18%|█▊        | 9/50 [00:11<00:36,  1.11it/s] 20%|██        | 10/50 [00:12<00:35,  1.14it/s] 22%|██▏       | 11/50 [00:13<00:33,  1.16it/s] 24%|██▍       | 12/50 [00:14<00:32,  1.18it/s] 26%|██▌       | 13/50 [00:15<00:31,  1.19it/s] 28%|██▊       | 14/50 [00:16<00:30,  1.19it/s] 30%|███       | 15/50 [00:16<00:29,  1.20it/s] 32%|███▏      | 16/50 [00:17<00:28,  1.20it/s] 34%|███▍      | 17/50 [00:18<00:27,  1.21it/s] 36%|███▌      | 18/50 [00:19<00:26,  1.21it/s] 38%|███▊      | 19/50 [00:20<00:25,  1.21it/s] 40%|████      | 20/50 [00:20<00:24,  1.21it/s] 42%|████▏     | 21/50 [00:21<00:24,  1.21it/s] 44%|████▍     | 22/50 [00:22<00:23,  1.21it/s] 46%|████▌     | 23/50 [00:23<00:22,  1.21it/s] 48%|████▊     | 24/50 [00:24<00:21,  1.21it/s] 50%|█████     | 25/50 [00:25<00:20,  1.20it/s] 52%|█████▏    | 26/50 [00:25<00:20,  1.20it/s] 54%|█████▍    | 27/50 [00:26<00:19,  1.20it/s] 56%|█████▌    | 28/50 [00:27<00:18,  1.20it/s] 58%|█████▊    | 29/50 [00:28<00:17,  1.20it/s] 60%|██████    | 30/50 [00:29<00:16,  1.20it/s] 62%|██████▏   | 31/50 [00:30<00:15,  1.20it/s] 64%|██████▍   | 32/50 [00:31<00:15,  1.20it/s] 66%|██████▌   | 33/50 [00:31<00:14,  1.20it/s] 68%|██████▊   | 34/50 [00:32<00:13,  1.20it/s] 70%|███████   | 35/50 [00:33<00:12,  1.20it/s] 72%|███████▏  | 36/50 [00:34<00:11,  1.20it/s] 74%|███████▍  | 37/50 [00:35<00:10,  1.19it/s] 76%|███████▌  | 38/50 [00:36<00:10,  1.19it/s] 78%|███████▊  | 39/50 [00:36<00:09,  1.19it/s] 80%|████████  | 40/50 [00:37<00:08,  1.19it/s] 82%|████████▏ | 41/50 [00:38<00:07,  1.19it/s] 84%|████████▍ | 42/50 [00:39<00:06,  1.19it/s] 86%|████████▌ | 43/50 [00:40<00:05,  1.19it/s] 88%|████████▊ | 44/50 [00:41<00:05,  1.18it/s] 90%|█████████ | 45/50 [00:41<00:04,  1.18it/s] 92%|█████████▏| 46/50 [00:42<00:03,  1.18it/s] 94%|█████████▍| 47/50 [00:43<00:02,  1.18it/s] 96%|█████████▌| 48/50 [00:44<00:01,  1.18it/s] 98%|█████████▊| 49/50 [00:45<00:00,  1.18it/s]100%|██████████| 50/50 [00:51<00:00,  2.48s/it]100%|██████████| 50/50 [00:51<00:00,  1.03s/it]
[I 2023-12-11 00:25:42,128] Trial 378 finished with value: 0.2930136420008268 and parameters: {'EMBEDDING_DIM': 962, 'HIDDEN_DIM': 1039, 'NUM_LAYERS': 1, 'DROPOUT': 0.03605595070558941, 'LR': 0.002102633183886155, 'WEIGHT_0': 0.2285662949769338, 'WEIGHT_1': 0.7273467677735579, 'WEIGHT_2': 0.4568412363329913, 'WEIGHT_3': 0.8861945914355877, 'WEIGHT_4': 0.71312330286692, 'WEIGHT_5': 0.6551614213527607, 'WEIGHT_6': 0.6629357826844976, 'WEIGHT_7': 0.5314502616520916, 'WEIGHT_8': 0.8463363954776473, 'optimizer': 'RMSprop'}. Best is trial 365 with value: 0.41910947782240837.
/userhome/cs2/dingruiw/conda/envs/py310/lib/python3.10/site-packages/torch/nn/modules/rnn.py:82: UserWarning: dropout option adds dropout after all but last recurrent layer, so non-zero dropout expects num_layers greater than 1, but got dropout=0.05852497901496511 and num_layers=1
  warnings.warn("dropout option adds dropout after all but last "
{'EMBEDDING_DIM': 962, 'HIDDEN_DIM': 1039, 'NUM_LAYERS': 1, 'DROPOUT': 0.03605595070558941, 'LR': 0.002102633183886155, 'WEIGHT_0': 0.2285662949769338, 'WEIGHT_1': 0.7273467677735579, 'WEIGHT_2': 0.4568412363329913, 'WEIGHT_3': 0.8861945914355877, 'WEIGHT_4': 0.71312330286692, 'WEIGHT_5': 0.6551614213527607, 'WEIGHT_6': 0.6629357826844976, 'WEIGHT_7': 0.5314502616520916, 'WEIGHT_8': 0.8463363954776473, 'optimizer': 'RMSprop'}
0
              precision    recall  f1-score   support

         LOC       0.12      0.02      0.04      1837
        MISC       0.03      0.02      0.02       922
         ORG       0.08      0.02      0.03      1341
         PER       0.04      0.02      0.03      1842

   micro avg       0.05      0.02      0.03      5942
   macro avg       0.07      0.02      0.03      5942
weighted avg       0.07      0.02      0.03      5942

{'EMBEDDING_DIM': 962, 'HIDDEN_DIM': 1039, 'NUM_LAYERS': 1, 'DROPOUT': 0.03605595070558941, 'LR': 0.002102633183886155, 'WEIGHT_0': 0.2285662949769338, 'WEIGHT_1': 0.7273467677735579, 'WEIGHT_2': 0.4568412363329913, 'WEIGHT_3': 0.8861945914355877, 'WEIGHT_4': 0.71312330286692, 'WEIGHT_5': 0.6551614213527607, 'WEIGHT_6': 0.6629357826844976, 'WEIGHT_7': 0.5314502616520916, 'WEIGHT_8': 0.8463363954776473, 'optimizer': 'RMSprop'}
49
              precision    recall  f1-score   support

         LOC       0.48      0.42      0.45      1837
        MISC       0.30      0.33      0.32       922
         ORG       0.21      0.20      0.21      1341
         PER       0.19      0.23      0.21      1842

   micro avg       0.29      0.30      0.29      5942
   macro avg       0.30      0.30      0.29      5942
weighted avg       0.30      0.30      0.30      5942

epoch 49
LSTM
  0%|          | 0/50 [00:00<?, ?it/s]  2%|▏         | 1/50 [00:04<03:39,  4.48s/it]  6%|▌         | 3/50 [00:04<00:59,  1.26s/it]  8%|▊         | 4/50 [00:04<00:40,  1.14it/s] 10%|█         | 5/50 [00:05<00:28,  1.57it/s] 12%|█▏        | 6/50 [00:05<00:21,  2.07it/s] 14%|█▍        | 7/50 [00:05<00:16,  2.64it/s] 16%|█▌        | 8/50 [00:05<00:13,  3.23it/s] 18%|█▊        | 9/50 [00:05<00:10,  3.81it/s] 20%|██        | 10/50 [00:05<00:09,  4.35it/s] 22%|██▏       | 11/50 [00:05<00:08,  4.82it/s] 24%|██▍       | 12/50 [00:06<00:07,  5.22it/s] 26%|██▌       | 13/50 [00:06<00:06,  5.53it/s] 28%|██▊       | 14/50 [00:06<00:06,  5.78it/s] 30%|███       | 15/50 [00:06<00:05,  5.96it/s] 32%|███▏      | 16/50 [00:06<00:05,  6.09it/s] 34%|███▍      | 17/50 [00:06<00:05,  6.20it/s] 36%|███▌      | 18/50 [00:07<00:05,  6.26it/s] 38%|███▊      | 19/50 [00:07<00:04,  6.30it/s] 40%|████      | 20/50 [00:07<00:04,  6.34it/s] 42%|████▏     | 21/50 [00:07<00:04,  6.36it/s] 44%|████▍     | 22/50 [00:07<00:04,  6.39it/s] 46%|████▌     | 23/50 [00:07<00:04,  6.39it/s] 48%|████▊     | 24/50 [00:08<00:04,  6.41it/s] 50%|█████     | 25/50 [00:08<00:03,  6.41it/s] 52%|█████▏    | 26/50 [00:08<00:03,  6.41it/s] 54%|█████▍    | 27/50 [00:08<00:03,  6.43it/s] 56%|█████▌    | 28/50 [00:08<00:03,  6.41it/s] 58%|█████▊    | 29/50 [00:08<00:03,  6.42it/s] 60%|██████    | 30/50 [00:08<00:03,  6.43it/s] 62%|██████▏   | 31/50 [00:09<00:02,  6.42it/s] 64%|██████▍   | 32/50 [00:09<00:02,  6.42it/s] 66%|██████▌   | 33/50 [00:09<00:02,  6.41it/s] 68%|██████▊   | 34/50 [00:09<00:02,  6.38it/s] 70%|███████   | 35/50 [00:09<00:02,  6.39it/s] 72%|███████▏  | 36/50 [00:09<00:02,  6.40it/s] 74%|███████▍  | 37/50 [00:10<00:02,  6.39it/s] 76%|███████▌  | 38/50 [00:10<00:01,  6.38it/s] 78%|███████▊  | 39/50 [00:10<00:01,  6.39it/s] 80%|████████  | 40/50 [00:10<00:01,  6.39it/s] 82%|████████▏ | 41/50 [00:10<00:01,  6.39it/s] 84%|████████▍ | 42/50 [00:10<00:01,  6.38it/s] 86%|████████▌ | 43/50 [00:10<00:01,  6.38it/s] 88%|████████▊ | 44/50 [00:11<00:00,  6.34it/s] 90%|█████████ | 45/50 [00:11<00:00,  6.36it/s] 92%|█████████▏| 46/50 [00:11<00:00,  6.33it/s] 94%|█████████▍| 47/50 [00:11<00:00,  6.31it/s] 96%|█████████▌| 48/50 [00:11<00:00,  6.33it/s] 98%|█████████▊| 49/50 [00:11<00:00,  6.33it/s]100%|██████████| 50/50 [00:16<00:00,  1.51s/it]100%|██████████| 50/50 [00:16<00:00,  3.01it/s]
[I 2023-12-11 00:26:02,991] Trial 379 finished with value: 0.40275358712780956 and parameters: {'EMBEDDING_DIM': 986, 'HIDDEN_DIM': 217, 'NUM_LAYERS': 1, 'DROPOUT': 0.05852497901496511, 'LR': 0.0021662278673138533, 'WEIGHT_0': 0.20923429671871024, 'WEIGHT_1': 0.6889460451040593, 'WEIGHT_2': 0.45697005806364865, 'WEIGHT_3': 0.9214106897057609, 'WEIGHT_4': 0.7451373546437786, 'WEIGHT_5': 0.6770340284903662, 'WEIGHT_6': 0.9506206821154276, 'WEIGHT_7': 0.36157056380437014, 'WEIGHT_8': 0.8890677033026124, 'optimizer': 'RMSprop'}. Best is trial 365 with value: 0.41910947782240837.
/userhome/cs2/dingruiw/conda/envs/py310/lib/python3.10/site-packages/torch/nn/modules/rnn.py:82: UserWarning: dropout option adds dropout after all but last recurrent layer, so non-zero dropout expects num_layers greater than 1, but got dropout=0.04943937341704242 and num_layers=1
  warnings.warn("dropout option adds dropout after all but last "
{'EMBEDDING_DIM': 986, 'HIDDEN_DIM': 217, 'NUM_LAYERS': 1, 'DROPOUT': 0.05852497901496511, 'LR': 0.0021662278673138533, 'WEIGHT_0': 0.20923429671871024, 'WEIGHT_1': 0.6889460451040593, 'WEIGHT_2': 0.45697005806364865, 'WEIGHT_3': 0.9214106897057609, 'WEIGHT_4': 0.7451373546437786, 'WEIGHT_5': 0.6770340284903662, 'WEIGHT_6': 0.9506206821154276, 'WEIGHT_7': 0.36157056380437014, 'WEIGHT_8': 0.8890677033026124, 'optimizer': 'RMSprop'}
0
              precision    recall  f1-score   support

         LOC       0.39      0.23      0.29      1837
        MISC       0.09      0.02      0.03       922
         ORG       0.28      0.05      0.09      1341
         PER       0.12      0.04      0.07      1842

   micro avg       0.27      0.10      0.15      5942
   macro avg       0.22      0.09      0.12      5942
weighted avg       0.24      0.10      0.13      5942

{'EMBEDDING_DIM': 986, 'HIDDEN_DIM': 217, 'NUM_LAYERS': 1, 'DROPOUT': 0.05852497901496511, 'LR': 0.0021662278673138533, 'WEIGHT_0': 0.20923429671871024, 'WEIGHT_1': 0.6889460451040593, 'WEIGHT_2': 0.45697005806364865, 'WEIGHT_3': 0.9214106897057609, 'WEIGHT_4': 0.7451373546437786, 'WEIGHT_5': 0.6770340284903662, 'WEIGHT_6': 0.9506206821154276, 'WEIGHT_7': 0.36157056380437014, 'WEIGHT_8': 0.8890677033026124, 'optimizer': 'RMSprop'}
49
              precision    recall  f1-score   support

         LOC       0.54      0.54      0.54      1837
        MISC       0.46      0.45      0.45       922
         ORG       0.26      0.27      0.26      1341
         PER       0.33      0.36      0.35      1842

   micro avg       0.40      0.41      0.40      5942
   macro avg       0.40      0.40      0.40      5942
weighted avg       0.40      0.41      0.40      5942

epoch 49
LSTM
  0%|          | 0/50 [00:00<?, ?it/s]  2%|▏         | 1/50 [00:04<04:00,  4.91s/it]  4%|▍         | 2/50 [00:05<01:40,  2.08s/it]  6%|▌         | 3/50 [00:05<00:57,  1.23s/it]  8%|▊         | 4/50 [00:05<00:37,  1.22it/s] 10%|█         | 5/50 [00:05<00:26,  1.69it/s] 12%|█▏        | 6/50 [00:05<00:20,  2.19it/s] 14%|█▍        | 7/50 [00:05<00:15,  2.70it/s] 16%|█▌        | 8/50 [00:06<00:13,  3.19it/s] 18%|█▊        | 9/50 [00:06<00:11,  3.63it/s] 20%|██        | 10/50 [00:06<00:10,  3.99it/s] 22%|██▏       | 11/50 [00:06<00:09,  4.30it/s] 24%|██▍       | 12/50 [00:06<00:08,  4.53it/s] 26%|██▌       | 13/50 [00:07<00:07,  4.72it/s] 28%|██▊       | 14/50 [00:07<00:07,  4.85it/s] 30%|███       | 15/50 [00:07<00:07,  4.95it/s] 32%|███▏      | 16/50 [00:07<00:06,  5.01it/s] 34%|███▍      | 17/50 [00:07<00:06,  5.06it/s] 36%|███▌      | 18/50 [00:08<00:06,  5.11it/s] 38%|███▊      | 19/50 [00:08<00:06,  5.14it/s] 40%|████      | 20/50 [00:08<00:05,  5.15it/s] 42%|████▏     | 21/50 [00:08<00:05,  5.17it/s] 44%|████▍     | 22/50 [00:08<00:05,  5.18it/s] 46%|████▌     | 23/50 [00:09<00:05,  5.18it/s] 48%|████▊     | 24/50 [00:09<00:04,  5.20it/s] 50%|█████     | 25/50 [00:09<00:04,  5.20it/s] 52%|█████▏    | 26/50 [00:09<00:04,  5.20it/s] 54%|█████▍    | 27/50 [00:09<00:04,  5.20it/s] 56%|█████▌    | 28/50 [00:10<00:04,  5.20it/s] 58%|█████▊    | 29/50 [00:10<00:04,  5.18it/s] 60%|██████    | 30/50 [00:10<00:03,  5.18it/s] 62%|██████▏   | 31/50 [00:10<00:03,  5.19it/s] 64%|██████▍   | 32/50 [00:10<00:03,  5.19it/s] 66%|██████▌   | 33/50 [00:11<00:03,  5.18it/s] 68%|██████▊   | 34/50 [00:11<00:03,  5.19it/s] 70%|███████   | 35/50 [00:11<00:02,  5.18it/s] 72%|███████▏  | 36/50 [00:11<00:02,  5.17it/s] 74%|███████▍  | 37/50 [00:11<00:02,  5.17it/s] 76%|███████▌  | 38/50 [00:11<00:02,  5.17it/s] 78%|███████▊  | 39/50 [00:12<00:02,  5.18it/s] 80%|████████  | 40/50 [00:12<00:01,  5.17it/s] 82%|████████▏ | 41/50 [00:12<00:01,  5.17it/s] 84%|████████▍ | 42/50 [00:12<00:01,  5.17it/s] 86%|████████▌ | 43/50 [00:12<00:01,  5.17it/s] 88%|████████▊ | 44/50 [00:13<00:01,  5.16it/s] 90%|█████████ | 45/50 [00:13<00:00,  5.17it/s] 92%|█████████▏| 46/50 [00:13<00:00,  5.18it/s] 94%|█████████▍| 47/50 [00:13<00:00,  5.17it/s] 96%|█████████▌| 48/50 [00:13<00:00,  5.18it/s] 98%|█████████▊| 49/50 [00:14<00:00,  5.17it/s]100%|██████████| 50/50 [00:18<00:00,  1.55s/it]100%|██████████| 50/50 [00:18<00:00,  2.66it/s]
[I 2023-12-11 00:26:26,069] Trial 380 finished with value: 0.39956405097250175 and parameters: {'EMBEDDING_DIM': 934, 'HIDDEN_DIM': 282, 'NUM_LAYERS': 1, 'DROPOUT': 0.04943937341704242, 'LR': 0.002402932961407534, 'WEIGHT_0': 0.2502175098612066, 'WEIGHT_1': 0.7137898596625896, 'WEIGHT_2': 0.4178837480929004, 'WEIGHT_3': 0.9498685320857695, 'WEIGHT_4': 0.8027873429631379, 'WEIGHT_5': 0.6420767651779788, 'WEIGHT_6': 0.8801068338386967, 'WEIGHT_7': 0.5078591375353023, 'WEIGHT_8': 0.8555062223946241, 'optimizer': 'RMSprop'}. Best is trial 365 with value: 0.41910947782240837.
/userhome/cs2/dingruiw/conda/envs/py310/lib/python3.10/site-packages/torch/nn/modules/rnn.py:82: UserWarning: dropout option adds dropout after all but last recurrent layer, so non-zero dropout expects num_layers greater than 1, but got dropout=0.021166567709191213 and num_layers=1
  warnings.warn("dropout option adds dropout after all but last "
{'EMBEDDING_DIM': 934, 'HIDDEN_DIM': 282, 'NUM_LAYERS': 1, 'DROPOUT': 0.04943937341704242, 'LR': 0.002402932961407534, 'WEIGHT_0': 0.2502175098612066, 'WEIGHT_1': 0.7137898596625896, 'WEIGHT_2': 0.4178837480929004, 'WEIGHT_3': 0.9498685320857695, 'WEIGHT_4': 0.8027873429631379, 'WEIGHT_5': 0.6420767651779788, 'WEIGHT_6': 0.8801068338386967, 'WEIGHT_7': 0.5078591375353023, 'WEIGHT_8': 0.8555062223946241, 'optimizer': 'RMSprop'}
0
              precision    recall  f1-score   support

         LOC       0.26      0.26      0.26      1837
        MISC       0.07      0.01      0.02       922
         ORG       0.20      0.02      0.04      1341
         PER       0.05      0.04      0.04      1842

   micro avg       0.16      0.10      0.12      5942
   macro avg       0.14      0.09      0.09      5942
weighted avg       0.15      0.10      0.11      5942

{'EMBEDDING_DIM': 934, 'HIDDEN_DIM': 282, 'NUM_LAYERS': 1, 'DROPOUT': 0.04943937341704242, 'LR': 0.002402932961407534, 'WEIGHT_0': 0.2502175098612066, 'WEIGHT_1': 0.7137898596625896, 'WEIGHT_2': 0.4178837480929004, 'WEIGHT_3': 0.9498685320857695, 'WEIGHT_4': 0.8027873429631379, 'WEIGHT_5': 0.6420767651779788, 'WEIGHT_6': 0.8801068338386967, 'WEIGHT_7': 0.5078591375353023, 'WEIGHT_8': 0.8555062223946241, 'optimizer': 'RMSprop'}
49
              precision    recall  f1-score   support

         LOC       0.56      0.55      0.55      1837
        MISC       0.44      0.42      0.43       922
         ORG       0.24      0.25      0.24      1341
         PER       0.34      0.35      0.35      1842

   micro avg       0.40      0.40      0.40      5942
   macro avg       0.40      0.39      0.39      5942
weighted avg       0.40      0.40      0.40      5942

epoch 49
LSTM
  0%|          | 0/50 [00:00<?, ?it/s]  2%|▏         | 1/50 [00:04<03:48,  4.66s/it]  4%|▍         | 2/50 [00:04<01:35,  1.99s/it]  6%|▌         | 3/50 [00:05<00:55,  1.19s/it]  8%|▊         | 4/50 [00:05<00:37,  1.24it/s] 10%|█         | 5/50 [00:05<00:26,  1.68it/s] 12%|█▏        | 6/50 [00:05<00:20,  2.13it/s] 14%|█▍        | 7/50 [00:05<00:16,  2.58it/s] 16%|█▌        | 8/50 [00:06<00:14,  2.99it/s] 18%|█▊        | 9/50 [00:06<00:12,  3.34it/s] 20%|██        | 10/50 [00:06<00:10,  3.64it/s] 22%|██▏       | 11/50 [00:06<00:10,  3.87it/s] 24%|██▍       | 12/50 [00:07<00:09,  4.04it/s] 26%|██▌       | 13/50 [00:07<00:08,  4.18it/s] 28%|██▊       | 14/50 [00:07<00:08,  4.28it/s] 30%|███       | 15/50 [00:07<00:08,  4.35it/s] 32%|███▏      | 16/50 [00:07<00:07,  4.40it/s] 34%|███▍      | 17/50 [00:08<00:07,  4.44it/s] 36%|███▌      | 18/50 [00:08<00:07,  4.46it/s] 38%|███▊      | 19/50 [00:08<00:06,  4.48it/s] 40%|████      | 20/50 [00:08<00:06,  4.49it/s] 42%|████▏     | 21/50 [00:09<00:06,  4.50it/s] 44%|████▍     | 22/50 [00:09<00:06,  4.50it/s] 46%|████▌     | 23/50 [00:09<00:05,  4.50it/s] 48%|████▊     | 24/50 [00:09<00:05,  4.50it/s] 50%|█████     | 25/50 [00:09<00:05,  4.50it/s] 52%|█████▏    | 26/50 [00:10<00:05,  4.50it/s] 54%|█████▍    | 27/50 [00:10<00:05,  4.50it/s] 56%|█████▌    | 28/50 [00:10<00:04,  4.50it/s] 58%|█████▊    | 29/50 [00:10<00:04,  4.49it/s] 60%|██████    | 30/50 [00:11<00:04,  4.49it/s] 62%|██████▏   | 31/50 [00:11<00:04,  4.49it/s] 64%|██████▍   | 32/50 [00:11<00:04,  4.49it/s] 66%|██████▌   | 33/50 [00:11<00:03,  4.49it/s] 68%|██████▊   | 34/50 [00:11<00:03,  4.50it/s] 70%|███████   | 35/50 [00:12<00:03,  4.49it/s] 72%|███████▏  | 36/50 [00:12<00:03,  4.50it/s] 74%|███████▍  | 37/50 [00:12<00:02,  4.50it/s] 76%|███████▌  | 38/50 [00:12<00:02,  4.49it/s] 78%|███████▊  | 39/50 [00:13<00:02,  4.49it/s] 80%|████████  | 40/50 [00:13<00:02,  4.49it/s] 82%|████████▏ | 41/50 [00:13<00:02,  4.49it/s] 84%|████████▍ | 42/50 [00:13<00:01,  4.49it/s] 86%|████████▌ | 43/50 [00:13<00:01,  4.49it/s] 88%|████████▊ | 44/50 [00:14<00:01,  4.49it/s] 90%|█████████ | 45/50 [00:14<00:01,  4.48it/s] 92%|█████████▏| 46/50 [00:14<00:00,  4.49it/s] 94%|█████████▍| 47/50 [00:14<00:00,  4.48it/s] 96%|█████████▌| 48/50 [00:15<00:00,  4.48it/s] 98%|█████████▊| 49/50 [00:15<00:00,  4.48it/s]100%|██████████| 50/50 [00:20<00:00,  1.59s/it]100%|██████████| 50/50 [00:20<00:00,  2.50it/s]
