[I 2023-12-11 00:04:35,923] Trial 333 finished with value: 0.3914487692700792 and parameters: {'EMBEDDING_DIM': 959, 'HIDDEN_DIM': 238, 'NUM_LAYERS': 1, 'DROPOUT': 0.3436134007174377, 'LR': 0.0033345600382235245, 'WEIGHT_0': 0.48171894557339595, 'WEIGHT_1': 0.7538585050162745, 'WEIGHT_2': 0.22657627415064294, 'WEIGHT_3': 0.47566603870060475, 'WEIGHT_4': 0.7123741628116759, 'WEIGHT_5': 0.8124394678262155, 'WEIGHT_6': 0.703802951653224, 'WEIGHT_7': 0.3059381104845662, 'WEIGHT_8': 0.6084790123196278, 'optimizer': 'RMSprop'}. Best is trial 221 with value: 0.418736930154747.
/userhome/cs2/dingruiw/conda/envs/py310/lib/python3.10/site-packages/torch/nn/modules/rnn.py:82: UserWarning: dropout option adds dropout after all but last recurrent layer, so non-zero dropout expects num_layers greater than 1, but got dropout=0.3600897738984982 and num_layers=1
  warnings.warn("dropout option adds dropout after all but last "
{'EMBEDDING_DIM': 959, 'HIDDEN_DIM': 238, 'NUM_LAYERS': 1, 'DROPOUT': 0.3436134007174377, 'LR': 0.0033345600382235245, 'WEIGHT_0': 0.48171894557339595, 'WEIGHT_1': 0.7538585050162745, 'WEIGHT_2': 0.22657627415064294, 'WEIGHT_3': 0.47566603870060475, 'WEIGHT_4': 0.7123741628116759, 'WEIGHT_5': 0.8124394678262155, 'WEIGHT_6': 0.703802951653224, 'WEIGHT_7': 0.3059381104845662, 'WEIGHT_8': 0.6084790123196278, 'optimizer': 'RMSprop'}
0
              precision    recall  f1-score   support

         LOC       0.40      0.13      0.20      1837
        MISC       0.03      0.01      0.01       922
         ORG       0.14      0.04      0.06      1341
         PER       0.06      0.01      0.01      1842

   micro avg       0.23      0.05      0.09      5942
   macro avg       0.16      0.05      0.07      5942
weighted avg       0.18      0.05      0.08      5942

{'EMBEDDING_DIM': 959, 'HIDDEN_DIM': 238, 'NUM_LAYERS': 1, 'DROPOUT': 0.3436134007174377, 'LR': 0.0033345600382235245, 'WEIGHT_0': 0.48171894557339595, 'WEIGHT_1': 0.7538585050162745, 'WEIGHT_2': 0.22657627415064294, 'WEIGHT_3': 0.47566603870060475, 'WEIGHT_4': 0.7123741628116759, 'WEIGHT_5': 0.8124394678262155, 'WEIGHT_6': 0.703802951653224, 'WEIGHT_7': 0.3059381104845662, 'WEIGHT_8': 0.6084790123196278, 'optimizer': 'RMSprop'}
49
              precision    recall  f1-score   support

         LOC       0.53      0.55      0.54      1837
        MISC       0.42      0.41      0.42       922
         ORG       0.25      0.27      0.26      1341
         PER       0.35      0.30      0.32      1842

   micro avg       0.40      0.39      0.39      5942
   macro avg       0.39      0.38      0.38      5942
weighted avg       0.39      0.39      0.39      5942

epoch 49
LSTM
  0%|          | 0/50 [00:00<?, ?it/s]  2%|▏         | 1/50 [00:04<03:47,  4.64s/it]  4%|▍         | 2/50 [00:04<01:34,  1.98s/it]  6%|▌         | 3/50 [00:04<00:55,  1.17s/it]  8%|▊         | 4/50 [00:05<00:36,  1.27it/s] 10%|█         | 5/50 [00:05<00:26,  1.73it/s] 12%|█▏        | 6/50 [00:05<00:19,  2.21it/s] 14%|█▍        | 7/50 [00:05<00:15,  2.69it/s] 16%|█▌        | 8/50 [00:05<00:13,  3.13it/s] 18%|█▊        | 9/50 [00:06<00:11,  3.52it/s] 20%|██        | 10/50 [00:06<00:10,  3.85it/s] 22%|██▏       | 11/50 [00:06<00:09,  4.11it/s] 24%|██▍       | 12/50 [00:06<00:08,  4.31it/s] 26%|██▌       | 13/50 [00:07<00:08,  4.45it/s] 28%|██▊       | 14/50 [00:07<00:07,  4.56it/s] 30%|███       | 15/50 [00:07<00:07,  4.65it/s] 32%|███▏      | 16/50 [00:07<00:07,  4.71it/s] 34%|███▍      | 17/50 [00:07<00:06,  4.75it/s] 36%|███▌      | 18/50 [00:08<00:06,  4.77it/s] 38%|███▊      | 19/50 [00:08<00:06,  4.79it/s] 40%|████      | 20/50 [00:08<00:06,  4.81it/s] 42%|████▏     | 21/50 [00:08<00:06,  4.83it/s] 44%|████▍     | 22/50 [00:08<00:05,  4.83it/s] 46%|████▌     | 23/50 [00:09<00:05,  4.83it/s] 48%|████▊     | 24/50 [00:09<00:05,  4.83it/s] 50%|█████     | 25/50 [00:09<00:05,  4.83it/s] 52%|█████▏    | 26/50 [00:09<00:04,  4.84it/s] 54%|█████▍    | 27/50 [00:09<00:04,  4.84it/s] 56%|█████▌    | 28/50 [00:10<00:04,  4.84it/s] 58%|█████▊    | 29/50 [00:10<00:04,  4.83it/s] 60%|██████    | 30/50 [00:10<00:04,  4.83it/s] 62%|██████▏   | 31/50 [00:10<00:03,  4.83it/s] 64%|██████▍   | 32/50 [00:10<00:03,  4.84it/s] 66%|██████▌   | 33/50 [00:11<00:03,  4.83it/s] 68%|██████▊   | 34/50 [00:11<00:03,  4.82it/s] 70%|███████   | 35/50 [00:11<00:03,  4.82it/s] 72%|███████▏  | 36/50 [00:11<00:02,  4.83it/s] 74%|███████▍  | 37/50 [00:11<00:02,  4.83it/s] 76%|███████▌  | 38/50 [00:12<00:02,  4.83it/s] 78%|███████▊  | 39/50 [00:12<00:02,  4.82it/s] 80%|████████  | 40/50 [00:12<00:02,  4.82it/s] 82%|████████▏ | 41/50 [00:12<00:01,  4.82it/s] 84%|████████▍ | 42/50 [00:13<00:01,  4.82it/s] 86%|████████▌ | 43/50 [00:13<00:01,  4.81it/s] 88%|████████▊ | 44/50 [00:13<00:01,  4.81it/s] 90%|█████████ | 45/50 [00:13<00:01,  4.82it/s] 92%|█████████▏| 46/50 [00:13<00:00,  4.81it/s] 94%|█████████▍| 47/50 [00:14<00:00,  4.81it/s] 96%|█████████▌| 48/50 [00:14<00:00,  4.81it/s] 98%|█████████▊| 49/50 [00:14<00:00,  4.81it/s]100%|██████████| 50/50 [00:19<00:00,  1.57s/it]100%|██████████| 50/50 [00:19<00:00,  2.60it/s]
[I 2023-12-11 00:04:59,380] Trial 334 finished with value: 0.3986677768526228 and parameters: {'EMBEDDING_DIM': 979, 'HIDDEN_DIM': 309, 'NUM_LAYERS': 1, 'DROPOUT': 0.3600897738984982, 'LR': 0.0014308518796427082, 'WEIGHT_0': 0.29007718482052636, 'WEIGHT_1': 0.7859790426696467, 'WEIGHT_2': 0.6564077499490368, 'WEIGHT_3': 0.18215324503542385, 'WEIGHT_4': 0.5021658573838491, 'WEIGHT_5': 0.5708482174322151, 'WEIGHT_6': 0.609581293442902, 'WEIGHT_7': 0.5256471901809388, 'WEIGHT_8': 0.4796458860832959, 'optimizer': 'RMSprop'}. Best is trial 221 with value: 0.418736930154747.
/userhome/cs2/dingruiw/conda/envs/py310/lib/python3.10/site-packages/torch/nn/modules/rnn.py:82: UserWarning: dropout option adds dropout after all but last recurrent layer, so non-zero dropout expects num_layers greater than 1, but got dropout=0.3765626485360575 and num_layers=1
  warnings.warn("dropout option adds dropout after all but last "
{'EMBEDDING_DIM': 979, 'HIDDEN_DIM': 309, 'NUM_LAYERS': 1, 'DROPOUT': 0.3600897738984982, 'LR': 0.0014308518796427082, 'WEIGHT_0': 0.29007718482052636, 'WEIGHT_1': 0.7859790426696467, 'WEIGHT_2': 0.6564077499490368, 'WEIGHT_3': 0.18215324503542385, 'WEIGHT_4': 0.5021658573838491, 'WEIGHT_5': 0.5708482174322151, 'WEIGHT_6': 0.609581293442902, 'WEIGHT_7': 0.5256471901809388, 'WEIGHT_8': 0.4796458860832959, 'optimizer': 'RMSprop'}
0
              precision    recall  f1-score   support

         LOC       0.29      0.15      0.20      1837
        MISC       0.05      0.04      0.04       922
         ORG       0.10      0.04      0.05      1341
         PER       0.10      0.02      0.03      1842

   micro avg       0.16      0.07      0.09      5942
   macro avg       0.13      0.06      0.08      5942
weighted avg       0.15      0.07      0.09      5942

{'EMBEDDING_DIM': 979, 'HIDDEN_DIM': 309, 'NUM_LAYERS': 1, 'DROPOUT': 0.3600897738984982, 'LR': 0.0014308518796427082, 'WEIGHT_0': 0.29007718482052636, 'WEIGHT_1': 0.7859790426696467, 'WEIGHT_2': 0.6564077499490368, 'WEIGHT_3': 0.18215324503542385, 'WEIGHT_4': 0.5021658573838491, 'WEIGHT_5': 0.5708482174322151, 'WEIGHT_6': 0.609581293442902, 'WEIGHT_7': 0.5256471901809388, 'WEIGHT_8': 0.4796458860832959, 'optimizer': 'RMSprop'}
49
              precision    recall  f1-score   support

         LOC       0.56      0.55      0.55      1837
        MISC       0.40      0.45      0.43       922
         ORG       0.26      0.29      0.28      1341
         PER       0.33      0.31      0.32      1842

   micro avg       0.39      0.40      0.40      5942
   macro avg       0.39      0.40      0.39      5942
weighted avg       0.40      0.40      0.40      5942

epoch 49
LSTM
  0%|          | 0/50 [00:00<?, ?it/s]  2%|▏         | 1/50 [00:04<03:47,  4.65s/it]  4%|▍         | 2/50 [00:04<01:35,  1.99s/it]  6%|▌         | 3/50 [00:05<00:55,  1.19s/it]  8%|▊         | 4/50 [00:05<00:37,  1.24it/s] 10%|█         | 5/50 [00:05<00:26,  1.67it/s] 12%|█▏        | 6/50 [00:05<00:20,  2.11it/s] 14%|█▍        | 7/50 [00:05<00:16,  2.54it/s] 16%|█▌        | 8/50 [00:06<00:14,  2.93it/s] 18%|█▊        | 9/50 [00:06<00:12,  3.27it/s] 20%|██        | 10/50 [00:06<00:11,  3.54it/s] 22%|██▏       | 11/50 [00:06<00:10,  3.76it/s] 24%|██▍       | 12/50 [00:07<00:09,  3.93it/s] 26%|██▌       | 13/50 [00:07<00:09,  4.05it/s] 28%|██▊       | 14/50 [00:07<00:08,  4.14it/s] 30%|███       | 15/50 [00:07<00:08,  4.21it/s] 32%|███▏      | 16/50 [00:07<00:07,  4.25it/s] 34%|███▍      | 17/50 [00:08<00:07,  4.28it/s] 36%|███▌      | 18/50 [00:08<00:07,  4.31it/s] 38%|███▊      | 19/50 [00:08<00:07,  4.33it/s] 40%|████      | 20/50 [00:08<00:06,  4.34it/s] 42%|████▏     | 21/50 [00:09<00:06,  4.34it/s] 44%|████▍     | 22/50 [00:09<00:06,  4.35it/s] 46%|████▌     | 23/50 [00:09<00:06,  4.35it/s] 48%|████▊     | 24/50 [00:09<00:05,  4.35it/s] 50%|█████     | 25/50 [00:10<00:05,  4.36it/s] 52%|█████▏    | 26/50 [00:10<00:05,  4.36it/s] 54%|█████▍    | 27/50 [00:10<00:05,  4.36it/s] 56%|█████▌    | 28/50 [00:10<00:05,  4.36it/s] 58%|█████▊    | 29/50 [00:10<00:04,  4.36it/s] 60%|██████    | 30/50 [00:11<00:04,  4.35it/s] 62%|██████▏   | 31/50 [00:11<00:04,  4.35it/s] 64%|██████▍   | 32/50 [00:11<00:04,  4.35it/s] 66%|██████▌   | 33/50 [00:11<00:03,  4.35it/s] 68%|██████▊   | 34/50 [00:12<00:03,  4.35it/s] 70%|███████   | 35/50 [00:12<00:03,  4.35it/s] 72%|███████▏  | 36/50 [00:12<00:03,  4.35it/s] 74%|███████▍  | 37/50 [00:12<00:02,  4.35it/s] 76%|███████▌  | 38/50 [00:13<00:02,  4.35it/s] 78%|███████▊  | 39/50 [00:13<00:02,  4.34it/s] 80%|████████  | 40/50 [00:13<00:02,  4.34it/s] 82%|████████▏ | 41/50 [00:13<00:02,  4.34it/s] 84%|████████▍ | 42/50 [00:13<00:01,  4.34it/s] 86%|████████▌ | 43/50 [00:14<00:01,  4.34it/s] 88%|████████▊ | 44/50 [00:14<00:01,  4.34it/s] 90%|█████████ | 45/50 [00:14<00:01,  4.34it/s] 92%|█████████▏| 46/50 [00:14<00:00,  4.34it/s] 94%|█████████▍| 47/50 [00:15<00:00,  4.34it/s] 96%|█████████▌| 48/50 [00:15<00:00,  4.34it/s] 98%|█████████▊| 49/50 [00:15<00:00,  4.34it/s]100%|██████████| 50/50 [00:20<00:00,  1.60s/it]100%|██████████| 50/50 [00:20<00:00,  2.46it/s]
[I 2023-12-11 00:05:23,969] Trial 335 finished with value: 0.39189964745429207 and parameters: {'EMBEDDING_DIM': 733, 'HIDDEN_DIM': 393, 'NUM_LAYERS': 1, 'DROPOUT': 0.3765626485360575, 'LR': 0.0018475874442367675, 'WEIGHT_0': 0.43801075582163745, 'WEIGHT_1': 0.7253271791873068, 'WEIGHT_2': 0.6325437502489588, 'WEIGHT_3': 0.7222642065423804, 'WEIGHT_4': 0.9053342546945091, 'WEIGHT_5': 0.5906550682190336, 'WEIGHT_6': 0.979605131861765, 'WEIGHT_7': 0.5902248876596263, 'WEIGHT_8': 0.8353091838866744, 'optimizer': 'Adam'}. Best is trial 221 with value: 0.418736930154747.
/userhome/cs2/dingruiw/conda/envs/py310/lib/python3.10/site-packages/torch/nn/modules/rnn.py:82: UserWarning: dropout option adds dropout after all but last recurrent layer, so non-zero dropout expects num_layers greater than 1, but got dropout=0.33695348210631737 and num_layers=1
  warnings.warn("dropout option adds dropout after all but last "
{'EMBEDDING_DIM': 733, 'HIDDEN_DIM': 393, 'NUM_LAYERS': 1, 'DROPOUT': 0.3765626485360575, 'LR': 0.0018475874442367675, 'WEIGHT_0': 0.43801075582163745, 'WEIGHT_1': 0.7253271791873068, 'WEIGHT_2': 0.6325437502489588, 'WEIGHT_3': 0.7222642065423804, 'WEIGHT_4': 0.9053342546945091, 'WEIGHT_5': 0.5906550682190336, 'WEIGHT_6': 0.979605131861765, 'WEIGHT_7': 0.5902248876596263, 'WEIGHT_8': 0.8353091838866744, 'optimizer': 'Adam'}
0
              precision    recall  f1-score   support

         LOC       0.05      0.11      0.07      1837
        MISC       0.02      0.03      0.02       922
         ORG       0.04      0.08      0.05      1341
         PER       0.02      0.03      0.02      1842

   micro avg       0.04      0.06      0.05      5942
   macro avg       0.03      0.06      0.04      5942
weighted avg       0.04      0.06      0.04      5942

{'EMBEDDING_DIM': 733, 'HIDDEN_DIM': 393, 'NUM_LAYERS': 1, 'DROPOUT': 0.3765626485360575, 'LR': 0.0018475874442367675, 'WEIGHT_0': 0.43801075582163745, 'WEIGHT_1': 0.7253271791873068, 'WEIGHT_2': 0.6325437502489588, 'WEIGHT_3': 0.7222642065423804, 'WEIGHT_4': 0.9053342546945091, 'WEIGHT_5': 0.5906550682190336, 'WEIGHT_6': 0.979605131861765, 'WEIGHT_7': 0.5902248876596263, 'WEIGHT_8': 0.8353091838866744, 'optimizer': 'Adam'}
49
              precision    recall  f1-score   support

         LOC       0.50      0.54      0.52      1837
        MISC       0.39      0.44      0.41       922
         ORG       0.27      0.27      0.27      1341
         PER       0.33      0.35      0.34      1842

   micro avg       0.38      0.40      0.39      5942
   macro avg       0.37      0.40      0.39      5942
weighted avg       0.38      0.40      0.39      5942

epoch 49
LSTM
  0%|          | 0/50 [00:00<?, ?it/s]  2%|▏         | 1/50 [00:04<03:51,  4.72s/it]  4%|▍         | 2/50 [00:04<01:38,  2.05s/it]  6%|▌         | 3/50 [00:05<00:59,  1.26s/it]  8%|▊         | 4/50 [00:05<00:40,  1.12it/s] 10%|█         | 5/50 [00:05<00:30,  1.46it/s] 12%|█▏        | 6/50 [00:06<00:24,  1.79it/s] 14%|█▍        | 7/50 [00:06<00:20,  2.08it/s] 16%|█▌        | 8/50 [00:06<00:18,  2.33it/s] 18%|█▊        | 9/50 [00:07<00:16,  2.53it/s] 20%|██        | 10/50 [00:07<00:14,  2.69it/s] 22%|██▏       | 11/50 [00:07<00:13,  2.82it/s] 24%|██▍       | 12/50 [00:08<00:13,  2.91it/s] 26%|██▌       | 13/50 [00:08<00:12,  2.98it/s] 28%|██▊       | 14/50 [00:08<00:11,  3.02it/s] 30%|███       | 15/50 [00:09<00:11,  3.06it/s] 32%|███▏      | 16/50 [00:09<00:11,  3.08it/s] 34%|███▍      | 17/50 [00:09<00:10,  3.09it/s] 36%|███▌      | 18/50 [00:10<00:10,  3.10it/s] 38%|███▊      | 19/50 [00:10<00:09,  3.11it/s] 40%|████      | 20/50 [00:10<00:09,  3.11it/s] 42%|████▏     | 21/50 [00:10<00:09,  3.12it/s] 44%|████▍     | 22/50 [00:11<00:08,  3.12it/s] 46%|████▌     | 23/50 [00:11<00:08,  3.12it/s] 48%|████▊     | 24/50 [00:11<00:08,  3.12it/s] 50%|█████     | 25/50 [00:12<00:08,  3.12it/s] 52%|█████▏    | 26/50 [00:12<00:07,  3.11it/s] 54%|█████▍    | 27/50 [00:12<00:07,  3.12it/s] 56%|█████▌    | 28/50 [00:13<00:07,  3.12it/s] 58%|█████▊    | 29/50 [00:13<00:06,  3.12it/s] 60%|██████    | 30/50 [00:13<00:06,  3.12it/s] 62%|██████▏   | 31/50 [00:14<00:06,  3.12it/s] 64%|██████▍   | 32/50 [00:14<00:05,  3.12it/s] 66%|██████▌   | 33/50 [00:14<00:05,  3.12it/s] 68%|██████▊   | 34/50 [00:15<00:05,  3.12it/s] 70%|███████   | 35/50 [00:15<00:04,  3.12it/s] 72%|███████▏  | 36/50 [00:15<00:04,  3.11it/s] 74%|███████▍  | 37/50 [00:16<00:04,  3.11it/s] 76%|███████▌  | 38/50 [00:16<00:03,  3.11it/s] 78%|███████▊  | 39/50 [00:16<00:03,  3.12it/s] 80%|████████  | 40/50 [00:17<00:03,  3.12it/s] 82%|████████▏ | 41/50 [00:17<00:02,  3.12it/s] 84%|████████▍ | 42/50 [00:17<00:02,  3.11it/s] 86%|████████▌ | 43/50 [00:18<00:02,  3.11it/s] 88%|████████▊ | 44/50 [00:18<00:01,  3.11it/s] 90%|█████████ | 45/50 [00:18<00:01,  3.11it/s] 92%|█████████▏| 46/50 [00:18<00:01,  3.11it/s] 94%|█████████▍| 47/50 [00:19<00:00,  3.11it/s] 96%|█████████▌| 48/50 [00:19<00:00,  3.11it/s] 98%|█████████▊| 49/50 [00:19<00:00,  3.11it/s]100%|██████████| 50/50 [00:24<00:00,  1.69s/it]100%|██████████| 50/50 [00:24<00:00,  2.01it/s]
[I 2023-12-11 00:05:53,002] Trial 336 finished with value: 0.36146179401993356 and parameters: {'EMBEDDING_DIM': 829, 'HIDDEN_DIM': 528, 'NUM_LAYERS': 1, 'DROPOUT': 0.33695348210631737, 'LR': 0.003664833521351148, 'WEIGHT_0': 0.3859880993304732, 'WEIGHT_1': 0.6728075587066932, 'WEIGHT_2': 0.6784375511092557, 'WEIGHT_3': 0.6459559642874471, 'WEIGHT_4': 0.8409649237594867, 'WEIGHT_5': 0.49669475609609975, 'WEIGHT_6': 0.5371716329372132, 'WEIGHT_7': 0.8914647218624955, 'WEIGHT_8': 0.7677200890373548, 'optimizer': 'RMSprop'}. Best is trial 221 with value: 0.418736930154747.
/userhome/cs2/dingruiw/conda/envs/py310/lib/python3.10/site-packages/torch/nn/modules/rnn.py:82: UserWarning: dropout option adds dropout after all but last recurrent layer, so non-zero dropout expects num_layers greater than 1, but got dropout=0.26334537628653115 and num_layers=1
  warnings.warn("dropout option adds dropout after all but last "
{'EMBEDDING_DIM': 829, 'HIDDEN_DIM': 528, 'NUM_LAYERS': 1, 'DROPOUT': 0.33695348210631737, 'LR': 0.003664833521351148, 'WEIGHT_0': 0.3859880993304732, 'WEIGHT_1': 0.6728075587066932, 'WEIGHT_2': 0.6784375511092557, 'WEIGHT_3': 0.6459559642874471, 'WEIGHT_4': 0.8409649237594867, 'WEIGHT_5': 0.49669475609609975, 'WEIGHT_6': 0.5371716329372132, 'WEIGHT_7': 0.8914647218624955, 'WEIGHT_8': 0.7677200890373548, 'optimizer': 'RMSprop'}
0
              precision    recall  f1-score   support

         LOC       0.06      0.03      0.04      1837
        MISC       0.02      0.01      0.01       922
         ORG       0.05      0.01      0.02      1341
         PER       0.01      0.01      0.01      1842

   micro avg       0.03      0.02      0.02      5942
   macro avg       0.03      0.02      0.02      5942
weighted avg       0.04      0.02      0.02      5942

{'EMBEDDING_DIM': 829, 'HIDDEN_DIM': 528, 'NUM_LAYERS': 1, 'DROPOUT': 0.33695348210631737, 'LR': 0.003664833521351148, 'WEIGHT_0': 0.3859880993304732, 'WEIGHT_1': 0.6728075587066932, 'WEIGHT_2': 0.6784375511092557, 'WEIGHT_3': 0.6459559642874471, 'WEIGHT_4': 0.8409649237594867, 'WEIGHT_5': 0.49669475609609975, 'WEIGHT_6': 0.5371716329372132, 'WEIGHT_7': 0.8914647218624955, 'WEIGHT_8': 0.7677200890373548, 'optimizer': 'RMSprop'}
49
              precision    recall  f1-score   support

         LOC       0.63      0.49      0.55      1837
        MISC       0.39      0.41      0.40       922
         ORG       0.23      0.24      0.24      1341
         PER       0.25      0.31      0.28      1842

   micro avg       0.36      0.37      0.36      5942
   macro avg       0.37      0.36      0.37      5942
weighted avg       0.38      0.37      0.37      5942

epoch 49
LSTM
  0%|          | 0/50 [00:00<?, ?it/s]  2%|▏         | 1/50 [00:04<03:47,  4.65s/it]  4%|▍         | 2/50 [00:04<01:36,  2.01s/it]  6%|▌         | 3/50 [00:05<00:58,  1.24s/it]  8%|▊         | 4/50 [00:05<00:40,  1.14it/s] 10%|█         | 5/50 [00:05<00:30,  1.49it/s] 12%|█▏        | 6/50 [00:06<00:24,  1.81it/s] 14%|█▍        | 7/50 [00:06<00:20,  2.11it/s] 16%|█▌        | 8/50 [00:06<00:17,  2.35it/s] 18%|█▊        | 9/50 [00:07<00:16,  2.55it/s] 20%|██        | 10/50 [00:07<00:14,  2.71it/s] 22%|██▏       | 11/50 [00:07<00:13,  2.84it/s] 24%|██▍       | 12/50 [00:07<00:12,  2.93it/s] 26%|██▌       | 13/50 [00:08<00:12,  2.99it/s] 28%|██▊       | 14/50 [00:08<00:11,  3.04it/s] 30%|███       | 15/50 [00:08<00:11,  3.07it/s] 32%|███▏      | 16/50 [00:09<00:10,  3.11it/s] 34%|███▍      | 17/50 [00:09<00:10,  3.11it/s] 36%|███▌      | 18/50 [00:09<00:10,  3.12it/s] 38%|███▊      | 19/50 [00:10<00:09,  3.14it/s] 40%|████      | 20/50 [00:10<00:09,  3.14it/s] 42%|████▏     | 21/50 [00:10<00:09,  3.13it/s] 44%|████▍     | 22/50 [00:11<00:08,  3.13it/s] 46%|████▌     | 23/50 [00:11<00:08,  3.13it/s] 48%|████▊     | 24/50 [00:11<00:08,  3.13it/s] 50%|█████     | 25/50 [00:12<00:07,  3.15it/s] 52%|█████▏    | 26/50 [00:12<00:07,  3.14it/s] 54%|█████▍    | 27/50 [00:12<00:07,  3.14it/s] 56%|█████▌    | 28/50 [00:13<00:07,  3.14it/s] 58%|█████▊    | 29/50 [00:13<00:06,  3.14it/s] 60%|██████    | 30/50 [00:13<00:06,  3.14it/s] 62%|██████▏   | 31/50 [00:14<00:06,  3.14it/s] 64%|██████▍   | 32/50 [00:14<00:05,  3.15it/s] 66%|██████▌   | 33/50 [00:14<00:05,  3.14it/s] 68%|██████▊   | 34/50 [00:14<00:05,  3.13it/s] 70%|███████   | 35/50 [00:15<00:04,  3.14it/s] 72%|███████▏  | 36/50 [00:15<00:04,  3.15it/s] 74%|███████▍  | 37/50 [00:15<00:04,  3.14it/s] 76%|███████▌  | 38/50 [00:16<00:03,  3.13it/s] 78%|███████▊  | 39/50 [00:16<00:03,  3.13it/s] 80%|████████  | 40/50 [00:16<00:03,  3.13it/s] 82%|████████▏ | 41/50 [00:17<00:02,  3.13it/s] 84%|████████▍ | 42/50 [00:17<00:02,  3.14it/s] 86%|████████▌ | 43/50 [00:17<00:02,  3.13it/s] 88%|████████▊ | 44/50 [00:18<00:01,  3.13it/s] 90%|█████████ | 45/50 [00:18<00:01,  3.13it/s] 92%|█████████▏| 46/50 [00:18<00:01,  3.14it/s] 94%|█████████▍| 47/50 [00:19<00:00,  3.15it/s] 96%|█████████▌| 48/50 [00:19<00:00,  3.13it/s] 98%|█████████▊| 49/50 [00:19<00:00,  3.13it/s]100%|██████████| 50/50 [00:24<00:00,  1.70s/it]100%|██████████| 50/50 [00:24<00:00,  2.03it/s]
