[I 2023-12-11 00:23:18,570] Trial 373 finished with value: 0.40435485242834057 and parameters: {'EMBEDDING_DIM': 955, 'HIDDEN_DIM': 293, 'NUM_LAYERS': 1, 'DROPOUT': 0.011631104666240039, 'LR': 0.0022914537206831734, 'WEIGHT_0': 0.2423865779669826, 'WEIGHT_1': 0.7009825446977979, 'WEIGHT_2': 0.47014350780118175, 'WEIGHT_3': 0.8815027596022172, 'WEIGHT_4': 0.7354474308502997, 'WEIGHT_5': 0.6454537296254865, 'WEIGHT_6': 0.6352556679356407, 'WEIGHT_7': 0.5164087460788093, 'WEIGHT_8': 0.8772713033848992, 'optimizer': 'RMSprop'}. Best is trial 365 with value: 0.41910947782240837.
/userhome/cs2/dingruiw/conda/envs/py310/lib/python3.10/site-packages/torch/nn/modules/rnn.py:82: UserWarning: dropout option adds dropout after all but last recurrent layer, so non-zero dropout expects num_layers greater than 1, but got dropout=0.02785322330996063 and num_layers=1
  warnings.warn("dropout option adds dropout after all but last "
{'EMBEDDING_DIM': 955, 'HIDDEN_DIM': 293, 'NUM_LAYERS': 1, 'DROPOUT': 0.011631104666240039, 'LR': 0.0022914537206831734, 'WEIGHT_0': 0.2423865779669826, 'WEIGHT_1': 0.7009825446977979, 'WEIGHT_2': 0.47014350780118175, 'WEIGHT_3': 0.8815027596022172, 'WEIGHT_4': 0.7354474308502997, 'WEIGHT_5': 0.6454537296254865, 'WEIGHT_6': 0.6352556679356407, 'WEIGHT_7': 0.5164087460788093, 'WEIGHT_8': 0.8772713033848992, 'optimizer': 'RMSprop'}
0
              precision    recall  f1-score   support

         LOC       0.34      0.21      0.26      1837
        MISC       0.07      0.02      0.03       922
         ORG       0.15      0.08      0.10      1341
         PER       0.07      0.03      0.04      1842

   micro avg       0.20      0.09      0.13      5942
   macro avg       0.16      0.08      0.11      5942
weighted avg       0.17      0.09      0.12      5942

{'EMBEDDING_DIM': 955, 'HIDDEN_DIM': 293, 'NUM_LAYERS': 1, 'DROPOUT': 0.011631104666240039, 'LR': 0.0022914537206831734, 'WEIGHT_0': 0.2423865779669826, 'WEIGHT_1': 0.7009825446977979, 'WEIGHT_2': 0.47014350780118175, 'WEIGHT_3': 0.8815027596022172, 'WEIGHT_4': 0.7354474308502997, 'WEIGHT_5': 0.6454537296254865, 'WEIGHT_6': 0.6352556679356407, 'WEIGHT_7': 0.5164087460788093, 'WEIGHT_8': 0.8772713033848992, 'optimizer': 'RMSprop'}
49
              precision    recall  f1-score   support

         LOC       0.57      0.54      0.55      1837
        MISC       0.44      0.43      0.44       922
         ORG       0.26      0.26      0.26      1341
         PER       0.35      0.35      0.35      1842

   micro avg       0.41      0.40      0.40      5942
   macro avg       0.40      0.39      0.40      5942
weighted avg       0.41      0.40      0.41      5942

epoch 49
LSTM
  0%|          | 0/50 [00:00<?, ?it/s]  2%|▏         | 1/50 [00:04<03:44,  4.59s/it]  6%|▌         | 3/50 [00:04<01:00,  1.29s/it]  8%|▊         | 4/50 [00:05<00:41,  1.11it/s] 10%|█         | 5/50 [00:05<00:29,  1.52it/s] 12%|█▏        | 6/50 [00:05<00:21,  2.00it/s] 14%|█▍        | 7/50 [00:05<00:16,  2.54it/s] 16%|█▌        | 8/50 [00:05<00:13,  3.10it/s] 18%|█▊        | 9/50 [00:05<00:11,  3.65it/s] 20%|██        | 10/50 [00:06<00:09,  4.16it/s] 22%|██▏       | 11/50 [00:06<00:08,  4.60it/s] 24%|██▍       | 12/50 [00:06<00:07,  4.97it/s] 26%|██▌       | 13/50 [00:06<00:07,  5.26it/s] 28%|██▊       | 14/50 [00:06<00:06,  5.48it/s] 30%|███       | 15/50 [00:06<00:06,  5.66it/s] 32%|███▏      | 16/50 [00:06<00:05,  5.79it/s] 34%|███▍      | 17/50 [00:07<00:05,  5.88it/s] 36%|███▌      | 18/50 [00:07<00:05,  5.94it/s] 38%|███▊      | 19/50 [00:07<00:05,  5.99it/s] 40%|████      | 20/50 [00:07<00:04,  6.02it/s] 42%|████▏     | 21/50 [00:07<00:04,  6.04it/s] 44%|████▍     | 22/50 [00:07<00:04,  6.06it/s] 46%|████▌     | 23/50 [00:08<00:04,  6.07it/s] 48%|████▊     | 24/50 [00:08<00:04,  6.08it/s] 50%|█████     | 25/50 [00:08<00:04,  6.09it/s] 52%|█████▏    | 26/50 [00:08<00:03,  6.09it/s] 54%|█████▍    | 27/50 [00:08<00:03,  6.09it/s] 56%|█████▌    | 28/50 [00:08<00:03,  6.10it/s] 58%|█████▊    | 29/50 [00:09<00:03,  6.09it/s] 60%|██████    | 30/50 [00:09<00:03,  6.10it/s] 62%|██████▏   | 31/50 [00:09<00:03,  6.10it/s] 64%|██████▍   | 32/50 [00:09<00:02,  6.11it/s] 66%|██████▌   | 33/50 [00:09<00:02,  6.09it/s] 68%|██████▊   | 34/50 [00:09<00:02,  6.10it/s] 70%|███████   | 35/50 [00:10<00:02,  6.08it/s] 72%|███████▏  | 36/50 [00:10<00:02,  6.10it/s] 74%|███████▍  | 37/50 [00:10<00:02,  6.08it/s] 76%|███████▌  | 38/50 [00:10<00:01,  6.10it/s] 78%|███████▊  | 39/50 [00:10<00:01,  6.08it/s] 80%|████████  | 40/50 [00:10<00:01,  6.10it/s] 82%|████████▏ | 41/50 [00:11<00:01,  6.08it/s] 84%|████████▍ | 42/50 [00:11<00:01,  6.09it/s] 86%|████████▌ | 43/50 [00:11<00:01,  6.07it/s] 88%|████████▊ | 44/50 [00:11<00:00,  6.07it/s] 90%|█████████ | 45/50 [00:11<00:00,  6.08it/s] 92%|█████████▏| 46/50 [00:11<00:00,  6.07it/s] 94%|█████████▍| 47/50 [00:12<00:00,  6.08it/s] 96%|█████████▌| 48/50 [00:12<00:00,  6.08it/s] 98%|█████████▊| 49/50 [00:12<00:00,  6.07it/s]100%|██████████| 50/50 [00:16<00:00,  1.48s/it]100%|██████████| 50/50 [00:16<00:00,  2.95it/s]
[I 2023-12-11 00:23:39,725] Trial 374 finished with value: 0.41118530884808013 and parameters: {'EMBEDDING_DIM': 972, 'HIDDEN_DIM': 251, 'NUM_LAYERS': 1, 'DROPOUT': 0.02785322330996063, 'LR': 0.0019727438902641587, 'WEIGHT_0': 0.20726897280991916, 'WEIGHT_1': 0.7191920701144026, 'WEIGHT_2': 0.4047784125515875, 'WEIGHT_3': 0.904471997565204, 'WEIGHT_4': 0.7471209618868371, 'WEIGHT_5': 0.697212094787125, 'WEIGHT_6': 0.6507377019012306, 'WEIGHT_7': 0.503614963505069, 'WEIGHT_8': 0.8715096217360698, 'optimizer': 'RMSprop'}. Best is trial 365 with value: 0.41910947782240837.
/userhome/cs2/dingruiw/conda/envs/py310/lib/python3.10/site-packages/torch/nn/modules/rnn.py:82: UserWarning: dropout option adds dropout after all but last recurrent layer, so non-zero dropout expects num_layers greater than 1, but got dropout=0.02398877572702895 and num_layers=1
  warnings.warn("dropout option adds dropout after all but last "
{'EMBEDDING_DIM': 972, 'HIDDEN_DIM': 251, 'NUM_LAYERS': 1, 'DROPOUT': 0.02785322330996063, 'LR': 0.0019727438902641587, 'WEIGHT_0': 0.20726897280991916, 'WEIGHT_1': 0.7191920701144026, 'WEIGHT_2': 0.4047784125515875, 'WEIGHT_3': 0.904471997565204, 'WEIGHT_4': 0.7471209618868371, 'WEIGHT_5': 0.697212094787125, 'WEIGHT_6': 0.6507377019012306, 'WEIGHT_7': 0.503614963505069, 'WEIGHT_8': 0.8715096217360698, 'optimizer': 'RMSprop'}
0
              precision    recall  f1-score   support

         LOC       0.29      0.28      0.28      1837
        MISC       0.09      0.04      0.06       922
         ORG       0.16      0.10      0.13      1341
         PER       0.05      0.08      0.06      1842

   micro avg       0.14      0.14      0.14      5942
   macro avg       0.15      0.13      0.13      5942
weighted avg       0.15      0.14      0.14      5942

{'EMBEDDING_DIM': 972, 'HIDDEN_DIM': 251, 'NUM_LAYERS': 1, 'DROPOUT': 0.02785322330996063, 'LR': 0.0019727438902641587, 'WEIGHT_0': 0.20726897280991916, 'WEIGHT_1': 0.7191920701144026, 'WEIGHT_2': 0.4047784125515875, 'WEIGHT_3': 0.904471997565204, 'WEIGHT_4': 0.7471209618868371, 'WEIGHT_5': 0.697212094787125, 'WEIGHT_6': 0.6507377019012306, 'WEIGHT_7': 0.503614963505069, 'WEIGHT_8': 0.8715096217360698, 'optimizer': 'RMSprop'}
49
              precision    recall  f1-score   support

         LOC       0.55      0.56      0.55      1837
        MISC       0.46      0.46      0.46       922
         ORG       0.29      0.28      0.29      1341
         PER       0.32      0.34      0.33      1842

   micro avg       0.41      0.41      0.41      5942
   macro avg       0.41      0.41      0.41      5942
weighted avg       0.41      0.41      0.41      5942

epoch 49
LSTM
  0%|          | 0/50 [00:00<?, ?it/s]  2%|▏         | 1/50 [00:04<03:46,  4.62s/it]  6%|▌         | 3/50 [00:04<01:01,  1.30s/it]  8%|▊         | 4/50 [00:05<00:41,  1.10it/s] 10%|█         | 5/50 [00:05<00:29,  1.51it/s] 12%|█▏        | 6/50 [00:05<00:22,  1.98it/s] 14%|█▍        | 7/50 [00:05<00:17,  2.51it/s] 16%|█▌        | 8/50 [00:05<00:13,  3.05it/s] 18%|█▊        | 9/50 [00:05<00:11,  3.59it/s] 20%|██        | 10/50 [00:06<00:09,  4.08it/s] 22%|██▏       | 11/50 [00:06<00:08,  4.51it/s] 24%|██▍       | 12/50 [00:06<00:07,  4.86it/s] 26%|██▌       | 13/50 [00:06<00:07,  5.14it/s] 28%|██▊       | 14/50 [00:06<00:06,  5.36it/s] 30%|███       | 15/50 [00:06<00:06,  5.52it/s] 32%|███▏      | 16/50 [00:07<00:06,  5.64it/s] 34%|███▍      | 17/50 [00:07<00:05,  5.73it/s] 36%|███▌      | 18/50 [00:07<00:05,  5.79it/s] 38%|███▊      | 19/50 [00:07<00:05,  5.82it/s] 40%|████      | 20/50 [00:07<00:05,  5.87it/s] 42%|████▏     | 21/50 [00:07<00:04,  5.89it/s] 44%|████▍     | 22/50 [00:08<00:04,  5.90it/s] 46%|████▌     | 23/50 [00:08<00:04,  5.91it/s] 48%|████▊     | 24/50 [00:08<00:04,  5.92it/s] 50%|█████     | 25/50 [00:08<00:04,  5.92it/s] 52%|█████▏    | 26/50 [00:08<00:04,  5.93it/s] 54%|█████▍    | 27/50 [00:08<00:03,  5.93it/s] 56%|█████▌    | 28/50 [00:09<00:03,  5.93it/s] 58%|█████▊    | 29/50 [00:09<00:03,  5.94it/s] 60%|██████    | 30/50 [00:09<00:03,  5.94it/s] 62%|██████▏   | 31/50 [00:09<00:03,  5.94it/s] 64%|██████▍   | 32/50 [00:09<00:03,  5.94it/s] 66%|██████▌   | 33/50 [00:09<00:02,  5.94it/s] 68%|██████▊   | 34/50 [00:10<00:02,  5.93it/s] 70%|███████   | 35/50 [00:10<00:02,  5.94it/s] 72%|███████▏  | 36/50 [00:10<00:02,  5.94it/s] 74%|███████▍  | 37/50 [00:10<00:02,  5.93it/s] 76%|███████▌  | 38/50 [00:10<00:02,  5.93it/s] 78%|███████▊  | 39/50 [00:10<00:01,  5.94it/s] 80%|████████  | 40/50 [00:11<00:01,  5.93it/s] 82%|████████▏ | 41/50 [00:11<00:01,  5.93it/s] 84%|████████▍ | 42/50 [00:11<00:01,  5.92it/s] 86%|████████▌ | 43/50 [00:11<00:01,  5.92it/s] 88%|████████▊ | 44/50 [00:11<00:01,  5.92it/s] 90%|█████████ | 45/50 [00:11<00:00,  5.92it/s] 92%|█████████▏| 46/50 [00:12<00:00,  5.92it/s] 94%|█████████▍| 47/50 [00:12<00:00,  5.92it/s] 96%|█████████▌| 48/50 [00:12<00:00,  5.92it/s] 98%|█████████▊| 49/50 [00:12<00:00,  5.91it/s]100%|██████████| 50/50 [00:17<00:00,  1.50s/it]100%|██████████| 50/50 [00:17<00:00,  2.90it/s]
[I 2023-12-11 00:24:01,199] Trial 375 finished with value: 0.4051399574398428 and parameters: {'EMBEDDING_DIM': 969, 'HIDDEN_DIM': 248, 'NUM_LAYERS': 1, 'DROPOUT': 0.02398877572702895, 'LR': 0.0019610064253282023, 'WEIGHT_0': 0.21464237134954448, 'WEIGHT_1': 0.6983700651387379, 'WEIGHT_2': 0.43985722472964894, 'WEIGHT_3': 0.9011263977695041, 'WEIGHT_4': 0.737026693739016, 'WEIGHT_5': 0.6745827083063843, 'WEIGHT_6': 0.6519069563549938, 'WEIGHT_7': 0.5040835629720863, 'WEIGHT_8': 0.8712024345114973, 'optimizer': 'RMSprop'}. Best is trial 365 with value: 0.41910947782240837.
/userhome/cs2/dingruiw/conda/envs/py310/lib/python3.10/site-packages/torch/nn/modules/rnn.py:82: UserWarning: dropout option adds dropout after all but last recurrent layer, so non-zero dropout expects num_layers greater than 1, but got dropout=0.033002617612094484 and num_layers=1
  warnings.warn("dropout option adds dropout after all but last "
{'EMBEDDING_DIM': 969, 'HIDDEN_DIM': 248, 'NUM_LAYERS': 1, 'DROPOUT': 0.02398877572702895, 'LR': 0.0019610064253282023, 'WEIGHT_0': 0.21464237134954448, 'WEIGHT_1': 0.6983700651387379, 'WEIGHT_2': 0.43985722472964894, 'WEIGHT_3': 0.9011263977695041, 'WEIGHT_4': 0.737026693739016, 'WEIGHT_5': 0.6745827083063843, 'WEIGHT_6': 0.6519069563549938, 'WEIGHT_7': 0.5040835629720863, 'WEIGHT_8': 0.8712024345114973, 'optimizer': 'RMSprop'}
0
              precision    recall  f1-score   support

         LOC       0.31      0.19      0.24      1837
        MISC       0.10      0.03      0.04       922
         ORG       0.16      0.04      0.07      1341
         PER       0.09      0.04      0.06      1842

   micro avg       0.20      0.09      0.12      5942
   macro avg       0.17      0.08      0.10      5942
weighted avg       0.18      0.09      0.11      5942

{'EMBEDDING_DIM': 969, 'HIDDEN_DIM': 248, 'NUM_LAYERS': 1, 'DROPOUT': 0.02398877572702895, 'LR': 0.0019610064253282023, 'WEIGHT_0': 0.21464237134954448, 'WEIGHT_1': 0.6983700651387379, 'WEIGHT_2': 0.43985722472964894, 'WEIGHT_3': 0.9011263977695041, 'WEIGHT_4': 0.737026693739016, 'WEIGHT_5': 0.6745827083063843, 'WEIGHT_6': 0.6519069563549938, 'WEIGHT_7': 0.5040835629720863, 'WEIGHT_8': 0.8712024345114973, 'optimizer': 'RMSprop'}
49
              precision    recall  f1-score   support

         LOC       0.53      0.54      0.54      1837
        MISC       0.43      0.46      0.44       922
         ORG       0.27      0.27      0.27      1341
         PER       0.33      0.38      0.35      1842

   micro avg       0.39      0.42      0.41      5942
   macro avg       0.39      0.41      0.40      5942
weighted avg       0.40      0.42      0.41      5942

epoch 49
LSTM
  0%|          | 0/50 [00:00<?, ?it/s]  2%|▏         | 1/50 [00:04<03:49,  4.69s/it]  4%|▍         | 2/50 [00:04<01:35,  2.00s/it]  6%|▌         | 3/50 [00:05<00:55,  1.19s/it]  8%|▊         | 4/50 [00:05<00:36,  1.25it/s] 10%|█         | 5/50 [00:05<00:26,  1.71it/s] 12%|█▏        | 6/50 [00:05<00:20,  2.18it/s] 14%|█▍        | 7/50 [00:05<00:16,  2.66it/s] 16%|█▌        | 8/50 [00:06<00:13,  3.10it/s] 18%|█▊        | 9/50 [00:06<00:11,  3.49it/s] 20%|██        | 10/50 [00:06<00:10,  3.81it/s] 22%|██▏       | 11/50 [00:06<00:09,  4.07it/s] 24%|██▍       | 12/50 [00:06<00:08,  4.27it/s] 26%|██▌       | 13/50 [00:07<00:08,  4.42it/s] 28%|██▊       | 14/50 [00:07<00:07,  4.52it/s] 30%|███       | 15/50 [00:07<00:07,  4.61it/s] 32%|███▏      | 16/50 [00:07<00:07,  4.67it/s] 34%|███▍      | 17/50 [00:07<00:07,  4.71it/s] 36%|███▌      | 18/50 [00:08<00:06,  4.74it/s] 38%|███▊      | 19/50 [00:08<00:06,  4.76it/s] 40%|████      | 20/50 [00:08<00:06,  4.77it/s] 42%|████▏     | 21/50 [00:08<00:06,  4.78it/s] 44%|████▍     | 22/50 [00:08<00:05,  4.79it/s] 46%|████▌     | 23/50 [00:09<00:05,  4.80it/s] 48%|████▊     | 24/50 [00:09<00:05,  4.80it/s] 50%|█████     | 25/50 [00:09<00:05,  4.80it/s] 52%|█████▏    | 26/50 [00:09<00:05,  4.80it/s] 54%|█████▍    | 27/50 [00:10<00:04,  4.81it/s] 56%|█████▌    | 28/50 [00:10<00:04,  4.81it/s] 58%|█████▊    | 29/50 [00:10<00:04,  4.80it/s] 60%|██████    | 30/50 [00:10<00:04,  4.81it/s] 62%|██████▏   | 31/50 [00:10<00:03,  4.81it/s] 64%|██████▍   | 32/50 [00:11<00:03,  4.80it/s] 66%|██████▌   | 33/50 [00:11<00:03,  4.79it/s] 68%|██████▊   | 34/50 [00:11<00:03,  4.80it/s] 70%|███████   | 35/50 [00:11<00:03,  4.80it/s] 72%|███████▏  | 36/50 [00:11<00:02,  4.80it/s] 74%|███████▍  | 37/50 [00:12<00:02,  4.79it/s] 76%|███████▌  | 38/50 [00:12<00:02,  4.80it/s] 78%|███████▊  | 39/50 [00:12<00:02,  4.80it/s] 80%|████████  | 40/50 [00:12<00:02,  4.79it/s] 82%|████████▏ | 41/50 [00:12<00:01,  4.79it/s] 84%|████████▍ | 42/50 [00:13<00:01,  4.79it/s] 86%|████████▌ | 43/50 [00:13<00:01,  4.78it/s] 88%|████████▊ | 44/50 [00:13<00:01,  4.79it/s] 90%|█████████ | 45/50 [00:13<00:01,  4.79it/s] 92%|█████████▏| 46/50 [00:13<00:00,  4.78it/s] 94%|█████████▍| 47/50 [00:14<00:00,  4.78it/s] 96%|█████████▌| 48/50 [00:14<00:00,  4.79it/s] 98%|█████████▊| 49/50 [00:14<00:00,  4.79it/s]100%|██████████| 50/50 [00:19<00:00,  1.59s/it]100%|██████████| 50/50 [00:19<00:00,  2.57it/s]
[I 2023-12-11 00:24:24,820] Trial 376 finished with value: 0.402555910543131 and parameters: {'EMBEDDING_DIM': 978, 'HIDDEN_DIM': 307, 'NUM_LAYERS': 1, 'DROPOUT': 0.033002617612094484, 'LR': 0.0020118260402823144, 'WEIGHT_0': 0.24867047520149682, 'WEIGHT_1': 0.6650094499656531, 'WEIGHT_2': 0.40409967788611917, 'WEIGHT_3': 0.9098495748477914, 'WEIGHT_4': 0.7381690638803337, 'WEIGHT_5': 0.6827919016492098, 'WEIGHT_6': 0.49282133934966227, 'WEIGHT_7': 0.4913948423393913, 'WEIGHT_8': 0.8622011102334164, 'optimizer': 'RMSprop'}. Best is trial 365 with value: 0.41910947782240837.
/userhome/cs2/dingruiw/conda/envs/py310/lib/python3.10/site-packages/torch/nn/modules/rnn.py:82: UserWarning: dropout option adds dropout after all but last recurrent layer, so non-zero dropout expects num_layers greater than 1, but got dropout=0.026455404900169958 and num_layers=1
  warnings.warn("dropout option adds dropout after all but last "
{'EMBEDDING_DIM': 978, 'HIDDEN_DIM': 307, 'NUM_LAYERS': 1, 'DROPOUT': 0.033002617612094484, 'LR': 0.0020118260402823144, 'WEIGHT_0': 0.24867047520149682, 'WEIGHT_1': 0.6650094499656531, 'WEIGHT_2': 0.40409967788611917, 'WEIGHT_3': 0.9098495748477914, 'WEIGHT_4': 0.7381690638803337, 'WEIGHT_5': 0.6827919016492098, 'WEIGHT_6': 0.49282133934966227, 'WEIGHT_7': 0.4913948423393913, 'WEIGHT_8': 0.8622011102334164, 'optimizer': 'RMSprop'}
0
              precision    recall  f1-score   support

         LOC       0.25      0.30      0.27      1837
        MISC       0.08      0.02      0.03       922
         ORG       0.08      0.02      0.04      1341
         PER       0.07      0.05      0.06      1842

   micro avg       0.17      0.12      0.14      5942
   macro avg       0.12      0.10      0.10      5942
weighted avg       0.13      0.12      0.12      5942

{'EMBEDDING_DIM': 978, 'HIDDEN_DIM': 307, 'NUM_LAYERS': 1, 'DROPOUT': 0.033002617612094484, 'LR': 0.0020118260402823144, 'WEIGHT_0': 0.24867047520149682, 'WEIGHT_1': 0.6650094499656531, 'WEIGHT_2': 0.40409967788611917, 'WEIGHT_3': 0.9098495748477914, 'WEIGHT_4': 0.7381690638803337, 'WEIGHT_5': 0.6827919016492098, 'WEIGHT_6': 0.49282133934966227, 'WEIGHT_7': 0.4913948423393913, 'WEIGHT_8': 0.8622011102334164, 'optimizer': 'RMSprop'}
49
              precision    recall  f1-score   support

         LOC       0.55      0.55      0.55      1837
        MISC       0.41      0.43      0.42       922
         ORG       0.29      0.28      0.28      1341
         PER       0.33      0.34      0.33      1842

   micro avg       0.40      0.40      0.40      5942
   macro avg       0.40      0.40      0.40      5942
weighted avg       0.40      0.40      0.40      5942

epoch 49
LSTM
  0%|          | 0/50 [00:00<?, ?it/s]  2%|▏         | 1/50 [00:04<03:23,  4.15s/it]  4%|▍         | 2/50 [00:04<01:24,  1.77s/it]  6%|▌         | 3/50 [00:04<00:49,  1.05s/it]  8%|▊         | 4/50 [00:04<00:32,  1.42it/s] 10%|█         | 5/50 [00:04<00:23,  1.94it/s] 12%|█▏        | 6/50 [00:04<00:17,  2.48it/s] 14%|█▍        | 7/50 [00:05<00:14,  3.02it/s] 16%|█▌        | 8/50 [00:05<00:11,  3.53it/s] 18%|█▊        | 9/50 [00:05<00:10,  3.97it/s] 20%|██        | 10/50 [00:05<00:09,  4.34it/s] 22%|██▏       | 11/50 [00:05<00:08,  4.64it/s] 24%|██▍       | 12/50 [00:06<00:07,  4.87it/s] 26%|██▌       | 13/50 [00:06<00:07,  5.04it/s] 28%|██▊       | 14/50 [00:06<00:06,  5.17it/s] 30%|███       | 15/50 [00:06<00:06,  5.26it/s] 32%|███▏      | 16/50 [00:06<00:06,  5.32it/s] 34%|███▍      | 17/50 [00:06<00:06,  5.37it/s] 36%|███▌      | 18/50 [00:07<00:05,  5.41it/s] 38%|███▊      | 19/50 [00:07<00:05,  5.43it/s] 40%|████      | 20/50 [00:07<00:05,  5.45it/s] 42%|████▏     | 21/50 [00:07<00:05,  5.46it/s] 44%|████▍     | 22/50 [00:07<00:05,  5.47it/s] 46%|████▌     | 23/50 [00:08<00:04,  5.47it/s] 48%|████▊     | 24/50 [00:08<00:04,  5.48it/s] 50%|█████     | 25/50 [00:08<00:04,  5.48it/s] 52%|█████▏    | 26/50 [00:08<00:04,  5.48it/s] 54%|█████▍    | 27/50 [00:08<00:04,  5.48it/s] 56%|█████▌    | 28/50 [00:08<00:04,  5.48it/s] 58%|█████▊    | 29/50 [00:09<00:03,  5.48it/s] 60%|██████    | 30/50 [00:09<00:03,  5.48it/s] 62%|██████▏   | 31/50 [00:09<00:03,  5.48it/s] 64%|██████▍   | 32/50 [00:09<00:03,  5.48it/s] 66%|██████▌   | 33/50 [00:09<00:03,  5.48it/s] 68%|██████▊   | 34/50 [00:10<00:02,  5.48it/s] 70%|███████   | 35/50 [00:10<00:02,  5.48it/s] 72%|███████▏  | 36/50 [00:10<00:02,  5.49it/s] 74%|███████▍  | 37/50 [00:10<00:02,  5.48it/s] 76%|███████▌  | 38/50 [00:10<00:02,  5.48it/s] 78%|███████▊  | 39/50 [00:11<00:02,  5.48it/s] 80%|████████  | 40/50 [00:11<00:01,  5.48it/s] 82%|████████▏ | 41/50 [00:11<00:01,  5.49it/s] 84%|████████▍ | 42/50 [00:11<00:01,  5.48it/s] 86%|████████▌ | 43/50 [00:11<00:01,  5.49it/s] 88%|████████▊ | 44/50 [00:11<00:01,  5.49it/s] 90%|█████████ | 45/50 [00:12<00:00,  5.49it/s] 92%|█████████▏| 46/50 [00:12<00:00,  5.49it/s] 94%|█████████▍| 47/50 [00:12<00:00,  5.48it/s] 96%|█████████▌| 48/50 [00:12<00:00,  5.48it/s] 98%|█████████▊| 49/50 [00:12<00:00,  5.48it/s]100%|██████████| 50/50 [00:17<00:00,  1.39s/it]100%|██████████| 50/50 [00:17<00:00,  2.93it/s]
