[I 2023-12-10 23:54:30,510] Trial 309 finished with value: 0.2113707708405999 and parameters: {'EMBEDDING_DIM': 873, 'HIDDEN_DIM': 241, 'NUM_LAYERS': 1, 'DROPOUT': 0.37118983193034794, 'LR': 0.000493672016279976, 'WEIGHT_0': 0.6369044010222177, 'WEIGHT_1': 0.4753630450071945, 'WEIGHT_2': 0.5184288157860322, 'WEIGHT_3': 0.5164912148280684, 'WEIGHT_4': 0.7563162902145822, 'WEIGHT_5': 0.5451942020695036, 'WEIGHT_6': 0.8782812074342415, 'WEIGHT_7': 0.322860810181357, 'WEIGHT_8': 0.7527095328547914, 'optimizer': 'Adam'}. Best is trial 221 with value: 0.418736930154747.
/userhome/cs2/dingruiw/conda/envs/py310/lib/python3.10/site-packages/torch/nn/modules/rnn.py:82: UserWarning: dropout option adds dropout after all but last recurrent layer, so non-zero dropout expects num_layers greater than 1, but got dropout=0.27404056337007615 and num_layers=1
  warnings.warn("dropout option adds dropout after all but last "
{'EMBEDDING_DIM': 873, 'HIDDEN_DIM': 241, 'NUM_LAYERS': 1, 'DROPOUT': 0.37118983193034794, 'LR': 0.000493672016279976, 'WEIGHT_0': 0.6369044010222177, 'WEIGHT_1': 0.4753630450071945, 'WEIGHT_2': 0.5184288157860322, 'WEIGHT_3': 0.5164912148280684, 'WEIGHT_4': 0.7563162902145822, 'WEIGHT_5': 0.5451942020695036, 'WEIGHT_6': 0.8782812074342415, 'WEIGHT_7': 0.322860810181357, 'WEIGHT_8': 0.7527095328547914, 'optimizer': 'Adam'}
0
              precision    recall  f1-score   support

         LOC       0.03      0.14      0.06      1837
        MISC       0.02      0.22      0.03       922
         ORG       0.01      0.08      0.02      1341
         PER       0.01      0.03      0.02      1842

   micro avg       0.02      0.11      0.03      5942
   macro avg       0.02      0.12      0.03      5942
weighted avg       0.02      0.11      0.03      5942

{'EMBEDDING_DIM': 873, 'HIDDEN_DIM': 241, 'NUM_LAYERS': 1, 'DROPOUT': 0.37118983193034794, 'LR': 0.000493672016279976, 'WEIGHT_0': 0.6369044010222177, 'WEIGHT_1': 0.4753630450071945, 'WEIGHT_2': 0.5184288157860322, 'WEIGHT_3': 0.5164912148280684, 'WEIGHT_4': 0.7563162902145822, 'WEIGHT_5': 0.5451942020695036, 'WEIGHT_6': 0.8782812074342415, 'WEIGHT_7': 0.322860810181357, 'WEIGHT_8': 0.7527095328547914, 'optimizer': 'Adam'}
49
              precision    recall  f1-score   support

         LOC       0.56      0.33      0.41      1837
        MISC       0.19      0.07      0.11       922
         ORG       0.18      0.04      0.06      1341
         PER       0.20      0.10      0.14      1842

   micro avg       0.34      0.15      0.21      5942
   macro avg       0.28      0.14      0.18      5942
weighted avg       0.31      0.15      0.20      5942

epoch 49
LSTM
  0%|          | 0/50 [00:00<?, ?it/s]  2%|▏         | 1/50 [00:03<03:15,  3.98s/it]  4%|▍         | 2/50 [00:04<01:22,  1.72s/it]  6%|▌         | 3/50 [00:04<00:49,  1.05s/it]  8%|▊         | 4/50 [00:04<00:33,  1.37it/s] 10%|█         | 5/50 [00:04<00:24,  1.81it/s] 12%|█▏        | 6/50 [00:05<00:19,  2.24it/s] 14%|█▍        | 7/50 [00:05<00:16,  2.64it/s] 16%|█▌        | 8/50 [00:05<00:14,  2.99it/s] 18%|█▊        | 9/50 [00:05<00:12,  3.28it/s] 20%|██        | 10/50 [00:06<00:11,  3.51it/s] 22%|██▏       | 11/50 [00:06<00:10,  3.69it/s] 24%|██▍       | 12/50 [00:06<00:09,  3.82it/s] 26%|██▌       | 13/50 [00:06<00:09,  3.92it/s] 28%|██▊       | 14/50 [00:07<00:09,  4.00it/s] 30%|███       | 15/50 [00:07<00:08,  4.05it/s] 32%|███▏      | 16/50 [00:07<00:08,  4.08it/s] 34%|███▍      | 17/50 [00:07<00:08,  4.11it/s] 36%|███▌      | 18/50 [00:07<00:07,  4.13it/s] 38%|███▊      | 19/50 [00:08<00:07,  4.14it/s] 40%|████      | 20/50 [00:08<00:07,  4.15it/s] 42%|████▏     | 21/50 [00:08<00:06,  4.16it/s] 44%|████▍     | 22/50 [00:08<00:06,  4.16it/s] 46%|████▌     | 23/50 [00:09<00:06,  4.17it/s] 48%|████▊     | 24/50 [00:09<00:06,  4.17it/s] 50%|█████     | 25/50 [00:09<00:05,  4.17it/s] 52%|█████▏    | 26/50 [00:09<00:05,  4.16it/s] 54%|█████▍    | 27/50 [00:10<00:05,  4.16it/s] 56%|█████▌    | 28/50 [00:10<00:05,  4.17it/s] 58%|█████▊    | 29/50 [00:10<00:05,  4.16it/s] 60%|██████    | 30/50 [00:10<00:04,  4.16it/s] 62%|██████▏   | 31/50 [00:11<00:04,  4.17it/s] 64%|██████▍   | 32/50 [00:11<00:04,  4.16it/s] 66%|██████▌   | 33/50 [00:11<00:04,  4.17it/s] 68%|██████▊   | 34/50 [00:11<00:03,  4.16it/s] 70%|███████   | 35/50 [00:12<00:03,  4.16it/s] 72%|███████▏  | 36/50 [00:12<00:03,  4.16it/s] 74%|███████▍  | 37/50 [00:12<00:03,  4.16it/s] 76%|███████▌  | 38/50 [00:12<00:02,  4.16it/s] 78%|███████▊  | 39/50 [00:13<00:02,  4.16it/s] 80%|████████  | 40/50 [00:13<00:02,  4.16it/s] 82%|████████▏ | 41/50 [00:13<00:02,  4.16it/s] 84%|████████▍ | 42/50 [00:13<00:01,  4.16it/s] 86%|████████▌ | 43/50 [00:13<00:01,  4.16it/s] 88%|████████▊ | 44/50 [00:14<00:01,  4.16it/s] 90%|█████████ | 45/50 [00:14<00:01,  4.16it/s] 92%|█████████▏| 46/50 [00:14<00:00,  4.16it/s] 94%|█████████▍| 47/50 [00:14<00:00,  4.16it/s] 96%|█████████▌| 48/50 [00:15<00:00,  4.16it/s] 98%|█████████▊| 49/50 [00:15<00:00,  4.16it/s]100%|██████████| 50/50 [00:19<00:00,  1.43s/it]100%|██████████| 50/50 [00:19<00:00,  2.55it/s]
[I 2023-12-10 23:54:53,765] Trial 310 finished with value: 0.3830444482581088 and parameters: {'EMBEDDING_DIM': 1024, 'HIDDEN_DIM': 174, 'NUM_LAYERS': 1, 'DROPOUT': 0.27404056337007615, 'LR': 0.0015858683022349303, 'WEIGHT_0': 0.3752705886593674, 'WEIGHT_1': 0.7576490608863112, 'WEIGHT_2': 0.20925472520714378, 'WEIGHT_3': 0.03329454327046366, 'WEIGHT_4': 0.8376588825839376, 'WEIGHT_5': 0.4811536279134543, 'WEIGHT_6': 0.7535858702053381, 'WEIGHT_7': 0.6707740842346478, 'WEIGHT_8': 0.47656880400763135, 'optimizer': 'RMSprop'}. Best is trial 221 with value: 0.418736930154747.
/userhome/cs2/dingruiw/conda/envs/py310/lib/python3.10/site-packages/torch/nn/modules/rnn.py:82: UserWarning: dropout option adds dropout after all but last recurrent layer, so non-zero dropout expects num_layers greater than 1, but got dropout=0.34474676900094 and num_layers=1
  warnings.warn("dropout option adds dropout after all but last "
{'EMBEDDING_DIM': 1024, 'HIDDEN_DIM': 174, 'NUM_LAYERS': 1, 'DROPOUT': 0.27404056337007615, 'LR': 0.0015858683022349303, 'WEIGHT_0': 0.3752705886593674, 'WEIGHT_1': 0.7576490608863112, 'WEIGHT_2': 0.20925472520714378, 'WEIGHT_3': 0.03329454327046366, 'WEIGHT_4': 0.8376588825839376, 'WEIGHT_5': 0.4811536279134543, 'WEIGHT_6': 0.7535858702053381, 'WEIGHT_7': 0.6707740842346478, 'WEIGHT_8': 0.47656880400763135, 'optimizer': 'RMSprop'}
0
              precision    recall  f1-score   support

         LOC       0.24      0.04      0.07      1837
        MISC       0.04      0.03      0.04       922
         ORG       0.12      0.02      0.04      1341
         PER       0.09      0.02      0.04      1842

   micro avg       0.10      0.03      0.05      5942
   macro avg       0.12      0.03      0.05      5942
weighted avg       0.14      0.03      0.05      5942

{'EMBEDDING_DIM': 1024, 'HIDDEN_DIM': 174, 'NUM_LAYERS': 1, 'DROPOUT': 0.27404056337007615, 'LR': 0.0015858683022349303, 'WEIGHT_0': 0.3752705886593674, 'WEIGHT_1': 0.7576490608863112, 'WEIGHT_2': 0.20925472520714378, 'WEIGHT_3': 0.03329454327046366, 'WEIGHT_4': 0.8376588825839376, 'WEIGHT_5': 0.4811536279134543, 'WEIGHT_6': 0.7535858702053381, 'WEIGHT_7': 0.6707740842346478, 'WEIGHT_8': 0.47656880400763135, 'optimizer': 'RMSprop'}
49
              precision    recall  f1-score   support

         LOC       0.53      0.53      0.53      1837
        MISC       0.46      0.44      0.45       922
         ORG       0.25      0.28      0.26      1341
         PER       0.31      0.26      0.28      1842

   micro avg       0.39      0.38      0.38      5942
   macro avg       0.39      0.38      0.38      5942
weighted avg       0.39      0.38      0.38      5942

epoch 49
LSTM
  0%|          | 0/50 [00:00<?, ?it/s]  2%|▏         | 1/50 [00:04<03:44,  4.58s/it]  4%|▍         | 2/50 [00:04<01:34,  1.97s/it]  6%|▌         | 3/50 [00:04<00:55,  1.19s/it]  8%|▊         | 4/50 [00:05<00:37,  1.22it/s] 10%|█         | 5/50 [00:05<00:27,  1.62it/s] 12%|█▏        | 6/50 [00:05<00:21,  2.01it/s] 14%|█▍        | 7/50 [00:06<00:18,  2.38it/s] 16%|█▌        | 8/50 [00:06<00:15,  2.71it/s] 18%|█▊        | 9/50 [00:06<00:13,  2.99it/s] 20%|██        | 10/50 [00:06<00:12,  3.21it/s] 22%|██▏       | 11/50 [00:07<00:11,  3.38it/s] 24%|██▍       | 12/50 [00:07<00:10,  3.51it/s] 26%|██▌       | 13/50 [00:07<00:10,  3.61it/s] 28%|██▊       | 14/50 [00:07<00:09,  3.68it/s] 30%|███       | 15/50 [00:08<00:09,  3.73it/s] 32%|███▏      | 16/50 [00:08<00:09,  3.77it/s] 34%|███▍      | 17/50 [00:08<00:08,  3.80it/s] 36%|███▌      | 18/50 [00:08<00:08,  3.81it/s] 38%|███▊      | 19/50 [00:09<00:08,  3.83it/s] 40%|████      | 20/50 [00:09<00:07,  3.84it/s] 42%|████▏     | 21/50 [00:09<00:07,  3.84it/s] 44%|████▍     | 22/50 [00:09<00:07,  3.85it/s] 46%|████▌     | 23/50 [00:10<00:07,  3.85it/s] 48%|████▊     | 24/50 [00:10<00:06,  3.84it/s] 50%|█████     | 25/50 [00:10<00:06,  3.85it/s] 52%|█████▏    | 26/50 [00:10<00:06,  3.85it/s] 54%|█████▍    | 27/50 [00:11<00:05,  3.85it/s] 56%|█████▌    | 28/50 [00:11<00:05,  3.84it/s] 58%|█████▊    | 29/50 [00:11<00:05,  3.85it/s] 60%|██████    | 30/50 [00:11<00:05,  3.85it/s] 62%|██████▏   | 31/50 [00:12<00:04,  3.84it/s] 64%|██████▍   | 32/50 [00:12<00:04,  3.85it/s] 66%|██████▌   | 33/50 [00:12<00:04,  3.85it/s] 68%|██████▊   | 34/50 [00:13<00:04,  3.84it/s] 70%|███████   | 35/50 [00:13<00:03,  3.84it/s] 72%|███████▏  | 36/50 [00:13<00:03,  3.84it/s] 74%|███████▍  | 37/50 [00:13<00:03,  3.84it/s] 76%|███████▌  | 38/50 [00:14<00:03,  3.84it/s] 78%|███████▊  | 39/50 [00:14<00:02,  3.84it/s] 80%|████████  | 40/50 [00:14<00:02,  3.84it/s] 82%|████████▏ | 41/50 [00:14<00:02,  3.84it/s] 84%|████████▍ | 42/50 [00:15<00:02,  3.84it/s] 86%|████████▌ | 43/50 [00:15<00:01,  3.84it/s] 88%|████████▊ | 44/50 [00:15<00:01,  3.84it/s] 90%|█████████ | 45/50 [00:15<00:01,  3.84it/s] 92%|█████████▏| 46/50 [00:16<00:01,  3.84it/s] 94%|█████████▍| 47/50 [00:16<00:00,  3.84it/s] 96%|█████████▌| 48/50 [00:16<00:00,  3.84it/s] 98%|█████████▊| 49/50 [00:16<00:00,  3.84it/s]100%|██████████| 50/50 [00:21<00:00,  1.63s/it]100%|██████████| 50/50 [00:21<00:00,  2.30it/s]
[I 2023-12-10 23:55:19,720] Trial 311 finished with value: 0.3998241758241758 and parameters: {'EMBEDDING_DIM': 915, 'HIDDEN_DIM': 391, 'NUM_LAYERS': 1, 'DROPOUT': 0.34474676900094, 'LR': 0.001983463834403176, 'WEIGHT_0': 0.5064958734654439, 'WEIGHT_1': 0.4996758519925628, 'WEIGHT_2': 0.33907144465411554, 'WEIGHT_3': 0.9528906971151645, 'WEIGHT_4': 0.7062018695221053, 'WEIGHT_5': 0.6398006978572586, 'WEIGHT_6': 0.6052104885618457, 'WEIGHT_7': 0.27886560375262953, 'WEIGHT_8': 0.6659674025819167, 'optimizer': 'RMSprop'}. Best is trial 221 with value: 0.418736930154747.
/userhome/cs2/dingruiw/conda/envs/py310/lib/python3.10/site-packages/torch/nn/modules/rnn.py:82: UserWarning: dropout option adds dropout after all but last recurrent layer, so non-zero dropout expects num_layers greater than 1, but got dropout=0.027333963937912903 and num_layers=1
  warnings.warn("dropout option adds dropout after all but last "
{'EMBEDDING_DIM': 915, 'HIDDEN_DIM': 391, 'NUM_LAYERS': 1, 'DROPOUT': 0.34474676900094, 'LR': 0.001983463834403176, 'WEIGHT_0': 0.5064958734654439, 'WEIGHT_1': 0.4996758519925628, 'WEIGHT_2': 0.33907144465411554, 'WEIGHT_3': 0.9528906971151645, 'WEIGHT_4': 0.7062018695221053, 'WEIGHT_5': 0.6398006978572586, 'WEIGHT_6': 0.6052104885618457, 'WEIGHT_7': 0.27886560375262953, 'WEIGHT_8': 0.6659674025819167, 'optimizer': 'RMSprop'}
0
              precision    recall  f1-score   support

         LOC       0.20      0.06      0.10      1837
        MISC       0.03      0.01      0.01       922
         ORG       0.14      0.03      0.04      1341
         PER       0.07      0.01      0.02      1842

   micro avg       0.13      0.03      0.05      5942
   macro avg       0.11      0.03      0.04      5942
weighted avg       0.12      0.03      0.05      5942

{'EMBEDDING_DIM': 915, 'HIDDEN_DIM': 391, 'NUM_LAYERS': 1, 'DROPOUT': 0.34474676900094, 'LR': 0.001983463834403176, 'WEIGHT_0': 0.5064958734654439, 'WEIGHT_1': 0.4996758519925628, 'WEIGHT_2': 0.33907144465411554, 'WEIGHT_3': 0.9528906971151645, 'WEIGHT_4': 0.7062018695221053, 'WEIGHT_5': 0.6398006978572586, 'WEIGHT_6': 0.6052104885618457, 'WEIGHT_7': 0.27886560375262953, 'WEIGHT_8': 0.6659674025819167, 'optimizer': 'RMSprop'}
49
              precision    recall  f1-score   support

         LOC       0.58      0.52      0.55      1837
        MISC       0.43      0.43      0.43       922
         ORG       0.29      0.24      0.26      1341
         PER       0.34      0.33      0.34      1842

   micro avg       0.42      0.38      0.40      5942
   macro avg       0.41      0.38      0.39      5942
weighted avg       0.42      0.38      0.40      5942

epoch 49
LSTM
  0%|          | 0/50 [00:00<?, ?it/s]  2%|▏         | 1/50 [00:04<03:40,  4.50s/it]  4%|▍         | 2/50 [00:04<01:32,  1.93s/it]  6%|▌         | 3/50 [00:04<00:54,  1.16s/it]  8%|▊         | 4/50 [00:05<00:36,  1.27it/s] 10%|█         | 5/50 [00:05<00:26,  1.71it/s] 12%|█▏        | 6/50 [00:05<00:20,  2.16it/s] 14%|█▍        | 7/50 [00:05<00:16,  2.60it/s] 16%|█▌        | 8/50 [00:05<00:14,  2.99it/s] 18%|█▊        | 9/50 [00:06<00:12,  3.33it/s] 20%|██        | 10/50 [00:06<00:11,  3.61it/s] 22%|██▏       | 11/50 [00:06<00:10,  3.83it/s] 24%|██▍       | 12/50 [00:06<00:09,  4.00it/s] 26%|██▌       | 13/50 [00:07<00:08,  4.13it/s] 28%|██▊       | 14/50 [00:07<00:08,  4.22it/s] 30%|███       | 15/50 [00:07<00:08,  4.28it/s] 32%|███▏      | 16/50 [00:07<00:07,  4.33it/s] 34%|███▍      | 17/50 [00:08<00:07,  4.36it/s] 36%|███▌      | 18/50 [00:08<00:07,  4.38it/s] 38%|███▊      | 19/50 [00:08<00:07,  4.40it/s] 40%|████      | 20/50 [00:08<00:06,  4.41it/s] 42%|████▏     | 21/50 [00:08<00:06,  4.42it/s] 44%|████▍     | 22/50 [00:09<00:06,  4.42it/s] 46%|████▌     | 23/50 [00:09<00:06,  4.43it/s] 48%|████▊     | 24/50 [00:09<00:05,  4.43it/s] 50%|█████     | 25/50 [00:09<00:05,  4.44it/s] 52%|█████▏    | 26/50 [00:10<00:05,  4.44it/s] 54%|█████▍    | 27/50 [00:10<00:05,  4.44it/s] 56%|█████▌    | 28/50 [00:10<00:04,  4.44it/s] 58%|█████▊    | 29/50 [00:10<00:04,  4.43it/s] 60%|██████    | 30/50 [00:10<00:04,  4.43it/s] 62%|██████▏   | 31/50 [00:11<00:04,  4.43it/s] 64%|██████▍   | 32/50 [00:11<00:04,  4.43it/s] 66%|██████▌   | 33/50 [00:11<00:03,  4.43it/s] 68%|██████▊   | 34/50 [00:11<00:03,  4.43it/s] 70%|███████   | 35/50 [00:12<00:03,  4.43it/s] 72%|███████▏  | 36/50 [00:12<00:03,  4.43it/s] 74%|███████▍  | 37/50 [00:12<00:02,  4.43it/s] 76%|███████▌  | 38/50 [00:12<00:02,  4.42it/s] 78%|███████▊  | 39/50 [00:12<00:02,  4.43it/s] 80%|████████  | 40/50 [00:13<00:02,  4.43it/s] 82%|████████▏ | 41/50 [00:13<00:02,  4.43it/s] 84%|████████▍ | 42/50 [00:13<00:01,  4.43it/s] 86%|████████▌ | 43/50 [00:13<00:01,  4.42it/s] 88%|████████▊ | 44/50 [00:14<00:01,  4.42it/s] 90%|█████████ | 45/50 [00:14<00:01,  4.42it/s] 92%|█████████▏| 46/50 [00:14<00:00,  4.42it/s] 94%|█████████▍| 47/50 [00:14<00:00,  4.42it/s] 96%|█████████▌| 48/50 [00:15<00:00,  4.42it/s] 98%|█████████▊| 49/50 [00:15<00:00,  4.42it/s]100%|██████████| 50/50 [00:20<00:00,  1.61s/it]100%|██████████| 50/50 [00:20<00:00,  2.49it/s]
[I 2023-12-10 23:55:44,010] Trial 312 finished with value: 0.37956790619227365 and parameters: {'EMBEDDING_DIM': 992, 'HIDDEN_DIM': 329, 'NUM_LAYERS': 1, 'DROPOUT': 0.027333963937912903, 'LR': 0.004371261851178705, 'WEIGHT_0': 0.8559341137209772, 'WEIGHT_1': 0.6814125565326588, 'WEIGHT_2': 0.5696034535507088, 'WEIGHT_3': 0.6344647004956774, 'WEIGHT_4': 0.8775683316851134, 'WEIGHT_5': 0.8910614313991276, 'WEIGHT_6': 0.6332894939240179, 'WEIGHT_7': 0.5463979303752754, 'WEIGHT_8': 0.5745577402719507, 'optimizer': 'Adam'}. Best is trial 221 with value: 0.418736930154747.
/userhome/cs2/dingruiw/conda/envs/py310/lib/python3.10/site-packages/torch/nn/modules/rnn.py:82: UserWarning: dropout option adds dropout after all but last recurrent layer, so non-zero dropout expects num_layers greater than 1, but got dropout=0.2174831319155462 and num_layers=1
  warnings.warn("dropout option adds dropout after all but last "
{'EMBEDDING_DIM': 992, 'HIDDEN_DIM': 329, 'NUM_LAYERS': 1, 'DROPOUT': 0.027333963937912903, 'LR': 0.004371261851178705, 'WEIGHT_0': 0.8559341137209772, 'WEIGHT_1': 0.6814125565326588, 'WEIGHT_2': 0.5696034535507088, 'WEIGHT_3': 0.6344647004956774, 'WEIGHT_4': 0.8775683316851134, 'WEIGHT_5': 0.8910614313991276, 'WEIGHT_6': 0.6332894939240179, 'WEIGHT_7': 0.5463979303752754, 'WEIGHT_8': 0.5745577402719507, 'optimizer': 'Adam'}
0
              precision    recall  f1-score   support

         LOC       0.10      0.05      0.06      1837
        MISC       0.02      0.01      0.02       922
         ORG       0.09      0.03      0.04      1341
         PER       0.05      0.01      0.02      1842

   micro avg       0.07      0.03      0.04      5942
   macro avg       0.07      0.02      0.04      5942
weighted avg       0.07      0.03      0.04      5942

{'EMBEDDING_DIM': 992, 'HIDDEN_DIM': 329, 'NUM_LAYERS': 1, 'DROPOUT': 0.027333963937912903, 'LR': 0.004371261851178705, 'WEIGHT_0': 0.8559341137209772, 'WEIGHT_1': 0.6814125565326588, 'WEIGHT_2': 0.5696034535507088, 'WEIGHT_3': 0.6344647004956774, 'WEIGHT_4': 0.8775683316851134, 'WEIGHT_5': 0.8910614313991276, 'WEIGHT_6': 0.6332894939240179, 'WEIGHT_7': 0.5463979303752754, 'WEIGHT_8': 0.5745577402719507, 'optimizer': 'Adam'}
49
              precision    recall  f1-score   support

         LOC       0.57      0.54      0.55      1837
        MISC       0.33      0.41      0.36       922
         ORG       0.24      0.26      0.25      1341
         PER       0.30      0.35      0.33      1842

   micro avg       0.36      0.40      0.38      5942
   macro avg       0.36      0.39      0.37      5942
weighted avg       0.37      0.40      0.38      5942

epoch 49
LSTM
  0%|          | 0/50 [00:00<?, ?it/s]  2%|▏         | 1/50 [00:03<03:06,  3.81s/it] 12%|█▏        | 6/50 [00:03<00:21,  2.04it/s] 18%|█▊        | 9/50 [00:04<00:12,  3.31it/s] 24%|██▍       | 12/50 [00:04<00:07,  4.80it/s] 30%|███       | 15/50 [00:04<00:05,  6.47it/s] 34%|███▍      | 17/50 [00:04<00:04,  7.72it/s] 38%|███▊      | 19/50 [00:04<00:03,  9.10it/s] 42%|████▏     | 21/50 [00:04<00:02, 10.53it/s] 46%|████▌     | 23/50 [00:04<00:02, 11.91it/s] 50%|█████     | 25/50 [00:04<00:01, 13.16it/s] 54%|█████▍    | 27/50 [00:05<00:01, 14.27it/s] 58%|█████▊    | 29/50 [00:05<00:01, 15.22it/s] 62%|██████▏   | 31/50 [00:05<00:01, 15.96it/s] 66%|██████▌   | 33/50 [00:05<00:01, 16.52it/s] 70%|███████   | 35/50 [00:05<00:00, 16.95it/s] 74%|███████▍  | 37/50 [00:05<00:00, 17.27it/s] 78%|███████▊  | 39/50 [00:05<00:00, 17.49it/s] 82%|████████▏ | 41/50 [00:05<00:00, 17.59it/s] 86%|████████▌ | 43/50 [00:05<00:00, 17.68it/s] 90%|█████████ | 45/50 [00:06<00:00, 17.76it/s] 94%|█████████▍| 47/50 [00:06<00:00, 17.84it/s] 98%|█████████▊| 49/50 [00:06<00:00, 17.89it/s]100%|██████████| 50/50 [00:10<00:00,  4.81it/s]
