[I 2023-12-10 21:26:45,854] Trial 33 finished with value: 0.34050880626223096 and parameters: {'EMBEDDING_DIM': 477, 'HIDDEN_DIM': 415, 'NUM_LAYERS': 1, 'DROPOUT': 0.3146346176080506, 'LR': 0.0007666981771132179, 'WEIGHT_0': 0.5291544901509191, 'WEIGHT_1': 0.7495849040064009, 'WEIGHT_2': 0.6190237942220405, 'WEIGHT_3': 0.8296257078145141, 'WEIGHT_4': 0.7971390083354323, 'WEIGHT_5': 0.8011996495577789, 'WEIGHT_6': 0.7314533875677585, 'WEIGHT_7': 0.32570239249844635, 'WEIGHT_8': 0.7151227547663928, 'optimizer': 'Adam'}. Best is trial 26 with value: 0.4051425745838141.
/userhome/cs2/dingruiw/conda/envs/py310/lib/python3.10/site-packages/torch/nn/modules/rnn.py:82: UserWarning: dropout option adds dropout after all but last recurrent layer, so non-zero dropout expects num_layers greater than 1, but got dropout=0.3614100678472549 and num_layers=1
  warnings.warn("dropout option adds dropout after all but last "
{'EMBEDDING_DIM': 477, 'HIDDEN_DIM': 415, 'NUM_LAYERS': 1, 'DROPOUT': 0.3146346176080506, 'LR': 0.0007666981771132179, 'WEIGHT_0': 0.5291544901509191, 'WEIGHT_1': 0.7495849040064009, 'WEIGHT_2': 0.6190237942220405, 'WEIGHT_3': 0.8296257078145141, 'WEIGHT_4': 0.7971390083354323, 'WEIGHT_5': 0.8011996495577789, 'WEIGHT_6': 0.7314533875677585, 'WEIGHT_7': 0.32570239249844635, 'WEIGHT_8': 0.7151227547663928, 'optimizer': 'Adam'}
0
              precision    recall  f1-score   support

         LOC       0.03      0.08      0.05      1837
        MISC       0.01      0.06      0.02       922
         ORG       0.02      0.09      0.04      1341
         PER       0.01      0.06      0.02      1842

   micro avg       0.02      0.07      0.03      5942
   macro avg       0.02      0.07      0.03      5942
weighted avg       0.02      0.07      0.03      5942

{'EMBEDDING_DIM': 477, 'HIDDEN_DIM': 415, 'NUM_LAYERS': 1, 'DROPOUT': 0.3146346176080506, 'LR': 0.0007666981771132179, 'WEIGHT_0': 0.5291544901509191, 'WEIGHT_1': 0.7495849040064009, 'WEIGHT_2': 0.6190237942220405, 'WEIGHT_3': 0.8296257078145141, 'WEIGHT_4': 0.7971390083354323, 'WEIGHT_5': 0.8011996495577789, 'WEIGHT_6': 0.7314533875677585, 'WEIGHT_7': 0.32570239249844635, 'WEIGHT_8': 0.7151227547663928, 'optimizer': 'Adam'}
49
              precision    recall  f1-score   support

         LOC       0.46      0.50      0.48      1837
        MISC       0.40      0.24      0.30       922
         ORG       0.25      0.17      0.20      1341
         PER       0.29      0.29      0.29      1842

   micro avg       0.36      0.32      0.34      5942
   macro avg       0.35      0.30      0.32      5942
weighted avg       0.35      0.32      0.33      5942

epoch 49
LSTM
  0%|          | 0/50 [00:00<?, ?it/s]  2%|▏         | 1/50 [00:05<04:06,  5.03s/it]  4%|▍         | 2/50 [00:05<01:44,  2.18s/it]  6%|▌         | 3/50 [00:05<01:04,  1.38s/it]  8%|▊         | 4/50 [00:06<00:46,  1.01s/it] 10%|█         | 5/50 [00:06<00:35,  1.25it/s] 12%|█▏        | 6/50 [00:06<00:29,  1.49it/s] 14%|█▍        | 7/50 [00:07<00:25,  1.68it/s] 16%|█▌        | 8/50 [00:07<00:22,  1.84it/s] 18%|█▊        | 9/50 [00:08<00:20,  1.97it/s] 20%|██        | 10/50 [00:08<00:19,  2.07it/s] 22%|██▏       | 11/50 [00:09<00:18,  2.14it/s] 24%|██▍       | 12/50 [00:09<00:17,  2.19it/s] 26%|██▌       | 13/50 [00:09<00:16,  2.23it/s] 28%|██▊       | 14/50 [00:10<00:15,  2.26it/s] 30%|███       | 15/50 [00:10<00:15,  2.28it/s] 32%|███▏      | 16/50 [00:11<00:14,  2.28it/s] 34%|███▍      | 17/50 [00:11<00:14,  2.30it/s] 36%|███▌      | 18/50 [00:12<00:13,  2.31it/s] 38%|███▊      | 19/50 [00:12<00:13,  2.31it/s] 40%|████      | 20/50 [00:12<00:12,  2.31it/s] 42%|████▏     | 21/50 [00:13<00:12,  2.31it/s] 44%|████▍     | 22/50 [00:13<00:12,  2.31it/s] 46%|████▌     | 23/50 [00:14<00:11,  2.31it/s] 48%|████▊     | 24/50 [00:14<00:11,  2.31it/s] 50%|█████     | 25/50 [00:15<00:10,  2.31it/s] 52%|█████▏    | 26/50 [00:15<00:10,  2.30it/s] 54%|█████▍    | 27/50 [00:16<00:10,  2.30it/s] 56%|█████▌    | 28/50 [00:16<00:09,  2.30it/s] 58%|█████▊    | 29/50 [00:16<00:09,  2.30it/s] 60%|██████    | 30/50 [00:17<00:08,  2.29it/s] 62%|██████▏   | 31/50 [00:17<00:08,  2.29it/s] 64%|██████▍   | 32/50 [00:18<00:07,  2.30it/s] 66%|██████▌   | 33/50 [00:18<00:07,  2.29it/s] 68%|██████▊   | 34/50 [00:19<00:06,  2.30it/s] 70%|███████   | 35/50 [00:19<00:06,  2.29it/s] 72%|███████▏  | 36/50 [00:19<00:06,  2.29it/s] 74%|███████▍  | 37/50 [00:20<00:05,  2.29it/s] 76%|███████▌  | 38/50 [00:20<00:05,  2.29it/s] 78%|███████▊  | 39/50 [00:21<00:04,  2.29it/s] 80%|████████  | 40/50 [00:21<00:04,  2.29it/s] 82%|████████▏ | 41/50 [00:22<00:03,  2.29it/s] 84%|████████▍ | 42/50 [00:22<00:03,  2.29it/s] 86%|████████▌ | 43/50 [00:23<00:03,  2.28it/s] 88%|████████▊ | 44/50 [00:23<00:02,  2.29it/s] 90%|█████████ | 45/50 [00:23<00:02,  2.29it/s] 92%|█████████▏| 46/50 [00:24<00:01,  2.29it/s] 94%|█████████▍| 47/50 [00:24<00:01,  2.28it/s] 96%|█████████▌| 48/50 [00:25<00:00,  2.28it/s] 98%|█████████▊| 49/50 [00:25<00:00,  2.28it/s]100%|██████████| 50/50 [00:30<00:00,  1.88s/it]100%|██████████| 50/50 [00:30<00:00,  1.62it/s]
[I 2023-12-10 21:27:20,867] Trial 34 finished with value: 0.3482270098080309 and parameters: {'EMBEDDING_DIM': 181, 'HIDDEN_DIM': 862, 'NUM_LAYERS': 1, 'DROPOUT': 0.3614100678472549, 'LR': 0.0023899928126350587, 'WEIGHT_0': 0.47339921946894964, 'WEIGHT_1': 0.6442062942137087, 'WEIGHT_2': 0.7740766950946111, 'WEIGHT_3': 0.7032441248851794, 'WEIGHT_4': 0.9412528300900063, 'WEIGHT_5': 0.7033495203079991, 'WEIGHT_6': 0.9192913668917039, 'WEIGHT_7': 0.4527828484315737, 'WEIGHT_8': 0.6141203378643123, 'optimizer': 'Adam'}. Best is trial 26 with value: 0.4051425745838141.
/userhome/cs2/dingruiw/conda/envs/py310/lib/python3.10/site-packages/torch/nn/modules/rnn.py:82: UserWarning: dropout option adds dropout after all but last recurrent layer, so non-zero dropout expects num_layers greater than 1, but got dropout=0.24657426841067534 and num_layers=1
  warnings.warn("dropout option adds dropout after all but last "
{'EMBEDDING_DIM': 181, 'HIDDEN_DIM': 862, 'NUM_LAYERS': 1, 'DROPOUT': 0.3614100678472549, 'LR': 0.0023899928126350587, 'WEIGHT_0': 0.47339921946894964, 'WEIGHT_1': 0.6442062942137087, 'WEIGHT_2': 0.7740766950946111, 'WEIGHT_3': 0.7032441248851794, 'WEIGHT_4': 0.9412528300900063, 'WEIGHT_5': 0.7033495203079991, 'WEIGHT_6': 0.9192913668917039, 'WEIGHT_7': 0.4527828484315737, 'WEIGHT_8': 0.6141203378643123, 'optimizer': 'Adam'}
0
              precision    recall  f1-score   support

         LOC       0.04      0.02      0.02      1837
        MISC       0.02      0.04      0.02       922
         ORG       0.06      0.03      0.04      1341
         PER       0.05      0.02      0.02      1842

   micro avg       0.03      0.02      0.03      5942
   macro avg       0.04      0.03      0.03      5942
weighted avg       0.04      0.02      0.03      5942

{'EMBEDDING_DIM': 181, 'HIDDEN_DIM': 862, 'NUM_LAYERS': 1, 'DROPOUT': 0.3614100678472549, 'LR': 0.0023899928126350587, 'WEIGHT_0': 0.47339921946894964, 'WEIGHT_1': 0.6442062942137087, 'WEIGHT_2': 0.7740766950946111, 'WEIGHT_3': 0.7032441248851794, 'WEIGHT_4': 0.9412528300900063, 'WEIGHT_5': 0.7033495203079991, 'WEIGHT_6': 0.9192913668917039, 'WEIGHT_7': 0.4527828484315737, 'WEIGHT_8': 0.6141203378643123, 'optimizer': 'Adam'}
49
              precision    recall  f1-score   support

         LOC       0.52      0.49      0.50      1837
        MISC       0.32      0.37      0.34       922
         ORG       0.20      0.21      0.21      1341
         PER       0.31      0.31      0.31      1842

   micro avg       0.35      0.35      0.35      5942
   macro avg       0.34      0.34      0.34      5942
weighted avg       0.35      0.35      0.35      5942

epoch 49
LSTM
  0%|          | 0/50 [00:00<?, ?it/s]  2%|▏         | 1/50 [00:04<03:42,  4.54s/it]  6%|▌         | 3/50 [00:04<00:59,  1.28s/it]  8%|▊         | 4/50 [00:04<00:40,  1.12it/s] 10%|█         | 5/50 [00:05<00:29,  1.54it/s] 12%|█▏        | 6/50 [00:05<00:21,  2.03it/s] 14%|█▍        | 7/50 [00:05<00:16,  2.58it/s] 16%|█▌        | 8/50 [00:05<00:13,  3.16it/s] 18%|█▊        | 9/50 [00:05<00:11,  3.72it/s] 20%|██        | 10/50 [00:05<00:09,  4.24it/s] 22%|██▏       | 11/50 [00:06<00:08,  4.69it/s] 24%|██▍       | 12/50 [00:06<00:07,  5.07it/s] 26%|██▌       | 13/50 [00:06<00:06,  5.37it/s] 28%|██▊       | 14/50 [00:06<00:06,  5.60it/s] 30%|███       | 15/50 [00:06<00:06,  5.77it/s] 32%|███▏      | 16/50 [00:06<00:05,  5.89it/s] 34%|███▍      | 17/50 [00:07<00:05,  5.98it/s] 36%|███▌      | 18/50 [00:07<00:05,  6.04it/s] 38%|███▊      | 19/50 [00:07<00:05,  6.09it/s] 40%|████      | 20/50 [00:07<00:04,  6.13it/s] 42%|████▏     | 21/50 [00:07<00:04,  6.16it/s] 44%|████▍     | 22/50 [00:07<00:04,  6.17it/s] 46%|████▌     | 23/50 [00:08<00:04,  6.18it/s] 48%|████▊     | 24/50 [00:08<00:04,  6.19it/s] 50%|█████     | 25/50 [00:08<00:04,  6.19it/s] 52%|█████▏    | 26/50 [00:08<00:03,  6.20it/s] 54%|█████▍    | 27/50 [00:08<00:03,  6.21it/s] 56%|█████▌    | 28/50 [00:08<00:03,  6.20it/s] 58%|█████▊    | 29/50 [00:08<00:03,  6.21it/s] 60%|██████    | 30/50 [00:09<00:03,  6.21it/s] 62%|██████▏   | 31/50 [00:09<00:03,  6.21it/s] 64%|██████▍   | 32/50 [00:09<00:02,  6.20it/s] 66%|██████▌   | 33/50 [00:09<00:02,  6.20it/s] 68%|██████▊   | 34/50 [00:09<00:02,  6.20it/s] 70%|███████   | 35/50 [00:09<00:02,  6.20it/s] 72%|███████▏  | 36/50 [00:10<00:02,  6.20it/s] 74%|███████▍  | 37/50 [00:10<00:02,  6.19it/s] 76%|███████▌  | 38/50 [00:10<00:01,  6.19it/s] 78%|███████▊  | 39/50 [00:10<00:01,  6.20it/s] 80%|████████  | 40/50 [00:10<00:01,  6.19it/s] 82%|████████▏ | 41/50 [00:10<00:01,  6.20it/s] 84%|████████▍ | 42/50 [00:11<00:01,  6.20it/s] 86%|████████▌ | 43/50 [00:11<00:01,  6.20it/s] 88%|████████▊ | 44/50 [00:11<00:00,  6.20it/s] 90%|█████████ | 45/50 [00:11<00:00,  6.20it/s] 92%|█████████▏| 46/50 [00:11<00:00,  6.20it/s] 94%|█████████▍| 47/50 [00:11<00:00,  6.20it/s] 96%|█████████▌| 48/50 [00:12<00:00,  6.20it/s] 98%|█████████▊| 49/50 [00:12<00:00,  6.20it/s]100%|██████████| 50/50 [00:17<00:00,  1.55s/it]100%|██████████| 50/50 [00:17<00:00,  2.94it/s]
[I 2023-12-10 21:27:42,035] Trial 35 finished with value: 0.3743213030980517 and parameters: {'EMBEDDING_DIM': 666, 'HIDDEN_DIM': 288, 'NUM_LAYERS': 1, 'DROPOUT': 0.24657426841067534, 'LR': 0.003036974992289301, 'WEIGHT_0': 0.6530725097769503, 'WEIGHT_1': 0.6946426234301737, 'WEIGHT_2': 0.5225866247684261, 'WEIGHT_3': 0.9363693014606516, 'WEIGHT_4': 0.7913678080390809, 'WEIGHT_5': 0.7577784411042052, 'WEIGHT_6': 0.7430151036336361, 'WEIGHT_7': 0.3645865383414784, 'WEIGHT_8': 0.7362824968265345, 'optimizer': 'RMSprop'}. Best is trial 26 with value: 0.4051425745838141.
{'EMBEDDING_DIM': 666, 'HIDDEN_DIM': 288, 'NUM_LAYERS': 1, 'DROPOUT': 0.24657426841067534, 'LR': 0.003036974992289301, 'WEIGHT_0': 0.6530725097769503, 'WEIGHT_1': 0.6946426234301737, 'WEIGHT_2': 0.5225866247684261, 'WEIGHT_3': 0.9363693014606516, 'WEIGHT_4': 0.7913678080390809, 'WEIGHT_5': 0.7577784411042052, 'WEIGHT_6': 0.7430151036336361, 'WEIGHT_7': 0.3645865383414784, 'WEIGHT_8': 0.7362824968265345, 'optimizer': 'RMSprop'}
0
              precision    recall  f1-score   support

         LOC       0.24      0.12      0.16      1837
        MISC       0.02      0.00      0.01       922
         ORG       0.08      0.01      0.02      1341
         PER       0.08      0.02      0.03      1842

   micro avg       0.15      0.05      0.07      5942
   macro avg       0.10      0.04      0.05      5942
weighted avg       0.12      0.05      0.06      5942

{'EMBEDDING_DIM': 666, 'HIDDEN_DIM': 288, 'NUM_LAYERS': 1, 'DROPOUT': 0.24657426841067534, 'LR': 0.003036974992289301, 'WEIGHT_0': 0.6530725097769503, 'WEIGHT_1': 0.6946426234301737, 'WEIGHT_2': 0.5225866247684261, 'WEIGHT_3': 0.9363693014606516, 'WEIGHT_4': 0.7913678080390809, 'WEIGHT_5': 0.7577784411042052, 'WEIGHT_6': 0.7430151036336361, 'WEIGHT_7': 0.3645865383414784, 'WEIGHT_8': 0.7362824968265345, 'optimizer': 'RMSprop'}
49
              precision    recall  f1-score   support

         LOC       0.52      0.54      0.53      1837
        MISC       0.39      0.41      0.40       922
         ORG       0.25      0.26      0.25      1341
         PER       0.27      0.35      0.31      1842

   micro avg       0.36      0.39      0.37      5942
   macro avg       0.36      0.39      0.37      5942
weighted avg       0.36      0.39      0.38      5942

epoch 49
LSTM
  0%|          | 0/50 [00:00<?, ?it/s]  2%|▏         | 1/50 [00:05<04:36,  5.64s/it]  4%|▍         | 2/50 [00:05<01:55,  2.41s/it]  6%|▌         | 3/50 [00:06<01:11,  1.53s/it]  8%|▊         | 4/50 [00:06<00:51,  1.11s/it] 10%|█         | 5/50 [00:07<00:39,  1.13it/s] 12%|█▏        | 6/50 [00:07<00:32,  1.34it/s] 14%|█▍        | 7/50 [00:08<00:28,  1.52it/s] 16%|█▌        | 8/50 [00:08<00:25,  1.66it/s] 18%|█▊        | 9/50 [00:09<00:23,  1.78it/s] 20%|██        | 10/50 [00:09<00:21,  1.86it/s] 22%|██▏       | 11/50 [00:10<00:20,  1.93it/s] 24%|██▍       | 12/50 [00:10<00:19,  1.97it/s] 26%|██▌       | 13/50 [00:11<00:18,  2.00it/s] 28%|██▊       | 14/50 [00:11<00:17,  2.03it/s] 30%|███       | 15/50 [00:12<00:17,  2.04it/s] 32%|███▏      | 16/50 [00:12<00:16,  2.05it/s] 34%|███▍      | 17/50 [00:12<00:15,  2.07it/s] 36%|███▌      | 18/50 [00:13<00:15,  2.07it/s] 38%|███▊      | 19/50 [00:13<00:14,  2.07it/s] 40%|████      | 20/50 [00:14<00:14,  2.07it/s] 42%|████▏     | 21/50 [00:14<00:13,  2.07it/s] 44%|████▍     | 22/50 [00:15<00:13,  2.08it/s] 46%|████▌     | 23/50 [00:15<00:12,  2.08it/s] 48%|████▊     | 24/50 [00:16<00:12,  2.08it/s] 50%|█████     | 25/50 [00:16<00:11,  2.09it/s] 52%|█████▏    | 26/50 [00:17<00:11,  2.09it/s] 54%|█████▍    | 27/50 [00:17<00:11,  2.09it/s] 56%|█████▌    | 28/50 [00:18<00:10,  2.08it/s] 58%|█████▊    | 29/50 [00:18<00:10,  2.08it/s] 60%|██████    | 30/50 [00:19<00:09,  2.08it/s] 62%|██████▏   | 31/50 [00:19<00:09,  2.08it/s] 64%|██████▍   | 32/50 [00:20<00:08,  2.07it/s] 66%|██████▌   | 33/50 [00:20<00:08,  2.07it/s] 68%|██████▊   | 34/50 [00:21<00:07,  2.07it/s] 70%|███████   | 35/50 [00:21<00:07,  2.07it/s] 72%|███████▏  | 36/50 [00:22<00:06,  2.07it/s] 74%|███████▍  | 37/50 [00:22<00:06,  2.07it/s] 76%|███████▌  | 38/50 [00:23<00:05,  2.07it/s] 78%|███████▊  | 39/50 [00:23<00:05,  2.07it/s] 80%|████████  | 40/50 [00:24<00:04,  2.07it/s] 82%|████████▏ | 41/50 [00:24<00:04,  2.07it/s] 84%|████████▍ | 42/50 [00:25<00:03,  2.07it/s] 86%|████████▌ | 43/50 [00:25<00:03,  2.07it/s] 88%|████████▊ | 44/50 [00:25<00:02,  2.07it/s] 90%|█████████ | 45/50 [00:26<00:02,  2.07it/s] 92%|█████████▏| 46/50 [00:26<00:01,  2.07it/s] 94%|█████████▍| 47/50 [00:27<00:01,  2.07it/s] 96%|█████████▌| 48/50 [00:27<00:00,  2.06it/s] 98%|█████████▊| 49/50 [00:28<00:00,  2.07it/s]100%|██████████| 50/50 [00:34<00:00,  2.12s/it]100%|██████████| 50/50 [00:34<00:00,  1.46it/s]
[I 2023-12-10 21:28:21,222] Trial 36 finished with value: 0.3690495936307846 and parameters: {'EMBEDDING_DIM': 533, 'HIDDEN_DIM': 483, 'NUM_LAYERS': 2, 'DROPOUT': 0.37916900091572703, 'LR': 0.001067997411143794, 'WEIGHT_0': 0.3486956072052493, 'WEIGHT_1': 0.916127172912997, 'WEIGHT_2': 0.8082415471197547, 'WEIGHT_3': 0.7606241020894637, 'WEIGHT_4': 0.9973514356458223, 'WEIGHT_5': 0.9242836831406841, 'WEIGHT_6': 0.8432428012751226, 'WEIGHT_7': 0.5354232349456711, 'WEIGHT_8': 0.5706493581769427, 'optimizer': 'Adam'}. Best is trial 26 with value: 0.4051425745838141.
/userhome/cs2/dingruiw/conda/envs/py310/lib/python3.10/site-packages/torch/nn/modules/rnn.py:82: UserWarning: dropout option adds dropout after all but last recurrent layer, so non-zero dropout expects num_layers greater than 1, but got dropout=0.33663867865083885 and num_layers=1
  warnings.warn("dropout option adds dropout after all but last "
{'EMBEDDING_DIM': 533, 'HIDDEN_DIM': 483, 'NUM_LAYERS': 2, 'DROPOUT': 0.37916900091572703, 'LR': 0.001067997411143794, 'WEIGHT_0': 0.3486956072052493, 'WEIGHT_1': 0.916127172912997, 'WEIGHT_2': 0.8082415471197547, 'WEIGHT_3': 0.7606241020894637, 'WEIGHT_4': 0.9973514356458223, 'WEIGHT_5': 0.9242836831406841, 'WEIGHT_6': 0.8432428012751226, 'WEIGHT_7': 0.5354232349456711, 'WEIGHT_8': 0.5706493581769427, 'optimizer': 'Adam'}
0
              precision    recall  f1-score   support

         LOC       0.07      0.03      0.04      1837
        MISC       0.00      0.00      0.00       922
         ORG       0.02      0.00      0.01      1341
         PER       0.00      0.00      0.00      1842

   micro avg       0.05      0.01      0.02      5942
   macro avg       0.02      0.01      0.01      5942
weighted avg       0.03      0.01      0.01      5942

{'EMBEDDING_DIM': 533, 'HIDDEN_DIM': 483, 'NUM_LAYERS': 2, 'DROPOUT': 0.37916900091572703, 'LR': 0.001067997411143794, 'WEIGHT_0': 0.3486956072052493, 'WEIGHT_1': 0.916127172912997, 'WEIGHT_2': 0.8082415471197547, 'WEIGHT_3': 0.7606241020894637, 'WEIGHT_4': 0.9973514356458223, 'WEIGHT_5': 0.9242836831406841, 'WEIGHT_6': 0.8432428012751226, 'WEIGHT_7': 0.5354232349456711, 'WEIGHT_8': 0.5706493581769427, 'optimizer': 'Adam'}
49
              precision    recall  f1-score   support

         LOC       0.51      0.54      0.52      1837
        MISC       0.28      0.31      0.30       922
         ORG       0.29      0.24      0.26      1341
         PER       0.30      0.34      0.32      1842

   micro avg       0.36      0.37      0.37      5942
   macro avg       0.35      0.36      0.35      5942
weighted avg       0.36      0.37      0.37      5942

epoch 49
LSTM
  0%|          | 0/50 [00:00<?, ?it/s]  2%|▏         | 1/50 [00:05<04:06,  5.03s/it]  4%|▍         | 2/50 [00:05<01:46,  2.22s/it]  6%|▌         | 3/50 [00:05<01:07,  1.43s/it]  8%|▊         | 4/50 [00:06<00:48,  1.06s/it] 10%|█         | 5/50 [00:06<00:38,  1.17it/s] 12%|█▏        | 6/50 [00:07<00:32,  1.37it/s] 14%|█▍        | 7/50 [00:07<00:27,  1.54it/s] 16%|█▌        | 8/50 [00:08<00:25,  1.68it/s] 18%|█▊        | 9/50 [00:08<00:23,  1.78it/s] 20%|██        | 10/50 [00:09<00:21,  1.86it/s] 22%|██▏       | 11/50 [00:09<00:20,  1.91it/s] 24%|██▍       | 12/50 [00:10<00:19,  1.95it/s] 26%|██▌       | 13/50 [00:10<00:18,  1.98it/s] 28%|██▊       | 14/50 [00:11<00:17,  2.01it/s] 30%|███       | 15/50 [00:11<00:17,  2.03it/s] 32%|███▏      | 16/50 [00:12<00:16,  2.03it/s] 34%|███▍      | 17/50 [00:12<00:16,  2.04it/s] 36%|███▌      | 18/50 [00:13<00:15,  2.05it/s] 38%|███▊      | 19/50 [00:13<00:15,  2.05it/s] 40%|████      | 20/50 [00:14<00:14,  2.05it/s] 42%|████▏     | 21/50 [00:14<00:14,  2.05it/s] 44%|████▍     | 22/50 [00:15<00:13,  2.05it/s] 46%|████▌     | 23/50 [00:15<00:13,  2.05it/s] 48%|████▊     | 24/50 [00:15<00:12,  2.06it/s] 50%|█████     | 25/50 [00:16<00:12,  2.06it/s] 52%|█████▏    | 26/50 [00:16<00:11,  2.06it/s] 54%|█████▍    | 27/50 [00:17<00:11,  2.06it/s] 56%|█████▌    | 28/50 [00:17<00:10,  2.05it/s] 58%|█████▊    | 29/50 [00:18<00:10,  2.05it/s] 60%|██████    | 30/50 [00:18<00:09,  2.05it/s] 62%|██████▏   | 31/50 [00:19<00:09,  2.05it/s] 64%|██████▍   | 32/50 [00:19<00:08,  2.05it/s] 66%|██████▌   | 33/50 [00:20<00:08,  2.05it/s] 68%|██████▊   | 34/50 [00:20<00:07,  2.05it/s] 70%|███████   | 35/50 [00:21<00:07,  2.05it/s] 72%|███████▏  | 36/50 [00:21<00:06,  2.04it/s] 74%|███████▍  | 37/50 [00:22<00:06,  2.04it/s] 76%|███████▌  | 38/50 [00:22<00:05,  2.03it/s] 78%|███████▊  | 39/50 [00:23<00:05,  2.03it/s] 80%|████████  | 40/50 [00:23<00:04,  2.03it/s] 82%|████████▏ | 41/50 [00:24<00:04,  2.03it/s] 84%|████████▍ | 42/50 [00:24<00:03,  2.03it/s] 86%|████████▌ | 43/50 [00:25<00:03,  2.03it/s] 88%|████████▊ | 44/50 [00:25<00:02,  2.03it/s] 90%|█████████ | 45/50 [00:26<00:02,  2.04it/s] 92%|█████████▏| 46/50 [00:26<00:01,  2.04it/s] 94%|█████████▍| 47/50 [00:27<00:01,  2.03it/s] 96%|█████████▌| 48/50 [00:27<00:00,  2.03it/s] 98%|█████████▊| 49/50 [00:28<00:00,  2.03it/s]100%|██████████| 50/50 [00:33<00:00,  1.89s/it]100%|██████████| 50/50 [00:33<00:00,  1.50it/s]
