[I 2023-12-10 21:16:05,025] Trial 21 finished with value: 0.3805764641086837 and parameters: {'EMBEDDING_DIM': 911, 'HIDDEN_DIM': 708, 'NUM_LAYERS': 1, 'DROPOUT': 0.45633915031717276, 'LR': 0.00427661544117323, 'WEIGHT_0': 0.6694237996812438, 'WEIGHT_1': 0.6542118987615226, 'WEIGHT_2': 0.4543459387339064, 'WEIGHT_3': 0.8993935139827496, 'WEIGHT_4': 0.7414157860385742, 'WEIGHT_5': 0.8697568453394101, 'WEIGHT_6': 0.9106511263439259, 'WEIGHT_7': 0.2355862725231502, 'WEIGHT_8': 0.5135223348741924, 'optimizer': 'Adam'}. Best is trial 19 with value: 0.3947319948425124.
/userhome/cs2/dingruiw/conda/envs/py310/lib/python3.10/site-packages/torch/nn/modules/rnn.py:82: UserWarning: dropout option adds dropout after all but last recurrent layer, so non-zero dropout expects num_layers greater than 1, but got dropout=0.44519109650544636 and num_layers=1
  warnings.warn("dropout option adds dropout after all but last "
{'EMBEDDING_DIM': 911, 'HIDDEN_DIM': 708, 'NUM_LAYERS': 1, 'DROPOUT': 0.45633915031717276, 'LR': 0.00427661544117323, 'WEIGHT_0': 0.6694237996812438, 'WEIGHT_1': 0.6542118987615226, 'WEIGHT_2': 0.4543459387339064, 'WEIGHT_3': 0.8993935139827496, 'WEIGHT_4': 0.7414157860385742, 'WEIGHT_5': 0.8697568453394101, 'WEIGHT_6': 0.9106511263439259, 'WEIGHT_7': 0.2355862725231502, 'WEIGHT_8': 0.5135223348741924, 'optimizer': 'Adam'}
0
              precision    recall  f1-score   support

         LOC       0.12      0.06      0.08      1837
        MISC       0.03      0.03      0.03       922
         ORG       0.05      0.00      0.01      1341
         PER       0.06      0.01      0.01      1842

   micro avg       0.07      0.03      0.04      5942
   macro avg       0.06      0.02      0.03      5942
weighted avg       0.07      0.03      0.03      5942

{'EMBEDDING_DIM': 911, 'HIDDEN_DIM': 708, 'NUM_LAYERS': 1, 'DROPOUT': 0.45633915031717276, 'LR': 0.00427661544117323, 'WEIGHT_0': 0.6694237996812438, 'WEIGHT_1': 0.6542118987615226, 'WEIGHT_2': 0.4543459387339064, 'WEIGHT_3': 0.8993935139827496, 'WEIGHT_4': 0.7414157860385742, 'WEIGHT_5': 0.8697568453394101, 'WEIGHT_6': 0.9106511263439259, 'WEIGHT_7': 0.2355862725231502, 'WEIGHT_8': 0.5135223348741924, 'optimizer': 'Adam'}
49
              precision    recall  f1-score   support

         LOC       0.58      0.51      0.54      1837
        MISC       0.45      0.34      0.39       922
         ORG       0.28      0.22      0.24      1341
         PER       0.34      0.29      0.31      1842

   micro avg       0.42      0.35      0.38      5942
   macro avg       0.41      0.34      0.37      5942
weighted avg       0.42      0.35      0.38      5942

epoch 49
LSTM
  0%|          | 0/50 [00:00<?, ?it/s]  2%|▏         | 1/50 [00:05<04:19,  5.29s/it]  4%|▍         | 2/50 [00:05<01:53,  2.36s/it]  6%|▌         | 3/50 [00:06<01:13,  1.57s/it]  8%|▊         | 4/50 [00:06<00:55,  1.20s/it] 10%|█         | 5/50 [00:07<00:44,  1.00it/s] 12%|█▏        | 6/50 [00:08<00:38,  1.14it/s] 14%|█▍        | 7/50 [00:08<00:34,  1.25it/s] 16%|█▌        | 8/50 [00:09<00:31,  1.34it/s] 18%|█▊        | 9/50 [00:10<00:29,  1.40it/s] 20%|██        | 10/50 [00:10<00:27,  1.45it/s] 22%|██▏       | 11/50 [00:11<00:26,  1.48it/s] 24%|██▍       | 12/50 [00:11<00:25,  1.51it/s] 26%|██▌       | 13/50 [00:12<00:24,  1.53it/s] 28%|██▊       | 14/50 [00:13<00:23,  1.54it/s] 30%|███       | 15/50 [00:13<00:22,  1.55it/s] 32%|███▏      | 16/50 [00:14<00:21,  1.56it/s] 34%|███▍      | 17/50 [00:15<00:21,  1.56it/s] 36%|███▌      | 18/50 [00:15<00:20,  1.56it/s] 38%|███▊      | 19/50 [00:16<00:19,  1.56it/s] 40%|████      | 20/50 [00:17<00:19,  1.57it/s] 42%|████▏     | 21/50 [00:17<00:18,  1.57it/s] 44%|████▍     | 22/50 [00:18<00:17,  1.57it/s] 46%|████▌     | 23/50 [00:18<00:17,  1.57it/s] 48%|████▊     | 24/50 [00:19<00:16,  1.57it/s] 50%|█████     | 25/50 [00:20<00:15,  1.56it/s] 52%|█████▏    | 26/50 [00:20<00:15,  1.57it/s] 54%|█████▍    | 27/50 [00:21<00:14,  1.56it/s] 56%|█████▌    | 28/50 [00:22<00:14,  1.56it/s] 58%|█████▊    | 29/50 [00:22<00:13,  1.57it/s] 60%|██████    | 30/50 [00:23<00:12,  1.57it/s] 62%|██████▏   | 31/50 [00:24<00:12,  1.56it/s] 64%|██████▍   | 32/50 [00:24<00:11,  1.56it/s] 66%|██████▌   | 33/50 [00:25<00:10,  1.56it/s] 68%|██████▊   | 34/50 [00:26<00:10,  1.56it/s] 70%|███████   | 35/50 [00:26<00:09,  1.56it/s] 72%|███████▏  | 36/50 [00:27<00:08,  1.56it/s] 74%|███████▍  | 37/50 [00:27<00:08,  1.55it/s] 76%|███████▌  | 38/50 [00:28<00:07,  1.55it/s] 78%|███████▊  | 39/50 [00:29<00:07,  1.55it/s] 80%|████████  | 40/50 [00:29<00:06,  1.55it/s] 82%|████████▏ | 41/50 [00:30<00:05,  1.55it/s] 84%|████████▍ | 42/50 [00:31<00:05,  1.55it/s] 86%|████████▌ | 43/50 [00:31<00:04,  1.55it/s] 88%|████████▊ | 44/50 [00:32<00:03,  1.55it/s] 90%|█████████ | 45/50 [00:33<00:03,  1.54it/s] 92%|█████████▏| 46/50 [00:33<00:02,  1.54it/s] 94%|█████████▍| 47/50 [00:34<00:01,  1.54it/s] 96%|█████████▌| 48/50 [00:35<00:01,  1.54it/s] 98%|█████████▊| 49/50 [00:35<00:00,  1.54it/s]100%|██████████| 50/50 [00:41<00:00,  2.12s/it]100%|██████████| 50/50 [00:41<00:00,  1.21it/s]
[I 2023-12-10 21:16:50,670] Trial 22 finished with value: 0.38042131350681535 and parameters: {'EMBEDDING_DIM': 931, 'HIDDEN_DIM': 810, 'NUM_LAYERS': 1, 'DROPOUT': 0.44519109650544636, 'LR': 0.004634765268468196, 'WEIGHT_0': 0.6229811470137419, 'WEIGHT_1': 0.7584225269422105, 'WEIGHT_2': 0.5812706533411693, 'WEIGHT_3': 0.8861656826138701, 'WEIGHT_4': 0.7506209257891533, 'WEIGHT_5': 0.884654814579259, 'WEIGHT_6': 0.8846070718051375, 'WEIGHT_7': 0.30204294429975476, 'WEIGHT_8': 0.48694172947494724, 'optimizer': 'Adam'}. Best is trial 19 with value: 0.3947319948425124.
/userhome/cs2/dingruiw/conda/envs/py310/lib/python3.10/site-packages/torch/nn/modules/rnn.py:82: UserWarning: dropout option adds dropout after all but last recurrent layer, so non-zero dropout expects num_layers greater than 1, but got dropout=0.39970873522365524 and num_layers=1
  warnings.warn("dropout option adds dropout after all but last "
{'EMBEDDING_DIM': 931, 'HIDDEN_DIM': 810, 'NUM_LAYERS': 1, 'DROPOUT': 0.44519109650544636, 'LR': 0.004634765268468196, 'WEIGHT_0': 0.6229811470137419, 'WEIGHT_1': 0.7584225269422105, 'WEIGHT_2': 0.5812706533411693, 'WEIGHT_3': 0.8861656826138701, 'WEIGHT_4': 0.7506209257891533, 'WEIGHT_5': 0.884654814579259, 'WEIGHT_6': 0.8846070718051375, 'WEIGHT_7': 0.30204294429975476, 'WEIGHT_8': 0.48694172947494724, 'optimizer': 'Adam'}
0
              precision    recall  f1-score   support

         LOC       0.11      0.12      0.12      1837
        MISC       0.03      0.06      0.04       922
         ORG       0.08      0.04      0.05      1341
         PER       0.02      0.01      0.01      1842

   micro avg       0.06      0.06      0.06      5942
   macro avg       0.06      0.06      0.05      5942
weighted avg       0.06      0.06      0.06      5942

{'EMBEDDING_DIM': 931, 'HIDDEN_DIM': 810, 'NUM_LAYERS': 1, 'DROPOUT': 0.44519109650544636, 'LR': 0.004634765268468196, 'WEIGHT_0': 0.6229811470137419, 'WEIGHT_1': 0.7584225269422105, 'WEIGHT_2': 0.5812706533411693, 'WEIGHT_3': 0.8861656826138701, 'WEIGHT_4': 0.7506209257891533, 'WEIGHT_5': 0.884654814579259, 'WEIGHT_6': 0.8846070718051375, 'WEIGHT_7': 0.30204294429975476, 'WEIGHT_8': 0.48694172947494724, 'optimizer': 'Adam'}
49
              precision    recall  f1-score   support

         LOC       0.62      0.52      0.57      1837
        MISC       0.42      0.40      0.41       922
         ORG       0.25      0.21      0.23      1341
         PER       0.30      0.29      0.29      1842

   micro avg       0.40      0.36      0.38      5942
   macro avg       0.40      0.36      0.38      5942
weighted avg       0.40      0.36      0.38      5942

epoch 49
LSTM
  0%|          | 0/50 [00:00<?, ?it/s]  2%|▏         | 1/50 [00:04<03:57,  4.84s/it]  4%|▍         | 2/50 [00:05<01:41,  2.11s/it]  6%|▌         | 3/50 [00:05<01:01,  1.32s/it]  8%|▊         | 4/50 [00:05<00:43,  1.06it/s] 10%|█         | 5/50 [00:06<00:33,  1.35it/s] 12%|█▏        | 6/50 [00:06<00:27,  1.63it/s] 14%|█▍        | 7/50 [00:06<00:23,  1.86it/s] 16%|█▌        | 8/50 [00:07<00:20,  2.06it/s] 18%|█▊        | 9/50 [00:07<00:18,  2.22it/s] 20%|██        | 10/50 [00:08<00:17,  2.34it/s] 22%|██▏       | 11/50 [00:08<00:16,  2.43it/s] 24%|██▍       | 12/50 [00:08<00:15,  2.49it/s] 26%|██▌       | 13/50 [00:09<00:14,  2.55it/s] 28%|██▊       | 14/50 [00:09<00:13,  2.58it/s] 30%|███       | 15/50 [00:09<00:13,  2.61it/s] 32%|███▏      | 16/50 [00:10<00:12,  2.62it/s] 34%|███▍      | 17/50 [00:10<00:12,  2.63it/s] 36%|███▌      | 18/50 [00:11<00:12,  2.64it/s] 38%|███▊      | 19/50 [00:11<00:11,  2.64it/s] 40%|████      | 20/50 [00:11<00:11,  2.64it/s] 42%|████▏     | 21/50 [00:12<00:10,  2.64it/s] 44%|████▍     | 22/50 [00:12<00:10,  2.64it/s] 46%|████▌     | 23/50 [00:12<00:10,  2.64it/s] 48%|████▊     | 24/50 [00:13<00:09,  2.64it/s] 50%|█████     | 25/50 [00:13<00:09,  2.63it/s] 52%|█████▏    | 26/50 [00:14<00:09,  2.63it/s] 54%|█████▍    | 27/50 [00:14<00:08,  2.63it/s] 56%|█████▌    | 28/50 [00:14<00:08,  2.63it/s] 58%|█████▊    | 29/50 [00:15<00:07,  2.64it/s] 60%|██████    | 30/50 [00:15<00:07,  2.63it/s] 62%|██████▏   | 31/50 [00:15<00:07,  2.64it/s] 64%|██████▍   | 32/50 [00:16<00:06,  2.63it/s] 66%|██████▌   | 33/50 [00:16<00:06,  2.64it/s] 68%|██████▊   | 34/50 [00:17<00:06,  2.64it/s] 70%|███████   | 35/50 [00:17<00:05,  2.64it/s] 72%|███████▏  | 36/50 [00:17<00:05,  2.64it/s] 74%|███████▍  | 37/50 [00:18<00:04,  2.64it/s] 76%|███████▌  | 38/50 [00:18<00:04,  2.63it/s] 78%|███████▊  | 39/50 [00:19<00:04,  2.64it/s] 80%|████████  | 40/50 [00:19<00:03,  2.63it/s] 82%|████████▏ | 41/50 [00:19<00:03,  2.63it/s] 84%|████████▍ | 42/50 [00:20<00:03,  2.63it/s] 86%|████████▌ | 43/50 [00:20<00:02,  2.63it/s] 88%|████████▊ | 44/50 [00:20<00:02,  2.63it/s] 90%|█████████ | 45/50 [00:21<00:01,  2.63it/s] 92%|█████████▏| 46/50 [00:21<00:01,  2.62it/s] 94%|█████████▍| 47/50 [00:22<00:01,  2.62it/s] 96%|█████████▌| 48/50 [00:22<00:00,  2.62it/s] 98%|█████████▊| 49/50 [00:22<00:00,  2.62it/s]100%|██████████| 50/50 [00:27<00:00,  1.78s/it]100%|██████████| 50/50 [00:27<00:00,  1.79it/s]
[I 2023-12-10 21:17:22,772] Trial 23 finished with value: 0.3873015873015873 and parameters: {'EMBEDDING_DIM': 739, 'HIDDEN_DIM': 615, 'NUM_LAYERS': 1, 'DROPOUT': 0.39970873522365524, 'LR': 0.0028293229965484627, 'WEIGHT_0': 0.7362864262621875, 'WEIGHT_1': 0.6347451971114011, 'WEIGHT_2': 0.4609604280309206, 'WEIGHT_3': 0.9003461517572999, 'WEIGHT_4': 0.8326662678359353, 'WEIGHT_5': 0.965090946471428, 'WEIGHT_6': 0.8122990604496971, 'WEIGHT_7': 0.24664242785955764, 'WEIGHT_8': 0.6069925139741458, 'optimizer': 'Adam'}. Best is trial 19 with value: 0.3947319948425124.
/userhome/cs2/dingruiw/conda/envs/py310/lib/python3.10/site-packages/torch/nn/modules/rnn.py:82: UserWarning: dropout option adds dropout after all but last recurrent layer, so non-zero dropout expects num_layers greater than 1, but got dropout=0.3885112407745235 and num_layers=1
  warnings.warn("dropout option adds dropout after all but last "
{'EMBEDDING_DIM': 739, 'HIDDEN_DIM': 615, 'NUM_LAYERS': 1, 'DROPOUT': 0.39970873522365524, 'LR': 0.0028293229965484627, 'WEIGHT_0': 0.7362864262621875, 'WEIGHT_1': 0.6347451971114011, 'WEIGHT_2': 0.4609604280309206, 'WEIGHT_3': 0.9003461517572999, 'WEIGHT_4': 0.8326662678359353, 'WEIGHT_5': 0.965090946471428, 'WEIGHT_6': 0.8122990604496971, 'WEIGHT_7': 0.24664242785955764, 'WEIGHT_8': 0.6069925139741458, 'optimizer': 'Adam'}
0
              precision    recall  f1-score   support

         LOC       0.06      0.03      0.04      1837
        MISC       0.03      0.02      0.03       922
         ORG       0.07      0.06      0.06      1341
         PER       0.06      0.02      0.03      1842

   micro avg       0.06      0.03      0.04      5942
   macro avg       0.05      0.03      0.04      5942
weighted avg       0.06      0.03      0.04      5942

{'EMBEDDING_DIM': 739, 'HIDDEN_DIM': 615, 'NUM_LAYERS': 1, 'DROPOUT': 0.39970873522365524, 'LR': 0.0028293229965484627, 'WEIGHT_0': 0.7362864262621875, 'WEIGHT_1': 0.6347451971114011, 'WEIGHT_2': 0.4609604280309206, 'WEIGHT_3': 0.9003461517572999, 'WEIGHT_4': 0.8326662678359353, 'WEIGHT_5': 0.965090946471428, 'WEIGHT_6': 0.8122990604496971, 'WEIGHT_7': 0.24664242785955764, 'WEIGHT_8': 0.6069925139741458, 'optimizer': 'Adam'}
49
              precision    recall  f1-score   support

         LOC       0.50      0.54      0.52      1837
        MISC       0.44      0.40      0.42       922
         ORG       0.26      0.25      0.25      1341
         PER       0.33      0.34      0.33      1842

   micro avg       0.38      0.39      0.39      5942
   macro avg       0.38      0.38      0.38      5942
weighted avg       0.38      0.39      0.39      5942

epoch 49
LSTM
  0%|          | 0/50 [00:00<?, ?it/s]  2%|▏         | 1/50 [00:05<04:24,  5.40s/it]  4%|▍         | 2/50 [00:05<01:53,  2.37s/it]  6%|▌         | 3/50 [00:06<01:13,  1.56s/it]  8%|▊         | 4/50 [00:06<00:54,  1.18s/it] 10%|█         | 5/50 [00:07<00:43,  1.03it/s] 12%|█▏        | 6/50 [00:08<00:36,  1.19it/s] 14%|█▍        | 7/50 [00:08<00:32,  1.32it/s] 16%|█▌        | 8/50 [00:09<00:29,  1.42it/s] 18%|█▊        | 9/50 [00:09<00:27,  1.50it/s] 20%|██        | 10/50 [00:10<00:25,  1.56it/s] 22%|██▏       | 11/50 [00:10<00:24,  1.61it/s] 24%|██▍       | 12/50 [00:11<00:23,  1.64it/s] 26%|██▌       | 13/50 [00:12<00:22,  1.66it/s] 28%|██▊       | 14/50 [00:12<00:21,  1.67it/s] 30%|███       | 15/50 [00:13<00:20,  1.68it/s] 32%|███▏      | 16/50 [00:13<00:20,  1.68it/s] 34%|███▍      | 17/50 [00:14<00:19,  1.68it/s] 36%|███▌      | 18/50 [00:15<00:18,  1.69it/s] 38%|███▊      | 19/50 [00:15<00:18,  1.69it/s] 40%|████      | 20/50 [00:16<00:17,  1.68it/s] 42%|████▏     | 21/50 [00:16<00:17,  1.68it/s] 44%|████▍     | 22/50 [00:17<00:16,  1.68it/s] 46%|████▌     | 23/50 [00:18<00:15,  1.69it/s] 48%|████▊     | 24/50 [00:18<00:15,  1.69it/s] 50%|█████     | 25/50 [00:19<00:14,  1.69it/s] 52%|█████▏    | 26/50 [00:19<00:14,  1.69it/s] 54%|█████▍    | 27/50 [00:20<00:13,  1.69it/s] 56%|█████▌    | 28/50 [00:20<00:13,  1.69it/s] 58%|█████▊    | 29/50 [00:21<00:12,  1.69it/s] 60%|██████    | 30/50 [00:22<00:11,  1.69it/s] 62%|██████▏   | 31/50 [00:22<00:11,  1.69it/s] 64%|██████▍   | 32/50 [00:23<00:10,  1.69it/s] 66%|██████▌   | 33/50 [00:23<00:10,  1.68it/s] 68%|██████▊   | 34/50 [00:24<00:09,  1.68it/s] 70%|███████   | 35/50 [00:25<00:08,  1.68it/s] 72%|███████▏  | 36/50 [00:25<00:08,  1.67it/s] 74%|███████▍  | 37/50 [00:26<00:07,  1.68it/s] 76%|███████▌  | 38/50 [00:26<00:07,  1.68it/s] 78%|███████▊  | 39/50 [00:27<00:06,  1.69it/s] 80%|████████  | 40/50 [00:28<00:05,  1.68it/s] 82%|████████▏ | 41/50 [00:28<00:05,  1.68it/s] 84%|████████▍ | 42/50 [00:29<00:04,  1.68it/s] 86%|████████▌ | 43/50 [00:29<00:04,  1.68it/s] 88%|████████▊ | 44/50 [00:30<00:03,  1.68it/s] 90%|█████████ | 45/50 [00:31<00:02,  1.69it/s] 92%|█████████▏| 46/50 [00:31<00:02,  1.68it/s] 94%|█████████▍| 47/50 [00:32<00:01,  1.68it/s] 96%|█████████▌| 48/50 [00:32<00:01,  1.68it/s] 98%|█████████▊| 49/50 [00:33<00:00,  1.68it/s]100%|██████████| 50/50 [00:39<00:00,  2.13s/it]100%|██████████| 50/50 [00:39<00:00,  1.28it/s]
[I 2023-12-10 21:18:06,410] Trial 24 finished with value: 0.38242445293504684 and parameters: {'EMBEDDING_DIM': 438, 'HIDDEN_DIM': 938, 'NUM_LAYERS': 1, 'DROPOUT': 0.3885112407745235, 'LR': 0.002822783893920562, 'WEIGHT_0': 0.8560215747504029, 'WEIGHT_1': 0.8242217034885313, 'WEIGHT_2': 0.41001859495099136, 'WEIGHT_3': 0.8019122452393215, 'WEIGHT_4': 0.896652241003214, 'WEIGHT_5': 0.9768550317066798, 'WEIGHT_6': 0.7881917749647998, 'WEIGHT_7': 0.3561006782045029, 'WEIGHT_8': 0.8036275143548376, 'optimizer': 'Adam'}. Best is trial 19 with value: 0.3947319948425124.
{'EMBEDDING_DIM': 438, 'HIDDEN_DIM': 938, 'NUM_LAYERS': 1, 'DROPOUT': 0.3885112407745235, 'LR': 0.002822783893920562, 'WEIGHT_0': 0.8560215747504029, 'WEIGHT_1': 0.8242217034885313, 'WEIGHT_2': 0.41001859495099136, 'WEIGHT_3': 0.8019122452393215, 'WEIGHT_4': 0.896652241003214, 'WEIGHT_5': 0.9768550317066798, 'WEIGHT_6': 0.7881917749647998, 'WEIGHT_7': 0.3561006782045029, 'WEIGHT_8': 0.8036275143548376, 'optimizer': 'Adam'}
0
              precision    recall  f1-score   support

         LOC       0.10      0.03      0.04      1837
        MISC       0.03      0.03      0.03       922
         ORG       0.05      0.02      0.02      1341
         PER       0.04      0.03      0.03      1842

   micro avg       0.05      0.02      0.03      5942
   macro avg       0.05      0.02      0.03      5942
weighted avg       0.06      0.02      0.03      5942

{'EMBEDDING_DIM': 438, 'HIDDEN_DIM': 938, 'NUM_LAYERS': 1, 'DROPOUT': 0.3885112407745235, 'LR': 0.002822783893920562, 'WEIGHT_0': 0.8560215747504029, 'WEIGHT_1': 0.8242217034885313, 'WEIGHT_2': 0.41001859495099136, 'WEIGHT_3': 0.8019122452393215, 'WEIGHT_4': 0.896652241003214, 'WEIGHT_5': 0.9768550317066798, 'WEIGHT_6': 0.7881917749647998, 'WEIGHT_7': 0.3561006782045029, 'WEIGHT_8': 0.8036275143548376, 'optimizer': 'Adam'}
49
              precision    recall  f1-score   support

         LOC       0.57      0.50      0.53      1837
        MISC       0.36      0.38      0.37       922
         ORG       0.25      0.24      0.24      1341
         PER       0.36      0.33      0.34      1842

   micro avg       0.40      0.37      0.38      5942
   macro avg       0.38      0.36      0.37      5942
weighted avg       0.40      0.37      0.38      5942

epoch 49
LSTM
  0%|          | 0/50 [00:00<?, ?it/s]  2%|▏         | 1/50 [00:06<04:55,  6.02s/it]  4%|▍         | 2/50 [00:06<02:07,  2.67s/it]  6%|▌         | 3/50 [00:06<01:21,  1.73s/it]  8%|▊         | 4/50 [00:07<00:59,  1.28s/it] 10%|█         | 5/50 [00:08<00:46,  1.04s/it] 12%|█▏        | 6/50 [00:08<00:39,  1.12it/s] 14%|█▍        | 7/50 [00:09<00:34,  1.25it/s] 16%|█▌        | 8/50 [00:09<00:31,  1.35it/s] 18%|█▊        | 9/50 [00:10<00:28,  1.43it/s] 20%|██        | 10/50 [00:11<00:26,  1.49it/s] 22%|██▏       | 11/50 [00:11<00:25,  1.53it/s] 24%|██▍       | 12/50 [00:12<00:24,  1.56it/s] 26%|██▌       | 13/50 [00:13<00:23,  1.58it/s] 28%|██▊       | 14/50 [00:13<00:22,  1.60it/s] 30%|███       | 15/50 [00:14<00:21,  1.61it/s] 32%|███▏      | 16/50 [00:14<00:21,  1.62it/s] 34%|███▍      | 17/50 [00:15<00:20,  1.63it/s] 36%|███▌      | 18/50 [00:16<00:19,  1.63it/s] 38%|███▊      | 19/50 [00:16<00:18,  1.63it/s] 40%|████      | 20/50 [00:17<00:18,  1.64it/s] 42%|████▏     | 21/50 [00:17<00:17,  1.63it/s] 44%|████▍     | 22/50 [00:18<00:17,  1.63it/s] 46%|████▌     | 23/50 [00:19<00:16,  1.63it/s] 48%|████▊     | 24/50 [00:19<00:15,  1.64it/s] 50%|█████     | 25/50 [00:20<00:15,  1.63it/s] 52%|█████▏    | 26/50 [00:20<00:14,  1.63it/s] 54%|█████▍    | 27/50 [00:21<00:14,  1.62it/s] 56%|█████▌    | 28/50 [00:22<00:13,  1.62it/s] 58%|█████▊    | 29/50 [00:22<00:12,  1.62it/s] 60%|██████    | 30/50 [00:23<00:12,  1.61it/s] 62%|██████▏   | 31/50 [00:24<00:11,  1.61it/s] 64%|██████▍   | 32/50 [00:24<00:11,  1.61it/s] 66%|██████▌   | 33/50 [00:25<00:10,  1.61it/s] 68%|██████▊   | 34/50 [00:25<00:09,  1.61it/s] 70%|███████   | 35/50 [00:26<00:09,  1.60it/s] 72%|███████▏  | 36/50 [00:27<00:08,  1.60it/s] 74%|███████▍  | 37/50 [00:27<00:08,  1.60it/s] 76%|███████▌  | 38/50 [00:28<00:07,  1.60it/s] 78%|███████▊  | 39/50 [00:29<00:06,  1.60it/s] 80%|████████  | 40/50 [00:29<00:06,  1.60it/s] 82%|████████▏ | 41/50 [00:30<00:05,  1.60it/s] 84%|████████▍ | 42/50 [00:30<00:05,  1.59it/s] 86%|████████▌ | 43/50 [00:31<00:04,  1.60it/s] 88%|████████▊ | 44/50 [00:32<00:03,  1.60it/s] 90%|█████████ | 45/50 [00:32<00:03,  1.59it/s] 92%|█████████▏| 46/50 [00:33<00:02,  1.60it/s] 94%|█████████▍| 47/50 [00:34<00:01,  1.60it/s] 96%|█████████▌| 48/50 [00:34<00:01,  1.60it/s] 98%|█████████▊| 49/50 [00:35<00:00,  1.59it/s]100%|██████████| 50/50 [00:41<00:00,  2.25s/it]100%|██████████| 50/50 [00:41<00:00,  1.21it/s]
