[I 2023-12-10 21:28:58,886] Trial 37 finished with value: 0.39415568057771433 and parameters: {'EMBEDDING_DIM': 953, 'HIDDEN_DIM': 654, 'NUM_LAYERS': 1, 'DROPOUT': 0.33663867865083885, 'LR': 0.0028575130862723104, 'WEIGHT_0': 0.5511710110995642, 'WEIGHT_1': 0.8258511706890775, 'WEIGHT_2': 0.6822909336954925, 'WEIGHT_3': 0.676598583885534, 'WEIGHT_4': 0.8500525894942859, 'WEIGHT_5': 0.8191231289031614, 'WEIGHT_6': 0.6353690227394237, 'WEIGHT_7': 0.19178289567717108, 'WEIGHT_8': 0.6629540381321027, 'optimizer': 'Adam'}. Best is trial 26 with value: 0.4051425745838141.
{'EMBEDDING_DIM': 953, 'HIDDEN_DIM': 654, 'NUM_LAYERS': 1, 'DROPOUT': 0.33663867865083885, 'LR': 0.0028575130862723104, 'WEIGHT_0': 0.5511710110995642, 'WEIGHT_1': 0.8258511706890775, 'WEIGHT_2': 0.6822909336954925, 'WEIGHT_3': 0.676598583885534, 'WEIGHT_4': 0.8500525894942859, 'WEIGHT_5': 0.8191231289031614, 'WEIGHT_6': 0.6353690227394237, 'WEIGHT_7': 0.19178289567717108, 'WEIGHT_8': 0.6629540381321027, 'optimizer': 'Adam'}
0
              precision    recall  f1-score   support

         LOC       0.09      0.05      0.06      1837
        MISC       0.05      0.03      0.03       922
         ORG       0.08      0.04      0.05      1341
         PER       0.05      0.02      0.03      1842

   micro avg       0.07      0.03      0.04      5942
   macro avg       0.07      0.03      0.04      5942
weighted avg       0.07      0.03      0.04      5942

{'EMBEDDING_DIM': 953, 'HIDDEN_DIM': 654, 'NUM_LAYERS': 1, 'DROPOUT': 0.33663867865083885, 'LR': 0.0028575130862723104, 'WEIGHT_0': 0.5511710110995642, 'WEIGHT_1': 0.8258511706890775, 'WEIGHT_2': 0.6822909336954925, 'WEIGHT_3': 0.676598583885534, 'WEIGHT_4': 0.8500525894942859, 'WEIGHT_5': 0.8191231289031614, 'WEIGHT_6': 0.6353690227394237, 'WEIGHT_7': 0.19178289567717108, 'WEIGHT_8': 0.6629540381321027, 'optimizer': 'Adam'}
49
              precision    recall  f1-score   support

         LOC       0.55      0.56      0.55      1837
        MISC       0.42      0.43      0.43       922
         ORG       0.25      0.25      0.25      1341
         PER       0.32      0.32      0.32      1842

   micro avg       0.39      0.39      0.39      5942
   macro avg       0.39      0.39      0.39      5942
weighted avg       0.39      0.39      0.39      5942

epoch 49
LSTM
  0%|          | 0/50 [00:00<?, ?it/s]  2%|▏         | 1/50 [00:05<04:22,  5.35s/it]  4%|▍         | 2/50 [00:05<01:48,  2.27s/it]  6%|▌         | 3/50 [00:05<01:02,  1.32s/it]  8%|▊         | 4/50 [00:05<00:40,  1.14it/s] 10%|█         | 5/50 [00:06<00:28,  1.58it/s] 12%|█▏        | 6/50 [00:06<00:21,  2.05it/s] 14%|█▍        | 7/50 [00:06<00:16,  2.54it/s] 16%|█▌        | 8/50 [00:06<00:13,  3.01it/s] 18%|█▊        | 9/50 [00:06<00:11,  3.43it/s] 20%|██        | 10/50 [00:07<00:10,  3.79it/s] 22%|██▏       | 11/50 [00:07<00:09,  4.09it/s] 24%|██▍       | 12/50 [00:07<00:08,  4.32it/s] 26%|██▌       | 13/50 [00:07<00:08,  4.49it/s] 28%|██▊       | 14/50 [00:07<00:07,  4.62it/s] 30%|███       | 15/50 [00:08<00:07,  4.72it/s] 32%|███▏      | 16/50 [00:08<00:07,  4.79it/s] 34%|███▍      | 17/50 [00:08<00:06,  4.84it/s] 36%|███▌      | 18/50 [00:08<00:06,  4.87it/s] 38%|███▊      | 19/50 [00:08<00:06,  4.92it/s] 40%|████      | 20/50 [00:09<00:06,  4.90it/s] 42%|████▏     | 21/50 [00:09<00:05,  4.92it/s] 44%|████▍     | 22/50 [00:09<00:05,  4.94it/s] 46%|████▌     | 23/50 [00:09<00:05,  4.95it/s] 48%|████▊     | 24/50 [00:09<00:05,  4.94it/s] 50%|█████     | 25/50 [00:10<00:05,  4.94it/s] 52%|█████▏    | 26/50 [00:10<00:04,  4.94it/s] 54%|█████▍    | 27/50 [00:10<00:04,  4.94it/s] 56%|█████▌    | 28/50 [00:10<00:04,  4.95it/s] 58%|█████▊    | 29/50 [00:10<00:04,  4.94it/s] 60%|██████    | 30/50 [00:11<00:04,  4.94it/s] 62%|██████▏   | 31/50 [00:11<00:03,  4.94it/s] 64%|██████▍   | 32/50 [00:11<00:03,  4.95it/s] 66%|██████▌   | 33/50 [00:11<00:03,  4.95it/s] 68%|██████▊   | 34/50 [00:11<00:03,  4.94it/s] 70%|███████   | 35/50 [00:12<00:03,  4.95it/s] 72%|███████▏  | 36/50 [00:12<00:02,  4.95it/s] 74%|███████▍  | 37/50 [00:12<00:02,  4.94it/s] 76%|███████▌  | 38/50 [00:12<00:02,  4.95it/s] 78%|███████▊  | 39/50 [00:12<00:02,  4.93it/s] 80%|████████  | 40/50 [00:13<00:02,  4.92it/s] 82%|████████▏ | 41/50 [00:13<00:01,  4.92it/s] 84%|████████▍ | 42/50 [00:13<00:01,  4.91it/s] 86%|████████▌ | 43/50 [00:13<00:01,  4.91it/s] 88%|████████▊ | 44/50 [00:13<00:01,  4.91it/s] 90%|█████████ | 45/50 [00:14<00:01,  4.91it/s] 92%|█████████▏| 46/50 [00:14<00:00,  4.91it/s] 94%|█████████▍| 47/50 [00:14<00:00,  4.92it/s] 96%|█████████▌| 48/50 [00:14<00:00,  4.91it/s] 98%|█████████▊| 49/50 [00:14<00:00,  4.92it/s]100%|██████████| 50/50 [00:20<00:00,  1.85s/it]100%|██████████| 50/50 [00:20<00:00,  2.42it/s]
[I 2023-12-10 21:29:24,538] Trial 38 finished with value: 0.3842203928600539 and parameters: {'EMBEDDING_DIM': 869, 'HIDDEN_DIM': 224, 'NUM_LAYERS': 2, 'DROPOUT': 0.3360316909766307, 'LR': 0.002087936631283765, 'WEIGHT_0': 0.34700045011179703, 'WEIGHT_1': 0.49752234725345634, 'WEIGHT_2': 0.9486768968187291, 'WEIGHT_3': 0.7927939192418351, 'WEIGHT_4': 0.9017884520065877, 'WEIGHT_5': 0.7473078932377162, 'WEIGHT_6': 0.7628106089025137, 'WEIGHT_7': 0.29526399480425247, 'WEIGHT_8': 0.8528714823112946, 'optimizer': 'RMSprop'}. Best is trial 26 with value: 0.4051425745838141.
/userhome/cs2/dingruiw/conda/envs/py310/lib/python3.10/site-packages/torch/nn/modules/rnn.py:82: UserWarning: dropout option adds dropout after all but last recurrent layer, so non-zero dropout expects num_layers greater than 1, but got dropout=0.3776670442219483 and num_layers=1
  warnings.warn("dropout option adds dropout after all but last "
{'EMBEDDING_DIM': 869, 'HIDDEN_DIM': 224, 'NUM_LAYERS': 2, 'DROPOUT': 0.3360316909766307, 'LR': 0.002087936631283765, 'WEIGHT_0': 0.34700045011179703, 'WEIGHT_1': 0.49752234725345634, 'WEIGHT_2': 0.9486768968187291, 'WEIGHT_3': 0.7927939192418351, 'WEIGHT_4': 0.9017884520065877, 'WEIGHT_5': 0.7473078932377162, 'WEIGHT_6': 0.7628106089025137, 'WEIGHT_7': 0.29526399480425247, 'WEIGHT_8': 0.8528714823112946, 'optimizer': 'RMSprop'}
0
              precision    recall  f1-score   support

         LOC       0.15      0.06      0.08      1837
        MISC       0.05      0.01      0.01       922
         ORG       0.00      0.00      0.00      1341
         PER       0.00      0.00      0.00      1842

   micro avg       0.13      0.02      0.03      5942
   macro avg       0.05      0.02      0.02      5942
weighted avg       0.05      0.02      0.03      5942

{'EMBEDDING_DIM': 869, 'HIDDEN_DIM': 224, 'NUM_LAYERS': 2, 'DROPOUT': 0.3360316909766307, 'LR': 0.002087936631283765, 'WEIGHT_0': 0.34700045011179703, 'WEIGHT_1': 0.49752234725345634, 'WEIGHT_2': 0.9486768968187291, 'WEIGHT_3': 0.7927939192418351, 'WEIGHT_4': 0.9017884520065877, 'WEIGHT_5': 0.7473078932377162, 'WEIGHT_6': 0.7628106089025137, 'WEIGHT_7': 0.29526399480425247, 'WEIGHT_8': 0.8528714823112946, 'optimizer': 'RMSprop'}
49
              precision    recall  f1-score   support

         LOC       0.57      0.52      0.55      1837
        MISC       0.35      0.40      0.38       922
         ORG       0.22      0.29      0.25      1341
         PER       0.35      0.35      0.35      1842

   micro avg       0.37      0.40      0.38      5942
   macro avg       0.37      0.39      0.38      5942
weighted avg       0.39      0.40      0.39      5942

epoch 49
LSTM
  0%|          | 0/50 [00:00<?, ?it/s]  2%|▏         | 1/50 [00:04<03:58,  4.87s/it]  4%|▍         | 2/50 [00:04<01:39,  2.07s/it]  6%|▌         | 3/50 [00:05<00:56,  1.21s/it]  8%|▊         | 4/50 [00:05<00:36,  1.25it/s] 10%|█         | 5/50 [00:05<00:26,  1.72it/s] 12%|█▏        | 6/50 [00:05<00:19,  2.24it/s] 14%|█▍        | 7/50 [00:05<00:15,  2.77it/s] 16%|█▌        | 8/50 [00:06<00:12,  3.28it/s] 18%|█▊        | 9/50 [00:06<00:10,  3.73it/s] 20%|██        | 10/50 [00:06<00:09,  4.13it/s] 22%|██▏       | 11/50 [00:06<00:08,  4.45it/s] 24%|██▍       | 12/50 [00:06<00:08,  4.70it/s] 26%|██▌       | 13/50 [00:07<00:07,  4.89it/s] 28%|██▊       | 14/50 [00:07<00:07,  5.02it/s] 30%|███       | 15/50 [00:07<00:06,  5.12it/s] 32%|███▏      | 16/50 [00:07<00:06,  5.19it/s] 34%|███▍      | 17/50 [00:07<00:06,  5.25it/s] 36%|███▌      | 18/50 [00:07<00:06,  5.29it/s] 38%|███▊      | 19/50 [00:08<00:05,  5.32it/s] 40%|████      | 20/50 [00:08<00:05,  5.33it/s] 42%|████▏     | 21/50 [00:08<00:05,  5.35it/s] 44%|████▍     | 22/50 [00:08<00:05,  5.35it/s] 46%|████▌     | 23/50 [00:08<00:05,  5.36it/s] 48%|████▊     | 24/50 [00:09<00:04,  5.37it/s] 50%|█████     | 25/50 [00:09<00:04,  5.37it/s] 52%|█████▏    | 26/50 [00:09<00:04,  5.37it/s] 54%|█████▍    | 27/50 [00:09<00:04,  5.37it/s] 56%|█████▌    | 28/50 [00:09<00:04,  5.37it/s] 58%|█████▊    | 29/50 [00:09<00:03,  5.37it/s] 60%|██████    | 30/50 [00:10<00:03,  5.38it/s] 62%|██████▏   | 31/50 [00:10<00:03,  5.38it/s] 64%|██████▍   | 32/50 [00:10<00:03,  5.38it/s] 66%|██████▌   | 33/50 [00:10<00:03,  5.38it/s] 68%|██████▊   | 34/50 [00:10<00:02,  5.38it/s] 70%|███████   | 35/50 [00:11<00:02,  5.37it/s] 72%|███████▏  | 36/50 [00:11<00:02,  5.38it/s] 74%|███████▍  | 37/50 [00:11<00:02,  5.39it/s] 76%|███████▌  | 38/50 [00:11<00:02,  5.38it/s] 78%|███████▊  | 39/50 [00:11<00:02,  5.38it/s] 80%|████████  | 40/50 [00:12<00:01,  5.38it/s] 82%|████████▏ | 41/50 [00:12<00:01,  5.37it/s] 84%|████████▍ | 42/50 [00:12<00:01,  5.38it/s] 86%|████████▌ | 43/50 [00:12<00:01,  5.38it/s] 88%|████████▊ | 44/50 [00:12<00:01,  5.37it/s] 90%|█████████ | 45/50 [00:12<00:00,  5.37it/s] 92%|█████████▏| 46/50 [00:13<00:00,  5.37it/s] 94%|█████████▍| 47/50 [00:13<00:00,  5.37it/s] 96%|█████████▌| 48/50 [00:13<00:00,  5.37it/s] 98%|█████████▊| 49/50 [00:13<00:00,  5.37it/s]100%|██████████| 50/50 [00:18<00:00,  1.62s/it]100%|██████████| 50/50 [00:18<00:00,  2.68it/s]
[I 2023-12-10 21:29:47,373] Trial 39 finished with value: 0.02506265664160401 and parameters: {'EMBEDDING_DIM': 625, 'HIDDEN_DIM': 371, 'NUM_LAYERS': 1, 'DROPOUT': 0.3776670442219483, 'LR': 0.0015194033754359244, 'WEIGHT_0': 0.14039344368169904, 'WEIGHT_1': 0.9928161199304925, 'WEIGHT_2': 0.59071573732342, 'WEIGHT_3': 0.8430017800713502, 'WEIGHT_4': 0.8455683366815057, 'WEIGHT_5': 0.5478938904655131, 'WEIGHT_6': 0.9360014022465252, 'WEIGHT_7': 0.4924853805741986, 'WEIGHT_8': 0.7968235176766255, 'optimizer': 'SGD'}. Best is trial 26 with value: 0.4051425745838141.
/userhome/cs2/dingruiw/conda/envs/py310/lib/python3.10/site-packages/torch/nn/modules/rnn.py:82: UserWarning: dropout option adds dropout after all but last recurrent layer, so non-zero dropout expects num_layers greater than 1, but got dropout=0.41757580471829026 and num_layers=1
  warnings.warn("dropout option adds dropout after all but last "
{'EMBEDDING_DIM': 625, 'HIDDEN_DIM': 371, 'NUM_LAYERS': 1, 'DROPOUT': 0.3776670442219483, 'LR': 0.0015194033754359244, 'WEIGHT_0': 0.14039344368169904, 'WEIGHT_1': 0.9928161199304925, 'WEIGHT_2': 0.59071573732342, 'WEIGHT_3': 0.8430017800713502, 'WEIGHT_4': 0.8455683366815057, 'WEIGHT_5': 0.5478938904655131, 'WEIGHT_6': 0.9360014022465252, 'WEIGHT_7': 0.4924853805741986, 'WEIGHT_8': 0.7968235176766255, 'optimizer': 'SGD'}
0
              precision    recall  f1-score   support

         LOC       0.03      0.11      0.05      1837
        MISC       0.01      0.10      0.02       922
         ORG       0.02      0.15      0.03      1341
         PER       0.01      0.08      0.02      1842

   micro avg       0.02      0.11      0.03      5942
   macro avg       0.02      0.11      0.03      5942
weighted avg       0.02      0.11      0.03      5942

{'EMBEDDING_DIM': 625, 'HIDDEN_DIM': 371, 'NUM_LAYERS': 1, 'DROPOUT': 0.3776670442219483, 'LR': 0.0015194033754359244, 'WEIGHT_0': 0.14039344368169904, 'WEIGHT_1': 0.9928161199304925, 'WEIGHT_2': 0.59071573732342, 'WEIGHT_3': 0.8430017800713502, 'WEIGHT_4': 0.8455683366815057, 'WEIGHT_5': 0.5478938904655131, 'WEIGHT_6': 0.9360014022465252, 'WEIGHT_7': 0.4924853805741986, 'WEIGHT_8': 0.7968235176766255, 'optimizer': 'SGD'}
49
              precision    recall  f1-score   support

         LOC       0.03      0.06      0.04      1837
        MISC       0.01      0.05      0.01       922
         ORG       0.02      0.10      0.03      1341
         PER       0.01      0.06      0.02      1842

   micro avg       0.02      0.07      0.03      5942
   macro avg       0.02      0.07      0.03      5942
weighted avg       0.02      0.07      0.03      5942

epoch 49
LSTM
  0%|          | 0/50 [00:00<?, ?it/s]  2%|▏         | 1/50 [00:05<04:22,  5.35s/it]  4%|▍         | 2/50 [00:05<01:52,  2.35s/it]  6%|▌         | 3/50 [00:06<01:11,  1.53s/it]  8%|▊         | 4/50 [00:06<00:52,  1.14s/it] 10%|█         | 5/50 [00:07<00:41,  1.07it/s] 12%|█▏        | 6/50 [00:07<00:35,  1.25it/s] 14%|█▍        | 7/50 [00:08<00:31,  1.39it/s] 16%|█▌        | 8/50 [00:08<00:28,  1.50it/s] 18%|█▊        | 9/50 [00:09<00:25,  1.58it/s] 20%|██        | 10/50 [00:10<00:24,  1.65it/s] 22%|██▏       | 11/50 [00:10<00:23,  1.69it/s] 24%|██▍       | 12/50 [00:11<00:22,  1.72it/s] 26%|██▌       | 13/50 [00:11<00:21,  1.75it/s] 28%|██▊       | 14/50 [00:12<00:20,  1.77it/s] 30%|███       | 15/50 [00:12<00:19,  1.78it/s] 32%|███▏      | 16/50 [00:13<00:19,  1.78it/s] 34%|███▍      | 17/50 [00:13<00:18,  1.79it/s] 36%|███▌      | 18/50 [00:14<00:17,  1.79it/s] 38%|███▊      | 19/50 [00:15<00:17,  1.79it/s] 40%|████      | 20/50 [00:15<00:16,  1.80it/s] 42%|████▏     | 21/50 [00:16<00:16,  1.79it/s] 44%|████▍     | 22/50 [00:16<00:15,  1.79it/s] 46%|████▌     | 23/50 [00:17<00:15,  1.79it/s] 48%|████▊     | 24/50 [00:17<00:14,  1.80it/s] 50%|█████     | 25/50 [00:18<00:13,  1.80it/s] 52%|█████▏    | 26/50 [00:18<00:13,  1.80it/s] 54%|█████▍    | 27/50 [00:19<00:12,  1.80it/s] 56%|█████▌    | 28/50 [00:20<00:12,  1.80it/s] 58%|█████▊    | 29/50 [00:20<00:11,  1.80it/s] 60%|██████    | 30/50 [00:21<00:11,  1.80it/s] 62%|██████▏   | 31/50 [00:21<00:10,  1.79it/s] 64%|██████▍   | 32/50 [00:22<00:10,  1.79it/s] 66%|██████▌   | 33/50 [00:22<00:09,  1.79it/s] 68%|██████▊   | 34/50 [00:23<00:08,  1.79it/s] 70%|███████   | 35/50 [00:23<00:08,  1.79it/s] 72%|███████▏  | 36/50 [00:24<00:07,  1.79it/s] 74%|███████▍  | 37/50 [00:25<00:07,  1.79it/s] 76%|███████▌  | 38/50 [00:25<00:06,  1.79it/s] 78%|███████▊  | 39/50 [00:26<00:06,  1.78it/s] 80%|████████  | 40/50 [00:26<00:05,  1.78it/s] 82%|████████▏ | 41/50 [00:27<00:05,  1.78it/s] 84%|████████▍ | 42/50 [00:27<00:04,  1.78it/s] 86%|████████▌ | 43/50 [00:28<00:03,  1.78it/s] 88%|████████▊ | 44/50 [00:28<00:03,  1.78it/s] 90%|█████████ | 45/50 [00:29<00:02,  1.77it/s] 92%|█████████▏| 46/50 [00:30<00:02,  1.77it/s] 94%|█████████▍| 47/50 [00:30<00:01,  1.77it/s] 96%|█████████▌| 48/50 [00:31<00:01,  1.77it/s] 98%|█████████▊| 49/50 [00:31<00:00,  1.78it/s]100%|██████████| 50/50 [00:37<00:00,  2.09s/it]100%|██████████| 50/50 [00:37<00:00,  1.33it/s]
[I 2023-12-10 21:30:29,264] Trial 40 finished with value: 0.3016981548187899 and parameters: {'EMBEDDING_DIM': 361, 'HIDDEN_DIM': 933, 'NUM_LAYERS': 1, 'DROPOUT': 0.41757580471829026, 'LR': 0.009414984193135262, 'WEIGHT_0': 0.5960049201214703, 'WEIGHT_1': 0.6062667200131756, 'WEIGHT_2': 0.49436589583122126, 'WEIGHT_3': 0.6020296803032893, 'WEIGHT_4': 0.7375301269553645, 'WEIGHT_5': 0.9222877480684875, 'WEIGHT_6': 0.8302707778776292, 'WEIGHT_7': 0.5852635714189399, 'WEIGHT_8': 0.7359040426194823, 'optimizer': 'Adam'}. Best is trial 26 with value: 0.4051425745838141.
/userhome/cs2/dingruiw/conda/envs/py310/lib/python3.10/site-packages/torch/nn/modules/rnn.py:82: UserWarning: dropout option adds dropout after all but last recurrent layer, so non-zero dropout expects num_layers greater than 1, but got dropout=0.33024513490088947 and num_layers=1
  warnings.warn("dropout option adds dropout after all but last "
{'EMBEDDING_DIM': 361, 'HIDDEN_DIM': 933, 'NUM_LAYERS': 1, 'DROPOUT': 0.41757580471829026, 'LR': 0.009414984193135262, 'WEIGHT_0': 0.5960049201214703, 'WEIGHT_1': 0.6062667200131756, 'WEIGHT_2': 0.49436589583122126, 'WEIGHT_3': 0.6020296803032893, 'WEIGHT_4': 0.7375301269553645, 'WEIGHT_5': 0.9222877480684875, 'WEIGHT_6': 0.8302707778776292, 'WEIGHT_7': 0.5852635714189399, 'WEIGHT_8': 0.7359040426194823, 'optimizer': 'Adam'}
0
              precision    recall  f1-score   support

         LOC       0.09      0.03      0.04      1837
        MISC       0.01      0.01      0.01       922
         ORG       0.06      0.01      0.02      1341
         PER       0.12      0.01      0.01      1842

   micro avg       0.05      0.01      0.02      5942
   macro avg       0.07      0.01      0.02      5942
weighted avg       0.08      0.01      0.02      5942

{'EMBEDDING_DIM': 361, 'HIDDEN_DIM': 933, 'NUM_LAYERS': 1, 'DROPOUT': 0.41757580471829026, 'LR': 0.009414984193135262, 'WEIGHT_0': 0.5960049201214703, 'WEIGHT_1': 0.6062667200131756, 'WEIGHT_2': 0.49436589583122126, 'WEIGHT_3': 0.6020296803032893, 'WEIGHT_4': 0.7375301269553645, 'WEIGHT_5': 0.9222877480684875, 'WEIGHT_6': 0.8302707778776292, 'WEIGHT_7': 0.5852635714189399, 'WEIGHT_8': 0.7359040426194823, 'optimizer': 'Adam'}
49
              precision    recall  f1-score   support

         LOC       0.48      0.51      0.50      1837
        MISC       0.25      0.38      0.30       922
         ORG       0.17      0.23      0.20      1341
         PER       0.18      0.24      0.21      1842

   micro avg       0.27      0.35      0.30      5942
   macro avg       0.27      0.34      0.30      5942
weighted avg       0.28      0.35      0.31      5942

epoch 49
LSTM
  0%|          | 0/50 [00:00<?, ?it/s]  2%|▏         | 1/50 [00:04<04:03,  4.97s/it]  4%|▍         | 2/50 [00:05<01:45,  2.19s/it]  6%|▌         | 3/50 [00:05<01:06,  1.41s/it]  8%|▊         | 4/50 [00:06<00:48,  1.05s/it] 10%|█         | 5/50 [00:06<00:38,  1.17it/s] 12%|█▏        | 6/50 [00:07<00:32,  1.37it/s] 14%|█▍        | 7/50 [00:07<00:28,  1.53it/s] 16%|█▌        | 8/50 [00:08<00:25,  1.66it/s] 18%|█▊        | 9/50 [00:08<00:23,  1.75it/s] 20%|██        | 10/50 [00:09<00:21,  1.83it/s] 22%|██▏       | 11/50 [00:09<00:20,  1.88it/s] 24%|██▍       | 12/50 [00:10<00:19,  1.92it/s] 26%|██▌       | 13/50 [00:10<00:18,  1.95it/s] 28%|██▊       | 14/50 [00:11<00:18,  1.97it/s] 30%|███       | 15/50 [00:11<00:17,  1.98it/s] 32%|███▏      | 16/50 [00:12<00:17,  1.99it/s] 34%|███▍      | 17/50 [00:12<00:16,  2.00it/s] 36%|███▌      | 18/50 [00:13<00:15,  2.00it/s] 38%|███▊      | 19/50 [00:13<00:15,  2.00it/s] 40%|████      | 20/50 [00:14<00:14,  2.00it/s] 42%|████▏     | 21/50 [00:14<00:14,  2.01it/s] 44%|████▍     | 22/50 [00:15<00:13,  2.01it/s] 46%|████▌     | 23/50 [00:15<00:13,  2.01it/s] 48%|████▊     | 24/50 [00:16<00:12,  2.01it/s] 50%|█████     | 25/50 [00:16<00:12,  2.01it/s] 52%|█████▏    | 26/50 [00:17<00:11,  2.01it/s] 54%|█████▍    | 27/50 [00:17<00:11,  2.01it/s] 56%|█████▌    | 28/50 [00:18<00:10,  2.01it/s] 58%|█████▊    | 29/50 [00:18<00:10,  2.01it/s] 60%|██████    | 30/50 [00:19<00:10,  2.00it/s] 62%|██████▏   | 31/50 [00:19<00:09,  2.00it/s] 64%|██████▍   | 32/50 [00:20<00:08,  2.01it/s] 66%|██████▌   | 33/50 [00:20<00:08,  2.01it/s] 68%|██████▊   | 34/50 [00:21<00:07,  2.01it/s] 70%|███████   | 35/50 [00:21<00:07,  2.01it/s] 72%|███████▏  | 36/50 [00:22<00:06,  2.01it/s] 74%|███████▍  | 37/50 [00:22<00:06,  2.01it/s] 76%|███████▌  | 38/50 [00:23<00:05,  2.01it/s] 78%|███████▊  | 39/50 [00:23<00:05,  2.01it/s] 80%|████████  | 40/50 [00:24<00:04,  2.00it/s] 82%|████████▏ | 41/50 [00:24<00:04,  2.00it/s] 84%|████████▍ | 42/50 [00:25<00:03,  2.00it/s] 86%|████████▌ | 43/50 [00:25<00:03,  2.00it/s] 88%|████████▊ | 44/50 [00:26<00:03,  2.00it/s] 90%|█████████ | 45/50 [00:26<00:02,  1.99it/s] 92%|█████████▏| 46/50 [00:27<00:02,  1.98it/s] 94%|█████████▍| 47/50 [00:27<00:01,  1.99it/s] 96%|█████████▌| 48/50 [00:28<00:01,  1.99it/s] 98%|█████████▊| 49/50 [00:28<00:00,  2.00it/s]100%|██████████| 50/50 [00:33<00:00,  1.90s/it]100%|██████████| 50/50 [00:33<00:00,  1.48it/s]
