[I 2023-12-10 20:50:33,184] Trial 4 finished with value: 0.009287925696594427 and parameters: {'EMBEDDING_DIM': 335, 'HIDDEN_DIM': 1575, 'NUM_LAYERS': 1, 'DROPOUT': 0.2686109757626853, 'LR': 0.008325377580092757, 'WEIGHT_0': 0.9902028161383089, 'WEIGHT_1': 0.9765009335796171, 'WEIGHT_2': 0.1935932991562639, 'WEIGHT_3': 0.6553382839857083, 'WEIGHT_4': 0.8477639044536832, 'WEIGHT_5': 0.0005000186485515368, 'WEIGHT_6': 0.07403594630024879, 'WEIGHT_7': 0.18787261607653738, 'WEIGHT_8': 0.7911500946378648, 'optimizer': 'SGD'}. Best is trial 3 with value: 0.3694009216589862.
{'EMBEDDING_DIM': 335, 'HIDDEN_DIM': 1575, 'NUM_LAYERS': 1, 'DROPOUT': 0.2686109757626853, 'LR': 0.008325377580092757, 'WEIGHT_0': 0.9902028161383089, 'WEIGHT_1': 0.9765009335796171, 'WEIGHT_2': 0.1935932991562639, 'WEIGHT_3': 0.6553382839857083, 'WEIGHT_4': 0.8477639044536832, 'WEIGHT_5': 0.0005000186485515368, 'WEIGHT_6': 0.07403594630024879, 'WEIGHT_7': 0.18787261607653738, 'WEIGHT_8': 0.7911500946378648, 'optimizer': 'SGD'}
0
              precision    recall  f1-score   support

         LOC       0.02      0.06      0.03      1837
        MISC       0.01      0.09      0.02       922
         ORG       0.01      0.06      0.02      1341
         PER       0.01      0.08      0.02      1842

   micro avg       0.01      0.07      0.02      5942
   macro avg       0.01      0.07      0.02      5942
weighted avg       0.02      0.07      0.02      5942

{'EMBEDDING_DIM': 335, 'HIDDEN_DIM': 1575, 'NUM_LAYERS': 1, 'DROPOUT': 0.2686109757626853, 'LR': 0.008325377580092757, 'WEIGHT_0': 0.9902028161383089, 'WEIGHT_1': 0.9765009335796171, 'WEIGHT_2': 0.1935932991562639, 'WEIGHT_3': 0.6553382839857083, 'WEIGHT_4': 0.8477639044536832, 'WEIGHT_5': 0.0005000186485515368, 'WEIGHT_6': 0.07403594630024879, 'WEIGHT_7': 0.18787261607653738, 'WEIGHT_8': 0.7911500946378648, 'optimizer': 'SGD'}
49
              precision    recall  f1-score   support

         LOC       0.01      0.00      0.00      1837
        MISC       0.02      0.01      0.01       922
         ORG       0.04      0.01      0.02      1341
         PER       0.01      0.00      0.00      1842

   micro avg       0.02      0.01      0.01      5942
   macro avg       0.02      0.01      0.01      5942
weighted avg       0.02      0.01      0.01      5942

epoch 49
LSTM
  0%|          | 0/50 [00:00<?, ?it/s]  2%|▏         | 1/50 [00:06<05:00,  6.13s/it]  4%|▍         | 2/50 [00:06<02:07,  2.65s/it]  6%|▌         | 3/50 [00:06<01:16,  1.64s/it]  8%|▊         | 4/50 [00:07<00:53,  1.16s/it] 10%|█         | 5/50 [00:07<00:40,  1.12it/s] 12%|█▏        | 6/50 [00:08<00:32,  1.36it/s] 14%|█▍        | 7/50 [00:08<00:27,  1.57it/s] 16%|█▌        | 8/50 [00:08<00:23,  1.76it/s] 18%|█▊        | 9/50 [00:09<00:21,  1.91it/s] 20%|██        | 10/50 [00:09<00:19,  2.02it/s] 22%|██▏       | 11/50 [00:10<00:18,  2.12it/s] 24%|██▍       | 12/50 [00:10<00:17,  2.18it/s] 26%|██▌       | 13/50 [00:11<00:16,  2.22it/s] 28%|██▊       | 14/50 [00:11<00:15,  2.26it/s] 30%|███       | 15/50 [00:11<00:15,  2.28it/s] 32%|███▏      | 16/50 [00:12<00:14,  2.30it/s] 34%|███▍      | 17/50 [00:12<00:14,  2.31it/s] 36%|███▌      | 18/50 [00:13<00:13,  2.32it/s] 38%|███▊      | 19/50 [00:13<00:13,  2.32it/s] 40%|████      | 20/50 [00:14<00:12,  2.32it/s] 42%|████▏     | 21/50 [00:14<00:12,  2.33it/s] 44%|████▍     | 22/50 [00:14<00:12,  2.33it/s] 46%|████▌     | 23/50 [00:15<00:11,  2.33it/s] 48%|████▊     | 24/50 [00:15<00:11,  2.33it/s] 50%|█████     | 25/50 [00:16<00:10,  2.34it/s] 52%|█████▏    | 26/50 [00:16<00:10,  2.34it/s] 54%|█████▍    | 27/50 [00:17<00:09,  2.34it/s] 56%|█████▌    | 28/50 [00:17<00:09,  2.34it/s] 58%|█████▊    | 29/50 [00:17<00:08,  2.34it/s] 60%|██████    | 30/50 [00:18<00:08,  2.33it/s] 62%|██████▏   | 31/50 [00:18<00:08,  2.33it/s] 64%|██████▍   | 32/50 [00:19<00:07,  2.34it/s] 66%|██████▌   | 33/50 [00:19<00:07,  2.33it/s] 68%|██████▊   | 34/50 [00:20<00:06,  2.33it/s] 70%|███████   | 35/50 [00:20<00:06,  2.33it/s] 72%|███████▏  | 36/50 [00:20<00:06,  2.33it/s] 74%|███████▍  | 37/50 [00:21<00:05,  2.33it/s] 76%|███████▌  | 38/50 [00:21<00:05,  2.32it/s] 78%|███████▊  | 39/50 [00:22<00:04,  2.33it/s] 80%|████████  | 40/50 [00:22<00:04,  2.32it/s] 82%|████████▏ | 41/50 [00:23<00:03,  2.32it/s] 84%|████████▍ | 42/50 [00:23<00:03,  2.32it/s] 86%|████████▌ | 43/50 [00:23<00:03,  2.32it/s] 88%|████████▊ | 44/50 [00:24<00:02,  2.32it/s] 90%|█████████ | 45/50 [00:24<00:02,  2.32it/s] 92%|█████████▏| 46/50 [00:25<00:01,  2.32it/s] 94%|█████████▍| 47/50 [00:25<00:01,  2.32it/s] 96%|█████████▌| 48/50 [00:26<00:00,  2.32it/s] 98%|█████████▊| 49/50 [00:26<00:00,  2.31it/s]100%|██████████| 50/50 [00:32<00:00,  2.21s/it]100%|██████████| 50/50 [00:32<00:00,  1.52it/s]
[I 2023-12-10 20:51:11,433] Trial 5 finished with value: 0.25728703773442796 and parameters: {'EMBEDDING_DIM': 554, 'HIDDEN_DIM': 355, 'NUM_LAYERS': 3, 'DROPOUT': 0.337203253407035, 'LR': 0.0013212343743944422, 'WEIGHT_0': 0.25399305699422503, 'WEIGHT_1': 0.1549237124181535, 'WEIGHT_2': 0.1193770311773168, 'WEIGHT_3': 0.08764239215905834, 'WEIGHT_4': 0.8886982934133197, 'WEIGHT_5': 0.1523862392639158, 'WEIGHT_6': 0.1868067203117565, 'WEIGHT_7': 0.8554075949474839, 'WEIGHT_8': 0.6836743045756292, 'optimizer': 'RMSprop'}. Best is trial 3 with value: 0.3694009216589862.
{'EMBEDDING_DIM': 554, 'HIDDEN_DIM': 355, 'NUM_LAYERS': 3, 'DROPOUT': 0.337203253407035, 'LR': 0.0013212343743944422, 'WEIGHT_0': 0.25399305699422503, 'WEIGHT_1': 0.1549237124181535, 'WEIGHT_2': 0.1193770311773168, 'WEIGHT_3': 0.08764239215905834, 'WEIGHT_4': 0.8886982934133197, 'WEIGHT_5': 0.1523862392639158, 'WEIGHT_6': 0.1868067203117565, 'WEIGHT_7': 0.8554075949474839, 'WEIGHT_8': 0.6836743045756292, 'optimizer': 'RMSprop'}
0
              precision    recall  f1-score   support

         LOC       0.00      0.00      0.00      1837
        MISC       0.03      0.00      0.01       922
         ORG       0.00      0.00      0.00      1341
         PER       0.09      0.00      0.01      1842

   micro avg       0.04      0.00      0.00      5942
   macro avg       0.03      0.00      0.00      5942
weighted avg       0.03      0.00      0.00      5942

{'EMBEDDING_DIM': 554, 'HIDDEN_DIM': 355, 'NUM_LAYERS': 3, 'DROPOUT': 0.337203253407035, 'LR': 0.0013212343743944422, 'WEIGHT_0': 0.25399305699422503, 'WEIGHT_1': 0.1549237124181535, 'WEIGHT_2': 0.1193770311773168, 'WEIGHT_3': 0.08764239215905834, 'WEIGHT_4': 0.8886982934133197, 'WEIGHT_5': 0.1523862392639158, 'WEIGHT_6': 0.1868067203117565, 'WEIGHT_7': 0.8554075949474839, 'WEIGHT_8': 0.6836743045756292, 'optimizer': 'RMSprop'}
49
              precision    recall  f1-score   support

         LOC       0.59      0.41      0.49      1837
        MISC       0.29      0.21      0.25       922
         ORG       0.07      0.20      0.11      1341
         PER       0.28      0.26      0.27      1842

   micro avg       0.23      0.29      0.26      5942
   macro avg       0.31      0.27      0.28      5942
weighted avg       0.33      0.29      0.30      5942

epoch 49
LSTM
  0%|          | 0/50 [00:00<?, ?it/s]  2%|▏         | 1/50 [00:07<05:55,  7.25s/it]  4%|▍         | 2/50 [00:07<02:32,  3.18s/it]  6%|▌         | 3/50 [00:08<01:45,  2.24s/it]  8%|▊         | 4/50 [00:09<01:22,  1.80s/it] 10%|█         | 5/50 [00:10<01:09,  1.55s/it] 12%|█▏        | 6/50 [00:12<01:01,  1.41s/it] 14%|█▍        | 7/50 [00:13<00:56,  1.31s/it] 16%|█▌        | 8/50 [00:14<00:52,  1.25s/it] 18%|█▊        | 9/50 [00:15<00:49,  1.21s/it] 20%|██        | 10/50 [00:16<00:47,  1.18s/it] 22%|██▏       | 11/50 [00:17<00:45,  1.16s/it] 24%|██▍       | 12/50 [00:18<00:43,  1.15s/it] 26%|██▌       | 13/50 [00:19<00:42,  1.14s/it] 28%|██▊       | 14/50 [00:21<00:40,  1.13s/it] 30%|███       | 15/50 [00:22<00:39,  1.13s/it] 32%|███▏      | 16/50 [00:23<00:38,  1.13s/it] 34%|███▍      | 17/50 [00:24<00:37,  1.13s/it] 36%|███▌      | 18/50 [00:25<00:36,  1.13s/it] 38%|███▊      | 19/50 [00:26<00:35,  1.13s/it] 40%|████      | 20/50 [00:27<00:33,  1.13s/it] 42%|████▏     | 21/50 [00:28<00:32,  1.13s/it] 44%|████▍     | 22/50 [00:30<00:31,  1.13s/it] 46%|████▌     | 23/50 [00:31<00:30,  1.14s/it] 48%|████▊     | 24/50 [00:32<00:29,  1.14s/it] 50%|█████     | 25/50 [00:33<00:28,  1.14s/it] 52%|█████▏    | 26/50 [00:34<00:27,  1.14s/it] 54%|█████▍    | 27/50 [00:35<00:26,  1.14s/it] 56%|█████▌    | 28/50 [00:36<00:25,  1.15s/it] 58%|█████▊    | 29/50 [00:38<00:24,  1.15s/it] 60%|██████    | 30/50 [00:39<00:22,  1.15s/it] 62%|██████▏   | 31/50 [00:40<00:21,  1.15s/it] 64%|██████▍   | 32/50 [00:41<00:20,  1.15s/it] 66%|██████▌   | 33/50 [00:42<00:19,  1.15s/it] 68%|██████▊   | 34/50 [00:43<00:18,  1.15s/it] 70%|███████   | 35/50 [00:45<00:17,  1.16s/it] 72%|███████▏  | 36/50 [00:46<00:16,  1.16s/it] 74%|███████▍  | 37/50 [00:47<00:15,  1.16s/it] 76%|███████▌  | 38/50 [00:48<00:13,  1.16s/it] 78%|███████▊  | 39/50 [00:49<00:12,  1.16s/it] 80%|████████  | 40/50 [00:50<00:11,  1.16s/it] 82%|████████▏ | 41/50 [00:52<00:10,  1.16s/it] 84%|████████▍ | 42/50 [00:53<00:09,  1.16s/it] 86%|████████▌ | 43/50 [00:54<00:08,  1.16s/it] 88%|████████▊ | 44/50 [00:55<00:06,  1.16s/it] 90%|█████████ | 45/50 [00:56<00:05,  1.16s/it] 92%|█████████▏| 46/50 [00:57<00:04,  1.16s/it] 94%|█████████▍| 47/50 [00:58<00:03,  1.16s/it] 96%|█████████▌| 48/50 [01:00<00:02,  1.16s/it] 98%|█████████▊| 49/50 [01:01<00:01,  1.17s/it]100%|██████████| 50/50 [01:09<00:00,  3.28s/it]100%|██████████| 50/50 [01:09<00:00,  1.39s/it]
[I 2023-12-10 20:52:26,776] Trial 6 finished with value: 0.1349619885538567 and parameters: {'EMBEDDING_DIM': 346, 'HIDDEN_DIM': 865, 'NUM_LAYERS': 2, 'DROPOUT': 0.03465407942951388, 'LR': 0.007798829855952181, 'WEIGHT_0': 0.6332447291862054, 'WEIGHT_1': 0.16028999348631723, 'WEIGHT_2': 0.6885110654711001, 'WEIGHT_3': 0.2846683593511875, 'WEIGHT_4': 0.5436388262208978, 'WEIGHT_5': 0.08721871134649828, 'WEIGHT_6': 0.04877230963363077, 'WEIGHT_7': 0.15427179474568997, 'WEIGHT_8': 0.9159216643113043, 'optimizer': 'Adam'}. Best is trial 3 with value: 0.3694009216589862.
{'EMBEDDING_DIM': 346, 'HIDDEN_DIM': 865, 'NUM_LAYERS': 2, 'DROPOUT': 0.03465407942951388, 'LR': 0.007798829855952181, 'WEIGHT_0': 0.6332447291862054, 'WEIGHT_1': 0.16028999348631723, 'WEIGHT_2': 0.6885110654711001, 'WEIGHT_3': 0.2846683593511875, 'WEIGHT_4': 0.5436388262208978, 'WEIGHT_5': 0.08721871134649828, 'WEIGHT_6': 0.04877230963363077, 'WEIGHT_7': 0.15427179474568997, 'WEIGHT_8': 0.9159216643113043, 'optimizer': 'Adam'}
0
              precision    recall  f1-score   support

         LOC       0.00      0.00      0.00      1837
        MISC       0.00      0.00      0.00       922
         ORG       0.14      0.02      0.03      1341
         PER       0.00      0.00      0.00      1842

   micro avg       0.09      0.00      0.01      5942
   macro avg       0.03      0.00      0.01      5942
weighted avg       0.03      0.00      0.01      5942

{'EMBEDDING_DIM': 346, 'HIDDEN_DIM': 865, 'NUM_LAYERS': 2, 'DROPOUT': 0.03465407942951388, 'LR': 0.007798829855952181, 'WEIGHT_0': 0.6332447291862054, 'WEIGHT_1': 0.16028999348631723, 'WEIGHT_2': 0.6885110654711001, 'WEIGHT_3': 0.2846683593511875, 'WEIGHT_4': 0.5436388262208978, 'WEIGHT_5': 0.08721871134649828, 'WEIGHT_6': 0.04877230963363077, 'WEIGHT_7': 0.15427179474568997, 'WEIGHT_8': 0.9159216643113043, 'optimizer': 'Adam'}
49
              precision    recall  f1-score   support

         LOC       0.42      0.05      0.08      1837
        MISC       0.11      0.30      0.16       922
         ORG       0.27      0.14      0.18      1341
         PER       0.11      0.13      0.12      1842

   micro avg       0.14      0.13      0.13      5942
   macro avg       0.23      0.15      0.14      5942
weighted avg       0.24      0.13      0.13      5942

epoch 49
LSTM
  0%|          | 0/50 [00:00<?, ?it/s]  2%|▏         | 1/50 [00:07<06:17,  7.70s/it]  4%|▍         | 2/50 [00:08<02:52,  3.59s/it]  6%|▌         | 3/50 [00:09<01:56,  2.47s/it]  8%|▊         | 4/50 [00:10<01:29,  1.95s/it] 10%|█         | 5/50 [00:11<01:14,  1.66s/it] 12%|█▏        | 6/50 [00:12<01:05,  1.48s/it] 14%|█▍        | 7/50 [00:14<00:58,  1.37s/it] 16%|█▌        | 8/50 [00:15<00:54,  1.30s/it] 18%|█▊        | 9/50 [00:16<00:51,  1.25s/it] 20%|██        | 10/50 [00:17<00:48,  1.22s/it] 22%|██▏       | 11/50 [00:18<00:46,  1.20s/it] 24%|██▍       | 12/50 [00:19<00:44,  1.18s/it] 26%|██▌       | 13/50 [00:20<00:43,  1.17s/it] 28%|██▊       | 14/50 [00:22<00:41,  1.16s/it] 30%|███       | 15/50 [00:23<00:40,  1.16s/it] 32%|███▏      | 16/50 [00:24<00:39,  1.16s/it] 34%|███▍      | 17/50 [00:25<00:38,  1.16s/it] 36%|███▌      | 18/50 [00:26<00:37,  1.16s/it] 38%|███▊      | 19/50 [00:27<00:35,  1.16s/it] 40%|████      | 20/50 [00:29<00:34,  1.16s/it] 42%|████▏     | 21/50 [00:30<00:33,  1.16s/it] 44%|████▍     | 22/50 [00:31<00:32,  1.16s/it] 46%|████▌     | 23/50 [00:32<00:31,  1.16s/it] 48%|████▊     | 24/50 [00:33<00:30,  1.16s/it] 50%|█████     | 25/50 [00:34<00:29,  1.16s/it] 52%|█████▏    | 26/50 [00:36<00:28,  1.17s/it] 54%|█████▍    | 27/50 [00:37<00:26,  1.17s/it] 56%|█████▌    | 28/50 [00:38<00:25,  1.17s/it] 58%|█████▊    | 29/50 [00:39<00:24,  1.17s/it] 60%|██████    | 30/50 [00:40<00:23,  1.17s/it] 62%|██████▏   | 31/50 [00:41<00:22,  1.17s/it] 64%|██████▍   | 32/50 [00:43<00:21,  1.17s/it] 66%|██████▌   | 33/50 [00:44<00:19,  1.17s/it] 68%|██████▊   | 34/50 [00:45<00:18,  1.17s/it] 70%|███████   | 35/50 [00:46<00:17,  1.17s/it] 72%|███████▏  | 36/50 [00:47<00:16,  1.17s/it] 74%|███████▍  | 37/50 [00:48<00:15,  1.17s/it] 76%|███████▌  | 38/50 [00:50<00:14,  1.17s/it] 78%|███████▊  | 39/50 [00:51<00:12,  1.17s/it] 80%|████████  | 40/50 [00:52<00:11,  1.18s/it] 82%|████████▏ | 41/50 [00:53<00:10,  1.18s/it] 84%|████████▍ | 42/50 [00:54<00:09,  1.18s/it] 86%|████████▌ | 43/50 [00:56<00:08,  1.18s/it] 88%|████████▊ | 44/50 [00:57<00:07,  1.19s/it] 90%|█████████ | 45/50 [00:58<00:05,  1.19s/it] 92%|█████████▏| 46/50 [00:59<00:04,  1.19s/it] 94%|█████████▍| 47/50 [01:00<00:03,  1.19s/it] 96%|█████████▌| 48/50 [01:01<00:02,  1.19s/it] 98%|█████████▊| 49/50 [01:03<00:01,  1.19s/it]100%|██████████| 50/50 [01:11<00:00,  3.26s/it]100%|██████████| 50/50 [01:11<00:00,  1.43s/it]
[I 2023-12-10 20:53:44,244] Trial 7 finished with value: 0.11779251433067328 and parameters: {'EMBEDDING_DIM': 669, 'HIDDEN_DIM': 568, 'NUM_LAYERS': 4, 'DROPOUT': 0.19334146840382002, 'LR': 0.0015369556399782837, 'WEIGHT_0': 0.3849720022106866, 'WEIGHT_1': 0.19703637354881742, 'WEIGHT_2': 0.2353927748443937, 'WEIGHT_3': 0.474627757110178, 'WEIGHT_4': 0.051533084038891674, 'WEIGHT_5': 0.5696024851010701, 'WEIGHT_6': 0.7880470516012997, 'WEIGHT_7': 0.5446883004329314, 'WEIGHT_8': 0.24865576433682857, 'optimizer': 'RMSprop'}. Best is trial 3 with value: 0.3694009216589862.
{'EMBEDDING_DIM': 669, 'HIDDEN_DIM': 568, 'NUM_LAYERS': 4, 'DROPOUT': 0.19334146840382002, 'LR': 0.0015369556399782837, 'WEIGHT_0': 0.3849720022106866, 'WEIGHT_1': 0.19703637354881742, 'WEIGHT_2': 0.2353927748443937, 'WEIGHT_3': 0.474627757110178, 'WEIGHT_4': 0.051533084038891674, 'WEIGHT_5': 0.5696024851010701, 'WEIGHT_6': 0.7880470516012997, 'WEIGHT_7': 0.5446883004329314, 'WEIGHT_8': 0.24865576433682857, 'optimizer': 'RMSprop'}
0
              precision    recall  f1-score   support

         LOC       0.00      0.00      0.00      1837
        MISC       0.00      0.00      0.00       922
         ORG       0.13      0.03      0.04      1341
         PER       0.06      0.01      0.01      1842

   micro avg       0.10      0.01      0.02      5942
   macro avg       0.05      0.01      0.01      5942
weighted avg       0.05      0.01      0.01      5942

{'EMBEDDING_DIM': 669, 'HIDDEN_DIM': 568, 'NUM_LAYERS': 4, 'DROPOUT': 0.19334146840382002, 'LR': 0.0015369556399782837, 'WEIGHT_0': 0.3849720022106866, 'WEIGHT_1': 0.19703637354881742, 'WEIGHT_2': 0.2353927748443937, 'WEIGHT_3': 0.474627757110178, 'WEIGHT_4': 0.051533084038891674, 'WEIGHT_5': 0.5696024851010701, 'WEIGHT_6': 0.7880470516012997, 'WEIGHT_7': 0.5446883004329314, 'WEIGHT_8': 0.24865576433682857, 'optimizer': 'RMSprop'}
49
              precision    recall  f1-score   support

         LOC       0.34      0.22      0.27      1837
        MISC       0.02      0.01      0.01       922
         ORG       0.08      0.03      0.04      1341
         PER       0.07      0.04      0.05      1842

   micro avg       0.18      0.09      0.12      5942
   macro avg       0.13      0.07      0.09      5942
weighted avg       0.15      0.09      0.11      5942

epoch 49
LSTM
  0%|          | 0/50 [00:00<?, ?it/s]  2%|▏         | 1/50 [00:18<15:29, 18.97s/it]  4%|▍         | 2/50 [00:20<07:10,  8.97s/it]  6%|▌         | 3/50 [00:24<05:14,  6.70s/it]  8%|▊         | 4/50 [00:28<04:19,  5.65s/it] 10%|█         | 5/50 [00:33<03:48,  5.07s/it] 12%|█▏        | 6/50 [00:37<03:28,  4.74s/it] 14%|█▍        | 7/50 [00:41<03:14,  4.53s/it] 16%|█▌        | 8/50 [00:45<03:04,  4.40s/it] 18%|█▊        | 9/50 [00:49<02:56,  4.30s/it] 20%|██        | 10/50 [00:53<02:50,  4.26s/it] 22%|██▏       | 11/50 [00:57<02:45,  4.25s/it] 24%|██▍       | 12/50 [01:02<02:40,  4.23s/it] 26%|██▌       | 13/50 [01:06<02:35,  4.21s/it] 28%|██▊       | 14/50 [01:10<02:31,  4.21s/it] 30%|███       | 15/50 [01:14<02:27,  4.21s/it] 32%|███▏      | 16/50 [01:18<02:23,  4.23s/it] 34%|███▍      | 17/50 [01:23<02:19,  4.22s/it] 36%|███▌      | 18/50 [01:27<02:14,  4.21s/it] 38%|███▊      | 19/50 [01:31<02:10,  4.20s/it] 40%|████      | 20/50 [01:35<02:06,  4.20s/it] 42%|████▏     | 21/50 [01:39<02:01,  4.19s/it] 44%|████▍     | 22/50 [01:43<01:57,  4.19s/it] 46%|████▌     | 23/50 [01:48<01:53,  4.19s/it] 48%|████▊     | 24/50 [01:52<01:48,  4.19s/it] 50%|█████     | 25/50 [01:56<01:44,  4.19s/it] 52%|█████▏    | 26/50 [02:00<01:40,  4.18s/it] 54%|█████▍    | 27/50 [02:04<01:35,  4.16s/it] 56%|█████▌    | 28/50 [02:08<01:31,  4.16s/it] 58%|█████▊    | 29/50 [02:13<01:27,  4.14s/it] 60%|██████    | 30/50 [02:17<01:22,  4.13s/it] 62%|██████▏   | 31/50 [02:21<01:18,  4.12s/it] 64%|██████▍   | 32/50 [02:25<01:14,  4.13s/it] 66%|██████▌   | 33/50 [02:29<01:09,  4.11s/it] 68%|██████▊   | 34/50 [02:33<01:05,  4.11s/it] 70%|███████   | 35/50 [02:37<01:01,  4.10s/it] 72%|███████▏  | 36/50 [02:41<00:57,  4.11s/it] 74%|███████▍  | 37/50 [02:45<00:53,  4.11s/it] 76%|███████▌  | 38/50 [02:50<00:49,  4.12s/it] 78%|███████▊  | 39/50 [02:54<00:45,  4.10s/it] 80%|████████  | 40/50 [02:58<00:41,  4.10s/it] 82%|████████▏ | 41/50 [03:02<00:36,  4.10s/it] 84%|████████▍ | 42/50 [03:06<00:32,  4.10s/it] 86%|████████▌ | 43/50 [03:10<00:28,  4.10s/it] 88%|████████▊ | 44/50 [03:14<00:24,  4.10s/it] 90%|█████████ | 45/50 [03:18<00:20,  4.10s/it] 92%|█████████▏| 46/50 [03:22<00:16,  4.11s/it] 94%|█████████▍| 47/50 [03:26<00:12,  4.10s/it] 96%|█████████▌| 48/50 [03:31<00:08,  4.09s/it] 98%|█████████▊| 49/50 [03:35<00:04,  4.08s/it]/userhome/cs2/dingruiw/conda/envs/py310/lib/python3.10/site-packages/seqeval/metrics/v1.py:57: UndefinedMetricWarning: Precision and F-score are ill-defined and being set to 0.0 due to no predicted samples. Use `zero_division` parameter to control this behavior.
  _warn_prf(average, modifier, msg_start, len(result))
100%|██████████| 50/50 [03:56<00:00,  9.17s/it]100%|██████████| 50/50 [03:56<00:00,  4.72s/it]
