[I 2023-12-10 21:31:07,317] Trial 41 finished with value: 0.3952596129252281 and parameters: {'EMBEDDING_DIM': 958, 'HIDDEN_DIM': 653, 'NUM_LAYERS': 1, 'DROPOUT': 0.33024513490088947, 'LR': 0.0028118417356331887, 'WEIGHT_0': 0.549692290246525, 'WEIGHT_1': 0.8436639129148515, 'WEIGHT_2': 0.6502651371226273, 'WEIGHT_3': 0.7068129706211104, 'WEIGHT_4': 0.8530287646148212, 'WEIGHT_5': 0.6922595736049637, 'WEIGHT_6': 0.6693272387713475, 'WEIGHT_7': 0.19363970805574726, 'WEIGHT_8': 0.6644783759846427, 'optimizer': 'Adam'}. Best is trial 26 with value: 0.4051425745838141.
/userhome/cs2/dingruiw/conda/envs/py310/lib/python3.10/site-packages/torch/nn/modules/rnn.py:82: UserWarning: dropout option adds dropout after all but last recurrent layer, so non-zero dropout expects num_layers greater than 1, but got dropout=0.35765603084581865 and num_layers=1
  warnings.warn("dropout option adds dropout after all but last "
{'EMBEDDING_DIM': 958, 'HIDDEN_DIM': 653, 'NUM_LAYERS': 1, 'DROPOUT': 0.33024513490088947, 'LR': 0.0028118417356331887, 'WEIGHT_0': 0.549692290246525, 'WEIGHT_1': 0.8436639129148515, 'WEIGHT_2': 0.6502651371226273, 'WEIGHT_3': 0.7068129706211104, 'WEIGHT_4': 0.8530287646148212, 'WEIGHT_5': 0.6922595736049637, 'WEIGHT_6': 0.6693272387713475, 'WEIGHT_7': 0.19363970805574726, 'WEIGHT_8': 0.6644783759846427, 'optimizer': 'Adam'}
0
              precision    recall  f1-score   support

         LOC       0.04      0.02      0.03      1837
        MISC       0.01      0.02      0.01       922
         ORG       0.10      0.02      0.04      1341
         PER       0.04      0.02      0.03      1842

   micro avg       0.03      0.02      0.03      5942
   macro avg       0.05      0.02      0.03      5942
weighted avg       0.05      0.02      0.03      5942

{'EMBEDDING_DIM': 958, 'HIDDEN_DIM': 653, 'NUM_LAYERS': 1, 'DROPOUT': 0.33024513490088947, 'LR': 0.0028118417356331887, 'WEIGHT_0': 0.549692290246525, 'WEIGHT_1': 0.8436639129148515, 'WEIGHT_2': 0.6502651371226273, 'WEIGHT_3': 0.7068129706211104, 'WEIGHT_4': 0.8530287646148212, 'WEIGHT_5': 0.6922595736049637, 'WEIGHT_6': 0.6693272387713475, 'WEIGHT_7': 0.19363970805574726, 'WEIGHT_8': 0.6644783759846427, 'optimizer': 'Adam'}
49
              precision    recall  f1-score   support

         LOC       0.56      0.49      0.52      1837
        MISC       0.47      0.43      0.45       922
         ORG       0.26      0.25      0.26      1341
         PER       0.34      0.37      0.35      1842

   micro avg       0.40      0.39      0.40      5942
   macro avg       0.41      0.39      0.39      5942
weighted avg       0.41      0.39      0.40      5942

epoch 49
LSTM
  0%|          | 0/50 [00:00<?, ?it/s]  2%|▏         | 1/50 [00:05<04:10,  5.11s/it]  4%|▍         | 2/50 [00:05<01:49,  2.27s/it]  6%|▌         | 3/50 [00:05<01:10,  1.51s/it]  8%|▊         | 4/50 [00:06<00:53,  1.16s/it] 10%|█         | 5/50 [00:07<00:43,  1.04it/s] 12%|█▏        | 6/50 [00:07<00:36,  1.19it/s] 14%|█▍        | 7/50 [00:08<00:32,  1.31it/s] 16%|█▌        | 8/50 [00:09<00:29,  1.40it/s] 18%|█▊        | 9/50 [00:09<00:27,  1.47it/s] 20%|██        | 10/50 [00:10<00:26,  1.53it/s] 22%|██▏       | 11/50 [00:10<00:25,  1.56it/s] 24%|██▍       | 12/50 [00:11<00:23,  1.58it/s] 26%|██▌       | 13/50 [00:12<00:23,  1.60it/s] 28%|██▊       | 14/50 [00:12<00:22,  1.61it/s] 30%|███       | 15/50 [00:13<00:21,  1.62it/s] 32%|███▏      | 16/50 [00:13<00:20,  1.62it/s] 34%|███▍      | 17/50 [00:14<00:20,  1.63it/s] 36%|███▌      | 18/50 [00:15<00:19,  1.63it/s] 38%|███▊      | 19/50 [00:15<00:18,  1.63it/s] 40%|████      | 20/50 [00:16<00:18,  1.64it/s] 42%|████▏     | 21/50 [00:16<00:17,  1.63it/s] 44%|████▍     | 22/50 [00:17<00:17,  1.63it/s] 46%|████▌     | 23/50 [00:18<00:16,  1.63it/s] 48%|████▊     | 24/50 [00:18<00:15,  1.63it/s] 50%|█████     | 25/50 [00:19<00:15,  1.64it/s] 52%|█████▏    | 26/50 [00:20<00:14,  1.64it/s] 54%|█████▍    | 27/50 [00:20<00:14,  1.64it/s] 56%|█████▌    | 28/50 [00:21<00:13,  1.64it/s] 58%|█████▊    | 29/50 [00:21<00:12,  1.64it/s] 60%|██████    | 30/50 [00:22<00:12,  1.64it/s] 62%|██████▏   | 31/50 [00:23<00:11,  1.63it/s] 64%|██████▍   | 32/50 [00:23<00:11,  1.64it/s] 66%|██████▌   | 33/50 [00:24<00:10,  1.63it/s] 68%|██████▊   | 34/50 [00:24<00:09,  1.63it/s] 70%|███████   | 35/50 [00:25<00:09,  1.63it/s] 72%|███████▏  | 36/50 [00:26<00:08,  1.62it/s] 74%|███████▍  | 37/50 [00:26<00:08,  1.62it/s] 76%|███████▌  | 38/50 [00:27<00:07,  1.62it/s] 78%|███████▊  | 39/50 [00:28<00:06,  1.62it/s] 80%|████████  | 40/50 [00:28<00:06,  1.61it/s] 82%|████████▏ | 41/50 [00:29<00:05,  1.61it/s] 84%|████████▍ | 42/50 [00:29<00:04,  1.61it/s] 86%|████████▌ | 43/50 [00:30<00:04,  1.61it/s] 88%|████████▊ | 44/50 [00:31<00:03,  1.60it/s] 90%|█████████ | 45/50 [00:31<00:03,  1.60it/s] 92%|█████████▏| 46/50 [00:32<00:02,  1.61it/s] 94%|█████████▍| 47/50 [00:32<00:01,  1.60it/s] 96%|█████████▌| 48/50 [00:33<00:01,  1.60it/s] 98%|█████████▊| 49/50 [00:34<00:00,  1.60it/s]100%|██████████| 50/50 [00:39<00:00,  2.09s/it]100%|██████████| 50/50 [00:39<00:00,  1.26it/s]
[I 2023-12-10 21:31:51,609] Trial 42 finished with value: 0.4124343257443082 and parameters: {'EMBEDDING_DIM': 961, 'HIDDEN_DIM': 782, 'NUM_LAYERS': 1, 'DROPOUT': 0.35765603084581865, 'LR': 0.0025516755525321583, 'WEIGHT_0': 0.48535723141938925, 'WEIGHT_1': 0.7518701832830008, 'WEIGHT_2': 0.6550755675853746, 'WEIGHT_3': 0.6965596932376337, 'WEIGHT_4': 0.8737090950224226, 'WEIGHT_5': 0.6775895169426134, 'WEIGHT_6': 0.6839379286105065, 'WEIGHT_7': 0.259476690823993, 'WEIGHT_8': 0.6432569135828189, 'optimizer': 'Adam'}. Best is trial 42 with value: 0.4124343257443082.
/userhome/cs2/dingruiw/conda/envs/py310/lib/python3.10/site-packages/torch/nn/modules/rnn.py:82: UserWarning: dropout option adds dropout after all but last recurrent layer, so non-zero dropout expects num_layers greater than 1, but got dropout=0.2938270207048394 and num_layers=1
  warnings.warn("dropout option adds dropout after all but last "
{'EMBEDDING_DIM': 961, 'HIDDEN_DIM': 782, 'NUM_LAYERS': 1, 'DROPOUT': 0.35765603084581865, 'LR': 0.0025516755525321583, 'WEIGHT_0': 0.48535723141938925, 'WEIGHT_1': 0.7518701832830008, 'WEIGHT_2': 0.6550755675853746, 'WEIGHT_3': 0.6965596932376337, 'WEIGHT_4': 0.8737090950224226, 'WEIGHT_5': 0.6775895169426134, 'WEIGHT_6': 0.6839379286105065, 'WEIGHT_7': 0.259476690823993, 'WEIGHT_8': 0.6432569135828189, 'optimizer': 'Adam'}
0
              precision    recall  f1-score   support

         LOC       0.10      0.05      0.07      1837
        MISC       0.02      0.01      0.01       922
         ORG       0.07      0.07      0.07      1341
         PER       0.06      0.02      0.03      1842

   micro avg       0.07      0.04      0.05      5942
   macro avg       0.06      0.04      0.05      5942
weighted avg       0.07      0.04      0.05      5942

{'EMBEDDING_DIM': 961, 'HIDDEN_DIM': 782, 'NUM_LAYERS': 1, 'DROPOUT': 0.35765603084581865, 'LR': 0.0025516755525321583, 'WEIGHT_0': 0.48535723141938925, 'WEIGHT_1': 0.7518701832830008, 'WEIGHT_2': 0.6550755675853746, 'WEIGHT_3': 0.6965596932376337, 'WEIGHT_4': 0.8737090950224226, 'WEIGHT_5': 0.6775895169426134, 'WEIGHT_6': 0.6839379286105065, 'WEIGHT_7': 0.259476690823993, 'WEIGHT_8': 0.6432569135828189, 'optimizer': 'Adam'}
49
              precision    recall  f1-score   support

         LOC       0.60      0.55      0.57      1837
        MISC       0.44      0.41      0.43       922
         ORG       0.29      0.25      0.27      1341
         PER       0.36      0.34      0.35      1842

   micro avg       0.43      0.40      0.41      5942
   macro avg       0.42      0.39      0.40      5942
weighted avg       0.43      0.40      0.41      5942

epoch 49
LSTM
  0%|          | 0/50 [00:00<?, ?it/s]  2%|▏         | 1/50 [00:05<04:17,  5.24s/it]  4%|▍         | 2/50 [00:05<01:52,  2.34s/it]  6%|▌         | 3/50 [00:06<01:13,  1.56s/it]  8%|▊         | 4/50 [00:06<00:54,  1.19s/it] 10%|█         | 5/50 [00:07<00:44,  1.01it/s] 12%|█▏        | 6/50 [00:08<00:38,  1.15it/s] 14%|█▍        | 7/50 [00:08<00:33,  1.27it/s] 16%|█▌        | 8/50 [00:09<00:31,  1.35it/s] 18%|█▊        | 9/50 [00:09<00:28,  1.42it/s] 20%|██        | 10/50 [00:10<00:27,  1.46it/s] 22%|██▏       | 11/50 [00:11<00:26,  1.50it/s] 24%|██▍       | 12/50 [00:11<00:24,  1.52it/s] 26%|██▌       | 13/50 [00:12<00:24,  1.54it/s] 28%|██▊       | 14/50 [00:13<00:23,  1.55it/s] 30%|███       | 15/50 [00:13<00:22,  1.56it/s] 32%|███▏      | 16/50 [00:14<00:21,  1.57it/s] 34%|███▍      | 17/50 [00:15<00:21,  1.57it/s] 36%|███▌      | 18/50 [00:15<00:20,  1.57it/s] 38%|███▊      | 19/50 [00:16<00:19,  1.57it/s] 40%|████      | 20/50 [00:16<00:19,  1.57it/s] 42%|████▏     | 21/50 [00:17<00:18,  1.57it/s] 44%|████▍     | 22/50 [00:18<00:17,  1.58it/s] 46%|████▌     | 23/50 [00:18<00:17,  1.58it/s] 48%|████▊     | 24/50 [00:19<00:16,  1.58it/s] 50%|█████     | 25/50 [00:20<00:15,  1.58it/s] 52%|█████▏    | 26/50 [00:20<00:15,  1.57it/s] 54%|█████▍    | 27/50 [00:21<00:14,  1.57it/s] 56%|█████▌    | 28/50 [00:22<00:14,  1.57it/s] 58%|█████▊    | 29/50 [00:22<00:13,  1.57it/s] 60%|██████    | 30/50 [00:23<00:12,  1.57it/s] 62%|██████▏   | 31/50 [00:23<00:12,  1.57it/s] 64%|██████▍   | 32/50 [00:24<00:11,  1.57it/s] 66%|██████▌   | 33/50 [00:25<00:10,  1.56it/s] 68%|██████▊   | 34/50 [00:25<00:10,  1.56it/s] 70%|███████   | 35/50 [00:26<00:09,  1.56it/s] 72%|███████▏  | 36/50 [00:27<00:08,  1.56it/s] 74%|███████▍  | 37/50 [00:27<00:08,  1.56it/s] 76%|███████▌  | 38/50 [00:28<00:07,  1.55it/s] 78%|███████▊  | 39/50 [00:29<00:07,  1.55it/s] 80%|████████  | 40/50 [00:29<00:06,  1.55it/s] 82%|████████▏ | 41/50 [00:30<00:05,  1.55it/s] 84%|████████▍ | 42/50 [00:31<00:05,  1.55it/s] 86%|████████▌ | 43/50 [00:31<00:04,  1.54it/s] 88%|████████▊ | 44/50 [00:32<00:03,  1.54it/s] 90%|█████████ | 45/50 [00:32<00:03,  1.54it/s] 92%|█████████▏| 46/50 [00:33<00:02,  1.54it/s] 94%|█████████▍| 47/50 [00:34<00:01,  1.54it/s] 96%|█████████▌| 48/50 [00:34<00:01,  1.54it/s] 98%|█████████▊| 49/50 [00:35<00:00,  1.54it/s]100%|██████████| 50/50 [00:41<00:00,  2.13s/it]100%|██████████| 50/50 [00:41<00:00,  1.22it/s]
[I 2023-12-10 21:32:37,182] Trial 43 finished with value: 0.3997237330570664 and parameters: {'EMBEDDING_DIM': 941, 'HIDDEN_DIM': 808, 'NUM_LAYERS': 1, 'DROPOUT': 0.2938270207048394, 'LR': 0.0024847385899084812, 'WEIGHT_0': 0.5174599481229212, 'WEIGHT_1': 0.7285146451319073, 'WEIGHT_2': 0.6479927222771658, 'WEIGHT_3': 0.7034809455792453, 'WEIGHT_4': 0.8736448507829059, 'WEIGHT_5': 0.6794074669937624, 'WEIGHT_6': 0.6760971261898788, 'WEIGHT_7': 0.1765989147739781, 'WEIGHT_8': 0.5561569649786641, 'optimizer': 'Adam'}. Best is trial 42 with value: 0.4124343257443082.
/userhome/cs2/dingruiw/conda/envs/py310/lib/python3.10/site-packages/torch/nn/modules/rnn.py:82: UserWarning: dropout option adds dropout after all but last recurrent layer, so non-zero dropout expects num_layers greater than 1, but got dropout=0.3008450963204227 and num_layers=1
  warnings.warn("dropout option adds dropout after all but last "
{'EMBEDDING_DIM': 941, 'HIDDEN_DIM': 808, 'NUM_LAYERS': 1, 'DROPOUT': 0.2938270207048394, 'LR': 0.0024847385899084812, 'WEIGHT_0': 0.5174599481229212, 'WEIGHT_1': 0.7285146451319073, 'WEIGHT_2': 0.6479927222771658, 'WEIGHT_3': 0.7034809455792453, 'WEIGHT_4': 0.8736448507829059, 'WEIGHT_5': 0.6794074669937624, 'WEIGHT_6': 0.6760971261898788, 'WEIGHT_7': 0.1765989147739781, 'WEIGHT_8': 0.5561569649786641, 'optimizer': 'Adam'}
0
              precision    recall  f1-score   support

         LOC       0.07      0.04      0.05      1837
        MISC       0.02      0.01      0.02       922
         ORG       0.05      0.02      0.03      1341
         PER       0.04      0.03      0.03      1842

   micro avg       0.04      0.03      0.03      5942
   macro avg       0.04      0.02      0.03      5942
weighted avg       0.05      0.03      0.03      5942

{'EMBEDDING_DIM': 941, 'HIDDEN_DIM': 808, 'NUM_LAYERS': 1, 'DROPOUT': 0.2938270207048394, 'LR': 0.0024847385899084812, 'WEIGHT_0': 0.5174599481229212, 'WEIGHT_1': 0.7285146451319073, 'WEIGHT_2': 0.6479927222771658, 'WEIGHT_3': 0.7034809455792453, 'WEIGHT_4': 0.8736448507829059, 'WEIGHT_5': 0.6794074669937624, 'WEIGHT_6': 0.6760971261898788, 'WEIGHT_7': 0.1765989147739781, 'WEIGHT_8': 0.5561569649786641, 'optimizer': 'Adam'}
49
              precision    recall  f1-score   support

         LOC       0.57      0.52      0.54      1837
        MISC       0.41      0.40      0.40       922
         ORG       0.30      0.27      0.29      1341
         PER       0.34      0.34      0.34      1842

   micro avg       0.41      0.39      0.40      5942
   macro avg       0.40      0.38      0.39      5942
weighted avg       0.41      0.39      0.40      5942

epoch 49
LSTM
  0%|          | 0/50 [00:00<?, ?it/s]  2%|▏         | 1/50 [00:05<04:11,  5.12s/it]  4%|▍         | 2/50 [00:05<01:48,  2.26s/it]  6%|▌         | 3/50 [00:05<01:09,  1.47s/it]  8%|▊         | 4/50 [00:06<00:50,  1.10s/it] 10%|█         | 5/50 [00:06<00:40,  1.12it/s] 12%|█▏        | 6/50 [00:07<00:33,  1.30it/s] 14%|█▍        | 7/50 [00:08<00:29,  1.45it/s] 16%|█▌        | 8/50 [00:08<00:26,  1.57it/s] 18%|█▊        | 9/50 [00:09<00:24,  1.65it/s] 20%|██        | 10/50 [00:09<00:23,  1.72it/s] 22%|██▏       | 11/50 [00:10<00:22,  1.77it/s] 24%|██▍       | 12/50 [00:10<00:21,  1.81it/s] 26%|██▌       | 13/50 [00:11<00:20,  1.83it/s] 28%|██▊       | 14/50 [00:11<00:19,  1.85it/s] 30%|███       | 15/50 [00:12<00:18,  1.86it/s] 32%|███▏      | 16/50 [00:12<00:18,  1.87it/s] 34%|███▍      | 17/50 [00:13<00:17,  1.87it/s] 36%|███▌      | 18/50 [00:13<00:17,  1.88it/s] 38%|███▊      | 19/50 [00:14<00:16,  1.88it/s] 40%|████      | 20/50 [00:14<00:15,  1.88it/s] 42%|████▏     | 21/50 [00:15<00:15,  1.88it/s] 44%|████▍     | 22/50 [00:15<00:14,  1.88it/s] 46%|████▌     | 23/50 [00:16<00:14,  1.88it/s] 48%|████▊     | 24/50 [00:17<00:13,  1.88it/s] 50%|█████     | 25/50 [00:17<00:13,  1.88it/s] 52%|█████▏    | 26/50 [00:18<00:12,  1.88it/s] 54%|█████▍    | 27/50 [00:18<00:12,  1.88it/s] 56%|█████▌    | 28/50 [00:19<00:11,  1.88it/s] 58%|█████▊    | 29/50 [00:19<00:11,  1.87it/s] 60%|██████    | 30/50 [00:20<00:10,  1.87it/s] 62%|██████▏   | 31/50 [00:20<00:10,  1.87it/s] 64%|██████▍   | 32/50 [00:21<00:09,  1.87it/s] 66%|██████▌   | 33/50 [00:21<00:09,  1.86it/s] 68%|██████▊   | 34/50 [00:22<00:08,  1.86it/s] 70%|███████   | 35/50 [00:22<00:08,  1.86it/s] 72%|███████▏  | 36/50 [00:23<00:07,  1.86it/s] 74%|███████▍  | 37/50 [00:24<00:06,  1.86it/s] 76%|███████▌  | 38/50 [00:24<00:06,  1.86it/s] 78%|███████▊  | 39/50 [00:25<00:05,  1.86it/s] 80%|████████  | 40/50 [00:25<00:05,  1.85it/s] 82%|████████▏ | 41/50 [00:26<00:04,  1.85it/s] 84%|████████▍ | 42/50 [00:26<00:04,  1.86it/s] 86%|████████▌ | 43/50 [00:27<00:03,  1.86it/s] 88%|████████▊ | 44/50 [00:27<00:03,  1.85it/s] 90%|█████████ | 45/50 [00:28<00:02,  1.85it/s] 92%|█████████▏| 46/50 [00:28<00:02,  1.85it/s] 94%|█████████▍| 47/50 [00:29<00:01,  1.85it/s] 96%|█████████▌| 48/50 [00:29<00:01,  1.84it/s] 98%|█████████▊| 49/50 [00:30<00:00,  1.85it/s]100%|██████████| 50/50 [00:35<00:00,  1.99s/it]100%|██████████| 50/50 [00:35<00:00,  1.39it/s]
[I 2023-12-10 21:33:17,345] Trial 44 finished with value: 0.35640542238980155 and parameters: {'EMBEDDING_DIM': 699, 'HIDDEN_DIM': 790, 'NUM_LAYERS': 1, 'DROPOUT': 0.3008450963204227, 'LR': 0.0017903919014704151, 'WEIGHT_0': 0.46296369125640147, 'WEIGHT_1': 0.7217271857712877, 'WEIGHT_2': 0.7145986816380288, 'WEIGHT_3': 0.6561828381369073, 'WEIGHT_4': 0.9457568107730077, 'WEIGHT_5': 0.5956713971033872, 'WEIGHT_6': 0.7062513238150286, 'WEIGHT_7': 0.13667843441706523, 'WEIGHT_8': 0.564559986960485, 'optimizer': 'RMSprop'}. Best is trial 42 with value: 0.4124343257443082.
{'EMBEDDING_DIM': 699, 'HIDDEN_DIM': 790, 'NUM_LAYERS': 1, 'DROPOUT': 0.3008450963204227, 'LR': 0.0017903919014704151, 'WEIGHT_0': 0.46296369125640147, 'WEIGHT_1': 0.7217271857712877, 'WEIGHT_2': 0.7145986816380288, 'WEIGHT_3': 0.6561828381369073, 'WEIGHT_4': 0.9457568107730077, 'WEIGHT_5': 0.5956713971033872, 'WEIGHT_6': 0.7062513238150286, 'WEIGHT_7': 0.13667843441706523, 'WEIGHT_8': 0.564559986960485, 'optimizer': 'RMSprop'}
0
              precision    recall  f1-score   support

         LOC       0.04      0.05      0.05      1837
        MISC       0.01      0.04      0.01       922
         ORG       0.02      0.05      0.03      1341
         PER       0.01      0.01      0.01      1842

   micro avg       0.02      0.04      0.02      5942
   macro avg       0.02      0.04      0.02      5942
weighted avg       0.02      0.04      0.03      5942

{'EMBEDDING_DIM': 699, 'HIDDEN_DIM': 790, 'NUM_LAYERS': 1, 'DROPOUT': 0.3008450963204227, 'LR': 0.0017903919014704151, 'WEIGHT_0': 0.46296369125640147, 'WEIGHT_1': 0.7217271857712877, 'WEIGHT_2': 0.7145986816380288, 'WEIGHT_3': 0.6561828381369073, 'WEIGHT_4': 0.9457568107730077, 'WEIGHT_5': 0.5956713971033872, 'WEIGHT_6': 0.7062513238150286, 'WEIGHT_7': 0.13667843441706523, 'WEIGHT_8': 0.564559986960485, 'optimizer': 'RMSprop'}
49
              precision    recall  f1-score   support

         LOC       0.61      0.47      0.53      1837
        MISC       0.40      0.38      0.39       922
         ORG       0.25      0.22      0.23      1341
         PER       0.28      0.26      0.27      1842

   micro avg       0.38      0.33      0.36      5942
   macro avg       0.38      0.33      0.35      5942
weighted avg       0.39      0.33      0.36      5942

epoch 49
LSTM
  0%|          | 0/50 [00:00<?, ?it/s]  2%|▏         | 1/50 [00:14<11:46, 14.41s/it]  4%|▍         | 2/50 [00:16<05:39,  7.07s/it]  6%|▌         | 3/50 [00:19<04:06,  5.25s/it]  8%|▊         | 4/50 [00:22<03:22,  4.40s/it] 10%|█         | 5/50 [00:25<02:56,  3.93s/it] 12%|█▏        | 6/50 [00:28<02:40,  3.65s/it] 14%|█▍        | 7/50 [00:31<02:29,  3.49s/it] 16%|█▌        | 8/50 [00:35<02:21,  3.38s/it] 18%|█▊        | 9/50 [00:38<02:15,  3.32s/it] 20%|██        | 10/50 [00:41<02:10,  3.26s/it] 22%|██▏       | 11/50 [00:44<02:06,  3.25s/it] 24%|██▍       | 12/50 [00:47<02:03,  3.24s/it] 26%|██▌       | 13/50 [00:51<02:00,  3.25s/it] 28%|██▊       | 14/50 [00:54<01:56,  3.25s/it] 30%|███       | 15/50 [00:57<01:53,  3.24s/it] 32%|███▏      | 16/50 [01:00<01:49,  3.23s/it] 34%|███▍      | 17/50 [01:03<01:46,  3.23s/it] 36%|███▌      | 18/50 [01:07<01:43,  3.22s/it] 38%|███▊      | 19/50 [01:10<01:39,  3.22s/it] 40%|████      | 20/50 [01:13<01:36,  3.22s/it] 42%|████▏     | 21/50 [01:16<01:33,  3.22s/it] 44%|████▍     | 22/50 [01:20<01:29,  3.21s/it] 46%|████▌     | 23/50 [01:23<01:26,  3.21s/it] 48%|████▊     | 24/50 [01:26<01:23,  3.22s/it] 50%|█████     | 25/50 [01:29<01:20,  3.21s/it] 52%|█████▏    | 26/50 [01:32<01:17,  3.24s/it] 54%|█████▍    | 27/50 [01:36<01:14,  3.24s/it] 56%|█████▌    | 28/50 [01:39<01:11,  3.23s/it] 58%|█████▊    | 29/50 [01:42<01:07,  3.24s/it] 60%|██████    | 30/50 [01:45<01:04,  3.23s/it] 62%|██████▏   | 31/50 [01:49<01:01,  3.22s/it] 64%|██████▍   | 32/50 [01:52<00:57,  3.21s/it] 66%|██████▌   | 33/50 [01:55<00:54,  3.20s/it] 68%|██████▊   | 34/50 [01:58<00:51,  3.20s/it] 70%|███████   | 35/50 [02:01<00:47,  3.19s/it] 72%|███████▏  | 36/50 [02:04<00:44,  3.19s/it] 74%|███████▍  | 37/50 [02:08<00:41,  3.19s/it] 76%|███████▌  | 38/50 [02:11<00:38,  3.18s/it] 78%|███████▊  | 39/50 [02:14<00:35,  3.19s/it] 80%|████████  | 40/50 [02:17<00:31,  3.19s/it] 82%|████████▏ | 41/50 [02:20<00:28,  3.19s/it] 84%|████████▍ | 42/50 [02:24<00:25,  3.18s/it] 86%|████████▌ | 43/50 [02:27<00:22,  3.18s/it] 88%|████████▊ | 44/50 [02:30<00:19,  3.18s/it] 90%|█████████ | 45/50 [02:33<00:15,  3.17s/it] 92%|█████████▏| 46/50 [02:36<00:12,  3.17s/it] 94%|█████████▍| 47/50 [02:39<00:09,  3.17s/it] 96%|█████████▌| 48/50 [02:43<00:06,  3.16s/it] 98%|█████████▊| 49/50 [02:46<00:03,  3.16s/it]100%|██████████| 50/50 [03:01<00:00,  6.92s/it]100%|██████████| 50/50 [03:01<00:00,  3.64s/it]
