[I 2023-12-11 00:17:43,985] Trial 361 finished with value: 0.40287769784172656 and parameters: {'EMBEDDING_DIM': 905, 'HIDDEN_DIM': 215, 'NUM_LAYERS': 1, 'DROPOUT': 0.04838211822549862, 'LR': 0.0022517443887498634, 'WEIGHT_0': 0.18659172508543156, 'WEIGHT_1': 0.7110965472226113, 'WEIGHT_2': 0.4440987652283648, 'WEIGHT_3': 0.8650901747380165, 'WEIGHT_4': 0.33641484110519376, 'WEIGHT_5': 0.7516828694249538, 'WEIGHT_6': 0.7443198773523839, 'WEIGHT_7': 0.31606789109292627, 'WEIGHT_8': 0.9081397278036599, 'optimizer': 'RMSprop'}. Best is trial 221 with value: 0.418736930154747.
/userhome/cs2/dingruiw/conda/envs/py310/lib/python3.10/site-packages/torch/nn/modules/rnn.py:82: UserWarning: dropout option adds dropout after all but last recurrent layer, so non-zero dropout expects num_layers greater than 1, but got dropout=0.05678462081884372 and num_layers=1
  warnings.warn("dropout option adds dropout after all but last "
{'EMBEDDING_DIM': 905, 'HIDDEN_DIM': 215, 'NUM_LAYERS': 1, 'DROPOUT': 0.04838211822549862, 'LR': 0.0022517443887498634, 'WEIGHT_0': 0.18659172508543156, 'WEIGHT_1': 0.7110965472226113, 'WEIGHT_2': 0.4440987652283648, 'WEIGHT_3': 0.8650901747380165, 'WEIGHT_4': 0.33641484110519376, 'WEIGHT_5': 0.7516828694249538, 'WEIGHT_6': 0.7443198773523839, 'WEIGHT_7': 0.31606789109292627, 'WEIGHT_8': 0.9081397278036599, 'optimizer': 'RMSprop'}
0
              precision    recall  f1-score   support

         LOC       0.45      0.26      0.33      1837
        MISC       0.08      0.03      0.04       922
         ORG       0.24      0.05      0.08      1341
         PER       0.05      0.06      0.05      1842

   micro avg       0.18      0.11      0.14      5942
   macro avg       0.20      0.10      0.13      5942
weighted avg       0.22      0.11      0.14      5942

{'EMBEDDING_DIM': 905, 'HIDDEN_DIM': 215, 'NUM_LAYERS': 1, 'DROPOUT': 0.04838211822549862, 'LR': 0.0022517443887498634, 'WEIGHT_0': 0.18659172508543156, 'WEIGHT_1': 0.7110965472226113, 'WEIGHT_2': 0.4440987652283648, 'WEIGHT_3': 0.8650901747380165, 'WEIGHT_4': 0.33641484110519376, 'WEIGHT_5': 0.7516828694249538, 'WEIGHT_6': 0.7443198773523839, 'WEIGHT_7': 0.31606789109292627, 'WEIGHT_8': 0.9081397278036599, 'optimizer': 'RMSprop'}
49
              precision    recall  f1-score   support

         LOC       0.55      0.54      0.54      1837
        MISC       0.45      0.45      0.45       922
         ORG       0.27      0.27      0.27      1341
         PER       0.33      0.35      0.34      1842

   micro avg       0.40      0.41      0.40      5942
   macro avg       0.40      0.40      0.40      5942
weighted avg       0.40      0.41      0.40      5942

epoch 49
LSTM
  0%|          | 0/50 [00:00<?, ?it/s]  2%|▏         | 1/50 [00:04<03:41,  4.52s/it]  4%|▍         | 2/50 [00:04<01:32,  1.92s/it]  6%|▌         | 3/50 [00:04<00:53,  1.13s/it]  8%|▊         | 4/50 [00:05<00:34,  1.32it/s] 10%|█         | 5/50 [00:05<00:24,  1.81it/s] 12%|█▏        | 6/50 [00:05<00:18,  2.34it/s] 14%|█▍        | 7/50 [00:05<00:14,  2.87it/s] 16%|█▌        | 8/50 [00:05<00:12,  3.37it/s] 18%|█▊        | 9/50 [00:05<00:10,  3.81it/s] 20%|██        | 10/50 [00:06<00:09,  4.18it/s] 22%|██▏       | 11/50 [00:06<00:08,  4.49it/s] 24%|██▍       | 12/50 [00:06<00:08,  4.73it/s] 26%|██▌       | 13/50 [00:06<00:07,  4.91it/s] 28%|██▊       | 14/50 [00:06<00:07,  5.03it/s] 30%|███       | 15/50 [00:07<00:06,  5.13it/s] 32%|███▏      | 16/50 [00:07<00:06,  5.19it/s] 34%|███▍      | 17/50 [00:07<00:06,  5.24it/s] 36%|███▌      | 18/50 [00:07<00:06,  5.28it/s] 38%|███▊      | 19/50 [00:07<00:05,  5.31it/s] 40%|████      | 20/50 [00:07<00:05,  5.32it/s] 42%|████▏     | 21/50 [00:08<00:05,  5.34it/s] 44%|████▍     | 22/50 [00:08<00:05,  5.34it/s] 46%|████▌     | 23/50 [00:08<00:05,  5.35it/s] 48%|████▊     | 24/50 [00:08<00:04,  5.36it/s] 50%|█████     | 25/50 [00:08<00:04,  5.35it/s] 52%|█████▏    | 26/50 [00:09<00:04,  5.35it/s] 54%|█████▍    | 27/50 [00:09<00:04,  5.35it/s] 56%|█████▌    | 28/50 [00:09<00:04,  5.36it/s] 58%|█████▊    | 29/50 [00:09<00:03,  5.36it/s] 60%|██████    | 30/50 [00:09<00:03,  5.36it/s] 62%|██████▏   | 31/50 [00:10<00:03,  5.35it/s] 64%|██████▍   | 32/50 [00:10<00:03,  5.35it/s] 66%|██████▌   | 33/50 [00:10<00:03,  5.35it/s] 68%|██████▊   | 34/50 [00:10<00:02,  5.36it/s] 70%|███████   | 35/50 [00:10<00:02,  5.35it/s] 72%|███████▏  | 36/50 [00:10<00:02,  5.35it/s] 74%|███████▍  | 37/50 [00:11<00:02,  5.35it/s] 76%|███████▌  | 38/50 [00:11<00:02,  5.35it/s] 78%|███████▊  | 39/50 [00:11<00:02,  5.35it/s] 80%|████████  | 40/50 [00:11<00:01,  5.35it/s] 82%|████████▏ | 41/50 [00:11<00:01,  5.35it/s] 84%|████████▍ | 42/50 [00:12<00:01,  5.35it/s] 86%|████████▌ | 43/50 [00:12<00:01,  5.35it/s] 88%|████████▊ | 44/50 [00:12<00:01,  5.35it/s] 90%|█████████ | 45/50 [00:12<00:00,  5.35it/s] 92%|█████████▏| 46/50 [00:12<00:00,  5.35it/s] 94%|█████████▍| 47/50 [00:13<00:00,  5.35it/s] 96%|█████████▌| 48/50 [00:13<00:00,  5.35it/s] 98%|█████████▊| 49/50 [00:13<00:00,  5.35it/s]100%|██████████| 50/50 [00:18<00:00,  1.53s/it]100%|██████████| 50/50 [00:18<00:00,  2.77it/s]
[I 2023-12-11 00:18:06,241] Trial 362 finished with value: 0.4082013047530289 and parameters: {'EMBEDDING_DIM': 963, 'HIDDEN_DIM': 264, 'NUM_LAYERS': 1, 'DROPOUT': 0.05678462081884372, 'LR': 0.0024692809171051188, 'WEIGHT_0': 0.22524986889372586, 'WEIGHT_1': 0.6960216272380659, 'WEIGHT_2': 0.37714472012485195, 'WEIGHT_3': 0.8668299200453833, 'WEIGHT_4': 0.7563807929573549, 'WEIGHT_5': 0.7041585772330369, 'WEIGHT_6': 0.7726444261797604, 'WEIGHT_7': 0.32809041016036955, 'WEIGHT_8': 0.9401213800888175, 'optimizer': 'RMSprop'}. Best is trial 221 with value: 0.418736930154747.
/userhome/cs2/dingruiw/conda/envs/py310/lib/python3.10/site-packages/torch/nn/modules/rnn.py:82: UserWarning: dropout option adds dropout after all but last recurrent layer, so non-zero dropout expects num_layers greater than 1, but got dropout=0.020807109233539883 and num_layers=1
  warnings.warn("dropout option adds dropout after all but last "
{'EMBEDDING_DIM': 963, 'HIDDEN_DIM': 264, 'NUM_LAYERS': 1, 'DROPOUT': 0.05678462081884372, 'LR': 0.0024692809171051188, 'WEIGHT_0': 0.22524986889372586, 'WEIGHT_1': 0.6960216272380659, 'WEIGHT_2': 0.37714472012485195, 'WEIGHT_3': 0.8668299200453833, 'WEIGHT_4': 0.7563807929573549, 'WEIGHT_5': 0.7041585772330369, 'WEIGHT_6': 0.7726444261797604, 'WEIGHT_7': 0.32809041016036955, 'WEIGHT_8': 0.9401213800888175, 'optimizer': 'RMSprop'}
0
              precision    recall  f1-score   support

         LOC       0.40      0.22      0.29      1837
        MISC       0.14      0.03      0.05       922
         ORG       0.20      0.06      0.10      1341
         PER       0.06      0.04      0.05      1842

   micro avg       0.21      0.10      0.14      5942
   macro avg       0.20      0.09      0.12      5942
weighted avg       0.21      0.10      0.13      5942

{'EMBEDDING_DIM': 963, 'HIDDEN_DIM': 264, 'NUM_LAYERS': 1, 'DROPOUT': 0.05678462081884372, 'LR': 0.0024692809171051188, 'WEIGHT_0': 0.22524986889372586, 'WEIGHT_1': 0.6960216272380659, 'WEIGHT_2': 0.37714472012485195, 'WEIGHT_3': 0.8668299200453833, 'WEIGHT_4': 0.7563807929573549, 'WEIGHT_5': 0.7041585772330369, 'WEIGHT_6': 0.7726444261797604, 'WEIGHT_7': 0.32809041016036955, 'WEIGHT_8': 0.9401213800888175, 'optimizer': 'RMSprop'}
49
              precision    recall  f1-score   support

         LOC       0.56      0.56      0.56      1837
        MISC       0.43      0.43      0.43       922
         ORG       0.28      0.25      0.26      1341
         PER       0.34      0.35      0.35      1842

   micro avg       0.41      0.41      0.41      5942
   macro avg       0.40      0.40      0.40      5942
weighted avg       0.41      0.41      0.41      5942

epoch 49
LSTM
  0%|          | 0/50 [00:00<?, ?it/s]  2%|▏         | 1/50 [00:04<03:42,  4.55s/it]  4%|▍         | 2/50 [00:04<01:33,  1.94s/it]  6%|▌         | 3/50 [00:04<00:53,  1.15s/it]  8%|▊         | 4/50 [00:05<00:35,  1.29it/s] 10%|█         | 5/50 [00:05<00:25,  1.76it/s] 12%|█▏        | 6/50 [00:05<00:19,  2.25it/s] 14%|█▍        | 7/50 [00:05<00:15,  2.73it/s] 16%|█▌        | 8/50 [00:05<00:13,  3.18it/s] 18%|█▊        | 9/50 [00:06<00:11,  3.58it/s] 20%|██        | 10/50 [00:06<00:10,  3.90it/s] 22%|██▏       | 11/50 [00:06<00:09,  4.17it/s] 24%|██▍       | 12/50 [00:06<00:08,  4.37it/s] 26%|██▌       | 13/50 [00:06<00:08,  4.52it/s] 28%|██▊       | 14/50 [00:07<00:07,  4.63it/s] 30%|███       | 15/50 [00:07<00:07,  4.71it/s] 32%|███▏      | 16/50 [00:07<00:07,  4.77it/s] 34%|███▍      | 17/50 [00:07<00:06,  4.81it/s] 36%|███▌      | 18/50 [00:07<00:06,  4.84it/s] 38%|███▊      | 19/50 [00:08<00:06,  4.85it/s] 40%|████      | 20/50 [00:08<00:06,  4.87it/s] 42%|████▏     | 21/50 [00:08<00:05,  4.88it/s] 44%|████▍     | 22/50 [00:08<00:05,  4.88it/s] 46%|████▌     | 23/50 [00:08<00:05,  4.89it/s] 48%|████▊     | 24/50 [00:09<00:05,  4.90it/s] 50%|█████     | 25/50 [00:09<00:05,  4.90it/s] 52%|█████▏    | 26/50 [00:09<00:04,  4.91it/s] 54%|█████▍    | 27/50 [00:09<00:04,  4.91it/s] 56%|█████▌    | 28/50 [00:09<00:04,  4.91it/s] 58%|█████▊    | 29/50 [00:10<00:04,  4.91it/s] 60%|██████    | 30/50 [00:10<00:04,  4.90it/s] 62%|██████▏   | 31/50 [00:10<00:03,  4.89it/s] 64%|██████▍   | 32/50 [00:10<00:03,  4.89it/s] 66%|██████▌   | 33/50 [00:10<00:03,  4.89it/s] 68%|██████▊   | 34/50 [00:11<00:03,  4.89it/s] 70%|███████   | 35/50 [00:11<00:03,  4.89it/s] 72%|███████▏  | 36/50 [00:11<00:02,  4.89it/s] 74%|███████▍  | 37/50 [00:11<00:02,  4.89it/s] 76%|███████▌  | 38/50 [00:12<00:02,  4.89it/s] 78%|███████▊  | 39/50 [00:12<00:02,  4.89it/s] 80%|████████  | 40/50 [00:12<00:02,  4.89it/s] 82%|████████▏ | 41/50 [00:12<00:01,  4.90it/s] 84%|████████▍ | 42/50 [00:12<00:01,  4.90it/s] 86%|████████▌ | 43/50 [00:13<00:01,  4.89it/s] 88%|████████▊ | 44/50 [00:13<00:01,  4.89it/s] 90%|█████████ | 45/50 [00:13<00:01,  4.88it/s] 92%|█████████▏| 46/50 [00:13<00:00,  4.89it/s] 94%|█████████▍| 47/50 [00:13<00:00,  4.89it/s] 96%|█████████▌| 48/50 [00:14<00:00,  4.88it/s] 98%|█████████▊| 49/50 [00:14<00:00,  4.89it/s]100%|██████████| 50/50 [00:19<00:00,  1.58s/it]100%|██████████| 50/50 [00:19<00:00,  2.63it/s]
[I 2023-12-11 00:18:29,571] Trial 363 finished with value: 0.41502715214101304 and parameters: {'EMBEDDING_DIM': 953, 'HIDDEN_DIM': 294, 'NUM_LAYERS': 1, 'DROPOUT': 0.020807109233539883, 'LR': 0.0020962351443072932, 'WEIGHT_0': 0.19225532525233485, 'WEIGHT_1': 0.7269746286644319, 'WEIGHT_2': 0.45304704390485073, 'WEIGHT_3': 0.9012671742629399, 'WEIGHT_4': 0.7418061636550691, 'WEIGHT_5': 0.6825470125933364, 'WEIGHT_6': 0.7062383844314045, 'WEIGHT_7': 0.3458425237575795, 'WEIGHT_8': 0.9008817128948537, 'optimizer': 'RMSprop'}. Best is trial 221 with value: 0.418736930154747.
/userhome/cs2/dingruiw/conda/envs/py310/lib/python3.10/site-packages/torch/nn/modules/rnn.py:82: UserWarning: dropout option adds dropout after all but last recurrent layer, so non-zero dropout expects num_layers greater than 1, but got dropout=0.032152666152949386 and num_layers=1
  warnings.warn("dropout option adds dropout after all but last "
{'EMBEDDING_DIM': 953, 'HIDDEN_DIM': 294, 'NUM_LAYERS': 1, 'DROPOUT': 0.020807109233539883, 'LR': 0.0020962351443072932, 'WEIGHT_0': 0.19225532525233485, 'WEIGHT_1': 0.7269746286644319, 'WEIGHT_2': 0.45304704390485073, 'WEIGHT_3': 0.9012671742629399, 'WEIGHT_4': 0.7418061636550691, 'WEIGHT_5': 0.6825470125933364, 'WEIGHT_6': 0.7062383844314045, 'WEIGHT_7': 0.3458425237575795, 'WEIGHT_8': 0.9008817128948537, 'optimizer': 'RMSprop'}
0
              precision    recall  f1-score   support

         LOC       0.49      0.24      0.33      1837
        MISC       0.17      0.02      0.04       922
         ORG       0.18      0.05      0.08      1341
         PER       0.04      0.09      0.06      1842

   micro avg       0.13      0.12      0.13      5942
   macro avg       0.22      0.10      0.13      5942
weighted avg       0.23      0.12      0.14      5942

{'EMBEDDING_DIM': 953, 'HIDDEN_DIM': 294, 'NUM_LAYERS': 1, 'DROPOUT': 0.020807109233539883, 'LR': 0.0020962351443072932, 'WEIGHT_0': 0.19225532525233485, 'WEIGHT_1': 0.7269746286644319, 'WEIGHT_2': 0.45304704390485073, 'WEIGHT_3': 0.9012671742629399, 'WEIGHT_4': 0.7418061636550691, 'WEIGHT_5': 0.6825470125933364, 'WEIGHT_6': 0.7062383844314045, 'WEIGHT_7': 0.3458425237575795, 'WEIGHT_8': 0.9008817128948537, 'optimizer': 'RMSprop'}
49
              precision    recall  f1-score   support

         LOC       0.60      0.51      0.55      1837
        MISC       0.47      0.44      0.45       922
         ORG       0.32      0.26      0.28      1341
         PER       0.36      0.35      0.36      1842

   micro avg       0.44      0.39      0.42      5942
   macro avg       0.44      0.39      0.41      5942
weighted avg       0.44      0.39      0.42      5942

epoch 49
LSTM
  0%|          | 0/50 [00:00<?, ?it/s]  2%|▏         | 1/50 [00:04<03:42,  4.54s/it]  6%|▌         | 3/50 [00:04<00:59,  1.27s/it]  8%|▊         | 4/50 [00:04<00:40,  1.14it/s] 10%|█         | 5/50 [00:05<00:28,  1.57it/s] 12%|█▏        | 6/50 [00:05<00:21,  2.09it/s] 14%|█▍        | 7/50 [00:05<00:16,  2.67it/s] 16%|█▌        | 8/50 [00:05<00:12,  3.29it/s] 18%|█▊        | 9/50 [00:05<00:10,  3.90it/s] 20%|██        | 10/50 [00:05<00:08,  4.49it/s] 22%|██▏       | 11/50 [00:05<00:07,  5.00it/s] 24%|██▍       | 12/50 [00:06<00:06,  5.43it/s] 26%|██▌       | 13/50 [00:06<00:06,  5.78it/s] 28%|██▊       | 14/50 [00:06<00:05,  6.06it/s] 30%|███       | 15/50 [00:06<00:05,  6.25it/s] 32%|███▏      | 16/50 [00:06<00:05,  6.40it/s] 34%|███▍      | 17/50 [00:06<00:05,  6.52it/s] 36%|███▌      | 18/50 [00:06<00:04,  6.59it/s] 38%|███▊      | 19/50 [00:07<00:04,  6.64it/s] 40%|████      | 20/50 [00:07<00:04,  6.69it/s] 42%|████▏     | 21/50 [00:07<00:04,  6.71it/s] 44%|████▍     | 22/50 [00:07<00:04,  6.73it/s] 46%|████▌     | 23/50 [00:07<00:04,  6.75it/s] 48%|████▊     | 24/50 [00:07<00:03,  6.75it/s] 50%|█████     | 25/50 [00:08<00:03,  6.76it/s] 52%|█████▏    | 26/50 [00:08<00:03,  6.77it/s] 54%|█████▍    | 27/50 [00:08<00:03,  6.76it/s] 56%|█████▌    | 28/50 [00:08<00:03,  6.78it/s] 58%|█████▊    | 29/50 [00:08<00:03,  6.77it/s] 60%|██████    | 30/50 [00:08<00:02,  6.78it/s] 62%|██████▏   | 31/50 [00:08<00:02,  6.78it/s] 64%|██████▍   | 32/50 [00:09<00:02,  6.78it/s] 66%|██████▌   | 33/50 [00:09<00:02,  6.78it/s] 68%|██████▊   | 34/50 [00:09<00:02,  6.78it/s] 70%|███████   | 35/50 [00:09<00:02,  6.78it/s] 72%|███████▏  | 36/50 [00:09<00:02,  6.77it/s] 74%|███████▍  | 37/50 [00:09<00:01,  6.78it/s] 76%|███████▌  | 38/50 [00:09<00:01,  6.78it/s] 78%|███████▊  | 39/50 [00:10<00:01,  6.77it/s] 80%|████████  | 40/50 [00:10<00:01,  6.78it/s] 82%|████████▏ | 41/50 [00:10<00:01,  6.77it/s] 84%|████████▍ | 42/50 [00:10<00:01,  6.77it/s] 86%|████████▌ | 43/50 [00:10<00:01,  6.78it/s] 88%|████████▊ | 44/50 [00:10<00:00,  6.77it/s] 90%|█████████ | 45/50 [00:10<00:00,  6.77it/s] 92%|█████████▏| 46/50 [00:11<00:00,  6.78it/s] 94%|█████████▍| 47/50 [00:11<00:00,  6.78it/s] 96%|█████████▌| 48/50 [00:11<00:00,  6.78it/s] 98%|█████████▊| 49/50 [00:11<00:00,  6.77it/s]100%|██████████| 50/50 [00:16<00:00,  1.49s/it]100%|██████████| 50/50 [00:16<00:00,  3.09it/s]
[I 2023-12-11 00:18:49,966] Trial 364 finished with value: 0.40124112027435294 and parameters: {'EMBEDDING_DIM': 972, 'HIDDEN_DIM': 213, 'NUM_LAYERS': 1, 'DROPOUT': 0.032152666152949386, 'LR': 0.0021038974902216822, 'WEIGHT_0': 0.18886304623196176, 'WEIGHT_1': 0.7206849600578751, 'WEIGHT_2': 0.39695252941866505, 'WEIGHT_3': 0.8979111154214939, 'WEIGHT_4': 0.7394307880100454, 'WEIGHT_5': 0.6731003077972996, 'WEIGHT_6': 0.7005293302933763, 'WEIGHT_7': 0.29124425695246486, 'WEIGHT_8': 0.878050294343149, 'optimizer': 'RMSprop'}. Best is trial 221 with value: 0.418736930154747.
/userhome/cs2/dingruiw/conda/envs/py310/lib/python3.10/site-packages/torch/nn/modules/rnn.py:82: UserWarning: dropout option adds dropout after all but last recurrent layer, so non-zero dropout expects num_layers greater than 1, but got dropout=0.03824613870064812 and num_layers=1
  warnings.warn("dropout option adds dropout after all but last "
{'EMBEDDING_DIM': 972, 'HIDDEN_DIM': 213, 'NUM_LAYERS': 1, 'DROPOUT': 0.032152666152949386, 'LR': 0.0021038974902216822, 'WEIGHT_0': 0.18886304623196176, 'WEIGHT_1': 0.7206849600578751, 'WEIGHT_2': 0.39695252941866505, 'WEIGHT_3': 0.8979111154214939, 'WEIGHT_4': 0.7394307880100454, 'WEIGHT_5': 0.6731003077972996, 'WEIGHT_6': 0.7005293302933763, 'WEIGHT_7': 0.29124425695246486, 'WEIGHT_8': 0.878050294343149, 'optimizer': 'RMSprop'}
0
              precision    recall  f1-score   support

         LOC       0.27      0.32      0.29      1837
        MISC       0.09      0.05      0.07       922
         ORG       0.14      0.06      0.08      1341
         PER       0.07      0.07      0.07      1842

   micro avg       0.16      0.14      0.15      5942
   macro avg       0.14      0.13      0.13      5942
weighted avg       0.15      0.14      0.14      5942

{'EMBEDDING_DIM': 972, 'HIDDEN_DIM': 213, 'NUM_LAYERS': 1, 'DROPOUT': 0.032152666152949386, 'LR': 0.0021038974902216822, 'WEIGHT_0': 0.18886304623196176, 'WEIGHT_1': 0.7206849600578751, 'WEIGHT_2': 0.39695252941866505, 'WEIGHT_3': 0.8979111154214939, 'WEIGHT_4': 0.7394307880100454, 'WEIGHT_5': 0.6731003077972996, 'WEIGHT_6': 0.7005293302933763, 'WEIGHT_7': 0.29124425695246486, 'WEIGHT_8': 0.878050294343149, 'optimizer': 'RMSprop'}
49
              precision    recall  f1-score   support

         LOC       0.51      0.54      0.53      1837
        MISC       0.43      0.45      0.44       922
         ORG       0.26      0.27      0.27      1341
         PER       0.35      0.37      0.36      1842

   micro avg       0.39      0.41      0.40      5942
   macro avg       0.39      0.41      0.40      5942
weighted avg       0.39      0.41      0.40      5942

epoch 49
LSTM
  0%|          | 0/50 [00:00<?, ?it/s]  2%|▏         | 1/50 [00:04<03:41,  4.51s/it]  4%|▍         | 2/50 [00:04<01:32,  1.92s/it]  6%|▌         | 3/50 [00:04<00:53,  1.14s/it]  8%|▊         | 4/50 [00:05<00:35,  1.30it/s] 10%|█         | 5/50 [00:05<00:25,  1.77it/s] 12%|█▏        | 6/50 [00:05<00:19,  2.26it/s] 14%|█▍        | 7/50 [00:05<00:15,  2.75it/s] 16%|█▌        | 8/50 [00:05<00:13,  3.20it/s] 18%|█▊        | 9/50 [00:06<00:11,  3.59it/s] 20%|██        | 10/50 [00:06<00:10,  3.91it/s] 22%|██▏       | 11/50 [00:06<00:09,  4.17it/s] 24%|██▍       | 12/50 [00:06<00:08,  4.37it/s] 26%|██▌       | 13/50 [00:06<00:08,  4.52it/s] 28%|██▊       | 14/50 [00:07<00:07,  4.63it/s] 30%|███       | 15/50 [00:07<00:07,  4.71it/s] 32%|███▏      | 16/50 [00:07<00:07,  4.76it/s] 34%|███▍      | 17/50 [00:07<00:06,  4.79it/s] 36%|███▌      | 18/50 [00:07<00:06,  4.82it/s] 38%|███▊      | 19/50 [00:08<00:06,  4.85it/s] 40%|████      | 20/50 [00:08<00:06,  4.87it/s] 42%|████▏     | 21/50 [00:08<00:05,  4.88it/s] 44%|████▍     | 22/50 [00:08<00:05,  4.90it/s] 46%|████▌     | 23/50 [00:08<00:05,  4.89it/s] 48%|████▊     | 24/50 [00:09<00:05,  4.89it/s] 50%|█████     | 25/50 [00:09<00:05,  4.89it/s] 52%|█████▏    | 26/50 [00:09<00:04,  4.89it/s] 54%|█████▍    | 27/50 [00:09<00:04,  4.89it/s] 56%|█████▌    | 28/50 [00:09<00:04,  4.89it/s] 58%|█████▊    | 29/50 [00:10<00:04,  4.89it/s] 60%|██████    | 30/50 [00:10<00:04,  4.88it/s] 62%|██████▏   | 31/50 [00:10<00:03,  4.88it/s] 64%|██████▍   | 32/50 [00:10<00:03,  4.89it/s] 66%|██████▌   | 33/50 [00:10<00:03,  4.89it/s] 68%|██████▊   | 34/50 [00:11<00:03,  4.90it/s] 70%|███████   | 35/50 [00:11<00:03,  4.90it/s] 72%|███████▏  | 36/50 [00:11<00:02,  4.89it/s] 74%|███████▍  | 37/50 [00:11<00:02,  4.89it/s] 76%|███████▌  | 38/50 [00:11<00:02,  4.89it/s] 78%|███████▊  | 39/50 [00:12<00:02,  4.89it/s] 80%|████████  | 40/50 [00:12<00:02,  4.88it/s] 82%|████████▏ | 41/50 [00:12<00:01,  4.88it/s] 84%|████████▍ | 42/50 [00:12<00:01,  4.88it/s] 86%|████████▌ | 43/50 [00:13<00:01,  4.87it/s] 88%|████████▊ | 44/50 [00:13<00:01,  4.87it/s] 90%|█████████ | 45/50 [00:13<00:01,  4.89it/s] 92%|█████████▏| 46/50 [00:13<00:00,  4.89it/s] 94%|█████████▍| 47/50 [00:13<00:00,  4.88it/s] 96%|█████████▌| 48/50 [00:14<00:00,  4.88it/s] 98%|█████████▊| 49/50 [00:14<00:00,  4.88it/s]100%|██████████| 50/50 [00:18<00:00,  1.54s/it]100%|██████████| 50/50 [00:18<00:00,  2.65it/s]
