[I 2023-12-10 21:11:51,037] Trial 17 finished with value: 0.2176346453803101 and parameters: {'EMBEDDING_DIM': 752, 'HIDDEN_DIM': 1085, 'NUM_LAYERS': 3, 'DROPOUT': 0.4136840011443111, 'LR': 0.005523975009328951, 'WEIGHT_0': 0.3995710785571385, 'WEIGHT_1': 0.4050433012450875, 'WEIGHT_2': 0.27319572015774474, 'WEIGHT_3': 0.7786704007406915, 'WEIGHT_4': 0.687449823695074, 'WEIGHT_5': 0.858920401038584, 'WEIGHT_6': 0.9935183222831021, 'WEIGHT_7': 0.13313568206638315, 'WEIGHT_8': 0.37002295405130947, 'optimizer': 'Adam'}. Best is trial 10 with value: 0.3870380484252685.
{'EMBEDDING_DIM': 752, 'HIDDEN_DIM': 1085, 'NUM_LAYERS': 3, 'DROPOUT': 0.4136840011443111, 'LR': 0.005523975009328951, 'WEIGHT_0': 0.3995710785571385, 'WEIGHT_1': 0.4050433012450875, 'WEIGHT_2': 0.27319572015774474, 'WEIGHT_3': 0.7786704007406915, 'WEIGHT_4': 0.687449823695074, 'WEIGHT_5': 0.858920401038584, 'WEIGHT_6': 0.9935183222831021, 'WEIGHT_7': 0.13313568206638315, 'WEIGHT_8': 0.37002295405130947, 'optimizer': 'Adam'}
0
              precision    recall  f1-score   support

         LOC       0.04      0.02      0.03      1837
        MISC       0.03      0.02      0.02       922
         ORG       0.00      0.00      0.00      1341
         PER       0.00      0.00      0.00      1842

   micro avg       0.04      0.01      0.01      5942
   macro avg       0.02      0.01      0.01      5942
weighted avg       0.02      0.01      0.01      5942

{'EMBEDDING_DIM': 752, 'HIDDEN_DIM': 1085, 'NUM_LAYERS': 3, 'DROPOUT': 0.4136840011443111, 'LR': 0.005523975009328951, 'WEIGHT_0': 0.3995710785571385, 'WEIGHT_1': 0.4050433012450875, 'WEIGHT_2': 0.27319572015774474, 'WEIGHT_3': 0.7786704007406915, 'WEIGHT_4': 0.687449823695074, 'WEIGHT_5': 0.858920401038584, 'WEIGHT_6': 0.9935183222831021, 'WEIGHT_7': 0.13313568206638315, 'WEIGHT_8': 0.37002295405130947, 'optimizer': 'Adam'}
49
              precision    recall  f1-score   support

         LOC       0.28      0.32      0.30      1837
        MISC       0.08      0.01      0.02       922
         ORG       0.19      0.12      0.14      1341
         PER       0.23      0.23      0.23      1842

   micro avg       0.24      0.20      0.22      5942
   macro avg       0.19      0.17      0.17      5942
weighted avg       0.21      0.20      0.20      5942

epoch 49
LSTM
  0%|          | 0/50 [00:00<?, ?it/s]  2%|▏         | 1/50 [00:05<04:28,  5.47s/it]  4%|▍         | 2/50 [00:05<01:51,  2.32s/it]  6%|▌         | 3/50 [00:05<01:05,  1.38s/it]  8%|▊         | 4/50 [00:06<00:43,  1.06it/s] 10%|█         | 5/50 [00:06<00:31,  1.42it/s] 12%|█▏        | 6/50 [00:06<00:24,  1.79it/s] 14%|█▍        | 7/50 [00:06<00:20,  2.14it/s] 16%|█▌        | 8/50 [00:07<00:17,  2.46it/s] 18%|█▊        | 9/50 [00:07<00:14,  2.74it/s] 20%|██        | 10/50 [00:07<00:13,  2.96it/s] 22%|██▏       | 11/50 [00:08<00:12,  3.13it/s] 24%|██▍       | 12/50 [00:08<00:11,  3.26it/s] 26%|██▌       | 13/50 [00:08<00:11,  3.36it/s] 28%|██▊       | 14/50 [00:08<00:10,  3.43it/s] 30%|███       | 15/50 [00:09<00:10,  3.48it/s] 32%|███▏      | 16/50 [00:09<00:09,  3.52it/s] 34%|███▍      | 17/50 [00:09<00:09,  3.54it/s] 36%|███▌      | 18/50 [00:10<00:08,  3.56it/s] 38%|███▊      | 19/50 [00:10<00:08,  3.57it/s] 40%|████      | 20/50 [00:10<00:08,  3.62it/s] 42%|████▏     | 21/50 [00:10<00:08,  3.58it/s] 44%|████▍     | 22/50 [00:11<00:07,  3.59it/s] 46%|████▌     | 23/50 [00:11<00:07,  3.59it/s] 48%|████▊     | 24/50 [00:11<00:07,  3.59it/s] 50%|█████     | 25/50 [00:11<00:06,  3.59it/s] 52%|█████▏    | 26/50 [00:12<00:06,  3.59it/s] 54%|█████▍    | 27/50 [00:12<00:06,  3.59it/s] 56%|█████▌    | 28/50 [00:12<00:06,  3.58it/s] 58%|█████▊    | 29/50 [00:13<00:05,  3.59it/s] 60%|██████    | 30/50 [00:13<00:05,  3.60it/s] 62%|██████▏   | 31/50 [00:13<00:05,  3.60it/s] 64%|██████▍   | 32/50 [00:13<00:05,  3.60it/s] 66%|██████▌   | 33/50 [00:14<00:04,  3.60it/s] 68%|██████▊   | 34/50 [00:14<00:04,  3.60it/s] 70%|███████   | 35/50 [00:14<00:04,  3.61it/s] 72%|███████▏  | 36/50 [00:15<00:03,  3.60it/s] 74%|███████▍  | 37/50 [00:15<00:03,  3.60it/s] 76%|███████▌  | 38/50 [00:15<00:03,  3.60it/s] 78%|███████▊  | 39/50 [00:15<00:03,  3.60it/s] 80%|████████  | 40/50 [00:16<00:02,  3.60it/s] 82%|████████▏ | 41/50 [00:16<00:02,  3.60it/s] 84%|████████▍ | 42/50 [00:16<00:02,  3.59it/s] 86%|████████▌ | 43/50 [00:16<00:01,  3.58it/s] 88%|████████▊ | 44/50 [00:17<00:01,  3.59it/s] 90%|█████████ | 45/50 [00:17<00:01,  3.60it/s] 92%|█████████▏| 46/50 [00:17<00:01,  3.59it/s] 94%|█████████▍| 47/50 [00:18<00:00,  3.59it/s] 96%|█████████▌| 48/50 [00:18<00:00,  3.59it/s] 98%|█████████▊| 49/50 [00:18<00:00,  3.59it/s]100%|██████████| 50/50 [00:24<00:00,  1.87s/it]100%|██████████| 50/50 [00:24<00:00,  2.07it/s]
[I 2023-12-10 21:12:20,212] Trial 18 finished with value: 0.0 and parameters: {'EMBEDDING_DIM': 897, 'HIDDEN_DIM': 282, 'NUM_LAYERS': 2, 'DROPOUT': 0.493343134832804, 'LR': 0.003357797322092882, 'WEIGHT_0': 0.5683578974949073, 'WEIGHT_1': 0.5635618044228403, 'WEIGHT_2': 0.3954476513214193, 'WEIGHT_3': 0.9985677518621834, 'WEIGHT_4': 0.5870555073543348, 'WEIGHT_5': 0.6140730843776754, 'WEIGHT_6': 0.8565878511696399, 'WEIGHT_7': 0.0022290286366703303, 'WEIGHT_8': 0.012373165755506066, 'optimizer': 'SGD'}. Best is trial 10 with value: 0.3870380484252685.
/userhome/cs2/dingruiw/conda/envs/py310/lib/python3.10/site-packages/torch/nn/modules/rnn.py:82: UserWarning: dropout option adds dropout after all but last recurrent layer, so non-zero dropout expects num_layers greater than 1, but got dropout=0.39057827976485304 and num_layers=1
  warnings.warn("dropout option adds dropout after all but last "
{'EMBEDDING_DIM': 897, 'HIDDEN_DIM': 282, 'NUM_LAYERS': 2, 'DROPOUT': 0.493343134832804, 'LR': 0.003357797322092882, 'WEIGHT_0': 0.5683578974949073, 'WEIGHT_1': 0.5635618044228403, 'WEIGHT_2': 0.3954476513214193, 'WEIGHT_3': 0.9985677518621834, 'WEIGHT_4': 0.5870555073543348, 'WEIGHT_5': 0.6140730843776754, 'WEIGHT_6': 0.8565878511696399, 'WEIGHT_7': 0.0022290286366703303, 'WEIGHT_8': 0.012373165755506066, 'optimizer': 'SGD'}
0
              precision    recall  f1-score   support

         LOC       0.03      0.14      0.05      1837
        MISC       0.00      0.00      0.00       922
         ORG       0.02      0.02      0.02      1341
         PER       0.00      0.00      0.00      1842

   micro avg       0.03      0.05      0.03      5942
   macro avg       0.01      0.04      0.02      5942
weighted avg       0.01      0.05      0.02      5942

{'EMBEDDING_DIM': 897, 'HIDDEN_DIM': 282, 'NUM_LAYERS': 2, 'DROPOUT': 0.493343134832804, 'LR': 0.003357797322092882, 'WEIGHT_0': 0.5683578974949073, 'WEIGHT_1': 0.5635618044228403, 'WEIGHT_2': 0.3954476513214193, 'WEIGHT_3': 0.9985677518621834, 'WEIGHT_4': 0.5870555073543348, 'WEIGHT_5': 0.6140730843776754, 'WEIGHT_6': 0.8565878511696399, 'WEIGHT_7': 0.0022290286366703303, 'WEIGHT_8': 0.012373165755506066, 'optimizer': 'SGD'}
49
              precision    recall  f1-score   support

         LOC       0.00      0.00      0.00      1837
        MISC       0.00      0.00      0.00       922
         ORG       0.00      0.00      0.00      1341
         PER       0.00      0.00      0.00      1842

   micro avg       0.00      0.00      0.00      5942
   macro avg       0.00      0.00      0.00      5942
weighted avg       0.00      0.00      0.00      5942

epoch 49
LSTM
  0%|          | 0/50 [00:00<?, ?it/s]  2%|▏         | 1/50 [00:05<04:11,  5.13s/it]  4%|▍         | 2/50 [00:05<01:48,  2.26s/it]  6%|▌         | 3/50 [00:05<01:09,  1.48s/it]  8%|▊         | 4/50 [00:06<00:51,  1.11s/it] 10%|█         | 5/50 [00:07<00:40,  1.10it/s] 12%|█▏        | 6/50 [00:07<00:34,  1.28it/s] 14%|█▍        | 7/50 [00:08<00:30,  1.41it/s] 16%|█▌        | 8/50 [00:08<00:27,  1.52it/s] 18%|█▊        | 9/50 [00:09<00:25,  1.61it/s] 20%|██        | 10/50 [00:09<00:23,  1.67it/s] 22%|██▏       | 11/50 [00:10<00:22,  1.71it/s] 24%|██▍       | 12/50 [00:10<00:21,  1.75it/s] 26%|██▌       | 13/50 [00:11<00:20,  1.77it/s] 28%|██▊       | 14/50 [00:11<00:20,  1.80it/s] 30%|███       | 15/50 [00:12<00:19,  1.81it/s] 32%|███▏      | 16/50 [00:13<00:18,  1.82it/s] 34%|███▍      | 17/50 [00:13<00:18,  1.83it/s] 36%|███▌      | 18/50 [00:14<00:17,  1.83it/s] 38%|███▊      | 19/50 [00:14<00:17,  1.82it/s] 40%|████      | 20/50 [00:15<00:16,  1.82it/s] 42%|████▏     | 21/50 [00:15<00:15,  1.82it/s] 44%|████▍     | 22/50 [00:16<00:15,  1.82it/s] 46%|████▌     | 23/50 [00:16<00:14,  1.82it/s] 48%|████▊     | 24/50 [00:17<00:14,  1.83it/s] 50%|█████     | 25/50 [00:17<00:13,  1.84it/s] 52%|█████▏    | 26/50 [00:18<00:13,  1.83it/s] 54%|█████▍    | 27/50 [00:19<00:12,  1.84it/s] 56%|█████▌    | 28/50 [00:19<00:12,  1.83it/s] 58%|█████▊    | 29/50 [00:20<00:11,  1.82it/s] 60%|██████    | 30/50 [00:20<00:10,  1.82it/s] 62%|██████▏   | 31/50 [00:21<00:10,  1.83it/s] 64%|██████▍   | 32/50 [00:21<00:09,  1.82it/s] 66%|██████▌   | 33/50 [00:22<00:09,  1.81it/s] 68%|██████▊   | 34/50 [00:22<00:08,  1.81it/s] 70%|███████   | 35/50 [00:23<00:08,  1.81it/s] 72%|███████▏  | 36/50 [00:24<00:07,  1.81it/s] 74%|███████▍  | 37/50 [00:24<00:07,  1.82it/s] 76%|███████▌  | 38/50 [00:25<00:06,  1.82it/s] 78%|███████▊  | 39/50 [00:25<00:06,  1.82it/s] 80%|████████  | 40/50 [00:26<00:05,  1.82it/s] 82%|████████▏ | 41/50 [00:26<00:04,  1.82it/s] 84%|████████▍ | 42/50 [00:27<00:04,  1.80it/s] 86%|████████▌ | 43/50 [00:27<00:03,  1.82it/s] 88%|████████▊ | 44/50 [00:28<00:03,  1.81it/s] 90%|█████████ | 45/50 [00:28<00:02,  1.82it/s] 92%|█████████▏| 46/50 [00:29<00:02,  1.82it/s] 94%|█████████▍| 47/50 [00:30<00:01,  1.82it/s] 96%|█████████▌| 48/50 [00:30<00:01,  1.82it/s] 98%|█████████▊| 49/50 [00:31<00:00,  1.81it/s]100%|██████████| 50/50 [00:36<00:00,  2.02s/it]100%|██████████| 50/50 [00:36<00:00,  1.37it/s]
[I 2023-12-10 21:13:01,170] Trial 19 finished with value: 0.3947319948425124 and parameters: {'EMBEDDING_DIM': 1001, 'HIDDEN_DIM': 717, 'NUM_LAYERS': 1, 'DROPOUT': 0.39057827976485304, 'LR': 0.004154289498171838, 'WEIGHT_0': 0.7262003704546426, 'WEIGHT_1': 0.7798480535780494, 'WEIGHT_2': 0.536655401233318, 'WEIGHT_3': 0.7915826763134279, 'WEIGHT_4': 0.7483446766727719, 'WEIGHT_5': 0.8648547706141839, 'WEIGHT_6': 0.890611679108898, 'WEIGHT_7': 0.2705195420452835, 'WEIGHT_8': 0.6488578103602569, 'optimizer': 'Adam'}. Best is trial 19 with value: 0.3947319948425124.
{'EMBEDDING_DIM': 1001, 'HIDDEN_DIM': 717, 'NUM_LAYERS': 1, 'DROPOUT': 0.39057827976485304, 'LR': 0.004154289498171838, 'WEIGHT_0': 0.7262003704546426, 'WEIGHT_1': 0.7798480535780494, 'WEIGHT_2': 0.536655401233318, 'WEIGHT_3': 0.7915826763134279, 'WEIGHT_4': 0.7483446766727719, 'WEIGHT_5': 0.8648547706141839, 'WEIGHT_6': 0.890611679108898, 'WEIGHT_7': 0.2705195420452835, 'WEIGHT_8': 0.6488578103602569, 'optimizer': 'Adam'}
0
              precision    recall  f1-score   support

         LOC       0.16      0.05      0.07      1837
        MISC       0.04      0.02      0.02       922
         ORG       0.11      0.03      0.04      1341
         PER       0.06      0.03      0.04      1842

   micro avg       0.09      0.03      0.05      5942
   macro avg       0.09      0.03      0.04      5942
weighted avg       0.10      0.03      0.05      5942

{'EMBEDDING_DIM': 1001, 'HIDDEN_DIM': 717, 'NUM_LAYERS': 1, 'DROPOUT': 0.39057827976485304, 'LR': 0.004154289498171838, 'WEIGHT_0': 0.7262003704546426, 'WEIGHT_1': 0.7798480535780494, 'WEIGHT_2': 0.536655401233318, 'WEIGHT_3': 0.7915826763134279, 'WEIGHT_4': 0.7483446766727719, 'WEIGHT_5': 0.8648547706141839, 'WEIGHT_6': 0.890611679108898, 'WEIGHT_7': 0.2705195420452835, 'WEIGHT_8': 0.6488578103602569, 'optimizer': 'Adam'}
49
              precision    recall  f1-score   support

         LOC       0.62      0.51      0.56      1837
        MISC       0.51      0.38      0.44       922
         ORG       0.27      0.23      0.25      1341
         PER       0.34      0.29      0.32      1842

   micro avg       0.44      0.36      0.39      5942
   macro avg       0.44      0.35      0.39      5942
weighted avg       0.44      0.36      0.40      5942

epoch 49
LSTM
  0%|          | 0/50 [00:00<?, ?it/s]  2%|▏         | 1/50 [00:11<09:43, 11.90s/it]  4%|▍         | 2/50 [00:13<04:26,  5.55s/it]  6%|▌         | 3/50 [00:15<03:09,  4.03s/it]  8%|▊         | 4/50 [00:17<02:32,  3.32s/it] 10%|█         | 5/50 [00:19<02:11,  2.93s/it] 12%|█▏        | 6/50 [00:21<01:58,  2.69s/it] 14%|█▍        | 7/50 [00:24<01:49,  2.55s/it] 16%|█▌        | 8/50 [00:26<01:43,  2.46s/it] 18%|█▊        | 9/50 [00:28<01:38,  2.41s/it] 20%|██        | 10/50 [00:31<01:34,  2.37s/it] 22%|██▏       | 11/50 [00:33<01:31,  2.35s/it] 24%|██▍       | 12/50 [00:35<01:28,  2.33s/it] 26%|██▌       | 13/50 [00:37<01:25,  2.32s/it] 28%|██▊       | 14/50 [00:40<01:23,  2.32s/it] 30%|███       | 15/50 [00:42<01:20,  2.31s/it] 32%|███▏      | 16/50 [00:44<01:18,  2.30s/it] 34%|███▍      | 17/50 [00:47<01:15,  2.30s/it] 36%|███▌      | 18/50 [00:49<01:13,  2.29s/it] 38%|███▊      | 19/50 [00:51<01:11,  2.29s/it] 40%|████      | 20/50 [00:53<01:09,  2.30s/it] 42%|████▏     | 21/50 [00:56<01:06,  2.31s/it] 44%|████▍     | 22/50 [00:58<01:04,  2.31s/it] 46%|████▌     | 23/50 [01:00<01:02,  2.31s/it] 48%|████▊     | 24/50 [01:03<00:59,  2.31s/it] 50%|█████     | 25/50 [01:05<00:57,  2.31s/it] 52%|█████▏    | 26/50 [01:07<00:55,  2.31s/it] 54%|█████▍    | 27/50 [01:10<00:52,  2.30s/it] 56%|█████▌    | 28/50 [01:12<00:50,  2.30s/it] 58%|█████▊    | 29/50 [01:14<00:48,  2.31s/it] 60%|██████    | 30/50 [01:17<00:46,  2.31s/it] 62%|██████▏   | 31/50 [01:19<00:43,  2.30s/it] 64%|██████▍   | 32/50 [01:21<00:41,  2.31s/it] 66%|██████▌   | 33/50 [01:23<00:39,  2.31s/it] 68%|██████▊   | 34/50 [01:26<00:36,  2.31s/it] 70%|███████   | 35/50 [01:28<00:34,  2.30s/it] 72%|███████▏  | 36/50 [01:30<00:32,  2.31s/it] 74%|███████▍  | 37/50 [01:33<00:30,  2.32s/it] 76%|███████▌  | 38/50 [01:35<00:27,  2.32s/it] 78%|███████▊  | 39/50 [01:37<00:25,  2.32s/it] 80%|████████  | 40/50 [01:40<00:23,  2.32s/it] 82%|████████▏ | 41/50 [01:42<00:20,  2.32s/it] 84%|████████▍ | 42/50 [01:44<00:18,  2.32s/it] 86%|████████▌ | 43/50 [01:47<00:16,  2.31s/it] 88%|████████▊ | 44/50 [01:49<00:13,  2.31s/it] 90%|█████████ | 45/50 [01:51<00:11,  2.31s/it] 92%|█████████▏| 46/50 [01:54<00:09,  2.31s/it] 94%|█████████▍| 47/50 [01:56<00:06,  2.31s/it] 96%|█████████▌| 48/50 [01:58<00:04,  2.31s/it] 98%|█████████▊| 49/50 [02:00<00:02,  2.31s/it]100%|██████████| 50/50 [02:14<00:00,  5.59s/it]100%|██████████| 50/50 [02:14<00:00,  2.68s/it]
[I 2023-12-10 21:15:25,167] Trial 20 finished with value: 0.17192737430167598 and parameters: {'EMBEDDING_DIM': 1020, 'HIDDEN_DIM': 1252, 'NUM_LAYERS': 2, 'DROPOUT': 0.4033868545810094, 'LR': 0.006442080212307421, 'WEIGHT_0': 0.769143943340195, 'WEIGHT_1': 0.819669902369961, 'WEIGHT_2': 0.5385511591329786, 'WEIGHT_3': 0.7264645336768156, 'WEIGHT_4': 0.9859361016976755, 'WEIGHT_5': 0.8760118943962684, 'WEIGHT_6': 0.587337319048699, 'WEIGHT_7': 0.41313993061055154, 'WEIGHT_8': 0.6551063142423262, 'optimizer': 'Adam'}. Best is trial 19 with value: 0.3947319948425124.
/userhome/cs2/dingruiw/conda/envs/py310/lib/python3.10/site-packages/torch/nn/modules/rnn.py:82: UserWarning: dropout option adds dropout after all but last recurrent layer, so non-zero dropout expects num_layers greater than 1, but got dropout=0.45633915031717276 and num_layers=1
  warnings.warn("dropout option adds dropout after all but last "
{'EMBEDDING_DIM': 1020, 'HIDDEN_DIM': 1252, 'NUM_LAYERS': 2, 'DROPOUT': 0.4033868545810094, 'LR': 0.006442080212307421, 'WEIGHT_0': 0.769143943340195, 'WEIGHT_1': 0.819669902369961, 'WEIGHT_2': 0.5385511591329786, 'WEIGHT_3': 0.7264645336768156, 'WEIGHT_4': 0.9859361016976755, 'WEIGHT_5': 0.8760118943962684, 'WEIGHT_6': 0.587337319048699, 'WEIGHT_7': 0.41313993061055154, 'WEIGHT_8': 0.6551063142423262, 'optimizer': 'Adam'}
0
              precision    recall  f1-score   support

         LOC       0.21      0.01      0.01      1837
        MISC       0.09      0.01      0.02       922
         ORG       0.00      0.00      0.00      1341
         PER       0.03      0.01      0.02      1842

   micro avg       0.04      0.01      0.01      5942
   macro avg       0.08      0.01      0.01      5942
weighted avg       0.09      0.01      0.01      5942

{'EMBEDDING_DIM': 1020, 'HIDDEN_DIM': 1252, 'NUM_LAYERS': 2, 'DROPOUT': 0.4033868545810094, 'LR': 0.006442080212307421, 'WEIGHT_0': 0.769143943340195, 'WEIGHT_1': 0.819669902369961, 'WEIGHT_2': 0.5385511591329786, 'WEIGHT_3': 0.7264645336768156, 'WEIGHT_4': 0.9859361016976755, 'WEIGHT_5': 0.8760118943962684, 'WEIGHT_6': 0.587337319048699, 'WEIGHT_7': 0.41313993061055154, 'WEIGHT_8': 0.6551063142423262, 'optimizer': 'Adam'}
49
              precision    recall  f1-score   support

         LOC       0.20      0.41      0.27      1837
        MISC       0.21      0.02      0.03       922
         ORG       0.13      0.14      0.13      1341
         PER       0.09      0.15      0.11      1842

   micro avg       0.15      0.21      0.17      5942
   macro avg       0.16      0.18      0.14      5942
weighted avg       0.15      0.21      0.15      5942

epoch 49
LSTM
  0%|          | 0/50 [00:00<?, ?it/s]  2%|▏         | 1/50 [00:05<04:08,  5.07s/it]  4%|▍         | 2/50 [00:05<01:47,  2.24s/it]  6%|▌         | 3/50 [00:05<01:08,  1.46s/it]  8%|▊         | 4/50 [00:06<00:50,  1.09s/it] 10%|█         | 5/50 [00:06<00:39,  1.13it/s] 12%|█▏        | 6/50 [00:07<00:33,  1.31it/s] 14%|█▍        | 7/50 [00:07<00:29,  1.45it/s] 16%|█▌        | 8/50 [00:08<00:26,  1.56it/s] 18%|█▊        | 9/50 [00:09<00:24,  1.66it/s] 20%|██        | 10/50 [00:09<00:23,  1.72it/s] 22%|██▏       | 11/50 [00:10<00:22,  1.77it/s] 24%|██▍       | 12/50 [00:10<00:21,  1.81it/s] 26%|██▌       | 13/50 [00:11<00:20,  1.83it/s] 28%|██▊       | 14/50 [00:11<00:19,  1.85it/s] 30%|███       | 15/50 [00:12<00:18,  1.86it/s] 32%|███▏      | 16/50 [00:12<00:18,  1.87it/s] 34%|███▍      | 17/50 [00:13<00:17,  1.87it/s] 36%|███▌      | 18/50 [00:13<00:17,  1.88it/s] 38%|███▊      | 19/50 [00:14<00:16,  1.87it/s] 40%|████      | 20/50 [00:14<00:15,  1.88it/s] 42%|████▏     | 21/50 [00:15<00:15,  1.88it/s] 44%|████▍     | 22/50 [00:15<00:14,  1.88it/s] 46%|████▌     | 23/50 [00:16<00:14,  1.88it/s] 48%|████▊     | 24/50 [00:16<00:13,  1.88it/s] 50%|█████     | 25/50 [00:17<00:13,  1.89it/s] 52%|█████▏    | 26/50 [00:18<00:12,  1.89it/s] 54%|█████▍    | 27/50 [00:18<00:12,  1.89it/s] 56%|█████▌    | 28/50 [00:19<00:11,  1.88it/s] 58%|█████▊    | 29/50 [00:19<00:11,  1.88it/s] 60%|██████    | 30/50 [00:20<00:10,  1.89it/s] 62%|██████▏   | 31/50 [00:20<00:10,  1.88it/s] 64%|██████▍   | 32/50 [00:21<00:09,  1.88it/s] 66%|██████▌   | 33/50 [00:21<00:09,  1.88it/s] 68%|██████▊   | 34/50 [00:22<00:08,  1.88it/s] 70%|███████   | 35/50 [00:22<00:07,  1.88it/s] 72%|███████▏  | 36/50 [00:23<00:07,  1.89it/s] 74%|███████▍  | 37/50 [00:23<00:06,  1.89it/s] 76%|███████▌  | 38/50 [00:24<00:06,  1.88it/s] 78%|███████▊  | 39/50 [00:24<00:05,  1.88it/s] 80%|████████  | 40/50 [00:25<00:05,  1.88it/s] 82%|████████▏ | 41/50 [00:26<00:04,  1.88it/s] 84%|████████▍ | 42/50 [00:26<00:04,  1.88it/s] 86%|████████▌ | 43/50 [00:27<00:03,  1.87it/s] 88%|████████▊ | 44/50 [00:27<00:03,  1.88it/s] 90%|█████████ | 45/50 [00:28<00:02,  1.88it/s] 92%|█████████▏| 46/50 [00:28<00:02,  1.87it/s] 94%|█████████▍| 47/50 [00:29<00:01,  1.87it/s] 96%|█████████▌| 48/50 [00:29<00:01,  1.88it/s] 98%|█████████▊| 49/50 [00:30<00:00,  1.87it/s]100%|██████████| 50/50 [00:35<00:00,  1.96s/it]100%|██████████| 50/50 [00:35<00:00,  1.41it/s]
