[I 2023-12-10 21:48:20,082] Trial 61 finished with value: 0.3901880621422731 and parameters: {'EMBEDDING_DIM': 928, 'HIDDEN_DIM': 346, 'NUM_LAYERS': 1, 'DROPOUT': 0.36934621563830666, 'LR': 0.002049475619493676, 'WEIGHT_0': 0.3776115172023816, 'WEIGHT_1': 0.6455680931599648, 'WEIGHT_2': 0.5324670270869934, 'WEIGHT_3': 0.8378612736632284, 'WEIGHT_4': 0.8775139525624266, 'WEIGHT_5': 0.7695484047200457, 'WEIGHT_6': 0.8358754931918444, 'WEIGHT_7': 0.41169276407152844, 'WEIGHT_8': 0.32147482200347893, 'optimizer': 'Adam'}. Best is trial 51 with value: 0.41438326562364947.
/userhome/cs2/dingruiw/conda/envs/py310/lib/python3.10/site-packages/torch/nn/modules/rnn.py:82: UserWarning: dropout option adds dropout after all but last recurrent layer, so non-zero dropout expects num_layers greater than 1, but got dropout=0.339630472677399 and num_layers=1
  warnings.warn("dropout option adds dropout after all but last "
{'EMBEDDING_DIM': 928, 'HIDDEN_DIM': 346, 'NUM_LAYERS': 1, 'DROPOUT': 0.36934621563830666, 'LR': 0.002049475619493676, 'WEIGHT_0': 0.3776115172023816, 'WEIGHT_1': 0.6455680931599648, 'WEIGHT_2': 0.5324670270869934, 'WEIGHT_3': 0.8378612736632284, 'WEIGHT_4': 0.8775139525624266, 'WEIGHT_5': 0.7695484047200457, 'WEIGHT_6': 0.8358754931918444, 'WEIGHT_7': 0.41169276407152844, 'WEIGHT_8': 0.32147482200347893, 'optimizer': 'Adam'}
0
              precision    recall  f1-score   support

         LOC       0.06      0.09      0.07      1837
        MISC       0.02      0.05      0.03       922
         ORG       0.03      0.05      0.04      1341
         PER       0.03      0.04      0.03      1842

   micro avg       0.04      0.06      0.04      5942
   macro avg       0.04      0.05      0.04      5942
weighted avg       0.04      0.06      0.04      5942

{'EMBEDDING_DIM': 928, 'HIDDEN_DIM': 346, 'NUM_LAYERS': 1, 'DROPOUT': 0.36934621563830666, 'LR': 0.002049475619493676, 'WEIGHT_0': 0.3776115172023816, 'WEIGHT_1': 0.6455680931599648, 'WEIGHT_2': 0.5324670270869934, 'WEIGHT_3': 0.8378612736632284, 'WEIGHT_4': 0.8775139525624266, 'WEIGHT_5': 0.7695484047200457, 'WEIGHT_6': 0.8358754931918444, 'WEIGHT_7': 0.41169276407152844, 'WEIGHT_8': 0.32147482200347893, 'optimizer': 'Adam'}
49
              precision    recall  f1-score   support

         LOC       0.52      0.53      0.53      1837
        MISC       0.39      0.42      0.41       922
         ORG       0.25      0.27      0.26      1341
         PER       0.33      0.36      0.34      1842

   micro avg       0.38      0.40      0.39      5942
   macro avg       0.37      0.40      0.38      5942
weighted avg       0.38      0.40      0.39      5942

epoch 49
LSTM
  0%|          | 0/50 [00:00<?, ?it/s]  2%|▏         | 1/50 [00:04<04:01,  4.93s/it]  4%|▍         | 2/50 [00:05<01:42,  2.13s/it]  6%|▌         | 3/50 [00:05<01:01,  1.32s/it]  8%|▊         | 4/50 [00:05<00:42,  1.08it/s] 10%|█         | 5/50 [00:06<00:32,  1.40it/s] 12%|█▏        | 6/50 [00:06<00:25,  1.70it/s] 14%|█▍        | 7/50 [00:06<00:21,  1.98it/s] 16%|█▌        | 8/50 [00:07<00:18,  2.21it/s] 18%|█▊        | 9/50 [00:07<00:17,  2.40it/s] 20%|██        | 10/50 [00:07<00:15,  2.55it/s] 22%|██▏       | 11/50 [00:08<00:14,  2.66it/s] 24%|██▍       | 12/50 [00:08<00:13,  2.75it/s] 26%|██▌       | 13/50 [00:08<00:13,  2.81it/s] 28%|██▊       | 14/50 [00:09<00:12,  2.85it/s] 30%|███       | 15/50 [00:09<00:12,  2.88it/s] 32%|███▏      | 16/50 [00:09<00:11,  2.91it/s] 34%|███▍      | 17/50 [00:10<00:11,  2.92it/s] 36%|███▌      | 18/50 [00:10<00:10,  2.93it/s] 38%|███▊      | 19/50 [00:10<00:10,  2.94it/s] 40%|████      | 20/50 [00:11<00:10,  2.94it/s] 42%|████▏     | 21/50 [00:11<00:09,  2.95it/s] 44%|████▍     | 22/50 [00:11<00:09,  2.95it/s] 46%|████▌     | 23/50 [00:12<00:09,  2.95it/s] 48%|████▊     | 24/50 [00:12<00:08,  2.94it/s] 50%|█████     | 25/50 [00:12<00:08,  2.95it/s] 52%|█████▏    | 26/50 [00:13<00:08,  2.95it/s] 54%|█████▍    | 27/50 [00:13<00:07,  2.94it/s] 56%|█████▌    | 28/50 [00:13<00:07,  2.94it/s] 58%|█████▊    | 29/50 [00:14<00:07,  2.94it/s] 60%|██████    | 30/50 [00:14<00:06,  2.94it/s] 62%|██████▏   | 31/50 [00:14<00:06,  2.94it/s] 64%|██████▍   | 32/50 [00:15<00:06,  2.94it/s] 66%|██████▌   | 33/50 [00:15<00:05,  2.94it/s] 68%|██████▊   | 34/50 [00:15<00:05,  2.94it/s] 70%|███████   | 35/50 [00:16<00:05,  2.94it/s] 72%|███████▏  | 36/50 [00:16<00:04,  2.94it/s] 74%|███████▍  | 37/50 [00:16<00:04,  2.93it/s] 76%|███████▌  | 38/50 [00:17<00:04,  2.93it/s] 78%|███████▊  | 39/50 [00:17<00:03,  2.93it/s] 80%|████████  | 40/50 [00:17<00:03,  2.93it/s] 82%|████████▏ | 41/50 [00:18<00:03,  2.93it/s] 84%|████████▍ | 42/50 [00:18<00:02,  2.93it/s] 86%|████████▌ | 43/50 [00:19<00:02,  2.93it/s] 88%|████████▊ | 44/50 [00:19<00:02,  2.93it/s] 90%|█████████ | 45/50 [00:19<00:01,  2.93it/s] 92%|█████████▏| 46/50 [00:20<00:01,  2.93it/s] 94%|█████████▍| 47/50 [00:20<00:01,  2.93it/s] 96%|█████████▌| 48/50 [00:20<00:00,  2.93it/s] 98%|█████████▊| 49/50 [00:21<00:00,  2.93it/s]100%|██████████| 50/50 [00:26<00:00,  1.76s/it]100%|██████████| 50/50 [00:26<00:00,  1.91it/s]
[I 2023-12-10 21:48:50,496] Trial 62 finished with value: 0.40811131851349064 and parameters: {'EMBEDDING_DIM': 1021, 'HIDDEN_DIM': 508, 'NUM_LAYERS': 1, 'DROPOUT': 0.339630472677399, 'LR': 0.0014968216830765638, 'WEIGHT_0': 0.4129588851054433, 'WEIGHT_1': 0.7538012785188333, 'WEIGHT_2': 0.5486288568661459, 'WEIGHT_3': 0.9643522042132556, 'WEIGHT_4': 0.8355416760479094, 'WEIGHT_5': 0.640960752447797, 'WEIGHT_6': 0.8957937851244921, 'WEIGHT_7': 0.3797092558566873, 'WEIGHT_8': 0.3670434845552769, 'optimizer': 'Adam'}. Best is trial 51 with value: 0.41438326562364947.
/userhome/cs2/dingruiw/conda/envs/py310/lib/python3.10/site-packages/torch/nn/modules/rnn.py:82: UserWarning: dropout option adds dropout after all but last recurrent layer, so non-zero dropout expects num_layers greater than 1, but got dropout=0.33892021842434217 and num_layers=1
  warnings.warn("dropout option adds dropout after all but last "
{'EMBEDDING_DIM': 1021, 'HIDDEN_DIM': 508, 'NUM_LAYERS': 1, 'DROPOUT': 0.339630472677399, 'LR': 0.0014968216830765638, 'WEIGHT_0': 0.4129588851054433, 'WEIGHT_1': 0.7538012785188333, 'WEIGHT_2': 0.5486288568661459, 'WEIGHT_3': 0.9643522042132556, 'WEIGHT_4': 0.8355416760479094, 'WEIGHT_5': 0.640960752447797, 'WEIGHT_6': 0.8957937851244921, 'WEIGHT_7': 0.3797092558566873, 'WEIGHT_8': 0.3670434845552769, 'optimizer': 'Adam'}
0
              precision    recall  f1-score   support

         LOC       0.05      0.06      0.06      1837
        MISC       0.02      0.06      0.03       922
         ORG       0.03      0.08      0.04      1341
         PER       0.04      0.03      0.03      1842

   micro avg       0.03      0.06      0.04      5942
   macro avg       0.04      0.06      0.04      5942
weighted avg       0.04      0.06      0.04      5942

{'EMBEDDING_DIM': 1021, 'HIDDEN_DIM': 508, 'NUM_LAYERS': 1, 'DROPOUT': 0.339630472677399, 'LR': 0.0014968216830765638, 'WEIGHT_0': 0.4129588851054433, 'WEIGHT_1': 0.7538012785188333, 'WEIGHT_2': 0.5486288568661459, 'WEIGHT_3': 0.9643522042132556, 'WEIGHT_4': 0.8355416760479094, 'WEIGHT_5': 0.640960752447797, 'WEIGHT_6': 0.8957937851244921, 'WEIGHT_7': 0.3797092558566873, 'WEIGHT_8': 0.3670434845552769, 'optimizer': 'Adam'}
49
              precision    recall  f1-score   support

         LOC       0.58      0.54      0.56      1837
        MISC       0.43      0.44      0.43       922
         ORG       0.28      0.26      0.27      1341
         PER       0.34      0.36      0.35      1842

   micro avg       0.41      0.40      0.41      5942
   macro avg       0.41      0.40      0.40      5942
weighted avg       0.41      0.40      0.41      5942

epoch 49
LSTM
  0%|          | 0/50 [00:00<?, ?it/s]  2%|▏         | 1/50 [00:04<03:53,  4.76s/it]  4%|▍         | 2/50 [00:04<01:37,  2.02s/it]  6%|▌         | 3/50 [00:05<00:55,  1.19s/it]  8%|▊         | 4/50 [00:05<00:36,  1.26it/s] 10%|█         | 5/50 [00:05<00:26,  1.73it/s] 12%|█▏        | 6/50 [00:05<00:19,  2.23it/s] 14%|█▍        | 7/50 [00:05<00:15,  2.74it/s] 16%|█▌        | 8/50 [00:06<00:13,  3.22it/s] 18%|█▊        | 9/50 [00:06<00:11,  3.64it/s] 20%|██        | 10/50 [00:06<00:09,  4.01it/s] 22%|██▏       | 11/50 [00:06<00:09,  4.30it/s] 24%|██▍       | 12/50 [00:06<00:08,  4.53it/s] 26%|██▌       | 13/50 [00:07<00:07,  4.70it/s] 28%|██▊       | 14/50 [00:07<00:07,  4.82it/s] 30%|███       | 15/50 [00:07<00:07,  4.91it/s] 32%|███▏      | 16/50 [00:07<00:06,  4.98it/s] 34%|███▍      | 17/50 [00:07<00:06,  5.03it/s] 36%|███▌      | 18/50 [00:07<00:06,  5.06it/s] 38%|███▊      | 19/50 [00:08<00:06,  5.08it/s] 40%|████      | 20/50 [00:08<00:05,  5.10it/s] 42%|████▏     | 21/50 [00:08<00:05,  5.10it/s] 44%|████▍     | 22/50 [00:08<00:05,  5.12it/s] 46%|████▌     | 23/50 [00:08<00:05,  5.12it/s] 48%|████▊     | 24/50 [00:09<00:05,  5.13it/s] 50%|█████     | 25/50 [00:09<00:04,  5.13it/s] 52%|█████▏    | 26/50 [00:09<00:04,  5.13it/s] 54%|█████▍    | 27/50 [00:09<00:04,  5.13it/s] 56%|█████▌    | 28/50 [00:09<00:04,  5.13it/s] 58%|█████▊    | 29/50 [00:10<00:04,  5.12it/s] 60%|██████    | 30/50 [00:10<00:03,  5.13it/s] 62%|██████▏   | 31/50 [00:10<00:03,  5.13it/s] 64%|██████▍   | 32/50 [00:10<00:03,  5.13it/s] 66%|██████▌   | 33/50 [00:10<00:03,  5.13it/s] 68%|██████▊   | 34/50 [00:11<00:03,  5.13it/s] 70%|███████   | 35/50 [00:11<00:02,  5.13it/s] 72%|███████▏  | 36/50 [00:11<00:02,  5.13it/s] 74%|███████▍  | 37/50 [00:11<00:02,  5.12it/s] 76%|███████▌  | 38/50 [00:11<00:02,  5.12it/s] 78%|███████▊  | 39/50 [00:12<00:02,  5.12it/s] 80%|████████  | 40/50 [00:12<00:01,  5.12it/s] 82%|████████▏ | 41/50 [00:12<00:01,  5.13it/s] 84%|████████▍ | 42/50 [00:12<00:01,  5.12it/s] 86%|████████▌ | 43/50 [00:12<00:01,  5.10it/s] 88%|████████▊ | 44/50 [00:13<00:01,  5.13it/s] 90%|█████████ | 45/50 [00:13<00:00,  5.12it/s] 92%|█████████▏| 46/50 [00:13<00:00,  5.13it/s] 94%|█████████▍| 47/50 [00:13<00:00,  5.12it/s] 96%|█████████▌| 48/50 [00:13<00:00,  5.12it/s] 98%|█████████▊| 49/50 [00:14<00:00,  5.12it/s]100%|██████████| 50/50 [00:18<00:00,  1.55s/it]100%|██████████| 50/50 [00:18<00:00,  2.67it/s]
[I 2023-12-10 21:49:13,468] Trial 63 finished with value: 0.413151052587436 and parameters: {'EMBEDDING_DIM': 1011, 'HIDDEN_DIM': 261, 'NUM_LAYERS': 1, 'DROPOUT': 0.33892021842434217, 'LR': 0.0014324168103369461, 'WEIGHT_0': 0.42424617057862163, 'WEIGHT_1': 0.7584058496371487, 'WEIGHT_2': 0.563557114963371, 'WEIGHT_3': 0.9575364250721898, 'WEIGHT_4': 0.7048335011909928, 'WEIGHT_5': 0.5213643493385485, 'WEIGHT_6': 0.881178226441964, 'WEIGHT_7': 0.5125140603553849, 'WEIGHT_8': 0.38584284636809807, 'optimizer': 'Adam'}. Best is trial 51 with value: 0.41438326562364947.
/userhome/cs2/dingruiw/conda/envs/py310/lib/python3.10/site-packages/torch/nn/modules/rnn.py:82: UserWarning: dropout option adds dropout after all but last recurrent layer, so non-zero dropout expects num_layers greater than 1, but got dropout=0.3325326602323567 and num_layers=1
  warnings.warn("dropout option adds dropout after all but last "
{'EMBEDDING_DIM': 1011, 'HIDDEN_DIM': 261, 'NUM_LAYERS': 1, 'DROPOUT': 0.33892021842434217, 'LR': 0.0014324168103369461, 'WEIGHT_0': 0.42424617057862163, 'WEIGHT_1': 0.7584058496371487, 'WEIGHT_2': 0.563557114963371, 'WEIGHT_3': 0.9575364250721898, 'WEIGHT_4': 0.7048335011909928, 'WEIGHT_5': 0.5213643493385485, 'WEIGHT_6': 0.881178226441964, 'WEIGHT_7': 0.5125140603553849, 'WEIGHT_8': 0.38584284636809807, 'optimizer': 'Adam'}
0
              precision    recall  f1-score   support

         LOC       0.07      0.19      0.10      1837
        MISC       0.01      0.04      0.02       922
         ORG       0.03      0.03      0.03      1341
         PER       0.02      0.07      0.03      1842

   micro avg       0.04      0.09      0.05      5942
   macro avg       0.03      0.08      0.05      5942
weighted avg       0.04      0.09      0.05      5942

{'EMBEDDING_DIM': 1011, 'HIDDEN_DIM': 261, 'NUM_LAYERS': 1, 'DROPOUT': 0.33892021842434217, 'LR': 0.0014324168103369461, 'WEIGHT_0': 0.42424617057862163, 'WEIGHT_1': 0.7584058496371487, 'WEIGHT_2': 0.563557114963371, 'WEIGHT_3': 0.9575364250721898, 'WEIGHT_4': 0.7048335011909928, 'WEIGHT_5': 0.5213643493385485, 'WEIGHT_6': 0.881178226441964, 'WEIGHT_7': 0.5125140603553849, 'WEIGHT_8': 0.38584284636809807, 'optimizer': 'Adam'}
49
              precision    recall  f1-score   support

         LOC       0.58      0.52      0.55      1837
        MISC       0.46      0.48      0.47       922
         ORG       0.28      0.27      0.28      1341
         PER       0.34      0.38      0.36      1842

   micro avg       0.41      0.41      0.41      5942
   macro avg       0.41      0.41      0.41      5942
weighted avg       0.42      0.41      0.42      5942

epoch 49
LSTM
  0%|          | 0/50 [00:00<?, ?it/s]  2%|▏         | 1/50 [00:04<03:52,  4.75s/it]  6%|▌         | 3/50 [00:05<01:02,  1.33s/it]  8%|▊         | 4/50 [00:05<00:42,  1.07it/s] 10%|█         | 5/50 [00:05<00:30,  1.47it/s] 12%|█▏        | 6/50 [00:05<00:22,  1.93it/s] 14%|█▍        | 7/50 [00:05<00:17,  2.44it/s] 16%|█▌        | 8/50 [00:05<00:14,  2.97it/s] 18%|█▊        | 9/50 [00:06<00:11,  3.49it/s] 20%|██        | 10/50 [00:06<00:10,  3.96it/s] 22%|██▏       | 11/50 [00:06<00:08,  4.38it/s] 24%|██▍       | 12/50 [00:06<00:08,  4.72it/s] 26%|██▌       | 13/50 [00:06<00:07,  4.99it/s] 28%|██▊       | 14/50 [00:06<00:06,  5.20it/s] 30%|███       | 15/50 [00:07<00:06,  5.36it/s] 32%|███▏      | 16/50 [00:07<00:06,  5.47it/s] 34%|███▍      | 17/50 [00:07<00:05,  5.56it/s] 36%|███▌      | 18/50 [00:07<00:05,  5.62it/s] 38%|███▊      | 19/50 [00:07<00:05,  5.66it/s] 40%|████      | 20/50 [00:07<00:05,  5.69it/s] 42%|████▏     | 21/50 [00:08<00:05,  5.71it/s] 44%|████▍     | 22/50 [00:08<00:04,  5.72it/s] 46%|████▌     | 23/50 [00:08<00:04,  5.73it/s] 48%|████▊     | 24/50 [00:08<00:04,  5.73it/s] 50%|█████     | 25/50 [00:08<00:04,  5.74it/s] 52%|█████▏    | 26/50 [00:09<00:04,  5.74it/s] 54%|█████▍    | 27/50 [00:09<00:04,  5.74it/s] 56%|█████▌    | 28/50 [00:09<00:03,  5.75it/s] 58%|█████▊    | 29/50 [00:09<00:03,  5.75it/s] 60%|██████    | 30/50 [00:09<00:03,  5.75it/s] 62%|██████▏   | 31/50 [00:09<00:03,  5.75it/s] 64%|██████▍   | 32/50 [00:10<00:03,  5.74it/s] 66%|██████▌   | 33/50 [00:10<00:02,  5.74it/s] 68%|██████▊   | 34/50 [00:10<00:02,  5.74it/s] 70%|███████   | 35/50 [00:10<00:02,  5.73it/s] 72%|███████▏  | 36/50 [00:10<00:02,  5.74it/s] 74%|███████▍  | 37/50 [00:10<00:02,  5.74it/s] 76%|███████▌  | 38/50 [00:11<00:02,  5.74it/s] 78%|███████▊  | 39/50 [00:11<00:01,  5.74it/s] 80%|████████  | 40/50 [00:11<00:01,  5.75it/s] 82%|████████▏ | 41/50 [00:11<00:01,  5.73it/s] 84%|████████▍ | 42/50 [00:11<00:01,  5.74it/s] 86%|████████▌ | 43/50 [00:11<00:01,  5.74it/s] 88%|████████▊ | 44/50 [00:12<00:01,  5.73it/s] 90%|█████████ | 45/50 [00:12<00:00,  5.74it/s] 92%|█████████▏| 46/50 [00:12<00:00,  5.73it/s] 94%|█████████▍| 47/50 [00:12<00:00,  5.73it/s] 96%|█████████▌| 48/50 [00:12<00:00,  5.74it/s] 98%|█████████▊| 49/50 [00:13<00:00,  5.74it/s]100%|██████████| 50/50 [00:17<00:00,  1.52s/it]100%|██████████| 50/50 [00:17<00:00,  2.83it/s]
[I 2023-12-10 21:49:35,396] Trial 64 finished with value: 0.3971558296924527 and parameters: {'EMBEDDING_DIM': 1021, 'HIDDEN_DIM': 252, 'NUM_LAYERS': 1, 'DROPOUT': 0.3325326602323567, 'LR': 0.0011121946911404905, 'WEIGHT_0': 0.42267228478426805, 'WEIGHT_1': 0.7344138359700985, 'WEIGHT_2': 0.5903886831454278, 'WEIGHT_3': 0.9727240637949839, 'WEIGHT_4': 0.7181052031208546, 'WEIGHT_5': 0.536405846168273, 'WEIGHT_6': 0.8954407526268817, 'WEIGHT_7': 0.5134385756986701, 'WEIGHT_8': 0.35086605522579273, 'optimizer': 'Adam'}. Best is trial 51 with value: 0.41438326562364947.
/userhome/cs2/dingruiw/conda/envs/py310/lib/python3.10/site-packages/torch/nn/modules/rnn.py:82: UserWarning: dropout option adds dropout after all but last recurrent layer, so non-zero dropout expects num_layers greater than 1, but got dropout=0.3437821785103727 and num_layers=1
  warnings.warn("dropout option adds dropout after all but last "
{'EMBEDDING_DIM': 1021, 'HIDDEN_DIM': 252, 'NUM_LAYERS': 1, 'DROPOUT': 0.3325326602323567, 'LR': 0.0011121946911404905, 'WEIGHT_0': 0.42267228478426805, 'WEIGHT_1': 0.7344138359700985, 'WEIGHT_2': 0.5903886831454278, 'WEIGHT_3': 0.9727240637949839, 'WEIGHT_4': 0.7181052031208546, 'WEIGHT_5': 0.536405846168273, 'WEIGHT_6': 0.8954407526268817, 'WEIGHT_7': 0.5134385756986701, 'WEIGHT_8': 0.35086605522579273, 'optimizer': 'Adam'}
0
              precision    recall  f1-score   support

         LOC       0.03      0.07      0.04      1837
        MISC       0.01      0.07      0.02       922
         ORG       0.03      0.14      0.05      1341
         PER       0.02      0.06      0.03      1842

   micro avg       0.03      0.08      0.04      5942
   macro avg       0.03      0.08      0.04      5942
weighted avg       0.03      0.08      0.04      5942

{'EMBEDDING_DIM': 1021, 'HIDDEN_DIM': 252, 'NUM_LAYERS': 1, 'DROPOUT': 0.3325326602323567, 'LR': 0.0011121946911404905, 'WEIGHT_0': 0.42267228478426805, 'WEIGHT_1': 0.7344138359700985, 'WEIGHT_2': 0.5903886831454278, 'WEIGHT_3': 0.9727240637949839, 'WEIGHT_4': 0.7181052031208546, 'WEIGHT_5': 0.536405846168273, 'WEIGHT_6': 0.8954407526268817, 'WEIGHT_7': 0.5134385756986701, 'WEIGHT_8': 0.35086605522579273, 'optimizer': 'Adam'}
49
              precision    recall  f1-score   support

         LOC       0.57      0.50      0.53      1837
        MISC       0.45      0.44      0.45       922
         ORG       0.27      0.26      0.27      1341
         PER       0.33      0.35      0.34      1842

   micro avg       0.40      0.39      0.40      5942
   macro avg       0.41      0.39      0.40      5942
weighted avg       0.41      0.39      0.40      5942

epoch 49
LSTM
  0%|          | 0/50 [00:00<?, ?it/s]  2%|▏         | 1/50 [00:04<03:59,  4.88s/it]  4%|▍         | 2/50 [00:05<01:42,  2.13s/it]  6%|▌         | 3/50 [00:05<01:02,  1.32s/it]  8%|▊         | 4/50 [00:05<00:43,  1.06it/s] 10%|█         | 5/50 [00:06<00:33,  1.36it/s] 12%|█▏        | 6/50 [00:06<00:26,  1.64it/s] 14%|█▍        | 7/50 [00:06<00:22,  1.89it/s] 16%|█▌        | 8/50 [00:07<00:20,  2.10it/s] 18%|█▊        | 9/50 [00:07<00:18,  2.27it/s] 20%|██        | 10/50 [00:07<00:16,  2.40it/s] 22%|██▏       | 11/50 [00:08<00:15,  2.50it/s] 24%|██▍       | 12/50 [00:08<00:14,  2.57it/s] 26%|██▌       | 13/50 [00:09<00:14,  2.62it/s] 28%|██▊       | 14/50 [00:09<00:13,  2.66it/s] 30%|███       | 15/50 [00:09<00:13,  2.69it/s] 32%|███▏      | 16/50 [00:10<00:12,  2.70it/s] 34%|███▍      | 17/50 [00:10<00:12,  2.72it/s] 36%|███▌      | 18/50 [00:10<00:11,  2.72it/s] 38%|███▊      | 19/50 [00:11<00:11,  2.73it/s] 40%|████      | 20/50 [00:11<00:10,  2.73it/s] 42%|████▏     | 21/50 [00:12<00:10,  2.73it/s] 44%|████▍     | 22/50 [00:12<00:10,  2.73it/s] 46%|████▌     | 23/50 [00:12<00:09,  2.73it/s] 48%|████▊     | 24/50 [00:13<00:09,  2.73it/s] 50%|█████     | 25/50 [00:13<00:09,  2.73it/s] 52%|█████▏    | 26/50 [00:13<00:08,  2.73it/s] 54%|█████▍    | 27/50 [00:14<00:08,  2.73it/s] 56%|█████▌    | 28/50 [00:14<00:08,  2.72it/s] 58%|█████▊    | 29/50 [00:14<00:07,  2.72it/s] 60%|██████    | 30/50 [00:15<00:07,  2.72it/s] 62%|██████▏   | 31/50 [00:15<00:06,  2.72it/s] 64%|██████▍   | 32/50 [00:16<00:06,  2.72it/s] 66%|██████▌   | 33/50 [00:16<00:06,  2.72it/s] 68%|██████▊   | 34/50 [00:16<00:05,  2.72it/s] 70%|███████   | 35/50 [00:17<00:05,  2.72it/s] 72%|███████▏  | 36/50 [00:17<00:05,  2.72it/s] 74%|███████▍  | 37/50 [00:17<00:04,  2.72it/s] 76%|███████▌  | 38/50 [00:18<00:04,  2.72it/s] 78%|███████▊  | 39/50 [00:18<00:04,  2.72it/s] 80%|████████  | 40/50 [00:18<00:03,  2.72it/s] 82%|████████▏ | 41/50 [00:19<00:03,  2.72it/s] 84%|████████▍ | 42/50 [00:19<00:02,  2.72it/s] 86%|████████▌ | 43/50 [00:20<00:02,  2.72it/s] 88%|████████▊ | 44/50 [00:20<00:02,  2.71it/s] 90%|█████████ | 45/50 [00:20<00:01,  2.72it/s] 92%|█████████▏| 46/50 [00:21<00:01,  2.71it/s] 94%|█████████▍| 47/50 [00:21<00:01,  2.71it/s] 96%|█████████▌| 48/50 [00:21<00:00,  2.71it/s] 98%|█████████▊| 49/50 [00:22<00:00,  2.71it/s]100%|██████████| 50/50 [00:27<00:00,  1.77s/it]100%|██████████| 50/50 [00:27<00:00,  1.83it/s]
