[I 2023-12-10 21:07:07,445] Trial 13 finished with value: 0.16697840503315764 and parameters: {'EMBEDDING_DIM': 801, 'HIDDEN_DIM': 755, 'NUM_LAYERS': 3, 'DROPOUT': 0.45577191095255976, 'LR': 0.004818209837815755, 'WEIGHT_0': 0.5099820589412448, 'WEIGHT_1': 0.6214761052041259, 'WEIGHT_2': 0.3353227659765106, 'WEIGHT_3': 0.9980170039729535, 'WEIGHT_4': 0.6692784483621139, 'WEIGHT_5': 0.725914551231517, 'WEIGHT_6': 0.9804788329387072, 'WEIGHT_7': 0.0013135744470895716, 'WEIGHT_8': 0.4622909693300695, 'optimizer': 'Adam'}. Best is trial 10 with value: 0.3870380484252685.
{'EMBEDDING_DIM': 801, 'HIDDEN_DIM': 755, 'NUM_LAYERS': 3, 'DROPOUT': 0.45577191095255976, 'LR': 0.004818209837815755, 'WEIGHT_0': 0.5099820589412448, 'WEIGHT_1': 0.6214761052041259, 'WEIGHT_2': 0.3353227659765106, 'WEIGHT_3': 0.9980170039729535, 'WEIGHT_4': 0.6692784483621139, 'WEIGHT_5': 0.725914551231517, 'WEIGHT_6': 0.9804788329387072, 'WEIGHT_7': 0.0013135744470895716, 'WEIGHT_8': 0.4622909693300695, 'optimizer': 'Adam'}
0
              precision    recall  f1-score   support

         LOC       0.00      0.00      0.00      1837
        MISC       0.01      0.01      0.01       922
         ORG       0.00      0.00      0.00      1341
         PER       0.06      0.01      0.02      1842

   micro avg       0.02      0.00      0.01      5942
   macro avg       0.02      0.01      0.01      5942
weighted avg       0.02      0.00      0.01      5942

{'EMBEDDING_DIM': 801, 'HIDDEN_DIM': 755, 'NUM_LAYERS': 3, 'DROPOUT': 0.45577191095255976, 'LR': 0.004818209837815755, 'WEIGHT_0': 0.5099820589412448, 'WEIGHT_1': 0.6214761052041259, 'WEIGHT_2': 0.3353227659765106, 'WEIGHT_3': 0.9980170039729535, 'WEIGHT_4': 0.6692784483621139, 'WEIGHT_5': 0.725914551231517, 'WEIGHT_6': 0.9804788329387072, 'WEIGHT_7': 0.0013135744470895716, 'WEIGHT_8': 0.4622909693300695, 'optimizer': 'Adam'}
49
              precision    recall  f1-score   support

         LOC       0.33      0.21      0.26      1837
        MISC       0.15      0.02      0.04       922
         ORG       0.13      0.14      0.13      1341
         PER       0.13      0.21      0.16      1842

   micro avg       0.17      0.17      0.17      5942
   macro avg       0.18      0.15      0.15      5942
weighted avg       0.19      0.17      0.17      5942

epoch 49
LSTM
  0%|          | 0/50 [00:00<?, ?it/s]  2%|▏         | 1/50 [00:05<04:16,  5.23s/it]  4%|▍         | 2/50 [00:05<01:46,  2.22s/it]  6%|▌         | 3/50 [00:05<00:58,  1.25s/it]  8%|▊         | 4/50 [00:05<00:37,  1.24it/s] 10%|█         | 5/50 [00:05<00:25,  1.77it/s] 12%|█▏        | 6/50 [00:05<00:18,  2.37it/s] 14%|█▍        | 7/50 [00:05<00:14,  3.03it/s] 16%|█▌        | 8/50 [00:06<00:11,  3.70it/s] 18%|█▊        | 9/50 [00:06<00:09,  4.35it/s] 20%|██        | 10/50 [00:06<00:08,  4.94it/s] 22%|██▏       | 11/50 [00:06<00:07,  5.40it/s] 24%|██▍       | 12/50 [00:06<00:06,  5.75it/s] 26%|██▌       | 13/50 [00:06<00:06,  5.99it/s] 28%|██▊       | 14/50 [00:07<00:05,  6.19it/s] 30%|███       | 15/50 [00:07<00:05,  6.34it/s] 32%|███▏      | 16/50 [00:07<00:05,  6.45it/s] 34%|███▍      | 17/50 [00:07<00:05,  6.51it/s] 36%|███▌      | 18/50 [00:07<00:04,  6.57it/s] 38%|███▊      | 19/50 [00:07<00:04,  6.61it/s] 40%|████      | 20/50 [00:07<00:04,  6.64it/s] 42%|████▏     | 21/50 [00:08<00:04,  6.66it/s] 44%|████▍     | 22/50 [00:08<00:04,  6.68it/s] 46%|████▌     | 23/50 [00:08<00:04,  6.68it/s] 48%|████▊     | 24/50 [00:08<00:03,  6.69it/s] 50%|█████     | 25/50 [00:08<00:03,  6.67it/s] 52%|█████▏    | 26/50 [00:08<00:03,  6.68it/s] 54%|█████▍    | 27/50 [00:08<00:03,  6.69it/s] 56%|█████▌    | 28/50 [00:09<00:03,  6.69it/s] 58%|█████▊    | 29/50 [00:09<00:03,  6.70it/s] 60%|██████    | 30/50 [00:09<00:02,  6.71it/s] 62%|██████▏   | 31/50 [00:09<00:02,  6.71it/s] 64%|██████▍   | 32/50 [00:09<00:02,  6.68it/s] 66%|██████▌   | 33/50 [00:09<00:02,  6.69it/s] 68%|██████▊   | 34/50 [00:09<00:02,  6.91it/s] 70%|███████   | 35/50 [00:10<00:02,  7.00it/s] 72%|███████▏  | 36/50 [00:10<00:01,  7.03it/s] 74%|███████▍  | 37/50 [00:10<00:01,  6.93it/s] 76%|███████▌  | 38/50 [00:10<00:01,  6.84it/s] 78%|███████▊  | 39/50 [00:10<00:01,  6.78it/s] 80%|████████  | 40/50 [00:10<00:01,  6.76it/s] 82%|████████▏ | 41/50 [00:11<00:01,  6.74it/s] 84%|████████▍ | 42/50 [00:11<00:01,  6.73it/s] 86%|████████▌ | 43/50 [00:11<00:01,  6.73it/s] 88%|████████▊ | 44/50 [00:11<00:00,  6.73it/s] 90%|█████████ | 45/50 [00:11<00:00,  6.69it/s] 92%|█████████▏| 46/50 [00:11<00:00,  6.70it/s] 94%|█████████▍| 47/50 [00:11<00:00,  6.70it/s] 96%|█████████▌| 48/50 [00:12<00:00,  6.71it/s] 98%|█████████▊| 49/50 [00:12<00:00,  6.71it/s]100%|██████████| 50/50 [00:17<00:00,  1.74s/it]100%|██████████| 50/50 [00:17<00:00,  2.83it/s]
[I 2023-12-10 21:07:29,708] Trial 14 finished with value: 0.18566896809106176 and parameters: {'EMBEDDING_DIM': 24, 'HIDDEN_DIM': 203, 'NUM_LAYERS': 2, 'DROPOUT': 0.4966775626458627, 'LR': 0.0035968451102694897, 'WEIGHT_0': 0.8032985290492181, 'WEIGHT_1': 0.7008119594155171, 'WEIGHT_2': 0.568061317656388, 'WEIGHT_3': 0.8672227781071578, 'WEIGHT_4': 0.6393758484918233, 'WEIGHT_5': 0.9413244953686394, 'WEIGHT_6': 0.5610730356190902, 'WEIGHT_7': 0.39969810481788437, 'WEIGHT_8': 0.4081697380189985, 'optimizer': 'Adam'}. Best is trial 10 with value: 0.3870380484252685.
/userhome/cs2/dingruiw/conda/envs/py310/lib/python3.10/site-packages/torch/nn/modules/rnn.py:82: UserWarning: dropout option adds dropout after all but last recurrent layer, so non-zero dropout expects num_layers greater than 1, but got dropout=0.4220680656719392 and num_layers=1
  warnings.warn("dropout option adds dropout after all but last "
{'EMBEDDING_DIM': 24, 'HIDDEN_DIM': 203, 'NUM_LAYERS': 2, 'DROPOUT': 0.4966775626458627, 'LR': 0.0035968451102694897, 'WEIGHT_0': 0.8032985290492181, 'WEIGHT_1': 0.7008119594155171, 'WEIGHT_2': 0.568061317656388, 'WEIGHT_3': 0.8672227781071578, 'WEIGHT_4': 0.6393758484918233, 'WEIGHT_5': 0.9413244953686394, 'WEIGHT_6': 0.5610730356190902, 'WEIGHT_7': 0.39969810481788437, 'WEIGHT_8': 0.4081697380189985, 'optimizer': 'Adam'}
0
              precision    recall  f1-score   support

         LOC       0.00      0.00      0.00      1837
        MISC       0.01      0.00      0.00       922
         ORG       0.00      0.00      0.00      1341
         PER       0.04      0.02      0.03      1842

   micro avg       0.04      0.01      0.01      5942
   macro avg       0.01      0.01      0.01      5942
weighted avg       0.01      0.01      0.01      5942

{'EMBEDDING_DIM': 24, 'HIDDEN_DIM': 203, 'NUM_LAYERS': 2, 'DROPOUT': 0.4966775626458627, 'LR': 0.0035968451102694897, 'WEIGHT_0': 0.8032985290492181, 'WEIGHT_1': 0.7008119594155171, 'WEIGHT_2': 0.568061317656388, 'WEIGHT_3': 0.8672227781071578, 'WEIGHT_4': 0.6393758484918233, 'WEIGHT_5': 0.9413244953686394, 'WEIGHT_6': 0.5610730356190902, 'WEIGHT_7': 0.39969810481788437, 'WEIGHT_8': 0.4081697380189985, 'optimizer': 'Adam'}
49
              precision    recall  f1-score   support

         LOC       0.25      0.30      0.27      1837
        MISC       0.00      0.00      0.00       922
         ORG       0.03      0.00      0.01      1341
         PER       0.18      0.24      0.20      1842

   micro avg       0.21      0.17      0.19      5942
   macro avg       0.12      0.14      0.12      5942
weighted avg       0.14      0.17      0.15      5942

epoch 49
LSTM
  0%|          | 0/50 [00:00<?, ?it/s]  2%|▏         | 1/50 [00:06<05:10,  6.35s/it]  4%|▍         | 2/50 [00:06<02:18,  2.88s/it]  6%|▌         | 3/50 [00:07<01:33,  1.99s/it]  8%|▊         | 4/50 [00:08<01:12,  1.57s/it] 10%|█         | 5/50 [00:09<01:00,  1.35s/it] 12%|█▏        | 6/50 [00:10<00:53,  1.21s/it] 14%|█▍        | 7/50 [00:11<00:48,  1.12s/it] 16%|█▌        | 8/50 [00:12<00:44,  1.07s/it] 18%|█▊        | 9/50 [00:13<00:42,  1.03s/it] 20%|██        | 10/50 [00:14<00:40,  1.00s/it] 22%|██▏       | 11/50 [00:15<00:38,  1.01it/s] 24%|██▍       | 12/50 [00:16<00:37,  1.02it/s] 26%|██▌       | 13/50 [00:17<00:35,  1.03it/s] 28%|██▊       | 14/50 [00:18<00:34,  1.04it/s] 30%|███       | 15/50 [00:19<00:33,  1.04it/s] 32%|███▏      | 16/50 [00:20<00:32,  1.05it/s] 34%|███▍      | 17/50 [00:21<00:31,  1.04it/s] 36%|███▌      | 18/50 [00:21<00:30,  1.05it/s] 38%|███▊      | 19/50 [00:22<00:29,  1.05it/s] 40%|████      | 20/50 [00:23<00:28,  1.04it/s] 42%|████▏     | 21/50 [00:24<00:27,  1.04it/s] 44%|████▍     | 22/50 [00:25<00:26,  1.05it/s] 46%|████▌     | 23/50 [00:26<00:25,  1.04it/s] 48%|████▊     | 24/50 [00:27<00:24,  1.05it/s] 50%|█████     | 25/50 [00:28<00:23,  1.05it/s] 52%|█████▏    | 26/50 [00:29<00:22,  1.05it/s] 54%|█████▍    | 27/50 [00:30<00:22,  1.04it/s] 56%|█████▌    | 28/50 [00:31<00:21,  1.04it/s] 58%|█████▊    | 29/50 [00:32<00:20,  1.04it/s] 60%|██████    | 30/50 [00:33<00:19,  1.04it/s] 62%|██████▏   | 31/50 [00:34<00:18,  1.04it/s] 64%|██████▍   | 32/50 [00:35<00:17,  1.04it/s] 66%|██████▌   | 33/50 [00:36<00:16,  1.03it/s] 68%|██████▊   | 34/50 [00:37<00:15,  1.03it/s] 70%|███████   | 35/50 [00:38<00:14,  1.03it/s] 72%|███████▏  | 36/50 [00:39<00:13,  1.03it/s] 74%|███████▍  | 37/50 [00:40<00:12,  1.02it/s] 76%|███████▌  | 38/50 [00:41<00:11,  1.02it/s] 78%|███████▊  | 39/50 [00:42<00:10,  1.02it/s] 80%|████████  | 40/50 [00:43<00:09,  1.01it/s] 82%|████████▏ | 41/50 [00:44<00:08,  1.01it/s] 84%|████████▍ | 42/50 [00:45<00:07,  1.01it/s] 86%|████████▌ | 43/50 [00:46<00:06,  1.01it/s] 88%|████████▊ | 44/50 [00:47<00:05,  1.01it/s] 90%|█████████ | 45/50 [00:48<00:04,  1.01it/s] 92%|█████████▏| 46/50 [00:49<00:03,  1.01it/s] 94%|█████████▍| 47/50 [00:50<00:02,  1.01it/s] 96%|█████████▌| 48/50 [00:51<00:01,  1.01it/s] 98%|█████████▊| 49/50 [00:52<00:00,  1.01it/s]100%|██████████| 50/50 [00:59<00:00,  2.76s/it]100%|██████████| 50/50 [00:59<00:00,  1.18s/it]
[I 2023-12-10 21:08:33,966] Trial 15 finished with value: 0.1818181818181818 and parameters: {'EMBEDDING_DIM': 833, 'HIDDEN_DIM': 1166, 'NUM_LAYERS': 1, 'DROPOUT': 0.4220680656719392, 'LR': 0.005604911952339633, 'WEIGHT_0': 0.5908793111347497, 'WEIGHT_1': 0.391001242735789, 'WEIGHT_2': 0.3015229688135054, 'WEIGHT_3': 0.839290615107372, 'WEIGHT_4': 0.6328803833624608, 'WEIGHT_5': 0.6498615803941402, 'WEIGHT_6': 0.8791601833743389, 'WEIGHT_7': 0.06527029221418928, 'WEIGHT_8': 0.6086962546014845, 'optimizer': 'Adam'}. Best is trial 10 with value: 0.3870380484252685.
/userhome/cs2/dingruiw/conda/envs/py310/lib/python3.10/site-packages/torch/nn/modules/rnn.py:82: UserWarning: dropout option adds dropout after all but last recurrent layer, so non-zero dropout expects num_layers greater than 1, but got dropout=0.4294469922382693 and num_layers=1
  warnings.warn("dropout option adds dropout after all but last "
{'EMBEDDING_DIM': 833, 'HIDDEN_DIM': 1166, 'NUM_LAYERS': 1, 'DROPOUT': 0.4220680656719392, 'LR': 0.005604911952339633, 'WEIGHT_0': 0.5908793111347497, 'WEIGHT_1': 0.391001242735789, 'WEIGHT_2': 0.3015229688135054, 'WEIGHT_3': 0.839290615107372, 'WEIGHT_4': 0.6328803833624608, 'WEIGHT_5': 0.6498615803941402, 'WEIGHT_6': 0.8791601833743389, 'WEIGHT_7': 0.06527029221418928, 'WEIGHT_8': 0.6086962546014845, 'optimizer': 'Adam'}
0
              precision    recall  f1-score   support

         LOC       0.12      0.04      0.06      1837
        MISC       0.01      0.02      0.01       922
         ORG       0.08      0.02      0.04      1341
         PER       0.02      0.01      0.01      1842

   micro avg       0.05      0.02      0.03      5942
   macro avg       0.06      0.02      0.03      5942
weighted avg       0.07      0.02      0.03      5942

{'EMBEDDING_DIM': 833, 'HIDDEN_DIM': 1166, 'NUM_LAYERS': 1, 'DROPOUT': 0.4220680656719392, 'LR': 0.005604911952339633, 'WEIGHT_0': 0.5908793111347497, 'WEIGHT_1': 0.391001242735789, 'WEIGHT_2': 0.3015229688135054, 'WEIGHT_3': 0.839290615107372, 'WEIGHT_4': 0.6328803833624608, 'WEIGHT_5': 0.6498615803941402, 'WEIGHT_6': 0.8791601833743389, 'WEIGHT_7': 0.06527029221418928, 'WEIGHT_8': 0.6086962546014845, 'optimizer': 'Adam'}
49
              precision    recall  f1-score   support

         LOC       0.46      0.31      0.37      1837
        MISC       0.23      0.02      0.04       922
         ORG       0.13      0.04      0.07      1341
         PER       0.12      0.12      0.12      1842

   micro avg       0.24      0.15      0.18      5942
   macro avg       0.24      0.12      0.15      5942
weighted avg       0.25      0.15      0.17      5942

epoch 49
LSTM
  0%|          | 0/50 [00:00<?, ?it/s]  2%|▏         | 1/50 [00:04<04:04,  4.99s/it]  4%|▍         | 2/50 [00:05<01:43,  2.17s/it]  6%|▌         | 3/50 [00:05<01:03,  1.35s/it]  8%|▊         | 4/50 [00:05<00:44,  1.04it/s] 10%|█         | 5/50 [00:06<00:33,  1.33it/s] 12%|█▏        | 6/50 [00:06<00:27,  1.60it/s] 14%|█▍        | 7/50 [00:07<00:23,  1.84it/s] 16%|█▌        | 8/50 [00:07<00:20,  2.04it/s] 18%|█▊        | 9/50 [00:07<00:18,  2.20it/s] 20%|██        | 10/50 [00:08<00:17,  2.31it/s] 22%|██▏       | 11/50 [00:08<00:16,  2.41it/s] 24%|██▍       | 12/50 [00:08<00:15,  2.48it/s] 26%|██▌       | 13/50 [00:09<00:14,  2.54it/s] 28%|██▊       | 14/50 [00:09<00:14,  2.56it/s] 30%|███       | 15/50 [00:10<00:13,  2.58it/s] 32%|███▏      | 16/50 [00:10<00:13,  2.59it/s] 34%|███▍      | 17/50 [00:10<00:12,  2.61it/s] 36%|███▌      | 18/50 [00:11<00:12,  2.63it/s] 38%|███▊      | 19/50 [00:11<00:11,  2.64it/s] 40%|████      | 20/50 [00:11<00:11,  2.63it/s] 42%|████▏     | 21/50 [00:12<00:10,  2.64it/s] 44%|████▍     | 22/50 [00:12<00:10,  2.65it/s] 46%|████▌     | 23/50 [00:13<00:10,  2.66it/s] 48%|████▊     | 24/50 [00:13<00:09,  2.66it/s] 50%|█████     | 25/50 [00:13<00:09,  2.65it/s] 52%|█████▏    | 26/50 [00:14<00:09,  2.65it/s] 54%|█████▍    | 27/50 [00:14<00:08,  2.66it/s] 56%|█████▌    | 28/50 [00:14<00:08,  2.65it/s] 58%|█████▊    | 29/50 [00:15<00:07,  2.64it/s] 60%|██████    | 30/50 [00:15<00:07,  2.65it/s] 62%|██████▏   | 31/50 [00:16<00:07,  2.63it/s] 64%|██████▍   | 32/50 [00:16<00:06,  2.62it/s] 66%|██████▌   | 33/50 [00:16<00:06,  2.64it/s] 68%|██████▊   | 34/50 [00:17<00:06,  2.62it/s] 70%|███████   | 35/50 [00:17<00:05,  2.63it/s] 72%|███████▏  | 36/50 [00:18<00:05,  2.63it/s] 74%|███████▍  | 37/50 [00:18<00:04,  2.63it/s] 76%|███████▌  | 38/50 [00:18<00:04,  2.62it/s] 78%|███████▊  | 39/50 [00:19<00:04,  2.63it/s] 80%|████████  | 40/50 [00:19<00:03,  2.64it/s] 82%|████████▏ | 41/50 [00:19<00:03,  2.64it/s] 84%|████████▍ | 42/50 [00:20<00:03,  2.63it/s] 86%|████████▌ | 43/50 [00:20<00:02,  2.63it/s] 88%|████████▊ | 44/50 [00:21<00:02,  2.65it/s] 90%|█████████ | 45/50 [00:21<00:01,  2.65it/s] 92%|█████████▏| 46/50 [00:21<00:01,  2.64it/s] 94%|█████████▍| 47/50 [00:22<00:01,  2.65it/s] 96%|█████████▌| 48/50 [00:22<00:00,  2.64it/s] 98%|█████████▊| 49/50 [00:22<00:00,  2.64it/s]100%|██████████| 50/50 [00:27<00:00,  1.75s/it]100%|██████████| 50/50 [00:27<00:00,  1.79it/s]
[I 2023-12-10 21:09:06,060] Trial 16 finished with value: 0.08027372022634557 and parameters: {'EMBEDDING_DIM': 825, 'HIDDEN_DIM': 553, 'NUM_LAYERS': 1, 'DROPOUT': 0.4294469922382693, 'LR': 0.00014604173488480011, 'WEIGHT_0': 0.8083769224344997, 'WEIGHT_1': 0.7107808014158046, 'WEIGHT_2': 0.4818971676736755, 'WEIGHT_3': 0.8680414414640439, 'WEIGHT_4': 0.42396034695643636, 'WEIGHT_5': 0.7869782524202472, 'WEIGHT_6': 0.4733572818292573, 'WEIGHT_7': 0.2794156962076336, 'WEIGHT_8': 0.5613745537658252, 'optimizer': 'Adam'}. Best is trial 10 with value: 0.3870380484252685.
{'EMBEDDING_DIM': 825, 'HIDDEN_DIM': 553, 'NUM_LAYERS': 1, 'DROPOUT': 0.4294469922382693, 'LR': 0.00014604173488480011, 'WEIGHT_0': 0.8083769224344997, 'WEIGHT_1': 0.7107808014158046, 'WEIGHT_2': 0.4818971676736755, 'WEIGHT_3': 0.8680414414640439, 'WEIGHT_4': 0.42396034695643636, 'WEIGHT_5': 0.7869782524202472, 'WEIGHT_6': 0.4733572818292573, 'WEIGHT_7': 0.2794156962076336, 'WEIGHT_8': 0.5613745537658252, 'optimizer': 'Adam'}
0
              precision    recall  f1-score   support

         LOC       0.04      0.10      0.06      1837
        MISC       0.01      0.10      0.02       922
         ORG       0.02      0.13      0.04      1341
         PER       0.01      0.07      0.02      1842

   micro avg       0.02      0.10      0.03      5942
   macro avg       0.02      0.10      0.03      5942
weighted avg       0.02      0.10      0.04      5942

{'EMBEDDING_DIM': 825, 'HIDDEN_DIM': 553, 'NUM_LAYERS': 1, 'DROPOUT': 0.4294469922382693, 'LR': 0.00014604173488480011, 'WEIGHT_0': 0.8083769224344997, 'WEIGHT_1': 0.7107808014158046, 'WEIGHT_2': 0.4818971676736755, 'WEIGHT_3': 0.8680414414640439, 'WEIGHT_4': 0.42396034695643636, 'WEIGHT_5': 0.7869782524202472, 'WEIGHT_6': 0.4733572818292573, 'WEIGHT_7': 0.2794156962076336, 'WEIGHT_8': 0.5613745537658252, 'optimizer': 'Adam'}
49
              precision    recall  f1-score   support

         LOC       0.36      0.11      0.16      1837
        MISC       0.10      0.03      0.04       922
         ORG       0.11      0.03      0.05      1341
         PER       0.09      0.02      0.04      1842

   micro avg       0.18      0.05      0.08      5942
   macro avg       0.16      0.05      0.07      5942
weighted avg       0.18      0.05      0.08      5942

epoch 49
LSTM
  0%|          | 0/50 [00:00<?, ?it/s]  2%|▏         | 1/50 [00:12<10:26, 12.79s/it]  4%|▍         | 2/50 [00:14<05:02,  6.30s/it]  6%|▌         | 3/50 [00:17<03:36,  4.61s/it]  8%|▊         | 4/50 [00:19<02:55,  3.81s/it] 10%|█         | 5/50 [00:22<02:31,  3.37s/it] 12%|█▏        | 6/50 [00:24<02:17,  3.12s/it] 14%|█▍        | 7/50 [00:27<02:07,  2.95s/it] 16%|█▌        | 8/50 [00:30<01:59,  2.85s/it] 18%|█▊        | 9/50 [00:32<01:54,  2.78s/it] 20%|██        | 10/50 [00:35<01:49,  2.75s/it] 22%|██▏       | 11/50 [00:38<01:46,  2.73s/it] 24%|██▍       | 12/50 [00:40<01:43,  2.71s/it] 26%|██▌       | 13/50 [00:43<01:39,  2.70s/it] 28%|██▊       | 14/50 [00:46<01:36,  2.69s/it] 30%|███       | 15/50 [00:48<01:33,  2.68s/it] 32%|███▏      | 16/50 [00:51<01:31,  2.69s/it] 34%|███▍      | 17/50 [00:54<01:28,  2.69s/it] 36%|███▌      | 18/50 [00:56<01:26,  2.70s/it] 38%|███▊      | 19/50 [00:59<01:24,  2.72s/it] 40%|████      | 20/50 [01:02<01:21,  2.71s/it] 42%|████▏     | 21/50 [01:05<01:18,  2.72s/it] 44%|████▍     | 22/50 [01:07<01:16,  2.72s/it] 46%|████▌     | 23/50 [01:10<01:13,  2.71s/it] 48%|████▊     | 24/50 [01:13<01:10,  2.71s/it] 50%|█████     | 25/50 [01:16<01:07,  2.71s/it] 52%|█████▏    | 26/50 [01:18<01:05,  2.71s/it] 54%|█████▍    | 27/50 [01:21<01:02,  2.71s/it] 56%|█████▌    | 28/50 [01:24<00:59,  2.71s/it] 58%|█████▊    | 29/50 [01:26<00:56,  2.71s/it] 60%|██████    | 30/50 [01:29<00:54,  2.72s/it] 62%|██████▏   | 31/50 [01:32<00:51,  2.72s/it] 64%|██████▍   | 32/50 [01:35<00:48,  2.72s/it] 66%|██████▌   | 33/50 [01:37<00:46,  2.73s/it] 68%|██████▊   | 34/50 [01:40<00:43,  2.73s/it] 70%|███████   | 35/50 [01:43<00:40,  2.73s/it] 72%|███████▏  | 36/50 [01:45<00:38,  2.72s/it] 74%|███████▍  | 37/50 [01:48<00:35,  2.71s/it] 76%|███████▌  | 38/50 [01:51<00:32,  2.71s/it] 78%|███████▊  | 39/50 [01:54<00:29,  2.71s/it] 80%|████████  | 40/50 [01:56<00:27,  2.71s/it] 82%|████████▏ | 41/50 [01:59<00:24,  2.70s/it] 84%|████████▍ | 42/50 [02:02<00:21,  2.70s/it] 86%|████████▌ | 43/50 [02:04<00:18,  2.69s/it] 88%|████████▊ | 44/50 [02:07<00:16,  2.70s/it] 90%|█████████ | 45/50 [02:10<00:13,  2.70s/it] 92%|█████████▏| 46/50 [02:12<00:10,  2.69s/it] 94%|█████████▍| 47/50 [02:15<00:08,  2.68s/it] 96%|█████████▌| 48/50 [02:18<00:05,  2.68s/it] 98%|█████████▊| 49/50 [02:20<00:02,  2.67s/it]100%|██████████| 50/50 [02:34<00:00,  6.03s/it]100%|██████████| 50/50 [02:34<00:00,  3.09s/it]
