[I 2023-12-10 23:11:29,195] Trial 221 finished with value: 0.418736930154747 and parameters: {'EMBEDDING_DIM': 1005, 'HIDDEN_DIM': 351, 'NUM_LAYERS': 1, 'DROPOUT': 0.35587960409858715, 'LR': 0.0018569027019974256, 'WEIGHT_0': 0.4749226228921323, 'WEIGHT_1': 0.514005727840619, 'WEIGHT_2': 0.20112831285008054, 'WEIGHT_3': 0.8157466372360254, 'WEIGHT_4': 0.9227490496875663, 'WEIGHT_5': 0.5493679622782176, 'WEIGHT_6': 0.6890516803720929, 'WEIGHT_7': 0.38084672643823825, 'WEIGHT_8': 0.8558638758148907, 'optimizer': 'Adam'}. Best is trial 221 with value: 0.418736930154747.
/userhome/cs2/dingruiw/conda/envs/py310/lib/python3.10/site-packages/torch/nn/modules/rnn.py:82: UserWarning: dropout option adds dropout after all but last recurrent layer, so non-zero dropout expects num_layers greater than 1, but got dropout=0.3607842651920685 and num_layers=1
  warnings.warn("dropout option adds dropout after all but last "
{'EMBEDDING_DIM': 1005, 'HIDDEN_DIM': 351, 'NUM_LAYERS': 1, 'DROPOUT': 0.35587960409858715, 'LR': 0.0018569027019974256, 'WEIGHT_0': 0.4749226228921323, 'WEIGHT_1': 0.514005727840619, 'WEIGHT_2': 0.20112831285008054, 'WEIGHT_3': 0.8157466372360254, 'WEIGHT_4': 0.9227490496875663, 'WEIGHT_5': 0.5493679622782176, 'WEIGHT_6': 0.6890516803720929, 'WEIGHT_7': 0.38084672643823825, 'WEIGHT_8': 0.8558638758148907, 'optimizer': 'Adam'}
0
              precision    recall  f1-score   support

         LOC       0.07      0.14      0.10      1837
        MISC       0.03      0.04      0.03       922
         ORG       0.04      0.08      0.06      1341
         PER       0.02      0.02      0.02      1842

   micro avg       0.05      0.07      0.06      5942
   macro avg       0.04      0.07      0.05      5942
weighted avg       0.04      0.07      0.06      5942

{'EMBEDDING_DIM': 1005, 'HIDDEN_DIM': 351, 'NUM_LAYERS': 1, 'DROPOUT': 0.35587960409858715, 'LR': 0.0018569027019974256, 'WEIGHT_0': 0.4749226228921323, 'WEIGHT_1': 0.514005727840619, 'WEIGHT_2': 0.20112831285008054, 'WEIGHT_3': 0.8157466372360254, 'WEIGHT_4': 0.9227490496875663, 'WEIGHT_5': 0.5493679622782176, 'WEIGHT_6': 0.6890516803720929, 'WEIGHT_7': 0.38084672643823825, 'WEIGHT_8': 0.8558638758148907, 'optimizer': 'Adam'}
49
              precision    recall  f1-score   support

         LOC       0.53      0.57      0.55      1837
        MISC       0.48      0.41      0.44       922
         ORG       0.29      0.28      0.28      1341
         PER       0.36      0.39      0.37      1842

   micro avg       0.42      0.42      0.42      5942
   macro avg       0.41      0.41      0.41      5942
weighted avg       0.42      0.42      0.42      5942

epoch 49
LSTM
  0%|          | 0/50 [00:00<?, ?it/s]  2%|▏         | 1/50 [00:04<03:53,  4.77s/it]  4%|▍         | 2/50 [00:04<01:38,  2.04s/it]  6%|▌         | 3/50 [00:05<00:57,  1.22s/it]  8%|▊         | 4/50 [00:05<00:38,  1.20it/s] 10%|█         | 5/50 [00:05<00:28,  1.61it/s] 12%|█▏        | 6/50 [00:05<00:21,  2.03it/s] 14%|█▍        | 7/50 [00:06<00:17,  2.43it/s] 16%|█▌        | 8/50 [00:06<00:15,  2.79it/s] 18%|█▊        | 9/50 [00:06<00:13,  3.10it/s] 20%|██        | 10/50 [00:06<00:11,  3.36it/s] 22%|██▏       | 11/50 [00:07<00:10,  3.56it/s] 24%|██▍       | 12/50 [00:07<00:10,  3.71it/s] 26%|██▌       | 13/50 [00:07<00:09,  3.82it/s] 28%|██▊       | 14/50 [00:07<00:09,  3.90it/s] 30%|███       | 15/50 [00:08<00:08,  3.96it/s] 32%|███▏      | 16/50 [00:08<00:08,  4.01it/s] 34%|███▍      | 17/50 [00:08<00:08,  4.04it/s] 36%|███▌      | 18/50 [00:08<00:07,  4.06it/s] 38%|███▊      | 19/50 [00:09<00:07,  4.08it/s] 40%|████      | 20/50 [00:09<00:07,  4.08it/s] 42%|████▏     | 21/50 [00:09<00:07,  4.09it/s] 44%|████▍     | 22/50 [00:09<00:06,  4.10it/s] 46%|████▌     | 23/50 [00:10<00:06,  4.10it/s] 48%|████▊     | 24/50 [00:10<00:06,  4.11it/s] 50%|█████     | 25/50 [00:10<00:06,  4.11it/s] 52%|█████▏    | 26/50 [00:10<00:05,  4.10it/s] 54%|█████▍    | 27/50 [00:10<00:05,  4.11it/s] 56%|█████▌    | 28/50 [00:11<00:05,  4.11it/s] 58%|█████▊    | 29/50 [00:11<00:05,  4.11it/s] 60%|██████    | 30/50 [00:11<00:04,  4.11it/s] 62%|██████▏   | 31/50 [00:11<00:04,  4.10it/s] 64%|██████▍   | 32/50 [00:12<00:04,  4.10it/s] 66%|██████▌   | 33/50 [00:12<00:04,  4.09it/s] 68%|██████▊   | 34/50 [00:12<00:03,  4.09it/s] 70%|███████   | 35/50 [00:12<00:03,  4.09it/s] 72%|███████▏  | 36/50 [00:13<00:03,  4.09it/s] 74%|███████▍  | 37/50 [00:13<00:03,  4.09it/s] 76%|███████▌  | 38/50 [00:13<00:02,  4.09it/s] 78%|███████▊  | 39/50 [00:13<00:02,  4.08it/s] 80%|████████  | 40/50 [00:14<00:02,  4.08it/s] 82%|████████▏ | 41/50 [00:14<00:02,  4.09it/s] 84%|████████▍ | 42/50 [00:14<00:01,  4.08it/s] 86%|████████▌ | 43/50 [00:14<00:01,  4.08it/s] 88%|████████▊ | 44/50 [00:15<00:01,  4.08it/s] 90%|█████████ | 45/50 [00:15<00:01,  4.08it/s] 92%|█████████▏| 46/50 [00:15<00:00,  4.08it/s] 94%|█████████▍| 47/50 [00:15<00:00,  4.07it/s] 96%|█████████▌| 48/50 [00:16<00:00,  4.07it/s] 98%|█████████▊| 49/50 [00:16<00:00,  4.07it/s]100%|██████████| 50/50 [00:21<00:00,  1.68s/it]100%|██████████| 50/50 [00:21<00:00,  2.34it/s]
[I 2023-12-10 23:11:54,931] Trial 222 finished with value: 0.39928819591560033 and parameters: {'EMBEDDING_DIM': 1001, 'HIDDEN_DIM': 354, 'NUM_LAYERS': 1, 'DROPOUT': 0.3607842651920685, 'LR': 0.001843615419630239, 'WEIGHT_0': 0.47508926345079994, 'WEIGHT_1': 0.5049770245761006, 'WEIGHT_2': 0.23141018814651781, 'WEIGHT_3': 0.8063198276772215, 'WEIGHT_4': 0.9245051364275801, 'WEIGHT_5': 0.5547530446595788, 'WEIGHT_6': 0.6911154976228036, 'WEIGHT_7': 0.3994151044051135, 'WEIGHT_8': 0.7711584684937659, 'optimizer': 'Adam'}. Best is trial 221 with value: 0.418736930154747.
/userhome/cs2/dingruiw/conda/envs/py310/lib/python3.10/site-packages/torch/nn/modules/rnn.py:82: UserWarning: dropout option adds dropout after all but last recurrent layer, so non-zero dropout expects num_layers greater than 1, but got dropout=0.37037548622872185 and num_layers=1
  warnings.warn("dropout option adds dropout after all but last "
{'EMBEDDING_DIM': 1001, 'HIDDEN_DIM': 354, 'NUM_LAYERS': 1, 'DROPOUT': 0.3607842651920685, 'LR': 0.001843615419630239, 'WEIGHT_0': 0.47508926345079994, 'WEIGHT_1': 0.5049770245761006, 'WEIGHT_2': 0.23141018814651781, 'WEIGHT_3': 0.8063198276772215, 'WEIGHT_4': 0.9245051364275801, 'WEIGHT_5': 0.5547530446595788, 'WEIGHT_6': 0.6911154976228036, 'WEIGHT_7': 0.3994151044051135, 'WEIGHT_8': 0.7711584684937659, 'optimizer': 'Adam'}
0
              precision    recall  f1-score   support

         LOC       0.06      0.10      0.08      1837
        MISC       0.02      0.03      0.03       922
         ORG       0.03      0.03      0.03      1341
         PER       0.03      0.05      0.04      1842

   micro avg       0.04      0.06      0.05      5942
   macro avg       0.03      0.05      0.04      5942
weighted avg       0.04      0.06      0.04      5942

{'EMBEDDING_DIM': 1001, 'HIDDEN_DIM': 354, 'NUM_LAYERS': 1, 'DROPOUT': 0.3607842651920685, 'LR': 0.001843615419630239, 'WEIGHT_0': 0.47508926345079994, 'WEIGHT_1': 0.5049770245761006, 'WEIGHT_2': 0.23141018814651781, 'WEIGHT_3': 0.8063198276772215, 'WEIGHT_4': 0.9245051364275801, 'WEIGHT_5': 0.5547530446595788, 'WEIGHT_6': 0.6911154976228036, 'WEIGHT_7': 0.3994151044051135, 'WEIGHT_8': 0.7711584684937659, 'optimizer': 'Adam'}
49
              precision    recall  f1-score   support

         LOC       0.54      0.56      0.55      1837
        MISC       0.46      0.41      0.43       922
         ORG       0.27      0.24      0.26      1341
         PER       0.32      0.34      0.33      1842

   micro avg       0.40      0.40      0.40      5942
   macro avg       0.40      0.39      0.39      5942
weighted avg       0.40      0.40      0.40      5942

epoch 49
LSTM
  0%|          | 0/50 [00:00<?, ?it/s]  2%|▏         | 1/50 [00:04<03:53,  4.76s/it]  4%|▍         | 2/50 [00:04<01:37,  2.03s/it]  6%|▌         | 3/50 [00:05<00:56,  1.20s/it]  8%|▊         | 4/50 [00:05<00:37,  1.23it/s] 10%|█         | 5/50 [00:05<00:26,  1.68it/s] 12%|█▏        | 6/50 [00:05<00:20,  2.16it/s] 14%|█▍        | 7/50 [00:05<00:16,  2.62it/s] 16%|█▌        | 8/50 [00:06<00:13,  3.06it/s] 18%|█▊        | 9/50 [00:06<00:11,  3.44it/s] 20%|██        | 10/50 [00:06<00:10,  3.76it/s] 22%|██▏       | 11/50 [00:06<00:09,  4.01it/s] 24%|██▍       | 12/50 [00:06<00:09,  4.21it/s] 26%|██▌       | 13/50 [00:07<00:08,  4.35it/s] 28%|██▊       | 14/50 [00:07<00:08,  4.47it/s] 30%|███       | 15/50 [00:07<00:07,  4.54it/s] 32%|███▏      | 16/50 [00:07<00:07,  4.60it/s] 34%|███▍      | 17/50 [00:08<00:07,  4.64it/s] 36%|███▌      | 18/50 [00:08<00:06,  4.67it/s] 38%|███▊      | 19/50 [00:08<00:06,  4.69it/s] 40%|████      | 20/50 [00:08<00:06,  4.70it/s] 42%|████▏     | 21/50 [00:08<00:06,  4.71it/s] 44%|████▍     | 22/50 [00:09<00:05,  4.72it/s] 46%|████▌     | 23/50 [00:09<00:05,  4.72it/s] 48%|████▊     | 24/50 [00:09<00:05,  4.72it/s] 50%|█████     | 25/50 [00:09<00:05,  4.72it/s] 52%|█████▏    | 26/50 [00:09<00:05,  4.73it/s] 54%|█████▍    | 27/50 [00:10<00:04,  4.72it/s] 56%|█████▌    | 28/50 [00:10<00:04,  4.72it/s] 58%|█████▊    | 29/50 [00:10<00:04,  4.72it/s] 60%|██████    | 30/50 [00:10<00:04,  4.72it/s] 62%|██████▏   | 31/50 [00:11<00:04,  4.72it/s] 64%|██████▍   | 32/50 [00:11<00:03,  4.72it/s] 66%|██████▌   | 33/50 [00:11<00:03,  4.72it/s] 68%|██████▊   | 34/50 [00:11<00:03,  4.71it/s] 70%|███████   | 35/50 [00:11<00:03,  4.72it/s] 72%|███████▏  | 36/50 [00:12<00:02,  4.71it/s] 74%|███████▍  | 37/50 [00:12<00:02,  4.72it/s] 76%|███████▌  | 38/50 [00:12<00:02,  4.72it/s] 78%|███████▊  | 39/50 [00:12<00:02,  4.72it/s] 80%|████████  | 40/50 [00:12<00:02,  4.72it/s] 82%|████████▏ | 41/50 [00:13<00:01,  4.71it/s] 84%|████████▍ | 42/50 [00:13<00:01,  4.71it/s] 86%|████████▌ | 43/50 [00:13<00:01,  4.71it/s] 88%|████████▊ | 44/50 [00:13<00:01,  4.71it/s] 90%|█████████ | 45/50 [00:13<00:01,  4.71it/s] 92%|█████████▏| 46/50 [00:14<00:00,  4.71it/s] 94%|█████████▍| 47/50 [00:14<00:00,  4.71it/s] 96%|█████████▌| 48/50 [00:14<00:00,  4.71it/s] 98%|█████████▊| 49/50 [00:14<00:00,  4.71it/s]100%|██████████| 50/50 [00:19<00:00,  1.62s/it]100%|██████████| 50/50 [00:19<00:00,  2.53it/s]
[I 2023-12-10 23:12:19,018] Trial 223 finished with value: 0.4072659366777014 and parameters: {'EMBEDDING_DIM': 1005, 'HIDDEN_DIM': 293, 'NUM_LAYERS': 1, 'DROPOUT': 0.37037548622872185, 'LR': 0.0021572797020871243, 'WEIGHT_0': 0.5207726603590044, 'WEIGHT_1': 0.5113887899703717, 'WEIGHT_2': 0.20074027219173196, 'WEIGHT_3': 0.7305886339810667, 'WEIGHT_4': 0.901379995927425, 'WEIGHT_5': 0.5392491120839793, 'WEIGHT_6': 0.6544918044307257, 'WEIGHT_7': 0.4403976282778845, 'WEIGHT_8': 0.8604760028187376, 'optimizer': 'Adam'}. Best is trial 221 with value: 0.418736930154747.
/userhome/cs2/dingruiw/conda/envs/py310/lib/python3.10/site-packages/torch/nn/modules/rnn.py:82: UserWarning: dropout option adds dropout after all but last recurrent layer, so non-zero dropout expects num_layers greater than 1, but got dropout=0.3535206697546986 and num_layers=1
  warnings.warn("dropout option adds dropout after all but last "
{'EMBEDDING_DIM': 1005, 'HIDDEN_DIM': 293, 'NUM_LAYERS': 1, 'DROPOUT': 0.37037548622872185, 'LR': 0.0021572797020871243, 'WEIGHT_0': 0.5207726603590044, 'WEIGHT_1': 0.5113887899703717, 'WEIGHT_2': 0.20074027219173196, 'WEIGHT_3': 0.7305886339810667, 'WEIGHT_4': 0.901379995927425, 'WEIGHT_5': 0.5392491120839793, 'WEIGHT_6': 0.6544918044307257, 'WEIGHT_7': 0.4403976282778845, 'WEIGHT_8': 0.8604760028187376, 'optimizer': 'Adam'}
0
              precision    recall  f1-score   support

         LOC       0.07      0.10      0.08      1837
        MISC       0.02      0.03      0.03       922
         ORG       0.04      0.05      0.04      1341
         PER       0.03      0.04      0.03      1842

   micro avg       0.04      0.06      0.05      5942
   macro avg       0.04      0.06      0.05      5942
weighted avg       0.04      0.06      0.05      5942

{'EMBEDDING_DIM': 1005, 'HIDDEN_DIM': 293, 'NUM_LAYERS': 1, 'DROPOUT': 0.37037548622872185, 'LR': 0.0021572797020871243, 'WEIGHT_0': 0.5207726603590044, 'WEIGHT_1': 0.5113887899703717, 'WEIGHT_2': 0.20074027219173196, 'WEIGHT_3': 0.7305886339810667, 'WEIGHT_4': 0.901379995927425, 'WEIGHT_5': 0.5392491120839793, 'WEIGHT_6': 0.6544918044307257, 'WEIGHT_7': 0.4403976282778845, 'WEIGHT_8': 0.8604760028187376, 'optimizer': 'Adam'}
49
              precision    recall  f1-score   support

         LOC       0.57      0.54      0.56      1837
        MISC       0.48      0.43      0.45       922
         ORG       0.28      0.25      0.27      1341
         PER       0.33      0.36      0.34      1842

   micro avg       0.41      0.40      0.41      5942
   macro avg       0.41      0.40      0.40      5942
weighted avg       0.42      0.40      0.41      5942

epoch 49
LSTM
  0%|          | 0/50 [00:00<?, ?it/s]  2%|▏         | 1/50 [00:04<03:56,  4.82s/it]  4%|▍         | 2/50 [00:04<01:38,  2.06s/it]  6%|▌         | 3/50 [00:05<00:57,  1.23s/it]  8%|▊         | 4/50 [00:05<00:38,  1.19it/s] 10%|█         | 5/50 [00:05<00:27,  1.61it/s] 12%|█▏        | 6/50 [00:05<00:21,  2.05it/s] 14%|█▍        | 7/50 [00:06<00:17,  2.47it/s] 16%|█▌        | 8/50 [00:06<00:14,  2.86it/s] 18%|█▊        | 9/50 [00:06<00:12,  3.20it/s] 20%|██        | 10/50 [00:06<00:11,  3.47it/s] 22%|██▏       | 11/50 [00:07<00:10,  3.69it/s] 24%|██▍       | 12/50 [00:07<00:09,  3.86it/s] 26%|██▌       | 13/50 [00:07<00:09,  3.98it/s] 28%|██▊       | 14/50 [00:07<00:08,  4.08it/s] 30%|███       | 15/50 [00:07<00:08,  4.14it/s] 32%|███▏      | 16/50 [00:08<00:08,  4.19it/s] 34%|███▍      | 17/50 [00:08<00:07,  4.22it/s] 36%|███▌      | 18/50 [00:08<00:07,  4.25it/s] 38%|███▊      | 19/50 [00:08<00:07,  4.26it/s] 40%|████      | 20/50 [00:09<00:07,  4.27it/s] 42%|████▏     | 21/50 [00:09<00:06,  4.28it/s] 44%|████▍     | 22/50 [00:09<00:06,  4.29it/s] 46%|████▌     | 23/50 [00:09<00:06,  4.30it/s] 48%|████▊     | 24/50 [00:10<00:06,  4.29it/s] 50%|█████     | 25/50 [00:10<00:05,  4.30it/s] 52%|█████▏    | 26/50 [00:10<00:05,  4.29it/s] 54%|█████▍    | 27/50 [00:10<00:05,  4.29it/s] 56%|█████▌    | 28/50 [00:11<00:05,  4.29it/s] 58%|█████▊    | 29/50 [00:11<00:04,  4.29it/s] 60%|██████    | 30/50 [00:11<00:04,  4.29it/s] 62%|██████▏   | 31/50 [00:11<00:04,  4.29it/s] 64%|██████▍   | 32/50 [00:11<00:04,  4.29it/s] 66%|██████▌   | 33/50 [00:12<00:03,  4.29it/s] 68%|██████▊   | 34/50 [00:12<00:03,  4.29it/s] 70%|███████   | 35/50 [00:12<00:03,  4.29it/s] 72%|███████▏  | 36/50 [00:12<00:03,  4.29it/s] 74%|███████▍  | 37/50 [00:13<00:03,  4.29it/s] 76%|███████▌  | 38/50 [00:13<00:02,  4.29it/s] 78%|███████▊  | 39/50 [00:13<00:02,  4.29it/s] 80%|████████  | 40/50 [00:13<00:02,  4.28it/s] 82%|████████▏ | 41/50 [00:14<00:02,  4.29it/s] 84%|████████▍ | 42/50 [00:14<00:01,  4.28it/s] 86%|████████▌ | 43/50 [00:14<00:01,  4.28it/s] 88%|████████▊ | 44/50 [00:14<00:01,  4.28it/s] 90%|█████████ | 45/50 [00:14<00:01,  4.28it/s] 92%|█████████▏| 46/50 [00:15<00:00,  4.28it/s] 94%|█████████▍| 47/50 [00:15<00:00,  4.28it/s] 96%|█████████▌| 48/50 [00:15<00:00,  4.28it/s] 98%|█████████▊| 49/50 [00:15<00:00,  4.28it/s]100%|██████████| 50/50 [00:20<00:00,  1.64s/it]100%|██████████| 50/50 [00:20<00:00,  2.40it/s]
[I 2023-12-10 23:12:44,175] Trial 224 finished with value: 0.39246062483862637 and parameters: {'EMBEDDING_DIM': 983, 'HIDDEN_DIM': 340, 'NUM_LAYERS': 1, 'DROPOUT': 0.3535206697546986, 'LR': 0.0016771539634284635, 'WEIGHT_0': 0.537748420314373, 'WEIGHT_1': 0.5368104183880987, 'WEIGHT_2': 0.1297539686903185, 'WEIGHT_3': 0.7763571220382777, 'WEIGHT_4': 0.9280413552945994, 'WEIGHT_5': 0.5994960279871405, 'WEIGHT_6': 0.6764862480678516, 'WEIGHT_7': 0.37720308732941144, 'WEIGHT_8': 0.8078096742728544, 'optimizer': 'Adam'}. Best is trial 221 with value: 0.418736930154747.
/userhome/cs2/dingruiw/conda/envs/py310/lib/python3.10/site-packages/torch/nn/modules/rnn.py:82: UserWarning: dropout option adds dropout after all but last recurrent layer, so non-zero dropout expects num_layers greater than 1, but got dropout=0.3919619626069864 and num_layers=1
  warnings.warn("dropout option adds dropout after all but last "
{'EMBEDDING_DIM': 983, 'HIDDEN_DIM': 340, 'NUM_LAYERS': 1, 'DROPOUT': 0.3535206697546986, 'LR': 0.0016771539634284635, 'WEIGHT_0': 0.537748420314373, 'WEIGHT_1': 0.5368104183880987, 'WEIGHT_2': 0.1297539686903185, 'WEIGHT_3': 0.7763571220382777, 'WEIGHT_4': 0.9280413552945994, 'WEIGHT_5': 0.5994960279871405, 'WEIGHT_6': 0.6764862480678516, 'WEIGHT_7': 0.37720308732941144, 'WEIGHT_8': 0.8078096742728544, 'optimizer': 'Adam'}
0
              precision    recall  f1-score   support

         LOC       0.05      0.08      0.06      1837
        MISC       0.02      0.03      0.02       922
         ORG       0.04      0.05      0.04      1341
         PER       0.03      0.07      0.04      1842

   micro avg       0.04      0.06      0.05      5942
   macro avg       0.04      0.06      0.04      5942
weighted avg       0.04      0.06      0.05      5942

{'EMBEDDING_DIM': 983, 'HIDDEN_DIM': 340, 'NUM_LAYERS': 1, 'DROPOUT': 0.3535206697546986, 'LR': 0.0016771539634284635, 'WEIGHT_0': 0.537748420314373, 'WEIGHT_1': 0.5368104183880987, 'WEIGHT_2': 0.1297539686903185, 'WEIGHT_3': 0.7763571220382777, 'WEIGHT_4': 0.9280413552945994, 'WEIGHT_5': 0.5994960279871405, 'WEIGHT_6': 0.6764862480678516, 'WEIGHT_7': 0.37720308732941144, 'WEIGHT_8': 0.8078096742728544, 'optimizer': 'Adam'}
49
              precision    recall  f1-score   support

         LOC       0.56      0.57      0.56      1837
        MISC       0.48      0.31      0.38       922
         ORG       0.27      0.24      0.26      1341
         PER       0.31      0.34      0.33      1842

   micro avg       0.40      0.38      0.39      5942
   macro avg       0.41      0.36      0.38      5942
weighted avg       0.41      0.38      0.39      5942

epoch 49
LSTM
  0%|          | 0/50 [00:00<?, ?it/s]  2%|▏         | 1/50 [00:05<04:36,  5.64s/it]  4%|▍         | 2/50 [00:05<01:58,  2.47s/it]  6%|▌         | 3/50 [00:06<01:14,  1.58s/it]  8%|▊         | 4/50 [00:06<00:53,  1.17s/it] 10%|█         | 5/50 [00:07<00:42,  1.07it/s] 12%|█▏        | 6/50 [00:07<00:34,  1.26it/s] 14%|█▍        | 7/50 [00:08<00:30,  1.42it/s] 16%|█▌        | 8/50 [00:09<00:27,  1.54it/s] 18%|█▊        | 9/50 [00:09<00:25,  1.64it/s] 20%|██        | 10/50 [00:10<00:23,  1.71it/s] 22%|██▏       | 11/50 [00:10<00:22,  1.77it/s] 24%|██▍       | 12/50 [00:11<00:21,  1.79it/s] 26%|██▌       | 13/50 [00:11<00:20,  1.83it/s] 28%|██▊       | 14/50 [00:12<00:19,  1.86it/s] 30%|███       | 15/50 [00:12<00:18,  1.87it/s] 32%|███▏      | 16/50 [00:13<00:18,  1.87it/s] 34%|███▍      | 17/50 [00:13<00:17,  1.87it/s] 36%|███▌      | 18/50 [00:14<00:17,  1.88it/s] 38%|███▊      | 19/50 [00:14<00:16,  1.88it/s] 40%|████      | 20/50 [00:15<00:15,  1.88it/s] 42%|████▏     | 21/50 [00:15<00:15,  1.88it/s] 44%|████▍     | 22/50 [00:16<00:14,  1.89it/s] 46%|████▌     | 23/50 [00:16<00:14,  1.89it/s] 48%|████▊     | 24/50 [00:17<00:13,  1.88it/s] 50%|█████     | 25/50 [00:18<00:13,  1.88it/s] 52%|█████▏    | 26/50 [00:18<00:12,  1.88it/s] 54%|█████▍    | 27/50 [00:19<00:12,  1.87it/s] 56%|█████▌    | 28/50 [00:19<00:11,  1.89it/s] 58%|█████▊    | 29/50 [00:20<00:11,  1.89it/s] 60%|██████    | 30/50 [00:20<00:10,  1.89it/s] 62%|██████▏   | 31/50 [00:21<00:10,  1.88it/s] 64%|██████▍   | 32/50 [00:21<00:09,  1.88it/s] 66%|██████▌   | 33/50 [00:22<00:09,  1.88it/s] 68%|██████▊   | 34/50 [00:22<00:08,  1.88it/s] 70%|███████   | 35/50 [00:23<00:08,  1.87it/s] 72%|███████▏  | 36/50 [00:23<00:07,  1.87it/s] 74%|███████▍  | 37/50 [00:24<00:06,  1.86it/s] 76%|███████▌  | 38/50 [00:24<00:06,  1.86it/s] 78%|███████▊  | 39/50 [00:25<00:05,  1.86it/s] 80%|████████  | 40/50 [00:26<00:05,  1.86it/s] 82%|████████▏ | 41/50 [00:26<00:04,  1.85it/s] 84%|████████▍ | 42/50 [00:27<00:04,  1.86it/s] 86%|████████▌ | 43/50 [00:27<00:03,  1.86it/s] 88%|████████▊ | 44/50 [00:28<00:03,  1.85it/s] 90%|█████████ | 45/50 [00:28<00:02,  1.85it/s] 92%|█████████▏| 46/50 [00:29<00:02,  1.84it/s] 94%|█████████▍| 47/50 [00:29<00:01,  1.85it/s] 96%|█████████▌| 48/50 [00:30<00:01,  1.85it/s] 98%|█████████▊| 49/50 [00:30<00:00,  1.85it/s]100%|██████████| 50/50 [00:36<00:00,  2.12s/it]100%|██████████| 50/50 [00:36<00:00,  1.36it/s]
