[I 2023-12-10 22:29:57,526] Trial 137 finished with value: 0.4036528150134048 and parameters: {'EMBEDDING_DIM': 922, 'HIDDEN_DIM': 190, 'NUM_LAYERS': 1, 'DROPOUT': 0.26973254355232473, 'LR': 0.0028068922235941086, 'WEIGHT_0': 0.46846460947894464, 'WEIGHT_1': 0.8636670120665224, 'WEIGHT_2': 0.7106705821283377, 'WEIGHT_3': 0.6623759164509395, 'WEIGHT_4': 0.9789643725501556, 'WEIGHT_5': 0.5039241295128822, 'WEIGHT_6': 0.8268098112219243, 'WEIGHT_7': 0.44283564558364913, 'WEIGHT_8': 0.5897809420904965, 'optimizer': 'RMSprop'}. Best is trial 134 with value: 0.4158467115484205.
{'EMBEDDING_DIM': 922, 'HIDDEN_DIM': 190, 'NUM_LAYERS': 1, 'DROPOUT': 0.26973254355232473, 'LR': 0.0028068922235941086, 'WEIGHT_0': 0.46846460947894464, 'WEIGHT_1': 0.8636670120665224, 'WEIGHT_2': 0.7106705821283377, 'WEIGHT_3': 0.6623759164509395, 'WEIGHT_4': 0.9789643725501556, 'WEIGHT_5': 0.5039241295128822, 'WEIGHT_6': 0.8268098112219243, 'WEIGHT_7': 0.44283564558364913, 'WEIGHT_8': 0.5897809420904965, 'optimizer': 'RMSprop'}
0
              precision    recall  f1-score   support

         LOC       0.53      0.12      0.19      1837
        MISC       0.07      0.03      0.05       922
         ORG       0.10      0.01      0.01      1341
         PER       0.12      0.04      0.06      1842

   micro avg       0.22      0.05      0.09      5942
   macro avg       0.21      0.05      0.08      5942
weighted avg       0.24      0.05      0.09      5942

{'EMBEDDING_DIM': 922, 'HIDDEN_DIM': 190, 'NUM_LAYERS': 1, 'DROPOUT': 0.26973254355232473, 'LR': 0.0028068922235941086, 'WEIGHT_0': 0.46846460947894464, 'WEIGHT_1': 0.8636670120665224, 'WEIGHT_2': 0.7106705821283377, 'WEIGHT_3': 0.6623759164509395, 'WEIGHT_4': 0.9789643725501556, 'WEIGHT_5': 0.5039241295128822, 'WEIGHT_6': 0.8268098112219243, 'WEIGHT_7': 0.44283564558364913, 'WEIGHT_8': 0.5897809420904965, 'optimizer': 'RMSprop'}
49
              precision    recall  f1-score   support

         LOC       0.59      0.55      0.57      1837
        MISC       0.42      0.46      0.44       922
         ORG       0.27      0.25      0.26      1341
         PER       0.32      0.35      0.33      1842

   micro avg       0.40      0.41      0.40      5942
   macro avg       0.40      0.40      0.40      5942
weighted avg       0.41      0.41      0.40      5942

epoch 49
LSTM
  0%|          | 0/50 [00:00<?, ?it/s]  2%|▏         | 1/50 [00:06<04:55,  6.02s/it]  4%|▍         | 2/50 [00:06<02:02,  2.56s/it]  6%|▌         | 3/50 [00:06<01:09,  1.48s/it]  8%|▊         | 4/50 [00:06<00:44,  1.02it/s] 10%|█         | 5/50 [00:06<00:31,  1.43it/s] 12%|█▏        | 6/50 [00:06<00:23,  1.89it/s] 14%|█▍        | 7/50 [00:07<00:18,  2.36it/s] 16%|█▌        | 8/50 [00:07<00:14,  2.83it/s] 18%|█▊        | 9/50 [00:07<00:12,  3.26it/s] 20%|██        | 10/50 [00:07<00:10,  3.64it/s] 22%|██▏       | 11/50 [00:07<00:09,  3.95it/s] 24%|██▍       | 12/50 [00:08<00:09,  4.20it/s] 26%|██▌       | 13/50 [00:08<00:08,  4.39it/s] 28%|██▊       | 14/50 [00:08<00:07,  4.53it/s] 30%|███       | 15/50 [00:08<00:07,  4.68it/s] 32%|███▏      | 16/50 [00:09<00:07,  4.71it/s] 34%|███▍      | 17/50 [00:09<00:06,  4.76it/s] 36%|███▌      | 18/50 [00:09<00:06,  4.79it/s] 38%|███▊      | 19/50 [00:09<00:06,  4.87it/s] 40%|████      | 20/50 [00:09<00:06,  4.84it/s] 42%|████▏     | 21/50 [00:10<00:05,  4.86it/s] 44%|████▍     | 22/50 [00:10<00:05,  4.92it/s] 46%|████▌     | 23/50 [00:10<00:05,  4.88it/s] 48%|████▊     | 24/50 [00:10<00:05,  4.88it/s] 50%|█████     | 25/50 [00:10<00:05,  4.89it/s] 52%|█████▏    | 26/50 [00:11<00:04,  4.89it/s] 54%|█████▍    | 27/50 [00:11<00:04,  4.88it/s] 56%|█████▌    | 28/50 [00:11<00:04,  4.88it/s] 58%|█████▊    | 29/50 [00:11<00:04,  4.88it/s] 60%|██████    | 30/50 [00:11<00:04,  4.89it/s] 62%|██████▏   | 31/50 [00:12<00:03,  4.89it/s] 64%|██████▍   | 32/50 [00:12<00:03,  4.89it/s] 66%|██████▌   | 33/50 [00:12<00:03,  4.88it/s] 68%|██████▊   | 34/50 [00:12<00:03,  4.88it/s] 70%|███████   | 35/50 [00:12<00:03,  4.88it/s] 72%|███████▏  | 36/50 [00:13<00:02,  4.88it/s] 74%|███████▍  | 37/50 [00:13<00:02,  4.88it/s] 76%|███████▌  | 38/50 [00:13<00:02,  4.89it/s] 78%|███████▊  | 39/50 [00:13<00:02,  4.89it/s] 80%|████████  | 40/50 [00:13<00:02,  4.88it/s] 82%|████████▏ | 41/50 [00:14<00:01,  4.88it/s] 84%|████████▍ | 42/50 [00:14<00:01,  4.87it/s] 86%|████████▌ | 43/50 [00:14<00:01,  4.87it/s] 88%|████████▊ | 44/50 [00:14<00:01,  4.87it/s] 90%|█████████ | 45/50 [00:14<00:01,  4.87it/s] 92%|█████████▏| 46/50 [00:15<00:00,  4.87it/s] 94%|█████████▍| 47/50 [00:15<00:00,  4.87it/s] 96%|█████████▌| 48/50 [00:15<00:00,  4.87it/s] 98%|█████████▊| 49/50 [00:15<00:00,  4.88it/s]100%|██████████| 50/50 [00:22<00:00,  2.04s/it]100%|██████████| 50/50 [00:22<00:00,  2.27it/s]
[I 2023-12-10 22:30:24,905] Trial 138 finished with value: 0.147946746671667 and parameters: {'EMBEDDING_DIM': 167, 'HIDDEN_DIM': 256, 'NUM_LAYERS': 3, 'DROPOUT': 0.32587911799422487, 'LR': 0.0029895220112768077, 'WEIGHT_0': 0.5567839091263104, 'WEIGHT_1': 0.8401635162336649, 'WEIGHT_2': 0.6463559389811429, 'WEIGHT_3': 0.9145346131781069, 'WEIGHT_4': 0.9604490636085, 'WEIGHT_5': 0.565072034497847, 'WEIGHT_6': 0.7826248177632821, 'WEIGHT_7': 0.5246351071325525, 'WEIGHT_8': 0.465545530724201, 'optimizer': 'RMSprop'}. Best is trial 134 with value: 0.4158467115484205.
/userhome/cs2/dingruiw/conda/envs/py310/lib/python3.10/site-packages/torch/nn/modules/rnn.py:82: UserWarning: dropout option adds dropout after all but last recurrent layer, so non-zero dropout expects num_layers greater than 1, but got dropout=0.289525124749113 and num_layers=1
  warnings.warn("dropout option adds dropout after all but last "
{'EMBEDDING_DIM': 167, 'HIDDEN_DIM': 256, 'NUM_LAYERS': 3, 'DROPOUT': 0.32587911799422487, 'LR': 0.0029895220112768077, 'WEIGHT_0': 0.5567839091263104, 'WEIGHT_1': 0.8401635162336649, 'WEIGHT_2': 0.6463559389811429, 'WEIGHT_3': 0.9145346131781069, 'WEIGHT_4': 0.9604490636085, 'WEIGHT_5': 0.565072034497847, 'WEIGHT_6': 0.7826248177632821, 'WEIGHT_7': 0.5246351071325525, 'WEIGHT_8': 0.465545530724201, 'optimizer': 'RMSprop'}
0
              precision    recall  f1-score   support

         LOC       0.00      0.00      0.00      1837
        MISC       0.00      0.00      0.00       922
         ORG       0.00      0.00      0.00      1341
         PER       0.12      0.01      0.01      1842

   micro avg       0.10      0.00      0.00      5942
   macro avg       0.03      0.00      0.00      5942
weighted avg       0.04      0.00      0.00      5942

{'EMBEDDING_DIM': 167, 'HIDDEN_DIM': 256, 'NUM_LAYERS': 3, 'DROPOUT': 0.32587911799422487, 'LR': 0.0029895220112768077, 'WEIGHT_0': 0.5567839091263104, 'WEIGHT_1': 0.8401635162336649, 'WEIGHT_2': 0.6463559389811429, 'WEIGHT_3': 0.9145346131781069, 'WEIGHT_4': 0.9604490636085, 'WEIGHT_5': 0.565072034497847, 'WEIGHT_6': 0.7826248177632821, 'WEIGHT_7': 0.5246351071325525, 'WEIGHT_8': 0.465545530724201, 'optimizer': 'RMSprop'}
49
              precision    recall  f1-score   support

         LOC       0.33      0.16      0.22      1837
        MISC       0.00      0.00      0.00       922
         ORG       0.14      0.14      0.14      1341
         PER       0.13      0.17      0.14      1842

   micro avg       0.17      0.13      0.15      5942
   macro avg       0.15      0.12      0.12      5942
weighted avg       0.17      0.13      0.14      5942

epoch 49
LSTM
  0%|          | 0/50 [00:00<?, ?it/s]  2%|▏         | 1/50 [00:04<03:49,  4.68s/it]  4%|▍         | 2/50 [00:04<01:36,  2.00s/it]  6%|▌         | 3/50 [00:05<00:56,  1.20s/it]  8%|▊         | 4/50 [00:05<00:37,  1.23it/s] 10%|█         | 5/50 [00:05<00:27,  1.67it/s] 12%|█▏        | 6/50 [00:05<00:20,  2.12it/s] 14%|█▍        | 7/50 [00:05<00:16,  2.56it/s] 16%|█▌        | 8/50 [00:06<00:14,  2.95it/s] 18%|█▊        | 9/50 [00:06<00:12,  3.30it/s] 20%|██        | 10/50 [00:06<00:11,  3.59it/s] 22%|██▏       | 11/50 [00:06<00:10,  3.82it/s] 24%|██▍       | 12/50 [00:07<00:09,  3.99it/s] 26%|██▌       | 13/50 [00:07<00:08,  4.12it/s] 28%|██▊       | 14/50 [00:07<00:08,  4.21it/s] 30%|███       | 15/50 [00:07<00:08,  4.28it/s] 32%|███▏      | 16/50 [00:07<00:07,  4.33it/s] 34%|███▍      | 17/50 [00:08<00:07,  4.36it/s] 36%|███▌      | 18/50 [00:08<00:07,  4.39it/s] 38%|███▊      | 19/50 [00:08<00:07,  4.41it/s] 40%|████      | 20/50 [00:08<00:06,  4.42it/s] 42%|████▏     | 21/50 [00:09<00:06,  4.43it/s] 44%|████▍     | 22/50 [00:09<00:06,  4.43it/s] 46%|████▌     | 23/50 [00:09<00:06,  4.44it/s] 48%|████▊     | 24/50 [00:09<00:05,  4.44it/s] 50%|█████     | 25/50 [00:09<00:05,  4.44it/s] 52%|█████▏    | 26/50 [00:10<00:05,  4.44it/s] 54%|█████▍    | 27/50 [00:10<00:05,  4.44it/s] 56%|█████▌    | 28/50 [00:10<00:04,  4.43it/s] 58%|█████▊    | 29/50 [00:10<00:04,  4.43it/s] 60%|██████    | 30/50 [00:11<00:04,  4.44it/s] 62%|██████▏   | 31/50 [00:11<00:04,  4.44it/s] 64%|██████▍   | 32/50 [00:11<00:04,  4.43it/s] 66%|██████▌   | 33/50 [00:11<00:03,  4.43it/s] 68%|██████▊   | 34/50 [00:12<00:03,  4.43it/s] 70%|███████   | 35/50 [00:12<00:03,  4.43it/s] 72%|███████▏  | 36/50 [00:12<00:03,  4.43it/s] 74%|███████▍  | 37/50 [00:12<00:02,  4.43it/s] 76%|███████▌  | 38/50 [00:12<00:02,  4.43it/s] 78%|███████▊  | 39/50 [00:13<00:02,  4.43it/s] 80%|████████  | 40/50 [00:13<00:02,  4.43it/s] 82%|████████▏ | 41/50 [00:13<00:02,  4.43it/s] 84%|████████▍ | 42/50 [00:13<00:01,  4.43it/s] 86%|████████▌ | 43/50 [00:14<00:01,  4.43it/s] 88%|████████▊ | 44/50 [00:14<00:01,  4.43it/s] 90%|█████████ | 45/50 [00:14<00:01,  4.43it/s] 92%|█████████▏| 46/50 [00:14<00:00,  4.43it/s] 94%|█████████▍| 47/50 [00:14<00:00,  4.43it/s] 96%|█████████▌| 48/50 [00:15<00:00,  4.42it/s] 98%|█████████▊| 49/50 [00:15<00:00,  4.42it/s]100%|██████████| 50/50 [00:20<00:00,  1.61s/it]100%|██████████| 50/50 [00:20<00:00,  2.47it/s]
[I 2023-12-10 22:30:49,414] Trial 139 finished with value: 0.39409455538487803 and parameters: {'EMBEDDING_DIM': 1001, 'HIDDEN_DIM': 335, 'NUM_LAYERS': 1, 'DROPOUT': 0.289525124749113, 'LR': 0.00241900093095189, 'WEIGHT_0': 0.5001483773180577, 'WEIGHT_1': 0.8156691350848388, 'WEIGHT_2': 0.6923045977254495, 'WEIGHT_3': 0.7264941560058399, 'WEIGHT_4': 0.9127738550687544, 'WEIGHT_5': 0.5296085863499755, 'WEIGHT_6': 0.7574581404211271, 'WEIGHT_7': 0.5435719518376084, 'WEIGHT_8': 0.5352617270570261, 'optimizer': 'RMSprop'}. Best is trial 134 with value: 0.4158467115484205.
/userhome/cs2/dingruiw/conda/envs/py310/lib/python3.10/site-packages/torch/nn/modules/rnn.py:82: UserWarning: dropout option adds dropout after all but last recurrent layer, so non-zero dropout expects num_layers greater than 1, but got dropout=0.30792156133015314 and num_layers=1
  warnings.warn("dropout option adds dropout after all but last "
{'EMBEDDING_DIM': 1001, 'HIDDEN_DIM': 335, 'NUM_LAYERS': 1, 'DROPOUT': 0.289525124749113, 'LR': 0.00241900093095189, 'WEIGHT_0': 0.5001483773180577, 'WEIGHT_1': 0.8156691350848388, 'WEIGHT_2': 0.6923045977254495, 'WEIGHT_3': 0.7264941560058399, 'WEIGHT_4': 0.9127738550687544, 'WEIGHT_5': 0.5296085863499755, 'WEIGHT_6': 0.7574581404211271, 'WEIGHT_7': 0.5435719518376084, 'WEIGHT_8': 0.5352617270570261, 'optimizer': 'RMSprop'}
0
              precision    recall  f1-score   support

         LOC       0.21      0.14      0.17      1837
        MISC       0.07      0.02      0.04       922
         ORG       0.10      0.03      0.04      1341
         PER       0.08      0.02      0.03      1842

   micro avg       0.15      0.06      0.09      5942
   macro avg       0.11      0.05      0.07      5942
weighted avg       0.12      0.06      0.08      5942

{'EMBEDDING_DIM': 1001, 'HIDDEN_DIM': 335, 'NUM_LAYERS': 1, 'DROPOUT': 0.289525124749113, 'LR': 0.00241900093095189, 'WEIGHT_0': 0.5001483773180577, 'WEIGHT_1': 0.8156691350848388, 'WEIGHT_2': 0.6923045977254495, 'WEIGHT_3': 0.7264941560058399, 'WEIGHT_4': 0.9127738550687544, 'WEIGHT_5': 0.5296085863499755, 'WEIGHT_6': 0.7574581404211271, 'WEIGHT_7': 0.5435719518376084, 'WEIGHT_8': 0.5352617270570261, 'optimizer': 'RMSprop'}
49
              precision    recall  f1-score   support

         LOC       0.58      0.52      0.55      1837
        MISC       0.41      0.42      0.41       922
         ORG       0.28      0.26      0.27      1341
         PER       0.32      0.33      0.32      1842

   micro avg       0.40      0.39      0.39      5942
   macro avg       0.40      0.38      0.39      5942
weighted avg       0.40      0.39      0.40      5942

epoch 49
LSTM
  0%|          | 0/50 [00:00<?, ?it/s]  2%|▏         | 1/50 [00:03<03:13,  3.95s/it] 10%|█         | 5/50 [00:04<00:27,  1.64it/s] 16%|█▌        | 8/50 [00:04<00:14,  2.93it/s] 22%|██▏       | 11/50 [00:04<00:08,  4.44it/s] 28%|██▊       | 14/50 [00:04<00:05,  6.16it/s] 32%|███▏      | 16/50 [00:04<00:04,  7.45it/s] 36%|███▌      | 18/50 [00:04<00:03,  8.87it/s] 40%|████      | 20/50 [00:04<00:02, 10.37it/s] 44%|████▍     | 22/50 [00:04<00:02, 11.85it/s] 48%|████▊     | 24/50 [00:05<00:01, 13.23it/s] 52%|█████▏    | 26/50 [00:05<00:01, 14.44it/s] 56%|█████▌    | 28/50 [00:05<00:01, 15.42it/s] 60%|██████    | 30/50 [00:05<00:01, 16.22it/s] 64%|██████▍   | 32/50 [00:05<00:01, 16.82it/s] 68%|██████▊   | 34/50 [00:05<00:00, 17.25it/s] 72%|███████▏  | 36/50 [00:05<00:00, 17.57it/s] 76%|███████▌  | 38/50 [00:05<00:00, 17.84it/s] 80%|████████  | 40/50 [00:05<00:00, 17.99it/s] 84%|████████▍ | 42/50 [00:06<00:00, 18.12it/s] 88%|████████▊ | 44/50 [00:06<00:00, 18.20it/s] 92%|█████████▏| 46/50 [00:06<00:00, 18.28it/s] 96%|█████████▌| 48/50 [00:06<00:00, 18.32it/s]100%|██████████| 50/50 [00:10<00:00,  1.49it/s]100%|██████████| 50/50 [00:10<00:00,  4.73it/s]
[I 2023-12-10 22:31:03,606] Trial 140 finished with value: 0.3781200212426979 and parameters: {'EMBEDDING_DIM': 907, 'HIDDEN_DIM': 51, 'NUM_LAYERS': 1, 'DROPOUT': 0.30792156133015314, 'LR': 0.0022343172828380026, 'WEIGHT_0': 0.5170494541139878, 'WEIGHT_1': 0.8021815583791253, 'WEIGHT_2': 0.7600948551779722, 'WEIGHT_3': 0.9980249602114074, 'WEIGHT_4': 0.9378405896365325, 'WEIGHT_5': 0.5979252813828286, 'WEIGHT_6': 0.7999089141772191, 'WEIGHT_7': 0.46841012164834506, 'WEIGHT_8': 0.6397497014901896, 'optimizer': 'RMSprop'}. Best is trial 134 with value: 0.4158467115484205.
/userhome/cs2/dingruiw/conda/envs/py310/lib/python3.10/site-packages/torch/nn/modules/rnn.py:82: UserWarning: dropout option adds dropout after all but last recurrent layer, so non-zero dropout expects num_layers greater than 1, but got dropout=0.3433514586983081 and num_layers=1
  warnings.warn("dropout option adds dropout after all but last "
{'EMBEDDING_DIM': 907, 'HIDDEN_DIM': 51, 'NUM_LAYERS': 1, 'DROPOUT': 0.30792156133015314, 'LR': 0.0022343172828380026, 'WEIGHT_0': 0.5170494541139878, 'WEIGHT_1': 0.8021815583791253, 'WEIGHT_2': 0.7600948551779722, 'WEIGHT_3': 0.9980249602114074, 'WEIGHT_4': 0.9378405896365325, 'WEIGHT_5': 0.5979252813828286, 'WEIGHT_6': 0.7999089141772191, 'WEIGHT_7': 0.46841012164834506, 'WEIGHT_8': 0.6397497014901896, 'optimizer': 'RMSprop'}
0
              precision    recall  f1-score   support

         LOC       0.17      0.02      0.04      1837
        MISC       0.07      0.06      0.06       922
         ORG       0.11      0.04      0.05      1341
         PER       0.09      0.03      0.05      1842

   micro avg       0.09      0.03      0.05      5942
   macro avg       0.11      0.04      0.05      5942
weighted avg       0.12      0.03      0.05      5942

{'EMBEDDING_DIM': 907, 'HIDDEN_DIM': 51, 'NUM_LAYERS': 1, 'DROPOUT': 0.30792156133015314, 'LR': 0.0022343172828380026, 'WEIGHT_0': 0.5170494541139878, 'WEIGHT_1': 0.8021815583791253, 'WEIGHT_2': 0.7600948551779722, 'WEIGHT_3': 0.9980249602114074, 'WEIGHT_4': 0.9378405896365325, 'WEIGHT_5': 0.5979252813828286, 'WEIGHT_6': 0.7999089141772191, 'WEIGHT_7': 0.46841012164834506, 'WEIGHT_8': 0.6397497014901896, 'optimizer': 'RMSprop'}
49
              precision    recall  f1-score   support

         LOC       0.61      0.51      0.55      1837
        MISC       0.44      0.44      0.44       922
         ORG       0.28      0.24      0.26      1341
         PER       0.28      0.26      0.27      1842

   micro avg       0.40      0.36      0.38      5942
   macro avg       0.40      0.36      0.38      5942
weighted avg       0.41      0.36      0.38      5942

epoch 49
LSTM
  0%|          | 0/50 [00:00<?, ?it/s]  2%|▏         | 1/50 [00:04<03:47,  4.63s/it]  6%|▌         | 3/50 [00:04<01:01,  1.31s/it]  8%|▊         | 4/50 [00:05<00:41,  1.10it/s] 10%|█         | 5/50 [00:05<00:29,  1.51it/s] 12%|█▏        | 6/50 [00:05<00:22,  1.98it/s] 14%|█▍        | 7/50 [00:05<00:17,  2.52it/s] 16%|█▌        | 8/50 [00:05<00:13,  3.07it/s] 18%|█▊        | 9/50 [00:05<00:11,  3.61it/s] 20%|██        | 10/50 [00:06<00:09,  4.11it/s] 22%|██▏       | 11/50 [00:06<00:08,  4.55it/s] 24%|██▍       | 12/50 [00:06<00:07,  4.92it/s] 26%|██▌       | 13/50 [00:06<00:07,  5.21it/s] 28%|██▊       | 14/50 [00:06<00:06,  5.43it/s] 30%|███       | 15/50 [00:06<00:06,  5.61it/s] 32%|███▏      | 16/50 [00:07<00:05,  5.72it/s] 34%|███▍      | 17/50 [00:07<00:05,  5.82it/s] 36%|███▌      | 18/50 [00:07<00:05,  5.89it/s] 38%|███▊      | 19/50 [00:07<00:05,  5.92it/s] 40%|████      | 20/50 [00:07<00:05,  5.96it/s] 42%|████▏     | 21/50 [00:07<00:04,  5.98it/s] 44%|████▍     | 22/50 [00:08<00:04,  6.00it/s] 46%|████▌     | 23/50 [00:08<00:04,  6.01it/s] 48%|████▊     | 24/50 [00:08<00:04,  6.01it/s] 50%|█████     | 25/50 [00:08<00:04,  6.02it/s] 52%|█████▏    | 26/50 [00:08<00:03,  6.02it/s] 54%|█████▍    | 27/50 [00:08<00:03,  6.03it/s] 56%|█████▌    | 28/50 [00:09<00:03,  6.03it/s] 58%|█████▊    | 29/50 [00:09<00:03,  6.03it/s] 60%|██████    | 30/50 [00:09<00:03,  6.03it/s] 62%|██████▏   | 31/50 [00:09<00:03,  6.03it/s] 64%|██████▍   | 32/50 [00:09<00:02,  6.03it/s] 66%|██████▌   | 33/50 [00:09<00:02,  6.04it/s] 68%|██████▊   | 34/50 [00:10<00:02,  6.03it/s] 70%|███████   | 35/50 [00:10<00:02,  6.03it/s] 72%|███████▏  | 36/50 [00:10<00:02,  6.03it/s] 74%|███████▍  | 37/50 [00:10<00:02,  6.03it/s] 76%|███████▌  | 38/50 [00:10<00:01,  6.04it/s] 78%|███████▊  | 39/50 [00:10<00:01,  6.03it/s] 80%|████████  | 40/50 [00:11<00:01,  6.02it/s] 82%|████████▏ | 41/50 [00:11<00:01,  6.02it/s] 84%|████████▍ | 42/50 [00:11<00:01,  6.03it/s] 86%|████████▌ | 43/50 [00:11<00:01,  6.03it/s] 88%|████████▊ | 44/50 [00:11<00:00,  6.02it/s] 90%|█████████ | 45/50 [00:11<00:00,  6.02it/s] 92%|█████████▏| 46/50 [00:12<00:00,  6.02it/s] 94%|█████████▍| 47/50 [00:12<00:00,  6.02it/s] 96%|█████████▌| 48/50 [00:12<00:00,  6.02it/s] 98%|█████████▊| 49/50 [00:12<00:00,  6.02it/s]100%|██████████| 50/50 [00:17<00:00,  1.52s/it]100%|██████████| 50/50 [00:17<00:00,  2.91it/s]
