[I 2023-12-10 23:55:57,832] Trial 313 finished with value: 0.3551649809318521 and parameters: {'EMBEDDING_DIM': 449, 'HIDDEN_DIM': 123, 'NUM_LAYERS': 1, 'DROPOUT': 0.2174831319155462, 'LR': 0.0008542751518112685, 'WEIGHT_0': 0.3938871901876078, 'WEIGHT_1': 0.7325524655765743, 'WEIGHT_2': 0.5919251033636053, 'WEIGHT_3': 0.24056606604827924, 'WEIGHT_4': 0.9191975143817919, 'WEIGHT_5': 0.5185742391204805, 'WEIGHT_6': 0.941406597105725, 'WEIGHT_7': 0.39883970486897213, 'WEIGHT_8': 0.532741172285585, 'optimizer': 'RMSprop'}. Best is trial 221 with value: 0.418736930154747.
/userhome/cs2/dingruiw/conda/envs/py310/lib/python3.10/site-packages/torch/nn/modules/rnn.py:82: UserWarning: dropout option adds dropout after all but last recurrent layer, so non-zero dropout expects num_layers greater than 1, but got dropout=0.15137195425204925 and num_layers=1
  warnings.warn("dropout option adds dropout after all but last "
{'EMBEDDING_DIM': 449, 'HIDDEN_DIM': 123, 'NUM_LAYERS': 1, 'DROPOUT': 0.2174831319155462, 'LR': 0.0008542751518112685, 'WEIGHT_0': 0.3938871901876078, 'WEIGHT_1': 0.7325524655765743, 'WEIGHT_2': 0.5919251033636053, 'WEIGHT_3': 0.24056606604827924, 'WEIGHT_4': 0.9191975143817919, 'WEIGHT_5': 0.5185742391204805, 'WEIGHT_6': 0.941406597105725, 'WEIGHT_7': 0.39883970486897213, 'WEIGHT_8': 0.532741172285585, 'optimizer': 'RMSprop'}
0
              precision    recall  f1-score   support

         LOC       0.07      0.05      0.06      1837
        MISC       0.03      0.02      0.03       922
         ORG       0.07      0.02      0.04      1341
         PER       0.06      0.03      0.04      1842

   micro avg       0.06      0.03      0.04      5942
   macro avg       0.06      0.03      0.04      5942
weighted avg       0.06      0.03      0.04      5942

{'EMBEDDING_DIM': 449, 'HIDDEN_DIM': 123, 'NUM_LAYERS': 1, 'DROPOUT': 0.2174831319155462, 'LR': 0.0008542751518112685, 'WEIGHT_0': 0.3938871901876078, 'WEIGHT_1': 0.7325524655765743, 'WEIGHT_2': 0.5919251033636053, 'WEIGHT_3': 0.24056606604827924, 'WEIGHT_4': 0.9191975143817919, 'WEIGHT_5': 0.5185742391204805, 'WEIGHT_6': 0.941406597105725, 'WEIGHT_7': 0.39883970486897213, 'WEIGHT_8': 0.532741172285585, 'optimizer': 'RMSprop'}
49
              precision    recall  f1-score   support

         LOC       0.50      0.50      0.50      1837
        MISC       0.41      0.39      0.40       922
         ORG       0.20      0.23      0.21      1341
         PER       0.29      0.30      0.30      1842

   micro avg       0.35      0.36      0.36      5942
   macro avg       0.35      0.35      0.35      5942
weighted avg       0.35      0.36      0.36      5942

epoch 49
LSTM
  0%|          | 0/50 [00:00<?, ?it/s]  2%|▏         | 1/50 [00:04<03:51,  4.72s/it]  4%|▍         | 2/50 [00:04<01:38,  2.04s/it]  6%|▌         | 3/50 [00:05<00:59,  1.26s/it]  8%|▊         | 4/50 [00:05<00:40,  1.12it/s] 10%|█         | 5/50 [00:05<00:30,  1.46it/s] 12%|█▏        | 6/50 [00:06<00:24,  1.78it/s] 14%|█▍        | 7/50 [00:06<00:20,  2.06it/s] 16%|█▌        | 8/50 [00:06<00:18,  2.30it/s] 18%|█▊        | 9/50 [00:07<00:16,  2.50it/s] 20%|██        | 10/50 [00:07<00:15,  2.65it/s] 22%|██▏       | 11/50 [00:07<00:14,  2.77it/s] 24%|██▍       | 12/50 [00:08<00:13,  2.87it/s] 26%|██▌       | 13/50 [00:08<00:12,  2.92it/s] 28%|██▊       | 14/50 [00:08<00:12,  2.97it/s] 30%|███       | 15/50 [00:09<00:11,  3.03it/s] 32%|███▏      | 16/50 [00:09<00:11,  3.02it/s] 34%|███▍      | 17/50 [00:09<00:10,  3.04it/s] 36%|███▌      | 18/50 [00:10<00:10,  3.06it/s] 38%|███▊      | 19/50 [00:10<00:10,  3.07it/s] 40%|████      | 20/50 [00:10<00:09,  3.08it/s] 42%|████▏     | 21/50 [00:11<00:09,  3.10it/s] 44%|████▍     | 22/50 [00:11<00:09,  3.11it/s] 46%|████▌     | 23/50 [00:11<00:08,  3.11it/s] 48%|████▊     | 24/50 [00:12<00:08,  3.11it/s] 50%|█████     | 25/50 [00:12<00:08,  3.09it/s] 52%|█████▏    | 26/50 [00:12<00:07,  3.10it/s] 54%|█████▍    | 27/50 [00:12<00:07,  3.10it/s] 56%|█████▌    | 28/50 [00:13<00:07,  3.10it/s] 58%|█████▊    | 29/50 [00:13<00:06,  3.10it/s] 60%|██████    | 30/50 [00:13<00:06,  3.10it/s] 62%|██████▏   | 31/50 [00:14<00:06,  3.09it/s] 64%|██████▍   | 32/50 [00:14<00:05,  3.08it/s] 66%|██████▌   | 33/50 [00:14<00:05,  3.08it/s] 68%|██████▊   | 34/50 [00:15<00:05,  3.08it/s] 70%|███████   | 35/50 [00:15<00:04,  3.08it/s] 72%|███████▏  | 36/50 [00:15<00:04,  3.08it/s] 74%|███████▍  | 37/50 [00:16<00:04,  3.07it/s] 76%|███████▌  | 38/50 [00:16<00:03,  3.09it/s] 78%|███████▊  | 39/50 [00:16<00:03,  3.07it/s] 80%|████████  | 40/50 [00:17<00:03,  3.08it/s] 82%|████████▏ | 41/50 [00:17<00:02,  3.08it/s] 84%|████████▍ | 42/50 [00:17<00:02,  3.07it/s] 86%|████████▌ | 43/50 [00:18<00:02,  3.07it/s] 88%|████████▊ | 44/50 [00:18<00:01,  3.07it/s] 90%|█████████ | 45/50 [00:18<00:01,  3.06it/s] 92%|█████████▏| 46/50 [00:19<00:01,  3.06it/s] 94%|█████████▍| 47/50 [00:19<00:00,  3.07it/s] 96%|█████████▌| 48/50 [00:19<00:00,  3.07it/s] 98%|█████████▊| 49/50 [00:20<00:00,  3.08it/s]100%|██████████| 50/50 [00:24<00:00,  1.68s/it]100%|██████████| 50/50 [00:24<00:00,  2.00it/s]
[I 2023-12-10 23:56:26,930] Trial 314 finished with value: 0.36296715741789354 and parameters: {'EMBEDDING_DIM': 946, 'HIDDEN_DIM': 491, 'NUM_LAYERS': 1, 'DROPOUT': 0.15137195425204925, 'LR': 0.0030659349691044614, 'WEIGHT_0': 0.46282323415972054, 'WEIGHT_1': 0.5267162567293054, 'WEIGHT_2': 0.7352615521899819, 'WEIGHT_3': 0.9996884589742685, 'WEIGHT_4': 0.54064123912686, 'WEIGHT_5': 0.45866955707497403, 'WEIGHT_6': 0.7933530700922309, 'WEIGHT_7': 0.44516541317058067, 'WEIGHT_8': 0.3893026786745819, 'optimizer': 'RMSprop'}. Best is trial 221 with value: 0.418736930154747.
/userhome/cs2/dingruiw/conda/envs/py310/lib/python3.10/site-packages/torch/nn/modules/rnn.py:82: UserWarning: dropout option adds dropout after all but last recurrent layer, so non-zero dropout expects num_layers greater than 1, but got dropout=0.3583356755621767 and num_layers=1
  warnings.warn("dropout option adds dropout after all but last "
{'EMBEDDING_DIM': 946, 'HIDDEN_DIM': 491, 'NUM_LAYERS': 1, 'DROPOUT': 0.15137195425204925, 'LR': 0.0030659349691044614, 'WEIGHT_0': 0.46282323415972054, 'WEIGHT_1': 0.5267162567293054, 'WEIGHT_2': 0.7352615521899819, 'WEIGHT_3': 0.9996884589742685, 'WEIGHT_4': 0.54064123912686, 'WEIGHT_5': 0.45866955707497403, 'WEIGHT_6': 0.7933530700922309, 'WEIGHT_7': 0.44516541317058067, 'WEIGHT_8': 0.3893026786745819, 'optimizer': 'RMSprop'}
0
              precision    recall  f1-score   support

         LOC       0.08      0.04      0.06      1837
        MISC       0.01      0.08      0.02       922
         ORG       0.04      0.01      0.02      1341
         PER       0.01      0.03      0.01      1842

   micro avg       0.02      0.04      0.02      5942
   macro avg       0.04      0.04      0.03      5942
weighted avg       0.04      0.04      0.03      5942

{'EMBEDDING_DIM': 946, 'HIDDEN_DIM': 491, 'NUM_LAYERS': 1, 'DROPOUT': 0.15137195425204925, 'LR': 0.0030659349691044614, 'WEIGHT_0': 0.46282323415972054, 'WEIGHT_1': 0.5267162567293054, 'WEIGHT_2': 0.7352615521899819, 'WEIGHT_3': 0.9996884589742685, 'WEIGHT_4': 0.54064123912686, 'WEIGHT_5': 0.45866955707497403, 'WEIGHT_6': 0.7933530700922309, 'WEIGHT_7': 0.44516541317058067, 'WEIGHT_8': 0.3893026786745819, 'optimizer': 'RMSprop'}
49
              precision    recall  f1-score   support

         LOC       0.66      0.50      0.57      1837
        MISC       0.43      0.37      0.40       922
         ORG       0.28      0.21      0.24      1341
         PER       0.26      0.20      0.23      1842

   micro avg       0.41      0.32      0.36      5942
   macro avg       0.41      0.32      0.36      5942
weighted avg       0.41      0.32      0.36      5942

epoch 49
LSTM
  0%|          | 0/50 [00:00<?, ?it/s]  2%|▏         | 1/50 [00:04<03:39,  4.49s/it]  4%|▍         | 2/50 [00:04<01:31,  1.91s/it]  6%|▌         | 3/50 [00:04<00:53,  1.13s/it]  8%|▊         | 4/50 [00:04<00:34,  1.32it/s] 10%|█         | 5/50 [00:05<00:24,  1.80it/s] 12%|█▏        | 6/50 [00:05<00:18,  2.32it/s] 14%|█▍        | 7/50 [00:05<00:15,  2.84it/s] 16%|█▌        | 8/50 [00:05<00:12,  3.32it/s] 18%|█▊        | 9/50 [00:05<00:10,  3.75it/s] 20%|██        | 10/50 [00:06<00:09,  4.11it/s] 22%|██▏       | 11/50 [00:06<00:08,  4.40it/s] 24%|██▍       | 12/50 [00:06<00:08,  4.62it/s] 26%|██▌       | 13/50 [00:06<00:07,  4.79it/s] 28%|██▊       | 14/50 [00:06<00:07,  4.92it/s] 30%|███       | 15/50 [00:07<00:06,  5.01it/s] 32%|███▏      | 16/50 [00:07<00:06,  5.07it/s] 34%|███▍      | 17/50 [00:07<00:06,  5.12it/s] 36%|███▌      | 18/50 [00:07<00:06,  5.15it/s] 38%|███▊      | 19/50 [00:07<00:05,  5.18it/s] 40%|████      | 20/50 [00:08<00:05,  5.19it/s] 42%|████▏     | 21/50 [00:08<00:05,  5.21it/s] 44%|████▍     | 22/50 [00:08<00:05,  5.21it/s] 46%|████▌     | 23/50 [00:08<00:05,  5.21it/s] 48%|████▊     | 24/50 [00:08<00:04,  5.22it/s] 50%|█████     | 25/50 [00:09<00:04,  5.22it/s] 52%|█████▏    | 26/50 [00:09<00:04,  5.22it/s] 54%|█████▍    | 27/50 [00:09<00:04,  5.23it/s] 56%|█████▌    | 28/50 [00:09<00:04,  5.23it/s] 58%|█████▊    | 29/50 [00:09<00:04,  5.23it/s] 60%|██████    | 30/50 [00:09<00:03,  5.22it/s] 62%|██████▏   | 31/50 [00:10<00:03,  5.23it/s] 64%|██████▍   | 32/50 [00:10<00:03,  5.22it/s] 66%|██████▌   | 33/50 [00:10<00:03,  5.23it/s] 68%|██████▊   | 34/50 [00:10<00:03,  5.22it/s] 70%|███████   | 35/50 [00:10<00:02,  5.23it/s] 72%|███████▏  | 36/50 [00:11<00:02,  5.22it/s] 74%|███████▍  | 37/50 [00:11<00:02,  5.22it/s] 76%|███████▌  | 38/50 [00:11<00:02,  5.23it/s] 78%|███████▊  | 39/50 [00:11<00:02,  5.22it/s] 80%|████████  | 40/50 [00:11<00:01,  5.23it/s] 82%|████████▏ | 41/50 [00:12<00:01,  5.23it/s] 84%|████████▍ | 42/50 [00:12<00:01,  5.23it/s] 86%|████████▌ | 43/50 [00:12<00:01,  5.22it/s] 88%|████████▊ | 44/50 [00:12<00:01,  5.22it/s] 90%|█████████ | 45/50 [00:12<00:00,  5.22it/s] 92%|█████████▏| 46/50 [00:13<00:00,  5.22it/s] 94%|█████████▍| 47/50 [00:13<00:00,  5.22it/s] 96%|█████████▌| 48/50 [00:13<00:00,  5.22it/s] 98%|█████████▊| 49/50 [00:13<00:00,  5.22it/s]100%|██████████| 50/50 [00:18<00:00,  1.57s/it]100%|██████████| 50/50 [00:18<00:00,  2.72it/s]
[I 2023-12-10 23:56:49,521] Trial 315 finished with value: 0.4134049186006235 and parameters: {'EMBEDDING_DIM': 1004, 'HIDDEN_DIM': 277, 'NUM_LAYERS': 1, 'DROPOUT': 0.3583356755621767, 'LR': 0.0011638997053664568, 'WEIGHT_0': 0.4923133797377865, 'WEIGHT_1': 0.8024956689275063, 'WEIGHT_2': 0.6341920698546313, 'WEIGHT_3': 0.9767817016611503, 'WEIGHT_4': 0.9756432051292632, 'WEIGHT_5': 0.7182336048637349, 'WEIGHT_6': 0.5561726036577751, 'WEIGHT_7': 0.5738514959080453, 'WEIGHT_8': 0.5074291504594967, 'optimizer': 'RMSprop'}. Best is trial 221 with value: 0.418736930154747.
/userhome/cs2/dingruiw/conda/envs/py310/lib/python3.10/site-packages/torch/nn/modules/rnn.py:82: UserWarning: dropout option adds dropout after all but last recurrent layer, so non-zero dropout expects num_layers greater than 1, but got dropout=0.35652379386157473 and num_layers=1
  warnings.warn("dropout option adds dropout after all but last "
{'EMBEDDING_DIM': 1004, 'HIDDEN_DIM': 277, 'NUM_LAYERS': 1, 'DROPOUT': 0.3583356755621767, 'LR': 0.0011638997053664568, 'WEIGHT_0': 0.4923133797377865, 'WEIGHT_1': 0.8024956689275063, 'WEIGHT_2': 0.6341920698546313, 'WEIGHT_3': 0.9767817016611503, 'WEIGHT_4': 0.9756432051292632, 'WEIGHT_5': 0.7182336048637349, 'WEIGHT_6': 0.5561726036577751, 'WEIGHT_7': 0.5738514959080453, 'WEIGHT_8': 0.5074291504594967, 'optimizer': 'RMSprop'}
0
              precision    recall  f1-score   support

         LOC       0.42      0.07      0.12      1837
        MISC       0.06      0.03      0.04       922
         ORG       0.15      0.04      0.06      1341
         PER       0.06      0.04      0.05      1842

   micro avg       0.12      0.05      0.07      5942
   macro avg       0.17      0.04      0.07      5942
weighted avg       0.19      0.05      0.07      5942

{'EMBEDDING_DIM': 1004, 'HIDDEN_DIM': 277, 'NUM_LAYERS': 1, 'DROPOUT': 0.3583356755621767, 'LR': 0.0011638997053664568, 'WEIGHT_0': 0.4923133797377865, 'WEIGHT_1': 0.8024956689275063, 'WEIGHT_2': 0.6341920698546313, 'WEIGHT_3': 0.9767817016611503, 'WEIGHT_4': 0.9756432051292632, 'WEIGHT_5': 0.7182336048637349, 'WEIGHT_6': 0.5561726036577751, 'WEIGHT_7': 0.5738514959080453, 'WEIGHT_8': 0.5074291504594967, 'optimizer': 'RMSprop'}
49
              precision    recall  f1-score   support

         LOC       0.59      0.53      0.56      1837
        MISC       0.48      0.45      0.46       922
         ORG       0.32      0.25      0.28      1341
         PER       0.32      0.36      0.34      1842

   micro avg       0.43      0.40      0.41      5942
   macro avg       0.43      0.40      0.41      5942
weighted avg       0.43      0.40      0.41      5942

epoch 49
LSTM
  0%|          | 0/50 [00:00<?, ?it/s]  2%|▏         | 1/50 [00:04<03:52,  4.74s/it]  4%|▍         | 2/50 [00:04<01:36,  2.02s/it]  6%|▌         | 3/50 [00:05<00:56,  1.19s/it]  8%|▊         | 4/50 [00:05<00:36,  1.24it/s] 10%|█         | 5/50 [00:05<00:26,  1.70it/s] 12%|█▏        | 6/50 [00:05<00:20,  2.18it/s] 14%|█▍        | 7/50 [00:05<00:16,  2.65it/s] 16%|█▌        | 8/50 [00:06<00:13,  3.10it/s] 18%|█▊        | 9/50 [00:06<00:11,  3.49it/s] 20%|██        | 10/50 [00:06<00:10,  3.81it/s] 22%|██▏       | 11/50 [00:06<00:09,  4.08it/s] 24%|██▍       | 12/50 [00:06<00:08,  4.28it/s] 26%|██▌       | 13/50 [00:07<00:08,  4.43it/s] 28%|██▊       | 14/50 [00:07<00:07,  4.54it/s] 30%|███       | 15/50 [00:07<00:07,  4.63it/s] 32%|███▏      | 16/50 [00:07<00:07,  4.69it/s] 34%|███▍      | 17/50 [00:07<00:06,  4.72it/s] 36%|███▌      | 18/50 [00:08<00:06,  4.76it/s] 38%|███▊      | 19/50 [00:08<00:06,  4.78it/s] 40%|████      | 20/50 [00:08<00:06,  4.79it/s] 42%|████▏     | 21/50 [00:08<00:06,  4.80it/s] 44%|████▍     | 22/50 [00:09<00:05,  4.80it/s] 46%|████▌     | 23/50 [00:09<00:05,  4.80it/s] 48%|████▊     | 24/50 [00:09<00:05,  4.81it/s] 50%|█████     | 25/50 [00:09<00:05,  4.81it/s] 52%|█████▏    | 26/50 [00:09<00:04,  4.80it/s] 54%|█████▍    | 27/50 [00:10<00:04,  4.80it/s] 56%|█████▌    | 28/50 [00:10<00:04,  4.81it/s] 58%|█████▊    | 29/50 [00:10<00:04,  4.81it/s] 60%|██████    | 30/50 [00:10<00:04,  4.80it/s] 62%|██████▏   | 31/50 [00:10<00:03,  4.80it/s] 64%|██████▍   | 32/50 [00:11<00:03,  4.80it/s] 66%|██████▌   | 33/50 [00:11<00:03,  4.80it/s] 68%|██████▊   | 34/50 [00:11<00:03,  4.79it/s] 70%|███████   | 35/50 [00:11<00:03,  4.80it/s] 72%|███████▏  | 36/50 [00:11<00:02,  4.80it/s] 74%|███████▍  | 37/50 [00:12<00:02,  4.80it/s] 76%|███████▌  | 38/50 [00:12<00:02,  4.79it/s] 78%|███████▊  | 39/50 [00:12<00:02,  4.79it/s] 80%|████████  | 40/50 [00:12<00:02,  4.79it/s] 82%|████████▏ | 41/50 [00:12<00:01,  4.78it/s] 84%|████████▍ | 42/50 [00:13<00:01,  4.78it/s] 86%|████████▌ | 43/50 [00:13<00:01,  4.78it/s] 88%|████████▊ | 44/50 [00:13<00:01,  4.77it/s] 90%|█████████ | 45/50 [00:13<00:01,  4.78it/s] 92%|█████████▏| 46/50 [00:14<00:00,  4.78it/s] 94%|█████████▍| 47/50 [00:14<00:00,  4.78it/s] 96%|█████████▌| 48/50 [00:14<00:00,  4.78it/s] 98%|█████████▊| 49/50 [00:14<00:00,  4.78it/s]100%|██████████| 50/50 [00:19<00:00,  1.60s/it]100%|██████████| 50/50 [00:19<00:00,  2.57it/s]
[I 2023-12-10 23:57:13,258] Trial 316 finished with value: 0.4087800759814268 and parameters: {'EMBEDDING_DIM': 1008, 'HIDDEN_DIM': 293, 'NUM_LAYERS': 1, 'DROPOUT': 0.35652379386157473, 'LR': 0.0011557495827670462, 'WEIGHT_0': 0.3512507272708864, 'WEIGHT_1': 0.7930033967777798, 'WEIGHT_2': 0.6339256848085227, 'WEIGHT_3': 0.8396861178391313, 'WEIGHT_4': 0.9838315855917814, 'WEIGHT_5': 0.7670003187940378, 'WEIGHT_6': 0.5542419855916078, 'WEIGHT_7': 0.685977136927404, 'WEIGHT_8': 0.4934021777745767, 'optimizer': 'Adam'}. Best is trial 221 with value: 0.418736930154747.
/userhome/cs2/dingruiw/conda/envs/py310/lib/python3.10/site-packages/torch/nn/modules/rnn.py:82: UserWarning: dropout option adds dropout after all but last recurrent layer, so non-zero dropout expects num_layers greater than 1, but got dropout=0.3596417301219964 and num_layers=1
  warnings.warn("dropout option adds dropout after all but last "
{'EMBEDDING_DIM': 1008, 'HIDDEN_DIM': 293, 'NUM_LAYERS': 1, 'DROPOUT': 0.35652379386157473, 'LR': 0.0011557495827670462, 'WEIGHT_0': 0.3512507272708864, 'WEIGHT_1': 0.7930033967777798, 'WEIGHT_2': 0.6339256848085227, 'WEIGHT_3': 0.8396861178391313, 'WEIGHT_4': 0.9838315855917814, 'WEIGHT_5': 0.7670003187940378, 'WEIGHT_6': 0.5542419855916078, 'WEIGHT_7': 0.685977136927404, 'WEIGHT_8': 0.4934021777745767, 'optimizer': 'Adam'}
0
              precision    recall  f1-score   support

         LOC       0.04      0.10      0.05      1837
        MISC       0.02      0.08      0.04       922
         ORG       0.04      0.10      0.05      1341
         PER       0.02      0.06      0.03      1842

   micro avg       0.03      0.09      0.04      5942
   macro avg       0.03      0.09      0.04      5942
weighted avg       0.03      0.09      0.04      5942

{'EMBEDDING_DIM': 1008, 'HIDDEN_DIM': 293, 'NUM_LAYERS': 1, 'DROPOUT': 0.35652379386157473, 'LR': 0.0011557495827670462, 'WEIGHT_0': 0.3512507272708864, 'WEIGHT_1': 0.7930033967777798, 'WEIGHT_2': 0.6339256848085227, 'WEIGHT_3': 0.8396861178391313, 'WEIGHT_4': 0.9838315855917814, 'WEIGHT_5': 0.7670003187940378, 'WEIGHT_6': 0.5542419855916078, 'WEIGHT_7': 0.685977136927404, 'WEIGHT_8': 0.4934021777745767, 'optimizer': 'Adam'}
49
              precision    recall  f1-score   support

         LOC       0.53      0.54      0.54      1837
        MISC       0.45      0.43      0.44       922
         ORG       0.31      0.27      0.29      1341
         PER       0.34      0.36      0.35      1842

   micro avg       0.41      0.41      0.41      5942
   macro avg       0.41      0.40      0.40      5942
weighted avg       0.41      0.41      0.41      5942

epoch 49
LSTM
  0%|          | 0/50 [00:00<?, ?it/s]  2%|▏         | 1/50 [00:04<03:50,  4.70s/it]  4%|▍         | 2/50 [00:04<01:36,  2.01s/it]  6%|▌         | 3/50 [00:05<00:56,  1.19s/it]  8%|▊         | 4/50 [00:05<00:37,  1.24it/s] 10%|█         | 5/50 [00:05<00:26,  1.69it/s] 12%|█▏        | 6/50 [00:05<00:20,  2.17it/s] 14%|█▍        | 7/50 [00:05<00:16,  2.64it/s] 16%|█▌        | 8/50 [00:06<00:13,  3.07it/s] 18%|█▊        | 9/50 [00:06<00:11,  3.45it/s] 20%|██        | 10/50 [00:06<00:10,  3.77it/s] 22%|██▏       | 11/50 [00:06<00:09,  4.03it/s] 24%|██▍       | 12/50 [00:06<00:09,  4.22it/s] 26%|██▌       | 13/50 [00:07<00:08,  4.37it/s] 28%|██▊       | 14/50 [00:07<00:08,  4.48it/s] 30%|███       | 15/50 [00:07<00:07,  4.55it/s] 32%|███▏      | 16/50 [00:07<00:07,  4.61it/s] 34%|███▍      | 17/50 [00:07<00:07,  4.65it/s] 36%|███▌      | 18/50 [00:08<00:06,  4.67it/s] 38%|███▊      | 19/50 [00:08<00:06,  4.70it/s] 40%|████      | 20/50 [00:08<00:06,  4.70it/s] 42%|████▏     | 21/50 [00:08<00:06,  4.72it/s] 44%|████▍     | 22/50 [00:09<00:05,  4.73it/s] 46%|████▌     | 23/50 [00:09<00:05,  4.72it/s] 48%|████▊     | 24/50 [00:09<00:05,  4.73it/s] 50%|█████     | 25/50 [00:09<00:05,  4.73it/s] 52%|█████▏    | 26/50 [00:09<00:05,  4.73it/s] 54%|█████▍    | 27/50 [00:10<00:04,  4.73it/s] 56%|█████▌    | 28/50 [00:10<00:04,  4.73it/s] 58%|█████▊    | 29/50 [00:10<00:04,  4.73it/s] 60%|██████    | 30/50 [00:10<00:04,  4.72it/s] 62%|██████▏   | 31/50 [00:10<00:04,  4.73it/s] 64%|██████▍   | 32/50 [00:11<00:03,  4.72it/s] 66%|██████▌   | 33/50 [00:11<00:03,  4.73it/s] 68%|██████▊   | 34/50 [00:11<00:03,  4.73it/s] 70%|███████   | 35/50 [00:11<00:03,  4.73it/s] 72%|███████▏  | 36/50 [00:12<00:02,  4.72it/s] 74%|███████▍  | 37/50 [00:12<00:02,  4.72it/s] 76%|███████▌  | 38/50 [00:12<00:02,  4.72it/s] 78%|███████▊  | 39/50 [00:12<00:02,  4.72it/s] 80%|████████  | 40/50 [00:12<00:02,  4.72it/s] 82%|████████▏ | 41/50 [00:13<00:01,  4.72it/s] 84%|████████▍ | 42/50 [00:13<00:01,  4.72it/s] 86%|████████▌ | 43/50 [00:13<00:01,  4.72it/s] 88%|████████▊ | 44/50 [00:13<00:01,  4.72it/s] 90%|█████████ | 45/50 [00:13<00:01,  4.72it/s] 92%|█████████▏| 46/50 [00:14<00:00,  4.71it/s] 94%|█████████▍| 47/50 [00:14<00:00,  4.72it/s] 96%|█████████▌| 48/50 [00:14<00:00,  4.71it/s] 98%|█████████▊| 49/50 [00:14<00:00,  4.71it/s]100%|██████████| 50/50 [00:19<00:00,  1.57s/it]100%|██████████| 50/50 [00:19<00:00,  2.56it/s]
