[I 2023-12-11 00:30:02,980] Trial 389 finished with value: 0.3885590030944217 and parameters: {'EMBEDDING_DIM': 919, 'HIDDEN_DIM': 89, 'NUM_LAYERS': 1, 'DROPOUT': 0.052467791801162775, 'LR': 0.004283223445554471, 'WEIGHT_0': 0.2524978638483799, 'WEIGHT_1': 0.6474446788303388, 'WEIGHT_2': 0.4325979609603365, 'WEIGHT_3': 0.26747812401577314, 'WEIGHT_4': 0.7966424906715012, 'WEIGHT_5': 0.6556446290579021, 'WEIGHT_6': 0.11757905036258243, 'WEIGHT_7': 0.13098583823165494, 'WEIGHT_8': 0.39868636176709843, 'optimizer': 'RMSprop'}. Best is trial 365 with value: 0.41910947782240837.
/userhome/cs2/dingruiw/conda/envs/py310/lib/python3.10/site-packages/torch/nn/modules/rnn.py:82: UserWarning: dropout option adds dropout after all but last recurrent layer, so non-zero dropout expects num_layers greater than 1, but got dropout=0.03134270059357931 and num_layers=1
  warnings.warn("dropout option adds dropout after all but last "
{'EMBEDDING_DIM': 919, 'HIDDEN_DIM': 89, 'NUM_LAYERS': 1, 'DROPOUT': 0.052467791801162775, 'LR': 0.004283223445554471, 'WEIGHT_0': 0.2524978638483799, 'WEIGHT_1': 0.6474446788303388, 'WEIGHT_2': 0.4325979609603365, 'WEIGHT_3': 0.26747812401577314, 'WEIGHT_4': 0.7966424906715012, 'WEIGHT_5': 0.6556446290579021, 'WEIGHT_6': 0.11757905036258243, 'WEIGHT_7': 0.13098583823165494, 'WEIGHT_8': 0.39868636176709843, 'optimizer': 'RMSprop'}
0
              precision    recall  f1-score   support

         LOC       0.49      0.20      0.28      1837
        MISC       0.05      0.02      0.03       922
         ORG       0.19      0.05      0.08      1341
         PER       0.12      0.01      0.03      1842

   micro avg       0.28      0.08      0.13      5942
   macro avg       0.21      0.07      0.10      5942
weighted avg       0.24      0.08      0.12      5942

{'EMBEDDING_DIM': 919, 'HIDDEN_DIM': 89, 'NUM_LAYERS': 1, 'DROPOUT': 0.052467791801162775, 'LR': 0.004283223445554471, 'WEIGHT_0': 0.2524978638483799, 'WEIGHT_1': 0.6474446788303388, 'WEIGHT_2': 0.4325979609603365, 'WEIGHT_3': 0.26747812401577314, 'WEIGHT_4': 0.7966424906715012, 'WEIGHT_5': 0.6556446290579021, 'WEIGHT_6': 0.11757905036258243, 'WEIGHT_7': 0.13098583823165494, 'WEIGHT_8': 0.39868636176709843, 'optimizer': 'RMSprop'}
49
              precision    recall  f1-score   support

         LOC       0.51      0.54      0.53      1837
        MISC       0.45      0.47      0.46       922
         ORG       0.26      0.27      0.26      1341
         PER       0.31      0.29      0.30      1842

   micro avg       0.39      0.39      0.39      5942
   macro avg       0.38      0.39      0.39      5942
weighted avg       0.38      0.39      0.39      5942

epoch 49
LSTM
  0%|          | 0/50 [00:00<?, ?it/s]  2%|▏         | 1/50 [00:04<03:46,  4.63s/it]  4%|▍         | 2/50 [00:04<01:34,  1.97s/it]  6%|▌         | 3/50 [00:04<00:54,  1.16s/it]  8%|▊         | 4/50 [00:05<00:35,  1.28it/s] 10%|█         | 5/50 [00:05<00:25,  1.76it/s] 12%|█▏        | 6/50 [00:05<00:19,  2.27it/s] 14%|█▍        | 7/50 [00:05<00:15,  2.79it/s] 16%|█▌        | 8/50 [00:05<00:12,  3.28it/s] 18%|█▊        | 9/50 [00:06<00:11,  3.71it/s] 20%|██        | 10/50 [00:06<00:09,  4.08it/s] 22%|██▏       | 11/50 [00:06<00:08,  4.37it/s] 24%|██▍       | 12/50 [00:06<00:08,  4.60it/s] 26%|██▌       | 13/50 [00:06<00:07,  4.78it/s] 28%|██▊       | 14/50 [00:07<00:07,  4.91it/s] 30%|███       | 15/50 [00:07<00:06,  5.00it/s] 32%|███▏      | 16/50 [00:07<00:06,  5.07it/s] 34%|███▍      | 17/50 [00:07<00:06,  5.11it/s] 36%|███▌      | 18/50 [00:07<00:06,  5.15it/s] 38%|███▊      | 19/50 [00:08<00:05,  5.17it/s] 40%|████      | 20/50 [00:08<00:05,  5.18it/s] 42%|████▏     | 21/50 [00:08<00:05,  5.19it/s] 44%|████▍     | 22/50 [00:08<00:05,  5.21it/s] 46%|████▌     | 23/50 [00:08<00:05,  5.22it/s] 48%|████▊     | 24/50 [00:08<00:04,  5.22it/s] 50%|█████     | 25/50 [00:09<00:04,  5.23it/s] 52%|█████▏    | 26/50 [00:09<00:04,  5.22it/s] 54%|█████▍    | 27/50 [00:09<00:04,  5.22it/s] 56%|█████▌    | 28/50 [00:09<00:04,  5.22it/s] 58%|█████▊    | 29/50 [00:09<00:04,  5.22it/s] 60%|██████    | 30/50 [00:10<00:03,  5.22it/s] 62%|██████▏   | 31/50 [00:10<00:03,  5.22it/s] 64%|██████▍   | 32/50 [00:10<00:03,  5.22it/s] 66%|██████▌   | 33/50 [00:10<00:03,  5.22it/s] 68%|██████▊   | 34/50 [00:10<00:03,  5.22it/s] 70%|███████   | 35/50 [00:11<00:02,  5.21it/s] 72%|███████▏  | 36/50 [00:11<00:02,  5.22it/s] 74%|███████▍  | 37/50 [00:11<00:02,  5.22it/s] 76%|███████▌  | 38/50 [00:11<00:02,  5.22it/s] 78%|███████▊  | 39/50 [00:11<00:02,  5.22it/s] 80%|████████  | 40/50 [00:12<00:01,  5.21it/s] 82%|████████▏ | 41/50 [00:12<00:01,  5.21it/s] 84%|████████▍ | 42/50 [00:12<00:01,  5.21it/s] 86%|████████▌ | 43/50 [00:12<00:01,  5.22it/s] 88%|████████▊ | 44/50 [00:12<00:01,  5.22it/s] 90%|█████████ | 45/50 [00:12<00:00,  5.22it/s] 92%|█████████▏| 46/50 [00:13<00:00,  5.20it/s] 94%|█████████▍| 47/50 [00:13<00:00,  5.22it/s] 96%|█████████▌| 48/50 [00:13<00:00,  5.22it/s] 98%|█████████▊| 49/50 [00:13<00:00,  5.22it/s]100%|██████████| 50/50 [00:18<00:00,  1.56s/it]100%|██████████| 50/50 [00:18<00:00,  2.70it/s]
[I 2023-12-11 00:30:25,690] Trial 390 finished with value: 0.3483820047355959 and parameters: {'EMBEDDING_DIM': 990, 'HIDDEN_DIM': 274, 'NUM_LAYERS': 1, 'DROPOUT': 0.03134270059357931, 'LR': 0.0045077526830266425, 'WEIGHT_0': 0.2729895710779567, 'WEIGHT_1': 0.6234922795615027, 'WEIGHT_2': 0.3612368240016279, 'WEIGHT_3': 0.9499246623570197, 'WEIGHT_4': 0.7249815261805442, 'WEIGHT_5': 0.6323210727057471, 'WEIGHT_6': 0.8511375038513401, 'WEIGHT_7': 0.2299436676179459, 'WEIGHT_8': 0.8614567868126248, 'optimizer': 'RMSprop'}. Best is trial 365 with value: 0.41910947782240837.
/userhome/cs2/dingruiw/conda/envs/py310/lib/python3.10/site-packages/torch/nn/modules/rnn.py:82: UserWarning: dropout option adds dropout after all but last recurrent layer, so non-zero dropout expects num_layers greater than 1, but got dropout=0.07714452430029829 and num_layers=1
  warnings.warn("dropout option adds dropout after all but last "
{'EMBEDDING_DIM': 990, 'HIDDEN_DIM': 274, 'NUM_LAYERS': 1, 'DROPOUT': 0.03134270059357931, 'LR': 0.0045077526830266425, 'WEIGHT_0': 0.2729895710779567, 'WEIGHT_1': 0.6234922795615027, 'WEIGHT_2': 0.3612368240016279, 'WEIGHT_3': 0.9499246623570197, 'WEIGHT_4': 0.7249815261805442, 'WEIGHT_5': 0.6323210727057471, 'WEIGHT_6': 0.8511375038513401, 'WEIGHT_7': 0.2299436676179459, 'WEIGHT_8': 0.8614567868126248, 'optimizer': 'RMSprop'}
0
              precision    recall  f1-score   support

         LOC       0.36      0.14      0.20      1837
        MISC       0.02      0.00      0.01       922
         ORG       0.12      0.01      0.03      1341
         PER       0.05      0.01      0.02      1842

   micro avg       0.20      0.05      0.08      5942
   macro avg       0.14      0.04      0.06      5942
weighted avg       0.16      0.05      0.07      5942

{'EMBEDDING_DIM': 990, 'HIDDEN_DIM': 274, 'NUM_LAYERS': 1, 'DROPOUT': 0.03134270059357931, 'LR': 0.0045077526830266425, 'WEIGHT_0': 0.2729895710779567, 'WEIGHT_1': 0.6234922795615027, 'WEIGHT_2': 0.3612368240016279, 'WEIGHT_3': 0.9499246623570197, 'WEIGHT_4': 0.7249815261805442, 'WEIGHT_5': 0.6323210727057471, 'WEIGHT_6': 0.8511375038513401, 'WEIGHT_7': 0.2299436676179459, 'WEIGHT_8': 0.8614567868126248, 'optimizer': 'RMSprop'}
49
              precision    recall  f1-score   support

         LOC       0.47      0.51      0.49      1837
        MISC       0.37      0.41      0.39       922
         ORG       0.20      0.24      0.22      1341
         PER       0.27      0.31      0.29      1842

   micro avg       0.33      0.37      0.35      5942
   macro avg       0.33      0.37      0.35      5942
weighted avg       0.33      0.37      0.35      5942

epoch 49
LSTM
  0%|          | 0/50 [00:00<?, ?it/s]  2%|▏         | 1/50 [00:04<03:39,  4.47s/it]  6%|▌         | 3/50 [00:04<00:59,  1.26s/it]  8%|▊         | 4/50 [00:04<00:40,  1.14it/s] 10%|█         | 5/50 [00:05<00:28,  1.55it/s] 12%|█▏        | 6/50 [00:05<00:21,  2.04it/s] 14%|█▍        | 7/50 [00:05<00:16,  2.58it/s] 16%|█▌        | 8/50 [00:05<00:13,  3.14it/s] 18%|█▊        | 9/50 [00:05<00:11,  3.68it/s] 20%|██        | 10/50 [00:05<00:09,  4.18it/s] 22%|██▏       | 11/50 [00:06<00:08,  4.62it/s] 24%|██▍       | 12/50 [00:06<00:07,  4.98it/s] 26%|██▌       | 13/50 [00:06<00:07,  5.27it/s] 28%|██▊       | 14/50 [00:06<00:06,  5.49it/s] 30%|███       | 15/50 [00:06<00:06,  5.65it/s] 32%|███▏      | 16/50 [00:06<00:05,  5.77it/s] 34%|███▍      | 17/50 [00:07<00:05,  5.86it/s] 36%|███▌      | 18/50 [00:07<00:05,  5.93it/s] 38%|███▊      | 19/50 [00:07<00:05,  5.97it/s] 40%|████      | 20/50 [00:07<00:04,  6.01it/s] 42%|████▏     | 21/50 [00:07<00:04,  6.03it/s] 44%|████▍     | 22/50 [00:07<00:04,  6.04it/s] 46%|████▌     | 23/50 [00:08<00:04,  6.05it/s] 48%|████▊     | 24/50 [00:08<00:04,  6.06it/s] 50%|█████     | 25/50 [00:08<00:04,  6.06it/s] 52%|█████▏    | 26/50 [00:08<00:03,  6.08it/s] 54%|█████▍    | 27/50 [00:08<00:03,  6.08it/s] 56%|█████▌    | 28/50 [00:08<00:03,  6.06it/s] 58%|█████▊    | 29/50 [00:09<00:03,  6.06it/s] 60%|██████    | 30/50 [00:09<00:03,  6.07it/s] 62%|██████▏   | 31/50 [00:09<00:03,  6.07it/s] 64%|██████▍   | 32/50 [00:09<00:02,  6.06it/s] 66%|██████▌   | 33/50 [00:09<00:02,  6.06it/s] 68%|██████▊   | 34/50 [00:09<00:02,  6.06it/s] 70%|███████   | 35/50 [00:10<00:02,  6.06it/s] 72%|███████▏  | 36/50 [00:10<00:02,  6.06it/s] 74%|███████▍  | 37/50 [00:10<00:02,  6.05it/s] 76%|███████▌  | 38/50 [00:10<00:01,  6.06it/s] 78%|███████▊  | 39/50 [00:10<00:01,  6.06it/s] 80%|████████  | 40/50 [00:10<00:01,  6.06it/s] 82%|████████▏ | 41/50 [00:11<00:01,  6.06it/s] 84%|████████▍ | 42/50 [00:11<00:01,  6.06it/s] 86%|████████▌ | 43/50 [00:11<00:01,  6.06it/s] 88%|████████▊ | 44/50 [00:11<00:00,  6.06it/s] 90%|█████████ | 45/50 [00:11<00:00,  6.06it/s] 92%|█████████▏| 46/50 [00:11<00:00,  6.06it/s] 94%|█████████▍| 47/50 [00:11<00:00,  6.06it/s] 96%|█████████▌| 48/50 [00:12<00:00,  6.06it/s] 98%|█████████▊| 49/50 [00:12<00:00,  6.06it/s]100%|██████████| 50/50 [00:16<00:00,  1.51s/it]100%|██████████| 50/50 [00:16<00:00,  2.95it/s]
[I 2023-12-11 00:30:46,863] Trial 391 finished with value: 0.3941038308900948 and parameters: {'EMBEDDING_DIM': 971, 'HIDDEN_DIM': 237, 'NUM_LAYERS': 1, 'DROPOUT': 0.07714452430029829, 'LR': 0.0017714013774381083, 'WEIGHT_0': 0.17738628255805344, 'WEIGHT_1': 0.6765476594523713, 'WEIGHT_2': 0.47213376856120576, 'WEIGHT_3': 0.897922541105155, 'WEIGHT_4': 0.847675404784806, 'WEIGHT_5': 0.705162437168705, 'WEIGHT_6': 0.9715623853666214, 'WEIGHT_7': 0.48130726533766743, 'WEIGHT_8': 0.42273015975538697, 'optimizer': 'RMSprop'}. Best is trial 365 with value: 0.41910947782240837.
/userhome/cs2/dingruiw/conda/envs/py310/lib/python3.10/site-packages/torch/nn/modules/rnn.py:82: UserWarning: dropout option adds dropout after all but last recurrent layer, so non-zero dropout expects num_layers greater than 1, but got dropout=0.06800964112582006 and num_layers=1
  warnings.warn("dropout option adds dropout after all but last "
{'EMBEDDING_DIM': 971, 'HIDDEN_DIM': 237, 'NUM_LAYERS': 1, 'DROPOUT': 0.07714452430029829, 'LR': 0.0017714013774381083, 'WEIGHT_0': 0.17738628255805344, 'WEIGHT_1': 0.6765476594523713, 'WEIGHT_2': 0.47213376856120576, 'WEIGHT_3': 0.897922541105155, 'WEIGHT_4': 0.847675404784806, 'WEIGHT_5': 0.705162437168705, 'WEIGHT_6': 0.9715623853666214, 'WEIGHT_7': 0.48130726533766743, 'WEIGHT_8': 0.42273015975538697, 'optimizer': 'RMSprop'}
0
              precision    recall  f1-score   support

         LOC       0.39      0.22      0.28      1837
        MISC       0.12      0.05      0.07       922
         ORG       0.16      0.04      0.07      1341
         PER       0.08      0.06      0.07      1842

   micro avg       0.20      0.11      0.14      5942
   macro avg       0.18      0.09      0.12      5942
weighted avg       0.20      0.11      0.14      5942

{'EMBEDDING_DIM': 971, 'HIDDEN_DIM': 237, 'NUM_LAYERS': 1, 'DROPOUT': 0.07714452430029829, 'LR': 0.0017714013774381083, 'WEIGHT_0': 0.17738628255805344, 'WEIGHT_1': 0.6765476594523713, 'WEIGHT_2': 0.47213376856120576, 'WEIGHT_3': 0.897922541105155, 'WEIGHT_4': 0.847675404784806, 'WEIGHT_5': 0.705162437168705, 'WEIGHT_6': 0.9715623853666214, 'WEIGHT_7': 0.48130726533766743, 'WEIGHT_8': 0.42273015975538697, 'optimizer': 'RMSprop'}
49
              precision    recall  f1-score   support

         LOC       0.49      0.51      0.50      1837
        MISC       0.42      0.43      0.43       922
         ORG       0.26      0.27      0.27      1341
         PER       0.34      0.39      0.37      1842

   micro avg       0.38      0.41      0.39      5942
   macro avg       0.38      0.40      0.39      5942
weighted avg       0.38      0.41      0.39      5942

epoch 49
LSTM
  0%|          | 0/50 [00:00<?, ?it/s]  2%|▏         | 1/50 [00:04<03:18,  4.05s/it]  4%|▍         | 2/50 [00:04<01:24,  1.75s/it]  6%|▌         | 3/50 [00:04<00:50,  1.07s/it]  8%|▊         | 4/50 [00:04<00:34,  1.33it/s] 10%|█         | 5/50 [00:04<00:25,  1.75it/s] 12%|█▏        | 6/50 [00:05<00:20,  2.15it/s] 14%|█▍        | 7/50 [00:05<00:17,  2.52it/s] 16%|█▌        | 8/50 [00:05<00:14,  2.83it/s] 18%|█▊        | 9/50 [00:05<00:13,  3.10it/s] 20%|██        | 10/50 [00:06<00:12,  3.30it/s] 22%|██▏       | 11/50 [00:06<00:11,  3.46it/s] 24%|██▍       | 12/50 [00:06<00:10,  3.58it/s] 26%|██▌       | 13/50 [00:07<00:10,  3.66it/s] 28%|██▊       | 14/50 [00:07<00:09,  3.72it/s] 30%|███       | 15/50 [00:07<00:09,  3.77it/s] 32%|███▏      | 16/50 [00:07<00:08,  3.80it/s] 34%|███▍      | 17/50 [00:08<00:08,  3.83it/s] 36%|███▌      | 18/50 [00:08<00:08,  3.84it/s] 38%|███▊      | 19/50 [00:08<00:08,  3.85it/s] 40%|████      | 20/50 [00:08<00:07,  3.86it/s] 42%|████▏     | 21/50 [00:09<00:07,  3.86it/s] 44%|████▍     | 22/50 [00:09<00:07,  3.87it/s] 46%|████▌     | 23/50 [00:09<00:06,  3.87it/s] 48%|████▊     | 24/50 [00:09<00:06,  3.87it/s] 50%|█████     | 25/50 [00:10<00:06,  3.88it/s] 52%|█████▏    | 26/50 [00:10<00:06,  3.88it/s] 54%|█████▍    | 27/50 [00:10<00:05,  3.88it/s] 56%|█████▌    | 28/50 [00:10<00:05,  3.88it/s] 58%|█████▊    | 29/50 [00:11<00:05,  3.88it/s] 60%|██████    | 30/50 [00:11<00:05,  3.88it/s] 62%|██████▏   | 31/50 [00:11<00:04,  3.88it/s] 64%|██████▍   | 32/50 [00:11<00:04,  3.88it/s] 66%|██████▌   | 33/50 [00:12<00:04,  3.88it/s] 68%|██████▊   | 34/50 [00:12<00:04,  3.88it/s] 70%|███████   | 35/50 [00:12<00:03,  3.88it/s] 72%|███████▏  | 36/50 [00:12<00:03,  3.88it/s] 74%|███████▍  | 37/50 [00:13<00:03,  3.88it/s] 76%|███████▌  | 38/50 [00:13<00:03,  3.88it/s] 78%|███████▊  | 39/50 [00:13<00:02,  3.88it/s] 80%|████████  | 40/50 [00:13<00:02,  3.88it/s] 82%|████████▏ | 41/50 [00:14<00:02,  3.88it/s] 84%|████████▍ | 42/50 [00:14<00:02,  3.87it/s] 86%|████████▌ | 43/50 [00:14<00:01,  3.88it/s] 88%|████████▊ | 44/50 [00:15<00:01,  3.88it/s] 90%|█████████ | 45/50 [00:15<00:01,  3.87it/s] 92%|█████████▏| 46/50 [00:15<00:01,  3.87it/s] 94%|█████████▍| 47/50 [00:15<00:00,  3.88it/s] 96%|█████████▌| 48/50 [00:16<00:00,  3.88it/s] 98%|█████████▊| 49/50 [00:16<00:00,  3.87it/s]100%|██████████| 50/50 [00:20<00:00,  1.45s/it]100%|██████████| 50/50 [00:20<00:00,  2.43it/s]
[I 2023-12-11 00:31:11,090] Trial 392 finished with value: 0.40475028469171953 and parameters: {'EMBEDDING_DIM': 1005, 'HIDDEN_DIM': 191, 'NUM_LAYERS': 1, 'DROPOUT': 0.06800964112582006, 'LR': 0.0024341852276072292, 'WEIGHT_0': 0.20764113742368875, 'WEIGHT_1': 0.5736305898270572, 'WEIGHT_2': 0.4187405174780811, 'WEIGHT_3': 0.6602819686446519, 'WEIGHT_4': 0.8249738164811581, 'WEIGHT_5': 0.6753270525704983, 'WEIGHT_6': 0.6737768139974378, 'WEIGHT_7': 0.5381242482022628, 'WEIGHT_8': 0.9204813230447125, 'optimizer': 'RMSprop'}. Best is trial 365 with value: 0.41910947782240837.
/userhome/cs2/dingruiw/conda/envs/py310/lib/python3.10/site-packages/torch/nn/modules/rnn.py:82: UserWarning: dropout option adds dropout after all but last recurrent layer, so non-zero dropout expects num_layers greater than 1, but got dropout=0.048343843488157755 and num_layers=1
  warnings.warn("dropout option adds dropout after all but last "
{'EMBEDDING_DIM': 1005, 'HIDDEN_DIM': 191, 'NUM_LAYERS': 1, 'DROPOUT': 0.06800964112582006, 'LR': 0.0024341852276072292, 'WEIGHT_0': 0.20764113742368875, 'WEIGHT_1': 0.5736305898270572, 'WEIGHT_2': 0.4187405174780811, 'WEIGHT_3': 0.6602819686446519, 'WEIGHT_4': 0.8249738164811581, 'WEIGHT_5': 0.6753270525704983, 'WEIGHT_6': 0.6737768139974378, 'WEIGHT_7': 0.5381242482022628, 'WEIGHT_8': 0.9204813230447125, 'optimizer': 'RMSprop'}
0
              precision    recall  f1-score   support

         LOC       0.44      0.30      0.36      1837
        MISC       0.14      0.05      0.07       922
         ORG       0.15      0.05      0.08      1341
         PER       0.11      0.06      0.08      1842

   micro avg       0.26      0.13      0.17      5942
   macro avg       0.21      0.11      0.15      5942
weighted avg       0.23      0.13      0.16      5942

{'EMBEDDING_DIM': 1005, 'HIDDEN_DIM': 191, 'NUM_LAYERS': 1, 'DROPOUT': 0.06800964112582006, 'LR': 0.0024341852276072292, 'WEIGHT_0': 0.20764113742368875, 'WEIGHT_1': 0.5736305898270572, 'WEIGHT_2': 0.4187405174780811, 'WEIGHT_3': 0.6602819686446519, 'WEIGHT_4': 0.8249738164811581, 'WEIGHT_5': 0.6753270525704983, 'WEIGHT_6': 0.6737768139974378, 'WEIGHT_7': 0.5381242482022628, 'WEIGHT_8': 0.9204813230447125, 'optimizer': 'RMSprop'}
49
              precision    recall  f1-score   support

         LOC       0.51      0.55      0.53      1837
        MISC       0.45      0.46      0.46       922
         ORG       0.26      0.27      0.27      1341
         PER       0.33      0.37      0.35      1842

   micro avg       0.39      0.42      0.40      5942
   macro avg       0.39      0.41      0.40      5942
weighted avg       0.39      0.42      0.40      5942

epoch 49
LSTM
  0%|          | 0/50 [00:00<?, ?it/s]  2%|▏         | 1/50 [00:05<04:14,  5.20s/it]  4%|▍         | 2/50 [00:05<01:51,  2.32s/it]  6%|▌         | 3/50 [00:06<01:13,  1.57s/it]  8%|▊         | 4/50 [00:06<00:55,  1.22s/it] 10%|█         | 5/50 [00:07<00:46,  1.02s/it] 12%|█▏        | 6/50 [00:08<00:39,  1.11it/s] 14%|█▍        | 7/50 [00:08<00:35,  1.20it/s] 16%|█▌        | 8/50 [00:09<00:32,  1.28it/s] 18%|█▊        | 9/50 [00:10<00:30,  1.33it/s] 20%|██        | 10/50 [00:10<00:29,  1.38it/s] 22%|██▏       | 11/50 [00:11<00:27,  1.41it/s] 24%|██▍       | 12/50 [00:12<00:26,  1.43it/s] 26%|██▌       | 13/50 [00:12<00:25,  1.45it/s] 28%|██▊       | 14/50 [00:13<00:24,  1.46it/s] 30%|███       | 15/50 [00:14<00:23,  1.47it/s] 32%|███▏      | 16/50 [00:14<00:23,  1.47it/s] 34%|███▍      | 17/50 [00:15<00:22,  1.47it/s] 36%|███▌      | 18/50 [00:16<00:21,  1.47it/s] 38%|███▊      | 19/50 [00:16<00:21,  1.47it/s] 40%|████      | 20/50 [00:17<00:20,  1.47it/s] 42%|████▏     | 21/50 [00:18<00:19,  1.47it/s] 44%|████▍     | 22/50 [00:19<00:19,  1.47it/s] 46%|████▌     | 23/50 [00:19<00:18,  1.48it/s] 48%|████▊     | 24/50 [00:20<00:17,  1.48it/s] 50%|█████     | 25/50 [00:21<00:16,  1.47it/s] 52%|█████▏    | 26/50 [00:21<00:16,  1.47it/s] 54%|█████▍    | 27/50 [00:22<00:15,  1.47it/s] 56%|█████▌    | 28/50 [00:23<00:14,  1.47it/s] 58%|█████▊    | 29/50 [00:23<00:14,  1.47it/s] 60%|██████    | 30/50 [00:24<00:13,  1.48it/s] 62%|██████▏   | 31/50 [00:25<00:12,  1.48it/s] 64%|██████▍   | 32/50 [00:25<00:12,  1.47it/s] 66%|██████▌   | 33/50 [00:26<00:11,  1.48it/s] 68%|██████▊   | 34/50 [00:27<00:10,  1.47it/s] 70%|███████   | 35/50 [00:27<00:10,  1.47it/s] 72%|███████▏  | 36/50 [00:28<00:09,  1.47it/s] 74%|███████▍  | 37/50 [00:29<00:08,  1.47it/s] 76%|███████▌  | 38/50 [00:29<00:08,  1.47it/s] 78%|███████▊  | 39/50 [00:30<00:07,  1.47it/s] 80%|████████  | 40/50 [00:31<00:06,  1.47it/s] 82%|████████▏ | 41/50 [00:31<00:06,  1.47it/s] 84%|████████▍ | 42/50 [00:32<00:05,  1.46it/s] 86%|████████▌ | 43/50 [00:33<00:04,  1.47it/s] 88%|████████▊ | 44/50 [00:33<00:04,  1.47it/s] 90%|█████████ | 45/50 [00:34<00:03,  1.46it/s] 92%|█████████▏| 46/50 [00:35<00:02,  1.46it/s] 94%|█████████▍| 47/50 [00:36<00:02,  1.46it/s] 96%|█████████▌| 48/50 [00:36<00:01,  1.46it/s] 98%|█████████▊| 49/50 [00:37<00:00,  1.46it/s]100%|██████████| 50/50 [00:42<00:00,  2.14s/it]100%|██████████| 50/50 [00:42<00:00,  1.16it/s]
