[I 2023-12-10 22:38:39,473] Trial 157 finished with value: 0.39825660582947425 and parameters: {'EMBEDDING_DIM': 978, 'HIDDEN_DIM': 862, 'NUM_LAYERS': 1, 'DROPOUT': 0.3903447659184712, 'LR': 0.0006541540589883754, 'WEIGHT_0': 0.4598739216110869, 'WEIGHT_1': 0.679526438872408, 'WEIGHT_2': 0.5326397437336167, 'WEIGHT_3': 0.885295689366547, 'WEIGHT_4': 0.9397661181734311, 'WEIGHT_5': 0.39874433386822306, 'WEIGHT_6': 0.9804068036934696, 'WEIGHT_7': 0.27816712054006737, 'WEIGHT_8': 0.3280566139324025, 'optimizer': 'RMSprop'}. Best is trial 134 with value: 0.4158467115484205.
/userhome/cs2/dingruiw/conda/envs/py310/lib/python3.10/site-packages/torch/nn/modules/rnn.py:82: UserWarning: dropout option adds dropout after all but last recurrent layer, so non-zero dropout expects num_layers greater than 1, but got dropout=0.2813230472956658 and num_layers=1
  warnings.warn("dropout option adds dropout after all but last "
{'EMBEDDING_DIM': 978, 'HIDDEN_DIM': 862, 'NUM_LAYERS': 1, 'DROPOUT': 0.3903447659184712, 'LR': 0.0006541540589883754, 'WEIGHT_0': 0.4598739216110869, 'WEIGHT_1': 0.679526438872408, 'WEIGHT_2': 0.5326397437336167, 'WEIGHT_3': 0.885295689366547, 'WEIGHT_4': 0.9397661181734311, 'WEIGHT_5': 0.39874433386822306, 'WEIGHT_6': 0.9804068036934696, 'WEIGHT_7': 0.27816712054006737, 'WEIGHT_8': 0.3280566139324025, 'optimizer': 'RMSprop'}
0
              precision    recall  f1-score   support

         LOC       0.11      0.18      0.14      1837
        MISC       0.03      0.01      0.02       922
         ORG       0.06      0.05      0.05      1341
         PER       0.02      0.02      0.02      1842

   micro avg       0.07      0.07      0.07      5942
   macro avg       0.05      0.06      0.06      5942
weighted avg       0.06      0.07      0.06      5942

{'EMBEDDING_DIM': 978, 'HIDDEN_DIM': 862, 'NUM_LAYERS': 1, 'DROPOUT': 0.3903447659184712, 'LR': 0.0006541540589883754, 'WEIGHT_0': 0.4598739216110869, 'WEIGHT_1': 0.679526438872408, 'WEIGHT_2': 0.5326397437336167, 'WEIGHT_3': 0.885295689366547, 'WEIGHT_4': 0.9397661181734311, 'WEIGHT_5': 0.39874433386822306, 'WEIGHT_6': 0.9804068036934696, 'WEIGHT_7': 0.27816712054006737, 'WEIGHT_8': 0.3280566139324025, 'optimizer': 'RMSprop'}
49
              precision    recall  f1-score   support

         LOC       0.60      0.49      0.54      1837
        MISC       0.52      0.40      0.45       922
         ORG       0.29      0.22      0.25      1341
         PER       0.34      0.34      0.34      1842

   micro avg       0.43      0.37      0.40      5942
   macro avg       0.44      0.36      0.40      5942
weighted avg       0.44      0.37      0.40      5942

epoch 49
LSTM
  0%|          | 0/50 [00:00<?, ?it/s]  2%|▏         | 1/50 [00:04<03:29,  4.28s/it]  4%|▍         | 2/50 [00:04<01:28,  1.85s/it]  6%|▌         | 3/50 [00:04<00:52,  1.12s/it]  8%|▊         | 4/50 [00:04<00:35,  1.29it/s] 10%|█         | 5/50 [00:05<00:26,  1.71it/s] 12%|█▏        | 6/50 [00:05<00:20,  2.13it/s] 14%|█▍        | 7/50 [00:05<00:17,  2.52it/s] 16%|█▌        | 8/50 [00:05<00:14,  2.87it/s] 18%|█▊        | 9/50 [00:06<00:12,  3.16it/s] 20%|██        | 10/50 [00:06<00:11,  3.39it/s] 22%|██▏       | 11/50 [00:06<00:10,  3.57it/s] 24%|██▍       | 12/50 [00:06<00:10,  3.71it/s] 26%|██▌       | 13/50 [00:07<00:09,  3.81it/s] 28%|██▊       | 14/50 [00:07<00:09,  3.88it/s] 30%|███       | 15/50 [00:07<00:08,  3.93it/s] 32%|███▏      | 16/50 [00:07<00:08,  3.97it/s] 34%|███▍      | 17/50 [00:08<00:08,  3.98it/s] 36%|███▌      | 18/50 [00:08<00:07,  4.01it/s] 38%|███▊      | 19/50 [00:08<00:07,  4.02it/s] 40%|████      | 20/50 [00:08<00:07,  4.03it/s] 42%|████▏     | 21/50 [00:09<00:07,  4.04it/s] 44%|████▍     | 22/50 [00:09<00:06,  4.02it/s] 46%|████▌     | 23/50 [00:09<00:06,  4.03it/s] 48%|████▊     | 24/50 [00:09<00:06,  4.04it/s] 50%|█████     | 25/50 [00:10<00:06,  4.04it/s] 52%|█████▏    | 26/50 [00:10<00:05,  4.05it/s] 54%|█████▍    | 27/50 [00:10<00:05,  4.03it/s] 56%|█████▌    | 28/50 [00:10<00:05,  4.03it/s] 58%|█████▊    | 29/50 [00:11<00:05,  4.02it/s] 60%|██████    | 30/50 [00:11<00:04,  4.01it/s] 62%|██████▏   | 31/50 [00:11<00:04,  4.02it/s] 64%|██████▍   | 32/50 [00:11<00:04,  4.03it/s] 66%|██████▌   | 33/50 [00:12<00:04,  4.02it/s] 68%|██████▊   | 34/50 [00:12<00:03,  4.02it/s] 70%|███████   | 35/50 [00:12<00:03,  4.02it/s] 72%|███████▏  | 36/50 [00:12<00:03,  4.00it/s] 74%|███████▍  | 37/50 [00:13<00:03,  4.01it/s] 76%|███████▌  | 38/50 [00:13<00:02,  4.01it/s] 78%|███████▊  | 39/50 [00:13<00:02,  4.02it/s] 80%|████████  | 40/50 [00:13<00:02,  4.03it/s] 82%|████████▏ | 41/50 [00:14<00:02,  4.02it/s] 84%|████████▍ | 42/50 [00:14<00:01,  4.02it/s] 86%|████████▌ | 43/50 [00:14<00:01,  4.01it/s] 88%|████████▊ | 44/50 [00:14<00:01,  4.01it/s] 90%|█████████ | 45/50 [00:15<00:01,  4.01it/s] 92%|█████████▏| 46/50 [00:15<00:00,  4.02it/s] 94%|█████████▍| 47/50 [00:15<00:00,  4.02it/s] 96%|█████████▌| 48/50 [00:15<00:00,  4.02it/s] 98%|█████████▊| 49/50 [00:16<00:00,  4.01it/s]100%|██████████| 50/50 [00:20<00:00,  1.50s/it]100%|██████████| 50/50 [00:20<00:00,  2.44it/s]
[I 2023-12-10 22:39:03,710] Trial 158 finished with value: 0.3898234161854548 and parameters: {'EMBEDDING_DIM': 946, 'HIDDEN_DIM': 176, 'NUM_LAYERS': 1, 'DROPOUT': 0.2813230472956658, 'LR': 0.0015404034726736963, 'WEIGHT_0': 0.48496805874363813, 'WEIGHT_1': 0.7910034530010931, 'WEIGHT_2': 0.71905771315406, 'WEIGHT_3': 0.9420880989160019, 'WEIGHT_4': 0.8899367101904156, 'WEIGHT_5': 0.433424841490683, 'WEIGHT_6': 0.8793094333402858, 'WEIGHT_7': 0.47916388428439094, 'WEIGHT_8': 0.4306114551683369, 'optimizer': 'Adam'}. Best is trial 134 with value: 0.4158467115484205.
/userhome/cs2/dingruiw/conda/envs/py310/lib/python3.10/site-packages/torch/nn/modules/rnn.py:82: UserWarning: dropout option adds dropout after all but last recurrent layer, so non-zero dropout expects num_layers greater than 1, but got dropout=0.35756061272947787 and num_layers=1
  warnings.warn("dropout option adds dropout after all but last "
{'EMBEDDING_DIM': 946, 'HIDDEN_DIM': 176, 'NUM_LAYERS': 1, 'DROPOUT': 0.2813230472956658, 'LR': 0.0015404034726736963, 'WEIGHT_0': 0.48496805874363813, 'WEIGHT_1': 0.7910034530010931, 'WEIGHT_2': 0.71905771315406, 'WEIGHT_3': 0.9420880989160019, 'WEIGHT_4': 0.8899367101904156, 'WEIGHT_5': 0.433424841490683, 'WEIGHT_6': 0.8793094333402858, 'WEIGHT_7': 0.47916388428439094, 'WEIGHT_8': 0.4306114551683369, 'optimizer': 'Adam'}
0
              precision    recall  f1-score   support

         LOC       0.04      0.07      0.05      1837
        MISC       0.01      0.16      0.03       922
         ORG       0.03      0.06      0.04      1341
         PER       0.03      0.07      0.04      1842

   micro avg       0.02      0.08      0.03      5942
   macro avg       0.03      0.09      0.04      5942
weighted avg       0.03      0.08      0.04      5942

{'EMBEDDING_DIM': 946, 'HIDDEN_DIM': 176, 'NUM_LAYERS': 1, 'DROPOUT': 0.2813230472956658, 'LR': 0.0015404034726736963, 'WEIGHT_0': 0.48496805874363813, 'WEIGHT_1': 0.7910034530010931, 'WEIGHT_2': 0.71905771315406, 'WEIGHT_3': 0.9420880989160019, 'WEIGHT_4': 0.8899367101904156, 'WEIGHT_5': 0.433424841490683, 'WEIGHT_6': 0.8793094333402858, 'WEIGHT_7': 0.47916388428439094, 'WEIGHT_8': 0.4306114551683369, 'optimizer': 'Adam'}
49
              precision    recall  f1-score   support

         LOC       0.57      0.48      0.52      1837
        MISC       0.41      0.45      0.43       922
         ORG       0.26      0.26      0.26      1341
         PER       0.32      0.37      0.34      1842

   micro avg       0.39      0.39      0.39      5942
   macro avg       0.39      0.39      0.39      5942
weighted avg       0.40      0.39      0.39      5942

epoch 49
LSTM
  0%|          | 0/50 [00:00<?, ?it/s]  2%|▏         | 1/50 [00:05<04:08,  5.06s/it]  4%|▍         | 2/50 [00:05<01:46,  2.23s/it]  6%|▌         | 3/50 [00:05<01:07,  1.44s/it]  8%|▊         | 4/50 [00:06<00:49,  1.07s/it] 10%|█         | 5/50 [00:06<00:39,  1.15it/s] 12%|█▏        | 6/50 [00:07<00:32,  1.34it/s] 14%|█▍        | 7/50 [00:07<00:28,  1.50it/s] 16%|█▌        | 8/50 [00:08<00:25,  1.63it/s] 18%|█▊        | 9/50 [00:08<00:23,  1.72it/s] 20%|██        | 10/50 [00:09<00:22,  1.79it/s] 22%|██▏       | 11/50 [00:09<00:21,  1.84it/s] 24%|██▍       | 12/50 [00:10<00:20,  1.88it/s] 26%|██▌       | 13/50 [00:10<00:19,  1.91it/s] 28%|██▊       | 14/50 [00:11<00:18,  1.93it/s] 30%|███       | 15/50 [00:11<00:18,  1.94it/s] 32%|███▏      | 16/50 [00:12<00:17,  1.95it/s] 34%|███▍      | 17/50 [00:12<00:16,  1.96it/s] 36%|███▌      | 18/50 [00:13<00:16,  1.96it/s] 38%|███▊      | 19/50 [00:13<00:15,  1.96it/s] 40%|████      | 20/50 [00:14<00:15,  1.97it/s] 42%|████▏     | 21/50 [00:14<00:14,  1.97it/s] 44%|████▍     | 22/50 [00:15<00:14,  1.97it/s] 46%|████▌     | 23/50 [00:15<00:13,  1.97it/s] 48%|████▊     | 24/50 [00:16<00:13,  1.97it/s] 50%|█████     | 25/50 [00:16<00:12,  1.96it/s] 52%|█████▏    | 26/50 [00:17<00:12,  1.96it/s] 54%|█████▍    | 27/50 [00:17<00:11,  1.96it/s] 56%|█████▌    | 28/50 [00:18<00:11,  1.96it/s] 58%|█████▊    | 29/50 [00:19<00:10,  1.96it/s] 60%|██████    | 30/50 [00:19<00:10,  1.96it/s] 62%|██████▏   | 31/50 [00:20<00:09,  1.95it/s] 64%|██████▍   | 32/50 [00:20<00:09,  1.95it/s] 66%|██████▌   | 33/50 [00:21<00:08,  1.95it/s] 68%|██████▊   | 34/50 [00:21<00:08,  1.95it/s] 70%|███████   | 35/50 [00:22<00:07,  1.95it/s] 72%|███████▏  | 36/50 [00:22<00:07,  1.95it/s] 74%|███████▍  | 37/50 [00:23<00:06,  1.94it/s] 76%|███████▌  | 38/50 [00:23<00:06,  1.94it/s] 78%|███████▊  | 39/50 [00:24<00:05,  1.94it/s] 80%|████████  | 40/50 [00:24<00:05,  1.94it/s] 82%|████████▏ | 41/50 [00:25<00:04,  1.94it/s] 84%|████████▍ | 42/50 [00:25<00:04,  1.94it/s] 86%|████████▌ | 43/50 [00:26<00:03,  1.94it/s] 88%|████████▊ | 44/50 [00:26<00:03,  1.94it/s] 90%|█████████ | 45/50 [00:27<00:02,  1.94it/s] 92%|█████████▏| 46/50 [00:27<00:02,  1.94it/s] 94%|█████████▍| 47/50 [00:28<00:01,  1.94it/s] 96%|█████████▌| 48/50 [00:28<00:01,  1.94it/s] 98%|█████████▊| 49/50 [00:29<00:00,  1.94it/s]100%|██████████| 50/50 [00:34<00:00,  1.94s/it]100%|██████████| 50/50 [00:34<00:00,  1.45it/s]
[I 2023-12-10 22:39:42,715] Trial 159 finished with value: 0.4085305498065329 and parameters: {'EMBEDDING_DIM': 1009, 'HIDDEN_DIM': 689, 'NUM_LAYERS': 1, 'DROPOUT': 0.35756061272947787, 'LR': 0.0012749964621737342, 'WEIGHT_0': 0.39055013144775563, 'WEIGHT_1': 0.7144492125733118, 'WEIGHT_2': 0.6190557555855287, 'WEIGHT_3': 0.9049405432352109, 'WEIGHT_4': 0.876739957883872, 'WEIGHT_5': 0.49757457299597396, 'WEIGHT_6': 0.6629352472000072, 'WEIGHT_7': 0.3045168982554227, 'WEIGHT_8': 0.521625381021596, 'optimizer': 'RMSprop'}. Best is trial 134 with value: 0.4158467115484205.
/userhome/cs2/dingruiw/conda/envs/py310/lib/python3.10/site-packages/torch/nn/modules/rnn.py:82: UserWarning: dropout option adds dropout after all but last recurrent layer, so non-zero dropout expects num_layers greater than 1, but got dropout=0.3573035843019541 and num_layers=1
  warnings.warn("dropout option adds dropout after all but last "
{'EMBEDDING_DIM': 1009, 'HIDDEN_DIM': 689, 'NUM_LAYERS': 1, 'DROPOUT': 0.35756061272947787, 'LR': 0.0012749964621737342, 'WEIGHT_0': 0.39055013144775563, 'WEIGHT_1': 0.7144492125733118, 'WEIGHT_2': 0.6190557555855287, 'WEIGHT_3': 0.9049405432352109, 'WEIGHT_4': 0.876739957883872, 'WEIGHT_5': 0.49757457299597396, 'WEIGHT_6': 0.6629352472000072, 'WEIGHT_7': 0.3045168982554227, 'WEIGHT_8': 0.521625381021596, 'optimizer': 'RMSprop'}
0
              precision    recall  f1-score   support

         LOC       0.14      0.19      0.16      1837
        MISC       0.05      0.02      0.03       922
         ORG       0.03      0.02      0.02      1341
         PER       0.04      0.04      0.04      1842

   micro avg       0.09      0.08      0.08      5942
   macro avg       0.06      0.07      0.06      5942
weighted avg       0.07      0.08      0.07      5942

{'EMBEDDING_DIM': 1009, 'HIDDEN_DIM': 689, 'NUM_LAYERS': 1, 'DROPOUT': 0.35756061272947787, 'LR': 0.0012749964621737342, 'WEIGHT_0': 0.39055013144775563, 'WEIGHT_1': 0.7144492125733118, 'WEIGHT_2': 0.6190557555855287, 'WEIGHT_3': 0.9049405432352109, 'WEIGHT_4': 0.876739957883872, 'WEIGHT_5': 0.49757457299597396, 'WEIGHT_6': 0.6629352472000072, 'WEIGHT_7': 0.3045168982554227, 'WEIGHT_8': 0.521625381021596, 'optimizer': 'RMSprop'}
49
              precision    recall  f1-score   support

         LOC       0.62      0.51      0.56      1837
        MISC       0.45      0.42      0.44       922
         ORG       0.30      0.23      0.26      1341
         PER       0.36      0.34      0.35      1842

   micro avg       0.44      0.38      0.41      5942
   macro avg       0.43      0.38      0.40      5942
weighted avg       0.44      0.38      0.41      5942

epoch 49
LSTM
  0%|          | 0/50 [00:00<?, ?it/s]  2%|▏         | 1/50 [00:05<04:11,  5.13s/it]  4%|▍         | 2/50 [00:05<01:47,  2.25s/it]  6%|▌         | 3/50 [00:05<01:07,  1.44s/it]  8%|▊         | 4/50 [00:06<00:49,  1.07s/it] 10%|█         | 5/50 [00:06<00:38,  1.17it/s] 12%|█▏        | 6/50 [00:07<00:32,  1.37it/s] 14%|█▍        | 7/50 [00:07<00:28,  1.54it/s] 16%|█▌        | 8/50 [00:08<00:25,  1.67it/s] 18%|█▊        | 9/50 [00:08<00:23,  1.78it/s] 20%|██        | 10/50 [00:09<00:21,  1.85it/s] 22%|██▏       | 11/50 [00:09<00:20,  1.91it/s] 24%|██▍       | 12/50 [00:10<00:19,  1.95it/s] 26%|██▌       | 13/50 [00:10<00:18,  1.97it/s] 28%|██▊       | 14/50 [00:11<00:18,  1.99it/s] 30%|███       | 15/50 [00:11<00:17,  2.01it/s] 32%|███▏      | 16/50 [00:12<00:16,  2.02it/s] 34%|███▍      | 17/50 [00:12<00:16,  2.02it/s] 36%|███▌      | 18/50 [00:13<00:15,  2.03it/s] 38%|███▊      | 19/50 [00:13<00:15,  2.03it/s] 40%|████      | 20/50 [00:14<00:14,  2.03it/s] 42%|████▏     | 21/50 [00:14<00:14,  2.03it/s] 44%|████▍     | 22/50 [00:15<00:13,  2.04it/s] 46%|████▌     | 23/50 [00:15<00:13,  2.04it/s] 48%|████▊     | 24/50 [00:16<00:12,  2.04it/s] 50%|█████     | 25/50 [00:16<00:12,  2.04it/s] 52%|█████▏    | 26/50 [00:17<00:11,  2.04it/s] 54%|█████▍    | 27/50 [00:17<00:11,  2.04it/s] 56%|█████▌    | 28/50 [00:18<00:10,  2.04it/s] 58%|█████▊    | 29/50 [00:18<00:10,  2.04it/s] 60%|██████    | 30/50 [00:19<00:09,  2.04it/s] 62%|██████▏   | 31/50 [00:19<00:09,  2.03it/s] 64%|██████▍   | 32/50 [00:20<00:08,  2.03it/s] 66%|██████▌   | 33/50 [00:20<00:08,  2.03it/s] 68%|██████▊   | 34/50 [00:21<00:07,  2.03it/s] 70%|███████   | 35/50 [00:21<00:07,  2.03it/s] 72%|███████▏  | 36/50 [00:22<00:06,  2.03it/s] 74%|███████▍  | 37/50 [00:22<00:06,  2.03it/s] 76%|███████▌  | 38/50 [00:23<00:05,  2.02it/s] 78%|███████▊  | 39/50 [00:23<00:05,  2.02it/s] 80%|████████  | 40/50 [00:24<00:04,  2.02it/s] 82%|████████▏ | 41/50 [00:24<00:04,  2.02it/s] 84%|████████▍ | 42/50 [00:25<00:03,  2.02it/s] 86%|████████▌ | 43/50 [00:25<00:03,  2.01it/s] 88%|████████▊ | 44/50 [00:26<00:02,  2.01it/s] 90%|█████████ | 45/50 [00:26<00:02,  2.00it/s] 92%|█████████▏| 46/50 [00:27<00:01,  2.00it/s] 94%|█████████▍| 47/50 [00:27<00:01,  2.00it/s] 96%|█████████▌| 48/50 [00:28<00:01,  2.00it/s] 98%|█████████▊| 49/50 [00:28<00:00,  2.01it/s]100%|██████████| 50/50 [00:33<00:00,  1.92s/it]100%|██████████| 50/50 [00:33<00:00,  1.48it/s]
[I 2023-12-10 22:40:20,783] Trial 160 finished with value: 0.40398740818467993 and parameters: {'EMBEDDING_DIM': 1008, 'HIDDEN_DIM': 680, 'NUM_LAYERS': 1, 'DROPOUT': 0.3573035843019541, 'LR': 0.001268754179240508, 'WEIGHT_0': 0.3724016295961013, 'WEIGHT_1': 0.7201785882845589, 'WEIGHT_2': 0.6028138281452469, 'WEIGHT_3': 0.9083228536043, 'WEIGHT_4': 0.8736961556106408, 'WEIGHT_5': 0.5017633453774325, 'WEIGHT_6': 0.6494484266710318, 'WEIGHT_7': 0.31483344314294504, 'WEIGHT_8': 0.5206739050167175, 'optimizer': 'RMSprop'}. Best is trial 134 with value: 0.4158467115484205.
/userhome/cs2/dingruiw/conda/envs/py310/lib/python3.10/site-packages/torch/nn/modules/rnn.py:82: UserWarning: dropout option adds dropout after all but last recurrent layer, so non-zero dropout expects num_layers greater than 1, but got dropout=0.3433750074744022 and num_layers=1
  warnings.warn("dropout option adds dropout after all but last "
{'EMBEDDING_DIM': 1008, 'HIDDEN_DIM': 680, 'NUM_LAYERS': 1, 'DROPOUT': 0.3573035843019541, 'LR': 0.001268754179240508, 'WEIGHT_0': 0.3724016295961013, 'WEIGHT_1': 0.7201785882845589, 'WEIGHT_2': 0.6028138281452469, 'WEIGHT_3': 0.9083228536043, 'WEIGHT_4': 0.8736961556106408, 'WEIGHT_5': 0.5017633453774325, 'WEIGHT_6': 0.6494484266710318, 'WEIGHT_7': 0.31483344314294504, 'WEIGHT_8': 0.5206739050167175, 'optimizer': 'RMSprop'}
0
              precision    recall  f1-score   support

         LOC       0.18      0.07      0.10      1837
        MISC       0.04      0.03      0.03       922
         ORG       0.09      0.03      0.04      1341
         PER       0.05      0.03      0.04      1842

   micro avg       0.09      0.04      0.06      5942
   macro avg       0.09      0.04      0.05      5942
weighted avg       0.10      0.04      0.06      5942

{'EMBEDDING_DIM': 1008, 'HIDDEN_DIM': 680, 'NUM_LAYERS': 1, 'DROPOUT': 0.3573035843019541, 'LR': 0.001268754179240508, 'WEIGHT_0': 0.3724016295961013, 'WEIGHT_1': 0.7201785882845589, 'WEIGHT_2': 0.6028138281452469, 'WEIGHT_3': 0.9083228536043, 'WEIGHT_4': 0.8736961556106408, 'WEIGHT_5': 0.5017633453774325, 'WEIGHT_6': 0.6494484266710318, 'WEIGHT_7': 0.31483344314294504, 'WEIGHT_8': 0.5206739050167175, 'optimizer': 'RMSprop'}
49
              precision    recall  f1-score   support

         LOC       0.58      0.53      0.56      1837
        MISC       0.46      0.44      0.45       922
         ORG       0.31      0.24      0.27      1341
         PER       0.32      0.33      0.32      1842

   micro avg       0.42      0.39      0.40      5942
   macro avg       0.42      0.39      0.40      5942
weighted avg       0.42      0.39      0.40      5942

epoch 49
LSTM
  0%|          | 0/50 [00:00<?, ?it/s]  2%|▏         | 1/50 [00:04<04:02,  4.94s/it]  4%|▍         | 2/50 [00:05<01:43,  2.16s/it]  6%|▌         | 3/50 [00:05<01:03,  1.36s/it]  8%|▊         | 4/50 [00:05<00:45,  1.02it/s] 10%|█         | 5/50 [00:06<00:34,  1.29it/s] 12%|█▏        | 6/50 [00:06<00:28,  1.54it/s] 14%|█▍        | 7/50 [00:07<00:24,  1.75it/s] 16%|█▌        | 8/50 [00:07<00:21,  1.93it/s] 18%|█▊        | 9/50 [00:08<00:19,  2.07it/s] 20%|██        | 10/50 [00:08<00:18,  2.17it/s] 22%|██▏       | 11/50 [00:08<00:17,  2.25it/s] 24%|██▍       | 12/50 [00:09<00:16,  2.31it/s] 26%|██▌       | 13/50 [00:09<00:15,  2.36it/s] 28%|██▊       | 14/50 [00:10<00:15,  2.39it/s] 30%|███       | 15/50 [00:10<00:14,  2.41it/s] 32%|███▏      | 16/50 [00:10<00:14,  2.42it/s] 34%|███▍      | 17/50 [00:11<00:13,  2.43it/s] 36%|███▌      | 18/50 [00:11<00:13,  2.44it/s] 38%|███▊      | 19/50 [00:12<00:12,  2.44it/s] 40%|████      | 20/50 [00:12<00:12,  2.44it/s] 42%|████▏     | 21/50 [00:12<00:11,  2.44it/s] 44%|████▍     | 22/50 [00:13<00:11,  2.44it/s] 46%|████▌     | 23/50 [00:13<00:11,  2.44it/s] 48%|████▊     | 24/50 [00:14<00:10,  2.44it/s] 50%|█████     | 25/50 [00:14<00:10,  2.43it/s] 52%|█████▏    | 26/50 [00:14<00:09,  2.43it/s] 54%|█████▍    | 27/50 [00:15<00:09,  2.44it/s] 56%|█████▌    | 28/50 [00:15<00:09,  2.43it/s] 58%|█████▊    | 29/50 [00:16<00:08,  2.43it/s] 60%|██████    | 30/50 [00:16<00:08,  2.43it/s] 62%|██████▏   | 31/50 [00:17<00:07,  2.43it/s] 64%|██████▍   | 32/50 [00:17<00:07,  2.43it/s] 66%|██████▌   | 33/50 [00:17<00:06,  2.43it/s] 68%|██████▊   | 34/50 [00:18<00:06,  2.43it/s] 70%|███████   | 35/50 [00:18<00:06,  2.43it/s] 72%|███████▏  | 36/50 [00:19<00:05,  2.43it/s] 74%|███████▍  | 37/50 [00:19<00:05,  2.43it/s] 76%|███████▌  | 38/50 [00:19<00:04,  2.43it/s] 78%|███████▊  | 39/50 [00:20<00:04,  2.43it/s] 80%|████████  | 40/50 [00:20<00:04,  2.43it/s] 82%|████████▏ | 41/50 [00:21<00:03,  2.43it/s] 84%|████████▍ | 42/50 [00:21<00:03,  2.43it/s] 86%|████████▌ | 43/50 [00:21<00:02,  2.42it/s] 88%|████████▊ | 44/50 [00:22<00:02,  2.42it/s] 90%|█████████ | 45/50 [00:22<00:02,  2.42it/s] 92%|█████████▏| 46/50 [00:23<00:01,  2.42it/s] 94%|█████████▍| 47/50 [00:23<00:01,  2.42it/s] 96%|█████████▌| 48/50 [00:24<00:00,  2.42it/s] 98%|█████████▊| 49/50 [00:24<00:00,  2.42it/s]100%|██████████| 50/50 [00:29<00:00,  1.80s/it]100%|██████████| 50/50 [00:29<00:00,  1.70it/s]
