[I 2023-12-10 22:45:50,484] Trial 173 finished with value: 0.40185107278081617 and parameters: {'EMBEDDING_DIM': 941, 'HIDDEN_DIM': 224, 'NUM_LAYERS': 1, 'DROPOUT': 0.35179858916022577, 'LR': 0.0024551903752702514, 'WEIGHT_0': 0.34945678485599374, 'WEIGHT_1': 0.8008119744214326, 'WEIGHT_2': 0.5594795435368578, 'WEIGHT_3': 0.818206374599451, 'WEIGHT_4': 0.7121143229936834, 'WEIGHT_5': 0.5698346491983646, 'WEIGHT_6': 0.674069226594755, 'WEIGHT_7': 0.2912368132930913, 'WEIGHT_8': 0.5140811991296013, 'optimizer': 'RMSprop'}. Best is trial 134 with value: 0.4158467115484205.
/userhome/cs2/dingruiw/conda/envs/py310/lib/python3.10/site-packages/torch/nn/modules/rnn.py:82: UserWarning: dropout option adds dropout after all but last recurrent layer, so non-zero dropout expects num_layers greater than 1, but got dropout=0.3705774054413331 and num_layers=1
  warnings.warn("dropout option adds dropout after all but last "
{'EMBEDDING_DIM': 941, 'HIDDEN_DIM': 224, 'NUM_LAYERS': 1, 'DROPOUT': 0.35179858916022577, 'LR': 0.0024551903752702514, 'WEIGHT_0': 0.34945678485599374, 'WEIGHT_1': 0.8008119744214326, 'WEIGHT_2': 0.5594795435368578, 'WEIGHT_3': 0.818206374599451, 'WEIGHT_4': 0.7121143229936834, 'WEIGHT_5': 0.5698346491983646, 'WEIGHT_6': 0.674069226594755, 'WEIGHT_7': 0.2912368132930913, 'WEIGHT_8': 0.5140811991296013, 'optimizer': 'RMSprop'}
0
              precision    recall  f1-score   support

         LOC       0.44      0.11      0.17      1837
        MISC       0.10      0.03      0.05       922
         ORG       0.15      0.06      0.09      1341
         PER       0.07      0.01      0.02      1842

   micro avg       0.20      0.06      0.09      5942
   macro avg       0.19      0.05      0.08      5942
weighted avg       0.21      0.06      0.09      5942

{'EMBEDDING_DIM': 941, 'HIDDEN_DIM': 224, 'NUM_LAYERS': 1, 'DROPOUT': 0.35179858916022577, 'LR': 0.0024551903752702514, 'WEIGHT_0': 0.34945678485599374, 'WEIGHT_1': 0.8008119744214326, 'WEIGHT_2': 0.5594795435368578, 'WEIGHT_3': 0.818206374599451, 'WEIGHT_4': 0.7121143229936834, 'WEIGHT_5': 0.5698346491983646, 'WEIGHT_6': 0.674069226594755, 'WEIGHT_7': 0.2912368132930913, 'WEIGHT_8': 0.5140811991296013, 'optimizer': 'RMSprop'}
49
              precision    recall  f1-score   support

         LOC       0.58      0.53      0.56      1837
        MISC       0.42      0.43      0.42       922
         ORG       0.27      0.29      0.28      1341
         PER       0.33      0.35      0.34      1842

   micro avg       0.40      0.40      0.40      5942
   macro avg       0.40      0.40      0.40      5942
weighted avg       0.41      0.40      0.41      5942

epoch 49
LSTM
  0%|          | 0/50 [00:00<?, ?it/s]  2%|▏         | 1/50 [00:04<03:53,  4.77s/it]  4%|▍         | 2/50 [00:04<01:37,  2.04s/it]  6%|▌         | 3/50 [00:05<00:57,  1.22s/it]  8%|▊         | 4/50 [00:05<00:37,  1.21it/s] 10%|█         | 5/50 [00:05<00:27,  1.64it/s] 12%|█▏        | 6/50 [00:05<00:21,  2.09it/s] 14%|█▍        | 7/50 [00:06<00:17,  2.52it/s] 16%|█▌        | 8/50 [00:06<00:14,  2.92it/s] 18%|█▊        | 9/50 [00:06<00:12,  3.26it/s] 20%|██        | 10/50 [00:06<00:11,  3.55it/s] 22%|██▏       | 11/50 [00:06<00:10,  3.78it/s] 24%|██▍       | 12/50 [00:07<00:09,  3.95it/s] 26%|██▌       | 13/50 [00:07<00:09,  4.08it/s] 28%|██▊       | 14/50 [00:07<00:08,  4.17it/s] 30%|███       | 15/50 [00:07<00:08,  4.25it/s] 32%|███▏      | 16/50 [00:08<00:07,  4.29it/s] 34%|███▍      | 17/50 [00:08<00:07,  4.33it/s] 36%|███▌      | 18/50 [00:08<00:07,  4.35it/s] 38%|███▊      | 19/50 [00:08<00:07,  4.37it/s] 40%|████      | 20/50 [00:08<00:06,  4.38it/s] 42%|████▏     | 21/50 [00:09<00:06,  4.39it/s] 44%|████▍     | 22/50 [00:09<00:06,  4.39it/s] 46%|████▌     | 23/50 [00:09<00:06,  4.40it/s] 48%|████▊     | 24/50 [00:09<00:05,  4.40it/s] 50%|█████     | 25/50 [00:10<00:05,  4.40it/s] 52%|█████▏    | 26/50 [00:10<00:05,  4.40it/s] 54%|█████▍    | 27/50 [00:10<00:05,  4.40it/s] 56%|█████▌    | 28/50 [00:10<00:04,  4.40it/s] 58%|█████▊    | 29/50 [00:11<00:04,  4.41it/s] 60%|██████    | 30/50 [00:11<00:04,  4.40it/s] 62%|██████▏   | 31/50 [00:11<00:04,  4.40it/s] 64%|██████▍   | 32/50 [00:11<00:04,  4.40it/s] 66%|██████▌   | 33/50 [00:11<00:03,  4.41it/s] 68%|██████▊   | 34/50 [00:12<00:03,  4.40it/s] 70%|███████   | 35/50 [00:12<00:03,  4.40it/s] 72%|███████▏  | 36/50 [00:12<00:03,  4.40it/s] 74%|███████▍  | 37/50 [00:12<00:02,  4.40it/s] 76%|███████▌  | 38/50 [00:13<00:02,  4.40it/s] 78%|███████▊  | 39/50 [00:13<00:02,  4.40it/s] 80%|████████  | 40/50 [00:13<00:02,  4.40it/s] 82%|████████▏ | 41/50 [00:13<00:02,  4.40it/s] 84%|████████▍ | 42/50 [00:13<00:01,  4.40it/s] 86%|████████▌ | 43/50 [00:14<00:01,  4.39it/s] 88%|████████▊ | 44/50 [00:14<00:01,  4.39it/s] 90%|█████████ | 45/50 [00:14<00:01,  4.39it/s] 92%|█████████▏| 46/50 [00:14<00:00,  4.39it/s] 94%|█████████▍| 47/50 [00:15<00:00,  4.39it/s] 96%|█████████▌| 48/50 [00:15<00:00,  4.39it/s] 98%|█████████▊| 49/50 [00:15<00:00,  4.39it/s]100%|██████████| 50/50 [00:20<00:00,  1.67s/it]100%|██████████| 50/50 [00:20<00:00,  2.43it/s]
[I 2023-12-10 22:46:15,496] Trial 174 finished with value: 0.4092473308038472 and parameters: {'EMBEDDING_DIM': 1002, 'HIDDEN_DIM': 338, 'NUM_LAYERS': 1, 'DROPOUT': 0.3705774054413331, 'LR': 0.002691301141833049, 'WEIGHT_0': 0.3764448942767291, 'WEIGHT_1': 0.7480427260353449, 'WEIGHT_2': 0.5943631113672064, 'WEIGHT_3': 0.7816683159439929, 'WEIGHT_4': 0.5569613287661387, 'WEIGHT_5': 0.5464048158147978, 'WEIGHT_6': 0.7286625235121142, 'WEIGHT_7': 0.27215568567947895, 'WEIGHT_8': 0.49252196560224404, 'optimizer': 'RMSprop'}. Best is trial 134 with value: 0.4158467115484205.
/userhome/cs2/dingruiw/conda/envs/py310/lib/python3.10/site-packages/torch/nn/modules/rnn.py:82: UserWarning: dropout option adds dropout after all but last recurrent layer, so non-zero dropout expects num_layers greater than 1, but got dropout=0.37839034264719207 and num_layers=1
  warnings.warn("dropout option adds dropout after all but last "
{'EMBEDDING_DIM': 1002, 'HIDDEN_DIM': 338, 'NUM_LAYERS': 1, 'DROPOUT': 0.3705774054413331, 'LR': 0.002691301141833049, 'WEIGHT_0': 0.3764448942767291, 'WEIGHT_1': 0.7480427260353449, 'WEIGHT_2': 0.5943631113672064, 'WEIGHT_3': 0.7816683159439929, 'WEIGHT_4': 0.5569613287661387, 'WEIGHT_5': 0.5464048158147978, 'WEIGHT_6': 0.7286625235121142, 'WEIGHT_7': 0.27215568567947895, 'WEIGHT_8': 0.49252196560224404, 'optimizer': 'RMSprop'}
0
              precision    recall  f1-score   support

         LOC       0.38      0.09      0.15      1837
        MISC       0.08      0.03      0.04       922
         ORG       0.19      0.01      0.03      1341
         PER       0.08      0.02      0.03      1842

   micro avg       0.20      0.04      0.07      5942
   macro avg       0.18      0.04      0.06      5942
weighted avg       0.20      0.04      0.07      5942

{'EMBEDDING_DIM': 1002, 'HIDDEN_DIM': 338, 'NUM_LAYERS': 1, 'DROPOUT': 0.3705774054413331, 'LR': 0.002691301141833049, 'WEIGHT_0': 0.3764448942767291, 'WEIGHT_1': 0.7480427260353449, 'WEIGHT_2': 0.5943631113672064, 'WEIGHT_3': 0.7816683159439929, 'WEIGHT_4': 0.5569613287661387, 'WEIGHT_5': 0.5464048158147978, 'WEIGHT_6': 0.7286625235121142, 'WEIGHT_7': 0.27215568567947895, 'WEIGHT_8': 0.49252196560224404, 'optimizer': 'RMSprop'}
49
              precision    recall  f1-score   support

         LOC       0.61      0.54      0.57      1837
        MISC       0.48      0.43      0.45       922
         ORG       0.27      0.24      0.25      1341
         PER       0.35      0.34      0.35      1842

   micro avg       0.43      0.39      0.41      5942
   macro avg       0.43      0.38      0.40      5942
weighted avg       0.43      0.39      0.41      5942

epoch 49
LSTM
  0%|          | 0/50 [00:00<?, ?it/s]  2%|▏         | 1/50 [00:04<03:50,  4.70s/it]  4%|▍         | 2/50 [00:04<01:35,  2.00s/it]  6%|▌         | 3/50 [00:04<00:55,  1.17s/it]  8%|▊         | 4/50 [00:05<00:35,  1.28it/s] 10%|█         | 5/50 [00:05<00:25,  1.76it/s] 12%|█▏        | 6/50 [00:05<00:19,  2.29it/s] 14%|█▍        | 7/50 [00:05<00:15,  2.82it/s] 16%|█▌        | 8/50 [00:05<00:12,  3.32it/s] 18%|█▊        | 9/50 [00:06<00:10,  3.77it/s] 20%|██        | 10/50 [00:06<00:09,  4.15it/s] 22%|██▏       | 11/50 [00:06<00:08,  4.46it/s] 24%|██▍       | 12/50 [00:06<00:08,  4.70it/s] 26%|██▌       | 13/50 [00:06<00:07,  4.88it/s] 28%|██▊       | 14/50 [00:07<00:07,  5.02it/s] 30%|███       | 15/50 [00:07<00:06,  5.12it/s] 32%|███▏      | 16/50 [00:07<00:06,  5.20it/s] 34%|███▍      | 17/50 [00:07<00:06,  5.25it/s] 36%|███▌      | 18/50 [00:07<00:06,  5.28it/s] 38%|███▊      | 19/50 [00:07<00:05,  5.30it/s] 40%|████      | 20/50 [00:08<00:05,  5.32it/s] 42%|████▏     | 21/50 [00:08<00:05,  5.34it/s] 44%|████▍     | 22/50 [00:08<00:05,  5.35it/s] 46%|████▌     | 23/50 [00:08<00:05,  5.35it/s] 48%|████▊     | 24/50 [00:08<00:04,  5.35it/s] 50%|█████     | 25/50 [00:09<00:04,  5.36it/s] 52%|█████▏    | 26/50 [00:09<00:04,  5.36it/s] 54%|█████▍    | 27/50 [00:09<00:04,  5.37it/s] 56%|█████▌    | 28/50 [00:09<00:04,  5.37it/s] 58%|█████▊    | 29/50 [00:09<00:03,  5.37it/s] 60%|██████    | 30/50 [00:10<00:03,  5.37it/s] 62%|██████▏   | 31/50 [00:10<00:03,  5.36it/s] 64%|██████▍   | 32/50 [00:10<00:03,  5.37it/s] 66%|██████▌   | 33/50 [00:10<00:03,  5.36it/s] 68%|██████▊   | 34/50 [00:10<00:02,  5.36it/s] 70%|███████   | 35/50 [00:10<00:02,  5.36it/s] 72%|███████▏  | 36/50 [00:11<00:02,  5.36it/s] 74%|███████▍  | 37/50 [00:11<00:02,  5.36it/s] 76%|███████▌  | 38/50 [00:11<00:02,  5.36it/s] 78%|███████▊  | 39/50 [00:11<00:02,  5.35it/s] 80%|████████  | 40/50 [00:11<00:01,  5.35it/s] 82%|████████▏ | 41/50 [00:12<00:01,  5.36it/s] 84%|████████▍ | 42/50 [00:12<00:01,  5.36it/s] 86%|████████▌ | 43/50 [00:12<00:01,  5.36it/s] 88%|████████▊ | 44/50 [00:12<00:01,  5.35it/s] 90%|█████████ | 45/50 [00:12<00:00,  5.36it/s] 92%|█████████▏| 46/50 [00:13<00:00,  5.35it/s] 94%|█████████▍| 47/50 [00:13<00:00,  5.35it/s] 96%|█████████▌| 48/50 [00:13<00:00,  5.36it/s] 98%|█████████▊| 49/50 [00:13<00:00,  5.36it/s]100%|██████████| 50/50 [00:18<00:00,  1.56s/it]100%|██████████| 50/50 [00:18<00:00,  2.73it/s]
[I 2023-12-10 22:46:38,067] Trial 175 finished with value: 0.39735675158681855 and parameters: {'EMBEDDING_DIM': 997, 'HIDDEN_DIM': 266, 'NUM_LAYERS': 1, 'DROPOUT': 0.37839034264719207, 'LR': 0.0027284791017091574, 'WEIGHT_0': 0.32356944275040905, 'WEIGHT_1': 0.7427452501007926, 'WEIGHT_2': 0.6192769294013268, 'WEIGHT_3': 0.772973892697055, 'WEIGHT_4': 0.5390448093970195, 'WEIGHT_5': 0.5501684423463389, 'WEIGHT_6': 0.7341304029962926, 'WEIGHT_7': 0.27639304014354604, 'WEIGHT_8': 0.506399123132917, 'optimizer': 'RMSprop'}. Best is trial 134 with value: 0.4158467115484205.
/userhome/cs2/dingruiw/conda/envs/py310/lib/python3.10/site-packages/torch/nn/modules/rnn.py:82: UserWarning: dropout option adds dropout after all but last recurrent layer, so non-zero dropout expects num_layers greater than 1, but got dropout=0.3672660922833805 and num_layers=1
  warnings.warn("dropout option adds dropout after all but last "
{'EMBEDDING_DIM': 997, 'HIDDEN_DIM': 266, 'NUM_LAYERS': 1, 'DROPOUT': 0.37839034264719207, 'LR': 0.0027284791017091574, 'WEIGHT_0': 0.32356944275040905, 'WEIGHT_1': 0.7427452501007926, 'WEIGHT_2': 0.6192769294013268, 'WEIGHT_3': 0.772973892697055, 'WEIGHT_4': 0.5390448093970195, 'WEIGHT_5': 0.5501684423463389, 'WEIGHT_6': 0.7341304029962926, 'WEIGHT_7': 0.27639304014354604, 'WEIGHT_8': 0.506399123132917, 'optimizer': 'RMSprop'}
0
              precision    recall  f1-score   support

         LOC       0.44      0.21      0.29      1837
        MISC       0.08      0.02      0.04       922
         ORG       0.16      0.04      0.07      1341
         PER       0.06      0.04      0.05      1842

   micro avg       0.19      0.09      0.12      5942
   macro avg       0.18      0.08      0.11      5942
weighted avg       0.20      0.09      0.12      5942

{'EMBEDDING_DIM': 997, 'HIDDEN_DIM': 266, 'NUM_LAYERS': 1, 'DROPOUT': 0.37839034264719207, 'LR': 0.0027284791017091574, 'WEIGHT_0': 0.32356944275040905, 'WEIGHT_1': 0.7427452501007926, 'WEIGHT_2': 0.6192769294013268, 'WEIGHT_3': 0.772973892697055, 'WEIGHT_4': 0.5390448093970195, 'WEIGHT_5': 0.5501684423463389, 'WEIGHT_6': 0.7341304029962926, 'WEIGHT_7': 0.27639304014354604, 'WEIGHT_8': 0.506399123132917, 'optimizer': 'RMSprop'}
49
              precision    recall  f1-score   support

         LOC       0.61      0.51      0.55      1837
        MISC       0.43      0.45      0.44       922
         ORG       0.28      0.26      0.27      1341
         PER       0.32      0.32      0.32      1842

   micro avg       0.41      0.38      0.40      5942
   macro avg       0.41      0.38      0.40      5942
weighted avg       0.42      0.38      0.40      5942

epoch 49
LSTM
  0%|          | 0/50 [00:00<?, ?it/s]  2%|▏         | 1/50 [00:04<03:49,  4.69s/it]  4%|▍         | 2/50 [00:04<01:36,  2.01s/it]  6%|▌         | 3/50 [00:05<00:56,  1.19s/it]  8%|▊         | 4/50 [00:05<00:37,  1.23it/s] 10%|█         | 5/50 [00:05<00:27,  1.66it/s] 12%|█▏        | 6/50 [00:05<00:20,  2.11it/s] 14%|█▍        | 7/50 [00:05<00:16,  2.54it/s] 16%|█▌        | 8/50 [00:06<00:14,  2.93it/s] 18%|█▊        | 9/50 [00:06<00:12,  3.27it/s] 20%|██        | 10/50 [00:06<00:11,  3.55it/s] 22%|██▏       | 11/50 [00:06<00:10,  3.77it/s] 24%|██▍       | 12/50 [00:07<00:09,  3.94it/s] 26%|██▌       | 13/50 [00:07<00:09,  4.06it/s] 28%|██▊       | 14/50 [00:07<00:08,  4.16it/s] 30%|███       | 15/50 [00:07<00:08,  4.23it/s] 32%|███▏      | 16/50 [00:08<00:07,  4.28it/s] 34%|███▍      | 17/50 [00:08<00:07,  4.31it/s] 36%|███▌      | 18/50 [00:08<00:07,  4.33it/s] 38%|███▊      | 19/50 [00:08<00:07,  4.35it/s] 40%|████      | 20/50 [00:08<00:06,  4.36it/s] 42%|████▏     | 21/50 [00:09<00:06,  4.37it/s] 44%|████▍     | 22/50 [00:09<00:06,  4.37it/s] 46%|████▌     | 23/50 [00:09<00:06,  4.37it/s] 48%|████▊     | 24/50 [00:09<00:05,  4.38it/s] 50%|█████     | 25/50 [00:10<00:05,  4.38it/s] 52%|█████▏    | 26/50 [00:10<00:05,  4.38it/s] 54%|█████▍    | 27/50 [00:10<00:05,  4.38it/s] 56%|█████▌    | 28/50 [00:10<00:05,  4.38it/s] 58%|█████▊    | 29/50 [00:10<00:04,  4.38it/s] 60%|██████    | 30/50 [00:11<00:04,  4.38it/s] 62%|██████▏   | 31/50 [00:11<00:04,  4.38it/s] 64%|██████▍   | 32/50 [00:11<00:04,  4.38it/s] 66%|██████▌   | 33/50 [00:11<00:03,  4.38it/s] 68%|██████▊   | 34/50 [00:12<00:03,  4.38it/s] 70%|███████   | 35/50 [00:12<00:03,  4.38it/s] 72%|███████▏  | 36/50 [00:12<00:03,  4.38it/s] 74%|███████▍  | 37/50 [00:12<00:02,  4.37it/s] 76%|███████▌  | 38/50 [00:13<00:02,  4.37it/s] 78%|███████▊  | 39/50 [00:13<00:02,  4.37it/s] 80%|████████  | 40/50 [00:13<00:02,  4.37it/s] 82%|████████▏ | 41/50 [00:13<00:02,  4.37it/s] 84%|████████▍ | 42/50 [00:13<00:01,  4.37it/s] 86%|████████▌ | 43/50 [00:14<00:01,  4.37it/s] 88%|████████▊ | 44/50 [00:14<00:01,  4.37it/s] 90%|█████████ | 45/50 [00:14<00:01,  4.37it/s] 92%|█████████▏| 46/50 [00:14<00:00,  4.37it/s] 94%|█████████▍| 47/50 [00:15<00:00,  4.37it/s] 96%|█████████▌| 48/50 [00:15<00:00,  4.36it/s] 98%|█████████▊| 49/50 [00:15<00:00,  4.37it/s]100%|██████████| 50/50 [00:20<00:00,  1.61s/it]100%|██████████| 50/50 [00:20<00:00,  2.45it/s]
[I 2023-12-10 22:47:02,925] Trial 176 finished with value: 0.38913400813219134 and parameters: {'EMBEDDING_DIM': 1008, 'HIDDEN_DIM': 347, 'NUM_LAYERS': 1, 'DROPOUT': 0.3672660922833805, 'LR': 0.003389573333652921, 'WEIGHT_0': 0.3959349102299948, 'WEIGHT_1': 0.7816665903104801, 'WEIGHT_2': 0.6028069930377646, 'WEIGHT_3': 0.7165501142184729, 'WEIGHT_4': 0.5638170086716856, 'WEIGHT_5': 0.5186214561489874, 'WEIGHT_6': 0.7531820207748674, 'WEIGHT_7': 0.22600381363662406, 'WEIGHT_8': 0.47377333371206604, 'optimizer': 'RMSprop'}. Best is trial 134 with value: 0.4158467115484205.
/userhome/cs2/dingruiw/conda/envs/py310/lib/python3.10/site-packages/torch/nn/modules/rnn.py:82: UserWarning: dropout option adds dropout after all but last recurrent layer, so non-zero dropout expects num_layers greater than 1, but got dropout=0.3523634328737281 and num_layers=1
  warnings.warn("dropout option adds dropout after all but last "
{'EMBEDDING_DIM': 1008, 'HIDDEN_DIM': 347, 'NUM_LAYERS': 1, 'DROPOUT': 0.3672660922833805, 'LR': 0.003389573333652921, 'WEIGHT_0': 0.3959349102299948, 'WEIGHT_1': 0.7816665903104801, 'WEIGHT_2': 0.6028069930377646, 'WEIGHT_3': 0.7165501142184729, 'WEIGHT_4': 0.5638170086716856, 'WEIGHT_5': 0.5186214561489874, 'WEIGHT_6': 0.7531820207748674, 'WEIGHT_7': 0.22600381363662406, 'WEIGHT_8': 0.47377333371206604, 'optimizer': 'RMSprop'}
0
              precision    recall  f1-score   support

         LOC       0.37      0.10      0.16      1837
        MISC       0.02      0.01      0.01       922
         ORG       0.12      0.03      0.05      1341
         PER       0.07      0.01      0.01      1842

   micro avg       0.19      0.04      0.07      5942
   macro avg       0.14      0.04      0.06      5942
weighted avg       0.17      0.04      0.06      5942

{'EMBEDDING_DIM': 1008, 'HIDDEN_DIM': 347, 'NUM_LAYERS': 1, 'DROPOUT': 0.3672660922833805, 'LR': 0.003389573333652921, 'WEIGHT_0': 0.3959349102299948, 'WEIGHT_1': 0.7816665903104801, 'WEIGHT_2': 0.6028069930377646, 'WEIGHT_3': 0.7165501142184729, 'WEIGHT_4': 0.5638170086716856, 'WEIGHT_5': 0.5186214561489874, 'WEIGHT_6': 0.7531820207748674, 'WEIGHT_7': 0.22600381363662406, 'WEIGHT_8': 0.47377333371206604, 'optimizer': 'RMSprop'}
49
              precision    recall  f1-score   support

         LOC       0.60      0.51      0.55      1837
        MISC       0.40      0.40      0.40       922
         ORG       0.27      0.26      0.26      1341
         PER       0.33      0.32      0.32      1842

   micro avg       0.40      0.38      0.39      5942
   macro avg       0.40      0.37      0.38      5942
weighted avg       0.41      0.38      0.39      5942

epoch 49
LSTM
  0%|          | 0/50 [00:00<?, ?it/s]  2%|▏         | 1/50 [00:04<03:28,  4.26s/it]  4%|▍         | 2/50 [00:04<01:28,  1.83s/it]  6%|▌         | 3/50 [00:04<00:51,  1.11s/it]  8%|▊         | 4/50 [00:04<00:35,  1.31it/s] 10%|█         | 5/50 [00:05<00:25,  1.75it/s] 12%|█▏        | 6/50 [00:05<00:20,  2.19it/s] 14%|█▍        | 7/50 [00:05<00:16,  2.60it/s] 16%|█▌        | 8/50 [00:05<00:14,  2.97it/s] 18%|█▊        | 9/50 [00:06<00:12,  3.28it/s] 20%|██        | 10/50 [00:06<00:11,  3.53it/s] 22%|██▏       | 11/50 [00:06<00:10,  3.72it/s] 24%|██▍       | 12/50 [00:06<00:09,  3.87it/s] 26%|██▌       | 13/50 [00:06<00:09,  3.98it/s] 28%|██▊       | 14/50 [00:07<00:08,  4.06it/s] 30%|███       | 15/50 [00:07<00:08,  4.12it/s] 32%|███▏      | 16/50 [00:07<00:08,  4.16it/s] 34%|███▍      | 17/50 [00:07<00:07,  4.18it/s] 36%|███▌      | 18/50 [00:08<00:07,  4.21it/s] 38%|███▊      | 19/50 [00:08<00:07,  4.22it/s] 40%|████      | 20/50 [00:08<00:07,  4.23it/s] 42%|████▏     | 21/50 [00:08<00:06,  4.24it/s] 44%|████▍     | 22/50 [00:09<00:06,  4.24it/s] 46%|████▌     | 23/50 [00:09<00:06,  4.24it/s] 48%|████▊     | 24/50 [00:09<00:06,  4.25it/s] 50%|█████     | 25/50 [00:09<00:05,  4.25it/s] 52%|█████▏    | 26/50 [00:10<00:05,  4.25it/s] 54%|█████▍    | 27/50 [00:10<00:05,  4.25it/s] 56%|█████▌    | 28/50 [00:10<00:05,  4.25it/s] 58%|█████▊    | 29/50 [00:10<00:04,  4.25it/s] 60%|██████    | 30/50 [00:10<00:04,  4.25it/s] 62%|██████▏   | 31/50 [00:11<00:04,  4.25it/s] 64%|██████▍   | 32/50 [00:11<00:04,  4.25it/s] 66%|██████▌   | 33/50 [00:11<00:03,  4.25it/s] 68%|██████▊   | 34/50 [00:11<00:03,  4.25it/s] 70%|███████   | 35/50 [00:12<00:03,  4.25it/s] 72%|███████▏  | 36/50 [00:12<00:03,  4.25it/s] 74%|███████▍  | 37/50 [00:12<00:03,  4.25it/s] 76%|███████▌  | 38/50 [00:12<00:02,  4.25it/s] 78%|███████▊  | 39/50 [00:13<00:02,  4.25it/s] 80%|████████  | 40/50 [00:13<00:02,  4.25it/s] 82%|████████▏ | 41/50 [00:13<00:02,  4.25it/s] 84%|████████▍ | 42/50 [00:13<00:01,  4.25it/s] 86%|████████▌ | 43/50 [00:14<00:01,  4.25it/s] 88%|████████▊ | 44/50 [00:14<00:01,  4.25it/s] 90%|█████████ | 45/50 [00:14<00:01,  4.25it/s] 92%|█████████▏| 46/50 [00:14<00:00,  4.25it/s] 94%|█████████▍| 47/50 [00:14<00:00,  4.25it/s] 96%|█████████▌| 48/50 [00:15<00:00,  4.25it/s] 98%|█████████▊| 49/50 [00:15<00:00,  4.25it/s]100%|██████████| 50/50 [00:19<00:00,  1.48s/it]100%|██████████| 50/50 [00:19<00:00,  2.52it/s]
