[I 2023-12-10 22:19:20,780] Trial 113 finished with value: 0.396505251417418 and parameters: {'EMBEDDING_DIM': 1007, 'HIDDEN_DIM': 500, 'NUM_LAYERS': 1, 'DROPOUT': 0.36201720706673884, 'LR': 0.0026170461688208527, 'WEIGHT_0': 0.3348482737608879, 'WEIGHT_1': 0.7781007184335528, 'WEIGHT_2': 0.6133491382239283, 'WEIGHT_3': 0.7177884358599975, 'WEIGHT_4': 0.8850559070723218, 'WEIGHT_5': 0.4839359198769346, 'WEIGHT_6': 0.9251884347670466, 'WEIGHT_7': 0.38785154956569917, 'WEIGHT_8': 0.48636832438140326, 'optimizer': 'RMSprop'}. Best is trial 51 with value: 0.41438326562364947.
/userhome/cs2/dingruiw/conda/envs/py310/lib/python3.10/site-packages/torch/nn/modules/rnn.py:82: UserWarning: dropout option adds dropout after all but last recurrent layer, so non-zero dropout expects num_layers greater than 1, but got dropout=0.38302979484900823 and num_layers=1
  warnings.warn("dropout option adds dropout after all but last "
{'EMBEDDING_DIM': 1007, 'HIDDEN_DIM': 500, 'NUM_LAYERS': 1, 'DROPOUT': 0.36201720706673884, 'LR': 0.0026170461688208527, 'WEIGHT_0': 0.3348482737608879, 'WEIGHT_1': 0.7781007184335528, 'WEIGHT_2': 0.6133491382239283, 'WEIGHT_3': 0.7177884358599975, 'WEIGHT_4': 0.8850559070723218, 'WEIGHT_5': 0.4839359198769346, 'WEIGHT_6': 0.9251884347670466, 'WEIGHT_7': 0.38785154956569917, 'WEIGHT_8': 0.48636832438140326, 'optimizer': 'RMSprop'}
0
              precision    recall  f1-score   support

         LOC       0.09      0.09      0.09      1837
        MISC       0.03      0.05      0.04       922
         ORG       0.09      0.03      0.05      1341
         PER       0.01      0.02      0.01      1842

   micro avg       0.04      0.05      0.05      5942
   macro avg       0.06      0.05      0.05      5942
weighted avg       0.06      0.05      0.05      5942

{'EMBEDDING_DIM': 1007, 'HIDDEN_DIM': 500, 'NUM_LAYERS': 1, 'DROPOUT': 0.36201720706673884, 'LR': 0.0026170461688208527, 'WEIGHT_0': 0.3348482737608879, 'WEIGHT_1': 0.7781007184335528, 'WEIGHT_2': 0.6133491382239283, 'WEIGHT_3': 0.7177884358599975, 'WEIGHT_4': 0.8850559070723218, 'WEIGHT_5': 0.4839359198769346, 'WEIGHT_6': 0.9251884347670466, 'WEIGHT_7': 0.38785154956569917, 'WEIGHT_8': 0.48636832438140326, 'optimizer': 'RMSprop'}
49
              precision    recall  f1-score   support

         LOC       0.67      0.50      0.57      1837
        MISC       0.49      0.40      0.44       922
         ORG       0.29      0.23      0.26      1341
         PER       0.33      0.29      0.31      1842

   micro avg       0.44      0.36      0.40      5942
   macro avg       0.44      0.35      0.39      5942
weighted avg       0.45      0.36      0.40      5942

epoch 49
LSTM
  0%|          | 0/50 [00:00<?, ?it/s]  2%|▏         | 1/50 [00:04<04:04,  4.99s/it]  4%|▍         | 2/50 [00:05<01:43,  2.15s/it]  6%|▌         | 3/50 [00:05<01:01,  1.31s/it]  8%|▊         | 4/50 [00:05<00:41,  1.10it/s] 10%|█         | 5/50 [00:06<00:30,  1.46it/s] 12%|█▏        | 6/50 [00:06<00:24,  1.80it/s] 14%|█▍        | 7/50 [00:06<00:20,  2.13it/s] 16%|█▌        | 8/50 [00:06<00:17,  2.41it/s] 18%|█▊        | 9/50 [00:07<00:15,  2.65it/s] 20%|██        | 10/50 [00:07<00:14,  2.83it/s] 22%|██▏       | 11/50 [00:07<00:13,  2.98it/s] 24%|██▍       | 12/50 [00:08<00:12,  3.09it/s] 26%|██▌       | 13/50 [00:08<00:11,  3.17it/s] 28%|██▊       | 14/50 [00:08<00:11,  3.22it/s] 30%|███       | 15/50 [00:09<00:10,  3.27it/s] 32%|███▏      | 16/50 [00:09<00:10,  3.29it/s] 34%|███▍      | 17/50 [00:09<00:09,  3.31it/s] 36%|███▌      | 18/50 [00:09<00:09,  3.33it/s] 38%|███▊      | 19/50 [00:10<00:09,  3.34it/s] 40%|████      | 20/50 [00:10<00:08,  3.35it/s] 42%|████▏     | 21/50 [00:10<00:08,  3.36it/s] 44%|████▍     | 22/50 [00:11<00:08,  3.35it/s] 46%|████▌     | 23/50 [00:11<00:08,  3.36it/s] 48%|████▊     | 24/50 [00:11<00:07,  3.36it/s] 50%|█████     | 25/50 [00:11<00:07,  3.36it/s] 52%|█████▏    | 26/50 [00:12<00:07,  3.37it/s] 54%|█████▍    | 27/50 [00:12<00:06,  3.36it/s] 56%|█████▌    | 28/50 [00:12<00:06,  3.36it/s] 58%|█████▊    | 29/50 [00:13<00:06,  3.37it/s] 60%|██████    | 30/50 [00:13<00:05,  3.36it/s] 62%|██████▏   | 31/50 [00:13<00:05,  3.36it/s] 64%|██████▍   | 32/50 [00:14<00:05,  3.36it/s] 66%|██████▌   | 33/50 [00:14<00:05,  3.36it/s] 68%|██████▊   | 34/50 [00:14<00:04,  3.36it/s] 70%|███████   | 35/50 [00:14<00:04,  3.36it/s] 72%|███████▏  | 36/50 [00:15<00:04,  3.36it/s] 74%|███████▍  | 37/50 [00:15<00:03,  3.35it/s] 76%|███████▌  | 38/50 [00:15<00:03,  3.36it/s] 78%|███████▊  | 39/50 [00:16<00:03,  3.36it/s] 80%|████████  | 40/50 [00:16<00:02,  3.35it/s] 82%|████████▏ | 41/50 [00:16<00:02,  3.36it/s] 84%|████████▍ | 42/50 [00:17<00:02,  3.36it/s] 86%|████████▌ | 43/50 [00:17<00:02,  3.35it/s] 88%|████████▊ | 44/50 [00:17<00:01,  3.35it/s] 90%|█████████ | 45/50 [00:17<00:01,  3.35it/s] 92%|█████████▏| 46/50 [00:18<00:01,  3.35it/s] 94%|█████████▍| 47/50 [00:18<00:00,  3.35it/s] 96%|█████████▌| 48/50 [00:18<00:00,  3.35it/s] 98%|█████████▊| 49/50 [00:19<00:00,  3.35it/s]100%|██████████| 50/50 [00:24<00:00,  1.76s/it]100%|██████████| 50/50 [00:24<00:00,  2.06it/s]
[I 2023-12-10 22:19:49,464] Trial 114 finished with value: 0.3907526507908917 and parameters: {'EMBEDDING_DIM': 981, 'HIDDEN_DIM': 456, 'NUM_LAYERS': 1, 'DROPOUT': 0.38302979484900823, 'LR': 0.002403303831401829, 'WEIGHT_0': 0.3729022182158851, 'WEIGHT_1': 0.7228768777028765, 'WEIGHT_2': 0.5691783476435195, 'WEIGHT_3': 0.7681214852191289, 'WEIGHT_4': 0.8553221570119502, 'WEIGHT_5': 0.5712789732684328, 'WEIGHT_6': 0.9024547248553806, 'WEIGHT_7': 0.3312201440749529, 'WEIGHT_8': 0.5043251857093787, 'optimizer': 'RMSprop'}. Best is trial 51 with value: 0.41438326562364947.
/userhome/cs2/dingruiw/conda/envs/py310/lib/python3.10/site-packages/torch/nn/modules/rnn.py:82: UserWarning: dropout option adds dropout after all but last recurrent layer, so non-zero dropout expects num_layers greater than 1, but got dropout=0.3340172733625538 and num_layers=1
  warnings.warn("dropout option adds dropout after all but last "
{'EMBEDDING_DIM': 981, 'HIDDEN_DIM': 456, 'NUM_LAYERS': 1, 'DROPOUT': 0.38302979484900823, 'LR': 0.002403303831401829, 'WEIGHT_0': 0.3729022182158851, 'WEIGHT_1': 0.7228768777028765, 'WEIGHT_2': 0.5691783476435195, 'WEIGHT_3': 0.7681214852191289, 'WEIGHT_4': 0.8553221570119502, 'WEIGHT_5': 0.5712789732684328, 'WEIGHT_6': 0.9024547248553806, 'WEIGHT_7': 0.3312201440749529, 'WEIGHT_8': 0.5043251857093787, 'optimizer': 'RMSprop'}
0
              precision    recall  f1-score   support

         LOC       0.22      0.13      0.16      1837
        MISC       0.03      0.02      0.03       922
         ORG       0.09      0.01      0.02      1341
         PER       0.07      0.01      0.01      1842

   micro avg       0.13      0.05      0.07      5942
   macro avg       0.10      0.04      0.06      5942
weighted avg       0.12      0.05      0.06      5942

{'EMBEDDING_DIM': 981, 'HIDDEN_DIM': 456, 'NUM_LAYERS': 1, 'DROPOUT': 0.38302979484900823, 'LR': 0.002403303831401829, 'WEIGHT_0': 0.3729022182158851, 'WEIGHT_1': 0.7228768777028765, 'WEIGHT_2': 0.5691783476435195, 'WEIGHT_3': 0.7681214852191289, 'WEIGHT_4': 0.8553221570119502, 'WEIGHT_5': 0.5712789732684328, 'WEIGHT_6': 0.9024547248553806, 'WEIGHT_7': 0.3312201440749529, 'WEIGHT_8': 0.5043251857093787, 'optimizer': 'RMSprop'}
49
              precision    recall  f1-score   support

         LOC       0.55      0.50      0.53      1837
        MISC       0.44      0.40      0.42       922
         ORG       0.28      0.25      0.26      1341
         PER       0.33      0.34      0.33      1842

   micro avg       0.40      0.38      0.39      5942
   macro avg       0.40      0.37      0.39      5942
weighted avg       0.41      0.38      0.39      5942

epoch 49
LSTM
  0%|          | 0/50 [00:00<?, ?it/s]  2%|▏         | 1/50 [00:07<05:58,  7.32s/it]  4%|▍         | 2/50 [00:07<02:41,  3.36s/it]  6%|▌         | 3/50 [00:09<01:51,  2.37s/it]  8%|▊         | 4/50 [00:10<01:28,  1.92s/it] 10%|█         | 5/50 [00:11<01:14,  1.66s/it] 12%|█▏        | 6/50 [00:12<01:06,  1.51s/it] 14%|█▍        | 7/50 [00:13<01:00,  1.42s/it] 16%|█▌        | 8/50 [00:15<00:56,  1.36s/it] 18%|█▊        | 9/50 [00:16<00:54,  1.32s/it] 20%|██        | 10/50 [00:17<00:51,  1.29s/it] 22%|██▏       | 11/50 [00:18<00:49,  1.28s/it] 24%|██▍       | 12/50 [00:20<00:48,  1.27s/it] 26%|██▌       | 13/50 [00:21<00:46,  1.25s/it] 28%|██▊       | 14/50 [00:22<00:44,  1.25s/it] 30%|███       | 15/50 [00:23<00:43,  1.25s/it] 32%|███▏      | 16/50 [00:25<00:42,  1.25s/it] 34%|███▍      | 17/50 [00:26<00:41,  1.25s/it] 36%|███▌      | 18/50 [00:27<00:39,  1.25s/it] 38%|███▊      | 19/50 [00:28<00:38,  1.25s/it] 40%|████      | 20/50 [00:30<00:37,  1.25s/it] 42%|████▏     | 21/50 [00:31<00:36,  1.25s/it] 44%|████▍     | 22/50 [00:32<00:34,  1.25s/it] 46%|████▌     | 23/50 [00:33<00:33,  1.25s/it] 48%|████▊     | 24/50 [00:35<00:32,  1.24s/it] 50%|█████     | 25/50 [00:36<00:31,  1.25s/it] 52%|█████▏    | 26/50 [00:37<00:30,  1.25s/it] 54%|█████▍    | 27/50 [00:38<00:28,  1.25s/it] 56%|█████▌    | 28/50 [00:40<00:27,  1.25s/it] 58%|█████▊    | 29/50 [00:41<00:26,  1.25s/it] 60%|██████    | 30/50 [00:42<00:25,  1.25s/it] 62%|██████▏   | 31/50 [00:43<00:23,  1.26s/it] 64%|██████▍   | 32/50 [00:45<00:22,  1.26s/it] 66%|██████▌   | 33/50 [00:46<00:21,  1.26s/it] 68%|██████▊   | 34/50 [00:47<00:20,  1.26s/it] 70%|███████   | 35/50 [00:48<00:19,  1.27s/it] 72%|███████▏  | 36/50 [00:50<00:17,  1.27s/it] 74%|███████▍  | 37/50 [00:51<00:16,  1.27s/it] 76%|███████▌  | 38/50 [00:52<00:15,  1.27s/it] 78%|███████▊  | 39/50 [00:54<00:13,  1.27s/it] 80%|████████  | 40/50 [00:55<00:12,  1.27s/it] 82%|████████▏ | 41/50 [00:56<00:11,  1.27s/it] 84%|████████▍ | 42/50 [00:57<00:10,  1.28s/it] 86%|████████▌ | 43/50 [00:59<00:08,  1.27s/it] 88%|████████▊ | 44/50 [01:00<00:07,  1.27s/it] 90%|█████████ | 45/50 [01:01<00:06,  1.28s/it] 92%|█████████▏| 46/50 [01:02<00:05,  1.28s/it] 94%|█████████▍| 47/50 [01:04<00:03,  1.28s/it] 96%|█████████▌| 48/50 [01:05<00:02,  1.28s/it] 98%|█████████▊| 49/50 [01:06<00:01,  1.27s/it]100%|██████████| 50/50 [01:14<00:00,  3.29s/it]100%|██████████| 50/50 [01:14<00:00,  1.50s/it]
[I 2023-12-10 22:21:10,186] Trial 115 finished with value: 0.21547308832779224 and parameters: {'EMBEDDING_DIM': 939, 'HIDDEN_DIM': 1347, 'NUM_LAYERS': 1, 'DROPOUT': 0.3340172733625538, 'LR': 0.0031835611332771373, 'WEIGHT_0': 0.40888765062184473, 'WEIGHT_1': 0.8034613357189937, 'WEIGHT_2': 0.6454800775972601, 'WEIGHT_3': 0.7483991619335206, 'WEIGHT_4': 0.9260701448653437, 'WEIGHT_5': 0.5283837256077808, 'WEIGHT_6': 0.9420760612462198, 'WEIGHT_7': 0.28992418641980044, 'WEIGHT_8': 0.4614172107945311, 'optimizer': 'RMSprop'}. Best is trial 51 with value: 0.41438326562364947.
/userhome/cs2/dingruiw/conda/envs/py310/lib/python3.10/site-packages/torch/nn/modules/rnn.py:82: UserWarning: dropout option adds dropout after all but last recurrent layer, so non-zero dropout expects num_layers greater than 1, but got dropout=0.37313984684552187 and num_layers=1
  warnings.warn("dropout option adds dropout after all but last "
{'EMBEDDING_DIM': 939, 'HIDDEN_DIM': 1347, 'NUM_LAYERS': 1, 'DROPOUT': 0.3340172733625538, 'LR': 0.0031835611332771373, 'WEIGHT_0': 0.40888765062184473, 'WEIGHT_1': 0.8034613357189937, 'WEIGHT_2': 0.6454800775972601, 'WEIGHT_3': 0.7483991619335206, 'WEIGHT_4': 0.9260701448653437, 'WEIGHT_5': 0.5283837256077808, 'WEIGHT_6': 0.9420760612462198, 'WEIGHT_7': 0.28992418641980044, 'WEIGHT_8': 0.4614172107945311, 'optimizer': 'RMSprop'}
0
              precision    recall  f1-score   support

         LOC       0.08      0.02      0.03      1837
        MISC       0.01      0.01      0.01       922
         ORG       0.18      0.01      0.02      1341
         PER       0.02      0.00      0.00      1842

   micro avg       0.05      0.01      0.02      5942
   macro avg       0.07      0.01      0.01      5942
weighted avg       0.07      0.01      0.02      5942

{'EMBEDDING_DIM': 939, 'HIDDEN_DIM': 1347, 'NUM_LAYERS': 1, 'DROPOUT': 0.3340172733625538, 'LR': 0.0031835611332771373, 'WEIGHT_0': 0.40888765062184473, 'WEIGHT_1': 0.8034613357189937, 'WEIGHT_2': 0.6454800775972601, 'WEIGHT_3': 0.7483991619335206, 'WEIGHT_4': 0.9260701448653437, 'WEIGHT_5': 0.5283837256077808, 'WEIGHT_6': 0.9420760612462198, 'WEIGHT_7': 0.28992418641980044, 'WEIGHT_8': 0.4614172107945311, 'optimizer': 'RMSprop'}
49
              precision    recall  f1-score   support

         LOC       0.46      0.29      0.35      1837
        MISC       0.25      0.18      0.21       922
         ORG       0.19      0.17      0.18      1341
         PER       0.13      0.15      0.14      1842

   micro avg       0.23      0.20      0.22      5942
   macro avg       0.26      0.20      0.22      5942
weighted avg       0.26      0.20      0.23      5942

epoch 49
LSTM
  0%|          | 0/50 [00:00<?, ?it/s]  2%|▏         | 1/50 [00:04<03:52,  4.74s/it]  4%|▍         | 2/50 [00:04<01:37,  2.03s/it]  6%|▌         | 3/50 [00:05<00:57,  1.22s/it]  8%|▊         | 4/50 [00:05<00:38,  1.19it/s] 10%|█         | 5/50 [00:05<00:28,  1.59it/s] 12%|█▏        | 6/50 [00:05<00:22,  1.99it/s] 14%|█▍        | 7/50 [00:06<00:18,  2.37it/s] 16%|█▌        | 8/50 [00:06<00:15,  2.70it/s] 18%|█▊        | 9/50 [00:06<00:13,  2.99it/s] 20%|██        | 10/50 [00:06<00:12,  3.22it/s] 22%|██▏       | 11/50 [00:07<00:11,  3.39it/s] 24%|██▍       | 12/50 [00:07<00:10,  3.53it/s] 26%|██▌       | 13/50 [00:07<00:10,  3.63it/s] 28%|██▊       | 14/50 [00:07<00:09,  3.70it/s] 30%|███       | 15/50 [00:08<00:09,  3.76it/s] 32%|███▏      | 16/50 [00:08<00:08,  3.80it/s] 34%|███▍      | 17/50 [00:08<00:08,  3.82it/s] 36%|███▌      | 18/50 [00:08<00:08,  3.84it/s] 38%|███▊      | 19/50 [00:09<00:08,  3.85it/s] 40%|████      | 20/50 [00:09<00:07,  3.86it/s] 42%|████▏     | 21/50 [00:09<00:07,  3.87it/s] 44%|████▍     | 22/50 [00:10<00:07,  3.87it/s] 46%|████▌     | 23/50 [00:10<00:06,  3.87it/s] 48%|████▊     | 24/50 [00:10<00:06,  3.86it/s] 50%|█████     | 25/50 [00:10<00:06,  3.86it/s] 52%|█████▏    | 26/50 [00:11<00:06,  3.87it/s] 54%|█████▍    | 27/50 [00:11<00:05,  3.87it/s] 56%|█████▌    | 28/50 [00:11<00:05,  3.89it/s] 58%|█████▊    | 29/50 [00:11<00:05,  3.87it/s] 60%|██████    | 30/50 [00:12<00:05,  3.86it/s] 62%|██████▏   | 31/50 [00:12<00:04,  3.86it/s] 64%|██████▍   | 32/50 [00:12<00:04,  3.86it/s] 66%|██████▌   | 33/50 [00:12<00:04,  3.86it/s] 68%|██████▊   | 34/50 [00:13<00:04,  3.86it/s] 70%|███████   | 35/50 [00:13<00:03,  3.85it/s] 72%|███████▏  | 36/50 [00:13<00:03,  3.85it/s] 74%|███████▍  | 37/50 [00:13<00:03,  3.86it/s] 76%|███████▌  | 38/50 [00:14<00:03,  3.85it/s] 78%|███████▊  | 39/50 [00:14<00:02,  3.83it/s] 80%|████████  | 40/50 [00:14<00:02,  3.84it/s] 82%|████████▏ | 41/50 [00:14<00:02,  3.82it/s] 84%|████████▍ | 42/50 [00:15<00:02,  3.83it/s] 86%|████████▌ | 43/50 [00:15<00:01,  3.83it/s] 88%|████████▊ | 44/50 [00:15<00:01,  3.83it/s] 90%|█████████ | 45/50 [00:15<00:01,  3.83it/s] 92%|█████████▏| 46/50 [00:16<00:01,  3.84it/s] 94%|█████████▍| 47/50 [00:16<00:00,  3.85it/s] 96%|█████████▌| 48/50 [00:16<00:00,  3.84it/s] 98%|█████████▊| 49/50 [00:17<00:00,  3.83it/s]100%|██████████| 50/50 [00:21<00:00,  1.65s/it]100%|██████████| 50/50 [00:21<00:00,  2.28it/s]
[I 2023-12-10 22:21:36,317] Trial 116 finished with value: 0.39559881506559463 and parameters: {'EMBEDDING_DIM': 879, 'HIDDEN_DIM': 404, 'NUM_LAYERS': 1, 'DROPOUT': 0.37313984684552187, 'LR': 0.001466452052747859, 'WEIGHT_0': 0.4336881783742756, 'WEIGHT_1': 0.7022984248876202, 'WEIGHT_2': 0.6771289968736931, 'WEIGHT_3': 0.9791967564812268, 'WEIGHT_4': 0.9591087683544801, 'WEIGHT_5': 0.4487343684949548, 'WEIGHT_6': 0.9622921421855478, 'WEIGHT_7': 0.30846452358557086, 'WEIGHT_8': 0.3376215788575688, 'optimizer': 'Adam'}. Best is trial 51 with value: 0.41438326562364947.
/userhome/cs2/dingruiw/conda/envs/py310/lib/python3.10/site-packages/torch/nn/modules/rnn.py:82: UserWarning: dropout option adds dropout after all but last recurrent layer, so non-zero dropout expects num_layers greater than 1, but got dropout=0.32860346158273396 and num_layers=1
  warnings.warn("dropout option adds dropout after all but last "
{'EMBEDDING_DIM': 879, 'HIDDEN_DIM': 404, 'NUM_LAYERS': 1, 'DROPOUT': 0.37313984684552187, 'LR': 0.001466452052747859, 'WEIGHT_0': 0.4336881783742756, 'WEIGHT_1': 0.7022984248876202, 'WEIGHT_2': 0.6771289968736931, 'WEIGHT_3': 0.9791967564812268, 'WEIGHT_4': 0.9591087683544801, 'WEIGHT_5': 0.4487343684949548, 'WEIGHT_6': 0.9622921421855478, 'WEIGHT_7': 0.30846452358557086, 'WEIGHT_8': 0.3376215788575688, 'optimizer': 'Adam'}
0
              precision    recall  f1-score   support

         LOC       0.06      0.05      0.06      1837
        MISC       0.02      0.05      0.03       922
         ORG       0.03      0.06      0.04      1341
         PER       0.03      0.06      0.04      1842

   micro avg       0.03      0.06      0.04      5942
   macro avg       0.04      0.05      0.04      5942
weighted avg       0.04      0.06      0.04      5942

{'EMBEDDING_DIM': 879, 'HIDDEN_DIM': 404, 'NUM_LAYERS': 1, 'DROPOUT': 0.37313984684552187, 'LR': 0.001466452052747859, 'WEIGHT_0': 0.4336881783742756, 'WEIGHT_1': 0.7022984248876202, 'WEIGHT_2': 0.6771289968736931, 'WEIGHT_3': 0.9791967564812268, 'WEIGHT_4': 0.9591087683544801, 'WEIGHT_5': 0.4487343684949548, 'WEIGHT_6': 0.9622921421855478, 'WEIGHT_7': 0.30846452358557086, 'WEIGHT_8': 0.3376215788575688, 'optimizer': 'Adam'}
49
              precision    recall  f1-score   support

         LOC       0.56      0.51      0.53      1837
        MISC       0.42      0.43      0.42       922
         ORG       0.27      0.27      0.27      1341
         PER       0.33      0.35      0.34      1842

   micro avg       0.40      0.39      0.40      5942
   macro avg       0.40      0.39      0.39      5942
weighted avg       0.40      0.39      0.40      5942

epoch 49
LSTM
  0%|          | 0/50 [00:00<?, ?it/s]  2%|▏         | 1/50 [00:04<03:49,  4.68s/it]  4%|▍         | 2/50 [00:04<01:36,  2.01s/it]  6%|▌         | 3/50 [00:05<00:56,  1.21s/it]  8%|▊         | 4/50 [00:05<00:37,  1.21it/s] 10%|█         | 5/50 [00:05<00:27,  1.63it/s] 12%|█▏        | 6/50 [00:05<00:21,  2.05it/s] 14%|█▍        | 7/50 [00:06<00:17,  2.47it/s] 16%|█▌        | 8/50 [00:06<00:14,  2.84it/s] 18%|█▊        | 9/50 [00:06<00:13,  3.15it/s] 20%|██        | 10/50 [00:06<00:11,  3.41it/s] 22%|██▏       | 11/50 [00:06<00:10,  3.61it/s] 24%|██▍       | 12/50 [00:07<00:10,  3.76it/s] 26%|██▌       | 13/50 [00:07<00:09,  3.88it/s] 28%|██▊       | 14/50 [00:07<00:09,  3.96it/s] 30%|███       | 15/50 [00:07<00:08,  4.02it/s] 32%|███▏      | 16/50 [00:08<00:08,  4.07it/s] 34%|███▍      | 17/50 [00:08<00:08,  4.10it/s] 36%|███▌      | 18/50 [00:08<00:07,  4.12it/s] 38%|███▊      | 19/50 [00:08<00:07,  4.13it/s] 40%|████      | 20/50 [00:09<00:07,  4.14it/s] 42%|████▏     | 21/50 [00:09<00:06,  4.15it/s] 44%|████▍     | 22/50 [00:09<00:06,  4.16it/s] 46%|████▌     | 23/50 [00:09<00:06,  4.16it/s] 48%|████▊     | 24/50 [00:10<00:06,  4.16it/s] 50%|█████     | 25/50 [00:10<00:06,  4.17it/s] 52%|█████▏    | 26/50 [00:10<00:05,  4.16it/s] 54%|█████▍    | 27/50 [00:10<00:05,  4.17it/s] 56%|█████▌    | 28/50 [00:11<00:05,  4.17it/s] 58%|█████▊    | 29/50 [00:11<00:05,  4.17it/s] 60%|██████    | 30/50 [00:11<00:04,  4.17it/s] 62%|██████▏   | 31/50 [00:11<00:04,  4.17it/s] 64%|██████▍   | 32/50 [00:12<00:04,  4.17it/s] 66%|██████▌   | 33/50 [00:12<00:04,  4.17it/s] 68%|██████▊   | 34/50 [00:12<00:03,  4.16it/s] 70%|███████   | 35/50 [00:12<00:03,  4.16it/s] 72%|███████▏  | 36/50 [00:12<00:03,  4.16it/s] 74%|███████▍  | 37/50 [00:13<00:03,  4.16it/s] 76%|███████▌  | 38/50 [00:13<00:02,  4.16it/s] 78%|███████▊  | 39/50 [00:13<00:02,  4.16it/s] 80%|████████  | 40/50 [00:13<00:02,  4.16it/s] 82%|████████▏ | 41/50 [00:14<00:02,  4.16it/s] 84%|████████▍ | 42/50 [00:14<00:01,  4.16it/s] 86%|████████▌ | 43/50 [00:14<00:01,  4.17it/s] 88%|████████▊ | 44/50 [00:14<00:01,  4.16it/s] 90%|█████████ | 45/50 [00:15<00:01,  4.16it/s] 92%|█████████▏| 46/50 [00:15<00:00,  4.16it/s] 94%|█████████▍| 47/50 [00:15<00:00,  4.16it/s] 96%|█████████▌| 48/50 [00:15<00:00,  4.16it/s] 98%|█████████▊| 49/50 [00:16<00:00,  4.16it/s]100%|██████████| 50/50 [00:21<00:00,  1.65s/it]100%|██████████| 50/50 [00:21<00:00,  2.38it/s]
