[I 2023-12-10 23:14:56,892] Trial 229 finished with value: 0.4103474511793051 and parameters: {'EMBEDDING_DIM': 956, 'HIDDEN_DIM': 361, 'NUM_LAYERS': 1, 'DROPOUT': 0.3644894951016022, 'LR': 0.0016377203970805408, 'WEIGHT_0': 0.45907257156314984, 'WEIGHT_1': 0.46747443850634296, 'WEIGHT_2': 0.21607135852933673, 'WEIGHT_3': 0.9998811871609283, 'WEIGHT_4': 0.9422765226663428, 'WEIGHT_5': 0.5418710387146352, 'WEIGHT_6': 0.7342683164637737, 'WEIGHT_7': 0.3592491423988498, 'WEIGHT_8': 0.7904036822924291, 'optimizer': 'Adam'}. Best is trial 221 with value: 0.418736930154747.
/userhome/cs2/dingruiw/conda/envs/py310/lib/python3.10/site-packages/torch/nn/modules/rnn.py:82: UserWarning: dropout option adds dropout after all but last recurrent layer, so non-zero dropout expects num_layers greater than 1, but got dropout=0.38285090852130477 and num_layers=1
  warnings.warn("dropout option adds dropout after all but last "
{'EMBEDDING_DIM': 956, 'HIDDEN_DIM': 361, 'NUM_LAYERS': 1, 'DROPOUT': 0.3644894951016022, 'LR': 0.0016377203970805408, 'WEIGHT_0': 0.45907257156314984, 'WEIGHT_1': 0.46747443850634296, 'WEIGHT_2': 0.21607135852933673, 'WEIGHT_3': 0.9998811871609283, 'WEIGHT_4': 0.9422765226663428, 'WEIGHT_5': 0.5418710387146352, 'WEIGHT_6': 0.7342683164637737, 'WEIGHT_7': 0.3592491423988498, 'WEIGHT_8': 0.7904036822924291, 'optimizer': 'Adam'}
0
              precision    recall  f1-score   support

         LOC       0.05      0.07      0.06      1837
        MISC       0.01      0.02      0.02       922
         ORG       0.04      0.08      0.05      1341
         PER       0.03      0.04      0.03      1842

   micro avg       0.04      0.05      0.04      5942
   macro avg       0.03      0.05      0.04      5942
weighted avg       0.04      0.05      0.04      5942

{'EMBEDDING_DIM': 956, 'HIDDEN_DIM': 361, 'NUM_LAYERS': 1, 'DROPOUT': 0.3644894951016022, 'LR': 0.0016377203970805408, 'WEIGHT_0': 0.45907257156314984, 'WEIGHT_1': 0.46747443850634296, 'WEIGHT_2': 0.21607135852933673, 'WEIGHT_3': 0.9998811871609283, 'WEIGHT_4': 0.9422765226663428, 'WEIGHT_5': 0.5418710387146352, 'WEIGHT_6': 0.7342683164637737, 'WEIGHT_7': 0.3592491423988498, 'WEIGHT_8': 0.7904036822924291, 'optimizer': 'Adam'}
49
              precision    recall  f1-score   support

         LOC       0.56      0.57      0.57      1837
        MISC       0.51      0.41      0.46       922
         ORG       0.27      0.25      0.26      1341
         PER       0.33      0.35      0.34      1842

   micro avg       0.41      0.41      0.41      5942
   macro avg       0.42      0.40      0.41      5942
weighted avg       0.41      0.41      0.41      5942

epoch 49
LSTM
  0%|          | 0/50 [00:00<?, ?it/s]  2%|▏         | 1/50 [00:04<04:02,  4.95s/it]  4%|▍         | 2/50 [00:05<01:41,  2.11s/it]  6%|▌         | 3/50 [00:05<00:59,  1.26s/it]  8%|▊         | 4/50 [00:05<00:39,  1.18it/s] 10%|█         | 5/50 [00:05<00:28,  1.60it/s] 12%|█▏        | 6/50 [00:05<00:21,  2.04it/s] 14%|█▍        | 7/50 [00:06<00:17,  2.48it/s] 16%|█▌        | 8/50 [00:06<00:14,  2.88it/s] 18%|█▊        | 9/50 [00:06<00:12,  3.23it/s] 20%|██        | 10/50 [00:06<00:11,  3.52it/s] 22%|██▏       | 11/50 [00:07<00:10,  3.75it/s] 24%|██▍       | 12/50 [00:07<00:09,  3.93it/s] 26%|██▌       | 13/50 [00:07<00:09,  4.06it/s] 28%|██▊       | 14/50 [00:07<00:08,  4.16it/s] 30%|███       | 15/50 [00:08<00:08,  4.23it/s] 32%|███▏      | 16/50 [00:08<00:07,  4.28it/s] 34%|███▍      | 17/50 [00:08<00:07,  4.33it/s] 36%|███▌      | 18/50 [00:08<00:07,  4.35it/s] 38%|███▊      | 19/50 [00:08<00:07,  4.37it/s] 40%|████      | 20/50 [00:09<00:06,  4.38it/s] 42%|████▏     | 21/50 [00:09<00:06,  4.39it/s] 44%|████▍     | 22/50 [00:09<00:06,  4.40it/s] 46%|████▌     | 23/50 [00:09<00:06,  4.40it/s] 48%|████▊     | 24/50 [00:10<00:05,  4.40it/s] 50%|█████     | 25/50 [00:10<00:05,  4.40it/s] 52%|█████▏    | 26/50 [00:10<00:05,  4.40it/s] 54%|█████▍    | 27/50 [00:10<00:05,  4.40it/s] 56%|█████▌    | 28/50 [00:10<00:04,  4.40it/s] 58%|█████▊    | 29/50 [00:11<00:04,  4.41it/s] 60%|██████    | 30/50 [00:11<00:04,  4.40it/s] 62%|██████▏   | 31/50 [00:11<00:04,  4.40it/s] 64%|██████▍   | 32/50 [00:11<00:04,  4.40it/s] 66%|██████▌   | 33/50 [00:12<00:03,  4.40it/s] 68%|██████▊   | 34/50 [00:12<00:03,  4.39it/s] 70%|███████   | 35/50 [00:12<00:03,  4.39it/s] 72%|███████▏  | 36/50 [00:12<00:03,  4.39it/s] 74%|███████▍  | 37/50 [00:13<00:02,  4.39it/s] 76%|███████▌  | 38/50 [00:13<00:02,  4.39it/s] 78%|███████▊  | 39/50 [00:13<00:02,  4.39it/s] 80%|████████  | 40/50 [00:13<00:02,  4.39it/s] 82%|████████▏ | 41/50 [00:13<00:02,  4.39it/s] 84%|████████▍ | 42/50 [00:14<00:01,  4.39it/s] 86%|████████▌ | 43/50 [00:14<00:01,  4.39it/s] 88%|████████▊ | 44/50 [00:14<00:01,  4.39it/s] 90%|█████████ | 45/50 [00:14<00:01,  4.39it/s] 92%|█████████▏| 46/50 [00:15<00:00,  4.39it/s] 94%|█████████▍| 47/50 [00:15<00:00,  4.39it/s] 96%|█████████▌| 48/50 [00:15<00:00,  4.38it/s] 98%|█████████▊| 49/50 [00:15<00:00,  4.39it/s]100%|██████████| 50/50 [00:20<00:00,  1.67s/it]100%|██████████| 50/50 [00:20<00:00,  2.40it/s]
[I 2023-12-10 23:15:22,038] Trial 230 finished with value: 0.031610859420240486 and parameters: {'EMBEDDING_DIM': 989, 'HIDDEN_DIM': 357, 'NUM_LAYERS': 1, 'DROPOUT': 0.38285090852130477, 'LR': 0.0015006205666880078, 'WEIGHT_0': 0.4482191704198565, 'WEIGHT_1': 0.4491891248413409, 'WEIGHT_2': 0.20439333637394363, 'WEIGHT_3': 0.9984371867952441, 'WEIGHT_4': 0.9521804315420954, 'WEIGHT_5': 0.5357327067579822, 'WEIGHT_6': 0.7421090855454822, 'WEIGHT_7': 0.23776949171481135, 'WEIGHT_8': 0.9435689896841619, 'optimizer': 'SGD'}. Best is trial 221 with value: 0.418736930154747.
/userhome/cs2/dingruiw/conda/envs/py310/lib/python3.10/site-packages/torch/nn/modules/rnn.py:82: UserWarning: dropout option adds dropout after all but last recurrent layer, so non-zero dropout expects num_layers greater than 1, but got dropout=0.3659207486136178 and num_layers=1
  warnings.warn("dropout option adds dropout after all but last "
{'EMBEDDING_DIM': 989, 'HIDDEN_DIM': 357, 'NUM_LAYERS': 1, 'DROPOUT': 0.38285090852130477, 'LR': 0.0015006205666880078, 'WEIGHT_0': 0.4482191704198565, 'WEIGHT_1': 0.4491891248413409, 'WEIGHT_2': 0.20439333637394363, 'WEIGHT_3': 0.9984371867952441, 'WEIGHT_4': 0.9521804315420954, 'WEIGHT_5': 0.5357327067579822, 'WEIGHT_6': 0.7421090855454822, 'WEIGHT_7': 0.23776949171481135, 'WEIGHT_8': 0.9435689896841619, 'optimizer': 'SGD'}
0
              precision    recall  f1-score   support

         LOC       0.02      0.11      0.04      1837
        MISC       0.02      0.18      0.04       922
         ORG       0.02      0.11      0.03      1341
         PER       0.02      0.09      0.03      1842

   micro avg       0.02      0.12      0.03      5942
   macro avg       0.02      0.12      0.03      5942
weighted avg       0.02      0.12      0.03      5942

{'EMBEDDING_DIM': 989, 'HIDDEN_DIM': 357, 'NUM_LAYERS': 1, 'DROPOUT': 0.38285090852130477, 'LR': 0.0015006205666880078, 'WEIGHT_0': 0.4482191704198565, 'WEIGHT_1': 0.4491891248413409, 'WEIGHT_2': 0.20439333637394363, 'WEIGHT_3': 0.9984371867952441, 'WEIGHT_4': 0.9521804315420954, 'WEIGHT_5': 0.5357327067579822, 'WEIGHT_6': 0.7421090855454822, 'WEIGHT_7': 0.23776949171481135, 'WEIGHT_8': 0.9435689896841619, 'optimizer': 'SGD'}
49
              precision    recall  f1-score   support

         LOC       0.02      0.07      0.03      1837
        MISC       0.02      0.11      0.03       922
         ORG       0.02      0.08      0.03      1341
         PER       0.02      0.07      0.03      1842

   micro avg       0.02      0.08      0.03      5942
   macro avg       0.02      0.08      0.03      5942
weighted avg       0.02      0.08      0.03      5942

epoch 49
LSTM
  0%|          | 0/50 [00:00<?, ?it/s]  2%|▏         | 1/50 [00:04<03:57,  4.85s/it]  4%|▍         | 2/50 [00:04<01:39,  2.08s/it]  6%|▌         | 3/50 [00:05<00:59,  1.26s/it]  8%|▊         | 4/50 [00:05<00:40,  1.15it/s] 10%|█         | 5/50 [00:05<00:29,  1.53it/s] 12%|█▏        | 6/50 [00:06<00:23,  1.91it/s] 14%|█▍        | 7/50 [00:06<00:18,  2.26it/s] 16%|█▌        | 8/50 [00:06<00:16,  2.58it/s] 18%|█▊        | 9/50 [00:06<00:14,  2.85it/s] 20%|██        | 10/50 [00:07<00:13,  3.07it/s] 22%|██▏       | 11/50 [00:07<00:12,  3.23it/s] 24%|██▍       | 12/50 [00:07<00:11,  3.36it/s] 26%|██▌       | 13/50 [00:07<00:10,  3.45it/s] 28%|██▊       | 14/50 [00:08<00:10,  3.52it/s] 30%|███       | 15/50 [00:08<00:09,  3.57it/s] 32%|███▏      | 16/50 [00:08<00:09,  3.60it/s] 34%|███▍      | 17/50 [00:09<00:09,  3.63it/s] 36%|███▌      | 18/50 [00:09<00:08,  3.64it/s] 38%|███▊      | 19/50 [00:09<00:08,  3.66it/s] 40%|████      | 20/50 [00:09<00:08,  3.67it/s] 42%|████▏     | 21/50 [00:10<00:07,  3.67it/s] 44%|████▍     | 22/50 [00:10<00:07,  3.67it/s] 46%|████▌     | 23/50 [00:10<00:07,  3.67it/s] 48%|████▊     | 24/50 [00:10<00:07,  3.67it/s] 50%|█████     | 25/50 [00:11<00:06,  3.67it/s] 52%|█████▏    | 26/50 [00:11<00:06,  3.67it/s] 54%|█████▍    | 27/50 [00:11<00:06,  3.67it/s] 56%|█████▌    | 28/50 [00:12<00:05,  3.67it/s] 58%|█████▊    | 29/50 [00:12<00:05,  3.67it/s] 60%|██████    | 30/50 [00:12<00:05,  3.67it/s] 62%|██████▏   | 31/50 [00:12<00:05,  3.68it/s] 64%|██████▍   | 32/50 [00:13<00:04,  3.67it/s] 66%|██████▌   | 33/50 [00:13<00:04,  3.67it/s] 68%|██████▊   | 34/50 [00:13<00:04,  3.67it/s] 70%|███████   | 35/50 [00:13<00:04,  3.67it/s] 72%|███████▏  | 36/50 [00:14<00:03,  3.67it/s] 74%|███████▍  | 37/50 [00:14<00:03,  3.67it/s] 76%|███████▌  | 38/50 [00:14<00:03,  3.67it/s] 78%|███████▊  | 39/50 [00:15<00:03,  3.67it/s] 80%|████████  | 40/50 [00:15<00:02,  3.67it/s] 82%|████████▏ | 41/50 [00:15<00:02,  3.66it/s] 84%|████████▍ | 42/50 [00:15<00:02,  3.66it/s] 86%|████████▌ | 43/50 [00:16<00:01,  3.66it/s] 88%|████████▊ | 44/50 [00:16<00:01,  3.66it/s] 90%|█████████ | 45/50 [00:16<00:01,  3.66it/s] 92%|█████████▏| 46/50 [00:16<00:01,  3.66it/s] 94%|█████████▍| 47/50 [00:17<00:00,  3.66it/s] 96%|█████████▌| 48/50 [00:17<00:00,  3.66it/s] 98%|█████████▊| 49/50 [00:17<00:00,  3.65it/s]100%|██████████| 50/50 [00:22<00:00,  1.67s/it]100%|██████████| 50/50 [00:22<00:00,  2.20it/s]
[I 2023-12-10 23:15:48,992] Trial 231 finished with value: 0.399149298170991 and parameters: {'EMBEDDING_DIM': 957, 'HIDDEN_DIM': 408, 'NUM_LAYERS': 1, 'DROPOUT': 0.3659207486136178, 'LR': 0.0017054178601019928, 'WEIGHT_0': 0.4618841634880856, 'WEIGHT_1': 0.4975002740782033, 'WEIGHT_2': 0.2597483449742627, 'WEIGHT_3': 0.8078586560989828, 'WEIGHT_4': 0.9271066792519674, 'WEIGHT_5': 0.5637798840003481, 'WEIGHT_6': 0.707112055889942, 'WEIGHT_7': 0.36329913014466103, 'WEIGHT_8': 0.8014938336841658, 'optimizer': 'Adam'}. Best is trial 221 with value: 0.418736930154747.
/userhome/cs2/dingruiw/conda/envs/py310/lib/python3.10/site-packages/torch/nn/modules/rnn.py:82: UserWarning: dropout option adds dropout after all but last recurrent layer, so non-zero dropout expects num_layers greater than 1, but got dropout=0.36544509418249943 and num_layers=1
  warnings.warn("dropout option adds dropout after all but last "
{'EMBEDDING_DIM': 957, 'HIDDEN_DIM': 408, 'NUM_LAYERS': 1, 'DROPOUT': 0.3659207486136178, 'LR': 0.0017054178601019928, 'WEIGHT_0': 0.4618841634880856, 'WEIGHT_1': 0.4975002740782033, 'WEIGHT_2': 0.2597483449742627, 'WEIGHT_3': 0.8078586560989828, 'WEIGHT_4': 0.9271066792519674, 'WEIGHT_5': 0.5637798840003481, 'WEIGHT_6': 0.707112055889942, 'WEIGHT_7': 0.36329913014466103, 'WEIGHT_8': 0.8014938336841658, 'optimizer': 'Adam'}
0
              precision    recall  f1-score   support

         LOC       0.05      0.08      0.06      1837
        MISC       0.03      0.06      0.04       922
         ORG       0.05      0.07      0.06      1341
         PER       0.02      0.02      0.02      1842

   micro avg       0.04      0.06      0.05      5942
   macro avg       0.04      0.06      0.05      5942
weighted avg       0.04      0.06      0.05      5942

{'EMBEDDING_DIM': 957, 'HIDDEN_DIM': 408, 'NUM_LAYERS': 1, 'DROPOUT': 0.3659207486136178, 'LR': 0.0017054178601019928, 'WEIGHT_0': 0.4618841634880856, 'WEIGHT_1': 0.4975002740782033, 'WEIGHT_2': 0.2597483449742627, 'WEIGHT_3': 0.8078586560989828, 'WEIGHT_4': 0.9271066792519674, 'WEIGHT_5': 0.5637798840003481, 'WEIGHT_6': 0.707112055889942, 'WEIGHT_7': 0.36329913014466103, 'WEIGHT_8': 0.8014938336841658, 'optimizer': 'Adam'}
49
              precision    recall  f1-score   support

         LOC       0.54      0.53      0.54      1837
        MISC       0.45      0.43      0.44       922
         ORG       0.28      0.25      0.26      1341
         PER       0.32      0.34      0.33      1842

   micro avg       0.40      0.39      0.40      5942
   macro avg       0.40      0.39      0.40      5942
weighted avg       0.40      0.39      0.40      5942

epoch 49
LSTM
  0%|          | 0/50 [00:00<?, ?it/s]  2%|▏         | 1/50 [00:04<03:54,  4.78s/it]  4%|▍         | 2/50 [00:04<01:37,  2.04s/it]  6%|▌         | 3/50 [00:05<00:57,  1.22s/it]  8%|▊         | 4/50 [00:05<00:38,  1.21it/s] 10%|█         | 5/50 [00:05<00:27,  1.64it/s] 12%|█▏        | 6/50 [00:05<00:21,  2.08it/s] 14%|█▍        | 7/50 [00:06<00:17,  2.51it/s] 16%|█▌        | 8/50 [00:06<00:14,  2.90it/s] 18%|█▊        | 9/50 [00:06<00:12,  3.23it/s] 20%|██        | 10/50 [00:06<00:11,  3.51it/s] 22%|██▏       | 11/50 [00:06<00:10,  3.72it/s] 24%|██▍       | 12/50 [00:07<00:09,  3.90it/s] 26%|██▌       | 13/50 [00:07<00:09,  4.02it/s] 28%|██▊       | 14/50 [00:07<00:08,  4.12it/s] 30%|███       | 15/50 [00:07<00:08,  4.19it/s] 32%|███▏      | 16/50 [00:08<00:08,  4.23it/s] 34%|███▍      | 17/50 [00:08<00:07,  4.26it/s] 36%|███▌      | 18/50 [00:08<00:07,  4.28it/s] 38%|███▊      | 19/50 [00:08<00:07,  4.30it/s] 40%|████      | 20/50 [00:09<00:06,  4.32it/s] 42%|████▏     | 21/50 [00:09<00:06,  4.32it/s] 44%|████▍     | 22/50 [00:09<00:06,  4.32it/s] 46%|████▌     | 23/50 [00:09<00:06,  4.33it/s] 48%|████▊     | 24/50 [00:09<00:06,  4.33it/s] 50%|█████     | 25/50 [00:10<00:05,  4.33it/s] 52%|█████▏    | 26/50 [00:10<00:05,  4.33it/s] 54%|█████▍    | 27/50 [00:10<00:05,  4.33it/s] 56%|█████▌    | 28/50 [00:10<00:05,  4.33it/s] 58%|█████▊    | 29/50 [00:11<00:04,  4.33it/s] 60%|██████    | 30/50 [00:11<00:04,  4.33it/s] 62%|██████▏   | 31/50 [00:11<00:04,  4.33it/s] 64%|██████▍   | 32/50 [00:11<00:04,  4.33it/s] 66%|██████▌   | 33/50 [00:12<00:03,  4.33it/s] 68%|██████▊   | 34/50 [00:12<00:03,  4.33it/s] 70%|███████   | 35/50 [00:12<00:03,  4.33it/s] 72%|███████▏  | 36/50 [00:12<00:03,  4.33it/s] 74%|███████▍  | 37/50 [00:12<00:03,  4.33it/s] 76%|███████▌  | 38/50 [00:13<00:02,  4.33it/s] 78%|███████▊  | 39/50 [00:13<00:02,  4.33it/s] 80%|████████  | 40/50 [00:13<00:02,  4.33it/s] 82%|████████▏ | 41/50 [00:13<00:02,  4.33it/s] 84%|████████▍ | 42/50 [00:14<00:01,  4.33it/s] 86%|████████▌ | 43/50 [00:14<00:01,  4.33it/s] 88%|████████▊ | 44/50 [00:14<00:01,  4.33it/s] 90%|█████████ | 45/50 [00:14<00:01,  4.32it/s] 92%|█████████▏| 46/50 [00:15<00:00,  4.32it/s] 94%|█████████▍| 47/50 [00:15<00:00,  4.32it/s] 96%|█████████▌| 48/50 [00:15<00:00,  4.32it/s] 98%|█████████▊| 49/50 [00:15<00:00,  4.32it/s]100%|██████████| 50/50 [00:20<00:00,  1.62s/it]100%|██████████| 50/50 [00:20<00:00,  2.43it/s]
[I 2023-12-10 23:16:13,848] Trial 232 finished with value: 0.4001671541997493 and parameters: {'EMBEDDING_DIM': 1023, 'HIDDEN_DIM': 323, 'NUM_LAYERS': 1, 'DROPOUT': 0.36544509418249943, 'LR': 0.0020655505398855497, 'WEIGHT_0': 0.4931588094363084, 'WEIGHT_1': 0.5356352590146889, 'WEIGHT_2': 0.29702439001212105, 'WEIGHT_3': 0.9819666008127844, 'WEIGHT_4': 0.9691948078807441, 'WEIGHT_5': 0.5079539446080913, 'WEIGHT_6': 0.7337987063092237, 'WEIGHT_7': 0.3885570767106512, 'WEIGHT_8': 0.781314246623966, 'optimizer': 'Adam'}. Best is trial 221 with value: 0.418736930154747.
/userhome/cs2/dingruiw/conda/envs/py310/lib/python3.10/site-packages/torch/nn/modules/rnn.py:82: UserWarning: dropout option adds dropout after all but last recurrent layer, so non-zero dropout expects num_layers greater than 1, but got dropout=0.3567818628625311 and num_layers=1
  warnings.warn("dropout option adds dropout after all but last "
{'EMBEDDING_DIM': 1023, 'HIDDEN_DIM': 323, 'NUM_LAYERS': 1, 'DROPOUT': 0.36544509418249943, 'LR': 0.0020655505398855497, 'WEIGHT_0': 0.4931588094363084, 'WEIGHT_1': 0.5356352590146889, 'WEIGHT_2': 0.29702439001212105, 'WEIGHT_3': 0.9819666008127844, 'WEIGHT_4': 0.9691948078807441, 'WEIGHT_5': 0.5079539446080913, 'WEIGHT_6': 0.7337987063092237, 'WEIGHT_7': 0.3885570767106512, 'WEIGHT_8': 0.781314246623966, 'optimizer': 'Adam'}
0
              precision    recall  f1-score   support

         LOC       0.05      0.09      0.06      1837
        MISC       0.02      0.06      0.03       922
         ORG       0.04      0.08      0.05      1341
         PER       0.03      0.03      0.03      1842

   micro avg       0.04      0.07      0.05      5942
   macro avg       0.03      0.07      0.04      5942
weighted avg       0.03      0.07      0.04      5942

{'EMBEDDING_DIM': 1023, 'HIDDEN_DIM': 323, 'NUM_LAYERS': 1, 'DROPOUT': 0.36544509418249943, 'LR': 0.0020655505398855497, 'WEIGHT_0': 0.4931588094363084, 'WEIGHT_1': 0.5356352590146889, 'WEIGHT_2': 0.29702439001212105, 'WEIGHT_3': 0.9819666008127844, 'WEIGHT_4': 0.9691948078807441, 'WEIGHT_5': 0.5079539446080913, 'WEIGHT_6': 0.7337987063092237, 'WEIGHT_7': 0.3885570767106512, 'WEIGHT_8': 0.781314246623966, 'optimizer': 'Adam'}
49
              precision    recall  f1-score   support

         LOC       0.56      0.52      0.54      1837
        MISC       0.46      0.43      0.45       922
         ORG       0.29      0.27      0.28      1341
         PER       0.30      0.36      0.33      1842

   micro avg       0.40      0.40      0.40      5942
   macro avg       0.41      0.40      0.40      5942
weighted avg       0.41      0.40      0.40      5942

epoch 49
LSTM
  0%|          | 0/50 [00:00<?, ?it/s]  2%|▏         | 1/50 [00:04<03:49,  4.68s/it]  6%|▌         | 3/50 [00:04<01:01,  1.31s/it]  8%|▊         | 4/50 [00:05<00:41,  1.10it/s] 10%|█         | 5/50 [00:05<00:29,  1.52it/s] 12%|█▏        | 6/50 [00:05<00:21,  2.01it/s] 14%|█▍        | 7/50 [00:05<00:16,  2.58it/s] 16%|█▌        | 8/50 [00:05<00:13,  3.17it/s] 18%|█▊        | 9/50 [00:05<00:10,  3.77it/s] 20%|██        | 10/50 [00:06<00:09,  4.33it/s] 22%|██▏       | 11/50 [00:06<00:08,  4.83it/s] 24%|██▍       | 12/50 [00:06<00:07,  5.24it/s] 26%|██▌       | 13/50 [00:06<00:06,  5.58it/s] 28%|██▊       | 14/50 [00:06<00:06,  5.83it/s] 30%|███       | 15/50 [00:06<00:05,  6.03it/s] 32%|███▏      | 16/50 [00:06<00:05,  6.18it/s] 34%|███▍      | 17/50 [00:07<00:05,  6.29it/s] 36%|███▌      | 18/50 [00:07<00:05,  6.37it/s] 38%|███▊      | 19/50 [00:07<00:04,  6.43it/s] 40%|████      | 20/50 [00:07<00:04,  6.46it/s] 42%|████▏     | 21/50 [00:07<00:04,  6.48it/s] 44%|████▍     | 22/50 [00:07<00:04,  6.50it/s] 46%|████▌     | 23/50 [00:07<00:04,  6.51it/s] 48%|████▊     | 24/50 [00:08<00:03,  6.51it/s] 50%|█████     | 25/50 [00:08<00:03,  6.52it/s] 52%|█████▏    | 26/50 [00:08<00:03,  6.53it/s] 54%|█████▍    | 27/50 [00:08<00:03,  6.54it/s] 56%|█████▌    | 28/50 [00:08<00:03,  6.53it/s] 58%|█████▊    | 29/50 [00:08<00:03,  6.54it/s] 60%|██████    | 30/50 [00:09<00:03,  6.53it/s] 62%|██████▏   | 31/50 [00:09<00:02,  6.53it/s] 64%|██████▍   | 32/50 [00:09<00:02,  6.52it/s] 66%|██████▌   | 33/50 [00:09<00:02,  6.51it/s] 68%|██████▊   | 34/50 [00:09<00:02,  6.51it/s] 70%|███████   | 35/50 [00:09<00:02,  6.52it/s] 72%|███████▏  | 36/50 [00:09<00:02,  6.53it/s] 74%|███████▍  | 37/50 [00:10<00:01,  6.53it/s] 76%|███████▌  | 38/50 [00:10<00:01,  6.53it/s] 78%|███████▊  | 39/50 [00:10<00:01,  6.52it/s] 80%|████████  | 40/50 [00:10<00:01,  6.52it/s] 82%|████████▏ | 41/50 [00:10<00:01,  6.51it/s] 84%|████████▍ | 42/50 [00:10<00:01,  6.52it/s] 86%|████████▌ | 43/50 [00:11<00:01,  6.53it/s] 88%|████████▊ | 44/50 [00:11<00:00,  6.53it/s] 90%|█████████ | 45/50 [00:11<00:00,  6.53it/s] 92%|█████████▏| 46/50 [00:11<00:00,  6.53it/s] 94%|█████████▍| 47/50 [00:11<00:00,  6.52it/s] 96%|█████████▌| 48/50 [00:11<00:00,  6.51it/s] 98%|█████████▊| 49/50 [00:11<00:00,  6.52it/s]100%|██████████| 50/50 [00:16<00:00,  1.54s/it]100%|██████████| 50/50 [00:16<00:00,  2.99it/s]
