[I 2023-12-10 23:27:45,123] Trial 257 finished with value: 0.3981288112939603 and parameters: {'EMBEDDING_DIM': 960, 'HIDDEN_DIM': 304, 'NUM_LAYERS': 1, 'DROPOUT': 0.15239621569069117, 'LR': 0.0014663911741597795, 'WEIGHT_0': 0.3778878901359393, 'WEIGHT_1': 0.5007731372428416, 'WEIGHT_2': 0.6413710401942003, 'WEIGHT_3': 0.8311546413349674, 'WEIGHT_4': 0.7465772071290323, 'WEIGHT_5': 0.8223664199594565, 'WEIGHT_6': 0.01400202110732307, 'WEIGHT_7': 0.4732983428564629, 'WEIGHT_8': 0.41566507215160886, 'optimizer': 'RMSprop'}. Best is trial 221 with value: 0.418736930154747.
/userhome/cs2/dingruiw/conda/envs/py310/lib/python3.10/site-packages/torch/nn/modules/rnn.py:82: UserWarning: dropout option adds dropout after all but last recurrent layer, so non-zero dropout expects num_layers greater than 1, but got dropout=0.2752161430810195 and num_layers=1
  warnings.warn("dropout option adds dropout after all but last "
{'EMBEDDING_DIM': 960, 'HIDDEN_DIM': 304, 'NUM_LAYERS': 1, 'DROPOUT': 0.15239621569069117, 'LR': 0.0014663911741597795, 'WEIGHT_0': 0.3778878901359393, 'WEIGHT_1': 0.5007731372428416, 'WEIGHT_2': 0.6413710401942003, 'WEIGHT_3': 0.8311546413349674, 'WEIGHT_4': 0.7465772071290323, 'WEIGHT_5': 0.8223664199594565, 'WEIGHT_6': 0.01400202110732307, 'WEIGHT_7': 0.4732983428564629, 'WEIGHT_8': 0.41566507215160886, 'optimizer': 'RMSprop'}
0
              precision    recall  f1-score   support

         LOC       0.29      0.21      0.24      1837
        MISC       0.05      0.03      0.04       922
         ORG       0.08      0.04      0.05      1341
         PER       0.05      0.04      0.04      1842

   micro avg       0.13      0.09      0.11      5942
   macro avg       0.12      0.08      0.09      5942
weighted avg       0.13      0.09      0.11      5942

{'EMBEDDING_DIM': 960, 'HIDDEN_DIM': 304, 'NUM_LAYERS': 1, 'DROPOUT': 0.15239621569069117, 'LR': 0.0014663911741597795, 'WEIGHT_0': 0.3778878901359393, 'WEIGHT_1': 0.5007731372428416, 'WEIGHT_2': 0.6413710401942003, 'WEIGHT_3': 0.8311546413349674, 'WEIGHT_4': 0.7465772071290323, 'WEIGHT_5': 0.8223664199594565, 'WEIGHT_6': 0.01400202110732307, 'WEIGHT_7': 0.4732983428564629, 'WEIGHT_8': 0.41566507215160886, 'optimizer': 'RMSprop'}
49
              precision    recall  f1-score   support

         LOC       0.52      0.54      0.53      1837
        MISC       0.41      0.46      0.43       922
         ORG       0.28      0.21      0.24      1341
         PER       0.33      0.37      0.35      1842

   micro avg       0.40      0.40      0.40      5942
   macro avg       0.38      0.40      0.39      5942
weighted avg       0.39      0.40      0.39      5942

epoch 49
LSTM
  0%|          | 0/50 [00:00<?, ?it/s]  2%|▏         | 1/50 [00:05<04:05,  5.01s/it]  4%|▍         | 2/50 [00:05<01:42,  2.14s/it]  6%|▌         | 3/50 [00:05<01:00,  1.28s/it]  8%|▊         | 4/50 [00:05<00:40,  1.15it/s] 10%|█         | 5/50 [00:05<00:29,  1.54it/s] 12%|█▏        | 6/50 [00:06<00:22,  1.95it/s] 14%|█▍        | 7/50 [00:06<00:18,  2.33it/s] 16%|█▌        | 8/50 [00:06<00:15,  2.69it/s] 18%|█▊        | 9/50 [00:06<00:13,  2.99it/s] 20%|██        | 10/50 [00:07<00:12,  3.24it/s] 22%|██▏       | 11/50 [00:07<00:11,  3.42it/s] 24%|██▍       | 12/50 [00:07<00:10,  3.58it/s] 26%|██▌       | 13/50 [00:07<00:10,  3.69it/s] 28%|██▊       | 14/50 [00:08<00:09,  3.76it/s] 30%|███       | 15/50 [00:08<00:09,  3.82it/s] 32%|███▏      | 16/50 [00:08<00:08,  3.86it/s] 34%|███▍      | 17/50 [00:08<00:08,  3.89it/s] 36%|███▌      | 18/50 [00:09<00:08,  3.91it/s] 38%|███▊      | 19/50 [00:09<00:07,  3.92it/s] 40%|████      | 20/50 [00:09<00:07,  3.93it/s] 42%|████▏     | 21/50 [00:09<00:07,  3.94it/s] 44%|████▍     | 22/50 [00:10<00:07,  3.95it/s] 46%|████▌     | 23/50 [00:10<00:06,  3.95it/s] 48%|████▊     | 24/50 [00:10<00:06,  3.95it/s] 50%|█████     | 25/50 [00:10<00:06,  3.95it/s] 52%|█████▏    | 26/50 [00:11<00:06,  3.96it/s] 54%|█████▍    | 27/50 [00:11<00:05,  3.96it/s] 56%|█████▌    | 28/50 [00:11<00:05,  3.95it/s] 58%|█████▊    | 29/50 [00:11<00:05,  3.95it/s] 60%|██████    | 30/50 [00:12<00:05,  3.95it/s] 62%|██████▏   | 31/50 [00:12<00:04,  3.94it/s] 64%|██████▍   | 32/50 [00:12<00:04,  3.94it/s] 66%|██████▌   | 33/50 [00:12<00:04,  3.94it/s] 68%|██████▊   | 34/50 [00:13<00:04,  3.94it/s] 70%|███████   | 35/50 [00:13<00:03,  3.94it/s] 72%|███████▏  | 36/50 [00:13<00:03,  3.94it/s] 74%|███████▍  | 37/50 [00:13<00:03,  3.94it/s] 76%|███████▌  | 38/50 [00:14<00:03,  3.94it/s] 78%|███████▊  | 39/50 [00:14<00:02,  3.94it/s] 80%|████████  | 40/50 [00:14<00:02,  3.94it/s] 82%|████████▏ | 41/50 [00:15<00:02,  3.94it/s] 84%|████████▍ | 42/50 [00:15<00:02,  3.94it/s] 86%|████████▌ | 43/50 [00:15<00:01,  3.94it/s] 88%|████████▊ | 44/50 [00:15<00:01,  3.94it/s] 90%|█████████ | 45/50 [00:16<00:01,  3.94it/s] 92%|█████████▏| 46/50 [00:16<00:01,  3.94it/s] 94%|█████████▍| 47/50 [00:16<00:00,  3.94it/s] 96%|█████████▌| 48/50 [00:16<00:00,  3.94it/s] 98%|█████████▊| 49/50 [00:17<00:00,  3.94it/s]100%|██████████| 50/50 [00:22<00:00,  1.68s/it]100%|██████████| 50/50 [00:22<00:00,  2.27it/s]
[I 2023-12-10 23:28:11,438] Trial 258 finished with value: 0.38391224862888484 and parameters: {'EMBEDDING_DIM': 1009, 'HIDDEN_DIM': 373, 'NUM_LAYERS': 1, 'DROPOUT': 0.2752161430810195, 'LR': 0.0006357803680828578, 'WEIGHT_0': 0.41509512769046025, 'WEIGHT_1': 0.7738530855404276, 'WEIGHT_2': 0.7145323492280007, 'WEIGHT_3': 0.7997140856245151, 'WEIGHT_4': 0.5545393514942168, 'WEIGHT_5': 0.5742314474122375, 'WEIGHT_6': 0.5472902618242832, 'WEIGHT_7': 0.42157751318785114, 'WEIGHT_8': 0.6091381576249663, 'optimizer': 'Adam'}. Best is trial 221 with value: 0.418736930154747.
/userhome/cs2/dingruiw/conda/envs/py310/lib/python3.10/site-packages/torch/nn/modules/rnn.py:82: UserWarning: dropout option adds dropout after all but last recurrent layer, so non-zero dropout expects num_layers greater than 1, but got dropout=0.2320636547145471 and num_layers=1
  warnings.warn("dropout option adds dropout after all but last "
{'EMBEDDING_DIM': 1009, 'HIDDEN_DIM': 373, 'NUM_LAYERS': 1, 'DROPOUT': 0.2752161430810195, 'LR': 0.0006357803680828578, 'WEIGHT_0': 0.41509512769046025, 'WEIGHT_1': 0.7738530855404276, 'WEIGHT_2': 0.7145323492280007, 'WEIGHT_3': 0.7997140856245151, 'WEIGHT_4': 0.5545393514942168, 'WEIGHT_5': 0.5742314474122375, 'WEIGHT_6': 0.5472902618242832, 'WEIGHT_7': 0.42157751318785114, 'WEIGHT_8': 0.6091381576249663, 'optimizer': 'Adam'}
0
              precision    recall  f1-score   support

         LOC       0.04      0.08      0.05      1837
        MISC       0.02      0.11      0.03       922
         ORG       0.02      0.09      0.03      1341
         PER       0.02      0.09      0.03      1842

   micro avg       0.02      0.09      0.04      5942
   macro avg       0.02      0.09      0.04      5942
weighted avg       0.03      0.09      0.04      5942

{'EMBEDDING_DIM': 1009, 'HIDDEN_DIM': 373, 'NUM_LAYERS': 1, 'DROPOUT': 0.2752161430810195, 'LR': 0.0006357803680828578, 'WEIGHT_0': 0.41509512769046025, 'WEIGHT_1': 0.7738530855404276, 'WEIGHT_2': 0.7145323492280007, 'WEIGHT_3': 0.7997140856245151, 'WEIGHT_4': 0.5545393514942168, 'WEIGHT_5': 0.5742314474122375, 'WEIGHT_6': 0.5472902618242832, 'WEIGHT_7': 0.42157751318785114, 'WEIGHT_8': 0.6091381576249663, 'optimizer': 'Adam'}
49
              precision    recall  f1-score   support

         LOC       0.61      0.50      0.55      1837
        MISC       0.45      0.38      0.41       922
         ORG       0.32      0.22      0.26      1341
         PER       0.30      0.29      0.30      1842

   micro avg       0.42      0.35      0.38      5942
   macro avg       0.42      0.35      0.38      5942
weighted avg       0.42      0.35      0.38      5942

epoch 49
LSTM
  0%|          | 0/50 [00:00<?, ?it/s]  2%|▏         | 1/50 [00:04<03:56,  4.83s/it]  4%|▍         | 2/50 [00:05<01:40,  2.09s/it]  6%|▌         | 3/50 [00:05<01:00,  1.29s/it]  8%|▊         | 4/50 [00:05<00:41,  1.10it/s] 10%|█         | 5/50 [00:05<00:31,  1.44it/s] 12%|█▏        | 6/50 [00:06<00:25,  1.76it/s] 14%|█▍        | 7/50 [00:06<00:21,  2.04it/s] 16%|█▌        | 8/50 [00:06<00:18,  2.29it/s] 18%|█▊        | 9/50 [00:07<00:16,  2.49it/s] 20%|██        | 10/50 [00:07<00:15,  2.64it/s] 22%|██▏       | 11/50 [00:07<00:14,  2.76it/s] 24%|██▍       | 12/50 [00:08<00:13,  2.85it/s] 26%|██▌       | 13/50 [00:08<00:12,  2.92it/s] 28%|██▊       | 14/50 [00:08<00:12,  2.96it/s] 30%|███       | 15/50 [00:09<00:11,  3.00it/s] 32%|███▏      | 16/50 [00:09<00:11,  3.02it/s] 34%|███▍      | 17/50 [00:09<00:10,  3.04it/s] 36%|███▌      | 18/50 [00:10<00:10,  3.05it/s] 38%|███▊      | 19/50 [00:10<00:10,  3.06it/s] 40%|████      | 20/50 [00:10<00:09,  3.06it/s] 42%|████▏     | 21/50 [00:11<00:09,  3.06it/s] 44%|████▍     | 22/50 [00:11<00:09,  3.07it/s] 46%|████▌     | 23/50 [00:11<00:08,  3.07it/s] 48%|████▊     | 24/50 [00:12<00:08,  3.07it/s] 50%|█████     | 25/50 [00:12<00:08,  3.07it/s] 52%|█████▏    | 26/50 [00:12<00:07,  3.07it/s] 54%|█████▍    | 27/50 [00:13<00:07,  3.07it/s] 56%|█████▌    | 28/50 [00:13<00:07,  3.07it/s] 58%|█████▊    | 29/50 [00:13<00:06,  3.06it/s] 60%|██████    | 30/50 [00:14<00:06,  3.06it/s] 62%|██████▏   | 31/50 [00:14<00:06,  3.06it/s] 64%|██████▍   | 32/50 [00:14<00:05,  3.06it/s] 66%|██████▌   | 33/50 [00:15<00:05,  3.06it/s] 68%|██████▊   | 34/50 [00:15<00:05,  3.06it/s] 70%|███████   | 35/50 [00:15<00:04,  3.06it/s] 72%|███████▏  | 36/50 [00:16<00:04,  3.06it/s] 74%|███████▍  | 37/50 [00:16<00:04,  3.06it/s] 76%|███████▌  | 38/50 [00:16<00:03,  3.06it/s] 78%|███████▊  | 39/50 [00:17<00:03,  3.06it/s] 80%|████████  | 40/50 [00:17<00:03,  3.06it/s] 82%|████████▏ | 41/50 [00:17<00:02,  3.06it/s] 84%|████████▍ | 42/50 [00:18<00:02,  3.06it/s] 86%|████████▌ | 43/50 [00:18<00:02,  3.06it/s] 88%|████████▊ | 44/50 [00:18<00:01,  3.05it/s] 90%|█████████ | 45/50 [00:19<00:01,  3.05it/s] 92%|█████████▏| 46/50 [00:19<00:01,  3.05it/s] 94%|█████████▍| 47/50 [00:19<00:00,  3.05it/s] 96%|█████████▌| 48/50 [00:20<00:00,  3.05it/s] 98%|█████████▊| 49/50 [00:20<00:00,  3.05it/s]100%|██████████| 50/50 [00:25<00:00,  1.74s/it]100%|██████████| 50/50 [00:25<00:00,  1.97it/s]
[I 2023-12-10 23:28:41,082] Trial 259 finished with value: 0.38947181219989324 and parameters: {'EMBEDDING_DIM': 931, 'HIDDEN_DIM': 509, 'NUM_LAYERS': 1, 'DROPOUT': 0.2320636547145471, 'LR': 0.000987320481130431, 'WEIGHT_0': 0.5967398722454499, 'WEIGHT_1': 0.42500716500469704, 'WEIGHT_2': 0.5940120117826553, 'WEIGHT_3': 0.13975934137501947, 'WEIGHT_4': 0.7236073604348938, 'WEIGHT_5': 0.5409184850627087, 'WEIGHT_6': 0.4783967224936755, 'WEIGHT_7': 0.3500927789198502, 'WEIGHT_8': 0.4453762059529519, 'optimizer': 'RMSprop'}. Best is trial 221 with value: 0.418736930154747.
{'EMBEDDING_DIM': 931, 'HIDDEN_DIM': 509, 'NUM_LAYERS': 1, 'DROPOUT': 0.2320636547145471, 'LR': 0.000987320481130431, 'WEIGHT_0': 0.5967398722454499, 'WEIGHT_1': 0.42500716500469704, 'WEIGHT_2': 0.5940120117826553, 'WEIGHT_3': 0.13975934137501947, 'WEIGHT_4': 0.7236073604348938, 'WEIGHT_5': 0.5409184850627087, 'WEIGHT_6': 0.4783967224936755, 'WEIGHT_7': 0.3500927789198502, 'WEIGHT_8': 0.4453762059529519, 'optimizer': 'RMSprop'}
0
              precision    recall  f1-score   support

         LOC       0.14      0.06      0.09      1837
        MISC       0.02      0.01      0.02       922
         ORG       0.05      0.01      0.02      1341
         PER       0.03      0.01      0.02      1842

   micro avg       0.07      0.03      0.04      5942
   macro avg       0.06      0.03      0.04      5942
weighted avg       0.07      0.03      0.04      5942

{'EMBEDDING_DIM': 931, 'HIDDEN_DIM': 509, 'NUM_LAYERS': 1, 'DROPOUT': 0.2320636547145471, 'LR': 0.000987320481130431, 'WEIGHT_0': 0.5967398722454499, 'WEIGHT_1': 0.42500716500469704, 'WEIGHT_2': 0.5940120117826553, 'WEIGHT_3': 0.13975934137501947, 'WEIGHT_4': 0.7236073604348938, 'WEIGHT_5': 0.5409184850627087, 'WEIGHT_6': 0.4783967224936755, 'WEIGHT_7': 0.3500927789198502, 'WEIGHT_8': 0.4453762059529519, 'optimizer': 'RMSprop'}
49
              precision    recall  f1-score   support

         LOC       0.58      0.53      0.55      1837
        MISC       0.40      0.43      0.41       922
         ORG       0.35      0.24      0.28      1341
         PER       0.30      0.27      0.29      1842

   micro avg       0.41      0.37      0.39      5942
   macro avg       0.40      0.37      0.38      5942
weighted avg       0.41      0.37      0.39      5942

epoch 49
LSTM
  0%|          | 0/50 [00:00<?, ?it/s]  2%|▏         | 1/50 [00:09<07:47,  9.54s/it]  4%|▍         | 2/50 [00:10<03:39,  4.58s/it]  6%|▌         | 3/50 [00:12<02:34,  3.29s/it]  8%|▊         | 4/50 [00:14<02:03,  2.70s/it] 10%|█         | 5/50 [00:15<01:46,  2.36s/it] 12%|█▏        | 6/50 [00:17<01:35,  2.16s/it] 14%|█▍        | 7/50 [00:19<01:27,  2.04s/it] 16%|█▌        | 8/50 [00:21<01:22,  1.95s/it] 18%|█▊        | 9/50 [00:23<01:17,  1.90s/it] 20%|██        | 10/50 [00:24<01:14,  1.87s/it] 22%|██▏       | 11/50 [00:26<01:11,  1.84s/it] 24%|██▍       | 12/50 [00:28<01:09,  1.82s/it] 26%|██▌       | 13/50 [00:30<01:07,  1.81s/it] 28%|██▊       | 14/50 [00:32<01:05,  1.81s/it] 30%|███       | 15/50 [00:33<01:02,  1.80s/it] 32%|███▏      | 16/50 [00:35<01:01,  1.80s/it] 34%|███▍      | 17/50 [00:37<00:59,  1.80s/it] 36%|███▌      | 18/50 [00:39<00:57,  1.80s/it] 38%|███▊      | 19/50 [00:40<00:55,  1.80s/it] 40%|████      | 20/50 [00:42<00:54,  1.80s/it] 42%|████▏     | 21/50 [00:44<00:52,  1.80s/it] 44%|████▍     | 22/50 [00:46<00:50,  1.80s/it] 46%|████▌     | 23/50 [00:48<00:48,  1.80s/it] 48%|████▊     | 24/50 [00:49<00:46,  1.80s/it] 50%|█████     | 25/50 [00:51<00:45,  1.80s/it] 52%|█████▏    | 26/50 [00:53<00:43,  1.80s/it] 54%|█████▍    | 27/50 [00:55<00:41,  1.81s/it] 56%|█████▌    | 28/50 [00:57<00:39,  1.82s/it] 58%|█████▊    | 29/50 [00:59<00:38,  1.82s/it] 60%|██████    | 30/50 [01:00<00:36,  1.83s/it] 62%|██████▏   | 31/50 [01:02<00:34,  1.83s/it] 64%|██████▍   | 32/50 [01:04<00:32,  1.83s/it] 66%|██████▌   | 33/50 [01:06<00:31,  1.82s/it] 68%|██████▊   | 34/50 [01:08<00:29,  1.82s/it] 70%|███████   | 35/50 [01:10<00:27,  1.82s/it] 72%|███████▏  | 36/50 [01:11<00:25,  1.82s/it] 74%|███████▍  | 37/50 [01:13<00:23,  1.82s/it] 76%|███████▌  | 38/50 [01:15<00:21,  1.82s/it] 78%|███████▊  | 39/50 [01:17<00:20,  1.82s/it] 80%|████████  | 40/50 [01:19<00:18,  1.82s/it] 82%|████████▏ | 41/50 [01:20<00:16,  1.82s/it] 84%|████████▍ | 42/50 [01:22<00:14,  1.82s/it] 86%|████████▌ | 43/50 [01:24<00:12,  1.82s/it] 88%|████████▊ | 44/50 [01:26<00:10,  1.82s/it] 90%|█████████ | 45/50 [01:28<00:09,  1.82s/it] 92%|█████████▏| 46/50 [01:30<00:07,  1.82s/it] 94%|█████████▍| 47/50 [01:31<00:05,  1.82s/it] 96%|█████████▌| 48/50 [01:33<00:03,  1.82s/it] 98%|█████████▊| 49/50 [01:35<00:01,  1.82s/it]100%|██████████| 50/50 [01:45<00:00,  4.37s/it]100%|██████████| 50/50 [01:45<00:00,  2.12s/it]
[I 2023-12-10 23:30:34,647] Trial 260 finished with value: 0.0 and parameters: {'EMBEDDING_DIM': 983, 'HIDDEN_DIM': 701, 'NUM_LAYERS': 4, 'DROPOUT': 0.35309030460463936, 'LR': 0.0046423657937804215, 'WEIGHT_0': 0.6713577641294809, 'WEIGHT_1': 0.6301359473632585, 'WEIGHT_2': 0.21457698387702362, 'WEIGHT_3': 0.7124225777647626, 'WEIGHT_4': 0.9635692451004606, 'WEIGHT_5': 0.2826801770051799, 'WEIGHT_6': 0.7033851244031045, 'WEIGHT_7': 0.31533821934469153, 'WEIGHT_8': 0.6568951928009505, 'optimizer': 'SGD'}. Best is trial 221 with value: 0.418736930154747.
/userhome/cs2/dingruiw/conda/envs/py310/lib/python3.10/site-packages/torch/nn/modules/rnn.py:82: UserWarning: dropout option adds dropout after all but last recurrent layer, so non-zero dropout expects num_layers greater than 1, but got dropout=0.34298349105145104 and num_layers=1
  warnings.warn("dropout option adds dropout after all but last "
{'EMBEDDING_DIM': 983, 'HIDDEN_DIM': 701, 'NUM_LAYERS': 4, 'DROPOUT': 0.35309030460463936, 'LR': 0.0046423657937804215, 'WEIGHT_0': 0.6713577641294809, 'WEIGHT_1': 0.6301359473632585, 'WEIGHT_2': 0.21457698387702362, 'WEIGHT_3': 0.7124225777647626, 'WEIGHT_4': 0.9635692451004606, 'WEIGHT_5': 0.2826801770051799, 'WEIGHT_6': 0.7033851244031045, 'WEIGHT_7': 0.31533821934469153, 'WEIGHT_8': 0.6568951928009505, 'optimizer': 'SGD'}
0
              precision    recall  f1-score   support

         LOC       0.00      0.00      0.00      1837
        MISC       0.01      0.02      0.01       922
         ORG       0.00      0.00      0.00      1341
         PER       0.00      0.00      0.00      1842

   micro avg       0.01      0.00      0.00      5942
   macro avg       0.00      0.01      0.00      5942
weighted avg       0.00      0.00      0.00      5942

{'EMBEDDING_DIM': 983, 'HIDDEN_DIM': 701, 'NUM_LAYERS': 4, 'DROPOUT': 0.35309030460463936, 'LR': 0.0046423657937804215, 'WEIGHT_0': 0.6713577641294809, 'WEIGHT_1': 0.6301359473632585, 'WEIGHT_2': 0.21457698387702362, 'WEIGHT_3': 0.7124225777647626, 'WEIGHT_4': 0.9635692451004606, 'WEIGHT_5': 0.2826801770051799, 'WEIGHT_6': 0.7033851244031045, 'WEIGHT_7': 0.31533821934469153, 'WEIGHT_8': 0.6568951928009505, 'optimizer': 'SGD'}
49
              precision    recall  f1-score   support

         LOC       0.00      0.00      0.00      1837
        MISC       0.00      0.00      0.00       922
         ORG       0.00      0.00      0.00      1341
         PER       0.00      0.00      0.00      1842

   micro avg       0.00      0.00      0.00      5942
   macro avg       0.00      0.00      0.00      5942
weighted avg       0.00      0.00      0.00      5942

epoch 49
LSTM
  0%|          | 0/50 [00:00<?, ?it/s]  2%|▏         | 1/50 [00:04<03:51,  4.73s/it]  4%|▍         | 2/50 [00:04<01:36,  2.01s/it]  6%|▌         | 3/50 [00:05<00:55,  1.18s/it]  8%|▊         | 4/50 [00:05<00:36,  1.26it/s] 10%|█         | 5/50 [00:05<00:25,  1.73it/s] 12%|█▏        | 6/50 [00:05<00:19,  2.23it/s] 14%|█▍        | 7/50 [00:05<00:15,  2.74it/s] 16%|█▌        | 8/50 [00:06<00:13,  3.21it/s] 18%|█▊        | 9/50 [00:06<00:11,  3.63it/s] 20%|██        | 10/50 [00:06<00:10,  3.98it/s] 22%|██▏       | 11/50 [00:06<00:09,  4.26it/s] 24%|██▍       | 12/50 [00:06<00:08,  4.48it/s] 26%|██▌       | 13/50 [00:06<00:07,  4.65it/s] 28%|██▊       | 14/50 [00:07<00:07,  4.77it/s] 30%|███       | 15/50 [00:07<00:07,  4.86it/s] 32%|███▏      | 16/50 [00:07<00:06,  4.92it/s] 34%|███▍      | 17/50 [00:07<00:06,  4.96it/s] 36%|███▌      | 18/50 [00:07<00:06,  4.99it/s] 38%|███▊      | 19/50 [00:08<00:06,  5.02it/s] 40%|████      | 20/50 [00:08<00:05,  5.04it/s] 42%|████▏     | 21/50 [00:08<00:05,  5.04it/s] 44%|████▍     | 22/50 [00:08<00:05,  5.05it/s] 46%|████▌     | 23/50 [00:08<00:05,  5.07it/s] 48%|████▊     | 24/50 [00:09<00:05,  5.06it/s] 50%|█████     | 25/50 [00:09<00:04,  5.06it/s] 52%|█████▏    | 26/50 [00:09<00:04,  5.07it/s] 54%|█████▍    | 27/50 [00:09<00:04,  5.06it/s] 56%|█████▌    | 28/50 [00:09<00:04,  5.06it/s] 58%|█████▊    | 29/50 [00:10<00:04,  5.05it/s] 60%|██████    | 30/50 [00:10<00:03,  5.06it/s] 62%|██████▏   | 31/50 [00:10<00:03,  5.06it/s] 64%|██████▍   | 32/50 [00:10<00:03,  5.06it/s] 66%|██████▌   | 33/50 [00:10<00:03,  5.06it/s] 68%|██████▊   | 34/50 [00:11<00:03,  5.07it/s] 70%|███████   | 35/50 [00:11<00:02,  5.06it/s] 72%|███████▏  | 36/50 [00:11<00:02,  5.05it/s] 74%|███████▍  | 37/50 [00:11<00:02,  5.05it/s] 76%|███████▌  | 38/50 [00:11<00:02,  5.05it/s] 78%|███████▊  | 39/50 [00:12<00:02,  5.05it/s] 80%|████████  | 40/50 [00:12<00:01,  5.05it/s] 82%|████████▏ | 41/50 [00:12<00:01,  5.05it/s] 84%|████████▍ | 42/50 [00:12<00:01,  5.05it/s] 86%|████████▌ | 43/50 [00:12<00:01,  5.05it/s] 88%|████████▊ | 44/50 [00:13<00:01,  5.05it/s] 90%|█████████ | 45/50 [00:13<00:00,  5.05it/s] 92%|█████████▏| 46/50 [00:13<00:00,  5.04it/s] 94%|█████████▍| 47/50 [00:13<00:00,  5.05it/s] 96%|█████████▌| 48/50 [00:13<00:00,  5.05it/s] 98%|█████████▊| 49/50 [00:14<00:00,  5.03it/s]100%|██████████| 50/50 [00:18<00:00,  1.59s/it]100%|██████████| 50/50 [00:18<00:00,  2.64it/s]
