[I 2023-12-11 00:06:21,894] Trial 337 finished with value: 0.32766033679684703 and parameters: {'EMBEDDING_DIM': 947, 'HIDDEN_DIM': 488, 'NUM_LAYERS': 1, 'DROPOUT': 0.26334537628653115, 'LR': 0.0070083120186210475, 'WEIGHT_0': 0.33387653865696054, 'WEIGHT_1': 0.6219597435138668, 'WEIGHT_2': 0.4223535999388049, 'WEIGHT_3': 0.6758419181225369, 'WEIGHT_4': 0.6575938423935835, 'WEIGHT_5': 0.5451280574394575, 'WEIGHT_6': 0.6417939884874372, 'WEIGHT_7': 0.00837876918716629, 'WEIGHT_8': 0.6404267305343395, 'optimizer': 'RMSprop'}. Best is trial 221 with value: 0.418736930154747.
/userhome/cs2/dingruiw/conda/envs/py310/lib/python3.10/site-packages/torch/nn/modules/rnn.py:82: UserWarning: dropout option adds dropout after all but last recurrent layer, so non-zero dropout expects num_layers greater than 1, but got dropout=0.35492003033333824 and num_layers=1
  warnings.warn("dropout option adds dropout after all but last "
{'EMBEDDING_DIM': 947, 'HIDDEN_DIM': 488, 'NUM_LAYERS': 1, 'DROPOUT': 0.26334537628653115, 'LR': 0.0070083120186210475, 'WEIGHT_0': 0.33387653865696054, 'WEIGHT_1': 0.6219597435138668, 'WEIGHT_2': 0.4223535999388049, 'WEIGHT_3': 0.6758419181225369, 'WEIGHT_4': 0.6575938423935835, 'WEIGHT_5': 0.5451280574394575, 'WEIGHT_6': 0.6417939884874372, 'WEIGHT_7': 0.00837876918716629, 'WEIGHT_8': 0.6404267305343395, 'optimizer': 'RMSprop'}
0
              precision    recall  f1-score   support

         LOC       0.28      0.02      0.04      1837
        MISC       0.01      0.00      0.01       922
         ORG       0.05      0.00      0.00      1341
         PER       0.00      0.00      0.00      1842

   micro avg       0.08      0.01      0.01      5942
   macro avg       0.08      0.01      0.01      5942
weighted avg       0.10      0.01      0.01      5942

{'EMBEDDING_DIM': 947, 'HIDDEN_DIM': 488, 'NUM_LAYERS': 1, 'DROPOUT': 0.26334537628653115, 'LR': 0.0070083120186210475, 'WEIGHT_0': 0.33387653865696054, 'WEIGHT_1': 0.6219597435138668, 'WEIGHT_2': 0.4223535999388049, 'WEIGHT_3': 0.6758419181225369, 'WEIGHT_4': 0.6575938423935835, 'WEIGHT_5': 0.5451280574394575, 'WEIGHT_6': 0.6417939884874372, 'WEIGHT_7': 0.00837876918716629, 'WEIGHT_8': 0.6404267305343395, 'optimizer': 'RMSprop'}
49
              precision    recall  f1-score   support

         LOC       0.50      0.47      0.49      1837
        MISC       0.40      0.36      0.38       922
         ORG       0.23      0.22      0.22      1341
         PER       0.24      0.18      0.20      1842

   micro avg       0.35      0.31      0.33      5942
   macro avg       0.34      0.31      0.32      5942
weighted avg       0.34      0.31      0.32      5942

epoch 49
LSTM
  0%|          | 0/50 [00:00<?, ?it/s]  2%|▏         | 1/50 [00:04<03:55,  4.81s/it]  4%|▍         | 2/50 [00:04<01:38,  2.06s/it]  6%|▌         | 3/50 [00:05<00:57,  1.23s/it]  8%|▊         | 4/50 [00:05<00:38,  1.20it/s] 10%|█         | 5/50 [00:05<00:27,  1.61it/s] 12%|█▏        | 6/50 [00:05<00:21,  2.04it/s] 14%|█▍        | 7/50 [00:06<00:17,  2.46it/s] 16%|█▌        | 8/50 [00:06<00:14,  2.83it/s] 18%|█▊        | 9/50 [00:06<00:12,  3.16it/s] 20%|██        | 10/50 [00:06<00:11,  3.43it/s] 22%|██▏       | 11/50 [00:07<00:10,  3.64it/s] 24%|██▍       | 12/50 [00:07<00:09,  3.80it/s] 26%|██▌       | 13/50 [00:07<00:09,  3.92it/s] 28%|██▊       | 14/50 [00:07<00:08,  4.00it/s] 30%|███       | 15/50 [00:08<00:08,  4.07it/s] 32%|███▏      | 16/50 [00:08<00:08,  4.11it/s] 34%|███▍      | 17/50 [00:08<00:07,  4.14it/s] 36%|███▌      | 18/50 [00:08<00:07,  4.17it/s] 38%|███▊      | 19/50 [00:08<00:07,  4.18it/s] 40%|████      | 20/50 [00:09<00:07,  4.19it/s] 42%|████▏     | 21/50 [00:09<00:06,  4.20it/s] 44%|████▍     | 22/50 [00:09<00:06,  4.21it/s] 46%|████▌     | 23/50 [00:09<00:06,  4.21it/s] 48%|████▊     | 24/50 [00:10<00:06,  4.22it/s] 50%|█████     | 25/50 [00:10<00:05,  4.22it/s] 52%|█████▏    | 26/50 [00:10<00:05,  4.22it/s] 54%|█████▍    | 27/50 [00:10<00:05,  4.22it/s] 56%|█████▌    | 28/50 [00:11<00:05,  4.22it/s] 58%|█████▊    | 29/50 [00:11<00:04,  4.22it/s] 60%|██████    | 30/50 [00:11<00:04,  4.22it/s] 62%|██████▏   | 31/50 [00:11<00:04,  4.22it/s] 64%|██████▍   | 32/50 [00:12<00:04,  4.22it/s] 66%|██████▌   | 33/50 [00:12<00:04,  4.22it/s] 68%|██████▊   | 34/50 [00:12<00:03,  4.22it/s] 70%|███████   | 35/50 [00:12<00:03,  4.22it/s] 72%|███████▏  | 36/50 [00:12<00:03,  4.22it/s] 74%|███████▍  | 37/50 [00:13<00:03,  4.22it/s] 76%|███████▌  | 38/50 [00:13<00:02,  4.21it/s] 78%|███████▊  | 39/50 [00:13<00:02,  4.21it/s] 80%|████████  | 40/50 [00:13<00:02,  4.21it/s] 82%|████████▏ | 41/50 [00:14<00:02,  4.21it/s] 84%|████████▍ | 42/50 [00:14<00:01,  4.21it/s] 86%|████████▌ | 43/50 [00:14<00:01,  4.21it/s] 88%|████████▊ | 44/50 [00:14<00:01,  4.21it/s] 90%|█████████ | 45/50 [00:15<00:01,  4.21it/s] 92%|█████████▏| 46/50 [00:15<00:00,  4.21it/s] 94%|█████████▍| 47/50 [00:15<00:00,  4.21it/s] 96%|█████████▌| 48/50 [00:15<00:00,  4.21it/s] 98%|█████████▊| 49/50 [00:16<00:00,  4.21it/s]100%|██████████| 50/50 [00:20<00:00,  1.61s/it]100%|██████████| 50/50 [00:20<00:00,  2.39it/s]
[I 2023-12-11 00:06:47,113] Trial 338 finished with value: 0.2246360582306831 and parameters: {'EMBEDDING_DIM': 1024, 'HIDDEN_DIM': 346, 'NUM_LAYERS': 1, 'DROPOUT': 0.35492003033333824, 'LR': 0.0002703413175665463, 'WEIGHT_0': 0.45651052643038814, 'WEIGHT_1': 0.8101015688655042, 'WEIGHT_2': 0.5018894479754991, 'WEIGHT_3': 0.4202825925586336, 'WEIGHT_4': 0.9433772973797948, 'WEIGHT_5': 0.7766968295166305, 'WEIGHT_6': 0.7386851833106887, 'WEIGHT_7': 0.21324614553734608, 'WEIGHT_8': 0.5139075005928131, 'optimizer': 'Adam'}. Best is trial 221 with value: 0.418736930154747.
/userhome/cs2/dingruiw/conda/envs/py310/lib/python3.10/site-packages/torch/nn/modules/rnn.py:82: UserWarning: dropout option adds dropout after all but last recurrent layer, so non-zero dropout expects num_layers greater than 1, but got dropout=0.36517603610865224 and num_layers=1
  warnings.warn("dropout option adds dropout after all but last "
{'EMBEDDING_DIM': 1024, 'HIDDEN_DIM': 346, 'NUM_LAYERS': 1, 'DROPOUT': 0.35492003033333824, 'LR': 0.0002703413175665463, 'WEIGHT_0': 0.45651052643038814, 'WEIGHT_1': 0.8101015688655042, 'WEIGHT_2': 0.5018894479754991, 'WEIGHT_3': 0.4202825925586336, 'WEIGHT_4': 0.9433772973797948, 'WEIGHT_5': 0.7766968295166305, 'WEIGHT_6': 0.7386851833106887, 'WEIGHT_7': 0.21324614553734608, 'WEIGHT_8': 0.5139075005928131, 'optimizer': 'Adam'}
0
              precision    recall  f1-score   support

         LOC       0.02      0.12      0.04      1837
        MISC       0.02      0.08      0.03       922
         ORG       0.02      0.10      0.03      1341
         PER       0.02      0.06      0.03      1842

   micro avg       0.02      0.09      0.03      5942
   macro avg       0.02      0.09      0.03      5942
weighted avg       0.02      0.09      0.03      5942

{'EMBEDDING_DIM': 1024, 'HIDDEN_DIM': 346, 'NUM_LAYERS': 1, 'DROPOUT': 0.35492003033333824, 'LR': 0.0002703413175665463, 'WEIGHT_0': 0.45651052643038814, 'WEIGHT_1': 0.8101015688655042, 'WEIGHT_2': 0.5018894479754991, 'WEIGHT_3': 0.4202825925586336, 'WEIGHT_4': 0.9433772973797948, 'WEIGHT_5': 0.7766968295166305, 'WEIGHT_6': 0.7386851833106887, 'WEIGHT_7': 0.21324614553734608, 'WEIGHT_8': 0.5139075005928131, 'optimizer': 'Adam'}
49
              precision    recall  f1-score   support

         LOC       0.46      0.35      0.40      1837
        MISC       0.27      0.05      0.08       922
         ORG       0.20      0.05      0.08      1341
         PER       0.23      0.13      0.17      1842

   micro avg       0.34      0.17      0.22      5942
   macro avg       0.29      0.15      0.18      5942
weighted avg       0.30      0.17      0.21      5942

epoch 49
LSTM
  0%|          | 0/50 [00:00<?, ?it/s]  2%|▏         | 1/50 [00:04<03:59,  4.89s/it]  6%|▌         | 3/50 [00:05<01:02,  1.33s/it]  8%|▊         | 4/50 [00:05<00:41,  1.10it/s] 10%|█         | 5/50 [00:05<00:28,  1.56it/s] 12%|█▏        | 6/50 [00:05<00:20,  2.13it/s] 14%|█▍        | 7/50 [00:05<00:15,  2.82it/s] 16%|█▌        | 8/50 [00:05<00:11,  3.61it/s] 18%|█▊        | 9/50 [00:05<00:09,  4.47it/s] 20%|██        | 10/50 [00:05<00:07,  5.33it/s] 22%|██▏       | 11/50 [00:05<00:06,  6.15it/s] 24%|██▍       | 12/50 [00:06<00:05,  6.89it/s] 26%|██▌       | 13/50 [00:06<00:04,  7.53it/s] 28%|██▊       | 14/50 [00:06<00:04,  8.03it/s] 30%|███       | 15/50 [00:06<00:04,  8.43it/s] 32%|███▏      | 16/50 [00:06<00:03,  8.73it/s] 34%|███▍      | 17/50 [00:06<00:03,  8.97it/s] 36%|███▌      | 18/50 [00:06<00:03,  9.14it/s] 38%|███▊      | 19/50 [00:06<00:03,  9.26it/s] 40%|████      | 20/50 [00:06<00:03,  9.34it/s] 42%|████▏     | 21/50 [00:06<00:03,  9.40it/s] 44%|████▍     | 22/50 [00:07<00:02,  9.44it/s] 46%|████▌     | 23/50 [00:07<00:02,  9.47it/s] 48%|████▊     | 24/50 [00:07<00:02,  9.49it/s] 50%|█████     | 25/50 [00:07<00:02,  9.50it/s] 52%|█████▏    | 26/50 [00:07<00:02,  9.50it/s] 54%|█████▍    | 27/50 [00:07<00:02,  9.52it/s] 56%|█████▌    | 28/50 [00:07<00:02,  9.54it/s] 58%|█████▊    | 29/50 [00:07<00:02,  9.55it/s] 60%|██████    | 30/50 [00:07<00:02,  9.55it/s] 62%|██████▏   | 31/50 [00:07<00:01,  9.54it/s] 64%|██████▍   | 32/50 [00:08<00:01,  9.54it/s] 66%|██████▌   | 33/50 [00:08<00:01,  9.54it/s] 68%|██████▊   | 34/50 [00:08<00:01,  9.54it/s] 70%|███████   | 35/50 [00:08<00:01,  9.52it/s] 72%|███████▏  | 36/50 [00:08<00:01,  9.51it/s] 74%|███████▍  | 37/50 [00:08<00:01,  9.53it/s] 76%|███████▌  | 38/50 [00:08<00:01,  9.54it/s] 78%|███████▊  | 39/50 [00:08<00:01,  9.55it/s] 80%|████████  | 40/50 [00:08<00:01,  9.55it/s] 82%|████████▏ | 41/50 [00:09<00:00,  9.54it/s] 84%|████████▍ | 42/50 [00:09<00:00,  9.55it/s] 86%|████████▌ | 43/50 [00:09<00:00,  9.56it/s] 88%|████████▊ | 44/50 [00:09<00:00,  9.56it/s] 90%|█████████ | 45/50 [00:09<00:00,  9.53it/s] 92%|█████████▏| 46/50 [00:09<00:00,  9.54it/s] 94%|█████████▍| 47/50 [00:09<00:00,  9.54it/s] 96%|█████████▌| 48/50 [00:09<00:00,  9.57it/s] 98%|█████████▊| 49/50 [00:09<00:00,  9.56it/s]100%|██████████| 50/50 [00:14<00:00,  1.47s/it]100%|██████████| 50/50 [00:14<00:00,  3.44it/s]
[I 2023-12-11 00:07:05,575] Trial 339 finished with value: 0.3687317956388255 and parameters: {'EMBEDDING_DIM': 266, 'HIDDEN_DIM': 268, 'NUM_LAYERS': 1, 'DROPOUT': 0.36517603610865224, 'LR': 0.002925312825551461, 'WEIGHT_0': 0.41461919403554715, 'WEIGHT_1': 0.5669117513882466, 'WEIGHT_2': 0.13444888553487438, 'WEIGHT_3': 0.7648507285423498, 'WEIGHT_4': 0.8059611876304011, 'WEIGHT_5': 0.5199275324292766, 'WEIGHT_6': 0.9490322203748189, 'WEIGHT_7': 0.5589232591240197, 'WEIGHT_8': 0.5844692459904995, 'optimizer': 'RMSprop'}. Best is trial 221 with value: 0.418736930154747.
/userhome/cs2/dingruiw/conda/envs/py310/lib/python3.10/site-packages/torch/nn/modules/rnn.py:82: UserWarning: dropout option adds dropout after all but last recurrent layer, so non-zero dropout expects num_layers greater than 1, but got dropout=0.03760157842329054 and num_layers=1
  warnings.warn("dropout option adds dropout after all but last "
{'EMBEDDING_DIM': 266, 'HIDDEN_DIM': 268, 'NUM_LAYERS': 1, 'DROPOUT': 0.36517603610865224, 'LR': 0.002925312825551461, 'WEIGHT_0': 0.41461919403554715, 'WEIGHT_1': 0.5669117513882466, 'WEIGHT_2': 0.13444888553487438, 'WEIGHT_3': 0.7648507285423498, 'WEIGHT_4': 0.8059611876304011, 'WEIGHT_5': 0.5199275324292766, 'WEIGHT_6': 0.9490322203748189, 'WEIGHT_7': 0.5589232591240197, 'WEIGHT_8': 0.5844692459904995, 'optimizer': 'RMSprop'}
0
              precision    recall  f1-score   support

         LOC       0.10      0.08      0.09      1837
        MISC       0.02      0.01      0.01       922
         ORG       0.06      0.03      0.04      1341
         PER       0.01      0.00      0.00      1842

   micro avg       0.07      0.03      0.05      5942
   macro avg       0.05      0.03      0.03      5942
weighted avg       0.05      0.03      0.04      5942

{'EMBEDDING_DIM': 266, 'HIDDEN_DIM': 268, 'NUM_LAYERS': 1, 'DROPOUT': 0.36517603610865224, 'LR': 0.002925312825551461, 'WEIGHT_0': 0.41461919403554715, 'WEIGHT_1': 0.5669117513882466, 'WEIGHT_2': 0.13444888553487438, 'WEIGHT_3': 0.7648507285423498, 'WEIGHT_4': 0.8059611876304011, 'WEIGHT_5': 0.5199275324292766, 'WEIGHT_6': 0.9490322203748189, 'WEIGHT_7': 0.5589232591240197, 'WEIGHT_8': 0.5844692459904995, 'optimizer': 'RMSprop'}
49
              precision    recall  f1-score   support

         LOC       0.58      0.53      0.55      1837
        MISC       0.33      0.37      0.35       922
         ORG       0.21      0.26      0.23      1341
         PER       0.29      0.37      0.32      1842

   micro avg       0.35      0.39      0.37      5942
   macro avg       0.35      0.38      0.36      5942
weighted avg       0.36      0.39      0.38      5942

epoch 49
LSTM
  0%|          | 0/50 [00:00<?, ?it/s]  2%|▏         | 1/50 [00:04<03:49,  4.69s/it]  4%|▍         | 2/50 [00:04<01:37,  2.02s/it]  6%|▌         | 3/50 [00:05<00:58,  1.24s/it]  8%|▊         | 4/50 [00:05<00:39,  1.16it/s] 10%|█         | 5/50 [00:05<00:29,  1.53it/s] 12%|█▏        | 6/50 [00:06<00:23,  1.89it/s] 14%|█▍        | 7/50 [00:06<00:19,  2.22it/s] 16%|█▌        | 8/50 [00:06<00:16,  2.51it/s] 18%|█▊        | 9/50 [00:06<00:14,  2.75it/s] 20%|██        | 10/50 [00:07<00:13,  2.94it/s] 22%|██▏       | 11/50 [00:07<00:12,  3.09it/s] 24%|██▍       | 12/50 [00:07<00:11,  3.20it/s] 26%|██▌       | 13/50 [00:08<00:11,  3.28it/s] 28%|██▊       | 14/50 [00:08<00:10,  3.34it/s] 30%|███       | 15/50 [00:08<00:10,  3.38it/s] 32%|███▏      | 16/50 [00:08<00:09,  3.42it/s] 34%|███▍      | 17/50 [00:09<00:09,  3.43it/s] 36%|███▌      | 18/50 [00:09<00:09,  3.45it/s] 38%|███▊      | 19/50 [00:09<00:08,  3.46it/s] 40%|████      | 20/50 [00:10<00:08,  3.46it/s] 42%|████▏     | 21/50 [00:10<00:08,  3.47it/s] 44%|████▍     | 22/50 [00:10<00:08,  3.47it/s] 46%|████▌     | 23/50 [00:10<00:07,  3.47it/s] 48%|████▊     | 24/50 [00:11<00:07,  3.47it/s] 50%|█████     | 25/50 [00:11<00:07,  3.47it/s] 52%|█████▏    | 26/50 [00:11<00:06,  3.47it/s] 54%|█████▍    | 27/50 [00:12<00:06,  3.47it/s] 56%|█████▌    | 28/50 [00:12<00:06,  3.47it/s] 58%|█████▊    | 29/50 [00:12<00:06,  3.47it/s] 60%|██████    | 30/50 [00:12<00:05,  3.47it/s] 62%|██████▏   | 31/50 [00:13<00:05,  3.47it/s] 64%|██████▍   | 32/50 [00:13<00:05,  3.48it/s] 66%|██████▌   | 33/50 [00:13<00:04,  3.47it/s] 68%|██████▊   | 34/50 [00:14<00:04,  3.47it/s] 70%|███████   | 35/50 [00:14<00:04,  3.47it/s] 72%|███████▏  | 36/50 [00:14<00:04,  3.47it/s] 74%|███████▍  | 37/50 [00:14<00:03,  3.47it/s] 76%|███████▌  | 38/50 [00:15<00:03,  3.47it/s] 78%|███████▊  | 39/50 [00:15<00:03,  3.47it/s] 80%|████████  | 40/50 [00:15<00:02,  3.47it/s] 82%|████████▏ | 41/50 [00:16<00:02,  3.47it/s] 84%|████████▍ | 42/50 [00:16<00:02,  3.46it/s] 86%|████████▌ | 43/50 [00:16<00:02,  3.46it/s] 88%|████████▊ | 44/50 [00:16<00:01,  3.46it/s] 90%|█████████ | 45/50 [00:17<00:01,  3.46it/s] 92%|█████████▏| 46/50 [00:17<00:01,  3.46it/s] 94%|█████████▍| 47/50 [00:17<00:00,  3.46it/s] 96%|█████████▌| 48/50 [00:18<00:00,  3.45it/s] 98%|█████████▊| 49/50 [00:18<00:00,  3.45it/s]100%|██████████| 50/50 [00:23<00:00,  1.67s/it]100%|██████████| 50/50 [00:23<00:00,  2.15it/s]
[I 2023-12-11 00:07:33,071] Trial 340 finished with value: 0.41092840013703325 and parameters: {'EMBEDDING_DIM': 995, 'HIDDEN_DIM': 427, 'NUM_LAYERS': 1, 'DROPOUT': 0.03760157842329054, 'LR': 0.0012254802717015655, 'WEIGHT_0': 0.48962025942706466, 'WEIGHT_1': 0.5080150698885134, 'WEIGHT_2': 0.3551293182883531, 'WEIGHT_3': 0.8183584920920631, 'WEIGHT_4': 0.9775908734308699, 'WEIGHT_5': 0.7532663238973533, 'WEIGHT_6': 0.6840646982390619, 'WEIGHT_7': 0.7729343591899696, 'WEIGHT_8': 0.9546752102482798, 'optimizer': 'RMSprop'}. Best is trial 221 with value: 0.418736930154747.
/userhome/cs2/dingruiw/conda/envs/py310/lib/python3.10/site-packages/torch/nn/modules/rnn.py:82: UserWarning: dropout option adds dropout after all but last recurrent layer, so non-zero dropout expects num_layers greater than 1, but got dropout=0.24361570701978233 and num_layers=1
  warnings.warn("dropout option adds dropout after all but last "
{'EMBEDDING_DIM': 995, 'HIDDEN_DIM': 427, 'NUM_LAYERS': 1, 'DROPOUT': 0.03760157842329054, 'LR': 0.0012254802717015655, 'WEIGHT_0': 0.48962025942706466, 'WEIGHT_1': 0.5080150698885134, 'WEIGHT_2': 0.3551293182883531, 'WEIGHT_3': 0.8183584920920631, 'WEIGHT_4': 0.9775908734308699, 'WEIGHT_5': 0.7532663238973533, 'WEIGHT_6': 0.6840646982390619, 'WEIGHT_7': 0.7729343591899696, 'WEIGHT_8': 0.9546752102482798, 'optimizer': 'RMSprop'}
0
              precision    recall  f1-score   support

         LOC       0.21      0.11      0.14      1837
        MISC       0.05      0.02      0.03       922
         ORG       0.12      0.02      0.04      1341
         PER       0.09      0.02      0.04      1842

   micro avg       0.15      0.05      0.07      5942
   macro avg       0.12      0.04      0.06      5942
weighted avg       0.13      0.05      0.07      5942

{'EMBEDDING_DIM': 995, 'HIDDEN_DIM': 427, 'NUM_LAYERS': 1, 'DROPOUT': 0.03760157842329054, 'LR': 0.0012254802717015655, 'WEIGHT_0': 0.48962025942706466, 'WEIGHT_1': 0.5080150698885134, 'WEIGHT_2': 0.3551293182883531, 'WEIGHT_3': 0.8183584920920631, 'WEIGHT_4': 0.9775908734308699, 'WEIGHT_5': 0.7532663238973533, 'WEIGHT_6': 0.6840646982390619, 'WEIGHT_7': 0.7729343591899696, 'WEIGHT_8': 0.9546752102482798, 'optimizer': 'RMSprop'}
49
              precision    recall  f1-score   support

         LOC       0.54      0.54      0.54      1837
        MISC       0.42      0.44      0.43       922
         ORG       0.29      0.27      0.28      1341
         PER       0.37      0.35      0.36      1842

   micro avg       0.42      0.40      0.41      5942
   macro avg       0.41      0.40      0.40      5942
weighted avg       0.42      0.40      0.41      5942

epoch 49
LSTM
  0%|          | 0/50 [00:00<?, ?it/s]  2%|▏         | 1/50 [00:04<03:49,  4.68s/it]  4%|▍         | 2/50 [00:04<01:36,  2.02s/it]  6%|▌         | 3/50 [00:05<00:57,  1.23s/it]  8%|▊         | 4/50 [00:05<00:39,  1.16it/s] 10%|█         | 5/50 [00:05<00:29,  1.53it/s] 12%|█▏        | 6/50 [00:05<00:23,  1.89it/s] 14%|█▍        | 7/50 [00:06<00:19,  2.22it/s] 16%|█▌        | 8/50 [00:06<00:16,  2.51it/s] 18%|█▊        | 9/50 [00:06<00:14,  2.74it/s] 20%|██        | 10/50 [00:07<00:13,  2.93it/s] 22%|██▏       | 11/50 [00:07<00:12,  3.08it/s] 24%|██▍       | 12/50 [00:07<00:11,  3.19it/s] 26%|██▌       | 13/50 [00:08<00:11,  3.27it/s] 28%|██▊       | 14/50 [00:08<00:10,  3.32it/s] 30%|███       | 15/50 [00:08<00:10,  3.37it/s] 32%|███▏      | 16/50 [00:08<00:10,  3.40it/s] 34%|███▍      | 17/50 [00:09<00:09,  3.42it/s] 36%|███▌      | 18/50 [00:09<00:09,  3.43it/s] 38%|███▊      | 19/50 [00:09<00:09,  3.44it/s] 40%|████      | 20/50 [00:10<00:08,  3.45it/s] 42%|████▏     | 21/50 [00:10<00:08,  3.45it/s] 44%|████▍     | 22/50 [00:10<00:08,  3.45it/s] 46%|████▌     | 23/50 [00:10<00:07,  3.46it/s] 48%|████▊     | 24/50 [00:11<00:07,  3.46it/s] 50%|█████     | 25/50 [00:11<00:07,  3.46it/s] 52%|█████▏    | 26/50 [00:11<00:06,  3.46it/s] 54%|█████▍    | 27/50 [00:12<00:06,  3.46it/s] 56%|█████▌    | 28/50 [00:12<00:06,  3.46it/s] 58%|█████▊    | 29/50 [00:12<00:06,  3.46it/s] 60%|██████    | 30/50 [00:12<00:05,  3.46it/s] 62%|██████▏   | 31/50 [00:13<00:05,  3.46it/s] 64%|██████▍   | 32/50 [00:13<00:05,  3.46it/s] 66%|██████▌   | 33/50 [00:13<00:04,  3.45it/s] 68%|██████▊   | 34/50 [00:14<00:04,  3.45it/s] 70%|███████   | 35/50 [00:14<00:04,  3.46it/s] 72%|███████▏  | 36/50 [00:14<00:04,  3.45it/s] 74%|███████▍  | 37/50 [00:14<00:03,  3.45it/s] 76%|███████▌  | 38/50 [00:15<00:03,  3.45it/s] 78%|███████▊  | 39/50 [00:15<00:03,  3.45it/s] 80%|████████  | 40/50 [00:15<00:02,  3.45it/s] 82%|████████▏ | 41/50 [00:16<00:02,  3.45it/s] 84%|████████▍ | 42/50 [00:16<00:02,  3.45it/s] 86%|████████▌ | 43/50 [00:16<00:02,  3.45it/s] 88%|████████▊ | 44/50 [00:16<00:01,  3.45it/s] 90%|█████████ | 45/50 [00:17<00:01,  3.45it/s] 92%|█████████▏| 46/50 [00:17<00:01,  3.45it/s] 94%|█████████▍| 47/50 [00:17<00:00,  3.45it/s] 96%|█████████▌| 48/50 [00:18<00:00,  3.44it/s] 98%|█████████▊| 49/50 [00:18<00:00,  3.45it/s]100%|██████████| 50/50 [00:23<00:00,  1.68s/it]100%|██████████| 50/50 [00:23<00:00,  2.14it/s]
