[I 2023-12-10 20:43:18,918] A new study created in memory with name: no-name-2edfa61b-deca-4b28-a2d5-4d1afce26773
/userhome/cs2/dingruiw/conda/envs/py310/lib/python3.10/site-packages/torch/nn/modules/rnn.py:82: UserWarning: dropout option adds dropout after all but last recurrent layer, so non-zero dropout expects num_layers greater than 1, but got dropout=0.09334122709940161 and num_layers=1
  warnings.warn("dropout option adds dropout after all but last "
LSTM
  0%|          | 0/50 [00:00<?, ?it/s]  2%|▏         | 1/50 [00:09<08:00,  9.80s/it]  4%|▍         | 2/50 [00:10<03:28,  4.34s/it]  6%|▌         | 3/50 [00:11<02:13,  2.85s/it]  8%|▊         | 4/50 [00:12<01:39,  2.16s/it] 10%|█         | 5/50 [00:13<01:19,  1.77s/it] 12%|█▏        | 6/50 [00:14<01:07,  1.54s/it] 14%|█▍        | 7/50 [00:15<01:00,  1.40s/it] 16%|█▌        | 8/50 [00:16<00:54,  1.30s/it] 18%|█▊        | 9/50 [00:17<00:50,  1.23s/it] 20%|██        | 10/50 [00:19<00:47,  1.19s/it] 22%|██▏       | 11/50 [00:20<00:45,  1.16s/it] 24%|██▍       | 12/50 [00:21<00:43,  1.14s/it] 26%|██▌       | 13/50 [00:22<00:41,  1.13s/it] 28%|██▊       | 14/50 [00:23<00:40,  1.12s/it] 30%|███       | 15/50 [00:24<00:38,  1.11s/it] 32%|███▏      | 16/50 [00:25<00:37,  1.11s/it] 34%|███▍      | 17/50 [00:26<00:36,  1.11s/it] 36%|███▌      | 18/50 [00:27<00:35,  1.11s/it] 38%|███▊      | 19/50 [00:28<00:34,  1.10s/it] 40%|████      | 20/50 [00:30<00:32,  1.10s/it] 42%|████▏     | 21/50 [00:31<00:31,  1.10s/it] 44%|████▍     | 22/50 [00:32<00:30,  1.10s/it] 46%|████▌     | 23/50 [00:33<00:29,  1.10s/it] 48%|████▊     | 24/50 [00:34<00:28,  1.10s/it] 50%|█████     | 25/50 [00:35<00:27,  1.10s/it] 52%|█████▏    | 26/50 [00:36<00:26,  1.09s/it] 54%|█████▍    | 27/50 [00:37<00:25,  1.10s/it] 56%|█████▌    | 28/50 [00:38<00:24,  1.10s/it] 58%|█████▊    | 29/50 [00:39<00:23,  1.10s/it] 60%|██████    | 30/50 [00:40<00:21,  1.10s/it] 62%|██████▏   | 31/50 [00:42<00:21,  1.11s/it] 64%|██████▍   | 32/50 [00:43<00:19,  1.10s/it] 66%|██████▌   | 33/50 [00:44<00:18,  1.10s/it] 68%|██████▊   | 34/50 [00:45<00:17,  1.11s/it] 70%|███████   | 35/50 [00:46<00:16,  1.10s/it] 72%|███████▏  | 36/50 [00:47<00:15,  1.11s/it] 74%|███████▍  | 37/50 [00:48<00:14,  1.10s/it] 76%|███████▌  | 38/50 [00:49<00:13,  1.10s/it] 78%|███████▊  | 39/50 [00:50<00:12,  1.11s/it] 80%|████████  | 40/50 [00:52<00:11,  1.11s/it] 82%|████████▏ | 41/50 [00:53<00:09,  1.11s/it] 84%|████████▍ | 42/50 [00:54<00:08,  1.11s/it] 86%|████████▌ | 43/50 [00:55<00:07,  1.10s/it] 88%|████████▊ | 44/50 [00:56<00:06,  1.11s/it] 90%|█████████ | 45/50 [00:57<00:05,  1.11s/it] 92%|█████████▏| 46/50 [00:58<00:04,  1.11s/it] 94%|█████████▍| 47/50 [00:59<00:03,  1.11s/it] 96%|█████████▌| 48/50 [01:00<00:02,  1.11s/it] 98%|█████████▊| 49/50 [01:02<00:01,  1.12s/it]100%|██████████| 50/50 [01:10<00:00,  3.18s/it]100%|██████████| 50/50 [01:10<00:00,  1.40s/it]
[I 2023-12-10 20:44:36,598] Trial 0 finished with value: 0.08689326808623199 and parameters: {'EMBEDDING_DIM': 521, 'HIDDEN_DIM': 1436, 'NUM_LAYERS': 1, 'DROPOUT': 0.09334122709940161, 'LR': 0.007523228370280148, 'WEIGHT_0': 0.061434385566354055, 'WEIGHT_1': 0.2538867781198776, 'WEIGHT_2': 0.7482996262913338, 'WEIGHT_3': 0.5233493848751173, 'WEIGHT_4': 0.8133453898982542, 'WEIGHT_5': 0.3044633385272736, 'WEIGHT_6': 0.6994192289341906, 'WEIGHT_7': 0.30576419583373926, 'WEIGHT_8': 0.576401966104284, 'optimizer': 'RMSprop'}. Best is trial 0 with value: 0.08689326808623199.
{'EMBEDDING_DIM': 521, 'HIDDEN_DIM': 1436, 'NUM_LAYERS': 1, 'DROPOUT': 0.09334122709940161, 'LR': 0.007523228370280148, 'WEIGHT_0': 0.061434385566354055, 'WEIGHT_1': 0.2538867781198776, 'WEIGHT_2': 0.7482996262913338, 'WEIGHT_3': 0.5233493848751173, 'WEIGHT_4': 0.8133453898982542, 'WEIGHT_5': 0.3044633385272736, 'WEIGHT_6': 0.6994192289341906, 'WEIGHT_7': 0.30576419583373926, 'WEIGHT_8': 0.576401966104284, 'optimizer': 'RMSprop'}
0
              precision    recall  f1-score   support

         LOC       0.30      0.02      0.03      1837
        MISC       0.28      0.01      0.01       922
         ORG       0.00      0.01      0.00      1341
         PER       0.05      0.03      0.04      1842

   micro avg       0.02      0.02      0.02      5942
   macro avg       0.16      0.01      0.02      5942
weighted avg       0.15      0.02      0.02      5942

{'EMBEDDING_DIM': 521, 'HIDDEN_DIM': 1436, 'NUM_LAYERS': 1, 'DROPOUT': 0.09334122709940161, 'LR': 0.007523228370280148, 'WEIGHT_0': 0.061434385566354055, 'WEIGHT_1': 0.2538867781198776, 'WEIGHT_2': 0.7482996262913338, 'WEIGHT_3': 0.5233493848751173, 'WEIGHT_4': 0.8133453898982542, 'WEIGHT_5': 0.3044633385272736, 'WEIGHT_6': 0.6994192289341906, 'WEIGHT_7': 0.30576419583373926, 'WEIGHT_8': 0.576401966104284, 'optimizer': 'RMSprop'}
49
              precision    recall  f1-score   support

         LOC       0.23      0.12      0.16      1837
        MISC       0.07      0.14      0.09       922
         ORG       0.10      0.10      0.10      1341
         PER       0.04      0.10      0.05      1842

   micro avg       0.07      0.11      0.09      5942
   macro avg       0.11      0.11      0.10      5942
weighted avg       0.11      0.11      0.10      5942

epoch 49
LSTM
  0%|          | 0/50 [00:00<?, ?it/s]/userhome/cs2/dingruiw/conda/envs/py310/lib/python3.10/site-packages/seqeval/metrics/v1.py:57: UndefinedMetricWarning: Precision and F-score are ill-defined and being set to 0.0 in labels with no predicted samples. Use `zero_division` parameter to control this behavior.
  _warn_prf(average, modifier, msg_start, len(result))
  2%|▏         | 1/50 [00:07<05:50,  7.15s/it]  4%|▍         | 2/50 [00:07<02:30,  3.13s/it]  6%|▌         | 3/50 [00:08<01:33,  1.99s/it]  8%|▊         | 4/50 [00:08<01:06,  1.45s/it] 10%|█         | 5/50 [00:09<00:51,  1.15s/it] 12%|█▏        | 6/50 [00:09<00:42,  1.03it/s] 14%|█▍        | 7/50 [00:10<00:36,  1.17it/s] 16%|█▌        | 8/50 [00:11<00:32,  1.28it/s] 18%|█▊        | 9/50 [00:11<00:30,  1.36it/s] 20%|██        | 10/50 [00:12<00:27,  1.43it/s] 22%|██▏       | 11/50 [00:13<00:26,  1.48it/s] 24%|██▍       | 12/50 [00:13<00:25,  1.52it/s] 26%|██▌       | 13/50 [00:14<00:24,  1.54it/s] 28%|██▊       | 14/50 [00:14<00:23,  1.56it/s] 30%|███       | 15/50 [00:15<00:22,  1.57it/s] 32%|███▏      | 16/50 [00:16<00:21,  1.58it/s] 34%|███▍      | 17/50 [00:16<00:20,  1.58it/s] 36%|███▌      | 18/50 [00:17<00:20,  1.59it/s] 38%|███▊      | 19/50 [00:18<00:19,  1.59it/s] 40%|████      | 20/50 [00:18<00:18,  1.59it/s] 42%|████▏     | 21/50 [00:19<00:18,  1.59it/s] 44%|████▍     | 22/50 [00:19<00:17,  1.59it/s] 46%|████▌     | 23/50 [00:20<00:16,  1.59it/s] 48%|████▊     | 24/50 [00:21<00:16,  1.59it/s] 50%|█████     | 25/50 [00:21<00:15,  1.59it/s] 52%|█████▏    | 26/50 [00:22<00:15,  1.59it/s] 54%|█████▍    | 27/50 [00:23<00:14,  1.59it/s] 56%|█████▌    | 28/50 [00:23<00:13,  1.58it/s] 58%|█████▊    | 29/50 [00:24<00:13,  1.58it/s] 60%|██████    | 30/50 [00:25<00:12,  1.58it/s] 62%|██████▏   | 31/50 [00:25<00:11,  1.58it/s] 64%|██████▍   | 32/50 [00:26<00:11,  1.59it/s] 66%|██████▌   | 33/50 [00:26<00:10,  1.59it/s] 68%|██████▊   | 34/50 [00:27<00:10,  1.59it/s] 70%|███████   | 35/50 [00:28<00:09,  1.58it/s] 72%|███████▏  | 36/50 [00:28<00:08,  1.58it/s] 74%|███████▍  | 37/50 [00:29<00:08,  1.58it/s] 76%|███████▌  | 38/50 [00:30<00:07,  1.58it/s] 78%|███████▊  | 39/50 [00:30<00:06,  1.58it/s] 80%|████████  | 40/50 [00:31<00:06,  1.58it/s] 82%|████████▏ | 41/50 [00:31<00:05,  1.58it/s] 84%|████████▍ | 42/50 [00:32<00:05,  1.59it/s] 86%|████████▌ | 43/50 [00:33<00:04,  1.59it/s] 88%|████████▊ | 44/50 [00:33<00:03,  1.58it/s] 90%|█████████ | 45/50 [00:34<00:03,  1.58it/s] 92%|█████████▏| 46/50 [00:35<00:02,  1.58it/s] 94%|█████████▍| 47/50 [00:35<00:01,  1.58it/s] 96%|█████████▌| 48/50 [00:36<00:01,  1.58it/s] 98%|█████████▊| 49/50 [00:37<00:00,  1.58it/s]100%|██████████| 50/50 [00:44<00:00,  2.62s/it]100%|██████████| 50/50 [00:44<00:00,  1.13it/s]
[I 2023-12-10 20:45:26,793] Trial 1 finished with value: 0.04898233057481548 and parameters: {'EMBEDDING_DIM': 250, 'HIDDEN_DIM': 411, 'NUM_LAYERS': 4, 'DROPOUT': 0.19953935519554183, 'LR': 0.009185077576061858, 'WEIGHT_0': 0.18819592038649025, 'WEIGHT_1': 0.9604986765604568, 'WEIGHT_2': 0.88932623035203, 'WEIGHT_3': 0.6891484172902043, 'WEIGHT_4': 0.52069118386669, 'WEIGHT_5': 0.10996506738261336, 'WEIGHT_6': 0.2903193538239993, 'WEIGHT_7': 0.710768454023662, 'WEIGHT_8': 0.11078876852211617, 'optimizer': 'RMSprop'}. Best is trial 0 with value: 0.08689326808623199.
{'EMBEDDING_DIM': 250, 'HIDDEN_DIM': 411, 'NUM_LAYERS': 4, 'DROPOUT': 0.19953935519554183, 'LR': 0.009185077576061858, 'WEIGHT_0': 0.18819592038649025, 'WEIGHT_1': 0.9604986765604568, 'WEIGHT_2': 0.88932623035203, 'WEIGHT_3': 0.6891484172902043, 'WEIGHT_4': 0.52069118386669, 'WEIGHT_5': 0.10996506738261336, 'WEIGHT_6': 0.2903193538239993, 'WEIGHT_7': 0.710768454023662, 'WEIGHT_8': 0.11078876852211617, 'optimizer': 'RMSprop'}
0
              precision    recall  f1-score   support

         LOC       0.00      0.00      0.00      1837
        MISC       0.00      0.00      0.00       922
         ORG       0.00      0.00      0.00      1341
         PER       0.00      0.00      0.00      1842

   micro avg       0.00      0.00      0.00      5942
   macro avg       0.00      0.00      0.00      5942
weighted avg       0.00      0.00      0.00      5942

{'EMBEDDING_DIM': 250, 'HIDDEN_DIM': 411, 'NUM_LAYERS': 4, 'DROPOUT': 0.19953935519554183, 'LR': 0.009185077576061858, 'WEIGHT_0': 0.18819592038649025, 'WEIGHT_1': 0.9604986765604568, 'WEIGHT_2': 0.88932623035203, 'WEIGHT_3': 0.6891484172902043, 'WEIGHT_4': 0.52069118386669, 'WEIGHT_5': 0.10996506738261336, 'WEIGHT_6': 0.2903193538239993, 'WEIGHT_7': 0.710768454023662, 'WEIGHT_8': 0.11078876852211617, 'optimizer': 'RMSprop'}
49
              precision    recall  f1-score   support

         LOC       0.00      0.00      0.00      1837
        MISC       0.00      0.00      0.00       922
         ORG       0.12      0.14      0.13      1341
         PER       0.02      0.01      0.02      1842

   micro avg       0.07      0.04      0.05      5942
   macro avg       0.03      0.04      0.04      5942
weighted avg       0.03      0.04      0.03      5942

epoch 49
LSTM
  0%|          | 0/50 [00:00<?, ?it/s]  2%|▏         | 1/50 [00:15<12:53, 15.78s/it]  4%|▍         | 2/50 [00:17<05:56,  7.43s/it]  6%|▌         | 3/50 [00:20<04:19,  5.53s/it]  8%|▊         | 4/50 [00:23<03:33,  4.64s/it] 10%|█         | 5/50 [00:27<03:07,  4.16s/it] 12%|█▏        | 6/50 [00:30<02:50,  3.86s/it] 14%|█▍        | 7/50 [00:33<02:38,  3.68s/it] 16%|█▌        | 8/50 [00:37<02:29,  3.56s/it] 18%|█▊        | 9/50 [00:40<02:23,  3.49s/it] 20%|██        | 10/50 [00:43<02:17,  3.44s/it] 22%|██▏       | 11/50 [00:47<02:13,  3.41s/it] 24%|██▍       | 12/50 [00:50<02:09,  3.40s/it] 26%|██▌       | 13/50 [00:53<02:05,  3.39s/it] 28%|██▊       | 14/50 [00:57<02:01,  3.39s/it] 30%|███       | 15/50 [01:00<01:58,  3.38s/it] 32%|███▏      | 16/50 [01:03<01:54,  3.38s/it] 34%|███▍      | 17/50 [01:07<01:51,  3.38s/it] 36%|███▌      | 18/50 [01:10<01:48,  3.38s/it] 38%|███▊      | 19/50 [01:14<01:44,  3.38s/it] 40%|████      | 20/50 [01:17<01:41,  3.38s/it] 42%|████▏     | 21/50 [01:20<01:38,  3.38s/it] 44%|████▍     | 22/50 [01:24<01:34,  3.39s/it] 46%|████▌     | 23/50 [01:27<01:31,  3.38s/it] 48%|████▊     | 24/50 [01:31<01:28,  3.39s/it] 50%|█████     | 25/50 [01:34<01:24,  3.39s/it] 52%|█████▏    | 26/50 [01:37<01:21,  3.38s/it] 54%|█████▍    | 27/50 [01:41<01:18,  3.39s/it] 56%|█████▌    | 28/50 [01:44<01:14,  3.40s/it] 58%|█████▊    | 29/50 [01:48<01:11,  3.38s/it] 60%|██████    | 30/50 [01:51<01:07,  3.39s/it] 62%|██████▏   | 31/50 [01:54<01:04,  3.40s/it] 64%|██████▍   | 32/50 [01:58<01:01,  3.40s/it] 66%|██████▌   | 33/50 [02:01<00:57,  3.39s/it] 68%|██████▊   | 34/50 [02:05<00:54,  3.39s/it] 70%|███████   | 35/50 [02:08<00:51,  3.41s/it] 72%|███████▏  | 36/50 [02:11<00:47,  3.40s/it] 74%|███████▍  | 37/50 [02:15<00:44,  3.40s/it] 76%|███████▌  | 38/50 [02:18<00:40,  3.40s/it] 78%|███████▊  | 39/50 [02:22<00:37,  3.40s/it] 80%|████████  | 40/50 [02:25<00:33,  3.40s/it] 82%|████████▏ | 41/50 [02:28<00:30,  3.40s/it] 84%|████████▍ | 42/50 [02:32<00:27,  3.40s/it] 86%|████████▌ | 43/50 [02:35<00:23,  3.41s/it] 88%|████████▊ | 44/50 [02:39<00:20,  3.41s/it] 90%|█████████ | 45/50 [02:42<00:17,  3.40s/it] 92%|█████████▏| 46/50 [02:45<00:13,  3.40s/it] 94%|█████████▍| 47/50 [02:49<00:10,  3.40s/it] 96%|█████████▌| 48/50 [02:52<00:06,  3.40s/it] 98%|█████████▊| 49/50 [02:56<00:03,  3.41s/it]100%|██████████| 50/50 [03:13<00:00,  7.71s/it]100%|██████████| 50/50 [03:13<00:00,  3.88s/it]
[I 2023-12-10 20:48:53,249] Trial 2 finished with value: 0.04950077344958515 and parameters: {'EMBEDDING_DIM': 680, 'HIDDEN_DIM': 1614, 'NUM_LAYERS': 2, 'DROPOUT': 0.20561852498879826, 'LR': 0.006528108098862454, 'WEIGHT_0': 0.7145871243923447, 'WEIGHT_1': 0.0852625695874919, 'WEIGHT_2': 0.4410342233621356, 'WEIGHT_3': 0.17946309258682036, 'WEIGHT_4': 0.3072100024331571, 'WEIGHT_5': 0.7555855552506645, 'WEIGHT_6': 0.673811881864857, 'WEIGHT_7': 0.9363312966979557, 'WEIGHT_8': 0.33801868619103337, 'optimizer': 'RMSprop'}. Best is trial 0 with value: 0.08689326808623199.
/userhome/cs2/dingruiw/conda/envs/py310/lib/python3.10/site-packages/torch/nn/modules/rnn.py:82: UserWarning: dropout option adds dropout after all but last recurrent layer, so non-zero dropout expects num_layers greater than 1, but got dropout=0.3573261693178715 and num_layers=1
  warnings.warn("dropout option adds dropout after all but last "
{'EMBEDDING_DIM': 680, 'HIDDEN_DIM': 1614, 'NUM_LAYERS': 2, 'DROPOUT': 0.20561852498879826, 'LR': 0.006528108098862454, 'WEIGHT_0': 0.7145871243923447, 'WEIGHT_1': 0.0852625695874919, 'WEIGHT_2': 0.4410342233621356, 'WEIGHT_3': 0.17946309258682036, 'WEIGHT_4': 0.3072100024331571, 'WEIGHT_5': 0.7555855552506645, 'WEIGHT_6': 0.673811881864857, 'WEIGHT_7': 0.9363312966979557, 'WEIGHT_8': 0.33801868619103337, 'optimizer': 'RMSprop'}
0
              precision    recall  f1-score   support

         LOC       0.00      0.00      0.00      1837
        MISC       0.00      0.00      0.00       922
         ORG       0.00      0.00      0.00      1341
         PER       0.22      0.00      0.00      1842

   micro avg       0.14      0.00      0.00      5942
   macro avg       0.06      0.00      0.00      5942
weighted avg       0.07      0.00      0.00      5942

{'EMBEDDING_DIM': 680, 'HIDDEN_DIM': 1614, 'NUM_LAYERS': 2, 'DROPOUT': 0.20561852498879826, 'LR': 0.006528108098862454, 'WEIGHT_0': 0.7145871243923447, 'WEIGHT_1': 0.0852625695874919, 'WEIGHT_2': 0.4410342233621356, 'WEIGHT_3': 0.17946309258682036, 'WEIGHT_4': 0.3072100024331571, 'WEIGHT_5': 0.7555855552506645, 'WEIGHT_6': 0.673811881864857, 'WEIGHT_7': 0.9363312966979557, 'WEIGHT_8': 0.33801868619103337, 'optimizer': 'RMSprop'}
49
              precision    recall  f1-score   support

         LOC       0.14      0.08      0.11      1837
        MISC       0.24      0.02      0.03       922
         ORG       0.29      0.00      0.01      1341
         PER       0.12      0.00      0.00      1842

   micro avg       0.15      0.03      0.05      5942
   macro avg       0.20      0.03      0.04      5942
weighted avg       0.18      0.03      0.04      5942

epoch 49
LSTM
  0%|          | 0/50 [00:00<?, ?it/s]  2%|▏         | 1/50 [00:04<03:35,  4.39s/it] 10%|█         | 5/50 [00:04<00:30,  1.46it/s] 14%|█▍        | 7/50 [00:04<00:19,  2.17it/s] 18%|█▊        | 9/50 [00:04<00:13,  3.01it/s] 22%|██▏       | 11/50 [00:05<00:09,  3.95it/s] 26%|██▌       | 13/50 [00:05<00:07,  4.95it/s] 30%|███       | 15/50 [00:05<00:05,  5.94it/s] 34%|███▍      | 17/50 [00:05<00:04,  6.86it/s] 38%|███▊      | 19/50 [00:05<00:04,  7.69it/s] 42%|████▏     | 21/50 [00:06<00:03,  8.37it/s] 46%|████▌     | 23/50 [00:06<00:03,  8.93it/s] 50%|█████     | 25/50 [00:06<00:02,  9.35it/s] 54%|█████▍    | 27/50 [00:06<00:02,  9.67it/s] 58%|█████▊    | 29/50 [00:06<00:02,  9.91it/s] 62%|██████▏   | 31/50 [00:07<00:01, 10.08it/s] 66%|██████▌   | 33/50 [00:07<00:01, 10.21it/s] 70%|███████   | 35/50 [00:07<00:01, 10.28it/s] 74%|███████▍  | 37/50 [00:07<00:01, 10.35it/s] 78%|███████▊  | 39/50 [00:07<00:01, 10.39it/s] 82%|████████▏ | 41/50 [00:07<00:00, 10.42it/s] 86%|████████▌ | 43/50 [00:08<00:00, 10.46it/s] 90%|█████████ | 45/50 [00:08<00:00, 10.46it/s] 94%|█████████▍| 47/50 [00:08<00:00, 10.48it/s] 98%|█████████▊| 49/50 [00:08<00:00, 10.47it/s]100%|██████████| 50/50 [00:13<00:00,  3.81it/s]
[I 2023-12-10 20:49:10,110] Trial 3 finished with value: 0.3694009216589862 and parameters: {'EMBEDDING_DIM': 994, 'HIDDEN_DIM': 101, 'NUM_LAYERS': 1, 'DROPOUT': 0.3573261693178715, 'LR': 0.002909740154587021, 'WEIGHT_0': 0.6809171671414394, 'WEIGHT_1': 0.4698726540259004, 'WEIGHT_2': 0.10541219932391088, 'WEIGHT_3': 0.14833925584556407, 'WEIGHT_4': 0.783090267987578, 'WEIGHT_5': 0.3827821686788757, 'WEIGHT_6': 0.7702693449338686, 'WEIGHT_7': 0.5495075737954472, 'WEIGHT_8': 0.7337973231315963, 'optimizer': 'Adam'}. Best is trial 3 with value: 0.3694009216589862.
/userhome/cs2/dingruiw/conda/envs/py310/lib/python3.10/site-packages/torch/nn/modules/rnn.py:82: UserWarning: dropout option adds dropout after all but last recurrent layer, so non-zero dropout expects num_layers greater than 1, but got dropout=0.2686109757626853 and num_layers=1
  warnings.warn("dropout option adds dropout after all but last "
{'EMBEDDING_DIM': 994, 'HIDDEN_DIM': 101, 'NUM_LAYERS': 1, 'DROPOUT': 0.3573261693178715, 'LR': 0.002909740154587021, 'WEIGHT_0': 0.6809171671414394, 'WEIGHT_1': 0.4698726540259004, 'WEIGHT_2': 0.10541219932391088, 'WEIGHT_3': 0.14833925584556407, 'WEIGHT_4': 0.783090267987578, 'WEIGHT_5': 0.3827821686788757, 'WEIGHT_6': 0.7702693449338686, 'WEIGHT_7': 0.5495075737954472, 'WEIGHT_8': 0.7337973231315963, 'optimizer': 'Adam'}
0
              precision    recall  f1-score   support

         LOC       0.03      0.06      0.04      1837
        MISC       0.02      0.06      0.03       922
         ORG       0.03      0.15      0.05      1341
         PER       0.02      0.03      0.03      1842

   micro avg       0.03      0.07      0.04      5942
   macro avg       0.03      0.07      0.04      5942
weighted avg       0.03      0.07      0.04      5942

{'EMBEDDING_DIM': 994, 'HIDDEN_DIM': 101, 'NUM_LAYERS': 1, 'DROPOUT': 0.3573261693178715, 'LR': 0.002909740154587021, 'WEIGHT_0': 0.6809171671414394, 'WEIGHT_1': 0.4698726540259004, 'WEIGHT_2': 0.10541219932391088, 'WEIGHT_3': 0.14833925584556407, 'WEIGHT_4': 0.783090267987578, 'WEIGHT_5': 0.3827821686788757, 'WEIGHT_6': 0.7702693449338686, 'WEIGHT_7': 0.5495075737954472, 'WEIGHT_8': 0.7337973231315963, 'optimizer': 'Adam'}
49
              precision    recall  f1-score   support

         LOC       0.61      0.56      0.58      1837
        MISC       0.43      0.20      0.28       922
         ORG       0.26      0.26      0.26      1341
         PER       0.31      0.24      0.27      1842

   micro avg       0.41      0.34      0.37      5942
   macro avg       0.40      0.32      0.35      5942
weighted avg       0.41      0.34      0.36      5942

epoch 49
LSTM
  0%|          | 0/50 [00:00<?, ?it/s]  2%|▏         | 1/50 [00:08<06:49,  8.36s/it]  4%|▍         | 2/50 [00:08<03:01,  3.78s/it]  6%|▌         | 3/50 [00:10<02:02,  2.61s/it]  8%|▊         | 4/50 [00:11<01:34,  2.06s/it] 10%|█         | 5/50 [00:12<01:19,  1.76s/it] 12%|█▏        | 6/50 [00:13<01:09,  1.57s/it] 14%|█▍        | 7/50 [00:15<01:02,  1.46s/it] 16%|█▌        | 8/50 [00:16<00:58,  1.38s/it] 18%|█▊        | 9/50 [00:17<00:54,  1.33s/it] 20%|██        | 10/50 [00:18<00:51,  1.30s/it] 22%|██▏       | 11/50 [00:19<00:49,  1.27s/it] 24%|██▍       | 12/50 [00:21<00:47,  1.26s/it] 26%|██▌       | 13/50 [00:22<00:46,  1.25s/it] 28%|██▊       | 14/50 [00:23<00:44,  1.24s/it] 30%|███       | 15/50 [00:24<00:43,  1.24s/it] 32%|███▏      | 16/50 [00:26<00:41,  1.23s/it] 34%|███▍      | 17/50 [00:27<00:40,  1.23s/it] 36%|███▌      | 18/50 [00:28<00:39,  1.23s/it] 38%|███▊      | 19/50 [00:29<00:38,  1.23s/it] 40%|████      | 20/50 [00:30<00:36,  1.23s/it] 42%|████▏     | 21/50 [00:32<00:35,  1.23s/it] 44%|████▍     | 22/50 [00:33<00:34,  1.24s/it] 46%|████▌     | 23/50 [00:34<00:33,  1.24s/it] 48%|████▊     | 24/50 [00:35<00:32,  1.24s/it] 50%|█████     | 25/50 [00:37<00:31,  1.25s/it] 52%|█████▏    | 26/50 [00:38<00:29,  1.25s/it] 54%|█████▍    | 27/50 [00:39<00:28,  1.25s/it] 56%|█████▌    | 28/50 [00:40<00:27,  1.25s/it] 58%|█████▊    | 29/50 [00:42<00:26,  1.26s/it] 60%|██████    | 30/50 [00:43<00:25,  1.26s/it] 62%|██████▏   | 31/50 [00:44<00:24,  1.27s/it] 64%|██████▍   | 32/50 [00:46<00:22,  1.27s/it] 66%|██████▌   | 33/50 [00:47<00:21,  1.27s/it] 68%|██████▊   | 34/50 [00:48<00:20,  1.27s/it] 70%|███████   | 35/50 [00:49<00:19,  1.27s/it] 72%|███████▏  | 36/50 [00:51<00:17,  1.27s/it] 74%|███████▍  | 37/50 [00:52<00:16,  1.27s/it] 76%|███████▌  | 38/50 [00:53<00:15,  1.27s/it] 78%|███████▊  | 39/50 [00:54<00:14,  1.28s/it] 80%|████████  | 40/50 [00:56<00:12,  1.28s/it] 82%|████████▏ | 41/50 [00:57<00:11,  1.28s/it] 84%|████████▍ | 42/50 [00:58<00:10,  1.28s/it] 86%|████████▌ | 43/50 [01:00<00:08,  1.28s/it] 88%|████████▊ | 44/50 [01:01<00:07,  1.28s/it] 90%|█████████ | 45/50 [01:02<00:06,  1.28s/it] 92%|█████████▏| 46/50 [01:03<00:05,  1.27s/it] 94%|█████████▍| 47/50 [01:05<00:03,  1.27s/it] 96%|█████████▌| 48/50 [01:06<00:02,  1.28s/it] 98%|█████████▊| 49/50 [01:07<00:01,  1.28s/it]100%|██████████| 50/50 [01:16<00:00,  3.54s/it]100%|██████████| 50/50 [01:16<00:00,  1.53s/it]
