[I 2023-12-10 22:13:41,037] Trial 101 finished with value: 0.41263440860215056 and parameters: {'EMBEDDING_DIM': 939, 'HIDDEN_DIM': 282, 'NUM_LAYERS': 1, 'DROPOUT': 0.3456366405231953, 'LR': 0.0019248026540690107, 'WEIGHT_0': 0.391116392139332, 'WEIGHT_1': 0.7809181437705089, 'WEIGHT_2': 0.5344102482698044, 'WEIGHT_3': 0.7188089385481077, 'WEIGHT_4': 0.8923201279138194, 'WEIGHT_5': 0.5100132109661288, 'WEIGHT_6': 0.9988326315926921, 'WEIGHT_7': 0.3413432495006251, 'WEIGHT_8': 0.4307132020467098, 'optimizer': 'RMSprop'}. Best is trial 51 with value: 0.41438326562364947.
/userhome/cs2/dingruiw/conda/envs/py310/lib/python3.10/site-packages/torch/nn/modules/rnn.py:82: UserWarning: dropout option adds dropout after all but last recurrent layer, so non-zero dropout expects num_layers greater than 1, but got dropout=0.34304752912362335 and num_layers=1
  warnings.warn("dropout option adds dropout after all but last "
{'EMBEDDING_DIM': 939, 'HIDDEN_DIM': 282, 'NUM_LAYERS': 1, 'DROPOUT': 0.3456366405231953, 'LR': 0.0019248026540690107, 'WEIGHT_0': 0.391116392139332, 'WEIGHT_1': 0.7809181437705089, 'WEIGHT_2': 0.5344102482698044, 'WEIGHT_3': 0.7188089385481077, 'WEIGHT_4': 0.8923201279138194, 'WEIGHT_5': 0.5100132109661288, 'WEIGHT_6': 0.9988326315926921, 'WEIGHT_7': 0.3413432495006251, 'WEIGHT_8': 0.4307132020467098, 'optimizer': 'RMSprop'}
0
              precision    recall  f1-score   support

         LOC       0.35      0.12      0.18      1837
        MISC       0.07      0.03      0.05       922
         ORG       0.16      0.05      0.07      1341
         PER       0.10      0.03      0.04      1842

   micro avg       0.19      0.06      0.09      5942
   macro avg       0.17      0.06      0.08      5942
weighted avg       0.19      0.06      0.09      5942

{'EMBEDDING_DIM': 939, 'HIDDEN_DIM': 282, 'NUM_LAYERS': 1, 'DROPOUT': 0.3456366405231953, 'LR': 0.0019248026540690107, 'WEIGHT_0': 0.391116392139332, 'WEIGHT_1': 0.7809181437705089, 'WEIGHT_2': 0.5344102482698044, 'WEIGHT_3': 0.7188089385481077, 'WEIGHT_4': 0.8923201279138194, 'WEIGHT_5': 0.5100132109661288, 'WEIGHT_6': 0.9988326315926921, 'WEIGHT_7': 0.3413432495006251, 'WEIGHT_8': 0.4307132020467098, 'optimizer': 'RMSprop'}
49
              precision    recall  f1-score   support

         LOC       0.56      0.54      0.55      1837
        MISC       0.44      0.45      0.45       922
         ORG       0.29      0.28      0.29      1341
         PER       0.34      0.37      0.36      1842

   micro avg       0.41      0.41      0.41      5942
   macro avg       0.41      0.41      0.41      5942
weighted avg       0.41      0.41      0.41      5942

epoch 49
LSTM
  0%|          | 0/50 [00:00<?, ?it/s]  2%|▏         | 1/50 [00:04<03:51,  4.73s/it]  4%|▍         | 2/50 [00:04<01:37,  2.02s/it]  6%|▌         | 3/50 [00:05<00:56,  1.21s/it]  8%|▊         | 4/50 [00:05<00:37,  1.21it/s] 10%|█         | 5/50 [00:05<00:27,  1.63it/s] 12%|█▏        | 6/50 [00:05<00:21,  2.07it/s] 14%|█▍        | 7/50 [00:06<00:17,  2.49it/s] 16%|█▌        | 8/50 [00:06<00:14,  2.87it/s] 18%|█▊        | 9/50 [00:06<00:12,  3.20it/s] 20%|██        | 10/50 [00:06<00:11,  3.47it/s] 22%|██▏       | 11/50 [00:06<00:10,  3.68it/s] 24%|██▍       | 12/50 [00:07<00:09,  3.84it/s] 26%|██▌       | 13/50 [00:07<00:09,  3.97it/s] 28%|██▊       | 14/50 [00:07<00:08,  4.06it/s] 30%|███       | 15/50 [00:07<00:08,  4.12it/s] 32%|███▏      | 16/50 [00:08<00:08,  4.17it/s] 34%|███▍      | 17/50 [00:08<00:07,  4.20it/s] 36%|███▌      | 18/50 [00:08<00:07,  4.22it/s] 38%|███▊      | 19/50 [00:08<00:07,  4.24it/s] 40%|████      | 20/50 [00:09<00:07,  4.25it/s] 42%|████▏     | 21/50 [00:09<00:06,  4.25it/s] 44%|████▍     | 22/50 [00:09<00:06,  4.26it/s] 46%|████▌     | 23/50 [00:09<00:06,  4.26it/s] 48%|████▊     | 24/50 [00:10<00:06,  4.27it/s] 50%|█████     | 25/50 [00:10<00:05,  4.26it/s] 52%|█████▏    | 26/50 [00:10<00:05,  4.27it/s] 54%|█████▍    | 27/50 [00:10<00:05,  4.27it/s] 56%|█████▌    | 28/50 [00:10<00:05,  4.27it/s] 58%|█████▊    | 29/50 [00:11<00:04,  4.27it/s] 60%|██████    | 30/50 [00:11<00:04,  4.27it/s] 62%|██████▏   | 31/50 [00:11<00:04,  4.26it/s] 64%|██████▍   | 32/50 [00:11<00:04,  4.26it/s] 66%|██████▌   | 33/50 [00:12<00:03,  4.26it/s] 68%|██████▊   | 34/50 [00:12<00:03,  4.26it/s] 70%|███████   | 35/50 [00:12<00:03,  4.26it/s] 72%|███████▏  | 36/50 [00:12<00:03,  4.26it/s] 74%|███████▍  | 37/50 [00:13<00:03,  4.26it/s] 76%|███████▌  | 38/50 [00:13<00:02,  4.26it/s] 78%|███████▊  | 39/50 [00:13<00:02,  4.26it/s] 80%|████████  | 40/50 [00:13<00:02,  4.26it/s] 82%|████████▏ | 41/50 [00:14<00:02,  4.26it/s] 84%|████████▍ | 42/50 [00:14<00:01,  4.26it/s] 86%|████████▌ | 43/50 [00:14<00:01,  4.26it/s] 88%|████████▊ | 44/50 [00:14<00:01,  4.26it/s] 90%|█████████ | 45/50 [00:14<00:01,  4.26it/s] 92%|█████████▏| 46/50 [00:15<00:00,  4.26it/s] 94%|█████████▍| 47/50 [00:15<00:00,  4.26it/s] 96%|█████████▌| 48/50 [00:15<00:00,  4.25it/s] 98%|█████████▊| 49/50 [00:15<00:00,  4.26it/s]100%|██████████| 50/50 [00:20<00:00,  1.68s/it]100%|██████████| 50/50 [00:20<00:00,  2.39it/s]
[I 2023-12-10 22:14:06,301] Trial 102 finished with value: 0.3894512973202892 and parameters: {'EMBEDDING_DIM': 984, 'HIDDEN_DIM': 353, 'NUM_LAYERS': 1, 'DROPOUT': 0.34304752912362335, 'LR': 0.002025491144299369, 'WEIGHT_0': 0.468852046184576, 'WEIGHT_1': 0.582921886456803, 'WEIGHT_2': 0.572405075311038, 'WEIGHT_3': 0.8437264406260633, 'WEIGHT_4': 0.8784705778197992, 'WEIGHT_5': 0.529348480100319, 'WEIGHT_6': 0.9719395438209071, 'WEIGHT_7': 0.39762513115630976, 'WEIGHT_8': 0.4720766683452822, 'optimizer': 'RMSprop'}. Best is trial 51 with value: 0.41438326562364947.
/userhome/cs2/dingruiw/conda/envs/py310/lib/python3.10/site-packages/torch/nn/modules/rnn.py:82: UserWarning: dropout option adds dropout after all but last recurrent layer, so non-zero dropout expects num_layers greater than 1, but got dropout=0.31597109898994524 and num_layers=1
  warnings.warn("dropout option adds dropout after all but last "
{'EMBEDDING_DIM': 984, 'HIDDEN_DIM': 353, 'NUM_LAYERS': 1, 'DROPOUT': 0.34304752912362335, 'LR': 0.002025491144299369, 'WEIGHT_0': 0.468852046184576, 'WEIGHT_1': 0.582921886456803, 'WEIGHT_2': 0.572405075311038, 'WEIGHT_3': 0.8437264406260633, 'WEIGHT_4': 0.8784705778197992, 'WEIGHT_5': 0.529348480100319, 'WEIGHT_6': 0.9719395438209071, 'WEIGHT_7': 0.39762513115630976, 'WEIGHT_8': 0.4720766683452822, 'optimizer': 'RMSprop'}
0
              precision    recall  f1-score   support

         LOC       0.27      0.07      0.11      1837
        MISC       0.03      0.02      0.03       922
         ORG       0.10      0.02      0.03      1341
         PER       0.05      0.02      0.03      1842

   micro avg       0.10      0.04      0.05      5942
   macro avg       0.11      0.03      0.05      5942
weighted avg       0.13      0.04      0.05      5942

{'EMBEDDING_DIM': 984, 'HIDDEN_DIM': 353, 'NUM_LAYERS': 1, 'DROPOUT': 0.34304752912362335, 'LR': 0.002025491144299369, 'WEIGHT_0': 0.468852046184576, 'WEIGHT_1': 0.582921886456803, 'WEIGHT_2': 0.572405075311038, 'WEIGHT_3': 0.8437264406260633, 'WEIGHT_4': 0.8784705778197992, 'WEIGHT_5': 0.529348480100319, 'WEIGHT_6': 0.9719395438209071, 'WEIGHT_7': 0.39762513115630976, 'WEIGHT_8': 0.4720766683452822, 'optimizer': 'RMSprop'}
49
              precision    recall  f1-score   support

         LOC       0.61      0.52      0.56      1837
        MISC       0.38      0.43      0.40       922
         ORG       0.26      0.25      0.25      1341
         PER       0.31      0.33      0.32      1842

   micro avg       0.39      0.39      0.39      5942
   macro avg       0.39      0.38      0.38      5942
weighted avg       0.40      0.39      0.39      5942

epoch 49
LSTM
  0%|          | 0/50 [00:00<?, ?it/s]  2%|▏         | 1/50 [00:05<04:05,  5.01s/it]  4%|▍         | 2/50 [00:05<01:44,  2.17s/it]  6%|▌         | 3/50 [00:05<01:03,  1.35s/it]  8%|▊         | 4/50 [00:05<00:44,  1.04it/s] 10%|█         | 5/50 [00:06<00:33,  1.34it/s] 12%|█▏        | 6/50 [00:06<00:27,  1.62it/s] 14%|█▍        | 7/50 [00:07<00:23,  1.86it/s] 16%|█▌        | 8/50 [00:07<00:20,  2.07it/s] 18%|█▊        | 9/50 [00:07<00:18,  2.23it/s] 20%|██        | 10/50 [00:08<00:16,  2.35it/s] 22%|██▏       | 11/50 [00:08<00:15,  2.45it/s] 24%|██▍       | 12/50 [00:08<00:15,  2.52it/s] 26%|██▌       | 13/50 [00:09<00:14,  2.57it/s] 28%|██▊       | 14/50 [00:09<00:13,  2.60it/s] 30%|███       | 15/50 [00:10<00:13,  2.63it/s] 32%|███▏      | 16/50 [00:10<00:12,  2.65it/s] 34%|███▍      | 17/50 [00:10<00:12,  2.67it/s] 36%|███▌      | 18/50 [00:11<00:11,  2.68it/s] 38%|███▊      | 19/50 [00:11<00:11,  2.69it/s] 40%|████      | 20/50 [00:11<00:11,  2.69it/s] 42%|████▏     | 21/50 [00:12<00:10,  2.70it/s] 44%|████▍     | 22/50 [00:12<00:10,  2.70it/s] 46%|████▌     | 23/50 [00:12<00:10,  2.70it/s] 48%|████▊     | 24/50 [00:13<00:09,  2.69it/s] 50%|█████     | 25/50 [00:13<00:09,  2.69it/s] 52%|█████▏    | 26/50 [00:14<00:08,  2.70it/s] 54%|█████▍    | 27/50 [00:14<00:08,  2.70it/s] 56%|█████▌    | 28/50 [00:14<00:08,  2.69it/s] 58%|█████▊    | 29/50 [00:15<00:07,  2.69it/s] 60%|██████    | 30/50 [00:15<00:07,  2.69it/s] 62%|██████▏   | 31/50 [00:15<00:07,  2.70it/s] 64%|██████▍   | 32/50 [00:16<00:06,  2.70it/s] 66%|██████▌   | 33/50 [00:16<00:06,  2.70it/s] 68%|██████▊   | 34/50 [00:17<00:05,  2.70it/s] 70%|███████   | 35/50 [00:17<00:05,  2.70it/s] 72%|███████▏  | 36/50 [00:17<00:05,  2.70it/s] 74%|███████▍  | 37/50 [00:18<00:04,  2.69it/s] 76%|███████▌  | 38/50 [00:18<00:04,  2.70it/s] 78%|███████▊  | 39/50 [00:18<00:04,  2.69it/s] 80%|████████  | 40/50 [00:19<00:03,  2.69it/s] 82%|████████▏ | 41/50 [00:19<00:03,  2.68it/s] 84%|████████▍ | 42/50 [00:20<00:02,  2.68it/s] 86%|████████▌ | 43/50 [00:20<00:02,  2.68it/s] 88%|████████▊ | 44/50 [00:20<00:02,  2.69it/s] 90%|█████████ | 45/50 [00:21<00:01,  2.69it/s] 92%|█████████▏| 46/50 [00:21<00:01,  2.69it/s] 94%|█████████▍| 47/50 [00:21<00:01,  2.70it/s] 96%|█████████▌| 48/50 [00:22<00:00,  2.69it/s] 98%|█████████▊| 49/50 [00:22<00:00,  2.68it/s]100%|██████████| 50/50 [00:27<00:00,  1.75s/it]100%|██████████| 50/50 [00:27<00:00,  1.81it/s]
[I 2023-12-10 22:14:38,155] Trial 103 finished with value: 0.4023829787234042 and parameters: {'EMBEDDING_DIM': 970, 'HIDDEN_DIM': 540, 'NUM_LAYERS': 1, 'DROPOUT': 0.31597109898994524, 'LR': 0.0016678590397414047, 'WEIGHT_0': 0.4199336097045838, 'WEIGHT_1': 0.7480037767011012, 'WEIGHT_2': 0.4696234275995087, 'WEIGHT_3': 0.7641987237207508, 'WEIGHT_4': 0.8447127749516565, 'WEIGHT_5': 0.47706819872334766, 'WEIGHT_6': 0.9572284020111372, 'WEIGHT_7': 0.31832642791136945, 'WEIGHT_8': 0.4397249283437779, 'optimizer': 'RMSprop'}. Best is trial 51 with value: 0.41438326562364947.
/userhome/cs2/dingruiw/conda/envs/py310/lib/python3.10/site-packages/torch/nn/modules/rnn.py:82: UserWarning: dropout option adds dropout after all but last recurrent layer, so non-zero dropout expects num_layers greater than 1, but got dropout=0.32504547016675583 and num_layers=1
  warnings.warn("dropout option adds dropout after all but last "
{'EMBEDDING_DIM': 970, 'HIDDEN_DIM': 540, 'NUM_LAYERS': 1, 'DROPOUT': 0.31597109898994524, 'LR': 0.0016678590397414047, 'WEIGHT_0': 0.4199336097045838, 'WEIGHT_1': 0.7480037767011012, 'WEIGHT_2': 0.4696234275995087, 'WEIGHT_3': 0.7641987237207508, 'WEIGHT_4': 0.8447127749516565, 'WEIGHT_5': 0.47706819872334766, 'WEIGHT_6': 0.9572284020111372, 'WEIGHT_7': 0.31832642791136945, 'WEIGHT_8': 0.4397249283437779, 'optimizer': 'RMSprop'}
0
              precision    recall  f1-score   support

         LOC       0.15      0.10      0.12      1837
        MISC       0.03      0.01      0.02       922
         ORG       0.16      0.04      0.06      1341
         PER       0.05      0.02      0.02      1842

   micro avg       0.11      0.05      0.06      5942
   macro avg       0.10      0.04      0.06      5942
weighted avg       0.10      0.05      0.06      5942

{'EMBEDDING_DIM': 970, 'HIDDEN_DIM': 540, 'NUM_LAYERS': 1, 'DROPOUT': 0.31597109898994524, 'LR': 0.0016678590397414047, 'WEIGHT_0': 0.4199336097045838, 'WEIGHT_1': 0.7480037767011012, 'WEIGHT_2': 0.4696234275995087, 'WEIGHT_3': 0.7641987237207508, 'WEIGHT_4': 0.8447127749516565, 'WEIGHT_5': 0.47706819872334766, 'WEIGHT_6': 0.9572284020111372, 'WEIGHT_7': 0.31832642791136945, 'WEIGHT_8': 0.4397249283437779, 'optimizer': 'RMSprop'}
49
              precision    recall  f1-score   support

         LOC       0.56      0.52      0.54      1837
        MISC       0.42      0.42      0.42       922
         ORG       0.27      0.25      0.26      1341
         PER       0.36      0.38      0.36      1842

   micro avg       0.41      0.40      0.40      5942
   macro avg       0.40      0.39      0.40      5942
weighted avg       0.41      0.40      0.40      5942

epoch 49
LSTM
  0%|          | 0/50 [00:00<?, ?it/s]  2%|▏         | 1/50 [00:04<03:20,  4.09s/it]  6%|▌         | 3/50 [00:04<00:54,  1.16s/it]  8%|▊         | 4/50 [00:04<00:37,  1.22it/s] 10%|█         | 5/50 [00:04<00:27,  1.66it/s] 12%|█▏        | 6/50 [00:04<00:20,  2.16it/s] 14%|█▍        | 7/50 [00:05<00:15,  2.70it/s] 16%|█▌        | 8/50 [00:05<00:12,  3.25it/s] 18%|█▊        | 9/50 [00:05<00:10,  3.77it/s] 20%|██        | 10/50 [00:05<00:09,  4.24it/s] 22%|██▏       | 11/50 [00:05<00:08,  4.64it/s] 24%|██▍       | 12/50 [00:05<00:07,  4.97it/s] 26%|██▌       | 13/50 [00:06<00:07,  5.22it/s] 28%|██▊       | 14/50 [00:06<00:06,  5.42it/s] 30%|███       | 15/50 [00:06<00:06,  5.56it/s] 32%|███▏      | 16/50 [00:06<00:05,  5.67it/s] 34%|███▍      | 17/50 [00:06<00:05,  5.74it/s] 36%|███▌      | 18/50 [00:06<00:05,  5.80it/s] 38%|███▊      | 19/50 [00:07<00:05,  5.84it/s] 40%|████      | 20/50 [00:07<00:05,  5.86it/s] 42%|████▏     | 21/50 [00:07<00:04,  5.88it/s] 44%|████▍     | 22/50 [00:07<00:04,  5.90it/s] 46%|████▌     | 23/50 [00:07<00:04,  5.91it/s] 48%|████▊     | 24/50 [00:07<00:04,  5.91it/s] 50%|█████     | 25/50 [00:08<00:04,  5.92it/s] 52%|█████▏    | 26/50 [00:08<00:04,  5.92it/s] 54%|█████▍    | 27/50 [00:08<00:03,  5.91it/s] 56%|█████▌    | 28/50 [00:08<00:03,  5.91it/s] 58%|█████▊    | 29/50 [00:08<00:03,  5.92it/s] 60%|██████    | 30/50 [00:08<00:03,  5.92it/s] 62%|██████▏   | 31/50 [00:09<00:03,  5.92it/s] 64%|██████▍   | 32/50 [00:09<00:03,  5.92it/s] 66%|██████▌   | 33/50 [00:09<00:02,  5.92it/s] 68%|██████▊   | 34/50 [00:09<00:02,  5.92it/s] 70%|███████   | 35/50 [00:09<00:02,  5.92it/s] 72%|███████▏  | 36/50 [00:09<00:02,  5.92it/s] 74%|███████▍  | 37/50 [00:10<00:02,  5.92it/s] 76%|███████▌  | 38/50 [00:10<00:02,  5.92it/s] 78%|███████▊  | 39/50 [00:10<00:01,  5.92it/s] 80%|████████  | 40/50 [00:10<00:01,  5.93it/s] 82%|████████▏ | 41/50 [00:10<00:01,  5.93it/s] 84%|████████▍ | 42/50 [00:10<00:01,  5.93it/s] 86%|████████▌ | 43/50 [00:11<00:01,  5.93it/s] 88%|████████▊ | 44/50 [00:11<00:01,  5.92it/s] 90%|█████████ | 45/50 [00:11<00:00,  5.92it/s] 92%|█████████▏| 46/50 [00:11<00:00,  5.92it/s] 94%|█████████▍| 47/50 [00:11<00:00,  5.93it/s] 96%|█████████▌| 48/50 [00:11<00:00,  5.92it/s] 98%|█████████▊| 49/50 [00:12<00:00,  5.92it/s]100%|██████████| 50/50 [00:16<00:00,  1.39s/it]100%|██████████| 50/50 [00:16<00:00,  3.06it/s]
[I 2023-12-10 22:14:58,195] Trial 104 finished with value: 0.39271457085828343 and parameters: {'EMBEDDING_DIM': 891, 'HIDDEN_DIM': 150, 'NUM_LAYERS': 1, 'DROPOUT': 0.32504547016675583, 'LR': 0.001390056518271635, 'WEIGHT_0': 0.3868481031592823, 'WEIGHT_1': 0.7850396590382992, 'WEIGHT_2': 0.5086459417102237, 'WEIGHT_3': 0.7877008563897843, 'WEIGHT_4': 0.9010797868408364, 'WEIGHT_5': 0.563447508338283, 'WEIGHT_6': 0.9992654300000174, 'WEIGHT_7': 0.2697525929334361, 'WEIGHT_8': 0.3915875156302705, 'optimizer': 'RMSprop'}. Best is trial 51 with value: 0.41438326562364947.
/userhome/cs2/dingruiw/conda/envs/py310/lib/python3.10/site-packages/torch/nn/modules/rnn.py:82: UserWarning: dropout option adds dropout after all but last recurrent layer, so non-zero dropout expects num_layers greater than 1, but got dropout=0.3750565099743746 and num_layers=1
  warnings.warn("dropout option adds dropout after all but last "
{'EMBEDDING_DIM': 891, 'HIDDEN_DIM': 150, 'NUM_LAYERS': 1, 'DROPOUT': 0.32504547016675583, 'LR': 0.001390056518271635, 'WEIGHT_0': 0.3868481031592823, 'WEIGHT_1': 0.7850396590382992, 'WEIGHT_2': 0.5086459417102237, 'WEIGHT_3': 0.7877008563897843, 'WEIGHT_4': 0.9010797868408364, 'WEIGHT_5': 0.563447508338283, 'WEIGHT_6': 0.9992654300000174, 'WEIGHT_7': 0.2697525929334361, 'WEIGHT_8': 0.3915875156302705, 'optimizer': 'RMSprop'}
0
              precision    recall  f1-score   support

         LOC       0.15      0.06      0.08      1837
        MISC       0.05      0.02      0.03       922
         ORG       0.15      0.02      0.04      1341
         PER       0.08      0.04      0.05      1842

   micro avg       0.10      0.04      0.06      5942
   macro avg       0.11      0.04      0.05      5942
weighted avg       0.11      0.04      0.06      5942

{'EMBEDDING_DIM': 891, 'HIDDEN_DIM': 150, 'NUM_LAYERS': 1, 'DROPOUT': 0.32504547016675583, 'LR': 0.001390056518271635, 'WEIGHT_0': 0.3868481031592823, 'WEIGHT_1': 0.7850396590382992, 'WEIGHT_2': 0.5086459417102237, 'WEIGHT_3': 0.7877008563897843, 'WEIGHT_4': 0.9010797868408364, 'WEIGHT_5': 0.563447508338283, 'WEIGHT_6': 0.9992654300000174, 'WEIGHT_7': 0.2697525929334361, 'WEIGHT_8': 0.3915875156302705, 'optimizer': 'RMSprop'}
49
              precision    recall  f1-score   support

         LOC       0.55      0.54      0.55      1837
        MISC       0.50      0.45      0.47       922
         ORG       0.25      0.24      0.25      1341
         PER       0.29      0.34      0.32      1842

   micro avg       0.39      0.40      0.39      5942
   macro avg       0.40      0.39      0.39      5942
weighted avg       0.40      0.40      0.40      5942

epoch 49
LSTM
  0%|          | 0/50 [00:00<?, ?it/s]  2%|▏         | 1/50 [00:04<03:48,  4.67s/it]  4%|▍         | 2/50 [00:04<01:35,  1.98s/it]  6%|▌         | 3/50 [00:04<00:54,  1.17s/it]  8%|▊         | 4/50 [00:05<00:35,  1.29it/s] 10%|█         | 5/50 [00:05<00:25,  1.78it/s] 12%|█▏        | 6/50 [00:05<00:19,  2.31it/s] 14%|█▍        | 7/50 [00:05<00:15,  2.86it/s] 16%|█▌        | 8/50 [00:05<00:12,  3.37it/s] 18%|█▊        | 9/50 [00:06<00:10,  3.84it/s] 20%|██        | 10/50 [00:06<00:09,  4.24it/s] 22%|██▏       | 11/50 [00:06<00:08,  4.57it/s] 24%|██▍       | 12/50 [00:06<00:07,  4.82it/s] 26%|██▌       | 13/50 [00:06<00:07,  5.01it/s] 28%|██▊       | 14/50 [00:06<00:06,  5.15it/s] 30%|███       | 15/50 [00:07<00:06,  5.26it/s] 32%|███▏      | 16/50 [00:07<00:06,  5.34it/s] 34%|███▍      | 17/50 [00:07<00:06,  5.39it/s] 36%|███▌      | 18/50 [00:07<00:05,  5.43it/s] 38%|███▊      | 19/50 [00:07<00:05,  5.46it/s] 40%|████      | 20/50 [00:08<00:05,  5.48it/s] 42%|████▏     | 21/50 [00:08<00:05,  5.50it/s] 44%|████▍     | 22/50 [00:08<00:05,  5.50it/s] 46%|████▌     | 23/50 [00:08<00:04,  5.51it/s] 48%|████▊     | 24/50 [00:08<00:04,  5.51it/s] 50%|█████     | 25/50 [00:08<00:04,  5.51it/s] 52%|█████▏    | 26/50 [00:09<00:04,  5.52it/s] 54%|█████▍    | 27/50 [00:09<00:04,  5.52it/s] 56%|█████▌    | 28/50 [00:09<00:03,  5.52it/s] 58%|█████▊    | 29/50 [00:09<00:03,  5.52it/s] 60%|██████    | 30/50 [00:09<00:03,  5.51it/s] 62%|██████▏   | 31/50 [00:10<00:03,  5.51it/s] 64%|██████▍   | 32/50 [00:10<00:03,  5.51it/s] 66%|██████▌   | 33/50 [00:10<00:03,  5.51it/s] 68%|██████▊   | 34/50 [00:10<00:02,  5.51it/s] 70%|███████   | 35/50 [00:10<00:02,  5.52it/s] 72%|███████▏  | 36/50 [00:10<00:02,  5.52it/s] 74%|███████▍  | 37/50 [00:11<00:02,  5.51it/s] 76%|███████▌  | 38/50 [00:11<00:02,  5.51it/s] 78%|███████▊  | 39/50 [00:11<00:01,  5.51it/s] 80%|████████  | 40/50 [00:11<00:01,  5.51it/s] 82%|████████▏ | 41/50 [00:11<00:01,  5.51it/s] 84%|████████▍ | 42/50 [00:12<00:01,  5.51it/s] 86%|████████▌ | 43/50 [00:12<00:01,  5.51it/s] 88%|████████▊ | 44/50 [00:12<00:01,  5.51it/s] 90%|█████████ | 45/50 [00:12<00:00,  5.50it/s] 92%|█████████▏| 46/50 [00:12<00:00,  5.50it/s] 94%|█████████▍| 47/50 [00:12<00:00,  5.50it/s] 96%|█████████▌| 48/50 [00:13<00:00,  5.50it/s] 98%|█████████▊| 49/50 [00:13<00:00,  5.50it/s]100%|██████████| 50/50 [00:18<00:00,  1.58s/it]100%|██████████| 50/50 [00:18<00:00,  2.76it/s]
