[I 2023-12-10 22:06:30,440] Trial 97 finished with value: 0.4063618952452328 and parameters: {'EMBEDDING_DIM': 945, 'HIDDEN_DIM': 294, 'NUM_LAYERS': 1, 'DROPOUT': 0.35104870694561235, 'LR': 0.0019283454688990948, 'WEIGHT_0': 0.3945097447562878, 'WEIGHT_1': 0.769551970616655, 'WEIGHT_2': 0.5399199041697803, 'WEIGHT_3': 0.7280226115536992, 'WEIGHT_4': 0.9046434546512485, 'WEIGHT_5': 0.5023108461053944, 'WEIGHT_6': 0.9938154184878328, 'WEIGHT_7': 0.3552113053239635, 'WEIGHT_8': 0.4486346234713049, 'optimizer': 'RMSprop'}. Best is trial 51 with value: 0.41438326562364947.
/userhome/cs2/dingruiw/conda/envs/py310/lib/python3.10/site-packages/torch/nn/modules/rnn.py:82: UserWarning: dropout option adds dropout after all but last recurrent layer, so non-zero dropout expects num_layers greater than 1, but got dropout=0.37563763104855874 and num_layers=1
  warnings.warn("dropout option adds dropout after all but last "
{'EMBEDDING_DIM': 945, 'HIDDEN_DIM': 294, 'NUM_LAYERS': 1, 'DROPOUT': 0.35104870694561235, 'LR': 0.0019283454688990948, 'WEIGHT_0': 0.3945097447562878, 'WEIGHT_1': 0.769551970616655, 'WEIGHT_2': 0.5399199041697803, 'WEIGHT_3': 0.7280226115536992, 'WEIGHT_4': 0.9046434546512485, 'WEIGHT_5': 0.5023108461053944, 'WEIGHT_6': 0.9938154184878328, 'WEIGHT_7': 0.3552113053239635, 'WEIGHT_8': 0.4486346234713049, 'optimizer': 'RMSprop'}
0
              precision    recall  f1-score   support

         LOC       0.19      0.08      0.11      1837
        MISC       0.08      0.03      0.05       922
         ORG       0.14      0.03      0.05      1341
         PER       0.06      0.01      0.01      1842

   micro avg       0.14      0.04      0.06      5942
   macro avg       0.12      0.04      0.05      5942
weighted avg       0.12      0.04      0.06      5942

{'EMBEDDING_DIM': 945, 'HIDDEN_DIM': 294, 'NUM_LAYERS': 1, 'DROPOUT': 0.35104870694561235, 'LR': 0.0019283454688990948, 'WEIGHT_0': 0.3945097447562878, 'WEIGHT_1': 0.769551970616655, 'WEIGHT_2': 0.5399199041697803, 'WEIGHT_3': 0.7280226115536992, 'WEIGHT_4': 0.9046434546512485, 'WEIGHT_5': 0.5023108461053944, 'WEIGHT_6': 0.9938154184878328, 'WEIGHT_7': 0.3552113053239635, 'WEIGHT_8': 0.4486346234713049, 'optimizer': 'RMSprop'}
49
              precision    recall  f1-score   support

         LOC       0.54      0.54      0.54      1837
        MISC       0.42      0.46      0.44       922
         ORG       0.28      0.27      0.27      1341
         PER       0.35      0.36      0.35      1842

   micro avg       0.40      0.41      0.41      5942
   macro avg       0.40      0.41      0.40      5942
weighted avg       0.40      0.41      0.41      5942

epoch 49
LSTM
  0%|          | 0/50 [00:00<?, ?it/s]  2%|▏         | 1/50 [00:05<04:06,  5.02s/it]  6%|▌         | 3/50 [00:05<01:05,  1.39s/it]  8%|▊         | 4/50 [00:05<00:44,  1.04it/s] 10%|█         | 5/50 [00:05<00:31,  1.45it/s] 12%|█▏        | 6/50 [00:05<00:22,  1.94it/s] 14%|█▍        | 7/50 [00:05<00:17,  2.50it/s] 16%|█▌        | 8/50 [00:05<00:13,  3.10it/s] 18%|█▊        | 9/50 [00:06<00:10,  3.73it/s] 20%|██        | 10/50 [00:06<00:09,  4.32it/s] 22%|██▏       | 11/50 [00:06<00:08,  4.86it/s] 24%|██▍       | 12/50 [00:06<00:07,  5.32it/s] 26%|██▌       | 13/50 [00:06<00:06,  5.69it/s] 28%|██▊       | 14/50 [00:06<00:06,  5.98it/s] 30%|███       | 15/50 [00:07<00:05,  6.17it/s] 32%|███▏      | 16/50 [00:07<00:05,  6.37it/s] 34%|███▍      | 17/50 [00:07<00:05,  6.49it/s] 36%|███▌      | 18/50 [00:07<00:04,  6.58it/s] 38%|███▊      | 19/50 [00:07<00:04,  6.64it/s] 40%|████      | 20/50 [00:07<00:04,  6.68it/s] 42%|████▏     | 21/50 [00:07<00:04,  6.71it/s] 44%|████▍     | 22/50 [00:08<00:04,  6.73it/s] 46%|████▌     | 23/50 [00:08<00:04,  6.75it/s] 48%|████▊     | 24/50 [00:08<00:03,  6.75it/s] 50%|█████     | 25/50 [00:08<00:03,  6.77it/s] 52%|█████▏    | 26/50 [00:08<00:03,  6.78it/s] 54%|█████▍    | 27/50 [00:08<00:03,  6.79it/s] 56%|█████▌    | 28/50 [00:08<00:03,  6.78it/s] 58%|█████▊    | 29/50 [00:09<00:03,  6.78it/s] 60%|██████    | 30/50 [00:09<00:02,  6.78it/s] 62%|██████▏   | 31/50 [00:09<00:02,  6.79it/s] 64%|██████▍   | 32/50 [00:09<00:02,  6.78it/s] 66%|██████▌   | 33/50 [00:09<00:02,  6.78it/s] 68%|██████▊   | 34/50 [00:09<00:02,  6.78it/s] 70%|███████   | 35/50 [00:09<00:02,  6.77it/s] 72%|███████▏  | 36/50 [00:10<00:02,  6.77it/s] 74%|███████▍  | 37/50 [00:10<00:01,  6.77it/s] 76%|███████▌  | 38/50 [00:10<00:01,  6.77it/s] 78%|███████▊  | 39/50 [00:10<00:01,  6.77it/s] 80%|████████  | 40/50 [00:10<00:01,  6.76it/s] 82%|████████▏ | 41/50 [00:10<00:01,  6.77it/s] 84%|████████▍ | 42/50 [00:11<00:01,  6.76it/s] 86%|████████▌ | 43/50 [00:11<00:01,  6.76it/s] 88%|████████▊ | 44/50 [00:11<00:00,  6.76it/s] 90%|█████████ | 45/50 [00:11<00:00,  6.75it/s] 92%|█████████▏| 46/50 [00:11<00:00,  6.76it/s] 94%|█████████▍| 47/50 [00:11<00:00,  6.76it/s] 96%|█████████▌| 48/50 [00:11<00:00,  6.75it/s] 98%|█████████▊| 49/50 [00:12<00:00,  6.76it/s]100%|██████████| 50/50 [00:16<00:00,  1.55s/it]100%|██████████| 50/50 [00:16<00:00,  2.96it/s]
[I 2023-12-10 22:06:51,585] Trial 98 finished with value: 0.3629067434354009 and parameters: {'EMBEDDING_DIM': 918, 'HIDDEN_DIM': 204, 'NUM_LAYERS': 1, 'DROPOUT': 0.37563763104855874, 'LR': 0.00080032367499055, 'WEIGHT_0': 0.36025493275226506, 'WEIGHT_1': 0.5374324885638028, 'WEIGHT_2': 0.5943364730269397, 'WEIGHT_3': 0.8633045882446402, 'WEIGHT_4': 0.8613327172147869, 'WEIGHT_5': 0.6083297467301649, 'WEIGHT_6': 0.9522731258102833, 'WEIGHT_7': 0.4809684633515554, 'WEIGHT_8': 0.3659352221460315, 'optimizer': 'Adam'}. Best is trial 51 with value: 0.41438326562364947.
{'EMBEDDING_DIM': 918, 'HIDDEN_DIM': 204, 'NUM_LAYERS': 1, 'DROPOUT': 0.37563763104855874, 'LR': 0.00080032367499055, 'WEIGHT_0': 0.36025493275226506, 'WEIGHT_1': 0.5374324885638028, 'WEIGHT_2': 0.5943364730269397, 'WEIGHT_3': 0.8633045882446402, 'WEIGHT_4': 0.8613327172147869, 'WEIGHT_5': 0.6083297467301649, 'WEIGHT_6': 0.9522731258102833, 'WEIGHT_7': 0.4809684633515554, 'WEIGHT_8': 0.3659352221460315, 'optimizer': 'Adam'}
0
              precision    recall  f1-score   support

         LOC       0.04      0.10      0.06      1837
        MISC       0.02      0.11      0.03       922
         ORG       0.02      0.13      0.04      1341
         PER       0.01      0.08      0.02      1842

   micro avg       0.02      0.10      0.03      5942
   macro avg       0.02      0.11      0.04      5942
weighted avg       0.02      0.10      0.04      5942

{'EMBEDDING_DIM': 918, 'HIDDEN_DIM': 204, 'NUM_LAYERS': 1, 'DROPOUT': 0.37563763104855874, 'LR': 0.00080032367499055, 'WEIGHT_0': 0.36025493275226506, 'WEIGHT_1': 0.5374324885638028, 'WEIGHT_2': 0.5943364730269397, 'WEIGHT_3': 0.8633045882446402, 'WEIGHT_4': 0.8613327172147869, 'WEIGHT_5': 0.6083297467301649, 'WEIGHT_6': 0.9522731258102833, 'WEIGHT_7': 0.4809684633515554, 'WEIGHT_8': 0.3659352221460315, 'optimizer': 'Adam'}
49
              precision    recall  f1-score   support

         LOC       0.55      0.48      0.51      1837
        MISC       0.46      0.37      0.41       922
         ORG       0.23      0.19      0.21      1341
         PER       0.29      0.33      0.31      1842

   micro avg       0.38      0.35      0.36      5942
   macro avg       0.38      0.34      0.36      5942
weighted avg       0.38      0.35      0.36      5942

epoch 49
LSTM
  0%|          | 0/50 [00:00<?, ?it/s]  2%|▏         | 1/50 [00:24<20:11, 24.73s/it]  4%|▍         | 2/50 [00:28<10:02, 12.56s/it]  6%|▌         | 3/50 [00:34<07:29,  9.56s/it]  8%|▊         | 4/50 [00:40<06:15,  8.16s/it] 10%|█         | 5/50 [00:46<05:32,  7.38s/it] 12%|█▏        | 6/50 [00:52<05:05,  6.94s/it] 14%|█▍        | 7/50 [00:59<04:47,  6.69s/it] 16%|█▌        | 8/50 [01:05<04:33,  6.51s/it] 18%|█▊        | 9/50 [01:11<04:23,  6.43s/it] 20%|██        | 10/50 [01:17<04:14,  6.37s/it] 22%|██▏       | 11/50 [01:23<04:06,  6.31s/it] 24%|██▍       | 12/50 [01:29<03:58,  6.26s/it] 26%|██▌       | 13/50 [01:36<03:51,  6.24s/it] 28%|██▊       | 14/50 [01:42<03:44,  6.24s/it] 30%|███       | 15/50 [01:48<03:37,  6.22s/it] 32%|███▏      | 16/50 [01:54<03:30,  6.20s/it] 34%|███▍      | 17/50 [02:00<03:24,  6.19s/it] 36%|███▌      | 18/50 [02:07<03:17,  6.18s/it] 38%|███▊      | 19/50 [02:13<03:11,  6.18s/it] 40%|████      | 20/50 [02:19<03:04,  6.16s/it] 42%|████▏     | 21/50 [02:25<02:58,  6.15s/it] 44%|████▍     | 22/50 [02:31<02:51,  6.13s/it] 46%|████▌     | 23/50 [02:37<02:44,  6.10s/it] 48%|████▊     | 24/50 [02:43<02:38,  6.10s/it] 50%|█████     | 25/50 [02:49<02:32,  6.08s/it] 52%|█████▏    | 26/50 [02:55<02:25,  6.07s/it] 54%|█████▍    | 27/50 [03:01<02:19,  6.06s/it] 56%|█████▌    | 28/50 [03:07<02:13,  6.06s/it] 58%|█████▊    | 29/50 [03:13<02:07,  6.05s/it] 60%|██████    | 30/50 [03:19<02:00,  6.04s/it] 62%|██████▏   | 31/50 [03:25<01:54,  6.04s/it] 64%|██████▍   | 32/50 [03:31<01:48,  6.03s/it] 66%|██████▌   | 33/50 [03:38<01:42,  6.03s/it] 68%|██████▊   | 34/50 [03:44<01:36,  6.02s/it] 70%|███████   | 35/50 [03:50<01:30,  6.03s/it] 72%|███████▏  | 36/50 [03:56<01:24,  6.03s/it] 74%|███████▍  | 37/50 [04:02<01:18,  6.02s/it] 76%|███████▌  | 38/50 [04:08<01:12,  6.02s/it] 78%|███████▊  | 39/50 [04:14<01:06,  6.02s/it] 80%|████████  | 40/50 [04:20<01:00,  6.02s/it] 82%|████████▏ | 41/50 [04:26<00:54,  6.02s/it] 84%|████████▍ | 42/50 [04:32<00:48,  6.02s/it] 86%|████████▌ | 43/50 [04:38<00:42,  6.02s/it] 88%|████████▊ | 44/50 [04:44<00:36,  6.02s/it] 90%|█████████ | 45/50 [04:50<00:30,  6.02s/it] 92%|█████████▏| 46/50 [04:56<00:24,  6.01s/it] 94%|█████████▍| 47/50 [05:02<00:18,  6.02s/it] 96%|█████████▌| 48/50 [05:08<00:12,  6.02s/it] 98%|█████████▊| 49/50 [05:14<00:06,  6.02s/it]100%|██████████| 50/50 [05:41<00:00, 12.29s/it]100%|██████████| 50/50 [05:41<00:00,  6.82s/it]
[I 2023-12-10 22:12:52,163] Trial 99 finished with value: 0.2927187316500294 and parameters: {'EMBEDDING_DIM': 1001, 'HIDDEN_DIM': 1670, 'NUM_LAYERS': 3, 'DROPOUT': 0.3324725746276499, 'LR': 0.0012112922934367383, 'WEIGHT_0': 0.324360228728285, 'WEIGHT_1': 0.6560010972239317, 'WEIGHT_2': 0.5247859017720488, 'WEIGHT_3': 0.8998993192852314, 'WEIGHT_4': 0.9274967411601406, 'WEIGHT_5': 0.5785791858859386, 'WEIGHT_6': 0.9253473428680598, 'WEIGHT_7': 0.44861711813111477, 'WEIGHT_8': 0.3282911246135061, 'optimizer': 'Adam'}. Best is trial 51 with value: 0.41438326562364947.
/userhome/cs2/dingruiw/conda/envs/py310/lib/python3.10/site-packages/torch/nn/modules/rnn.py:82: UserWarning: dropout option adds dropout after all but last recurrent layer, so non-zero dropout expects num_layers greater than 1, but got dropout=0.36006638083390896 and num_layers=1
  warnings.warn("dropout option adds dropout after all but last "
{'EMBEDDING_DIM': 1001, 'HIDDEN_DIM': 1670, 'NUM_LAYERS': 3, 'DROPOUT': 0.3324725746276499, 'LR': 0.0012112922934367383, 'WEIGHT_0': 0.324360228728285, 'WEIGHT_1': 0.6560010972239317, 'WEIGHT_2': 0.5247859017720488, 'WEIGHT_3': 0.8998993192852314, 'WEIGHT_4': 0.9274967411601406, 'WEIGHT_5': 0.5785791858859386, 'WEIGHT_6': 0.9253473428680598, 'WEIGHT_7': 0.44861711813111477, 'WEIGHT_8': 0.3282911246135061, 'optimizer': 'Adam'}
0
              precision    recall  f1-score   support

         LOC       0.02      0.01      0.01      1837
        MISC       0.01      0.00      0.01       922
         ORG       0.02      0.01      0.02      1341
         PER       0.02      0.05      0.03      1842

   micro avg       0.02      0.02      0.02      5942
   macro avg       0.02      0.02      0.01      5942
weighted avg       0.02      0.02      0.02      5942

{'EMBEDDING_DIM': 1001, 'HIDDEN_DIM': 1670, 'NUM_LAYERS': 3, 'DROPOUT': 0.3324725746276499, 'LR': 0.0012112922934367383, 'WEIGHT_0': 0.324360228728285, 'WEIGHT_1': 0.6560010972239317, 'WEIGHT_2': 0.5247859017720488, 'WEIGHT_3': 0.8998993192852314, 'WEIGHT_4': 0.9274967411601406, 'WEIGHT_5': 0.5785791858859386, 'WEIGHT_6': 0.9253473428680598, 'WEIGHT_7': 0.44861711813111477, 'WEIGHT_8': 0.3282911246135061, 'optimizer': 'Adam'}
49
              precision    recall  f1-score   support

         LOC       0.55      0.46      0.51      1837
        MISC       0.12      0.38      0.18       922
         ORG       0.18      0.26      0.21      1341
         PER       0.40      0.24      0.30      1842

   micro avg       0.26      0.34      0.29      5942
   macro avg       0.31      0.34      0.30      5942
weighted avg       0.35      0.34      0.32      5942

epoch 49
LSTM
  0%|          | 0/50 [00:00<?, ?it/s]  2%|▏         | 1/50 [00:05<04:06,  5.03s/it]  4%|▍         | 2/50 [00:05<01:43,  2.15s/it]  6%|▌         | 3/50 [00:05<01:00,  1.29s/it]  8%|▊         | 4/50 [00:05<00:40,  1.14it/s] 10%|█         | 5/50 [00:05<00:29,  1.54it/s] 12%|█▏        | 6/50 [00:06<00:22,  1.95it/s] 14%|█▍        | 7/50 [00:06<00:18,  2.34it/s] 16%|█▌        | 8/50 [00:06<00:15,  2.70it/s] 18%|█▊        | 9/50 [00:06<00:13,  3.02it/s] 20%|██        | 10/50 [00:07<00:12,  3.27it/s] 22%|██▏       | 11/50 [00:07<00:11,  3.47it/s] 24%|██▍       | 12/50 [00:07<00:10,  3.62it/s] 26%|██▌       | 13/50 [00:07<00:09,  3.73it/s] 28%|██▊       | 14/50 [00:08<00:09,  3.82it/s] 30%|███       | 15/50 [00:08<00:09,  3.87it/s] 32%|███▏      | 16/50 [00:08<00:08,  3.92it/s] 34%|███▍      | 17/50 [00:08<00:08,  3.95it/s] 36%|███▌      | 18/50 [00:09<00:08,  3.96it/s] 38%|███▊      | 19/50 [00:09<00:07,  3.99it/s] 40%|████      | 20/50 [00:09<00:07,  4.00it/s] 42%|████▏     | 21/50 [00:09<00:07,  4.01it/s] 44%|████▍     | 22/50 [00:10<00:06,  4.00it/s] 46%|████▌     | 23/50 [00:10<00:06,  4.00it/s] 48%|████▊     | 24/50 [00:10<00:06,  4.00it/s] 50%|█████     | 25/50 [00:10<00:06,  4.01it/s] 52%|█████▏    | 26/50 [00:11<00:05,  4.01it/s] 54%|█████▍    | 27/50 [00:11<00:05,  4.01it/s] 56%|█████▌    | 28/50 [00:11<00:05,  4.01it/s] 58%|█████▊    | 29/50 [00:11<00:05,  4.01it/s] 60%|██████    | 30/50 [00:12<00:04,  4.01it/s] 62%|██████▏   | 31/50 [00:12<00:04,  4.00it/s] 64%|██████▍   | 32/50 [00:12<00:04,  4.00it/s] 66%|██████▌   | 33/50 [00:12<00:04,  4.00it/s] 68%|██████▊   | 34/50 [00:13<00:03,  4.00it/s] 70%|███████   | 35/50 [00:13<00:03,  4.01it/s] 72%|███████▏  | 36/50 [00:13<00:03,  4.01it/s] 74%|███████▍  | 37/50 [00:13<00:03,  4.00it/s] 76%|███████▌  | 38/50 [00:14<00:02,  4.00it/s] 78%|███████▊  | 39/50 [00:14<00:02,  4.00it/s] 80%|████████  | 40/50 [00:14<00:02,  4.00it/s] 82%|████████▏ | 41/50 [00:14<00:02,  4.00it/s] 84%|████████▍ | 42/50 [00:15<00:02,  4.00it/s] 86%|████████▌ | 43/50 [00:15<00:01,  4.00it/s] 88%|████████▊ | 44/50 [00:15<00:01,  4.01it/s] 90%|█████████ | 45/50 [00:15<00:01,  4.00it/s] 92%|█████████▏| 46/50 [00:16<00:00,  4.00it/s] 94%|█████████▍| 47/50 [00:16<00:00,  4.00it/s] 96%|█████████▌| 48/50 [00:16<00:00,  4.00it/s] 98%|█████████▊| 49/50 [00:16<00:00,  4.00it/s]100%|██████████| 50/50 [00:21<00:00,  1.67s/it]100%|██████████| 50/50 [00:21<00:00,  2.28it/s]
[I 2023-12-10 22:13:18,263] Trial 100 finished with value: 0.024060049594531195 and parameters: {'EMBEDDING_DIM': 762, 'HIDDEN_DIM': 438, 'NUM_LAYERS': 1, 'DROPOUT': 0.36006638083390896, 'LR': 0.001024752759717713, 'WEIGHT_0': 0.5365318774021931, 'WEIGHT_1': 0.7369061604377911, 'WEIGHT_2': 0.6994735406003959, 'WEIGHT_3': 0.9599300866094743, 'WEIGHT_4': 0.8170346008076279, 'WEIGHT_5': 0.4438395767328217, 'WEIGHT_6': 0.849222801226184, 'WEIGHT_7': 0.29180521066632537, 'WEIGHT_8': 0.4967070417548053, 'optimizer': 'SGD'}. Best is trial 51 with value: 0.41438326562364947.
/userhome/cs2/dingruiw/conda/envs/py310/lib/python3.10/site-packages/torch/nn/modules/rnn.py:82: UserWarning: dropout option adds dropout after all but last recurrent layer, so non-zero dropout expects num_layers greater than 1, but got dropout=0.3456366405231953 and num_layers=1
  warnings.warn("dropout option adds dropout after all but last "
{'EMBEDDING_DIM': 762, 'HIDDEN_DIM': 438, 'NUM_LAYERS': 1, 'DROPOUT': 0.36006638083390896, 'LR': 0.001024752759717713, 'WEIGHT_0': 0.5365318774021931, 'WEIGHT_1': 0.7369061604377911, 'WEIGHT_2': 0.6994735406003959, 'WEIGHT_3': 0.9599300866094743, 'WEIGHT_4': 0.8170346008076279, 'WEIGHT_5': 0.4438395767328217, 'WEIGHT_6': 0.849222801226184, 'WEIGHT_7': 0.29180521066632537, 'WEIGHT_8': 0.4967070417548053, 'optimizer': 'SGD'}
0
              precision    recall  f1-score   support

         LOC       0.03      0.09      0.05      1837
        MISC       0.01      0.16      0.02       922
         ORG       0.01      0.07      0.02      1341
         PER       0.01      0.06      0.02      1842

   micro avg       0.01      0.09      0.03      5942
   macro avg       0.02      0.09      0.03      5942
weighted avg       0.02      0.09      0.03      5942

{'EMBEDDING_DIM': 762, 'HIDDEN_DIM': 438, 'NUM_LAYERS': 1, 'DROPOUT': 0.36006638083390896, 'LR': 0.001024752759717713, 'WEIGHT_0': 0.5365318774021931, 'WEIGHT_1': 0.7369061604377911, 'WEIGHT_2': 0.6994735406003959, 'WEIGHT_3': 0.9599300866094743, 'WEIGHT_4': 0.8170346008076279, 'WEIGHT_5': 0.4438395767328217, 'WEIGHT_6': 0.849222801226184, 'WEIGHT_7': 0.29180521066632537, 'WEIGHT_8': 0.4967070417548053, 'optimizer': 'SGD'}
49
              precision    recall  f1-score   support

         LOC       0.03      0.06      0.04      1837
        MISC       0.01      0.09      0.02       922
         ORG       0.02      0.06      0.03      1341
         PER       0.01      0.05      0.02      1842

   micro avg       0.02      0.06      0.02      5942
   macro avg       0.02      0.06      0.03      5942
weighted avg       0.02      0.06      0.03      5942

epoch 49
LSTM
  0%|          | 0/50 [00:00<?, ?it/s]  2%|▏         | 1/50 [00:04<03:48,  4.67s/it]  4%|▍         | 2/50 [00:04<01:35,  1.98s/it]  6%|▌         | 3/50 [00:04<00:54,  1.16s/it]  8%|▊         | 4/50 [00:05<00:35,  1.28it/s] 10%|█         | 5/50 [00:05<00:25,  1.76it/s] 12%|█▏        | 6/50 [00:05<00:19,  2.27it/s] 14%|█▍        | 7/50 [00:05<00:15,  2.79it/s] 16%|█▌        | 8/50 [00:05<00:12,  3.28it/s] 18%|█▊        | 9/50 [00:06<00:11,  3.71it/s] 20%|██        | 10/50 [00:06<00:09,  4.08it/s] 22%|██▏       | 11/50 [00:06<00:08,  4.38it/s] 24%|██▍       | 12/50 [00:06<00:08,  4.61it/s] 26%|██▌       | 13/50 [00:06<00:07,  4.79it/s] 28%|██▊       | 14/50 [00:07<00:07,  4.91it/s] 30%|███       | 15/50 [00:07<00:06,  5.01it/s] 32%|███▏      | 16/50 [00:07<00:06,  5.08it/s] 34%|███▍      | 17/50 [00:07<00:06,  5.13it/s] 36%|███▌      | 18/50 [00:07<00:06,  5.16it/s] 38%|███▊      | 19/50 [00:08<00:05,  5.19it/s] 40%|████      | 20/50 [00:08<00:05,  5.19it/s] 42%|████▏     | 21/50 [00:08<00:05,  5.21it/s] 44%|████▍     | 22/50 [00:08<00:05,  5.21it/s] 46%|████▌     | 23/50 [00:08<00:05,  5.23it/s] 48%|████▊     | 24/50 [00:08<00:04,  5.24it/s] 50%|█████     | 25/50 [00:09<00:04,  5.23it/s] 52%|█████▏    | 26/50 [00:09<00:04,  5.24it/s] 54%|█████▍    | 27/50 [00:09<00:04,  5.24it/s] 56%|█████▌    | 28/50 [00:09<00:04,  5.24it/s] 58%|█████▊    | 29/50 [00:09<00:04,  5.25it/s] 60%|██████    | 30/50 [00:10<00:03,  5.24it/s] 62%|██████▏   | 31/50 [00:10<00:03,  5.25it/s] 64%|██████▍   | 32/50 [00:10<00:03,  5.24it/s] 66%|██████▌   | 33/50 [00:10<00:03,  5.24it/s] 68%|██████▊   | 34/50 [00:10<00:03,  5.23it/s] 70%|███████   | 35/50 [00:11<00:02,  5.21it/s] 72%|███████▏  | 36/50 [00:11<00:02,  5.22it/s] 74%|███████▍  | 37/50 [00:11<00:02,  5.24it/s] 76%|███████▌  | 38/50 [00:11<00:02,  5.23it/s] 78%|███████▊  | 39/50 [00:11<00:02,  5.22it/s] 80%|████████  | 40/50 [00:12<00:01,  5.22it/s] 82%|████████▏ | 41/50 [00:12<00:01,  5.22it/s] 84%|████████▍ | 42/50 [00:12<00:01,  5.23it/s] 86%|████████▌ | 43/50 [00:12<00:01,  5.23it/s] 88%|████████▊ | 44/50 [00:12<00:01,  5.23it/s] 90%|█████████ | 45/50 [00:12<00:00,  5.24it/s] 92%|█████████▏| 46/50 [00:13<00:00,  5.24it/s] 94%|█████████▍| 47/50 [00:13<00:00,  5.24it/s] 96%|█████████▌| 48/50 [00:13<00:00,  5.23it/s] 98%|█████████▊| 49/50 [00:13<00:00,  5.23it/s]100%|██████████| 50/50 [00:18<00:00,  1.58s/it]100%|██████████| 50/50 [00:18<00:00,  2.69it/s]
