[I 2023-12-11 00:28:16,440] Trial 385 finished with value: 0.40952065019074474 and parameters: {'EMBEDDING_DIM': 1009, 'HIDDEN_DIM': 260, 'NUM_LAYERS': 1, 'DROPOUT': 0.04629135447977409, 'LR': 0.0018913357341834379, 'WEIGHT_0': 0.2297327208206566, 'WEIGHT_1': 0.645063618682006, 'WEIGHT_2': 0.4486567996866943, 'WEIGHT_3': 0.9530621907628042, 'WEIGHT_4': 0.7185837150016815, 'WEIGHT_5': 0.6640881966565262, 'WEIGHT_6': 0.9339773574355786, 'WEIGHT_7': 0.19559262575858605, 'WEIGHT_8': 0.8836947842280667, 'optimizer': 'RMSprop'}. Best is trial 365 with value: 0.41910947782240837.
/userhome/cs2/dingruiw/conda/envs/py310/lib/python3.10/site-packages/torch/nn/modules/rnn.py:82: UserWarning: dropout option adds dropout after all but last recurrent layer, so non-zero dropout expects num_layers greater than 1, but got dropout=0.05852159733069061 and num_layers=1
  warnings.warn("dropout option adds dropout after all but last "
{'EMBEDDING_DIM': 1009, 'HIDDEN_DIM': 260, 'NUM_LAYERS': 1, 'DROPOUT': 0.04629135447977409, 'LR': 0.0018913357341834379, 'WEIGHT_0': 0.2297327208206566, 'WEIGHT_1': 0.645063618682006, 'WEIGHT_2': 0.4486567996866943, 'WEIGHT_3': 0.9530621907628042, 'WEIGHT_4': 0.7185837150016815, 'WEIGHT_5': 0.6640881966565262, 'WEIGHT_6': 0.9339773574355786, 'WEIGHT_7': 0.19559262575858605, 'WEIGHT_8': 0.8836947842280667, 'optimizer': 'RMSprop'}
0
              precision    recall  f1-score   support

         LOC       0.42      0.23      0.30      1837
        MISC       0.04      0.01      0.02       922
         ORG       0.16      0.06      0.08      1341
         PER       0.06      0.03      0.04      1842

   micro avg       0.21      0.10      0.13      5942
   macro avg       0.17      0.08      0.11      5942
weighted avg       0.19      0.10      0.13      5942

{'EMBEDDING_DIM': 1009, 'HIDDEN_DIM': 260, 'NUM_LAYERS': 1, 'DROPOUT': 0.04629135447977409, 'LR': 0.0018913357341834379, 'WEIGHT_0': 0.2297327208206566, 'WEIGHT_1': 0.645063618682006, 'WEIGHT_2': 0.4486567996866943, 'WEIGHT_3': 0.9530621907628042, 'WEIGHT_4': 0.7185837150016815, 'WEIGHT_5': 0.6640881966565262, 'WEIGHT_6': 0.9339773574355786, 'WEIGHT_7': 0.19559262575858605, 'WEIGHT_8': 0.8836947842280667, 'optimizer': 'RMSprop'}
49
              precision    recall  f1-score   support

         LOC       0.56      0.53      0.55      1837
        MISC       0.46      0.43      0.45       922
         ORG       0.27      0.28      0.27      1341
         PER       0.33      0.39      0.36      1842

   micro avg       0.40      0.42      0.41      5942
   macro avg       0.41      0.41      0.41      5942
weighted avg       0.41      0.42      0.41      5942

epoch 49
LSTM
  0%|          | 0/50 [00:00<?, ?it/s]  2%|▏         | 1/50 [00:04<03:22,  4.12s/it]  4%|▍         | 2/50 [00:04<01:24,  1.76s/it]  6%|▌         | 3/50 [00:04<00:49,  1.05s/it]  8%|▊         | 4/50 [00:04<00:32,  1.42it/s] 10%|█         | 5/50 [00:04<00:23,  1.94it/s] 12%|█▏        | 6/50 [00:04<00:17,  2.49it/s] 14%|█▍        | 7/50 [00:05<00:14,  3.04it/s] 16%|█▌        | 8/50 [00:05<00:11,  3.54it/s] 18%|█▊        | 9/50 [00:05<00:10,  3.99it/s] 20%|██        | 10/50 [00:05<00:09,  4.37it/s] 22%|██▏       | 11/50 [00:05<00:08,  4.67it/s] 24%|██▍       | 12/50 [00:06<00:07,  4.90it/s] 26%|██▌       | 13/50 [00:06<00:07,  5.07it/s] 28%|██▊       | 14/50 [00:06<00:06,  5.20it/s] 30%|███       | 15/50 [00:06<00:06,  5.30it/s] 32%|███▏      | 16/50 [00:06<00:06,  5.37it/s] 34%|███▍      | 17/50 [00:06<00:06,  5.42it/s] 36%|███▌      | 18/50 [00:07<00:05,  5.46it/s] 38%|███▊      | 19/50 [00:07<00:05,  5.48it/s] 40%|████      | 20/50 [00:07<00:05,  5.50it/s] 42%|████▏     | 21/50 [00:07<00:05,  5.51it/s] 44%|████▍     | 22/50 [00:07<00:05,  5.52it/s] 46%|████▌     | 23/50 [00:08<00:04,  5.52it/s] 48%|████▊     | 24/50 [00:08<00:04,  5.52it/s] 50%|█████     | 25/50 [00:08<00:04,  5.53it/s] 52%|█████▏    | 26/50 [00:08<00:04,  5.53it/s] 54%|█████▍    | 27/50 [00:08<00:04,  5.53it/s] 56%|█████▌    | 28/50 [00:08<00:03,  5.53it/s] 58%|█████▊    | 29/50 [00:09<00:03,  5.53it/s] 60%|██████    | 30/50 [00:09<00:03,  5.53it/s] 62%|██████▏   | 31/50 [00:09<00:03,  5.53it/s] 64%|██████▍   | 32/50 [00:09<00:03,  5.53it/s] 66%|██████▌   | 33/50 [00:09<00:03,  5.53it/s] 68%|██████▊   | 34/50 [00:10<00:02,  5.53it/s] 70%|███████   | 35/50 [00:10<00:02,  5.53it/s] 72%|███████▏  | 36/50 [00:10<00:02,  5.53it/s] 74%|███████▍  | 37/50 [00:10<00:02,  5.53it/s] 76%|███████▌  | 38/50 [00:10<00:02,  5.53it/s] 78%|███████▊  | 39/50 [00:10<00:01,  5.53it/s] 80%|████████  | 40/50 [00:11<00:01,  5.53it/s] 82%|████████▏ | 41/50 [00:11<00:01,  5.53it/s] 84%|████████▍ | 42/50 [00:11<00:01,  5.53it/s] 86%|████████▌ | 43/50 [00:11<00:01,  5.53it/s] 88%|████████▊ | 44/50 [00:11<00:01,  5.53it/s] 90%|█████████ | 45/50 [00:12<00:00,  5.53it/s] 92%|█████████▏| 46/50 [00:12<00:00,  5.53it/s] 94%|█████████▍| 47/50 [00:12<00:00,  5.53it/s] 96%|█████████▌| 48/50 [00:12<00:00,  5.53it/s] 98%|█████████▊| 49/50 [00:12<00:00,  5.53it/s]100%|██████████| 50/50 [00:16<00:00,  1.38s/it]100%|██████████| 50/50 [00:16<00:00,  2.95it/s]
[I 2023-12-11 00:28:37,124] Trial 386 finished with value: 0.3928571428571429 and parameters: {'EMBEDDING_DIM': 977, 'HIDDEN_DIM': 155, 'NUM_LAYERS': 1, 'DROPOUT': 0.05852159733069061, 'LR': 0.0022011831175294634, 'WEIGHT_0': 0.2620113605298336, 'WEIGHT_1': 0.6169142810802102, 'WEIGHT_2': 0.5027956226068198, 'WEIGHT_3': 0.9221051286565783, 'WEIGHT_4': 0.7574325614820873, 'WEIGHT_5': 0.7151466799735283, 'WEIGHT_6': 0.6427877853395252, 'WEIGHT_7': 0.14211427525274856, 'WEIGHT_8': 0.9323541945805979, 'optimizer': 'RMSprop'}. Best is trial 365 with value: 0.41910947782240837.
/userhome/cs2/dingruiw/conda/envs/py310/lib/python3.10/site-packages/torch/nn/modules/rnn.py:82: UserWarning: dropout option adds dropout after all but last recurrent layer, so non-zero dropout expects num_layers greater than 1, but got dropout=0.035886235987004675 and num_layers=1
  warnings.warn("dropout option adds dropout after all but last "
{'EMBEDDING_DIM': 977, 'HIDDEN_DIM': 155, 'NUM_LAYERS': 1, 'DROPOUT': 0.05852159733069061, 'LR': 0.0022011831175294634, 'WEIGHT_0': 0.2620113605298336, 'WEIGHT_1': 0.6169142810802102, 'WEIGHT_2': 0.5027956226068198, 'WEIGHT_3': 0.9221051286565783, 'WEIGHT_4': 0.7574325614820873, 'WEIGHT_5': 0.7151466799735283, 'WEIGHT_6': 0.6427877853395252, 'WEIGHT_7': 0.14211427525274856, 'WEIGHT_8': 0.9323541945805979, 'optimizer': 'RMSprop'}
0
              precision    recall  f1-score   support

         LOC       0.37      0.27      0.31      1837
        MISC       0.09      0.02      0.03       922
         ORG       0.11      0.04      0.06      1341
         PER       0.07      0.05      0.06      1842

   micro avg       0.21      0.11      0.14      5942
   macro avg       0.16      0.09      0.12      5942
weighted avg       0.18      0.11      0.13      5942

{'EMBEDDING_DIM': 977, 'HIDDEN_DIM': 155, 'NUM_LAYERS': 1, 'DROPOUT': 0.05852159733069061, 'LR': 0.0022011831175294634, 'WEIGHT_0': 0.2620113605298336, 'WEIGHT_1': 0.6169142810802102, 'WEIGHT_2': 0.5027956226068198, 'WEIGHT_3': 0.9221051286565783, 'WEIGHT_4': 0.7574325614820873, 'WEIGHT_5': 0.7151466799735283, 'WEIGHT_6': 0.6427877853395252, 'WEIGHT_7': 0.14211427525274856, 'WEIGHT_8': 0.9323541945805979, 'optimizer': 'RMSprop'}
49
              precision    recall  f1-score   support

         LOC       0.48      0.55      0.51      1837
        MISC       0.46      0.44      0.45       922
         ORG       0.26      0.27      0.27      1341
         PER       0.31      0.35      0.33      1842

   micro avg       0.38      0.41      0.39      5942
   macro avg       0.38      0.40      0.39      5942
weighted avg       0.38      0.41      0.39      5942

epoch 49
LSTM
  0%|          | 0/50 [00:00<?, ?it/s]  2%|▏         | 1/50 [00:04<03:49,  4.69s/it]  6%|▌         | 3/50 [00:04<01:01,  1.30s/it]  8%|▊         | 4/50 [00:05<00:41,  1.11it/s] 10%|█         | 5/50 [00:05<00:29,  1.55it/s] 12%|█▏        | 6/50 [00:05<00:21,  2.07it/s] 14%|█▍        | 7/50 [00:05<00:16,  2.67it/s] 16%|█▌        | 8/50 [00:05<00:12,  3.31it/s] 18%|█▊        | 9/50 [00:05<00:10,  3.97it/s] 20%|██        | 10/50 [00:05<00:08,  4.60it/s] 22%|██▏       | 11/50 [00:06<00:07,  5.16it/s] 24%|██▍       | 12/50 [00:06<00:06,  5.64it/s] 26%|██▌       | 13/50 [00:06<00:06,  6.04it/s] 28%|██▊       | 14/50 [00:06<00:05,  6.34it/s] 30%|███       | 15/50 [00:06<00:05,  6.58it/s] 32%|███▏      | 16/50 [00:06<00:05,  6.76it/s] 34%|███▍      | 17/50 [00:06<00:04,  6.88it/s] 36%|███▌      | 18/50 [00:07<00:04,  6.96it/s] 38%|███▊      | 19/50 [00:07<00:04,  7.04it/s] 40%|████      | 20/50 [00:07<00:04,  7.09it/s] 42%|████▏     | 21/50 [00:07<00:04,  7.11it/s] 44%|████▍     | 22/50 [00:07<00:03,  7.14it/s] 46%|████▌     | 23/50 [00:07<00:03,  7.16it/s] 48%|████▊     | 24/50 [00:07<00:03,  7.16it/s] 50%|█████     | 25/50 [00:07<00:03,  7.17it/s] 52%|█████▏    | 26/50 [00:08<00:03,  7.18it/s] 54%|█████▍    | 27/50 [00:08<00:03,  7.18it/s] 56%|█████▌    | 28/50 [00:08<00:03,  7.18it/s] 58%|█████▊    | 29/50 [00:08<00:02,  7.19it/s] 60%|██████    | 30/50 [00:08<00:02,  7.19it/s] 62%|██████▏   | 31/50 [00:08<00:02,  7.19it/s] 64%|██████▍   | 32/50 [00:08<00:02,  7.19it/s] 66%|██████▌   | 33/50 [00:09<00:02,  7.20it/s] 68%|██████▊   | 34/50 [00:09<00:02,  7.18it/s] 70%|███████   | 35/50 [00:09<00:02,  7.18it/s] 72%|███████▏  | 36/50 [00:09<00:01,  7.19it/s] 74%|███████▍  | 37/50 [00:09<00:01,  7.18it/s] 76%|███████▌  | 38/50 [00:09<00:01,  7.18it/s] 78%|███████▊  | 39/50 [00:09<00:01,  7.19it/s] 80%|████████  | 40/50 [00:10<00:01,  7.18it/s] 82%|████████▏ | 41/50 [00:10<00:01,  7.18it/s] 84%|████████▍ | 42/50 [00:10<00:01,  7.18it/s] 86%|████████▌ | 43/50 [00:10<00:00,  7.19it/s] 88%|████████▊ | 44/50 [00:10<00:00,  7.18it/s] 90%|█████████ | 45/50 [00:10<00:00,  7.19it/s] 92%|█████████▏| 46/50 [00:10<00:00,  7.19it/s] 94%|█████████▍| 47/50 [00:11<00:00,  7.17it/s] 96%|█████████▌| 48/50 [00:11<00:00,  7.18it/s] 98%|█████████▊| 49/50 [00:11<00:00,  7.18it/s]100%|██████████| 50/50 [00:16<00:00,  1.53s/it]100%|██████████| 50/50 [00:16<00:00,  3.11it/s]
[I 2023-12-11 00:28:57,472] Trial 387 finished with value: 0.030151884492780796 and parameters: {'EMBEDDING_DIM': 1002, 'HIDDEN_DIM': 215, 'NUM_LAYERS': 1, 'DROPOUT': 0.035886235987004675, 'LR': 0.002581863702585736, 'WEIGHT_0': 0.23721469433437992, 'WEIGHT_1': 0.6368659618935064, 'WEIGHT_2': 0.4670479045793185, 'WEIGHT_3': 0.8765344540620716, 'WEIGHT_4': 0.7028627600395628, 'WEIGHT_5': 0.6890193468320579, 'WEIGHT_6': 0.6708034144342616, 'WEIGHT_7': 0.18979024504159653, 'WEIGHT_8': 0.9164721041756076, 'optimizer': 'SGD'}. Best is trial 365 with value: 0.41910947782240837.
/userhome/cs2/dingruiw/conda/envs/py310/lib/python3.10/site-packages/torch/nn/modules/rnn.py:82: UserWarning: dropout option adds dropout after all but last recurrent layer, so non-zero dropout expects num_layers greater than 1, but got dropout=0.06438531143519814 and num_layers=1
  warnings.warn("dropout option adds dropout after all but last "
{'EMBEDDING_DIM': 1002, 'HIDDEN_DIM': 215, 'NUM_LAYERS': 1, 'DROPOUT': 0.035886235987004675, 'LR': 0.002581863702585736, 'WEIGHT_0': 0.23721469433437992, 'WEIGHT_1': 0.6368659618935064, 'WEIGHT_2': 0.4670479045793185, 'WEIGHT_3': 0.8765344540620716, 'WEIGHT_4': 0.7028627600395628, 'WEIGHT_5': 0.6890193468320579, 'WEIGHT_6': 0.6708034144342616, 'WEIGHT_7': 0.18979024504159653, 'WEIGHT_8': 0.9164721041756076, 'optimizer': 'SGD'}
0
              precision    recall  f1-score   support

         LOC       0.04      0.12      0.06      1837
        MISC       0.01      0.08      0.02       922
         ORG       0.01      0.13      0.03      1341
         PER       0.01      0.04      0.02      1842

   micro avg       0.02      0.09      0.03      5942
   macro avg       0.02      0.09      0.03      5942
weighted avg       0.02      0.09      0.03      5942

{'EMBEDDING_DIM': 1002, 'HIDDEN_DIM': 215, 'NUM_LAYERS': 1, 'DROPOUT': 0.035886235987004675, 'LR': 0.002581863702585736, 'WEIGHT_0': 0.23721469433437992, 'WEIGHT_1': 0.6368659618935064, 'WEIGHT_2': 0.4670479045793185, 'WEIGHT_3': 0.8765344540620716, 'WEIGHT_4': 0.7028627600395628, 'WEIGHT_5': 0.6890193468320579, 'WEIGHT_6': 0.6708034144342616, 'WEIGHT_7': 0.18979024504159653, 'WEIGHT_8': 0.9164721041756076, 'optimizer': 'SGD'}
49
              precision    recall  f1-score   support

         LOC       0.04      0.09      0.06      1837
        MISC       0.01      0.07      0.02       922
         ORG       0.02      0.09      0.03      1341
         PER       0.01      0.03      0.02      1842

   micro avg       0.02      0.07      0.03      5942
   macro avg       0.02      0.07      0.03      5942
weighted avg       0.02      0.07      0.03      5942

epoch 49
LSTM
  0%|          | 0/50 [00:00<?, ?it/s]  2%|▏         | 1/50 [00:05<04:28,  5.49s/it]  4%|▍         | 2/50 [00:05<01:57,  2.45s/it]  6%|▌         | 3/50 [00:06<01:18,  1.66s/it]  8%|▊         | 4/50 [00:07<00:59,  1.29s/it] 10%|█         | 5/50 [00:07<00:49,  1.09s/it] 12%|█▏        | 6/50 [00:08<00:42,  1.03it/s] 14%|█▍        | 7/50 [00:09<00:38,  1.12it/s] 16%|█▌        | 8/50 [00:10<00:35,  1.19it/s] 18%|█▊        | 9/50 [00:10<00:32,  1.24it/s] 20%|██        | 10/50 [00:11<00:31,  1.28it/s] 22%|██▏       | 11/50 [00:12<00:29,  1.31it/s] 24%|██▍       | 12/50 [00:13<00:28,  1.33it/s] 26%|██▌       | 13/50 [00:13<00:27,  1.34it/s] 28%|██▊       | 14/50 [00:14<00:26,  1.35it/s] 30%|███       | 15/50 [00:15<00:25,  1.35it/s] 32%|███▏      | 16/50 [00:16<00:25,  1.36it/s] 34%|███▍      | 17/50 [00:16<00:24,  1.36it/s] 36%|███▌      | 18/50 [00:17<00:23,  1.36it/s] 38%|███▊      | 19/50 [00:18<00:22,  1.36it/s] 40%|████      | 20/50 [00:18<00:22,  1.36it/s] 42%|████▏     | 21/50 [00:19<00:21,  1.36it/s] 44%|████▍     | 22/50 [00:20<00:20,  1.36it/s] 46%|████▌     | 23/50 [00:21<00:19,  1.36it/s] 48%|████▊     | 24/50 [00:21<00:19,  1.36it/s] 50%|█████     | 25/50 [00:22<00:18,  1.36it/s] 52%|█████▏    | 26/50 [00:23<00:17,  1.36it/s] 54%|█████▍    | 27/50 [00:24<00:16,  1.36it/s] 56%|█████▌    | 28/50 [00:24<00:16,  1.36it/s] 58%|█████▊    | 29/50 [00:25<00:15,  1.36it/s] 60%|██████    | 30/50 [00:26<00:14,  1.36it/s] 62%|██████▏   | 31/50 [00:27<00:14,  1.35it/s] 64%|██████▍   | 32/50 [00:27<00:13,  1.36it/s] 66%|██████▌   | 33/50 [00:28<00:12,  1.35it/s] 68%|██████▊   | 34/50 [00:29<00:11,  1.35it/s] 70%|███████   | 35/50 [00:30<00:11,  1.35it/s] 72%|███████▏  | 36/50 [00:30<00:10,  1.35it/s] 74%|███████▍  | 37/50 [00:31<00:09,  1.35it/s] 76%|███████▌  | 38/50 [00:32<00:08,  1.35it/s] 78%|███████▊  | 39/50 [00:32<00:08,  1.35it/s] 80%|████████  | 40/50 [00:33<00:07,  1.35it/s] 82%|████████▏ | 41/50 [00:34<00:06,  1.35it/s] 84%|████████▍ | 42/50 [00:35<00:05,  1.35it/s] 86%|████████▌ | 43/50 [00:35<00:05,  1.35it/s] 88%|████████▊ | 44/50 [00:36<00:04,  1.35it/s] 90%|█████████ | 45/50 [00:37<00:03,  1.35it/s] 92%|█████████▏| 46/50 [00:38<00:02,  1.34it/s] 94%|█████████▍| 47/50 [00:38<00:02,  1.34it/s] 96%|█████████▌| 48/50 [00:39<00:01,  1.34it/s] 98%|█████████▊| 49/50 [00:40<00:00,  1.34it/s]100%|██████████| 50/50 [00:46<00:00,  2.27s/it]100%|██████████| 50/50 [00:46<00:00,  1.08it/s]
[I 2023-12-11 00:29:48,361] Trial 388 finished with value: 0.36994412476023686 and parameters: {'EMBEDDING_DIM': 947, 'HIDDEN_DIM': 936, 'NUM_LAYERS': 1, 'DROPOUT': 0.06438531143519814, 'LR': 0.0019937265758338814, 'WEIGHT_0': 0.2688567493910091, 'WEIGHT_1': 0.6672799404570389, 'WEIGHT_2': 0.38300771019761104, 'WEIGHT_3': 0.45873351120998573, 'WEIGHT_4': 0.7526655137106293, 'WEIGHT_5': 0.725005229580337, 'WEIGHT_6': 0.6127281576284489, 'WEIGHT_7': 0.2130428468485167, 'WEIGHT_8': 0.834737208868258, 'optimizer': 'RMSprop'}. Best is trial 365 with value: 0.41910947782240837.
/userhome/cs2/dingruiw/conda/envs/py310/lib/python3.10/site-packages/torch/nn/modules/rnn.py:82: UserWarning: dropout option adds dropout after all but last recurrent layer, so non-zero dropout expects num_layers greater than 1, but got dropout=0.052467791801162775 and num_layers=1
  warnings.warn("dropout option adds dropout after all but last "
{'EMBEDDING_DIM': 947, 'HIDDEN_DIM': 936, 'NUM_LAYERS': 1, 'DROPOUT': 0.06438531143519814, 'LR': 0.0019937265758338814, 'WEIGHT_0': 0.2688567493910091, 'WEIGHT_1': 0.6672799404570389, 'WEIGHT_2': 0.38300771019761104, 'WEIGHT_3': 0.45873351120998573, 'WEIGHT_4': 0.7526655137106293, 'WEIGHT_5': 0.725005229580337, 'WEIGHT_6': 0.6127281576284489, 'WEIGHT_7': 0.2130428468485167, 'WEIGHT_8': 0.834737208868258, 'optimizer': 'RMSprop'}
0
              precision    recall  f1-score   support

         LOC       0.17      0.06      0.09      1837
        MISC       0.03      0.03      0.03       922
         ORG       0.07      0.02      0.03      1341
         PER       0.04      0.01      0.02      1842

   micro avg       0.08      0.03      0.04      5942
   macro avg       0.08      0.03      0.04      5942
weighted avg       0.09      0.03      0.04      5942

{'EMBEDDING_DIM': 947, 'HIDDEN_DIM': 936, 'NUM_LAYERS': 1, 'DROPOUT': 0.06438531143519814, 'LR': 0.0019937265758338814, 'WEIGHT_0': 0.2688567493910091, 'WEIGHT_1': 0.6672799404570389, 'WEIGHT_2': 0.38300771019761104, 'WEIGHT_3': 0.45873351120998573, 'WEIGHT_4': 0.7526655137106293, 'WEIGHT_5': 0.725005229580337, 'WEIGHT_6': 0.6127281576284489, 'WEIGHT_7': 0.2130428468485167, 'WEIGHT_8': 0.834737208868258, 'optimizer': 'RMSprop'}
49
              precision    recall  f1-score   support

         LOC       0.53      0.51      0.52      1837
        MISC       0.42      0.41      0.42       922
         ORG       0.28      0.24      0.26      1341
         PER       0.26      0.32      0.29      1842

   micro avg       0.37      0.37      0.37      5942
   macro avg       0.37      0.37      0.37      5942
weighted avg       0.37      0.37      0.37      5942

epoch 49
LSTM
  0%|          | 0/50 [00:00<?, ?it/s]  2%|▏         | 1/50 [00:03<03:08,  3.85s/it] 12%|█▏        | 6/50 [00:04<00:22,  2.00it/s] 16%|█▌        | 8/50 [00:04<00:14,  2.81it/s] 20%|██        | 10/50 [00:04<00:10,  3.80it/s] 24%|██▍       | 12/50 [00:04<00:07,  4.96it/s] 28%|██▊       | 14/50 [00:04<00:05,  6.25it/s] 32%|███▏      | 16/50 [00:04<00:04,  7.59it/s] 36%|███▌      | 18/50 [00:04<00:03,  8.90it/s] 40%|████      | 20/50 [00:04<00:02, 10.11it/s] 44%|████▍     | 22/50 [00:05<00:02, 11.15it/s] 48%|████▊     | 24/50 [00:05<00:02, 12.02it/s] 52%|█████▏    | 26/50 [00:05<00:01, 12.71it/s] 56%|█████▌    | 28/50 [00:05<00:01, 13.24it/s] 60%|██████    | 30/50 [00:05<00:01, 13.63it/s] 64%|██████▍   | 32/50 [00:05<00:01, 13.92it/s] 68%|██████▊   | 34/50 [00:05<00:01, 14.12it/s] 72%|███████▏  | 36/50 [00:06<00:00, 14.27it/s] 76%|███████▌  | 38/50 [00:06<00:00, 14.38it/s] 80%|████████  | 40/50 [00:06<00:00, 14.46it/s] 84%|████████▍ | 42/50 [00:06<00:00, 14.51it/s] 88%|████████▊ | 44/50 [00:06<00:00, 14.54it/s] 92%|█████████▏| 46/50 [00:06<00:00, 14.59it/s] 96%|█████████▌| 48/50 [00:06<00:00, 14.59it/s]100%|██████████| 50/50 [00:11<00:00,  1.48it/s]100%|██████████| 50/50 [00:11<00:00,  4.53it/s]
