[I 2023-12-10 22:55:50,858] Trial 189 finished with value: 0.02520010005002501 and parameters: {'EMBEDDING_DIM': 872, 'HIDDEN_DIM': 242, 'NUM_LAYERS': 1, 'DROPOUT': 0.3304913495894606, 'LR': 0.0015316490102905535, 'WEIGHT_0': 0.38758400143961874, 'WEIGHT_1': 0.7754171868915127, 'WEIGHT_2': 0.5909954180425464, 'WEIGHT_3': 0.8460036749765583, 'WEIGHT_4': 0.6761856793186581, 'WEIGHT_5': 0.4641175916877803, 'WEIGHT_6': 0.7078721402807333, 'WEIGHT_7': 0.3026171402672413, 'WEIGHT_8': 0.6715581028631743, 'optimizer': 'SGD'}. Best is trial 134 with value: 0.4158467115484205.
/userhome/cs2/dingruiw/conda/envs/py310/lib/python3.10/site-packages/torch/nn/modules/rnn.py:82: UserWarning: dropout option adds dropout after all but last recurrent layer, so non-zero dropout expects num_layers greater than 1, but got dropout=0.30310158011784544 and num_layers=1
  warnings.warn("dropout option adds dropout after all but last "
{'EMBEDDING_DIM': 872, 'HIDDEN_DIM': 242, 'NUM_LAYERS': 1, 'DROPOUT': 0.3304913495894606, 'LR': 0.0015316490102905535, 'WEIGHT_0': 0.38758400143961874, 'WEIGHT_1': 0.7754171868915127, 'WEIGHT_2': 0.5909954180425464, 'WEIGHT_3': 0.8460036749765583, 'WEIGHT_4': 0.6761856793186581, 'WEIGHT_5': 0.4641175916877803, 'WEIGHT_6': 0.7078721402807333, 'WEIGHT_7': 0.3026171402672413, 'WEIGHT_8': 0.6715581028631743, 'optimizer': 'SGD'}
0
              precision    recall  f1-score   support

         LOC       0.03      0.12      0.04      1837
        MISC       0.01      0.12      0.02       922
         ORG       0.02      0.16      0.03      1341
         PER       0.01      0.04      0.02      1842

   micro avg       0.02      0.10      0.03      5942
   macro avg       0.02      0.11      0.03      5942
weighted avg       0.02      0.10      0.03      5942

{'EMBEDDING_DIM': 872, 'HIDDEN_DIM': 242, 'NUM_LAYERS': 1, 'DROPOUT': 0.3304913495894606, 'LR': 0.0015316490102905535, 'WEIGHT_0': 0.38758400143961874, 'WEIGHT_1': 0.7754171868915127, 'WEIGHT_2': 0.5909954180425464, 'WEIGHT_3': 0.8460036749765583, 'WEIGHT_4': 0.6761856793186581, 'WEIGHT_5': 0.4641175916877803, 'WEIGHT_6': 0.7078721402807333, 'WEIGHT_7': 0.3026171402672413, 'WEIGHT_8': 0.6715581028631743, 'optimizer': 'SGD'}
49
              precision    recall  f1-score   support

         LOC       0.02      0.08      0.04      1837
        MISC       0.01      0.08      0.02       922
         ORG       0.02      0.11      0.03      1341
         PER       0.01      0.03      0.01      1842

   micro avg       0.02      0.07      0.03      5942
   macro avg       0.02      0.07      0.02      5942
weighted avg       0.02      0.07      0.02      5942

epoch 49
LSTM
  0%|          | 0/50 [00:00<?, ?it/s]  2%|▏         | 1/50 [00:04<03:19,  4.07s/it]  6%|▌         | 3/50 [00:04<00:54,  1.16s/it]  8%|▊         | 4/50 [00:04<00:37,  1.22it/s] 10%|█         | 5/50 [00:04<00:26,  1.68it/s] 12%|█▏        | 6/50 [00:04<00:20,  2.18it/s] 14%|█▍        | 7/50 [00:05<00:15,  2.73it/s] 16%|█▌        | 8/50 [00:05<00:12,  3.30it/s] 18%|█▊        | 9/50 [00:05<00:10,  3.83it/s] 20%|██        | 10/50 [00:05<00:09,  4.31it/s] 22%|██▏       | 11/50 [00:05<00:08,  4.72it/s] 24%|██▍       | 12/50 [00:05<00:07,  5.05it/s] 26%|██▌       | 13/50 [00:05<00:06,  5.32it/s] 28%|██▊       | 14/50 [00:06<00:06,  5.52it/s] 30%|███       | 15/50 [00:06<00:06,  5.68it/s] 32%|███▏      | 16/50 [00:06<00:05,  5.78it/s] 34%|███▍      | 17/50 [00:06<00:05,  5.87it/s] 36%|███▌      | 18/50 [00:06<00:05,  5.94it/s] 38%|███▊      | 19/50 [00:06<00:05,  5.99it/s] 40%|████      | 20/50 [00:07<00:05,  6.00it/s] 42%|████▏     | 21/50 [00:07<00:04,  6.04it/s] 44%|████▍     | 22/50 [00:07<00:04,  6.04it/s] 46%|████▌     | 23/50 [00:07<00:04,  6.07it/s] 48%|████▊     | 24/50 [00:07<00:04,  6.07it/s] 50%|█████     | 25/50 [00:07<00:04,  6.07it/s] 52%|█████▏    | 26/50 [00:08<00:03,  6.06it/s] 54%|█████▍    | 27/50 [00:08<00:03,  6.06it/s] 56%|█████▌    | 28/50 [00:08<00:03,  6.05it/s] 58%|█████▊    | 29/50 [00:08<00:03,  6.08it/s] 60%|██████    | 30/50 [00:08<00:03,  6.06it/s] 62%|██████▏   | 31/50 [00:08<00:03,  6.06it/s] 64%|██████▍   | 32/50 [00:09<00:02,  6.07it/s] 66%|██████▌   | 33/50 [00:09<00:02,  6.05it/s] 68%|██████▊   | 34/50 [00:09<00:02,  6.04it/s] 70%|███████   | 35/50 [00:09<00:02,  6.04it/s] 72%|███████▏  | 36/50 [00:09<00:02,  6.04it/s] 74%|███████▍  | 37/50 [00:09<00:02,  6.04it/s] 76%|███████▌  | 38/50 [00:10<00:01,  6.05it/s] 78%|███████▊  | 39/50 [00:10<00:01,  6.05it/s] 80%|████████  | 40/50 [00:10<00:01,  6.05it/s] 82%|████████▏ | 41/50 [00:10<00:01,  6.06it/s] 84%|████████▍ | 42/50 [00:10<00:01,  6.07it/s] 86%|████████▌ | 43/50 [00:10<00:01,  6.06it/s] 88%|████████▊ | 44/50 [00:11<00:00,  6.07it/s] 90%|█████████ | 45/50 [00:11<00:00,  6.05it/s] 92%|█████████▏| 46/50 [00:11<00:00,  6.05it/s] 94%|█████████▍| 47/50 [00:11<00:00,  6.06it/s] 96%|█████████▌| 48/50 [00:11<00:00,  6.05it/s] 98%|█████████▊| 49/50 [00:11<00:00,  6.05it/s]100%|██████████| 50/50 [00:16<00:00,  1.38s/it]100%|██████████| 50/50 [00:16<00:00,  3.10it/s]
[I 2023-12-10 22:56:10,652] Trial 190 finished with value: 0.393628376714016 and parameters: {'EMBEDDING_DIM': 944, 'HIDDEN_DIM': 139, 'NUM_LAYERS': 1, 'DROPOUT': 0.30310158011784544, 'LR': 0.002507633720559192, 'WEIGHT_0': 0.3439474199959277, 'WEIGHT_1': 0.5496990372735199, 'WEIGHT_2': 0.614547510768154, 'WEIGHT_3': 0.6957778707867486, 'WEIGHT_4': 0.6937292021551755, 'WEIGHT_5': 0.6637267607678795, 'WEIGHT_6': 0.6852038303441095, 'WEIGHT_7': 0.2425375739911967, 'WEIGHT_8': 0.418747823330424, 'optimizer': 'RMSprop'}. Best is trial 134 with value: 0.4158467115484205.
/userhome/cs2/dingruiw/conda/envs/py310/lib/python3.10/site-packages/torch/nn/modules/rnn.py:82: UserWarning: dropout option adds dropout after all but last recurrent layer, so non-zero dropout expects num_layers greater than 1, but got dropout=0.32283918949924234 and num_layers=1
  warnings.warn("dropout option adds dropout after all but last "
{'EMBEDDING_DIM': 944, 'HIDDEN_DIM': 139, 'NUM_LAYERS': 1, 'DROPOUT': 0.30310158011784544, 'LR': 0.002507633720559192, 'WEIGHT_0': 0.3439474199959277, 'WEIGHT_1': 0.5496990372735199, 'WEIGHT_2': 0.614547510768154, 'WEIGHT_3': 0.6957778707867486, 'WEIGHT_4': 0.6937292021551755, 'WEIGHT_5': 0.6637267607678795, 'WEIGHT_6': 0.6852038303441095, 'WEIGHT_7': 0.2425375739911967, 'WEIGHT_8': 0.418747823330424, 'optimizer': 'RMSprop'}
0
              precision    recall  f1-score   support

         LOC       0.28      0.15      0.20      1837
        MISC       0.08      0.03      0.04       922
         ORG       0.14      0.05      0.08      1341
         PER       0.11      0.03      0.05      1842

   micro avg       0.19      0.07      0.10      5942
   macro avg       0.15      0.07      0.09      5942
weighted avg       0.17      0.07      0.10      5942

{'EMBEDDING_DIM': 944, 'HIDDEN_DIM': 139, 'NUM_LAYERS': 1, 'DROPOUT': 0.30310158011784544, 'LR': 0.002507633720559192, 'WEIGHT_0': 0.3439474199959277, 'WEIGHT_1': 0.5496990372735199, 'WEIGHT_2': 0.614547510768154, 'WEIGHT_3': 0.6957778707867486, 'WEIGHT_4': 0.6937292021551755, 'WEIGHT_5': 0.6637267607678795, 'WEIGHT_6': 0.6852038303441095, 'WEIGHT_7': 0.2425375739911967, 'WEIGHT_8': 0.418747823330424, 'optimizer': 'RMSprop'}
49
              precision    recall  f1-score   support

         LOC       0.50      0.55      0.52      1837
        MISC       0.42      0.46      0.44       922
         ORG       0.25      0.26      0.26      1341
         PER       0.33      0.34      0.33      1842

   micro avg       0.38      0.40      0.39      5942
   macro avg       0.38      0.40      0.39      5942
weighted avg       0.38      0.40      0.39      5942

epoch 49
LSTM
  0%|          | 0/50 [00:00<?, ?it/s]  2%|▏         | 1/50 [00:04<03:46,  4.61s/it]  6%|▌         | 3/50 [00:04<00:59,  1.28s/it]  8%|▊         | 4/50 [00:05<00:41,  1.12it/s] 10%|█         | 5/50 [00:05<00:29,  1.52it/s] 12%|█▏        | 6/50 [00:05<00:22,  1.99it/s] 14%|█▍        | 7/50 [00:05<00:17,  2.51it/s] 16%|█▌        | 8/50 [00:05<00:13,  3.04it/s] 18%|█▊        | 9/50 [00:05<00:11,  3.55it/s] 20%|██        | 10/50 [00:06<00:09,  4.02it/s] 22%|██▏       | 11/50 [00:06<00:08,  4.41it/s] 24%|██▍       | 12/50 [00:06<00:07,  4.75it/s] 26%|██▌       | 13/50 [00:06<00:07,  5.01it/s] 28%|██▊       | 14/50 [00:06<00:06,  5.21it/s] 30%|███       | 15/50 [00:06<00:06,  5.35it/s] 32%|███▏      | 16/50 [00:07<00:06,  5.46it/s] 34%|███▍      | 17/50 [00:07<00:05,  5.55it/s] 36%|███▌      | 18/50 [00:07<00:05,  5.60it/s] 38%|███▊      | 19/50 [00:07<00:05,  5.64it/s] 40%|████      | 20/50 [00:07<00:05,  5.67it/s] 42%|████▏     | 21/50 [00:07<00:05,  5.68it/s] 44%|████▍     | 22/50 [00:08<00:04,  5.70it/s] 46%|████▌     | 23/50 [00:08<00:04,  5.71it/s] 48%|████▊     | 24/50 [00:08<00:04,  5.72it/s] 50%|█████     | 25/50 [00:08<00:04,  5.72it/s] 52%|█████▏    | 26/50 [00:08<00:04,  5.72it/s] 54%|█████▍    | 27/50 [00:09<00:04,  5.73it/s] 56%|█████▌    | 28/50 [00:09<00:03,  5.72it/s] 58%|█████▊    | 29/50 [00:09<00:03,  5.73it/s] 60%|██████    | 30/50 [00:09<00:03,  5.73it/s] 62%|██████▏   | 31/50 [00:09<00:03,  5.73it/s] 64%|██████▍   | 32/50 [00:09<00:03,  5.73it/s] 66%|██████▌   | 33/50 [00:10<00:02,  5.72it/s] 68%|██████▊   | 34/50 [00:10<00:02,  5.73it/s] 70%|███████   | 35/50 [00:10<00:02,  5.73it/s] 72%|███████▏  | 36/50 [00:10<00:02,  5.73it/s] 74%|███████▍  | 37/50 [00:10<00:02,  5.72it/s] 76%|███████▌  | 38/50 [00:10<00:02,  5.72it/s] 78%|███████▊  | 39/50 [00:11<00:01,  5.72it/s] 80%|████████  | 40/50 [00:11<00:01,  5.71it/s] 82%|████████▏ | 41/50 [00:11<00:01,  5.71it/s] 84%|████████▍ | 42/50 [00:11<00:01,  5.72it/s] 86%|████████▌ | 43/50 [00:11<00:01,  5.72it/s] 88%|████████▊ | 44/50 [00:11<00:01,  5.72it/s] 90%|█████████ | 45/50 [00:12<00:00,  5.72it/s] 92%|█████████▏| 46/50 [00:12<00:00,  5.71it/s] 94%|█████████▍| 47/50 [00:12<00:00,  5.72it/s] 96%|█████████▌| 48/50 [00:12<00:00,  5.71it/s] 98%|█████████▊| 49/50 [00:12<00:00,  5.71it/s]100%|██████████| 50/50 [00:17<00:00,  1.54s/it]100%|██████████| 50/50 [00:17<00:00,  2.84it/s]
[I 2023-12-10 22:56:32,481] Trial 191 finished with value: 0.3895062244130671 and parameters: {'EMBEDDING_DIM': 925, 'HIDDEN_DIM': 257, 'NUM_LAYERS': 1, 'DROPOUT': 0.32283918949924234, 'LR': 0.0027907982236003055, 'WEIGHT_0': 0.4313534611473444, 'WEIGHT_1': 0.8409625045910406, 'WEIGHT_2': 0.6648865679968188, 'WEIGHT_3': 0.6184413816027095, 'WEIGHT_4': 0.660528102385426, 'WEIGHT_5': 0.48799136911203644, 'WEIGHT_6': 0.8122227351437563, 'WEIGHT_7': 0.40980322371386846, 'WEIGHT_8': 0.4480320665228012, 'optimizer': 'RMSprop'}. Best is trial 134 with value: 0.4158467115484205.
/userhome/cs2/dingruiw/conda/envs/py310/lib/python3.10/site-packages/torch/nn/modules/rnn.py:82: UserWarning: dropout option adds dropout after all but last recurrent layer, so non-zero dropout expects num_layers greater than 1, but got dropout=0.3424788667859915 and num_layers=1
  warnings.warn("dropout option adds dropout after all but last "
{'EMBEDDING_DIM': 925, 'HIDDEN_DIM': 257, 'NUM_LAYERS': 1, 'DROPOUT': 0.32283918949924234, 'LR': 0.0027907982236003055, 'WEIGHT_0': 0.4313534611473444, 'WEIGHT_1': 0.8409625045910406, 'WEIGHT_2': 0.6648865679968188, 'WEIGHT_3': 0.6184413816027095, 'WEIGHT_4': 0.660528102385426, 'WEIGHT_5': 0.48799136911203644, 'WEIGHT_6': 0.8122227351437563, 'WEIGHT_7': 0.40980322371386846, 'WEIGHT_8': 0.4480320665228012, 'optimizer': 'RMSprop'}
0
              precision    recall  f1-score   support

         LOC       0.21      0.06      0.09      1837
        MISC       0.04      0.01      0.02       922
         ORG       0.18      0.05      0.08      1341
         PER       0.10      0.01      0.02      1842

   micro avg       0.15      0.03      0.05      5942
   macro avg       0.13      0.03      0.05      5942
weighted avg       0.14      0.03      0.05      5942

{'EMBEDDING_DIM': 925, 'HIDDEN_DIM': 257, 'NUM_LAYERS': 1, 'DROPOUT': 0.32283918949924234, 'LR': 0.0027907982236003055, 'WEIGHT_0': 0.4313534611473444, 'WEIGHT_1': 0.8409625045910406, 'WEIGHT_2': 0.6648865679968188, 'WEIGHT_3': 0.6184413816027095, 'WEIGHT_4': 0.660528102385426, 'WEIGHT_5': 0.48799136911203644, 'WEIGHT_6': 0.8122227351437563, 'WEIGHT_7': 0.40980322371386846, 'WEIGHT_8': 0.4480320665228012, 'optimizer': 'RMSprop'}
49
              precision    recall  f1-score   support

         LOC       0.55      0.51      0.53      1837
        MISC       0.41      0.45      0.43       922
         ORG       0.29      0.27      0.28      1341
         PER       0.30      0.33      0.32      1842

   micro avg       0.39      0.39      0.39      5942
   macro avg       0.39      0.39      0.39      5942
weighted avg       0.39      0.39      0.39      5942

epoch 49
LSTM
  0%|          | 0/50 [00:00<?, ?it/s]  2%|▏         | 1/50 [00:04<03:47,  4.64s/it]  4%|▍         | 2/50 [00:04<01:34,  1.97s/it]  6%|▌         | 3/50 [00:04<00:54,  1.16s/it]  8%|▊         | 4/50 [00:05<00:35,  1.29it/s] 10%|█         | 5/50 [00:05<00:25,  1.77it/s] 12%|█▏        | 6/50 [00:05<00:19,  2.29it/s] 14%|█▍        | 7/50 [00:05<00:15,  2.81it/s] 16%|█▌        | 8/50 [00:05<00:12,  3.29it/s] 18%|█▊        | 9/50 [00:06<00:10,  3.73it/s] 20%|██        | 10/50 [00:06<00:09,  4.10it/s] 22%|██▏       | 11/50 [00:06<00:08,  4.39it/s] 24%|██▍       | 12/50 [00:06<00:08,  4.61it/s] 26%|██▌       | 13/50 [00:06<00:07,  4.79it/s] 28%|██▊       | 14/50 [00:07<00:07,  4.92it/s] 30%|███       | 15/50 [00:07<00:06,  5.03it/s] 32%|███▏      | 16/50 [00:07<00:06,  5.09it/s] 34%|███▍      | 17/50 [00:07<00:06,  5.12it/s] 36%|███▌      | 18/50 [00:07<00:06,  5.18it/s] 38%|███▊      | 19/50 [00:07<00:05,  5.22it/s] 40%|████      | 20/50 [00:08<00:05,  5.21it/s] 42%|████▏     | 21/50 [00:08<00:05,  5.22it/s] 44%|████▍     | 22/50 [00:08<00:05,  5.24it/s] 46%|████▌     | 23/50 [00:08<00:05,  5.22it/s] 48%|████▊     | 24/50 [00:08<00:04,  5.22it/s] 50%|█████     | 25/50 [00:09<00:04,  5.23it/s] 52%|█████▏    | 26/50 [00:09<00:04,  5.24it/s] 54%|█████▍    | 27/50 [00:09<00:04,  5.24it/s] 56%|█████▌    | 28/50 [00:09<00:04,  5.25it/s] 58%|█████▊    | 29/50 [00:09<00:03,  5.25it/s] 60%|██████    | 30/50 [00:10<00:03,  5.26it/s] 62%|██████▏   | 31/50 [00:10<00:03,  5.28it/s] 64%|██████▍   | 32/50 [00:10<00:03,  5.26it/s] 66%|██████▌   | 33/50 [00:10<00:03,  5.24it/s] 68%|██████▊   | 34/50 [00:10<00:03,  5.23it/s] 70%|███████   | 35/50 [00:11<00:02,  5.26it/s] 72%|███████▏  | 36/50 [00:11<00:02,  5.24it/s] 74%|███████▍  | 37/50 [00:11<00:02,  5.25it/s] 76%|███████▌  | 38/50 [00:11<00:02,  5.25it/s] 78%|███████▊  | 39/50 [00:11<00:02,  5.25it/s] 80%|████████  | 40/50 [00:11<00:01,  5.24it/s] 82%|████████▏ | 41/50 [00:12<00:01,  5.23it/s] 84%|████████▍ | 42/50 [00:12<00:01,  5.22it/s] 86%|████████▌ | 43/50 [00:12<00:01,  5.23it/s] 88%|████████▊ | 44/50 [00:12<00:01,  5.23it/s] 90%|█████████ | 45/50 [00:12<00:00,  5.23it/s] 92%|█████████▏| 46/50 [00:13<00:00,  5.21it/s] 94%|█████████▍| 47/50 [00:13<00:00,  5.22it/s] 96%|█████████▌| 48/50 [00:13<00:00,  5.24it/s] 98%|█████████▊| 49/50 [00:13<00:00,  5.23it/s]100%|██████████| 50/50 [00:18<00:00,  1.62s/it]100%|██████████| 50/50 [00:18<00:00,  2.68it/s]
[I 2023-12-10 22:56:55,384] Trial 192 finished with value: 0.39366930445647647 and parameters: {'EMBEDDING_DIM': 915, 'HIDDEN_DIM': 285, 'NUM_LAYERS': 1, 'DROPOUT': 0.3424788667859915, 'LR': 0.003069013360198227, 'WEIGHT_0': 0.5078489260370724, 'WEIGHT_1': 0.8896002427420516, 'WEIGHT_2': 0.6849632036661661, 'WEIGHT_3': 0.8830062638593771, 'WEIGHT_4': 0.9378820861646837, 'WEIGHT_5': 0.5120869050939462, 'WEIGHT_6': 0.7727567901201495, 'WEIGHT_7': 0.4302727232065289, 'WEIGHT_8': 0.4992607263313582, 'optimizer': 'RMSprop'}. Best is trial 134 with value: 0.4158467115484205.
/userhome/cs2/dingruiw/conda/envs/py310/lib/python3.10/site-packages/torch/nn/modules/rnn.py:82: UserWarning: dropout option adds dropout after all but last recurrent layer, so non-zero dropout expects num_layers greater than 1, but got dropout=0.31463103206888676 and num_layers=1
  warnings.warn("dropout option adds dropout after all but last "
{'EMBEDDING_DIM': 915, 'HIDDEN_DIM': 285, 'NUM_LAYERS': 1, 'DROPOUT': 0.3424788667859915, 'LR': 0.003069013360198227, 'WEIGHT_0': 0.5078489260370724, 'WEIGHT_1': 0.8896002427420516, 'WEIGHT_2': 0.6849632036661661, 'WEIGHT_3': 0.8830062638593771, 'WEIGHT_4': 0.9378820861646837, 'WEIGHT_5': 0.5120869050939462, 'WEIGHT_6': 0.7727567901201495, 'WEIGHT_7': 0.4302727232065289, 'WEIGHT_8': 0.4992607263313582, 'optimizer': 'RMSprop'}
0
              precision    recall  f1-score   support

         LOC       0.28      0.06      0.09      1837
        MISC       0.11      0.01      0.02       922
         ORG       0.21      0.02      0.03      1341
         PER       0.05      0.01      0.02      1842

   micro avg       0.17      0.03      0.04      5942
   macro avg       0.16      0.02      0.04      5942
weighted avg       0.17      0.03      0.04      5942

{'EMBEDDING_DIM': 915, 'HIDDEN_DIM': 285, 'NUM_LAYERS': 1, 'DROPOUT': 0.3424788667859915, 'LR': 0.003069013360198227, 'WEIGHT_0': 0.5078489260370724, 'WEIGHT_1': 0.8896002427420516, 'WEIGHT_2': 0.6849632036661661, 'WEIGHT_3': 0.8830062638593771, 'WEIGHT_4': 0.9378820861646837, 'WEIGHT_5': 0.5120869050939462, 'WEIGHT_6': 0.7727567901201495, 'WEIGHT_7': 0.4302727232065289, 'WEIGHT_8': 0.4992607263313582, 'optimizer': 'RMSprop'}
49
              precision    recall  f1-score   support

         LOC       0.56      0.53      0.55      1837
        MISC       0.40      0.43      0.41       922
         ORG       0.27      0.26      0.26      1341
         PER       0.32      0.35      0.33      1842

   micro avg       0.39      0.40      0.39      5942
   macro avg       0.39      0.39      0.39      5942
weighted avg       0.39      0.40      0.40      5942

epoch 49
LSTM
  0%|          | 0/50 [00:00<?, ?it/s]  2%|▏         | 1/50 [00:04<03:48,  4.65s/it]  6%|▌         | 3/50 [00:04<01:00,  1.29s/it]  8%|▊         | 4/50 [00:05<00:41,  1.11it/s] 10%|█         | 5/50 [00:05<00:29,  1.54it/s] 12%|█▏        | 6/50 [00:05<00:21,  2.05it/s] 14%|█▍        | 7/50 [00:05<00:16,  2.62it/s] 16%|█▌        | 8/50 [00:05<00:12,  3.24it/s] 18%|█▊        | 9/50 [00:05<00:10,  3.85it/s] 20%|██        | 10/50 [00:05<00:09,  4.43it/s] 22%|██▏       | 11/50 [00:06<00:07,  4.95it/s] 24%|██▍       | 12/50 [00:06<00:07,  5.38it/s] 26%|██▌       | 13/50 [00:06<00:06,  5.74it/s] 28%|██▊       | 14/50 [00:06<00:05,  6.01it/s] 30%|███       | 15/50 [00:06<00:05,  6.21it/s] 32%|███▏      | 16/50 [00:06<00:05,  6.37it/s] 34%|███▍      | 17/50 [00:06<00:05,  6.48it/s] 36%|███▌      | 18/50 [00:07<00:04,  6.56it/s] 38%|███▊      | 19/50 [00:07<00:04,  6.61it/s] 40%|████      | 20/50 [00:07<00:04,  6.66it/s] 42%|████▏     | 21/50 [00:07<00:04,  6.68it/s] 44%|████▍     | 22/50 [00:07<00:04,  6.70it/s] 46%|████▌     | 23/50 [00:07<00:04,  6.73it/s] 48%|████▊     | 24/50 [00:07<00:03,  6.73it/s] 50%|█████     | 25/50 [00:08<00:03,  6.74it/s] 52%|█████▏    | 26/50 [00:08<00:03,  6.75it/s] 54%|█████▍    | 27/50 [00:08<00:03,  6.74it/s] 56%|█████▌    | 28/50 [00:08<00:03,  6.74it/s] 58%|█████▊    | 29/50 [00:08<00:03,  6.75it/s] 60%|██████    | 30/50 [00:08<00:02,  6.74it/s] 62%|██████▏   | 31/50 [00:09<00:02,  6.74it/s] 64%|██████▍   | 32/50 [00:09<00:02,  6.75it/s] 66%|██████▌   | 33/50 [00:09<00:02,  6.74it/s] 68%|██████▊   | 34/50 [00:09<00:02,  6.74it/s] 70%|███████   | 35/50 [00:09<00:02,  6.76it/s] 72%|███████▏  | 36/50 [00:09<00:02,  6.74it/s] 74%|███████▍  | 37/50 [00:09<00:01,  6.75it/s] 76%|███████▌  | 38/50 [00:10<00:01,  6.76it/s] 78%|███████▊  | 39/50 [00:10<00:01,  6.74it/s] 80%|████████  | 40/50 [00:10<00:01,  6.75it/s] 82%|████████▏ | 41/50 [00:10<00:01,  6.75it/s] 84%|████████▍ | 42/50 [00:10<00:01,  6.74it/s] 86%|████████▌ | 43/50 [00:10<00:01,  6.74it/s] 88%|████████▊ | 44/50 [00:10<00:00,  6.75it/s] 90%|█████████ | 45/50 [00:11<00:00,  6.74it/s] 92%|█████████▏| 46/50 [00:11<00:00,  6.74it/s] 94%|█████████▍| 47/50 [00:11<00:00,  6.75it/s] 96%|█████████▌| 48/50 [00:11<00:00,  6.74it/s] 98%|█████████▊| 49/50 [00:11<00:00,  6.74it/s]100%|██████████| 50/50 [00:16<00:00,  1.54s/it]100%|██████████| 50/50 [00:16<00:00,  3.03it/s]
