[I 2023-12-10 21:58:55,841] Trial 81 finished with value: 0.4079221681723419 and parameters: {'EMBEDDING_DIM': 966, 'HIDDEN_DIM': 454, 'NUM_LAYERS': 1, 'DROPOUT': 0.344583085806479, 'LR': 0.001025094546910038, 'WEIGHT_0': 0.42574288360098705, 'WEIGHT_1': 0.6726996007389928, 'WEIGHT_2': 0.6735345210190722, 'WEIGHT_3': 0.8990336538993172, 'WEIGHT_4': 0.8427752714361677, 'WEIGHT_5': 0.487534508935966, 'WEIGHT_6': 0.9375190791791631, 'WEIGHT_7': 0.38492298448992596, 'WEIGHT_8': 0.445294036955478, 'optimizer': 'RMSprop'}. Best is trial 51 with value: 0.41438326562364947.
/userhome/cs2/dingruiw/conda/envs/py310/lib/python3.10/site-packages/torch/nn/modules/rnn.py:82: UserWarning: dropout option adds dropout after all but last recurrent layer, so non-zero dropout expects num_layers greater than 1, but got dropout=0.31283737277736073 and num_layers=1
  warnings.warn("dropout option adds dropout after all but last "
{'EMBEDDING_DIM': 966, 'HIDDEN_DIM': 454, 'NUM_LAYERS': 1, 'DROPOUT': 0.344583085806479, 'LR': 0.001025094546910038, 'WEIGHT_0': 0.42574288360098705, 'WEIGHT_1': 0.6726996007389928, 'WEIGHT_2': 0.6735345210190722, 'WEIGHT_3': 0.8990336538993172, 'WEIGHT_4': 0.8427752714361677, 'WEIGHT_5': 0.487534508935966, 'WEIGHT_6': 0.9375190791791631, 'WEIGHT_7': 0.38492298448992596, 'WEIGHT_8': 0.445294036955478, 'optimizer': 'RMSprop'}
0
              precision    recall  f1-score   support

         LOC       0.34      0.09      0.14      1837
        MISC       0.03      0.02      0.02       922
         ORG       0.06      0.05      0.06      1341
         PER       0.04      0.02      0.03      1842

   micro avg       0.09      0.05      0.07      5942
   macro avg       0.12      0.05      0.06      5942
weighted avg       0.14      0.05      0.07      5942

{'EMBEDDING_DIM': 966, 'HIDDEN_DIM': 454, 'NUM_LAYERS': 1, 'DROPOUT': 0.344583085806479, 'LR': 0.001025094546910038, 'WEIGHT_0': 0.42574288360098705, 'WEIGHT_1': 0.6726996007389928, 'WEIGHT_2': 0.6735345210190722, 'WEIGHT_3': 0.8990336538993172, 'WEIGHT_4': 0.8427752714361677, 'WEIGHT_5': 0.487534508935966, 'WEIGHT_6': 0.9375190791791631, 'WEIGHT_7': 0.38492298448992596, 'WEIGHT_8': 0.445294036955478, 'optimizer': 'RMSprop'}
49
              precision    recall  f1-score   support

         LOC       0.60      0.53      0.56      1837
        MISC       0.43      0.43      0.43       922
         ORG       0.27      0.25      0.26      1341
         PER       0.36      0.35      0.35      1842

   micro avg       0.42      0.40      0.41      5942
   macro avg       0.41      0.39      0.40      5942
weighted avg       0.42      0.40      0.41      5942

epoch 49
LSTM
  0%|          | 0/50 [00:00<?, ?it/s]  2%|▏         | 1/50 [00:04<03:56,  4.83s/it]  4%|▍         | 2/50 [00:05<01:40,  2.09s/it]  6%|▌         | 3/50 [00:05<01:00,  1.28s/it]  8%|▊         | 4/50 [00:05<00:41,  1.11it/s] 10%|█         | 5/50 [00:05<00:30,  1.46it/s] 12%|█▏        | 6/50 [00:06<00:24,  1.79it/s] 14%|█▍        | 7/50 [00:06<00:20,  2.10it/s] 16%|█▌        | 8/50 [00:06<00:17,  2.36it/s] 18%|█▊        | 9/50 [00:07<00:15,  2.57it/s] 20%|██        | 10/50 [00:07<00:14,  2.74it/s] 22%|██▏       | 11/50 [00:07<00:13,  2.87it/s] 24%|██▍       | 12/50 [00:08<00:12,  2.97it/s] 26%|██▌       | 13/50 [00:08<00:12,  3.04it/s] 28%|██▊       | 14/50 [00:08<00:11,  3.08it/s] 30%|███       | 15/50 [00:09<00:11,  3.12it/s] 32%|███▏      | 16/50 [00:09<00:10,  3.15it/s] 34%|███▍      | 17/50 [00:09<00:10,  3.16it/s] 36%|███▌      | 18/50 [00:09<00:10,  3.18it/s] 38%|███▊      | 19/50 [00:10<00:09,  3.18it/s] 40%|████      | 20/50 [00:10<00:09,  3.18it/s] 42%|████▏     | 21/50 [00:10<00:09,  3.18it/s] 44%|████▍     | 22/50 [00:11<00:08,  3.19it/s] 46%|████▌     | 23/50 [00:11<00:08,  3.19it/s] 48%|████▊     | 24/50 [00:11<00:08,  3.19it/s] 50%|█████     | 25/50 [00:12<00:07,  3.19it/s] 52%|█████▏    | 26/50 [00:12<00:07,  3.19it/s] 54%|█████▍    | 27/50 [00:12<00:07,  3.19it/s] 56%|█████▌    | 28/50 [00:13<00:06,  3.19it/s] 58%|█████▊    | 29/50 [00:13<00:06,  3.19it/s] 60%|██████    | 30/50 [00:13<00:06,  3.19it/s] 62%|██████▏   | 31/50 [00:14<00:05,  3.19it/s] 64%|██████▍   | 32/50 [00:14<00:05,  3.19it/s] 66%|██████▌   | 33/50 [00:14<00:05,  3.19it/s] 68%|██████▊   | 34/50 [00:15<00:05,  3.19it/s] 70%|███████   | 35/50 [00:15<00:04,  3.18it/s] 72%|███████▏  | 36/50 [00:15<00:04,  3.18it/s] 74%|███████▍  | 37/50 [00:15<00:04,  3.18it/s] 76%|███████▌  | 38/50 [00:16<00:03,  3.19it/s] 78%|███████▊  | 39/50 [00:16<00:03,  3.18it/s] 80%|████████  | 40/50 [00:16<00:03,  3.18it/s] 82%|████████▏ | 41/50 [00:17<00:02,  3.18it/s] 84%|████████▍ | 42/50 [00:17<00:02,  3.18it/s] 86%|████████▌ | 43/50 [00:17<00:02,  3.18it/s] 88%|████████▊ | 44/50 [00:18<00:01,  3.18it/s] 90%|█████████ | 45/50 [00:18<00:01,  3.18it/s] 92%|█████████▏| 46/50 [00:18<00:01,  3.18it/s] 94%|█████████▍| 47/50 [00:19<00:00,  3.18it/s] 96%|█████████▌| 48/50 [00:19<00:00,  3.18it/s] 98%|█████████▊| 49/50 [00:19<00:00,  3.18it/s]100%|██████████| 50/50 [00:24<00:00,  1.73s/it]100%|██████████| 50/50 [00:24<00:00,  2.02it/s]
[I 2023-12-10 21:59:24,909] Trial 82 finished with value: 0.41113416320885204 and parameters: {'EMBEDDING_DIM': 990, 'HIDDEN_DIM': 475, 'NUM_LAYERS': 1, 'DROPOUT': 0.31283737277736073, 'LR': 0.0011102444037162662, 'WEIGHT_0': 0.4381319187658664, 'WEIGHT_1': 0.68230526141525, 'WEIGHT_2': 0.6682220664548362, 'WEIGHT_3': 0.8807104033485468, 'WEIGHT_4': 0.8441093783187424, 'WEIGHT_5': 0.48279314253156824, 'WEIGHT_6': 0.9476251664545758, 'WEIGHT_7': 0.3742858417846753, 'WEIGHT_8': 0.4227018015788432, 'optimizer': 'RMSprop'}. Best is trial 51 with value: 0.41438326562364947.
/userhome/cs2/dingruiw/conda/envs/py310/lib/python3.10/site-packages/torch/nn/modules/rnn.py:82: UserWarning: dropout option adds dropout after all but last recurrent layer, so non-zero dropout expects num_layers greater than 1, but got dropout=0.2868324318592259 and num_layers=1
  warnings.warn("dropout option adds dropout after all but last "
{'EMBEDDING_DIM': 990, 'HIDDEN_DIM': 475, 'NUM_LAYERS': 1, 'DROPOUT': 0.31283737277736073, 'LR': 0.0011102444037162662, 'WEIGHT_0': 0.4381319187658664, 'WEIGHT_1': 0.68230526141525, 'WEIGHT_2': 0.6682220664548362, 'WEIGHT_3': 0.8807104033485468, 'WEIGHT_4': 0.8441093783187424, 'WEIGHT_5': 0.48279314253156824, 'WEIGHT_6': 0.9476251664545758, 'WEIGHT_7': 0.3742858417846753, 'WEIGHT_8': 0.4227018015788432, 'optimizer': 'RMSprop'}
0
              precision    recall  f1-score   support

         LOC       0.14      0.06      0.08      1837
        MISC       0.04      0.02      0.03       922
         ORG       0.09      0.04      0.06      1341
         PER       0.12      0.03      0.05      1842

   micro avg       0.10      0.04      0.06      5942
   macro avg       0.10      0.04      0.05      5942
weighted avg       0.11      0.04      0.06      5942

{'EMBEDDING_DIM': 990, 'HIDDEN_DIM': 475, 'NUM_LAYERS': 1, 'DROPOUT': 0.31283737277736073, 'LR': 0.0011102444037162662, 'WEIGHT_0': 0.4381319187658664, 'WEIGHT_1': 0.68230526141525, 'WEIGHT_2': 0.6682220664548362, 'WEIGHT_3': 0.8807104033485468, 'WEIGHT_4': 0.8441093783187424, 'WEIGHT_5': 0.48279314253156824, 'WEIGHT_6': 0.9476251664545758, 'WEIGHT_7': 0.3742858417846753, 'WEIGHT_8': 0.4227018015788432, 'optimizer': 'RMSprop'}
49
              precision    recall  f1-score   support

         LOC       0.61      0.53      0.57      1837
        MISC       0.44      0.44      0.44       922
         ORG       0.29      0.25      0.27      1341
         PER       0.34      0.35      0.34      1842

   micro avg       0.42      0.40      0.41      5942
   macro avg       0.42      0.40      0.41      5942
weighted avg       0.43      0.40      0.41      5942

epoch 49
LSTM
  0%|          | 0/50 [00:00<?, ?it/s]  2%|▏         | 1/50 [00:04<03:51,  4.73s/it]  4%|▍         | 2/50 [00:04<01:36,  2.01s/it]  6%|▌         | 3/50 [00:05<00:55,  1.18s/it]  8%|▊         | 4/50 [00:05<00:36,  1.27it/s] 10%|█         | 5/50 [00:05<00:25,  1.76it/s] 12%|█▏        | 6/50 [00:05<00:19,  2.28it/s] 14%|█▍        | 7/50 [00:05<00:15,  2.81it/s] 16%|█▌        | 8/50 [00:05<00:12,  3.32it/s] 18%|█▊        | 9/50 [00:06<00:10,  3.78it/s] 20%|██        | 10/50 [00:06<00:09,  4.17it/s] 22%|██▏       | 11/50 [00:06<00:08,  4.49it/s] 24%|██▍       | 12/50 [00:06<00:08,  4.74it/s] 26%|██▌       | 13/50 [00:06<00:07,  4.92it/s] 28%|██▊       | 14/50 [00:07<00:07,  5.06it/s] 30%|███       | 15/50 [00:07<00:06,  5.16it/s] 32%|███▏      | 16/50 [00:07<00:06,  5.24it/s] 34%|███▍      | 17/50 [00:07<00:06,  5.29it/s] 36%|███▌      | 18/50 [00:07<00:06,  5.33it/s] 38%|███▊      | 19/50 [00:07<00:05,  5.35it/s] 40%|████      | 20/50 [00:08<00:05,  5.37it/s] 42%|████▏     | 21/50 [00:08<00:05,  5.39it/s] 44%|████▍     | 22/50 [00:08<00:05,  5.39it/s] 46%|████▌     | 23/50 [00:08<00:05,  5.39it/s] 48%|████▊     | 24/50 [00:08<00:04,  5.40it/s] 50%|█████     | 25/50 [00:09<00:04,  5.40it/s] 52%|█████▏    | 26/50 [00:09<00:04,  5.40it/s] 54%|█████▍    | 27/50 [00:09<00:04,  5.41it/s] 56%|█████▌    | 28/50 [00:09<00:04,  5.41it/s] 58%|█████▊    | 29/50 [00:09<00:03,  5.41it/s] 60%|██████    | 30/50 [00:10<00:03,  5.41it/s] 62%|██████▏   | 31/50 [00:10<00:03,  5.41it/s] 64%|██████▍   | 32/50 [00:10<00:03,  5.41it/s] 66%|██████▌   | 33/50 [00:10<00:03,  5.41it/s] 68%|██████▊   | 34/50 [00:10<00:02,  5.41it/s] 70%|███████   | 35/50 [00:10<00:02,  5.40it/s] 72%|███████▏  | 36/50 [00:11<00:02,  5.40it/s] 74%|███████▍  | 37/50 [00:11<00:02,  5.41it/s] 76%|███████▌  | 38/50 [00:11<00:02,  5.40it/s] 78%|███████▊  | 39/50 [00:11<00:02,  5.40it/s] 80%|████████  | 40/50 [00:11<00:01,  5.41it/s] 82%|████████▏ | 41/50 [00:12<00:01,  5.40it/s] 84%|████████▍ | 42/50 [00:12<00:01,  5.40it/s] 86%|████████▌ | 43/50 [00:12<00:01,  5.40it/s] 88%|████████▊ | 44/50 [00:12<00:01,  5.40it/s] 90%|█████████ | 45/50 [00:12<00:00,  5.40it/s] 92%|█████████▏| 46/50 [00:12<00:00,  5.40it/s] 94%|█████████▍| 47/50 [00:13<00:00,  5.40it/s] 96%|█████████▌| 48/50 [00:13<00:00,  5.40it/s] 98%|█████████▊| 49/50 [00:13<00:00,  5.40it/s]100%|██████████| 50/50 [00:18<00:00,  1.57s/it]100%|██████████| 50/50 [00:18<00:00,  2.73it/s]
[I 2023-12-10 21:59:47,449] Trial 83 finished with value: 0.373652917131178 and parameters: {'EMBEDDING_DIM': 972, 'HIDDEN_DIM': 266, 'NUM_LAYERS': 1, 'DROPOUT': 0.2868324318592259, 'LR': 0.00038252369065735537, 'WEIGHT_0': 0.4275333881429165, 'WEIGHT_1': 0.7346569718263574, 'WEIGHT_2': 0.675913743688816, 'WEIGHT_3': 0.8831390692206197, 'WEIGHT_4': 0.8450836318499018, 'WEIGHT_5': 0.5550129861684289, 'WEIGHT_6': 0.9991200082072766, 'WEIGHT_7': 0.403705466286325, 'WEIGHT_8': 0.43958758848888346, 'optimizer': 'RMSprop'}. Best is trial 51 with value: 0.41438326562364947.
/userhome/cs2/dingruiw/conda/envs/py310/lib/python3.10/site-packages/torch/nn/modules/rnn.py:82: UserWarning: dropout option adds dropout after all but last recurrent layer, so non-zero dropout expects num_layers greater than 1, but got dropout=0.3106083784244311 and num_layers=1
  warnings.warn("dropout option adds dropout after all but last "
{'EMBEDDING_DIM': 972, 'HIDDEN_DIM': 266, 'NUM_LAYERS': 1, 'DROPOUT': 0.2868324318592259, 'LR': 0.00038252369065735537, 'WEIGHT_0': 0.4275333881429165, 'WEIGHT_1': 0.7346569718263574, 'WEIGHT_2': 0.675913743688816, 'WEIGHT_3': 0.8831390692206197, 'WEIGHT_4': 0.8450836318499018, 'WEIGHT_5': 0.5550129861684289, 'WEIGHT_6': 0.9991200082072766, 'WEIGHT_7': 0.403705466286325, 'WEIGHT_8': 0.43958758848888346, 'optimizer': 'RMSprop'}
0
              precision    recall  f1-score   support

         LOC       0.07      0.07      0.07      1837
        MISC       0.02      0.04      0.03       922
         ORG       0.04      0.04      0.04      1341
         PER       0.04      0.05      0.04      1842

   micro avg       0.04      0.05      0.05      5942
   macro avg       0.04      0.05      0.04      5942
weighted avg       0.05      0.05      0.05      5942

{'EMBEDDING_DIM': 972, 'HIDDEN_DIM': 266, 'NUM_LAYERS': 1, 'DROPOUT': 0.2868324318592259, 'LR': 0.00038252369065735537, 'WEIGHT_0': 0.4275333881429165, 'WEIGHT_1': 0.7346569718263574, 'WEIGHT_2': 0.675913743688816, 'WEIGHT_3': 0.8831390692206197, 'WEIGHT_4': 0.8450836318499018, 'WEIGHT_5': 0.5550129861684289, 'WEIGHT_6': 0.9991200082072766, 'WEIGHT_7': 0.403705466286325, 'WEIGHT_8': 0.43958758848888346, 'optimizer': 'RMSprop'}
49
              precision    recall  f1-score   support

         LOC       0.61      0.44      0.51      1837
        MISC       0.49      0.37      0.42       922
         ORG       0.29      0.21      0.24      1341
         PER       0.32      0.32      0.32      1842

   micro avg       0.42      0.34      0.37      5942
   macro avg       0.43      0.33      0.37      5942
weighted avg       0.43      0.34      0.38      5942

epoch 49
LSTM
  0%|          | 0/50 [00:00<?, ?it/s]  2%|▏         | 1/50 [00:04<03:25,  4.20s/it]  4%|▍         | 2/50 [00:04<01:26,  1.81s/it]  6%|▌         | 3/50 [00:04<00:51,  1.09s/it]  8%|▊         | 4/50 [00:04<00:34,  1.32it/s] 10%|█         | 5/50 [00:05<00:25,  1.76it/s] 12%|█▏        | 6/50 [00:05<00:20,  2.19it/s] 14%|█▍        | 7/50 [00:05<00:16,  2.60it/s] 16%|█▌        | 8/50 [00:05<00:14,  2.95it/s] 18%|█▊        | 9/50 [00:06<00:12,  3.26it/s] 20%|██        | 10/50 [00:06<00:11,  3.50it/s] 22%|██▏       | 11/50 [00:06<00:10,  3.69it/s] 24%|██▍       | 12/50 [00:06<00:09,  3.83it/s] 26%|██▌       | 13/50 [00:06<00:09,  3.94it/s] 28%|██▊       | 14/50 [00:07<00:08,  4.01it/s] 30%|███       | 15/50 [00:07<00:08,  4.07it/s] 32%|███▏      | 16/50 [00:07<00:08,  4.11it/s] 34%|███▍      | 17/50 [00:07<00:07,  4.14it/s] 36%|███▌      | 18/50 [00:08<00:07,  4.16it/s] 38%|███▊      | 19/50 [00:08<00:07,  4.17it/s] 40%|████      | 20/50 [00:08<00:07,  4.18it/s] 42%|████▏     | 21/50 [00:08<00:06,  4.19it/s] 44%|████▍     | 22/50 [00:09<00:06,  4.19it/s] 46%|████▌     | 23/50 [00:09<00:06,  4.19it/s] 48%|████▊     | 24/50 [00:09<00:06,  4.20it/s] 50%|█████     | 25/50 [00:09<00:05,  4.20it/s] 52%|█████▏    | 26/50 [00:10<00:05,  4.19it/s] 54%|█████▍    | 27/50 [00:10<00:05,  4.19it/s] 56%|█████▌    | 28/50 [00:10<00:05,  4.20it/s] 58%|█████▊    | 29/50 [00:10<00:05,  4.20it/s] 60%|██████    | 30/50 [00:11<00:04,  4.20it/s] 62%|██████▏   | 31/50 [00:11<00:04,  4.19it/s] 64%|██████▍   | 32/50 [00:11<00:04,  4.20it/s] 66%|██████▌   | 33/50 [00:11<00:04,  4.20it/s] 68%|██████▊   | 34/50 [00:11<00:03,  4.19it/s] 70%|███████   | 35/50 [00:12<00:03,  4.19it/s] 72%|███████▏  | 36/50 [00:12<00:03,  4.19it/s] 74%|███████▍  | 37/50 [00:12<00:03,  4.19it/s] 76%|███████▌  | 38/50 [00:12<00:02,  4.19it/s] 78%|███████▊  | 39/50 [00:13<00:02,  4.19it/s] 80%|████████  | 40/50 [00:13<00:02,  4.19it/s] 82%|████████▏ | 41/50 [00:13<00:02,  4.20it/s] 84%|████████▍ | 42/50 [00:13<00:01,  4.20it/s] 86%|████████▌ | 43/50 [00:14<00:01,  4.19it/s] 88%|████████▊ | 44/50 [00:14<00:01,  4.19it/s] 90%|█████████ | 45/50 [00:14<00:01,  4.20it/s] 92%|█████████▏| 46/50 [00:14<00:00,  4.19it/s] 94%|█████████▍| 47/50 [00:15<00:00,  4.19it/s] 96%|█████████▌| 48/50 [00:15<00:00,  4.20it/s] 98%|█████████▊| 49/50 [00:15<00:00,  4.19it/s]100%|██████████| 50/50 [00:19<00:00,  1.50s/it]100%|██████████| 50/50 [00:19<00:00,  2.50it/s]
[I 2023-12-10 22:00:11,111] Trial 84 finished with value: 0.40494130015770113 and parameters: {'EMBEDDING_DIM': 934, 'HIDDEN_DIM': 175, 'NUM_LAYERS': 1, 'DROPOUT': 0.3106083784244311, 'LR': 0.0008677733059555693, 'WEIGHT_0': 0.4820642580650527, 'WEIGHT_1': 0.6800554417825241, 'WEIGHT_2': 0.6652888019722293, 'WEIGHT_3': 0.9057848163457028, 'WEIGHT_4': 0.8968282662822157, 'WEIGHT_5': 0.48635720244239733, 'WEIGHT_6': 0.901210389991745, 'WEIGHT_7': 0.38168916735018316, 'WEIGHT_8': 0.5106710454246566, 'optimizer': 'RMSprop'}. Best is trial 51 with value: 0.41438326562364947.
/userhome/cs2/dingruiw/conda/envs/py310/lib/python3.10/site-packages/torch/nn/modules/rnn.py:82: UserWarning: dropout option adds dropout after all but last recurrent layer, so non-zero dropout expects num_layers greater than 1, but got dropout=0.3230654896720469 and num_layers=1
  warnings.warn("dropout option adds dropout after all but last "
{'EMBEDDING_DIM': 934, 'HIDDEN_DIM': 175, 'NUM_LAYERS': 1, 'DROPOUT': 0.3106083784244311, 'LR': 0.0008677733059555693, 'WEIGHT_0': 0.4820642580650527, 'WEIGHT_1': 0.6800554417825241, 'WEIGHT_2': 0.6652888019722293, 'WEIGHT_3': 0.9057848163457028, 'WEIGHT_4': 0.8968282662822157, 'WEIGHT_5': 0.48635720244239733, 'WEIGHT_6': 0.901210389991745, 'WEIGHT_7': 0.38168916735018316, 'WEIGHT_8': 0.5106710454246566, 'optimizer': 'RMSprop'}
0
              precision    recall  f1-score   support

         LOC       0.12      0.03      0.05      1837
        MISC       0.05      0.05      0.05       922
         ORG       0.09      0.05      0.06      1341
         PER       0.07      0.03      0.04      1842

   micro avg       0.08      0.03      0.05      5942
   macro avg       0.08      0.04      0.05      5942
weighted avg       0.09      0.03      0.05      5942

{'EMBEDDING_DIM': 934, 'HIDDEN_DIM': 175, 'NUM_LAYERS': 1, 'DROPOUT': 0.3106083784244311, 'LR': 0.0008677733059555693, 'WEIGHT_0': 0.4820642580650527, 'WEIGHT_1': 0.6800554417825241, 'WEIGHT_2': 0.6652888019722293, 'WEIGHT_3': 0.9057848163457028, 'WEIGHT_4': 0.8968282662822157, 'WEIGHT_5': 0.48635720244239733, 'WEIGHT_6': 0.901210389991745, 'WEIGHT_7': 0.38168916735018316, 'WEIGHT_8': 0.5106710454246566, 'optimizer': 'RMSprop'}
49
              precision    recall  f1-score   support

         LOC       0.63      0.52      0.57      1837
        MISC       0.48      0.46      0.47       922
         ORG       0.25      0.24      0.25      1341
         PER       0.33      0.33      0.33      1842

   micro avg       0.42      0.39      0.40      5942
   macro avg       0.43      0.39      0.41      5942
weighted avg       0.43      0.39      0.41      5942

epoch 49
LSTM
  0%|          | 0/50 [00:00<?, ?it/s]  2%|▏         | 1/50 [00:04<03:56,  4.82s/it]  4%|▍         | 2/50 [00:04<01:38,  2.06s/it]  6%|▌         | 3/50 [00:05<00:57,  1.22s/it]  8%|▊         | 4/50 [00:05<00:38,  1.21it/s] 10%|█         | 5/50 [00:05<00:27,  1.65it/s] 12%|█▏        | 6/50 [00:05<00:20,  2.11it/s] 14%|█▍        | 7/50 [00:06<00:16,  2.56it/s] 16%|█▌        | 8/50 [00:06<00:14,  2.98it/s] 18%|█▊        | 9/50 [00:06<00:12,  3.34it/s] 20%|██        | 10/50 [00:06<00:10,  3.65it/s] 22%|██▏       | 11/50 [00:06<00:10,  3.89it/s] 24%|██▍       | 12/50 [00:07<00:09,  4.08it/s] 26%|██▌       | 13/50 [00:07<00:08,  4.22it/s] 28%|██▊       | 14/50 [00:07<00:08,  4.32it/s] 30%|███       | 15/50 [00:07<00:07,  4.40it/s] 32%|███▏      | 16/50 [00:08<00:07,  4.45it/s] 34%|███▍      | 17/50 [00:08<00:07,  4.50it/s] 36%|███▌      | 18/50 [00:08<00:07,  4.52it/s] 38%|███▊      | 19/50 [00:08<00:06,  4.54it/s] 40%|████      | 20/50 [00:08<00:06,  4.55it/s] 42%|████▏     | 21/50 [00:09<00:06,  4.56it/s] 44%|████▍     | 22/50 [00:09<00:06,  4.57it/s] 46%|████▌     | 23/50 [00:09<00:05,  4.57it/s] 48%|████▊     | 24/50 [00:09<00:05,  4.58it/s] 50%|█████     | 25/50 [00:09<00:05,  4.58it/s] 52%|█████▏    | 26/50 [00:10<00:05,  4.57it/s] 54%|█████▍    | 27/50 [00:10<00:05,  4.57it/s] 56%|█████▌    | 28/50 [00:10<00:04,  4.57it/s] 58%|█████▊    | 29/50 [00:10<00:04,  4.57it/s] 60%|██████    | 30/50 [00:11<00:04,  4.57it/s] 62%|██████▏   | 31/50 [00:11<00:04,  4.57it/s] 64%|██████▍   | 32/50 [00:11<00:03,  4.57it/s] 66%|██████▌   | 33/50 [00:11<00:03,  4.56it/s] 68%|██████▊   | 34/50 [00:11<00:03,  4.57it/s] 70%|███████   | 35/50 [00:12<00:03,  4.56it/s] 72%|███████▏  | 36/50 [00:12<00:03,  4.56it/s] 74%|███████▍  | 37/50 [00:12<00:02,  4.56it/s] 76%|███████▌  | 38/50 [00:12<00:02,  4.56it/s] 78%|███████▊  | 39/50 [00:13<00:02,  4.56it/s] 80%|████████  | 40/50 [00:13<00:02,  4.56it/s] 82%|████████▏ | 41/50 [00:13<00:01,  4.56it/s] 84%|████████▍ | 42/50 [00:13<00:01,  4.56it/s] 86%|████████▌ | 43/50 [00:13<00:01,  4.56it/s] 88%|████████▊ | 44/50 [00:14<00:01,  4.55it/s] 90%|█████████ | 45/50 [00:14<00:01,  4.56it/s] 92%|█████████▏| 46/50 [00:14<00:00,  4.56it/s] 94%|█████████▍| 47/50 [00:14<00:00,  4.56it/s] 96%|█████████▌| 48/50 [00:15<00:00,  4.56it/s] 98%|█████████▊| 49/50 [00:15<00:00,  4.56it/s]100%|██████████| 50/50 [00:20<00:00,  1.61s/it]100%|██████████| 50/50 [00:20<00:00,  2.49it/s]
