[I 2023-12-10 23:16:34,808] Trial 233 finished with value: 0.41286217866047625 and parameters: {'EMBEDDING_DIM': 941, 'HIDDEN_DIM': 197, 'NUM_LAYERS': 1, 'DROPOUT': 0.3567818628625311, 'LR': 0.0018508089900578625, 'WEIGHT_0': 0.5547975200876547, 'WEIGHT_1': 0.4651813611753428, 'WEIGHT_2': 0.2277949500072679, 'WEIGHT_3': 0.33184423804792573, 'WEIGHT_4': 0.9417387104945518, 'WEIGHT_5': 0.7683530927643846, 'WEIGHT_6': 0.6866206503430399, 'WEIGHT_7': 0.33121118944039846, 'WEIGHT_8': 0.7846790164691294, 'optimizer': 'Adam'}. Best is trial 221 with value: 0.418736930154747.
/userhome/cs2/dingruiw/conda/envs/py310/lib/python3.10/site-packages/torch/nn/modules/rnn.py:82: UserWarning: dropout option adds dropout after all but last recurrent layer, so non-zero dropout expects num_layers greater than 1, but got dropout=0.34625071871890417 and num_layers=1
  warnings.warn("dropout option adds dropout after all but last "
{'EMBEDDING_DIM': 941, 'HIDDEN_DIM': 197, 'NUM_LAYERS': 1, 'DROPOUT': 0.3567818628625311, 'LR': 0.0018508089900578625, 'WEIGHT_0': 0.5547975200876547, 'WEIGHT_1': 0.4651813611753428, 'WEIGHT_2': 0.2277949500072679, 'WEIGHT_3': 0.33184423804792573, 'WEIGHT_4': 0.9417387104945518, 'WEIGHT_5': 0.7683530927643846, 'WEIGHT_6': 0.6866206503430399, 'WEIGHT_7': 0.33121118944039846, 'WEIGHT_8': 0.7846790164691294, 'optimizer': 'Adam'}
0
              precision    recall  f1-score   support

         LOC       0.07      0.12      0.09      1837
        MISC       0.02      0.09      0.04       922
         ORG       0.02      0.08      0.04      1341
         PER       0.04      0.02      0.03      1842

   micro avg       0.04      0.08      0.05      5942
   macro avg       0.04      0.08      0.05      5942
weighted avg       0.04      0.08      0.05      5942

{'EMBEDDING_DIM': 941, 'HIDDEN_DIM': 197, 'NUM_LAYERS': 1, 'DROPOUT': 0.3567818628625311, 'LR': 0.0018508089900578625, 'WEIGHT_0': 0.5547975200876547, 'WEIGHT_1': 0.4651813611753428, 'WEIGHT_2': 0.2277949500072679, 'WEIGHT_3': 0.33184423804792573, 'WEIGHT_4': 0.9417387104945518, 'WEIGHT_5': 0.7683530927643846, 'WEIGHT_6': 0.6866206503430399, 'WEIGHT_7': 0.33121118944039846, 'WEIGHT_8': 0.7846790164691294, 'optimizer': 'Adam'}
49
              precision    recall  f1-score   support

         LOC       0.54      0.58      0.56      1837
        MISC       0.57      0.38      0.46       922
         ORG       0.28      0.25      0.26      1341
         PER       0.34      0.35      0.35      1842

   micro avg       0.42      0.40      0.41      5942
   macro avg       0.43      0.39      0.41      5942
weighted avg       0.42      0.40      0.41      5942

epoch 49
LSTM
  0%|          | 0/50 [00:00<?, ?it/s]  2%|▏         | 1/50 [00:04<03:51,  4.72s/it]  6%|▌         | 3/50 [00:04<01:01,  1.32s/it]  8%|▊         | 4/50 [00:05<00:41,  1.10it/s] 10%|█         | 5/50 [00:05<00:29,  1.52it/s] 12%|█▏        | 6/50 [00:05<00:21,  2.03it/s] 14%|█▍        | 7/50 [00:05<00:16,  2.60it/s] 16%|█▌        | 8/50 [00:05<00:13,  3.22it/s] 18%|█▊        | 9/50 [00:05<00:10,  3.85it/s] 20%|██        | 10/50 [00:05<00:09,  4.43it/s] 22%|██▏       | 11/50 [00:06<00:07,  4.97it/s] 24%|██▍       | 12/50 [00:06<00:07,  5.41it/s] 26%|██▌       | 13/50 [00:06<00:06,  5.78it/s] 28%|██▊       | 14/50 [00:06<00:05,  6.06it/s] 30%|███       | 15/50 [00:06<00:05,  6.27it/s] 32%|███▏      | 16/50 [00:06<00:05,  6.43it/s] 34%|███▍      | 17/50 [00:07<00:05,  6.55it/s] 36%|███▌      | 18/50 [00:07<00:04,  6.64it/s] 38%|███▊      | 19/50 [00:07<00:04,  6.69it/s] 40%|████      | 20/50 [00:07<00:04,  6.70it/s] 42%|████▏     | 21/50 [00:07<00:04,  6.78it/s] 44%|████▍     | 22/50 [00:07<00:04,  6.80it/s] 46%|████▌     | 23/50 [00:07<00:03,  6.81it/s] 48%|████▊     | 24/50 [00:08<00:03,  6.81it/s] 50%|█████     | 25/50 [00:08<00:03,  6.83it/s] 52%|█████▏    | 26/50 [00:08<00:03,  6.82it/s] 54%|█████▍    | 27/50 [00:08<00:03,  6.83it/s] 56%|█████▌    | 28/50 [00:08<00:03,  6.83it/s] 58%|█████▊    | 29/50 [00:08<00:03,  6.83it/s] 60%|██████    | 30/50 [00:08<00:02,  6.83it/s] 62%|██████▏   | 31/50 [00:09<00:02,  6.83it/s] 64%|██████▍   | 32/50 [00:09<00:02,  6.83it/s] 66%|██████▌   | 33/50 [00:09<00:02,  6.83it/s] 68%|██████▊   | 34/50 [00:09<00:02,  6.83it/s] 70%|███████   | 35/50 [00:09<00:02,  6.83it/s] 72%|███████▏  | 36/50 [00:09<00:02,  6.83it/s] 74%|███████▍  | 37/50 [00:09<00:01,  6.83it/s] 76%|███████▌  | 38/50 [00:10<00:01,  6.83it/s] 78%|███████▊  | 39/50 [00:10<00:01,  6.83it/s] 80%|████████  | 40/50 [00:10<00:01,  6.82it/s] 82%|████████▏ | 41/50 [00:10<00:01,  6.82it/s] 84%|████████▍ | 42/50 [00:10<00:01,  6.81it/s] 86%|████████▌ | 43/50 [00:10<00:01,  6.81it/s] 88%|████████▊ | 44/50 [00:10<00:00,  6.82it/s] 90%|█████████ | 45/50 [00:11<00:00,  6.81it/s] 92%|█████████▏| 46/50 [00:11<00:00,  6.81it/s] 94%|█████████▍| 47/50 [00:11<00:00,  6.82it/s] 96%|█████████▌| 48/50 [00:11<00:00,  6.82it/s] 98%|█████████▊| 49/50 [00:11<00:00,  6.81it/s]100%|██████████| 50/50 [00:16<00:00,  1.57s/it]100%|██████████| 50/50 [00:16<00:00,  3.01it/s]
[I 2023-12-10 23:16:55,696] Trial 234 finished with value: 0.3648538593792417 and parameters: {'EMBEDDING_DIM': 912, 'HIDDEN_DIM': 212, 'NUM_LAYERS': 1, 'DROPOUT': 0.34625071871890417, 'LR': 0.0012104870888192322, 'WEIGHT_0': 0.5555333094219237, 'WEIGHT_1': 0.46640113529470845, 'WEIGHT_2': 0.23694624517203022, 'WEIGHT_3': 0.24951148733980183, 'WEIGHT_4': 0.5584379677125368, 'WEIGHT_5': 0.7621057084924369, 'WEIGHT_6': 0.7656102166708035, 'WEIGHT_7': 0.3285296014440804, 'WEIGHT_8': 0.821417220280971, 'optimizer': 'Adam'}. Best is trial 221 with value: 0.418736930154747.
/userhome/cs2/dingruiw/conda/envs/py310/lib/python3.10/site-packages/torch/nn/modules/rnn.py:82: UserWarning: dropout option adds dropout after all but last recurrent layer, so non-zero dropout expects num_layers greater than 1, but got dropout=0.2994262743032601 and num_layers=1
  warnings.warn("dropout option adds dropout after all but last "
{'EMBEDDING_DIM': 912, 'HIDDEN_DIM': 212, 'NUM_LAYERS': 1, 'DROPOUT': 0.34625071871890417, 'LR': 0.0012104870888192322, 'WEIGHT_0': 0.5555333094219237, 'WEIGHT_1': 0.46640113529470845, 'WEIGHT_2': 0.23694624517203022, 'WEIGHT_3': 0.24951148733980183, 'WEIGHT_4': 0.5584379677125368, 'WEIGHT_5': 0.7621057084924369, 'WEIGHT_6': 0.7656102166708035, 'WEIGHT_7': 0.3285296014440804, 'WEIGHT_8': 0.821417220280971, 'optimizer': 'Adam'}
0
              precision    recall  f1-score   support

         LOC       0.05      0.12      0.07      1837
        MISC       0.01      0.06      0.02       922
         ORG       0.03      0.10      0.05      1341
         PER       0.01      0.07      0.02      1842

   micro avg       0.03      0.09      0.04      5942
   macro avg       0.03      0.09      0.04      5942
weighted avg       0.03      0.09      0.04      5942

{'EMBEDDING_DIM': 912, 'HIDDEN_DIM': 212, 'NUM_LAYERS': 1, 'DROPOUT': 0.34625071871890417, 'LR': 0.0012104870888192322, 'WEIGHT_0': 0.5555333094219237, 'WEIGHT_1': 0.46640113529470845, 'WEIGHT_2': 0.23694624517203022, 'WEIGHT_3': 0.24951148733980183, 'WEIGHT_4': 0.5584379677125368, 'WEIGHT_5': 0.7621057084924369, 'WEIGHT_6': 0.7656102166708035, 'WEIGHT_7': 0.3285296014440804, 'WEIGHT_8': 0.821417220280971, 'optimizer': 'Adam'}
49
              precision    recall  f1-score   support

         LOC       0.50      0.58      0.54      1837
        MISC       0.49      0.21      0.30       922
         ORG       0.28      0.21      0.24      1341
         PER       0.30      0.25      0.28      1842

   micro avg       0.39      0.34      0.36      5942
   macro avg       0.39      0.32      0.34      5942
weighted avg       0.39      0.34      0.35      5942

epoch 49
LSTM
  0%|          | 0/50 [00:00<?, ?it/s]  2%|▏         | 1/50 [00:04<03:53,  4.76s/it]  6%|▌         | 3/50 [00:05<01:02,  1.34s/it]  8%|▊         | 4/50 [00:05<00:42,  1.07it/s] 10%|█         | 5/50 [00:05<00:30,  1.47it/s] 12%|█▏        | 6/50 [00:05<00:22,  1.93it/s] 14%|█▍        | 7/50 [00:05<00:17,  2.45it/s] 16%|█▌        | 8/50 [00:05<00:14,  2.99it/s] 18%|█▊        | 9/50 [00:06<00:11,  3.52it/s] 20%|██        | 10/50 [00:06<00:09,  4.02it/s] 22%|██▏       | 11/50 [00:06<00:08,  4.45it/s] 24%|██▍       | 12/50 [00:06<00:07,  4.79it/s] 26%|██▌       | 13/50 [00:06<00:07,  5.08it/s] 28%|██▊       | 14/50 [00:06<00:06,  5.30it/s] 30%|███       | 15/50 [00:07<00:06,  5.46it/s] 32%|███▏      | 16/50 [00:07<00:06,  5.59it/s] 34%|███▍      | 17/50 [00:07<00:05,  5.67it/s] 36%|███▌      | 18/50 [00:07<00:05,  5.72it/s] 38%|███▊      | 19/50 [00:07<00:05,  5.77it/s] 40%|████      | 20/50 [00:07<00:05,  5.80it/s] 42%|████▏     | 21/50 [00:08<00:04,  5.83it/s] 44%|████▍     | 22/50 [00:08<00:04,  5.84it/s] 46%|████▌     | 23/50 [00:08<00:04,  5.85it/s] 48%|████▊     | 24/50 [00:08<00:04,  5.86it/s] 50%|█████     | 25/50 [00:08<00:04,  5.86it/s] 52%|█████▏    | 26/50 [00:08<00:04,  5.87it/s] 54%|█████▍    | 27/50 [00:09<00:03,  5.87it/s] 56%|█████▌    | 28/50 [00:09<00:03,  5.87it/s] 58%|█████▊    | 29/50 [00:09<00:03,  5.88it/s] 60%|██████    | 30/50 [00:09<00:03,  5.87it/s] 62%|██████▏   | 31/50 [00:09<00:03,  5.88it/s] 64%|██████▍   | 32/50 [00:09<00:03,  5.88it/s] 66%|██████▌   | 33/50 [00:10<00:02,  5.88it/s] 68%|██████▊   | 34/50 [00:10<00:02,  5.89it/s] 70%|███████   | 35/50 [00:10<00:02,  5.88it/s] 72%|███████▏  | 36/50 [00:10<00:02,  5.87it/s] 74%|███████▍  | 37/50 [00:10<00:02,  5.87it/s] 76%|███████▌  | 38/50 [00:10<00:02,  5.87it/s] 78%|███████▊  | 39/50 [00:11<00:01,  5.87it/s] 80%|████████  | 40/50 [00:11<00:01,  5.87it/s] 82%|████████▏ | 41/50 [00:11<00:01,  5.87it/s] 84%|████████▍ | 42/50 [00:11<00:01,  5.87it/s] 86%|████████▌ | 43/50 [00:11<00:01,  5.87it/s] 88%|████████▊ | 44/50 [00:12<00:01,  5.87it/s] 90%|█████████ | 45/50 [00:12<00:00,  5.86it/s] 92%|█████████▏| 46/50 [00:12<00:00,  5.86it/s] 94%|█████████▍| 47/50 [00:12<00:00,  5.86it/s] 96%|█████████▌| 48/50 [00:12<00:00,  5.86it/s] 98%|█████████▊| 49/50 [00:12<00:00,  5.86it/s]100%|██████████| 50/50 [00:17<00:00,  1.56s/it]100%|██████████| 50/50 [00:17<00:00,  2.83it/s]
[I 2023-12-10 23:17:17,658] Trial 235 finished with value: 0.3991163475699558 and parameters: {'EMBEDDING_DIM': 936, 'HIDDEN_DIM': 247, 'NUM_LAYERS': 1, 'DROPOUT': 0.2994262743032601, 'LR': 0.0022176614856199857, 'WEIGHT_0': 0.5285099012145318, 'WEIGHT_1': 0.43874649803445576, 'WEIGHT_2': 0.23245629596422251, 'WEIGHT_3': 0.998981711163838, 'WEIGHT_4': 0.8865329506755248, 'WEIGHT_5': 0.7319166044898897, 'WEIGHT_6': 0.7229475920600537, 'WEIGHT_7': 0.3350840879518, 'WEIGHT_8': 0.7989282034835934, 'optimizer': 'Adam'}. Best is trial 221 with value: 0.418736930154747.
/userhome/cs2/dingruiw/conda/envs/py310/lib/python3.10/site-packages/torch/nn/modules/rnn.py:82: UserWarning: dropout option adds dropout after all but last recurrent layer, so non-zero dropout expects num_layers greater than 1, but got dropout=0.35580107512081727 and num_layers=1
  warnings.warn("dropout option adds dropout after all but last "
{'EMBEDDING_DIM': 936, 'HIDDEN_DIM': 247, 'NUM_LAYERS': 1, 'DROPOUT': 0.2994262743032601, 'LR': 0.0022176614856199857, 'WEIGHT_0': 0.5285099012145318, 'WEIGHT_1': 0.43874649803445576, 'WEIGHT_2': 0.23245629596422251, 'WEIGHT_3': 0.998981711163838, 'WEIGHT_4': 0.8865329506755248, 'WEIGHT_5': 0.7319166044898897, 'WEIGHT_6': 0.7229475920600537, 'WEIGHT_7': 0.3350840879518, 'WEIGHT_8': 0.7989282034835934, 'optimizer': 'Adam'}
0
              precision    recall  f1-score   support

         LOC       0.05      0.06      0.05      1837
        MISC       0.02      0.06      0.03       922
         ORG       0.05      0.07      0.06      1341
         PER       0.03      0.06      0.04      1842

   micro avg       0.04      0.06      0.04      5942
   macro avg       0.04      0.06      0.05      5942
weighted avg       0.04      0.06      0.05      5942

{'EMBEDDING_DIM': 936, 'HIDDEN_DIM': 247, 'NUM_LAYERS': 1, 'DROPOUT': 0.2994262743032601, 'LR': 0.0022176614856199857, 'WEIGHT_0': 0.5285099012145318, 'WEIGHT_1': 0.43874649803445576, 'WEIGHT_2': 0.23245629596422251, 'WEIGHT_3': 0.998981711163838, 'WEIGHT_4': 0.8865329506755248, 'WEIGHT_5': 0.7319166044898897, 'WEIGHT_6': 0.7229475920600537, 'WEIGHT_7': 0.3350840879518, 'WEIGHT_8': 0.7989282034835934, 'optimizer': 'Adam'}
49
              precision    recall  f1-score   support

         LOC       0.53      0.57      0.55      1837
        MISC       0.52      0.43      0.47       922
         ORG       0.26      0.25      0.25      1341
         PER       0.30      0.36      0.33      1842

   micro avg       0.39      0.41      0.40      5942
   macro avg       0.40      0.40      0.40      5942
weighted avg       0.39      0.41      0.40      5942

epoch 49
LSTM
  0%|          | 0/50 [00:00<?, ?it/s]  2%|▏         | 1/50 [00:04<03:33,  4.35s/it]  4%|▍         | 2/50 [00:04<01:30,  1.88s/it]  6%|▌         | 3/50 [00:04<00:53,  1.14s/it]  8%|▊         | 4/50 [00:05<00:36,  1.26it/s] 10%|█         | 5/50 [00:05<00:26,  1.67it/s] 12%|█▏        | 6/50 [00:05<00:21,  2.08it/s] 14%|█▍        | 7/50 [00:05<00:17,  2.46it/s] 16%|█▌        | 8/50 [00:06<00:15,  2.79it/s] 18%|█▊        | 9/50 [00:06<00:13,  3.07it/s] 20%|██        | 10/50 [00:06<00:12,  3.29it/s] 22%|██▏       | 11/50 [00:06<00:11,  3.47it/s] 24%|██▍       | 12/50 [00:07<00:10,  3.60it/s] 26%|██▌       | 13/50 [00:07<00:10,  3.69it/s] 28%|██▊       | 14/50 [00:07<00:09,  3.76it/s] 30%|███       | 15/50 [00:07<00:09,  3.81it/s] 32%|███▏      | 16/50 [00:08<00:08,  3.85it/s] 34%|███▍      | 17/50 [00:08<00:08,  3.87it/s] 36%|███▌      | 18/50 [00:08<00:08,  3.89it/s] 38%|███▊      | 19/50 [00:08<00:07,  3.90it/s] 40%|████      | 20/50 [00:09<00:07,  3.90it/s] 42%|████▏     | 21/50 [00:09<00:07,  3.92it/s] 44%|████▍     | 22/50 [00:09<00:07,  3.92it/s] 46%|████▌     | 23/50 [00:09<00:06,  3.93it/s] 48%|████▊     | 24/50 [00:10<00:06,  3.93it/s] 50%|█████     | 25/50 [00:10<00:06,  3.93it/s] 52%|█████▏    | 26/50 [00:10<00:06,  3.93it/s] 54%|█████▍    | 27/50 [00:10<00:05,  3.93it/s] 56%|█████▌    | 28/50 [00:11<00:05,  3.93it/s] 58%|█████▊    | 29/50 [00:11<00:05,  3.93it/s] 60%|██████    | 30/50 [00:11<00:05,  3.93it/s] 62%|██████▏   | 31/50 [00:11<00:04,  3.93it/s] 64%|██████▍   | 32/50 [00:12<00:04,  3.93it/s] 66%|██████▌   | 33/50 [00:12<00:04,  3.93it/s] 68%|██████▊   | 34/50 [00:12<00:04,  3.93it/s] 70%|███████   | 35/50 [00:12<00:03,  3.93it/s] 72%|███████▏  | 36/50 [00:13<00:03,  3.93it/s] 74%|███████▍  | 37/50 [00:13<00:03,  3.93it/s] 76%|███████▌  | 38/50 [00:13<00:03,  3.93it/s] 78%|███████▊  | 39/50 [00:13<00:02,  3.93it/s] 80%|████████  | 40/50 [00:14<00:02,  3.93it/s] 82%|████████▏ | 41/50 [00:14<00:02,  3.93it/s] 84%|████████▍ | 42/50 [00:14<00:02,  3.93it/s] 86%|████████▌ | 43/50 [00:14<00:01,  3.93it/s] 88%|████████▊ | 44/50 [00:15<00:01,  3.93it/s] 90%|█████████ | 45/50 [00:15<00:01,  3.93it/s] 92%|█████████▏| 46/50 [00:15<00:01,  3.93it/s] 94%|█████████▍| 47/50 [00:15<00:00,  3.92it/s] 96%|█████████▌| 48/50 [00:16<00:00,  3.93it/s] 98%|█████████▊| 49/50 [00:16<00:00,  3.93it/s]100%|██████████| 50/50 [00:20<00:00,  1.48s/it]100%|██████████| 50/50 [00:20<00:00,  2.40it/s]
[I 2023-12-10 23:17:42,173] Trial 236 finished with value: 0.38626007711181215 and parameters: {'EMBEDDING_DIM': 971, 'HIDDEN_DIM': 182, 'NUM_LAYERS': 1, 'DROPOUT': 0.35580107512081727, 'LR': 0.0015946702002986636, 'WEIGHT_0': 0.5807113237228041, 'WEIGHT_1': 0.4235479388464851, 'WEIGHT_2': 0.1818978992009016, 'WEIGHT_3': 0.43734583976304975, 'WEIGHT_4': 0.9042444702770199, 'WEIGHT_5': 0.8387908824999839, 'WEIGHT_6': 0.606073176660145, 'WEIGHT_7': 0.30206153497865434, 'WEIGHT_8': 0.6211491913524646, 'optimizer': 'Adam'}. Best is trial 221 with value: 0.418736930154747.
/userhome/cs2/dingruiw/conda/envs/py310/lib/python3.10/site-packages/torch/nn/modules/rnn.py:82: UserWarning: dropout option adds dropout after all but last recurrent layer, so non-zero dropout expects num_layers greater than 1, but got dropout=0.2756804342008252 and num_layers=1
  warnings.warn("dropout option adds dropout after all but last "
{'EMBEDDING_DIM': 971, 'HIDDEN_DIM': 182, 'NUM_LAYERS': 1, 'DROPOUT': 0.35580107512081727, 'LR': 0.0015946702002986636, 'WEIGHT_0': 0.5807113237228041, 'WEIGHT_1': 0.4235479388464851, 'WEIGHT_2': 0.1818978992009016, 'WEIGHT_3': 0.43734583976304975, 'WEIGHT_4': 0.9042444702770199, 'WEIGHT_5': 0.8387908824999839, 'WEIGHT_6': 0.606073176660145, 'WEIGHT_7': 0.30206153497865434, 'WEIGHT_8': 0.6211491913524646, 'optimizer': 'Adam'}
0
              precision    recall  f1-score   support

         LOC       0.05      0.13      0.07      1837
        MISC       0.02      0.05      0.03       922
         ORG       0.02      0.08      0.04      1341
         PER       0.04      0.06      0.05      1842

   micro avg       0.03      0.09      0.05      5942
   macro avg       0.03      0.08      0.04      5942
weighted avg       0.03      0.09      0.05      5942

{'EMBEDDING_DIM': 971, 'HIDDEN_DIM': 182, 'NUM_LAYERS': 1, 'DROPOUT': 0.35580107512081727, 'LR': 0.0015946702002986636, 'WEIGHT_0': 0.5807113237228041, 'WEIGHT_1': 0.4235479388464851, 'WEIGHT_2': 0.1818978992009016, 'WEIGHT_3': 0.43734583976304975, 'WEIGHT_4': 0.9042444702770199, 'WEIGHT_5': 0.8387908824999839, 'WEIGHT_6': 0.606073176660145, 'WEIGHT_7': 0.30206153497865434, 'WEIGHT_8': 0.6211491913524646, 'optimizer': 'Adam'}
49
              precision    recall  f1-score   support

         LOC       0.54      0.58      0.56      1837
        MISC       0.52      0.22      0.31       922
         ORG       0.27      0.22      0.25      1341
         PER       0.32      0.35      0.33      1842

   micro avg       0.40      0.37      0.39      5942
   macro avg       0.41      0.34      0.36      5942
weighted avg       0.41      0.37      0.38      5942

epoch 49
LSTM
  0%|          | 0/50 [00:00<?, ?it/s]  2%|▏         | 1/50 [00:04<03:55,  4.81s/it]  4%|▍         | 2/50 [00:04<01:38,  2.04s/it]  6%|▌         | 3/50 [00:05<00:56,  1.20s/it]  8%|▊         | 4/50 [00:05<00:36,  1.25it/s] 10%|█         | 5/50 [00:05<00:26,  1.72it/s] 12%|█▏        | 6/50 [00:05<00:19,  2.23it/s] 14%|█▍        | 7/50 [00:05<00:15,  2.75it/s] 16%|█▌        | 8/50 [00:06<00:12,  3.24it/s] 18%|█▊        | 9/50 [00:06<00:11,  3.68it/s] 20%|██        | 10/50 [00:06<00:09,  4.05it/s] 22%|██▏       | 11/50 [00:06<00:08,  4.36it/s] 24%|██▍       | 12/50 [00:06<00:08,  4.60it/s] 26%|██▌       | 13/50 [00:07<00:07,  4.79it/s] 28%|██▊       | 14/50 [00:07<00:07,  4.93it/s] 30%|███       | 15/50 [00:07<00:06,  5.02it/s] 32%|███▏      | 16/50 [00:07<00:06,  5.10it/s] 34%|███▍      | 17/50 [00:07<00:06,  5.15it/s] 36%|███▌      | 18/50 [00:07<00:06,  5.19it/s] 38%|███▊      | 19/50 [00:08<00:05,  5.22it/s] 40%|████      | 20/50 [00:08<00:05,  5.24it/s] 42%|████▏     | 21/50 [00:08<00:05,  5.25it/s] 44%|████▍     | 22/50 [00:08<00:05,  5.26it/s] 46%|████▌     | 23/50 [00:08<00:05,  5.26it/s] 48%|████▊     | 24/50 [00:09<00:04,  5.27it/s] 50%|█████     | 25/50 [00:09<00:04,  5.27it/s] 52%|█████▏    | 26/50 [00:09<00:04,  5.27it/s] 54%|█████▍    | 27/50 [00:09<00:04,  5.27it/s] 56%|█████▌    | 28/50 [00:09<00:04,  5.27it/s] 58%|█████▊    | 29/50 [00:10<00:03,  5.27it/s] 60%|██████    | 30/50 [00:10<00:03,  5.27it/s] 62%|██████▏   | 31/50 [00:10<00:03,  5.27it/s] 64%|██████▍   | 32/50 [00:10<00:03,  5.27it/s] 66%|██████▌   | 33/50 [00:10<00:03,  5.27it/s] 68%|██████▊   | 34/50 [00:10<00:03,  5.28it/s] 70%|███████   | 35/50 [00:11<00:02,  5.27it/s] 72%|███████▏  | 36/50 [00:11<00:02,  5.27it/s] 74%|███████▍  | 37/50 [00:11<00:02,  5.27it/s] 76%|███████▌  | 38/50 [00:11<00:02,  5.27it/s] 78%|███████▊  | 39/50 [00:11<00:02,  5.26it/s] 80%|████████  | 40/50 [00:12<00:01,  5.28it/s] 82%|████████▏ | 41/50 [00:12<00:01,  5.27it/s] 84%|████████▍ | 42/50 [00:12<00:01,  5.27it/s] 86%|████████▌ | 43/50 [00:12<00:01,  5.27it/s] 88%|████████▊ | 44/50 [00:12<00:01,  5.26it/s] 90%|█████████ | 45/50 [00:13<00:00,  5.27it/s] 92%|█████████▏| 46/50 [00:13<00:00,  5.26it/s] 94%|█████████▍| 47/50 [00:13<00:00,  5.26it/s] 96%|█████████▌| 48/50 [00:13<00:00,  5.27it/s] 98%|█████████▊| 49/50 [00:13<00:00,  5.27it/s]100%|██████████| 50/50 [00:18<00:00,  1.58s/it]100%|██████████| 50/50 [00:18<00:00,  2.68it/s]
