[I 2023-12-11 00:09:45,110] Trial 345 finished with value: 0.40047716428084523 and parameters: {'EMBEDDING_DIM': 906, 'HIDDEN_DIM': 370, 'NUM_LAYERS': 1, 'DROPOUT': 0.07548029197567718, 'LR': 0.001870385398894613, 'WEIGHT_0': 0.5511543823737726, 'WEIGHT_1': 0.5067644291253907, 'WEIGHT_2': 0.20002291589927507, 'WEIGHT_3': 0.5255609821018744, 'WEIGHT_4': 0.6893527152709847, 'WEIGHT_5': 0.5751308482110721, 'WEIGHT_6': 0.6272527471396528, 'WEIGHT_7': 0.33257675630720124, 'WEIGHT_8': 0.9031773106433887, 'optimizer': 'RMSprop'}. Best is trial 221 with value: 0.418736930154747.
/userhome/cs2/dingruiw/conda/envs/py310/lib/python3.10/site-packages/torch/nn/modules/rnn.py:82: UserWarning: dropout option adds dropout after all but last recurrent layer, so non-zero dropout expects num_layers greater than 1, but got dropout=0.14501201366759248 and num_layers=1
  warnings.warn("dropout option adds dropout after all but last "
{'EMBEDDING_DIM': 906, 'HIDDEN_DIM': 370, 'NUM_LAYERS': 1, 'DROPOUT': 0.07548029197567718, 'LR': 0.001870385398894613, 'WEIGHT_0': 0.5511543823737726, 'WEIGHT_1': 0.5067644291253907, 'WEIGHT_2': 0.20002291589927507, 'WEIGHT_3': 0.5255609821018744, 'WEIGHT_4': 0.6893527152709847, 'WEIGHT_5': 0.5751308482110721, 'WEIGHT_6': 0.6272527471396528, 'WEIGHT_7': 0.33257675630720124, 'WEIGHT_8': 0.9031773106433887, 'optimizer': 'RMSprop'}
0
              precision    recall  f1-score   support

         LOC       0.16      0.03      0.06      1837
        MISC       0.01      0.00      0.00       922
         ORG       0.11      0.06      0.07      1341
         PER       0.10      0.01      0.02      1842

   micro avg       0.11      0.03      0.04      5942
   macro avg       0.10      0.02      0.04      5942
weighted avg       0.11      0.03      0.04      5942

{'EMBEDDING_DIM': 906, 'HIDDEN_DIM': 370, 'NUM_LAYERS': 1, 'DROPOUT': 0.07548029197567718, 'LR': 0.001870385398894613, 'WEIGHT_0': 0.5511543823737726, 'WEIGHT_1': 0.5067644291253907, 'WEIGHT_2': 0.20002291589927507, 'WEIGHT_3': 0.5255609821018744, 'WEIGHT_4': 0.6893527152709847, 'WEIGHT_5': 0.5751308482110721, 'WEIGHT_6': 0.6272527471396528, 'WEIGHT_7': 0.33257675630720124, 'WEIGHT_8': 0.9031773106433887, 'optimizer': 'RMSprop'}
49
              precision    recall  f1-score   support

         LOC       0.56      0.54      0.55      1837
        MISC       0.45      0.42      0.44       922
         ORG       0.30      0.26      0.28      1341
         PER       0.31      0.34      0.32      1842

   micro avg       0.41      0.40      0.40      5942
   macro avg       0.41      0.39      0.40      5942
weighted avg       0.41      0.40      0.40      5942

epoch 49
LSTM
  0%|          | 0/50 [00:00<?, ?it/s]  2%|▏         | 1/50 [00:04<03:57,  4.85s/it]  4%|▍         | 2/50 [00:05<01:41,  2.12s/it]  6%|▌         | 3/50 [00:05<01:02,  1.33s/it]  8%|▊         | 4/50 [00:05<00:44,  1.05it/s] 10%|█         | 5/50 [00:06<00:33,  1.33it/s] 12%|█▏        | 6/50 [00:06<00:27,  1.59it/s] 14%|█▍        | 7/50 [00:07<00:23,  1.82it/s] 16%|█▌        | 8/50 [00:07<00:20,  2.00it/s] 18%|█▊        | 9/50 [00:07<00:19,  2.15it/s] 20%|██        | 10/50 [00:08<00:17,  2.26it/s] 22%|██▏       | 11/50 [00:08<00:16,  2.35it/s] 24%|██▍       | 12/50 [00:08<00:15,  2.41it/s] 26%|██▌       | 13/50 [00:09<00:15,  2.46it/s] 28%|██▊       | 14/50 [00:09<00:14,  2.49it/s] 30%|███       | 15/50 [00:10<00:13,  2.51it/s] 32%|███▏      | 16/50 [00:10<00:13,  2.52it/s] 34%|███▍      | 17/50 [00:10<00:13,  2.53it/s] 36%|███▌      | 18/50 [00:11<00:12,  2.54it/s] 38%|███▊      | 19/50 [00:11<00:12,  2.54it/s] 40%|████      | 20/50 [00:12<00:11,  2.55it/s] 42%|████▏     | 21/50 [00:12<00:11,  2.54it/s] 44%|████▍     | 22/50 [00:12<00:11,  2.55it/s] 46%|████▌     | 23/50 [00:13<00:10,  2.55it/s] 48%|████▊     | 24/50 [00:13<00:10,  2.54it/s] 50%|█████     | 25/50 [00:14<00:09,  2.54it/s] 52%|█████▏    | 26/50 [00:14<00:09,  2.54it/s] 54%|█████▍    | 27/50 [00:14<00:09,  2.54it/s] 56%|█████▌    | 28/50 [00:15<00:08,  2.55it/s] 58%|█████▊    | 29/50 [00:15<00:08,  2.55it/s] 60%|██████    | 30/50 [00:16<00:07,  2.54it/s] 62%|██████▏   | 31/50 [00:16<00:07,  2.54it/s] 64%|██████▍   | 32/50 [00:16<00:07,  2.54it/s] 66%|██████▌   | 33/50 [00:17<00:06,  2.54it/s] 68%|██████▊   | 34/50 [00:17<00:06,  2.54it/s] 70%|███████   | 35/50 [00:17<00:05,  2.54it/s] 72%|███████▏  | 36/50 [00:18<00:05,  2.54it/s] 74%|███████▍  | 37/50 [00:18<00:05,  2.53it/s] 76%|███████▌  | 38/50 [00:19<00:04,  2.54it/s] 78%|███████▊  | 39/50 [00:19<00:04,  2.53it/s] 80%|████████  | 40/50 [00:19<00:03,  2.54it/s] 82%|████████▏ | 41/50 [00:20<00:03,  2.53it/s] 84%|████████▍ | 42/50 [00:20<00:03,  2.53it/s] 86%|████████▌ | 43/50 [00:21<00:02,  2.53it/s] 88%|████████▊ | 44/50 [00:21<00:02,  2.53it/s] 90%|█████████ | 45/50 [00:21<00:01,  2.53it/s] 92%|█████████▏| 46/50 [00:22<00:01,  2.53it/s] 94%|█████████▍| 47/50 [00:22<00:01,  2.53it/s] 96%|█████████▌| 48/50 [00:23<00:00,  2.53it/s] 98%|█████████▊| 49/50 [00:23<00:00,  2.53it/s]100%|██████████| 50/50 [00:28<00:00,  1.75s/it]100%|██████████| 50/50 [00:28<00:00,  1.76it/s]
[I 2023-12-11 00:10:17,767] Trial 346 finished with value: 0.2996288585136236 and parameters: {'EMBEDDING_DIM': 990, 'HIDDEN_DIM': 553, 'NUM_LAYERS': 1, 'DROPOUT': 0.14501201366759248, 'LR': 0.001235501121539898, 'WEIGHT_0': 0.4435275846346129, 'WEIGHT_1': 0.4808191724489639, 'WEIGHT_2': 0.5542158389020847, 'WEIGHT_3': 0.5579267980393271, 'WEIGHT_4': 0.9039020867302104, 'WEIGHT_5': 0.010909717976967492, 'WEIGHT_6': 0.759123836792706, 'WEIGHT_7': 0.8374354184683527, 'WEIGHT_8': 0.8864538458400849, 'optimizer': 'RMSprop'}. Best is trial 221 with value: 0.418736930154747.
/userhome/cs2/dingruiw/conda/envs/py310/lib/python3.10/site-packages/torch/nn/modules/rnn.py:82: UserWarning: dropout option adds dropout after all but last recurrent layer, so non-zero dropout expects num_layers greater than 1, but got dropout=0.04956423921077045 and num_layers=1
  warnings.warn("dropout option adds dropout after all but last "
{'EMBEDDING_DIM': 990, 'HIDDEN_DIM': 553, 'NUM_LAYERS': 1, 'DROPOUT': 0.14501201366759248, 'LR': 0.001235501121539898, 'WEIGHT_0': 0.4435275846346129, 'WEIGHT_1': 0.4808191724489639, 'WEIGHT_2': 0.5542158389020847, 'WEIGHT_3': 0.5579267980393271, 'WEIGHT_4': 0.9039020867302104, 'WEIGHT_5': 0.010909717976967492, 'WEIGHT_6': 0.759123836792706, 'WEIGHT_7': 0.8374354184683527, 'WEIGHT_8': 0.8864538458400849, 'optimizer': 'RMSprop'}
0
              precision    recall  f1-score   support

         LOC       0.09      0.02      0.04      1837
        MISC       0.03      0.02      0.03       922
         ORG       0.12      0.03      0.05      1341
         PER       0.07      0.02      0.03      1842

   micro avg       0.07      0.02      0.04      5942
   macro avg       0.08      0.03      0.04      5942
weighted avg       0.08      0.02      0.04      5942

{'EMBEDDING_DIM': 990, 'HIDDEN_DIM': 553, 'NUM_LAYERS': 1, 'DROPOUT': 0.14501201366759248, 'LR': 0.001235501121539898, 'WEIGHT_0': 0.4435275846346129, 'WEIGHT_1': 0.4808191724489639, 'WEIGHT_2': 0.5542158389020847, 'WEIGHT_3': 0.5579267980393271, 'WEIGHT_4': 0.9039020867302104, 'WEIGHT_5': 0.010909717976967492, 'WEIGHT_6': 0.759123836792706, 'WEIGHT_7': 0.8374354184683527, 'WEIGHT_8': 0.8864538458400849, 'optimizer': 'RMSprop'}
49
              precision    recall  f1-score   support

         LOC       0.61      0.15      0.24      1837
        MISC       0.36      0.42      0.39       922
         ORG       0.25      0.27      0.26      1341
         PER       0.29      0.34      0.31      1842

   micro avg       0.32      0.28      0.30      5942
   macro avg       0.38      0.30      0.30      5942
weighted avg       0.39      0.28      0.29      5942

epoch 49
LSTM
  0%|          | 0/50 [00:00<?, ?it/s]  2%|▏         | 1/50 [00:04<03:49,  4.68s/it]  4%|▍         | 2/50 [00:04<01:36,  2.01s/it]  6%|▌         | 3/50 [00:05<00:56,  1.21s/it]  8%|▊         | 4/50 [00:05<00:38,  1.19it/s] 10%|█         | 5/50 [00:05<00:28,  1.59it/s] 12%|█▏        | 6/50 [00:05<00:22,  1.98it/s] 14%|█▍        | 7/50 [00:06<00:18,  2.34it/s] 16%|█▌        | 8/50 [00:06<00:15,  2.66it/s] 18%|█▊        | 9/50 [00:06<00:13,  2.93it/s] 20%|██        | 10/50 [00:06<00:12,  3.15it/s] 22%|██▏       | 11/50 [00:07<00:11,  3.31it/s] 24%|██▍       | 12/50 [00:07<00:11,  3.44it/s] 26%|██▌       | 13/50 [00:07<00:10,  3.53it/s] 28%|██▊       | 14/50 [00:07<00:10,  3.60it/s] 30%|███       | 15/50 [00:08<00:09,  3.64it/s] 32%|███▏      | 16/50 [00:08<00:09,  3.68it/s] 34%|███▍      | 17/50 [00:08<00:08,  3.70it/s] 36%|███▌      | 18/50 [00:09<00:08,  3.72it/s] 38%|███▊      | 19/50 [00:09<00:08,  3.73it/s] 40%|████      | 20/50 [00:09<00:08,  3.74it/s] 42%|████▏     | 21/50 [00:09<00:07,  3.74it/s] 44%|████▍     | 22/50 [00:10<00:07,  3.75it/s] 46%|████▌     | 23/50 [00:10<00:07,  3.75it/s] 48%|████▊     | 24/50 [00:10<00:06,  3.75it/s] 50%|█████     | 25/50 [00:10<00:06,  3.75it/s] 52%|█████▏    | 26/50 [00:11<00:06,  3.75it/s] 54%|█████▍    | 27/50 [00:11<00:06,  3.75it/s] 56%|█████▌    | 28/50 [00:11<00:05,  3.75it/s] 58%|█████▊    | 29/50 [00:11<00:05,  3.75it/s] 60%|██████    | 30/50 [00:12<00:05,  3.75it/s] 62%|██████▏   | 31/50 [00:12<00:05,  3.75it/s] 64%|██████▍   | 32/50 [00:12<00:04,  3.75it/s] 66%|██████▌   | 33/50 [00:13<00:04,  3.75it/s] 68%|██████▊   | 34/50 [00:13<00:04,  3.75it/s] 70%|███████   | 35/50 [00:13<00:03,  3.75it/s] 72%|███████▏  | 36/50 [00:13<00:03,  3.75it/s] 74%|███████▍  | 37/50 [00:14<00:03,  3.75it/s] 76%|███████▌  | 38/50 [00:14<00:03,  3.75it/s] 78%|███████▊  | 39/50 [00:14<00:02,  3.75it/s] 80%|████████  | 40/50 [00:14<00:02,  3.75it/s] 82%|████████▏ | 41/50 [00:15<00:02,  3.75it/s] 84%|████████▍ | 42/50 [00:15<00:02,  3.75it/s] 86%|████████▌ | 43/50 [00:15<00:01,  3.75it/s] 88%|████████▊ | 44/50 [00:15<00:01,  3.74it/s] 90%|█████████ | 45/50 [00:16<00:01,  3.74it/s] 92%|█████████▏| 46/50 [00:16<00:01,  3.74it/s] 94%|█████████▍| 47/50 [00:16<00:00,  3.74it/s] 96%|█████████▌| 48/50 [00:17<00:00,  3.74it/s] 98%|█████████▊| 49/50 [00:17<00:00,  3.74it/s]100%|██████████| 50/50 [00:22<00:00,  1.63s/it]100%|██████████| 50/50 [00:22<00:00,  2.26it/s]
[I 2023-12-11 00:10:44,161] Trial 347 finished with value: 0.41338582677165353 and parameters: {'EMBEDDING_DIM': 943, 'HIDDEN_DIM': 406, 'NUM_LAYERS': 1, 'DROPOUT': 0.04956423921077045, 'LR': 0.0025880872426142687, 'WEIGHT_0': 0.24164566781133529, 'WEIGHT_1': 0.5154416712660609, 'WEIGHT_2': 0.3795508977392224, 'WEIGHT_3': 0.7783158590042003, 'WEIGHT_4': 0.7624756981541503, 'WEIGHT_5': 0.4886391522090344, 'WEIGHT_6': 0.713991853148008, 'WEIGHT_7': 0.26033208358411375, 'WEIGHT_8': 0.9228860526776894, 'optimizer': 'RMSprop'}. Best is trial 221 with value: 0.418736930154747.
{'EMBEDDING_DIM': 943, 'HIDDEN_DIM': 406, 'NUM_LAYERS': 1, 'DROPOUT': 0.04956423921077045, 'LR': 0.0025880872426142687, 'WEIGHT_0': 0.24164566781133529, 'WEIGHT_1': 0.5154416712660609, 'WEIGHT_2': 0.3795508977392224, 'WEIGHT_3': 0.7783158590042003, 'WEIGHT_4': 0.7624756981541503, 'WEIGHT_5': 0.4886391522090344, 'WEIGHT_6': 0.713991853148008, 'WEIGHT_7': 0.26033208358411375, 'WEIGHT_8': 0.9228860526776894, 'optimizer': 'RMSprop'}
0
              precision    recall  f1-score   support

         LOC       0.26      0.10      0.15      1837
        MISC       0.09      0.02      0.03       922
         ORG       0.17      0.03      0.05      1341
         PER       0.03      0.02      0.02      1842

   micro avg       0.13      0.05      0.07      5942
   macro avg       0.14      0.04      0.06      5942
weighted avg       0.14      0.05      0.07      5942

{'EMBEDDING_DIM': 943, 'HIDDEN_DIM': 406, 'NUM_LAYERS': 1, 'DROPOUT': 0.04956423921077045, 'LR': 0.0025880872426142687, 'WEIGHT_0': 0.24164566781133529, 'WEIGHT_1': 0.5154416712660609, 'WEIGHT_2': 0.3795508977392224, 'WEIGHT_3': 0.7783158590042003, 'WEIGHT_4': 0.7624756981541503, 'WEIGHT_5': 0.4886391522090344, 'WEIGHT_6': 0.713991853148008, 'WEIGHT_7': 0.26033208358411375, 'WEIGHT_8': 0.9228860526776894, 'optimizer': 'RMSprop'}
49
              precision    recall  f1-score   support

         LOC       0.61      0.53      0.57      1837
        MISC       0.45      0.41      0.43       922
         ORG       0.29      0.25      0.27      1341
         PER       0.38      0.34      0.36      1842

   micro avg       0.44      0.39      0.41      5942
   macro avg       0.43      0.38      0.41      5942
weighted avg       0.44      0.39      0.41      5942

epoch 49
LSTM
  0%|          | 0/50 [00:00<?, ?it/s]  2%|▏         | 1/50 [00:06<05:40,  6.96s/it]  4%|▍         | 2/50 [00:07<02:27,  3.07s/it]  6%|▌         | 3/50 [00:08<01:33,  1.99s/it]  8%|▊         | 4/50 [00:08<01:08,  1.49s/it] 10%|█         | 5/50 [00:09<00:54,  1.21s/it] 12%|█▏        | 6/50 [00:10<00:45,  1.04s/it] 14%|█▍        | 7/50 [00:10<00:39,  1.08it/s] 16%|█▌        | 8/50 [00:11<00:36,  1.16it/s] 18%|█▊        | 9/50 [00:12<00:33,  1.23it/s] 20%|██        | 10/50 [00:12<00:31,  1.28it/s] 22%|██▏       | 11/50 [00:13<00:29,  1.32it/s] 24%|██▍       | 12/50 [00:14<00:28,  1.34it/s] 26%|██▌       | 13/50 [00:15<00:27,  1.36it/s] 28%|██▊       | 14/50 [00:15<00:26,  1.37it/s] 30%|███       | 15/50 [00:16<00:25,  1.38it/s] 32%|███▏      | 16/50 [00:17<00:24,  1.39it/s] 34%|███▍      | 17/50 [00:17<00:23,  1.39it/s] 36%|███▌      | 18/50 [00:18<00:22,  1.40it/s] 38%|███▊      | 19/50 [00:19<00:22,  1.40it/s] 40%|████      | 20/50 [00:20<00:21,  1.40it/s] 42%|████▏     | 21/50 [00:20<00:20,  1.40it/s] 44%|████▍     | 22/50 [00:21<00:19,  1.40it/s] 46%|████▌     | 23/50 [00:22<00:19,  1.40it/s] 48%|████▊     | 24/50 [00:22<00:18,  1.40it/s] 50%|█████     | 25/50 [00:23<00:17,  1.40it/s] 52%|█████▏    | 26/50 [00:24<00:17,  1.40it/s] 54%|█████▍    | 27/50 [00:25<00:16,  1.40it/s] 56%|█████▌    | 28/50 [00:25<00:15,  1.40it/s] 58%|█████▊    | 29/50 [00:26<00:15,  1.40it/s] 60%|██████    | 30/50 [00:27<00:14,  1.40it/s] 62%|██████▏   | 31/50 [00:27<00:13,  1.40it/s] 64%|██████▍   | 32/50 [00:28<00:12,  1.40it/s] 66%|██████▌   | 33/50 [00:29<00:12,  1.40it/s] 68%|██████▊   | 34/50 [00:30<00:11,  1.40it/s] 70%|███████   | 35/50 [00:30<00:10,  1.39it/s] 72%|███████▏  | 36/50 [00:31<00:10,  1.39it/s] 74%|███████▍  | 37/50 [00:32<00:09,  1.39it/s] 76%|███████▌  | 38/50 [00:32<00:08,  1.39it/s] 78%|███████▊  | 39/50 [00:33<00:07,  1.39it/s] 80%|████████  | 40/50 [00:34<00:07,  1.39it/s] 82%|████████▏ | 41/50 [00:35<00:06,  1.39it/s] 84%|████████▍ | 42/50 [00:35<00:05,  1.39it/s] 86%|████████▌ | 43/50 [00:36<00:05,  1.39it/s] 88%|████████▊ | 44/50 [00:37<00:04,  1.39it/s] 90%|█████████ | 45/50 [00:38<00:03,  1.39it/s] 92%|█████████▏| 46/50 [00:38<00:02,  1.39it/s] 94%|█████████▍| 47/50 [00:39<00:02,  1.39it/s] 96%|█████████▌| 48/50 [00:40<00:01,  1.39it/s] 98%|█████████▊| 49/50 [00:40<00:00,  1.39it/s]100%|██████████| 50/50 [00:48<00:00,  2.71s/it]100%|██████████| 50/50 [00:48<00:00,  1.04it/s]
[I 2023-12-11 00:11:38,530] Trial 348 finished with value: 0.10637381567614126 and parameters: {'EMBEDDING_DIM': 936, 'HIDDEN_DIM': 416, 'NUM_LAYERS': 4, 'DROPOUT': 0.05258839804199243, 'LR': 0.002698639929425291, 'WEIGHT_0': 0.21757687529313152, 'WEIGHT_1': 0.5180647793831282, 'WEIGHT_2': 0.3462723590143728, 'WEIGHT_3': 0.7954431692893469, 'WEIGHT_4': 0.763738099671603, 'WEIGHT_5': 0.47977795079700103, 'WEIGHT_6': 0.7174660268867682, 'WEIGHT_7': 0.2702062413169598, 'WEIGHT_8': 0.936837690389878, 'optimizer': 'RMSprop'}. Best is trial 221 with value: 0.418736930154747.
/userhome/cs2/dingruiw/conda/envs/py310/lib/python3.10/site-packages/torch/nn/modules/rnn.py:82: UserWarning: dropout option adds dropout after all but last recurrent layer, so non-zero dropout expects num_layers greater than 1, but got dropout=0.041595274577397714 and num_layers=1
  warnings.warn("dropout option adds dropout after all but last "
{'EMBEDDING_DIM': 936, 'HIDDEN_DIM': 416, 'NUM_LAYERS': 4, 'DROPOUT': 0.05258839804199243, 'LR': 0.002698639929425291, 'WEIGHT_0': 0.21757687529313152, 'WEIGHT_1': 0.5180647793831282, 'WEIGHT_2': 0.3462723590143728, 'WEIGHT_3': 0.7954431692893469, 'WEIGHT_4': 0.763738099671603, 'WEIGHT_5': 0.47977795079700103, 'WEIGHT_6': 0.7174660268867682, 'WEIGHT_7': 0.2702062413169598, 'WEIGHT_8': 0.936837690389878, 'optimizer': 'RMSprop'}
0
              precision    recall  f1-score   support

         LOC       0.06      0.00      0.01      1837
        MISC       0.00      0.00      0.00       922
         ORG       0.00      0.00      0.00      1341
         PER       0.06      0.00      0.01      1842

   micro avg       0.06      0.00      0.00      5942
   macro avg       0.03      0.00      0.00      5942
weighted avg       0.04      0.00      0.00      5942

{'EMBEDDING_DIM': 936, 'HIDDEN_DIM': 416, 'NUM_LAYERS': 4, 'DROPOUT': 0.05258839804199243, 'LR': 0.002698639929425291, 'WEIGHT_0': 0.21757687529313152, 'WEIGHT_1': 0.5180647793831282, 'WEIGHT_2': 0.3462723590143728, 'WEIGHT_3': 0.7954431692893469, 'WEIGHT_4': 0.763738099671603, 'WEIGHT_5': 0.47977795079700103, 'WEIGHT_6': 0.7174660268867682, 'WEIGHT_7': 0.2702062413169598, 'WEIGHT_8': 0.936837690389878, 'optimizer': 'RMSprop'}
49
              precision    recall  f1-score   support

         LOC       0.24      0.10      0.14      1837
        MISC       0.00      0.00      0.00       922
         ORG       0.19      0.15      0.17      1341
         PER       0.07      0.05      0.06      1842

   micro avg       0.15      0.08      0.11      5942
   macro avg       0.13      0.08      0.09      5942
weighted avg       0.14      0.08      0.10      5942

epoch 49
LSTM
  0%|          | 0/50 [00:00<?, ?it/s]  2%|▏         | 1/50 [00:04<03:56,  4.83s/it]  4%|▍         | 2/50 [00:04<01:39,  2.06s/it]  6%|▌         | 3/50 [00:05<00:57,  1.23s/it]  8%|▊         | 4/50 [00:05<00:38,  1.20it/s] 10%|█         | 5/50 [00:05<00:27,  1.62it/s] 12%|█▏        | 6/50 [00:05<00:21,  2.06it/s] 14%|█▍        | 7/50 [00:06<00:17,  2.48it/s] 16%|█▌        | 8/50 [00:06<00:14,  2.87it/s] 18%|█▊        | 9/50 [00:06<00:12,  3.20it/s] 20%|██        | 10/50 [00:06<00:11,  3.48it/s] 22%|██▏       | 11/50 [00:07<00:10,  3.70it/s] 24%|██▍       | 12/50 [00:07<00:09,  3.87it/s] 26%|██▌       | 13/50 [00:07<00:09,  3.99it/s] 28%|██▊       | 14/50 [00:07<00:08,  4.08it/s] 30%|███       | 15/50 [00:07<00:08,  4.15it/s] 32%|███▏      | 16/50 [00:08<00:08,  4.19it/s] 34%|███▍      | 17/50 [00:08<00:07,  4.23it/s] 36%|███▌      | 18/50 [00:08<00:07,  4.25it/s] 38%|███▊      | 19/50 [00:08<00:07,  4.27it/s] 40%|████      | 20/50 [00:09<00:07,  4.28it/s] 42%|████▏     | 21/50 [00:09<00:06,  4.29it/s] 44%|████▍     | 22/50 [00:09<00:06,  4.28it/s] 46%|████▌     | 23/50 [00:09<00:06,  4.29it/s] 48%|████▊     | 24/50 [00:10<00:06,  4.28it/s] 50%|█████     | 25/50 [00:10<00:05,  4.29it/s] 52%|█████▏    | 26/50 [00:10<00:05,  4.29it/s] 54%|█████▍    | 27/50 [00:10<00:05,  4.29it/s] 56%|█████▌    | 28/50 [00:10<00:05,  4.29it/s] 58%|█████▊    | 29/50 [00:11<00:04,  4.29it/s] 60%|██████    | 30/50 [00:11<00:04,  4.29it/s] 62%|██████▏   | 31/50 [00:11<00:04,  4.29it/s] 64%|██████▍   | 32/50 [00:11<00:04,  4.30it/s] 66%|██████▌   | 33/50 [00:12<00:03,  4.30it/s] 68%|██████▊   | 34/50 [00:12<00:03,  4.30it/s] 70%|███████   | 35/50 [00:12<00:03,  4.30it/s] 72%|███████▏  | 36/50 [00:12<00:03,  4.29it/s] 74%|███████▍  | 37/50 [00:13<00:03,  4.29it/s] 76%|███████▌  | 38/50 [00:13<00:02,  4.29it/s] 78%|███████▊  | 39/50 [00:13<00:02,  4.29it/s] 80%|████████  | 40/50 [00:13<00:02,  4.29it/s] 82%|████████▏ | 41/50 [00:14<00:02,  4.29it/s] 84%|████████▍ | 42/50 [00:14<00:01,  4.29it/s] 86%|████████▌ | 43/50 [00:14<00:01,  4.29it/s] 88%|████████▊ | 44/50 [00:14<00:01,  4.29it/s] 90%|█████████ | 45/50 [00:14<00:01,  4.29it/s] 92%|█████████▏| 46/50 [00:15<00:00,  4.29it/s] 94%|█████████▍| 47/50 [00:15<00:00,  4.29it/s] 96%|█████████▌| 48/50 [00:15<00:00,  4.28it/s] 98%|█████████▊| 49/50 [00:15<00:00,  4.29it/s]100%|██████████| 50/50 [00:20<00:00,  1.66s/it]100%|██████████| 50/50 [00:20<00:00,  2.39it/s]
