[I 2023-12-10 22:31:25,031] Trial 141 finished with value: 0.3945191313340228 and parameters: {'EMBEDDING_DIM': 979, 'HIDDEN_DIM': 254, 'NUM_LAYERS': 1, 'DROPOUT': 0.3433514586983081, 'LR': 0.003208609687316338, 'WEIGHT_0': 0.47722258108964233, 'WEIGHT_1': 0.7310203616295448, 'WEIGHT_2': 0.6697847615331547, 'WEIGHT_3': 0.904681438261565, 'WEIGHT_4': 0.9075188220069342, 'WEIGHT_5': 0.48009604262008265, 'WEIGHT_6': 0.8202118829937798, 'WEIGHT_7': 0.44136621493242995, 'WEIGHT_8': 0.44843181888781936, 'optimizer': 'RMSprop'}. Best is trial 134 with value: 0.4158467115484205.
/userhome/cs2/dingruiw/conda/envs/py310/lib/python3.10/site-packages/torch/nn/modules/rnn.py:82: UserWarning: dropout option adds dropout after all but last recurrent layer, so non-zero dropout expects num_layers greater than 1, but got dropout=0.3693554065230803 and num_layers=1
  warnings.warn("dropout option adds dropout after all but last "
{'EMBEDDING_DIM': 979, 'HIDDEN_DIM': 254, 'NUM_LAYERS': 1, 'DROPOUT': 0.3433514586983081, 'LR': 0.003208609687316338, 'WEIGHT_0': 0.47722258108964233, 'WEIGHT_1': 0.7310203616295448, 'WEIGHT_2': 0.6697847615331547, 'WEIGHT_3': 0.904681438261565, 'WEIGHT_4': 0.9075188220069342, 'WEIGHT_5': 0.48009604262008265, 'WEIGHT_6': 0.8202118829937798, 'WEIGHT_7': 0.44136621493242995, 'WEIGHT_8': 0.44843181888781936, 'optimizer': 'RMSprop'}
0
              precision    recall  f1-score   support

         LOC       0.12      0.03      0.04      1837
        MISC       0.06      0.02      0.03       922
         ORG       0.08      0.01      0.01      1341
         PER       0.09      0.03      0.04      1842

   micro avg       0.09      0.02      0.03      5942
   macro avg       0.09      0.02      0.03      5942
weighted avg       0.09      0.02      0.03      5942

{'EMBEDDING_DIM': 979, 'HIDDEN_DIM': 254, 'NUM_LAYERS': 1, 'DROPOUT': 0.3433514586983081, 'LR': 0.003208609687316338, 'WEIGHT_0': 0.47722258108964233, 'WEIGHT_1': 0.7310203616295448, 'WEIGHT_2': 0.6697847615331547, 'WEIGHT_3': 0.904681438261565, 'WEIGHT_4': 0.9075188220069342, 'WEIGHT_5': 0.48009604262008265, 'WEIGHT_6': 0.8202118829937798, 'WEIGHT_7': 0.44136621493242995, 'WEIGHT_8': 0.44843181888781936, 'optimizer': 'RMSprop'}
49
              precision    recall  f1-score   support

         LOC       0.61      0.52      0.56      1837
        MISC       0.41      0.42      0.41       922
         ORG       0.27      0.25      0.26      1341
         PER       0.32      0.33      0.33      1842

   micro avg       0.40      0.39      0.39      5942
   macro avg       0.40      0.38      0.39      5942
weighted avg       0.41      0.39      0.40      5942

epoch 49
LSTM
  0%|          | 0/50 [00:00<?, ?it/s]  2%|▏         | 1/50 [00:04<03:52,  4.74s/it]  4%|▍         | 2/50 [00:04<01:37,  2.03s/it]  6%|▌         | 3/50 [00:05<00:57,  1.22s/it]  8%|▊         | 4/50 [00:05<00:38,  1.20it/s] 10%|█         | 5/50 [00:05<00:27,  1.61it/s] 12%|█▏        | 6/50 [00:05<00:21,  2.02it/s] 14%|█▍        | 7/50 [00:06<00:17,  2.43it/s] 16%|█▌        | 8/50 [00:06<00:15,  2.79it/s] 18%|█▊        | 9/50 [00:06<00:13,  3.09it/s] 20%|██        | 10/50 [00:06<00:11,  3.35it/s] 22%|██▏       | 11/50 [00:07<00:11,  3.54it/s] 24%|██▍       | 12/50 [00:07<00:10,  3.69it/s] 26%|██▌       | 13/50 [00:07<00:09,  3.80it/s] 28%|██▊       | 14/50 [00:07<00:09,  3.89it/s] 30%|███       | 15/50 [00:08<00:08,  3.95it/s] 32%|███▏      | 16/50 [00:08<00:08,  3.99it/s] 34%|███▍      | 17/50 [00:08<00:08,  4.02it/s] 36%|███▌      | 18/50 [00:08<00:07,  4.04it/s] 38%|███▊      | 19/50 [00:09<00:07,  4.05it/s] 40%|████      | 20/50 [00:09<00:07,  4.07it/s] 42%|████▏     | 21/50 [00:09<00:07,  4.07it/s] 44%|████▍     | 22/50 [00:09<00:06,  4.07it/s] 46%|████▌     | 23/50 [00:10<00:06,  4.08it/s] 48%|████▊     | 24/50 [00:10<00:06,  4.08it/s] 50%|█████     | 25/50 [00:10<00:06,  4.08it/s] 52%|█████▏    | 26/50 [00:10<00:05,  4.08it/s] 54%|█████▍    | 27/50 [00:11<00:05,  4.08it/s] 56%|█████▌    | 28/50 [00:11<00:05,  4.08it/s] 58%|█████▊    | 29/50 [00:11<00:05,  4.08it/s] 60%|██████    | 30/50 [00:11<00:04,  4.09it/s] 62%|██████▏   | 31/50 [00:11<00:04,  4.08it/s] 64%|██████▍   | 32/50 [00:12<00:04,  4.09it/s] 66%|██████▌   | 33/50 [00:12<00:04,  4.09it/s] 68%|██████▊   | 34/50 [00:12<00:03,  4.08it/s] 70%|███████   | 35/50 [00:12<00:03,  4.08it/s] 72%|███████▏  | 36/50 [00:13<00:03,  4.08it/s] 74%|███████▍  | 37/50 [00:13<00:03,  4.08it/s] 76%|███████▌  | 38/50 [00:13<00:02,  4.08it/s] 78%|███████▊  | 39/50 [00:13<00:02,  4.08it/s] 80%|████████  | 40/50 [00:14<00:02,  4.08it/s] 82%|████████▏ | 41/50 [00:14<00:02,  4.07it/s] 84%|████████▍ | 42/50 [00:14<00:01,  4.07it/s] 86%|████████▌ | 43/50 [00:14<00:01,  4.07it/s] 88%|████████▊ | 44/50 [00:15<00:01,  4.08it/s] 90%|█████████ | 45/50 [00:15<00:01,  4.07it/s] 92%|█████████▏| 46/50 [00:15<00:00,  4.07it/s] 94%|█████████▍| 47/50 [00:15<00:00,  4.07it/s] 96%|█████████▌| 48/50 [00:16<00:00,  4.07it/s] 98%|█████████▊| 49/50 [00:16<00:00,  4.07it/s]100%|██████████| 50/50 [00:21<00:00,  1.63s/it]100%|██████████| 50/50 [00:21<00:00,  2.35it/s]
[I 2023-12-10 22:31:50,549] Trial 142 finished with value: 0.38843117061448673 and parameters: {'EMBEDDING_DIM': 1023, 'HIDDEN_DIM': 374, 'NUM_LAYERS': 1, 'DROPOUT': 0.3693554065230803, 'LR': 0.0028062755045193902, 'WEIGHT_0': 0.4268608964572017, 'WEIGHT_1': 0.6833737169066055, 'WEIGHT_2': 0.7427954271719234, 'WEIGHT_3': 0.9596804654498542, 'WEIGHT_4': 0.9648191638324444, 'WEIGHT_5': 0.5052806551748563, 'WEIGHT_6': 0.8511309061722319, 'WEIGHT_7': 0.3903101888022068, 'WEIGHT_8': 0.48214074694539716, 'optimizer': 'RMSprop'}. Best is trial 134 with value: 0.4158467115484205.
/userhome/cs2/dingruiw/conda/envs/py310/lib/python3.10/site-packages/torch/nn/modules/rnn.py:82: UserWarning: dropout option adds dropout after all but last recurrent layer, so non-zero dropout expects num_layers greater than 1, but got dropout=0.3184497539619573 and num_layers=1
  warnings.warn("dropout option adds dropout after all but last "
{'EMBEDDING_DIM': 1023, 'HIDDEN_DIM': 374, 'NUM_LAYERS': 1, 'DROPOUT': 0.3693554065230803, 'LR': 0.0028062755045193902, 'WEIGHT_0': 0.4268608964572017, 'WEIGHT_1': 0.6833737169066055, 'WEIGHT_2': 0.7427954271719234, 'WEIGHT_3': 0.9596804654498542, 'WEIGHT_4': 0.9648191638324444, 'WEIGHT_5': 0.5052806551748563, 'WEIGHT_6': 0.8511309061722319, 'WEIGHT_7': 0.3903101888022068, 'WEIGHT_8': 0.48214074694539716, 'optimizer': 'RMSprop'}
0
              precision    recall  f1-score   support

         LOC       0.34      0.10      0.15      1837
        MISC       0.06      0.02      0.03       922
         ORG       0.15      0.04      0.06      1341
         PER       0.06      0.01      0.02      1842

   micro avg       0.18      0.05      0.07      5942
   macro avg       0.15      0.04      0.07      5942
weighted avg       0.17      0.05      0.07      5942

{'EMBEDDING_DIM': 1023, 'HIDDEN_DIM': 374, 'NUM_LAYERS': 1, 'DROPOUT': 0.3693554065230803, 'LR': 0.0028062755045193902, 'WEIGHT_0': 0.4268608964572017, 'WEIGHT_1': 0.6833737169066055, 'WEIGHT_2': 0.7427954271719234, 'WEIGHT_3': 0.9596804654498542, 'WEIGHT_4': 0.9648191638324444, 'WEIGHT_5': 0.5052806551748563, 'WEIGHT_6': 0.8511309061722319, 'WEIGHT_7': 0.3903101888022068, 'WEIGHT_8': 0.48214074694539716, 'optimizer': 'RMSprop'}
49
              precision    recall  f1-score   support

         LOC       0.60      0.50      0.55      1837
        MISC       0.43      0.40      0.42       922
         ORG       0.29      0.28      0.28      1341
         PER       0.30      0.33      0.31      1842

   micro avg       0.40      0.38      0.39      5942
   macro avg       0.40      0.38      0.39      5942
weighted avg       0.41      0.38      0.39      5942

epoch 49
LSTM
  0%|          | 0/50 [00:00<?, ?it/s]  2%|▏         | 1/50 [00:04<03:53,  4.76s/it]  4%|▍         | 2/50 [00:04<01:37,  2.03s/it]  6%|▌         | 3/50 [00:05<00:56,  1.20s/it]  8%|▊         | 4/50 [00:05<00:37,  1.24it/s] 10%|█         | 5/50 [00:05<00:26,  1.70it/s] 12%|█▏        | 6/50 [00:05<00:20,  2.18it/s] 14%|█▍        | 7/50 [00:05<00:16,  2.66it/s] 16%|█▌        | 8/50 [00:06<00:13,  3.11it/s] 18%|█▊        | 9/50 [00:06<00:11,  3.51it/s] 20%|██        | 10/50 [00:06<00:10,  3.84it/s] 22%|██▏       | 11/50 [00:06<00:09,  4.11it/s] 24%|██▍       | 12/50 [00:06<00:08,  4.32it/s] 26%|██▌       | 13/50 [00:07<00:08,  4.47it/s] 28%|██▊       | 14/50 [00:07<00:07,  4.59it/s] 30%|███       | 15/50 [00:07<00:07,  4.68it/s] 32%|███▏      | 16/50 [00:07<00:07,  4.75it/s] 34%|███▍      | 17/50 [00:07<00:06,  4.78it/s] 36%|███▌      | 18/50 [00:08<00:06,  4.81it/s] 38%|███▊      | 19/50 [00:08<00:06,  4.83it/s] 40%|████      | 20/50 [00:08<00:06,  4.85it/s] 42%|████▏     | 21/50 [00:08<00:05,  4.86it/s] 44%|████▍     | 22/50 [00:08<00:05,  4.87it/s] 46%|████▌     | 23/50 [00:09<00:05,  4.87it/s] 48%|████▊     | 24/50 [00:09<00:05,  4.87it/s] 50%|█████     | 25/50 [00:09<00:05,  4.87it/s] 52%|█████▏    | 26/50 [00:09<00:04,  4.89it/s] 54%|█████▍    | 27/50 [00:09<00:04,  4.90it/s] 56%|█████▌    | 28/50 [00:10<00:04,  4.89it/s] 58%|█████▊    | 29/50 [00:10<00:04,  4.88it/s] 60%|██████    | 30/50 [00:10<00:04,  4.88it/s] 62%|██████▏   | 31/50 [00:10<00:03,  4.88it/s] 64%|██████▍   | 32/50 [00:11<00:03,  4.88it/s] 66%|██████▌   | 33/50 [00:11<00:03,  4.87it/s] 68%|██████▊   | 34/50 [00:11<00:03,  4.88it/s] 70%|███████   | 35/50 [00:11<00:03,  4.87it/s] 72%|███████▏  | 36/50 [00:11<00:02,  4.88it/s] 74%|███████▍  | 37/50 [00:12<00:02,  4.88it/s] 76%|███████▌  | 38/50 [00:12<00:02,  4.88it/s] 78%|███████▊  | 39/50 [00:12<00:02,  4.88it/s] 80%|████████  | 40/50 [00:12<00:02,  4.88it/s] 82%|████████▏ | 41/50 [00:12<00:01,  4.87it/s] 84%|████████▍ | 42/50 [00:13<00:01,  4.87it/s] 86%|████████▌ | 43/50 [00:13<00:01,  4.87it/s] 88%|████████▊ | 44/50 [00:13<00:01,  4.87it/s] 90%|█████████ | 45/50 [00:13<00:01,  4.87it/s] 92%|█████████▏| 46/50 [00:13<00:00,  4.88it/s] 94%|█████████▍| 47/50 [00:14<00:00,  4.88it/s] 96%|█████████▌| 48/50 [00:14<00:00,  4.87it/s] 98%|█████████▊| 49/50 [00:14<00:00,  4.87it/s]100%|██████████| 50/50 [00:19<00:00,  1.60s/it]100%|██████████| 50/50 [00:19<00:00,  2.58it/s]
[I 2023-12-10 22:32:14,156] Trial 143 finished with value: 0.3901893287435456 and parameters: {'EMBEDDING_DIM': 955, 'HIDDEN_DIM': 302, 'NUM_LAYERS': 1, 'DROPOUT': 0.3184497539619573, 'LR': 0.0021105926298280783, 'WEIGHT_0': 0.40138604950292117, 'WEIGHT_1': 0.7740487605813512, 'WEIGHT_2': 0.6830754241667343, 'WEIGHT_3': 0.9362251910810514, 'WEIGHT_4': 0.8708971369500569, 'WEIGHT_5': 0.4495801434951689, 'WEIGHT_6': 0.7443469516362118, 'WEIGHT_7': 0.49731015207680035, 'WEIGHT_8': 0.42024207893090226, 'optimizer': 'RMSprop'}. Best is trial 134 with value: 0.4158467115484205.
/userhome/cs2/dingruiw/conda/envs/py310/lib/python3.10/site-packages/torch/nn/modules/rnn.py:82: UserWarning: dropout option adds dropout after all but last recurrent layer, so non-zero dropout expects num_layers greater than 1, but got dropout=0.3536909227931108 and num_layers=1
  warnings.warn("dropout option adds dropout after all but last "
{'EMBEDDING_DIM': 955, 'HIDDEN_DIM': 302, 'NUM_LAYERS': 1, 'DROPOUT': 0.3184497539619573, 'LR': 0.0021105926298280783, 'WEIGHT_0': 0.40138604950292117, 'WEIGHT_1': 0.7740487605813512, 'WEIGHT_2': 0.6830754241667343, 'WEIGHT_3': 0.9362251910810514, 'WEIGHT_4': 0.8708971369500569, 'WEIGHT_5': 0.4495801434951689, 'WEIGHT_6': 0.7443469516362118, 'WEIGHT_7': 0.49731015207680035, 'WEIGHT_8': 0.42024207893090226, 'optimizer': 'RMSprop'}
0
              precision    recall  f1-score   support

         LOC       0.20      0.11      0.14      1837
        MISC       0.06      0.05      0.06       922
         ORG       0.10      0.03      0.05      1341
         PER       0.03      0.04      0.03      1842

   micro avg       0.08      0.06      0.07      5942
   macro avg       0.10      0.06      0.07      5942
weighted avg       0.10      0.06      0.07      5942

{'EMBEDDING_DIM': 955, 'HIDDEN_DIM': 302, 'NUM_LAYERS': 1, 'DROPOUT': 0.3184497539619573, 'LR': 0.0021105926298280783, 'WEIGHT_0': 0.40138604950292117, 'WEIGHT_1': 0.7740487605813512, 'WEIGHT_2': 0.6830754241667343, 'WEIGHT_3': 0.9362251910810514, 'WEIGHT_4': 0.8708971369500569, 'WEIGHT_5': 0.4495801434951689, 'WEIGHT_6': 0.7443469516362118, 'WEIGHT_7': 0.49731015207680035, 'WEIGHT_8': 0.42024207893090226, 'optimizer': 'RMSprop'}
49
              precision    recall  f1-score   support

         LOC       0.60      0.51      0.55      1837
        MISC       0.39      0.43      0.41       922
         ORG       0.29      0.25      0.27      1341
         PER       0.31      0.33      0.32      1842

   micro avg       0.40      0.38      0.39      5942
   macro avg       0.40      0.38      0.39      5942
weighted avg       0.41      0.38      0.39      5942

epoch 49
LSTM
  0%|          | 0/50 [00:00<?, ?it/s]  2%|▏         | 1/50 [00:04<03:45,  4.60s/it]  6%|▌         | 3/50 [00:04<01:00,  1.28s/it]  8%|▊         | 4/50 [00:04<00:40,  1.13it/s] 10%|█         | 5/50 [00:05<00:28,  1.56it/s] 12%|█▏        | 6/50 [00:05<00:21,  2.08it/s] 14%|█▍        | 7/50 [00:05<00:16,  2.67it/s] 16%|█▌        | 8/50 [00:05<00:12,  3.31it/s] 18%|█▊        | 9/50 [00:05<00:10,  3.94it/s] 20%|██        | 10/50 [00:05<00:08,  4.55it/s] 22%|██▏       | 11/50 [00:05<00:07,  5.09it/s] 24%|██▍       | 12/50 [00:06<00:06,  5.54it/s] 26%|██▌       | 13/50 [00:06<00:06,  5.91it/s] 28%|██▊       | 14/50 [00:06<00:05,  6.20it/s] 30%|███       | 15/50 [00:06<00:05,  6.41it/s] 32%|███▏      | 16/50 [00:06<00:05,  6.57it/s] 34%|███▍      | 17/50 [00:06<00:04,  6.68it/s] 36%|███▌      | 18/50 [00:06<00:04,  6.76it/s] 38%|███▊      | 19/50 [00:07<00:04,  6.83it/s] 40%|████      | 20/50 [00:07<00:04,  6.88it/s] 42%|████▏     | 21/50 [00:07<00:04,  6.91it/s] 44%|████▍     | 22/50 [00:07<00:04,  6.92it/s] 46%|████▌     | 23/50 [00:07<00:03,  6.94it/s] 48%|████▊     | 24/50 [00:07<00:03,  6.95it/s] 50%|█████     | 25/50 [00:07<00:03,  6.96it/s] 52%|█████▏    | 26/50 [00:08<00:03,  6.97it/s] 54%|█████▍    | 27/50 [00:08<00:03,  6.96it/s] 56%|█████▌    | 28/50 [00:08<00:03,  6.97it/s] 58%|█████▊    | 29/50 [00:08<00:03,  6.97it/s] 60%|██████    | 30/50 [00:08<00:02,  6.97it/s] 62%|██████▏   | 31/50 [00:08<00:02,  6.98it/s] 64%|██████▍   | 32/50 [00:08<00:02,  6.98it/s] 66%|██████▌   | 33/50 [00:09<00:02,  6.97it/s] 68%|██████▊   | 34/50 [00:09<00:02,  6.97it/s] 70%|███████   | 35/50 [00:09<00:02,  6.98it/s] 72%|███████▏  | 36/50 [00:09<00:02,  6.97it/s] 74%|███████▍  | 37/50 [00:09<00:01,  6.98it/s] 76%|███████▌  | 38/50 [00:09<00:01,  6.98it/s] 78%|███████▊  | 39/50 [00:09<00:01,  6.97it/s] 80%|████████  | 40/50 [00:10<00:01,  6.98it/s] 82%|████████▏ | 41/50 [00:10<00:01,  6.98it/s] 84%|████████▍ | 42/50 [00:10<00:01,  6.97it/s] 86%|████████▌ | 43/50 [00:10<00:01,  6.97it/s] 88%|████████▊ | 44/50 [00:10<00:00,  6.98it/s] 90%|█████████ | 45/50 [00:10<00:00,  6.97it/s] 92%|█████████▏| 46/50 [00:10<00:00,  6.98it/s] 94%|█████████▍| 47/50 [00:11<00:00,  6.98it/s] 96%|█████████▌| 48/50 [00:11<00:00,  6.97it/s] 98%|█████████▊| 49/50 [00:11<00:00,  6.98it/s]100%|██████████| 50/50 [00:16<00:00,  1.57s/it]100%|██████████| 50/50 [00:16<00:00,  3.06it/s]
[I 2023-12-10 22:32:34,692] Trial 144 finished with value: 0.3887515977844056 and parameters: {'EMBEDDING_DIM': 934, 'HIDDEN_DIM': 198, 'NUM_LAYERS': 1, 'DROPOUT': 0.3536909227931108, 'LR': 0.003455602314327726, 'WEIGHT_0': 0.44755972447994063, 'WEIGHT_1': 0.865765362961412, 'WEIGHT_2': 0.6309958052723715, 'WEIGHT_3': 0.70362037778607, 'WEIGHT_4': 0.9276091989402124, 'WEIGHT_5': 0.4154570113124228, 'WEIGHT_6': 0.870745653911839, 'WEIGHT_7': 0.41296372313969715, 'WEIGHT_8': 0.4522527008995941, 'optimizer': 'RMSprop'}. Best is trial 134 with value: 0.4158467115484205.
/userhome/cs2/dingruiw/conda/envs/py310/lib/python3.10/site-packages/torch/nn/modules/rnn.py:82: UserWarning: dropout option adds dropout after all but last recurrent layer, so non-zero dropout expects num_layers greater than 1, but got dropout=0.33189825661376576 and num_layers=1
  warnings.warn("dropout option adds dropout after all but last "
{'EMBEDDING_DIM': 934, 'HIDDEN_DIM': 198, 'NUM_LAYERS': 1, 'DROPOUT': 0.3536909227931108, 'LR': 0.003455602314327726, 'WEIGHT_0': 0.44755972447994063, 'WEIGHT_1': 0.865765362961412, 'WEIGHT_2': 0.6309958052723715, 'WEIGHT_3': 0.70362037778607, 'WEIGHT_4': 0.9276091989402124, 'WEIGHT_5': 0.4154570113124228, 'WEIGHT_6': 0.870745653911839, 'WEIGHT_7': 0.41296372313969715, 'WEIGHT_8': 0.4522527008995941, 'optimizer': 'RMSprop'}
0
              precision    recall  f1-score   support

         LOC       0.24      0.04      0.07      1837
        MISC       0.04      0.01      0.01       922
         ORG       0.17      0.01      0.02      1341
         PER       0.13      0.02      0.03      1842

   micro avg       0.16      0.02      0.04      5942
   macro avg       0.15      0.02      0.04      5942
weighted avg       0.16      0.02      0.04      5942

{'EMBEDDING_DIM': 934, 'HIDDEN_DIM': 198, 'NUM_LAYERS': 1, 'DROPOUT': 0.3536909227931108, 'LR': 0.003455602314327726, 'WEIGHT_0': 0.44755972447994063, 'WEIGHT_1': 0.865765362961412, 'WEIGHT_2': 0.6309958052723715, 'WEIGHT_3': 0.70362037778607, 'WEIGHT_4': 0.9276091989402124, 'WEIGHT_5': 0.4154570113124228, 'WEIGHT_6': 0.870745653911839, 'WEIGHT_7': 0.41296372313969715, 'WEIGHT_8': 0.4522527008995941, 'optimizer': 'RMSprop'}
49
              precision    recall  f1-score   support

         LOC       0.60      0.51      0.55      1837
        MISC       0.39      0.44      0.41       922
         ORG       0.26      0.26      0.26      1341
         PER       0.32      0.32      0.32      1842

   micro avg       0.39      0.38      0.39      5942
   macro avg       0.39      0.38      0.39      5942
weighted avg       0.40      0.38      0.39      5942

epoch 49
LSTM
  0%|          | 0/50 [00:00<?, ?it/s]  2%|▏         | 1/50 [00:04<04:02,  4.95s/it]  4%|▍         | 2/50 [00:05<01:41,  2.12s/it]  6%|▌         | 3/50 [00:05<00:59,  1.27s/it]  8%|▊         | 4/50 [00:05<00:40,  1.15it/s] 10%|█         | 5/50 [00:05<00:29,  1.54it/s] 12%|█▏        | 6/50 [00:06<00:22,  1.93it/s] 14%|█▍        | 7/50 [00:06<00:18,  2.31it/s] 16%|█▌        | 8/50 [00:06<00:15,  2.64it/s] 18%|█▊        | 9/50 [00:06<00:13,  2.94it/s] 20%|██        | 10/50 [00:07<00:12,  3.17it/s] 22%|██▏       | 11/50 [00:07<00:11,  3.35it/s] 24%|██▍       | 12/50 [00:07<00:10,  3.49it/s] 26%|██▌       | 13/50 [00:07<00:10,  3.59it/s] 28%|██▊       | 14/50 [00:08<00:09,  3.67it/s] 30%|███       | 15/50 [00:08<00:09,  3.73it/s] 32%|███▏      | 16/50 [00:08<00:09,  3.76it/s] 34%|███▍      | 17/50 [00:08<00:08,  3.79it/s] 36%|███▌      | 18/50 [00:09<00:08,  3.81it/s] 38%|███▊      | 19/50 [00:09<00:08,  3.82it/s] 40%|████      | 20/50 [00:09<00:07,  3.83it/s] 42%|████▏     | 21/50 [00:10<00:07,  3.84it/s] 44%|████▍     | 22/50 [00:10<00:07,  3.84it/s] 46%|████▌     | 23/50 [00:10<00:07,  3.84it/s] 48%|████▊     | 24/50 [00:10<00:06,  3.85it/s] 50%|█████     | 25/50 [00:11<00:06,  3.85it/s] 52%|█████▏    | 26/50 [00:11<00:06,  3.85it/s] 54%|█████▍    | 27/50 [00:11<00:05,  3.85it/s] 56%|█████▌    | 28/50 [00:11<00:05,  3.85it/s] 58%|█████▊    | 29/50 [00:12<00:05,  3.85it/s] 60%|██████    | 30/50 [00:12<00:05,  3.85it/s] 62%|██████▏   | 31/50 [00:12<00:04,  3.85it/s] 64%|██████▍   | 32/50 [00:12<00:04,  3.85it/s] 66%|██████▌   | 33/50 [00:13<00:04,  3.85it/s] 68%|██████▊   | 34/50 [00:13<00:04,  3.85it/s] 70%|███████   | 35/50 [00:13<00:03,  3.84it/s] 72%|███████▏  | 36/50 [00:13<00:03,  3.85it/s] 74%|███████▍  | 37/50 [00:14<00:03,  3.85it/s] 76%|███████▌  | 38/50 [00:14<00:03,  3.84it/s] 78%|███████▊  | 39/50 [00:14<00:02,  3.84it/s] 80%|████████  | 40/50 [00:14<00:02,  3.84it/s] 82%|████████▏ | 41/50 [00:15<00:02,  3.84it/s] 84%|████████▍ | 42/50 [00:15<00:02,  3.84it/s] 86%|████████▌ | 43/50 [00:15<00:01,  3.84it/s] 88%|████████▊ | 44/50 [00:16<00:01,  3.84it/s] 90%|█████████ | 45/50 [00:16<00:01,  3.84it/s] 92%|█████████▏| 46/50 [00:16<00:01,  3.83it/s] 94%|█████████▍| 47/50 [00:16<00:00,  3.83it/s] 96%|█████████▌| 48/50 [00:17<00:00,  3.83it/s] 98%|█████████▊| 49/50 [00:17<00:00,  3.83it/s]100%|██████████| 50/50 [00:22<00:00,  1.68s/it]100%|██████████| 50/50 [00:22<00:00,  2.24it/s]
