[I 2023-12-10 23:46:14,523] Trial 293 finished with value: 0.38978271686846905 and parameters: {'EMBEDDING_DIM': 907, 'HIDDEN_DIM': 275, 'NUM_LAYERS': 1, 'DROPOUT': 0.2943239636061509, 'LR': 0.0016397666464062692, 'WEIGHT_0': 0.36730809534908837, 'WEIGHT_1': 0.37660700420896365, 'WEIGHT_2': 0.7742786032088055, 'WEIGHT_3': 0.7137729141116863, 'WEIGHT_4': 0.6373870339830726, 'WEIGHT_5': 0.5548966948316626, 'WEIGHT_6': 0.5790207678767472, 'WEIGHT_7': 0.8361097214933948, 'WEIGHT_8': 0.7725600103647676, 'optimizer': 'RMSprop'}. Best is trial 221 with value: 0.418736930154747.
/userhome/cs2/dingruiw/conda/envs/py310/lib/python3.10/site-packages/torch/nn/modules/rnn.py:82: UserWarning: dropout option adds dropout after all but last recurrent layer, so non-zero dropout expects num_layers greater than 1, but got dropout=0.3018282264357733 and num_layers=1
  warnings.warn("dropout option adds dropout after all but last "
{'EMBEDDING_DIM': 907, 'HIDDEN_DIM': 275, 'NUM_LAYERS': 1, 'DROPOUT': 0.2943239636061509, 'LR': 0.0016397666464062692, 'WEIGHT_0': 0.36730809534908837, 'WEIGHT_1': 0.37660700420896365, 'WEIGHT_2': 0.7742786032088055, 'WEIGHT_3': 0.7137729141116863, 'WEIGHT_4': 0.6373870339830726, 'WEIGHT_5': 0.5548966948316626, 'WEIGHT_6': 0.5790207678767472, 'WEIGHT_7': 0.8361097214933948, 'WEIGHT_8': 0.7725600103647676, 'optimizer': 'RMSprop'}
0
              precision    recall  f1-score   support

         LOC       0.32      0.16      0.21      1837
        MISC       0.05      0.06      0.05       922
         ORG       0.11      0.03      0.05      1341
         PER       0.04      0.02      0.03      1842

   micro avg       0.13      0.07      0.09      5942
   macro avg       0.13      0.07      0.08      5942
weighted avg       0.15      0.07      0.09      5942

{'EMBEDDING_DIM': 907, 'HIDDEN_DIM': 275, 'NUM_LAYERS': 1, 'DROPOUT': 0.2943239636061509, 'LR': 0.0016397666464062692, 'WEIGHT_0': 0.36730809534908837, 'WEIGHT_1': 0.37660700420896365, 'WEIGHT_2': 0.7742786032088055, 'WEIGHT_3': 0.7137729141116863, 'WEIGHT_4': 0.6373870339830726, 'WEIGHT_5': 0.5548966948316626, 'WEIGHT_6': 0.5790207678767472, 'WEIGHT_7': 0.8361097214933948, 'WEIGHT_8': 0.7725600103647676, 'optimizer': 'RMSprop'}
49
              precision    recall  f1-score   support

         LOC       0.52      0.52      0.52      1837
        MISC       0.41      0.46      0.43       922
         ORG       0.28      0.25      0.27      1341
         PER       0.31      0.34      0.32      1842

   micro avg       0.38      0.40      0.39      5942
   macro avg       0.38      0.39      0.39      5942
weighted avg       0.38      0.40      0.39      5942

epoch 49
LSTM
  0%|          | 0/50 [00:00<?, ?it/s]  2%|▏         | 1/50 [00:04<03:47,  4.65s/it]  4%|▍         | 2/50 [00:04<01:36,  2.01s/it]  6%|▌         | 3/50 [00:05<00:57,  1.23s/it]  8%|▊         | 4/50 [00:05<00:39,  1.16it/s] 10%|█         | 5/50 [00:05<00:29,  1.52it/s] 12%|█▏        | 6/50 [00:06<00:23,  1.87it/s] 14%|█▍        | 7/50 [00:06<00:19,  2.18it/s] 16%|█▌        | 8/50 [00:06<00:17,  2.46it/s] 18%|█▊        | 9/50 [00:06<00:15,  2.68it/s] 20%|██        | 10/50 [00:07<00:14,  2.85it/s] 22%|██▏       | 11/50 [00:07<00:13,  2.99it/s] 24%|██▍       | 12/50 [00:07<00:12,  3.09it/s] 26%|██▌       | 13/50 [00:08<00:11,  3.16it/s] 28%|██▊       | 14/50 [00:08<00:11,  3.20it/s] 30%|███       | 15/50 [00:08<00:10,  3.24it/s] 32%|███▏      | 16/50 [00:08<00:10,  3.28it/s] 34%|███▍      | 17/50 [00:09<00:10,  3.29it/s] 36%|███▌      | 18/50 [00:09<00:09,  3.30it/s] 38%|███▊      | 19/50 [00:09<00:09,  3.31it/s] 40%|████      | 20/50 [00:10<00:09,  3.32it/s] 42%|████▏     | 21/50 [00:10<00:08,  3.33it/s] 44%|████▍     | 22/50 [00:10<00:08,  3.33it/s] 46%|████▌     | 23/50 [00:11<00:08,  3.32it/s] 48%|████▊     | 24/50 [00:11<00:07,  3.32it/s] 50%|█████     | 25/50 [00:11<00:07,  3.33it/s] 52%|█████▏    | 26/50 [00:11<00:07,  3.33it/s] 54%|█████▍    | 27/50 [00:12<00:06,  3.33it/s] 56%|█████▌    | 28/50 [00:12<00:06,  3.33it/s] 58%|█████▊    | 29/50 [00:12<00:06,  3.32it/s] 60%|██████    | 30/50 [00:13<00:06,  3.33it/s] 62%|██████▏   | 31/50 [00:13<00:05,  3.33it/s] 64%|██████▍   | 32/50 [00:13<00:05,  3.33it/s] 66%|██████▌   | 33/50 [00:14<00:05,  3.32it/s] 68%|██████▊   | 34/50 [00:14<00:04,  3.32it/s] 70%|███████   | 35/50 [00:14<00:04,  3.32it/s] 72%|███████▏  | 36/50 [00:14<00:04,  3.33it/s] 74%|███████▍  | 37/50 [00:15<00:03,  3.33it/s] 76%|███████▌  | 38/50 [00:15<00:03,  3.32it/s] 78%|███████▊  | 39/50 [00:15<00:03,  3.32it/s] 80%|████████  | 40/50 [00:16<00:03,  3.32it/s] 82%|████████▏ | 41/50 [00:16<00:02,  3.32it/s] 84%|████████▍ | 42/50 [00:16<00:02,  3.33it/s] 86%|████████▌ | 43/50 [00:17<00:02,  3.33it/s] 88%|████████▊ | 44/50 [00:17<00:01,  3.32it/s] 90%|█████████ | 45/50 [00:17<00:01,  3.32it/s] 92%|█████████▏| 46/50 [00:18<00:01,  3.31it/s] 94%|█████████▍| 47/50 [00:18<00:00,  3.32it/s] 96%|█████████▌| 48/50 [00:18<00:00,  3.32it/s] 98%|█████████▊| 49/50 [00:18<00:00,  3.32it/s]100%|██████████| 50/50 [00:23<00:00,  1.71s/it]100%|██████████| 50/50 [00:23<00:00,  2.09it/s]
[I 2023-12-10 23:46:42,641] Trial 294 finished with value: 0.36839895894551256 and parameters: {'EMBEDDING_DIM': 968, 'HIDDEN_DIM': 470, 'NUM_LAYERS': 1, 'DROPOUT': 0.3018282264357733, 'LR': 0.002982510364634205, 'WEIGHT_0': 0.32903684253188964, 'WEIGHT_1': 0.7601655297084333, 'WEIGHT_2': 0.24348233108463888, 'WEIGHT_3': 0.5389757890522707, 'WEIGHT_4': 0.9768697029766464, 'WEIGHT_5': 0.5786637940074855, 'WEIGHT_6': 0.6794011358754204, 'WEIGHT_7': 0.5114176593713076, 'WEIGHT_8': 0.06035522226189893, 'optimizer': 'RMSprop'}. Best is trial 221 with value: 0.418736930154747.
/userhome/cs2/dingruiw/conda/envs/py310/lib/python3.10/site-packages/torch/nn/modules/rnn.py:82: UserWarning: dropout option adds dropout after all but last recurrent layer, so non-zero dropout expects num_layers greater than 1, but got dropout=0.010305700825058745 and num_layers=1
  warnings.warn("dropout option adds dropout after all but last "
{'EMBEDDING_DIM': 968, 'HIDDEN_DIM': 470, 'NUM_LAYERS': 1, 'DROPOUT': 0.3018282264357733, 'LR': 0.002982510364634205, 'WEIGHT_0': 0.32903684253188964, 'WEIGHT_1': 0.7601655297084333, 'WEIGHT_2': 0.24348233108463888, 'WEIGHT_3': 0.5389757890522707, 'WEIGHT_4': 0.9768697029766464, 'WEIGHT_5': 0.5786637940074855, 'WEIGHT_6': 0.6794011358754204, 'WEIGHT_7': 0.5114176593713076, 'WEIGHT_8': 0.06035522226189893, 'optimizer': 'RMSprop'}
0
              precision    recall  f1-score   support

         LOC       0.15      0.08      0.10      1837
        MISC       0.05      0.02      0.03       922
         ORG       0.08      0.02      0.03      1341
         PER       0.05      0.01      0.02      1842

   micro avg       0.10      0.03      0.05      5942
   macro avg       0.08      0.03      0.04      5942
weighted avg       0.09      0.03      0.05      5942

{'EMBEDDING_DIM': 968, 'HIDDEN_DIM': 470, 'NUM_LAYERS': 1, 'DROPOUT': 0.3018282264357733, 'LR': 0.002982510364634205, 'WEIGHT_0': 0.32903684253188964, 'WEIGHT_1': 0.7601655297084333, 'WEIGHT_2': 0.24348233108463888, 'WEIGHT_3': 0.5389757890522707, 'WEIGHT_4': 0.9768697029766464, 'WEIGHT_5': 0.5786637940074855, 'WEIGHT_6': 0.6794011358754204, 'WEIGHT_7': 0.5114176593713076, 'WEIGHT_8': 0.06035522226189893, 'optimizer': 'RMSprop'}
49
              precision    recall  f1-score   support

         LOC       0.55      0.49      0.52      1837
        MISC       0.40      0.37      0.39       922
         ORG       0.24      0.24      0.24      1341
         PER       0.30      0.34      0.32      1842

   micro avg       0.37      0.37      0.37      5942
   macro avg       0.37      0.36      0.36      5942
weighted avg       0.38      0.37      0.37      5942

epoch 49
LSTM
  0%|          | 0/50 [00:00<?, ?it/s]  2%|▏         | 1/50 [00:04<03:59,  4.88s/it]  4%|▍         | 2/50 [00:05<01:42,  2.14s/it]  6%|▌         | 3/50 [00:05<01:03,  1.35s/it]  8%|▊         | 4/50 [00:05<00:44,  1.03it/s] 10%|█         | 5/50 [00:06<00:34,  1.30it/s] 12%|█▏        | 6/50 [00:06<00:28,  1.55it/s] 14%|█▍        | 7/50 [00:07<00:24,  1.76it/s] 16%|█▌        | 8/50 [00:07<00:21,  1.93it/s] 18%|█▊        | 9/50 [00:07<00:19,  2.06it/s] 20%|██        | 10/50 [00:08<00:18,  2.17it/s] 22%|██▏       | 11/50 [00:08<00:17,  2.25it/s] 24%|██▍       | 12/50 [00:09<00:16,  2.31it/s] 26%|██▌       | 13/50 [00:09<00:15,  2.36it/s] 28%|██▊       | 14/50 [00:09<00:15,  2.39it/s] 30%|███       | 15/50 [00:10<00:14,  2.41it/s] 32%|███▏      | 16/50 [00:10<00:14,  2.43it/s] 34%|███▍      | 17/50 [00:11<00:13,  2.43it/s] 36%|███▌      | 18/50 [00:11<00:13,  2.44it/s] 38%|███▊      | 19/50 [00:12<00:12,  2.45it/s] 40%|████      | 20/50 [00:12<00:12,  2.45it/s] 42%|████▏     | 21/50 [00:12<00:11,  2.46it/s] 44%|████▍     | 22/50 [00:13<00:11,  2.46it/s] 46%|████▌     | 23/50 [00:13<00:10,  2.46it/s] 48%|████▊     | 24/50 [00:14<00:10,  2.46it/s] 50%|█████     | 25/50 [00:14<00:10,  2.46it/s] 52%|█████▏    | 26/50 [00:14<00:09,  2.46it/s] 54%|█████▍    | 27/50 [00:15<00:09,  2.46it/s] 56%|█████▌    | 28/50 [00:15<00:08,  2.46it/s] 58%|█████▊    | 29/50 [00:16<00:08,  2.46it/s] 60%|██████    | 30/50 [00:16<00:08,  2.46it/s] 62%|██████▏   | 31/50 [00:16<00:07,  2.47it/s] 64%|██████▍   | 32/50 [00:17<00:07,  2.46it/s] 66%|██████▌   | 33/50 [00:17<00:06,  2.46it/s] 68%|██████▊   | 34/50 [00:18<00:06,  2.45it/s] 70%|███████   | 35/50 [00:18<00:06,  2.45it/s] 72%|███████▏  | 36/50 [00:18<00:05,  2.45it/s] 74%|███████▍  | 37/50 [00:19<00:05,  2.45it/s] 76%|███████▌  | 38/50 [00:19<00:04,  2.45it/s] 78%|███████▊  | 39/50 [00:20<00:04,  2.45it/s] 80%|████████  | 40/50 [00:20<00:04,  2.45it/s] 82%|████████▏ | 41/50 [00:20<00:03,  2.44it/s] 84%|████████▍ | 42/50 [00:21<00:03,  2.45it/s] 86%|████████▌ | 43/50 [00:21<00:02,  2.45it/s] 88%|████████▊ | 44/50 [00:22<00:02,  2.45it/s] 90%|█████████ | 45/50 [00:22<00:02,  2.44it/s] 92%|█████████▏| 46/50 [00:23<00:01,  2.44it/s] 94%|█████████▍| 47/50 [00:23<00:01,  2.44it/s] 96%|█████████▌| 48/50 [00:23<00:00,  2.44it/s] 98%|█████████▊| 49/50 [00:24<00:00,  2.44it/s]100%|██████████| 50/50 [00:29<00:00,  1.77s/it]100%|██████████| 50/50 [00:29<00:00,  1.71it/s]
[I 2023-12-10 23:47:16,030] Trial 295 finished with value: 0.3792900897876982 and parameters: {'EMBEDDING_DIM': 960, 'HIDDEN_DIM': 597, 'NUM_LAYERS': 1, 'DROPOUT': 0.010305700825058745, 'LR': 0.002398481802432469, 'WEIGHT_0': 0.45198362679034804, 'WEIGHT_1': 0.5780518134962559, 'WEIGHT_2': 0.5296667004871779, 'WEIGHT_3': 0.608898147601548, 'WEIGHT_4': 0.846816962676822, 'WEIGHT_5': 0.6300640213660003, 'WEIGHT_6': 0.7417109018995205, 'WEIGHT_7': 0.7845315358376301, 'WEIGHT_8': 0.8342316663334771, 'optimizer': 'RMSprop'}. Best is trial 221 with value: 0.418736930154747.
/userhome/cs2/dingruiw/conda/envs/py310/lib/python3.10/site-packages/torch/nn/modules/rnn.py:82: UserWarning: dropout option adds dropout after all but last recurrent layer, so non-zero dropout expects num_layers greater than 1, but got dropout=0.20549768327717166 and num_layers=1
  warnings.warn("dropout option adds dropout after all but last "
{'EMBEDDING_DIM': 960, 'HIDDEN_DIM': 597, 'NUM_LAYERS': 1, 'DROPOUT': 0.010305700825058745, 'LR': 0.002398481802432469, 'WEIGHT_0': 0.45198362679034804, 'WEIGHT_1': 0.5780518134962559, 'WEIGHT_2': 0.5296667004871779, 'WEIGHT_3': 0.608898147601548, 'WEIGHT_4': 0.846816962676822, 'WEIGHT_5': 0.6300640213660003, 'WEIGHT_6': 0.7417109018995205, 'WEIGHT_7': 0.7845315358376301, 'WEIGHT_8': 0.8342316663334771, 'optimizer': 'RMSprop'}
0
              precision    recall  f1-score   support

         LOC       0.07      0.03      0.04      1837
        MISC       0.01      0.01      0.01       922
         ORG       0.03      0.01      0.01      1341
         PER       0.01      0.03      0.02      1842

   micro avg       0.02      0.02      0.02      5942
   macro avg       0.03      0.02      0.02      5942
weighted avg       0.03      0.02      0.02      5942

{'EMBEDDING_DIM': 960, 'HIDDEN_DIM': 597, 'NUM_LAYERS': 1, 'DROPOUT': 0.010305700825058745, 'LR': 0.002398481802432469, 'WEIGHT_0': 0.45198362679034804, 'WEIGHT_1': 0.5780518134962559, 'WEIGHT_2': 0.5296667004871779, 'WEIGHT_3': 0.608898147601548, 'WEIGHT_4': 0.846816962676822, 'WEIGHT_5': 0.6300640213660003, 'WEIGHT_6': 0.7417109018995205, 'WEIGHT_7': 0.7845315358376301, 'WEIGHT_8': 0.8342316663334771, 'optimizer': 'RMSprop'}
49
              precision    recall  f1-score   support

         LOC       0.55      0.50      0.53      1837
        MISC       0.38      0.40      0.39       922
         ORG       0.27      0.24      0.25      1341
         PER       0.30      0.35      0.32      1842

   micro avg       0.38      0.38      0.38      5942
   macro avg       0.38      0.37      0.37      5942
weighted avg       0.38      0.38      0.38      5942

epoch 49
LSTM
  0%|          | 0/50 [00:00<?, ?it/s]  2%|▏         | 1/50 [00:04<03:53,  4.76s/it]  4%|▍         | 2/50 [00:04<01:38,  2.05s/it]  6%|▌         | 3/50 [00:05<00:58,  1.25s/it]  8%|▊         | 4/50 [00:05<00:40,  1.15it/s] 10%|█         | 5/50 [00:05<00:29,  1.51it/s] 12%|█▏        | 6/50 [00:06<00:23,  1.87it/s] 14%|█▍        | 7/50 [00:06<00:19,  2.19it/s] 16%|█▌        | 8/50 [00:06<00:16,  2.48it/s] 18%|█▊        | 9/50 [00:06<00:15,  2.71it/s] 20%|██        | 10/50 [00:07<00:13,  2.89it/s] 22%|██▏       | 11/50 [00:07<00:12,  3.03it/s] 24%|██▍       | 12/50 [00:07<00:12,  3.14it/s] 26%|██▌       | 13/50 [00:08<00:11,  3.22it/s] 28%|██▊       | 14/50 [00:08<00:10,  3.28it/s] 30%|███       | 15/50 [00:08<00:10,  3.32it/s] 32%|███▏      | 16/50 [00:09<00:10,  3.34it/s] 34%|███▍      | 17/50 [00:09<00:09,  3.36it/s] 36%|███▌      | 18/50 [00:09<00:09,  3.37it/s] 38%|███▊      | 19/50 [00:09<00:09,  3.39it/s] 40%|████      | 20/50 [00:10<00:08,  3.40it/s] 42%|████▏     | 21/50 [00:10<00:08,  3.40it/s] 44%|████▍     | 22/50 [00:10<00:08,  3.41it/s] 46%|████▌     | 23/50 [00:11<00:07,  3.40it/s] 48%|████▊     | 24/50 [00:11<00:07,  3.41it/s] 50%|█████     | 25/50 [00:11<00:07,  3.41it/s] 52%|█████▏    | 26/50 [00:11<00:07,  3.41it/s] 54%|█████▍    | 27/50 [00:12<00:06,  3.41it/s] 56%|█████▌    | 28/50 [00:12<00:06,  3.41it/s] 58%|█████▊    | 29/50 [00:12<00:06,  3.41it/s] 60%|██████    | 30/50 [00:13<00:05,  3.41it/s] 62%|██████▏   | 31/50 [00:13<00:05,  3.41it/s] 64%|██████▍   | 32/50 [00:13<00:05,  3.41it/s] 66%|██████▌   | 33/50 [00:13<00:04,  3.40it/s] 68%|██████▊   | 34/50 [00:14<00:04,  3.41it/s] 70%|███████   | 35/50 [00:14<00:04,  3.40it/s] 72%|███████▏  | 36/50 [00:14<00:04,  3.40it/s] 74%|███████▍  | 37/50 [00:15<00:03,  3.40it/s] 76%|███████▌  | 38/50 [00:15<00:03,  3.40it/s] 78%|███████▊  | 39/50 [00:15<00:03,  3.40it/s] 80%|████████  | 40/50 [00:16<00:02,  3.40it/s] 82%|████████▏ | 41/50 [00:16<00:02,  3.40it/s] 84%|████████▍ | 42/50 [00:16<00:02,  3.40it/s] 86%|████████▌ | 43/50 [00:16<00:02,  3.40it/s] 88%|████████▊ | 44/50 [00:17<00:01,  3.40it/s] 90%|█████████ | 45/50 [00:17<00:01,  3.40it/s] 92%|█████████▏| 46/50 [00:17<00:01,  3.40it/s] 94%|█████████▍| 47/50 [00:18<00:00,  3.39it/s] 96%|█████████▌| 48/50 [00:18<00:00,  3.39it/s] 98%|█████████▊| 49/50 [00:18<00:00,  3.39it/s]100%|██████████| 50/50 [00:23<00:00,  1.67s/it]100%|██████████| 50/50 [00:23<00:00,  2.12it/s]
[I 2023-12-10 23:47:43,927] Trial 296 finished with value: 0.39765605924961345 and parameters: {'EMBEDDING_DIM': 986, 'HIDDEN_DIM': 426, 'NUM_LAYERS': 1, 'DROPOUT': 0.20549768327717166, 'LR': 0.0026947634476314083, 'WEIGHT_0': 0.42717483756893, 'WEIGHT_1': 0.486493130038804, 'WEIGHT_2': 0.6535786256003318, 'WEIGHT_3': 0.3483172583079956, 'WEIGHT_4': 0.6496841674574432, 'WEIGHT_5': 0.7843175178220874, 'WEIGHT_6': 0.8356400878671746, 'WEIGHT_7': 0.6562545785070785, 'WEIGHT_8': 0.8011450058108842, 'optimizer': 'Adam'}. Best is trial 221 with value: 0.418736930154747.
/userhome/cs2/dingruiw/conda/envs/py310/lib/python3.10/site-packages/torch/nn/modules/rnn.py:82: UserWarning: dropout option adds dropout after all but last recurrent layer, so non-zero dropout expects num_layers greater than 1, but got dropout=0.32590159725168 and num_layers=1
  warnings.warn("dropout option adds dropout after all but last "
{'EMBEDDING_DIM': 986, 'HIDDEN_DIM': 426, 'NUM_LAYERS': 1, 'DROPOUT': 0.20549768327717166, 'LR': 0.0026947634476314083, 'WEIGHT_0': 0.42717483756893, 'WEIGHT_1': 0.486493130038804, 'WEIGHT_2': 0.6535786256003318, 'WEIGHT_3': 0.3483172583079956, 'WEIGHT_4': 0.6496841674574432, 'WEIGHT_5': 0.7843175178220874, 'WEIGHT_6': 0.8356400878671746, 'WEIGHT_7': 0.6562545785070785, 'WEIGHT_8': 0.8011450058108842, 'optimizer': 'Adam'}
0
              precision    recall  f1-score   support

         LOC       0.09      0.08      0.08      1837
        MISC       0.02      0.01      0.02       922
         ORG       0.05      0.05      0.05      1341
         PER       0.04      0.01      0.02      1842

   micro avg       0.06      0.04      0.05      5942
   macro avg       0.05      0.04      0.04      5942
weighted avg       0.05      0.04      0.05      5942

{'EMBEDDING_DIM': 986, 'HIDDEN_DIM': 426, 'NUM_LAYERS': 1, 'DROPOUT': 0.20549768327717166, 'LR': 0.0026947634476314083, 'WEIGHT_0': 0.42717483756893, 'WEIGHT_1': 0.486493130038804, 'WEIGHT_2': 0.6535786256003318, 'WEIGHT_3': 0.3483172583079956, 'WEIGHT_4': 0.6496841674574432, 'WEIGHT_5': 0.7843175178220874, 'WEIGHT_6': 0.8356400878671746, 'WEIGHT_7': 0.6562545785070785, 'WEIGHT_8': 0.8011450058108842, 'optimizer': 'Adam'}
49
              precision    recall  f1-score   support

         LOC       0.53      0.57      0.55      1837
        MISC       0.39      0.43      0.41       922
         ORG       0.28      0.26      0.27      1341
         PER       0.31      0.35      0.33      1842

   micro avg       0.39      0.41      0.40      5942
   macro avg       0.38      0.40      0.39      5942
weighted avg       0.38      0.41      0.40      5942

epoch 49
LSTM
  0%|          | 0/50 [00:00<?, ?it/s]  2%|▏         | 1/50 [00:04<03:44,  4.59s/it]  6%|▌         | 3/50 [00:04<01:00,  1.29s/it]  8%|▊         | 4/50 [00:05<00:41,  1.11it/s] 10%|█         | 5/50 [00:05<00:29,  1.52it/s] 12%|█▏        | 6/50 [00:05<00:22,  2.00it/s] 14%|█▍        | 7/50 [00:05<00:17,  2.52it/s] 16%|█▌        | 8/50 [00:05<00:13,  3.07it/s] 18%|█▊        | 9/50 [00:05<00:11,  3.61it/s] 20%|██        | 10/50 [00:06<00:09,  4.10it/s] 22%|██▏       | 11/50 [00:06<00:08,  4.53it/s] 24%|██▍       | 12/50 [00:06<00:07,  4.89it/s] 26%|██▌       | 13/50 [00:06<00:07,  5.17it/s] 28%|██▊       | 14/50 [00:06<00:06,  5.39it/s] 30%|███       | 15/50 [00:06<00:06,  5.55it/s] 32%|███▏      | 16/50 [00:07<00:05,  5.67it/s] 34%|███▍      | 17/50 [00:07<00:05,  5.76it/s] 36%|███▌      | 18/50 [00:07<00:05,  5.82it/s] 38%|███▊      | 19/50 [00:07<00:05,  5.86it/s] 40%|████      | 20/50 [00:07<00:05,  5.89it/s] 42%|████▏     | 21/50 [00:07<00:04,  5.91it/s] 44%|████▍     | 22/50 [00:08<00:04,  5.93it/s] 46%|████▌     | 23/50 [00:08<00:04,  5.95it/s] 48%|████▊     | 24/50 [00:08<00:04,  5.96it/s] 50%|█████     | 25/50 [00:08<00:04,  5.95it/s] 52%|█████▏    | 26/50 [00:08<00:04,  5.95it/s] 54%|█████▍    | 27/50 [00:08<00:03,  5.96it/s] 56%|█████▌    | 28/50 [00:09<00:03,  5.95it/s] 58%|█████▊    | 29/50 [00:09<00:03,  5.96it/s] 60%|██████    | 30/50 [00:09<00:03,  5.97it/s] 62%|██████▏   | 31/50 [00:09<00:03,  5.96it/s] 64%|██████▍   | 32/50 [00:09<00:03,  5.96it/s] 66%|██████▌   | 33/50 [00:09<00:02,  5.96it/s] 68%|██████▊   | 34/50 [00:10<00:02,  5.96it/s] 70%|███████   | 35/50 [00:10<00:02,  5.96it/s] 72%|███████▏  | 36/50 [00:10<00:02,  5.96it/s] 74%|███████▍  | 37/50 [00:10<00:02,  5.96it/s] 76%|███████▌  | 38/50 [00:10<00:02,  5.96it/s] 78%|███████▊  | 39/50 [00:10<00:01,  5.96it/s] 80%|████████  | 40/50 [00:11<00:01,  5.97it/s] 82%|████████▏ | 41/50 [00:11<00:01,  5.96it/s] 84%|████████▍ | 42/50 [00:11<00:01,  5.96it/s] 86%|████████▌ | 43/50 [00:11<00:01,  5.96it/s] 88%|████████▊ | 44/50 [00:11<00:01,  5.97it/s] 90%|█████████ | 45/50 [00:11<00:00,  5.97it/s] 92%|█████████▏| 46/50 [00:12<00:00,  5.96it/s] 94%|█████████▍| 47/50 [00:12<00:00,  5.97it/s] 96%|█████████▌| 48/50 [00:12<00:00,  5.97it/s] 98%|█████████▊| 49/50 [00:12<00:00,  5.96it/s]100%|██████████| 50/50 [00:17<00:00,  1.52s/it]100%|██████████| 50/50 [00:17<00:00,  2.90it/s]
