[I 2023-12-10 22:15:20,604] Trial 105 finished with value: 0.39986341130271474 and parameters: {'EMBEDDING_DIM': 928, 'HIDDEN_DIM': 272, 'NUM_LAYERS': 1, 'DROPOUT': 0.3750565099743746, 'LR': 0.002236916019419745, 'WEIGHT_0': 0.44017407737542846, 'WEIGHT_1': 0.712422060435902, 'WEIGHT_2': 0.5510424767853486, 'WEIGHT_3': 0.7405086871144484, 'WEIGHT_4': 0.7939606774573623, 'WEIGHT_5': 0.463594753186765, 'WEIGHT_6': 0.9068071226573763, 'WEIGHT_7': 0.3689762435928668, 'WEIGHT_8': 0.41330831792665046, 'optimizer': 'RMSprop'}. Best is trial 51 with value: 0.41438326562364947.
/userhome/cs2/dingruiw/conda/envs/py310/lib/python3.10/site-packages/torch/nn/modules/rnn.py:82: UserWarning: dropout option adds dropout after all but last recurrent layer, so non-zero dropout expects num_layers greater than 1, but got dropout=0.3363092751634053 and num_layers=1
  warnings.warn("dropout option adds dropout after all but last "
{'EMBEDDING_DIM': 928, 'HIDDEN_DIM': 272, 'NUM_LAYERS': 1, 'DROPOUT': 0.3750565099743746, 'LR': 0.002236916019419745, 'WEIGHT_0': 0.44017407737542846, 'WEIGHT_1': 0.712422060435902, 'WEIGHT_2': 0.5510424767853486, 'WEIGHT_3': 0.7405086871144484, 'WEIGHT_4': 0.7939606774573623, 'WEIGHT_5': 0.463594753186765, 'WEIGHT_6': 0.9068071226573763, 'WEIGHT_7': 0.3689762435928668, 'WEIGHT_8': 0.41330831792665046, 'optimizer': 'RMSprop'}
0
              precision    recall  f1-score   support

         LOC       0.48      0.06      0.10      1837
        MISC       0.06      0.03      0.04       922
         ORG       0.11      0.02      0.03      1341
         PER       0.15      0.01      0.02      1842

   micro avg       0.16      0.03      0.05      5942
   macro avg       0.20      0.03      0.05      5942
weighted avg       0.23      0.03      0.05      5942

{'EMBEDDING_DIM': 928, 'HIDDEN_DIM': 272, 'NUM_LAYERS': 1, 'DROPOUT': 0.3750565099743746, 'LR': 0.002236916019419745, 'WEIGHT_0': 0.44017407737542846, 'WEIGHT_1': 0.712422060435902, 'WEIGHT_2': 0.5510424767853486, 'WEIGHT_3': 0.7405086871144484, 'WEIGHT_4': 0.7939606774573623, 'WEIGHT_5': 0.463594753186765, 'WEIGHT_6': 0.9068071226573763, 'WEIGHT_7': 0.3689762435928668, 'WEIGHT_8': 0.41330831792665046, 'optimizer': 'RMSprop'}
49
              precision    recall  f1-score   support

         LOC       0.61      0.53      0.57      1837
        MISC       0.43      0.45      0.44       922
         ORG       0.25      0.25      0.25      1341
         PER       0.33      0.34      0.34      1842

   micro avg       0.41      0.39      0.40      5942
   macro avg       0.41      0.39      0.40      5942
weighted avg       0.42      0.39      0.40      5942

epoch 49
LSTM
  0%|          | 0/50 [00:00<?, ?it/s]  2%|▏         | 1/50 [00:05<04:12,  5.15s/it]  4%|▍         | 2/50 [00:05<01:49,  2.27s/it]  6%|▌         | 3/50 [00:05<01:09,  1.48s/it]  8%|▊         | 4/50 [00:06<00:50,  1.11s/it] 10%|█         | 5/50 [00:07<00:40,  1.11it/s] 12%|█▏        | 6/50 [00:07<00:34,  1.29it/s] 14%|█▍        | 7/50 [00:08<00:30,  1.43it/s] 16%|█▌        | 8/50 [00:08<00:27,  1.54it/s] 18%|█▊        | 9/50 [00:09<00:25,  1.63it/s] 20%|██        | 10/50 [00:09<00:23,  1.69it/s] 22%|██▏       | 11/50 [00:10<00:22,  1.74it/s] 24%|██▍       | 12/50 [00:10<00:21,  1.77it/s] 26%|██▌       | 13/50 [00:11<00:20,  1.79it/s] 28%|██▊       | 14/50 [00:11<00:19,  1.81it/s] 30%|███       | 15/50 [00:12<00:19,  1.82it/s] 32%|███▏      | 16/50 [00:12<00:18,  1.83it/s] 34%|███▍      | 17/50 [00:13<00:18,  1.83it/s] 36%|███▌      | 18/50 [00:14<00:17,  1.84it/s] 38%|███▊      | 19/50 [00:14<00:16,  1.84it/s] 40%|████      | 20/50 [00:15<00:16,  1.84it/s] 42%|████▏     | 21/50 [00:15<00:15,  1.84it/s] 44%|████▍     | 22/50 [00:16<00:15,  1.84it/s] 46%|████▌     | 23/50 [00:16<00:14,  1.84it/s] 48%|████▊     | 24/50 [00:17<00:14,  1.84it/s] 50%|█████     | 25/50 [00:17<00:13,  1.84it/s] 52%|█████▏    | 26/50 [00:18<00:13,  1.84it/s] 54%|█████▍    | 27/50 [00:18<00:12,  1.84it/s] 56%|█████▌    | 28/50 [00:19<00:11,  1.84it/s] 58%|█████▊    | 29/50 [00:20<00:11,  1.84it/s] 60%|██████    | 30/50 [00:20<00:10,  1.84it/s] 62%|██████▏   | 31/50 [00:21<00:10,  1.84it/s] 64%|██████▍   | 32/50 [00:21<00:09,  1.84it/s] 66%|██████▌   | 33/50 [00:22<00:09,  1.84it/s] 68%|██████▊   | 34/50 [00:22<00:08,  1.84it/s] 70%|███████   | 35/50 [00:23<00:08,  1.84it/s] 72%|███████▏  | 36/50 [00:23<00:07,  1.84it/s] 74%|███████▍  | 37/50 [00:24<00:07,  1.84it/s] 76%|███████▌  | 38/50 [00:24<00:06,  1.83it/s] 78%|███████▊  | 39/50 [00:25<00:06,  1.83it/s] 80%|████████  | 40/50 [00:26<00:05,  1.83it/s] 82%|████████▏ | 41/50 [00:26<00:04,  1.83it/s] 84%|████████▍ | 42/50 [00:27<00:04,  1.83it/s] 86%|████████▌ | 43/50 [00:27<00:03,  1.83it/s] 88%|████████▊ | 44/50 [00:28<00:03,  1.82it/s] 90%|█████████ | 45/50 [00:28<00:02,  1.82it/s] 92%|█████████▏| 46/50 [00:29<00:02,  1.82it/s] 94%|█████████▍| 47/50 [00:29<00:01,  1.82it/s] 96%|█████████▌| 48/50 [00:30<00:01,  1.82it/s] 98%|█████████▊| 49/50 [00:30<00:00,  1.82it/s]100%|██████████| 50/50 [00:36<00:00,  1.98s/it]100%|██████████| 50/50 [00:36<00:00,  1.38it/s]
[I 2023-12-10 22:16:01,257] Trial 106 finished with value: 0.3780223311109326 and parameters: {'EMBEDDING_DIM': 1005, 'HIDDEN_DIM': 763, 'NUM_LAYERS': 1, 'DROPOUT': 0.3363092751634053, 'LR': 0.0018428926175966674, 'WEIGHT_0': 0.5175077604295704, 'WEIGHT_1': 0.8060292455315768, 'WEIGHT_2': 0.6603539039048844, 'WEIGHT_3': 0.880242049768582, 'WEIGHT_4': 0.9865997563437978, 'WEIGHT_5': 0.5025354961559275, 'WEIGHT_6': 0.8188259511759168, 'WEIGHT_7': 0.3219001447586682, 'WEIGHT_8': 0.3509206015870269, 'optimizer': 'Adam'}. Best is trial 51 with value: 0.41438326562364947.
/userhome/cs2/dingruiw/conda/envs/py310/lib/python3.10/site-packages/torch/nn/modules/rnn.py:82: UserWarning: dropout option adds dropout after all but last recurrent layer, so non-zero dropout expects num_layers greater than 1, but got dropout=0.35687213254400896 and num_layers=1
  warnings.warn("dropout option adds dropout after all but last "
{'EMBEDDING_DIM': 1005, 'HIDDEN_DIM': 763, 'NUM_LAYERS': 1, 'DROPOUT': 0.3363092751634053, 'LR': 0.0018428926175966674, 'WEIGHT_0': 0.5175077604295704, 'WEIGHT_1': 0.8060292455315768, 'WEIGHT_2': 0.6603539039048844, 'WEIGHT_3': 0.880242049768582, 'WEIGHT_4': 0.9865997563437978, 'WEIGHT_5': 0.5025354961559275, 'WEIGHT_6': 0.8188259511759168, 'WEIGHT_7': 0.3219001447586682, 'WEIGHT_8': 0.3509206015870269, 'optimizer': 'Adam'}
0
              precision    recall  f1-score   support

         LOC       0.06      0.04      0.05      1837
        MISC       0.02      0.01      0.01       922
         ORG       0.05      0.07      0.06      1341
         PER       0.03      0.02      0.02      1842

   micro avg       0.04      0.04      0.04      5942
   macro avg       0.04      0.03      0.04      5942
weighted avg       0.04      0.04      0.04      5942

{'EMBEDDING_DIM': 1005, 'HIDDEN_DIM': 763, 'NUM_LAYERS': 1, 'DROPOUT': 0.3363092751634053, 'LR': 0.0018428926175966674, 'WEIGHT_0': 0.5175077604295704, 'WEIGHT_1': 0.8060292455315768, 'WEIGHT_2': 0.6603539039048844, 'WEIGHT_3': 0.880242049768582, 'WEIGHT_4': 0.9865997563437978, 'WEIGHT_5': 0.5025354961559275, 'WEIGHT_6': 0.8188259511759168, 'WEIGHT_7': 0.3219001447586682, 'WEIGHT_8': 0.3509206015870269, 'optimizer': 'Adam'}
49
              precision    recall  f1-score   support

         LOC       0.64      0.47      0.54      1837
        MISC       0.38      0.39      0.39       922
         ORG       0.20      0.32      0.25      1341
         PER       0.34      0.38      0.36      1842

   micro avg       0.36      0.40      0.38      5942
   macro avg       0.39      0.39      0.38      5942
weighted avg       0.41      0.40      0.39      5942

epoch 49
LSTM
  0%|          | 0/50 [00:00<?, ?it/s]  2%|▏         | 1/50 [00:04<03:56,  4.83s/it]  4%|▍         | 2/50 [00:04<01:38,  2.06s/it]  6%|▌         | 3/50 [00:05<00:57,  1.22s/it]  8%|▊         | 4/50 [00:05<00:37,  1.22it/s] 10%|█         | 5/50 [00:05<00:27,  1.66it/s] 12%|█▏        | 6/50 [00:05<00:20,  2.13it/s] 14%|█▍        | 7/50 [00:06<00:16,  2.59it/s] 16%|█▌        | 8/50 [00:06<00:13,  3.03it/s] 18%|█▊        | 9/50 [00:06<00:12,  3.41it/s] 20%|██        | 10/50 [00:06<00:10,  3.72it/s] 22%|██▏       | 11/50 [00:06<00:09,  3.98it/s] 24%|██▍       | 12/50 [00:07<00:09,  4.17it/s] 26%|██▌       | 13/50 [00:07<00:08,  4.32it/s] 28%|██▊       | 14/50 [00:07<00:08,  4.42it/s] 30%|███       | 15/50 [00:07<00:07,  4.51it/s] 32%|███▏      | 16/50 [00:07<00:07,  4.56it/s] 34%|███▍      | 17/50 [00:08<00:07,  4.61it/s] 36%|███▌      | 18/50 [00:08<00:06,  4.63it/s] 38%|███▊      | 19/50 [00:08<00:06,  4.65it/s] 40%|████      | 20/50 [00:08<00:06,  4.67it/s] 42%|████▏     | 21/50 [00:08<00:06,  4.68it/s] 44%|████▍     | 22/50 [00:09<00:05,  4.68it/s] 46%|████▌     | 23/50 [00:09<00:05,  4.69it/s] 48%|████▊     | 24/50 [00:09<00:05,  4.69it/s] 50%|█████     | 25/50 [00:09<00:05,  4.69it/s] 52%|█████▏    | 26/50 [00:10<00:05,  4.69it/s] 54%|█████▍    | 27/50 [00:10<00:04,  4.69it/s] 56%|█████▌    | 28/50 [00:10<00:04,  4.69it/s] 58%|█████▊    | 29/50 [00:10<00:04,  4.71it/s] 60%|██████    | 30/50 [00:10<00:04,  4.69it/s] 62%|██████▏   | 31/50 [00:11<00:04,  4.69it/s] 64%|██████▍   | 32/50 [00:11<00:03,  4.68it/s] 66%|██████▌   | 33/50 [00:11<00:03,  4.68it/s] 68%|██████▊   | 34/50 [00:11<00:03,  4.68it/s] 70%|███████   | 35/50 [00:11<00:03,  4.68it/s] 72%|███████▏  | 36/50 [00:12<00:02,  4.68it/s] 74%|███████▍  | 37/50 [00:12<00:02,  4.68it/s] 76%|███████▌  | 38/50 [00:12<00:02,  4.68it/s] 78%|███████▊  | 39/50 [00:12<00:02,  4.68it/s] 80%|████████  | 40/50 [00:13<00:02,  4.68it/s] 82%|████████▏ | 41/50 [00:13<00:01,  4.68it/s] 84%|████████▍ | 42/50 [00:13<00:01,  4.68it/s] 86%|████████▌ | 43/50 [00:13<00:01,  4.67it/s] 88%|████████▊ | 44/50 [00:13<00:01,  4.67it/s] 90%|█████████ | 45/50 [00:14<00:01,  4.67it/s] 92%|█████████▏| 46/50 [00:14<00:00,  4.67it/s] 94%|█████████▍| 47/50 [00:14<00:00,  4.67it/s] 96%|█████████▌| 48/50 [00:14<00:00,  4.67it/s] 98%|█████████▊| 49/50 [00:14<00:00,  4.67it/s]100%|██████████| 50/50 [00:19<00:00,  1.62s/it]100%|██████████| 50/50 [00:19<00:00,  2.52it/s]
[I 2023-12-10 22:16:25,361] Trial 107 finished with value: 0.3970856102003643 and parameters: {'EMBEDDING_DIM': 823, 'HIDDEN_DIM': 336, 'NUM_LAYERS': 1, 'DROPOUT': 0.35687213254400896, 'LR': 0.0012683548694187702, 'WEIGHT_0': 0.4090783333949175, 'WEIGHT_1': 0.8306705451833022, 'WEIGHT_2': 0.6257133802731976, 'WEIGHT_3': 0.9301599712427279, 'WEIGHT_4': 0.9476386258842442, 'WEIGHT_5': 0.6544474700504169, 'WEIGHT_6': 0.8777414993113412, 'WEIGHT_7': 0.41417770435897544, 'WEIGHT_8': 0.5298135010527938, 'optimizer': 'Adam'}. Best is trial 51 with value: 0.41438326562364947.
{'EMBEDDING_DIM': 823, 'HIDDEN_DIM': 336, 'NUM_LAYERS': 1, 'DROPOUT': 0.35687213254400896, 'LR': 0.0012683548694187702, 'WEIGHT_0': 0.4090783333949175, 'WEIGHT_1': 0.8306705451833022, 'WEIGHT_2': 0.6257133802731976, 'WEIGHT_3': 0.9301599712427279, 'WEIGHT_4': 0.9476386258842442, 'WEIGHT_5': 0.6544474700504169, 'WEIGHT_6': 0.8777414993113412, 'WEIGHT_7': 0.41417770435897544, 'WEIGHT_8': 0.5298135010527938, 'optimizer': 'Adam'}
0
              precision    recall  f1-score   support

         LOC       0.05      0.15      0.07      1837
        MISC       0.01      0.04      0.02       922
         ORG       0.04      0.07      0.05      1341
         PER       0.02      0.07      0.03      1842

   micro avg       0.03      0.09      0.04      5942
   macro avg       0.03      0.08      0.04      5942
weighted avg       0.03      0.09      0.04      5942

{'EMBEDDING_DIM': 823, 'HIDDEN_DIM': 336, 'NUM_LAYERS': 1, 'DROPOUT': 0.35687213254400896, 'LR': 0.0012683548694187702, 'WEIGHT_0': 0.4090783333949175, 'WEIGHT_1': 0.8306705451833022, 'WEIGHT_2': 0.6257133802731976, 'WEIGHT_3': 0.9301599712427279, 'WEIGHT_4': 0.9476386258842442, 'WEIGHT_5': 0.6544474700504169, 'WEIGHT_6': 0.8777414993113412, 'WEIGHT_7': 0.41417770435897544, 'WEIGHT_8': 0.5298135010527938, 'optimizer': 'Adam'}
49
              precision    recall  f1-score   support

         LOC       0.57      0.54      0.56      1837
        MISC       0.44      0.44      0.44       922
         ORG       0.25      0.25      0.25      1341
         PER       0.31      0.36      0.33      1842

   micro avg       0.39      0.40      0.40      5942
   macro avg       0.39      0.40      0.39      5942
weighted avg       0.40      0.40      0.40      5942

epoch 49
LSTM
  0%|          | 0/50 [00:00<?, ?it/s]  2%|▏         | 1/50 [00:05<04:38,  5.68s/it]  4%|▍         | 2/50 [00:05<01:56,  2.43s/it]  6%|▌         | 3/50 [00:06<01:11,  1.52s/it]  8%|▊         | 4/50 [00:06<00:50,  1.09s/it] 10%|█         | 5/50 [00:07<00:38,  1.17it/s] 12%|█▏        | 6/50 [00:07<00:31,  1.40it/s] 14%|█▍        | 7/50 [00:08<00:26,  1.60it/s] 16%|█▌        | 8/50 [00:08<00:23,  1.77it/s] 18%|█▊        | 9/50 [00:08<00:21,  1.90it/s] 20%|██        | 10/50 [00:09<00:19,  2.00it/s] 22%|██▏       | 11/50 [00:09<00:18,  2.08it/s] 24%|██▍       | 12/50 [00:10<00:17,  2.14it/s] 26%|██▌       | 13/50 [00:10<00:16,  2.18it/s] 28%|██▊       | 14/50 [00:11<00:16,  2.21it/s] 30%|███       | 15/50 [00:11<00:15,  2.23it/s] 32%|███▏      | 16/50 [00:11<00:15,  2.24it/s] 34%|███▍      | 17/50 [00:12<00:14,  2.26it/s] 36%|███▌      | 18/50 [00:12<00:14,  2.26it/s] 38%|███▊      | 19/50 [00:13<00:13,  2.26it/s] 40%|████      | 20/50 [00:13<00:13,  2.27it/s] 42%|████▏     | 21/50 [00:14<00:12,  2.27it/s] 44%|████▍     | 22/50 [00:14<00:12,  2.27it/s] 46%|████▌     | 23/50 [00:15<00:11,  2.28it/s] 48%|████▊     | 24/50 [00:15<00:11,  2.27it/s] 50%|█████     | 25/50 [00:15<00:11,  2.27it/s] 52%|█████▏    | 26/50 [00:16<00:10,  2.27it/s] 54%|█████▍    | 27/50 [00:16<00:10,  2.27it/s] 56%|█████▌    | 28/50 [00:17<00:09,  2.27it/s] 58%|█████▊    | 29/50 [00:17<00:09,  2.27it/s] 60%|██████    | 30/50 [00:18<00:08,  2.27it/s] 62%|██████▏   | 31/50 [00:18<00:08,  2.27it/s] 64%|██████▍   | 32/50 [00:19<00:07,  2.27it/s] 66%|██████▌   | 33/50 [00:19<00:07,  2.27it/s] 68%|██████▊   | 34/50 [00:19<00:07,  2.27it/s] 70%|███████   | 35/50 [00:20<00:06,  2.28it/s] 72%|███████▏  | 36/50 [00:20<00:06,  2.27it/s] 74%|███████▍  | 37/50 [00:21<00:05,  2.27it/s] 76%|███████▌  | 38/50 [00:21<00:05,  2.26it/s] 78%|███████▊  | 39/50 [00:22<00:04,  2.26it/s] 80%|████████  | 40/50 [00:22<00:04,  2.26it/s] 82%|████████▏ | 41/50 [00:22<00:03,  2.26it/s] 84%|████████▍ | 42/50 [00:23<00:03,  2.26it/s] 86%|████████▌ | 43/50 [00:23<00:03,  2.26it/s] 88%|████████▊ | 44/50 [00:24<00:02,  2.26it/s] 90%|█████████ | 45/50 [00:24<00:02,  2.26it/s] 92%|█████████▏| 46/50 [00:25<00:01,  2.26it/s] 94%|█████████▍| 47/50 [00:25<00:01,  2.26it/s] 96%|█████████▌| 48/50 [00:26<00:00,  2.27it/s] 98%|█████████▊| 49/50 [00:26<00:00,  2.26it/s]100%|██████████| 50/50 [00:32<00:00,  2.12s/it]100%|██████████| 50/50 [00:32<00:00,  1.54it/s]
[I 2023-12-10 22:17:02,959] Trial 108 finished with value: 0.37756650954701604 and parameters: {'EMBEDDING_DIM': 947, 'HIDDEN_DIM': 390, 'NUM_LAYERS': 2, 'DROPOUT': 0.3061241919766718, 'LR': 0.0015951935832524, 'WEIGHT_0': 0.48970853053253327, 'WEIGHT_1': 0.7461914558049305, 'WEIGHT_2': 0.535811252642903, 'WEIGHT_3': 0.9972040653054209, 'WEIGHT_4': 0.7773272148847383, 'WEIGHT_5': 0.4292370149960971, 'WEIGHT_6': 0.9471901456828328, 'WEIGHT_7': 0.34223797857220883, 'WEIGHT_8': 0.45170459667201474, 'optimizer': 'Adam'}. Best is trial 51 with value: 0.41438326562364947.
/userhome/cs2/dingruiw/conda/envs/py310/lib/python3.10/site-packages/torch/nn/modules/rnn.py:82: UserWarning: dropout option adds dropout after all but last recurrent layer, so non-zero dropout expects num_layers greater than 1, but got dropout=0.349521913261968 and num_layers=1
  warnings.warn("dropout option adds dropout after all but last "
{'EMBEDDING_DIM': 947, 'HIDDEN_DIM': 390, 'NUM_LAYERS': 2, 'DROPOUT': 0.3061241919766718, 'LR': 0.0015951935832524, 'WEIGHT_0': 0.48970853053253327, 'WEIGHT_1': 0.7461914558049305, 'WEIGHT_2': 0.535811252642903, 'WEIGHT_3': 0.9972040653054209, 'WEIGHT_4': 0.7773272148847383, 'WEIGHT_5': 0.4292370149960971, 'WEIGHT_6': 0.9471901456828328, 'WEIGHT_7': 0.34223797857220883, 'WEIGHT_8': 0.45170459667201474, 'optimizer': 'Adam'}
0
              precision    recall  f1-score   support

         LOC       0.05      0.01      0.02      1837
        MISC       0.02      0.02      0.02       922
         ORG       0.08      0.00      0.00      1341
         PER       0.01      0.00      0.00      1842

   micro avg       0.03      0.01      0.01      5942
   macro avg       0.04      0.01      0.01      5942
weighted avg       0.04      0.01      0.01      5942

{'EMBEDDING_DIM': 947, 'HIDDEN_DIM': 390, 'NUM_LAYERS': 2, 'DROPOUT': 0.3061241919766718, 'LR': 0.0015951935832524, 'WEIGHT_0': 0.48970853053253327, 'WEIGHT_1': 0.7461914558049305, 'WEIGHT_2': 0.535811252642903, 'WEIGHT_3': 0.9972040653054209, 'WEIGHT_4': 0.7773272148847383, 'WEIGHT_5': 0.4292370149960971, 'WEIGHT_6': 0.9471901456828328, 'WEIGHT_7': 0.34223797857220883, 'WEIGHT_8': 0.45170459667201474, 'optimizer': 'Adam'}
49
              precision    recall  f1-score   support

         LOC       0.54      0.54      0.54      1837
        MISC       0.24      0.34      0.28       922
         ORG       0.25      0.26      0.26      1341
         PER       0.34      0.38      0.36      1842

   micro avg       0.36      0.40      0.38      5942
   macro avg       0.35      0.38      0.36      5942
weighted avg       0.37      0.40      0.38      5942

epoch 49
LSTM
  0%|          | 0/50 [00:00<?, ?it/s]  2%|▏         | 1/50 [00:04<04:04,  5.00s/it]  4%|▍         | 2/50 [00:05<01:44,  2.19s/it]  6%|▌         | 3/50 [00:05<01:04,  1.38s/it]  8%|▊         | 4/50 [00:06<00:46,  1.00s/it] 10%|█         | 5/50 [00:06<00:35,  1.26it/s] 12%|█▏        | 6/50 [00:06<00:29,  1.50it/s] 14%|█▍        | 7/50 [00:07<00:25,  1.70it/s] 16%|█▌        | 8/50 [00:07<00:22,  1.87it/s] 18%|█▊        | 9/50 [00:08<00:20,  2.01it/s] 20%|██        | 10/50 [00:08<00:18,  2.11it/s] 22%|██▏       | 11/50 [00:09<00:17,  2.18it/s] 24%|██▍       | 12/50 [00:09<00:16,  2.24it/s] 26%|██▌       | 13/50 [00:09<00:16,  2.27it/s] 28%|██▊       | 14/50 [00:10<00:15,  2.30it/s] 30%|███       | 15/50 [00:10<00:15,  2.32it/s] 32%|███▏      | 16/50 [00:11<00:14,  2.33it/s] 34%|███▍      | 17/50 [00:11<00:14,  2.33it/s] 36%|███▌      | 18/50 [00:11<00:13,  2.34it/s] 38%|███▊      | 19/50 [00:12<00:13,  2.35it/s] 40%|████      | 20/50 [00:12<00:12,  2.35it/s] 42%|████▏     | 21/50 [00:13<00:12,  2.35it/s] 44%|████▍     | 22/50 [00:13<00:11,  2.36it/s] 46%|████▌     | 23/50 [00:14<00:11,  2.36it/s] 48%|████▊     | 24/50 [00:14<00:11,  2.36it/s] 50%|█████     | 25/50 [00:14<00:10,  2.36it/s] 52%|█████▏    | 26/50 [00:15<00:10,  2.37it/s] 54%|█████▍    | 27/50 [00:15<00:09,  2.36it/s] 56%|█████▌    | 28/50 [00:16<00:09,  2.35it/s] 58%|█████▊    | 29/50 [00:16<00:08,  2.35it/s] 60%|██████    | 30/50 [00:17<00:08,  2.34it/s] 62%|██████▏   | 31/50 [00:17<00:08,  2.34it/s] 64%|██████▍   | 32/50 [00:17<00:07,  2.34it/s] 66%|██████▌   | 33/50 [00:18<00:07,  2.33it/s] 68%|██████▊   | 34/50 [00:18<00:06,  2.34it/s] 70%|███████   | 35/50 [00:19<00:06,  2.35it/s] 72%|███████▏  | 36/50 [00:19<00:05,  2.36it/s] 74%|███████▍  | 37/50 [00:20<00:05,  2.35it/s] 76%|███████▌  | 38/50 [00:20<00:05,  2.35it/s] 78%|███████▊  | 39/50 [00:20<00:04,  2.35it/s] 80%|████████  | 40/50 [00:21<00:04,  2.34it/s] 82%|████████▏ | 41/50 [00:21<00:03,  2.35it/s] 84%|████████▍ | 42/50 [00:22<00:03,  2.35it/s] 86%|████████▌ | 43/50 [00:22<00:02,  2.35it/s] 88%|████████▊ | 44/50 [00:23<00:02,  2.35it/s] 90%|█████████ | 45/50 [00:23<00:02,  2.35it/s] 92%|█████████▏| 46/50 [00:23<00:01,  2.34it/s] 94%|█████████▍| 47/50 [00:24<00:01,  2.34it/s] 96%|█████████▌| 48/50 [00:24<00:00,  2.34it/s] 98%|█████████▊| 49/50 [00:25<00:00,  2.34it/s]100%|██████████| 50/50 [00:30<00:00,  1.82s/it]100%|██████████| 50/50 [00:30<00:00,  1.65it/s]
