[I 2023-12-10 22:00:35,453] Trial 85 finished with value: 0.39587005791991947 and parameters: {'EMBEDDING_DIM': 992, 'HIDDEN_DIM': 325, 'NUM_LAYERS': 1, 'DROPOUT': 0.3230654896720469, 'LR': 0.0016285351308766465, 'WEIGHT_0': 0.45693590469887624, 'WEIGHT_1': 0.7440643806021698, 'WEIGHT_2': 0.5655314202985305, 'WEIGHT_3': 0.8156414251684287, 'WEIGHT_4': 0.9404710596729194, 'WEIGHT_5': 0.4598536541719539, 'WEIGHT_6': 0.9397872598446992, 'WEIGHT_7': 0.2986578971048282, 'WEIGHT_8': 0.431719688171731, 'optimizer': 'RMSprop'}. Best is trial 51 with value: 0.41438326562364947.
/userhome/cs2/dingruiw/conda/envs/py310/lib/python3.10/site-packages/torch/nn/modules/rnn.py:82: UserWarning: dropout option adds dropout after all but last recurrent layer, so non-zero dropout expects num_layers greater than 1, but got dropout=0.3033372593322962 and num_layers=1
  warnings.warn("dropout option adds dropout after all but last "
{'EMBEDDING_DIM': 992, 'HIDDEN_DIM': 325, 'NUM_LAYERS': 1, 'DROPOUT': 0.3230654896720469, 'LR': 0.0016285351308766465, 'WEIGHT_0': 0.45693590469887624, 'WEIGHT_1': 0.7440643806021698, 'WEIGHT_2': 0.5655314202985305, 'WEIGHT_3': 0.8156414251684287, 'WEIGHT_4': 0.9404710596729194, 'WEIGHT_5': 0.4598536541719539, 'WEIGHT_6': 0.9397872598446992, 'WEIGHT_7': 0.2986578971048282, 'WEIGHT_8': 0.431719688171731, 'optimizer': 'RMSprop'}
0
              precision    recall  f1-score   support

         LOC       0.17      0.06      0.09      1837
        MISC       0.04      0.02      0.02       922
         ORG       0.12      0.02      0.04      1341
         PER       0.06      0.03      0.04      1842

   micro avg       0.10      0.04      0.05      5942
   macro avg       0.10      0.03      0.05      5942
weighted avg       0.11      0.04      0.05      5942

{'EMBEDDING_DIM': 992, 'HIDDEN_DIM': 325, 'NUM_LAYERS': 1, 'DROPOUT': 0.3230654896720469, 'LR': 0.0016285351308766465, 'WEIGHT_0': 0.45693590469887624, 'WEIGHT_1': 0.7440643806021698, 'WEIGHT_2': 0.5655314202985305, 'WEIGHT_3': 0.8156414251684287, 'WEIGHT_4': 0.9404710596729194, 'WEIGHT_5': 0.4598536541719539, 'WEIGHT_6': 0.9397872598446992, 'WEIGHT_7': 0.2986578971048282, 'WEIGHT_8': 0.431719688171731, 'optimizer': 'RMSprop'}
49
              precision    recall  f1-score   support

         LOC       0.57      0.51      0.54      1837
        MISC       0.45      0.47      0.46       922
         ORG       0.26      0.26      0.26      1341
         PER       0.31      0.35      0.33      1842

   micro avg       0.39      0.40      0.40      5942
   macro avg       0.40      0.40      0.40      5942
weighted avg       0.40      0.40      0.40      5942

epoch 49
LSTM
  0%|          | 0/50 [00:00<?, ?it/s]  2%|▏         | 1/50 [00:04<04:01,  4.93s/it]  4%|▍         | 2/50 [00:05<01:43,  2.17s/it]  6%|▌         | 3/50 [00:05<01:04,  1.38s/it]  8%|▊         | 4/50 [00:06<00:46,  1.00s/it] 10%|█         | 5/50 [00:06<00:35,  1.25it/s] 12%|█▏        | 6/50 [00:06<00:29,  1.48it/s] 14%|█▍        | 7/50 [00:07<00:25,  1.68it/s] 16%|█▌        | 8/50 [00:07<00:22,  1.84it/s] 18%|█▊        | 9/50 [00:08<00:20,  1.96it/s] 20%|██        | 10/50 [00:08<00:19,  2.06it/s] 22%|██▏       | 11/50 [00:09<00:18,  2.13it/s] 24%|██▍       | 12/50 [00:09<00:17,  2.18it/s] 26%|██▌       | 13/50 [00:09<00:16,  2.22it/s] 28%|██▊       | 14/50 [00:10<00:15,  2.25it/s] 30%|███       | 15/50 [00:10<00:15,  2.27it/s] 32%|███▏      | 16/50 [00:11<00:14,  2.27it/s] 34%|███▍      | 17/50 [00:11<00:14,  2.27it/s] 36%|███▌      | 18/50 [00:12<00:14,  2.27it/s] 38%|███▊      | 19/50 [00:12<00:13,  2.28it/s] 40%|████      | 20/50 [00:12<00:13,  2.28it/s] 42%|████▏     | 21/50 [00:13<00:12,  2.29it/s] 44%|████▍     | 22/50 [00:13<00:12,  2.29it/s] 46%|████▌     | 23/50 [00:14<00:11,  2.29it/s] 48%|████▊     | 24/50 [00:14<00:11,  2.29it/s] 50%|█████     | 25/50 [00:15<00:10,  2.28it/s] 52%|█████▏    | 26/50 [00:15<00:10,  2.28it/s] 54%|█████▍    | 27/50 [00:16<00:10,  2.28it/s] 56%|█████▌    | 28/50 [00:16<00:09,  2.29it/s] 58%|█████▊    | 29/50 [00:16<00:09,  2.29it/s] 60%|██████    | 30/50 [00:17<00:08,  2.30it/s] 62%|██████▏   | 31/50 [00:17<00:08,  2.29it/s] 64%|██████▍   | 32/50 [00:18<00:07,  2.29it/s] 66%|██████▌   | 33/50 [00:18<00:07,  2.29it/s] 68%|██████▊   | 34/50 [00:19<00:06,  2.29it/s] 70%|███████   | 35/50 [00:19<00:06,  2.29it/s] 72%|███████▏  | 36/50 [00:19<00:06,  2.29it/s] 74%|███████▍  | 37/50 [00:20<00:05,  2.30it/s] 76%|███████▌  | 38/50 [00:20<00:05,  2.30it/s] 78%|███████▊  | 39/50 [00:21<00:04,  2.30it/s] 80%|████████  | 40/50 [00:21<00:04,  2.29it/s] 82%|████████▏ | 41/50 [00:22<00:03,  2.30it/s] 84%|████████▍ | 42/50 [00:22<00:03,  2.30it/s] 86%|████████▌ | 43/50 [00:23<00:03,  2.29it/s] 88%|████████▊ | 44/50 [00:23<00:02,  2.29it/s] 90%|█████████ | 45/50 [00:23<00:02,  2.28it/s] 92%|█████████▏| 46/50 [00:24<00:01,  2.28it/s] 94%|█████████▍| 47/50 [00:24<00:01,  2.29it/s] 96%|█████████▌| 48/50 [00:25<00:00,  2.29it/s] 98%|█████████▊| 49/50 [00:25<00:00,  2.28it/s]100%|██████████| 50/50 [00:30<00:00,  1.83s/it]100%|██████████| 50/50 [00:30<00:00,  1.63it/s]
[I 2023-12-10 22:01:10,424] Trial 86 finished with value: 0.3924016282225238 and parameters: {'EMBEDDING_DIM': 959, 'HIDDEN_DIM': 617, 'NUM_LAYERS': 1, 'DROPOUT': 0.3033372593322962, 'LR': 0.0005821970417803621, 'WEIGHT_0': 0.4221785434049003, 'WEIGHT_1': 0.7123458409650111, 'WEIGHT_2': 0.7043128294754329, 'WEIGHT_3': 0.8968726570121898, 'WEIGHT_4': 0.8272944195054286, 'WEIGHT_5': 0.43105949233344254, 'WEIGHT_6': 0.856889571789778, 'WEIGHT_7': 0.41431027189492986, 'WEIGHT_8': 0.47072605950890545, 'optimizer': 'RMSprop'}. Best is trial 51 with value: 0.41438326562364947.
/userhome/cs2/dingruiw/conda/envs/py310/lib/python3.10/site-packages/torch/nn/modules/rnn.py:82: UserWarning: dropout option adds dropout after all but last recurrent layer, so non-zero dropout expects num_layers greater than 1, but got dropout=0.28258611530429145 and num_layers=1
  warnings.warn("dropout option adds dropout after all but last "
{'EMBEDDING_DIM': 959, 'HIDDEN_DIM': 617, 'NUM_LAYERS': 1, 'DROPOUT': 0.3033372593322962, 'LR': 0.0005821970417803621, 'WEIGHT_0': 0.4221785434049003, 'WEIGHT_1': 0.7123458409650111, 'WEIGHT_2': 0.7043128294754329, 'WEIGHT_3': 0.8968726570121898, 'WEIGHT_4': 0.8272944195054286, 'WEIGHT_5': 0.43105949233344254, 'WEIGHT_6': 0.856889571789778, 'WEIGHT_7': 0.41431027189492986, 'WEIGHT_8': 0.47072605950890545, 'optimizer': 'RMSprop'}
0
              precision    recall  f1-score   support

         LOC       0.07      0.04      0.05      1837
        MISC       0.04      0.03      0.03       922
         ORG       0.08      0.06      0.07      1341
         PER       0.03      0.02      0.03      1842

   micro avg       0.05      0.04      0.04      5942
   macro avg       0.06      0.04      0.04      5942
weighted avg       0.06      0.04      0.04      5942

{'EMBEDDING_DIM': 959, 'HIDDEN_DIM': 617, 'NUM_LAYERS': 1, 'DROPOUT': 0.3033372593322962, 'LR': 0.0005821970417803621, 'WEIGHT_0': 0.4221785434049003, 'WEIGHT_1': 0.7123458409650111, 'WEIGHT_2': 0.7043128294754329, 'WEIGHT_3': 0.8968726570121898, 'WEIGHT_4': 0.8272944195054286, 'WEIGHT_5': 0.43105949233344254, 'WEIGHT_6': 0.856889571789778, 'WEIGHT_7': 0.41431027189492986, 'WEIGHT_8': 0.47072605950890545, 'optimizer': 'RMSprop'}
49
              precision    recall  f1-score   support

         LOC       0.63      0.48      0.55      1837
        MISC       0.44      0.41      0.42       922
         ORG       0.28      0.24      0.26      1341
         PER       0.34      0.32      0.33      1842

   micro avg       0.42      0.37      0.39      5942
   macro avg       0.42      0.36      0.39      5942
weighted avg       0.43      0.37      0.40      5942

epoch 49
LSTM
  0%|          | 0/50 [00:00<?, ?it/s]  2%|▏         | 1/50 [00:04<03:54,  4.79s/it]  4%|▍         | 2/50 [00:04<01:39,  2.07s/it]  6%|▌         | 3/50 [00:05<00:59,  1.27s/it]  8%|▊         | 4/50 [00:05<00:40,  1.14it/s] 10%|█         | 5/50 [00:05<00:30,  1.49it/s] 12%|█▏        | 6/50 [00:06<00:24,  1.83it/s] 14%|█▍        | 7/50 [00:06<00:19,  2.15it/s] 16%|█▌        | 8/50 [00:06<00:17,  2.43it/s] 18%|█▊        | 9/50 [00:07<00:15,  2.65it/s] 20%|██        | 10/50 [00:07<00:14,  2.83it/s] 22%|██▏       | 11/50 [00:07<00:13,  2.96it/s] 24%|██▍       | 12/50 [00:07<00:12,  3.06it/s] 26%|██▌       | 13/50 [00:08<00:11,  3.14it/s] 28%|██▊       | 14/50 [00:08<00:11,  3.20it/s] 30%|███       | 15/50 [00:08<00:10,  3.23it/s] 32%|███▏      | 16/50 [00:09<00:10,  3.25it/s] 34%|███▍      | 17/50 [00:09<00:10,  3.27it/s] 36%|███▌      | 18/50 [00:09<00:09,  3.29it/s] 38%|███▊      | 19/50 [00:10<00:09,  3.30it/s] 40%|████      | 20/50 [00:10<00:09,  3.31it/s] 42%|████▏     | 21/50 [00:10<00:08,  3.31it/s] 44%|████▍     | 22/50 [00:10<00:08,  3.31it/s] 46%|████▌     | 23/50 [00:11<00:08,  3.31it/s] 48%|████▊     | 24/50 [00:11<00:07,  3.31it/s] 50%|█████     | 25/50 [00:11<00:07,  3.31it/s] 52%|█████▏    | 26/50 [00:12<00:07,  3.31it/s] 54%|█████▍    | 27/50 [00:12<00:06,  3.32it/s] 56%|█████▌    | 28/50 [00:12<00:06,  3.32it/s] 58%|█████▊    | 29/50 [00:13<00:06,  3.32it/s] 60%|██████    | 30/50 [00:13<00:06,  3.31it/s] 62%|██████▏   | 31/50 [00:13<00:05,  3.31it/s] 64%|██████▍   | 32/50 [00:13<00:05,  3.30it/s] 66%|██████▌   | 33/50 [00:14<00:05,  3.30it/s] 68%|██████▊   | 34/50 [00:14<00:04,  3.30it/s] 70%|███████   | 35/50 [00:14<00:04,  3.31it/s] 72%|███████▏  | 36/50 [00:15<00:04,  3.31it/s] 74%|███████▍  | 37/50 [00:15<00:03,  3.31it/s] 76%|███████▌  | 38/50 [00:15<00:03,  3.31it/s] 78%|███████▊  | 39/50 [00:16<00:03,  3.31it/s] 80%|████████  | 40/50 [00:16<00:03,  3.30it/s] 82%|████████▏ | 41/50 [00:16<00:02,  3.30it/s] 84%|████████▍ | 42/50 [00:17<00:02,  3.30it/s] 86%|████████▌ | 43/50 [00:17<00:02,  3.30it/s] 88%|████████▊ | 44/50 [00:17<00:01,  3.30it/s] 90%|█████████ | 45/50 [00:17<00:01,  3.29it/s] 92%|█████████▏| 46/50 [00:18<00:01,  3.30it/s] 94%|█████████▍| 47/50 [00:18<00:00,  3.30it/s] 96%|█████████▌| 48/50 [00:18<00:00,  3.30it/s] 98%|█████████▊| 49/50 [00:19<00:00,  3.30it/s]100%|██████████| 50/50 [00:24<00:00,  1.70s/it]100%|██████████| 50/50 [00:24<00:00,  2.07it/s]
[I 2023-12-10 22:01:38,821] Trial 87 finished with value: 0.39330184628595966 and parameters: {'EMBEDDING_DIM': 1022, 'HIDDEN_DIM': 452, 'NUM_LAYERS': 1, 'DROPOUT': 0.28258611530429145, 'LR': 0.0010783202880976245, 'WEIGHT_0': 0.527285645377449, 'WEIGHT_1': 0.6248185179268613, 'WEIGHT_2': 0.5993018236240006, 'WEIGHT_3': 0.9829250746890796, 'WEIGHT_4': 0.9233130197409728, 'WEIGHT_5': 0.47371053938706553, 'WEIGHT_6': 0.9169019739093297, 'WEIGHT_7': 0.37550568235197607, 'WEIGHT_8': 0.37563843047179923, 'optimizer': 'RMSprop'}. Best is trial 51 with value: 0.41438326562364947.
/userhome/cs2/dingruiw/conda/envs/py310/lib/python3.10/site-packages/torch/nn/modules/rnn.py:82: UserWarning: dropout option adds dropout after all but last recurrent layer, so non-zero dropout expects num_layers greater than 1, but got dropout=0.26990062570619877 and num_layers=1
  warnings.warn("dropout option adds dropout after all but last "
{'EMBEDDING_DIM': 1022, 'HIDDEN_DIM': 452, 'NUM_LAYERS': 1, 'DROPOUT': 0.28258611530429145, 'LR': 0.0010783202880976245, 'WEIGHT_0': 0.527285645377449, 'WEIGHT_1': 0.6248185179268613, 'WEIGHT_2': 0.5993018236240006, 'WEIGHT_3': 0.9829250746890796, 'WEIGHT_4': 0.9233130197409728, 'WEIGHT_5': 0.47371053938706553, 'WEIGHT_6': 0.9169019739093297, 'WEIGHT_7': 0.37550568235197607, 'WEIGHT_8': 0.37563843047179923, 'optimizer': 'RMSprop'}
0
              precision    recall  f1-score   support

         LOC       0.25      0.07      0.11      1837
        MISC       0.03      0.02      0.02       922
         ORG       0.05      0.03      0.04      1341
         PER       0.06      0.03      0.04      1842

   micro avg       0.08      0.04      0.06      5942
   macro avg       0.10      0.04      0.05      5942
weighted avg       0.11      0.04      0.06      5942

{'EMBEDDING_DIM': 1022, 'HIDDEN_DIM': 452, 'NUM_LAYERS': 1, 'DROPOUT': 0.28258611530429145, 'LR': 0.0010783202880976245, 'WEIGHT_0': 0.527285645377449, 'WEIGHT_1': 0.6248185179268613, 'WEIGHT_2': 0.5993018236240006, 'WEIGHT_3': 0.9829250746890796, 'WEIGHT_4': 0.9233130197409728, 'WEIGHT_5': 0.47371053938706553, 'WEIGHT_6': 0.9169019739093297, 'WEIGHT_7': 0.37550568235197607, 'WEIGHT_8': 0.37563843047179923, 'optimizer': 'RMSprop'}
49
              precision    recall  f1-score   support

         LOC       0.55      0.51      0.53      1837
        MISC       0.46      0.44      0.45       922
         ORG       0.25      0.23      0.24      1341
         PER       0.34      0.34      0.34      1842

   micro avg       0.40      0.39      0.39      5942
   macro avg       0.40      0.38      0.39      5942
weighted avg       0.40      0.39      0.39      5942

epoch 49
LSTM
  0%|          | 0/50 [00:00<?, ?it/s]  2%|▏         | 1/50 [00:03<03:13,  3.96s/it] 10%|█         | 5/50 [00:04<00:27,  1.63it/s] 18%|█▊        | 9/50 [00:04<00:12,  3.40it/s] 24%|██▍       | 12/50 [00:04<00:07,  5.01it/s] 30%|███       | 15/50 [00:04<00:05,  6.88it/s] 36%|███▌      | 18/50 [00:04<00:03,  9.08it/s] 42%|████▏     | 21/50 [00:04<00:02, 11.32it/s] 48%|████▊     | 24/50 [00:04<00:01, 13.75it/s] 54%|█████▍    | 27/50 [00:04<00:01, 16.02it/s] 60%|██████    | 30/50 [00:05<00:01, 18.14it/s] 66%|██████▌   | 33/50 [00:05<00:00, 19.96it/s] 72%|███████▏  | 36/50 [00:05<00:00, 21.42it/s] 78%|███████▊  | 39/50 [00:05<00:00, 22.56it/s] 84%|████████▍ | 42/50 [00:05<00:00, 23.29it/s] 90%|█████████ | 45/50 [00:05<00:00, 23.93it/s] 96%|█████████▌| 48/50 [00:05<00:00, 24.42it/s]100%|██████████| 50/50 [00:09<00:00,  5.02it/s]
[I 2023-12-10 22:01:52,541] Trial 88 finished with value: 0.26647938196046955 and parameters: {'EMBEDDING_DIM': 859, 'HIDDEN_DIM': 16, 'NUM_LAYERS': 1, 'DROPOUT': 0.26990062570619877, 'LR': 0.0018420067135910597, 'WEIGHT_0': 0.4947915049134381, 'WEIGHT_1': 0.8116949789002279, 'WEIGHT_2': 0.6301109580895816, 'WEIGHT_3': 0.8547855583226505, 'WEIGHT_4': 0.8020545774750929, 'WEIGHT_5': 0.49767703788706213, 'WEIGHT_6': 0.949003432551936, 'WEIGHT_7': 0.25221085378341185, 'WEIGHT_8': 0.5212452544348087, 'optimizer': 'RMSprop'}. Best is trial 51 with value: 0.41438326562364947.
/userhome/cs2/dingruiw/conda/envs/py310/lib/python3.10/site-packages/torch/nn/modules/rnn.py:82: UserWarning: dropout option adds dropout after all but last recurrent layer, so non-zero dropout expects num_layers greater than 1, but got dropout=0.35962888664502596 and num_layers=1
  warnings.warn("dropout option adds dropout after all but last "
{'EMBEDDING_DIM': 859, 'HIDDEN_DIM': 16, 'NUM_LAYERS': 1, 'DROPOUT': 0.26990062570619877, 'LR': 0.0018420067135910597, 'WEIGHT_0': 0.4947915049134381, 'WEIGHT_1': 0.8116949789002279, 'WEIGHT_2': 0.6301109580895816, 'WEIGHT_3': 0.8547855583226505, 'WEIGHT_4': 0.8020545774750929, 'WEIGHT_5': 0.49767703788706213, 'WEIGHT_6': 0.949003432551936, 'WEIGHT_7': 0.25221085378341185, 'WEIGHT_8': 0.5212452544348087, 'optimizer': 'RMSprop'}
0
              precision    recall  f1-score   support

         LOC       0.12      0.01      0.01      1837
        MISC       0.04      0.01      0.02       922
         ORG       0.08      0.06      0.07      1341
         PER       0.04      0.07      0.05      1842

   micro avg       0.05      0.04      0.04      5942
   macro avg       0.07      0.04      0.04      5942
weighted avg       0.07      0.04      0.04      5942

{'EMBEDDING_DIM': 859, 'HIDDEN_DIM': 16, 'NUM_LAYERS': 1, 'DROPOUT': 0.26990062570619877, 'LR': 0.0018420067135910597, 'WEIGHT_0': 0.4947915049134381, 'WEIGHT_1': 0.8116949789002279, 'WEIGHT_2': 0.6301109580895816, 'WEIGHT_3': 0.8547855583226505, 'WEIGHT_4': 0.8020545774750929, 'WEIGHT_5': 0.49767703788706213, 'WEIGHT_6': 0.949003432551936, 'WEIGHT_7': 0.25221085378341185, 'WEIGHT_8': 0.5212452544348087, 'optimizer': 'RMSprop'}
49
              precision    recall  f1-score   support

         LOC       0.65      0.36      0.46      1837
        MISC       0.42      0.21      0.28       922
         ORG       0.28      0.20      0.23      1341
         PER       0.13      0.11      0.12      1842

   micro avg       0.33      0.22      0.27      5942
   macro avg       0.37      0.22      0.27      5942
weighted avg       0.37      0.22      0.28      5942

epoch 49
LSTM
  0%|          | 0/50 [00:00<?, ?it/s]  2%|▏         | 1/50 [00:05<04:07,  5.05s/it]  4%|▍         | 2/50 [00:05<01:47,  2.23s/it]  6%|▌         | 3/50 [00:05<01:08,  1.46s/it]  8%|▊         | 4/50 [00:06<00:50,  1.09s/it] 10%|█         | 5/50 [00:06<00:39,  1.13it/s] 12%|█▏        | 6/50 [00:07<00:33,  1.31it/s] 14%|█▍        | 7/50 [00:07<00:29,  1.45it/s] 16%|█▌        | 8/50 [00:08<00:26,  1.56it/s] 18%|█▊        | 9/50 [00:09<00:24,  1.64it/s] 20%|██        | 10/50 [00:09<00:23,  1.71it/s] 22%|██▏       | 11/50 [00:10<00:22,  1.76it/s] 24%|██▍       | 12/50 [00:10<00:21,  1.79it/s] 26%|██▌       | 13/50 [00:11<00:20,  1.82it/s] 28%|██▊       | 14/50 [00:11<00:19,  1.84it/s] 30%|███       | 15/50 [00:12<00:18,  1.85it/s] 32%|███▏      | 16/50 [00:12<00:18,  1.87it/s] 34%|███▍      | 17/50 [00:13<00:17,  1.87it/s] 36%|███▌      | 18/50 [00:13<00:17,  1.88it/s] 38%|███▊      | 19/50 [00:14<00:16,  1.88it/s] 40%|████      | 20/50 [00:14<00:15,  1.89it/s] 42%|████▏     | 21/50 [00:15<00:15,  1.88it/s] 44%|████▍     | 22/50 [00:15<00:14,  1.89it/s] 46%|████▌     | 23/50 [00:16<00:14,  1.90it/s] 48%|████▊     | 24/50 [00:16<00:13,  1.89it/s] 50%|█████     | 25/50 [00:17<00:13,  1.89it/s] 52%|█████▏    | 26/50 [00:18<00:12,  1.88it/s] 54%|█████▍    | 27/50 [00:18<00:12,  1.88it/s] 56%|█████▌    | 28/50 [00:19<00:11,  1.87it/s] 58%|█████▊    | 29/50 [00:19<00:11,  1.87it/s] 60%|██████    | 30/50 [00:20<00:10,  1.88it/s] 62%|██████▏   | 31/50 [00:20<00:10,  1.87it/s] 64%|██████▍   | 32/50 [00:21<00:09,  1.86it/s] 66%|██████▌   | 33/50 [00:21<00:09,  1.86it/s] 68%|██████▊   | 34/50 [00:22<00:08,  1.87it/s] 70%|███████   | 35/50 [00:22<00:08,  1.87it/s] 72%|███████▏  | 36/50 [00:23<00:07,  1.86it/s] 74%|███████▍  | 37/50 [00:23<00:06,  1.87it/s] 76%|███████▌  | 38/50 [00:24<00:06,  1.86it/s] 78%|███████▊  | 39/50 [00:25<00:05,  1.87it/s] 80%|████████  | 40/50 [00:25<00:05,  1.87it/s] 82%|████████▏ | 41/50 [00:26<00:04,  1.87it/s] 84%|████████▍ | 42/50 [00:26<00:04,  1.87it/s] 86%|████████▌ | 43/50 [00:27<00:03,  1.86it/s] 88%|████████▊ | 44/50 [00:27<00:03,  1.86it/s] 90%|█████████ | 45/50 [00:28<00:02,  1.86it/s] 92%|█████████▏| 46/50 [00:28<00:02,  1.87it/s] 94%|█████████▍| 47/50 [00:29<00:01,  1.87it/s] 96%|█████████▌| 48/50 [00:29<00:01,  1.87it/s] 98%|█████████▊| 49/50 [00:30<00:00,  1.87it/s]100%|██████████| 50/50 [00:35<00:00,  1.94s/it]100%|██████████| 50/50 [00:35<00:00,  1.41it/s]
