[I 2023-12-10 22:58:58,469] Trial 197 finished with value: 0.40697103583701516 and parameters: {'EMBEDDING_DIM': 894, 'HIDDEN_DIM': 260, 'NUM_LAYERS': 1, 'DROPOUT': 0.341563108681323, 'LR': 0.002082901236884714, 'WEIGHT_0': 0.5353405474238748, 'WEIGHT_1': 0.9180124399819352, 'WEIGHT_2': 0.6578893911645322, 'WEIGHT_3': 0.8654374502356579, 'WEIGHT_4': 0.7120689442043021, 'WEIGHT_5': 0.45434529543338187, 'WEIGHT_6': 0.7319497875099352, 'WEIGHT_7': 0.37899831122190014, 'WEIGHT_8': 0.6404132025433387, 'optimizer': 'Adam'}. Best is trial 134 with value: 0.4158467115484205.
/userhome/cs2/dingruiw/conda/envs/py310/lib/python3.10/site-packages/torch/nn/modules/rnn.py:82: UserWarning: dropout option adds dropout after all but last recurrent layer, so non-zero dropout expects num_layers greater than 1, but got dropout=0.2766616710498117 and num_layers=1
  warnings.warn("dropout option adds dropout after all but last "
{'EMBEDDING_DIM': 894, 'HIDDEN_DIM': 260, 'NUM_LAYERS': 1, 'DROPOUT': 0.341563108681323, 'LR': 0.002082901236884714, 'WEIGHT_0': 0.5353405474238748, 'WEIGHT_1': 0.9180124399819352, 'WEIGHT_2': 0.6578893911645322, 'WEIGHT_3': 0.8654374502356579, 'WEIGHT_4': 0.7120689442043021, 'WEIGHT_5': 0.45434529543338187, 'WEIGHT_6': 0.7319497875099352, 'WEIGHT_7': 0.37899831122190014, 'WEIGHT_8': 0.6404132025433387, 'optimizer': 'Adam'}
0
              precision    recall  f1-score   support

         LOC       0.05      0.08      0.06      1837
        MISC       0.02      0.08      0.03       922
         ORG       0.03      0.09      0.05      1341
         PER       0.03      0.04      0.03      1842

   micro avg       0.03      0.07      0.05      5942
   macro avg       0.03      0.07      0.04      5942
weighted avg       0.04      0.07      0.05      5942

{'EMBEDDING_DIM': 894, 'HIDDEN_DIM': 260, 'NUM_LAYERS': 1, 'DROPOUT': 0.341563108681323, 'LR': 0.002082901236884714, 'WEIGHT_0': 0.5353405474238748, 'WEIGHT_1': 0.9180124399819352, 'WEIGHT_2': 0.6578893911645322, 'WEIGHT_3': 0.8654374502356579, 'WEIGHT_4': 0.7120689442043021, 'WEIGHT_5': 0.45434529543338187, 'WEIGHT_6': 0.7319497875099352, 'WEIGHT_7': 0.37899831122190014, 'WEIGHT_8': 0.6404132025433387, 'optimizer': 'Adam'}
49
              precision    recall  f1-score   support

         LOC       0.59      0.55      0.57      1837
        MISC       0.43      0.44      0.44       922
         ORG       0.28      0.28      0.28      1341
         PER       0.30      0.38      0.34      1842

   micro avg       0.40      0.42      0.41      5942
   macro avg       0.40      0.41      0.41      5942
weighted avg       0.41      0.42      0.41      5942

epoch 49
LSTM
  0%|          | 0/50 [00:00<?, ?it/s]  2%|▏         | 1/50 [00:04<03:24,  4.18s/it]  4%|▍         | 2/50 [00:04<01:26,  1.80s/it]  6%|▌         | 3/50 [00:04<00:51,  1.09s/it]  8%|▊         | 4/50 [00:04<00:34,  1.33it/s] 10%|█         | 5/50 [00:05<00:25,  1.77it/s] 12%|█▏        | 6/50 [00:05<00:19,  2.21it/s] 14%|█▍        | 7/50 [00:05<00:16,  2.63it/s] 16%|█▌        | 8/50 [00:05<00:14,  2.99it/s] 18%|█▊        | 9/50 [00:05<00:12,  3.30it/s] 20%|██        | 10/50 [00:06<00:11,  3.55it/s] 22%|██▏       | 11/50 [00:06<00:10,  3.74it/s] 24%|██▍       | 12/50 [00:06<00:09,  3.89it/s] 26%|██▌       | 13/50 [00:06<00:09,  4.00it/s] 28%|██▊       | 14/50 [00:07<00:08,  4.08it/s] 30%|███       | 15/50 [00:07<00:08,  4.13it/s] 32%|███▏      | 16/50 [00:07<00:08,  4.17it/s] 34%|███▍      | 17/50 [00:07<00:07,  4.20it/s] 36%|███▌      | 18/50 [00:08<00:07,  4.22it/s] 38%|███▊      | 19/50 [00:08<00:07,  4.24it/s] 40%|████      | 20/50 [00:08<00:07,  4.24it/s] 42%|████▏     | 21/50 [00:08<00:06,  4.25it/s] 44%|████▍     | 22/50 [00:09<00:06,  4.26it/s] 46%|████▌     | 23/50 [00:09<00:06,  4.26it/s] 48%|████▊     | 24/50 [00:09<00:06,  4.26it/s] 50%|█████     | 25/50 [00:09<00:05,  4.26it/s] 52%|█████▏    | 26/50 [00:09<00:05,  4.27it/s] 54%|█████▍    | 27/50 [00:10<00:05,  4.27it/s] 56%|█████▌    | 28/50 [00:10<00:05,  4.27it/s] 58%|█████▊    | 29/50 [00:10<00:04,  4.27it/s] 60%|██████    | 30/50 [00:10<00:04,  4.27it/s] 62%|██████▏   | 31/50 [00:11<00:04,  4.27it/s] 64%|██████▍   | 32/50 [00:11<00:04,  4.27it/s] 66%|██████▌   | 33/50 [00:11<00:03,  4.27it/s] 68%|██████▊   | 34/50 [00:11<00:03,  4.27it/s] 70%|███████   | 35/50 [00:12<00:03,  4.27it/s] 72%|███████▏  | 36/50 [00:12<00:03,  4.27it/s] 74%|███████▍  | 37/50 [00:12<00:03,  4.27it/s] 76%|███████▌  | 38/50 [00:12<00:02,  4.27it/s] 78%|███████▊  | 39/50 [00:12<00:02,  4.27it/s] 80%|████████  | 40/50 [00:13<00:02,  4.26it/s] 82%|████████▏ | 41/50 [00:13<00:02,  4.27it/s] 84%|████████▍ | 42/50 [00:13<00:01,  4.27it/s] 86%|████████▌ | 43/50 [00:13<00:01,  4.26it/s] 88%|████████▊ | 44/50 [00:14<00:01,  4.27it/s] 90%|█████████ | 45/50 [00:14<00:01,  4.26it/s] 92%|█████████▏| 46/50 [00:14<00:00,  4.27it/s] 94%|█████████▍| 47/50 [00:14<00:00,  4.27it/s] 96%|█████████▌| 48/50 [00:15<00:00,  4.26it/s] 98%|█████████▊| 49/50 [00:15<00:00,  4.26it/s]100%|██████████| 50/50 [00:19<00:00,  1.51s/it]100%|██████████| 50/50 [00:19<00:00,  2.53it/s]
[I 2023-12-10 22:59:22,009] Trial 198 finished with value: 0.40633199230365574 and parameters: {'EMBEDDING_DIM': 1001, 'HIDDEN_DIM': 167, 'NUM_LAYERS': 1, 'DROPOUT': 0.2766616710498117, 'LR': 0.001087760442166815, 'WEIGHT_0': 0.378275515283582, 'WEIGHT_1': 0.4697627167168983, 'WEIGHT_2': 0.5663831249117909, 'WEIGHT_3': 0.4748616296238065, 'WEIGHT_4': 0.9851618268921641, 'WEIGHT_5': 0.5408163900270917, 'WEIGHT_6': 0.7624454220395115, 'WEIGHT_7': 0.8635788520877289, 'WEIGHT_8': 0.38721030563819714, 'optimizer': 'RMSprop'}. Best is trial 134 with value: 0.4158467115484205.
/userhome/cs2/dingruiw/conda/envs/py310/lib/python3.10/site-packages/torch/nn/modules/rnn.py:82: UserWarning: dropout option adds dropout after all but last recurrent layer, so non-zero dropout expects num_layers greater than 1, but got dropout=0.3501032466190861 and num_layers=1
  warnings.warn("dropout option adds dropout after all but last "
{'EMBEDDING_DIM': 1001, 'HIDDEN_DIM': 167, 'NUM_LAYERS': 1, 'DROPOUT': 0.2766616710498117, 'LR': 0.001087760442166815, 'WEIGHT_0': 0.378275515283582, 'WEIGHT_1': 0.4697627167168983, 'WEIGHT_2': 0.5663831249117909, 'WEIGHT_3': 0.4748616296238065, 'WEIGHT_4': 0.9851618268921641, 'WEIGHT_5': 0.5408163900270917, 'WEIGHT_6': 0.7624454220395115, 'WEIGHT_7': 0.8635788520877289, 'WEIGHT_8': 0.38721030563819714, 'optimizer': 'RMSprop'}
0
              precision    recall  f1-score   support

         LOC       0.18      0.07      0.10      1837
        MISC       0.04      0.02      0.03       922
         ORG       0.08      0.01      0.02      1341
         PER       0.09      0.04      0.06      1842

   micro avg       0.10      0.04      0.06      5942
   macro avg       0.10      0.04      0.05      5942
weighted avg       0.11      0.04      0.06      5942

{'EMBEDDING_DIM': 1001, 'HIDDEN_DIM': 167, 'NUM_LAYERS': 1, 'DROPOUT': 0.2766616710498117, 'LR': 0.001087760442166815, 'WEIGHT_0': 0.378275515283582, 'WEIGHT_1': 0.4697627167168983, 'WEIGHT_2': 0.5663831249117909, 'WEIGHT_3': 0.4748616296238065, 'WEIGHT_4': 0.9851618268921641, 'WEIGHT_5': 0.5408163900270917, 'WEIGHT_6': 0.7624454220395115, 'WEIGHT_7': 0.8635788520877289, 'WEIGHT_8': 0.38721030563819714, 'optimizer': 'RMSprop'}
49
              precision    recall  f1-score   support

         LOC       0.58      0.53      0.55      1837
        MISC       0.43      0.45      0.44       922
         ORG       0.32      0.24      0.27      1341
         PER       0.33      0.33      0.33      1842

   micro avg       0.42      0.39      0.41      5942
   macro avg       0.41      0.39      0.40      5942
weighted avg       0.42      0.39      0.40      5942

epoch 49
LSTM
  0%|          | 0/50 [00:00<?, ?it/s]  2%|▏         | 1/50 [00:04<04:01,  4.93s/it]  4%|▍         | 2/50 [00:05<01:43,  2.15s/it]  6%|▌         | 3/50 [00:05<01:03,  1.35s/it]  8%|▊         | 4/50 [00:05<00:44,  1.03it/s] 10%|█         | 5/50 [00:06<00:34,  1.32it/s] 12%|█▏        | 6/50 [00:06<00:27,  1.58it/s] 14%|█▍        | 7/50 [00:07<00:23,  1.82it/s] 16%|█▌        | 8/50 [00:07<00:20,  2.01it/s] 18%|█▊        | 9/50 [00:07<00:18,  2.16it/s] 20%|██        | 10/50 [00:08<00:17,  2.28it/s] 22%|██▏       | 11/50 [00:08<00:16,  2.36it/s] 24%|██▍       | 12/50 [00:09<00:15,  2.42it/s] 26%|██▌       | 13/50 [00:09<00:14,  2.47it/s] 28%|██▊       | 14/50 [00:09<00:14,  2.50it/s] 30%|███       | 15/50 [00:10<00:13,  2.53it/s] 32%|███▏      | 16/50 [00:10<00:13,  2.55it/s] 34%|███▍      | 17/50 [00:10<00:12,  2.56it/s] 36%|███▌      | 18/50 [00:11<00:12,  2.57it/s] 38%|███▊      | 19/50 [00:11<00:12,  2.57it/s] 40%|████      | 20/50 [00:12<00:11,  2.57it/s] 42%|████▏     | 21/50 [00:12<00:11,  2.58it/s] 44%|████▍     | 22/50 [00:12<00:10,  2.58it/s] 46%|████▌     | 23/50 [00:13<00:10,  2.58it/s] 48%|████▊     | 24/50 [00:13<00:10,  2.58it/s] 50%|█████     | 25/50 [00:14<00:09,  2.58it/s] 52%|█████▏    | 26/50 [00:14<00:09,  2.58it/s] 54%|█████▍    | 27/50 [00:14<00:08,  2.58it/s] 56%|█████▌    | 28/50 [00:15<00:08,  2.58it/s] 58%|█████▊    | 29/50 [00:15<00:08,  2.58it/s] 60%|██████    | 30/50 [00:15<00:07,  2.58it/s] 62%|██████▏   | 31/50 [00:16<00:07,  2.58it/s] 64%|██████▍   | 32/50 [00:16<00:06,  2.58it/s] 66%|██████▌   | 33/50 [00:17<00:06,  2.58it/s] 68%|██████▊   | 34/50 [00:17<00:06,  2.58it/s] 70%|███████   | 35/50 [00:17<00:05,  2.58it/s] 72%|███████▏  | 36/50 [00:18<00:05,  2.57it/s] 74%|███████▍  | 37/50 [00:18<00:05,  2.57it/s] 76%|███████▌  | 38/50 [00:19<00:04,  2.56it/s] 78%|███████▊  | 39/50 [00:19<00:04,  2.56it/s] 80%|████████  | 40/50 [00:19<00:03,  2.55it/s] 82%|████████▏ | 41/50 [00:20<00:03,  2.55it/s] 84%|████████▍ | 42/50 [00:20<00:03,  2.55it/s] 86%|████████▌ | 43/50 [00:21<00:02,  2.56it/s] 88%|████████▊ | 44/50 [00:21<00:02,  2.56it/s] 90%|█████████ | 45/50 [00:21<00:01,  2.55it/s] 92%|█████████▏| 46/50 [00:22<00:01,  2.55it/s] 94%|█████████▍| 47/50 [00:22<00:01,  2.56it/s] 96%|█████████▌| 48/50 [00:22<00:00,  2.57it/s] 98%|█████████▊| 49/50 [00:23<00:00,  2.56it/s]100%|██████████| 50/50 [00:28<00:00,  1.78s/it]100%|██████████| 50/50 [00:28<00:00,  1.76it/s]
[I 2023-12-10 22:59:54,721] Trial 199 finished with value: 0.3223694976272296 and parameters: {'EMBEDDING_DIM': 953, 'HIDDEN_DIM': 546, 'NUM_LAYERS': 1, 'DROPOUT': 0.3501032466190861, 'LR': 0.005481711107994519, 'WEIGHT_0': 0.4489798627051194, 'WEIGHT_1': 0.790918407904273, 'WEIGHT_2': 0.5956966142650566, 'WEIGHT_3': 0.8319821774963907, 'WEIGHT_4': 0.8751931205365058, 'WEIGHT_5': 0.49962280257929953, 'WEIGHT_6': 0.7973774043949693, 'WEIGHT_7': 0.3135663893180629, 'WEIGHT_8': 0.6995796090169845, 'optimizer': 'RMSprop'}. Best is trial 134 with value: 0.4158467115484205.
{'EMBEDDING_DIM': 953, 'HIDDEN_DIM': 546, 'NUM_LAYERS': 1, 'DROPOUT': 0.3501032466190861, 'LR': 0.005481711107994519, 'WEIGHT_0': 0.4489798627051194, 'WEIGHT_1': 0.790918407904273, 'WEIGHT_2': 0.5956966142650566, 'WEIGHT_3': 0.8319821774963907, 'WEIGHT_4': 0.8751931205365058, 'WEIGHT_5': 0.49962280257929953, 'WEIGHT_6': 0.7973774043949693, 'WEIGHT_7': 0.3135663893180629, 'WEIGHT_8': 0.6995796090169845, 'optimizer': 'RMSprop'}
0
              precision    recall  f1-score   support

         LOC       0.04      0.00      0.01      1837
        MISC       0.03      0.01      0.01       922
         ORG       0.02      0.01      0.01      1341
         PER       0.05      0.00      0.01      1842

   micro avg       0.02      0.01      0.01      5942
   macro avg       0.03      0.01      0.01      5942
weighted avg       0.04      0.01      0.01      5942

{'EMBEDDING_DIM': 953, 'HIDDEN_DIM': 546, 'NUM_LAYERS': 1, 'DROPOUT': 0.3501032466190861, 'LR': 0.005481711107994519, 'WEIGHT_0': 0.4489798627051194, 'WEIGHT_1': 0.790918407904273, 'WEIGHT_2': 0.5956966142650566, 'WEIGHT_3': 0.8319821774963907, 'WEIGHT_4': 0.8751931205365058, 'WEIGHT_5': 0.49962280257929953, 'WEIGHT_6': 0.7973774043949693, 'WEIGHT_7': 0.3135663893180629, 'WEIGHT_8': 0.6995796090169845, 'optimizer': 'RMSprop'}
49
              precision    recall  f1-score   support

         LOC       0.42      0.48      0.45      1837
        MISC       0.30      0.41      0.35       922
         ORG       0.21      0.21      0.21      1341
         PER       0.27      0.24      0.25      1842

   micro avg       0.31      0.33      0.32      5942
   macro avg       0.30      0.33      0.31      5942
weighted avg       0.31      0.33      0.32      5942

epoch 49
LSTM
  0%|          | 0/50 [00:00<?, ?it/s]  2%|▏         | 1/50 [00:09<07:55,  9.69s/it]  4%|▍         | 2/50 [00:10<03:37,  4.54s/it]  6%|▌         | 3/50 [00:12<02:36,  3.33s/it]  8%|▊         | 4/50 [00:14<02:06,  2.76s/it] 10%|█         | 5/50 [00:16<01:50,  2.45s/it] 12%|█▏        | 6/50 [00:18<01:39,  2.26s/it] 14%|█▍        | 7/50 [00:20<01:32,  2.14s/it] 16%|█▌        | 8/50 [00:21<01:26,  2.07s/it] 18%|█▊        | 9/50 [00:23<01:22,  2.01s/it] 20%|██        | 10/50 [00:25<01:19,  1.98s/it] 22%|██▏       | 11/50 [00:27<01:16,  1.95s/it] 24%|██▍       | 12/50 [00:29<01:13,  1.94s/it] 26%|██▌       | 13/50 [00:31<01:11,  1.93s/it] 28%|██▊       | 14/50 [00:33<01:09,  1.92s/it] 30%|███       | 15/50 [00:35<01:07,  1.92s/it] 32%|███▏      | 16/50 [00:37<01:05,  1.92s/it] 34%|███▍      | 17/50 [00:39<01:03,  1.92s/it] 36%|███▌      | 18/50 [00:41<01:01,  1.92s/it] 38%|███▊      | 19/50 [00:42<00:59,  1.92s/it] 40%|████      | 20/50 [00:44<00:57,  1.92s/it] 42%|████▏     | 21/50 [00:46<00:55,  1.93s/it] 44%|████▍     | 22/50 [00:48<00:53,  1.93s/it] 46%|████▌     | 23/50 [00:50<00:51,  1.93s/it] 48%|████▊     | 24/50 [00:52<00:50,  1.93s/it] 50%|█████     | 25/50 [00:54<00:48,  1.93s/it] 52%|█████▏    | 26/50 [00:56<00:46,  1.93s/it] 54%|█████▍    | 27/50 [00:58<00:44,  1.92s/it] 56%|█████▌    | 28/50 [01:00<00:42,  1.93s/it] 58%|█████▊    | 29/50 [01:02<00:40,  1.93s/it] 60%|██████    | 30/50 [01:04<00:38,  1.93s/it] 62%|██████▏   | 31/50 [01:06<00:36,  1.94s/it] 64%|██████▍   | 32/50 [01:08<00:35,  1.94s/it] 66%|██████▌   | 33/50 [01:10<00:33,  1.94s/it] 68%|██████▊   | 34/50 [01:12<00:31,  1.94s/it] 70%|███████   | 35/50 [01:13<00:29,  1.94s/it] 72%|███████▏  | 36/50 [01:15<00:27,  1.94s/it] 74%|███████▍  | 37/50 [01:17<00:25,  1.93s/it] 76%|███████▌  | 38/50 [01:19<00:23,  1.93s/it] 78%|███████▊  | 39/50 [01:21<00:21,  1.93s/it] 80%|████████  | 40/50 [01:23<00:19,  1.94s/it] 82%|████████▏ | 41/50 [01:25<00:17,  1.95s/it] 84%|████████▍ | 42/50 [01:27<00:15,  1.95s/it] 86%|████████▌ | 43/50 [01:29<00:13,  1.95s/it] 88%|████████▊ | 44/50 [01:31<00:11,  1.94s/it] 90%|█████████ | 45/50 [01:33<00:09,  1.94s/it] 92%|█████████▏| 46/50 [01:35<00:07,  1.94s/it] 94%|█████████▍| 47/50 [01:37<00:05,  1.94s/it] 96%|█████████▌| 48/50 [01:39<00:03,  1.94s/it] 98%|█████████▊| 49/50 [01:41<00:01,  1.94s/it]100%|██████████| 50/50 [01:51<00:00,  4.60s/it]100%|██████████| 50/50 [01:51<00:00,  2.24s/it]
[I 2023-12-10 23:01:54,489] Trial 200 finished with value: 0.2672278499072621 and parameters: {'EMBEDDING_DIM': 971, 'HIDDEN_DIM': 843, 'NUM_LAYERS': 3, 'DROPOUT': 0.3084251017863903, 'LR': 0.002918675838245363, 'WEIGHT_0': 0.31780221845003237, 'WEIGHT_1': 0.57873579335305, 'WEIGHT_2': 0.6864371705892983, 'WEIGHT_3': 0.578106137365119, 'WEIGHT_4': 0.6373071496122026, 'WEIGHT_5': 0.5878300686948696, 'WEIGHT_6': 0.717905012530388, 'WEIGHT_7': 0.4637793232966383, 'WEIGHT_8': 0.5225585084938796, 'optimizer': 'Adam'}. Best is trial 134 with value: 0.4158467115484205.
/userhome/cs2/dingruiw/conda/envs/py310/lib/python3.10/site-packages/torch/nn/modules/rnn.py:82: UserWarning: dropout option adds dropout after all but last recurrent layer, so non-zero dropout expects num_layers greater than 1, but got dropout=0.33559284976969184 and num_layers=1
  warnings.warn("dropout option adds dropout after all but last "
{'EMBEDDING_DIM': 971, 'HIDDEN_DIM': 843, 'NUM_LAYERS': 3, 'DROPOUT': 0.3084251017863903, 'LR': 0.002918675838245363, 'WEIGHT_0': 0.31780221845003237, 'WEIGHT_1': 0.57873579335305, 'WEIGHT_2': 0.6864371705892983, 'WEIGHT_3': 0.578106137365119, 'WEIGHT_4': 0.6373071496122026, 'WEIGHT_5': 0.5878300686948696, 'WEIGHT_6': 0.717905012530388, 'WEIGHT_7': 0.4637793232966383, 'WEIGHT_8': 0.5225585084938796, 'optimizer': 'Adam'}
0
              precision    recall  f1-score   support

         LOC       0.00      0.00      0.00      1837
        MISC       0.00      0.00      0.00       922
         ORG       0.00      0.00      0.00      1341
         PER       0.00      0.00      0.00      1842

   micro avg       0.00      0.00      0.00      5942
   macro avg       0.00      0.00      0.00      5942
weighted avg       0.00      0.00      0.00      5942

{'EMBEDDING_DIM': 971, 'HIDDEN_DIM': 843, 'NUM_LAYERS': 3, 'DROPOUT': 0.3084251017863903, 'LR': 0.002918675838245363, 'WEIGHT_0': 0.31780221845003237, 'WEIGHT_1': 0.57873579335305, 'WEIGHT_2': 0.6864371705892983, 'WEIGHT_3': 0.578106137365119, 'WEIGHT_4': 0.6373071496122026, 'WEIGHT_5': 0.5878300686948696, 'WEIGHT_6': 0.717905012530388, 'WEIGHT_7': 0.4637793232966383, 'WEIGHT_8': 0.5225585084938796, 'optimizer': 'Adam'}
49
              precision    recall  f1-score   support

         LOC       0.54      0.40      0.46      1837
        MISC       0.12      0.38      0.18       922
         ORG       0.14      0.28      0.19      1341
         PER       0.40      0.22      0.28      1842

   micro avg       0.23      0.32      0.27      5942
   macro avg       0.30      0.32      0.28      5942
weighted avg       0.34      0.32      0.30      5942

epoch 49
LSTM
  0%|          | 0/50 [00:00<?, ?it/s]  2%|▏         | 1/50 [00:04<03:56,  4.82s/it]  4%|▍         | 2/50 [00:04<01:40,  2.08s/it]  6%|▌         | 3/50 [00:05<01:00,  1.28s/it]  8%|▊         | 4/50 [00:05<00:41,  1.11it/s] 10%|█         | 5/50 [00:05<00:30,  1.45it/s] 12%|█▏        | 6/50 [00:06<00:24,  1.78it/s] 14%|█▍        | 7/50 [00:06<00:20,  2.07it/s] 16%|█▌        | 8/50 [00:06<00:18,  2.33it/s] 18%|█▊        | 9/50 [00:07<00:16,  2.53it/s] 20%|██        | 10/50 [00:07<00:14,  2.70it/s] 22%|██▏       | 11/50 [00:07<00:13,  2.82it/s] 24%|██▍       | 12/50 [00:08<00:13,  2.91it/s] 26%|██▌       | 13/50 [00:08<00:12,  2.98it/s] 28%|██▊       | 14/50 [00:08<00:11,  3.03it/s] 30%|███       | 15/50 [00:09<00:11,  3.06it/s] 32%|███▏      | 16/50 [00:09<00:11,  3.08it/s] 34%|███▍      | 17/50 [00:09<00:10,  3.10it/s] 36%|███▌      | 18/50 [00:10<00:10,  3.12it/s] 38%|███▊      | 19/50 [00:10<00:09,  3.13it/s] 40%|████      | 20/50 [00:10<00:09,  3.13it/s] 42%|████▏     | 21/50 [00:11<00:09,  3.14it/s] 44%|████▍     | 22/50 [00:11<00:08,  3.12it/s] 46%|████▌     | 23/50 [00:11<00:08,  3.12it/s] 48%|████▊     | 24/50 [00:11<00:08,  3.13it/s] 50%|█████     | 25/50 [00:12<00:07,  3.13it/s] 52%|█████▏    | 26/50 [00:12<00:07,  3.13it/s] 54%|█████▍    | 27/50 [00:12<00:07,  3.13it/s] 56%|█████▌    | 28/50 [00:13<00:07,  3.13it/s] 58%|█████▊    | 29/50 [00:13<00:06,  3.13it/s] 60%|██████    | 30/50 [00:13<00:06,  3.13it/s] 62%|██████▏   | 31/50 [00:14<00:06,  3.13it/s] 64%|██████▍   | 32/50 [00:14<00:05,  3.13it/s] 66%|██████▌   | 33/50 [00:14<00:05,  3.12it/s] 68%|██████▊   | 34/50 [00:15<00:05,  3.12it/s] 70%|███████   | 35/50 [00:15<00:04,  3.12it/s] 72%|███████▏  | 36/50 [00:15<00:04,  3.12it/s] 74%|███████▍  | 37/50 [00:16<00:04,  3.12it/s] 76%|███████▌  | 38/50 [00:16<00:03,  3.12it/s] 78%|███████▊  | 39/50 [00:16<00:03,  3.12it/s] 80%|████████  | 40/50 [00:17<00:03,  3.11it/s] 82%|████████▏ | 41/50 [00:17<00:02,  3.11it/s] 84%|████████▍ | 42/50 [00:17<00:02,  3.11it/s] 86%|████████▌ | 43/50 [00:18<00:02,  3.11it/s] 88%|████████▊ | 44/50 [00:18<00:01,  3.12it/s] 90%|█████████ | 45/50 [00:18<00:01,  3.11it/s] 92%|█████████▏| 46/50 [00:19<00:01,  3.11it/s] 94%|█████████▍| 47/50 [00:19<00:00,  3.11it/s] 96%|█████████▌| 48/50 [00:19<00:00,  3.10it/s] 98%|█████████▊| 49/50 [00:20<00:00,  3.10it/s]100%|██████████| 50/50 [00:25<00:00,  1.73s/it]100%|██████████| 50/50 [00:25<00:00,  2.00it/s]
