[I 2023-12-10 23:41:00,256] Trial 285 finished with value: 0.2809953434225844 and parameters: {'EMBEDDING_DIM': 137, 'HIDDEN_DIM': 379, 'NUM_LAYERS': 1, 'DROPOUT': 0.3510659870861382, 'LR': 0.005805708268583497, 'WEIGHT_0': 0.547874043946118, 'WEIGHT_1': 0.9713037900292846, 'WEIGHT_2': 0.8491059366550646, 'WEIGHT_3': 0.5925095524881209, 'WEIGHT_4': 0.7777927720201865, 'WEIGHT_5': 0.5028332105132934, 'WEIGHT_6': 0.813938611565202, 'WEIGHT_7': 0.3389474812807488, 'WEIGHT_8': 0.8778669450063069, 'optimizer': 'RMSprop'}. Best is trial 221 with value: 0.418736930154747.
/userhome/cs2/dingruiw/conda/envs/py310/lib/python3.10/site-packages/torch/nn/modules/rnn.py:82: UserWarning: dropout option adds dropout after all but last recurrent layer, so non-zero dropout expects num_layers greater than 1, but got dropout=0.37364855156961807 and num_layers=1
  warnings.warn("dropout option adds dropout after all but last "
{'EMBEDDING_DIM': 137, 'HIDDEN_DIM': 379, 'NUM_LAYERS': 1, 'DROPOUT': 0.3510659870861382, 'LR': 0.005805708268583497, 'WEIGHT_0': 0.547874043946118, 'WEIGHT_1': 0.9713037900292846, 'WEIGHT_2': 0.8491059366550646, 'WEIGHT_3': 0.5925095524881209, 'WEIGHT_4': 0.7777927720201865, 'WEIGHT_5': 0.5028332105132934, 'WEIGHT_6': 0.813938611565202, 'WEIGHT_7': 0.3389474812807488, 'WEIGHT_8': 0.8778669450063069, 'optimizer': 'RMSprop'}
0
              precision    recall  f1-score   support

         LOC       0.08      0.02      0.03      1837
        MISC       0.02      0.02      0.02       922
         ORG       0.10      0.01      0.02      1341
         PER       0.00      0.00      0.00      1842

   micro avg       0.05      0.01      0.02      5942
   macro avg       0.05      0.01      0.02      5942
weighted avg       0.05      0.01      0.02      5942

{'EMBEDDING_DIM': 137, 'HIDDEN_DIM': 379, 'NUM_LAYERS': 1, 'DROPOUT': 0.3510659870861382, 'LR': 0.005805708268583497, 'WEIGHT_0': 0.547874043946118, 'WEIGHT_1': 0.9713037900292846, 'WEIGHT_2': 0.8491059366550646, 'WEIGHT_3': 0.5925095524881209, 'WEIGHT_4': 0.7777927720201865, 'WEIGHT_5': 0.5028332105132934, 'WEIGHT_6': 0.813938611565202, 'WEIGHT_7': 0.3389474812807488, 'WEIGHT_8': 0.8778669450063069, 'optimizer': 'RMSprop'}
49
              precision    recall  f1-score   support

         LOC       0.37      0.45      0.41      1837
        MISC       0.24      0.40      0.30       922
         ORG       0.20      0.24      0.22      1341
         PER       0.17      0.23      0.20      1842

   micro avg       0.25      0.32      0.28      5942
   macro avg       0.25      0.33      0.28      5942
weighted avg       0.25      0.32      0.28      5942

epoch 49
LSTM
  0%|          | 0/50 [00:00<?, ?it/s]  2%|▏         | 1/50 [00:04<03:48,  4.65s/it]  4%|▍         | 2/50 [00:04<01:36,  2.01s/it]  6%|▌         | 3/50 [00:05<00:57,  1.22s/it]  8%|▊         | 4/50 [00:05<00:39,  1.18it/s] 10%|█         | 5/50 [00:05<00:28,  1.55it/s] 12%|█▏        | 6/50 [00:05<00:22,  1.92it/s] 14%|█▍        | 7/50 [00:06<00:18,  2.27it/s] 16%|█▌        | 8/50 [00:06<00:16,  2.57it/s] 18%|█▊        | 9/50 [00:06<00:14,  2.82it/s] 20%|██        | 10/50 [00:07<00:13,  3.02it/s] 22%|██▏       | 11/50 [00:07<00:12,  3.17it/s] 24%|██▍       | 12/50 [00:07<00:11,  3.28it/s] 26%|██▌       | 13/50 [00:07<00:10,  3.37it/s] 28%|██▊       | 14/50 [00:08<00:10,  3.43it/s] 30%|███       | 15/50 [00:08<00:10,  3.47it/s] 32%|███▏      | 16/50 [00:08<00:09,  3.50it/s] 34%|███▍      | 17/50 [00:09<00:09,  3.53it/s] 36%|███▌      | 18/50 [00:09<00:09,  3.55it/s] 38%|███▊      | 19/50 [00:09<00:08,  3.56it/s] 40%|████      | 20/50 [00:09<00:08,  3.56it/s] 42%|████▏     | 21/50 [00:10<00:08,  3.57it/s] 44%|████▍     | 22/50 [00:10<00:07,  3.57it/s] 46%|████▌     | 23/50 [00:10<00:07,  3.56it/s] 48%|████▊     | 24/50 [00:10<00:07,  3.57it/s] 50%|█████     | 25/50 [00:11<00:07,  3.57it/s] 52%|█████▏    | 26/50 [00:11<00:06,  3.57it/s] 54%|█████▍    | 27/50 [00:11<00:06,  3.57it/s] 56%|█████▌    | 28/50 [00:12<00:06,  3.57it/s] 58%|█████▊    | 29/50 [00:12<00:05,  3.57it/s] 60%|██████    | 30/50 [00:12<00:05,  3.56it/s] 62%|██████▏   | 31/50 [00:12<00:05,  3.56it/s] 64%|██████▍   | 32/50 [00:13<00:05,  3.56it/s] 66%|██████▌   | 33/50 [00:13<00:04,  3.56it/s] 68%|██████▊   | 34/50 [00:13<00:04,  3.56it/s] 70%|███████   | 35/50 [00:14<00:04,  3.56it/s] 72%|███████▏  | 36/50 [00:14<00:03,  3.56it/s] 74%|███████▍  | 37/50 [00:14<00:03,  3.56it/s] 76%|███████▌  | 38/50 [00:14<00:03,  3.56it/s] 78%|███████▊  | 39/50 [00:15<00:03,  3.56it/s] 80%|████████  | 40/50 [00:15<00:02,  3.56it/s] 82%|████████▏ | 41/50 [00:15<00:02,  3.55it/s] 84%|████████▍ | 42/50 [00:16<00:02,  3.55it/s] 86%|████████▌ | 43/50 [00:16<00:01,  3.55it/s] 88%|████████▊ | 44/50 [00:16<00:01,  3.56it/s] 90%|█████████ | 45/50 [00:16<00:01,  3.55it/s] 92%|█████████▏| 46/50 [00:17<00:01,  3.55it/s] 94%|█████████▍| 47/50 [00:17<00:00,  3.55it/s] 96%|█████████▌| 48/50 [00:17<00:00,  3.55it/s] 98%|█████████▊| 49/50 [00:17<00:00,  3.55it/s]100%|██████████| 50/50 [00:22<00:00,  1.65s/it]100%|██████████| 50/50 [00:22<00:00,  2.19it/s]
[I 2023-12-10 23:41:27,215] Trial 286 finished with value: 0.34644744568408686 and parameters: {'EMBEDDING_DIM': 992, 'HIDDEN_DIM': 424, 'NUM_LAYERS': 1, 'DROPOUT': 0.37364855156961807, 'LR': 0.0005060545474990535, 'WEIGHT_0': 0.994261318744284, 'WEIGHT_1': 0.7047134389909712, 'WEIGHT_2': 0.21806089178930607, 'WEIGHT_3': 0.5398749581636781, 'WEIGHT_4': 0.9153895657144576, 'WEIGHT_5': 0.5573188540162471, 'WEIGHT_6': 0.7557371697622044, 'WEIGHT_7': 0.4699919113901022, 'WEIGHT_8': 0.4562592581878373, 'optimizer': 'RMSprop'}. Best is trial 221 with value: 0.418736930154747.
/userhome/cs2/dingruiw/conda/envs/py310/lib/python3.10/site-packages/torch/nn/modules/rnn.py:82: UserWarning: dropout option adds dropout after all but last recurrent layer, so non-zero dropout expects num_layers greater than 1, but got dropout=0.23294892107185597 and num_layers=1
  warnings.warn("dropout option adds dropout after all but last "
{'EMBEDDING_DIM': 992, 'HIDDEN_DIM': 424, 'NUM_LAYERS': 1, 'DROPOUT': 0.37364855156961807, 'LR': 0.0005060545474990535, 'WEIGHT_0': 0.994261318744284, 'WEIGHT_1': 0.7047134389909712, 'WEIGHT_2': 0.21806089178930607, 'WEIGHT_3': 0.5398749581636781, 'WEIGHT_4': 0.9153895657144576, 'WEIGHT_5': 0.5573188540162471, 'WEIGHT_6': 0.7557371697622044, 'WEIGHT_7': 0.4699919113901022, 'WEIGHT_8': 0.4562592581878373, 'optimizer': 'RMSprop'}
0
              precision    recall  f1-score   support

         LOC       0.09      0.05      0.06      1837
        MISC       0.02      0.02      0.02       922
         ORG       0.10      0.05      0.07      1341
         PER       0.05      0.03      0.04      1842

   micro avg       0.06      0.04      0.05      5942
   macro avg       0.07      0.04      0.05      5942
weighted avg       0.07      0.04      0.05      5942

{'EMBEDDING_DIM': 992, 'HIDDEN_DIM': 424, 'NUM_LAYERS': 1, 'DROPOUT': 0.37364855156961807, 'LR': 0.0005060545474990535, 'WEIGHT_0': 0.994261318744284, 'WEIGHT_1': 0.7047134389909712, 'WEIGHT_2': 0.21806089178930607, 'WEIGHT_3': 0.5398749581636781, 'WEIGHT_4': 0.9153895657144576, 'WEIGHT_5': 0.5573188540162471, 'WEIGHT_6': 0.7557371697622044, 'WEIGHT_7': 0.4699919113901022, 'WEIGHT_8': 0.4562592581878373, 'optimizer': 'RMSprop'}
49
              precision    recall  f1-score   support

         LOC       0.60      0.47      0.53      1837
        MISC       0.29      0.07      0.12       922
         ORG       0.29      0.21      0.24      1341
         PER       0.34      0.30      0.32      1842

   micro avg       0.41      0.30      0.35      5942
   macro avg       0.38      0.26      0.30      5942
weighted avg       0.40      0.30      0.34      5942

epoch 49
LSTM
  0%|          | 0/50 [00:00<?, ?it/s]  2%|▏         | 1/50 [00:08<06:37,  8.12s/it]  4%|▍         | 2/50 [00:08<02:59,  3.73s/it]  6%|▌         | 3/50 [00:10<02:05,  2.67s/it]  8%|▊         | 4/50 [00:11<01:39,  2.17s/it] 10%|█         | 5/50 [00:13<01:25,  1.90s/it] 12%|█▏        | 6/50 [00:14<01:16,  1.73s/it] 14%|█▍        | 7/50 [00:15<01:10,  1.63s/it] 16%|█▌        | 8/50 [00:17<01:05,  1.56s/it] 18%|█▊        | 9/50 [00:18<01:02,  1.52s/it] 20%|██        | 10/50 [00:20<00:59,  1.49s/it] 22%|██▏       | 11/50 [00:21<00:57,  1.46s/it] 24%|██▍       | 12/50 [00:22<00:55,  1.45s/it] 26%|██▌       | 13/50 [00:24<00:53,  1.44s/it] 28%|██▊       | 14/50 [00:25<00:51,  1.44s/it] 30%|███       | 15/50 [00:27<00:50,  1.43s/it] 32%|███▏      | 16/50 [00:28<00:48,  1.43s/it] 34%|███▍      | 17/50 [00:30<00:47,  1.43s/it] 36%|███▌      | 18/50 [00:31<00:45,  1.43s/it] 38%|███▊      | 19/50 [00:32<00:44,  1.43s/it] 40%|████      | 20/50 [00:34<00:43,  1.43s/it] 42%|████▏     | 21/50 [00:35<00:41,  1.43s/it] 44%|████▍     | 22/50 [00:37<00:40,  1.44s/it] 46%|████▌     | 23/50 [00:38<00:39,  1.44s/it] 48%|████▊     | 24/50 [00:40<00:37,  1.45s/it] 50%|█████     | 25/50 [00:41<00:36,  1.45s/it] 52%|█████▏    | 26/50 [00:43<00:34,  1.45s/it] 54%|█████▍    | 27/50 [00:44<00:33,  1.46s/it] 56%|█████▌    | 28/50 [00:45<00:31,  1.45s/it] 58%|█████▊    | 29/50 [00:47<00:30,  1.46s/it] 60%|██████    | 30/50 [00:48<00:29,  1.46s/it] 62%|██████▏   | 31/50 [00:50<00:27,  1.46s/it] 64%|██████▍   | 32/50 [00:51<00:26,  1.47s/it] 66%|██████▌   | 33/50 [00:53<00:24,  1.47s/it] 68%|██████▊   | 34/50 [00:54<00:23,  1.47s/it] 70%|███████   | 35/50 [00:56<00:22,  1.47s/it] 72%|███████▏  | 36/50 [00:57<00:20,  1.47s/it] 74%|███████▍  | 37/50 [00:59<00:19,  1.47s/it] 76%|███████▌  | 38/50 [01:00<00:17,  1.47s/it] 78%|███████▊  | 39/50 [01:02<00:16,  1.47s/it] 80%|████████  | 40/50 [01:03<00:14,  1.47s/it] 82%|████████▏ | 41/50 [01:05<00:13,  1.47s/it] 84%|████████▍ | 42/50 [01:06<00:11,  1.47s/it] 86%|████████▌ | 43/50 [01:08<00:10,  1.48s/it] 88%|████████▊ | 44/50 [01:09<00:08,  1.48s/it] 90%|█████████ | 45/50 [01:11<00:07,  1.48s/it] 92%|█████████▏| 46/50 [01:12<00:05,  1.49s/it] 94%|█████████▍| 47/50 [01:14<00:04,  1.48s/it] 96%|█████████▌| 48/50 [01:15<00:02,  1.48s/it] 98%|█████████▊| 49/50 [01:16<00:01,  1.48s/it]100%|██████████| 50/50 [01:25<00:00,  3.73s/it]100%|██████████| 50/50 [01:25<00:00,  1.72s/it]
[I 2023-12-10 23:42:59,807] Trial 287 finished with value: 0.031147074370755905 and parameters: {'EMBEDDING_DIM': 1024, 'HIDDEN_DIM': 1491, 'NUM_LAYERS': 1, 'DROPOUT': 0.23294892107185597, 'LR': 0.0014595698589329417, 'WEIGHT_0': 0.513236896755553, 'WEIGHT_1': 0.7941096899765697, 'WEIGHT_2': 0.9761587630654281, 'WEIGHT_3': 0.978856711917027, 'WEIGHT_4': 0.7336087805373244, 'WEIGHT_5': 0.5368586060702601, 'WEIGHT_6': 0.8718998498191324, 'WEIGHT_7': 0.5518981153933105, 'WEIGHT_8': 0.557489658570217, 'optimizer': 'SGD'}. Best is trial 221 with value: 0.418736930154747.
/userhome/cs2/dingruiw/conda/envs/py310/lib/python3.10/site-packages/torch/nn/modules/rnn.py:82: UserWarning: dropout option adds dropout after all but last recurrent layer, so non-zero dropout expects num_layers greater than 1, but got dropout=0.3049443625606177 and num_layers=1
  warnings.warn("dropout option adds dropout after all but last "
{'EMBEDDING_DIM': 1024, 'HIDDEN_DIM': 1491, 'NUM_LAYERS': 1, 'DROPOUT': 0.23294892107185597, 'LR': 0.0014595698589329417, 'WEIGHT_0': 0.513236896755553, 'WEIGHT_1': 0.7941096899765697, 'WEIGHT_2': 0.9761587630654281, 'WEIGHT_3': 0.978856711917027, 'WEIGHT_4': 0.7336087805373244, 'WEIGHT_5': 0.5368586060702601, 'WEIGHT_6': 0.8718998498191324, 'WEIGHT_7': 0.5518981153933105, 'WEIGHT_8': 0.557489658570217, 'optimizer': 'SGD'}
0
              precision    recall  f1-score   support

         LOC       0.02      0.09      0.03      1837
        MISC       0.01      0.17      0.03       922
         ORG       0.02      0.11      0.03      1341
         PER       0.02      0.07      0.03      1842

   micro avg       0.02      0.10      0.03      5942
   macro avg       0.02      0.11      0.03      5942
weighted avg       0.02      0.10      0.03      5942

{'EMBEDDING_DIM': 1024, 'HIDDEN_DIM': 1491, 'NUM_LAYERS': 1, 'DROPOUT': 0.23294892107185597, 'LR': 0.0014595698589329417, 'WEIGHT_0': 0.513236896755553, 'WEIGHT_1': 0.7941096899765697, 'WEIGHT_2': 0.9761587630654281, 'WEIGHT_3': 0.978856711917027, 'WEIGHT_4': 0.7336087805373244, 'WEIGHT_5': 0.5368586060702601, 'WEIGHT_6': 0.8718998498191324, 'WEIGHT_7': 0.5518981153933105, 'WEIGHT_8': 0.557489658570217, 'optimizer': 'SGD'}
49
              precision    recall  f1-score   support

         LOC       0.02      0.06      0.04      1837
        MISC       0.01      0.09      0.03       922
         ORG       0.02      0.07      0.03      1341
         PER       0.02      0.04      0.03      1842

   micro avg       0.02      0.06      0.03      5942
   macro avg       0.02      0.07      0.03      5942
weighted avg       0.02      0.06      0.03      5942

epoch 49
LSTM
  0%|          | 0/50 [00:00<?, ?it/s]  2%|▏         | 1/50 [00:04<03:56,  4.83s/it]  4%|▍         | 2/50 [00:05<01:41,  2.11s/it]  6%|▌         | 3/50 [00:05<01:02,  1.33s/it]  8%|▊         | 4/50 [00:05<00:44,  1.04it/s] 10%|█         | 5/50 [00:06<00:34,  1.31it/s] 12%|█▏        | 6/50 [00:06<00:28,  1.56it/s] 14%|█▍        | 7/50 [00:07<00:24,  1.78it/s] 16%|█▌        | 8/50 [00:07<00:21,  1.96it/s] 18%|█▊        | 9/50 [00:07<00:19,  2.10it/s] 20%|██        | 10/50 [00:08<00:18,  2.20it/s] 22%|██▏       | 11/50 [00:08<00:17,  2.28it/s] 24%|██▍       | 12/50 [00:09<00:16,  2.34it/s] 26%|██▌       | 13/50 [00:09<00:15,  2.38it/s] 28%|██▊       | 14/50 [00:09<00:14,  2.41it/s] 30%|███       | 15/50 [00:10<00:14,  2.43it/s] 32%|███▏      | 16/50 [00:10<00:13,  2.44it/s] 34%|███▍      | 17/50 [00:11<00:13,  2.45it/s] 36%|███▌      | 18/50 [00:11<00:12,  2.47it/s] 38%|███▊      | 19/50 [00:11<00:12,  2.47it/s] 40%|████      | 20/50 [00:12<00:12,  2.47it/s] 42%|████▏     | 21/50 [00:12<00:11,  2.47it/s] 44%|████▍     | 22/50 [00:13<00:11,  2.47it/s] 46%|████▌     | 23/50 [00:13<00:10,  2.47it/s] 48%|████▊     | 24/50 [00:13<00:10,  2.46it/s] 50%|█████     | 25/50 [00:14<00:10,  2.46it/s] 52%|█████▏    | 26/50 [00:14<00:09,  2.46it/s] 54%|█████▍    | 27/50 [00:15<00:09,  2.46it/s] 56%|█████▌    | 28/50 [00:15<00:08,  2.46it/s] 58%|█████▊    | 29/50 [00:15<00:08,  2.46it/s] 60%|██████    | 30/50 [00:16<00:08,  2.46it/s] 62%|██████▏   | 31/50 [00:16<00:07,  2.46it/s] 64%|██████▍   | 32/50 [00:17<00:07,  2.46it/s] 66%|██████▌   | 33/50 [00:17<00:06,  2.46it/s] 68%|██████▊   | 34/50 [00:17<00:06,  2.46it/s] 70%|███████   | 35/50 [00:18<00:06,  2.46it/s] 72%|███████▏  | 36/50 [00:18<00:05,  2.46it/s] 74%|███████▍  | 37/50 [00:19<00:05,  2.46it/s] 76%|███████▌  | 38/50 [00:19<00:04,  2.46it/s] 78%|███████▊  | 39/50 [00:20<00:04,  2.46it/s] 80%|████████  | 40/50 [00:20<00:04,  2.46it/s] 82%|████████▏ | 41/50 [00:20<00:03,  2.46it/s] 84%|████████▍ | 42/50 [00:21<00:03,  2.46it/s] 86%|████████▌ | 43/50 [00:21<00:02,  2.46it/s] 88%|████████▊ | 44/50 [00:22<00:02,  2.46it/s] 90%|█████████ | 45/50 [00:22<00:02,  2.46it/s] 92%|█████████▏| 46/50 [00:22<00:01,  2.46it/s] 94%|█████████▍| 47/50 [00:23<00:01,  2.46it/s] 96%|█████████▌| 48/50 [00:23<00:00,  2.46it/s] 98%|█████████▊| 49/50 [00:24<00:00,  2.46it/s]100%|██████████| 50/50 [00:29<00:00,  1.81s/it]100%|██████████| 50/50 [00:29<00:00,  1.72it/s]
[I 2023-12-10 23:43:33,195] Trial 288 finished with value: 0.40921122286924305 and parameters: {'EMBEDDING_DIM': 960, 'HIDDEN_DIM': 563, 'NUM_LAYERS': 1, 'DROPOUT': 0.3049443625606177, 'LR': 0.0016575685287184257, 'WEIGHT_0': 0.35334007710321225, 'WEIGHT_1': 0.6370731140093874, 'WEIGHT_2': 0.6921760986623423, 'WEIGHT_3': 0.5519710147452295, 'WEIGHT_4': 0.8782396524352393, 'WEIGHT_5': 0.5767943850315083, 'WEIGHT_6': 0.6535238123670992, 'WEIGHT_7': 0.7115179342328171, 'WEIGHT_8': 0.7204081772928361, 'optimizer': 'RMSprop'}. Best is trial 221 with value: 0.418736930154747.
{'EMBEDDING_DIM': 960, 'HIDDEN_DIM': 563, 'NUM_LAYERS': 1, 'DROPOUT': 0.3049443625606177, 'LR': 0.0016575685287184257, 'WEIGHT_0': 0.35334007710321225, 'WEIGHT_1': 0.6370731140093874, 'WEIGHT_2': 0.6921760986623423, 'WEIGHT_3': 0.5519710147452295, 'WEIGHT_4': 0.8782396524352393, 'WEIGHT_5': 0.5767943850315083, 'WEIGHT_6': 0.6535238123670992, 'WEIGHT_7': 0.7115179342328171, 'WEIGHT_8': 0.7204081772928361, 'optimizer': 'RMSprop'}
0
              precision    recall  f1-score   support

         LOC       0.28      0.16      0.20      1837
        MISC       0.05      0.02      0.03       922
         ORG       0.09      0.04      0.06      1341
         PER       0.04      0.05      0.04      1842

   micro avg       0.10      0.08      0.09      5942
   macro avg       0.11      0.07      0.08      5942
weighted avg       0.13      0.08      0.09      5942

{'EMBEDDING_DIM': 960, 'HIDDEN_DIM': 563, 'NUM_LAYERS': 1, 'DROPOUT': 0.3049443625606177, 'LR': 0.0016575685287184257, 'WEIGHT_0': 0.35334007710321225, 'WEIGHT_1': 0.6370731140093874, 'WEIGHT_2': 0.6921760986623423, 'WEIGHT_3': 0.5519710147452295, 'WEIGHT_4': 0.8782396524352393, 'WEIGHT_5': 0.5767943850315083, 'WEIGHT_6': 0.6535238123670992, 'WEIGHT_7': 0.7115179342328171, 'WEIGHT_8': 0.7204081772928361, 'optimizer': 'RMSprop'}
49
              precision    recall  f1-score   support

         LOC       0.59      0.53      0.56      1837
        MISC       0.46      0.44      0.45       922
         ORG       0.31      0.26      0.28      1341
         PER       0.34      0.32      0.33      1842

   micro avg       0.43      0.39      0.41      5942
   macro avg       0.43      0.39      0.41      5942
weighted avg       0.43      0.39      0.41      5942

epoch 49
LSTM
  0%|          | 0/50 [00:00<?, ?it/s]  2%|▏         | 1/50 [00:06<05:30,  6.74s/it]  4%|▍         | 2/50 [00:07<02:30,  3.14s/it]  6%|▌         | 3/50 [00:08<01:40,  2.13s/it]  8%|▊         | 4/50 [00:09<01:16,  1.65s/it] 10%|█         | 5/50 [00:10<01:02,  1.39s/it] 12%|█▏        | 6/50 [00:11<00:54,  1.23s/it] 14%|█▍        | 7/50 [00:11<00:48,  1.13s/it] 16%|█▌        | 8/50 [00:12<00:44,  1.07s/it] 18%|█▊        | 9/50 [00:13<00:41,  1.02s/it] 20%|██        | 10/50 [00:14<00:39,  1.01it/s] 22%|██▏       | 11/50 [00:15<00:37,  1.03it/s] 24%|██▍       | 12/50 [00:16<00:36,  1.04it/s] 26%|██▌       | 13/50 [00:17<00:35,  1.05it/s] 28%|██▊       | 14/50 [00:18<00:33,  1.06it/s] 30%|███       | 15/50 [00:19<00:32,  1.07it/s] 32%|███▏      | 16/50 [00:20<00:31,  1.07it/s] 34%|███▍      | 17/50 [00:21<00:30,  1.07it/s] 36%|███▌      | 18/50 [00:22<00:29,  1.07it/s] 38%|███▊      | 19/50 [00:23<00:28,  1.07it/s] 40%|████      | 20/50 [00:24<00:27,  1.07it/s] 42%|████▏     | 21/50 [00:24<00:27,  1.07it/s] 44%|████▍     | 22/50 [00:25<00:26,  1.07it/s] 46%|████▌     | 23/50 [00:26<00:25,  1.07it/s] 48%|████▊     | 24/50 [00:27<00:24,  1.07it/s] 50%|█████     | 25/50 [00:28<00:23,  1.07it/s] 52%|█████▏    | 26/50 [00:29<00:22,  1.07it/s] 54%|█████▍    | 27/50 [00:30<00:21,  1.07it/s] 56%|█████▌    | 28/50 [00:31<00:20,  1.07it/s] 58%|█████▊    | 29/50 [00:32<00:19,  1.07it/s] 60%|██████    | 30/50 [00:33<00:18,  1.07it/s] 62%|██████▏   | 31/50 [00:34<00:17,  1.07it/s] 64%|██████▍   | 32/50 [00:35<00:16,  1.07it/s] 66%|██████▌   | 33/50 [00:36<00:15,  1.07it/s] 68%|██████▊   | 34/50 [00:37<00:14,  1.07it/s] 70%|███████   | 35/50 [00:38<00:14,  1.07it/s] 72%|███████▏  | 36/50 [00:38<00:13,  1.07it/s] 74%|███████▍  | 37/50 [00:39<00:12,  1.07it/s] 76%|███████▌  | 38/50 [00:40<00:11,  1.07it/s] 78%|███████▊  | 39/50 [00:41<00:10,  1.06it/s] 80%|████████  | 40/50 [00:42<00:09,  1.06it/s] 82%|████████▏ | 41/50 [00:43<00:08,  1.06it/s] 84%|████████▍ | 42/50 [00:44<00:07,  1.06it/s] 86%|████████▌ | 43/50 [00:45<00:06,  1.06it/s] 88%|████████▊ | 44/50 [00:46<00:05,  1.06it/s] 90%|█████████ | 45/50 [00:47<00:04,  1.06it/s] 92%|█████████▏| 46/50 [00:48<00:03,  1.06it/s] 94%|█████████▍| 47/50 [00:49<00:02,  1.05it/s] 96%|█████████▌| 48/50 [00:50<00:01,  1.05it/s] 98%|█████████▊| 49/50 [00:51<00:00,  1.05it/s]100%|██████████| 50/50 [00:58<00:00,  2.77s/it]100%|██████████| 50/50 [00:58<00:00,  1.17s/it]
