[I 2023-12-10 22:36:33,230] Trial 153 finished with value: 0.15161477470508605 and parameters: {'EMBEDDING_DIM': 986, 'HIDDEN_DIM': 986, 'NUM_LAYERS': 1, 'DROPOUT': 0.33686182876770326, 'LR': 0.002254062015947668, 'WEIGHT_0': 0.5792143273509067, 'WEIGHT_1': 0.6983690586403823, 'WEIGHT_2': 0.5542276004196227, 'WEIGHT_3': 0.9030501787308729, 'WEIGHT_4': 0.6814775484157926, 'WEIGHT_5': 0.44418625901642406, 'WEIGHT_6': 0.8589393171540143, 'WEIGHT_7': 0.526742189532309, 'WEIGHT_8': 0.46630036785327056, 'optimizer': 'RMSprop'}. Best is trial 134 with value: 0.4158467115484205.
/userhome/cs2/dingruiw/conda/envs/py310/lib/python3.10/site-packages/torch/nn/modules/rnn.py:82: UserWarning: dropout option adds dropout after all but last recurrent layer, so non-zero dropout expects num_layers greater than 1, but got dropout=0.36574096083176344 and num_layers=1
  warnings.warn("dropout option adds dropout after all but last "
{'EMBEDDING_DIM': 986, 'HIDDEN_DIM': 986, 'NUM_LAYERS': 1, 'DROPOUT': 0.33686182876770326, 'LR': 0.002254062015947668, 'WEIGHT_0': 0.5792143273509067, 'WEIGHT_1': 0.6983690586403823, 'WEIGHT_2': 0.5542276004196227, 'WEIGHT_3': 0.9030501787308729, 'WEIGHT_4': 0.6814775484157926, 'WEIGHT_5': 0.44418625901642406, 'WEIGHT_6': 0.8589393171540143, 'WEIGHT_7': 0.526742189532309, 'WEIGHT_8': 0.46630036785327056, 'optimizer': 'RMSprop'}
0
              precision    recall  f1-score   support

         LOC       0.03      0.04      0.03      1837
        MISC       0.03      0.03      0.03       922
         ORG       0.03      0.01      0.02      1341
         PER       0.01      0.02      0.01      1842

   micro avg       0.02      0.02      0.02      5942
   macro avg       0.02      0.02      0.02      5942
weighted avg       0.02      0.02      0.02      5942

{'EMBEDDING_DIM': 986, 'HIDDEN_DIM': 986, 'NUM_LAYERS': 1, 'DROPOUT': 0.33686182876770326, 'LR': 0.002254062015947668, 'WEIGHT_0': 0.5792143273509067, 'WEIGHT_1': 0.6983690586403823, 'WEIGHT_2': 0.5542276004196227, 'WEIGHT_3': 0.9030501787308729, 'WEIGHT_4': 0.6814775484157926, 'WEIGHT_5': 0.44418625901642406, 'WEIGHT_6': 0.8589393171540143, 'WEIGHT_7': 0.526742189532309, 'WEIGHT_8': 0.46630036785327056, 'optimizer': 'RMSprop'}
49
              precision    recall  f1-score   support

         LOC       0.40      0.20      0.26      1837
        MISC       0.34      0.04      0.07       922
         ORG       0.18      0.19      0.18      1341
         PER       0.07      0.07      0.07      1842

   micro avg       0.18      0.13      0.15      5942
   macro avg       0.25      0.12      0.15      5942
weighted avg       0.24      0.13      0.16      5942

epoch 49
LSTM
  0%|          | 0/50 [00:00<?, ?it/s]  2%|▏         | 1/50 [00:04<03:59,  4.89s/it]  4%|▍         | 2/50 [00:05<01:41,  2.12s/it]  6%|▌         | 3/50 [00:05<01:01,  1.31s/it]  8%|▊         | 4/50 [00:05<00:42,  1.08it/s] 10%|█         | 5/50 [00:06<00:32,  1.39it/s] 12%|█▏        | 6/50 [00:06<00:26,  1.69it/s] 14%|█▍        | 7/50 [00:06<00:22,  1.95it/s] 16%|█▌        | 8/50 [00:07<00:19,  2.18it/s] 18%|█▊        | 9/50 [00:07<00:17,  2.36it/s] 20%|██        | 10/50 [00:07<00:16,  2.50it/s] 22%|██▏       | 11/50 [00:08<00:15,  2.60it/s] 24%|██▍       | 12/50 [00:08<00:14,  2.68it/s] 26%|██▌       | 13/50 [00:08<00:13,  2.73it/s] 28%|██▊       | 14/50 [00:09<00:12,  2.78it/s] 30%|███       | 15/50 [00:09<00:12,  2.80it/s] 32%|███▏      | 16/50 [00:09<00:12,  2.82it/s] 34%|███▍      | 17/50 [00:10<00:11,  2.84it/s] 36%|███▌      | 18/50 [00:10<00:11,  2.85it/s] 38%|███▊      | 19/50 [00:10<00:10,  2.86it/s] 40%|████      | 20/50 [00:11<00:10,  2.86it/s] 42%|████▏     | 21/50 [00:11<00:10,  2.86it/s] 44%|████▍     | 22/50 [00:12<00:09,  2.86it/s] 46%|████▌     | 23/50 [00:12<00:09,  2.86it/s] 48%|████▊     | 24/50 [00:12<00:09,  2.86it/s] 50%|█████     | 25/50 [00:13<00:08,  2.86it/s] 52%|█████▏    | 26/50 [00:13<00:08,  2.86it/s] 54%|█████▍    | 27/50 [00:13<00:08,  2.86it/s] 56%|█████▌    | 28/50 [00:14<00:07,  2.86it/s] 58%|█████▊    | 29/50 [00:14<00:07,  2.86it/s] 60%|██████    | 30/50 [00:14<00:06,  2.86it/s] 62%|██████▏   | 31/50 [00:15<00:06,  2.86it/s] 64%|██████▍   | 32/50 [00:15<00:06,  2.85it/s] 66%|██████▌   | 33/50 [00:15<00:05,  2.85it/s] 68%|██████▊   | 34/50 [00:16<00:05,  2.85it/s] 70%|███████   | 35/50 [00:16<00:05,  2.86it/s] 72%|███████▏  | 36/50 [00:16<00:04,  2.86it/s] 74%|███████▍  | 37/50 [00:17<00:04,  2.85it/s] 76%|███████▌  | 38/50 [00:17<00:04,  2.85it/s] 78%|███████▊  | 39/50 [00:17<00:03,  2.85it/s] 80%|████████  | 40/50 [00:18<00:03,  2.85it/s] 82%|████████▏ | 41/50 [00:18<00:03,  2.85it/s] 84%|████████▍ | 42/50 [00:19<00:02,  2.86it/s] 86%|████████▌ | 43/50 [00:19<00:02,  2.86it/s] 88%|████████▊ | 44/50 [00:19<00:02,  2.86it/s] 90%|█████████ | 45/50 [00:20<00:01,  2.86it/s] 92%|█████████▏| 46/50 [00:20<00:01,  2.85it/s] 94%|█████████▍| 47/50 [00:20<00:01,  2.85it/s] 96%|█████████▌| 48/50 [00:21<00:00,  2.85it/s] 98%|█████████▊| 49/50 [00:21<00:00,  2.85it/s]100%|██████████| 50/50 [00:26<00:00,  1.75s/it]100%|██████████| 50/50 [00:26<00:00,  1.89it/s]
[I 2023-12-10 22:37:04,163] Trial 154 finished with value: 0.4070422535211268 and parameters: {'EMBEDDING_DIM': 964, 'HIDDEN_DIM': 523, 'NUM_LAYERS': 1, 'DROPOUT': 0.36574096083176344, 'LR': 0.0019331092672170021, 'WEIGHT_0': 0.5449370929407854, 'WEIGHT_1': 0.7368203112421743, 'WEIGHT_2': 0.6339767700654202, 'WEIGHT_3': 0.9212821613898007, 'WEIGHT_4': 0.9095194605616239, 'WEIGHT_5': 0.5187689016758309, 'WEIGHT_6': 0.8991024498892926, 'WEIGHT_7': 0.4490346383537943, 'WEIGHT_8': 0.5002504403875387, 'optimizer': 'RMSprop'}. Best is trial 134 with value: 0.4158467115484205.
/userhome/cs2/dingruiw/conda/envs/py310/lib/python3.10/site-packages/torch/nn/modules/rnn.py:82: UserWarning: dropout option adds dropout after all but last recurrent layer, so non-zero dropout expects num_layers greater than 1, but got dropout=0.3288998876931969 and num_layers=1
  warnings.warn("dropout option adds dropout after all but last "
{'EMBEDDING_DIM': 964, 'HIDDEN_DIM': 523, 'NUM_LAYERS': 1, 'DROPOUT': 0.36574096083176344, 'LR': 0.0019331092672170021, 'WEIGHT_0': 0.5449370929407854, 'WEIGHT_1': 0.7368203112421743, 'WEIGHT_2': 0.6339767700654202, 'WEIGHT_3': 0.9212821613898007, 'WEIGHT_4': 0.9095194605616239, 'WEIGHT_5': 0.5187689016758309, 'WEIGHT_6': 0.8991024498892926, 'WEIGHT_7': 0.4490346383537943, 'WEIGHT_8': 0.5002504403875387, 'optimizer': 'RMSprop'}
0
              precision    recall  f1-score   support

         LOC       0.17      0.10      0.12      1837
        MISC       0.04      0.01      0.01       922
         ORG       0.12      0.02      0.04      1341
         PER       0.04      0.03      0.03      1842

   micro avg       0.10      0.04      0.06      5942
   macro avg       0.09      0.04      0.05      5942
weighted avg       0.10      0.04      0.06      5942

{'EMBEDDING_DIM': 964, 'HIDDEN_DIM': 523, 'NUM_LAYERS': 1, 'DROPOUT': 0.36574096083176344, 'LR': 0.0019331092672170021, 'WEIGHT_0': 0.5449370929407854, 'WEIGHT_1': 0.7368203112421743, 'WEIGHT_2': 0.6339767700654202, 'WEIGHT_3': 0.9212821613898007, 'WEIGHT_4': 0.9095194605616239, 'WEIGHT_5': 0.5187689016758309, 'WEIGHT_6': 0.8991024498892926, 'WEIGHT_7': 0.4490346383537943, 'WEIGHT_8': 0.5002504403875387, 'optimizer': 'RMSprop'}
49
              precision    recall  f1-score   support

         LOC       0.61      0.52      0.56      1837
        MISC       0.44      0.41      0.42       922
         ORG       0.29      0.24      0.26      1341
         PER       0.35      0.35      0.35      1842

   micro avg       0.43      0.39      0.41      5942
   macro avg       0.42      0.38      0.40      5942
weighted avg       0.43      0.39      0.41      5942

epoch 49
LSTM
  0%|          | 0/50 [00:00<?, ?it/s]  2%|▏         | 1/50 [00:04<03:56,  4.83s/it]  4%|▍         | 2/50 [00:04<01:39,  2.07s/it]  6%|▌         | 3/50 [00:05<00:58,  1.24s/it]  8%|▊         | 4/50 [00:05<00:39,  1.18it/s] 10%|█         | 5/50 [00:05<00:28,  1.58it/s] 12%|█▏        | 6/50 [00:05<00:22,  1.99it/s] 14%|█▍        | 7/50 [00:06<00:18,  2.39it/s] 16%|█▌        | 8/50 [00:06<00:15,  2.74it/s] 18%|█▊        | 9/50 [00:06<00:13,  3.04it/s] 20%|██        | 10/50 [00:06<00:12,  3.29it/s] 22%|██▏       | 11/50 [00:07<00:11,  3.48it/s] 24%|██▍       | 12/50 [00:07<00:10,  3.63it/s] 26%|██▌       | 13/50 [00:07<00:09,  3.74it/s] 28%|██▊       | 14/50 [00:07<00:09,  3.82it/s] 30%|███       | 15/50 [00:08<00:09,  3.88it/s] 32%|███▏      | 16/50 [00:08<00:08,  3.92it/s] 34%|███▍      | 17/50 [00:08<00:08,  3.94it/s] 36%|███▌      | 18/50 [00:08<00:08,  3.97it/s] 38%|███▊      | 19/50 [00:09<00:07,  3.98it/s] 40%|████      | 20/50 [00:09<00:07,  3.99it/s] 42%|████▏     | 21/50 [00:09<00:07,  4.00it/s] 44%|████▍     | 22/50 [00:09<00:06,  4.01it/s] 46%|████▌     | 23/50 [00:10<00:06,  4.01it/s] 48%|████▊     | 24/50 [00:10<00:06,  4.01it/s] 50%|█████     | 25/50 [00:10<00:06,  4.01it/s] 52%|█████▏    | 26/50 [00:10<00:05,  4.01it/s] 54%|█████▍    | 27/50 [00:11<00:05,  4.01it/s] 56%|█████▌    | 28/50 [00:11<00:05,  4.01it/s] 58%|█████▊    | 29/50 [00:11<00:05,  4.01it/s] 60%|██████    | 30/50 [00:11<00:04,  4.01it/s] 62%|██████▏   | 31/50 [00:12<00:04,  4.01it/s] 64%|██████▍   | 32/50 [00:12<00:04,  4.01it/s] 66%|██████▌   | 33/50 [00:12<00:04,  4.01it/s] 68%|██████▊   | 34/50 [00:12<00:03,  4.01it/s] 70%|███████   | 35/50 [00:13<00:03,  4.00it/s] 72%|███████▏  | 36/50 [00:13<00:03,  4.01it/s] 74%|███████▍  | 37/50 [00:13<00:03,  4.01it/s] 76%|███████▌  | 38/50 [00:13<00:02,  4.00it/s] 78%|███████▊  | 39/50 [00:14<00:02,  4.00it/s] 80%|████████  | 40/50 [00:14<00:02,  4.01it/s] 82%|████████▏ | 41/50 [00:14<00:02,  4.00it/s] 84%|████████▍ | 42/50 [00:14<00:01,  4.00it/s] 86%|████████▌ | 43/50 [00:15<00:01,  4.00it/s] 88%|████████▊ | 44/50 [00:15<00:01,  4.00it/s] 90%|█████████ | 45/50 [00:15<00:01,  4.00it/s] 92%|█████████▏| 46/50 [00:15<00:01,  4.00it/s] 94%|█████████▍| 47/50 [00:16<00:00,  4.00it/s] 96%|█████████▌| 48/50 [00:16<00:00,  4.00it/s] 98%|█████████▊| 49/50 [00:16<00:00,  4.00it/s]100%|██████████| 50/50 [00:21<00:00,  1.65s/it]100%|██████████| 50/50 [00:21<00:00,  2.32it/s]
[I 2023-12-10 22:37:30,013] Trial 155 finished with value: 0.4008897253828386 and parameters: {'EMBEDDING_DIM': 996, 'HIDDEN_DIM': 373, 'NUM_LAYERS': 1, 'DROPOUT': 0.3288998876931969, 'LR': 0.0017135814151091736, 'WEIGHT_0': 0.43522041129848, 'WEIGHT_1': 0.8203096489765522, 'WEIGHT_2': 0.6774368335756564, 'WEIGHT_3': 0.7457120244324621, 'WEIGHT_4': 0.568409197306524, 'WEIGHT_5': 0.4779129707652463, 'WEIGHT_6': 0.9591197118339394, 'WEIGHT_7': 0.35875204877036043, 'WEIGHT_8': 0.3576727380454439, 'optimizer': 'Adam'}. Best is trial 134 with value: 0.4158467115484205.
/userhome/cs2/dingruiw/conda/envs/py310/lib/python3.10/site-packages/torch/nn/modules/rnn.py:82: UserWarning: dropout option adds dropout after all but last recurrent layer, so non-zero dropout expects num_layers greater than 1, but got dropout=0.31554170628827877 and num_layers=1
  warnings.warn("dropout option adds dropout after all but last "
{'EMBEDDING_DIM': 996, 'HIDDEN_DIM': 373, 'NUM_LAYERS': 1, 'DROPOUT': 0.3288998876931969, 'LR': 0.0017135814151091736, 'WEIGHT_0': 0.43522041129848, 'WEIGHT_1': 0.8203096489765522, 'WEIGHT_2': 0.6774368335756564, 'WEIGHT_3': 0.7457120244324621, 'WEIGHT_4': 0.568409197306524, 'WEIGHT_5': 0.4779129707652463, 'WEIGHT_6': 0.9591197118339394, 'WEIGHT_7': 0.35875204877036043, 'WEIGHT_8': 0.3576727380454439, 'optimizer': 'Adam'}
0
              precision    recall  f1-score   support

         LOC       0.05      0.04      0.04      1837
        MISC       0.02      0.06      0.03       922
         ORG       0.02      0.06      0.03      1341
         PER       0.04      0.06      0.05      1842

   micro avg       0.03      0.05      0.04      5942
   macro avg       0.03      0.05      0.04      5942
weighted avg       0.03      0.05      0.04      5942

{'EMBEDDING_DIM': 996, 'HIDDEN_DIM': 373, 'NUM_LAYERS': 1, 'DROPOUT': 0.3288998876931969, 'LR': 0.0017135814151091736, 'WEIGHT_0': 0.43522041129848, 'WEIGHT_1': 0.8203096489765522, 'WEIGHT_2': 0.6774368335756564, 'WEIGHT_3': 0.7457120244324621, 'WEIGHT_4': 0.568409197306524, 'WEIGHT_5': 0.4779129707652463, 'WEIGHT_6': 0.9591197118339394, 'WEIGHT_7': 0.35875204877036043, 'WEIGHT_8': 0.3576727380454439, 'optimizer': 'Adam'}
49
              precision    recall  f1-score   support

         LOC       0.59      0.51      0.54      1837
        MISC       0.43      0.44      0.44       922
         ORG       0.26      0.27      0.27      1341
         PER       0.35      0.35      0.35      1842

   micro avg       0.41      0.39      0.40      5942
   macro avg       0.41      0.39      0.40      5942
weighted avg       0.42      0.39      0.40      5942

epoch 49
LSTM
  0%|          | 0/50 [00:00<?, ?it/s]  2%|▏         | 1/50 [00:04<03:58,  4.87s/it]  4%|▍         | 2/50 [00:04<01:39,  2.07s/it]  6%|▌         | 3/50 [00:05<00:57,  1.22s/it]  8%|▊         | 4/50 [00:05<00:37,  1.23it/s] 10%|█         | 5/50 [00:05<00:26,  1.71it/s] 12%|█▏        | 6/50 [00:05<00:19,  2.22it/s] 14%|█▍        | 7/50 [00:05<00:15,  2.74it/s] 16%|█▌        | 8/50 [00:06<00:12,  3.25it/s] 18%|█▊        | 9/50 [00:06<00:11,  3.69it/s] 20%|██        | 10/50 [00:06<00:09,  4.08it/s] 22%|██▏       | 11/50 [00:06<00:08,  4.40it/s] 24%|██▍       | 12/50 [00:06<00:08,  4.64it/s] 26%|██▌       | 13/50 [00:07<00:07,  4.83it/s] 28%|██▊       | 14/50 [00:07<00:07,  4.96it/s] 30%|███       | 15/50 [00:07<00:06,  5.07it/s] 32%|███▏      | 16/50 [00:07<00:06,  5.14it/s] 34%|███▍      | 17/50 [00:07<00:06,  5.18it/s] 36%|███▌      | 18/50 [00:07<00:06,  5.22it/s] 38%|███▊      | 19/50 [00:08<00:05,  5.25it/s] 40%|████      | 20/50 [00:08<00:05,  5.26it/s] 42%|████▏     | 21/50 [00:08<00:05,  5.28it/s] 44%|████▍     | 22/50 [00:08<00:05,  5.29it/s] 46%|████▌     | 23/50 [00:08<00:05,  5.30it/s] 48%|████▊     | 24/50 [00:09<00:04,  5.30it/s] 50%|█████     | 25/50 [00:09<00:04,  5.30it/s] 52%|█████▏    | 26/50 [00:09<00:04,  5.30it/s] 54%|█████▍    | 27/50 [00:09<00:04,  5.30it/s] 56%|█████▌    | 28/50 [00:09<00:04,  5.30it/s] 58%|█████▊    | 29/50 [00:10<00:03,  5.30it/s] 60%|██████    | 30/50 [00:10<00:03,  5.31it/s] 62%|██████▏   | 31/50 [00:10<00:03,  5.30it/s] 64%|██████▍   | 32/50 [00:10<00:03,  5.31it/s] 66%|██████▌   | 33/50 [00:10<00:03,  5.31it/s] 68%|██████▊   | 34/50 [00:11<00:03,  5.31it/s] 70%|███████   | 35/50 [00:11<00:02,  5.30it/s] 72%|███████▏  | 36/50 [00:11<00:02,  5.31it/s] 74%|███████▍  | 37/50 [00:11<00:02,  5.30it/s] 76%|███████▌  | 38/50 [00:11<00:02,  5.30it/s] 78%|███████▊  | 39/50 [00:11<00:02,  5.31it/s] 80%|████████  | 40/50 [00:12<00:01,  5.31it/s] 82%|████████▏ | 41/50 [00:12<00:01,  5.30it/s] 84%|████████▍ | 42/50 [00:12<00:01,  5.30it/s] 86%|████████▌ | 43/50 [00:12<00:01,  5.30it/s] 88%|████████▊ | 44/50 [00:12<00:01,  5.30it/s] 90%|█████████ | 45/50 [00:13<00:00,  5.30it/s] 92%|█████████▏| 46/50 [00:13<00:00,  5.30it/s] 94%|█████████▍| 47/50 [00:13<00:00,  5.30it/s] 96%|█████████▌| 48/50 [00:13<00:00,  5.30it/s] 98%|█████████▊| 49/50 [00:13<00:00,  5.30it/s]100%|██████████| 50/50 [00:18<00:00,  1.64s/it]100%|██████████| 50/50 [00:18<00:00,  2.65it/s]
[I 2023-12-10 22:37:52,958] Trial 156 finished with value: 0.03685495468378984 and parameters: {'EMBEDDING_DIM': 490, 'HIDDEN_DIM': 413, 'NUM_LAYERS': 1, 'DROPOUT': 0.31554170628827877, 'LR': 0.0009455777395027951, 'WEIGHT_0': 0.4117286594596911, 'WEIGHT_1': 0.7668725455749151, 'WEIGHT_2': 0.5783929850907561, 'WEIGHT_3': 0.9657428240976622, 'WEIGHT_4': 0.8583738649395132, 'WEIGHT_5': 0.545651624353031, 'WEIGHT_6': 0.918651522597604, 'WEIGHT_7': 0.5069339911382257, 'WEIGHT_8': 0.3102407237886848, 'optimizer': 'SGD'}. Best is trial 134 with value: 0.4158467115484205.
/userhome/cs2/dingruiw/conda/envs/py310/lib/python3.10/site-packages/torch/nn/modules/rnn.py:82: UserWarning: dropout option adds dropout after all but last recurrent layer, so non-zero dropout expects num_layers greater than 1, but got dropout=0.3903447659184712 and num_layers=1
  warnings.warn("dropout option adds dropout after all but last "
{'EMBEDDING_DIM': 490, 'HIDDEN_DIM': 413, 'NUM_LAYERS': 1, 'DROPOUT': 0.31554170628827877, 'LR': 0.0009455777395027951, 'WEIGHT_0': 0.4117286594596911, 'WEIGHT_1': 0.7668725455749151, 'WEIGHT_2': 0.5783929850907561, 'WEIGHT_3': 0.9657428240976622, 'WEIGHT_4': 0.8583738649395132, 'WEIGHT_5': 0.545651624353031, 'WEIGHT_6': 0.918651522597604, 'WEIGHT_7': 0.5069339911382257, 'WEIGHT_8': 0.3102407237886848, 'optimizer': 'SGD'}
0
              precision    recall  f1-score   support

         LOC       0.03      0.25      0.05      1837
        MISC       0.01      0.08      0.02       922
         ORG       0.02      0.08      0.03      1341
         PER       0.01      0.07      0.02      1842

   micro avg       0.02      0.13      0.03      5942
   macro avg       0.02      0.12      0.03      5942
weighted avg       0.02      0.13      0.03      5942

{'EMBEDDING_DIM': 490, 'HIDDEN_DIM': 413, 'NUM_LAYERS': 1, 'DROPOUT': 0.31554170628827877, 'LR': 0.0009455777395027951, 'WEIGHT_0': 0.4117286594596911, 'WEIGHT_1': 0.7668725455749151, 'WEIGHT_2': 0.5783929850907561, 'WEIGHT_3': 0.9657428240976622, 'WEIGHT_4': 0.8583738649395132, 'WEIGHT_5': 0.545651624353031, 'WEIGHT_6': 0.918651522597604, 'WEIGHT_7': 0.5069339911382257, 'WEIGHT_8': 0.3102407237886848, 'optimizer': 'SGD'}
49
              precision    recall  f1-score   support

         LOC       0.03      0.19      0.06      1837
        MISC       0.01      0.04      0.02       922
         ORG       0.02      0.07      0.03      1341
         PER       0.01      0.04      0.02      1842

   micro avg       0.02      0.09      0.04      5942
   macro avg       0.02      0.08      0.03      5942
weighted avg       0.02      0.09      0.03      5942

epoch 49
LSTM
  0%|          | 0/50 [00:00<?, ?it/s]  2%|▏         | 1/50 [00:05<04:23,  5.38s/it]  4%|▍         | 2/50 [00:05<01:54,  2.39s/it]  6%|▌         | 3/50 [00:06<01:14,  1.59s/it]  8%|▊         | 4/50 [00:06<00:56,  1.22s/it] 10%|█         | 5/50 [00:07<00:45,  1.01s/it] 12%|█▏        | 6/50 [00:08<00:39,  1.13it/s] 14%|█▍        | 7/50 [00:08<00:34,  1.24it/s] 16%|█▌        | 8/50 [00:09<00:31,  1.32it/s] 18%|█▊        | 9/50 [00:10<00:29,  1.39it/s] 20%|██        | 10/50 [00:10<00:27,  1.43it/s] 22%|██▏       | 11/50 [00:11<00:26,  1.47it/s] 24%|██▍       | 12/50 [00:12<00:25,  1.49it/s] 26%|██▌       | 13/50 [00:12<00:24,  1.51it/s] 28%|██▊       | 14/50 [00:13<00:23,  1.52it/s] 30%|███       | 15/50 [00:14<00:22,  1.52it/s] 32%|███▏      | 16/50 [00:14<00:22,  1.53it/s] 34%|███▍      | 17/50 [00:15<00:21,  1.53it/s] 36%|███▌      | 18/50 [00:16<00:20,  1.54it/s] 38%|███▊      | 19/50 [00:16<00:20,  1.54it/s] 40%|████      | 20/50 [00:17<00:19,  1.54it/s] 42%|████▏     | 21/50 [00:17<00:18,  1.54it/s] 44%|████▍     | 22/50 [00:18<00:18,  1.54it/s] 46%|████▌     | 23/50 [00:19<00:17,  1.54it/s] 48%|████▊     | 24/50 [00:19<00:16,  1.54it/s] 50%|█████     | 25/50 [00:20<00:16,  1.54it/s] 52%|█████▏    | 26/50 [00:21<00:15,  1.54it/s] 54%|█████▍    | 27/50 [00:21<00:14,  1.54it/s] 56%|█████▌    | 28/50 [00:22<00:14,  1.54it/s] 58%|█████▊    | 29/50 [00:23<00:13,  1.53it/s] 60%|██████    | 30/50 [00:23<00:13,  1.53it/s] 62%|██████▏   | 31/50 [00:24<00:12,  1.53it/s] 64%|██████▍   | 32/50 [00:25<00:11,  1.53it/s] 66%|██████▌   | 33/50 [00:25<00:11,  1.53it/s] 68%|██████▊   | 34/50 [00:26<00:10,  1.53it/s] 70%|███████   | 35/50 [00:27<00:09,  1.53it/s] 72%|███████▏  | 36/50 [00:27<00:09,  1.53it/s] 74%|███████▍  | 37/50 [00:28<00:08,  1.52it/s] 76%|███████▌  | 38/50 [00:29<00:07,  1.52it/s] 78%|███████▊  | 39/50 [00:29<00:07,  1.52it/s] 80%|████████  | 40/50 [00:30<00:06,  1.52it/s] 82%|████████▏ | 41/50 [00:31<00:05,  1.52it/s] 84%|████████▍ | 42/50 [00:31<00:05,  1.52it/s] 86%|████████▌ | 43/50 [00:32<00:04,  1.51it/s] 88%|████████▊ | 44/50 [00:33<00:03,  1.52it/s] 90%|█████████ | 45/50 [00:33<00:03,  1.51it/s] 92%|█████████▏| 46/50 [00:34<00:02,  1.51it/s] 94%|█████████▍| 47/50 [00:35<00:01,  1.51it/s] 96%|█████████▌| 48/50 [00:35<00:01,  1.51it/s] 98%|█████████▊| 49/50 [00:36<00:00,  1.51it/s]100%|██████████| 50/50 [00:41<00:00,  2.16s/it]100%|██████████| 50/50 [00:41<00:00,  1.19it/s]
