[I 2023-12-10 21:21:13,200] Trial 29 finished with value: 0.016745620799823727 and parameters: {'EMBEDDING_DIM': 76, 'HIDDEN_DIM': 997, 'NUM_LAYERS': 1, 'DROPOUT': 0.2992414337186001, 'LR': 0.003769588376781193, 'WEIGHT_0': 0.4335732880579064, 'WEIGHT_1': 0.8872965003291658, 'WEIGHT_2': 0.770758689158358, 'WEIGHT_3': 0.5580578233626052, 'WEIGHT_4': 0.9486559610437277, 'WEIGHT_5': 0.716851709278662, 'WEIGHT_6': 0.9290686117833, 'WEIGHT_7': 0.3118277857216601, 'WEIGHT_8': 0.7560155071221005, 'optimizer': 'SGD'}. Best is trial 26 with value: 0.4051425745838141.
{'EMBEDDING_DIM': 76, 'HIDDEN_DIM': 997, 'NUM_LAYERS': 1, 'DROPOUT': 0.2992414337186001, 'LR': 0.003769588376781193, 'WEIGHT_0': 0.4335732880579064, 'WEIGHT_1': 0.8872965003291658, 'WEIGHT_2': 0.770758689158358, 'WEIGHT_3': 0.5580578233626052, 'WEIGHT_4': 0.9486559610437277, 'WEIGHT_5': 0.716851709278662, 'WEIGHT_6': 0.9290686117833, 'WEIGHT_7': 0.3118277857216601, 'WEIGHT_8': 0.7560155071221005, 'optimizer': 'SGD'}
0
              precision    recall  f1-score   support

         LOC       0.03      0.17      0.04      1837
        MISC       0.02      0.22      0.03       922
         ORG       0.01      0.04      0.02      1341
         PER       0.02      0.05      0.02      1842

   micro avg       0.02      0.11      0.03      5942
   macro avg       0.02      0.12      0.03      5942
weighted avg       0.02      0.11      0.03      5942

{'EMBEDDING_DIM': 76, 'HIDDEN_DIM': 997, 'NUM_LAYERS': 1, 'DROPOUT': 0.2992414337186001, 'LR': 0.003769588376781193, 'WEIGHT_0': 0.4335732880579064, 'WEIGHT_1': 0.8872965003291658, 'WEIGHT_2': 0.770758689158358, 'WEIGHT_3': 0.5580578233626052, 'WEIGHT_4': 0.9486559610437277, 'WEIGHT_5': 0.716851709278662, 'WEIGHT_6': 0.9290686117833, 'WEIGHT_7': 0.3118277857216601, 'WEIGHT_8': 0.7560155071221005, 'optimizer': 'SGD'}
49
              precision    recall  f1-score   support

         LOC       0.08      0.02      0.03      1837
        MISC       0.02      0.02      0.02       922
         ORG       0.01      0.00      0.00      1341
         PER       0.02      0.01      0.01      1842

   micro avg       0.02      0.01      0.02      5942
   macro avg       0.03      0.01      0.02      5942
weighted avg       0.03      0.01      0.02      5942

epoch 49
LSTM
  0%|          | 0/50 [00:00<?, ?it/s]  2%|▏         | 1/50 [00:17<14:30, 17.77s/it]  4%|▍         | 2/50 [00:20<07:05,  8.87s/it]  6%|▌         | 3/50 [00:24<05:10,  6.60s/it]  8%|▊         | 4/50 [00:28<04:15,  5.55s/it] 10%|█         | 5/50 [00:32<03:43,  4.97s/it] 12%|█▏        | 6/50 [00:36<03:23,  4.63s/it] 14%|█▍        | 7/50 [00:40<03:11,  4.45s/it] 16%|█▌        | 8/50 [00:44<03:01,  4.32s/it] 18%|█▊        | 9/50 [00:48<02:54,  4.25s/it] 20%|██        | 10/50 [00:52<02:47,  4.20s/it] 22%|██▏       | 11/50 [00:56<02:42,  4.16s/it] 24%|██▍       | 12/50 [01:00<02:37,  4.13s/it] 26%|██▌       | 13/50 [01:04<02:32,  4.12s/it] 28%|██▊       | 14/50 [01:08<02:27,  4.11s/it] 30%|███       | 15/50 [01:12<02:24,  4.12s/it] 32%|███▏      | 16/50 [01:17<02:20,  4.13s/it] 34%|███▍      | 17/50 [01:21<02:16,  4.13s/it] 36%|███▌      | 18/50 [01:25<02:11,  4.12s/it] 38%|███▊      | 19/50 [01:29<02:07,  4.11s/it] 40%|████      | 20/50 [01:33<02:03,  4.11s/it] 42%|████▏     | 21/50 [01:37<01:58,  4.09s/it] 44%|████▍     | 22/50 [01:41<01:54,  4.08s/it] 46%|████▌     | 23/50 [01:45<01:50,  4.09s/it] 48%|████▊     | 24/50 [01:49<01:46,  4.10s/it] 50%|█████     | 25/50 [01:53<01:42,  4.09s/it] 52%|█████▏    | 26/50 [01:57<01:37,  4.08s/it] 54%|█████▍    | 27/50 [02:02<01:33,  4.07s/it] 56%|█████▌    | 28/50 [02:06<01:29,  4.07s/it] 58%|█████▊    | 29/50 [02:10<01:25,  4.06s/it] 60%|██████    | 30/50 [02:14<01:20,  4.05s/it] 62%|██████▏   | 31/50 [02:18<01:16,  4.04s/it] 64%|██████▍   | 32/50 [02:22<01:12,  4.04s/it] 66%|██████▌   | 33/50 [02:26<01:08,  4.04s/it] 68%|██████▊   | 34/50 [02:30<01:04,  4.03s/it] 70%|███████   | 35/50 [02:34<01:00,  4.03s/it] 72%|███████▏  | 36/50 [02:38<00:56,  4.03s/it] 74%|███████▍  | 37/50 [02:42<00:52,  4.02s/it] 76%|███████▌  | 38/50 [02:46<00:48,  4.01s/it] 78%|███████▊  | 39/50 [02:50<00:44,  4.00s/it] 80%|████████  | 40/50 [02:54<00:40,  4.00s/it] 82%|████████▏ | 41/50 [02:58<00:35,  4.00s/it] 84%|████████▍ | 42/50 [03:02<00:31,  3.99s/it] 86%|████████▌ | 43/50 [03:06<00:27,  3.98s/it] 88%|████████▊ | 44/50 [03:10<00:23,  3.97s/it] 90%|█████████ | 45/50 [03:14<00:19,  3.97s/it] 92%|█████████▏| 46/50 [03:18<00:15,  3.97s/it] 94%|█████████▍| 47/50 [03:22<00:11,  3.97s/it] 96%|█████████▌| 48/50 [03:26<00:07,  3.96s/it] 98%|█████████▊| 49/50 [03:29<00:03,  3.96s/it]100%|██████████| 50/50 [03:49<00:00,  8.52s/it]100%|██████████| 50/50 [03:49<00:00,  4.58s/it]
[I 2023-12-10 21:25:16,218] Trial 30 finished with value: 0.20580287299103966 and parameters: {'EMBEDDING_DIM': 425, 'HIDDEN_DIM': 1386, 'NUM_LAYERS': 3, 'DROPOUT': 0.278473130175481, 'LR': 0.002255638713608857, 'WEIGHT_0': 0.44380232552914617, 'WEIGHT_1': 0.7681669210877149, 'WEIGHT_2': 0.6187519802287602, 'WEIGHT_3': 0.7368617990944316, 'WEIGHT_4': 0.9086645509914497, 'WEIGHT_5': 0.6784658865858689, 'WEIGHT_6': 0.9259470611338491, 'WEIGHT_7': 0.4636863398061715, 'WEIGHT_8': 0.8434655340512826, 'optimizer': 'Adam'}. Best is trial 26 with value: 0.4051425745838141.
/userhome/cs2/dingruiw/conda/envs/py310/lib/python3.10/site-packages/torch/nn/modules/rnn.py:82: UserWarning: dropout option adds dropout after all but last recurrent layer, so non-zero dropout expects num_layers greater than 1, but got dropout=0.3771093955710231 and num_layers=1
  warnings.warn("dropout option adds dropout after all but last "
{'EMBEDDING_DIM': 425, 'HIDDEN_DIM': 1386, 'NUM_LAYERS': 3, 'DROPOUT': 0.278473130175481, 'LR': 0.002255638713608857, 'WEIGHT_0': 0.44380232552914617, 'WEIGHT_1': 0.7681669210877149, 'WEIGHT_2': 0.6187519802287602, 'WEIGHT_3': 0.7368617990944316, 'WEIGHT_4': 0.9086645509914497, 'WEIGHT_5': 0.6784658865858689, 'WEIGHT_6': 0.9259470611338491, 'WEIGHT_7': 0.4636863398061715, 'WEIGHT_8': 0.8434655340512826, 'optimizer': 'Adam'}
0
              precision    recall  f1-score   support

         LOC       0.04      0.01      0.01      1837
        MISC       0.07      0.01      0.01       922
         ORG       0.00      0.00      0.00      1341
         PER       0.00      0.00      0.00      1842

   micro avg       0.04      0.00      0.01      5942
   macro avg       0.03      0.00      0.01      5942
weighted avg       0.02      0.00      0.01      5942

{'EMBEDDING_DIM': 425, 'HIDDEN_DIM': 1386, 'NUM_LAYERS': 3, 'DROPOUT': 0.278473130175481, 'LR': 0.002255638713608857, 'WEIGHT_0': 0.44380232552914617, 'WEIGHT_1': 0.7681669210877149, 'WEIGHT_2': 0.6187519802287602, 'WEIGHT_3': 0.7368617990944316, 'WEIGHT_4': 0.9086645509914497, 'WEIGHT_5': 0.6784658865858689, 'WEIGHT_6': 0.9259470611338491, 'WEIGHT_7': 0.4636863398061715, 'WEIGHT_8': 0.8434655340512826, 'optimizer': 'Adam'}
49
              precision    recall  f1-score   support

         LOC       0.30      0.34      0.32      1837
        MISC       0.08      0.22      0.12       922
         ORG       0.15      0.20      0.17      1341
         PER       0.21      0.19      0.20      1842

   micro avg       0.18      0.24      0.21      5942
   macro avg       0.19      0.24      0.20      5942
weighted avg       0.21      0.24      0.22      5942

epoch 49
LSTM
  0%|          | 0/50 [00:00<?, ?it/s]  2%|▏         | 1/50 [00:04<04:04,  4.98s/it]  4%|▍         | 2/50 [00:05<01:44,  2.17s/it]  6%|▌         | 3/50 [00:05<01:03,  1.36s/it]  8%|▊         | 4/50 [00:05<00:44,  1.03it/s] 10%|█         | 5/50 [00:06<00:34,  1.31it/s] 12%|█▏        | 6/50 [00:06<00:27,  1.58it/s] 14%|█▍        | 7/50 [00:07<00:23,  1.80it/s] 16%|█▌        | 8/50 [00:07<00:21,  2.00it/s] 18%|█▊        | 9/50 [00:07<00:19,  2.15it/s] 20%|██        | 10/50 [00:08<00:17,  2.27it/s] 22%|██▏       | 11/50 [00:08<00:16,  2.35it/s] 24%|██▍       | 12/50 [00:09<00:15,  2.42it/s] 26%|██▌       | 13/50 [00:09<00:15,  2.46it/s] 28%|██▊       | 14/50 [00:09<00:14,  2.50it/s] 30%|███       | 15/50 [00:10<00:13,  2.52it/s] 32%|███▏      | 16/50 [00:10<00:13,  2.54it/s] 34%|███▍      | 17/50 [00:11<00:12,  2.55it/s] 36%|███▌      | 18/50 [00:11<00:12,  2.56it/s] 38%|███▊      | 19/50 [00:11<00:12,  2.57it/s] 40%|████      | 20/50 [00:12<00:11,  2.57it/s] 42%|████▏     | 21/50 [00:12<00:11,  2.57it/s] 44%|████▍     | 22/50 [00:12<00:10,  2.57it/s] 46%|████▌     | 23/50 [00:13<00:10,  2.57it/s] 48%|████▊     | 24/50 [00:13<00:10,  2.57it/s] 50%|█████     | 25/50 [00:14<00:09,  2.58it/s] 52%|█████▏    | 26/50 [00:14<00:09,  2.58it/s] 54%|█████▍    | 27/50 [00:14<00:08,  2.58it/s] 56%|█████▌    | 28/50 [00:15<00:08,  2.58it/s] 58%|█████▊    | 29/50 [00:15<00:08,  2.58it/s] 60%|██████    | 30/50 [00:16<00:07,  2.57it/s] 62%|██████▏   | 31/50 [00:16<00:07,  2.58it/s] 64%|██████▍   | 32/50 [00:16<00:06,  2.57it/s] 66%|██████▌   | 33/50 [00:17<00:06,  2.57it/s] 68%|██████▊   | 34/50 [00:17<00:06,  2.57it/s] 70%|███████   | 35/50 [00:17<00:05,  2.57it/s] 72%|███████▏  | 36/50 [00:18<00:05,  2.56it/s] 74%|███████▍  | 37/50 [00:18<00:05,  2.57it/s] 76%|███████▌  | 38/50 [00:19<00:04,  2.56it/s] 78%|███████▊  | 39/50 [00:19<00:04,  2.56it/s] 80%|████████  | 40/50 [00:19<00:03,  2.56it/s] 82%|████████▏ | 41/50 [00:20<00:03,  2.57it/s] 84%|████████▍ | 42/50 [00:20<00:03,  2.56it/s] 86%|████████▌ | 43/50 [00:21<00:02,  2.56it/s] 88%|████████▊ | 44/50 [00:21<00:02,  2.56it/s] 90%|█████████ | 45/50 [00:21<00:01,  2.57it/s] 92%|█████████▏| 46/50 [00:22<00:01,  2.56it/s] 94%|█████████▍| 47/50 [00:22<00:01,  2.56it/s] 96%|█████████▌| 48/50 [00:23<00:00,  2.57it/s] 98%|█████████▊| 49/50 [00:23<00:00,  2.56it/s]100%|██████████| 50/50 [00:28<00:00,  1.79s/it]100%|██████████| 50/50 [00:28<00:00,  1.75it/s]
[I 2023-12-10 21:25:48,941] Trial 31 finished with value: 0.3997609289617486 and parameters: {'EMBEDDING_DIM': 621, 'HIDDEN_DIM': 660, 'NUM_LAYERS': 1, 'DROPOUT': 0.3771093955710231, 'LR': 0.002759755669190579, 'WEIGHT_0': 0.5938384486017315, 'WEIGHT_1': 0.6353863677107077, 'WEIGHT_2': 0.5202196998617303, 'WEIGHT_3': 0.8347432565168946, 'WEIGHT_4': 0.8339363869458062, 'WEIGHT_5': 0.8274256788660282, 'WEIGHT_6': 0.8649189864956064, 'WEIGHT_7': 0.32245059936147824, 'WEIGHT_8': 0.6172429060098609, 'optimizer': 'Adam'}. Best is trial 26 with value: 0.4051425745838141.
/userhome/cs2/dingruiw/conda/envs/py310/lib/python3.10/site-packages/torch/nn/modules/rnn.py:82: UserWarning: dropout option adds dropout after all but last recurrent layer, so non-zero dropout expects num_layers greater than 1, but got dropout=0.35672753417780756 and num_layers=1
  warnings.warn("dropout option adds dropout after all but last "
{'EMBEDDING_DIM': 621, 'HIDDEN_DIM': 660, 'NUM_LAYERS': 1, 'DROPOUT': 0.3771093955710231, 'LR': 0.002759755669190579, 'WEIGHT_0': 0.5938384486017315, 'WEIGHT_1': 0.6353863677107077, 'WEIGHT_2': 0.5202196998617303, 'WEIGHT_3': 0.8347432565168946, 'WEIGHT_4': 0.8339363869458062, 'WEIGHT_5': 0.8274256788660282, 'WEIGHT_6': 0.8649189864956064, 'WEIGHT_7': 0.32245059936147824, 'WEIGHT_8': 0.6172429060098609, 'optimizer': 'Adam'}
0
              precision    recall  f1-score   support

         LOC       0.12      0.04      0.06      1837
        MISC       0.03      0.03      0.03       922
         ORG       0.09      0.05      0.06      1341
         PER       0.03      0.03      0.03      1842

   micro avg       0.06      0.04      0.05      5942
   macro avg       0.07      0.04      0.05      5942
weighted avg       0.07      0.04      0.05      5942

{'EMBEDDING_DIM': 621, 'HIDDEN_DIM': 660, 'NUM_LAYERS': 1, 'DROPOUT': 0.3771093955710231, 'LR': 0.002759755669190579, 'WEIGHT_0': 0.5938384486017315, 'WEIGHT_1': 0.6353863677107077, 'WEIGHT_2': 0.5202196998617303, 'WEIGHT_3': 0.8347432565168946, 'WEIGHT_4': 0.8339363869458062, 'WEIGHT_5': 0.8274256788660282, 'WEIGHT_6': 0.8649189864956064, 'WEIGHT_7': 0.32245059936147824, 'WEIGHT_8': 0.6172429060098609, 'optimizer': 'Adam'}
49
              precision    recall  f1-score   support

         LOC       0.58      0.53      0.55      1837
        MISC       0.45      0.41      0.43       922
         ORG       0.28      0.25      0.26      1341
         PER       0.32      0.35      0.34      1842

   micro avg       0.41      0.39      0.40      5942
   macro avg       0.41      0.39      0.40      5942
weighted avg       0.41      0.39      0.40      5942

epoch 49
LSTM
  0%|          | 0/50 [00:00<?, ?it/s]  2%|▏         | 1/50 [00:04<04:00,  4.90s/it]  4%|▍         | 2/50 [00:05<01:42,  2.13s/it]  6%|▌         | 3/50 [00:05<01:03,  1.35s/it]  8%|▊         | 4/50 [00:05<00:45,  1.02it/s] 10%|█         | 5/50 [00:06<00:34,  1.29it/s] 12%|█▏        | 6/50 [00:06<00:28,  1.53it/s] 14%|█▍        | 7/50 [00:07<00:24,  1.74it/s] 16%|█▌        | 8/50 [00:07<00:21,  1.91it/s] 18%|█▊        | 9/50 [00:07<00:20,  2.04it/s] 20%|██        | 10/50 [00:08<00:18,  2.15it/s] 22%|██▏       | 11/50 [00:08<00:17,  2.22it/s] 24%|██▍       | 12/50 [00:09<00:16,  2.28it/s] 26%|██▌       | 13/50 [00:09<00:15,  2.32it/s] 28%|██▊       | 14/50 [00:10<00:15,  2.35it/s] 30%|███       | 15/50 [00:10<00:14,  2.37it/s] 32%|███▏      | 16/50 [00:10<00:14,  2.38it/s] 34%|███▍      | 17/50 [00:11<00:13,  2.39it/s] 36%|███▌      | 18/50 [00:11<00:13,  2.40it/s] 38%|███▊      | 19/50 [00:12<00:12,  2.40it/s] 40%|████      | 20/50 [00:12<00:12,  2.40it/s] 42%|████▏     | 21/50 [00:12<00:12,  2.40it/s] 44%|████▍     | 22/50 [00:13<00:11,  2.41it/s] 46%|████▌     | 23/50 [00:13<00:11,  2.41it/s] 48%|████▊     | 24/50 [00:14<00:10,  2.41it/s] 50%|█████     | 25/50 [00:14<00:10,  2.41it/s] 52%|█████▏    | 26/50 [00:15<00:09,  2.41it/s] 54%|█████▍    | 27/50 [00:15<00:09,  2.41it/s] 56%|█████▌    | 28/50 [00:15<00:09,  2.41it/s] 58%|█████▊    | 29/50 [00:16<00:08,  2.41it/s] 60%|██████    | 30/50 [00:16<00:08,  2.40it/s] 62%|██████▏   | 31/50 [00:17<00:07,  2.40it/s] 64%|██████▍   | 32/50 [00:17<00:07,  2.40it/s] 66%|██████▌   | 33/50 [00:17<00:07,  2.40it/s] 68%|██████▊   | 34/50 [00:18<00:06,  2.40it/s] 70%|███████   | 35/50 [00:18<00:06,  2.40it/s] 72%|███████▏  | 36/50 [00:19<00:05,  2.40it/s] 74%|███████▍  | 37/50 [00:19<00:05,  2.40it/s] 76%|███████▌  | 38/50 [00:20<00:04,  2.40it/s] 78%|███████▊  | 39/50 [00:20<00:04,  2.40it/s] 80%|████████  | 40/50 [00:20<00:04,  2.40it/s] 82%|████████▏ | 41/50 [00:21<00:03,  2.40it/s] 84%|████████▍ | 42/50 [00:21<00:03,  2.40it/s] 86%|████████▌ | 43/50 [00:22<00:02,  2.40it/s] 88%|████████▊ | 44/50 [00:22<00:02,  2.40it/s] 90%|█████████ | 45/50 [00:22<00:02,  2.40it/s] 92%|█████████▏| 46/50 [00:23<00:01,  2.40it/s] 94%|█████████▍| 47/50 [00:23<00:01,  2.40it/s] 96%|█████████▌| 48/50 [00:24<00:00,  2.40it/s] 98%|█████████▊| 49/50 [00:24<00:00,  2.40it/s]100%|██████████| 50/50 [00:29<00:00,  1.82s/it]100%|██████████| 50/50 [00:29<00:00,  1.68it/s]
[I 2023-12-10 21:26:22,772] Trial 32 finished with value: 0.38457109959700636 and parameters: {'EMBEDDING_DIM': 597, 'HIDDEN_DIM': 687, 'NUM_LAYERS': 1, 'DROPOUT': 0.35672753417780756, 'LR': 0.0035482162047269215, 'WEIGHT_0': 0.6095203197992172, 'WEIGHT_1': 0.8906594806817714, 'WEIGHT_2': 0.7223656444587885, 'WEIGHT_3': 0.8170933546164547, 'WEIGHT_4': 0.8455942812384776, 'WEIGHT_5': 0.8095423417297839, 'WEIGHT_6': 0.8405789316153233, 'WEIGHT_7': 0.33690174029090286, 'WEIGHT_8': 0.6865861766229178, 'optimizer': 'Adam'}. Best is trial 26 with value: 0.4051425745838141.
/userhome/cs2/dingruiw/conda/envs/py310/lib/python3.10/site-packages/torch/nn/modules/rnn.py:82: UserWarning: dropout option adds dropout after all but last recurrent layer, so non-zero dropout expects num_layers greater than 1, but got dropout=0.3146346176080506 and num_layers=1
  warnings.warn("dropout option adds dropout after all but last "
{'EMBEDDING_DIM': 597, 'HIDDEN_DIM': 687, 'NUM_LAYERS': 1, 'DROPOUT': 0.35672753417780756, 'LR': 0.0035482162047269215, 'WEIGHT_0': 0.6095203197992172, 'WEIGHT_1': 0.8906594806817714, 'WEIGHT_2': 0.7223656444587885, 'WEIGHT_3': 0.8170933546164547, 'WEIGHT_4': 0.8455942812384776, 'WEIGHT_5': 0.8095423417297839, 'WEIGHT_6': 0.8405789316153233, 'WEIGHT_7': 0.33690174029090286, 'WEIGHT_8': 0.6865861766229178, 'optimizer': 'Adam'}
0
              precision    recall  f1-score   support

         LOC       0.12      0.03      0.04      1837
        MISC       0.02      0.01      0.01       922
         ORG       0.06      0.05      0.05      1341
         PER       0.04      0.02      0.02      1842

   micro avg       0.05      0.03      0.04      5942
   macro avg       0.06      0.03      0.03      5942
weighted avg       0.06      0.03      0.03      5942

{'EMBEDDING_DIM': 597, 'HIDDEN_DIM': 687, 'NUM_LAYERS': 1, 'DROPOUT': 0.35672753417780756, 'LR': 0.0035482162047269215, 'WEIGHT_0': 0.6095203197992172, 'WEIGHT_1': 0.8906594806817714, 'WEIGHT_2': 0.7223656444587885, 'WEIGHT_3': 0.8170933546164547, 'WEIGHT_4': 0.8455942812384776, 'WEIGHT_5': 0.8095423417297839, 'WEIGHT_6': 0.8405789316153233, 'WEIGHT_7': 0.33690174029090286, 'WEIGHT_8': 0.6865861766229178, 'optimizer': 'Adam'}
49
              precision    recall  f1-score   support

         LOC       0.55      0.52      0.53      1837
        MISC       0.41      0.40      0.41       922
         ORG       0.24      0.26      0.25      1341
         PER       0.31      0.36      0.34      1842

   micro avg       0.38      0.39      0.38      5942
   macro avg       0.38      0.39      0.38      5942
weighted avg       0.38      0.39      0.39      5942

epoch 49
LSTM
  0%|          | 0/50 [00:00<?, ?it/s]  2%|▏         | 1/50 [00:04<03:51,  4.73s/it]  4%|▍         | 2/50 [00:04<01:36,  2.01s/it]  6%|▌         | 3/50 [00:05<00:55,  1.19s/it]  8%|▊         | 4/50 [00:05<00:36,  1.25it/s] 10%|█         | 5/50 [00:05<00:26,  1.72it/s] 12%|█▏        | 6/50 [00:05<00:19,  2.22it/s] 14%|█▍        | 7/50 [00:05<00:15,  2.72it/s] 16%|█▌        | 8/50 [00:06<00:13,  3.18it/s] 18%|█▊        | 9/50 [00:06<00:11,  3.59it/s] 20%|██        | 10/50 [00:06<00:10,  3.95it/s] 22%|██▏       | 11/50 [00:06<00:09,  4.22it/s] 24%|██▍       | 12/50 [00:06<00:08,  4.44it/s] 26%|██▌       | 13/50 [00:07<00:08,  4.60it/s] 28%|██▊       | 14/50 [00:07<00:07,  4.72it/s] 30%|███       | 15/50 [00:07<00:07,  4.81it/s] 32%|███▏      | 16/50 [00:07<00:06,  4.89it/s] 34%|███▍      | 17/50 [00:07<00:06,  4.93it/s] 36%|███▌      | 18/50 [00:08<00:06,  4.94it/s] 38%|███▊      | 19/50 [00:08<00:06,  4.97it/s] 40%|████      | 20/50 [00:08<00:06,  4.99it/s] 42%|████▏     | 21/50 [00:08<00:05,  5.01it/s] 44%|████▍     | 22/50 [00:08<00:05,  5.01it/s] 46%|████▌     | 23/50 [00:09<00:05,  5.01it/s] 48%|████▊     | 24/50 [00:09<00:05,  5.01it/s] 50%|█████     | 25/50 [00:09<00:04,  5.01it/s] 52%|█████▏    | 26/50 [00:09<00:04,  5.02it/s] 54%|█████▍    | 27/50 [00:09<00:04,  5.02it/s] 56%|█████▌    | 28/50 [00:10<00:04,  5.02it/s] 58%|█████▊    | 29/50 [00:10<00:04,  5.01it/s] 60%|██████    | 30/50 [00:10<00:03,  5.01it/s] 62%|██████▏   | 31/50 [00:10<00:03,  5.02it/s] 64%|██████▍   | 32/50 [00:10<00:03,  5.02it/s] 66%|██████▌   | 33/50 [00:11<00:03,  5.02it/s] 68%|██████▊   | 34/50 [00:11<00:03,  5.01it/s] 70%|███████   | 35/50 [00:11<00:02,  5.01it/s] 72%|███████▏  | 36/50 [00:11<00:02,  5.01it/s] 74%|███████▍  | 37/50 [00:11<00:02,  5.02it/s] 76%|███████▌  | 38/50 [00:12<00:02,  5.02it/s] 78%|███████▊  | 39/50 [00:12<00:02,  5.02it/s] 80%|████████  | 40/50 [00:12<00:01,  5.01it/s] 82%|████████▏ | 41/50 [00:12<00:01,  5.00it/s] 84%|████████▍ | 42/50 [00:12<00:01,  5.00it/s] 86%|████████▌ | 43/50 [00:13<00:01,  5.01it/s] 88%|████████▊ | 44/50 [00:13<00:01,  5.00it/s] 90%|█████████ | 45/50 [00:13<00:00,  5.01it/s] 92%|█████████▏| 46/50 [00:13<00:00,  5.00it/s] 94%|█████████▍| 47/50 [00:13<00:00,  4.99it/s] 96%|█████████▌| 48/50 [00:14<00:00,  4.99it/s] 98%|█████████▊| 49/50 [00:14<00:00,  4.99it/s]100%|██████████| 50/50 [00:19<00:00,  1.59s/it]100%|██████████| 50/50 [00:19<00:00,  2.63it/s]
