[I 2023-12-10 23:13:25,478] Trial 225 finished with value: 0.16166936790923825 and parameters: {'EMBEDDING_DIM': 34, 'HIDDEN_DIM': 1078, 'NUM_LAYERS': 1, 'DROPOUT': 0.3919619626069864, 'LR': 0.0022897725064742235, 'WEIGHT_0': 0.48569571337675205, 'WEIGHT_1': 0.5205805340518999, 'WEIGHT_2': 0.09856117156843199, 'WEIGHT_3': 0.8489415585874, 'WEIGHT_4': 0.9563655962050414, 'WEIGHT_5': 0.5262286337719204, 'WEIGHT_6': 0.6990009756962557, 'WEIGHT_7': 0.41576816196905997, 'WEIGHT_8': 0.8685417187421904, 'optimizer': 'Adam'}. Best is trial 221 with value: 0.418736930154747.
/userhome/cs2/dingruiw/conda/envs/py310/lib/python3.10/site-packages/torch/nn/modules/rnn.py:82: UserWarning: dropout option adds dropout after all but last recurrent layer, so non-zero dropout expects num_layers greater than 1, but got dropout=0.24652950178803587 and num_layers=1
  warnings.warn("dropout option adds dropout after all but last "
{'EMBEDDING_DIM': 34, 'HIDDEN_DIM': 1078, 'NUM_LAYERS': 1, 'DROPOUT': 0.3919619626069864, 'LR': 0.0022897725064742235, 'WEIGHT_0': 0.48569571337675205, 'WEIGHT_1': 0.5205805340518999, 'WEIGHT_2': 0.09856117156843199, 'WEIGHT_3': 0.8489415585874, 'WEIGHT_4': 0.9563655962050414, 'WEIGHT_5': 0.5262286337719204, 'WEIGHT_6': 0.6990009756962557, 'WEIGHT_7': 0.41576816196905997, 'WEIGHT_8': 0.8685417187421904, 'optimizer': 'Adam'}
0
              precision    recall  f1-score   support

         LOC       0.04      0.09      0.06      1837
        MISC       0.01      0.10      0.02       922
         ORG       0.01      0.00      0.00      1341
         PER       0.02      0.00      0.00      1842

   micro avg       0.02      0.04      0.03      5942
   macro avg       0.02      0.05      0.02      5942
weighted avg       0.02      0.04      0.02      5942

{'EMBEDDING_DIM': 34, 'HIDDEN_DIM': 1078, 'NUM_LAYERS': 1, 'DROPOUT': 0.3919619626069864, 'LR': 0.0022897725064742235, 'WEIGHT_0': 0.48569571337675205, 'WEIGHT_1': 0.5205805340518999, 'WEIGHT_2': 0.09856117156843199, 'WEIGHT_3': 0.8489415585874, 'WEIGHT_4': 0.9563655962050414, 'WEIGHT_5': 0.5262286337719204, 'WEIGHT_6': 0.6990009756962557, 'WEIGHT_7': 0.41576816196905997, 'WEIGHT_8': 0.8685417187421904, 'optimizer': 'Adam'}
49
              precision    recall  f1-score   support

         LOC       0.41      0.20      0.27      1837
        MISC       0.00      0.00      0.00       922
         ORG       0.05      0.01      0.02      1341
         PER       0.15      0.23      0.18      1842

   micro avg       0.20      0.13      0.16      5942
   macro avg       0.15      0.11      0.12      5942
weighted avg       0.18      0.13      0.14      5942

epoch 49
LSTM
  0%|          | 0/50 [00:00<?, ?it/s]  2%|▏         | 1/50 [00:04<03:49,  4.69s/it]  6%|▌         | 3/50 [00:04<01:01,  1.32s/it]  8%|▊         | 4/50 [00:05<00:42,  1.09it/s] 10%|█         | 5/50 [00:05<00:30,  1.50it/s] 12%|█▏        | 6/50 [00:05<00:22,  1.98it/s] 14%|█▍        | 7/50 [00:05<00:17,  2.52it/s] 16%|█▌        | 8/50 [00:05<00:13,  3.08it/s] 18%|█▊        | 9/50 [00:05<00:11,  3.64it/s] 20%|██        | 10/50 [00:06<00:09,  4.16it/s] 22%|██▏       | 11/50 [00:06<00:08,  4.61it/s] 24%|██▍       | 12/50 [00:06<00:07,  4.99it/s] 26%|██▌       | 13/50 [00:06<00:06,  5.29it/s] 28%|██▊       | 14/50 [00:06<00:06,  5.52it/s] 30%|███       | 15/50 [00:06<00:06,  5.70it/s] 32%|███▏      | 16/50 [00:07<00:05,  5.83it/s] 34%|███▍      | 17/50 [00:07<00:05,  5.92it/s] 36%|███▌      | 18/50 [00:07<00:05,  5.99it/s] 38%|███▊      | 19/50 [00:07<00:05,  6.04it/s] 40%|████      | 20/50 [00:07<00:04,  6.07it/s] 42%|████▏     | 21/50 [00:07<00:04,  6.09it/s] 44%|████▍     | 22/50 [00:08<00:04,  6.11it/s] 46%|████▌     | 23/50 [00:08<00:04,  6.12it/s] 48%|████▊     | 24/50 [00:08<00:04,  6.12it/s] 50%|█████     | 25/50 [00:08<00:04,  6.13it/s] 52%|█████▏    | 26/50 [00:08<00:03,  6.14it/s] 54%|█████▍    | 27/50 [00:08<00:03,  6.14it/s] 56%|█████▌    | 28/50 [00:09<00:03,  6.14it/s] 58%|█████▊    | 29/50 [00:09<00:03,  6.15it/s] 60%|██████    | 30/50 [00:09<00:03,  6.14it/s] 62%|██████▏   | 31/50 [00:09<00:03,  6.14it/s] 64%|██████▍   | 32/50 [00:09<00:02,  6.14it/s] 66%|██████▌   | 33/50 [00:09<00:02,  6.12it/s] 68%|██████▊   | 34/50 [00:10<00:02,  6.11it/s] 70%|███████   | 35/50 [00:10<00:02,  6.12it/s] 72%|███████▏  | 36/50 [00:10<00:02,  6.13it/s] 74%|███████▍  | 37/50 [00:10<00:02,  6.10it/s] 76%|███████▌  | 38/50 [00:10<00:01,  6.10it/s] 78%|███████▊  | 39/50 [00:10<00:01,  6.10it/s] 80%|████████  | 40/50 [00:10<00:01,  6.12it/s] 82%|████████▏ | 41/50 [00:11<00:01,  6.13it/s] 84%|████████▍ | 42/50 [00:11<00:01,  6.10it/s] 86%|████████▌ | 43/50 [00:11<00:01,  6.07it/s] 88%|████████▊ | 44/50 [00:11<00:00,  6.08it/s] 90%|█████████ | 45/50 [00:11<00:00,  6.09it/s] 92%|█████████▏| 46/50 [00:11<00:00,  6.07it/s] 94%|█████████▍| 47/50 [00:12<00:00,  6.06it/s] 96%|█████████▌| 48/50 [00:12<00:00,  6.05it/s] 98%|█████████▊| 49/50 [00:12<00:00,  6.04it/s]100%|██████████| 50/50 [00:17<00:00,  1.56s/it]100%|██████████| 50/50 [00:17<00:00,  2.89it/s]
[I 2023-12-10 23:13:46,833] Trial 226 finished with value: 0.3574766355140187 and parameters: {'EMBEDDING_DIM': 300, 'HIDDEN_DIM': 391, 'NUM_LAYERS': 1, 'DROPOUT': 0.24652950178803587, 'LR': 0.001935723601578137, 'WEIGHT_0': 0.44948408217513836, 'WEIGHT_1': 0.44343472579960586, 'WEIGHT_2': 0.3020789994268407, 'WEIGHT_3': 0.8268445627437804, 'WEIGHT_4': 0.49240440802608765, 'WEIGHT_5': 0.5510355883785704, 'WEIGHT_6': 0.5279228087679998, 'WEIGHT_7': 0.5448792691688993, 'WEIGHT_8': 0.7704466121167636, 'optimizer': 'Adam'}. Best is trial 221 with value: 0.418736930154747.
/userhome/cs2/dingruiw/conda/envs/py310/lib/python3.10/site-packages/torch/nn/modules/rnn.py:82: UserWarning: dropout option adds dropout after all but last recurrent layer, so non-zero dropout expects num_layers greater than 1, but got dropout=0.34865820840469497 and num_layers=1
  warnings.warn("dropout option adds dropout after all but last "
{'EMBEDDING_DIM': 300, 'HIDDEN_DIM': 391, 'NUM_LAYERS': 1, 'DROPOUT': 0.24652950178803587, 'LR': 0.001935723601578137, 'WEIGHT_0': 0.44948408217513836, 'WEIGHT_1': 0.44343472579960586, 'WEIGHT_2': 0.3020789994268407, 'WEIGHT_3': 0.8268445627437804, 'WEIGHT_4': 0.49240440802608765, 'WEIGHT_5': 0.5510355883785704, 'WEIGHT_6': 0.5279228087679998, 'WEIGHT_7': 0.5448792691688993, 'WEIGHT_8': 0.7704466121167636, 'optimizer': 'Adam'}
0
              precision    recall  f1-score   support

         LOC       0.05      0.11      0.07      1837
        MISC       0.02      0.03      0.03       922
         ORG       0.03      0.07      0.04      1341
         PER       0.02      0.02      0.02      1842

   micro avg       0.04      0.06      0.05      5942
   macro avg       0.03      0.06      0.04      5942
weighted avg       0.03      0.06      0.04      5942

{'EMBEDDING_DIM': 300, 'HIDDEN_DIM': 391, 'NUM_LAYERS': 1, 'DROPOUT': 0.24652950178803587, 'LR': 0.001935723601578137, 'WEIGHT_0': 0.44948408217513836, 'WEIGHT_1': 0.44343472579960586, 'WEIGHT_2': 0.3020789994268407, 'WEIGHT_3': 0.8268445627437804, 'WEIGHT_4': 0.49240440802608765, 'WEIGHT_5': 0.5510355883785704, 'WEIGHT_6': 0.5279228087679998, 'WEIGHT_7': 0.5448792691688993, 'WEIGHT_8': 0.7704466121167636, 'optimizer': 'Adam'}
49
              precision    recall  f1-score   support

         LOC       0.48      0.52      0.50      1837
        MISC       0.43      0.29      0.35       922
         ORG       0.24      0.23      0.24      1341
         PER       0.28      0.33      0.30      1842

   micro avg       0.35      0.36      0.36      5942
   macro avg       0.36      0.34      0.35      5942
weighted avg       0.36      0.36      0.36      5942

epoch 49
LSTM
  0%|          | 0/50 [00:00<?, ?it/s]  2%|▏         | 1/50 [00:04<03:53,  4.76s/it]  6%|▌         | 3/50 [00:04<01:02,  1.32s/it]  8%|▊         | 4/50 [00:05<00:42,  1.09it/s] 10%|█         | 5/50 [00:05<00:29,  1.52it/s] 12%|█▏        | 6/50 [00:05<00:21,  2.04it/s] 14%|█▍        | 7/50 [00:05<00:16,  2.64it/s] 16%|█▌        | 8/50 [00:05<00:12,  3.29it/s] 18%|█▊        | 9/50 [00:05<00:10,  3.96it/s] 20%|██        | 10/50 [00:05<00:08,  4.60it/s] 22%|██▏       | 11/50 [00:06<00:07,  5.17it/s] 24%|██▍       | 12/50 [00:06<00:06,  5.67it/s] 26%|██▌       | 13/50 [00:06<00:06,  6.07it/s] 28%|██▊       | 14/50 [00:06<00:05,  6.39it/s] 30%|███       | 15/50 [00:06<00:05,  6.64it/s] 32%|███▏      | 16/50 [00:06<00:04,  6.82it/s] 34%|███▍      | 17/50 [00:06<00:04,  6.95it/s] 36%|███▌      | 18/50 [00:07<00:04,  7.05it/s] 38%|███▊      | 19/50 [00:07<00:04,  7.12it/s] 40%|████      | 20/50 [00:07<00:04,  7.17it/s] 42%|████▏     | 21/50 [00:07<00:04,  7.20it/s] 44%|████▍     | 22/50 [00:07<00:03,  7.23it/s] 46%|████▌     | 23/50 [00:07<00:03,  7.24it/s] 48%|████▊     | 24/50 [00:07<00:03,  7.25it/s] 50%|█████     | 25/50 [00:08<00:03,  7.26it/s] 52%|█████▏    | 26/50 [00:08<00:03,  7.27it/s] 54%|█████▍    | 27/50 [00:08<00:03,  7.27it/s] 56%|█████▌    | 28/50 [00:08<00:03,  7.27it/s] 58%|█████▊    | 29/50 [00:08<00:02,  7.28it/s] 60%|██████    | 30/50 [00:08<00:02,  7.28it/s] 62%|██████▏   | 31/50 [00:08<00:02,  7.27it/s] 64%|██████▍   | 32/50 [00:08<00:02,  7.26it/s] 66%|██████▌   | 33/50 [00:09<00:02,  7.27it/s] 68%|██████▊   | 34/50 [00:09<00:02,  7.27it/s] 70%|███████   | 35/50 [00:09<00:02,  7.28it/s] 72%|███████▏  | 36/50 [00:09<00:01,  7.27it/s] 74%|███████▍  | 37/50 [00:09<00:01,  7.28it/s] 76%|███████▌  | 38/50 [00:09<00:01,  7.27it/s] 78%|███████▊  | 39/50 [00:09<00:01,  7.28it/s] 80%|████████  | 40/50 [00:10<00:01,  7.28it/s] 82%|████████▏ | 41/50 [00:10<00:01,  7.27it/s] 84%|████████▍ | 42/50 [00:10<00:01,  7.27it/s] 86%|████████▌ | 43/50 [00:10<00:00,  7.27it/s] 88%|████████▊ | 44/50 [00:10<00:00,  7.27it/s] 90%|█████████ | 45/50 [00:10<00:00,  7.28it/s] 92%|█████████▏| 46/50 [00:10<00:00,  7.27it/s] 94%|█████████▍| 47/50 [00:11<00:00,  7.28it/s] 96%|█████████▌| 48/50 [00:11<00:00,  7.28it/s] 98%|█████████▊| 49/50 [00:11<00:00,  7.29it/s]100%|██████████| 50/50 [00:15<00:00,  1.49s/it]100%|██████████| 50/50 [00:15<00:00,  3.13it/s]
[I 2023-12-10 23:14:06,962] Trial 227 finished with value: 0.37579073345871095 and parameters: {'EMBEDDING_DIM': 563, 'HIDDEN_DIM': 259, 'NUM_LAYERS': 1, 'DROPOUT': 0.34865820840469497, 'LR': 0.0013718197199072166, 'WEIGHT_0': 0.5035059984868095, 'WEIGHT_1': 0.47828972435521616, 'WEIGHT_2': 0.4810956069539073, 'WEIGHT_3': 0.7513316359129111, 'WEIGHT_4': 0.9097484087526956, 'WEIGHT_5': 0.5816229129872467, 'WEIGHT_6': 0.6394029865863351, 'WEIGHT_7': 0.31677494197371237, 'WEIGHT_8': 0.8348290431781866, 'optimizer': 'Adam'}. Best is trial 221 with value: 0.418736930154747.
/userhome/cs2/dingruiw/conda/envs/py310/lib/python3.10/site-packages/torch/nn/modules/rnn.py:82: UserWarning: dropout option adds dropout after all but last recurrent layer, so non-zero dropout expects num_layers greater than 1, but got dropout=0.28691078456364694 and num_layers=1
  warnings.warn("dropout option adds dropout after all but last "
{'EMBEDDING_DIM': 563, 'HIDDEN_DIM': 259, 'NUM_LAYERS': 1, 'DROPOUT': 0.34865820840469497, 'LR': 0.0013718197199072166, 'WEIGHT_0': 0.5035059984868095, 'WEIGHT_1': 0.47828972435521616, 'WEIGHT_2': 0.4810956069539073, 'WEIGHT_3': 0.7513316359129111, 'WEIGHT_4': 0.9097484087526956, 'WEIGHT_5': 0.5816229129872467, 'WEIGHT_6': 0.6394029865863351, 'WEIGHT_7': 0.31677494197371237, 'WEIGHT_8': 0.8348290431781866, 'optimizer': 'Adam'}
0
              precision    recall  f1-score   support

         LOC       0.05      0.15      0.07      1837
        MISC       0.02      0.07      0.03       922
         ORG       0.02      0.08      0.04      1341
         PER       0.03      0.04      0.03      1842

   micro avg       0.03      0.09      0.05      5942
   macro avg       0.03      0.09      0.04      5942
weighted avg       0.03      0.09      0.05      5942

{'EMBEDDING_DIM': 563, 'HIDDEN_DIM': 259, 'NUM_LAYERS': 1, 'DROPOUT': 0.34865820840469497, 'LR': 0.0013718197199072166, 'WEIGHT_0': 0.5035059984868095, 'WEIGHT_1': 0.47828972435521616, 'WEIGHT_2': 0.4810956069539073, 'WEIGHT_3': 0.7513316359129111, 'WEIGHT_4': 0.9097484087526956, 'WEIGHT_5': 0.5816229129872467, 'WEIGHT_6': 0.6394029865863351, 'WEIGHT_7': 0.31677494197371237, 'WEIGHT_8': 0.8348290431781866, 'optimizer': 'Adam'}
49
              precision    recall  f1-score   support

         LOC       0.55      0.52      0.53      1837
        MISC       0.41      0.35      0.38       922
         ORG       0.24      0.21      0.22      1341
         PER       0.31      0.35      0.33      1842

   micro avg       0.38      0.37      0.38      5942
   macro avg       0.38      0.36      0.37      5942
weighted avg       0.38      0.37      0.38      5942

epoch 49
LSTM
  0%|          | 0/50 [00:00<?, ?it/s]  2%|▏         | 1/50 [00:04<03:54,  4.79s/it]  4%|▍         | 2/50 [00:04<01:38,  2.04s/it]  6%|▌         | 3/50 [00:05<00:56,  1.21s/it]  8%|▊         | 4/50 [00:05<00:37,  1.23it/s] 10%|█         | 5/50 [00:05<00:26,  1.67it/s] 12%|█▏        | 6/50 [00:05<00:20,  2.14it/s] 14%|█▍        | 7/50 [00:05<00:16,  2.60it/s] 16%|█▌        | 8/50 [00:06<00:13,  3.03it/s] 18%|█▊        | 9/50 [00:06<00:12,  3.40it/s] 20%|██        | 10/50 [00:06<00:10,  3.71it/s] 22%|██▏       | 11/50 [00:06<00:09,  3.96it/s] 24%|██▍       | 12/50 [00:07<00:09,  4.15it/s] 26%|██▌       | 13/50 [00:07<00:08,  4.29it/s] 28%|██▊       | 14/50 [00:07<00:08,  4.40it/s] 30%|███       | 15/50 [00:07<00:07,  4.48it/s] 32%|███▏      | 16/50 [00:07<00:07,  4.54it/s] 34%|███▍      | 17/50 [00:08<00:07,  4.57it/s] 36%|███▌      | 18/50 [00:08<00:06,  4.60it/s] 38%|███▊      | 19/50 [00:08<00:06,  4.62it/s] 40%|████      | 20/50 [00:08<00:06,  4.63it/s] 42%|████▏     | 21/50 [00:08<00:06,  4.64it/s] 44%|████▍     | 22/50 [00:09<00:06,  4.65it/s] 46%|████▌     | 23/50 [00:09<00:05,  4.66it/s] 48%|████▊     | 24/50 [00:09<00:05,  4.65it/s] 50%|█████     | 25/50 [00:09<00:05,  4.66it/s] 52%|█████▏    | 26/50 [00:10<00:05,  4.66it/s] 54%|█████▍    | 27/50 [00:10<00:04,  4.65it/s] 56%|█████▌    | 28/50 [00:10<00:04,  4.66it/s] 58%|█████▊    | 29/50 [00:10<00:04,  4.66it/s] 60%|██████    | 30/50 [00:10<00:04,  4.66it/s] 62%|██████▏   | 31/50 [00:11<00:04,  4.66it/s] 64%|██████▍   | 32/50 [00:11<00:03,  4.66it/s] 66%|██████▌   | 33/50 [00:11<00:03,  4.66it/s] 68%|██████▊   | 34/50 [00:11<00:03,  4.65it/s] 70%|███████   | 35/50 [00:11<00:03,  4.65it/s] 72%|███████▏  | 36/50 [00:12<00:03,  4.65it/s] 74%|███████▍  | 37/50 [00:12<00:02,  4.65it/s] 76%|███████▌  | 38/50 [00:12<00:02,  4.65it/s] 78%|███████▊  | 39/50 [00:12<00:02,  4.65it/s] 80%|████████  | 40/50 [00:13<00:02,  4.65it/s] 82%|████████▏ | 41/50 [00:13<00:01,  4.65it/s] 84%|████████▍ | 42/50 [00:13<00:01,  4.65it/s] 86%|████████▌ | 43/50 [00:13<00:01,  4.65it/s] 88%|████████▊ | 44/50 [00:13<00:01,  4.65it/s] 90%|█████████ | 45/50 [00:14<00:01,  4.65it/s] 92%|█████████▏| 46/50 [00:14<00:00,  4.65it/s] 94%|█████████▍| 47/50 [00:14<00:00,  4.65it/s] 96%|█████████▌| 48/50 [00:14<00:00,  4.65it/s] 98%|█████████▊| 49/50 [00:14<00:00,  4.65it/s]100%|██████████| 50/50 [00:20<00:00,  1.66s/it]100%|██████████| 50/50 [00:20<00:00,  2.49it/s]
[I 2023-12-10 23:14:31,318] Trial 228 finished with value: 0.39542857142857135 and parameters: {'EMBEDDING_DIM': 1010, 'HIDDEN_DIM': 302, 'NUM_LAYERS': 1, 'DROPOUT': 0.28691078456364694, 'LR': 0.0025186199014015117, 'WEIGHT_0': 0.4726086360339085, 'WEIGHT_1': 0.5517627599018871, 'WEIGHT_2': 0.5023820798790853, 'WEIGHT_3': 0.7842917283066158, 'WEIGHT_4': 0.8907263496067428, 'WEIGHT_5': 0.5138868062694063, 'WEIGHT_6': 0.6663062674964484, 'WEIGHT_7': 0.28130398407079005, 'WEIGHT_8': 0.8842951678394144, 'optimizer': 'Adam'}. Best is trial 221 with value: 0.418736930154747.
/userhome/cs2/dingruiw/conda/envs/py310/lib/python3.10/site-packages/torch/nn/modules/rnn.py:82: UserWarning: dropout option adds dropout after all but last recurrent layer, so non-zero dropout expects num_layers greater than 1, but got dropout=0.3644894951016022 and num_layers=1
  warnings.warn("dropout option adds dropout after all but last "
{'EMBEDDING_DIM': 1010, 'HIDDEN_DIM': 302, 'NUM_LAYERS': 1, 'DROPOUT': 0.28691078456364694, 'LR': 0.0025186199014015117, 'WEIGHT_0': 0.4726086360339085, 'WEIGHT_1': 0.5517627599018871, 'WEIGHT_2': 0.5023820798790853, 'WEIGHT_3': 0.7842917283066158, 'WEIGHT_4': 0.8907263496067428, 'WEIGHT_5': 0.5138868062694063, 'WEIGHT_6': 0.6663062674964484, 'WEIGHT_7': 0.28130398407079005, 'WEIGHT_8': 0.8842951678394144, 'optimizer': 'Adam'}
0
              precision    recall  f1-score   support

         LOC       0.12      0.10      0.11      1837
        MISC       0.02      0.05      0.03       922
         ORG       0.04      0.09      0.05      1341
         PER       0.02      0.02      0.02      1842

   micro avg       0.04      0.06      0.05      5942
   macro avg       0.05      0.06      0.05      5942
weighted avg       0.05      0.06      0.06      5942

{'EMBEDDING_DIM': 1010, 'HIDDEN_DIM': 302, 'NUM_LAYERS': 1, 'DROPOUT': 0.28691078456364694, 'LR': 0.0025186199014015117, 'WEIGHT_0': 0.4726086360339085, 'WEIGHT_1': 0.5517627599018871, 'WEIGHT_2': 0.5023820798790853, 'WEIGHT_3': 0.7842917283066158, 'WEIGHT_4': 0.8907263496067428, 'WEIGHT_5': 0.5138868062694063, 'WEIGHT_6': 0.6663062674964484, 'WEIGHT_7': 0.28130398407079005, 'WEIGHT_8': 0.8842951678394144, 'optimizer': 'Adam'}
49
              precision    recall  f1-score   support

         LOC       0.54      0.53      0.53      1837
        MISC       0.42      0.44      0.43       922
         ORG       0.27      0.28      0.27      1341
         PER       0.31      0.36      0.33      1842

   micro avg       0.38      0.41      0.40      5942
   macro avg       0.38      0.40      0.39      5942
weighted avg       0.39      0.41      0.40      5942

epoch 49
LSTM
  0%|          | 0/50 [00:00<?, ?it/s]  2%|▏         | 1/50 [00:04<03:57,  4.84s/it]  4%|▍         | 2/50 [00:04<01:39,  2.07s/it]  6%|▌         | 3/50 [00:05<00:58,  1.24s/it]  8%|▊         | 4/50 [00:05<00:38,  1.18it/s] 10%|█         | 5/50 [00:05<00:28,  1.60it/s] 12%|█▏        | 6/50 [00:05<00:21,  2.02it/s] 14%|█▍        | 7/50 [00:06<00:17,  2.42it/s] 16%|█▌        | 8/50 [00:06<00:15,  2.79it/s] 18%|█▊        | 9/50 [00:06<00:13,  3.11it/s] 20%|██        | 10/50 [00:06<00:11,  3.37it/s] 22%|██▏       | 11/50 [00:07<00:10,  3.57it/s] 24%|██▍       | 12/50 [00:07<00:10,  3.73it/s] 26%|██▌       | 13/50 [00:07<00:09,  3.84it/s] 28%|██▊       | 14/50 [00:07<00:09,  3.92it/s] 30%|███       | 15/50 [00:08<00:08,  3.99it/s] 32%|███▏      | 16/50 [00:08<00:08,  4.03it/s] 34%|███▍      | 17/50 [00:08<00:08,  4.07it/s] 36%|███▌      | 18/50 [00:08<00:07,  4.09it/s] 38%|███▊      | 19/50 [00:09<00:07,  4.11it/s] 40%|████      | 20/50 [00:09<00:07,  4.12it/s] 42%|████▏     | 21/50 [00:09<00:07,  4.12it/s] 44%|████▍     | 22/50 [00:09<00:06,  4.12it/s] 46%|████▌     | 23/50 [00:10<00:06,  4.12it/s] 48%|████▊     | 24/50 [00:10<00:06,  4.13it/s] 50%|█████     | 25/50 [00:10<00:06,  4.13it/s] 52%|█████▏    | 26/50 [00:10<00:05,  4.13it/s] 54%|█████▍    | 27/50 [00:11<00:05,  4.13it/s] 56%|█████▌    | 28/50 [00:11<00:05,  4.13it/s] 58%|█████▊    | 29/50 [00:11<00:05,  4.13it/s] 60%|██████    | 30/50 [00:11<00:04,  4.13it/s] 62%|██████▏   | 31/50 [00:11<00:04,  4.13it/s] 64%|██████▍   | 32/50 [00:12<00:04,  4.13it/s] 66%|██████▌   | 33/50 [00:12<00:04,  4.12it/s] 68%|██████▊   | 34/50 [00:12<00:03,  4.12it/s] 70%|███████   | 35/50 [00:12<00:03,  4.12it/s] 72%|███████▏  | 36/50 [00:13<00:03,  4.12it/s] 74%|███████▍  | 37/50 [00:13<00:03,  4.12it/s] 76%|███████▌  | 38/50 [00:13<00:02,  4.12it/s] 78%|███████▊  | 39/50 [00:13<00:02,  4.12it/s] 80%|████████  | 40/50 [00:14<00:02,  4.12it/s] 82%|████████▏ | 41/50 [00:14<00:02,  4.12it/s] 84%|████████▍ | 42/50 [00:14<00:01,  4.12it/s] 86%|████████▌ | 43/50 [00:14<00:01,  4.12it/s] 88%|████████▊ | 44/50 [00:15<00:01,  4.11it/s] 90%|█████████ | 45/50 [00:15<00:01,  4.11it/s] 92%|█████████▏| 46/50 [00:15<00:00,  4.11it/s] 94%|█████████▍| 47/50 [00:15<00:00,  4.11it/s] 96%|█████████▌| 48/50 [00:16<00:00,  4.11it/s] 98%|█████████▊| 49/50 [00:16<00:00,  4.11it/s]100%|██████████| 50/50 [00:21<00:00,  1.65s/it]100%|██████████| 50/50 [00:21<00:00,  2.35it/s]
