[I 2023-12-11 00:02:54,320] Trial 329 finished with value: 0.028998709481515218 and parameters: {'EMBEDDING_DIM': 1001, 'HIDDEN_DIM': 240, 'NUM_LAYERS': 1, 'DROPOUT': 0.3905820999147336, 'LR': 0.0017244525487234812, 'WEIGHT_0': 0.5944131824395219, 'WEIGHT_1': 0.8591170837789305, 'WEIGHT_2': 0.1804343168534177, 'WEIGHT_3': 0.8877063292337711, 'WEIGHT_4': 0.45353794191663294, 'WEIGHT_5': 0.9549980155474002, 'WEIGHT_6': 0.6556274729917052, 'WEIGHT_7': 0.337325700568558, 'WEIGHT_8': 0.7355081698431009, 'optimizer': 'SGD'}. Best is trial 221 with value: 0.418736930154747.
/userhome/cs2/dingruiw/conda/envs/py310/lib/python3.10/site-packages/torch/nn/modules/rnn.py:82: UserWarning: dropout option adds dropout after all but last recurrent layer, so non-zero dropout expects num_layers greater than 1, but got dropout=0.3509605995833902 and num_layers=1
  warnings.warn("dropout option adds dropout after all but last "
{'EMBEDDING_DIM': 1001, 'HIDDEN_DIM': 240, 'NUM_LAYERS': 1, 'DROPOUT': 0.3905820999147336, 'LR': 0.0017244525487234812, 'WEIGHT_0': 0.5944131824395219, 'WEIGHT_1': 0.8591170837789305, 'WEIGHT_2': 0.1804343168534177, 'WEIGHT_3': 0.8877063292337711, 'WEIGHT_4': 0.45353794191663294, 'WEIGHT_5': 0.9549980155474002, 'WEIGHT_6': 0.6556274729917052, 'WEIGHT_7': 0.337325700568558, 'WEIGHT_8': 0.7355081698431009, 'optimizer': 'SGD'}
0
              precision    recall  f1-score   support

         LOC       0.04      0.07      0.05      1837
        MISC       0.02      0.14      0.04       922
         ORG       0.02      0.08      0.03      1341
         PER       0.01      0.11      0.02      1842

   micro avg       0.02      0.10      0.03      5942
   macro avg       0.02      0.10      0.03      5942
weighted avg       0.02      0.10      0.03      5942

{'EMBEDDING_DIM': 1001, 'HIDDEN_DIM': 240, 'NUM_LAYERS': 1, 'DROPOUT': 0.3905820999147336, 'LR': 0.0017244525487234812, 'WEIGHT_0': 0.5944131824395219, 'WEIGHT_1': 0.8591170837789305, 'WEIGHT_2': 0.1804343168534177, 'WEIGHT_3': 0.8877063292337711, 'WEIGHT_4': 0.45353794191663294, 'WEIGHT_5': 0.9549980155474002, 'WEIGHT_6': 0.6556274729917052, 'WEIGHT_7': 0.337325700568558, 'WEIGHT_8': 0.7355081698431009, 'optimizer': 'SGD'}
49
              precision    recall  f1-score   support

         LOC       0.05      0.05      0.05      1837
        MISC       0.03      0.10      0.04       922
         ORG       0.02      0.05      0.03      1341
         PER       0.01      0.07      0.02      1842

   micro avg       0.02      0.06      0.03      5942
   macro avg       0.03      0.07      0.03      5942
weighted avg       0.03      0.06      0.03      5942

epoch 49
LSTM
  0%|          | 0/50 [00:00<?, ?it/s]  2%|▏         | 1/50 [00:04<03:56,  4.84s/it]  4%|▍         | 2/50 [00:04<01:38,  2.06s/it]  6%|▌         | 3/50 [00:05<00:57,  1.21s/it]  8%|▊         | 4/50 [00:05<00:37,  1.23it/s] 10%|█         | 5/50 [00:05<00:26,  1.68it/s] 12%|█▏        | 6/50 [00:05<00:20,  2.17it/s] 14%|█▍        | 7/50 [00:05<00:16,  2.66it/s] 16%|█▌        | 8/50 [00:06<00:13,  3.11it/s] 18%|█▊        | 9/50 [00:06<00:11,  3.52it/s] 20%|██        | 10/50 [00:06<00:10,  3.86it/s] 22%|██▏       | 11/50 [00:06<00:09,  4.13it/s] 24%|██▍       | 12/50 [00:06<00:08,  4.34it/s] 26%|██▌       | 13/50 [00:07<00:08,  4.51it/s] 28%|██▊       | 14/50 [00:07<00:07,  4.63it/s] 30%|███       | 15/50 [00:07<00:07,  4.72it/s] 32%|███▏      | 16/50 [00:07<00:07,  4.78it/s] 34%|███▍      | 17/50 [00:07<00:06,  4.82it/s] 36%|███▌      | 18/50 [00:08<00:06,  4.86it/s] 38%|███▊      | 19/50 [00:08<00:06,  4.89it/s] 40%|████      | 20/50 [00:08<00:06,  4.91it/s] 42%|████▏     | 21/50 [00:08<00:05,  4.93it/s] 44%|████▍     | 22/50 [00:09<00:05,  4.93it/s] 46%|████▌     | 23/50 [00:09<00:05,  4.94it/s] 48%|████▊     | 24/50 [00:09<00:05,  4.94it/s] 50%|█████     | 25/50 [00:09<00:05,  4.94it/s] 52%|█████▏    | 26/50 [00:09<00:04,  4.93it/s] 54%|█████▍    | 27/50 [00:10<00:04,  4.93it/s] 56%|█████▌    | 28/50 [00:10<00:04,  4.93it/s] 58%|█████▊    | 29/50 [00:10<00:04,  4.93it/s] 60%|██████    | 30/50 [00:10<00:04,  4.93it/s] 62%|██████▏   | 31/50 [00:10<00:03,  4.93it/s] 64%|██████▍   | 32/50 [00:11<00:03,  4.93it/s] 66%|██████▌   | 33/50 [00:11<00:03,  4.93it/s] 68%|██████▊   | 34/50 [00:11<00:03,  4.93it/s] 70%|███████   | 35/50 [00:11<00:03,  4.92it/s] 72%|███████▏  | 36/50 [00:11<00:02,  4.92it/s] 74%|███████▍  | 37/50 [00:12<00:02,  4.93it/s] 76%|███████▌  | 38/50 [00:12<00:02,  4.93it/s] 78%|███████▊  | 39/50 [00:12<00:02,  4.92it/s] 80%|████████  | 40/50 [00:12<00:02,  4.92it/s] 82%|████████▏ | 41/50 [00:12<00:01,  4.93it/s] 84%|████████▍ | 42/50 [00:13<00:01,  4.93it/s] 86%|████████▌ | 43/50 [00:13<00:01,  4.92it/s] 88%|████████▊ | 44/50 [00:13<00:01,  4.93it/s] 90%|█████████ | 45/50 [00:13<00:01,  4.92it/s] 92%|█████████▏| 46/50 [00:13<00:00,  4.92it/s] 94%|█████████▍| 47/50 [00:14<00:00,  4.92it/s] 96%|█████████▌| 48/50 [00:14<00:00,  4.92it/s] 98%|█████████▊| 49/50 [00:14<00:00,  4.92it/s]100%|██████████| 50/50 [00:19<00:00,  1.70s/it]100%|██████████| 50/50 [00:19<00:00,  2.54it/s]
[I 2023-12-11 00:03:18,594] Trial 330 finished with value: 0.40868567393415134 and parameters: {'EMBEDDING_DIM': 921, 'HIDDEN_DIM': 295, 'NUM_LAYERS': 1, 'DROPOUT': 0.3509605995833902, 'LR': 0.0007770742440642805, 'WEIGHT_0': 0.4618481853990749, 'WEIGHT_1': 0.5907942806722116, 'WEIGHT_2': 0.477167770050365, 'WEIGHT_3': 0.5263291864670174, 'WEIGHT_4': 0.623817484125848, 'WEIGHT_5': 0.8366300548650698, 'WEIGHT_6': 0.9081167588146574, 'WEIGHT_7': 0.3609745515496663, 'WEIGHT_8': 0.4513227318547608, 'optimizer': 'RMSprop'}. Best is trial 221 with value: 0.418736930154747.
/userhome/cs2/dingruiw/conda/envs/py310/lib/python3.10/site-packages/torch/nn/modules/rnn.py:82: UserWarning: dropout option adds dropout after all but last recurrent layer, so non-zero dropout expects num_layers greater than 1, but got dropout=0.3710638314894814 and num_layers=1
  warnings.warn("dropout option adds dropout after all but last "
{'EMBEDDING_DIM': 921, 'HIDDEN_DIM': 295, 'NUM_LAYERS': 1, 'DROPOUT': 0.3509605995833902, 'LR': 0.0007770742440642805, 'WEIGHT_0': 0.4618481853990749, 'WEIGHT_1': 0.5907942806722116, 'WEIGHT_2': 0.477167770050365, 'WEIGHT_3': 0.5263291864670174, 'WEIGHT_4': 0.623817484125848, 'WEIGHT_5': 0.8366300548650698, 'WEIGHT_6': 0.9081167588146574, 'WEIGHT_7': 0.3609745515496663, 'WEIGHT_8': 0.4513227318547608, 'optimizer': 'RMSprop'}
0
              precision    recall  f1-score   support

         LOC       0.20      0.05      0.08      1837
        MISC       0.03      0.02      0.02       922
         ORG       0.09      0.05      0.07      1341
         PER       0.04      0.01      0.01      1842

   micro avg       0.08      0.03      0.05      5942
   macro avg       0.09      0.03      0.05      5942
weighted avg       0.10      0.03      0.05      5942

{'EMBEDDING_DIM': 921, 'HIDDEN_DIM': 295, 'NUM_LAYERS': 1, 'DROPOUT': 0.3509605995833902, 'LR': 0.0007770742440642805, 'WEIGHT_0': 0.4618481853990749, 'WEIGHT_1': 0.5907942806722116, 'WEIGHT_2': 0.477167770050365, 'WEIGHT_3': 0.5263291864670174, 'WEIGHT_4': 0.623817484125848, 'WEIGHT_5': 0.8366300548650698, 'WEIGHT_6': 0.9081167588146574, 'WEIGHT_7': 0.3609745515496663, 'WEIGHT_8': 0.4513227318547608, 'optimizer': 'RMSprop'}
49
              precision    recall  f1-score   support

         LOC       0.56      0.53      0.54      1837
        MISC       0.48      0.44      0.46       922
         ORG       0.31      0.25      0.28      1341
         PER       0.35      0.33      0.34      1842

   micro avg       0.43      0.39      0.41      5942
   macro avg       0.43      0.39      0.40      5942
weighted avg       0.43      0.39      0.41      5942

epoch 49
LSTM
  0%|          | 0/50 [00:00<?, ?it/s]  2%|▏         | 1/50 [00:05<04:15,  5.21s/it]  4%|▍         | 2/50 [00:05<01:46,  2.22s/it]  6%|▌         | 3/50 [00:05<01:01,  1.32s/it]  8%|▊         | 4/50 [00:05<00:40,  1.12it/s] 10%|█         | 5/50 [00:06<00:29,  1.53it/s] 12%|█▏        | 6/50 [00:06<00:22,  1.95it/s] 14%|█▍        | 7/50 [00:06<00:18,  2.37it/s] 16%|█▌        | 8/50 [00:06<00:15,  2.76it/s] 18%|█▊        | 9/50 [00:06<00:13,  3.10it/s] 20%|██        | 10/50 [00:07<00:11,  3.39it/s] 22%|██▏       | 11/50 [00:07<00:10,  3.62it/s] 24%|██▍       | 12/50 [00:07<00:10,  3.79it/s] 26%|██▌       | 13/50 [00:07<00:09,  3.92it/s] 28%|██▊       | 14/50 [00:08<00:08,  4.02it/s] 30%|███       | 15/50 [00:08<00:08,  4.09it/s] 32%|███▏      | 16/50 [00:08<00:08,  4.13it/s] 34%|███▍      | 17/50 [00:08<00:07,  4.17it/s] 36%|███▌      | 18/50 [00:09<00:07,  4.20it/s] 38%|███▊      | 19/50 [00:09<00:07,  4.21it/s] 40%|████      | 20/50 [00:09<00:07,  4.23it/s] 42%|████▏     | 21/50 [00:09<00:06,  4.24it/s] 44%|████▍     | 22/50 [00:10<00:06,  4.24it/s] 46%|████▌     | 23/50 [00:10<00:06,  4.25it/s] 48%|████▊     | 24/50 [00:10<00:06,  4.25it/s] 50%|█████     | 25/50 [00:10<00:05,  4.25it/s] 52%|█████▏    | 26/50 [00:10<00:05,  4.25it/s] 54%|█████▍    | 27/50 [00:11<00:05,  4.25it/s] 56%|█████▌    | 28/50 [00:11<00:05,  4.25it/s] 58%|█████▊    | 29/50 [00:11<00:04,  4.25it/s] 60%|██████    | 30/50 [00:11<00:04,  4.26it/s] 62%|██████▏   | 31/50 [00:12<00:04,  4.25it/s] 64%|██████▍   | 32/50 [00:12<00:04,  4.26it/s] 66%|██████▌   | 33/50 [00:12<00:03,  4.26it/s] 68%|██████▊   | 34/50 [00:12<00:03,  4.26it/s] 70%|███████   | 35/50 [00:13<00:03,  4.25it/s] 72%|███████▏  | 36/50 [00:13<00:03,  4.25it/s] 74%|███████▍  | 37/50 [00:13<00:03,  4.25it/s] 76%|███████▌  | 38/50 [00:13<00:02,  4.26it/s] 78%|███████▊  | 39/50 [00:14<00:02,  4.25it/s] 80%|████████  | 40/50 [00:14<00:02,  4.25it/s] 82%|████████▏ | 41/50 [00:14<00:02,  4.25it/s] 84%|████████▍ | 42/50 [00:14<00:01,  4.25it/s] 86%|████████▌ | 43/50 [00:14<00:01,  4.24it/s] 88%|████████▊ | 44/50 [00:15<00:01,  4.24it/s] 90%|█████████ | 45/50 [00:15<00:01,  4.24it/s] 92%|█████████▏| 46/50 [00:15<00:00,  4.24it/s] 94%|█████████▍| 47/50 [00:15<00:00,  4.24it/s] 96%|█████████▌| 48/50 [00:16<00:00,  4.24it/s] 98%|█████████▊| 49/50 [00:16<00:00,  4.23it/s]100%|██████████| 50/50 [00:21<00:00,  1.72s/it]100%|██████████| 50/50 [00:21<00:00,  2.31it/s]
[I 2023-12-11 00:03:44,804] Trial 331 finished with value: 0.3935521590244717 and parameters: {'EMBEDDING_DIM': 978, 'HIDDEN_DIM': 359, 'NUM_LAYERS': 1, 'DROPOUT': 0.3710638314894814, 'LR': 0.0028338412153501914, 'WEIGHT_0': 0.4098092554183202, 'WEIGHT_1': 0.5347648683426843, 'WEIGHT_2': 0.605968140182351, 'WEIGHT_3': 0.5857649618240264, 'WEIGHT_4': 0.8896893893759886, 'WEIGHT_5': 0.7328881039977675, 'WEIGHT_6': 0.725023826449416, 'WEIGHT_7': 0.2332582186751867, 'WEIGHT_8': 0.22197081978857824, 'optimizer': 'RMSprop'}. Best is trial 221 with value: 0.418736930154747.
/userhome/cs2/dingruiw/conda/envs/py310/lib/python3.10/site-packages/torch/nn/modules/rnn.py:82: UserWarning: dropout option adds dropout after all but last recurrent layer, so non-zero dropout expects num_layers greater than 1, but got dropout=0.3261659052080746 and num_layers=1
  warnings.warn("dropout option adds dropout after all but last "
{'EMBEDDING_DIM': 978, 'HIDDEN_DIM': 359, 'NUM_LAYERS': 1, 'DROPOUT': 0.3710638314894814, 'LR': 0.0028338412153501914, 'WEIGHT_0': 0.4098092554183202, 'WEIGHT_1': 0.5347648683426843, 'WEIGHT_2': 0.605968140182351, 'WEIGHT_3': 0.5857649618240264, 'WEIGHT_4': 0.8896893893759886, 'WEIGHT_5': 0.7328881039977675, 'WEIGHT_6': 0.725023826449416, 'WEIGHT_7': 0.2332582186751867, 'WEIGHT_8': 0.22197081978857824, 'optimizer': 'RMSprop'}
0
              precision    recall  f1-score   support

         LOC       0.35      0.09      0.14      1837
        MISC       0.04      0.02      0.03       922
         ORG       0.11      0.02      0.03      1341
         PER       0.09      0.02      0.03      1842

   micro avg       0.16      0.04      0.07      5942
   macro avg       0.15      0.04      0.06      5942
weighted avg       0.17      0.04      0.07      5942

{'EMBEDDING_DIM': 978, 'HIDDEN_DIM': 359, 'NUM_LAYERS': 1, 'DROPOUT': 0.3710638314894814, 'LR': 0.0028338412153501914, 'WEIGHT_0': 0.4098092554183202, 'WEIGHT_1': 0.5347648683426843, 'WEIGHT_2': 0.605968140182351, 'WEIGHT_3': 0.5857649618240264, 'WEIGHT_4': 0.8896893893759886, 'WEIGHT_5': 0.7328881039977675, 'WEIGHT_6': 0.725023826449416, 'WEIGHT_7': 0.2332582186751867, 'WEIGHT_8': 0.22197081978857824, 'optimizer': 'RMSprop'}
49
              precision    recall  f1-score   support

         LOC       0.56      0.53      0.54      1837
        MISC       0.42      0.44      0.43       922
         ORG       0.27      0.24      0.25      1341
         PER       0.31      0.36      0.33      1842

   micro avg       0.39      0.40      0.39      5942
   macro avg       0.39      0.39      0.39      5942
weighted avg       0.40      0.40      0.40      5942

epoch 49
LSTM
  0%|          | 0/50 [00:00<?, ?it/s]  2%|▏         | 1/50 [00:05<04:30,  5.51s/it]  4%|▍         | 2/50 [00:05<01:53,  2.37s/it]  6%|▌         | 3/50 [00:05<01:07,  1.43s/it]  8%|▊         | 4/50 [00:06<00:45,  1.01it/s] 10%|█         | 5/50 [00:06<00:33,  1.35it/s] 12%|█▏        | 6/50 [00:06<00:26,  1.69it/s] 14%|█▍        | 7/50 [00:07<00:21,  2.00it/s] 16%|█▌        | 8/50 [00:07<00:18,  2.29it/s] 18%|█▊        | 9/50 [00:07<00:16,  2.53it/s] 20%|██        | 10/50 [00:08<00:14,  2.72it/s] 22%|██▏       | 11/50 [00:08<00:13,  2.87it/s] 24%|██▍       | 12/50 [00:08<00:12,  2.98it/s] 26%|██▌       | 13/50 [00:09<00:12,  3.07it/s] 28%|██▊       | 14/50 [00:09<00:11,  3.13it/s] 30%|███       | 15/50 [00:09<00:11,  3.17it/s] 32%|███▏      | 16/50 [00:09<00:10,  3.20it/s] 34%|███▍      | 17/50 [00:10<00:10,  3.23it/s] 36%|███▌      | 18/50 [00:10<00:09,  3.24it/s] 38%|███▊      | 19/50 [00:10<00:09,  3.25it/s] 40%|████      | 20/50 [00:11<00:09,  3.26it/s] 42%|████▏     | 21/50 [00:11<00:08,  3.27it/s] 44%|████▍     | 22/50 [00:11<00:08,  3.28it/s] 46%|████▌     | 23/50 [00:12<00:08,  3.28it/s] 48%|████▊     | 24/50 [00:12<00:07,  3.28it/s] 50%|█████     | 25/50 [00:12<00:07,  3.28it/s] 52%|█████▏    | 26/50 [00:13<00:07,  3.28it/s] 54%|█████▍    | 27/50 [00:13<00:07,  3.28it/s] 56%|█████▌    | 28/50 [00:13<00:06,  3.28it/s] 58%|█████▊    | 29/50 [00:13<00:06,  3.28it/s] 60%|██████    | 30/50 [00:14<00:06,  3.28it/s] 62%|██████▏   | 31/50 [00:14<00:05,  3.28it/s] 64%|██████▍   | 32/50 [00:14<00:05,  3.28it/s] 66%|██████▌   | 33/50 [00:15<00:05,  3.28it/s] 68%|██████▊   | 34/50 [00:15<00:04,  3.28it/s] 70%|███████   | 35/50 [00:15<00:04,  3.28it/s] 72%|███████▏  | 36/50 [00:16<00:04,  3.28it/s] 74%|███████▍  | 37/50 [00:16<00:03,  3.28it/s] 76%|███████▌  | 38/50 [00:16<00:03,  3.28it/s] 78%|███████▊  | 39/50 [00:16<00:03,  3.28it/s] 80%|████████  | 40/50 [00:17<00:03,  3.28it/s] 82%|████████▏ | 41/50 [00:17<00:02,  3.28it/s] 84%|████████▍ | 42/50 [00:17<00:02,  3.28it/s] 86%|████████▌ | 43/50 [00:18<00:02,  3.28it/s] 88%|████████▊ | 44/50 [00:18<00:01,  3.28it/s] 90%|█████████ | 45/50 [00:18<00:01,  3.27it/s] 92%|█████████▏| 46/50 [00:19<00:01,  3.27it/s] 94%|█████████▍| 47/50 [00:19<00:00,  3.26it/s] 96%|█████████▌| 48/50 [00:19<00:00,  3.25it/s] 98%|█████████▊| 49/50 [00:20<00:00,  3.26it/s]100%|██████████| 50/50 [00:25<00:00,  1.76s/it]100%|██████████| 50/50 [00:25<00:00,  1.99it/s]
[I 2023-12-11 00:04:14,810] Trial 332 finished with value: 0.3973374295954941 and parameters: {'EMBEDDING_DIM': 1007, 'HIDDEN_DIM': 447, 'NUM_LAYERS': 1, 'DROPOUT': 0.3261659052080746, 'LR': 0.00103748829058667, 'WEIGHT_0': 0.35438160933458057, 'WEIGHT_1': 0.7024206209946982, 'WEIGHT_2': 0.5371560773343185, 'WEIGHT_3': 0.8505555988296357, 'WEIGHT_4': 0.8616464340639908, 'WEIGHT_5': 0.5304090299064954, 'WEIGHT_6': 0.9266675331745505, 'WEIGHT_7': 0.577284256041887, 'WEIGHT_8': 0.3651339813728735, 'optimizer': 'Adam'}. Best is trial 221 with value: 0.418736930154747.
/userhome/cs2/dingruiw/conda/envs/py310/lib/python3.10/site-packages/torch/nn/modules/rnn.py:82: UserWarning: dropout option adds dropout after all but last recurrent layer, so non-zero dropout expects num_layers greater than 1, but got dropout=0.3436134007174377 and num_layers=1
  warnings.warn("dropout option adds dropout after all but last "
{'EMBEDDING_DIM': 1007, 'HIDDEN_DIM': 447, 'NUM_LAYERS': 1, 'DROPOUT': 0.3261659052080746, 'LR': 0.00103748829058667, 'WEIGHT_0': 0.35438160933458057, 'WEIGHT_1': 0.7024206209946982, 'WEIGHT_2': 0.5371560773343185, 'WEIGHT_3': 0.8505555988296357, 'WEIGHT_4': 0.8616464340639908, 'WEIGHT_5': 0.5304090299064954, 'WEIGHT_6': 0.9266675331745505, 'WEIGHT_7': 0.577284256041887, 'WEIGHT_8': 0.3651339813728735, 'optimizer': 'Adam'}
0
              precision    recall  f1-score   support

         LOC       0.07      0.14      0.09      1837
        MISC       0.01      0.07      0.02       922
         ORG       0.04      0.10      0.05      1341
         PER       0.02      0.04      0.03      1842

   micro avg       0.03      0.09      0.05      5942
   macro avg       0.04      0.09      0.05      5942
weighted avg       0.04      0.09      0.05      5942

{'EMBEDDING_DIM': 1007, 'HIDDEN_DIM': 447, 'NUM_LAYERS': 1, 'DROPOUT': 0.3261659052080746, 'LR': 0.00103748829058667, 'WEIGHT_0': 0.35438160933458057, 'WEIGHT_1': 0.7024206209946982, 'WEIGHT_2': 0.5371560773343185, 'WEIGHT_3': 0.8505555988296357, 'WEIGHT_4': 0.8616464340639908, 'WEIGHT_5': 0.5304090299064954, 'WEIGHT_6': 0.9266675331745505, 'WEIGHT_7': 0.577284256041887, 'WEIGHT_8': 0.3651339813728735, 'optimizer': 'Adam'}
49
              precision    recall  f1-score   support

         LOC       0.55      0.52      0.53      1837
        MISC       0.42      0.43      0.43       922
         ORG       0.28      0.26      0.27      1341
         PER       0.34      0.34      0.34      1842

   micro avg       0.40      0.39      0.40      5942
   macro avg       0.40      0.39      0.39      5942
weighted avg       0.40      0.39      0.40      5942

epoch 49
LSTM
  0%|          | 0/50 [00:00<?, ?it/s]  2%|▏         | 1/50 [00:04<03:44,  4.58s/it]  6%|▌         | 3/50 [00:04<01:00,  1.28s/it]  8%|▊         | 4/50 [00:05<00:41,  1.12it/s] 10%|█         | 5/50 [00:05<00:29,  1.53it/s] 12%|█▏        | 6/50 [00:05<00:21,  2.02it/s] 14%|█▍        | 7/50 [00:05<00:16,  2.56it/s] 16%|█▌        | 8/50 [00:05<00:13,  3.13it/s] 18%|█▊        | 9/50 [00:05<00:11,  3.69it/s] 20%|██        | 10/50 [00:05<00:09,  4.20it/s] 22%|██▏       | 11/50 [00:06<00:08,  4.65it/s] 24%|██▍       | 12/50 [00:06<00:07,  5.02it/s] 26%|██▌       | 13/50 [00:06<00:06,  5.32it/s] 28%|██▊       | 14/50 [00:06<00:06,  5.55it/s] 30%|███       | 15/50 [00:06<00:06,  5.72it/s] 32%|███▏      | 16/50 [00:06<00:05,  5.85it/s] 34%|███▍      | 17/50 [00:07<00:05,  5.94it/s] 36%|███▌      | 18/50 [00:07<00:05,  6.01it/s] 38%|███▊      | 19/50 [00:07<00:05,  6.06it/s] 40%|████      | 20/50 [00:07<00:04,  6.09it/s] 42%|████▏     | 21/50 [00:07<00:04,  6.12it/s] 44%|████▍     | 22/50 [00:07<00:04,  6.14it/s] 46%|████▌     | 23/50 [00:08<00:04,  6.15it/s] 48%|████▊     | 24/50 [00:08<00:04,  6.15it/s] 50%|█████     | 25/50 [00:08<00:04,  6.16it/s] 52%|█████▏    | 26/50 [00:08<00:03,  6.16it/s] 54%|█████▍    | 27/50 [00:08<00:03,  6.16it/s] 56%|█████▌    | 28/50 [00:08<00:03,  6.16it/s] 58%|█████▊    | 29/50 [00:09<00:03,  6.17it/s] 60%|██████    | 30/50 [00:09<00:03,  6.17it/s] 62%|██████▏   | 31/50 [00:09<00:03,  6.18it/s] 64%|██████▍   | 32/50 [00:09<00:02,  6.17it/s] 66%|██████▌   | 33/50 [00:09<00:02,  6.17it/s] 68%|██████▊   | 34/50 [00:09<00:02,  6.17it/s] 70%|███████   | 35/50 [00:10<00:02,  6.18it/s] 72%|███████▏  | 36/50 [00:10<00:02,  6.17it/s] 74%|███████▍  | 37/50 [00:10<00:02,  6.17it/s] 76%|███████▌  | 38/50 [00:10<00:01,  6.17it/s] 78%|███████▊  | 39/50 [00:10<00:01,  6.18it/s] 80%|████████  | 40/50 [00:10<00:01,  6.17it/s] 82%|████████▏ | 41/50 [00:10<00:01,  6.17it/s] 84%|████████▍ | 42/50 [00:11<00:01,  6.16it/s] 86%|████████▌ | 43/50 [00:11<00:01,  6.16it/s] 88%|████████▊ | 44/50 [00:11<00:00,  6.16it/s] 90%|█████████ | 45/50 [00:11<00:00,  6.16it/s] 92%|█████████▏| 46/50 [00:11<00:00,  6.16it/s] 94%|█████████▍| 47/50 [00:11<00:00,  6.16it/s] 96%|█████████▌| 48/50 [00:12<00:00,  6.16it/s] 98%|█████████▊| 49/50 [00:12<00:00,  6.17it/s]100%|██████████| 50/50 [00:16<00:00,  1.50s/it]100%|██████████| 50/50 [00:16<00:00,  2.96it/s]
