[I 2023-12-10 21:50:07,059] Trial 65 finished with value: 0.4076167289800887 and parameters: {'EMBEDDING_DIM': 989, 'HIDDEN_DIM': 529, 'NUM_LAYERS': 1, 'DROPOUT': 0.3437821785103727, 'LR': 0.0015305653326509368, 'WEIGHT_0': 0.4864018049041375, 'WEIGHT_1': 0.762288012927679, 'WEIGHT_2': 0.4636424091261945, 'WEIGHT_3': 0.9322705151433553, 'WEIGHT_4': 0.7151549791195579, 'WEIGHT_5': 0.4827924494246248, 'WEIGHT_6': 0.9647434625631647, 'WEIGHT_7': 0.4872026992915845, 'WEIGHT_8': 0.26753583200791964, 'optimizer': 'Adam'}. Best is trial 51 with value: 0.41438326562364947.
/userhome/cs2/dingruiw/conda/envs/py310/lib/python3.10/site-packages/torch/nn/modules/rnn.py:82: UserWarning: dropout option adds dropout after all but last recurrent layer, so non-zero dropout expects num_layers greater than 1, but got dropout=0.3458446736753588 and num_layers=1
  warnings.warn("dropout option adds dropout after all but last "
{'EMBEDDING_DIM': 989, 'HIDDEN_DIM': 529, 'NUM_LAYERS': 1, 'DROPOUT': 0.3437821785103727, 'LR': 0.0015305653326509368, 'WEIGHT_0': 0.4864018049041375, 'WEIGHT_1': 0.762288012927679, 'WEIGHT_2': 0.4636424091261945, 'WEIGHT_3': 0.9322705151433553, 'WEIGHT_4': 0.7151549791195579, 'WEIGHT_5': 0.4827924494246248, 'WEIGHT_6': 0.9647434625631647, 'WEIGHT_7': 0.4872026992915845, 'WEIGHT_8': 0.26753583200791964, 'optimizer': 'Adam'}
0
              precision    recall  f1-score   support

         LOC       0.05      0.05      0.05      1837
        MISC       0.04      0.05      0.04       922
         ORG       0.02      0.03      0.03      1341
         PER       0.02      0.03      0.03      1842

   micro avg       0.03      0.04      0.04      5942
   macro avg       0.03      0.04      0.04      5942
weighted avg       0.03      0.04      0.04      5942

{'EMBEDDING_DIM': 989, 'HIDDEN_DIM': 529, 'NUM_LAYERS': 1, 'DROPOUT': 0.3437821785103727, 'LR': 0.0015305653326509368, 'WEIGHT_0': 0.4864018049041375, 'WEIGHT_1': 0.762288012927679, 'WEIGHT_2': 0.4636424091261945, 'WEIGHT_3': 0.9322705151433553, 'WEIGHT_4': 0.7151549791195579, 'WEIGHT_5': 0.4827924494246248, 'WEIGHT_6': 0.9647434625631647, 'WEIGHT_7': 0.4872026992915845, 'WEIGHT_8': 0.26753583200791964, 'optimizer': 'Adam'}
49
              precision    recall  f1-score   support

         LOC       0.58      0.52      0.55      1837
        MISC       0.45      0.44      0.45       922
         ORG       0.30      0.27      0.28      1341
         PER       0.35      0.34      0.34      1842

   micro avg       0.42      0.39      0.41      5942
   macro avg       0.42      0.39      0.40      5942
weighted avg       0.42      0.39      0.41      5942

epoch 49
LSTM
  0%|          | 0/50 [00:00<?, ?it/s]  2%|▏         | 1/50 [00:04<04:03,  4.96s/it]  4%|▍         | 2/50 [00:05<01:43,  2.16s/it]  6%|▌         | 3/50 [00:05<01:02,  1.34s/it]  8%|▊         | 4/50 [00:05<00:43,  1.05it/s] 10%|█         | 5/50 [00:06<00:33,  1.36it/s] 12%|█▏        | 6/50 [00:06<00:26,  1.64it/s] 14%|█▍        | 7/50 [00:06<00:22,  1.90it/s] 16%|█▌        | 8/50 [00:07<00:19,  2.11it/s] 18%|█▊        | 9/50 [00:07<00:17,  2.28it/s] 20%|██        | 10/50 [00:08<00:16,  2.42it/s] 22%|██▏       | 11/50 [00:08<00:15,  2.52it/s] 24%|██▍       | 12/50 [00:08<00:14,  2.59it/s] 26%|██▌       | 13/50 [00:09<00:13,  2.65it/s] 28%|██▊       | 14/50 [00:09<00:13,  2.69it/s] 30%|███       | 15/50 [00:09<00:12,  2.71it/s] 32%|███▏      | 16/50 [00:10<00:12,  2.73it/s] 34%|███▍      | 17/50 [00:10<00:12,  2.75it/s] 36%|███▌      | 18/50 [00:10<00:11,  2.75it/s] 38%|███▊      | 19/50 [00:11<00:11,  2.76it/s] 40%|████      | 20/50 [00:11<00:10,  2.76it/s] 42%|████▏     | 21/50 [00:11<00:10,  2.77it/s] 44%|████▍     | 22/50 [00:12<00:10,  2.77it/s] 46%|████▌     | 23/50 [00:12<00:09,  2.77it/s] 48%|████▊     | 24/50 [00:13<00:09,  2.77it/s] 50%|█████     | 25/50 [00:13<00:09,  2.77it/s] 52%|█████▏    | 26/50 [00:13<00:08,  2.77it/s] 54%|█████▍    | 27/50 [00:14<00:08,  2.77it/s] 56%|█████▌    | 28/50 [00:14<00:07,  2.77it/s] 58%|█████▊    | 29/50 [00:14<00:07,  2.77it/s] 60%|██████    | 30/50 [00:15<00:07,  2.76it/s] 62%|██████▏   | 31/50 [00:15<00:06,  2.77it/s] 64%|██████▍   | 32/50 [00:15<00:06,  2.77it/s] 66%|██████▌   | 33/50 [00:16<00:06,  2.76it/s] 68%|██████▊   | 34/50 [00:16<00:05,  2.77it/s] 70%|███████   | 35/50 [00:17<00:05,  2.77it/s] 72%|███████▏  | 36/50 [00:17<00:05,  2.76it/s] 74%|███████▍  | 37/50 [00:17<00:04,  2.76it/s] 76%|███████▌  | 38/50 [00:18<00:04,  2.76it/s] 78%|███████▊  | 39/50 [00:18<00:03,  2.76it/s] 80%|████████  | 40/50 [00:18<00:03,  2.76it/s] 82%|████████▏ | 41/50 [00:19<00:03,  2.76it/s] 84%|████████▍ | 42/50 [00:19<00:02,  2.76it/s] 86%|████████▌ | 43/50 [00:19<00:02,  2.75it/s] 88%|████████▊ | 44/50 [00:20<00:02,  2.75it/s] 90%|█████████ | 45/50 [00:20<00:01,  2.75it/s] 92%|█████████▏| 46/50 [00:21<00:01,  2.75it/s] 94%|█████████▍| 47/50 [00:21<00:01,  2.74it/s] 96%|█████████▌| 48/50 [00:21<00:00,  2.75it/s] 98%|█████████▊| 49/50 [00:22<00:00,  2.75it/s]100%|██████████| 50/50 [00:27<00:00,  1.76s/it]100%|██████████| 50/50 [00:27<00:00,  1.84it/s]
[I 2023-12-10 21:50:38,622] Trial 66 finished with value: 0.3978977706196491 and parameters: {'EMBEDDING_DIM': 1017, 'HIDDEN_DIM': 528, 'NUM_LAYERS': 1, 'DROPOUT': 0.3458446736753588, 'LR': 0.0015369387725561632, 'WEIGHT_0': 0.47683399325324183, 'WEIGHT_1': 0.7596506035946277, 'WEIGHT_2': 0.46968991902257323, 'WEIGHT_3': 0.9177049330916176, 'WEIGHT_4': 0.6967873539558691, 'WEIGHT_5': 0.4891847522105697, 'WEIGHT_6': 0.9641498490074181, 'WEIGHT_7': 0.4871389818045727, 'WEIGHT_8': 0.252825493387549, 'optimizer': 'Adam'}. Best is trial 51 with value: 0.41438326562364947.
/userhome/cs2/dingruiw/conda/envs/py310/lib/python3.10/site-packages/torch/nn/modules/rnn.py:82: UserWarning: dropout option adds dropout after all but last recurrent layer, so non-zero dropout expects num_layers greater than 1, but got dropout=0.32154850139124225 and num_layers=1
  warnings.warn("dropout option adds dropout after all but last "
{'EMBEDDING_DIM': 1017, 'HIDDEN_DIM': 528, 'NUM_LAYERS': 1, 'DROPOUT': 0.3458446736753588, 'LR': 0.0015369387725561632, 'WEIGHT_0': 0.47683399325324183, 'WEIGHT_1': 0.7596506035946277, 'WEIGHT_2': 0.46968991902257323, 'WEIGHT_3': 0.9177049330916176, 'WEIGHT_4': 0.6967873539558691, 'WEIGHT_5': 0.4891847522105697, 'WEIGHT_6': 0.9641498490074181, 'WEIGHT_7': 0.4871389818045727, 'WEIGHT_8': 0.252825493387549, 'optimizer': 'Adam'}
0
              precision    recall  f1-score   support

         LOC       0.06      0.06      0.06      1837
        MISC       0.02      0.03      0.02       922
         ORG       0.03      0.06      0.04      1341
         PER       0.03      0.04      0.03      1842

   micro avg       0.03      0.05      0.04      5942
   macro avg       0.03      0.05      0.04      5942
weighted avg       0.04      0.05      0.04      5942

{'EMBEDDING_DIM': 1017, 'HIDDEN_DIM': 528, 'NUM_LAYERS': 1, 'DROPOUT': 0.3458446736753588, 'LR': 0.0015369387725561632, 'WEIGHT_0': 0.47683399325324183, 'WEIGHT_1': 0.7596506035946277, 'WEIGHT_2': 0.46968991902257323, 'WEIGHT_3': 0.9177049330916176, 'WEIGHT_4': 0.6967873539558691, 'WEIGHT_5': 0.4891847522105697, 'WEIGHT_6': 0.9641498490074181, 'WEIGHT_7': 0.4871389818045727, 'WEIGHT_8': 0.252825493387549, 'optimizer': 'Adam'}
49
              precision    recall  f1-score   support

         LOC       0.52      0.53      0.52      1837
        MISC       0.42      0.44      0.43       922
         ORG       0.30      0.26      0.28      1341
         PER       0.34      0.34      0.34      1842

   micro avg       0.40      0.39      0.40      5942
   macro avg       0.39      0.39      0.39      5942
weighted avg       0.40      0.39      0.40      5942

epoch 49
LSTM
  0%|          | 0/50 [00:00<?, ?it/s]  2%|▏         | 1/50 [00:05<04:10,  5.11s/it]  4%|▍         | 2/50 [00:05<01:46,  2.23s/it]  6%|▌         | 3/50 [00:05<01:05,  1.39s/it]  8%|▊         | 4/50 [00:06<00:46,  1.00s/it] 10%|█         | 5/50 [00:06<00:35,  1.27it/s] 12%|█▏        | 6/50 [00:06<00:28,  1.53it/s] 14%|█▍        | 7/50 [00:07<00:24,  1.76it/s] 16%|█▌        | 8/50 [00:07<00:21,  1.94it/s] 18%|█▊        | 9/50 [00:08<00:19,  2.09it/s] 20%|██        | 10/50 [00:08<00:18,  2.20it/s] 22%|██▏       | 11/50 [00:08<00:17,  2.28it/s] 24%|██▍       | 12/50 [00:09<00:16,  2.35it/s] 26%|██▌       | 13/50 [00:09<00:15,  2.39it/s] 28%|██▊       | 14/50 [00:10<00:14,  2.42it/s] 30%|███       | 15/50 [00:10<00:14,  2.44it/s] 32%|███▏      | 16/50 [00:10<00:13,  2.46it/s] 34%|███▍      | 17/50 [00:11<00:13,  2.47it/s] 36%|███▌      | 18/50 [00:11<00:12,  2.48it/s] 38%|███▊      | 19/50 [00:12<00:12,  2.48it/s] 40%|████      | 20/50 [00:12<00:12,  2.49it/s] 42%|████▏     | 21/50 [00:12<00:11,  2.49it/s] 44%|████▍     | 22/50 [00:13<00:11,  2.49it/s] 46%|████▌     | 23/50 [00:13<00:10,  2.49it/s] 48%|████▊     | 24/50 [00:14<00:10,  2.49it/s] 50%|█████     | 25/50 [00:14<00:10,  2.49it/s] 52%|█████▏    | 26/50 [00:14<00:09,  2.49it/s] 54%|█████▍    | 27/50 [00:15<00:09,  2.49it/s] 56%|█████▌    | 28/50 [00:15<00:08,  2.49it/s] 58%|█████▊    | 29/50 [00:16<00:08,  2.48it/s] 60%|██████    | 30/50 [00:16<00:08,  2.49it/s] 62%|██████▏   | 31/50 [00:16<00:07,  2.49it/s] 64%|██████▍   | 32/50 [00:17<00:07,  2.49it/s] 66%|██████▌   | 33/50 [00:17<00:06,  2.48it/s] 68%|██████▊   | 34/50 [00:18<00:06,  2.48it/s] 70%|███████   | 35/50 [00:18<00:06,  2.48it/s] 72%|███████▏  | 36/50 [00:18<00:05,  2.47it/s] 74%|███████▍  | 37/50 [00:19<00:05,  2.47it/s] 76%|███████▌  | 38/50 [00:19<00:04,  2.47it/s] 78%|███████▊  | 39/50 [00:20<00:04,  2.47it/s] 80%|████████  | 40/50 [00:20<00:04,  2.47it/s] 82%|████████▏ | 41/50 [00:20<00:03,  2.47it/s] 84%|████████▍ | 42/50 [00:21<00:03,  2.47it/s] 86%|████████▌ | 43/50 [00:21<00:02,  2.47it/s] 88%|████████▊ | 44/50 [00:22<00:02,  2.48it/s] 90%|█████████ | 45/50 [00:22<00:02,  2.48it/s] 92%|█████████▏| 46/50 [00:23<00:01,  2.47it/s] 94%|█████████▍| 47/50 [00:23<00:01,  2.47it/s] 96%|█████████▌| 48/50 [00:23<00:00,  2.47it/s] 98%|█████████▊| 49/50 [00:24<00:00,  2.47it/s]100%|██████████| 50/50 [00:29<00:00,  1.79s/it]100%|██████████| 50/50 [00:29<00:00,  1.71it/s]
[I 2023-12-10 21:51:12,118] Trial 67 finished with value: 0.22577232331781635 and parameters: {'EMBEDDING_DIM': 985, 'HIDDEN_DIM': 568, 'NUM_LAYERS': 1, 'DROPOUT': 0.32154850139124225, 'LR': 0.00024899659726517777, 'WEIGHT_0': 0.4304926876903724, 'WEIGHT_1': 0.8104961373495313, 'WEIGHT_2': 0.6030117556808444, 'WEIGHT_3': 0.9789104826408423, 'WEIGHT_4': 0.6305874024904132, 'WEIGHT_5': 0.35842142080000483, 'WEIGHT_6': 0.9936173959900952, 'WEIGHT_7': 0.4317262779707503, 'WEIGHT_8': 0.48665639498447466, 'optimizer': 'Adam'}. Best is trial 51 with value: 0.41438326562364947.
/userhome/cs2/dingruiw/conda/envs/py310/lib/python3.10/site-packages/torch/nn/modules/rnn.py:82: UserWarning: dropout option adds dropout after all but last recurrent layer, so non-zero dropout expects num_layers greater than 1, but got dropout=0.348870754150453 and num_layers=1
  warnings.warn("dropout option adds dropout after all but last "
{'EMBEDDING_DIM': 985, 'HIDDEN_DIM': 568, 'NUM_LAYERS': 1, 'DROPOUT': 0.32154850139124225, 'LR': 0.00024899659726517777, 'WEIGHT_0': 0.4304926876903724, 'WEIGHT_1': 0.8104961373495313, 'WEIGHT_2': 0.6030117556808444, 'WEIGHT_3': 0.9789104826408423, 'WEIGHT_4': 0.6305874024904132, 'WEIGHT_5': 0.35842142080000483, 'WEIGHT_6': 0.9936173959900952, 'WEIGHT_7': 0.4317262779707503, 'WEIGHT_8': 0.48665639498447466, 'optimizer': 'Adam'}
0
              precision    recall  f1-score   support

         LOC       0.04      0.18      0.06      1837
        MISC       0.02      0.12      0.03       922
         ORG       0.01      0.10      0.02      1341
         PER       0.01      0.06      0.02      1842

   micro avg       0.02      0.11      0.04      5942
   macro avg       0.02      0.11      0.04      5942
weighted avg       0.02      0.11      0.04      5942

{'EMBEDDING_DIM': 985, 'HIDDEN_DIM': 568, 'NUM_LAYERS': 1, 'DROPOUT': 0.32154850139124225, 'LR': 0.00024899659726517777, 'WEIGHT_0': 0.4304926876903724, 'WEIGHT_1': 0.8104961373495313, 'WEIGHT_2': 0.6030117556808444, 'WEIGHT_3': 0.9789104826408423, 'WEIGHT_4': 0.6305874024904132, 'WEIGHT_5': 0.35842142080000483, 'WEIGHT_6': 0.9936173959900952, 'WEIGHT_7': 0.4317262779707503, 'WEIGHT_8': 0.48665639498447466, 'optimizer': 'Adam'}
49
              precision    recall  f1-score   support

         LOC       0.62      0.24      0.34      1837
        MISC       0.35      0.08      0.14       922
         ORG       0.21      0.10      0.14      1341
         PER       0.22      0.22      0.22      1842

   micro avg       0.30      0.18      0.23      5942
   macro avg       0.35      0.16      0.21      5942
weighted avg       0.36      0.18      0.23      5942

epoch 49
LSTM
  0%|          | 0/50 [00:00<?, ?it/s]  2%|▏         | 1/50 [00:04<03:59,  4.89s/it]  6%|▌         | 3/50 [00:05<01:04,  1.37s/it]  8%|▊         | 4/50 [00:05<00:44,  1.04it/s] 10%|█         | 5/50 [00:05<00:31,  1.42it/s] 12%|█▏        | 6/50 [00:05<00:23,  1.87it/s] 14%|█▍        | 7/50 [00:05<00:18,  2.36it/s] 16%|█▌        | 8/50 [00:06<00:14,  2.87it/s] 18%|█▊        | 9/50 [00:06<00:12,  3.37it/s] 20%|██        | 10/50 [00:06<00:10,  3.82it/s] 22%|██▏       | 11/50 [00:06<00:09,  4.23it/s] 24%|██▍       | 12/50 [00:06<00:08,  4.55it/s] 26%|██▌       | 13/50 [00:06<00:07,  4.80it/s] 28%|██▊       | 14/50 [00:07<00:07,  4.99it/s] 30%|███       | 15/50 [00:07<00:06,  5.13it/s] 32%|███▏      | 16/50 [00:07<00:06,  5.24it/s] 34%|███▍      | 17/50 [00:07<00:06,  5.32it/s] 36%|███▌      | 18/50 [00:07<00:05,  5.37it/s] 38%|███▊      | 19/50 [00:08<00:05,  5.41it/s] 40%|████      | 20/50 [00:08<00:05,  5.44it/s] 42%|████▏     | 21/50 [00:08<00:05,  5.46it/s] 44%|████▍     | 22/50 [00:08<00:05,  5.48it/s] 46%|████▌     | 23/50 [00:08<00:04,  5.49it/s] 48%|████▊     | 24/50 [00:08<00:04,  5.49it/s] 50%|█████     | 25/50 [00:09<00:04,  5.49it/s] 52%|█████▏    | 26/50 [00:09<00:04,  5.50it/s] 54%|█████▍    | 27/50 [00:09<00:04,  5.50it/s] 56%|█████▌    | 28/50 [00:09<00:03,  5.50it/s] 58%|█████▊    | 29/50 [00:09<00:03,  5.51it/s] 60%|██████    | 30/50 [00:10<00:03,  5.50it/s] 62%|██████▏   | 31/50 [00:10<00:03,  5.50it/s] 64%|██████▍   | 32/50 [00:10<00:03,  5.50it/s] 66%|██████▌   | 33/50 [00:10<00:03,  5.50it/s] 68%|██████▊   | 34/50 [00:10<00:02,  5.50it/s] 70%|███████   | 35/50 [00:10<00:02,  5.50it/s] 72%|███████▏  | 36/50 [00:11<00:02,  5.50it/s] 74%|███████▍  | 37/50 [00:11<00:02,  5.49it/s] 76%|███████▌  | 38/50 [00:11<00:02,  5.49it/s] 78%|███████▊  | 39/50 [00:11<00:02,  5.50it/s] 80%|████████  | 40/50 [00:11<00:01,  5.49it/s] 82%|████████▏ | 41/50 [00:12<00:01,  5.49it/s] 84%|████████▍ | 42/50 [00:12<00:01,  5.49it/s] 86%|████████▌ | 43/50 [00:12<00:01,  5.49it/s] 88%|████████▊ | 44/50 [00:12<00:01,  5.50it/s] 90%|█████████ | 45/50 [00:12<00:00,  5.49it/s] 92%|█████████▏| 46/50 [00:12<00:00,  5.49it/s] 94%|█████████▍| 47/50 [00:13<00:00,  5.49it/s] 96%|█████████▌| 48/50 [00:13<00:00,  5.49it/s] 98%|█████████▊| 49/50 [00:13<00:00,  5.49it/s]100%|██████████| 50/50 [00:18<00:00,  1.61s/it]100%|██████████| 50/50 [00:18<00:00,  2.71it/s]
[I 2023-12-10 21:51:34,809] Trial 68 finished with value: 0.03448928291483092 and parameters: {'EMBEDDING_DIM': 810, 'HIDDEN_DIM': 303, 'NUM_LAYERS': 1, 'DROPOUT': 0.348870754150453, 'LR': 0.0008916021639802303, 'WEIGHT_0': 0.4758649277787334, 'WEIGHT_1': 0.7028068533735343, 'WEIGHT_2': 0.5689250577830829, 'WEIGHT_3': 0.9209365967559369, 'WEIGHT_4': 0.8140303710387082, 'WEIGHT_5': 0.5757296413813073, 'WEIGHT_6': 0.8875550728978241, 'WEIGHT_7': 0.4584717557521349, 'WEIGHT_8': 0.3857116483921856, 'optimizer': 'SGD'}. Best is trial 51 with value: 0.41438326562364947.
/userhome/cs2/dingruiw/conda/envs/py310/lib/python3.10/site-packages/torch/nn/modules/rnn.py:82: UserWarning: dropout option adds dropout after all but last recurrent layer, so non-zero dropout expects num_layers greater than 1, but got dropout=0.308868292071752 and num_layers=1
  warnings.warn("dropout option adds dropout after all but last "
{'EMBEDDING_DIM': 810, 'HIDDEN_DIM': 303, 'NUM_LAYERS': 1, 'DROPOUT': 0.348870754150453, 'LR': 0.0008916021639802303, 'WEIGHT_0': 0.4758649277787334, 'WEIGHT_1': 0.7028068533735343, 'WEIGHT_2': 0.5689250577830829, 'WEIGHT_3': 0.9209365967559369, 'WEIGHT_4': 0.8140303710387082, 'WEIGHT_5': 0.5757296413813073, 'WEIGHT_6': 0.8875550728978241, 'WEIGHT_7': 0.4584717557521349, 'WEIGHT_8': 0.3857116483921856, 'optimizer': 'SGD'}
0
              precision    recall  f1-score   support

         LOC       0.03      0.12      0.05      1837
        MISC       0.01      0.15      0.03       922
         ORG       0.02      0.19      0.03      1341
         PER       0.01      0.09      0.02      1842

   micro avg       0.02      0.13      0.03      5942
   macro avg       0.02      0.14      0.03      5942
weighted avg       0.02      0.13      0.03      5942

{'EMBEDDING_DIM': 810, 'HIDDEN_DIM': 303, 'NUM_LAYERS': 1, 'DROPOUT': 0.348870754150453, 'LR': 0.0008916021639802303, 'WEIGHT_0': 0.4758649277787334, 'WEIGHT_1': 0.7028068533735343, 'WEIGHT_2': 0.5689250577830829, 'WEIGHT_3': 0.9209365967559369, 'WEIGHT_4': 0.8140303710387082, 'WEIGHT_5': 0.5757296413813073, 'WEIGHT_6': 0.8875550728978241, 'WEIGHT_7': 0.4584717557521349, 'WEIGHT_8': 0.3857116483921856, 'optimizer': 'SGD'}
49
              precision    recall  f1-score   support

         LOC       0.03      0.10      0.05      1837
        MISC       0.02      0.13      0.03       922
         ORG       0.02      0.16      0.04      1341
         PER       0.02      0.07      0.02      1842

   micro avg       0.02      0.11      0.03      5942
   macro avg       0.02      0.11      0.04      5942
weighted avg       0.02      0.11      0.04      5942

epoch 49
LSTM
  0%|          | 0/50 [00:00<?, ?it/s]  2%|▏         | 1/50 [00:04<03:54,  4.78s/it]  4%|▍         | 2/50 [00:04<01:38,  2.06s/it]  6%|▌         | 3/50 [00:05<00:58,  1.25s/it]  8%|▊         | 4/50 [00:05<00:39,  1.16it/s] 10%|█         | 5/50 [00:05<00:29,  1.53it/s] 12%|█▏        | 6/50 [00:06<00:23,  1.90it/s] 14%|█▍        | 7/50 [00:06<00:19,  2.25it/s] 16%|█▌        | 8/50 [00:06<00:16,  2.55it/s] 18%|█▊        | 9/50 [00:06<00:14,  2.80it/s] 20%|██        | 10/50 [00:07<00:13,  3.00it/s] 22%|██▏       | 11/50 [00:07<00:12,  3.16it/s] 24%|██▍       | 12/50 [00:07<00:11,  3.28it/s] 26%|██▌       | 13/50 [00:08<00:11,  3.36it/s] 28%|██▊       | 14/50 [00:08<00:10,  3.42it/s] 30%|███       | 15/50 [00:08<00:10,  3.47it/s] 32%|███▏      | 16/50 [00:08<00:09,  3.50it/s] 34%|███▍      | 17/50 [00:09<00:09,  3.52it/s] 36%|███▌      | 18/50 [00:09<00:09,  3.54it/s] 38%|███▊      | 19/50 [00:09<00:08,  3.55it/s] 40%|████      | 20/50 [00:09<00:08,  3.55it/s] 42%|████▏     | 21/50 [00:10<00:08,  3.56it/s] 44%|████▍     | 22/50 [00:10<00:07,  3.56it/s] 46%|████▌     | 23/50 [00:10<00:07,  3.56it/s] 48%|████▊     | 24/50 [00:11<00:07,  3.57it/s] 50%|█████     | 25/50 [00:11<00:07,  3.57it/s] 52%|█████▏    | 26/50 [00:11<00:06,  3.57it/s] 54%|█████▍    | 27/50 [00:11<00:06,  3.57it/s] 56%|█████▌    | 28/50 [00:12<00:06,  3.56it/s] 58%|█████▊    | 29/50 [00:12<00:05,  3.57it/s] 60%|██████    | 30/50 [00:12<00:05,  3.56it/s] 62%|██████▏   | 31/50 [00:13<00:05,  3.56it/s] 64%|██████▍   | 32/50 [00:13<00:05,  3.56it/s] 66%|██████▌   | 33/50 [00:13<00:04,  3.56it/s] 68%|██████▊   | 34/50 [00:13<00:04,  3.55it/s] 70%|███████   | 35/50 [00:14<00:04,  3.55it/s] 72%|███████▏  | 36/50 [00:14<00:03,  3.54it/s] 74%|███████▍  | 37/50 [00:14<00:03,  3.54it/s] 76%|███████▌  | 38/50 [00:15<00:03,  3.55it/s] 78%|███████▊  | 39/50 [00:15<00:03,  3.54it/s] 80%|████████  | 40/50 [00:15<00:02,  3.54it/s] 82%|████████▏ | 41/50 [00:15<00:02,  3.54it/s] 84%|████████▍ | 42/50 [00:16<00:02,  3.54it/s] 86%|████████▌ | 43/50 [00:16<00:01,  3.54it/s] 88%|████████▊ | 44/50 [00:16<00:01,  3.54it/s] 90%|█████████ | 45/50 [00:17<00:01,  3.54it/s] 92%|█████████▏| 46/50 [00:17<00:01,  3.54it/s] 94%|█████████▍| 47/50 [00:17<00:00,  3.53it/s] 96%|█████████▌| 48/50 [00:17<00:00,  3.54it/s] 98%|█████████▊| 49/50 [00:18<00:00,  3.54it/s]100%|██████████| 50/50 [00:23<00:00,  1.68s/it]100%|██████████| 50/50 [00:23<00:00,  2.17it/s]
