[I 2023-12-10 22:24:06,274] Trial 121 finished with value: 0.40117029515532227 and parameters: {'EMBEDDING_DIM': 965, 'HIDDEN_DIM': 492, 'NUM_LAYERS': 1, 'DROPOUT': 0.29589545453423804, 'LR': 0.0011466233467472375, 'WEIGHT_0': 0.3374548405004234, 'WEIGHT_1': 0.4945716736117541, 'WEIGHT_2': 0.6093663677684319, 'WEIGHT_3': 0.8898566713054117, 'WEIGHT_4': 0.838891131877453, 'WEIGHT_5': 0.5151517230348305, 'WEIGHT_6': 0.7449530390074325, 'WEIGHT_7': 0.380418140247925, 'WEIGHT_8': 0.37105492645056887, 'optimizer': 'RMSprop'}. Best is trial 51 with value: 0.41438326562364947.
/userhome/cs2/dingruiw/conda/envs/py310/lib/python3.10/site-packages/torch/nn/modules/rnn.py:82: UserWarning: dropout option adds dropout after all but last recurrent layer, so non-zero dropout expects num_layers greater than 1, but got dropout=0.3132969370245911 and num_layers=1
  warnings.warn("dropout option adds dropout after all but last "
{'EMBEDDING_DIM': 965, 'HIDDEN_DIM': 492, 'NUM_LAYERS': 1, 'DROPOUT': 0.29589545453423804, 'LR': 0.0011466233467472375, 'WEIGHT_0': 0.3374548405004234, 'WEIGHT_1': 0.4945716736117541, 'WEIGHT_2': 0.6093663677684319, 'WEIGHT_3': 0.8898566713054117, 'WEIGHT_4': 0.838891131877453, 'WEIGHT_5': 0.5151517230348305, 'WEIGHT_6': 0.7449530390074325, 'WEIGHT_7': 0.380418140247925, 'WEIGHT_8': 0.37105492645056887, 'optimizer': 'RMSprop'}
0
              precision    recall  f1-score   support

         LOC       0.30      0.11      0.16      1837
        MISC       0.04      0.03      0.03       922
         ORG       0.09      0.03      0.05      1341
         PER       0.06      0.05      0.05      1842

   micro avg       0.11      0.06      0.08      5942
   macro avg       0.12      0.05      0.07      5942
weighted avg       0.14      0.06      0.08      5942

{'EMBEDDING_DIM': 965, 'HIDDEN_DIM': 492, 'NUM_LAYERS': 1, 'DROPOUT': 0.29589545453423804, 'LR': 0.0011466233467472375, 'WEIGHT_0': 0.3374548405004234, 'WEIGHT_1': 0.4945716736117541, 'WEIGHT_2': 0.6093663677684319, 'WEIGHT_3': 0.8898566713054117, 'WEIGHT_4': 0.838891131877453, 'WEIGHT_5': 0.5151517230348305, 'WEIGHT_6': 0.7449530390074325, 'WEIGHT_7': 0.380418140247925, 'WEIGHT_8': 0.37105492645056887, 'optimizer': 'RMSprop'}
49
              precision    recall  f1-score   support

         LOC       0.58      0.54      0.56      1837
        MISC       0.43      0.42      0.42       922
         ORG       0.28      0.23      0.25      1341
         PER       0.33      0.35      0.33      1842

   micro avg       0.41      0.39      0.40      5942
   macro avg       0.40      0.38      0.39      5942
weighted avg       0.41      0.39      0.40      5942

epoch 49
LSTM
  0%|          | 0/50 [00:00<?, ?it/s]  2%|▏         | 1/50 [00:04<03:53,  4.76s/it]  4%|▍         | 2/50 [00:04<01:38,  2.06s/it]  6%|▌         | 3/50 [00:05<00:59,  1.26s/it]  8%|▊         | 4/50 [00:05<00:40,  1.14it/s] 10%|█         | 5/50 [00:05<00:29,  1.50it/s] 12%|█▏        | 6/50 [00:06<00:23,  1.85it/s] 14%|█▍        | 7/50 [00:06<00:19,  2.18it/s] 16%|█▌        | 8/50 [00:06<00:17,  2.45it/s] 18%|█▊        | 9/50 [00:06<00:15,  2.69it/s] 20%|██        | 10/50 [00:07<00:13,  2.87it/s] 22%|██▏       | 11/50 [00:07<00:12,  3.01it/s] 24%|██▍       | 12/50 [00:07<00:12,  3.12it/s] 26%|██▌       | 13/50 [00:08<00:11,  3.19it/s] 28%|██▊       | 14/50 [00:08<00:11,  3.25it/s] 30%|███       | 15/50 [00:08<00:10,  3.28it/s] 32%|███▏      | 16/50 [00:09<00:10,  3.32it/s] 34%|███▍      | 17/50 [00:09<00:09,  3.34it/s] 36%|███▌      | 18/50 [00:09<00:09,  3.35it/s] 38%|███▊      | 19/50 [00:09<00:09,  3.36it/s] 40%|████      | 20/50 [00:10<00:08,  3.36it/s] 42%|████▏     | 21/50 [00:10<00:08,  3.37it/s] 44%|████▍     | 22/50 [00:10<00:08,  3.37it/s] 46%|████▌     | 23/50 [00:11<00:08,  3.37it/s] 48%|████▊     | 24/50 [00:11<00:07,  3.37it/s] 50%|█████     | 25/50 [00:11<00:07,  3.37it/s] 52%|█████▏    | 26/50 [00:12<00:07,  3.38it/s] 54%|█████▍    | 27/50 [00:12<00:06,  3.37it/s] 56%|█████▌    | 28/50 [00:12<00:06,  3.38it/s] 58%|█████▊    | 29/50 [00:12<00:06,  3.38it/s] 60%|██████    | 30/50 [00:13<00:05,  3.38it/s] 62%|██████▏   | 31/50 [00:13<00:05,  3.38it/s] 64%|██████▍   | 32/50 [00:13<00:05,  3.37it/s] 66%|██████▌   | 33/50 [00:14<00:05,  3.37it/s] 68%|██████▊   | 34/50 [00:14<00:04,  3.37it/s] 70%|███████   | 35/50 [00:14<00:04,  3.37it/s] 72%|███████▏  | 36/50 [00:14<00:04,  3.37it/s] 74%|███████▍  | 37/50 [00:15<00:03,  3.37it/s] 76%|███████▌  | 38/50 [00:15<00:03,  3.37it/s] 78%|███████▊  | 39/50 [00:15<00:03,  3.37it/s] 80%|████████  | 40/50 [00:16<00:02,  3.37it/s] 82%|████████▏ | 41/50 [00:16<00:02,  3.37it/s] 84%|████████▍ | 42/50 [00:16<00:02,  3.37it/s] 86%|████████▌ | 43/50 [00:17<00:02,  3.36it/s] 88%|████████▊ | 44/50 [00:17<00:01,  3.37it/s] 90%|█████████ | 45/50 [00:17<00:01,  3.37it/s] 92%|█████████▏| 46/50 [00:17<00:01,  3.36it/s] 94%|█████████▍| 47/50 [00:18<00:00,  3.37it/s] 96%|█████████▌| 48/50 [00:18<00:00,  3.36it/s] 98%|█████████▊| 49/50 [00:18<00:00,  3.36it/s]100%|██████████| 50/50 [00:23<00:00,  1.71s/it]100%|██████████| 50/50 [00:23<00:00,  2.09it/s]
[I 2023-12-10 22:24:34,424] Trial 122 finished with value: 0.4025442188725276 and parameters: {'EMBEDDING_DIM': 934, 'HIDDEN_DIM': 454, 'NUM_LAYERS': 1, 'DROPOUT': 0.3132969370245911, 'LR': 0.00087433331868009, 'WEIGHT_0': 0.4845794318342004, 'WEIGHT_1': 0.7317966974087273, 'WEIGHT_2': 0.5893467566584975, 'WEIGHT_3': 0.865453801655293, 'WEIGHT_4': 0.8941325343599681, 'WEIGHT_5': 0.43074744400639076, 'WEIGHT_6': 0.7156559389227857, 'WEIGHT_7': 0.35255257192844125, 'WEIGHT_8': 0.3998454141185144, 'optimizer': 'RMSprop'}. Best is trial 51 with value: 0.41438326562364947.
/userhome/cs2/dingruiw/conda/envs/py310/lib/python3.10/site-packages/torch/nn/modules/rnn.py:82: UserWarning: dropout option adds dropout after all but last recurrent layer, so non-zero dropout expects num_layers greater than 1, but got dropout=0.3003367659021869 and num_layers=1
  warnings.warn("dropout option adds dropout after all but last "
{'EMBEDDING_DIM': 934, 'HIDDEN_DIM': 454, 'NUM_LAYERS': 1, 'DROPOUT': 0.3132969370245911, 'LR': 0.00087433331868009, 'WEIGHT_0': 0.4845794318342004, 'WEIGHT_1': 0.7317966974087273, 'WEIGHT_2': 0.5893467566584975, 'WEIGHT_3': 0.865453801655293, 'WEIGHT_4': 0.8941325343599681, 'WEIGHT_5': 0.43074744400639076, 'WEIGHT_6': 0.7156559389227857, 'WEIGHT_7': 0.35255257192844125, 'WEIGHT_8': 0.3998454141185144, 'optimizer': 'RMSprop'}
0
              precision    recall  f1-score   support

         LOC       0.21      0.08      0.12      1837
        MISC       0.04      0.03      0.04       922
         ORG       0.08      0.02      0.04      1341
         PER       0.05      0.03      0.04      1842

   micro avg       0.09      0.04      0.06      5942
   macro avg       0.09      0.04      0.06      5942
weighted avg       0.10      0.04      0.06      5942

{'EMBEDDING_DIM': 934, 'HIDDEN_DIM': 454, 'NUM_LAYERS': 1, 'DROPOUT': 0.3132969370245911, 'LR': 0.00087433331868009, 'WEIGHT_0': 0.4845794318342004, 'WEIGHT_1': 0.7317966974087273, 'WEIGHT_2': 0.5893467566584975, 'WEIGHT_3': 0.865453801655293, 'WEIGHT_4': 0.8941325343599681, 'WEIGHT_5': 0.43074744400639076, 'WEIGHT_6': 0.7156559389227857, 'WEIGHT_7': 0.35255257192844125, 'WEIGHT_8': 0.3998454141185144, 'optimizer': 'RMSprop'}
49
              precision    recall  f1-score   support

         LOC       0.58      0.52      0.55      1837
        MISC       0.47      0.43      0.45       922
         ORG       0.30      0.26      0.27      1341
         PER       0.33      0.33      0.33      1842

   micro avg       0.42      0.39      0.40      5942
   macro avg       0.42      0.38      0.40      5942
weighted avg       0.42      0.39      0.40      5942

epoch 49
LSTM
  0%|          | 0/50 [00:00<?, ?it/s]  2%|▏         | 1/50 [00:04<03:52,  4.75s/it]  4%|▍         | 2/50 [00:04<01:37,  2.03s/it]  6%|▌         | 3/50 [00:05<00:56,  1.21s/it]  8%|▊         | 4/50 [00:05<00:37,  1.22it/s] 10%|█         | 5/50 [00:05<00:27,  1.65it/s] 12%|█▏        | 6/50 [00:05<00:20,  2.10it/s] 14%|█▍        | 7/50 [00:06<00:16,  2.54it/s] 16%|█▌        | 8/50 [00:06<00:14,  2.94it/s] 18%|█▊        | 9/50 [00:06<00:12,  3.29it/s] 20%|██        | 10/50 [00:06<00:11,  3.57it/s] 22%|██▏       | 11/50 [00:06<00:10,  3.80it/s] 24%|██▍       | 12/50 [00:07<00:09,  3.97it/s] 26%|██▌       | 13/50 [00:07<00:09,  4.10it/s] 28%|██▊       | 14/50 [00:07<00:08,  4.20it/s] 30%|███       | 15/50 [00:07<00:08,  4.27it/s] 32%|███▏      | 16/50 [00:08<00:07,  4.31it/s] 34%|███▍      | 17/50 [00:08<00:07,  4.35it/s] 36%|███▌      | 18/50 [00:08<00:07,  4.37it/s] 38%|███▊      | 19/50 [00:08<00:07,  4.38it/s] 40%|████      | 20/50 [00:08<00:06,  4.40it/s] 42%|████▏     | 21/50 [00:09<00:06,  4.40it/s] 44%|████▍     | 22/50 [00:09<00:06,  4.41it/s] 46%|████▌     | 23/50 [00:09<00:06,  4.41it/s] 48%|████▊     | 24/50 [00:09<00:05,  4.42it/s] 50%|█████     | 25/50 [00:10<00:05,  4.41it/s] 52%|█████▏    | 26/50 [00:10<00:05,  4.41it/s] 54%|█████▍    | 27/50 [00:10<00:05,  4.41it/s] 56%|█████▌    | 28/50 [00:10<00:04,  4.42it/s] 58%|█████▊    | 29/50 [00:10<00:04,  4.42it/s] 60%|██████    | 30/50 [00:11<00:04,  4.42it/s] 62%|██████▏   | 31/50 [00:11<00:04,  4.42it/s] 64%|██████▍   | 32/50 [00:11<00:04,  4.41it/s] 66%|██████▌   | 33/50 [00:11<00:03,  4.42it/s] 68%|██████▊   | 34/50 [00:12<00:03,  4.42it/s] 70%|███████   | 35/50 [00:12<00:03,  4.42it/s] 72%|███████▏  | 36/50 [00:12<00:03,  4.42it/s] 74%|███████▍  | 37/50 [00:12<00:02,  4.41it/s] 76%|███████▌  | 38/50 [00:13<00:02,  4.41it/s] 78%|███████▊  | 39/50 [00:13<00:02,  4.42it/s] 80%|████████  | 40/50 [00:13<00:02,  4.42it/s] 82%|████████▏ | 41/50 [00:13<00:02,  4.41it/s] 84%|████████▍ | 42/50 [00:13<00:01,  4.41it/s] 86%|████████▌ | 43/50 [00:14<00:01,  4.41it/s] 88%|████████▊ | 44/50 [00:14<00:01,  4.41it/s] 90%|█████████ | 45/50 [00:14<00:01,  4.41it/s] 92%|█████████▏| 46/50 [00:14<00:00,  4.41it/s] 94%|█████████▍| 47/50 [00:15<00:00,  4.41it/s] 96%|█████████▌| 48/50 [00:15<00:00,  4.41it/s] 98%|█████████▊| 49/50 [00:15<00:00,  4.41it/s]100%|██████████| 50/50 [00:20<00:00,  1.63s/it]100%|██████████| 50/50 [00:20<00:00,  2.45it/s]
[I 2023-12-10 22:24:59,133] Trial 123 finished with value: 0.4154373927958834 and parameters: {'EMBEDDING_DIM': 1021, 'HIDDEN_DIM': 318, 'NUM_LAYERS': 1, 'DROPOUT': 0.3003367659021869, 'LR': 0.0014931017028928884, 'WEIGHT_0': 0.3724293039663079, 'WEIGHT_1': 0.5294049369378068, 'WEIGHT_2': 0.6400893676735748, 'WEIGHT_3': 0.9600244801028648, 'WEIGHT_4': 0.9358118348570831, 'WEIGHT_5': 0.48309046377400044, 'WEIGHT_6': 0.7637661172360876, 'WEIGHT_7': 0.42535788428050264, 'WEIGHT_8': 0.43712120929517206, 'optimizer': 'RMSprop'}. Best is trial 123 with value: 0.4154373927958834.
/userhome/cs2/dingruiw/conda/envs/py310/lib/python3.10/site-packages/torch/nn/modules/rnn.py:82: UserWarning: dropout option adds dropout after all but last recurrent layer, so non-zero dropout expects num_layers greater than 1, but got dropout=0.30087908438980665 and num_layers=1
  warnings.warn("dropout option adds dropout after all but last "
{'EMBEDDING_DIM': 1021, 'HIDDEN_DIM': 318, 'NUM_LAYERS': 1, 'DROPOUT': 0.3003367659021869, 'LR': 0.0014931017028928884, 'WEIGHT_0': 0.3724293039663079, 'WEIGHT_1': 0.5294049369378068, 'WEIGHT_2': 0.6400893676735748, 'WEIGHT_3': 0.9600244801028648, 'WEIGHT_4': 0.9358118348570831, 'WEIGHT_5': 0.48309046377400044, 'WEIGHT_6': 0.7637661172360876, 'WEIGHT_7': 0.42535788428050264, 'WEIGHT_8': 0.43712120929517206, 'optimizer': 'RMSprop'}
0
              precision    recall  f1-score   support

         LOC       0.24      0.06      0.10      1837
        MISC       0.10      0.04      0.06       922
         ORG       0.12      0.02      0.04      1341
         PER       0.08      0.03      0.04      1842

   micro avg       0.13      0.04      0.06      5942
   macro avg       0.13      0.04      0.06      5942
weighted avg       0.14      0.04      0.06      5942

{'EMBEDDING_DIM': 1021, 'HIDDEN_DIM': 318, 'NUM_LAYERS': 1, 'DROPOUT': 0.3003367659021869, 'LR': 0.0014931017028928884, 'WEIGHT_0': 0.3724293039663079, 'WEIGHT_1': 0.5294049369378068, 'WEIGHT_2': 0.6400893676735748, 'WEIGHT_3': 0.9600244801028648, 'WEIGHT_4': 0.9358118348570831, 'WEIGHT_5': 0.48309046377400044, 'WEIGHT_6': 0.7637661172360876, 'WEIGHT_7': 0.42535788428050264, 'WEIGHT_8': 0.43712120929517206, 'optimizer': 'RMSprop'}
49
              precision    recall  f1-score   support

         LOC       0.58      0.52      0.55      1837
        MISC       0.45      0.45      0.45       922
         ORG       0.27      0.25      0.26      1341
         PER       0.37      0.39      0.38      1842

   micro avg       0.42      0.41      0.42      5942
   macro avg       0.42      0.40      0.41      5942
weighted avg       0.43      0.41      0.42      5942

epoch 49
LSTM
  0%|          | 0/50 [00:00<?, ?it/s]  2%|▏         | 1/50 [00:04<03:52,  4.75s/it]  4%|▍         | 2/50 [00:04<01:37,  2.03s/it]  6%|▌         | 3/50 [00:05<00:56,  1.21s/it]  8%|▊         | 4/50 [00:05<00:37,  1.22it/s] 10%|█         | 5/50 [00:05<00:27,  1.66it/s] 12%|█▏        | 6/50 [00:05<00:20,  2.12it/s] 14%|█▍        | 7/50 [00:05<00:16,  2.57it/s] 16%|█▌        | 8/50 [00:06<00:14,  2.98it/s] 18%|█▊        | 9/50 [00:06<00:12,  3.34it/s] 20%|██        | 10/50 [00:06<00:10,  3.64it/s] 22%|██▏       | 11/50 [00:06<00:10,  3.88it/s] 24%|██▍       | 12/50 [00:07<00:09,  4.06it/s] 26%|██▌       | 13/50 [00:07<00:08,  4.20it/s] 28%|██▊       | 14/50 [00:07<00:08,  4.30it/s] 30%|███       | 15/50 [00:07<00:08,  4.37it/s] 32%|███▏      | 16/50 [00:07<00:07,  4.42it/s] 34%|███▍      | 17/50 [00:08<00:07,  4.46it/s] 36%|███▌      | 18/50 [00:08<00:07,  4.49it/s] 38%|███▊      | 19/50 [00:08<00:06,  4.51it/s] 40%|████      | 20/50 [00:08<00:06,  4.52it/s] 42%|████▏     | 21/50 [00:09<00:06,  4.53it/s] 44%|████▍     | 22/50 [00:09<00:06,  4.53it/s] 46%|████▌     | 23/50 [00:09<00:05,  4.54it/s] 48%|████▊     | 24/50 [00:09<00:05,  4.55it/s] 50%|█████     | 25/50 [00:09<00:05,  4.55it/s] 52%|█████▏    | 26/50 [00:10<00:05,  4.55it/s] 54%|█████▍    | 27/50 [00:10<00:05,  4.55it/s] 56%|█████▌    | 28/50 [00:10<00:04,  4.55it/s] 58%|█████▊    | 29/50 [00:10<00:04,  4.55it/s] 60%|██████    | 30/50 [00:11<00:04,  4.55it/s] 62%|██████▏   | 31/50 [00:11<00:04,  4.55it/s] 64%|██████▍   | 32/50 [00:11<00:03,  4.55it/s] 66%|██████▌   | 33/50 [00:11<00:03,  4.54it/s] 68%|██████▊   | 34/50 [00:11<00:03,  4.54it/s] 70%|███████   | 35/50 [00:12<00:03,  4.54it/s] 72%|███████▏  | 36/50 [00:12<00:03,  4.55it/s] 74%|███████▍  | 37/50 [00:12<00:02,  4.55it/s] 76%|███████▌  | 38/50 [00:12<00:02,  4.55it/s] 78%|███████▊  | 39/50 [00:13<00:02,  4.54it/s] 80%|████████  | 40/50 [00:13<00:02,  4.54it/s] 82%|████████▏ | 41/50 [00:13<00:01,  4.54it/s] 84%|████████▍ | 42/50 [00:13<00:01,  4.53it/s] 86%|████████▌ | 43/50 [00:13<00:01,  4.53it/s] 88%|████████▊ | 44/50 [00:14<00:01,  4.53it/s] 90%|█████████ | 45/50 [00:14<00:01,  4.52it/s] 92%|█████████▏| 46/50 [00:14<00:00,  4.53it/s] 94%|█████████▍| 47/50 [00:14<00:00,  4.53it/s] 96%|█████████▌| 48/50 [00:15<00:00,  4.52it/s] 98%|█████████▊| 49/50 [00:15<00:00,  4.52it/s]100%|██████████| 50/50 [00:20<00:00,  1.62s/it]100%|██████████| 50/50 [00:20<00:00,  2.48it/s]
[I 2023-12-10 22:25:23,543] Trial 124 finished with value: 0.4076082279025734 and parameters: {'EMBEDDING_DIM': 971, 'HIDDEN_DIM': 314, 'NUM_LAYERS': 1, 'DROPOUT': 0.30087908438980665, 'LR': 0.0014319224733221397, 'WEIGHT_0': 0.34595185156403296, 'WEIGHT_1': 0.4524442686130803, 'WEIGHT_2': 0.6549410622378271, 'WEIGHT_3': 0.943309912971299, 'WEIGHT_4': 0.9813762416103711, 'WEIGHT_5': 0.49011300547875536, 'WEIGHT_6': 0.7689362716292242, 'WEIGHT_7': 0.4295847199171474, 'WEIGHT_8': 0.4342373654882463, 'optimizer': 'RMSprop'}. Best is trial 123 with value: 0.4154373927958834.
/userhome/cs2/dingruiw/conda/envs/py310/lib/python3.10/site-packages/torch/nn/modules/rnn.py:82: UserWarning: dropout option adds dropout after all but last recurrent layer, so non-zero dropout expects num_layers greater than 1, but got dropout=0.2677026557179828 and num_layers=1
  warnings.warn("dropout option adds dropout after all but last "
{'EMBEDDING_DIM': 971, 'HIDDEN_DIM': 314, 'NUM_LAYERS': 1, 'DROPOUT': 0.30087908438980665, 'LR': 0.0014319224733221397, 'WEIGHT_0': 0.34595185156403296, 'WEIGHT_1': 0.4524442686130803, 'WEIGHT_2': 0.6549410622378271, 'WEIGHT_3': 0.943309912971299, 'WEIGHT_4': 0.9813762416103711, 'WEIGHT_5': 0.49011300547875536, 'WEIGHT_6': 0.7689362716292242, 'WEIGHT_7': 0.4295847199171474, 'WEIGHT_8': 0.4342373654882463, 'optimizer': 'RMSprop'}
0
              precision    recall  f1-score   support

         LOC       0.40      0.16      0.23      1837
        MISC       0.07      0.05      0.06       922
         ORG       0.09      0.05      0.06      1341
         PER       0.08      0.04      0.06      1842

   micro avg       0.15      0.08      0.11      5942
   macro avg       0.16      0.08      0.10      5942
weighted avg       0.18      0.08      0.11      5942

{'EMBEDDING_DIM': 971, 'HIDDEN_DIM': 314, 'NUM_LAYERS': 1, 'DROPOUT': 0.30087908438980665, 'LR': 0.0014319224733221397, 'WEIGHT_0': 0.34595185156403296, 'WEIGHT_1': 0.4524442686130803, 'WEIGHT_2': 0.6549410622378271, 'WEIGHT_3': 0.943309912971299, 'WEIGHT_4': 0.9813762416103711, 'WEIGHT_5': 0.49011300547875536, 'WEIGHT_6': 0.7689362716292242, 'WEIGHT_7': 0.4295847199171474, 'WEIGHT_8': 0.4342373654882463, 'optimizer': 'RMSprop'}
49
              precision    recall  f1-score   support

         LOC       0.58      0.52      0.55      1837
        MISC       0.45      0.46      0.45       922
         ORG       0.29      0.25      0.27      1341
         PER       0.34      0.36      0.35      1842

   micro avg       0.42      0.40      0.41      5942
   macro avg       0.41      0.40      0.40      5942
weighted avg       0.42      0.40      0.41      5942

epoch 49
LSTM
  0%|          | 0/50 [00:00<?, ?it/s]  2%|▏         | 1/50 [00:04<03:16,  4.02s/it] 10%|█         | 5/50 [00:04<00:28,  1.60it/s] 16%|█▌        | 8/50 [00:04<00:15,  2.71it/s] 20%|██        | 10/50 [00:04<00:11,  3.55it/s] 24%|██▍       | 12/50 [00:04<00:08,  4.50it/s] 28%|██▊       | 14/50 [00:04<00:06,  5.51it/s] 32%|███▏      | 16/50 [00:05<00:05,  6.52it/s] 36%|███▌      | 18/50 [00:05<00:04,  7.46it/s] 40%|████      | 20/50 [00:05<00:03,  8.29it/s] 44%|████▍     | 22/50 [00:05<00:03,  9.01it/s] 48%|████▊     | 24/50 [00:05<00:02,  9.58it/s] 52%|█████▏    | 26/50 [00:06<00:02, 10.02it/s] 56%|█████▌    | 28/50 [00:06<00:02, 10.35it/s] 60%|██████    | 30/50 [00:06<00:01, 10.59it/s] 64%|██████▍   | 32/50 [00:06<00:01, 10.77it/s] 68%|██████▊   | 34/50 [00:06<00:01, 10.91it/s] 72%|███████▏  | 36/50 [00:06<00:01, 11.00it/s] 76%|███████▌  | 38/50 [00:07<00:01, 11.07it/s] 80%|████████  | 40/50 [00:07<00:00, 11.11it/s] 84%|████████▍ | 42/50 [00:07<00:00, 11.14it/s] 88%|████████▊ | 44/50 [00:07<00:00, 11.17it/s] 92%|█████████▏| 46/50 [00:07<00:00, 11.19it/s] 96%|█████████▌| 48/50 [00:07<00:00, 11.20it/s]100%|██████████| 50/50 [00:12<00:00,  1.38it/s]100%|██████████| 50/50 [00:12<00:00,  4.04it/s]
