[I 2023-12-10 21:44:42,437] Trial 53 finished with value: 0.3873628639775633 and parameters: {'EMBEDDING_DIM': 560, 'HIDDEN_DIM': 570, 'NUM_LAYERS': 1, 'DROPOUT': 0.36910128563671757, 'LR': 0.002593315378066757, 'WEIGHT_0': 0.6157326880230157, 'WEIGHT_1': 0.5489769427710829, 'WEIGHT_2': 0.5821542293455089, 'WEIGHT_3': 0.7016067937308111, 'WEIGHT_4': 0.9930801192956819, 'WEIGHT_5': 0.5062459024133056, 'WEIGHT_6': 0.7657404687383299, 'WEIGHT_7': 0.27119875969378193, 'WEIGHT_8': 0.5074621550945544, 'optimizer': 'Adam'}. Best is trial 51 with value: 0.41438326562364947.
/userhome/cs2/dingruiw/conda/envs/py310/lib/python3.10/site-packages/torch/nn/modules/rnn.py:82: UserWarning: dropout option adds dropout after all but last recurrent layer, so non-zero dropout expects num_layers greater than 1, but got dropout=0.2937112406662419 and num_layers=1
  warnings.warn("dropout option adds dropout after all but last "
{'EMBEDDING_DIM': 560, 'HIDDEN_DIM': 570, 'NUM_LAYERS': 1, 'DROPOUT': 0.36910128563671757, 'LR': 0.002593315378066757, 'WEIGHT_0': 0.6157326880230157, 'WEIGHT_1': 0.5489769427710829, 'WEIGHT_2': 0.5821542293455089, 'WEIGHT_3': 0.7016067937308111, 'WEIGHT_4': 0.9930801192956819, 'WEIGHT_5': 0.5062459024133056, 'WEIGHT_6': 0.7657404687383299, 'WEIGHT_7': 0.27119875969378193, 'WEIGHT_8': 0.5074621550945544, 'optimizer': 'Adam'}
0
              precision    recall  f1-score   support

         LOC       0.07      0.05      0.06      1837
        MISC       0.02      0.03      0.02       922
         ORG       0.05      0.04      0.04      1341
         PER       0.02      0.00      0.00      1842

   micro avg       0.04      0.03      0.03      5942
   macro avg       0.04      0.03      0.03      5942
weighted avg       0.04      0.03      0.03      5942

{'EMBEDDING_DIM': 560, 'HIDDEN_DIM': 570, 'NUM_LAYERS': 1, 'DROPOUT': 0.36910128563671757, 'LR': 0.002593315378066757, 'WEIGHT_0': 0.6157326880230157, 'WEIGHT_1': 0.5489769427710829, 'WEIGHT_2': 0.5821542293455089, 'WEIGHT_3': 0.7016067937308111, 'WEIGHT_4': 0.9930801192956819, 'WEIGHT_5': 0.5062459024133056, 'WEIGHT_6': 0.7657404687383299, 'WEIGHT_7': 0.27119875969378193, 'WEIGHT_8': 0.5074621550945544, 'optimizer': 'Adam'}
49
              precision    recall  f1-score   support

         LOC       0.53      0.54      0.54      1837
        MISC       0.40      0.43      0.42       922
         ORG       0.26      0.25      0.25      1341
         PER       0.31      0.33      0.32      1842

   micro avg       0.38      0.40      0.39      5942
   macro avg       0.37      0.39      0.38      5942
weighted avg       0.38      0.40      0.39      5942

epoch 49
LSTM
  0%|          | 0/50 [00:00<?, ?it/s]  2%|▏         | 1/50 [00:04<03:55,  4.82s/it]  4%|▍         | 2/50 [00:04<01:39,  2.07s/it]  6%|▌         | 3/50 [00:05<00:59,  1.26s/it]  8%|▊         | 4/50 [00:05<00:40,  1.14it/s] 10%|█         | 5/50 [00:05<00:29,  1.50it/s] 12%|█▏        | 6/50 [00:06<00:23,  1.85it/s] 14%|█▍        | 7/50 [00:06<00:19,  2.18it/s] 16%|█▌        | 8/50 [00:06<00:17,  2.46it/s] 18%|█▊        | 9/50 [00:07<00:15,  2.70it/s] 20%|██        | 10/50 [00:07<00:13,  2.89it/s] 22%|██▏       | 11/50 [00:07<00:12,  3.03it/s] 24%|██▍       | 12/50 [00:07<00:12,  3.14it/s] 26%|██▌       | 13/50 [00:08<00:11,  3.22it/s] 28%|██▊       | 14/50 [00:08<00:10,  3.28it/s] 30%|███       | 15/50 [00:08<00:10,  3.32it/s] 32%|███▏      | 16/50 [00:09<00:10,  3.35it/s] 34%|███▍      | 17/50 [00:09<00:09,  3.37it/s] 36%|███▌      | 18/50 [00:09<00:09,  3.38it/s] 38%|███▊      | 19/50 [00:09<00:09,  3.39it/s] 40%|████      | 20/50 [00:10<00:08,  3.40it/s] 42%|████▏     | 21/50 [00:10<00:08,  3.40it/s] 44%|████▍     | 22/50 [00:10<00:08,  3.41it/s] 46%|████▌     | 23/50 [00:11<00:07,  3.41it/s] 48%|████▊     | 24/50 [00:11<00:07,  3.41it/s] 50%|█████     | 25/50 [00:11<00:07,  3.41it/s] 52%|█████▏    | 26/50 [00:11<00:07,  3.41it/s] 54%|█████▍    | 27/50 [00:12<00:06,  3.41it/s] 56%|█████▌    | 28/50 [00:12<00:06,  3.41it/s] 58%|█████▊    | 29/50 [00:12<00:06,  3.41it/s] 60%|██████    | 30/50 [00:13<00:05,  3.41it/s] 62%|██████▏   | 31/50 [00:13<00:05,  3.41it/s] 64%|██████▍   | 32/50 [00:13<00:05,  3.41it/s] 66%|██████▌   | 33/50 [00:14<00:04,  3.40it/s] 68%|██████▊   | 34/50 [00:14<00:04,  3.41it/s] 70%|███████   | 35/50 [00:14<00:04,  3.40it/s] 72%|███████▏  | 36/50 [00:14<00:04,  3.41it/s] 74%|███████▍  | 37/50 [00:15<00:03,  3.41it/s] 76%|███████▌  | 38/50 [00:15<00:03,  3.40it/s] 78%|███████▊  | 39/50 [00:15<00:03,  3.40it/s] 80%|████████  | 40/50 [00:16<00:02,  3.40it/s] 82%|████████▏ | 41/50 [00:16<00:02,  3.40it/s] 84%|████████▍ | 42/50 [00:16<00:02,  3.40it/s] 86%|████████▌ | 43/50 [00:16<00:02,  3.40it/s] 88%|████████▊ | 44/50 [00:17<00:01,  3.40it/s] 90%|█████████ | 45/50 [00:17<00:01,  3.40it/s] 92%|█████████▏| 46/50 [00:17<00:01,  3.40it/s] 94%|█████████▍| 47/50 [00:18<00:00,  3.40it/s] 96%|█████████▌| 48/50 [00:18<00:00,  3.40it/s] 98%|█████████▊| 49/50 [00:18<00:00,  3.40it/s]100%|██████████| 50/50 [00:23<00:00,  1.71s/it]100%|██████████| 50/50 [00:23<00:00,  2.10it/s]
[I 2023-12-10 21:45:10,633] Trial 54 finished with value: 0.40073132219729074 and parameters: {'EMBEDDING_DIM': 975, 'HIDDEN_DIM': 423, 'NUM_LAYERS': 1, 'DROPOUT': 0.2937112406662419, 'LR': 0.0019096272856152004, 'WEIGHT_0': 0.3660860417724082, 'WEIGHT_1': 0.7936306135147405, 'WEIGHT_2': 0.5509048228592911, 'WEIGHT_3': 0.8270008421864089, 'WEIGHT_4': 0.9086761217387349, 'WEIGHT_5': 0.7263233263493148, 'WEIGHT_6': 0.8111561094533336, 'WEIGHT_7': 0.3864837020171312, 'WEIGHT_8': 0.39771759458207767, 'optimizer': 'Adam'}. Best is trial 51 with value: 0.41438326562364947.
/userhome/cs2/dingruiw/conda/envs/py310/lib/python3.10/site-packages/torch/nn/modules/rnn.py:82: UserWarning: dropout option adds dropout after all but last recurrent layer, so non-zero dropout expects num_layers greater than 1, but got dropout=0.29698069244504827 and num_layers=1
  warnings.warn("dropout option adds dropout after all but last "
{'EMBEDDING_DIM': 975, 'HIDDEN_DIM': 423, 'NUM_LAYERS': 1, 'DROPOUT': 0.2937112406662419, 'LR': 0.0019096272856152004, 'WEIGHT_0': 0.3660860417724082, 'WEIGHT_1': 0.7936306135147405, 'WEIGHT_2': 0.5509048228592911, 'WEIGHT_3': 0.8270008421864089, 'WEIGHT_4': 0.9086761217387349, 'WEIGHT_5': 0.7263233263493148, 'WEIGHT_6': 0.8111561094533336, 'WEIGHT_7': 0.3864837020171312, 'WEIGHT_8': 0.39771759458207767, 'optimizer': 'Adam'}
0
              precision    recall  f1-score   support

         LOC       0.09      0.09      0.09      1837
        MISC       0.03      0.06      0.04       922
         ORG       0.03      0.04      0.03      1341
         PER       0.03      0.05      0.04      1842

   micro avg       0.04      0.06      0.05      5942
   macro avg       0.05      0.06      0.05      5942
weighted avg       0.05      0.06      0.05      5942

{'EMBEDDING_DIM': 975, 'HIDDEN_DIM': 423, 'NUM_LAYERS': 1, 'DROPOUT': 0.2937112406662419, 'LR': 0.0019096272856152004, 'WEIGHT_0': 0.3660860417724082, 'WEIGHT_1': 0.7936306135147405, 'WEIGHT_2': 0.5509048228592911, 'WEIGHT_3': 0.8270008421864089, 'WEIGHT_4': 0.9086761217387349, 'WEIGHT_5': 0.7263233263493148, 'WEIGHT_6': 0.8111561094533336, 'WEIGHT_7': 0.3864837020171312, 'WEIGHT_8': 0.39771759458207767, 'optimizer': 'Adam'}
49
              precision    recall  f1-score   support

         LOC       0.53      0.55      0.54      1837
        MISC       0.44      0.45      0.44       922
         ORG       0.25      0.25      0.25      1341
         PER       0.34      0.36      0.35      1842

   micro avg       0.40      0.41      0.40      5942
   macro avg       0.39      0.40      0.40      5942
weighted avg       0.39      0.41      0.40      5942

epoch 49
LSTM
  0%|          | 0/50 [00:00<?, ?it/s]  2%|▏         | 1/50 [00:04<03:53,  4.76s/it]  4%|▍         | 2/50 [00:04<01:37,  2.04s/it]  6%|▌         | 3/50 [00:05<00:57,  1.22s/it]  8%|▊         | 4/50 [00:05<00:37,  1.21it/s] 10%|█         | 5/50 [00:05<00:27,  1.64it/s] 12%|█▏        | 6/50 [00:05<00:21,  2.08it/s] 14%|█▍        | 7/50 [00:06<00:17,  2.51it/s] 16%|█▌        | 8/50 [00:06<00:14,  2.91it/s] 18%|█▊        | 9/50 [00:06<00:12,  3.25it/s] 20%|██        | 10/50 [00:06<00:11,  3.52it/s] 22%|██▏       | 11/50 [00:06<00:10,  3.75it/s] 24%|██▍       | 12/50 [00:07<00:09,  3.92it/s] 26%|██▌       | 13/50 [00:07<00:09,  4.05it/s] 28%|██▊       | 14/50 [00:07<00:08,  4.14it/s] 30%|███       | 15/50 [00:07<00:08,  4.21it/s] 32%|███▏      | 16/50 [00:08<00:07,  4.26it/s] 34%|███▍      | 17/50 [00:08<00:07,  4.29it/s] 36%|███▌      | 18/50 [00:08<00:07,  4.31it/s] 38%|███▊      | 19/50 [00:08<00:07,  4.33it/s] 40%|████      | 20/50 [00:09<00:06,  4.35it/s] 42%|████▏     | 21/50 [00:09<00:06,  4.36it/s] 44%|████▍     | 22/50 [00:09<00:06,  4.36it/s] 46%|████▌     | 23/50 [00:09<00:06,  4.36it/s] 48%|████▊     | 24/50 [00:09<00:05,  4.37it/s] 50%|█████     | 25/50 [00:10<00:05,  4.36it/s] 52%|█████▏    | 26/50 [00:10<00:05,  4.36it/s] 54%|█████▍    | 27/50 [00:10<00:05,  4.36it/s] 56%|█████▌    | 28/50 [00:10<00:05,  4.36it/s] 58%|█████▊    | 29/50 [00:11<00:04,  4.36it/s] 60%|██████    | 30/50 [00:11<00:04,  4.36it/s] 62%|██████▏   | 31/50 [00:11<00:04,  4.36it/s] 64%|██████▍   | 32/50 [00:11<00:04,  4.36it/s] 66%|██████▌   | 33/50 [00:11<00:03,  4.36it/s] 68%|██████▊   | 34/50 [00:12<00:03,  4.36it/s] 70%|███████   | 35/50 [00:12<00:03,  4.36it/s] 72%|███████▏  | 36/50 [00:12<00:03,  4.36it/s] 74%|███████▍  | 37/50 [00:12<00:02,  4.36it/s] 76%|███████▌  | 38/50 [00:13<00:02,  4.36it/s] 78%|███████▊  | 39/50 [00:13<00:02,  4.36it/s] 80%|████████  | 40/50 [00:13<00:02,  4.36it/s] 82%|████████▏ | 41/50 [00:13<00:02,  4.36it/s] 84%|████████▍ | 42/50 [00:14<00:01,  4.36it/s] 86%|████████▌ | 43/50 [00:14<00:01,  4.36it/s] 88%|████████▊ | 44/50 [00:14<00:01,  4.36it/s] 90%|█████████ | 45/50 [00:14<00:01,  4.36it/s] 92%|█████████▏| 46/50 [00:14<00:00,  4.36it/s] 94%|█████████▍| 47/50 [00:15<00:00,  4.36it/s] 96%|█████████▌| 48/50 [00:15<00:00,  4.35it/s] 98%|█████████▊| 49/50 [00:15<00:00,  4.35it/s]100%|██████████| 50/50 [00:20<00:00,  1.63s/it]100%|██████████| 50/50 [00:20<00:00,  2.43it/s]
[I 2023-12-10 21:45:35,426] Trial 55 finished with value: 0.4082820555463163 and parameters: {'EMBEDDING_DIM': 982, 'HIDDEN_DIM': 328, 'NUM_LAYERS': 1, 'DROPOUT': 0.29698069244504827, 'LR': 0.002058330112307039, 'WEIGHT_0': 0.3667551345460293, 'WEIGHT_1': 0.733380600488694, 'WEIGHT_2': 0.5635542807627303, 'WEIGHT_3': 0.8618041114795213, 'WEIGHT_4': 0.8761845595295099, 'WEIGHT_5': 0.4456914282433857, 'WEIGHT_6': 0.72045966149252, 'WEIGHT_7': 0.3895516898712311, 'WEIGHT_8': 0.40608364513754897, 'optimizer': 'Adam'}. Best is trial 51 with value: 0.41438326562364947.
/userhome/cs2/dingruiw/conda/envs/py310/lib/python3.10/site-packages/torch/nn/modules/rnn.py:82: UserWarning: dropout option adds dropout after all but last recurrent layer, so non-zero dropout expects num_layers greater than 1, but got dropout=0.40546552465590907 and num_layers=1
  warnings.warn("dropout option adds dropout after all but last "
{'EMBEDDING_DIM': 982, 'HIDDEN_DIM': 328, 'NUM_LAYERS': 1, 'DROPOUT': 0.29698069244504827, 'LR': 0.002058330112307039, 'WEIGHT_0': 0.3667551345460293, 'WEIGHT_1': 0.733380600488694, 'WEIGHT_2': 0.5635542807627303, 'WEIGHT_3': 0.8618041114795213, 'WEIGHT_4': 0.8761845595295099, 'WEIGHT_5': 0.4456914282433857, 'WEIGHT_6': 0.72045966149252, 'WEIGHT_7': 0.3895516898712311, 'WEIGHT_8': 0.40608364513754897, 'optimizer': 'Adam'}
0
              precision    recall  f1-score   support

         LOC       0.07      0.13      0.10      1837
        MISC       0.03      0.05      0.03       922
         ORG       0.03      0.08      0.04      1341
         PER       0.02      0.04      0.03      1842

   micro avg       0.04      0.08      0.05      5942
   macro avg       0.04      0.08      0.05      5942
weighted avg       0.04      0.08      0.05      5942

{'EMBEDDING_DIM': 982, 'HIDDEN_DIM': 328, 'NUM_LAYERS': 1, 'DROPOUT': 0.29698069244504827, 'LR': 0.002058330112307039, 'WEIGHT_0': 0.3667551345460293, 'WEIGHT_1': 0.733380600488694, 'WEIGHT_2': 0.5635542807627303, 'WEIGHT_3': 0.8618041114795213, 'WEIGHT_4': 0.8761845595295099, 'WEIGHT_5': 0.4456914282433857, 'WEIGHT_6': 0.72045966149252, 'WEIGHT_7': 0.3895516898712311, 'WEIGHT_8': 0.40608364513754897, 'optimizer': 'Adam'}
49
              precision    recall  f1-score   support

         LOC       0.56      0.54      0.55      1837
        MISC       0.41      0.47      0.44       922
         ORG       0.29      0.27      0.28      1341
         PER       0.33      0.36      0.35      1842

   micro avg       0.40      0.41      0.41      5942
   macro avg       0.40      0.41      0.40      5942
weighted avg       0.41      0.41      0.41      5942

epoch 49
LSTM
  0%|          | 0/50 [00:00<?, ?it/s]  2%|▏         | 1/50 [00:04<03:53,  4.77s/it]  4%|▍         | 2/50 [00:04<01:37,  2.04s/it]  6%|▌         | 3/50 [00:05<00:57,  1.22s/it]  8%|▊         | 4/50 [00:05<00:38,  1.21it/s] 10%|█         | 5/50 [00:05<00:27,  1.63it/s] 12%|█▏        | 6/50 [00:05<00:21,  2.07it/s] 14%|█▍        | 7/50 [00:06<00:17,  2.50it/s] 16%|█▌        | 8/50 [00:06<00:14,  2.90it/s] 18%|█▊        | 9/50 [00:06<00:12,  3.24it/s] 20%|██        | 10/50 [00:06<00:11,  3.52it/s] 22%|██▏       | 11/50 [00:06<00:10,  3.74it/s] 24%|██▍       | 12/50 [00:07<00:09,  3.91it/s] 26%|██▌       | 13/50 [00:07<00:09,  4.04it/s] 28%|██▊       | 14/50 [00:07<00:08,  4.14it/s] 30%|███       | 15/50 [00:07<00:08,  4.20it/s] 32%|███▏      | 16/50 [00:08<00:08,  4.25it/s] 34%|███▍      | 17/50 [00:08<00:07,  4.28it/s] 36%|███▌      | 18/50 [00:08<00:07,  4.30it/s] 38%|███▊      | 19/50 [00:08<00:07,  4.32it/s] 40%|████      | 20/50 [00:09<00:06,  4.33it/s] 42%|████▏     | 21/50 [00:09<00:06,  4.34it/s] 44%|████▍     | 22/50 [00:09<00:06,  4.34it/s] 46%|████▌     | 23/50 [00:09<00:06,  4.34it/s] 48%|████▊     | 24/50 [00:09<00:05,  4.35it/s] 50%|█████     | 25/50 [00:10<00:05,  4.35it/s] 52%|█████▏    | 26/50 [00:10<00:05,  4.35it/s] 54%|█████▍    | 27/50 [00:10<00:05,  4.35it/s] 56%|█████▌    | 28/50 [00:10<00:05,  4.35it/s] 58%|█████▊    | 29/50 [00:11<00:04,  4.35it/s] 60%|██████    | 30/50 [00:11<00:04,  4.35it/s] 62%|██████▏   | 31/50 [00:11<00:04,  4.34it/s] 64%|██████▍   | 32/50 [00:11<00:04,  4.34it/s] 66%|██████▌   | 33/50 [00:12<00:03,  4.34it/s] 68%|██████▊   | 34/50 [00:12<00:03,  4.34it/s] 70%|███████   | 35/50 [00:12<00:03,  4.34it/s] 72%|███████▏  | 36/50 [00:12<00:03,  4.34it/s] 74%|███████▍  | 37/50 [00:12<00:02,  4.34it/s] 76%|███████▌  | 38/50 [00:13<00:02,  4.35it/s] 78%|███████▊  | 39/50 [00:13<00:02,  4.35it/s] 80%|████████  | 40/50 [00:13<00:02,  4.34it/s] 82%|████████▏ | 41/50 [00:13<00:02,  4.34it/s] 84%|████████▍ | 42/50 [00:14<00:01,  4.34it/s] 86%|████████▌ | 43/50 [00:14<00:01,  4.34it/s] 88%|████████▊ | 44/50 [00:14<00:01,  4.34it/s] 90%|█████████ | 45/50 [00:14<00:01,  4.34it/s] 92%|█████████▏| 46/50 [00:15<00:00,  4.34it/s] 94%|█████████▍| 47/50 [00:15<00:00,  4.33it/s] 96%|█████████▌| 48/50 [00:15<00:00,  4.33it/s] 98%|█████████▊| 49/50 [00:15<00:00,  4.34it/s]100%|██████████| 50/50 [00:20<00:00,  1.65s/it]100%|██████████| 50/50 [00:20<00:00,  2.42it/s]
[I 2023-12-10 21:46:00,400] Trial 56 finished with value: 0.39614901632482213 and parameters: {'EMBEDDING_DIM': 978, 'HIDDEN_DIM': 317, 'NUM_LAYERS': 1, 'DROPOUT': 0.40546552465590907, 'LR': 0.001772642174630146, 'WEIGHT_0': 0.35279519462187564, 'WEIGHT_1': 0.6908325620851575, 'WEIGHT_2': 0.5438049728062804, 'WEIGHT_3': 0.8719431241511076, 'WEIGHT_4': 0.9664926685452828, 'WEIGHT_5': 0.45771739088988905, 'WEIGHT_6': 0.7991425782259073, 'WEIGHT_7': 0.3953488326605453, 'WEIGHT_8': 0.372777923178423, 'optimizer': 'Adam'}. Best is trial 51 with value: 0.41438326562364947.
{'EMBEDDING_DIM': 978, 'HIDDEN_DIM': 317, 'NUM_LAYERS': 1, 'DROPOUT': 0.40546552465590907, 'LR': 0.001772642174630146, 'WEIGHT_0': 0.35279519462187564, 'WEIGHT_1': 0.6908325620851575, 'WEIGHT_2': 0.5438049728062804, 'WEIGHT_3': 0.8719431241511076, 'WEIGHT_4': 0.9664926685452828, 'WEIGHT_5': 0.45771739088988905, 'WEIGHT_6': 0.7991425782259073, 'WEIGHT_7': 0.3953488326605453, 'WEIGHT_8': 0.372777923178423, 'optimizer': 'Adam'}
0
              precision    recall  f1-score   support

         LOC       0.05      0.08      0.06      1837
        MISC       0.02      0.07      0.03       922
         ORG       0.03      0.11      0.05      1341
         PER       0.03      0.05      0.04      1842

   micro avg       0.03      0.08      0.05      5942
   macro avg       0.04      0.08      0.05      5942
weighted avg       0.04      0.08      0.05      5942

{'EMBEDDING_DIM': 978, 'HIDDEN_DIM': 317, 'NUM_LAYERS': 1, 'DROPOUT': 0.40546552465590907, 'LR': 0.001772642174630146, 'WEIGHT_0': 0.35279519462187564, 'WEIGHT_1': 0.6908325620851575, 'WEIGHT_2': 0.5438049728062804, 'WEIGHT_3': 0.8719431241511076, 'WEIGHT_4': 0.9664926685452828, 'WEIGHT_5': 0.45771739088988905, 'WEIGHT_6': 0.7991425782259073, 'WEIGHT_7': 0.3953488326605453, 'WEIGHT_8': 0.372777923178423, 'optimizer': 'Adam'}
49
              precision    recall  f1-score   support

         LOC       0.57      0.50      0.54      1837
        MISC       0.44      0.44      0.44       922
         ORG       0.27      0.30      0.28      1341
         PER       0.32      0.34      0.33      1842

   micro avg       0.39      0.40      0.40      5942
   macro avg       0.40      0.40      0.40      5942
weighted avg       0.41      0.40      0.40      5942

epoch 49
LSTM
  0%|          | 0/50 [00:00<?, ?it/s]  2%|▏         | 1/50 [00:05<04:24,  5.40s/it]  4%|▍         | 2/50 [00:05<01:55,  2.40s/it]  6%|▌         | 3/50 [00:06<01:12,  1.54s/it]  8%|▊         | 4/50 [00:06<00:52,  1.14s/it] 10%|█         | 5/50 [00:07<00:41,  1.09it/s] 12%|█▏        | 6/50 [00:07<00:34,  1.27it/s] 14%|█▍        | 7/50 [00:08<00:30,  1.43it/s] 16%|█▌        | 8/50 [00:08<00:27,  1.55it/s] 18%|█▊        | 9/50 [00:09<00:24,  1.64it/s] 20%|██        | 10/50 [00:09<00:23,  1.72it/s] 22%|██▏       | 11/50 [00:10<00:22,  1.77it/s] 24%|██▍       | 12/50 [00:10<00:21,  1.80it/s] 26%|██▌       | 13/50 [00:11<00:20,  1.83it/s] 28%|██▊       | 14/50 [00:12<00:19,  1.85it/s] 30%|███       | 15/50 [00:12<00:18,  1.87it/s] 32%|███▏      | 16/50 [00:13<00:18,  1.88it/s] 34%|███▍      | 17/50 [00:13<00:17,  1.88it/s] 36%|███▌      | 18/50 [00:14<00:16,  1.89it/s] 38%|███▊      | 19/50 [00:14<00:16,  1.89it/s] 40%|████      | 20/50 [00:15<00:15,  1.89it/s] 42%|████▏     | 21/50 [00:15<00:15,  1.90it/s] 44%|████▍     | 22/50 [00:16<00:14,  1.90it/s] 46%|████▌     | 23/50 [00:16<00:14,  1.90it/s] 48%|████▊     | 24/50 [00:17<00:13,  1.90it/s] 50%|█████     | 25/50 [00:17<00:13,  1.90it/s] 52%|█████▏    | 26/50 [00:18<00:12,  1.90it/s] 54%|█████▍    | 27/50 [00:18<00:12,  1.90it/s] 56%|█████▌    | 28/50 [00:19<00:11,  1.90it/s] 58%|█████▊    | 29/50 [00:19<00:11,  1.90it/s] 60%|██████    | 30/50 [00:20<00:10,  1.90it/s] 62%|██████▏   | 31/50 [00:20<00:10,  1.90it/s] 64%|██████▍   | 32/50 [00:21<00:09,  1.90it/s] 66%|██████▌   | 33/50 [00:22<00:08,  1.90it/s] 68%|██████▊   | 34/50 [00:22<00:08,  1.89it/s] 70%|███████   | 35/50 [00:23<00:07,  1.89it/s] 72%|███████▏  | 36/50 [00:23<00:07,  1.90it/s] 74%|███████▍  | 37/50 [00:24<00:06,  1.90it/s] 76%|███████▌  | 38/50 [00:24<00:06,  1.89it/s] 78%|███████▊  | 39/50 [00:25<00:05,  1.89it/s] 80%|████████  | 40/50 [00:25<00:05,  1.89it/s] 82%|████████▏ | 41/50 [00:26<00:04,  1.89it/s] 84%|████████▍ | 42/50 [00:26<00:04,  1.89it/s] 86%|████████▌ | 43/50 [00:27<00:03,  1.89it/s] 88%|████████▊ | 44/50 [00:27<00:03,  1.89it/s] 90%|█████████ | 45/50 [00:28<00:02,  1.89it/s] 92%|█████████▏| 46/50 [00:28<00:02,  1.88it/s] 94%|█████████▍| 47/50 [00:29<00:01,  1.88it/s] 96%|█████████▌| 48/50 [00:29<00:01,  1.88it/s] 98%|█████████▊| 49/50 [00:30<00:00,  1.88it/s]100%|██████████| 50/50 [00:36<00:00,  2.04s/it]100%|██████████| 50/50 [00:36<00:00,  1.39it/s]
