[I 2023-12-10 23:24:22,112] Trial 249 finished with value: 0.3966842241602625 and parameters: {'EMBEDDING_DIM': 968, 'HIDDEN_DIM': 236, 'NUM_LAYERS': 1, 'DROPOUT': 0.3552628738059988, 'LR': 0.0015682600782498946, 'WEIGHT_0': 0.4196932458747502, 'WEIGHT_1': 0.7305981495869648, 'WEIGHT_2': 0.31117820680644215, 'WEIGHT_3': 0.816419216086818, 'WEIGHT_4': 0.4249617329886908, 'WEIGHT_5': 0.7845732090758046, 'WEIGHT_6': 0.541823329067106, 'WEIGHT_7': 0.3904284818242037, 'WEIGHT_8': 0.6783530659070799, 'optimizer': 'Adam'}. Best is trial 221 with value: 0.418736930154747.
{'EMBEDDING_DIM': 968, 'HIDDEN_DIM': 236, 'NUM_LAYERS': 1, 'DROPOUT': 0.3552628738059988, 'LR': 0.0015682600782498946, 'WEIGHT_0': 0.4196932458747502, 'WEIGHT_1': 0.7305981495869648, 'WEIGHT_2': 0.31117820680644215, 'WEIGHT_3': 0.816419216086818, 'WEIGHT_4': 0.4249617329886908, 'WEIGHT_5': 0.7845732090758046, 'WEIGHT_6': 0.541823329067106, 'WEIGHT_7': 0.3904284818242037, 'WEIGHT_8': 0.6783530659070799, 'optimizer': 'Adam'}
0
              precision    recall  f1-score   support

         LOC       0.05      0.09      0.07      1837
        MISC       0.02      0.10      0.03       922
         ORG       0.02      0.04      0.03      1341
         PER       0.02      0.03      0.02      1842

   micro avg       0.03      0.06      0.04      5942
   macro avg       0.03      0.06      0.04      5942
weighted avg       0.03      0.06      0.04      5942

{'EMBEDDING_DIM': 968, 'HIDDEN_DIM': 236, 'NUM_LAYERS': 1, 'DROPOUT': 0.3552628738059988, 'LR': 0.0015682600782498946, 'WEIGHT_0': 0.4196932458747502, 'WEIGHT_1': 0.7305981495869648, 'WEIGHT_2': 0.31117820680644215, 'WEIGHT_3': 0.816419216086818, 'WEIGHT_4': 0.4249617329886908, 'WEIGHT_5': 0.7845732090758046, 'WEIGHT_6': 0.541823329067106, 'WEIGHT_7': 0.3904284818242037, 'WEIGHT_8': 0.6783530659070799, 'optimizer': 'Adam'}
49
              precision    recall  f1-score   support

         LOC       0.54      0.54      0.54      1837
        MISC       0.48      0.43      0.45       922
         ORG       0.29      0.26      0.27      1341
         PER       0.32      0.31      0.32      1842

   micro avg       0.41      0.39      0.40      5942
   macro avg       0.41      0.38      0.39      5942
weighted avg       0.41      0.39      0.40      5942

epoch 49
LSTM
  0%|          | 0/50 [00:00<?, ?it/s]  2%|▏         | 1/50 [00:05<04:40,  5.72s/it]  4%|▍         | 2/50 [00:05<01:56,  2.43s/it]  6%|▌         | 3/50 [00:06<01:09,  1.47s/it]  8%|▊         | 4/50 [00:06<00:47,  1.03s/it] 10%|█         | 5/50 [00:06<00:34,  1.29it/s] 12%|█▏        | 6/50 [00:07<00:27,  1.59it/s] 14%|█▍        | 7/50 [00:07<00:22,  1.87it/s] 16%|█▌        | 8/50 [00:07<00:19,  2.11it/s] 18%|█▊        | 9/50 [00:08<00:17,  2.32it/s] 20%|██        | 10/50 [00:08<00:16,  2.48it/s] 22%|██▏       | 11/50 [00:08<00:14,  2.60it/s] 24%|██▍       | 12/50 [00:09<00:14,  2.69it/s] 26%|██▌       | 13/50 [00:09<00:13,  2.77it/s] 28%|██▊       | 14/50 [00:09<00:12,  2.82it/s] 30%|███       | 15/50 [00:10<00:12,  2.86it/s] 32%|███▏      | 16/50 [00:10<00:11,  2.88it/s] 34%|███▍      | 17/50 [00:10<00:11,  2.90it/s] 36%|███▌      | 18/50 [00:11<00:10,  2.91it/s] 38%|███▊      | 19/50 [00:11<00:10,  2.92it/s] 40%|████      | 20/50 [00:11<00:10,  2.93it/s] 42%|████▏     | 21/50 [00:12<00:09,  2.93it/s] 44%|████▍     | 22/50 [00:12<00:09,  2.93it/s] 46%|████▌     | 23/50 [00:12<00:09,  2.93it/s] 48%|████▊     | 24/50 [00:13<00:08,  2.93it/s] 50%|█████     | 25/50 [00:13<00:08,  2.93it/s] 52%|█████▏    | 26/50 [00:14<00:08,  2.93it/s] 54%|█████▍    | 27/50 [00:14<00:07,  2.93it/s] 56%|█████▌    | 28/50 [00:14<00:07,  2.92it/s] 58%|█████▊    | 29/50 [00:15<00:07,  2.92it/s] 60%|██████    | 30/50 [00:15<00:06,  2.91it/s] 62%|██████▏   | 31/50 [00:15<00:06,  2.92it/s] 64%|██████▍   | 32/50 [00:16<00:06,  2.91it/s] 66%|██████▌   | 33/50 [00:16<00:05,  2.91it/s] 68%|██████▊   | 34/50 [00:16<00:05,  2.92it/s] 70%|███████   | 35/50 [00:17<00:05,  2.92it/s] 72%|███████▏  | 36/50 [00:17<00:04,  2.92it/s] 74%|███████▍  | 37/50 [00:17<00:04,  2.92it/s] 76%|███████▌  | 38/50 [00:18<00:04,  2.91it/s] 78%|███████▊  | 39/50 [00:18<00:03,  2.91it/s] 80%|████████  | 40/50 [00:18<00:03,  2.90it/s] 82%|████████▏ | 41/50 [00:19<00:03,  2.91it/s] 84%|████████▍ | 42/50 [00:19<00:02,  2.91it/s] 86%|████████▌ | 43/50 [00:19<00:02,  2.92it/s] 88%|████████▊ | 44/50 [00:20<00:02,  2.90it/s] 90%|█████████ | 45/50 [00:20<00:01,  2.91it/s] 92%|█████████▏| 46/50 [00:20<00:01,  2.90it/s] 94%|█████████▍| 47/50 [00:21<00:01,  2.90it/s] 96%|█████████▌| 48/50 [00:21<00:00,  2.91it/s] 98%|█████████▊| 49/50 [00:21<00:00,  2.91it/s]100%|██████████| 50/50 [00:27<00:00,  2.01s/it]100%|██████████| 50/50 [00:27<00:00,  1.80it/s]
[I 2023-12-10 23:24:55,041] Trial 250 finished with value: 0.2893284887632889 and parameters: {'EMBEDDING_DIM': 985, 'HIDDEN_DIM': 331, 'NUM_LAYERS': 2, 'DROPOUT': 0.345864964727683, 'LR': 0.004107557495983339, 'WEIGHT_0': 0.6453006800398478, 'WEIGHT_1': 0.7748142410910123, 'WEIGHT_2': 0.17170528057491657, 'WEIGHT_3': 0.9288572214671823, 'WEIGHT_4': 0.9072646459787964, 'WEIGHT_5': 0.4726511653131592, 'WEIGHT_6': 0.9321934441126074, 'WEIGHT_7': 0.35646013078751193, 'WEIGHT_8': 0.4966566003277482, 'optimizer': 'RMSprop'}. Best is trial 221 with value: 0.418736930154747.
/userhome/cs2/dingruiw/conda/envs/py310/lib/python3.10/site-packages/torch/nn/modules/rnn.py:82: UserWarning: dropout option adds dropout after all but last recurrent layer, so non-zero dropout expects num_layers greater than 1, but got dropout=0.2961901705447239 and num_layers=1
  warnings.warn("dropout option adds dropout after all but last "
{'EMBEDDING_DIM': 985, 'HIDDEN_DIM': 331, 'NUM_LAYERS': 2, 'DROPOUT': 0.345864964727683, 'LR': 0.004107557495983339, 'WEIGHT_0': 0.6453006800398478, 'WEIGHT_1': 0.7748142410910123, 'WEIGHT_2': 0.17170528057491657, 'WEIGHT_3': 0.9288572214671823, 'WEIGHT_4': 0.9072646459787964, 'WEIGHT_5': 0.4726511653131592, 'WEIGHT_6': 0.9321934441126074, 'WEIGHT_7': 0.35646013078751193, 'WEIGHT_8': 0.4966566003277482, 'optimizer': 'RMSprop'}
0
              precision    recall  f1-score   support

         LOC       0.07      0.00      0.00      1837
        MISC       0.00      0.00      0.00       922
         ORG       0.01      0.08      0.02      1341
         PER       0.06      0.00      0.00      1842

   micro avg       0.01      0.02      0.02      5942
   macro avg       0.04      0.02      0.01      5942
weighted avg       0.04      0.02      0.01      5942

{'EMBEDDING_DIM': 985, 'HIDDEN_DIM': 331, 'NUM_LAYERS': 2, 'DROPOUT': 0.345864964727683, 'LR': 0.004107557495983339, 'WEIGHT_0': 0.6453006800398478, 'WEIGHT_1': 0.7748142410910123, 'WEIGHT_2': 0.17170528057491657, 'WEIGHT_3': 0.9288572214671823, 'WEIGHT_4': 0.9072646459787964, 'WEIGHT_5': 0.4726511653131592, 'WEIGHT_6': 0.9321934441126074, 'WEIGHT_7': 0.35646013078751193, 'WEIGHT_8': 0.4966566003277482, 'optimizer': 'RMSprop'}
49
              precision    recall  f1-score   support

         LOC       0.27      0.53      0.36      1837
        MISC       0.15      0.35      0.21       922
         ORG       0.20      0.26      0.22      1341
         PER       0.35      0.27      0.30      1842

   micro avg       0.24      0.36      0.29      5942
   macro avg       0.24      0.35      0.28      5942
weighted avg       0.26      0.36      0.29      5942

epoch 49
LSTM
  0%|          | 0/50 [00:00<?, ?it/s]  2%|▏         | 1/50 [00:04<03:53,  4.77s/it]  4%|▍         | 2/50 [00:04<01:37,  2.03s/it]  6%|▌         | 3/50 [00:05<00:56,  1.20s/it]  8%|▊         | 4/50 [00:05<00:37,  1.24it/s] 10%|█         | 5/50 [00:05<00:26,  1.70it/s] 12%|█▏        | 6/50 [00:05<00:20,  2.19it/s] 14%|█▍        | 7/50 [00:05<00:16,  2.69it/s] 16%|█▌        | 8/50 [00:06<00:13,  3.14it/s] 18%|█▊        | 9/50 [00:06<00:11,  3.55it/s] 20%|██        | 10/50 [00:06<00:10,  3.89it/s] 22%|██▏       | 11/50 [00:06<00:09,  4.17it/s] 24%|██▍       | 12/50 [00:06<00:08,  4.39it/s] 26%|██▌       | 13/50 [00:07<00:08,  4.56it/s] 28%|██▊       | 14/50 [00:07<00:07,  4.68it/s] 30%|███       | 15/50 [00:07<00:07,  4.77it/s] 32%|███▏      | 16/50 [00:07<00:07,  4.82it/s] 34%|███▍      | 17/50 [00:07<00:06,  4.87it/s] 36%|███▌      | 18/50 [00:08<00:06,  4.90it/s] 38%|███▊      | 19/50 [00:08<00:06,  4.92it/s] 40%|████      | 20/50 [00:08<00:06,  4.93it/s] 42%|████▏     | 21/50 [00:08<00:05,  4.93it/s] 44%|████▍     | 22/50 [00:08<00:05,  4.94it/s] 46%|████▌     | 23/50 [00:09<00:05,  4.94it/s] 48%|████▊     | 24/50 [00:09<00:05,  4.95it/s] 50%|█████     | 25/50 [00:09<00:05,  4.95it/s] 52%|█████▏    | 26/50 [00:09<00:04,  4.97it/s] 54%|█████▍    | 27/50 [00:09<00:04,  4.96it/s] 56%|█████▌    | 28/50 [00:10<00:04,  4.96it/s] 58%|█████▊    | 29/50 [00:10<00:04,  4.95it/s] 60%|██████    | 30/50 [00:10<00:04,  4.95it/s] 62%|██████▏   | 31/50 [00:10<00:03,  4.94it/s] 64%|██████▍   | 32/50 [00:10<00:03,  4.94it/s] 66%|██████▌   | 33/50 [00:11<00:03,  4.94it/s] 68%|██████▊   | 34/50 [00:11<00:03,  4.94it/s] 70%|███████   | 35/50 [00:11<00:03,  4.94it/s] 72%|███████▏  | 36/50 [00:11<00:02,  4.94it/s] 74%|███████▍  | 37/50 [00:11<00:02,  4.94it/s] 76%|███████▌  | 38/50 [00:12<00:02,  4.93it/s] 78%|███████▊  | 39/50 [00:12<00:02,  4.94it/s] 80%|████████  | 40/50 [00:12<00:02,  4.94it/s] 82%|████████▏ | 41/50 [00:12<00:01,  4.94it/s] 84%|████████▍ | 42/50 [00:12<00:01,  4.93it/s] 86%|████████▌ | 43/50 [00:13<00:01,  4.93it/s] 88%|████████▊ | 44/50 [00:13<00:01,  4.93it/s] 90%|█████████ | 45/50 [00:13<00:01,  4.93it/s] 92%|█████████▏| 46/50 [00:13<00:00,  4.93it/s] 94%|█████████▍| 47/50 [00:13<00:00,  4.93it/s] 96%|█████████▌| 48/50 [00:14<00:00,  4.93it/s] 98%|█████████▊| 49/50 [00:14<00:00,  4.93it/s]100%|██████████| 50/50 [00:19<00:00,  1.60s/it]100%|██████████| 50/50 [00:19<00:00,  2.60it/s]
[I 2023-12-10 23:25:18,577] Trial 251 finished with value: 0.3878787878787879 and parameters: {'EMBEDDING_DIM': 949, 'HIDDEN_DIM': 291, 'NUM_LAYERS': 1, 'DROPOUT': 0.2961901705447239, 'LR': 0.0018000191459314236, 'WEIGHT_0': 0.48543784067140683, 'WEIGHT_1': 0.6945981149388871, 'WEIGHT_2': 0.20075546188131535, 'WEIGHT_3': 0.6946475041614083, 'WEIGHT_4': 0.8550348461235936, 'WEIGHT_5': 0.5389202060701218, 'WEIGHT_6': 0.7324352317889294, 'WEIGHT_7': 0.29252961518529713, 'WEIGHT_8': 0.7017623536339151, 'optimizer': 'RMSprop'}. Best is trial 221 with value: 0.418736930154747.
/userhome/cs2/dingruiw/conda/envs/py310/lib/python3.10/site-packages/torch/nn/modules/rnn.py:82: UserWarning: dropout option adds dropout after all but last recurrent layer, so non-zero dropout expects num_layers greater than 1, but got dropout=0.25497472211135586 and num_layers=1
  warnings.warn("dropout option adds dropout after all but last "
{'EMBEDDING_DIM': 949, 'HIDDEN_DIM': 291, 'NUM_LAYERS': 1, 'DROPOUT': 0.2961901705447239, 'LR': 0.0018000191459314236, 'WEIGHT_0': 0.48543784067140683, 'WEIGHT_1': 0.6945981149388871, 'WEIGHT_2': 0.20075546188131535, 'WEIGHT_3': 0.6946475041614083, 'WEIGHT_4': 0.8550348461235936, 'WEIGHT_5': 0.5389202060701218, 'WEIGHT_6': 0.7324352317889294, 'WEIGHT_7': 0.29252961518529713, 'WEIGHT_8': 0.7017623536339151, 'optimizer': 'RMSprop'}
0
              precision    recall  f1-score   support

         LOC       0.22      0.12      0.16      1837
        MISC       0.01      0.00      0.01       922
         ORG       0.15      0.05      0.08      1341
         PER       0.06      0.01      0.02      1842

   micro avg       0.16      0.05      0.08      5942
   macro avg       0.11      0.05      0.06      5942
weighted avg       0.12      0.05      0.07      5942

{'EMBEDDING_DIM': 949, 'HIDDEN_DIM': 291, 'NUM_LAYERS': 1, 'DROPOUT': 0.2961901705447239, 'LR': 0.0018000191459314236, 'WEIGHT_0': 0.48543784067140683, 'WEIGHT_1': 0.6945981149388871, 'WEIGHT_2': 0.20075546188131535, 'WEIGHT_3': 0.6946475041614083, 'WEIGHT_4': 0.8550348461235936, 'WEIGHT_5': 0.5389202060701218, 'WEIGHT_6': 0.7324352317889294, 'WEIGHT_7': 0.29252961518529713, 'WEIGHT_8': 0.7017623536339151, 'optimizer': 'RMSprop'}
49
              precision    recall  f1-score   support

         LOC       0.53      0.53      0.53      1837
        MISC       0.43      0.40      0.42       922
         ORG       0.29      0.27      0.28      1341
         PER       0.30      0.32      0.31      1842

   micro avg       0.39      0.39      0.39      5942
   macro avg       0.39      0.38      0.38      5942
weighted avg       0.39      0.39      0.39      5942

epoch 49
LSTM
  0%|          | 0/50 [00:00<?, ?it/s]  2%|▏         | 1/50 [00:04<04:00,  4.90s/it]  6%|▌         | 3/50 [00:05<01:04,  1.36s/it]  8%|▊         | 4/50 [00:05<00:43,  1.06it/s] 10%|█         | 5/50 [00:05<00:30,  1.47it/s] 12%|█▏        | 6/50 [00:05<00:22,  1.96it/s] 14%|█▍        | 7/50 [00:05<00:17,  2.52it/s] 16%|█▌        | 8/50 [00:05<00:13,  3.13it/s] 18%|█▊        | 9/50 [00:06<00:10,  3.74it/s] 20%|██        | 10/50 [00:06<00:09,  4.32it/s] 22%|██▏       | 11/50 [00:06<00:08,  4.84it/s] 24%|██▍       | 12/50 [00:06<00:07,  5.27it/s] 26%|██▌       | 13/50 [00:06<00:06,  5.64it/s] 28%|██▊       | 14/50 [00:06<00:06,  5.92it/s] 30%|███       | 15/50 [00:06<00:05,  6.13it/s] 32%|███▏      | 16/50 [00:07<00:05,  6.29it/s] 34%|███▍      | 17/50 [00:07<00:05,  6.40it/s] 36%|███▌      | 18/50 [00:07<00:04,  6.49it/s] 38%|███▊      | 19/50 [00:07<00:04,  6.55it/s] 40%|████      | 20/50 [00:07<00:04,  6.59it/s] 42%|████▏     | 21/50 [00:07<00:04,  6.61it/s] 44%|████▍     | 22/50 [00:07<00:04,  6.63it/s] 46%|████▌     | 23/50 [00:08<00:04,  6.66it/s] 48%|████▊     | 24/50 [00:08<00:03,  6.66it/s] 50%|█████     | 25/50 [00:08<00:03,  6.67it/s] 52%|█████▏    | 26/50 [00:08<00:03,  6.67it/s] 54%|█████▍    | 27/50 [00:08<00:03,  6.67it/s] 56%|█████▌    | 28/50 [00:08<00:03,  6.69it/s] 58%|█████▊    | 29/50 [00:09<00:03,  6.68it/s] 60%|██████    | 30/50 [00:09<00:02,  6.68it/s] 62%|██████▏   | 31/50 [00:09<00:02,  6.68it/s] 64%|██████▍   | 32/50 [00:09<00:02,  6.69it/s] 66%|██████▌   | 33/50 [00:09<00:02,  6.69it/s] 68%|██████▊   | 34/50 [00:09<00:02,  6.68it/s] 70%|███████   | 35/50 [00:09<00:02,  6.68it/s] 72%|███████▏  | 36/50 [00:10<00:02,  6.67it/s] 74%|███████▍  | 37/50 [00:10<00:01,  6.68it/s] 76%|███████▌  | 38/50 [00:10<00:01,  6.69it/s] 78%|███████▊  | 39/50 [00:10<00:01,  6.68it/s] 80%|████████  | 40/50 [00:10<00:01,  6.67it/s] 82%|████████▏ | 41/50 [00:10<00:01,  6.67it/s] 84%|████████▍ | 42/50 [00:10<00:01,  6.68it/s] 86%|████████▌ | 43/50 [00:11<00:01,  6.68it/s] 88%|████████▊ | 44/50 [00:11<00:00,  6.68it/s] 90%|█████████ | 45/50 [00:11<00:00,  6.67it/s] 92%|█████████▏| 46/50 [00:11<00:00,  6.67it/s] 94%|█████████▍| 47/50 [00:11<00:00,  6.67it/s] 96%|█████████▌| 48/50 [00:11<00:00,  6.66it/s] 98%|█████████▊| 49/50 [00:12<00:00,  6.67it/s]100%|██████████| 50/50 [00:17<00:00,  1.62s/it]100%|██████████| 50/50 [00:17<00:00,  2.93it/s]
[I 2023-12-10 23:25:40,075] Trial 252 finished with value: 0.37649935059974027 and parameters: {'EMBEDDING_DIM': 994, 'HIDDEN_DIM': 198, 'NUM_LAYERS': 1, 'DROPOUT': 0.25497472211135586, 'LR': 0.0011476876174541782, 'WEIGHT_0': 0.02188780605410412, 'WEIGHT_1': 0.5853488653336857, 'WEIGHT_2': 0.614755465123792, 'WEIGHT_3': 0.9788149085913088, 'WEIGHT_4': 0.9429634825162453, 'WEIGHT_5': 0.5187558941750131, 'WEIGHT_6': 0.137349205381603, 'WEIGHT_7': 0.3726656277425204, 'WEIGHT_8': 0.46800900475804924, 'optimizer': 'Adam'}. Best is trial 221 with value: 0.418736930154747.
/userhome/cs2/dingruiw/conda/envs/py310/lib/python3.10/site-packages/torch/nn/modules/rnn.py:82: UserWarning: dropout option adds dropout after all but last recurrent layer, so non-zero dropout expects num_layers greater than 1, but got dropout=0.30930146355395716 and num_layers=1
  warnings.warn("dropout option adds dropout after all but last "
{'EMBEDDING_DIM': 994, 'HIDDEN_DIM': 198, 'NUM_LAYERS': 1, 'DROPOUT': 0.25497472211135586, 'LR': 0.0011476876174541782, 'WEIGHT_0': 0.02188780605410412, 'WEIGHT_1': 0.5853488653336857, 'WEIGHT_2': 0.614755465123792, 'WEIGHT_3': 0.9788149085913088, 'WEIGHT_4': 0.9429634825162453, 'WEIGHT_5': 0.5187558941750131, 'WEIGHT_6': 0.137349205381603, 'WEIGHT_7': 0.3726656277425204, 'WEIGHT_8': 0.46800900475804924, 'optimizer': 'Adam'}
0
              precision    recall  f1-score   support

         LOC       0.08      0.38      0.13      1837
        MISC       0.02      0.27      0.04       922
         ORG       0.02      0.09      0.03      1341
         PER       0.02      0.11      0.03      1842

   micro avg       0.03      0.21      0.06      5942
   macro avg       0.04      0.21      0.06      5942
weighted avg       0.04      0.21      0.07      5942

{'EMBEDDING_DIM': 994, 'HIDDEN_DIM': 198, 'NUM_LAYERS': 1, 'DROPOUT': 0.25497472211135586, 'LR': 0.0011476876174541782, 'WEIGHT_0': 0.02188780605410412, 'WEIGHT_1': 0.5853488653336857, 'WEIGHT_2': 0.614755465123792, 'WEIGHT_3': 0.9788149085913088, 'WEIGHT_4': 0.9429634825162453, 'WEIGHT_5': 0.5187558941750131, 'WEIGHT_6': 0.137349205381603, 'WEIGHT_7': 0.3726656277425204, 'WEIGHT_8': 0.46800900475804924, 'optimizer': 'Adam'}
49
              precision    recall  f1-score   support

         LOC       0.46      0.54      0.50      1837
        MISC       0.35      0.43      0.39       922
         ORG       0.25      0.27      0.26      1341
         PER       0.29      0.39      0.33      1842

   micro avg       0.34      0.41      0.38      5942
   macro avg       0.34      0.41      0.37      5942
weighted avg       0.34      0.41      0.38      5942

epoch 49
LSTM
  0%|          | 0/50 [00:00<?, ?it/s]  2%|▏         | 1/50 [00:04<03:58,  4.87s/it]  4%|▍         | 2/50 [00:05<01:40,  2.09s/it]  6%|▌         | 3/50 [00:05<00:59,  1.26s/it]  8%|▊         | 4/50 [00:05<00:39,  1.15it/s] 10%|█         | 5/50 [00:05<00:29,  1.54it/s] 12%|█▏        | 6/50 [00:06<00:22,  1.93it/s] 14%|█▍        | 7/50 [00:06<00:18,  2.30it/s] 16%|█▌        | 8/50 [00:06<00:15,  2.63it/s] 18%|█▊        | 9/50 [00:06<00:14,  2.92it/s] 20%|██        | 10/50 [00:07<00:12,  3.14it/s] 22%|██▏       | 11/50 [00:07<00:11,  3.32it/s] 24%|██▍       | 12/50 [00:07<00:10,  3.46it/s] 26%|██▌       | 13/50 [00:07<00:10,  3.56it/s] 28%|██▊       | 14/50 [00:08<00:09,  3.63it/s] 30%|███       | 15/50 [00:08<00:09,  3.68it/s] 32%|███▏      | 16/50 [00:08<00:09,  3.72it/s] 34%|███▍      | 17/50 [00:08<00:08,  3.74it/s] 36%|███▌      | 18/50 [00:09<00:08,  3.76it/s] 38%|███▊      | 19/50 [00:09<00:08,  3.77it/s] 40%|████      | 20/50 [00:09<00:07,  3.78it/s] 42%|████▏     | 21/50 [00:10<00:07,  3.79it/s] 44%|████▍     | 22/50 [00:10<00:07,  3.79it/s] 46%|████▌     | 23/50 [00:10<00:07,  3.80it/s] 48%|████▊     | 24/50 [00:10<00:06,  3.80it/s] 50%|█████     | 25/50 [00:11<00:06,  3.80it/s] 52%|█████▏    | 26/50 [00:11<00:06,  3.80it/s] 54%|█████▍    | 27/50 [00:11<00:06,  3.80it/s] 56%|█████▌    | 28/50 [00:11<00:05,  3.80it/s] 58%|█████▊    | 29/50 [00:12<00:05,  3.79it/s] 60%|██████    | 30/50 [00:12<00:05,  3.79it/s] 62%|██████▏   | 31/50 [00:12<00:05,  3.79it/s] 64%|██████▍   | 32/50 [00:12<00:04,  3.79it/s] 66%|██████▌   | 33/50 [00:13<00:04,  3.79it/s] 68%|██████▊   | 34/50 [00:13<00:04,  3.79it/s] 70%|███████   | 35/50 [00:13<00:03,  3.78it/s] 72%|███████▏  | 36/50 [00:13<00:03,  3.78it/s] 74%|███████▍  | 37/50 [00:14<00:03,  3.78it/s] 76%|███████▌  | 38/50 [00:14<00:03,  3.78it/s] 78%|███████▊  | 39/50 [00:14<00:02,  3.78it/s] 80%|████████  | 40/50 [00:15<00:02,  3.78it/s] 82%|████████▏ | 41/50 [00:15<00:02,  3.78it/s] 84%|████████▍ | 42/50 [00:15<00:02,  3.78it/s] 86%|████████▌ | 43/50 [00:15<00:01,  3.78it/s] 88%|████████▊ | 44/50 [00:16<00:01,  3.78it/s] 90%|█████████ | 45/50 [00:16<00:01,  3.78it/s] 92%|█████████▏| 46/50 [00:16<00:01,  3.78it/s] 94%|█████████▍| 47/50 [00:16<00:00,  3.78it/s] 96%|█████████▌| 48/50 [00:17<00:00,  3.78it/s] 98%|█████████▊| 49/50 [00:17<00:00,  3.78it/s]100%|██████████| 50/50 [00:22<00:00,  1.70s/it]100%|██████████| 50/50 [00:22<00:00,  2.23it/s]
